Sheet:  name
D1: Вхiднi данi | H1: Зкореговано
C2: Закуп: | D2: 122361 | G2: грн
C3: Продано: | D3: 195965 | G3: грн
C4: Дохiд-Коефiцiент: | D4: 73604(1.60)
C5: Процент з-ти: | D5: 1 | G5: %
C6: Нараховано з-ти: | D6: 1959.65 | G6: грн | H6: =SUM(R[4]C[4]:R[310]C[4]) -> 
B7: курси: Все 0 , грн 1 , usd 20 , euro 25 , zl 5 , Инт 20 ,
A9: #11579 (2015-01-09) Розуменко Руслан Александрович - Відправлено-Продано
A10: N | B10: арт | C10: назва | D10: закуп | F10: к-ть | G10: цiна | H10: кф | I10: продж | J10: дохiд | K10: % | L10: з-та
A11: 1 | B11: H4027/XLR | C11: URBAN TACTICAL штаны Jungle Green ||SP-UTL-CO-27 | D11: 743 | E11: * | F11: 1 | G11: 1634.00 | H11: 2.20 | I11: 1225.50 | J11: 482.50 | K11: 1 | L11: =RC[-3]/100*RC[-1] -> 2.20
A12: 2 | B12: H4031/XLR | C12: URBAN TACTICAL штаны Jeans ||SP-UTL-CO-31 | D12: 743 | E12: * | F12: 1 | G12: 1634.00 | H12: 2.20 | I12: 1225.50 | J12: 482.50 | K12: 1 | L12: =RC[-3]/100*RC[-1] -> 2.20
A13: 3 | B13: H4001/LR | C13: URBAN TACTICAL штаны чёрные ||SP-UTL-CO-01 | D13: 743 | E13: * | F13: 1 | G13: 1634.00 | H13: 2.20 | I13: 1225.50 | J13: 482.50 | K13: 1 | L13: =RC[-3]/100*RC[-1] -> 2.20
A14: 4 | B14: H4001/MR | C14: URBAN TACTICAL штаны чёрные ||SP-UTL-CO-01 | D14: 743 | E14: * | F14: 1 | G14: 1634.00 | H14: 2.20 | I14: 1225.50 | J14: 482.50 | K14: 1 | L14: =RC[-3]/100*RC[-1] -> 2.20
A15: 5 | B15: H0131/M | C15: Перчатки тактические Half Finger чёрные ||RK-HFG-PO-01 | D15: 158 | E15: * | F15: 1 | G15: 347.00 | H15: 2.20 | I15: 260.25 | J15: 102.25 | K15: 1 | L15: =RC[-3]/100*RC[-1] -> 2.20 | M15: =SUM(R[-5]C[-1]:RC[-1]) -> 
A17: #11608 (2015-01-12) Харьков Трофуша Светлана Алексеевна - Відправлено-Продано
A18: N | B18: арт | C18: назва | D18: закуп | F18: к-ть | G18: цiна | H18: кф | I18: продж | J18: дохiд | K18: % | L18: з-та
A19: 1 | B19: H3102/M | C19: Куртка Alpha Grid Fleece олива ||BL-ALP-FG-02 | D19: 493 | E19: * | F19: 1 | G19: 1084.00 | H19: 2.20 | I19: 813.00 | J19: 320.00 | K19: 1 | L19: =RC[-3]/100*RC[-1] -> 2.20
A20: 2 | B20: H3501/M | C20: Комплект термобілизни (100% полиэстер) чёрный ||KP-UN1-PO-01 | D20: 274 | E20: * | F20: 1 | G20: 603.00 | H20: 2.20 | I20: 452.25 | J20: 178.25 | K20: 1 | L20: =RC[-3]/100*RC[-1] -> 2.20
A21: 3 | B21: H4301/MR | C21: US SFU штаны чёрные (PolyCotton) ||SP-SFU-PR-01 | D21: 301 | E21: * | F21: 1 | G21: 661.00 | H21: 2.20 | I21: 495.75 | J21: 194.75 | K21: 1 | L21: =RC[-3]/100*RC[-1] -> 2.20 | M21: =SUM(R[-3]C[-1]:RC[-1]) -> 
A23: #11617 (2015-01-12) ФОП Пошпур Володимир Мирославович - Відправлено-Продано
A24: N | B24: арт | C24: назва | D24: закуп | F24: к-ть | G24: цiна | H24: кф | I24: продж | J24: дохiд | K24: % | L24: з-та
A25: 1 | B25: H7232 | C25: US BDU кепка олива драп ( PolyCotton Ripstop) ||CZ-COM-NR-32 | D25: 47 | E25: * | F25: 5 | G25: 103.00 | H25: 2.19 | I25: 360.50 | J25: 125.50 | K25: 1 | L25: =RC[-3]/100*RC[-1] -> 2.19
A26: 2 | B26: H7210/M | C26: US BDU кепка ACU (NYCO R/S) ||CZ-ACU-NR-10 | D26: 86 | E26: * | F26: 2 | G26: 190.00 | H26: 2.21 | I26: 266.00 | J26: 94.00 | K26: 1 | L26: =RC[-3]/100*RC[-1] -> 2.21
A27: 3 | B27: H7210/S | C27: US BDU кепка ACU (NYCO R/S) ||CZ-ACU-NR-10 | D27: 86 | E27: * | F27: 1 | G27: 190.00 | H27: 2.21 | I27: 133.00 | J27: 47.00 | K27: 1 | L27: =RC[-3]/100*RC[-1] -> 2.21
A28: 4 | B28: H7214/M-57 | C28: US ACU кепка мультикам (NYCO R/S) ||CZ-ACU-PR-14 | D28: 86 | E28: * | F28: 2 | G28: 190.00 | H28: 2.21 | I28: 266.00 | J28: 94.00 | K28: 1 | L28: =RC[-3]/100*RC[-1] -> 2.21
A29: 5 | B29: H7214/S-55 | C29: US ACU кепка мультикам (NYCO R/S) ||CZ-ACU-PR-14 | D29: 86 | E29: * | F29: 1 | G29: 190.00 | H29: 2.21 | I29: 133.00 | J29: 47.00 | K29: 1 | L29: =RC[-3]/100*RC[-1] -> 2.21
A30: 6 | B30: H7407/S | C30: USMC кепка марпат (NYCO) ||CZ-USM-NT-07 | D30: 89 | E30: * | F30: 1 | G30: 197.00 | H30: 2.21 | I30: 137.90 | J30: 48.90 | K30: 1 | L30: =RC[-3]/100*RC[-1] -> 2.21
A31: 7 | B31: H02301/M | C31: Носки высокие MEDIUMWEIGHT ||р39-42 ||SK-MWT-WA-01 | D31: 92 | E31: * | F31: 2 | G31: 202.00 | H31: 2.20 | I31: 282.80 | J31: 98.80 | K31: 1 | L31: =RC[-3]/100*RC[-1] -> 2.20
A32: 8 | B32: H02301/L | C32: Носки высокие MEDIUMWEIGHT ||р43-46 ||SK-MWT-WA-01 | D32: 92 | E32: * | F32: 2 | G32: 202.00 | H32: 2.20 | I32: 282.80 | J32: 98.80 | K32: 1 | L32: =RC[-3]/100*RC[-1] -> 2.20
A33: 9 | B33: H43141/2XLR | C33: US SFU китель мультикам (PolyCotton) ||BL-SFU-PR-14 | D33: 333 | E33: * | F33: 1 | G33: 732.00 | H33: 2.20 | I33: 512.40 | J33: 179.40 | K33: 1 | L33: =RC[-3]/100*RC[-1] -> 2.20
A34: 10 | B34: H43141/MR | C34: US SFU китель мультикам (PolyCotton) ||BL-SFU-PR-14 | D34: 333 | E34: * | F34: 2 | G34: 732.00 | H34: 2.20 | I34: 1024.80 | J34: 358.80 | K34: 1 | L34: =RC[-3]/100*RC[-1] -> 2.20
A35: 11 | B35: H43141/SR | C35: US SFU китель мультикам (PolyCotton) ||BL-SFU-PR-14 | D35: 333 | E35: * | F35: 1 | G35: 732.00 | H35: 2.20 | I35: 512.40 | J35: 179.40 | K35: 1 | L35: =RC[-3]/100*RC[-1] -> 2.20
A36: 12 | B36: H59041/LR | C36: CPU китель польский вудлэнд (PolyCotton) ||BL-CPU-PR-04 | D36: 402 | E36: * | F36: 1 | G36: 884.00 | H36: 2.20 | I36: 618.80 | J36: 216.80 | K36: 1 | L36: =RC[-3]/100*RC[-1] -> 2.20
A37: 13 | B37: H5914/LR | C37: CPU штаны мультикамо (PolyCotton) ||SP-CPU-PR-14 | D37: 428 | E37: * | F37: 1 | G37: 942.00 | H37: 2.20 | I37: 659.40 | J37: 231.40 | K37: 1 | L37: =RC[-3]/100*RC[-1] -> 2.20
A38: 14 | B38: H5914/MR | C38: CPU штаны мультикамо (PolyCotton) ||SP-CPU-PR-14 | D38: 428 | E38: * | F38: 2 | G38: 942.00 | H38: 2.20 | I38: 1318.80 | J38: 462.80 | K38: 1 | L38: =RC[-3]/100*RC[-1] -> 2.20
A39: 15 | B39: H5901/ML | C39: CPU штаны чёрные (PolyCotton) ||SP-CPU-PR-01 | D39: 402 | E39: * | F39: 1 | G39: 884.00 | H39: 2.20 | I39: 618.80 | J39: 216.80 | K39: 1 | L39: =RC[-3]/100*RC[-1] -> 2.20
A40: 16 | B40: H155021 | C40: Пилка туристическая с кільцями ||PD-PD1-SS-15 | D40: 38 | E40: * | F40: 5 | G40: 84.00 | H40: 2.21 | I40: 294.00 | J40: 104.00 | K40: 1 | L40: =RC[-3]/100*RC[-1] -> 2.21
A41: 17 | B41: H4710/2XLL | C41: US ACU штаны ACU (PolyCotton) ||SP-ACU-PR-10 | D41: 349 | E41: * | F41: 1 | G41: 767.00 | H41: 2.20 | I41: 536.90 | J41: 187.90 | K41: 1 | L41: =RC[-3]/100*RC[-1] -> 2.20
A42: 18 | B42: H4710/LR | C42: US ACU штаны ACU (PolyCotton) ||SP-ACU-PR-10 | D42: 349 | E42: * | F42: 1 | G42: 767.00 | H42: 2.20 | I42: 536.90 | J42: 187.90 | K42: 1 | L42: =RC[-3]/100*RC[-1] -> 2.20
A43: 19 | B43: H0121/2XL | C43: Перчатки тактические IHD чёрные ||RK-IHD-PO-01 | D43: 247 | E43: * | F43: 1 | G43: 544.00 | H43: 2.20 | I43: 380.80 | J43: 133.80 | K43: 1 | L43: =RC[-3]/100*RC[-1] -> 2.20
A44: 20 | B44: H0141/L | C44: Перчатки тактические US Model чёрные ||RK-USM-PO-01 | D44: 209 | E44: * | F44: 1 | G44: 459.00 | H44: 2.20 | I44: 321.30 | J44: 112.30 | K44: 1 | L44: =RC[-3]/100*RC[-1] -> 2.20
A45: 21 | B45: H0141/S | C45: Перчатки тактические US Model чёрные ||RK-USM-PO-01 | D45: 209 | E45: * | F45: 1 | G45: 459.00 | H45: 2.20 | I45: 321.30 | J45: 112.30 | K45: 1 | L45: =RC[-3]/100*RC[-1] -> 2.20
A46: 22 | B46: H3301/L | C46: Комплект термобілизни (95% полиэстер 5% спандекс) чёрный ||KP-UN2-PO-01/L | D46: 400 | E46: * | F46: 1 | G46: 880.00 | H46: 2.20 | I46: 616.00 | J46: 216.00 | K46: 1 | L46: =RC[-3]/100*RC[-1] -> 2.20
A47: 23 | B47: H4304/LR | C47: US SFU штаны польский вудлэнд (PolyCotton) ||SP-SFU-PR-04 | D47: 290 | E47: * | F47: 1 | G47: 638.00 | H47: 2.20 | I47: 446.60 | J47: 156.60 | K47: 1 | L47: =RC[-3]/100*RC[-1] -> 2.20
A48: 24 | B48: H6236/M | C48: Куртка LEVEL 7 - Climashield® Apex 100g Alpha Green ||KU-L70-NL-36 | D48: 1444 | E48: * | F48: 1 | G48: 3177.00 | H48: 2.20 | I48: 2223.90 | J48: 779.90 | K48: 1 | L48: =RC[-3]/100*RC[-1] -> 2.20
A49: 25 | B49: H2233/M | C49: Куртка GUNFIGHTER MP Camo||KU-GUN-FM-33 | D49: 1116 | E49: * | F49: 1 | G49: 2456.00 | H49: 2.20 | I49: 1719.20 | J49: 603.20 | K49: 1 | L49: =RC[-3]/100*RC[-1] -> 2.20
A50: 26 | B50: H55141/L | C50: Куртка SOLDIER-2008 мультикам (PolyCotton) ||KU-FP8-PR-14 | D50: 914 | E50: * | F50: 1 | G50: 2011.00 | H50: 2.20 | I50: 1407.70 | J50: 493.70 | K50: 1 | L50: =RC[-3]/100*RC[-1] -> 2.20
A51: 27 | B51: H91111 | C51: Панель набедренная койот №11 ||LA-M11-PO-11 | D51: 152 | E51: * | F51: 1 | G51: 334.00 | H51: 2.20 | I51: 233.80 | J51: 81.80 | K51: 1 | L51: =RC[-3]/100*RC[-1] -> 2.20
A52: 28 | B52: H91102 | C52: Панель набедренная олива №11 ||LA-M11-PO-02 | D52: 152 | E52: * | F52: 2 | G52: 334.00 | H52: 2.20 | I52: 467.60 | J52: 163.60 | K52: 1 | L52: =RC[-3]/100*RC[-1] -> 2.20
A53: 29 | B53: H91101 | C53: Панель набедренная чёрная №11 ||LA-M11-PO-01 | D53: 152 | E53: * | F53: 1 | G53: 334.00 | H53: 2.20 | I53: 233.80 | J53: 81.80 | K53: 1 | L53: =RC[-3]/100*RC[-1] -> 2.20
A54: 30 | B54: H90511 | C54: Подсумок Modular System для рации койот №5 ||LA-M05-PO-11 | D54: 48 | E54: * | F54: 2 | G54: 106.00 | H54: 2.21 | I54: 148.40 | J54: 52.40 | K54: 1 | L54: =RC[-3]/100*RC[-1] -> 2.21
A55: 31 | B55: H90141 | C55: Подсумок Modular System магазинный мультикамо №1 ||LA-M01-PO-14 | D55: 64 | E55: * | F55: 1 | G55: 141.00 | H55: 2.20 | I55: 98.70 | J55: 34.70 | K55: 1 | L55: =RC[-3]/100*RC[-1] -> 2.20
A56: 32 | B56: H4311/SR | C56: US SFU штаны койот (PolyCotton) ||SP-SFU-PR-11 | D56: 301 | E56: * | F56: 1 | G56: 661.00 | H56: 2.20 | I56: 462.70 | J56: 161.70 | K56: 1 | L56: =RC[-3]/100*RC[-1] -> 2.20
A57: 33 | B57: H7914 | C57: Шапка флисовая мультикам ||CZ-DOK-FL-14 | D57: 80 | E57: * | F57: 5 | G57: 200.00 | H57: 2.50 | I57: 700.00 | J57: 300.00 | K57: 1 | L57: =RC[-3]/100*RC[-1] -> 2.50
A58: 34 | B58: H2004/S | C58: Куртка LIBERTY флисовая польский вудлєнд 390г/м (superfine) ||BL-LIB-HF-04 | D58: 561 | E58: * | F58: 1 | G58: 1234.00 | H58: 2.20 | I58: 863.80 | J58: 302.80 | K58: 1 | L58: =RC[-3]/100*RC[-1] -> 2.20
A59: 35 | B59: H7601N | C59: Балаклава чёрная с 1-м отв.(ComfortDry) ||CZ-KO2-FG-01 | D59: 113 | E59: * | F59: 3 | G59: 283.00 | H59: 2.50 | I59: 594.30 | J59: 255.30 | K59: 1 | L59: =RC[-3]/100*RC[-1] -> 2.50 | M59: =SUM(R[-35]C[-1]:RC[-1]) -> 
A61: #11626 (2015-01-12) Славицкая Ирина - Відправлено-Продано
A62: N | B62: арт | C62: назва | D62: закуп | F62: к-ть | G62: цiна | H62: кф | I62: продж | J62: дохiд | K62: % | L62: з-та
A63: 1 | B63: H3501/L | C63: Комплект термобілизни (100% полиэстер) чёрный ||KP-UN1-PO-01 | D63: 274 | E63: * | F63: 3 | G63: 603.00 | H63: 2.20 | I63: 1356.75 | J63: 534.75 | K63: 1 | L63: =RC[-3]/100*RC[-1] -> 2.20
A64: 2 | B64: H3501/XL | C64: Комплект термобілизни (100% полиэстер) чёрный ||KP-UN1-PO-01 | D64: 274 | E64: * | F64: 3 | G64: 603.00 | H64: 2.20 | I64: 1356.75 | J64: 534.75 | K64: 1 | L64: =RC[-3]/100*RC[-1] -> 2.20
A65: 3 | B65: H3501/2XL | C65: Комплект термобілизни (100% полиэстер) чёрный ||KP-UN1-PO-01 | D65: 274 | E65: * | F65: 1 | G65: 603.00 | H65: 2.20 | I65: 452.25 | J65: 178.25 | K65: 1 | L65: =RC[-3]/100*RC[-1] -> 2.20
A66: 4 | B66: H2302/XS | C66: Куртка CLASSIC ARMY флисовая олива ||BL-CAF-FL-02 | D66: 366 | E66: * | F66: 1 | G66: 805.00 | H66: 2.20 | I66: 603.75 | J66: 237.75 | K66: 1 | L66: =RC[-3]/100*RC[-1] -> 2.20 | M66: =SUM(R[-4]C[-1]:RC[-1]) -> 
A68: #11628 (2015-01-12) Городецкий Дмитрий Александрович - Відправлено-Продано
A69: N | B69: арт | C69: назва | D69: закуп | F69: к-ть | G69: цiна | H69: кф | I69: продж | J69: дохiд | K69: % | L69: з-та
A70: 1 | B70: H3301/M | C70: Комплект термобілизни (95% полиэстер 5% спандекс) чёрный ||KP-UN2-PO-01/M | D70: 400 | E70: * | F70: 2 | G70: 880.00 | H70: 2.20 | I70: 1320.00 | J70: 520.00 | K70: 1 | L70: =RC[-3]/100*RC[-1] -> 2.20
A71: 2 | B71: H3301/L | C71: Комплект термобілизни (95% полиэстер 5% спандекс) чёрный ||KP-UN2-PO-01/L | D71: 400 | E71: * | F71: 2 | G71: 880.00 | H71: 2.20 | I71: 1320.00 | J71: 520.00 | K71: 1 | L71: =RC[-3]/100*RC[-1] -> 2.20
A72: 3 | B72: H3301/L | C72: Комплект термобілизни (95% полиэстер 5% спандекс) чёрный ||KP-UN2-PO-01/L | D72: 400 | E72: * | F72: 1 | G72: 880.00 | H72: 2.20 | I72: 660.00 | J72: 260.00 | K72: 1 | L72: =RC[-3]/100*RC[-1] -> 2.20
A73: 4 | B73: H65031/L | C73: Куртка М65 с отстегивающейся курткой вудлэнд (NYCO) ||KU-M65-NY-03 | D73: 744 | E73: * | F73: 1 | G73: 1638.00 | H73: 2.20 | I73: 1228.50 | J73: 484.50 | K73: 1 | L73: =RC[-3]/100*RC[-1] -> 2.20
A74: 5 | B74: H5914/SR | C74: CPU штаны мультикамо (PolyCotton) ||SP-CPU-PR-14 | D74: 428 | E74: * | F74: 1 | G74: 942.00 | H74: 2.20 | I74: 706.50 | J74: 278.50 | K74: 1 | L74: =RC[-3]/100*RC[-1] -> 2.20 | M74: =SUM(R[-5]C[-1]:RC[-1]) -> 
A76: #11644 (2015-01-13) Городецкий Дмитрий Александрович - Відправлено-Продано
A77: N | B77: арт | C77: назва | D77: закуп | F77: к-ть | G77: цiна | H77: кф | I77: продж | J77: дохiд | K77: % | L77: з-та
A78: 1 | B78: H26141/XL | C78: Куртка PATRIOT флисовая мультикам 390г/м (superfine) ||BL-PAT-HF-14 | D78: 621 | E78: * | F78: 1 | G78: 1365.00 | H78: 2.20 | I78: 1023.75 | J78: 402.75 | K78: 1 | L78: =RC[-3]/100*RC[-1] -> 2.20
A79: 2 | B79: H1314 | C79: US пончо мультикам (R/S) ||PO-MUS-PO-14 | D79: 245 | E79: * | F79: 2 | G79: 539.00 | H79: 2.20 | I79: 808.50 | J79: 318.50 | K79: 1 | L79: =RC[-3]/100*RC[-1] -> 2.20
A80: 3 | B80: H2214/M | C80: Куртка GUNFIGHTER мультикам ||KU-GUN-FM-14 | D80: 1116 | E80: * | F80: 1 | G80: 2456.00 | H80: 2.20 | I80: 1842.00 | J80: 726.00 | K80: 1 | L80: =RC[-3]/100*RC[-1] -> 2.20
A81: 4 | B81: H4302/MR | C81: US SFU штаны олива (NYCO R/S) ||SP-SFU-NR-02 SP-SFU-PR-02 | D81: 301 | E81: * | F81: 1 | G81: 661.00 | H81: 2.20 | I81: 495.75 | J81: 194.75 | K81: 1 | L81: =RC[-3]/100*RC[-1] -> 2.20
A82: 5 | B82: M800332/47 | C82: Берцы MAGNUM Precision Ultra Lite CT WPI Wide | D82: 1065 | E82: * | F82: 1 | G82: 1887.00 | H82: 1.77 | I82: 1415.25 | J82: 350.25 | K82: 1 | L82: =RC[-3]/100*RC[-1] -> 1.77 | M82: =SUM(R[-5]C[-1]:RC[-1]) -> 
A84: #11648 (2015-01-13) Розуменко Руслан Александрович - Відправлено-Продано
A85: N | B85: арт | C85: назва | D85: закуп | F85: к-ть | G85: цiна | H85: кф | I85: продж | J85: дохiд | K85: % | L85: з-та
A86: 1 | B86: H2016/M | C86: Куртка LIBERTY флисовая чорн/олива 390г/м (superfine) ||BL-LIB-HF-16 | D86: 561 | E86: * | F86: 2 | G86: 1234.00 | H86: 2.20 | I86: 1851.00 | J86: 729.00 | K86: 1 | L86: =RC[-3]/100*RC[-1] -> 2.20
A87: 2 | B87: H2016/L | C87: Куртка LIBERTY флисовая чорн/олива 390г/м (superfine) ||BL-LIB-HF-16 | D87: 561 | E87: * | F87: 3 | G87: 1234.00 | H87: 2.20 | I87: 2776.50 | J87: 1093.50 | K87: 1 | L87: =RC[-3]/100*RC[-1] -> 2.20
A88: 3 | B88: H2016/XL | C88: Куртка LIBERTY флисовая чорн/олива 390г/м (superfine) ||BL-LIB-HF-16 | D88: 561 | E88: * | F88: 2 | G88: 1234.00 | H88: 2.20 | I88: 1851.00 | J88: 729.00 | K88: 1 | L88: =RC[-3]/100*RC[-1] -> 2.20
A89: 4 | B89: H2016/2XL | C89: Куртка LIBERTY флисовая чорн/олива 390г/м (superfine) ||BL-LIB-HF-16 | D89: 561 | E89: * | F89: 2 | G89: 1234.00 | H89: 2.20 | I89: 1851.00 | J89: 729.00 | K89: 1 | L89: =RC[-3]/100*RC[-1] -> 2.20
A90: 5 | B90: H7901 | C90: Шапка флисовая чёрная ||CZ-DOK-FL-01 | D90: 40 | E90: * | F90: 10 | G90: 100.00 | H90: 2.50 | I90: 750.00 | J90: 350.00 | K90: 1 | L90: =RC[-3]/100*RC[-1] -> 2.50
A91: 6 | B91: H3414/M | C91: Футболка мультикам ||TS-TSH-CO-14 | D91: 81 | E91: * | F91: 3 | G91: 179.00 | H91: 2.21 | I91: 402.75 | J91: 159.75 | K91: 1 | L91: =RC[-3]/100*RC[-1] -> 2.21
A92: 7 | B92: H26141/M | C92: Куртка PATRIOT флисовая мультикам 390г/м (superfine) ||BL-PAT-HF-14 | D92: 621 | E92: * | F92: 1 | G92: 1365.00 | H92: 2.20 | I92: 1023.75 | J92: 402.75 | K92: 1 | L92: =RC[-3]/100*RC[-1] -> 2.20 | M92: =SUM(R[-7]C[-1]:RC[-1]) -> 
A94: #11662 (2015-01-14) Иващенко Евгений Георгиевич - Відправлено-Продано
A95: N | B95: арт | C95: назва | D95: закуп | F95: к-ть | G95: цiна | H95: кф | I95: продж | J95: дохiд | K95: % | L95: з-та
A96: 1 | B96: H4301/XLL | C96: US SFU штаны чёрные (PolyCotton) ||SP-SFU-PR-01 | D96: 15.03 | E96: usd | F96: 1 | G96: 661.00 | H96: 2.20 | I96: 462.70 | J96: 162.10 | K96: 1 | L96: =RC[-3]/100*RC[-1] -> 2.20
A97: 2 | B97: H1333 | C97: US пончо MP CAMO (R/S) ||PO-MUS-PO-33 | D97: 12.25 | E97: usd | F97: 1 | G97: 539.00 | H97: 2.20 | I97: 377.30 | J97: 132.30 | K97: 1 | L97: =RC[-3]/100*RC[-1] -> 2.20
A98: 3 | B98: H1304 | C98: US пончо пол. вудлэнд (R/S) ||PO-MUS-PO-04 | D98: 12.25 | E98: usd | F98: 1 | G98: 539.00 | H98: 2.20 | I98: 377.30 | J98: 132.30 | K98: 1 | L98: =RC[-3]/100*RC[-1] -> 2.20
A99: 4 | B99: K13166-W | C99: Кобура набедренная многовункционал. вудлэнд ||M51613166-WL | D99: 8.62 | E99: usd | F99: 1 | G99: 397.00 | H99: 2.30 | I99: 277.90 | J99: 105.50 | K99: 1 | L99: =RC[-3]/100*RC[-1] -> 2.30
A100: 5 | B100: K13049-O | C100: Кобура набедренная олива ||M51613049-OD | D100: 6.06 | E100: usd | F100: 1 | G100: 279.00 | H100: 2.30 | I100: 195.30 | J100: 74.10 | K100: 1 | L100: =RC[-3]/100*RC[-1] -> 2.30
A101: 6 | B101: H3301/M | C101: Комплект термобілизни (95% полиэстер 5% спандекс) чёрный ||KP-UN2-PO-01/M | D101: 19.99 | E101: usd | F101: 1 | G101: 880.00 | H101: 2.20 | I101: 616.00 | J101: 216.20 | K101: 1 | L101: =RC[-3]/100*RC[-1] -> 2.20
A102: 7 | B102: H8601/120 | C102: Ремень TOUGH NAVY SEAL чёрный ||PS-NAV-CO-02 | D102: 4.23 | E102: usd | F102: 1 | G102: 193.00 | H102: 2.28 | I102: 135.10 | J102: 50.50 | K102: 1 | L102: =RC[-3]/100*RC[-1] -> 2.28
A103: 8 | B103: H49401/MR | C103: Рубашка COMBAT A-TACS AU с налокотниками (NYCO POL) ||KO-CS2-PO-40 | D103: 27.89 | E103: usd | F103: 1 | G103: 1227.00 | H103: 2.20 | I103: 858.90 | J103: 301.10 | K103: 1 | L103: =RC[-3]/100*RC[-1] -> 2.20
A104: 9 | B104: H49391/MR | C104: Рубашка COMBAT A-TACS FG с налокотниками (NYCO POL) ||KO-CS2-PO-39 | D104: 27.89 | E104: usd | F104: 1 | G104: 1227.00 | H104: 2.20 | I104: 858.90 | J104: 301.10 | K104: 1 | L104: =RC[-3]/100*RC[-1] -> 2.20
A105: 10 | B105: H3001/M | C105: Рубашка DEFENDER длинный рукав чёрная (170г/м) ||KO-DEF-CO-01 | D105: 19.76 | E105: usd | F105: 1 | G105: 869.00 | H105: 2.20 | I105: 608.30 | J105: 213.20 | K105: 1 | L105: =RC[-3]/100*RC[-1] -> 2.20
A106: 11 | B106: H3403/L | C106: Футболка вудлэнд ||TS-TSH-CO-03 | D106: 4.06 | E106: usd | F106: 4 | G106: 179.00 | H106: 2.21 | I106: 501.20 | J106: 176.60 | K106: 1 | L106: =RC[-3]/100*RC[-1] -> 2.21
A107: 12 | B107: H3403/XL | C107: Футболка вудлэнд ||TS-TSH-CO-03 | D107: 4.06 | E107: usd | F107: 4 | G107: 179.00 | H107: 2.21 | I107: 501.20 | J107: 176.60 | K107: 1 | L107: =RC[-3]/100*RC[-1] -> 2.21
A108: 13 | B108: H3407/M | C108: Футболка марпат ||TS-TSH-CO-07 | D108: 4.13 | E108: usd | F108: 2 | G108: 182.00 | H108: 2.20 | I108: 254.80 | J108: 89.60 | K108: 1 | L108: =RC[-3]/100*RC[-1] -> 2.20 | M108: =SUM(R[-13]C[-1]:RC[-1]) -> 
A110: #11680 (2015-01-15) Розуменко Руслан Александрович - Відправлено-Продано
A111: N | B111: арт | C111: назва | D111: закуп | F111: к-ть | G111: цiна | H111: кф | I111: продж | J111: дохiд | K111: % | L111: з-та
A112: 1 | B112: H2016/S | C112: Куртка LIBERTY флисовая чорн/олива 390г/м (superfine) ||BL-LIB-HF-16 | D112: 561 | E112: * | F112: 4 | G112: 1234.00 | H112: 2.20 | I112: 3702.00 | J112: 1458.00 | K112: 1 | L112: =RC[-3]/100*RC[-1] -> 2.20
A113: 2 | B113: H2016/M | C113: Куртка LIBERTY флисовая чорн/олива 390г/м (superfine) ||BL-LIB-HF-16 | D113: 561 | E113: * | F113: 3 | G113: 1234.00 | H113: 2.20 | I113: 2776.50 | J113: 1093.50 | K113: 1 | L113: =RC[-3]/100*RC[-1] -> 2.20
A114: 3 | B114: H2016/L | C114: Куртка LIBERTY флисовая чорн/олива 390г/м (superfine) ||BL-LIB-HF-16 | D114: 561 | E114: * | F114: 7 | G114: 1234.00 | H114: 2.20 | I114: 6478.50 | J114: 2551.50 | K114: 1 | L114: =RC[-3]/100*RC[-1] -> 2.20
A115: 4 | B115: H2016/2XL | C115: Куртка LIBERTY флисовая чорн/олива 390г/м (superfine) ||BL-LIB-HF-16 | D115: 561 | E115: * | F115: 2 | G115: 1234.00 | H115: 2.20 | I115: 1851.00 | J115: 729.00 | K115: 1 | L115: =RC[-3]/100*RC[-1] -> 2.20 | M115: =SUM(R[-4]C[-1]:RC[-1]) -> 
A117: #11683 (2015-01-15) Иващенко Евгений Георгиевич - Відправлено-Продано
A118: N | B118: арт | C118: назва | D118: закуп | F118: к-ть | G118: цiна | H118: кф | I118: продж | J118: дохiд | K118: % | L118: з-та
A119: 1 | B119: H5011/M | C119: US шорты URBAN TACTICAL койот (PolyCotton ) ||SP-UTK-PR-11 | D119: 378 | E119: * | F119: 1 | G119: 832.00 | H119: 2.20 | I119: 582.40 | J119: 204.40 | K119: 1 | L119: =RC[-3]/100*RC[-1] -> 2.20
A120: 2 | B120: H8913/130 | C120: Ремень TOUGH US MARINES койот ||PS-USM-CO-13 | D120: 74 | E120: * | F120: 1 | G120: 193.00 | H120: 2.61 | I120: 135.10 | J120: 61.10 | K120: 1 | L120: =RC[-3]/100*RC[-1] -> 2.61
A121: 3 | B121: H5939/XXLR | C121: CPU штаны A-TACS FG (PolyCotton) ||SP-CPU-PR-39 | D121: 642 | E121: * | F121: 2 | G121: 1413.00 | H121: 2.20 | I121: 1978.20 | J121: 694.20 | K121: 1 | L121: =RC[-3]/100*RC[-1] -> 2.20
A122: 4 | B122: H5939/LR | C122: CPU штаны A-TACS FG (PolyCotton) ||SP-CPU-PR-39 | D122: 642 | E122: * | F122: 1 | G122: 1413.00 | H122: 2.20 | I122: 989.10 | J122: 347.10 | K122: 1 | L122: =RC[-3]/100*RC[-1] -> 2.20
A123: 5 | B123: H59391/XXLR | C123: CPU китель A-TACS FG (PolyCotton) ||BL-CPU-PR-39 | D123: 642 | E123: * | F123: 2 | G123: 1413.00 | H123: 2.20 | I123: 1978.20 | J123: 694.20 | K123: 1 | L123: =RC[-3]/100*RC[-1] -> 2.20
A124: 6 | B124: H49331/XLR | C124: Рубашка COMBAT MP CAMO с налокотниками (NYCO POL) ||KO-CS2-PO-33 | D124: 518 | E124: * | F124: 1 | G124: 1139.00 | H124: 2.20 | I124: 797.30 | J124: 279.30 | K124: 1 | L124: =RC[-3]/100*RC[-1] -> 2.20
A125: 7 | B125: H6236/XL | C125: Куртка LEVEL 7 - Climashield® Apex 100g Alpha Green ||KU-L70-NL-36 | D125: 1444 | E125: * | F125: 1 | G125: 3177.00 | H125: 2.20 | I125: 2223.90 | J125: 779.90 | K125: 1 | L125: =RC[-3]/100*RC[-1] -> 2.20
A126: 8 | B126: H5801/2XLR | C126: URBAN TACTICAL штаны чёрные (NYCO R/S) ||SP-UTL-NR-01 | D126: 581 | E126: * | F126: 1 | G126: 1279.00 | H126: 2.20 | I126: 895.30 | J126: 314.30 | K126: 1 | L126: =RC[-3]/100*RC[-1] -> 2.20
A127: 9 | B127: H4304/LR | C127: US SFU штаны польский вудлэнд (PolyCotton) ||SP-SFU-PR-04 | D127: 290 | E127: * | F127: 1 | G127: 638.00 | H127: 2.20 | I127: 446.60 | J127: 156.60 | K127: 1 | L127: =RC[-3]/100*RC[-1] -> 2.20 | M127: =SUM(R[-9]C[-1]:RC[-1]) -> 
A129: #11687 (2015-01-15) Ночовна Ольга Викторовна/Арапов Сергей Николаевич - Відправлено-Продано
A130: N | B130: арт | C130: назва | D130: закуп | F130: к-ть | G130: цiна | H130: кф | I130: продж | J130: дохiд | K130: % | L130: з-та
A131: 1 | B131: H26111/2XL | C131: Куртка PATRIOT флисовая койот 390г/м (superfine) ||BL-PAT-HF-11 | D131: 540 | E131: * | F131: 1 | G131: 1188.00 | H131: 2.20 | I131: 950.40 | J131: 410.40 | K131: 1 | L131: =RC[-3]/100*RC[-1] -> 2.20
A132: 2 | B132: H2201/L | C132: Куртка GUNFIGHTER чёрная ||KU-GUN-FM-01 | D132: 1018 | E132: * | F132: 1 | G132: 2239.00 | H132: 2.20 | I132: 1791.20 | J132: 773.20 | K132: 1 | L132: =RC[-3]/100*RC[-1] -> 2.20
A133: 3 | B133: H2201/XL | C133: Куртка GUNFIGHTER чёрная ||KU-GUN-FM-01 | D133: 1018 | E133: * | F133: 1 | G133: 2239.00 | H133: 2.20 | I133: 1791.20 | J133: 773.20 | K133: 1 | L133: =RC[-3]/100*RC[-1] -> 2.20
A134: 4 | B134: H2301/L | C134: Куртка CLASSIC ARMY флисовая чёрная ||BL-CAF-FL-01 | D134: 366 | E134: * | F134: 1 | G134: 805.00 | H134: 2.20 | I134: 644.00 | J134: 278.00 | K134: 1 | L134: =RC[-3]/100*RC[-1] -> 2.20
A135: 5 | B135: H2301/XL | C135: Куртка CLASSIC ARMY флисовая чёрная ||BL-CAF-FL-01 | D135: 366 | E135: * | F135: 1 | G135: 805.00 | H135: 2.20 | I135: 644.00 | J135: 278.00 | K135: 1 | L135: =RC[-3]/100*RC[-1] -> 2.20
A136: 6 | B136: H2316/L | C136: Куртка CLASSIC ARMY флисовая чорн/олива ||BL-CAF-FL-16 | D136: 366 | E136: * | F136: 1 | G136: 805.00 | H136: 2.20 | I136: 644.00 | J136: 278.00 | K136: 1 | L136: =RC[-3]/100*RC[-1] -> 2.20
A137: 7 | B137: H2302/S | C137: Куртка CLASSIC ARMY флисовая олива ||BL-CAF-FL-02 | D137: 366 | E137: * | F137: 1 | G137: 805.00 | H137: 2.20 | I137: 644.00 | J137: 278.00 | K137: 1 | L137: =RC[-3]/100*RC[-1] -> 2.20
A138: 8 | B138: _10181/M | C138: Куртка-аляска US N3B длинная олива ||10181001/903 | D138: 862 | E138: * | F138: 1 | G138: 2156.00 | H138: 2.50 | I138: 1724.80 | J138: 862.80 | K138: 1 | L138: =RC[-3]/100*RC[-1] -> 2.50
A139: 9 | B139: H4302/LL | C139: US SFU штаны олива (NYCO R/S) ||SP-SFU-NR-02 SP-SFU-PR-02 | D139: 301 | E139: * | F139: 1 | G139: 661.00 | H139: 2.20 | I139: 528.80 | J139: 227.80 | K139: 1 | L139: =RC[-3]/100*RC[-1] -> 2.20
A140: 10 | B140: H7820 | C140: Хустка SHEMAGH біло/чёрная ||CZ-ARF-CO-20 | D140: 72 | E140: * | F140: 5 | G140: 159.00 | H140: 2.21 | I140: 636.00 | J140: 276.00 | K140: 1 | L140: =RC[-3]/100*RC[-1] -> 2.21
A141: 11 | B141: H7811 | C141: Хустка SHEMAGH койот/чёрная ||CZ-ARF-CO-11 | D141: 72 | E141: * | F141: 5 | G141: 159.00 | H141: 2.21 | I141: 636.00 | J141: 276.00 | K141: 1 | L141: =RC[-3]/100*RC[-1] -> 2.21
A142: 12 | B142: _874404 | C142: Балаклава двойная чёрная | D142: 82 | E142: * | F142: 2 | G142: 161.00 | H142: 1.96 | I142: 257.60 | J142: 93.60 | K142: 1 | L142: =RC[-3]/100*RC[-1] -> 1.96
A143: 13 | B143: 40484-1 | C143: Балаклава чёрная вязаная | D143: 51 | E143: * | F143: 2 | G143: 94.00 | H143: 1.84 | I143: 150.40 | J143: 48.40 | K143: 1 | L143: =RC[-3]/100*RC[-1] -> 1.84
A144: 14 | B144: H12141/XL | C144: ECWCS куртка TRILAMINAT Gen.2 мультикам ||KU-EC2-NL-14 | D144: 880 | E144: * | F144: 1 | G144: 1936.00 | H144: 2.20 | I144: 1548.80 | J144: 668.80 | K144: 1 | L144: =RC[-3]/100*RC[-1] -> 2.20
A145: 15 | B145: _10181/S | C145: Куртка-аляска US N3B длинная олива ||10181001/902 | D145: 862 | E145: * | F145: 1 | G145: 2156.00 | H145: 2.50 | I145: 1724.80 | J145: 862.80 | K145: 1 | L145: =RC[-3]/100*RC[-1] -> 2.50 | M145: =SUM(R[-15]C[-1]:RC[-1]) -> 
A147: #11701 (2015-01-16) Славицкая Ирина - Відправлено-Продано
A148: N | B148: арт | C148: назва | D148: закуп | F148: к-ть | G148: цiна | H148: кф | I148: продж | J148: дохiд | K148: % | L148: з-та
A149: 1 | B149: H43021/XLR | C149: US SFU китель олива (PolyCotton) ||BL-SFU-PR-02 | D149: 301 | E149: * | F149: 1 | G149: 661.00 | H149: 2.20 | I149: 495.75 | J149: 194.75 | K149: 1 | L149: =RC[-3]/100*RC[-1] -> 2.20
A150: 2 | B150: H43021/2XLR | C150: US SFU китель олива (PolyCotton) ||BL-SFU-PR-02 | D150: 301 | E150: * | F150: 1 | G150: 661.00 | H150: 2.20 | I150: 495.75 | J150: 194.75 | K150: 1 | L150: =RC[-3]/100*RC[-1] -> 2.20
A151: 3 | B151: H43021/MR | C151: US SFU китель олива (PolyCotton) ||BL-SFU-PR-02 | D151: 301 | E151: * | F151: 1 | G151: 661.00 | H151: 2.20 | I151: 495.75 | J151: 194.75 | K151: 1 | L151: =RC[-3]/100*RC[-1] -> 2.20
A152: 4 | B152: H4302/XLR | C152: US SFU штаны олива (NYCO R/S) ||SP-SFU-NR-02 SP-SFU-PR-02 | D152: 301 | E152: * | F152: 1 | G152: 661.00 | H152: 2.20 | I152: 495.75 | J152: 194.75 | K152: 1 | L152: =RC[-3]/100*RC[-1] -> 2.20
A153: 5 | B153: H4302/2XLR | C153: US SFU штаны олива (NYCO R/S) ||SP-SFU-NR-02 SP-SFU-PR-02 | D153: 301 | E153: * | F153: 1 | G153: 661.00 | H153: 2.20 | I153: 495.75 | J153: 194.75 | K153: 1 | L153: =RC[-3]/100*RC[-1] -> 2.20
A154: 6 | B154: H4302/MR | C154: US SFU штаны олива (NYCO R/S) ||SP-SFU-NR-02 SP-SFU-PR-02 | D154: 301 | E154: * | F154: 1 | G154: 661.00 | H154: 2.20 | I154: 495.75 | J154: 194.75 | K154: 1 | L154: =RC[-3]/100*RC[-1] -> 2.20
A155: 7 | B155: H4302/LL | C155: US SFU штаны олива (NYCO R/S) ||SP-SFU-NR-02 SP-SFU-PR-02 | D155: 301 | E155: * | F155: 1 | G155: 661.00 | H155: 2.20 | I155: 495.75 | J155: 194.75 | K155: 1 | L155: =RC[-3]/100*RC[-1] -> 2.20 | M155: =SUM(R[-7]C[-1]:RC[-1]) -> 
A157: #11711 (2015-01-16) ФОП Пошпур Володимир Мирославович - Відправлено-Продано
A158: N | B158: арт | C158: назва | D158: закуп | F158: к-ть | G158: цiна | H158: кф | I158: продж | J158: дохiд | K158: % | L158: з-та
A159: 1 | B159: H1107/M | C159: APECS USMC штаны TRILAMINAT марпат ||SP-APE-NL-07 | D159: 615 | E159: * | F159: 3 | G159: 1353.00 | H159: 2.20 | I159: 2841.30 | J159: 996.30 | K159: 1 | L159: =RC[-3]/100*RC[-1] -> 2.20
A160: 2 | B160: H1107/L | C160: APECS USMC штаны TRILAMINAT марпат ||SP-APE-NL-07 | D160: 615 | E160: * | F160: 4 | G160: 1353.00 | H160: 2.20 | I160: 3788.40 | J160: 1328.40 | K160: 1 | L160: =RC[-3]/100*RC[-1] -> 2.20
A161: 3 | B161: H12071/L | C161: ECWCS куртка TRILAMINAT марпат ||KU-EC2-NL-07 | D161: 880 | E161: * | F161: 2 | G161: 1936.00 | H161: 2.20 | I161: 2710.40 | J161: 950.40 | K161: 1 | L161: =RC[-3]/100*RC[-1] -> 2.20
A162: 4 | B162: H12071/M | C162: ECWCS куртка TRILAMINAT марпат ||KU-EC2-NL-07 | D162: 880 | E162: * | F162: 5 | G162: 1936.00 | H162: 2.20 | I162: 6776.00 | J162: 2376.00 | K162: 1 | L162: =RC[-3]/100*RC[-1] -> 2.20 | M162: =SUM(R[-4]C[-1]:RC[-1]) -> 
A164: #11714 (2015-01-17) Суми-Біллер Р.А. - Відправлено-Продано
A165: N | B165: арт | C165: назва | D165: закуп | F165: к-ть | G165: цiна | H165: кф | I165: продж | J165: дохiд | K165: % | L165: з-та
A166: 1 | B166: H3111/M | C166: Куртка Alpha Grid Fleece койот ||BL-ALP-FG-11 | D166: 493 | E166: * | F166: 1 | G166: 1084.00 | H166: 2.20 | I166: 867.20 | J166: 374.20 | K166: 1 | L166: =RC[-3]/100*RC[-1] -> 2.20
A167: 2 | B167: H2233/M | C167: Куртка GUNFIGHTER MP Camo||KU-GUN-FM-33 | D167: 1116 | E167: * | F167: 1 | G167: 2456.00 | H167: 2.20 | I167: 1964.80 | J167: 848.80 | K167: 1 | L167: =RC[-3]/100*RC[-1] -> 2.20
A168: 3 | B168: H0141/L | C168: Перчатки тактические US Model чёрные ||RK-USM-PO-01 | D168: 209 | E168: * | F168: 1 | G168: 459.00 | H168: 2.20 | I168: 367.20 | J168: 158.20 | K168: 1 | L168: =RC[-3]/100*RC[-1] -> 2.20 | M168: =SUM(R[-3]C[-1]:RC[-1]) -> 
A170: #11731 (2015-01-19) Славицкая Ирина - Відправлено-Продано
A171: N | B171: арт | C171: назва | D171: закуп | F171: к-ть | G171: цiна | H171: кф | I171: продж | J171: дохiд | K171: % | L171: з-та
A172: 1 | B172: H2016/M | C172: Куртка LIBERTY флисовая чорн/олива 390г/м (superfine) ||BL-LIB-HF-16 | D172: 561 | E172: * | F172: 1 | G172: 1234.00 | H172: 2.20 | I172: 925.50 | J172: 364.50 | K172: 1 | L172: =RC[-3]/100*RC[-1] -> 2.20
A173: 2 | B173: H2016/L | C173: Куртка LIBERTY флисовая чорн/олива 390г/м (superfine) ||BL-LIB-HF-16 | D173: 561 | E173: * | F173: 1 | G173: 1234.00 | H173: 2.20 | I173: 925.50 | J173: 364.50 | K173: 1 | L173: =RC[-3]/100*RC[-1] -> 2.20
A174: 3 | B174: H3301/L | C174: Комплект термобілизни (95% полиэстер 5% спандекс) чёрный ||KP-UN2-PO-01/L | D174: 400 | E174: * | F174: 4 | G174: 880.00 | H174: 2.20 | I174: 2640.00 | J174: 1040.00 | K174: 1 | L174: =RC[-3]/100*RC[-1] -> 2.20
A175: 4 | B175: H2227/L | C175: Куртка GUNFIGHTER Jungle Green||KU-GUN-FM-27 | D175: 1018 | E175: * | F175: 1 | G175: 2239.00 | H175: 2.20 | I175: 1679.25 | J175: 661.25 | K175: 1 | L175: =RC[-3]/100*RC[-1] -> 2.20 | M175: =SUM(R[-4]C[-1]:RC[-1]) -> 
A177: #11754 (2015-01-20) Розуменко Руслан Александрович - Відправлено-Продано
A178: N | B178: арт | C178: назва | D178: закуп | F178: к-ть | G178: цiна | H178: кф | I178: продж | J178: дохiд | K178: % | L178: з-та
A179: 1 | B179: H26021/3XL | C179: Куртка PATRIOT флисовая олива 390г/м (superfine) ||BL-PAT-HF-02 | D179: 540 | E179: * | F179: 1 | G179: 1188.00 | H179: 2.20 | I179: 891.00 | J179: 351.00 | K179: 1 | L179: =RC[-3]/100*RC[-1] -> 2.20
A180: 2 | B180: H0131/L | C180: Перчатки тактические Half Finger чёрные ||RK-HFG-PO-01 | D180: 158 | E180: * | F180: 1 | G180: 347.00 | H180: 2.20 | I180: 260.25 | J180: 102.25 | K180: 1 | L180: =RC[-3]/100*RC[-1] -> 2.20
A181: 3 | B181: H2001/2XL | C181: Куртка LIBERTY флисовая чёрная 390г/м (superfine) ||BL-LIB-HF-01 | D181: 561 | E181: * | F181: 1 | G181: 1234.00 | H181: 2.20 | I181: 925.50 | J181: 364.50 | K181: 1 | L181: =RC[-3]/100*RC[-1] -> 2.20
A182: 4 | B182: H2016/S | C182: Куртка LIBERTY флисовая чорн/олива 390г/м (superfine) ||BL-LIB-HF-16 | D182: 561 | E182: * | F182: 1 | G182: 1234.00 | H182: 2.20 | I182: 925.50 | J182: 364.50 | K182: 1 | L182: =RC[-3]/100*RC[-1] -> 2.20
A183: 5 | B183: H2016/3XL | C183: Куртка LIBERTY флисовая чорн/олива 390г/м (superfine) ||BL-LIB-HF-16 | D183: 561 | E183: * | F183: 1 | G183: 1234.00 | H183: 2.20 | I183: 925.50 | J183: 364.50 | K183: 1 | L183: =RC[-3]/100*RC[-1] -> 2.20 | M183: =SUM(R[-5]C[-1]:RC[-1]) -> 
A185: #11777 (2015-01-20) Славицкая Ирина - Відправлено-Продано
A186: N | B186: арт | C186: назва | D186: закуп | F186: к-ть | G186: цiна | H186: кф | I186: продж | J186: дохiд | K186: % | L186: з-та
A187: 1 | B187: H4302/2XLR | C187: US SFU штаны олива (NYCO R/S) ||SP-SFU-NR-02 SP-SFU-PR-02 | D187: 301 | E187: * | F187: 1 | G187: 661.00 | H187: 2.20 | I187: 495.75 | J187: 194.75 | K187: 1 | L187: =RC[-3]/100*RC[-1] -> 2.20
A188: 2 | B188: H4302/2XLL | C188: US SFU штаны олива (NYCO R/S) ||SP-SFU-NR-02 SP-SFU-PR-02 | D188: 301 | E188: * | F188: 2 | G188: 661.00 | H188: 2.20 | I188: 991.50 | J188: 389.50 | K188: 1 | L188: =RC[-3]/100*RC[-1] -> 2.20
A189: 3 | B189: H43021/2XLR | C189: US SFU китель олива (PolyCotton) ||BL-SFU-PR-02 | D189: 301 | E189: * | F189: 1 | G189: 661.00 | H189: 2.20 | I189: 495.75 | J189: 194.75 | K189: 1 | L189: =RC[-3]/100*RC[-1] -> 2.20 | M189: =SUM(R[-3]C[-1]:RC[-1]) -> 
A191: #11803 (2015-01-22) Каховка Уманец Вадим Викторович - Відправлено-Продано
A192: N | B192: арт | C192: назва | D192: закуп | F192: к-ть | G192: цiна | H192: кф | I192: продж | J192: дохiд | K192: % | L192: з-та
A193: 1 | B193: H2701/XL | C193: Куртка COMMANDER чёрная ||BL-CMR-FM-01 | D193: 733 | E193: * | F193: 1 | G193: 1613.00 | H193: 2.20 | I193: 1290.40 | J193: 557.40 | K193: 1 | L193: =RC[-3]/100*RC[-1] -> 2.20
A194: 2 | B194: H3412/L | C194: Футболка Black Camo ||TS-TSH-CO-12 | D194: 81 | E194: * | F194: 2 | G194: 179.00 | H194: 2.21 | I194: 286.40 | J194: 124.40 | K194: 1 | L194: =RC[-3]/100*RC[-1] -> 2.21
A195: 3 | B195: _K17066-W | C195: Очки защитные жёлтые ||M51617066-YELLOW | D195: 59 | E195: * | F195: 2 | G195: 152.00 | H195: 2.58 | I195: 243.20 | J195: 125.20 | K195: 1 | L195: =RC[-3]/100*RC[-1] -> 2.58 | M195: =SUM(R[-3]C[-1]:RC[-1]) -> 
A197: #11877 (2015-01-26) Иващенко Евгений Георгиевич - Відправлено-Продано
A198: N | B198: арт | C198: назва | D198: закуп | F198: к-ть | G198: цiна | H198: кф | I198: продж | J198: дохiд | K198: % | L198: з-та
A199: 1 | B199: H2033/XL | C199: Куртка LIBERTY флисовая MP Camo 390г/м (superfine) ||BL-LIB-HF-33 | D199: 621 | E199: * | F199: 1 | G199: 1365.00 | H199: 2.20 | I199: 955.50 | J199: 334.50 | K199: 1 | L199: =RC[-3]/100*RC[-1] -> 2.20 | M199: =SUM(R[-1]C[-1]:RC[-1]) -> 
A201: #11878 (2015-01-26) Харьков Трофуша Светлана Алексеевна - Відправлено-Продано
A202: N | B202: арт | C202: назва | D202: закуп | F202: к-ть | G202: цiна | H202: кф | I202: продж | J202: дохiд | K202: % | L202: з-та
A203: 1 | B203: H4301/LR | C203: US SFU штаны чёрные (PolyCotton) ||SP-SFU-PR-01 | D203: 301 | E203: * | F203: 1 | G203: 661.00 | H203: 2.20 | I203: 495.75 | J203: 194.75 | K203: 1 | L203: =RC[-3]/100*RC[-1] -> 2.20
A204: 2 | B204: H4301/XLL | C204: US SFU штаны чёрные (PolyCotton) ||SP-SFU-PR-01 | D204: 301 | E204: * | F204: 1 | G204: 661.00 | H204: 2.20 | I204: 495.75 | J204: 194.75 | K204: 1 | L204: =RC[-3]/100*RC[-1] -> 2.20
A205: 3 | B205: H4601/XLR | C205: US BDU штаны чёрные (PolyCotton) ||SP-BDU-PR-01 | D205: 273 | E205: * | F205: 1 | G205: 600.00 | H205: 2.20 | I205: 450.00 | J205: 177.00 | K205: 1 | L205: =RC[-3]/100*RC[-1] -> 2.20
A206: 4 | B206: H5601/2XL | C206: Куртка CWU чёрная ||KU-CWU-NL-01 | D206: 522 | E206: * | F206: 1 | G206: 1149.00 | H206: 2.20 | I206: 861.75 | J206: 339.75 | K206: 1 | L206: =RC[-3]/100*RC[-1] -> 2.20 | M206: =SUM(R[-4]C[-1]:RC[-1]) -> 
A208: #11883 (2015-01-26) Иващенко Евгений Георгиевич - Відправлено-Продано
A209: N | B209: арт | C209: назва | D209: закуп | F209: к-ть | G209: цiна | H209: кф | I209: продж | J209: дохiд | K209: % | L209: з-та
A210: 1 | B210: H23011/M | C210: Куртка CLASSIC ARMY (флис-кордура) чёрная ||BL-CAF-FM-01 | D210: 750 | E210: * | F210: 1 | G210: 1651.00 | H210: 2.20 | I210: 1155.70 | J210: 405.70 | K210: 1 | L210: =RC[-3]/100*RC[-1] -> 2.20
A211: 2 | B211: H2016/M | C211: Куртка LIBERTY флисовая чорн/олива 390г/м (superfine) ||BL-LIB-HF-16 | D211: 561 | E211: * | F211: 1 | G211: 1234.00 | H211: 2.20 | I211: 863.80 | J211: 302.80 | K211: 1 | L211: =RC[-3]/100*RC[-1] -> 2.20 | M211: =SUM(R[-2]C[-1]:RC[-1]) -> 
A213: #11903 (2015-01-26) ФОП Пошпур Володимир Мирославович - Відправлено-Продано
A214: N | B214: арт | C214: назва | D214: закуп | F214: к-ть | G214: цiна | H214: кф | I214: продж | J214: дохiд | K214: % | L214: з-та
A215: 1 | B215: H7902 | C215: Шапка флисовая олива ||CZ-DOK-FL-02 | D215: 40 | E215: * | F215: 6 | G215: 100.00 | H215: 2.50 | I215: 420.00 | J215: 180.00 | K215: 1 | L215: =RC[-3]/100*RC[-1] -> 2.50
A216: 2 | B216: H7911 | C216: Шапка флисовая койот ||CZ-DOK-FL-11 | D216: 40 | E216: * | F216: 5 | G216: 100.00 | H216: 2.50 | I216: 350.00 | J216: 150.00 | K216: 1 | L216: =RC[-3]/100*RC[-1] -> 2.50
A217: 3 | B217: H7214/L-59 | C217: US ACU кепка мультикам (NYCO R/S) ||CZ-ACU-PR-14 | D217: 86 | E217: * | F217: 2 | G217: 190.00 | H217: 2.21 | I217: 266.00 | J217: 94.00 | K217: 1 | L217: =RC[-3]/100*RC[-1] -> 2.21
A218: 4 | B218: H59041/MR | C218: CPU китель польский вудлэнд (PolyCotton) ||BL-CPU-PR-04 | D218: 402 | E218: * | F218: 1 | G218: 884.00 | H218: 2.20 | I218: 618.80 | J218: 216.80 | K218: 1 | L218: =RC[-3]/100*RC[-1] -> 2.20
A219: 5 | B219: H59041/LR | C219: CPU китель польский вудлэнд (PolyCotton) ||BL-CPU-PR-04 | D219: 402 | E219: * | F219: 1 | G219: 884.00 | H219: 2.20 | I219: 618.80 | J219: 216.80 | K219: 1 | L219: =RC[-3]/100*RC[-1] -> 2.20
A220: 6 | B220: H43141/LR | C220: US SFU китель мультикам (PolyCotton) ||BL-SFU-PR-14 | D220: 333 | E220: * | F220: 2 | G220: 732.00 | H220: 2.20 | I220: 1024.80 | J220: 358.80 | K220: 1 | L220: =RC[-3]/100*RC[-1] -> 2.20
A221: 7 | B221: H43141/MR | C221: US SFU китель мультикам (PolyCotton) ||BL-SFU-PR-14 | D221: 333 | E221: * | F221: 1 | G221: 732.00 | H221: 2.20 | I221: 512.40 | J221: 179.40 | K221: 1 | L221: =RC[-3]/100*RC[-1] -> 2.20
A222: 8 | B222: H2233/XL | C222: Куртка GUNFIGHTER MP Camo||KU-GUN-FM-33 | D222: 1116 | E222: * | F222: 1 | G222: 2456.00 | H222: 2.20 | I222: 1719.20 | J222: 603.20 | K222: 1 | L222: =RC[-3]/100*RC[-1] -> 2.20
A223: 9 | B223: H2301/M | C223: Куртка CLASSIC ARMY флисовая чёрная ||BL-CAF-FL-01 | D223: 366 | E223: * | F223: 3 | G223: 805.00 | H223: 2.20 | I223: 1690.50 | J223: 592.50 | K223: 1 | L223: =RC[-3]/100*RC[-1] -> 2.20
A224: 10 | B224: H2033/XL | C224: Куртка LIBERTY флисовая MP Camo 390г/м (superfine) ||BL-LIB-HF-33 | D224: 621 | E224: * | F224: 1 | G224: 1365.00 | H224: 2.20 | I224: 955.50 | J224: 334.50 | K224: 1 | L224: =RC[-3]/100*RC[-1] -> 2.20
A225: 11 | B225: H2014/M | C225: Куртка LIBERTY флисовая мультикам 390г/м (superfine) ||BL-LIB-HF-14 | D225: 620 | E225: * | F225: 1 | G225: 1364.00 | H225: 2.20 | I225: 954.80 | J225: 334.80 | K225: 1 | L225: =RC[-3]/100*RC[-1] -> 2.20
A226: 12 | B226: H2014/L | C226: Куртка LIBERTY флисовая мультикам 390г/м (superfine) ||BL-LIB-HF-14 | D226: 620 | E226: * | F226: 1 | G226: 1364.00 | H226: 2.20 | I226: 954.80 | J226: 334.80 | K226: 1 | L226: =RC[-3]/100*RC[-1] -> 2.20
A227: 13 | B227: H2014/XL | C227: Куртка LIBERTY флисовая мультикам 390г/м (superfine) ||BL-LIB-HF-14 | D227: 620 | E227: * | F227: 1 | G227: 1364.00 | H227: 2.20 | I227: 954.80 | J227: 334.80 | K227: 1 | L227: =RC[-3]/100*RC[-1] -> 2.20
A228: 14 | B228: H2233/M | C228: Куртка GUNFIGHTER MP Camo||KU-GUN-FM-33 | D228: 1116 | E228: * | F228: 1 | G228: 2456.00 | H228: 2.20 | I228: 1719.20 | J228: 603.20 | K228: 1 | L228: =RC[-3]/100*RC[-1] -> 2.20
A229: 15 | B229: H2316/L | C229: Куртка CLASSIC ARMY флисовая чорн/олива ||BL-CAF-FL-16 | D229: 366 | E229: * | F229: 2 | G229: 805.00 | H229: 2.20 | I229: 1127.00 | J229: 395.00 | K229: 1 | L229: =RC[-3]/100*RC[-1] -> 2.20
A230: 16 | B230: H2016/XL | C230: Куртка LIBERTY флисовая чорн/олива 390г/м (superfine) ||BL-LIB-HF-16 | D230: 561 | E230: * | F230: 1 | G230: 1234.00 | H230: 2.20 | I230: 863.80 | J230: 302.80 | K230: 1 | L230: =RC[-3]/100*RC[-1] -> 2.20
A231: 17 | B231: H91101 | C231: Панель набедренная чёрная №11 ||LA-M11-PO-01 | D231: 152 | E231: * | F231: 1 | G231: 334.00 | H231: 2.20 | I231: 233.80 | J231: 81.80 | K231: 1 | L231: =RC[-3]/100*RC[-1] -> 2.20
A232: 18 | B232: H155021 | C232: Пилка туристическая с кільцями ||PD-PD1-SS-15 | D232: 38 | E232: * | F232: 3 | G232: 84.00 | H232: 2.21 | I232: 176.40 | J232: 62.40 | K232: 1 | L232: =RC[-3]/100*RC[-1] -> 2.21
A233: 19 | B233: H88001/L | C233: Ремень US UTILITY чёрный нейлон ||PS-UTL-NL-01 | D233: 112 | E233: * | F233: 1 | G233: 257.00 | H233: 2.29 | I233: 179.90 | J233: 67.90 | K233: 1 | L233: =RC[-3]/100*RC[-1] -> 2.29
A234: 20 | B234: H0141/M | C234: Перчатки тактические US Model чёрные ||RK-USM-PO-01 | D234: 209 | E234: * | F234: 1 | G234: 459.00 | H234: 2.20 | I234: 321.30 | J234: 112.30 | K234: 1 | L234: =RC[-3]/100*RC[-1] -> 2.20
A235: 21 | B235: H0141/L | C235: Перчатки тактические US Model чёрные ||RK-USM-PO-01 | D235: 209 | E235: * | F235: 1 | G235: 459.00 | H235: 2.20 | I235: 321.30 | J235: 112.30 | K235: 1 | L235: =RC[-3]/100*RC[-1] -> 2.20
A236: 22 | B236: H3301/XL | C236: Комплект термобілизни (95% полиэстер 5% спандекс) чёрный ||KP-UN2-PO-01/XL | D236: 400 | E236: * | F236: 2 | G236: 880.00 | H236: 2.20 | I236: 1232.00 | J236: 432.00 | K236: 1 | L236: =RC[-3]/100*RC[-1] -> 2.20
A237: 23 | B237: H02101/L | C237: Носки высокие HEAVYWEIGHT ||р43-46 ||SK-HWT-WA-01 | D237: 97 | E237: * | F237: 2 | G237: 213.00 | H237: 2.20 | I237: 298.20 | J237: 104.20 | K237: 1 | L237: =RC[-3]/100*RC[-1] -> 2.20
A238: 24 | B238: H5914/MR | C238: CPU штаны мультикамо (PolyCotton) ||SP-CPU-PR-14 | D238: 431 | E238: * | F238: 2 | G238: 949.00 | H238: 2.20 | I238: 1328.60 | J238: 466.60 | K238: 1 | L238: =RC[-3]/100*RC[-1] -> 2.20
A239: 25 | B239: H5914/LR | C239: CPU штаны мультикамо (PolyCotton) ||SP-CPU-PR-14 | D239: 431 | E239: * | F239: 1 | G239: 949.00 | H239: 2.20 | I239: 664.30 | J239: 233.30 | K239: 1 | L239: =RC[-3]/100*RC[-1] -> 2.20
A240: 26 | B240: H5914/LL | C240: CPU штаны мультикамо (PolyCotton) ||SP-CPU-PR-14 | D240: 431 | E240: * | F240: 1 | G240: 949.00 | H240: 2.20 | I240: 664.30 | J240: 233.30 | K240: 1 | L240: =RC[-3]/100*RC[-1] -> 2.20
A241: 27 | B241: H43141/MR | C241: US SFU китель мультикам (PolyCotton) ||BL-SFU-PR-14 | D241: 333 | E241: * | F241: 1 | G241: 732.00 | H241: 2.20 | I241: 512.40 | J241: 179.40 | K241: 1 | L241: =RC[-3]/100*RC[-1] -> 2.20
A242: 28 | B242: H65011/L | C242: Куртка М65 с отстегивающейся курткой чёрная (NYCO) ||KU-M65-NY-01 | D242: 768 | E242: * | F242: 1 | G242: 1689.00 | H242: 2.20 | I242: 1182.30 | J242: 414.30 | K242: 1 | L242: =RC[-3]/100*RC[-1] -> 2.20
A243: 29 | B243: H65031/M | C243: Куртка М65 с отстегивающейся курткой вудлэнд (NYCO) ||KU-M65-NY-03 | D243: 744 | E243: * | F243: 1 | G243: 1638.00 | H243: 2.20 | I243: 1146.60 | J243: 402.60 | K243: 1 | L243: =RC[-3]/100*RC[-1] -> 2.20
A244: 30 | B244: H65031/L | C244: Куртка М65 с отстегивающейся курткой вудлэнд (NYCO) ||KU-M65-NY-03 | D244: 744 | E244: * | F244: 1 | G244: 1638.00 | H244: 2.20 | I244: 1146.60 | J244: 402.60 | K244: 1 | L244: =RC[-3]/100*RC[-1] -> 2.20
A245: 31 | B245: H2233/2XL | C245: Куртка GUNFIGHTER MP Camo||KU-GUN-FM-33 | D245: 1116 | E245: * | F245: 1 | G245: 2456.00 | H245: 2.20 | I245: 1719.20 | J245: 603.20 | K245: 1 | L245: =RC[-3]/100*RC[-1] -> 2.20
A246: 32 | B246: H2233/S | C246: Куртка GUNFIGHTER MP Camo||KU-GUN-FM-33 | D246: 1116 | E246: * | F246: 1 | G246: 2456.00 | H246: 2.20 | I246: 1719.20 | J246: 603.20 | K246: 1 | L246: =RC[-3]/100*RC[-1] -> 2.20
A247: 33 | B247: H26141/S | C247: Куртка PATRIOT флисовая мультикам 390г/м (superfine) ||BL-PAT-HF-14 | D247: 621 | E247: * | F247: 1 | G247: 1365.00 | H247: 2.20 | I247: 955.50 | J247: 334.50 | K247: 1 | L247: =RC[-3]/100*RC[-1] -> 2.20
A248: 34 | B248: H26141/2XL | C248: Куртка PATRIOT флисовая мультикам 390г/м (superfine) ||BL-PAT-HF-14 | D248: 621 | E248: * | F248: 1 | G248: 1365.00 | H248: 2.20 | I248: 955.50 | J248: 334.50 | K248: 1 | L248: =RC[-3]/100*RC[-1] -> 2.20
A249: 35 | B249: H5814/LL | C249: URBAN TACTICAL штаны мультикам (NYCO R/S) ||SP-UTL-NR-14 | D249: 615 | E249: * | F249: 1 | G249: 1353.00 | H249: 2.20 | I249: 947.10 | J249: 332.10 | K249: 1 | L249: =RC[-3]/100*RC[-1] -> 2.20
A250: 36 | B250: H5814/ML | C250: URBAN TACTICAL штаны мультикам (NYCO R/S) ||SP-UTL-NR-14 | D250: 615 | E250: * | F250: 1 | G250: 1353.00 | H250: 2.20 | I250: 947.10 | J250: 332.10 | K250: 1 | L250: =RC[-3]/100*RC[-1] -> 2.20
A251: 37 | B251: H5814/XLR | C251: URBAN TACTICAL штаны мультикам (NYCO R/S) ||SP-UTL-NR-14 | D251: 615 | E251: * | F251: 1 | G251: 1353.00 | H251: 2.20 | I251: 947.10 | J251: 332.10 | K251: 1 | L251: =RC[-3]/100*RC[-1] -> 2.20
A252: 38 | B252: H5814/LR | C252: URBAN TACTICAL штаны мультикам (NYCO R/S) ||SP-UTL-NR-14 | D252: 615 | E252: * | F252: 1 | G252: 1353.00 | H252: 2.20 | I252: 947.10 | J252: 332.10 | K252: 1 | L252: =RC[-3]/100*RC[-1] -> 2.20
A253: 39 | B253: H4001/MR | C253: URBAN TACTICAL штаны чёрные ||SP-UTL-CO-01 | D253: 743 | E253: * | F253: 1 | G253: 1634.00 | H253: 2.20 | I253: 1143.80 | J253: 400.80 | K253: 1 | L253: =RC[-3]/100*RC[-1] -> 2.20
A254: 40 | B254: H4001/LR | C254: URBAN TACTICAL штаны чёрные ||SP-UTL-CO-01 | D254: 743 | E254: * | F254: 1 | G254: 1634.00 | H254: 2.20 | I254: 1143.80 | J254: 400.80 | K254: 1 | L254: =RC[-3]/100*RC[-1] -> 2.20
A255: 41 | B255: H5832/MR | C255: URBAN TACTICAL штаны олива драп (NYCO R/S) ||SP-UTL-NR-32 | D255: 581 | E255: * | F255: 1 | G255: 1279.00 | H255: 2.20 | I255: 895.30 | J255: 314.30 | K255: 1 | L255: =RC[-3]/100*RC[-1] -> 2.20
A256: 42 | B256: H5832/LR | C256: URBAN TACTICAL штаны олива драп (NYCO R/S) ||SP-UTL-NR-32 | D256: 581 | E256: * | F256: 1 | G256: 1279.00 | H256: 2.20 | I256: 895.30 | J256: 314.30 | K256: 1 | L256: =RC[-3]/100*RC[-1] -> 2.20
A257: 43 | B257: H4031/MR | C257: URBAN TACTICAL штаны Jeans ||SP-UTL-CO-31 | D257: 743 | E257: * | F257: 1 | G257: 1634.00 | H257: 2.20 | I257: 1143.80 | J257: 400.80 | K257: 1 | L257: =RC[-3]/100*RC[-1] -> 2.20
A258: 44 | B258: H4031/LR | C258: URBAN TACTICAL штаны Jeans ||SP-UTL-CO-31 | D258: 743 | E258: * | F258: 1 | G258: 1634.00 | H258: 2.20 | I258: 1143.80 | J258: 400.80 | K258: 1 | L258: =RC[-3]/100*RC[-1] -> 2.20
A259: 45 | B259: H4302/XLR | C259: US SFU штаны олива (NYCO R/S) ||SP-SFU-NR-02 SP-SFU-PR-02 | D259: 301 | E259: * | F259: 1 | G259: 661.00 | H259: 2.20 | I259: 462.70 | J259: 161.70 | K259: 1 | L259: =RC[-3]/100*RC[-1] -> 2.20
A260: 46 | B260: H4302/XLL | C260: US SFU штаны олива (NYCO R/S) ||SP-SFU-NR-02 SP-SFU-PR-02 | D260: 301 | E260: * | F260: 1 | G260: 661.00 | H260: 2.20 | I260: 462.70 | J260: 161.70 | K260: 1 | L260: =RC[-3]/100*RC[-1] -> 2.20
A261: 47 | B261: H4304/LR | C261: US SFU штаны польский вудлэнд (PolyCotton) ||SP-SFU-PR-04 | D261: 290 | E261: * | F261: 1 | G261: 638.00 | H261: 2.20 | I261: 446.60 | J261: 156.60 | K261: 1 | L261: =RC[-3]/100*RC[-1] -> 2.20
A262: 48 | B262: H4304/LR | C262: US SFU штаны польский вудлэнд (PolyCotton) ||SP-SFU-PR-04 | D262: 290 | E262: * | F262: 1 | G262: 638.00 | H262: 2.20 | I262: 446.60 | J262: 156.60 | K262: 1 | L262: =RC[-3]/100*RC[-1] -> 2.20
A263: 49 | B263: H4301/MR | C263: US SFU штаны чёрные (PolyCotton) ||SP-SFU-PR-01 | D263: 301 | E263: * | F263: 2 | G263: 661.00 | H263: 2.20 | I263: 925.40 | J263: 323.40 | K263: 1 | L263: =RC[-3]/100*RC[-1] -> 2.20
A264: 50 | B264: H4301/LR | C264: US SFU штаны чёрные (PolyCotton) ||SP-SFU-PR-01 | D264: 301 | E264: * | F264: 2 | G264: 661.00 | H264: 2.20 | I264: 925.40 | J264: 323.40 | K264: 1 | L264: =RC[-3]/100*RC[-1] -> 2.20
A265: 51 | B265: H4301/LL | C265: US SFU штаны чёрные (PolyCotton) ||SP-SFU-PR-01 | D265: 301 | E265: * | F265: 1 | G265: 661.00 | H265: 2.20 | I265: 462.70 | J265: 161.70 | K265: 1 | L265: =RC[-3]/100*RC[-1] -> 2.20
A266: 52 | B266: H5904/XLR | C266: CPU штаны польский вудлэнд (PolyCotton) ||SP-CPU-PR-04 | D266: 402 | E266: * | F266: 1 | G266: 884.00 | H266: 2.20 | I266: 618.80 | J266: 216.80 | K266: 1 | L266: =RC[-3]/100*RC[-1] -> 2.20
A267: 53 | B267: H5904/MR | C267: CPU штаны польский вудлэнд (PolyCotton) ||SP-CPU-PR-04 | D267: 402 | E267: * | F267: 1 | G267: 884.00 | H267: 2.20 | I267: 618.80 | J267: 216.80 | K267: 1 | L267: =RC[-3]/100*RC[-1] -> 2.20 | M267: =SUM(R[-53]C[-1]:RC[-1]) -> 
A269: #11906 (2015-01-26) Иващенко Евгений Георгиевич - Відправлено-Продано
A270: N | B270: арт | C270: назва | D270: закуп | F270: к-ть | G270: цiна | H270: кф | I270: продж | J270: дохiд | K270: % | L270: з-та
A271: 1 | B271: H2014/XL | C271: Куртка LIBERTY флисовая мультикам 390г/м (superfine) ||BL-LIB-HF-14 | D271: 620 | E271: * | F271: 1 | G271: 1364.00 | H271: 2.20 | I271: 954.80 | J271: 334.80 | K271: 1 | L271: =RC[-3]/100*RC[-1] -> 2.20 | M271: =SUM(R[-1]C[-1]:RC[-1]) -> 
A273: #11919 (2015-01-27) Харьков Трофуша Светлана Алексеевна - Відправлено-Продано
A274: N | B274: арт | C274: назва | D274: закуп | F274: к-ть | G274: цiна | H274: кф | I274: продж | J274: дохiд | K274: % | L274: з-та
A275: 1 | B275: H4311/LR | C275: US SFU штаны койот (PolyCotton) ||SP-SFU-PR-11 | D275: 301 | E275: * | F275: 1 | G275: 661.00 | H275: 2.20 | I275: 495.75 | J275: 194.75 | K275: 1 | L275: =RC[-3]/100*RC[-1] -> 2.20
A276: 2 | B276: H7811 | C276: Хустка SHEMAGH койот/чёрная ||CZ-ARF-CO-11 | D276: 72 | E276: * | F276: 1 | G276: 159.00 | H276: 2.21 | I276: 119.25 | J276: 47.25 | K276: 1 | L276: =RC[-3]/100*RC[-1] -> 2.21 | M276: =SUM(R[-2]C[-1]:RC[-1]) -> 
A278: #11944 (2015-01-28) Розуменко Руслан Александрович - Відправлено-Продано
A279: N | B279: арт | C279: назва | D279: закуп | F279: к-ть | G279: цiна | H279: кф | I279: продж | J279: дохiд | K279: % | L279: з-та
A280: 1 | B280: H26141/M | C280: Куртка PATRIOT флисовая мультикам 390г/м (superfine) ||BL-PAT-HF-14 | D280: 621 | E280: * | F280: 1 | G280: 1365.00 | H280: 2.20 | I280: 1023.75 | J280: 402.75 | K280: 1 | L280: =RC[-3]/100*RC[-1] -> 2.20
A281: 2 | B281: H26141/L | C281: Куртка PATRIOT флисовая мультикам 390г/м (superfine) ||BL-PAT-HF-14 | D281: 621 | E281: * | F281: 1 | G281: 1365.00 | H281: 2.20 | I281: 1023.75 | J281: 402.75 | K281: 1 | L281: =RC[-3]/100*RC[-1] -> 2.20
A282: 3 | B282: H3414/M | C282: Футболка мультикам ||TS-TSH-CO-14 | D282: 81 | E282: * | F282: 2 | G282: 179.00 | H282: 2.21 | I282: 268.50 | J282: 106.50 | K282: 1 | L282: =RC[-3]/100*RC[-1] -> 2.21 | M282: =SUM(R[-3]C[-1]:RC[-1]) -> 
A284: #11976 (2015-01-29) Иващенко Евгений Георгиевич - Відправлено-Продано
A285: N | B285: арт | C285: назва | D285: закуп | F285: к-ть | G285: цiна | H285: кф | I285: продж | J285: дохiд | K285: % | L285: з-та
A286: 1 | B286: H23011/M | C286: Куртка CLASSIC ARMY (флис-кордура) чёрная ||BL-CAF-FM-01 | D286: 750 | E286: * | F286: 1 | G286: 1651.00 | H286: 2.20 | I286: 1155.70 | J286: 405.70 | K286: 1 | L286: =RC[-3]/100*RC[-1] -> 2.20
A287: 2 | B287: H26141/M | C287: Куртка PATRIOT флисовая мультикам 390г/м (superfine) ||BL-PAT-HF-14 | D287: 621 | E287: * | F287: 2 | G287: 1365.00 | H287: 2.20 | I287: 1911.00 | J287: 669.00 | K287: 1 | L287: =RC[-3]/100*RC[-1] -> 2.20
A288: 3 | B288: H2016/XL | C288: Куртка LIBERTY флисовая чорн/олива 390г/м (superfine) ||BL-LIB-HF-16 | D288: 561 | E288: * | F288: 1 | G288: 1234.00 | H288: 2.20 | I288: 863.80 | J288: 302.80 | K288: 1 | L288: =RC[-3]/100*RC[-1] -> 2.20 | M288: =SUM(R[-3]C[-1]:RC[-1]) -> 
A290: #11983 (2015-01-29) Иващенко Евгений Георгиевич - Відправлено-Продано
A291: N | B291: арт | C291: назва | D291: закуп | F291: к-ть | G291: цiна | H291: кф | I291: продж | J291: дохiд | K291: % | L291: з-та
A292: 1 | B292: H5939/MR | C292: CPU штаны A-TACS FG (PolyCotton) ||SP-CPU-PR-39 | D292: 642 | E292: * | F292: 1 | G292: 1413.00 | H292: 2.20 | I292: 989.10 | J292: 347.10 | K292: 1 | L292: =RC[-3]/100*RC[-1] -> 2.20 | M292: =SUM(R[-1]C[-1]:RC[-1]) -> 
A294: #11991 (2015-01-29) Городецкий Дмитрий Александрович - Відправлено-Продано
A295: N | B295: арт | C295: назва | D295: закуп | F295: к-ть | G295: цiна | H295: кф | I295: продж | J295: дохiд | K295: % | L295: з-та
A296: 1 | B296: H47141/MR | C296: US ACU китель мультикам (NYCO R/S) ||BL-ACU-PR-14 | D296: 461 | E296: * | F296: 1 | G296: 1013.00 | H296: 2.20 | I296: 759.75 | J296: 298.75 | K296: 1 | L296: =RC[-3]/100*RC[-1] -> 2.20
A297: 2 | B297: H5914/MR | C297: CPU штаны мультикамо (PolyCotton) ||SP-CPU-PR-14 | D297: 431 | E297: * | F297: 1 | G297: 949.00 | H297: 2.20 | I297: 711.75 | J297: 280.75 | K297: 1 | L297: =RC[-3]/100*RC[-1] -> 2.20
A298: 3 | B298: H65021/MR | C298: Куртка М65 с отстегивающейся курткой олива (NYCO) ||KU-M65-NY-02 | D298: 768 | E298: * | F298: 1 | G298: 1689.00 | H298: 2.20 | I298: 1266.75 | J298: 498.75 | K298: 1 | L298: =RC[-3]/100*RC[-1] -> 2.20
A299: 4 | B299: H4301/LR | C299: US SFU штаны чёрные (PolyCotton) ||SP-SFU-PR-01 | D299: 301 | E299: * | F299: 1 | G299: 661.00 | H299: 2.20 | I299: 495.75 | J299: 194.75 | K299: 1 | L299: =RC[-3]/100*RC[-1] -> 2.20 | M299: =SUM(R[-4]C[-1]:RC[-1]) -> 