Sheet:  name
D1: Вхiднi данi | H1: Зкореговано
C2: Закуп: | D2: 35218 | G2: грн
C3: Продано: | D3: 65774 | G3: грн
C4: Дохiд-Коефiцiент: | D4: 30556(1.87)
C5: Процент з-ти: | D5: 5 | G5: %
C6: Нараховано з-ти: | D6: 3288.70 | G6: грн | H6: =SUM(R[4]C[4]:R[88]C[4]) -> 
B7: курси: Все 0 , грн 1 , usd 20 , euro 25 , zl 5 , Инт 20 ,
A9: #11589 (2015-01-09) Роздріб - Відправлено-Продано
A10: N | B10: арт | C10: назва | D10: закуп | F10: к-ть | G10: цiна | H10: кф | I10: продж | J10: дохiд | K10: % | L10: з-та
A11: 1 | B11: H12101/L | C11: ECWCS куртка TRILAMINAT ACU ||KU-EC2-NL-10 | D11: 43.99 | E11: usd | F11: 1 | G11: 1936.00 | H11: 2.20 | I11: 1548.80 | J11: 669.00 | K11: 5 | L11: =RC[-3]/100*RC[-1] -> 2.20
A12: 2 | B12: H12101/M | C12: ECWCS куртка TRILAMINAT ACU ||KU-EC2-NL-10 | D12: 43.99 | E12: usd | F12: 13 | G12: 1936.00 | H12: 2.20 | I12: 20134.40 | J12: 8697.00 | K12: 5 | L12: =RC[-3]/100*RC[-1] -> 2.20
A13: 3 | B13: H12101/S | C13: ECWCS куртка TRILAMINAT ACU ||KU-EC2-NL-10 | D13: 43.99 | E13: usd | F13: 2 | G13: 1936.00 | H13: 2.20 | I13: 3097.60 | J13: 1338.00 | K13: 5 | L13: =RC[-3]/100*RC[-1] -> 2.20
A14: 4 | B14: H12101/XL | C14: ECWCS куртка TRILAMINAT ACU ||KU-EC2-NL-10 | D14: 43.99 | E14: usd | F14: 1 | G14: 1936.00 | H14: 2.20 | I14: 1548.80 | J14: 669.00 | K14: 5 | L14: =RC[-3]/100*RC[-1] -> 2.20
A15: 5 | B15: _1.1402 | C15: Бинокль SAKURA 30x60 ||B-20 | D15: 9.00 | E15: Инт | F15: 3 | G15: 294.00 | H15: 1.63 | I15: 749.70 | J15: 209.70 | K15: 5 | L15: =RC[-3]/100*RC[-1] -> 1.63
A16: 6 | B16: _1.16151 | C16: Монокуляр TASCO 22x32 woodland | D16: 7.60 | E16: Инт | F16: 1 | G16: 256.00 | H16: 1.68 | I16: 217.60 | J16: 65.60 | K16: 5 | L16: =RC[-3]/100*RC[-1] -> 1.68
A17: 7 | B17: _1.16151 | C17: Монокуляр TASCO 22x32 woodland | D17: 7.60 | E17: Инт | F17: 1 | G17: 256.00 | H17: 1.68 | I17: 217.60 | J17: 65.60 | K17: 5 | L17: =RC[-3]/100*RC[-1] -> 1.68
A18: 8 | B18: H0141/XL | C18: Перчатки тактические US Model чёрные ||RK-USM-PO-01 | D18: 10.43 | E18: usd | F18: 5 | G18: 459.00 | H18: 2.20 | I18: 1836.00 | J18: 793.00 | K18: 5 | L18: =RC[-3]/100*RC[-1] -> 2.20
A19: 9 | B19: K12023-A | C19: Рюкзак поясной тактический универсальный ACU ||M51612023-ACU | D19: 10.31 | E19: usd | F19: 5 | G19: 454.00 | H19: 2.20 | I19: 1816.00 | J19: 785.00 | K19: 5 | L19: =RC[-3]/100*RC[-1] -> 2.20
A20: 10 | B20: K12023-A | C20: Рюкзак поясной тактический универсальный ACU ||M51612023-ACU | D20: 10.31 | E20: usd | F20: 1 | G20: 454.00 | H20: 2.20 | I20: 363.20 | J20: 157.00 | K20: 5 | L20: =RC[-3]/100*RC[-1] -> 2.20
A21: 11 | B21: K12023-M | C21: Рюкзак поясной тактический универсальный мультикам ||M51612023-CP | D21: 10.31 | E21: usd | F21: 6 | G21: 454.00 | H21: 2.20 | I21: 2179.20 | J21: 942.00 | K21: 5 | L21: =RC[-3]/100*RC[-1] -> 2.20
A22: 12 | B22: K12023-O | C22: Рюкзак поясной тактический универсальный олива ||M51612023-OD | D22: 10.31 | E22: usd | F22: 5 | G22: 454.00 | H22: 2.20 | I22: 1816.00 | J22: 785.00 | K22: 5 | L22: =RC[-3]/100*RC[-1] -> 2.20 | M22: =SUM(R[-12]C[-1]:RC[-1]) -> 
A24: #11643 (2015-01-13) ППО"Карлсберг Україна" - Відправлено-Продано
A25: N | B25: арт | C25: назва | D25: закуп | F25: к-ть | G25: цiна | H25: кф | I25: продж | J25: дохiд | K25: % | L25: з-та
A26: 1 | B26: H47141/LR | C26: US ACU китель мультикам (NYCO R/S) ||BL-ACU-PR-14 | D26: 23.03 | E26: usd | F26: 1 | G26: 1013.00 | H26: 2.20 | I26: 1013.00 | J26: 552.40 | K26: 5 | L26: =RC[-3]/100*RC[-1] -> 2.20
A27: 2 | B27: H4714/LL | C27: US ACU штаны мультикам (PolyCotton) ||SP-ACU-PR-14 | D27: 23.03 | E27: usd | F27: 1 | G27: 1013.00 | H27: 2.20 | I27: 1013.00 | J27: 552.40 | K27: 5 | L27: =RC[-3]/100*RC[-1] -> 2.20
A28: 3 | B28: _874404 | C28: Балаклава двойная чёрная | D28: 4.10 | E28: Инт | F28: 1 | G28: 161.00 | H28: 1.96 | I28: 161.00 | J28: 79.00 | K28: 5 | L28: =RC[-3]/100*RC[-1] -> 1.96
A29: 4 | B29: H7514 | C29: Блайзер мультикам (Polycotton) ||CZ-BBC-PR-14 | D29: 4.31 | E29: usd | F29: 1 | G29: 190.00 | H29: 2.20 | I29: 190.00 | J29: 103.80 | K29: 5 | L29: =RC[-3]/100*RC[-1] -> 2.20
A30: 5 | B30: _TRA-026 | C30: Гермопакет 13x20 см | D30: 2.43 | E30: Инт | F30: 1 | G30: 77.00 | H30: 1.59 | I30: 77.00 | J30: 28.43 | K30: 5 | L30: =RC[-3]/100*RC[-1] -> 1.59
A31: 6 | B31: H3301/L | C31: Комплект термобілизни (95% полиэстер 5% спандекс) чёрный ||KP-UN2-PO-01/L | D31: 19.99 | E31: usd | F31: 1 | G31: 880.00 | H31: 2.20 | I31: 880.00 | J31: 480.20 | K31: 5 | L31: =RC[-3]/100*RC[-1] -> 2.20
A32: 7 | B32: H26331/L | C32: Куртка PATRIOT флисовая MP CAMO 390г/м (superfine) ||BL-PAT-HF-33 | D32: 31.03 | E32: usd | F32: 1 | G32: 1365.00 | H32: 2.20 | I32: 1365.00 | J32: 744.40 | K32: 5 | L32: =RC[-3]/100*RC[-1] -> 2.20
A33: 8 | B33: H0415 | C33: Набор посуды 3 предметн. из нержавеющей стали||ME-MEN-SS-15 | D33: 6.38 | E33: usd | F33: 1 | G33: 281.00 | H33: 2.20 | I33: 281.00 | J33: 153.40 | K33: 5 | L33: =RC[-3]/100*RC[-1] -> 2.20
A34: 9 | B34: 52913-16 | C34: Наколінники AltaCOUNTOUR Flexible мультикам [ALTA] ||OK-ACL-CD-34 | D34: 24.21 | E34: usd | F34: 1 | G34: 1065.00 | H34: 2.20 | I34: 1065.00 | J34: 580.80 | K34: 5 | L34: =RC[-3]/100*RC[-1] -> 2.20
A35: 10 | B35: H02101/L | C35: Носки высокие HEAVYWEIGHT ||р43-46 ||SK-HWT-WA-01 | D35: 4.83 | E35: usd | F35: 1 | G35: 213.00 | H35: 2.20 | I35: 213.00 | J35: 116.40 | K35: 5 | L35: =RC[-3]/100*RC[-1] -> 2.20
A36: 11 | B36: _12550 | C36: Перчатки THINSULATE акриловые без пальцев олива ||12540001 | D36: 2.00 | E36: euro | F36: 1 | G36: 120.00 | H36: 2.40 | I36: 120.00 | J36: 70.00 | K36: 5 | L36: =RC[-3]/100*RC[-1] -> 2.40
A37: 12 | B37: _155155-O | C37: Перчатки флисовые олива | D37: 1.83 | E37: Инт | F37: 1 | G37: 83.00 | H37: 2.26 | I37: 83.00 | J37: 46.33 | K37: 5 | L37: =RC[-3]/100*RC[-1] -> 2.26
A38: 13 | B38: H120 | C38: Підтяжки KL олива б/у | D38: 1.25 | E38: usd | F38: 1 | G38: 59.00 | H38: 2.36 | I38: 59.00 | J38: 34.00 | K38: 5 | L38: =RC[-3]/100*RC[-1] -> 2.36
A39: 14 | B39: H0602 | C39: Резиновая кружка олива ||TK-FOL-PP-02 | D39: 1.15 | E39: usd | F39: 1 | G39: 51.00 | H39: 2.22 | I39: 51.00 | J39: 28.00 | K39: 5 | L39: =RC[-3]/100*RC[-1] -> 2.22 | M39: =SUM(R[-14]C[-1]:RC[-1]) -> 
A41: #11657 (2015-01-14) ТзОВ РСП "Шувар" - Відправлено-Продано
A42: N | B42: арт | C42: назва | D42: закуп | F42: к-ть | G42: цiна | H42: кф | I42: продж | J42: дохiд | K42: % | L42: з-та
A43: 1 | B43: A19-205/45 | C43: Ботинки ACROPOLIS коричневые | D43: 1300.00 | E43: грн | F43: 1 | G43: 1820.00 | H43: 1.40 | I43: 1820.00 | J43: 520.00 | K43: 5 | L43: =RC[-3]/100*RC[-1] -> 1.40
A44: 2 | B44: H3301/2XL | C44: Комплект термобілизни (95% полиэстер 5% спандекс) чёрный ||KP-UN2-PO-01/2XL | D44: 19.99 | E44: usd | F44: 1 | G44: 880.00 | H44: 2.20 | I44: 880.00 | J44: 480.20 | K44: 5 | L44: =RC[-3]/100*RC[-1] -> 2.20 | M44: =SUM(R[-2]C[-1]:RC[-1]) -> 
A46: #11790 (2015-01-21) _____ - Відправлено-Продано
A47: N | B47: арт | C47: назва | D47: закуп | F47: к-ть | G47: цiна | H47: кф | I47: продж | J47: дохiд | K47: % | L47: з-та
A48: 1 | B48: X7299 | C48: US BDU кепка украинская цифра ( PolyCotton Ripstop) | D48: 45.00 | E48: грн | F48: 1 | G48: 99.00 | H48: 2.20 | I48: 99.00 | J48: 54.00 | K48: 5 | L48: =RC[-3]/100*RC[-1] -> 2.20
A49: 2 | B49: H65031/M | C49: Куртка М65 с отстегивающейся курткой вудлэнд (NYCO) ||KU-M65-NY-03 | D49: 37.22 | E49: usd | F49: 1 | G49: 1638.00 | H49: 2.20 | I49: 1638.00 | J49: 893.60 | K49: 5 | L49: =RC[-3]/100*RC[-1] -> 2.20
A50: 3 | B50: H26141/M | C50: Куртка PATRIOT флисовая мультикам 390г/м (superfine) ||BL-PAT-HF-14 | D50: 31.03 | E50: usd | F50: 1 | G50: 1365.00 | H50: 2.20 | I50: 1365.00 | J50: 744.40 | K50: 5 | L50: =RC[-3]/100*RC[-1] -> 2.20 | M50: =SUM(R[-3]C[-1]:RC[-1]) -> 
A52: #11798 (2015-01-21) ТзОВ ТВК"Львівхолод"профком - Відправлено-Продано
A53: N | B53: арт | C53: назва | D53: закуп | F53: к-ть | G53: цiна | H53: кф | I53: продж | J53: дохiд | K53: % | L53: з-та
A54: 1 | B54: H46031/MR | C54: US BDU китель вудлэнд (PolyCotton) ||BL-BDU-PR-03 | D54: 13.64 | E54: usd | F54: 1 | G54: 600.00 | H54: 2.20 | I54: 600.00 | J54: 327.20 | K54: 5 | L54: =RC[-3]/100*RC[-1] -> 2.20
A55: 2 | B55: H4603/MR | C55: US BDU штаны вудлэнд (PolyCotton) ||SP-BDU-PR-03 | D55: 13.64 | E55: usd | F55: 1 | G55: 600.00 | H55: 2.20 | I55: 600.00 | J55: 327.20 | K55: 5 | L55: =RC[-3]/100*RC[-1] -> 2.20
A56: 3 | B56: H1304 | C56: US пончо пол. вудлэнд (R/S) ||PO-MUS-PO-04 | D56: 12.25 | E56: usd | F56: 1 | G56: 539.00 | H56: 2.20 | I56: 539.00 | J56: 294.00 | K56: 5 | L56: =RC[-3]/100*RC[-1] -> 2.20
A57: 4 | B57: R1283/43 | C57: Берци кожа чёрные Украина | D57: 70.00 | E57: usd | F57: 1 | G57: 2001.00 | H57: 1.43 | I57: 2001.00 | J57: 601.00 | K57: 5 | L57: =RC[-3]/100*RC[-1] -> 1.43
A58: 5 | B58: _1400020 | C58: Каремат туристический 10мм | D58: 4.15 | E58: Инт | F58: 1 | G58: 150.00 | H58: 1.81 | I58: 150.00 | J58: 67.00 | K58: 5 | L58: =RC[-3]/100*RC[-1] -> 1.81
A59: 6 | B59: _1400021 | C59: Каремат-сидушка туристический 8мм олива | D59: 1.00 | E59: Инт | F59: 1 | G59: 57.00 | H59: 2.85 | I59: 57.00 | J59: 37.00 | K59: 5 | L59: =RC[-3]/100*RC[-1] -> 2.85
A60: 7 | B60: H3301/L | C60: Комплект термобілизни (95% полиэстер 5% спандекс) чёрный ||KP-UN2-PO-01/L | D60: 19.99 | E60: usd | F60: 1 | G60: 880.00 | H60: 2.20 | I60: 880.00 | J60: 480.20 | K60: 5 | L60: =RC[-3]/100*RC[-1] -> 2.20
A61: 8 | B61: H2016/M | C61: Куртка LIBERTY флисовая чорн/олива 390г/м (superfine) ||BL-LIB-HF-16 | D61: 28.04 | E61: usd | F61: 1 | G61: 1234.00 | H61: 2.20 | I61: 1234.00 | J61: 673.30 | K61: 5 | L61: =RC[-3]/100*RC[-1] -> 2.20
A62: 9 | B62: H65031/M | C62: Куртка М65 с отстегивающейся курткой вудлэнд (NYCO) ||KU-M65-NY-03 | D62: 37.22 | E62: usd | F62: 1 | G62: 1638.00 | H62: 2.20 | I62: 1638.00 | J62: 893.60 | K62: 5 | L62: =RC[-3]/100*RC[-1] -> 2.20
A63: 10 | B63: H02101/M | C63: Носки высокие HEAVYWEIGHT ||р39-42 ||SK-HWT-WA-01 | D63: 4.83 | E63: usd | F63: 1 | G63: 213.00 | H63: 2.20 | I63: 213.00 | J63: 116.40 | K63: 5 | L63: =RC[-3]/100*RC[-1] -> 2.20
A64: 11 | B64: H0202/09 | C64: Носки шерстяные высокие (олива) ||SK-NOR-WA-02 | D64: 5.12 | E64: usd | F64: 1 | G64: 225.00 | H64: 2.20 | I64: 225.00 | J64: 122.60 | K64: 5 | L64: =RC[-3]/100*RC[-1] -> 2.20
A65: 12 | B65: _155155-O | C65: Перчатки флисовые олива | D65: 1.83 | E65: Инт | F65: 1 | G65: 83.00 | H65: 2.26 | I65: 83.00 | J65: 46.33 | K65: 5 | L65: =RC[-3]/100*RC[-1] -> 2.26
A66: 13 | B66: H8902/120 | C66: Ремень TOUGH US MARINES олива ||PS-USM-CO-02 | D66: 3.68 | E66: usd | F66: 1 | G66: 193.00 | H66: 2.62 | I66: 193.00 | J66: 119.40 | K66: 5 | L66: =RC[-3]/100*RC[-1] -> 2.62
A67: 14 | B67: _TRM-007 | C67: Спальный мешок-одеяло ||CП-5 люкс | D67: 26.00 | E67: usd | F67: 1 | G67: 802.00 | H67: 1.54 | I67: 802.00 | J67: 282.00 | K67: 5 | L67: =RC[-3]/100*RC[-1] -> 1.54
A68: 15 | B68: _916596-1 | C68: Шапка олива с флисовой подкладкой | D68: 2.50 | E68: Инт | F68: 1 | G68: 125.00 | H68: 2.50 | I68: 125.00 | J68: 75.00 | K68: 5 | L68: =RC[-3]/100*RC[-1] -> 2.50 | M68: =SUM(R[-15]C[-1]:RC[-1]) -> 
A70: #11832 (2015-01-22) Тзов"Компанія"Центр-ЛТД" - Відправлено-Продано
A71: N | B71: арт | C71: назва | D71: закуп | F71: к-ть | G71: цiна | H71: кф | I71: продж | J71: дохiд | K71: % | L71: з-та
A72: 1 | B72: H12101/L | C72: ECWCS куртка TRILAMINAT ACU ||KU-EC2-NL-10 | D72: 43.99 | E72: usd | F72: 1 | G72: 1936.00 | H72: 2.20 | I72: 1936.00 | J72: 1056.20 | K72: 5 | L72: =RC[-3]/100*RC[-1] -> 2.20
A73: 2 | B73: H12101/XXL | C73: ECWCS куртка TRILAMINAT ACU ||KU-EC2-NL-10 | D73: 43.99 | E73: usd | F73: 1 | G73: 1936.00 | H73: 2.20 | I73: 1936.00 | J73: 1056.20 | K73: 5 | L73: =RC[-3]/100*RC[-1] -> 2.20
A74: 3 | B74: H1210/L | C74: ECWCS штаны TRILAMINAT ACU ||SP-EC2-NL-10 | D74: 35.80 | E74: usd | F74: 1 | G74: 1575.00 | H74: 2.20 | I74: 1575.00 | J74: 859.00 | K74: 5 | L74: =RC[-3]/100*RC[-1] -> 2.20
A75: 4 | B75: H1210/XXL | C75: ECWCS штаны TRILAMINAT ACU ||SP-EC2-NL-10 | D75: 35.80 | E75: usd | F75: 1 | G75: 1575.00 | H75: 2.20 | I75: 1575.00 | J75: 859.00 | K75: 5 | L75: =RC[-3]/100*RC[-1] -> 2.20
A76: 5 | B76: H2302/2XL | C76: Куртка CLASSIC ARMY флисовая олива ||BL-CAF-FL-02 | D76: 18.29 | E76: usd | F76: 1 | G76: 805.00 | H76: 2.20 | I76: 805.00 | J76: 439.20 | K76: 5 | L76: =RC[-3]/100*RC[-1] -> 2.20
A77: 6 | B77: 50413-00 | C77: Наколінники AltaFLEX Long Cap чёрные [ALTA] ||OK-AFL-CD-01 | D77: 16.11 | E77: usd | F77: 1 | G77: 709.00 | H77: 2.20 | I77: 709.00 | J77: 386.80 | K77: 5 | L77: =RC[-3]/100*RC[-1] -> 2.20 | M77: =SUM(R[-6]C[-1]:RC[-1]) -> 