Sheet:  name
D1: Вхiднi данi | H1: Зкореговано
C2: Закуп: | D2: 270324 | G2: грн
C3: Продано: | D3: 525624 | G3: грн
C4: Дохiд-Коефiцiент: | D4: 255300(1.94)
C5: Процент з-ти: | D5: 5 | G5: %
C6: Нараховано з-ти: | D6: 26281.21 | G6: грн | H6: =SUM(R[4]C[4]:R[979]C[4]) -> 
B7: курси: Все 0 , грн 1 , usd 20 , euro 25 , zl 5 , Инт 20 ,
A9: #11566 (2015-01-09) Магазин Верхнього одягу - Відправлено-Продано
A10: N | B10: арт | C10: назва | D10: закуп | F10: к-ть | G10: цiна | H10: кф | I10: продж | J10: дохiд | K10: % | L10: з-та
A11: 1 | B11: H12101/L | C11: ECWCS куртка TRILAMINAT ACU ||KU-EC2-NL-10 | D11: 43.99 | E11: usd | F11: 1 | G11: 1936.00 | H11: 2.20 | I11: 1742.40 | J11: 862.60 | K11: 5 | L11: =RC[-3]/100*RC[-1] -> 2.20
A12: 2 | B12: H1210/L | C12: ECWCS штаны TRILAMINAT ACU ||SP-EC2-NL-10 | D12: 35.80 | E12: usd | F12: 1 | G12: 1575.00 | H12: 2.20 | I12: 1417.50 | J12: 701.50 | K12: 5 | L12: =RC[-3]/100*RC[-1] -> 2.20
A13: 3 | B13: H14302/M | C13: Безрукавка охотничья WILD BOAR ||KK-WIL-PO-02 | D13: 19.32 | E13: usd | F13: 1 | G13: 850.00 | H13: 2.20 | I13: 850.00 | J13: 463.60 | K13: 5 | L13: =RC[-3]/100*RC[-1] -> 2.20
A14: 4 | B14: R1284/40 | C14: Берци кожа чёрные утепленные Украина | D14: 70.00 | E14: usd | F14: 1 | G14: 2001.00 | H14: 1.43 | I14: 2000.00 | J14: 600.00 | K14: 5 | L14: =RC[-3]/100*RC[-1] -> 1.43
A15: 5 | B15: T7308880/42 | C15: Берци кожанные с замком чёрные TEMPEX Hanrath | D15: 26.50 | E15: Инт | F15: 1 | G15: 909.00 | H15: 1.72 | I15: 909.00 | J15: 379.00 | K15: 5 | L15: =RC[-3]/100*RC[-1] -> 1.72
A16: 6 | B16: M800332/43 | C16: Берцы MAGNUM Precision Ultra Lite CT WPI Wide | D16: 53.25 | E16: usd | F16: 1 | G16: 1887.00 | H16: 1.77 | I16: 1887.00 | J16: 822.00 | K16: 5 | L16: =RC[-3]/100*RC[-1] -> 1.77
A17: 7 | B17: C7335/39 | C17: Кросівки | D17: 55.00 | E17: грн | F17: 1 | G17: 167.00 | H17: 3.04 | I17: 140.90 | J17: 85.90 | K17: 5 | L17: =RC[-3]/100*RC[-1] -> 3.04
A18: 8 | B18: H65031/L | C18: Куртка М65 с отстегивающейся курткой вудлэнд (NYCO) ||KU-M65-NY-03 | D18: 37.22 | E18: usd | F18: 1 | G18: 1638.00 | H18: 2.20 | I18: 1474.20 | J18: 729.80 | K18: 5 | L18: =RC[-3]/100*RC[-1] -> 2.20
A19: 9 | B19: H65021/2XLR | C19: Куртка М65 с отстегивающейся курткой олива (NYCO) ||KU-M65-NY-02 | D19: 38.39 | E19: usd | F19: 1 | G19: 1689.00 | H19: 2.20 | I19: 1689.00 | J19: 921.20 | K19: 5 | L19: =RC[-3]/100*RC[-1] -> 2.20
A20: 10 | B20: Бабки | C20: Прихід Грошей | D20: 0.00 | E20: грн | F20: 1 | G20: 0.00 | H20: 0.00 | I20: 14990.00 | J20: 14989.00 | K20: 5 | L20: =RC[-3]/100*RC[-1] -> 0.00 | M20: =SUM(R[-10]C[-1]:RC[-1]) -> 
A22: #11567 (2015-01-09) Магазин туризму - Відправлено-Продано
A23: N | B23: арт | C23: назва | D23: закуп | F23: к-ть | G23: цiна | H23: кф | I23: продж | J23: дохiд | K23: % | L23: з-та
A24: 1 | B24: K16164-B | C24: Мушка складная к М-серии чёрная [Производитель: ACM] ||M51616164-BK | D24: 228 | E24: * | F24: 1 | G24: 459.00 | H24: 2.01 | I24: 459.00 | J24: 231.00 | K24: 5 | L24: =RC[-3]/100*RC[-1] -> 2.01
A25: 2 | B25: K17173-B | C25: Петля магазинна к М-серии резина чёрная [Производитель: P] ||M51617173-BK | D25: 39 | E25: * | F25: 3 | G25: 89.00 | H25: 2.28 | I25: 267.00 | J25: 150.00 | K25: 5 | L25: =RC[-3]/100*RC[-1] -> 2.28
A26: 3 | B26: K5-0378A | C26: Шарики BB 6мм 0,20x2000 [PREMIUM] ||PJBB 0,2-2000 | D26: 38 | E26: * | F26: 1 | G26: 87.00 | H26: 2.29 | I26: 87.00 | J26: 49.00 | K26: 5 | L26: =RC[-3]/100*RC[-1] -> 2.29
A27: 4 | B27: _3929 | C27: Кобура тактическая кожанная | D27: 350 | E27: * | F27: 1 | G27: 235.00 | H27: 0.67 | I27: 235.00 | J27: -115.00 | K27: 5 | L27: =RC[-3]/100*RC[-1] -> 0.67
A28: 5 | B28: B1020 | C28: Швед. одеяло серое 210х160 | D28: 215 | E28: * | F28: 5 | G28: 311.00 | H28: 1.45 | I28: 1400.00 | J28: 325.00 | K28: 5 | L28: =RC[-3]/100*RC[-1] -> 1.45 | M28: =SUM(R[-5]C[-1]:RC[-1]) -> 
A30: #11569 (2015-01-09) магазин Зброя - Відправлено-Продано
A31: N | B31: арт | C31: назва | D31: закуп | F31: к-ть | G31: цiна | H31: кф | I31: продж | J31: дохiд | K31: % | L31: з-та
A32: 1 | B32: GW2086 | C32: Плоскогубцы GRAND WAY | D32: 10.98 | E32: Инт | F32: 1 | G32: 365.00 | H32: 1.66 | I32: 365.00 | J32: 145.49 | K32: 5 | L32: =RC[-3]/100*RC[-1] -> 1.66
A33: 2 | B33: _M015 | C33: Нож NAVY Enlan | D33: 4.96 | E33: Инт | F33: 1 | G33: 122.00 | H33: 1.23 | I33: 122.00 | J33: 22.80 | K33: 5 | L33: =RC[-3]/100*RC[-1] -> 1.23
A34: 3 | B34: GW6241BCS | C34: Нож GRAND WAY складной | D34: 3.97 | E34: Инт | F34: 1 | G34: 132.00 | H34: 1.66 | I34: 132.00 | J34: 52.59 | K34: 5 | L34: =RC[-3]/100*RC[-1] -> 1.66
A35: 4 | B35: _N14086-5 | C35: Нож складной балисонг | D35: 3.60 | E35: Инт | F35: 1 | G35: 110.00 | H35: 1.53 | I35: 110.00 | J35: 38.00 | K35: 5 | L35: =RC[-3]/100*RC[-1] -> 1.53
A36: 5 | B36: _2514HW | C36: Дартс 46х3,5см | D36: 62.00 | E36: usd | F36: 1 | G36: 1215.00 | H36: 0.98 | I36: 1215.00 | J36: -25.00 | K36: 5 | L36: =RC[-3]/100*RC[-1] -> 0.98
A37: 6 | B37: _204.78.94 | C37: Нож OPINEL Outdoor зеленый | D37: 16.00 | E37: euro | F37: 1 | G37: 600.00 | H37: 1.50 | I37: 600.00 | J37: 200.00 | K37: 5 | L37: =RC[-3]/100*RC[-1] -> 1.50
A38: 7 | B38: _204.78.92 | C38: Нож OPINEL Outdoor синий | D38: 16.00 | E38: euro | F38: 1 | G38: 600.00 | H38: 1.50 | I38: 600.00 | J38: 200.00 | K38: 5 | L38: =RC[-3]/100*RC[-1] -> 1.50
A39: 8 | B39: _21021 | C39: BRUNOX масло для оружия 100 мл | D39: 3.76 | E39: Инт | F39: 1 | G39: 113.00 | H39: 1.50 | I39: 113.00 | J39: 37.90 | K39: 5 | L39: =RC[-3]/100*RC[-1] -> 1.50
A40: 9 | B40: _82-25 | C40: OXYDA засіб для холодного вороніння NU-BLAK 25г | D40: 4.00 | E40: Инт | F40: 1 | G40: 121.00 | H40: 1.51 | I40: 121.00 | J40: 41.00 | K40: 5 | L40: =RC[-3]/100*RC[-1] -> 1.51
A41: 10 | B41: _82-50R | C41: OXYDA засіб для холодного вороніння NU-BLAK 50г (рідкий) | D41: 3.81 | E41: Инт | F41: 1 | G41: 124.00 | H41: 1.63 | I41: 124.00 | J41: 47.79 | K41: 5 | L41: =RC[-3]/100*RC[-1] -> 1.63
A42: 11 | B42: _82-00 | C42: OXYDA активатор для холодного вороніння NU-BLAK 50г | D42: 2.69 | E42: Инт | F42: 1 | G42: 82.00 | H42: 1.52 | I42: 82.00 | J42: 28.21 | K42: 5 | L42: =RC[-3]/100*RC[-1] -> 1.52
A43: 12 | B43: _82-00 | C43: OXYDA активатор для холодного вороніння NU-BLAK 50г | D43: 2.69 | E43: Инт | F43: 1 | G43: 82.00 | H43: 1.52 | I43: 0.00 | J43: -53.79 | K43: 5 | L43: =RC[-3]/100*RC[-1] -> 1.52
A44: 13 | B44: _1684 | C44: Патрон Флобера 4мм Нобель | D44: 0.20 | E44: Инт | F44: 9 | G44: 6.00 | H44: 1.47 | I44: 54.00 | J44: 17.36 | K44: 5 | L44: =RC[-3]/100*RC[-1] -> 1.47
A45: 14 | B45: _4.1687 | C45: Балон СО-2 UMAREX 12г | D45: 0.39 | E45: Инт | F45: 4 | G45: 12.00 | H45: 1.54 | I45: 48.00 | J45: 16.83 | K45: 5 | L45: =RC[-3]/100*RC[-1] -> 1.54
A46: 15 | B46: _15479200 | C46: WH багнет 98K в піхвах (репро) новий прихід||15479200 | D46: 29.50 | E46: euro | F46: 1 | G46: 1564.00 | H46: 2.12 | I46: 1251.20 | J46: 513.70 | K46: 5 | L46: =RC[-3]/100*RC[-1] -> 2.12
A47: 16 | B47: _18774 | C47: Чохол на багнет ||18281100 | D47: 6.00 | E47: euro | F47: 1 | G47: 369.00 | H47: 2.46 | I47: 295.20 | J47: 145.20 | K47: 5 | L47: =RC[-3]/100*RC[-1] -> 2.46
A48: 17 | B48: _2317322 | C48: Патрон шумовой 9мм OZKURSAN | D48: 0.33 | E48: Инт | F48: 2 | G48: 10.00 | H48: 1.52 | I48: 20.00 | J48: 6.80 | K48: 5 | L48: =RC[-3]/100*RC[-1] -> 1.52
A49: 18 | B49: _K17122-E | C49: Очки FL8008 затемненные ||M51617122-TEA | D49: 3.70 | E49: usd | F49: 1 | G49: 159.00 | H49: 2.15 | I49: 159.00 | J49: 85.00 | K49: 5 | L49: =RC[-3]/100*RC[-1] -> 2.15
A50: 19 | B50: _1684 | C50: Патрон Флобера 4мм Нобель | D50: 0.20 | E50: Инт | F50: 32 | G50: 6.00 | H50: 1.47 | I50: 192.00 | J50: 61.71 | K50: 5 | L50: =RC[-3]/100*RC[-1] -> 1.47
A51: 20 | B51: GW5011D | C51: Нож многофункциональный GRAND WAY | D51: 1.19 | E51: Инт | F51: 1 | G51: 40.00 | H51: 1.68 | I51: 40.00 | J51: 16.22 | K51: 5 | L51: =RC[-3]/100*RC[-1] -> 1.68 | M51: =SUM(R[-20]C[-1]:RC[-1]) -> 
A53: #11575 (2015-01-09) Магазин Уніформи - Відправлено-Продано
A54: N | B54: арт | C54: назва | D54: закуп | F54: к-ть | G54: цiна | H54: кф | I54: продж | J54: дохiд | K54: % | L54: з-та
A55: 1 | B55: 40484-2 | C55: Балаклава чёрная флисовая | D55: 2.94 | E55: Инт | F55: 2 | G55: 106.00 | H55: 1.80 | I55: 212.00 | J55: 94.40 | K55: 5 | L55: =RC[-3]/100*RC[-1] -> 1.80
A56: 2 | B56: _155155-B | C56: Перчатки флисовые чёрные | D56: 1.83 | E56: Инт | F56: 1 | G56: 83.00 | H56: 2.26 | I56: 83.00 | J56: 46.33 | K56: 5 | L56: =RC[-3]/100*RC[-1] -> 2.26
A57: 3 | B57: 40484-2 | C57: Балаклава чёрная флисовая | D57: 2.94 | E57: Инт | F57: 1 | G57: 106.00 | H57: 1.80 | I57: 95.40 | J57: 36.60 | K57: 5 | L57: =RC[-3]/100*RC[-1] -> 1.80
A58: 4 | B58: _12550 | C58: Перчатки THINSULATE акриловые без пальцев олива ||12540001 | D58: 2.00 | E58: euro | F58: 1 | G58: 120.00 | H58: 2.40 | I58: 108.00 | J58: 58.00 | K58: 5 | L58: =RC[-3]/100*RC[-1] -> 2.40
A59: 5 | B59: G4502/86-170 | C59: Комплект теплого нательного белья (100% полиэстер) олива | D59: 90 | E59: * | F59: 1 | G59: 250.00 | H59: 2.78 | I59: 225.00 | J59: 135.00 | K59: 5 | L59: =RC[-3]/100*RC[-1] -> 2.78
A60: 6 | B60: H5914/SR | C60: CPU штаны мультикамо (PolyCotton) ||SP-CPU-PR-14 | D60: 428 | E60: * | F60: 1 | G60: 942.00 | H60: 2.20 | I60: 847.80 | J60: 419.80 | K60: 5 | L60: =RC[-3]/100*RC[-1] -> 2.20
A61: 7 | B61: H43141/SR | C61: US SFU китель мультикам (PolyCotton) ||BL-SFU-PR-14 | D61: 333 | E61: * | F61: 1 | G61: 732.00 | H61: 2.20 | I61: 631.80 | J61: 298.80 | K61: 5 | L61: =RC[-3]/100*RC[-1] -> 2.20
A62: 8 | B62: A19-143 | C62: Стакан металический маленький ACROPOLIS ||СХМ-1з | D62: 21 | E62: * | F62: 1 | G62: 25.00 | H62: 1.19 | I62: 22.50 | J62: 1.50 | K62: 5 | L62: =RC[-3]/100*RC[-1] -> 1.19
A63: 9 | B63: H02301/M | C63: Носки высокие MEDIUMWEIGHT ||р39-42 ||SK-MWT-WA-01 | D63: 92 | E63: * | F63: 1 | G63: 202.00 | H63: 2.20 | I63: 202.00 | J63: 110.00 | K63: 5 | L63: =RC[-3]/100*RC[-1] -> 2.20
A64: 10 | B64: H0201/10 | C64: Носки шерстяные высокие (чёрные) ||SK-NOR-WA-01 | D64: 108 | E64: * | F64: 1 | G64: 238.00 | H64: 2.20 | I64: 238.00 | J64: 130.00 | K64: 5 | L64: =RC[-3]/100*RC[-1] -> 2.20
A65: 11 | B65: SSS | C65: Салфетки для чистки оружия | D65: 140 | E65: * | F65: 1 | G65: 15.00 | H65: 0.11 | I65: 15.00 | J65: -125.00 | K65: 5 | L65: =RC[-3]/100*RC[-1] -> 0.11
A66: 12 | B66: H0131/M | C66: Перчатки тактические Half Finger чёрные ||RK-HFG-PO-01 | D66: 158 | E66: * | F66: 1 | G66: 347.00 | H66: 2.20 | I66: 312.30 | J66: 154.30 | K66: 5 | L66: =RC[-3]/100*RC[-1] -> 2.20
A67: 13 | B67: H5503/XLL | C67: CARGO штаны вудлэнд (NYCO) ||SP-CAR-NT-03 | D67: 345 | E67: * | F67: 1 | G67: 759.00 | H67: 2.20 | I67: 683.10 | J67: 338.10 | K67: 5 | L67: =RC[-3]/100*RC[-1] -> 2.20
A68: 14 | B68: H7820 | C68: Хустка SHEMAGH біло/чёрная ||CZ-ARF-CO-20 | D68: 72 | E68: * | F68: 1 | G68: 159.00 | H68: 2.21 | I68: 159.00 | J68: 87.00 | K68: 5 | L68: =RC[-3]/100*RC[-1] -> 2.21
A69: 15 | B69: H3302/S | C69: Комплект термобілизни (95% полиэстер 5% спандекс) олива ||KP-UN2-PO-02/S | D69: 400 | E69: * | F69: 1 | G69: 880.00 | H69: 2.20 | I69: 792.00 | J69: 392.00 | K69: 5 | L69: =RC[-3]/100*RC[-1] -> 2.20
A70: 16 | B70: K13082-A | C70: Хлястик T-тип d-ring - ACU [Производитель: ACM] ||M51613082-ACU | D70: 28 | E70: * | F70: 2 | G70: 61.00 | H70: 2.18 | I70: 109.80 | J70: 53.80 | K70: 5 | L70: =RC[-3]/100*RC[-1] -> 2.18
A71: 17 | B71: H7901 | C71: Шапка флисовая чёрная ||CZ-DOK-FL-01 | D71: 40 | E71: * | F71: 1 | G71: 100.00 | H71: 2.50 | I71: 80.00 | J71: 40.00 | K71: 5 | L71: =RC[-3]/100*RC[-1] -> 2.50
A72: 18 | B72: _125501 | C72: Перчатки THINSULATE акриловые без пальцев чёрные ||12540002 | D72: 50 | E72: * | F72: 1 | G72: 120.00 | H72: 2.40 | I72: 120.00 | J72: 70.00 | K72: 5 | L72: =RC[-3]/100*RC[-1] -> 2.40
A73: 19 | B73: H7232 | C73: US BDU кепка олива драп ( PolyCotton Ripstop) ||CZ-COM-NR-32 | D73: 47 | E73: * | F73: 1 | G73: 103.00 | H73: 2.19 | I73: 103.00 | J73: 56.00 | K73: 5 | L73: =RC[-3]/100*RC[-1] -> 2.19
A74: 20 | B74: _109341/G/6/42 | C74: BW гольф на молнии олива (оригинал) TL ||10901001/9 | D74: 300 | E74: * | F74: 4 | G74: 20.00 | H74: 0.07 | I74: 80.00 | J74: -1120.00 | K74: 5 | L74: =RC[-3]/100*RC[-1] -> 0.07
A75: 21 | B75: H0613 | C75: Резиновая кружка хаки ||TK-FOL-PP-13 | D75: 23 | E75: * | F75: 1 | G75: 51.00 | H75: 2.22 | I75: 51.00 | J75: 28.00 | K75: 5 | L75: =RC[-3]/100*RC[-1] -> 2.22 | M75: =SUM(R[-21]C[-1]:RC[-1]) -> 
A77: #11584 (2015-01-09) ШЕФ - Відправлено-Продано
A78: N | B78: арт | C78: назва | D78: закуп | F78: к-ть | G78: цiна | H78: кф | I78: продж | J78: дохiд | K78: % | L78: з-та
A79: 1 | B79: _5.8310 | C79: Пістолет пневматичний COLT Defender | D79: 1265 | E79: * | F79: 1 | G79: 1775.00 | H79: 1.40 | I79: 1775.00 | J79: 510.00 | K79: 5 | L79: =RC[-3]/100*RC[-1] -> 1.40 | M79: =SUM(R[-1]C[-1]:RC[-1]) -> 
A81: #11586 (2015-01-09) ШЕФ - Відправлено-Продано
A82: N | B82: арт | C82: назва | D82: закуп | F82: к-ть | G82: цiна | H82: кф | I82: продж | J82: дохiд | K82: % | L82: з-та
A83: 1 | B83: Брон | C83: Бронепластина 4-й класс | D83: 1400 | E83: * | F83: 2 | G83: 1662.00 | H83: 1.19 | I83: 3324.00 | J83: 524.00 | K83: 5 | L83: =RC[-3]/100*RC[-1] -> 1.19
A84: 2 | B84: _703025-B | C84: Перчатки флисовые чёрные | D84: 36 | E84: * | F84: 1 | G84: 61.00 | H84: 1.69 | I84: 61.00 | J84: 25.00 | K84: 5 | L84: =RC[-3]/100*RC[-1] -> 1.69
A85: 3 | B85: _874404 | C85: Балаклава двойная чёрная | D85: 82 | E85: * | F85: 1 | G85: 161.00 | H85: 1.96 | I85: 161.00 | J85: 79.00 | K85: 5 | L85: =RC[-3]/100*RC[-1] -> 1.96
A86: 4 | B86: H3301/M | C86: Комплект термобілизни (95% полиэстер 5% спандекс) чёрный ||KP-UN2-PO-01/M | D86: 400 | E86: * | F86: 1 | G86: 880.00 | H86: 2.20 | I86: 880.00 | J86: 480.00 | K86: 5 | L86: =RC[-3]/100*RC[-1] -> 2.20
A87: 5 | B87: H0202/09 | C87: Носки шерстяные высокие (олива) ||SK-NOR-WA-02 | D87: 102 | E87: * | F87: 1 | G87: 225.00 | H87: 2.21 | I87: 225.00 | J87: 123.00 | K87: 5 | L87: =RC[-3]/100*RC[-1] -> 2.21
A88: 6 | B88: _1400020 | C88: Каремат туристический 10мм | D88: 83 | E88: * | F88: 1 | G88: 150.00 | H88: 1.81 | I88: 150.00 | J88: 67.00 | K88: 5 | L88: =RC[-3]/100*RC[-1] -> 1.81
A89: 7 | B89: _1400021 | C89: Каремат-сидушка туристический 8мм олива | D89: 20 | E89: * | F89: 1 | G89: 57.00 | H89: 2.85 | I89: 57.00 | J89: 37.00 | K89: 5 | L89: =RC[-3]/100*RC[-1] -> 2.85 | M89: =SUM(R[-7]C[-1]:RC[-1]) -> 
A91: #11594 (2015-01-10) Магазин Верхнього одягу - Відправлено-Продано
A92: N | B92: арт | C92: назва | D92: закуп | F92: к-ть | G92: цiна | H92: кф | I92: продж | J92: дохiд | K92: % | L92: з-та
A93: 1 | B93: R1284/44 | C93: Берци кожа чёрные утепленные Украина | D93: 1400 | E93: * | F93: 1 | G93: 2001.00 | H93: 1.43 | I93: 2000.00 | J93: 600.00 | K93: 5 | L93: =RC[-3]/100*RC[-1] -> 1.43
A94: 2 | B94: X1011/48 | C94: BW пуловер (полушерсть) чёрный (3 нитки) | D94: 500 | E94: * | F94: 1 | G94: 686.00 | H94: 1.37 | I94: 686.00 | J94: 186.00 | K94: 5 | L94: =RC[-3]/100*RC[-1] -> 1.37
A95: 3 | B95: H2316/3XL | C95: Куртка CLASSIC ARMY флисовая чорн/олива ||BL-CAF-FL-16 | D95: 366 | E95: * | F95: 1 | G95: 805.00 | H95: 2.20 | I95: 800.00 | J95: 434.00 | K95: 5 | L95: =RC[-3]/100*RC[-1] -> 2.20
A96: 4 | B96: H2316/2XL | C96: Куртка CLASSIC ARMY флисовая чорн/олива ||BL-CAF-FL-16 | D96: 366 | E96: * | F96: 1 | G96: 805.00 | H96: 2.20 | I96: 644.00 | J96: 278.00 | K96: 5 | L96: =RC[-3]/100*RC[-1] -> 2.20
A97: 5 | B97: H2316/L | C97: Куртка CLASSIC ARMY флисовая чорн/олива ||BL-CAF-FL-16 | D97: 366 | E97: * | F97: 1 | G97: 805.00 | H97: 2.20 | I97: 644.00 | J97: 278.00 | K97: 5 | L97: =RC[-3]/100*RC[-1] -> 2.20 | M97: =SUM(R[-5]C[-1]:RC[-1]) -> 
A99: #11595 (2015-01-10) магазин Зброя - Відправлено-Продано
A100: N | B100: арт | C100: назва | D100: закуп | F100: к-ть | G100: цiна | H100: кф | I100: продж | J100: дохiд | K100: % | L100: з-та
A101: 1 | B101: _1.1802 | C101: Бинокль YUKON 12x50WA ||ПС 22023 | D101: 914 | E101: * | F101: 1 | G101: 1715.00 | H101: 1.88 | I101: 1715.00 | J101: 801.00 | K101: 5 | L101: =RC[-3]/100*RC[-1] -> 1.88
A102: 2 | B102: _D910 | C102: Нож м-р ГРАЄВСЬКИЙ складной | D102: 425 | E102: * | F102: 1 | G102: 555.00 | H102: 1.31 | I102: 555.00 | J102: 130.00 | K102: 5 | L102: =RC[-3]/100*RC[-1] -> 1.31
A103: 3 | B103: K16182L | C103: Кольцо для оптики низьке 30 mm RIS [Производитель: ACM] ||M51616182 | D103: 42 | E103: * | F103: 1 | G103: 107.00 | H103: 2.55 | I103: 107.00 | J103: 65.00 | K103: 5 | L103: =RC[-3]/100*RC[-1] -> 2.55
A104: 4 | B104: _1684 | C104: Патрон Флобера 4мм Нобель | D104: 4 | E104: * | F104: 15 | G104: 6.00 | H104: 1.50 | I104: 90.00 | J104: 30.00 | K104: 5 | L104: =RC[-3]/100*RC[-1] -> 1.50
A105: 5 | B105: _1201 | C105: Винтовка кремниевая Кентуки США 19ст. (110см) | D105: 1330 | E105: * | F105: 1 | G105: 1733.00 | H105: 1.30 | I105: 1559.70 | J105: 229.70 | K105: 5 | L105: =RC[-3]/100*RC[-1] -> 1.30
A106: 6 | B106: _048B | C106: Сабля SHAMSHIR | D106: 618 | E106: * | F106: 1 | G106: 926.00 | H106: 1.50 | I106: 833.40 | J106: 215.40 | K106: 5 | L106: =RC[-3]/100*RC[-1] -> 1.50
A107: 7 | B107: 120740 | C107: Точило FISKARS | D107: 221 | E107: * | F107: 1 | G107: 309.00 | H107: 1.40 | I107: 309.00 | J107: 88.00 | K107: 5 | L107: =RC[-3]/100*RC[-1] -> 1.40
A108: 8 | B108: AA55 | C108: Батарейка DURACELL Turbo AA ||_80317 | D108: 7 | E108: * | F108: 3 | G108: 11.00 | H108: 1.57 | I108: 33.00 | J108: 12.00 | K108: 5 | L108: =RC[-3]/100*RC[-1] -> 1.57
A109: 9 | B109: _297386 | C109: Батарейка ENERGIZER Base AAA | D109: 5 | E109: * | F109: 4 | G109: 8.00 | H109: 1.60 | I109: 32.00 | J109: 12.00 | K109: 5 | L109: =RC[-3]/100*RC[-1] -> 1.60
A110: 10 | B110: _1.1810 | C110: Бинокль YUKON 8-24x50 WA ||22121 | D110: 1401 | E110: * | F110: 1 | G110: 1966.00 | H110: 1.40 | I110: 1828.38 | J110: 427.38 | K110: 5 | L110: =RC[-3]/100*RC[-1] -> 1.40
A111: 11 | B111: _DS-0.752 | C111: Пульки ШЕРШЕНЬ 4.5мм 0.75г (200шт) | D111: 20 | E111: * | F111: 1 | G111: 37.00 | H111: 1.85 | I111: 37.00 | J111: 17.00 | K111: 5 | L111: =RC[-3]/100*RC[-1] -> 1.85
A112: 12 | B112: _4.1687 | C112: Балон СО-2 UMAREX 12г | D112: 8 | E112: * | F112: 1 | G112: 12.00 | H112: 1.50 | I112: 12.00 | J112: 4.00 | K112: 5 | L112: =RC[-3]/100*RC[-1] -> 1.50
A113: 13 | B113: _DS-0.282 | C113: Пульки ШЕРШЕНЬ 4.5мм 0.28г (2500шт) | D113: 65 | E113: * | F113: 1 | G113: 108.00 | H113: 1.66 | I113: 108.00 | J113: 43.00 | K113: 5 | L113: =RC[-3]/100*RC[-1] -> 1.66
A114: 14 | B114: _141425 | C114: Мишень 14x14cм (25шт) | D114: 9 | E114: * | F114: 4 | G114: 23.00 | H114: 2.56 | I114: 92.00 | J114: 56.00 | K114: 5 | L114: =RC[-3]/100*RC[-1] -> 2.56
A115: 15 | B115: _429.00.02 | C115: Масло для чистки Clever BALLISTOL 50мл спрей | D115: 73 | E115: * | F115: 1 | G115: 120.00 | H115: 1.64 | I115: 120.00 | J115: 47.00 | K115: 5 | L115: =RC[-3]/100*RC[-1] -> 1.64
A116: 16 | B116: _898-9130 | C116: Набор для чистки оружия 4.5 мм | D116: 83 | E116: * | F116: 1 | G116: 137.00 | H116: 1.65 | I116: 137.00 | J116: 54.00 | K116: 5 | L116: =RC[-3]/100*RC[-1] -> 1.65
A117: 17 | B117: _TiA9 | C117: Фонарик TIABLO A09 | D117: 1333 | E117: * | F117: 1 | G117: 1867.00 | H117: 1.40 | I117: 1867.00 | J117: 534.00 | K117: 5 | L117: =RC[-3]/100*RC[-1] -> 1.40
A118: 18 | B118: _XT-B2 | C118: Винтовка пневматическая XTSG XT-B2 | D118: 657 | E118: * | F118: 1 | G118: 988.00 | H118: 1.50 | I118: 988.00 | J118: 331.00 | K118: 5 | L118: =RC[-3]/100*RC[-1] -> 1.50 | M118: =SUM(R[-18]C[-1]:RC[-1]) -> 
A120: #11596 (2015-01-10) Магазин туризму - Відправлено-Продано
A121: N | B121: арт | C121: назва | D121: закуп | F121: к-ть | G121: цiна | H121: кф | I121: продж | J121: дохiд | K121: % | L121: з-та
A122: 1 | B122: _26-0005 | C122: Гарнитура к KENWOOD Quansheng Puxing Motorola GP-888(1х провод. прозрачный возд) [Китай] | D122: 8.00 | E122: usd | F122: 2 | G122: 234.00 | H122: 1.46 | I122: 468.00 | J122: 148.00 | K122: 5 | L122: =RC[-3]/100*RC[-1] -> 1.46
A123: 2 | B123: K5-1351-В | C123: Магазин страйкбольный механический к AK/AKM (150шар) чёрный [CM]||K5-1351 BK | D123: 4.64 | E123: usd | F123: 2 | G123: 200.00 | H123: 2.16 | I123: 400.00 | J123: 214.40 | K123: 5 | L123: =RC[-3]/100*RC[-1] -> 2.16
A124: 3 | B124: K5-0378A | C124: Шарики BB 6мм 0,20x2000 [PREMIUM] ||PJBB 0,2-2000 | D124: 1.88 | E124: usd | F124: 1 | G124: 87.00 | H124: 2.31 | I124: 87.00 | J124: 49.40 | K124: 5 | L124: =RC[-3]/100*RC[-1] -> 2.31
A125: 4 | B125: K5-0378B | C125: Шарики BB 6мм 0,20x4000 [PREMIUM] ||PJBB 0,2-4000 | D125: 3.57 | E125: usd | F125: 2 | G125: 171.00 | H125: 2.39 | I125: 342.00 | J125: 199.20 | K125: 5 | L125: =RC[-3]/100*RC[-1] -> 2.39
A126: 5 | B126: _11030-094 | C126: Шарики BB 6мм 0,20x3000 [EXCEL] бутылка | D126: 115 | E126: * | F126: 1 | G126: 97.00 | H126: 0.84 | I126: 97.00 | J126: -18.00 | K126: 5 | L126: =RC[-3]/100*RC[-1] -> 0.84
A127: 6 | B127: K4-1995 | C127: Винтовка электропневматическая страйкбольная AK74U рам.приклад (метал+дерево) RK01 [P tune] | D127: 1931 | E127: * | F127: 1 | G127: 3766.00 | H127: 1.95 | I127: 3577.70 | J127: 1646.70 | K127: 5 | L127: =RC[-3]/100*RC[-1] -> 1.95
A128: 7 | B128: K13048-W | C128: Кобура набедренная вудлэнд ||M51613048-WL | D128: 97 | E128: * | F128: 3 | G128: 223.00 | H128: 2.30 | I128: 602.10 | J128: 311.10 | K128: 5 | L128: =RC[-3]/100*RC[-1] -> 2.30
A129: 8 | B129: _14906 | C129: Горелка для сухого спирту ||14906000 | D129: 62 | E129: * | F129: 1 | G129: 142.00 | H129: 2.29 | I129: 142.00 | J129: 80.00 | K129: 5 | L129: =RC[-3]/100*RC[-1] -> 2.29
A130: 9 | B130: _542693 | C130: Таблетки для дезинфенкции воды Javel Aqua (10шт) | D130: 15 | E130: * | F130: 2 | G130: 25.00 | H130: 1.67 | I130: 50.00 | J130: 20.00 | K130: 5 | L130: =RC[-3]/100*RC[-1] -> 1.67
A131: 10 | B131: A19-39 | C131: Сумка рибальська ACROPOLIS ||РС-1у | D131: 423 | E131: * | F131: 1 | G131: 575.00 | H131: 1.36 | I131: 575.00 | J131: 152.00 | K131: 5 | L131: =RC[-3]/100*RC[-1] -> 1.36
A132: 11 | B132: A19-184 | C132: Подсумок гранатный олива ACROPOLIS||ПГР-1 | D132: 50 | E132: * | F132: 1 | G132: 70.00 | H132: 1.40 | I132: 70.00 | J132: 20.00 | K132: 5 | L132: =RC[-3]/100*RC[-1] -> 1.40
A133: 12 | B133: K4-2760 | C133: Винтовка электропневматическая страйкбольная AKS74U (метал+дерево) [Производитель: CYMA.045A] | D133: 2377 | E133: * | F133: 1 | G133: 4207.00 | H133: 1.77 | I133: 4207.00 | J133: 1830.00 | K133: 5 | L133: =RC[-3]/100*RC[-1] -> 1.77
A134: 13 | B134: K4-2956 | C134: Винтовка пневматическая страйкбольна HI-POWER M870 SHOTGUN 420 fps | D134: 774 | E134: * | F134: 1 | G134: 1577.00 | H134: 2.04 | I134: 1577.00 | J134: 803.00 | K134: 5 | L134: =RC[-3]/100*RC[-1] -> 2.04
A135: 14 | B135: K5-0772 | C135: Шарики BB 6мм 0,23x3000 [PREMIUM] ||PJBB 0,23-3000 | D135: 71 | E135: * | F135: 1 | G135: 171.00 | H135: 2.41 | I135: 171.00 | J135: 100.00 | K135: 5 | L135: =RC[-3]/100*RC[-1] -> 2.41
A136: 15 | B136: _N550200 | C136: Кобура оперативная ПМ с подсумком | D136: 270 | E136: * | F136: 1 | G136: 382.00 | H136: 1.41 | I136: 382.00 | J136: 112.00 | K136: 5 | L136: =RC[-3]/100*RC[-1] -> 1.41
A137: 16 | B137: K5-0772 | C137: Шарики BB 6мм 0,23x3000 [PREMIUM] ||PJBB 0,23-3000 | D137: 71 | E137: * | F137: 1 | G137: 171.00 | H137: 2.41 | I137: 171.00 | J137: 100.00 | K137: 5 | L137: =RC[-3]/100*RC[-1] -> 2.41
A138: 17 | B138: BD0767 | C138: Адаптер магазинов М4 к G36 ||BD0767 K5-0643 | D138: 174 | E138: * | F138: 1 | G138: 416.00 | H138: 2.39 | I138: 416.00 | J138: 242.00 | K138: 5 | L138: =RC[-3]/100*RC[-1] -> 2.39
A139: 18 | B139: KBB-23 | C139: Шарики BB 6мм 0,23x4300 [GUARDER] ||BB-23(BAG) | D139: 157 | E139: * | F139: 1 | G139: 253.00 | H139: 1.61 | I139: 0.00 | J139: -157.00 | K139: 5 | L139: =RC[-3]/100*RC[-1] -> 1.61 | M139: =SUM(R[-18]C[-1]:RC[-1]) -> 
A141: #11597 (2015-01-10) Магазин Уніформи - Відправлено-Продано
A142: N | B142: арт | C142: назва | D142: закуп | F142: к-ть | G142: цiна | H142: кф | I142: продж | J142: дохiд | K142: % | L142: з-та
A143: 1 | B143: H02101/M | C143: Носки высокие HEAVYWEIGHT ||р39-42 ||SK-HWT-WA-01 | D143: 97 | E143: * | F143: 1 | G143: 213.00 | H143: 2.20 | I143: 213.00 | J143: 116.00 | K143: 5 | L143: =RC[-3]/100*RC[-1] -> 2.20
A144: 2 | B144: H47101/LR | C144: US ACU китель ACU (PolyCotton) ||BL-ACU-PR-10 | D144: 349 | E144: * | F144: 1 | G144: 767.00 | H144: 2.20 | I144: 690.30 | J144: 341.30 | K144: 5 | L144: =RC[-3]/100*RC[-1] -> 2.20
A145: 3 | B145: H4710/LR | C145: US ACU штаны ACU (PolyCotton) ||SP-ACU-PR-10 | D145: 349 | E145: * | F145: 1 | G145: 767.00 | H145: 2.20 | I145: 690.30 | J145: 341.30 | K145: 5 | L145: =RC[-3]/100*RC[-1] -> 2.20
A146: 4 | B146: G4502/92-175 | C146: Комплект теплого нательного белья (100% полиэстер) олива | D146: 90 | E146: * | F146: 1 | G146: 250.00 | H146: 2.78 | I146: 225.00 | J146: 135.00 | K146: 5 | L146: =RC[-3]/100*RC[-1] -> 2.78
A147: 5 | B147: H4011/LR | C147: URBAN TACTICAL штаны койот ||SP-UTL-CO-11 | D147: 743 | E147: * | F147: 1 | G147: 1634.00 | H147: 2.20 | I147: 1470.60 | J147: 727.60 | K147: 5 | L147: =RC[-3]/100*RC[-1] -> 2.20
A148: 6 | B148: H4632/LR | C148: US BDU штаны олива драп (NYCO R/S) ||SP-BDU-NR-32 | D148: 281 | E148: * | F148: 1 | G148: 619.00 | H148: 2.20 | I148: 619.00 | J148: 338.00 | K148: 5 | L148: =RC[-3]/100*RC[-1] -> 2.20
A149: 7 | B149: A0256 | C149: Нашивка 38-а піхотна дивізія армии США ||139581 | D149: 38 | E149: * | F149: 1 | G149: 26.00 | H149: 0.68 | I149: 26.00 | J149: -12.00 | K149: 5 | L149: =RC[-3]/100*RC[-1] -> 0.68
A150: 8 | B150: X4011 | C150: Балаклава чёрная с 1-м отв. нинзя(100%хлопок) ||X76011 | D150: 63 | E150: * | F150: 1 | G150: 80.00 | H150: 1.27 | I150: 80.00 | J150: 17.00 | K150: 5 | L150: =RC[-3]/100*RC[-1] -> 1.27
A151: 9 | B151: _916596-1 | C151: Шапка олива с флисовой подкладкой | D151: 50 | E151: * | F151: 1 | G151: 125.00 | H151: 2.50 | I151: 125.00 | J151: 75.00 | K151: 5 | L151: =RC[-3]/100*RC[-1] -> 2.50
A152: 10 | B152: K17222-C | C152: Балаклава SKULL type C-чёрная [Производитель: ACM] ||M51617222-C | D152: 53 | E152: * | F152: 1 | G152: 117.00 | H152: 2.21 | I152: 117.00 | J152: 64.00 | K152: 5 | L152: =RC[-3]/100*RC[-1] -> 2.21
A153: 11 | B153: H7901 | C153: Шапка флисовая чёрная ||CZ-DOK-FL-01 | D153: 40 | E153: * | F153: 1 | G153: 100.00 | H153: 2.50 | I153: 100.00 | J153: 60.00 | K153: 5 | L153: =RC[-3]/100*RC[-1] -> 2.50
A154: 12 | B154: H3502/XS | C154: Комплект термобілизни (100% полиэстер) олива ||KP-UN1-PO-02 | D154: 274 | E154: * | F154: 2 | G154: 603.00 | H154: 2.20 | I154: 1085.40 | J154: 537.40 | K154: 5 | L154: =RC[-3]/100*RC[-1] -> 2.20
A155: 13 | B155: H3302/XS | C155: Комплект термобілизни (95% полиэстер 5% спандекс) олива ||KP-UN2-PO-02/XS | D155: 400 | E155: * | F155: 1 | G155: 880.00 | H155: 2.20 | I155: 792.00 | J155: 392.00 | K155: 5 | L155: =RC[-3]/100*RC[-1] -> 2.20
A156: 14 | B156: 40484-2 | C156: Балаклава чёрная флисовая | D156: 59 | E156: * | F156: 1 | G156: 106.00 | H156: 1.80 | I156: 95.40 | J156: 36.40 | K156: 5 | L156: =RC[-3]/100*RC[-1] -> 1.80
A157: 15 | B157: H8601/140 | C157: Ремень TOUGH NAVY SEAL чёрный ||PS-NAV-CO-02 | D157: 85 | E157: * | F157: 1 | G157: 193.00 | H157: 2.27 | I157: 193.00 | J157: 108.00 | K157: 5 | L157: =RC[-3]/100*RC[-1] -> 2.27
A158: 16 | B158: _108195/54(3) | C158: Тельник морской с голуб.полосами длинный рукав (байковый) | D158: 1100 | E158: * | F158: 1 | G158: 133.00 | H158: 0.12 | I158: 133.00 | J158: -967.00 | K158: 5 | L158: =RC[-3]/100*RC[-1] -> 0.12
A159: 17 | B159: H47101/MR | C159: US ACU китель ACU (PolyCotton) ||BL-ACU-PR-10 | D159: 349 | E159: * | F159: 1 | G159: 767.00 | H159: 2.20 | I159: 613.60 | J159: 264.60 | K159: 5 | L159: =RC[-3]/100*RC[-1] -> 2.20
A160: 18 | B160: H47101/XLR | C160: US ACU китель ACU (PolyCotton) ||BL-ACU-PR-10 | D160: 349 | E160: * | F160: 1 | G160: 767.00 | H160: 2.20 | I160: 613.60 | J160: 264.60 | K160: 5 | L160: =RC[-3]/100*RC[-1] -> 2.20
A161: 19 | B161: H4710/MR | C161: US ACU штаны ACU (PolyCotton) ||SP-ACU-PR-10 | D161: 349 | E161: * | F161: 1 | G161: 767.00 | H161: 2.20 | I161: 613.60 | J161: 264.60 | K161: 5 | L161: =RC[-3]/100*RC[-1] -> 2.20
A162: 20 | B162: H4710/XLR | C162: US ACU штаны ACU (PolyCotton) ||SP-ACU-PR-10 | D162: 349 | E162: * | F162: 1 | G162: 767.00 | H162: 2.20 | I162: 613.60 | J162: 264.60 | K162: 5 | L162: =RC[-3]/100*RC[-1] -> 2.20
A163: 21 | B163: H49101/MR | C163: Рубашка COMBAT ACU с налокотниками (NYCO POL) ||KO-CS2-PO-10 | D163: 518 | E163: * | F163: 1 | G163: 1139.00 | H163: 2.20 | I163: 911.20 | J163: 393.20 | K163: 5 | L163: =RC[-3]/100*RC[-1] -> 2.20
A164: 22 | B164: _11957/Р/2 | C164: Рос.костюм маскировочный белый | D164: 70 | E164: * | F164: 5 | G164: 164.00 | H164: 2.34 | I164: 656.00 | J164: 306.00 | K164: 5 | L164: =RC[-3]/100*RC[-1] -> 2.34
A165: 23 | B165: H0141/XL | C165: Перчатки тактические US Model чёрные ||RK-USM-PO-01 | D165: 209 | E165: * | F165: 2 | G165: 459.00 | H165: 2.20 | I165: 734.40 | J165: 316.40 | K165: 5 | L165: =RC[-3]/100*RC[-1] -> 2.20
A166: 24 | B166: H7811 | C166: Хустка SHEMAGH койот/чёрная ||CZ-ARF-CO-11 | D166: 72 | E166: * | F166: 2 | G166: 159.00 | H166: 2.21 | I166: 254.40 | J166: 110.40 | K166: 5 | L166: =RC[-3]/100*RC[-1] -> 2.21
A167: 25 | B167: H7820 | C167: Хустка SHEMAGH біло/чёрная ||CZ-ARF-CO-20 | D167: 72 | E167: * | F167: 18 | G167: 159.00 | H167: 2.21 | I167: 2289.60 | J167: 993.60 | K167: 5 | L167: =RC[-3]/100*RC[-1] -> 2.21
A168: 26 | B168: K17112-B | C168: Маска-сетка короткая чёрная ||M51617112-BK | D168: 80 | E168: * | F168: 1 | G168: 176.00 | H168: 2.20 | I168: 123.20 | J168: 43.20 | K168: 5 | L168: =RC[-3]/100*RC[-1] -> 2.20
A169: 27 | B169: Бабки | C169: Прихід Грошей | D169: 0.00 | E169: грн | F169: 1 | G169: 0.00 | H169: 0.00 | I169: 35524.90 | J169: 35523.90 | K169: 5 | L169: =RC[-3]/100*RC[-1] -> 0.00 | M169: =SUM(R[-27]C[-1]:RC[-1]) -> 
A171: #11609 (2015-01-12) Магазин Верхнього одягу - Відправлено-Продано
A172: N | B172: арт | C172: назва | D172: закуп | F172: к-ть | G172: цiна | H172: кф | I172: продж | J172: дохiд | K172: % | L172: з-та
A173: 1 | B173: H2227/M | C173: Куртка GUNFIGHTER Jungle Green||KU-GUN-FM-27 | D173: 1018 | E173: * | F173: 1 | G173: 2239.00 | H173: 2.20 | I173: 2015.10 | J173: 997.10 | K173: 5 | L173: =RC[-3]/100*RC[-1] -> 2.20
A174: 2 | B174: T7308880/42 | C174: Берци кожанные с замком чёрные TEMPEX Hanrath | D174: 530 | E174: * | F174: 1 | G174: 909.00 | H174: 1.72 | I174: 0.00 | J174: -530.00 | K174: 5 | L174: =RC[-3]/100*RC[-1] -> 1.72 | M174: =SUM(R[-2]C[-1]:RC[-1]) -> 
A176: #11610 (2015-01-12) Магазин туризму - Відправлено-Продано
A177: N | B177: арт | C177: назва | D177: закуп | F177: к-ть | G177: цiна | H177: кф | I177: продж | J177: дохiд | K177: % | L177: з-та
A178: 1 | B178: K13068-AT | C178: Подсумок універс.25х8.5х13 ATACS [A.C.M] ||M51613068-ATACS | D178: 4.43 | E178: usd | F178: 1 | G178: 195.00 | H178: 2.20 | I178: 175.50 | J178: 86.90 | K178: 5 | L178: =RC[-3]/100*RC[-1] -> 2.20
A179: 2 | B179: A19-186 | C179: Кобура набедренная ACROPOLIS||КП-1 | D179: 190.00 | E179: грн | F179: 1 | G179: 275.00 | H179: 1.45 | I179: 275.00 | J179: 85.00 | K179: 5 | L179: =RC[-3]/100*RC[-1] -> 1.45
A180: 3 | B180: _542693 | C180: Таблетки для дезинфенкции воды Javel Aqua (10шт) | D180: 0.76 | E180: Инт | F180: 2 | G180: 25.00 | H180: 1.64 | I180: 50.00 | J180: 19.60 | K180: 5 | L180: =RC[-3]/100*RC[-1] -> 1.64
A181: 4 | B181: _N254-2543 | C181: Термоодеяло | D181: 2.73 | E181: Инт | F181: 1 | G181: 94.00 | H181: 1.72 | I181: 60.00 | J181: 5.40 | K181: 5 | L181: =RC[-3]/100*RC[-1] -> 1.72
A182: 5 | B182: A19-161 | C182: Сумка гігієнічна ACROPOLIS ||СГ-1 | D182: 31.50 | E182: грн | F182: 1 | G182: 45.00 | H182: 1.43 | I182: 45.00 | J182: 13.50 | K182: 5 | L182: =RC[-3]/100*RC[-1] -> 1.43 | M182: =SUM(R[-5]C[-1]:RC[-1]) -> 
A184: #11611 (2015-01-12) магазин Зброя - Відправлено-Продано
A185: N | B185: арт | C185: назва | D185: закуп | F185: к-ть | G185: цiна | H185: кф | I185: продж | J185: дохiд | K185: % | L185: з-та
A186: 1 | B186: _DS-0.286 | C186: Пульки ШЕРШЕНЬ 4.5мм 0.28г (600шт) | D186: 16 | E186: * | F186: 1 | G186: 30.00 | H186: 1.88 | I186: 30.00 | J186: 14.00 | K186: 5 | L186: =RC[-3]/100*RC[-1] -> 1.88
A187: 2 | B187: _4.0524.31 | C187: Чохол VICTORINOX поясной кожаный чёрный | D187: 200 | E187: * | F187: 1 | G187: 310.00 | H187: 1.55 | I187: 310.00 | J187: 110.00 | K187: 5 | L187: =RC[-3]/100*RC[-1] -> 1.55
A188: 3 | B188: _N1920S | C188: Нож NAVY (с викруткою) (синий) | D188: 147 | E188: * | F188: 1 | G188: 178.00 | H188: 1.21 | I188: 160.00 | J188: 13.00 | K188: 5 | L188: =RC[-3]/100*RC[-1] -> 1.21
A189: 4 | B189: _N3893S | C189: Нож FlipZip (2 леза) | D189: 195 | E189: * | F189: 1 | G189: 239.00 | H189: 1.23 | I189: 239.00 | J189: 44.00 | K189: 5 | L189: =RC[-3]/100*RC[-1] -> 1.23
A190: 5 | B190: _N939393 | C190: Нож нескладной | D190: 83 | E190: * | F190: 1 | G190: 133.00 | H190: 1.60 | I190: 133.00 | J190: 50.00 | K190: 5 | L190: =RC[-3]/100*RC[-1] -> 1.60
A191: 6 | B191: _YF045 | C191: Нож метательный (комплект 3 шт) | D191: 109 | E191: * | F191: 1 | G191: 178.00 | H191: 1.63 | I191: 178.00 | J191: 69.00 | K191: 5 | L191: =RC[-3]/100*RC[-1] -> 1.63
A192: 7 | B192: _6320024 | C192: Пульки GAMO Match 4.5мм 0.5г (250шт) | D192: 24 | E192: * | F192: 1 | G192: 38.00 | H192: 1.58 | I192: 38.00 | J192: 14.00 | K192: 5 | L192: =RC[-3]/100*RC[-1] -> 1.58 | M192: =SUM(R[-7]C[-1]:RC[-1]) -> 
A194: #11612 (2015-01-12) Магазин Уніформи - Відправлено-Продано
A195: N | B195: арт | C195: назва | D195: закуп | F195: к-ть | G195: цiна | H195: кф | I195: продж | J195: дохiд | K195: % | L195: з-та
A196: 1 | B196: _155155-O | C196: Перчатки флисовые олива | D196: 37 | E196: * | F196: 1 | G196: 83.00 | H196: 2.24 | I196: 83.00 | J196: 46.00 | K196: 5 | L196: =RC[-3]/100*RC[-1] -> 2.24
A197: 2 | B197: H02101/L | C197: Носки высокие HEAVYWEIGHT ||р43-46 ||SK-HWT-WA-01 | D197: 97 | E197: * | F197: 1 | G197: 213.00 | H197: 2.20 | I197: 213.00 | J197: 116.00 | K197: 5 | L197: =RC[-3]/100*RC[-1] -> 2.20
A198: 3 | B198: 40484-2 | C198: Балаклава чёрная флисовая | D198: 59 | E198: * | F198: 2 | G198: 106.00 | H198: 1.80 | I198: 212.00 | J198: 94.00 | K198: 5 | L198: =RC[-3]/100*RC[-1] -> 1.80
A199: 4 | B199: H4027/MR | C199: URBAN TACTICAL штаны Jungle Green ||SP-UTL-CO-27 | D199: 743 | E199: * | F199: 1 | G199: 1634.00 | H199: 2.20 | I199: 1470.60 | J199: 727.60 | K199: 5 | L199: =RC[-3]/100*RC[-1] -> 2.20
A200: 5 | B200: H88001/L | C200: Ремень US UTILITY чёрный нейлон ||PS-UTL-NL-01 | D200: 112 | E200: * | F200: 1 | G200: 257.00 | H200: 2.29 | I200: 257.00 | J200: 145.00 | K200: 5 | L200: =RC[-3]/100*RC[-1] -> 2.29
A201: 6 | B201: H3301/M | C201: Комплект термобілизни (95% полиэстер 5% спандекс) чёрный ||KP-UN2-PO-01/M | D201: 400 | E201: * | F201: 1 | G201: 880.00 | H201: 2.20 | I201: 880.00 | J201: 480.00 | K201: 5 | L201: =RC[-3]/100*RC[-1] -> 2.20
A202: 7 | B202: R0415 | C202: Тарелка алюминиевая глубокая СССР | D202: 26 | E202: * | F202: 1 | G202: 56.00 | H202: 2.15 | I202: 56.00 | J202: 30.00 | K202: 5 | L202: =RC[-3]/100*RC[-1] -> 2.15
A203: 8 | B203: X4021 | C203: Балаклава олива с 1-м отв. нинзя (100%хлопок) ||X76012 | D203: 63 | E203: * | F203: 1 | G203: 80.00 | H203: 1.27 | I203: 80.00 | J203: 17.00 | K203: 5 | L203: =RC[-3]/100*RC[-1] -> 1.27
A204: 9 | B204: H43041/LR | C204: US SFU китель польский вудлэнд (PolyCotton) ||BL-SFU-PR-04 | D204: 290 | E204: * | F204: 1 | G204: 638.00 | H204: 2.20 | I204: 574.20 | J204: 284.20 | K204: 5 | L204: =RC[-3]/100*RC[-1] -> 2.20
A205: 10 | B205: H4304/MR | C205: US SFU штаны польский вудлэнд (PolyCotton) ||SP-SFU-PR-04 | D205: 290 | E205: * | F205: 1 | G205: 638.00 | H205: 2.20 | I205: 574.20 | J205: 284.20 | K205: 5 | L205: =RC[-3]/100*RC[-1] -> 2.20
A206: 11 | B206: H5827/LR | C206: URBAN TACTICAL штаны Jungle Green PolyCotton ||SP-UTL-PR-27 | D206: 569 | E206: * | F206: 1 | G206: 1251.00 | H206: 2.20 | I206: 1125.90 | J206: 556.90 | K206: 5 | L206: =RC[-3]/100*RC[-1] -> 2.20
A207: 12 | B207: H3302/XS | C207: Комплект термобілизни (95% полиэстер 5% спандекс) олива ||KP-UN2-PO-02/XS | D207: 400 | E207: * | F207: -1 | G207: 880.00 | H207: 2.20 | I207: -880.00 | J207: -480.00 | K207: 5 | L207: =RC[-3]/100*RC[-1] -> 2.20
A208: 13 | B208: H3301/L | C208: Комплект термобілизни (95% полиэстер 5% спандекс) чёрный ||KP-UN2-PO-01/L | D208: 400 | E208: * | F208: 1 | G208: 880.00 | H208: 2.20 | I208: 0.00 | J208: -400.00 | K208: 5 | L208: =RC[-3]/100*RC[-1] -> 2.20 | M208: =SUM(R[-13]C[-1]:RC[-1]) -> 
A210: #11632 (2015-01-13) Магазин Верхнього одягу - Відправлено-Продано
A211: N | B211: арт | C211: назва | D211: закуп | F211: к-ть | G211: цiна | H211: кф | I211: продж | J211: дохiд | K211: % | L211: з-та
A212: 1 | B212: R1284/42 | C212: Берци кожа чёрные утепленные Украина | D212: 1400 | E212: * | F212: 1 | G212: 2001.00 | H212: 1.43 | I212: 2001.00 | J212: 601.00 | K212: 5 | L212: =RC[-3]/100*RC[-1] -> 1.43
A213: 2 | B213: H2214/M | C213: Куртка GUNFIGHTER мультикам ||KU-GUN-FM-14 | D213: 1116 | E213: * | F213: 1 | G213: 2456.00 | H213: 2.20 | I213: 2210.40 | J213: 1094.40 | K213: 5 | L213: =RC[-3]/100*RC[-1] -> 2.20
A214: 3 | B214: H2233/L | C214: Куртка GUNFIGHTER MP Camo||KU-GUN-FM-33 | D214: 1116 | E214: * | F214: 1 | G214: 2456.00 | H214: 2.20 | I214: 2210.40 | J214: 1094.40 | K214: 5 | L214: =RC[-3]/100*RC[-1] -> 2.20
A215: 4 | B215: H49141/LR | C215: Рубашка COMBAT мультикам с налокотниками (NYCO POL) ||KO-CS2-PO-14 | D215: 518 | E215: * | F215: 1 | G215: 1139.00 | H215: 2.20 | I215: 1025.10 | J215: 507.10 | K215: 5 | L215: =RC[-3]/100*RC[-1] -> 2.20
A216: 5 | B216: H49141/MR | C216: Рубашка COMBAT мультикам с налокотниками (NYCO POL) ||KO-CS2-PO-14 | D216: 518 | E216: * | F216: 1 | G216: 1139.00 | H216: 2.20 | I216: 1025.10 | J216: 507.10 | K216: 5 | L216: =RC[-3]/100*RC[-1] -> 2.20 | M216: =SUM(R[-5]C[-1]:RC[-1]) -> 
A218: #11634 (2015-01-13) магазин Зброя - Відправлено-Продано
A219: N | B219: арт | C219: назва | D219: закуп | F219: к-ть | G219: цiна | H219: кф | I219: продж | J219: дохiд | K219: % | L219: з-та
A220: 1 | B220: _G620-Y2 | C220: Нож GANZO G620-Y2 | D220: 135 | E220: * | F220: 1 | G220: 223.00 | H220: 1.65 | I220: 223.00 | J220: 88.00 | K220: 5 | L220: =RC[-3]/100*RC[-1] -> 1.65
A221: 2 | B221: _1.1606 | C221: Бинокль TASCO 22x36 ||B-22 | D221: 322 | E221: * | F221: 1 | G221: 516.00 | H221: 1.60 | I221: 464.40 | J221: 142.40 | K221: 5 | L221: =RC[-3]/100*RC[-1] -> 1.60
A222: 3 | B222: _K17122-E | C222: Очки FL8008 затемненные ||M51617122-TEA | D222: 74 | E222: * | F222: 1 | G222: 159.00 | H222: 2.15 | I222: 143.10 | J222: 69.10 | K222: 5 | L222: =RC[-3]/100*RC[-1] -> 2.15
A223: 4 | B223: _204.78.55 | C223: Нож OPINEL 7VRI блистер | D223: 165 | E223: * | F223: 1 | G223: 248.00 | H223: 1.50 | I223: 248.00 | J223: 83.00 | K223: 5 | L223: =RC[-3]/100*RC[-1] -> 1.50
A224: 5 | B224: _K17066-B | C224: Окуляри защитные чёрные ||M51617066-TEA | D224: 59 | E224: * | F224: 1 | G224: 152.00 | H224: 2.58 | I224: 136.80 | J224: 77.80 | K224: 5 | L224: =RC[-3]/100*RC[-1] -> 2.58
A225: 6 | B225: _DS-0.406 | C225: Пульки ШЕРШЕНЬ 4.5мм 0.40г (600шт) | D225: 18 | E225: * | F225: 1 | G225: 33.00 | H225: 1.83 | I225: 33.00 | J225: 15.00 | K225: 5 | L225: =RC[-3]/100*RC[-1] -> 1.83
A226: 7 | B226: _DS-0.752 | C226: Пульки ШЕРШЕНЬ 4.5мм 0.75г (200шт) | D226: 20 | E226: * | F226: 1 | G226: 37.00 | H226: 1.85 | I226: 37.00 | J226: 17.00 | K226: 5 | L226: =RC[-3]/100*RC[-1] -> 1.85
A227: 8 | B227: _X-1000-SV | C227: Винтовка пневматическая HATSAN Striker 1000S Vortex | D227: 1640 | E227: * | F227: 1 | G227: 2296.00 | H227: 1.40 | I227: 2296.00 | J227: 656.00 | K227: 5 | L227: =RC[-3]/100*RC[-1] -> 1.40
A228: 9 | B228: _G702B | C228: Нож GANZO G702B | D228: 273 | E228: * | F228: 1 | G228: 450.00 | H228: 1.65 | I228: 405.00 | J228: 132.00 | K228: 5 | L228: =RC[-3]/100*RC[-1] -> 1.65
A229: 10 | B229: _GM4x28 | C229: Прицел оптический GAMO 4x28 | D229: 152 | E229: * | F229: 1 | G229: 228.00 | H229: 1.50 | I229: 228.00 | J229: 76.00 | K229: 5 | L229: =RC[-3]/100*RC[-1] -> 1.50 | M229: =SUM(R[-10]C[-1]:RC[-1]) -> 
A231: #11635 (2015-01-13) Магазин туризму - Відправлено-Продано
A232: N | B232: арт | C232: назва | D232: закуп | F232: к-ть | G232: цiна | H232: кф | I232: продж | J232: дохiд | K232: % | L232: з-та
A233: 1 | B233: A19-34 | C233: Сигн.-звук. ошийник (большой) ACROPOLIS ||СЗО-1а | D233: 43 | E233: * | F233: 1 | G233: 53.00 | H233: 1.23 | I233: 47.70 | J233: 4.70 | K233: 5 | L233: =RC[-3]/100*RC[-1] -> 1.23
A234: 2 | B234: K5-0378A | C234: Шарики BB 6мм 0,20x2000 [PREMIUM] ||PJBB 0,2-2000 | D234: 38 | E234: * | F234: 1 | G234: 87.00 | H234: 2.29 | I234: 87.00 | J234: 49.00 | K234: 5 | L234: =RC[-3]/100*RC[-1] -> 2.29
A235: 3 | B235: K12082-A | C235: Рюкзак MOLLE Tactical Backpack ACU ||M51612082-ACU | D235: 380 | E235: * | F235: 1 | G235: 836.00 | H235: 2.20 | I235: 836.00 | J235: 456.00 | K235: 5 | L235: =RC[-3]/100*RC[-1] -> 2.20
A236: 4 | B236: K11023-M | C236: Розгруз. New Mesh Vest мультикам [A.C.M] ||M51611023-CP | D236: 308 | E236: * | F236: 1 | G236: 678.00 | H236: 2.20 | I236: 610.20 | J236: 302.20 | K236: 5 | L236: =RC[-3]/100*RC[-1] -> 2.20
A237: 5 | B237: K12212-M | C237: Подсумок магазинный двойной G36/M4/AK мультикам [A.C.M] ||M51612212-CP | D237: 102 | E237: * | F237: 1 | G237: 224.00 | H237: 2.20 | I237: 201.60 | J237: 99.60 | K237: 5 | L237: =RC[-3]/100*RC[-1] -> 2.20
A238: 6 | B238: K11162-M | C238: Розгруз. Interceptor Body Armour мультикам [A.C.M] ||M51611162-CP | D238: 780 | E238: * | F238: 1 | G238: 1716.00 | H238: 2.20 | I238: 1630.20 | J238: 850.20 | K238: 5 | L238: =RC[-3]/100*RC[-1] -> 2.20
A239: 7 | B239: K11005-AT | C239: Розгрузочна система тактическая STRIKE с подсумками Atacs ||M51611005-ATACS | D239: 460 | E239: * | F239: 1 | G239: 1012.00 | H239: 2.20 | I239: 910.80 | J239: 450.80 | K239: 5 | L239: =RC[-3]/100*RC[-1] -> 2.20
A240: 8 | B240: K5-0378A | C240: Шарики BB 6мм 0,20x2000 [PREMIUM] ||PJBB 0,2-2000 | D240: 38 | E240: * | F240: 1 | G240: 87.00 | H240: 2.29 | I240: 87.00 | J240: 49.00 | K240: 5 | L240: =RC[-3]/100*RC[-1] -> 2.29
A241: 9 | B241: H159310 | C241: Лента маскировочная универсальная 50мм (4,5м) ACU ||TM-SCG-PO-10 | D241: 42 | E241: * | F241: 1 | G241: 97.00 | H241: 2.31 | I241: 97.00 | J241: 55.00 | K241: 5 | L241: =RC[-3]/100*RC[-1] -> 2.31
A242: 10 | B242: K032-20 | C242: Шарики BB 6мм 0,32x2000 [PREMIUM] ||PJBB 0,32-2000 | D242: 89 | E242: * | F242: 1 | G242: 183.00 | H242: 2.06 | I242: 183.00 | J242: 94.00 | K242: 5 | L242: =RC[-3]/100*RC[-1] -> 2.06
A243: 11 | B243: K5-0378B | C243: Шарики BB 6мм 0,20x4000 [PREMIUM] ||PJBB 0,2-4000 | D243: 71 | E243: * | F243: 1 | G243: 171.00 | H243: 2.41 | I243: 171.00 | J243: 100.00 | K243: 5 | L243: =RC[-3]/100*RC[-1] -> 2.41
A244: 12 | B244: A19-1881 | C244: Разгр. жилет АК олива с поясом ACROPOLIS||РЗ-1п | D244: 511 | E244: * | F244: 1 | G244: 715.00 | H244: 1.40 | I244: 715.00 | J244: 204.00 | K244: 5 | L244: =RC[-3]/100*RC[-1] -> 1.40
A245: 13 | B245: K12024-O | C245: Рюкзак 3-Day Assault 36л олива ||M51612024-OD | D245: 520 | E245: * | F245: 1 | G245: 1144.00 | H245: 2.20 | I245: 915.20 | J245: 395.20 | K245: 5 | L245: =RC[-3]/100*RC[-1] -> 2.20 | M245: =SUM(R[-13]C[-1]:RC[-1]) -> 
A247: #11636 (2015-01-13) Магазин Уніформи - Відправлено-Продано
A248: N | B248: арт | C248: назва | D248: закуп | F248: к-ть | G248: цiна | H248: кф | I248: продж | J248: дохiд | K248: % | L248: з-та
A249: 1 | B249: X4021 | C249: Балаклава олива с 1-м отв. нинзя (100%хлопок) ||X76012 | D249: 63 | E249: * | F249: 1 | G249: 80.00 | H249: 1.27 | I249: 80.00 | J249: 17.00 | K249: 5 | L249: =RC[-3]/100*RC[-1] -> 1.27
A250: 2 | B250: H3402/M | C250: Футболка олива ||TS-TSH-CO-29 | D250: 81 | E250: * | F250: 1 | G250: 179.00 | H250: 2.21 | I250: 179.00 | J250: 98.00 | K250: 5 | L250: =RC[-3]/100*RC[-1] -> 2.21
A251: 3 | B251: H5914/MR | C251: CPU штаны мультикамо (PolyCotton) ||SP-CPU-PR-14 | D251: 428 | E251: * | F251: 1 | G251: 942.00 | H251: 2.20 | I251: 987.00 | J251: 559.00 | K251: 5 | L251: =RC[-3]/100*RC[-1] -> 2.20
A252: 4 | B252: H47141/MR | C252: US ACU китель мультикам (NYCO R/S) ||BL-ACU-PR-14 | D252: 461 | E252: * | F252: 1 | G252: 1013.00 | H252: 2.20 | I252: 1059.00 | J252: 598.00 | K252: 5 | L252: =RC[-3]/100*RC[-1] -> 2.20
A253: 5 | B253: H3301/M | C253: Комплект термобілизни (95% полиэстер 5% спандекс) чёрный ||KP-UN2-PO-01/M | D253: 400 | E253: * | F253: 1 | G253: 880.00 | H253: 2.20 | I253: 880.00 | J253: 480.00 | K253: 5 | L253: =RC[-3]/100*RC[-1] -> 2.20
A254: 6 | B254: _11957/Р/2 | C254: Рос.костюм маскировочный белый | D254: 70 | E254: * | F254: 1 | G254: 164.00 | H254: 2.34 | I254: 164.00 | J254: 94.00 | K254: 5 | L254: =RC[-3]/100*RC[-1] -> 2.34
A255: 7 | B255: X4011 | C255: Балаклава чёрная с 1-м отв. нинзя(100%хлопок) ||X76011 | D255: 63 | E255: * | F255: 1 | G255: 80.00 | H255: 1.27 | I255: 80.00 | J255: 17.00 | K255: 5 | L255: =RC[-3]/100*RC[-1] -> 1.27
A256: 8 | B256: K17112-B | C256: Маска-сетка короткая чёрная ||M51617112-BK | D256: 80 | E256: * | F256: 2 | G256: 177.00 | H256: 2.21 | I256: 354.00 | J256: 194.00 | K256: 5 | L256: =RC[-3]/100*RC[-1] -> 2.21
A257: 9 | B257: K17128-B | C257: Реплика шлема MICH2001 RIS чёрный ||M51617128-BK | D257: 379 | E257: * | F257: 1 | G257: 872.00 | H257: 2.30 | I257: 872.00 | J257: 493.00 | K257: 5 | L257: =RC[-3]/100*RC[-1] -> 2.30
A258: 10 | B258: EM1812 | C258: Чохол-кавер на шлем MICH2001 ACU | D258: 87 | E258: * | F258: 1 | G258: 219.00 | H258: 2.52 | I258: 219.00 | J258: 132.00 | K258: 5 | L258: =RC[-3]/100*RC[-1] -> 2.52
A259: 11 | B259: H5814/MR | C259: URBAN TACTICAL штаны мультикам (NYCO R/S) ||SP-UTL-NR-14 | D259: 615 | E259: * | F259: 2 | G259: 1353.00 | H259: 2.20 | I259: 2435.40 | J259: 1205.40 | K259: 5 | L259: =RC[-3]/100*RC[-1] -> 2.20
A260: 12 | B260: H9013/120 | C260: Ремень ARMY BELT хаки ||PS-ARM-CO-13 | D260: 85 | E260: * | F260: 1 | G260: 193.00 | H260: 2.27 | I260: 173.70 | J260: 88.70 | K260: 5 | L260: =RC[-3]/100*RC[-1] -> 2.27
A261: 13 | B261: H7514 | C261: Блайзер мультикам (Polycotton) ||CZ-BBC-PR-14 | D261: 86 | E261: * | F261: 1 | G261: 190.00 | H261: 2.21 | I261: 171.00 | J261: 85.00 | K261: 5 | L261: =RC[-3]/100*RC[-1] -> 2.21
A262: 14 | B262: H7914 | C262: Шапка флисовая мультикам ||CZ-DOK-FL-14 | D262: 80 | E262: * | F262: 1 | G262: 200.00 | H262: 2.50 | I262: 180.00 | J262: 100.00 | K262: 5 | L262: =RC[-3]/100*RC[-1] -> 2.50
A263: 15 | B263: _608-0202/L | C263: Перчатки тактические олива (без палые) | D263: 345 | E263: * | F263: 1 | G263: 517.00 | H263: 1.50 | I263: 465.30 | J263: 120.30 | K263: 5 | L263: =RC[-3]/100*RC[-1] -> 1.50
A264: 16 | B264: H0141/M | C264: Перчатки тактические US Model чёрные ||RK-USM-PO-01 | D264: 209 | E264: * | F264: 1 | G264: 459.00 | H264: 2.20 | I264: 413.10 | J264: 204.10 | K264: 5 | L264: =RC[-3]/100*RC[-1] -> 2.20
A265: 17 | B265: H3410/M | C265: Футболка ACU ||TS-TSH-CO-10 | D265: 81 | E265: * | F265: 1 | G265: 179.00 | H265: 2.21 | I265: 179.00 | J265: 98.00 | K265: 5 | L265: =RC[-3]/100*RC[-1] -> 2.21
A266: 18 | B266: H7210/M | C266: US BDU кепка ACU (NYCO R/S) ||CZ-ACU-NR-10 | D266: 86 | E266: * | F266: 1 | G266: 190.00 | H266: 2.21 | I266: 190.00 | J266: 104.00 | K266: 5 | L266: =RC[-3]/100*RC[-1] -> 2.21
A267: 19 | B267: _108190/54(3) | C267: Тельник морской с голуб.полосами длинный рукав | D267: 125 | E267: * | F267: 1 | G267: 50.00 | H267: 0.40 | I267: 50.00 | J267: -75.00 | K267: 5 | L267: =RC[-3]/100*RC[-1] -> 0.40
A268: 20 | B268: H7106 | C268: US BDU кепка польский дезерт (R/S) ||CZ-COM-CR-06 | D268: 47 | E268: * | F268: 1 | G268: 103.00 | H268: 2.19 | I268: 103.00 | J268: 56.00 | K268: 5 | L268: =RC[-3]/100*RC[-1] -> 2.19
A269: 21 | B269: H5503/XLL | C269: CARGO штаны вудлэнд (NYCO) ||SP-CAR-NT-03 | D269: 345 | E269: * | F269: 1 | G269: 759.00 | H269: 2.20 | I269: 683.10 | J269: 338.10 | K269: 5 | L269: =RC[-3]/100*RC[-1] -> 2.20 | M269: =SUM(R[-21]C[-1]:RC[-1]) -> 
A271: #11640 (2015-01-13) ШЕФ - Відправлено-Продано
A272: N | B272: арт | C272: назва | D272: закуп | F272: к-ть | G272: цiна | H272: кф | I272: продж | J272: дохiд | K272: % | L272: з-та
A273: 1 | B273: A16661/M | C273: Шлем кевларовий б/у | D273: 3500 | E273: * | F273: 2 | G273: 5796.00 | H273: 1.66 | I273: 11592.00 | J273: 4592.00 | K273: 5 | L273: =RC[-3]/100*RC[-1] -> 1.66
A274: 2 | B274: H0602 | C274: Резиновая кружка олива ||TK-FOL-PP-02 | D274: 23 | E274: * | F274: 20 | G274: 51.00 | H274: 2.22 | I274: 1020.00 | J274: 560.00 | K274: 5 | L274: =RC[-3]/100*RC[-1] -> 2.22
A275: 3 | B275: H0613 | C275: Резиновая кружка хаки ||TK-FOL-PP-13 | D275: 23 | E275: * | F275: 20 | G275: 51.00 | H275: 2.22 | I275: 1020.00 | J275: 560.00 | K275: 5 | L275: =RC[-3]/100*RC[-1] -> 2.22
A276: 4 | B276: Брон | C276: Бронепластина 4-й класс | D276: 1400 | E276: * | F276: 2 | G276: 1662.00 | H276: 1.19 | I276: 3324.00 | J276: 524.00 | K276: 5 | L276: =RC[-3]/100*RC[-1] -> 1.19 | M276: =SUM(R[-4]C[-1]:RC[-1]) -> 
A278: #11650 (2015-01-14) Магазин Верхнього одягу - Відправлено-Продано
A279: N | B279: арт | C279: назва | D279: закуп | F279: к-ть | G279: цiна | H279: кф | I279: продж | J279: дохiд | K279: % | L279: з-та
A280: 1 | B280: H2014/L | C280: Куртка LIBERTY флисовая мультикам 390г/м (superfine) ||BL-LIB-HF-14 | D280: 620 | E280: * | F280: 1 | G280: 1364.00 | H280: 2.20 | I280: 1364.00 | J280: 744.00 | K280: 5 | L280: =RC[-3]/100*RC[-1] -> 2.20
A281: 2 | B281: R1283/44 | C281: Берци кожа чёрные Украина | D281: 1400 | E281: * | F281: 1 | G281: 2001.00 | H281: 1.43 | I281: 2001.00 | J281: 601.00 | K281: 5 | L281: =RC[-3]/100*RC[-1] -> 1.43
A282: 3 | B282: _12002/XXL | C282: US BDU детские штаны вудлэнд р.176 ||12031020-906 | D282: 200 | E282: * | F282: 1 | G282: 540.00 | H282: 2.70 | I282: 540.00 | J282: 340.00 | K282: 5 | L282: =RC[-3]/100*RC[-1] -> 2.70
A283: 4 | B283: H65031/L | C283: Куртка М65 с отстегивающейся курткой вудлэнд (NYCO) ||KU-M65-NY-03 | D283: 744 | E283: * | F283: 1 | G283: 1638.00 | H283: 2.20 | I283: 0.00 | J283: -744.00 | K283: 5 | L283: =RC[-3]/100*RC[-1] -> 2.20 | M283: =SUM(R[-4]C[-1]:RC[-1]) -> 
A285: #11652 (2015-01-14) Магазин туризму - Відправлено-Продано
A286: N | B286: арт | C286: назва | D286: закуп | F286: к-ть | G286: цiна | H286: кф | I286: продж | J286: дохiд | K286: % | L286: з-та
A287: 1 | B287: _26-0705 | C287: Рация VOYAGER IP-66 MAX 400-470 МГц, 5Вт,1500mAp Li-ion водостійка | D287: 1260 | E287: * | F287: 2 | G287: 1928.00 | H287: 1.53 | I287: 3470.40 | J287: 950.40 | K287: 5 | L287: =RC[-3]/100*RC[-1] -> 1.53
A288: 2 | B288: _26-0020 | C288: Кабель 12В авто к стакана KENWOOD Quansheng [Китай] | D288: 60 | E288: * | F288: 2 | G288: 152.00 | H288: 2.53 | I288: 273.60 | J288: 153.60 | K288: 5 | L288: =RC[-3]/100*RC[-1] -> 2.53
A289: 3 | B289: A19-36 | C289: Стул для відпочинку ACROPOLIS ||СТ-1 | D289: 220 | E289: * | F289: 1 | G289: 310.00 | H289: 1.41 | I289: 310.00 | J289: 90.00 | K289: 5 | L289: =RC[-3]/100*RC[-1] -> 1.41
A290: 4 | B290: _19-1142 | C290: Патронташ на приклад (камуфляжный) | D290: 45 | E290: * | F290: 1 | G290: 65.00 | H290: 1.44 | I290: 65.00 | J290: 20.00 | K290: 5 | L290: =RC[-3]/100*RC[-1] -> 1.44
A291: 5 | B291: K17088N-С | C291: Ремень 3-точ.тактический MP5/G3/M4 койот (нейлон)[Производитель: ACM] ||M51617088N-TAN | D291: 111 | E291: * | F291: 1 | G291: 269.00 | H291: 2.42 | I291: 242.10 | J291: 131.10 | K291: 5 | L291: =RC[-3]/100*RC[-1] -> 2.42 | M291: =SUM(R[-5]C[-1]:RC[-1]) -> 
A293: #11653 (2015-01-14) магазин Зброя - Відправлено-Продано
A294: N | B294: арт | C294: назва | D294: закуп | F294: к-ть | G294: цiна | H294: кф | I294: продж | J294: дохiд | K294: % | L294: з-та
A295: 1 | B295: Бабки | C295: Прихід Грошей | D295: 0.00 | E295: грн | F295: 1 | G295: 0.00 | H295: 0.00 | I295: 83.00 | J295: 82.00 | K295: 5 | L295: =RC[-3]/100*RC[-1] -> 0.00
A296: 2 | B296: _M11746 | C296: Нож Morakniv™ Companion HeavyDuty MG | D296: 183 | E296: * | F296: 1 | G296: 284.00 | H296: 1.55 | I296: 284.00 | J296: 101.00 | K296: 5 | L296: =RC[-3]/100*RC[-1] -> 1.55
A297: 3 | B297: GW4321-2 | C297: Нож GRAND WAY НДТР-2 (псевдодамаск) | D297: 588 | E297: * | F297: 1 | G297: 978.00 | H297: 1.66 | I297: 978.00 | J297: 390.00 | K297: 5 | L297: =RC[-3]/100*RC[-1] -> 1.66
A298: 4 | B298: _E01/BL | C298: Фонарь FENIX E01 чёрный | D298: 182 | E298: * | F298: 1 | G298: 273.00 | H298: 1.50 | I298: 273.00 | J298: 91.00 | K298: 5 | L298: =RC[-3]/100*RC[-1] -> 1.50
A299: 5 | B299: _DS-0.683 | C299: Пульки ШЕРШЕНЬ HUNTER 4.5мм 0.68г (360шт) | D299: 33 | E299: * | F299: 1 | G299: 59.00 | H299: 1.79 | I299: 59.00 | J299: 26.00 | K299: 5 | L299: =RC[-3]/100*RC[-1] -> 1.79
A300: 6 | B300: GW6241BCS | C300: Нож GRAND WAY складной | D300: 79 | E300: * | F300: 1 | G300: 132.00 | H300: 1.67 | I300: 131.00 | J300: 52.00 | K300: 5 | L300: =RC[-3]/100*RC[-1] -> 1.67
A301: 7 | B301: _409409 | C301: Нож складной COLUMBIA | D301: 91 | E301: * | F301: 1 | G301: 150.00 | H301: 1.65 | I301: 150.00 | J301: 59.00 | K301: 5 | L301: =RC[-3]/100*RC[-1] -> 1.65 | M301: =SUM(R[-7]C[-1]:RC[-1]) -> 
A303: #11654 (2015-01-14) Магазин Верхнього одягу - Відправлено-Продано
A304: N | B304: арт | C304: назва | D304: закуп | F304: к-ть | G304: цiна | H304: кф | I304: продж | J304: дохiд | K304: % | L304: з-та
A305: 1 | B305: G4501/L | C305: Комплект термобелья GRENE (100% полиэстер) чёрный | D305: 1000 | E305: * | F305: 1 | G305: 350.00 | H305: 0.35 | I305: 350.00 | J305: -650.00 | K305: 5 | L305: =RC[-3]/100*RC[-1] -> 0.35
A306: 2 | B306: H5914/LR | C306: CPU штаны мультикамо (PolyCotton) ||SP-CPU-PR-14 | D306: 428 | E306: * | F306: 1 | G306: 942.00 | H306: 2.20 | I306: 942.00 | J306: 514.00 | K306: 5 | L306: =RC[-3]/100*RC[-1] -> 2.20
A307: 3 | B307: _155155-B | C307: Перчатки флисовые чёрные | D307: 37 | E307: * | F307: 1 | G307: 83.00 | H307: 2.24 | I307: 83.00 | J307: 46.00 | K307: 5 | L307: =RC[-3]/100*RC[-1] -> 2.24
A308: 4 | B308: _11601/G/04 | C308: BW китель флектарн б/у ||91160121-004 | D308: 30 | E308: * | F308: 1 | G308: 70.00 | H308: 2.33 | I308: 70.00 | J308: 40.00 | K308: 5 | L308: =RC[-3]/100*RC[-1] -> 2.33
A309: 5 | B309: _11957/Р/2 | C309: Рос.костюм маскировочный белый | D309: 70 | E309: * | F309: 1 | G309: 164.00 | H309: 2.34 | I309: 164.00 | J309: 94.00 | K309: 5 | L309: =RC[-3]/100*RC[-1] -> 2.34
A310: 6 | B310: H7911 | C310: Шапка флисовая койот ||CZ-DOK-FL-11 | D310: 40 | E310: * | F310: 1 | G310: 100.00 | H310: 2.50 | I310: 100.00 | J310: 60.00 | K310: 5 | L310: =RC[-3]/100*RC[-1] -> 2.50
A311: 7 | B311: X4011 | C311: Балаклава чёрная с 1-м отв. нинзя(100%хлопок) ||X76011 | D311: 63 | E311: * | F311: 1 | G311: 80.00 | H311: 1.27 | I311: 80.00 | J311: 17.00 | K311: 5 | L311: =RC[-3]/100*RC[-1] -> 1.27
A312: 8 | B312: H7202 | C312: US BDU кепка олива (NYCO R/S) ||CZ-COM-CR-02 | D312: 47 | E312: * | F312: 1 | G312: 103.00 | H312: 2.19 | I312: 103.00 | J312: 56.00 | K312: 5 | L312: =RC[-3]/100*RC[-1] -> 2.19
A313: 9 | B313: X4011 | C313: Балаклава чёрная с 1-м отв. нинзя(100%хлопок) ||X76011 | D313: 63 | E313: * | F313: 1 | G313: 80.00 | H313: 1.27 | I313: 80.00 | J313: 17.00 | K313: 5 | L313: =RC[-3]/100*RC[-1] -> 1.27
A314: 10 | B314: A0122 | C314: Аксельбант срібно-чёрный ||69944 | D314: 93 | E314: * | F314: 1 | G314: 28.00 | H314: 0.30 | I314: 28.00 | J314: -65.00 | K314: 5 | L314: =RC[-3]/100*RC[-1] -> 0.30
A315: 11 | B315: A0101 | C315: Кластер ЗІРКА (3 разом) 188941 | D315: 8 | E315: * | F315: 1 | G315: 3.00 | H315: 0.38 | I315: 3.00 | J315: -5.00 | K315: 5 | L315: =RC[-3]/100*RC[-1] -> 0.38
A316: 12 | B316: A0108 | C316: Кластер ЗІРКА срібна 1 ||180941 | D316: 2 | E316: * | F316: 1 | G316: 1.00 | H316: 0.50 | I316: 1.00 | J316: -1.00 | K316: 5 | L316: =RC[-3]/100*RC[-1] -> 0.50
A317: 13 | B317: A0083 | C317: Кластер Літера "V" бронзова ||180241 | D317: 5 | E317: * | F317: 1 | G317: 3.00 | H317: 0.60 | I317: 3.00 | J317: -2.00 | K317: 5 | L317: =RC[-3]/100*RC[-1] -> 0.60
A318: 14 | B318: K104707/SR | C318: Комплект формы марпат ACU китель, штаны, кепка (R/S) ||KP-ACU-PR-07 | D318: 280 | E318: * | F318: 1 | G318: 616.00 | H318: 2.20 | I318: 616.00 | J318: 336.00 | K318: 5 | L318: =RC[-3]/100*RC[-1] -> 2.20
A319: 15 | B319: H3407/S | C319: Футболка марпат ||TS-TSH-CO-07 | D319: 83 | E319: * | F319: 1 | G319: 182.00 | H319: 2.19 | I319: 182.00 | J319: 99.00 | K319: 5 | L319: =RC[-3]/100*RC[-1] -> 2.19
A320: 16 | B320: X4021 | C320: Балаклава олива с 1-м отв. нинзя (100%хлопок) ||X76012 | D320: 63 | E320: * | F320: 1 | G320: 80.00 | H320: 1.27 | I320: 80.00 | J320: 17.00 | K320: 5 | L320: =RC[-3]/100*RC[-1] -> 1.27 | M320: =SUM(R[-16]C[-1]:RC[-1]) -> 
A322: #11673 (2015-01-15) Магазин Уніформи - Відправлено-Продано
A323: N | B323: арт | C323: назва | D323: закуп | F323: к-ть | G323: цiна | H323: кф | I323: продж | J323: дохiд | K323: % | L323: з-та
A324: 1 | B324: DS8838/XL | C324: Носки водонепроницаемые Dexshell Coolvent Lite | D324: 256 | E324: * | F324: 1 | G324: 384.00 | H324: 1.50 | I324: 384.00 | J324: 128.00 | K324: 5 | L324: =RC[-3]/100*RC[-1] -> 1.50
A325: 2 | B325: _13072/30 | C325: NVA носки серые нові 44 ||91307200 | D325: 19 | E325: * | F325: 1 | G325: 43.00 | H325: 2.26 | I325: 43.00 | J325: 24.00 | K325: 5 | L325: =RC[-3]/100*RC[-1] -> 2.26
A326: 3 | B326: X4011 | C326: Балаклава чёрная с 1-м отв. нинзя(100%хлопок) ||X76011 | D326: 63 | E326: * | F326: 1 | G326: 80.00 | H326: 1.27 | I326: 80.00 | J326: 17.00 | K326: 5 | L326: =RC[-3]/100*RC[-1] -> 1.27
A327: 4 | B327: 40484-2 | C327: Балаклава чёрная флисовая | D327: 59 | E327: * | F327: 1 | G327: 106.00 | H327: 1.80 | I327: 106.00 | J327: 47.00 | K327: 5 | L327: =RC[-3]/100*RC[-1] -> 1.80
A328: 5 | B328: H4311/SR | C328: US SFU штаны койот (PolyCotton) ||SP-SFU-PR-11 | D328: 301 | E328: * | F328: 1 | G328: 661.00 | H328: 2.20 | I328: 594.90 | J328: 293.90 | K328: 5 | L328: =RC[-3]/100*RC[-1] -> 2.20
A329: 6 | B329: H8913/120 | C329: Ремень TOUGH US MARINES койот ||PS-USM-CO-13 | D329: 74 | E329: * | F329: 1 | G329: 193.00 | H329: 2.61 | I329: 173.70 | J329: 99.70 | K329: 5 | L329: =RC[-3]/100*RC[-1] -> 2.61
A330: 7 | B330: H7201 | C330: US BDU кепка чёрная ( PolyCotton Ripstop) ||CZ-COM-NR-01 | D330: 47 | E330: * | F330: 2 | G330: 103.00 | H330: 2.19 | I330: 185.40 | J330: 91.40 | K330: 5 | L330: =RC[-3]/100*RC[-1] -> 2.19
A331: 8 | B331: X7299 | C331: US BDU кепка украинская цифра ( PolyCotton Ripstop) | D331: 45 | E331: * | F331: 1 | G331: 99.00 | H331: 2.20 | I331: 89.10 | J331: 44.10 | K331: 5 | L331: =RC[-3]/100*RC[-1] -> 2.20
A332: 9 | B332: _916596 | C332: Шапка чёрная с флисовой подкладкой | D332: 47 | E332: * | F332: 1 | G332: 118.00 | H332: 2.51 | I332: 106.20 | J332: 59.20 | K332: 5 | L332: =RC[-3]/100*RC[-1] -> 2.51
A333: 10 | B333: _181302/120 | C333: Ремень Другої Мировой Войны без пряжки | D333: 1600 | E333: * | F333: 1 | G333: 230.00 | H333: 0.14 | I333: 195.50 | J333: -1404.50 | K333: 5 | L333: =RC[-3]/100*RC[-1] -> 0.14
A334: 11 | B334: S172 | C334: Пряжка к ременя "SS" солдатская | D334: 200 | E334: * | F334: 1 | G334: 235.00 | H334: 1.18 | I334: 199.75 | J334: -0.25 | K334: 5 | L334: =RC[-3]/100*RC[-1] -> 1.18
A335: 12 | B335: H3501/M | C335: Комплект термобілизни (100% полиэстер) чёрный ||KP-UN1-PO-01 | D335: 274 | E335: * | F335: 1 | G335: 603.00 | H335: 2.20 | I335: 603.00 | J335: 329.00 | K335: 5 | L335: =RC[-3]/100*RC[-1] -> 2.20
A336: 13 | B336: EM6628A | C336: Шапка-труба MARPAT||EM6628A | D336: 85 | E336: * | F336: 1 | G336: 187.00 | H336: 2.20 | I336: 187.00 | J336: 102.00 | K336: 5 | L336: =RC[-3]/100*RC[-1] -> 2.20
A337: 14 | B337: _11957/Р/2 | C337: Рос.костюм маскировочный белый | D337: 70 | E337: * | F337: 10 | G337: 164.00 | H337: 2.34 | I337: 1476.00 | J337: 776.00 | K337: 5 | L337: =RC[-3]/100*RC[-1] -> 2.34 | M337: =SUM(R[-14]C[-1]:RC[-1]) -> 
A339: #11675 (2015-01-15) магазин Зброя - Відправлено-Продано
A340: N | B340: арт | C340: назва | D340: закуп | F340: к-ть | G340: цiна | H340: кф | I340: продж | J340: дохiд | K340: % | L340: з-та
A341: 1 | B341: _1.2000 | C341: Нож MORA 2000 Stainless Steel K J Eriksson ||NZ-200-ST-02 | D341: 343 | E341: * | F341: 1 | G341: 531.00 | H341: 1.55 | I341: 531.00 | J341: 188.00 | K341: 5 | L341: =RC[-3]/100*RC[-1] -> 1.55
A342: 2 | B342: _1.1808 | C342: Бинокль YUKON 30x50 ||00609 | D342: 1258 | E342: * | F342: 1 | G342: 1765.00 | H342: 1.40 | I342: 1765.00 | J342: 507.00 | K342: 5 | L342: =RC[-3]/100*RC[-1] -> 1.40
A343: 3 | B343: _G702B | C343: Нож GANZO G702B | D343: 273 | E343: * | F343: 1 | G343: 450.00 | H343: 1.65 | I343: 450.00 | J343: 177.00 | K343: 5 | L343: =RC[-3]/100*RC[-1] -> 1.65
A344: 4 | B344: _G620-B2 | C344: Нож GANZO G620-B2 | D344: 135 | E344: * | F344: 1 | G344: 223.00 | H344: 1.65 | I344: 223.00 | J344: 88.00 | K344: 5 | L344: =RC[-3]/100*RC[-1] -> 1.65
A345: 5 | B345: _K17121-TR | C345: Очки FL8013 прозрачные ||M51617121-TRANSP | D345: 60 | E345: * | F345: 1 | G345: 152.00 | H345: 2.53 | I345: 152.00 | J345: 92.00 | K345: 5 | L345: =RC[-3]/100*RC[-1] -> 2.53
A346: 6 | B346: _KWC-0548 | C346: Пістолет пневматичний KWC PM (KM-44 DHN) | D346: 834 | E346: * | F346: 1 | G346: 1250.00 | H346: 1.50 | I346: 1250.00 | J346: 416.00 | K346: 5 | L346: =RC[-3]/100*RC[-1] -> 1.50
A347: 7 | B347: _4.1687 | C347: Балон СО-2 UMAREX 12г | D347: 8 | E347: * | F347: 3 | G347: 12.00 | H347: 1.50 | I347: 36.00 | J347: 12.00 | K347: 5 | L347: =RC[-3]/100*RC[-1] -> 1.50
A348: 8 | B348: _429.00.02 | C348: Масло для чистки Clever BALLISTOL 50мл спрей | D348: 73 | E348: * | F348: 1 | G348: 120.00 | H348: 1.64 | I348: 0.00 | J348: -73.00 | K348: 5 | L348: =RC[-3]/100*RC[-1] -> 1.64 | M348: =SUM(R[-8]C[-1]:RC[-1]) -> 
A350: #11676 (2015-01-15) Магазин туризму - Відправлено-Продано
A351: N | B351: арт | C351: назва | D351: закуп | F351: к-ть | G351: цiна | H351: кф | I351: продж | J351: дохiд | K351: % | L351: з-та
A352: 1 | B352: K12032-ATACS | C352: Рюкзак Combat Camping 65л ATACS N-600D ||M51612032-ATACS | D352: 615 | E352: * | F352: 1 | G352: 1354.00 | H352: 2.20 | I352: 1218.60 | J352: 603.60 | K352: 5 | L352: =RC[-3]/100*RC[-1] -> 2.20
A353: 2 | B353: K4-1703 | C353: Винтовка электропневматическая страйкбольная M4 (метал) [BI3681] | D353: 2601 | E353: * | F353: 1 | G353: 4759.00 | H353: 1.83 | I353: 4759.00 | J353: 2158.00 | K353: 5 | L353: =RC[-3]/100*RC[-1] -> 1.83
A354: 3 | B354: _18789/G-O | C354: US чехол на флягу оригинал (олива) б/у | D354: 40 | E354: * | F354: 1 | G354: 60.00 | H354: 1.50 | I354: 60.00 | J354: 20.00 | K354: 5 | L354: =RC[-3]/100*RC[-1] -> 1.50
A355: 4 | B355: K13028-M | C355: Кобура набедренная MOLLE tactical backpack мультикам ||M51613028-CP | D355: 152 | E355: * | F355: 1 | G355: 350.00 | H355: 2.30 | I355: 350.00 | J355: 198.00 | K355: 5 | L355: =RC[-3]/100*RC[-1] -> 2.30
A356: 5 | B356: A19-190 | C356: Подсумок аптечка ACROPOLIS||ПМ-1 | D356: 100 | E356: * | F356: 1 | G356: 145.00 | H356: 1.45 | I356: 145.00 | J356: 45.00 | K356: 5 | L356: =RC[-3]/100*RC[-1] -> 1.45
A357: 6 | B357: K12024-D | C357: Рюкзак 3-Day Assault 36л марпат ||M51612024-DW | D357: 520 | E357: * | F357: 1 | G357: 1144.00 | H357: 2.20 | I357: 1144.00 | J357: 624.00 | K357: 5 | L357: =RC[-3]/100*RC[-1] -> 2.20
A358: 7 | B358: _14906 | C358: Горелка для сухого спирту ||14906000 | D358: 62 | E358: * | F358: 1 | G358: 142.00 | H358: 2.29 | I358: 142.00 | J358: 80.00 | K358: 5 | L358: =RC[-3]/100*RC[-1] -> 2.29
A359: 8 | B359: K5-0179 | C359: Зарядное устройство для магазинов (470шар) [DiBoys] | D359: 82 | E359: * | F359: 1 | G359: 189.00 | H359: 2.30 | I359: 189.00 | J359: 107.00 | K359: 5 | L359: =RC[-3]/100*RC[-1] -> 2.30
A360: 9 | B360: KBB-23 | C360: Шарики BB 6мм 0,23x4300 [GUARDER] ||BB-23(BAG) | D360: 157 | E360: * | F360: 1 | G360: 253.00 | H360: 1.61 | I360: 253.00 | J360: 96.00 | K360: 5 | L360: =RC[-3]/100*RC[-1] -> 1.61
A361: 10 | B361: _TRP012.08 | C361: Рюкзак ULTRA | D361: 106 | E361: * | F361: 1 | G361: 160.00 | H361: 1.51 | I361: 155.00 | J361: 49.00 | K361: 5 | L361: =RC[-3]/100*RC[-1] -> 1.51 | M361: =SUM(R[-10]C[-1]:RC[-1]) -> 
A363: #11677 (2015-01-15) Магазин Верхнього одягу - Відправлено-Продано
A364: N | B364: арт | C364: назва | D364: закуп | F364: к-ть | G364: цiна | H364: кф | I364: продж | J364: дохiд | K364: % | L364: з-та
A365: 1 | B365: H65021/XLR | C365: Куртка М65 с отстегивающейся курткой олива (NYCO) ||KU-M65-NY-02 | D365: 768 | E365: * | F365: 1 | G365: 1689.00 | H365: 2.20 | I365: 0.00 | J365: -768.00 | K365: 5 | L365: =RC[-3]/100*RC[-1] -> 2.20
A366: 2 | B366: H2502/112C | C366: Куртка FRENCH ARMY флисовая олива (оригинал) ||BL-FRF-HF-02 | D366: 483 | E366: * | F366: 1 | G366: 1063.00 | H366: 2.20 | I366: 1063.00 | J366: 580.00 | K366: 5 | L366: =RC[-3]/100*RC[-1] -> 2.20
A367: 3 | B367: _12864/250 | C367: BW берцы горные (на мембране) ||12801000-250 | D367: 812 | E367: * | F367: 1 | G367: 1869.00 | H367: 2.30 | I367: 1869.00 | J367: 1057.00 | K367: 5 | L367: =RC[-3]/100*RC[-1] -> 2.30
A368: 4 | B368: H12041/XL | C368: ECWCS куртка TRILAMINAT польский вудлєнд ||KU-EC2-NL-04 | D368: 880 | E368: * | F368: 1 | G368: 1936.00 | H368: 2.20 | I368: 1936.00 | J368: 1056.00 | K368: 5 | L368: =RC[-3]/100*RC[-1] -> 2.20
A369: 5 | B369: M800004/37 | C369: Берцы MAGNUM Spider 8.1 Urban SZ(USA Version) | D369: 1185 | E369: * | F369: 1 | G369: 2108.00 | H369: 1.78 | I369: 2108.00 | J369: 923.00 | K369: 5 | L369: =RC[-3]/100*RC[-1] -> 1.78 | M369: =SUM(R[-5]C[-1]:RC[-1]) -> 
A371: #11695 (2015-01-16) Магазин Уніформи - Відправлено-Продано
A372: N | B372: арт | C372: назва | D372: закуп | F372: к-ть | G372: цiна | H372: кф | I372: продж | J372: дохiд | K372: % | L372: з-та
A373: 1 | B373: X601 | C373: Шапка шерстяная камуфляжна | D373: 2.00 | E373: Инт | F373: 1 | G373: 120.00 | H373: 3.00 | I373: 120.00 | J373: 80.00 | K373: 5 | L373: =RC[-3]/100*RC[-1] -> 3.00
A374: 2 | B374: H47141/SR | C374: US ACU китель мультикам (NYCO R/S) ||BL-ACU-PR-14 | D374: 23.03 | E374: usd | F374: 1 | G374: 1013.00 | H374: 2.20 | I374: 1013.00 | J374: 552.40 | K374: 5 | L374: =RC[-3]/100*RC[-1] -> 2.20
A375: 3 | B375: H5914/SR | C375: CPU штаны мультикамо (PolyCotton) ||SP-CPU-PR-14 | D375: 21.56 | E375: usd | F375: 1 | G375: 949.00 | H375: 2.20 | I375: 942.00 | J375: 510.80 | K375: 5 | L375: =RC[-3]/100*RC[-1] -> 2.20
A376: 4 | B376: _15993/G | C376: BW ремень-стяжка олива 50см б/у ||91599300 | D376: 0.25 | E376: euro | F376: 1 | G376: 16.00 | H376: 2.56 | I376: 16.00 | J376: 9.75 | K376: 5 | L376: =RC[-3]/100*RC[-1] -> 2.56
A377: 5 | B377: _15993/G | C377: BW ремень-стяжка олива 50см б/у ||91599300 | D377: 0.25 | E377: euro | F377: 2 | G377: 16.00 | H377: 2.56 | I377: 32.00 | J377: 19.50 | K377: 5 | L377: =RC[-3]/100*RC[-1] -> 2.56
A378: 6 | B378: H0141/L | C378: Перчатки тактические US Model чёрные ||RK-USM-PO-01 | D378: 10.43 | E378: usd | F378: 1 | G378: 459.00 | H378: 2.20 | I378: 459.00 | J378: 250.40 | K378: 5 | L378: =RC[-3]/100*RC[-1] -> 2.20
A379: 7 | B379: H0141/L | C379: Перчатки тактические US Model чёрные ||RK-USM-PO-01 | D379: 10.43 | E379: usd | F379: 1 | G379: 459.00 | H379: 2.20 | I379: 459.00 | J379: 250.40 | K379: 5 | L379: =RC[-3]/100*RC[-1] -> 2.20
A380: 8 | B380: 53112-16 | C380: Налокотники AltaCONTOUR мультикам [ALTA] ||OL-ACV-CD-34 | D380: 21.60 | E380: usd | F380: 1 | G380: 950.00 | H380: 2.20 | I380: 950.00 | J380: 518.00 | K380: 5 | L380: =RC[-3]/100*RC[-1] -> 2.20
A381: 9 | B381: 52913-16 | C381: Наколінники AltaCOUNTOUR Flexible мультикам [ALTA] ||OK-ACL-CD-34 | D381: 24.21 | E381: usd | F381: 1 | G381: 1065.00 | H381: 2.20 | I381: 1065.00 | J381: 580.80 | K381: 5 | L381: =RC[-3]/100*RC[-1] -> 2.20
A382: 10 | B382: H7914 | C382: Шапка флисовая мультикам ||CZ-DOK-FL-14 | D382: 4.00 | E382: usd | F382: 1 | G382: 200.00 | H382: 2.50 | I382: 200.00 | J382: 120.00 | K382: 5 | L382: =RC[-3]/100*RC[-1] -> 2.50
A383: 11 | B383: H5814/LR | C383: URBAN TACTICAL штаны мультикам (NYCO R/S) ||SP-UTL-NR-14 | D383: 30.75 | E383: usd | F383: 1 | G383: 1353.00 | H383: 2.20 | I383: 1353.00 | J383: 738.00 | K383: 5 | L383: =RC[-3]/100*RC[-1] -> 2.20
A384: 12 | B384: H3301/L | C384: Комплект термобілизни (95% полиэстер 5% спандекс) чёрный ||KP-UN2-PO-01/L | D384: 19.99 | E384: usd | F384: 1 | G384: 880.00 | H384: 2.20 | I384: 880.00 | J384: 480.20 | K384: 5 | L384: =RC[-3]/100*RC[-1] -> 2.20
A385: 13 | B385: H47141/MR | C385: US ACU китель мультикам (NYCO R/S) ||BL-ACU-PR-14 | D385: 23.03 | E385: usd | F385: 1 | G385: 1013.00 | H385: 2.20 | I385: 1013.00 | J385: 552.40 | K385: 5 | L385: =RC[-3]/100*RC[-1] -> 2.20
A386: 14 | B386: BD5560B | C386: Тактический ремень мультикам | D386: 6.81 | E386: usd | F386: 1 | G386: 300.00 | H386: 2.20 | I386: 300.00 | J386: 163.80 | K386: 5 | L386: =RC[-3]/100*RC[-1] -> 2.20
A387: 15 | B387: H02101/L | C387: Носки высокие HEAVYWEIGHT ||р43-46 ||SK-HWT-WA-01 | D387: 4.83 | E387: usd | F387: 1 | G387: 213.00 | H387: 2.20 | I387: 213.00 | J387: 116.40 | K387: 5 | L387: =RC[-3]/100*RC[-1] -> 2.20
A388: 16 | B388: H7513 | C388: Блайзер беж (Polycotton) ||CZ-BBC-CR-13 | D388: 4.31 | E388: usd | F388: 1 | G388: 190.00 | H388: 2.20 | I388: 190.00 | J388: 103.80 | K388: 5 | L388: =RC[-3]/100*RC[-1] -> 2.20
A389: 17 | B389: H4027/SR | C389: URBAN TACTICAL штаны Jungle Green ||SP-UTL-CO-27 | D389: 37.13 | E389: usd | F389: 1 | G389: 1634.00 | H389: 2.20 | I389: 1634.00 | J389: 891.40 | K389: 5 | L389: =RC[-3]/100*RC[-1] -> 2.20
A390: 18 | B390: H6502/SR | C390: US М65 штаны олива (NYCO) ||SP-M65-NY-02 | D390: 19.44 | E390: usd | F390: 1 | G390: 855.00 | H390: 2.20 | I390: 769.50 | J390: 380.70 | K390: 5 | L390: =RC[-3]/100*RC[-1] -> 2.20
A391: 19 | B391: _11957/Р/2 | C391: Рос.костюм маскировочный белый | D391: 2.80 | E391: euro | F391: 25 | G391: 164.00 | H391: 2.34 | I391: 3690.00 | J391: 1940.00 | K391: 5 | L391: =RC[-3]/100*RC[-1] -> 2.34
A392: 20 | B392: _TRC-019 | C392: Термокружка TRAMP с поїлкою 400мл | D392: 6.40 | E392: Инт | F392: 1 | G392: 196.00 | H392: 1.53 | I392: 176.40 | J392: 48.40 | K392: 5 | L392: =RC[-3]/100*RC[-1] -> 1.53
A393: 21 | B393: H0141/M | C393: Перчатки тактические US Model чёрные ||RK-USM-PO-01 | D393: 10.43 | E393: usd | F393: 1 | G393: 459.00 | H393: 2.20 | I393: 413.10 | J393: 204.50 | K393: 5 | L393: =RC[-3]/100*RC[-1] -> 2.20
A394: 22 | B394: H7514 | C394: Блайзер мультикам (Polycotton) ||CZ-BBC-PR-14 | D394: 86 | E394: * | F394: 1 | G394: 190.00 | H394: 2.21 | I394: 190.00 | J394: 104.00 | K394: 5 | L394: =RC[-3]/100*RC[-1] -> 2.21 | M394: =SUM(R[-22]C[-1]:RC[-1]) -> 
A396: #11696 (2015-01-16) магазин Зброя - Відправлено-Продано
A397: N | B397: арт | C397: назва | D397: закуп | F397: к-ть | G397: цiна | H397: кф | I397: продж | J397: дохiд | K397: % | L397: з-та
A398: 1 | B398: _1684 | C398: Патрон Флобера 4мм Нобель | D398: 4 | E398: * | F398: 55 | G398: 6.00 | H398: 1.50 | I398: 330.00 | J398: 110.00 | K398: 5 | L398: =RC[-3]/100*RC[-1] -> 1.50
A399: 2 | B399: _G202 | C399: Мультитул GANZO G202 | D399: 330 | E399: * | F399: 1 | G399: 544.00 | H399: 1.65 | I399: 544.00 | J399: 214.00 | K399: 5 | L399: =RC[-3]/100*RC[-1] -> 1.65
A400: 3 | B400: _G620-B2 | C400: Нож GANZO G620-B2 | D400: 135 | E400: * | F400: 1 | G400: 223.00 | H400: 1.65 | I400: 223.00 | J400: 88.00 | K400: 5 | L400: =RC[-3]/100*RC[-1] -> 1.65
A401: 4 | B401: _DS-0.282 | C401: Пульки ШЕРШЕНЬ 4.5мм 0.28г (2500шт) | D401: 65 | E401: * | F401: 1 | G401: 108.00 | H401: 1.66 | I401: 108.00 | J401: 43.00 | K401: 5 | L401: =RC[-3]/100*RC[-1] -> 1.66
A402: 5 | B402: _N3890 | C402: Нож NAVY CT002 | D402: 170 | E402: * | F402: 1 | G402: 200.00 | H402: 1.18 | I402: 200.00 | J402: 30.00 | K402: 5 | L402: =RC[-3]/100*RC[-1] -> 1.18
A403: 6 | B403: _2200133 | C403: Нож нескладной BEAR GRYLLS GERBER mod. 31-000752 (копия) | D403: 254 | E403: * | F403: 1 | G403: 417.00 | H403: 1.64 | I403: 417.00 | J403: 163.00 | K403: 5 | L403: =RC[-3]/100*RC[-1] -> 1.64
A404: 7 | B404: _1.05212 | C404: Монокуляр KANDAR 6X30 ||18-0120 | D404: 480 | E404: * | F404: 1 | G404: 723.00 | H404: 1.51 | I404: 723.00 | J404: 243.00 | K404: 5 | L404: =RC[-3]/100*RC[-1] -> 1.51
A405: 8 | B405: _03438 | C405: ПНВ Монокуляр NVMT Spartan 1x24 с маской | D405: 2487 | E405: * | F405: 1 | G405: 4720.00 | H405: 1.90 | I405: 4720.00 | J405: 2233.00 | K405: 5 | L405: =RC[-3]/100*RC[-1] -> 1.90
A406: 9 | B406: _95FB | C406: Нож COLD STEEL Pocket Bushman | D406: 630 | E406: * | F406: 1 | G406: 882.00 | H406: 1.40 | I406: 882.00 | J406: 252.00 | K406: 5 | L406: =RC[-3]/100*RC[-1] -> 1.40
A407: 10 | B407: _6321748 | C407: Пульки GAMO Master TS-10 4.5мм 0.68г (200шт) | D407: 45 | E407: * | F407: 1 | G407: 73.00 | H407: 1.62 | I407: 73.00 | J407: 28.00 | K407: 5 | L407: =RC[-3]/100*RC[-1] -> 1.62 | M407: =SUM(R[-10]C[-1]:RC[-1]) -> 
A409: #11697 (2015-01-16) Магазин туризму - Відправлено-Продано
A410: N | B410: арт | C410: назва | D410: закуп | F410: к-ть | G410: цiна | H410: кф | I410: продж | J410: дохiд | K410: % | L410: з-та
A411: 1 | B411: _1400021 | C411: Каремат-сидушка туристический 8мм олива | D411: 20 | E411: * | F411: 1 | G411: 57.00 | H411: 2.85 | I411: 57.00 | J411: 37.00 | K411: 5 | L411: =RC[-3]/100*RC[-1] -> 2.85
A412: 2 | B412: _19-11423 | C412: Ремень для винтовки adventure | D412: 40 | E412: * | F412: 1 | G412: 60.00 | H412: 1.50 | I412: 60.00 | J412: 20.00 | K412: 5 | L412: =RC[-3]/100*RC[-1] -> 1.50
A413: 3 | B413: K12024-D | C413: Рюкзак 3-Day Assault 36л марпат ||M51612024-DW | D413: 520 | E413: * | F413: 1 | G413: 1144.00 | H413: 2.20 | I413: 1144.00 | J413: 624.00 | K413: 5 | L413: =RC[-3]/100*RC[-1] -> 2.20
A414: 4 | B414: KBB-23 | C414: Шарики BB 6мм 0,23x4300 [GUARDER] ||BB-23(BAG) | D414: 157 | E414: * | F414: 1 | G414: 253.00 | H414: 1.61 | I414: 253.00 | J414: 96.00 | K414: 5 | L414: =RC[-3]/100*RC[-1] -> 1.61
A415: 5 | B415: A13851/G | C415: Баул прорезинений оливковий | D415: 17 | E415: * | F415: 1 | G415: 54.00 | H415: 3.18 | I415: 48.60 | J415: 31.60 | K415: 5 | L415: =RC[-3]/100*RC[-1] -> 3.18 | M415: =SUM(R[-5]C[-1]:RC[-1]) -> 
A417: #11698 (2015-01-16) Магазин Верхнього одягу - Відправлено-Продано
A418: N | B418: арт | C418: назва | D418: закуп | F418: к-ть | G418: цiна | H418: кф | I418: продж | J418: дохiд | K418: % | L418: з-та
A419: 1 | B419: _3378-1/45 | C419: Берцы STAR FORCE THUNDERSTORM HI чёрные | D419: 33.53 | E419: euro | F419: 1 | G419: 1894.00 | H419: 2.26 | I419: 1894.00 | J419: 1055.75 | K419: 5 | L419: =RC[-3]/100*RC[-1] -> 2.26
A420: 2 | B420: 91604/42 | C420: Ботинки Trekking North Track brown | D420: 41.00 | E420: Инт | F420: 1 | G420: 1272.00 | H420: 1.55 | I420: 1270.00 | J420: 450.00 | K420: 5 | L420: =RC[-3]/100*RC[-1] -> 1.55
A421: 3 | B421: H5601/M | C421: Куртка CWU чёрная ||KU-CWU-NL-01 | D421: 26.12 | E421: usd | F421: 1 | G421: 1149.00 | H421: 2.20 | I421: 1149.00 | J421: 626.60 | K421: 5 | L421: =RC[-3]/100*RC[-1] -> 2.20
A422: 4 | B422: H2214/M | C422: Куртка GUNFIGHTER мультикам ||KU-GUN-FM-14 | D422: 55.81 | E422: usd | F422: 1 | G422: 2456.00 | H422: 2.20 | I422: 2456.00 | J422: 1339.80 | K422: 5 | L422: =RC[-3]/100*RC[-1] -> 2.20
A423: 5 | B423: H2202/S | C423: Куртка GUNFIGHTER олива ||KU-GUN-FM-02 | D423: 50.89 | E423: usd | F423: 1 | G423: 2239.00 | H423: 2.20 | I423: 2239.00 | J423: 1221.20 | K423: 5 | L423: =RC[-3]/100*RC[-1] -> 2.20
A424: 6 | B424: H2201/M | C424: Куртка GUNFIGHTER чёрная ||KU-GUN-FM-01 | D424: 50.89 | E424: usd | F424: 1 | G424: 2239.00 | H424: 2.20 | I424: 2015.10 | J424: 997.30 | K424: 5 | L424: =RC[-3]/100*RC[-1] -> 2.20
A425: 7 | B425: H49141/LR | C425: Рубашка COMBAT мультикам с налокотниками (NYCO POL) ||KO-CS2-PO-14 | D425: 25.88 | E425: usd | F425: 1 | G425: 1139.00 | H425: 2.20 | I425: 1139.00 | J425: 621.40 | K425: 5 | L425: =RC[-3]/100*RC[-1] -> 2.20
A426: 8 | B426: H2014/L | C426: Куртка LIBERTY флисовая мультикам 390г/м (superfine) ||BL-LIB-HF-14 | D426: 620 | E426: * | F426: 1 | G426: 1364.00 | H426: 2.20 | I426: 1364.00 | J426: 744.00 | K426: 5 | L426: =RC[-3]/100*RC[-1] -> 2.20 | M426: =SUM(R[-8]C[-1]:RC[-1]) -> 
A428: #11719 (2015-01-19) Магазин Верхнього одягу - Відправлено-Продано
A429: N | B429: арт | C429: назва | D429: закуп | F429: к-ть | G429: цiна | H429: кф | I429: продж | J429: дохiд | K429: % | L429: з-та
A430: 1 | B430: X1011/52 | C430: BW пуловер (полушерсть) чёрный (3 нитки) | D430: 500 | E430: * | F430: 1 | G430: 686.00 | H430: 1.37 | I430: 617.40 | J430: 117.40 | K430: 5 | L430: =RC[-3]/100*RC[-1] -> 1.37
A431: 2 | B431: H2033/L | C431: Куртка LIBERTY флисовая MP Camo 390г/м (superfine) ||BL-LIB-HF-33 | D431: 621 | E431: * | F431: 1 | G431: 1365.00 | H431: 2.20 | I431: 1365.00 | J431: 744.00 | K431: 5 | L431: =RC[-3]/100*RC[-1] -> 2.20
A432: 3 | B432: _12846/310 | C432: Канадские резиновые сапоги (с носком) | D432: 488 | E432: * | F432: 1 | G432: 829.00 | H432: 1.70 | I432: 746.10 | J432: 258.10 | K432: 5 | L432: =RC[-3]/100*RC[-1] -> 1.70
A433: 4 | B433: A19-205/42 | C433: Ботинки ACROPOLIS коричневые | D433: 1300 | E433: * | F433: 1 | G433: 1820.00 | H433: 1.40 | I433: 1820.00 | J433: 520.00 | K433: 5 | L433: =RC[-3]/100*RC[-1] -> 1.40 | M433: =SUM(R[-4]C[-1]:RC[-1]) -> 
A435: #11720 (2015-01-19) магазин Зброя - Відправлено-Продано
A436: N | B436: арт | C436: назва | D436: закуп | F436: к-ть | G436: цiна | H436: кф | I436: продж | J436: дохiд | K436: % | L436: з-та
A437: 1 | B437: _297386 | C437: Батарейка ENERGIZER Base AAA | D437: 5 | E437: * | F437: 1 | G437: 8.00 | H437: 1.60 | I437: 8.00 | J437: 3.00 | K437: 5 | L437: =RC[-3]/100*RC[-1] -> 1.60
A438: 2 | B438: _DS-0.683 | C438: Пульки ШЕРШЕНЬ HUNTER 4.5мм 0.68г (360шт) | D438: 33 | E438: * | F438: 1 | G438: 59.00 | H438: 1.79 | I438: 59.00 | J438: 26.00 | K438: 5 | L438: =RC[-3]/100*RC[-1] -> 1.79
A439: 3 | B439: _141425 | C439: Мишень 14x14cм (25шт) | D439: 9 | E439: * | F439: 1 | G439: 23.00 | H439: 2.56 | I439: 23.00 | J439: 14.00 | K439: 5 | L439: =RC[-3]/100*RC[-1] -> 2.56
A440: 4 | B440: _K17066-B | C440: Окуляри защитные чёрные ||M51617066-TEA | D440: 59 | E440: * | F440: 1 | G440: 152.00 | H440: 2.58 | I440: 152.00 | J440: 93.00 | K440: 5 | L440: =RC[-3]/100*RC[-1] -> 2.58
A441: 5 | B441: _18-0401 | C441: Прицел коллиматорный 1x30 Red | D441: 220 | E441: * | F441: 1 | G441: 278.00 | H441: 1.26 | I441: 278.00 | J441: 58.00 | K441: 5 | L441: =RC[-3]/100*RC[-1] -> 1.26
A442: 6 | B442: _M07 | C442: Нож Enlan M07 (8Cr13Mov) пластикова ручка | D442: 109 | E442: * | F442: 1 | G442: 133.00 | H442: 1.22 | I442: 133.00 | J442: 24.00 | K442: 5 | L442: =RC[-3]/100*RC[-1] -> 1.22
A443: 7 | B443: _M08 | C443: Нож NAVY 8Cn13Mov | D443: 87 | E443: * | F443: 1 | G443: 121.00 | H443: 1.39 | I443: 121.00 | J443: 34.00 | K443: 5 | L443: =RC[-3]/100*RC[-1] -> 1.39 | M443: =SUM(R[-7]C[-1]:RC[-1]) -> 
A445: #11721 (2015-01-19) Магазин Уніформи - Відправлено-Продано
A446: N | B446: арт | C446: назва | D446: закуп | F446: к-ть | G446: цiна | H446: кф | I446: продж | J446: дохiд | K446: % | L446: з-та
A447: 1 | B447: H02101/L | C447: Носки высокие HEAVYWEIGHT ||р43-46 ||SK-HWT-WA-01 | D447: 97 | E447: * | F447: 1 | G447: 213.00 | H447: 2.20 | I447: 213.00 | J447: 116.00 | K447: 5 | L447: =RC[-3]/100*RC[-1] -> 2.20
A448: 2 | B448: H7904 | C448: Шапка флисовая пол.вудлэнд ||CZ-DOK-FL-04 | D448: 60 | E448: * | F448: 1 | G448: 150.00 | H448: 2.50 | I448: 120.00 | J448: 60.00 | K448: 5 | L448: =RC[-3]/100*RC[-1] -> 2.50
A449: 3 | B449: H7914 | C449: Шапка флисовая мультикам ||CZ-DOK-FL-14 | D449: 80 | E449: * | F449: 1 | G449: 200.00 | H449: 2.50 | I449: 200.00 | J449: 120.00 | K449: 5 | L449: =RC[-3]/100*RC[-1] -> 2.50
A450: 4 | B450: H0141/S | C450: Перчатки тактические US Model чёрные ||RK-USM-PO-01 | D450: 209 | E450: * | F450: 1 | G450: 459.00 | H450: 2.20 | I450: 459.00 | J450: 250.00 | K450: 5 | L450: =RC[-3]/100*RC[-1] -> 2.20
A451: 5 | B451: _155155-O | C451: Перчатки флисовые олива | D451: 37 | E451: * | F451: 1 | G451: 83.00 | H451: 2.24 | I451: 83.00 | J451: 46.00 | K451: 5 | L451: =RC[-3]/100*RC[-1] -> 2.24
A452: 6 | B452: H02101/M | C452: Носки высокие HEAVYWEIGHT ||р39-42 ||SK-HWT-WA-01 | D452: 97 | E452: * | F452: 1 | G452: 213.00 | H452: 2.20 | I452: 213.00 | J452: 116.00 | K452: 5 | L452: =RC[-3]/100*RC[-1] -> 2.20
A453: 7 | B453: 52913-16 | C453: Наколінники AltaCOUNTOUR Flexible мультикам [ALTA] ||OK-ACL-CD-34 | D453: 484 | E453: * | F453: 1 | G453: 1065.00 | H453: 2.20 | I453: 1065.00 | J453: 581.00 | K453: 5 | L453: =RC[-3]/100*RC[-1] -> 2.20
A454: 8 | B454: X4011 | C454: Балаклава чёрная с 1-м отв. нинзя(100%хлопок) ||X76011 | D454: 63 | E454: * | F454: 1 | G454: 80.00 | H454: 1.27 | I454: 80.00 | J454: 17.00 | K454: 5 | L454: =RC[-3]/100*RC[-1] -> 1.27
A455: 9 | B455: _18309008 | C455: WH лычки UFFZ.INF.белые (REPRO) | D455: 162 | E455: * | F455: 1 | G455: 374.00 | H455: 2.31 | I455: 374.00 | J455: 212.00 | K455: 5 | L455: =RC[-3]/100*RC[-1] -> 2.31
A456: 10 | B456: A19-169/25-27 | C456: Носки охотничьи зимние ACROPOLIS ||ШКМ-2/25-27 | D456: 21 | E456: * | F456: 1 | G456: 33.00 | H456: 1.57 | I456: 33.00 | J456: 12.00 | K456: 5 | L456: =RC[-3]/100*RC[-1] -> 1.57
A457: 11 | B457: X4021 | C457: Балаклава олива с 1-м отв. нинзя (100%хлопок) ||X76012 | D457: 63 | E457: * | F457: 1 | G457: 80.00 | H457: 1.27 | I457: 80.00 | J457: 17.00 | K457: 5 | L457: =RC[-3]/100*RC[-1] -> 1.27 | M457: =SUM(R[-11]C[-1]:RC[-1]) -> 
A459: #11722 (2015-01-19) Магазин туризму - Відправлено-Продано
A460: N | B460: арт | C460: назва | D460: закуп | F460: к-ть | G460: цiна | H460: кф | I460: продж | J460: дохiд | K460: % | L460: з-та
A461: 1 | B461: A19-117 | C461: Футляр для винтовки ACROPOLIS ||ФЗ-8б | D461: 461 | E461: * | F461: 1 | G461: 651.00 | H461: 1.41 | I461: 651.00 | J461: 190.00 | K461: 5 | L461: =RC[-3]/100*RC[-1] -> 1.41
A462: 2 | B462: _19-1101 | C462: Подсумок на 8 патронів (кожаный) | D462: 55 | E462: * | F462: 1 | G462: 80.00 | H462: 1.45 | I462: 80.00 | J462: 25.00 | K462: 5 | L462: =RC[-3]/100*RC[-1] -> 1.45
A463: 3 | B463: _11030-094 | C463: Шарики BB 6мм 0,20x3000 [EXCEL] бутылка | D463: 115 | E463: * | F463: 1 | G463: 97.00 | H463: 0.84 | I463: 97.00 | J463: -18.00 | K463: 5 | L463: =RC[-3]/100*RC[-1] -> 0.84
A464: 4 | B464: K12025-M | C464: Рюкзак 3-Day Assault 30л мультикам ||M51612025-CP | D464: 353 | E464: * | F464: 1 | G464: 777.00 | H464: 2.20 | I464: 777.00 | J464: 424.00 | K464: 5 | L464: =RC[-3]/100*RC[-1] -> 2.20
A465: 5 | B465: _16172 | C465: Шарики BB 6мм 0,20x6000 [BLASTER-DEVIL] - бутылка | D465: 171 | E465: * | F465: 1 | G465: 180.00 | H465: 1.05 | I465: 180.00 | J465: 9.00 | K465: 5 | L465: =RC[-3]/100*RC[-1] -> 1.05
A466: 6 | B466: _542693 | C466: Таблетки для дезинфенкции воды Javel Aqua (10шт) | D466: 15 | E466: * | F466: 10 | G466: 25.00 | H466: 1.67 | I466: 250.00 | J466: 100.00 | K466: 5 | L466: =RC[-3]/100*RC[-1] -> 1.67
A467: 7 | B467: A19-190 | C467: Подсумок аптечка ACROPOLIS||ПМ-1 | D467: 100 | E467: * | F467: 1 | G467: 145.00 | H467: 1.45 | I467: 145.00 | J467: 45.00 | K467: 5 | L467: =RC[-3]/100*RC[-1] -> 1.45
A468: 8 | B468: L0004 | C468: Кресало FS9.5*101 | D468: 173 | E468: * | F468: 1 | G468: 263.00 | H468: 1.52 | I468: 263.00 | J468: 90.00 | K468: 5 | L468: =RC[-3]/100*RC[-1] -> 1.52
A469: 9 | B469: H155021 | C469: Пилка туристическая с кільцями ||PD-PD1-SS-15 | D469: 38 | E469: * | F469: 1 | G469: 84.00 | H469: 2.21 | I469: 84.00 | J469: 46.00 | K469: 5 | L469: =RC[-3]/100*RC[-1] -> 2.21
A470: 10 | B470: K5-0379B | C470: Шарики BB 6мм 0,25x4000 [PREMIUM] ||PJBB 0,25-4000 | D470: 100 | E470: * | F470: 1 | G470: 243.00 | H470: 2.43 | I470: 243.00 | J470: 143.00 | K470: 5 | L470: =RC[-3]/100*RC[-1] -> 2.43
A471: 11 | B471: K5-0379B | C471: Шарики BB 6мм 0,25x4000 [PREMIUM] ||PJBB 0,25-4000 | D471: 100 | E471: * | F471: 1 | G471: 243.00 | H471: 2.43 | I471: 243.00 | J471: 143.00 | K471: 5 | L471: =RC[-3]/100*RC[-1] -> 2.43
A472: 12 | B472: K5-0378A | C472: Шарики BB 6мм 0,20x2000 [PREMIUM] ||PJBB 0,2-2000 | D472: 38 | E472: * | F472: 1 | G472: 87.00 | H472: 2.29 | I472: 87.00 | J472: 49.00 | K472: 5 | L472: =RC[-3]/100*RC[-1] -> 2.29
A473: 13 | B473: A19-139 | C473: Охотничий ремень ACROPOLIS ||МР-10 | D473: 71 | E473: * | F473: 1 | G473: 85.00 | H473: 1.20 | I473: 85.00 | J473: 14.00 | K473: 5 | L473: =RC[-3]/100*RC[-1] -> 1.20
A474: 14 | B474: A19-136 | C474: Футляр для винтовки ACROPOLIS ||ФЗ-7в | D474: 507 | E474: * | F474: 1 | G474: 619.00 | H474: 1.22 | I474: 619.00 | J474: 112.00 | K474: 5 | L474: =RC[-3]/100*RC[-1] -> 1.22 | M474: =SUM(R[-14]C[-1]:RC[-1]) -> 
A476: #11723 (2015-01-19) Магазин Верхнього одягу - Відправлено-Продано
A477: N | B477: арт | C477: назва | D477: закуп | F477: к-ть | G477: цiна | H477: кф | I477: продж | J477: дохiд | K477: % | L477: з-та
A478: 1 | B478: H2233/2XL | C478: Куртка GUNFIGHTER MP Camo||KU-GUN-FM-33 | D478: 55.81 | E478: usd | F478: 1 | G478: 2456.00 | H478: 2.20 | I478: 1964.80 | J478: 848.60 | K478: 5 | L478: =RC[-3]/100*RC[-1] -> 2.20
A479: 2 | B479: H12141/XL | C479: ECWCS куртка TRILAMINAT Gen.2 мультикам ||KU-EC2-NL-14 | D479: 43.99 | E479: usd | F479: 1 | G479: 1936.00 | H479: 2.20 | I479: 1742.40 | J479: 862.60 | K479: 5 | L479: =RC[-3]/100*RC[-1] -> 2.20
A480: 3 | B480: H55141/L | C480: Куртка SOLDIER-2008 мультикам (PolyCotton) ||KU-FP8-PR-14 | D480: 45.71 | E480: usd | F480: 1 | G480: 2011.00 | H480: 2.20 | I480: 1809.90 | J480: 895.70 | K480: 5 | L480: =RC[-3]/100*RC[-1] -> 2.20
A481: 4 | B481: H2702/2XL | C481: Куртка COMMANDER олива ||BL-CMR-FM-02 | D481: 36.66 | E481: usd | F481: 1 | G481: 1613.00 | H481: 2.20 | I481: 1613.00 | J481: 879.80 | K481: 5 | L481: =RC[-3]/100*RC[-1] -> 2.20
A482: 5 | B482: _12002/L | C482: US BDU детские штаны вудлэнд р.152 ||12031020-904 | D482: 8.00 | E482: euro | F482: 1 | G482: 540.00 | H482: 2.70 | I482: 540.00 | J482: 340.00 | K482: 5 | L482: =RC[-3]/100*RC[-1] -> 2.70 | M482: =SUM(R[-5]C[-1]:RC[-1]) -> 
A484: #11725 (2015-01-19) Магазин туризму - Відправлено-Продано
A485: N | B485: арт | C485: назва | D485: закуп | F485: к-ть | G485: цiна | H485: кф | I485: продж | J485: дохiд | K485: % | L485: з-та
A486: 1 | B486: K11002-A | C486: Розгруз. FA ACU [WwCH] ||M51611002-ACU | D486: 1272 | E486: * | F486: 1 | G486: 2798.00 | H486: 2.20 | I486: 2518.20 | J486: 1246.20 | K486: 5 | L486: =RC[-3]/100*RC[-1] -> 2.20
A487: 2 | B487: Брон | C487: Бронепластина 4-й класс | D487: 1400 | E487: * | F487: 2 | G487: 1662.00 | H487: 1.19 | I487: 3324.00 | J487: 524.00 | K487: 5 | L487: =RC[-3]/100*RC[-1] -> 1.19
A488: 3 | B488: _N550200 | C488: Кобура оперативная ПМ с подсумком | D488: 270 | E488: * | F488: 1 | G488: 382.00 | H488: 1.41 | I488: 382.00 | J488: 112.00 | K488: 5 | L488: =RC[-3]/100*RC[-1] -> 1.41
A489: 4 | B489: K4-3178 | C489: Винтовка снайперская страйкбольная. пневм. MB01 койот [Well] | D489: 1631 | E489: * | F489: 1 | G489: 2805.00 | H489: 1.72 | I489: 2524.50 | J489: 893.50 | K489: 5 | L489: =RC[-3]/100*RC[-1] -> 1.72
A490: 5 | B490: K5-0882 | C490: Комплект для тюнинга WARRIOR (MB01, MB05) 170м/с | D490: 256 | E490: * | F490: 1 | G490: 589.00 | H490: 2.30 | I490: 589.00 | J490: 333.00 | K490: 5 | L490: =RC[-3]/100*RC[-1] -> 2.30
A491: 6 | B491: K032-20 | C491: Шарики BB 6мм 0,32x2000 [PREMIUM] ||PJBB 0,32-2000 | D491: 89 | E491: * | F491: 1 | G491: 183.00 | H491: 2.06 | I491: 183.00 | J491: 94.00 | K491: 5 | L491: =RC[-3]/100*RC[-1] -> 2.06
A492: 7 | B492: K12083-M | C492: Рюкзак Combat с кишенею для винтовки мультикам ||M51612083-CP | D492: 569 | E492: * | F492: 1 | G492: 1251.00 | H492: 2.20 | I492: 1125.90 | J492: 556.90 | K492: 5 | L492: =RC[-3]/100*RC[-1] -> 2.20
A493: 8 | B493: A19-78 | C493: Чохол для оружия (L-118) ACROPOLIS ||ЧДЗ-1 | D493: 160 | E493: * | F493: 1 | G493: 192.00 | H493: 1.20 | I493: 192.00 | J493: 32.00 | K493: 5 | L493: =RC[-3]/100*RC[-1] -> 1.20 | M493: =SUM(R[-8]C[-1]:RC[-1]) -> 
A495: #11726 (2015-01-19) магазин Зброя - Відправлено-Продано
A496: N | B496: арт | C496: назва | D496: закуп | F496: к-ть | G496: цiна | H496: кф | I496: продж | J496: дохiд | K496: % | L496: з-та
A497: 1 | B497: GW5017KL | C497: Нож GRAND WAY складной | D497: 71 | E497: * | F497: 1 | G497: 118.00 | H497: 1.66 | I497: 118.00 | J497: 47.00 | K497: 5 | L497: =RC[-3]/100*RC[-1] -> 1.66
A498: 2 | B498: _G108 | C498: Мультитул GANZO G108 | D498: 262 | E498: * | F498: 1 | G498: 433.00 | H498: 1.65 | I498: 433.00 | J498: 171.00 | K498: 5 | L498: =RC[-3]/100*RC[-1] -> 1.65
A499: 3 | B499: _PR2505 | C499: Револьвер под патрон Флобера PROFI 4.5 (пластик чёрный) | D499: 2334 | E499: * | F499: 1 | G499: 3270.00 | H499: 1.40 | I499: 3270.00 | J499: 936.00 | K499: 5 | L499: =RC[-3]/100*RC[-1] -> 1.40
A500: 4 | B500: _1684 | C500: Патрон Флобера 4мм Нобель | D500: 4 | E500: * | F500: 100 | G500: 6.00 | H500: 1.50 | I500: 600.00 | J500: 200.00 | K500: 5 | L500: =RC[-3]/100*RC[-1] -> 1.50
A501: 5 | B501: _429.00.02 | C501: Масло для чистки Clever BALLISTOL 50мл спрей | D501: 73 | E501: * | F501: 1 | G501: 120.00 | H501: 1.64 | I501: 120.00 | J501: 47.00 | K501: 5 | L501: =RC[-3]/100*RC[-1] -> 1.64
A502: 6 | B502: _201-3406 | C502: Бинокль KONUS Army 7x50 | D502: 32 | E502: * | F502: 1 | G502: 580.00 | H502: 18.13 | I502: 580.00 | J502: 548.00 | K502: 5 | L502: =RC[-3]/100*RC[-1] -> 18.13 | M502: =SUM(R[-6]C[-1]:RC[-1]) -> 
A504: #11728 (2015-01-19) Магазин Уніформи - Відправлено-Продано
A505: N | B505: арт | C505: назва | D505: закуп | F505: к-ть | G505: цiна | H505: кф | I505: продж | J505: дохiд | K505: % | L505: з-та
A506: 1 | B506: G0001 | C506: Комплект (наколенники и налокотники) койот | D506: 350 | E506: * | F506: 1 | G506: 600.00 | H506: 1.71 | I506: 600.00 | J506: 250.00 | K506: 5 | L506: =RC[-3]/100*RC[-1] -> 1.71
A507: 2 | B507: X4011 | C507: Балаклава чёрная с 1-м отв. нинзя(100%хлопок) ||X76011 | D507: 63 | E507: * | F507: 1 | G507: 80.00 | H507: 1.27 | I507: 80.00 | J507: 17.00 | K507: 5 | L507: =RC[-3]/100*RC[-1] -> 1.27
A508: 3 | B508: _TRC-037 | C508: Кружка TRAMP 500 мл, складные ручки | D508: 141 | E508: * | F508: 1 | G508: 226.00 | H508: 1.60 | I508: 203.40 | J508: 62.40 | K508: 5 | L508: =RC[-3]/100*RC[-1] -> 1.60
A509: 4 | B509: H7214/M-57 | C509: US ACU кепка мультикам (NYCO R/S) ||CZ-ACU-PR-14 | D509: 86 | E509: * | F509: 1 | G509: 190.00 | H509: 2.21 | I509: 171.00 | J509: 85.00 | K509: 5 | L509: =RC[-3]/100*RC[-1] -> 2.21
A510: 5 | B510: H7914 | C510: Шапка флисовая мультикам ||CZ-DOK-FL-14 | D510: 80 | E510: * | F510: 1 | G510: 200.00 | H510: 2.50 | I510: 180.00 | J510: 100.00 | K510: 5 | L510: =RC[-3]/100*RC[-1] -> 2.50
A511: 6 | B511: H5914/MR | C511: CPU штаны мультикамо (PolyCotton) ||SP-CPU-PR-14 | D511: 431 | E511: * | F511: 1 | G511: 949.00 | H511: 2.20 | I511: 854.10 | J511: 423.10 | K511: 5 | L511: =RC[-3]/100*RC[-1] -> 2.20
A512: 7 | B512: 50413-15 | C512: Наколінники AltaFLEX Long Cap UCP(R) [ALTA] ||OK-AFL-CD-10 | D512: 351 | E512: * | F512: 1 | G512: 772.00 | H512: 2.20 | I512: 694.80 | J512: 343.80 | K512: 5 | L512: =RC[-3]/100*RC[-1] -> 2.20
A513: 8 | B513: 53112-15 | C513: Налокотники AltaCONTOUR UCP(R) [ALTA] ||OL-ACV-CD-10 | D513: 432 | E513: * | F513: 1 | G513: 950.00 | H513: 2.20 | I513: 855.00 | J513: 423.00 | K513: 5 | L513: =RC[-3]/100*RC[-1] -> 2.20
A514: 9 | B514: H98701 | C514: Портмоне чорне ||PF-PRF-PO-01 | D514: 48 | E514: * | F514: 1 | G514: 111.00 | H514: 2.31 | I514: 99.90 | J514: 51.90 | K514: 5 | L514: =RC[-3]/100*RC[-1] -> 2.31
A515: 10 | B515: A16661/L | C515: Шлем кевларовий б/у | D515: 3500 | E515: * | F515: 1 | G515: 5796.00 | H515: 1.66 | I515: 5216.40 | J515: 1716.40 | K515: 5 | L515: =RC[-3]/100*RC[-1] -> 1.66
A516: 11 | B516: H7914 | C516: Шапка флисовая мультикам ||CZ-DOK-FL-14 | D516: 80 | E516: * | F516: 1 | G516: 200.00 | H516: 2.50 | I516: 160.00 | J516: 80.00 | K516: 5 | L516: =RC[-3]/100*RC[-1] -> 2.50
A517: 12 | B517: _11957/XXL | C517: BW костюм маскировочный зимний камуфляж ||11971000/906 | D517: 488 | E517: * | F517: 1 | G517: 1122.00 | H517: 2.30 | I517: 1122.00 | J517: 634.00 | K517: 5 | L517: =RC[-3]/100*RC[-1] -> 2.30
A518: 13 | B518: 40484-2 | C518: Балаклава чёрная флисовая | D518: 59 | E518: * | F518: 1 | G518: 106.00 | H518: 1.80 | I518: 106.00 | J518: 47.00 | K518: 5 | L518: =RC[-3]/100*RC[-1] -> 1.80
A519: 14 | B519: _155155-B | C519: Перчатки флисовые чёрные | D519: 37 | E519: * | F519: 1 | G519: 83.00 | H519: 2.24 | I519: 83.00 | J519: 46.00 | K519: 5 | L519: =RC[-3]/100*RC[-1] -> 2.24 | M519: =SUM(R[-14]C[-1]:RC[-1]) -> 
A521: #11746 (2015-01-20) Магазин Уніформи - Відправлено-Продано
A522: N | B522: арт | C522: назва | D522: закуп | F522: к-ть | G522: цiна | H522: кф | I522: продж | J522: дохiд | K522: % | L522: з-та
A523: 1 | B523: H7914 | C523: Шапка флисовая мультикам ||CZ-DOK-FL-14 | D523: 4.00 | E523: usd | F523: 1 | G523: 200.00 | H523: 2.50 | I523: 180.00 | J523: 100.00 | K523: 5 | L523: =RC[-3]/100*RC[-1] -> 2.50
A524: 2 | B524: H0501G/AB+ | C524: Ліпучка група крові чёрная резина ||OD-BLP-RB-01 | D524: 2.01 | E524: usd | F524: 1 | G524: 89.00 | H524: 2.21 | I524: 80.10 | J524: 39.90 | K524: 5 | L524: =RC[-3]/100*RC[-1] -> 2.21
A525: 3 | B525: H7514 | C525: Блайзер мультикам (Polycotton) ||CZ-BBC-PR-14 | D525: 4.31 | E525: usd | F525: 1 | G525: 190.00 | H525: 2.20 | I525: 171.00 | J525: 84.80 | K525: 5 | L525: =RC[-3]/100*RC[-1] -> 2.20
A526: 4 | B526: H45031/2XLR | C526: US BDU китель вудлэнд (NYCO) ||BL-BDU-NT-03 | D526: 14.06 | E526: usd | F526: 1 | G526: 619.00 | H526: 2.20 | I526: 619.00 | J526: 337.80 | K526: 5 | L526: =RC[-3]/100*RC[-1] -> 2.20
A527: 5 | B527: H4503/2XLR | C527: US BDU штаны вудлэнд (NYCO) ||SP-BDU-NT-03 | D527: 14.06 | E527: usd | F527: 1 | G527: 619.00 | H527: 2.20 | I527: 619.00 | J527: 337.80 | K527: 5 | L527: =RC[-3]/100*RC[-1] -> 2.20
A528: 6 | B528: A19-143 | C528: Стакан металический маленький ACROPOLIS ||СХМ-1з | D528: 17.42 | E528: грн | F528: 1 | G528: 25.00 | H528: 1.44 | I528: 25.00 | J528: 7.58 | K528: 5 | L528: =RC[-3]/100*RC[-1] -> 1.44
A529: 7 | B529: H9002/120 | C529: Ремень ARMY BELT олива ||PS-ARM-CO-02 | D529: 4.23 | E529: usd | F529: 1 | G529: 193.00 | H529: 2.28 | I529: 193.00 | J529: 108.40 | K529: 5 | L529: =RC[-3]/100*RC[-1] -> 2.28
A530: 8 | B530: _11957/Р/2 | C530: Рос.костюм маскировочный белый | D530: 2.80 | E530: euro | F530: 10 | G530: 164.00 | H530: 2.34 | I530: 1476.00 | J530: 776.00 | K530: 5 | L530: =RC[-3]/100*RC[-1] -> 2.34
A531: 9 | B531: K104707/MR | C531: Комплект формы марпат ACU китель, штаны, кепка (R/S) ||KP-ACU-PR-07 | D531: 14.00 | E531: usd | F531: 1 | G531: 616.00 | H531: 2.20 | I531: 616.00 | J531: 336.00 | K531: 5 | L531: =RC[-3]/100*RC[-1] -> 2.20
A532: 10 | B532: X402 | C532: Балаклава олива с 1-м отв.(100%хлопок) ||X76012 | D532: 3.15 | E532: Инт | F532: 1 | G532: 80.00 | H532: 1.27 | I532: 80.00 | J532: 17.00 | K532: 5 | L532: =RC[-3]/100*RC[-1] -> 1.27
A533: 11 | B533: X4021 | C533: Балаклава олива с 1-м отв. нинзя (100%хлопок) ||X76012 | D533: 3.15 | E533: Инт | F533: 1 | G533: 80.00 | H533: 1.27 | I533: 80.00 | J533: 17.00 | K533: 5 | L533: =RC[-3]/100*RC[-1] -> 1.27
A534: 12 | B534: H7911 | C534: Шапка флисовая койот ||CZ-DOK-FL-11 | D534: 2.00 | E534: usd | F534: 1 | G534: 100.00 | H534: 2.50 | I534: 100.00 | J534: 60.00 | K534: 5 | L534: =RC[-3]/100*RC[-1] -> 2.50
A535: 13 | B535: H9013/120 | C535: Ремень ARMY BELT хаки ||PS-ARM-CO-13 | D535: 4.23 | E535: usd | F535: 1 | G535: 193.00 | H535: 2.28 | I535: 193.00 | J535: 108.40 | K535: 5 | L535: =RC[-3]/100*RC[-1] -> 2.28
A536: 14 | B536: H7811 | C536: Хустка SHEMAGH койот/чёрная ||CZ-ARF-CO-11 | D536: 72 | E536: * | F536: 1 | G536: 159.00 | H536: 2.21 | I536: 159.00 | J536: 87.00 | K536: 5 | L536: =RC[-3]/100*RC[-1] -> 2.21 | M536: =SUM(R[-14]C[-1]:RC[-1]) -> 
A538: #11747 (2015-01-20) магазин Зброя - Відправлено-Продано
A539: N | B539: арт | C539: назва | D539: закуп | F539: к-ть | G539: цiна | H539: кф | I539: продж | J539: дохiд | K539: % | L539: з-та
A540: 1 | B540: _6321934 | C540: Пульки GAMO Pro-Hunter 4.5мм 0.51г (500шт) | D540: 63 | E540: * | F540: 1 | G540: 102.00 | H540: 1.62 | I540: 102.00 | J540: 39.00 | K540: 5 | L540: =RC[-3]/100*RC[-1] -> 1.62
A541: 2 | B541: _G614 | C541: Нож GANZO G614 | D541: 107 | E541: * | F541: 1 | G541: 177.00 | H541: 1.65 | I541: 164.61 | J541: 57.61 | K541: 5 | L541: =RC[-3]/100*RC[-1] -> 1.65
A542: 3 | B542: _BE-211 | C542: Нож BENCHMADE Snody Activator** | D542: 1800 | E542: * | F542: 1 | G542: 1080.00 | H542: 0.60 | I542: 1026.00 | J542: -774.00 | K542: 5 | L542: =RC[-3]/100*RC[-1] -> 0.60
A543: 4 | B543: _1568.06.34 | C543: Точило LANSKY Quick Edge | D543: 114 | E543: * | F543: 1 | G543: 166.00 | H543: 1.46 | I543: 166.00 | J543: 52.00 | K543: 5 | L543: =RC[-3]/100*RC[-1] -> 1.46 | M543: =SUM(R[-4]C[-1]:RC[-1]) -> 
A545: #11748 (2015-01-20) Магазин туризму - Відправлено-Продано
A546: N | B546: арт | C546: назва | D546: закуп | F546: к-ть | G546: цiна | H546: кф | I546: продж | J546: дохiд | K546: % | L546: з-та
A547: 1 | B547: _19-1125 | C547: Чохол МЦ woodland | D547: 150 | E547: * | F547: 1 | G547: 220.00 | H547: 1.47 | I547: 220.00 | J547: 70.00 | K547: 5 | L547: =RC[-3]/100*RC[-1] -> 1.47
A548: 2 | B548: K17133-DW | C548: Плечеременная разгрузочная система марпат ||M51617133-DW | D548: 155 | E548: * | F548: 1 | G548: 342.00 | H548: 2.21 | I548: 342.00 | J548: 187.00 | K548: 5 | L548: =RC[-3]/100*RC[-1] -> 2.21
A549: 3 | B549: K13191-M | C549: Подсумок магазинный один. мультикам AK/RPK [A.C.M] ||M51613191-CP | D549: 73 | E549: * | F549: 3 | G549: 160.00 | H549: 2.19 | I549: 432.00 | J549: 213.00 | K549: 5 | L549: =RC[-3]/100*RC[-1] -> 2.19
A550: 4 | B550: _542693 | C550: Таблетки для дезинфенкции воды Javel Aqua (10шт) | D550: 15 | E550: * | F550: 1 | G550: 25.00 | H550: 1.67 | I550: 25.00 | J550: 10.00 | K550: 5 | L550: =RC[-3]/100*RC[-1] -> 1.67
A551: 5 | B551: KG-1000 | C551: GREEN GAS 1000мл | D551: 94 | E551: * | F551: 1 | G551: 248.00 | H551: 2.64 | I551: 0.00 | J551: -94.00 | K551: 5 | L551: =RC[-3]/100*RC[-1] -> 2.64 | M551: =SUM(R[-5]C[-1]:RC[-1]) -> 
A553: #11749 (2015-01-20) Магазин Верхнього одягу - Відправлено-Продано
A554: N | B554: арт | C554: назва | D554: закуп | F554: к-ть | G554: цiна | H554: кф | I554: продж | J554: дохiд | K554: % | L554: з-та
A555: 1 | B555: H12141/XXL | C555: ECWCS куртка TRILAMINAT Gen.2 мультикам ||KU-EC2-NL-14 | D555: 43.99 | E555: usd | F555: 1 | G555: 1936.00 | H555: 2.20 | I555: 1742.40 | J555: 862.60 | K555: 5 | L555: =RC[-3]/100*RC[-1] -> 2.20
A556: 2 | B556: H2014/L | C556: Куртка LIBERTY флисовая мультикам 390г/м (superfine) ||BL-LIB-HF-14 | D556: 31.00 | E556: usd | F556: 1 | G556: 1364.00 | H556: 2.20 | I556: 1227.60 | J556: 607.60 | K556: 5 | L556: =RC[-3]/100*RC[-1] -> 2.20
A557: 3 | B557: H65031/3XL | C557: Куртка М65 с отстегивающейся курткой вудлэнд (NYCO) ||KU-M65-NY-03 | D557: 37.22 | E557: usd | F557: 1 | G557: 1638.00 | H557: 2.20 | I557: 1638.00 | J557: 893.60 | K557: 5 | L557: =RC[-3]/100*RC[-1] -> 2.20
A558: 4 | B558: _10721/XXL | C558: Безрукавка вудлэнд ||10701020-906 | D558: 12.00 | E558: euro | F558: 1 | G558: 684.00 | H558: 2.28 | I558: 684.00 | J558: 384.00 | K558: 5 | L558: =RC[-3]/100*RC[-1] -> 2.28
A559: 5 | B559: _10147/G/01 | C559: BW куртка флектарн б/у ||91010500 | D559: 80.00 | E559: грн | F559: 1 | G559: 184.00 | H559: 2.30 | I559: 184.00 | J559: 104.00 | K559: 5 | L559: =RC[-3]/100*RC[-1] -> 2.30
A560: 6 | B560: _160581/XXL | C560: US костюм TRILAMINAT вудлэнд ||10620020/906 | D560: 45.00 | E560: euro | F560: 1 | G560: 2892.00 | H560: 2.57 | I560: 2602.80 | J560: 1477.80 | K560: 5 | L560: =RC[-3]/100*RC[-1] -> 2.57 | M560: =SUM(R[-6]C[-1]:RC[-1]) -> 
A562: #11782 (2015-01-21) Магазин Уніформи - Відправлено-Продано
A563: N | B563: арт | C563: назва | D563: закуп | F563: к-ть | G563: цiна | H563: кф | I563: продж | J563: дохiд | K563: % | L563: з-та
A564: 1 | B564: EM6628D | C564: Шапка-труба ATAK-FG ||EM6628D | D564: 85 | E564: * | F564: 1 | G564: 187.00 | H564: 2.20 | I564: 187.00 | J564: 102.00 | K564: 5 | L564: =RC[-3]/100*RC[-1] -> 2.20
A565: 2 | B565: H0301 | C565: Наколінники неопренові к штанів ||OC-LPI-NE-01 | D565: 99 | E565: * | F565: 1 | G565: 217.00 | H565: 2.19 | I565: 217.00 | J565: 118.00 | K565: 5 | L565: =RC[-3]/100*RC[-1] -> 2.19
A566: 3 | B566: H8902/120 | C566: Ремень TOUGH US MARINES олива ||PS-USM-CO-02 | D566: 74 | E566: * | F566: 1 | G566: 193.00 | H566: 2.61 | I566: 193.00 | J566: 119.00 | K566: 5 | L566: =RC[-3]/100*RC[-1] -> 2.61
A567: 4 | B567: _TRC-029 | C567: Термос TRAMP 1,6 л | D567: 399 | E567: * | F567: 1 | G567: 559.00 | H567: 1.40 | I567: 559.00 | J567: 160.00 | K567: 5 | L567: =RC[-3]/100*RC[-1] -> 1.40
A568: 5 | B568: H7911 | C568: Шапка флисовая койот ||CZ-DOK-FL-11 | D568: 40 | E568: * | F568: 1 | G568: 100.00 | H568: 2.50 | I568: 100.00 | J568: 60.00 | K568: 5 | L568: =RC[-3]/100*RC[-1] -> 2.50
A569: 6 | B569: H3302/2XL | C569: Комплект термобілизни (95% полиэстер 5% спандекс) олива ||KP-UN2-PO-02/2XL | D569: 400 | E569: * | F569: 1 | G569: 880.00 | H569: 2.20 | I569: 880.00 | J569: 480.00 | K569: 5 | L569: =RC[-3]/100*RC[-1] -> 2.20
A570: 7 | B570: H7514 | C570: Блайзер мультикам (Polycotton) ||CZ-BBC-PR-14 | D570: 86 | E570: * | F570: 1 | G570: 190.00 | H570: 2.21 | I570: 190.00 | J570: 104.00 | K570: 5 | L570: =RC[-3]/100*RC[-1] -> 2.21
A571: 8 | B571: H4027/2XLR | C571: URBAN TACTICAL штаны Jungle Green ||SP-UTL-CO-27 | D571: 743 | E571: * | F571: 1 | G571: 1634.00 | H571: 2.20 | I571: 1470.60 | J571: 727.60 | K571: 5 | L571: =RC[-3]/100*RC[-1] -> 2.20
A572: 9 | B572: DS8838/XL | C572: Носки водонепроницаемые Dexshell Coolvent Lite | D572: 256 | E572: * | F572: 1 | G572: 384.00 | H572: 1.50 | I572: 345.60 | J572: 89.60 | K572: 5 | L572: =RC[-3]/100*RC[-1] -> 1.50
A573: 10 | B573: DS8830W/L | C573: Носки водонепроницаемые DexShell Overcalf Wading | D573: 483 | E573: * | F573: 1 | G573: 725.00 | H573: 1.50 | I573: 580.00 | J573: 97.00 | K573: 5 | L573: =RC[-3]/100*RC[-1] -> 1.50
A574: 11 | B574: H3301/XL | C574: Комплект термобілизни (95% полиэстер 5% спандекс) чёрный ||KP-UN2-PO-01/XL | D574: 400 | E574: * | F574: 1 | G574: 880.00 | H574: 2.20 | I574: 704.00 | J574: 304.00 | K574: 5 | L574: =RC[-3]/100*RC[-1] -> 2.20
A575: 12 | B575: 40484-2 | C575: Балаклава чёрная флисовая | D575: 59 | E575: * | F575: 1 | G575: 106.00 | H575: 1.80 | I575: 106.00 | J575: 47.00 | K575: 5 | L575: =RC[-3]/100*RC[-1] -> 1.80
A576: 13 | B576: H2014/XL | C576: Куртка LIBERTY флисовая мультикам 390г/м (superfine) ||BL-LIB-HF-14 | D576: 620 | E576: * | F576: 1 | G576: 1364.00 | H576: 2.20 | I576: 1091.20 | J576: 471.20 | K576: 5 | L576: =RC[-3]/100*RC[-1] -> 2.20 | M576: =SUM(R[-13]C[-1]:RC[-1]) -> 
A578: #11784 (2015-01-21) магазин Зброя - Відправлено-Продано
A579: N | B579: арт | C579: назва | D579: закуп | F579: к-ть | G579: цiна | H579: кф | I579: продж | J579: дохiд | K579: % | L579: з-та
A580: 1 | B580: _DS-0.752 | C580: Пульки ШЕРШЕНЬ 4.5мм 0.75г (200шт) | D580: 20 | E580: * | F580: 2 | G580: 37.00 | H580: 1.85 | I580: 74.00 | J580: 34.00 | K580: 5 | L580: =RC[-3]/100*RC[-1] -> 1.85
A581: 2 | B581: 123870 | C581: Пила FISKARS с кліпсою Xtrack SW73 | D581: 300 | E581: * | F581: 1 | G581: 420.00 | H581: 1.40 | I581: 420.00 | J581: 120.00 | K581: 5 | L581: =RC[-3]/100*RC[-1] -> 1.40
A582: 3 | B582: _N98-341 | C582: Нож Витязь Диверсант | D582: 467 | E582: * | F582: 1 | G582: 534.00 | H582: 1.14 | I582: 534.00 | J582: 67.00 | K582: 5 | L582: =RC[-3]/100*RC[-1] -> 1.14
A583: 4 | B583: _M12051 | C583: Нож Morakniv™ Bushcraft Survival Orange | D583: 702 | E583: * | F583: 1 | G583: 1087.00 | H583: 1.55 | I583: 1087.00 | J583: 385.00 | K583: 5 | L583: =RC[-3]/100*RC[-1] -> 1.55
A584: 5 | B584: _NEDC | C584: Нож NAVY (копія Boker) | D584: 45 | E584: * | F584: 1 | G584: 56.00 | H584: 1.24 | I584: 56.00 | J584: 11.00 | K584: 5 | L584: =RC[-3]/100*RC[-1] -> 1.24
A585: 6 | B585: _429.00.04 | C585: Масло для чистки Clever BALLISTOL 200мл спрей | D585: 146 | E585: * | F585: 1 | G585: 243.00 | H585: 1.66 | I585: 0.00 | J585: -146.00 | K585: 5 | L585: =RC[-3]/100*RC[-1] -> 1.66 | M585: =SUM(R[-6]C[-1]:RC[-1]) -> 
A587: #11785 (2015-01-21) Магазин туризму - Відправлено-Продано
A588: N | B588: арт | C588: назва | D588: закуп | F588: к-ть | G588: цiна | H588: кф | I588: продж | J588: дохiд | K588: % | L588: з-та
A589: 1 | B589: H90111 | C589: Подсумок Modular System магазинный койот №1 ||LA-M01-PO-11 | D589: 64 | E589: * | F589: 2 | G589: 141.00 | H589: 2.20 | I589: 253.80 | J589: 125.80 | K589: 5 | L589: =RC[-3]/100*RC[-1] -> 2.20
A590: 2 | B590: _TRA-026 | C590: Гермопакет 13x20 см | D590: 49 | E590: * | F590: 1 | G590: 77.00 | H590: 1.57 | I590: 77.00 | J590: 28.00 | K590: 5 | L590: =RC[-3]/100*RC[-1] -> 1.57
A591: 3 | B591: K13165-O | C591: Подсумок Leg Linear Utility Pounch олива [A.C.M] ||M51613165-OD | D591: 229 | E591: * | F591: 1 | G591: 503.00 | H591: 2.20 | I591: 452.70 | J591: 223.70 | K591: 5 | L591: =RC[-3]/100*RC[-1] -> 2.20
A592: 4 | B592: A19-48 | C592: Футляр двохсекційний (L-135) ACROPOLIS ||КВ-3в | D592: 306 | E592: * | F592: 1 | G592: 368.00 | H592: 1.20 | I592: 368.00 | J592: 62.00 | K592: 5 | L592: =RC[-3]/100*RC[-1] -> 1.20
A593: 5 | B593: K12083-M | C593: Рюкзак Combat с кишенею для винтовки мультикам ||M51612083-CP | D593: 569 | E593: * | F593: 1 | G593: 1251.00 | H593: 2.20 | I593: 1125.90 | J593: 556.90 | K593: 5 | L593: =RC[-3]/100*RC[-1] -> 2.20
A594: 6 | B594: K12025-С | C594: Рюкзак 3-Day Assault 30л койот ||M51612025-TAN | D594: 353 | E594: * | F594: 1 | G594: 777.00 | H594: 2.20 | I594: 699.30 | J594: 346.30 | K594: 5 | L594: =RC[-3]/100*RC[-1] -> 2.20 | M594: =SUM(R[-6]C[-1]:RC[-1]) -> 
A596: #11808 (2015-01-22) Магазин Уніформи - Відправлено-Продано
A597: N | B597: арт | C597: назва | D597: закуп | F597: к-ть | G597: цiна | H597: кф | I597: продж | J597: дохiд | K597: % | L597: з-та
A598: 1 | B598: X4011 | C598: Балаклава чёрная с 1-м отв. нинзя(100%хлопок) ||X76011 | D598: 63 | E598: * | F598: 3 | G598: 80.00 | H598: 1.27 | I598: 240.00 | J598: 51.00 | K598: 5 | L598: =RC[-3]/100*RC[-1] -> 1.27
A599: 2 | B599: H0602 | C599: Резиновая кружка олива ||TK-FOL-PP-02 | D599: 23 | E599: * | F599: 1 | G599: 51.00 | H599: 2.22 | I599: 51.00 | J599: 28.00 | K599: 5 | L599: =RC[-3]/100*RC[-1] -> 2.22
A600: 3 | B600: _TRC-008 | C600: Термокружка TRAMP 225 мл | D600: 93 | E600: * | F600: 1 | G600: 153.00 | H600: 1.65 | I600: 153.00 | J600: 60.00 | K600: 5 | L600: =RC[-3]/100*RC[-1] -> 1.65
A601: 4 | B601: H02101/L | C601: Носки высокие HEAVYWEIGHT ||р43-46 ||SK-HWT-WA-01 | D601: 97 | E601: * | F601: 1 | G601: 213.00 | H601: 2.20 | I601: 203.00 | J601: 106.00 | K601: 5 | L601: =RC[-3]/100*RC[-1] -> 2.20
A602: 5 | B602: _703025-11 | C602: Перчатки флисовые Adventure | D602: 217 | E602: * | F602: 1 | G602: 361.00 | H602: 1.66 | I602: 360.00 | J602: 143.00 | K602: 5 | L602: =RC[-3]/100*RC[-1] -> 1.66
A603: 6 | B603: _11957/Р/1 | C603: Рос.костюм маскировочный белый | D603: 70 | E603: * | F603: 1 | G603: 164.00 | H603: 2.34 | I603: 164.00 | J603: 94.00 | K603: 5 | L603: =RC[-3]/100*RC[-1] -> 2.34
A604: 7 | B604: H7902 | C604: Шапка флисовая олива ||CZ-DOK-FL-02 | D604: 40 | E604: * | F604: 1 | G604: 100.00 | H604: 2.50 | I604: 80.00 | J604: 40.00 | K604: 5 | L604: =RC[-3]/100*RC[-1] -> 2.50
A605: 8 | B605: _155155-B | C605: Перчатки флисовые чёрные | D605: 37 | E605: * | F605: 1 | G605: 83.00 | H605: 2.24 | I605: 83.00 | J605: 46.00 | K605: 5 | L605: =RC[-3]/100*RC[-1] -> 2.24
A606: 9 | B606: H3412/L | C606: Футболка Black Camo ||TS-TSH-CO-12 | D606: 81 | E606: * | F606: 2 | G606: 179.00 | H606: 2.21 | I606: 358.00 | J606: 196.00 | K606: 5 | L606: =RC[-3]/100*RC[-1] -> 2.21
A607: 10 | B607: H02101/M | C607: Носки высокие HEAVYWEIGHT ||р39-42 ||SK-HWT-WA-01 | D607: 97 | E607: * | F607: 1 | G607: 213.00 | H607: 2.20 | I607: 213.00 | J607: 116.00 | K607: 5 | L607: =RC[-3]/100*RC[-1] -> 2.20
A608: 11 | B608: H7201 | C608: US BDU кепка чёрная ( PolyCotton Ripstop) ||CZ-COM-NR-01 | D608: 47 | E608: * | F608: 1 | G608: 103.00 | H608: 2.19 | I608: 103.00 | J608: 56.00 | K608: 5 | L608: =RC[-3]/100*RC[-1] -> 2.19
A609: 12 | B609: 40484-2 | C609: Балаклава чёрная флисовая | D609: 59 | E609: * | F609: 1 | G609: 106.00 | H609: 1.80 | I609: 106.00 | J609: 47.00 | K609: 5 | L609: =RC[-3]/100*RC[-1] -> 1.80
A610: 13 | B610: X4021 | C610: Балаклава олива с 1-м отв. нинзя (100%хлопок) ||X76012 | D610: 63 | E610: * | F610: 2 | G610: 80.00 | H610: 1.27 | I610: 160.00 | J610: 34.00 | K610: 5 | L610: =RC[-3]/100*RC[-1] -> 1.27 | M610: =SUM(R[-13]C[-1]:RC[-1]) -> 
A612: #11811 (2015-01-22) Магазин туризму - Відправлено-Продано
A613: N | B613: арт | C613: назва | D613: закуп | F613: к-ть | G613: цiна | H613: кф | I613: продж | J613: дохiд | K613: % | L613: з-та
A614: 1 | B614: A19-183 | C614: Подсумок для сброса магазинов олива ACROPOLIS||СВМ-1 | D614: 56.00 | E614: грн | F614: 1 | G614: 85.00 | H614: 1.52 | I614: 85.00 | J614: 29.00 | K614: 5 | L614: =RC[-3]/100*RC[-1] -> 1.52
A615: 2 | B615: H1621 | C615: Шарф-сетка Foliage Green 95X115см ||CZ-SOR-CO-21 | D615: 7.34 | E615: usd | F615: 1 | G615: 337.00 | H615: 2.30 | I615: 337.00 | J615: 190.20 | K615: 5 | L615: =RC[-3]/100*RC[-1] -> 2.30
A616: 3 | B616: A19-190 | C616: Подсумок аптечка ACROPOLIS||ПМ-1 | D616: 100.00 | E616: грн | F616: 1 | G616: 145.00 | H616: 1.45 | I616: 145.00 | J616: 45.00 | K616: 5 | L616: =RC[-3]/100*RC[-1] -> 1.45
A617: 4 | B617: _1400021 | C617: Каремат-сидушка туристический 8мм олива | D617: 1.00 | E617: Инт | F617: 1 | G617: 57.00 | H617: 2.85 | I617: 57.00 | J617: 37.00 | K617: 5 | L617: =RC[-3]/100*RC[-1] -> 2.85
A618: 5 | B618: A19-186 | C618: Кобура набедренная ACROPOLIS||КП-1 | D618: 190.00 | E618: грн | F618: 2 | G618: 275.00 | H618: 1.45 | I618: 522.50 | J618: 142.50 | K618: 5 | L618: =RC[-3]/100*RC[-1] -> 1.45
A619: 6 | B619: A19-185 | C619: Ремень 3.-точ ACROPOLIS||РТО-1 | D619: 179.00 | E619: грн | F619: 1 | G619: 250.00 | H619: 1.40 | I619: 237.50 | J619: 58.50 | K619: 5 | L619: =RC[-3]/100*RC[-1] -> 1.40 | M619: =SUM(R[-6]C[-1]:RC[-1]) -> 
A621: #11812 (2015-01-22) Магазин Верхнього одягу - Відправлено-Продано
A622: N | B622: арт | C622: назва | D622: закуп | F622: к-ть | G622: цiна | H622: кф | I622: продж | J622: дохiд | K622: % | L622: з-та
A623: 1 | B623: _10147/G/13 | C623: BW куртка флектарн б/у ||91010500 | D623: 80 | E623: * | F623: 1 | G623: 184.00 | H623: 2.30 | I623: 184.00 | J623: 104.00 | K623: 5 | L623: =RC[-3]/100*RC[-1] -> 2.30
A624: 2 | B624: H2016/L | C624: Куртка LIBERTY флисовая чорн/олива 390г/м (superfine) ||BL-LIB-HF-16 | D624: 561 | E624: * | F624: 1 | G624: 1234.00 | H624: 2.20 | I624: 1234.00 | J624: 673.00 | K624: 5 | L624: =RC[-3]/100*RC[-1] -> 2.20
A625: 3 | B625: H12061/M | C625: ECWCS куртка TRILAMINAT польский дезерт||KU-EC2-NL-06 | D625: 880 | E625: * | F625: 1 | G625: 1936.00 | H625: 2.20 | I625: 0.00 | J625: -880.00 | K625: 5 | L625: =RC[-3]/100*RC[-1] -> 2.20
A626: 4 | B626: H51101/S | C626: Куртка М65 с отстегивающейся курткой ACU (NYCO) PROPER | D626: 1000 | E626: * | F626: 1 | G626: 2200.00 | H626: 2.20 | I626: 2200.00 | J626: 1200.00 | K626: 5 | L626: =RC[-3]/100*RC[-1] -> 2.20
A627: 5 | B627: H2301/L | C627: Куртка CLASSIC ARMY флисовая чёрная ||BL-CAF-FL-01 | D627: 366 | E627: * | F627: 1 | G627: 805.00 | H627: 2.20 | I627: 724.50 | J627: 358.50 | K627: 5 | L627: =RC[-3]/100*RC[-1] -> 2.20 | M627: =SUM(R[-5]C[-1]:RC[-1]) -> 
A629: #11824 (2015-01-22) магазин Зброя - Відправлено-Продано
A630: N | B630: арт | C630: назва | D630: закуп | F630: к-ть | G630: цiна | H630: кф | I630: продж | J630: дохiд | K630: % | L630: з-та
A631: 1 | B631: GF8609-2 | C631: Фонарик GRAND FIRE | D631: 31 | E631: * | F631: 1 | G631: 56.00 | H631: 1.81 | I631: 56.00 | J631: 25.00 | K631: 5 | L631: =RC[-3]/100*RC[-1] -> 1.81
A632: 2 | B632: GF8609-2 | C632: Фонарик GRAND FIRE | D632: 31 | E632: * | F632: 1 | G632: 56.00 | H632: 1.81 | I632: 56.00 | J632: 25.00 | K632: 5 | L632: =RC[-3]/100*RC[-1] -> 1.81
A633: 3 | B633: _297386 | C633: Батарейка ENERGIZER Base AAA | D633: 5 | E633: * | F633: 3 | G633: 8.00 | H633: 1.60 | I633: 24.00 | J633: 9.00 | K633: 5 | L633: =RC[-3]/100*RC[-1] -> 1.60
A634: 4 | B634: AA03 | C634: Батарейка MAXUS AAA/LR03 1.5V ||_240573 | D634: 4 | E634: * | F634: 1 | G634: 7.00 | H634: 1.75 | I634: 7.00 | J634: 3.00 | K634: 5 | L634: =RC[-3]/100*RC[-1] -> 1.75
A635: 5 | B635: GET001 | C635: Жетон стальной с набивкой + цепочка | D635: 35 | E635: * | F635: 1 | G635: 60.00 | H635: 1.71 | I635: 65.00 | J635: 30.00 | K635: 5 | L635: =RC[-3]/100*RC[-1] -> 1.71
A636: 6 | B636: K17177A | C636: Очки GX-1000 с 3-мя сменніми стеклами ||M51617177A | D636: 176 | E636: * | F636: 1 | G636: 431.00 | H636: 2.45 | I636: 431.00 | J636: 255.00 | K636: 5 | L636: =RC[-3]/100*RC[-1] -> 2.45
A637: 7 | B637: _217-21 | C637: Фонарь Armytek Tiara A1 Silver XM-L2 550lm | D637: 727 | E637: * | F637: 1 | G637: 1091.00 | H637: 1.50 | I637: 1090.00 | J637: 363.00 | K637: 5 | L637: =RC[-3]/100*RC[-1] -> 1.50
A638: 8 | B638: GW1025 | C638: Плоскогубцы GRAND WAY набір | D638: 183 | E638: * | F638: 1 | G638: 305.00 | H638: 1.67 | I638: 305.00 | J638: 122.00 | K638: 5 | L638: =RC[-3]/100*RC[-1] -> 1.67
A639: 9 | B639: _217-05 | C639: Фонарь Armytek Partner A1 XM-L 260lm ||A1XML | D639: 530 | E639: * | F639: 1 | G639: 796.00 | H639: 1.50 | I639: 636.80 | J639: 106.80 | K639: 5 | L639: =RC[-3]/100*RC[-1] -> 1.50
A640: 10 | B640: AA03 | C640: Батарейка MAXUS AAA/LR03 1.5V ||_240573 | D640: 4 | E640: * | F640: 3 | G640: 7.00 | H640: 1.75 | I640: 21.00 | J640: 9.00 | K640: 5 | L640: =RC[-3]/100*RC[-1] -> 1.75
A641: 11 | B641: _L353013 | C641: Фонарь-лампа FORREST | D641: 66 | E641: * | F641: 1 | G641: 139.00 | H641: 2.11 | I641: 139.00 | J641: 73.00 | K641: 5 | L641: =RC[-3]/100*RC[-1] -> 2.11 | M641: =SUM(R[-11]C[-1]:RC[-1]) -> 
A643: #11839 (2015-01-23) Магазин Уніформи - Відправлено-Продано
A644: N | B644: арт | C644: назва | D644: закуп | F644: к-ть | G644: цiна | H644: кф | I644: продж | J644: дохiд | K644: % | L644: з-та
A645: 1 | B645: M0011/2XL | C645: Футболка Sc белая | D645: 900 | E645: * | F645: 1 | G645: 60.00 | H645: 0.07 | I645: 60.00 | J645: -840.00 | K645: 5 | L645: =RC[-3]/100*RC[-1] -> 0.07
A646: 2 | B646: H5409/2XL | C646: US RANGER штаны мэтро (R/S) | D646: 200 | E646: * | F646: 1 | G646: 440.00 | H646: 2.20 | I646: 461.00 | J646: 261.00 | K646: 5 | L646: =RC[-3]/100*RC[-1] -> 2.20
A647: 3 | B647: H3301/2XL | C647: Комплект термобілизни (95% полиэстер 5% спандекс) чёрный ||KP-UN2-PO-01/2XL | D647: 400 | E647: * | F647: 1 | G647: 880.00 | H647: 2.20 | I647: 880.00 | J647: 480.00 | K647: 5 | L647: =RC[-3]/100*RC[-1] -> 2.20
A648: 4 | B648: _108190/54(3) | C648: Тельник морской с голуб.полосами длинный рукав | D648: 125 | E648: * | F648: 1 | G648: 50.00 | H648: 0.40 | I648: 50.00 | J648: -75.00 | K648: 5 | L648: =RC[-3]/100*RC[-1] -> 0.40
A649: 5 | B649: _874404 | C649: Балаклава двойная чёрная | D649: 82 | E649: * | F649: 1 | G649: 161.00 | H649: 1.96 | I649: 161.00 | J649: 79.00 | K649: 5 | L649: =RC[-3]/100*RC[-1] -> 1.96
A650: 6 | B650: R0415 | C650: Тарелка алюминиевая глубокая СССР | D650: 26 | E650: * | F650: 1 | G650: 56.00 | H650: 2.15 | I650: 56.00 | J650: 30.00 | K650: 5 | L650: =RC[-3]/100*RC[-1] -> 2.15
A651: 7 | B651: G0001 | C651: Комплект (наколенники и налокотники) койот | D651: 350 | E651: * | F651: 1 | G651: 600.00 | H651: 1.71 | I651: 600.00 | J651: 250.00 | K651: 5 | L651: =RC[-3]/100*RC[-1] -> 1.71
A652: 8 | B652: H43021/SR | C652: US SFU китель олива (PolyCotton) ||BL-SFU-PR-02 | D652: 301 | E652: * | F652: 1 | G652: 661.00 | H652: 2.20 | I652: 661.00 | J652: 360.00 | K652: 5 | L652: =RC[-3]/100*RC[-1] -> 2.20
A653: 9 | B653: X2099/48 | C653: Футболка укр-цифра X3445/48 | D653: 75 | E653: * | F653: 1 | G653: 133.00 | H653: 1.77 | I653: 133.00 | J653: 58.00 | K653: 5 | L653: =RC[-3]/100*RC[-1] -> 1.77
A654: 10 | B654: K104707/SR | C654: Комплект формы марпат ACU китель, штаны, кепка (R/S) ||KP-ACU-PR-07 | D654: 280 | E654: * | F654: 1 | G654: 616.00 | H654: 2.20 | I654: 616.00 | J654: 336.00 | K654: 5 | L654: =RC[-3]/100*RC[-1] -> 2.20
A655: 11 | B655: K17112-B | C655: Маска-сетка короткая чёрная ||M51617112-BK | D655: 80 | E655: * | F655: 1 | G655: 176.00 | H655: 2.20 | I655: 176.00 | J655: 96.00 | K655: 5 | L655: =RC[-3]/100*RC[-1] -> 2.20
A656: 12 | B656: пасок13 | C656: Пасок ременний хаки 120 см | D656: 0.01 | E656: zl | F656: 1 | G656: 40.00 | H656: 800.00 | I656: 40.00 | J656: 39.95 | K656: 5 | L656: =RC[-3]/100*RC[-1] -> 800.00
A657: 13 | B657: H0141/S | C657: Перчатки тактические US Model чёрные ||RK-USM-PO-01 | D657: 209 | E657: * | F657: 1 | G657: 459.00 | H657: 2.20 | I657: 459.00 | J657: 250.00 | K657: 5 | L657: =RC[-3]/100*RC[-1] -> 2.20
A658: 14 | B658: H7901 | C658: Шапка флисовая чёрная ||CZ-DOK-FL-01 | D658: 40 | E658: * | F658: 1 | G658: 100.00 | H658: 2.50 | I658: 90.00 | J658: 50.00 | K658: 5 | L658: =RC[-3]/100*RC[-1] -> 2.50
A659: 15 | B659: H0502G/A+ | C659: Ліпучка група крові олива резина ||OD-BLP-RB-02 | D659: 40 | E659: * | F659: 1 | G659: 89.00 | H659: 2.23 | I659: 89.00 | J659: 49.00 | K659: 5 | L659: =RC[-3]/100*RC[-1] -> 2.23 | M659: =SUM(R[-15]C[-1]:RC[-1]) -> 
A661: #11840 (2015-01-23) магазин Зброя - Відправлено-Продано
A662: N | B662: арт | C662: назва | D662: закуп | F662: к-ть | G662: цiна | H662: кф | I662: продж | J662: дохiд | K662: % | L662: з-та
A663: 1 | B663: _SAR | C663: Нож NAVY | D663: 7.68 | E663: Инт | F663: 1 | G663: 213.00 | H663: 1.39 | I663: 213.00 | J663: 59.40 | K663: 5 | L663: =RC[-3]/100*RC[-1] -> 1.39
A664: 2 | B664: _M11602 | C664: Нож MORA® Bushcraft Forest | D664: 19.06 | E664: usd | F664: 1 | G664: 591.00 | H664: 1.55 | I664: 591.00 | J664: 209.81 | K664: 5 | L664: =RC[-3]/100*RC[-1] -> 1.55
A665: 3 | B665: K17177A | C665: Очки GX-1000 с 3-мя сменніми стеклами ||M51617177A | D665: 8.80 | E665: usd | F665: 1 | G665: 431.00 | H665: 2.45 | I665: 431.00 | J665: 255.00 | K665: 5 | L665: =RC[-3]/100*RC[-1] -> 2.45
A666: 4 | B666: _20747 | C666: Шарики BB Copperhead (2500шт) | D666: 0.45 | E666: Инт | F666: 1 | G666: 144.00 | H666: 16.00 | I666: 144.00 | J666: 135.00 | K666: 5 | L666: =RC[-3]/100*RC[-1] -> 16.00
A667: 5 | B667: _4.1687 | C667: Балон СО-2 UMAREX 12г | D667: 0.39 | E667: Инт | F667: 3 | G667: 12.00 | H667: 1.54 | I667: 36.00 | J667: 12.62 | K667: 5 | L667: =RC[-3]/100*RC[-1] -> 1.54
A668: 6 | B668: _50701 | C668: Мишень 50x70cм | D668: 0.11 | E668: Инт | F668: 5 | G668: 4.00 | H668: 1.83 | I668: 20.00 | J668: 9.06 | K668: 5 | L668: =RC[-3]/100*RC[-1] -> 1.83
A669: 7 | B669: _1684 | C669: Патрон Флобера 4мм Нобель | D669: 0.20 | E669: Инт | F669: 30 | G669: 6.00 | H669: 1.47 | I669: 180.00 | J669: 57.86 | K669: 5 | L669: =RC[-3]/100*RC[-1] -> 1.47
A670: 8 | B670: _SAR | C670: Нож NAVY | D670: 7.68 | E670: Инт | F670: 1 | G670: 213.00 | H670: 1.39 | I670: 213.00 | J670: 59.40 | K670: 5 | L670: =RC[-3]/100*RC[-1] -> 1.39 | M670: =SUM(R[-8]C[-1]:RC[-1]) -> 
A672: #11841 (2015-01-23) Магазин туризму - Відправлено-Продано
A673: N | B673: арт | C673: назва | D673: закуп | F673: к-ть | G673: цiна | H673: кф | I673: продж | J673: дохiд | K673: % | L673: з-та
A674: 1 | B674: K13035-C | C674: Подсумок магазинный тройной M4/AK койот [A.C.M] ||M51613035-TAN | D674: 89 | E674: * | F674: 1 | G674: 195.00 | H674: 2.19 | I674: 195.00 | J674: 106.00 | K674: 5 | L674: =RC[-3]/100*RC[-1] -> 2.19
A675: 2 | B675: _16079 | C675: Гидроспрей 500мл FCKW-FREI ||10640000 | D675: 69 | E675: * | F675: 1 | G675: 158.00 | H675: 2.29 | I675: 158.00 | J675: 89.00 | K675: 5 | L675: =RC[-3]/100*RC[-1] -> 2.29
A676: 3 | B676: K12036-A | C676: Рюкзак Becker Patrol Pack MOLLE ACU ||M51612036-ACU | D676: 446 | E676: * | F676: 1 | G676: 982.00 | H676: 2.20 | I676: 785.60 | J676: 339.60 | K676: 5 | L676: =RC[-3]/100*RC[-1] -> 2.20
A677: 4 | B677: KGG-105 | C677: Пістолет газопневматический страйкбольний (Green Gas) BERETTA M92F/M9 [STTI] (ABS) | D677: 269 | E677: * | F677: 1 | G677: 683.00 | H677: 2.54 | I677: 683.00 | J677: 414.00 | K677: 5 | L677: =RC[-3]/100*RC[-1] -> 2.54
A678: 5 | B678: _16171 | C678: Шарики BB 6мм 0,20x3000 [BLASTER-DEVIL] бутылка | D678: 91 | E678: * | F678: 1 | G678: 90.00 | H678: 0.99 | I678: 90.00 | J678: -1.00 | K678: 5 | L678: =RC[-3]/100*RC[-1] -> 0.99
A679: 6 | B679: K13068-AT | C679: Подсумок універс.25х8.5х13 ATACS [A.C.M] ||M51613068-ATACS | D679: 89 | E679: * | F679: 1 | G679: 195.00 | H679: 2.19 | I679: 195.00 | J679: 106.00 | K679: 5 | L679: =RC[-3]/100*RC[-1] -> 2.19
A680: 7 | B680: K13002-TAN | C680: Подсумок MOLLE 12 кал. 6 шт коёт [A.C.M] ||M51613002-TAN | D680: 94 | E680: * | F680: 1 | G680: 207.00 | H680: 2.20 | I680: 207.00 | J680: 113.00 | K680: 5 | L680: =RC[-3]/100*RC[-1] -> 2.20
A681: 8 | B681: A19-184 | C681: Подсумок гранатный олива ACROPOLIS||ПГР-1 | D681: 50 | E681: * | F681: 1 | G681: 70.00 | H681: 1.40 | I681: 70.00 | J681: 20.00 | K681: 5 | L681: =RC[-3]/100*RC[-1] -> 1.40
A682: 9 | B682: _CZ7955 | C682: Спальный мешок CarpZoom Extreme Sleeping Bag | D682: 840 | E682: * | F682: 1 | G682: 1345.00 | H682: 1.60 | I682: 1089.00 | J682: 249.00 | K682: 5 | L682: =RC[-3]/100*RC[-1] -> 1.60
A683: 10 | B683: A19-145 | C683: Фуляр на патрони ACROPOLIS ||ПП-2 | D683: 254 | E683: * | F683: 1 | G683: 370.00 | H683: 1.46 | I683: 370.00 | J683: 116.00 | K683: 5 | L683: =RC[-3]/100*RC[-1] -> 1.46
A684: 11 | B684: K13034-C | C684: Подсумок магазинный двойной койот M4/AK ||M51613034-TAN | D684: 79 | E684: * | F684: 1 | G684: 173.00 | H684: 2.19 | I684: 173.00 | J684: 94.00 | K684: 5 | L684: =RC[-3]/100*RC[-1] -> 2.19 | M684: =SUM(R[-11]C[-1]:RC[-1]) -> 
A686: #11842 (2015-01-23) Магазин Верхнього одягу - Відправлено-Продано
A687: N | B687: арт | C687: назва | D687: закуп | F687: к-ть | G687: цiна | H687: кф | I687: продж | J687: дохiд | K687: % | L687: з-та
A688: 1 | B688: _114441/XXL | C688: Штани спортивные зелёные | D688: 112 | E688: * | F688: 1 | G688: 76.00 | H688: 0.68 | I688: 76.00 | J688: -36.00 | K688: 5 | L688: =RC[-3]/100*RC[-1] -> 0.68
A689: 2 | B689: M800332/42.5 | C689: Берцы MAGNUM Precision Ultra Lite CT WPI Wide | D689: 1065 | E689: * | F689: 1 | G689: 1887.00 | H689: 1.77 | I689: 1887.00 | J689: 822.00 | K689: 5 | L689: =RC[-3]/100*RC[-1] -> 1.77
A690: 3 | B690: H2301/3XL | C690: Куртка CLASSIC ARMY флисовая чёрная ||BL-CAF-FL-01 | D690: 366 | E690: * | F690: 1 | G690: 805.00 | H690: 2.20 | I690: 805.00 | J690: 439.00 | K690: 5 | L690: =RC[-3]/100*RC[-1] -> 2.20 | M690: =SUM(R[-3]C[-1]:RC[-1]) -> 
A692: #11843 (2015-01-23) Магазин Уніформи - Відправлено-Продано
A693: N | B693: арт | C693: назва | D693: закуп | F693: к-ть | G693: цiна | H693: кф | I693: продж | J693: дохiд | K693: % | L693: з-та
A694: 1 | B694: H5814/LR | C694: URBAN TACTICAL штаны мультикам (NYCO R/S) ||SP-UTL-NR-14 | D694: 30.75 | E694: usd | F694: 1 | G694: 1353.00 | H694: 2.20 | I694: 1217.70 | J694: 602.70 | K694: 5 | L694: =RC[-3]/100*RC[-1] -> 2.20
A695: 2 | B695: H7514 | C695: Блайзер мультикам (Polycotton) ||CZ-BBC-PR-14 | D695: 4.31 | E695: usd | F695: 1 | G695: 190.00 | H695: 2.20 | I695: 171.00 | J695: 84.80 | K695: 5 | L695: =RC[-3]/100*RC[-1] -> 2.20
A696: 3 | B696: H3102/L | C696: Куртка Alpha Grid Fleece олива ||BL-ALP-FG-02 | D696: 24.64 | E696: usd | F696: 1 | G696: 1084.00 | H696: 2.20 | I696: 975.60 | J696: 482.80 | K696: 5 | L696: =RC[-3]/100*RC[-1] -> 2.20
A697: 4 | B697: H2233/XL | C697: Куртка GUNFIGHTER MP Camo||KU-GUN-FM-33 | D697: 55.81 | E697: usd | F697: 1 | G697: 2456.00 | H697: 2.20 | I697: 2210.40 | J697: 1094.20 | K697: 5 | L697: =RC[-3]/100*RC[-1] -> 2.20
A698: 5 | B698: H2201/L | C698: Куртка GUNFIGHTER чёрная ||KU-GUN-FM-01 | D698: 50.89 | E698: usd | F698: 1 | G698: 2239.00 | H698: 2.20 | I698: 2015.10 | J698: 997.30 | K698: 5 | L698: =RC[-3]/100*RC[-1] -> 2.20
A699: 6 | B699: H2014/L | C699: Куртка LIBERTY флисовая мультикам 390г/м (superfine) ||BL-LIB-HF-14 | D699: 31.00 | E699: usd | F699: 1 | G699: 1364.00 | H699: 2.20 | I699: 1227.60 | J699: 607.60 | K699: 5 | L699: =RC[-3]/100*RC[-1] -> 2.20
A700: 7 | B700: H02101/M | C700: Носки высокие HEAVYWEIGHT ||р39-42 ||SK-HWT-WA-01 | D700: 4.83 | E700: usd | F700: 1 | G700: 213.00 | H700: 2.20 | I700: 191.70 | J700: 95.10 | K700: 5 | L700: =RC[-3]/100*RC[-1] -> 2.20
A701: 8 | B701: H02301/M | C701: Носки высокие MEDIUMWEIGHT ||р39-42 ||SK-MWT-WA-01 | D701: 4.58 | E701: usd | F701: 1 | G701: 202.00 | H701: 2.21 | I701: 181.80 | J701: 90.20 | K701: 5 | L701: =RC[-3]/100*RC[-1] -> 2.21
A702: 9 | B702: H8902/120 | C702: Ремень TOUGH US MARINES олива ||PS-USM-CO-02 | D702: 3.68 | E702: usd | F702: 1 | G702: 193.00 | H702: 2.62 | I702: 173.70 | J702: 100.10 | K702: 5 | L702: =RC[-3]/100*RC[-1] -> 2.62
A703: 10 | B703: EM6628C | C703: Шапка-труба мультикамо ||EM6628C | D703: 4.24 | E703: usd | F703: 1 | G703: 187.00 | H703: 2.21 | I703: 168.30 | J703: 83.50 | K703: 5 | L703: =RC[-3]/100*RC[-1] -> 2.21 | M703: =SUM(R[-10]C[-1]:RC[-1]) -> 
A705: #11844 (2015-01-23) Магазин Уніформи - Відправлено-Продано
A706: N | B706: арт | C706: назва | D706: закуп | F706: к-ть | G706: цiна | H706: кф | I706: продж | J706: дохiд | K706: % | L706: з-та
A707: 1 | B707: H5827/LR | C707: URBAN TACTICAL штаны Jungle Green PolyCotton ||SP-UTL-PR-27 | D707: 28.43 | E707: usd | F707: 2 | G707: 1251.00 | H707: 2.20 | I707: 2251.80 | J707: 1114.60 | K707: 5 | L707: =RC[-3]/100*RC[-1] -> 2.20
A708: 2 | B708: H5814/LR | C708: URBAN TACTICAL штаны мультикам (NYCO R/S) ||SP-UTL-NR-14 | D708: 30.75 | E708: usd | F708: 1 | G708: 1353.00 | H708: 2.20 | I708: 1217.70 | J708: 602.70 | K708: 5 | L708: =RC[-3]/100*RC[-1] -> 2.20
A709: 3 | B709: H7504 | C709: Блайзер PL Woodland(Polycotton) ||CZ-BBC-PR-04 | D709: 4.31 | E709: usd | F709: 1 | G709: 190.00 | H709: 2.20 | I709: 171.00 | J709: 84.80 | K709: 5 | L709: =RC[-3]/100*RC[-1] -> 2.20
A710: 4 | B710: H7514 | C710: Блайзер мультикам (Polycotton) ||CZ-BBC-PR-14 | D710: 4.31 | E710: usd | F710: 1 | G710: 190.00 | H710: 2.20 | I710: 171.00 | J710: 84.80 | K710: 5 | L710: =RC[-3]/100*RC[-1] -> 2.20
A711: 5 | B711: H3301/L | C711: Комплект термобілизни (95% полиэстер 5% спандекс) чёрный ||KP-UN2-PO-01/L | D711: 19.99 | E711: usd | F711: 2 | G711: 880.00 | H711: 2.20 | I711: 1584.00 | J711: 784.40 | K711: 5 | L711: =RC[-3]/100*RC[-1] -> 2.20
A712: 6 | B712: H2727/L | C712: Куртка COMMANDER Jungle Green||BL-CMR-FM-27 | D712: 36.66 | E712: usd | F712: 1 | G712: 1613.00 | H712: 2.20 | I712: 1451.70 | J712: 718.50 | K712: 5 | L712: =RC[-3]/100*RC[-1] -> 2.20
A713: 7 | B713: H2227/L | C713: Куртка GUNFIGHTER Jungle Green||KU-GUN-FM-27 | D713: 50.89 | E713: usd | F713: 1 | G713: 2239.00 | H713: 2.20 | I713: 2015.10 | J713: 997.30 | K713: 5 | L713: =RC[-3]/100*RC[-1] -> 2.20
A714: 8 | B714: H02101/M | C714: Носки высокие HEAVYWEIGHT ||р39-42 ||SK-HWT-WA-01 | D714: 4.83 | E714: usd | F714: 2 | G714: 213.00 | H714: 2.20 | I714: 383.40 | J714: 190.20 | K714: 5 | L714: =RC[-3]/100*RC[-1] -> 2.20
A715: 9 | B715: H02301/M | C715: Носки высокие MEDIUMWEIGHT ||р39-42 ||SK-MWT-WA-01 | D715: 4.58 | E715: usd | F715: 2 | G715: 202.00 | H715: 2.21 | I715: 363.60 | J715: 180.40 | K715: 5 | L715: =RC[-3]/100*RC[-1] -> 2.21
A716: 10 | B716: H0131/M | C716: Перчатки тактические Half Finger чёрные ||RK-HFG-PO-01 | D716: 7.88 | E716: usd | F716: 1 | G716: 347.00 | H716: 2.20 | I716: 312.30 | J716: 154.70 | K716: 5 | L716: =RC[-3]/100*RC[-1] -> 2.20
A717: 11 | B717: H0141/L | C717: Перчатки тактические US Model чёрные ||RK-USM-PO-01 | D717: 10.43 | E717: usd | F717: 2 | G717: 459.00 | H717: 2.20 | I717: 826.20 | J717: 409.00 | K717: 5 | L717: =RC[-3]/100*RC[-1] -> 2.20
A718: 12 | B718: _608-0202/L | C718: Перчатки тактические олива (без палые) | D718: 17.25 | E718: Инт | F718: 1 | G718: 517.00 | H718: 1.50 | I718: 465.30 | J718: 120.30 | K718: 5 | L718: =RC[-3]/100*RC[-1] -> 1.50
A719: 13 | B719: H98702 | C719: Портмоне олива ||PF-PRF-PO-02 | D719: 2.42 | E719: usd | F719: 2 | G719: 111.00 | H719: 2.29 | I719: 199.80 | J719: 103.00 | K719: 5 | L719: =RC[-3]/100*RC[-1] -> 2.29
A720: 14 | B720: H3414/L | C720: Футболка мультикам ||TS-TSH-CO-14 | D720: 4.06 | E720: usd | F720: 1 | G720: 179.00 | H720: 2.21 | I720: 161.10 | J720: 79.95 | K720: 5 | L720: =RC[-3]/100*RC[-1] -> 2.21
A721: 15 | B721: H3404/XL | C721: Футболка польский вудлэнд ||TS-TSH-CO-04 | D721: 4.06 | E721: usd | F721: 3 | G721: 179.00 | H721: 2.21 | I721: 483.30 | J721: 239.85 | K721: 5 | L721: =RC[-3]/100*RC[-1] -> 2.21
A722: 16 | B722: EM6628D | C722: Шапка-труба ATAK-FG ||EM6628D | D722: 4.24 | E722: usd | F722: 1 | G722: 187.00 | H722: 2.21 | I722: 168.30 | J722: 83.50 | K722: 5 | L722: =RC[-3]/100*RC[-1] -> 2.21
A723: 17 | B723: EM6628C | C723: Шапка-труба мультикамо ||EM6628C | D723: 4.24 | E723: usd | F723: 1 | G723: 187.00 | H723: 2.21 | I723: 168.30 | J723: 83.50 | K723: 5 | L723: =RC[-3]/100*RC[-1] -> 2.21 | M723: =SUM(R[-17]C[-1]:RC[-1]) -> 
A725: #11858 (2015-01-24) Магазин Верхнього одягу - Відправлено-Продано
A726: N | B726: арт | C726: назва | D726: закуп | F726: к-ть | G726: цiна | H726: кф | I726: продж | J726: дохiд | K726: % | L726: з-та
A727: 1 | B727: H55071/M | C727: Куртка SOLDIER-2008 марпат (NYCO R/S) ||KU-FP8-NR-07 | D727: 45.71 | E727: usd | F727: -1 | G727: 2011.00 | H727: 2.20 | I727: -2011.00 | J727: -1096.80 | K727: 5 | L727: =RC[-3]/100*RC[-1] -> 2.20
A728: 2 | B728: H55071/XL | C728: Куртка SOLDIER-2008 марпат (NYCO R/S) ||KU-FP8-NR-07 | D728: 45.71 | E728: usd | F728: 1 | G728: 2011.00 | H728: 2.20 | I728: 2011.00 | J728: 1096.80 | K728: 5 | L728: =RC[-3]/100*RC[-1] -> 2.20
A729: 3 | B729: H65031/2XL | C729: Куртка М65 с отстегивающейся курткой вудлэнд (NYCO) ||KU-M65-NY-03 | D729: 37.22 | E729: usd | F729: 1 | G729: 1638.00 | H729: 2.20 | I729: 1474.00 | J729: 729.60 | K729: 5 | L729: =RC[-3]/100*RC[-1] -> 2.20
A730: 4 | B730: H55041/XL | C730: Куртка SOLDIER-2008 польский вудлэнд (NYCO) ||KU-FP8-NT-04 | D730: 43.99 | E730: usd | F730: 1 | G730: 1936.00 | H730: 2.20 | I730: 1742.00 | J730: 862.20 | K730: 5 | L730: =RC[-3]/100*RC[-1] -> 2.20
A731: 5 | B731: H12041/L | C731: ECWCS куртка TRILAMINAT польский вудлєнд ||KU-EC2-NL-04 | D731: 43.99 | E731: usd | F731: 1 | G731: 1936.00 | H731: 2.20 | I731: 1742.40 | J731: 862.60 | K731: 5 | L731: =RC[-3]/100*RC[-1] -> 2.20
A732: 6 | B732: H6130/43 | C732: Берцы Trekking YUKON коричневые ||BU-TYU-LE-30 | D732: 99.00 | E732: usd | F732: 1 | G732: 4356.00 | H732: 2.20 | I732: 4356.00 | J732: 2376.00 | K732: 5 | L732: =RC[-3]/100*RC[-1] -> 2.20
A733: 7 | B733: H2033/XL | C733: Куртка LIBERTY флисовая MP Camo 390г/м (superfine) ||BL-LIB-HF-33 | D733: 31.03 | E733: usd | F733: 1 | G733: 1365.00 | H733: 2.20 | I733: 1365.00 | J733: 744.40 | K733: 5 | L733: =RC[-3]/100*RC[-1] -> 2.20
A734: 8 | B734: H6211/L | C734: Куртка LEVEL 7 - Climashield® Apex 100g койот ||KU-L70-NL-11 | D734: 72.20 | E734: usd | F734: 1 | G734: 3177.00 | H734: 2.20 | I734: 3018.00 | J734: 1574.00 | K734: 5 | L734: =RC[-3]/100*RC[-1] -> 2.20
A735: 9 | B735: H6911/L | C735: Безрукавка коет Lightweight Vest - Climashield ||KK-MMT-NL-11 | D735: 36.14 | E735: usd | F735: 1 | G735: 1590.00 | H735: 2.20 | I735: 1510.50 | J735: 787.70 | K735: 5 | L735: =RC[-3]/100*RC[-1] -> 2.20
A736: 10 | B736: H6936/L | C736: Безрукавка Alpha Green Lightweight Vest - Climashield ||KK-MMT-NL-36 | D736: 36.14 | E736: usd | F736: 1 | G736: 1590.00 | H736: 2.20 | I736: 1510.50 | J736: 787.70 | K736: 5 | L736: =RC[-3]/100*RC[-1] -> 2.20
A737: 11 | B737: H2227/L | C737: Куртка GUNFIGHTER Jungle Green||KU-GUN-FM-27 | D737: 50.89 | E737: usd | F737: 1 | G737: 2239.00 | H737: 2.20 | I737: 2127.00 | J737: 1109.20 | K737: 5 | L737: =RC[-3]/100*RC[-1] -> 2.20
A738: 12 | B738: _10147/G/14 | C738: BW куртка флектарн б/у ||91010500 | D738: 80.00 | E738: грн | F738: 1 | G738: 184.00 | H738: 2.30 | I738: 184.00 | J738: 104.00 | K738: 5 | L738: =RC[-3]/100*RC[-1] -> 2.30 | M738: =SUM(R[-12]C[-1]:RC[-1]) -> 
A740: #11859 (2015-01-24) магазин Зброя - Відправлено-Продано
A741: N | B741: арт | C741: назва | D741: закуп | F741: к-ть | G741: цiна | H741: кф | I741: продж | J741: дохiд | K741: % | L741: з-та
A742: 1 | B742: _015508 | C742: Батарейка Таблетка 2032 | D742: 0.45 | E742: Инт | F742: 1 | G742: 12.00 | H742: 1.34 | I742: 12.00 | J742: 3.05 | K742: 5 | L742: =RC[-3]/100*RC[-1] -> 1.34
A743: 2 | B743: _G105 | C743: Мультитул GANZO G105 | D743: 13.12 | E743: usd | F743: 1 | G743: 433.00 | H743: 1.65 | I743: 433.00 | J743: 170.60 | K743: 5 | L743: =RC[-3]/100*RC[-1] -> 1.65
A744: 3 | B744: _4.1687 | C744: Балон СО-2 UMAREX 12г | D744: 8 | E744: * | F744: 2 | G744: 12.00 | H744: 1.50 | I744: 24.00 | J744: 8.00 | K744: 5 | L744: =RC[-3]/100*RC[-1] -> 1.50
A745: 4 | B745: GW6034APS | C745: Нож GRAND WAY выкидной | D745: 38 | E745: * | F745: 2 | G745: 64.00 | H745: 1.68 | I745: 128.00 | J745: 52.00 | K745: 5 | L745: =RC[-3]/100*RC[-1] -> 1.68
A746: 5 | B746: _15479200 | C746: WH багнет 98K в піхвах (репро) новий прихід||15479200 | D746: 738 | E746: * | F746: 1 | G746: 1564.00 | H746: 2.12 | I746: 1411.00 | J746: 673.00 | K746: 5 | L746: =RC[-3]/100*RC[-1] -> 2.12
A747: 6 | B747: _N001001 | C747: Нож Puma TEC | D747: 192 | E747: * | F747: 1 | G747: 233.00 | H747: 1.21 | I747: 233.00 | J747: 41.00 | K747: 5 | L747: =RC[-3]/100*RC[-1] -> 1.21
A748: 7 | B748: _1684 | C748: Патрон Флобера 4мм Нобель | D748: 4 | E748: * | F748: 50 | G748: 6.00 | H748: 1.50 | I748: 300.00 | J748: 100.00 | K748: 5 | L748: =RC[-3]/100*RC[-1] -> 1.50
A749: 8 | B749: _K17122-E | C749: Очки FL8008 затемненные ||M51617122-TEA | D749: 74 | E749: * | F749: 1 | G749: 159.00 | H749: 2.15 | I749: 143.10 | J749: 69.10 | K749: 5 | L749: =RC[-3]/100*RC[-1] -> 2.15
A750: 9 | B750: _545830 | C750: Окуляри прозрачные [OREGON] | D750: 92 | E750: * | F750: 1 | G750: 141.00 | H750: 1.53 | I750: 141.00 | J750: 49.00 | K750: 5 | L750: =RC[-3]/100*RC[-1] -> 1.53
A751: 10 | B751: _G202 | C751: Мультитул GANZO G202 | D751: 330 | E751: * | F751: 1 | G751: 544.00 | H751: 1.65 | I751: 435.20 | J751: 105.20 | K751: 5 | L751: =RC[-3]/100*RC[-1] -> 1.65 | M751: =SUM(R[-10]C[-1]:RC[-1]) -> 
A753: #11860 (2015-01-24) Магазин туризму - Відправлено-Продано
A754: N | B754: арт | C754: назва | D754: закуп | F754: к-ть | G754: цiна | H754: кф | I754: продж | J754: дохiд | K754: % | L754: з-та
A755: 1 | B755: A19-01 | C755: Відро рибальське ACROPOLIS (Д-30см) ||ВР-1а | D755: 35.30 | E755: грн | F755: 1 | G755: 52.00 | H755: 1.47 | I755: 52.00 | J755: 16.70 | K755: 5 | L755: =RC[-3]/100*RC[-1] -> 1.47
A756: 2 | B756: H159310 | C756: Лента маскировочная универсальная 50мм (4,5м) ACU ||TM-SCG-PO-10 | D756: 2.10 | E756: usd | F756: 1 | G756: 97.00 | H756: 2.31 | I756: 97.00 | J756: 55.00 | K756: 5 | L756: =RC[-3]/100*RC[-1] -> 2.31
A757: 3 | B757: A19-185 | C757: Ремень 3.-точ ACROPOLIS||РТО-1 | D757: 179.00 | E757: грн | F757: 1 | G757: 250.00 | H757: 1.40 | I757: 250.00 | J757: 71.00 | K757: 5 | L757: =RC[-3]/100*RC[-1] -> 1.40
A758: 4 | B758: A19-156 | C758: Чохол для льодобура ACROPOLIS ||ЧДЛ-11 | D758: 61.32 | E758: грн | F758: 1 | G758: 74.00 | H758: 1.21 | I758: 74.00 | J758: 12.68 | K758: 5 | L758: =RC[-3]/100*RC[-1] -> 1.21
A759: 5 | B759: KBB-23 | C759: Шарики BB 6мм 0,23x4300 [GUARDER] ||BB-23(BAG) | D759: 7.87 | E759: usd | F759: 1 | G759: 253.00 | H759: 1.61 | I759: 190.00 | J759: 32.60 | K759: 5 | L759: =RC[-3]/100*RC[-1] -> 1.61
A760: 6 | B760: K0001-MM | C760: Переходник Mini-to-T [MINI M]||VB MINI M | D760: 1.00 | E760: usd | F760: 1 | G760: 39.00 | H760: 1.95 | I760: 39.00 | J760: 19.00 | K760: 5 | L760: =RC[-3]/100*RC[-1] -> 1.95
A761: 7 | B761: K13022-M | C761: Подсумок поясной на сброс магазинный сетка мультикам ||M51613022-CP | D761: 3.45 | E761: usd | F761: 1 | G761: 152.00 | H761: 2.20 | I761: 152.00 | J761: 83.00 | K761: 5 | L761: =RC[-3]/100*RC[-1] -> 2.20
A762: 8 | B762: K13049-B | C762: Кобура набедренная чёрная ||M51613049-BK | D762: 6.06 | E762: usd | F762: 1 | G762: 279.00 | H762: 2.30 | I762: 279.00 | J762: 157.80 | K762: 5 | L762: =RC[-3]/100*RC[-1] -> 2.30
A763: 9 | B763: K12082-С | C763: Рюкзак MOLLE Tactical Backpack койот ||M51612082-TAN | D763: 19.17 | E763: usd | F763: 1 | G763: 843.00 | H763: 2.20 | I763: 758.70 | J763: 375.30 | K763: 5 | L763: =RC[-3]/100*RC[-1] -> 2.20
A764: 10 | B764: H9711 | C764: Рюкзак RACCOON 20л койот ||PL-RCN-PO-11 | D764: 23.00 | E764: usd | F764: 2 | G764: 1012.00 | H764: 2.20 | I764: 1821.60 | J764: 901.60 | K764: 5 | L764: =RC[-3]/100*RC[-1] -> 2.20
A765: 11 | B765: _14906 | C765: Горелка для сухого спирту ||14906000 | D765: 62 | E765: * | F765: 1 | G765: 142.00 | H765: 2.29 | I765: 127.80 | J765: 65.80 | K765: 5 | L765: =RC[-3]/100*RC[-1] -> 2.29
A766: 12 | B766: A19-187 | C766: Подсумок для рации олива ACROPOLIS||ЧР-1 | D766: 65 | E766: * | F766: 1 | G766: 98.00 | H766: 1.51 | I766: 98.00 | J766: 33.00 | K766: 5 | L766: =RC[-3]/100*RC[-1] -> 1.51
A767: 13 | B767: K12210-O | C767: Подсумок сумок магазинный двойной M4/AK олива [A.C.M] ||M51612210-OD | D767: 115 | E767: * | F767: 1 | G767: 253.00 | H767: 2.20 | I767: 227.70 | J767: 112.70 | K767: 5 | L767: =RC[-3]/100*RC[-1] -> 2.20
A768: 14 | B768: K11023-O | C768: Розгруз. New Mesh Vest олива [A.C.M] ||M51611023-OD | D768: 308 | E768: * | F768: 1 | G768: 678.00 | H768: 2.20 | I768: 610.20 | J768: 302.20 | K768: 5 | L768: =RC[-3]/100*RC[-1] -> 2.20
A769: 15 | B769: A19-187 | C769: Подсумок для рации олива ACROPOLIS||ЧР-1 | D769: 65 | E769: * | F769: 1 | G769: 98.00 | H769: 1.51 | I769: 98.00 | J769: 33.00 | K769: 5 | L769: =RC[-3]/100*RC[-1] -> 1.51
A770: 16 | B770: K12213-C | C770: Подсумок для ножа койот [A.C.M] ||M51612213-TAN | D770: 74 | E770: * | F770: 1 | G770: 163.00 | H770: 2.20 | I770: 146.70 | J770: 72.70 | K770: 5 | L770: =RC[-3]/100*RC[-1] -> 2.20
A771: 17 | B771: _916196 | C771: Рос. кобура для сигнального пистолета M44 б/у ||91619600 | D771: 62 | E771: * | F771: 1 | G771: 240.00 | H771: 3.87 | I771: 240.00 | J771: 178.00 | K771: 5 | L771: =RC[-3]/100*RC[-1] -> 3.87 | M771: =SUM(R[-17]C[-1]:RC[-1]) -> 
A773: #11862 (2015-01-24) Магазин Уніформи - Відправлено-Продано
A774: N | B774: арт | C774: назва | D774: закуп | F774: к-ть | G774: цiна | H774: кф | I774: продж | J774: дохiд | K774: % | L774: з-та
A775: 1 | B775: H7820 | C775: Хустка SHEMAGH біло/чёрная ||CZ-ARF-CO-20 | D775: 3.62 | E775: usd | F775: 1 | G775: 159.00 | H775: 2.20 | I775: 143.00 | J775: 70.60 | K775: 5 | L775: =RC[-3]/100*RC[-1] -> 2.20
A776: 2 | B776: Бабки | C776: Прихід Грошей | D776: 0.00 | E776: грн | F776: 1 | G776: 0.00 | H776: 0.00 | I776: 20927.00 | J776: 20926.00 | K776: 5 | L776: =RC[-3]/100*RC[-1] -> 0.00
A777: 3 | B777: H0131/M | C777: Перчатки тактические Half Finger чёрные ||RK-HFG-PO-01 | D777: 7.88 | E777: usd | F777: 1 | G777: 347.00 | H777: 2.20 | I777: 312.00 | J777: 154.40 | K777: 5 | L777: =RC[-3]/100*RC[-1] -> 2.20
A778: 4 | B778: _703025-G | C778: Перчатки флисовые серые | D778: 1.78 | E778: Инт | F778: 1 | G778: 61.00 | H778: 1.71 | I778: 61.00 | J778: 25.40 | K778: 5 | L778: =RC[-3]/100*RC[-1] -> 1.71
A779: 5 | B779: X4041 | C779: Балаклава дубок с 1-м отв. нинзя (100%хлопок) ||X7600 | D779: 3.15 | E779: Инт | F779: 1 | G779: 80.00 | H779: 1.27 | I779: 80.00 | J779: 17.00 | K779: 5 | L779: =RC[-3]/100*RC[-1] -> 1.27
A780: 6 | B780: _11957/XL | C780: BW костюм маскировочный зимний камуфляж ||11971000/905 | D780: 19.50 | E780: euro | F780: 1 | G780: 1122.00 | H780: 2.30 | I780: 1009.80 | J780: 522.30 | K780: 5 | L780: =RC[-3]/100*RC[-1] -> 2.30
A781: 7 | B781: X4011 | C781: Балаклава чёрная с 1-м отв. нинзя(100%хлопок) ||X76011 | D781: 3.15 | E781: Инт | F781: 1 | G781: 80.00 | H781: 1.27 | I781: 72.00 | J781: 9.00 | K781: 5 | L781: =RC[-3]/100*RC[-1] -> 1.27
A782: 8 | B782: H7901 | C782: Шапка флисовая чёрная ||CZ-DOK-FL-01 | D782: 2.00 | E782: usd | F782: 1 | G782: 100.00 | H782: 2.50 | I782: 100.00 | J782: 60.00 | K782: 5 | L782: =RC[-3]/100*RC[-1] -> 2.50
A783: 9 | B783: H7902 | C783: Шапка флисовая олива ||CZ-DOK-FL-02 | D783: 2.00 | E783: usd | F783: 1 | G783: 100.00 | H783: 2.50 | I783: 100.00 | J783: 60.00 | K783: 5 | L783: =RC[-3]/100*RC[-1] -> 2.50
A784: 10 | B784: H4503/XLR | C784: US BDU штаны вудлэнд (NYCO) ||SP-BDU-NT-03 | D784: 14.06 | E784: usd | F784: 1 | G784: 619.00 | H784: 2.20 | I784: 557.10 | J784: 275.90 | K784: 5 | L784: =RC[-3]/100*RC[-1] -> 2.20
A785: 11 | B785: H3301/XL | C785: Комплект термобілизни (95% полиэстер 5% спандекс) чёрный ||KP-UN2-PO-01/XL | D785: 19.99 | E785: usd | F785: 2 | G785: 880.00 | H785: 2.20 | I785: 1584.00 | J785: 784.40 | K785: 5 | L785: =RC[-3]/100*RC[-1] -> 2.20
A786: 12 | B786: _608-9401/L | C786: Перчатки тактические олива FreeSolder | D786: 25.83 | E786: Инт | F786: 1 | G786: 750.00 | H786: 1.45 | I786: 675.00 | J786: 158.40 | K786: 5 | L786: =RC[-3]/100*RC[-1] -> 1.45
A787: 13 | B787: _TRC-011 | C787: Кружка TRAMP 300 мл, складные ручки | D787: 3.60 | E787: Инт | F787: 1 | G787: 117.00 | H787: 1.63 | I787: 93.60 | J787: 21.60 | K787: 5 | L787: =RC[-3]/100*RC[-1] -> 1.63
A788: 14 | B788: Бабки | C788: Прихід Грошей | D788: 0.00 | E788: грн | F788: 1 | G788: 0.00 | H788: 0.00 | I788: 100.00 | J788: 99.00 | K788: 5 | L788: =RC[-3]/100*RC[-1] -> 0.00 | M788: =SUM(R[-14]C[-1]:RC[-1]) -> 
A790: #11869 (2015-01-26) Магазин Уніформи - Відправлено-Продано
A791: N | B791: арт | C791: назва | D791: закуп | F791: к-ть | G791: цiна | H791: кф | I791: продж | J791: дохiд | K791: % | L791: з-та
A792: 1 | B792: H5928/LR | C792: CPU штаны грецьк. кам (PolyCotton) ||SP-CPU-PR-28 | D792: 402 | E792: * | F792: 1 | G792: 884.00 | H792: 2.20 | I792: 884.00 | J792: 482.00 | K792: 5 | L792: =RC[-3]/100*RC[-1] -> 2.20
A793: 2 | B793: _108195/54(3) | C793: Тельник морской с голуб.полосами длинный рукав (байковый) | D793: 1100 | E793: * | F793: 1 | G793: 133.00 | H793: 0.12 | I793: 133.00 | J793: -967.00 | K793: 5 | L793: =RC[-3]/100*RC[-1] -> 0.12
A794: 3 | B794: X402 | C794: Балаклава олива с 1-м отв.(100%хлопок) ||X76012 | D794: 63 | E794: * | F794: 1 | G794: 80.00 | H794: 1.27 | I794: 80.00 | J794: 17.00 | K794: 5 | L794: =RC[-3]/100*RC[-1] -> 1.27
A795: 4 | B795: H3414/S | C795: Футболка мультикам ||TS-TSH-CO-14 | D795: 81 | E795: * | F795: 1 | G795: 179.00 | H795: 2.21 | I795: 161.10 | J795: 80.10 | K795: 5 | L795: =RC[-3]/100*RC[-1] -> 2.21
A796: 5 | B796: X4021 | C796: Балаклава олива с 1-м отв. нинзя (100%хлопок) ||X76012 | D796: 63 | E796: * | F796: 1 | G796: 80.00 | H796: 1.27 | I796: 72.00 | J796: 9.00 | K796: 5 | L796: =RC[-3]/100*RC[-1] -> 1.27
A797: 6 | B797: H3302/XS | C797: Комплект термобілизни (95% полиэстер 5% спандекс) олива ||KP-UN2-PO-02/XS | D797: 400 | E797: * | F797: 1 | G797: 880.00 | H797: 2.20 | I797: 792.00 | J797: 392.00 | K797: 5 | L797: =RC[-3]/100*RC[-1] -> 2.20
A798: 7 | B798: H5914/SR | C798: CPU штаны мультикамо (PolyCotton) ||SP-CPU-PR-14 | D798: 431 | E798: * | F798: 1 | G798: 949.00 | H798: 2.20 | I798: 854.10 | J798: 423.10 | K798: 5 | L798: =RC[-3]/100*RC[-1] -> 2.20
A799: 8 | B799: H47141/SR | C799: US ACU китель мультикам (NYCO R/S) ||BL-ACU-PR-14 | D799: 461 | E799: * | F799: 1 | G799: 1013.00 | H799: 2.20 | I799: 911.70 | J799: 450.70 | K799: 5 | L799: =RC[-3]/100*RC[-1] -> 2.20
A800: 9 | B800: _11957/Р/1 | C800: Рос.костюм маскировочный белый | D800: 70 | E800: * | F800: 1 | G800: 164.00 | H800: 2.34 | I800: 147.60 | J800: 77.60 | K800: 5 | L800: =RC[-3]/100*RC[-1] -> 2.34
A801: 10 | B801: _11957/Р/2 | C801: Рос.костюм маскировочный белый | D801: 70 | E801: * | F801: 1 | G801: 164.00 | H801: 2.34 | I801: 147.60 | J801: 77.60 | K801: 5 | L801: =RC[-3]/100*RC[-1] -> 2.34
A802: 11 | B802: H0514/0+ | C802: Ліпучка група крові мультикам ||OD-BLP-PO-14 | D802: 27 | E802: * | F802: 1 | G802: 61.00 | H802: 2.26 | I802: 61.00 | J802: 34.00 | K802: 5 | L802: =RC[-3]/100*RC[-1] -> 2.26
A803: 12 | B803: H5814/XLL | C803: URBAN TACTICAL штаны мультикам (NYCO R/S) ||SP-UTL-NR-14 | D803: 615 | E803: * | F803: 1 | G803: 1353.00 | H803: 2.20 | I803: 1217.70 | J803: 602.70 | K803: 5 | L803: =RC[-3]/100*RC[-1] -> 2.20
A804: 13 | B804: H7214/XL-61 | C804: US ACU кепка мультикам (NYCO R/S) ||CZ-ACU-PR-14 | D804: 86 | E804: * | F804: 1 | G804: 190.00 | H804: 2.21 | I804: 171.00 | J804: 85.00 | K804: 5 | L804: =RC[-3]/100*RC[-1] -> 2.21
A805: 14 | B805: EM1811 | C805: Чохол-кавер на шлем MICH2001 мультикам | D805: 87 | E805: * | F805: 3 | G805: 219.00 | H805: 2.52 | I805: 657.00 | J805: 396.00 | K805: 5 | L805: =RC[-3]/100*RC[-1] -> 2.52
A806: 15 | B806: H3414/XL | C806: Футболка мультикам ||TS-TSH-CO-14 | D806: 81 | E806: * | F806: 1 | G806: 179.00 | H806: 2.21 | I806: 161.10 | J806: 80.10 | K806: 5 | L806: =RC[-3]/100*RC[-1] -> 2.21
A807: 16 | B807: H7901 | C807: Шапка флисовая чёрная ||CZ-DOK-FL-01 | D807: 40 | E807: * | F807: 1 | G807: 100.00 | H807: 2.50 | I807: 100.00 | J807: 60.00 | K807: 5 | L807: =RC[-3]/100*RC[-1] -> 2.50
A808: 17 | B808: X4011 | C808: Балаклава чёрная с 1-м отв. нинзя(100%хлопок) ||X76011 | D808: 63 | E808: * | F808: 1 | G808: 80.00 | H808: 1.27 | I808: 80.00 | J808: 17.00 | K808: 5 | L808: =RC[-3]/100*RC[-1] -> 1.27
A809: 18 | B809: _155155-B | C809: Перчатки флисовые чёрные | D809: 37 | E809: * | F809: 1 | G809: 83.00 | H809: 2.24 | I809: 83.00 | J809: 46.00 | K809: 5 | L809: =RC[-3]/100*RC[-1] -> 2.24
A810: 19 | B810: H3301/L | C810: Комплект термобілизни (95% полиэстер 5% спандекс) чёрный ||KP-UN2-PO-01/L | D810: 400 | E810: * | F810: 1 | G810: 880.00 | H810: 2.20 | I810: 880.00 | J810: 480.00 | K810: 5 | L810: =RC[-3]/100*RC[-1] -> 2.20
A811: 20 | B811: H0202/11 | C811: Носки шерстяные высокие (олива) ||SK-NOR-WA-02 | D811: 102 | E811: * | F811: 1 | G811: 225.00 | H811: 2.21 | I811: 202.50 | J811: 100.50 | K811: 5 | L811: =RC[-3]/100*RC[-1] -> 2.21
A812: 21 | B812: H02101/M | C812: Носки высокие HEAVYWEIGHT ||р39-42 ||SK-HWT-WA-01 | D812: 97 | E812: * | F812: 1 | G812: 213.00 | H812: 2.20 | I812: 191.70 | J812: 94.70 | K812: 5 | L812: =RC[-3]/100*RC[-1] -> 2.20
A813: 22 | B813: H3502/L | C813: Комплект термобілизни (100% полиэстер) олива ||KP-UN1-PO-02 | D813: 274 | E813: * | F813: 1 | G813: 603.00 | H813: 2.20 | I813: 542.70 | J813: 268.70 | K813: 5 | L813: =RC[-3]/100*RC[-1] -> 2.20 | M813: =SUM(R[-22]C[-1]:RC[-1]) -> 
A815: #11870 (2015-01-26) Магазин туризму - Відправлено-Продано
A816: N | B816: арт | C816: назва | D816: закуп | F816: к-ть | G816: цiна | H816: кф | I816: продж | J816: дохiд | K816: % | L816: з-та
A817: 1 | B817: K5-0378A | C817: Шарики BB 6мм 0,20x2000 [PREMIUM] ||PJBB 0,2-2000 | D817: 38 | E817: * | F817: 1 | G817: 87.00 | H817: 2.29 | I817: 87.00 | J817: 49.00 | K817: 5 | L817: =RC[-3]/100*RC[-1] -> 2.29
A818: 2 | B818: KG-1000 | C818: GREEN GAS 1000мл | D818: 94 | E818: * | F818: 1 | G818: 248.00 | H818: 2.64 | I818: 248.00 | J818: 154.00 | K818: 5 | L818: =RC[-3]/100*RC[-1] -> 2.64
A819: 3 | B819: K8-9905 | C819: Пістолет газопневматический страйкбольний (Green Gas) G23 GLOCK блоубек [KJW] | D819: 727 | E819: * | F819: 1 | G819: 1645.00 | H819: 2.26 | I819: 1645.00 | J819: 918.00 | K819: 5 | L819: =RC[-3]/100*RC[-1] -> 2.26
A820: 4 | B820: A19-186 | C820: Кобура набедренная ACROPOLIS||КП-1 | D820: 190 | E820: * | F820: 2 | G820: 275.00 | H820: 1.45 | I820: 550.00 | J820: 170.00 | K820: 5 | L820: =RC[-3]/100*RC[-1] -> 1.45
A821: 5 | B821: Брон | C821: Бронепластина 4-й класс | D821: 1400 | E821: * | F821: 1 | G821: 1662.00 | H821: 1.19 | I821: 1662.00 | J821: 262.00 | K821: 5 | L821: =RC[-3]/100*RC[-1] -> 1.19
A822: 6 | B822: K17088-B | C822: Ремень 3-точ.тактический MP5/G3/M4 чёрный (котон)[Производитель: ACM] ||M51617088-BK | D822: 63 | E822: * | F822: 1 | G822: 203.00 | H822: 3.22 | I822: 203.00 | J822: 140.00 | K822: 5 | L822: =RC[-3]/100*RC[-1] -> 3.22
A823: 7 | B823: A19-201 | C823: Нагрудник олива ACROPOLIS ||РЗ-5 | D823: 1211 | E823: * | F823: 1 | G823: 1695.00 | H823: 1.40 | I823: 1695.00 | J823: 484.00 | K823: 5 | L823: =RC[-3]/100*RC[-1] -> 1.40
A824: 8 | B824: _TRM-007 | C824: Спальный мешок-одеяло ||CП-5 люкс | D824: 520 | E824: * | F824: 1 | G824: 802.00 | H824: 1.54 | I824: 721.80 | J824: 201.80 | K824: 5 | L824: =RC[-3]/100*RC[-1] -> 1.54
A825: 9 | B825: K11018-W | C825: Розгруз. Chest Rigg AK с подсумками вудлэнд ||M51611018-WL | D825: 276 | E825: * | F825: 1 | G825: 607.00 | H825: 2.20 | I825: 607.00 | J825: 331.00 | K825: 5 | L825: =RC[-3]/100*RC[-1] -> 2.20
A826: 10 | B826: K13028-M | C826: Кобура набедренная MOLLE tactical backpack мультикам ||M51613028-CP | D826: 152 | E826: * | F826: 2 | G826: 350.00 | H826: 2.30 | I826: 700.00 | J826: 396.00 | K826: 5 | L826: =RC[-3]/100*RC[-1] -> 2.30
A827: 11 | B827: H91414 | C827: Подсумок M-14 магазинный двойной мультикам ||MO-M14-NL-14 | D827: 150 | E827: * | F827: 1 | G827: 330.00 | H827: 2.20 | I827: 297.00 | J827: 147.00 | K827: 5 | L827: =RC[-3]/100*RC[-1] -> 2.20
A828: 12 | B828: K13022-M | C828: Подсумок поясной на сброс магазинный сетка мультикам ||M51613022-CP | D828: 69 | E828: * | F828: 2 | G828: 152.00 | H828: 2.20 | I828: 304.00 | J828: 166.00 | K828: 5 | L828: =RC[-3]/100*RC[-1] -> 2.20 | M828: =SUM(R[-12]C[-1]:RC[-1]) -> 
A830: #11871 (2015-01-26) магазин Зброя - Відправлено-Продано
A831: N | B831: арт | C831: назва | D831: закуп | F831: к-ть | G831: цiна | H831: кф | I831: продж | J831: дохiд | K831: % | L831: з-та
A832: 1 | B832: _201-3404 | C832: Бинокль KONUS Newzoom 7-21x40 | D832: 30 | E832: * | F832: 1 | G832: 555.00 | H832: 18.50 | I832: 527.25 | J832: 497.25 | K832: 5 | L832: =RC[-3]/100*RC[-1] -> 18.50
A833: 2 | B833: _G704y | C833: Нож GANZO G704y | D833: 330 | E833: * | F833: 1 | G833: 544.00 | H833: 1.65 | I833: 544.00 | J833: 214.00 | K833: 5 | L833: =RC[-3]/100*RC[-1] -> 1.65
A834: 3 | B834: _20-0985 | C834: Нож WENGER Motorist 39||1 39 09 300 | D834: 595 | E834: * | F834: 1 | G834: 946.00 | H834: 1.59 | I834: 946.00 | J834: 351.00 | K834: 5 | L834: =RC[-3]/100*RC[-1] -> 1.59
A835: 4 | B835: _OTF-R | C835: Нож MICROTECH красный (копія) | D835: 236 | E835: * | F835: 1 | G835: 413.00 | H835: 1.75 | I835: 330.40 | J835: 94.40 | K835: 5 | L835: =RC[-3]/100*RC[-1] -> 1.75
A836: 5 | B836: _5.0749 | C836: Нож WALTHER P99, 440 SS | D836: 518 | E836: * | F836: 1 | G836: 750.00 | H836: 1.45 | I836: 712.50 | J836: 194.50 | K836: 5 | L836: =RC[-3]/100*RC[-1] -> 1.45
A837: 6 | B837: GF8710 | C837: Фонарик GRAND FIRE | D837: 35 | E837: * | F837: 1 | G837: 62.00 | H837: 1.77 | I837: 62.00 | J837: 27.00 | K837: 5 | L837: =RC[-3]/100*RC[-1] -> 1.77
A838: 7 | B838: GET001 | C838: Жетон стальной с набивкой + цепочка | D838: 35 | E838: * | F838: 1 | G838: 60.00 | H838: 1.71 | I838: 60.00 | J838: 25.00 | K838: 5 | L838: =RC[-3]/100*RC[-1] -> 1.71 | M838: =SUM(R[-7]C[-1]:RC[-1]) -> 
A840: #11872 (2015-01-26) Магазин Верхнього одягу - Відправлено-Продано
A841: N | B841: арт | C841: назва | D841: закуп | F841: к-ть | G841: цiна | H841: кф | I841: продж | J841: дохiд | K841: % | L841: з-та
A842: 1 | B842: H2014/S | C842: Куртка LIBERTY флисовая мультикам 390г/м (superfine) ||BL-LIB-HF-14 | D842: 620 | E842: * | F842: 1 | G842: 1364.00 | H842: 2.20 | I842: 1227.60 | J842: 607.60 | K842: 5 | L842: =RC[-3]/100*RC[-1] -> 2.20
A843: 2 | B843: H2214/M | C843: Куртка GUNFIGHTER мультикам ||KU-GUN-FM-14 | D843: 1116 | E843: * | F843: 1 | G843: 2456.00 | H843: 2.20 | I843: 2210.40 | J843: 1094.40 | K843: 5 | L843: =RC[-3]/100*RC[-1] -> 2.20
A844: 3 | B844: H11071/2XL | C844: APECS USMC куртка TRILAMINAT марпат ||KU-APE-NL-07 | D844: 765 | E844: * | F844: 1 | G844: 1683.00 | H844: 2.20 | I844: 1683.00 | J844: 918.00 | K844: 5 | L844: =RC[-3]/100*RC[-1] -> 2.20
A845: 4 | B845: H2233/XL | C845: Куртка GUNFIGHTER MP Camo||KU-GUN-FM-33 | D845: 1116 | E845: * | F845: 1 | G845: 2456.00 | H845: 2.20 | I845: 2210.40 | J845: 1094.40 | K845: 5 | L845: =RC[-3]/100*RC[-1] -> 2.20
A846: 5 | B846: H2014/2XL | C846: Куртка LIBERTY флисовая мультикам 390г/м (superfine) ||BL-LIB-HF-14 | D846: 620 | E846: * | F846: 1 | G846: 1364.00 | H846: 2.20 | I846: 1227.60 | J846: 607.60 | K846: 5 | L846: =RC[-3]/100*RC[-1] -> 2.20
A847: 6 | B847: B12004/2XL | C847: Дорожній светловідбівний жилет помаранч ГАБАРИТ | D847: 17 | E847: * | F847: 2 | G847: 50.00 | H847: 2.94 | I847: 100.00 | J847: 66.00 | K847: 5 | L847: =RC[-3]/100*RC[-1] -> 2.94
A848: 7 | B848: M800332/45 | C848: Берцы MAGNUM Precision Ultra Lite CT WPI Wide | D848: 1065 | E848: * | F848: 1 | G848: 1887.00 | H848: 1.77 | I848: 1792.65 | J848: 727.65 | K848: 5 | L848: =RC[-3]/100*RC[-1] -> 1.77
A849: 8 | B849: R1283/43 | C849: Берци кожа чёрные Украина | D849: 1400 | E849: * | F849: -1 | G849: 2001.00 | H849: 1.43 | I849: -2001.00 | J849: -601.00 | K849: 5 | L849: =RC[-3]/100*RC[-1] -> 1.43
A850: 9 | B850: R1283/44 | C850: Берци кожа чёрные Украина | D850: 1400 | E850: * | F850: 1 | G850: 2001.00 | H850: 1.43 | I850: 2001.00 | J850: 601.00 | K850: 5 | L850: =RC[-3]/100*RC[-1] -> 1.43 | M850: =SUM(R[-9]C[-1]:RC[-1]) -> 
A852: #11910 (2015-01-27) Магазин Верхнього одягу - Відправлено-Продано
A853: N | B853: арт | C853: назва | D853: закуп | F853: к-ть | G853: цiна | H853: кф | I853: продж | J853: дохiд | K853: % | L853: з-та
A854: 1 | B854: R1284/42 | C854: Берци кожа чёрные утепленные Украина | D854: 1400 | E854: * | F854: 1 | G854: 2001.00 | H854: 1.43 | I854: 2001.00 | J854: 601.00 | K854: 5 | L854: =RC[-3]/100*RC[-1] -> 1.43
A855: 2 | B855: H2033/XL | C855: Куртка LIBERTY флисовая MP Camo 390г/м (superfine) ||BL-LIB-HF-33 | D855: 621 | E855: * | F855: 1 | G855: 1365.00 | H855: 2.20 | I855: 1296.75 | J855: 675.75 | K855: 5 | L855: =RC[-3]/100*RC[-1] -> 2.20
A856: 3 | B856: R1283/42 | C856: Берци кожа чёрные Украина | D856: 1400 | E856: * | F856: 1 | G856: 2001.00 | H856: 1.43 | I856: 1900.95 | J856: 500.95 | K856: 5 | L856: =RC[-3]/100*RC[-1] -> 1.43
A857: 4 | B857: R1283/43 | C857: Берци кожа чёрные Украина | D857: 1400 | E857: * | F857: 1 | G857: 2001.00 | H857: 1.43 | I857: 1900.95 | J857: 500.95 | K857: 5 | L857: =RC[-3]/100*RC[-1] -> 1.43
A858: 5 | B858: _10852/L | C858: BW куртка M.BRUSTTA флисовая олива ||10852001/904 | D858: 275 | E858: * | F858: 1 | G858: 490.00 | H858: 1.78 | I858: 343.00 | J858: 68.00 | K858: 5 | L858: =RC[-3]/100*RC[-1] -> 1.78
A859: 6 | B859: X1021/56 | C859: BW пуловер (полушерсть) олива (3 нитки) | D859: 500 | E859: * | F859: 1 | G859: 686.00 | H859: 1.37 | I859: 686.00 | J859: 186.00 | K859: 5 | L859: =RC[-3]/100*RC[-1] -> 1.37
A860: 7 | B860: M800332/42.5 | C860: Берцы MAGNUM Precision Ultra Lite CT WPI Wide | D860: 1065 | E860: * | F860: 6 | G860: 1887.00 | H860: 1.77 | I860: 9057.60 | J860: 2667.60 | K860: 5 | L860: =RC[-3]/100*RC[-1] -> 1.77
A861: 8 | B861: M800332/43 | C861: Берцы MAGNUM Precision Ultra Lite CT WPI Wide | D861: 1065 | E861: * | F861: 2 | G861: 1887.00 | H861: 1.77 | I861: 3019.20 | J861: 889.20 | K861: 5 | L861: =RC[-3]/100*RC[-1] -> 1.77
A862: 9 | B862: M800332/44 | C862: Берцы MAGNUM Precision Ultra Lite CT WPI Wide | D862: 1065 | E862: * | F862: 1 | G862: 1887.00 | H862: 1.77 | I862: 1509.60 | J862: 444.60 | K862: 5 | L862: =RC[-3]/100*RC[-1] -> 1.77
A863: 10 | B863: H65031/L | C863: Куртка М65 с отстегивающейся курткой вудлэнд (NYCO) ||KU-M65-NY-03 | D863: 744 | E863: * | F863: 1 | G863: 1638.00 | H863: 2.20 | I863: 1638.00 | J863: 894.00 | K863: 5 | L863: =RC[-3]/100*RC[-1] -> 2.20
A864: 11 | B864: H65031/M | C864: Куртка М65 с отстегивающейся курткой вудлэнд (NYCO) ||KU-M65-NY-03 | D864: 744 | E864: * | F864: -1 | G864: 1638.00 | H864: 2.20 | I864: -1638.00 | J864: -894.00 | K864: 5 | L864: =RC[-3]/100*RC[-1] -> 2.20
A865: 12 | B865: H12041/M | C865: ECWCS куртка TRILAMINAT польский вудлєнд ||KU-EC2-NL-04 | D865: 880 | E865: * | F865: 1 | G865: 1936.00 | H865: 2.20 | I865: 1819.84 | J865: 939.84 | K865: 5 | L865: =RC[-3]/100*RC[-1] -> 2.20
A866: 13 | B866: H2004/M | C866: Куртка LIBERTY флисовая польский вудлєнд 390г/м (superfine) ||BL-LIB-HF-04 | D866: 561 | E866: * | F866: 1 | G866: 1234.00 | H866: 2.20 | I866: 1159.96 | J866: 598.96 | K866: 5 | L866: =RC[-3]/100*RC[-1] -> 2.20
A867: 14 | B867: H55141/S | C867: Куртка SOLDIER-2008 мультикам (PolyCotton) ||KU-FP8-PR-14 | D867: 914 | E867: * | F867: 1 | G867: 2011.00 | H867: 2.20 | I867: 1809.90 | J867: 895.90 | K867: 5 | L867: =RC[-3]/100*RC[-1] -> 2.20 | M867: =SUM(R[-14]C[-1]:RC[-1]) -> 
A869: #11911 (2015-01-27) Магазин туризму - Відправлено-Продано
A870: N | B870: арт | C870: назва | D870: закуп | F870: к-ть | G870: цiна | H870: кф | I870: продж | J870: дохiд | K870: % | L870: з-та
A871: 1 | B871: K12234-B | C871: Подсумок універс. для оружия чёрный [A.C.M] ||M51612234-BK | D871: 109 | E871: * | F871: 1 | G871: 239.00 | H871: 2.19 | I871: 239.00 | J871: 130.00 | K871: 5 | L871: =RC[-3]/100*RC[-1] -> 2.19
A872: 2 | B872: A19-190 | C872: Подсумок аптечка ACROPOLIS||ПМ-1 | D872: 100 | E872: * | F872: 1 | G872: 145.00 | H872: 1.45 | I872: 145.00 | J872: 45.00 | K872: 5 | L872: =RC[-3]/100*RC[-1] -> 1.45
A873: 3 | B873: _1400021 | C873: Каремат-сидушка туристический 8мм олива | D873: 20 | E873: * | F873: 1 | G873: 57.00 | H873: 2.85 | I873: 57.00 | J873: 37.00 | K873: 5 | L873: =RC[-3]/100*RC[-1] -> 2.85
A874: 4 | B874: _187512T | C874: Подсумок магазинный к THOMSON | D874: 1100 | E874: * | F874: 1 | G874: 100.00 | H874: 0.09 | I874: 100.00 | J874: -1000.00 | K874: 5 | L874: =RC[-3]/100*RC[-1] -> 0.09
A875: 5 | B875: K5-0378B | C875: Шарики BB 6мм 0,20x4000 [PREMIUM] ||PJBB 0,2-4000 | D875: 71 | E875: * | F875: 1 | G875: 171.00 | H875: 2.41 | I875: 171.00 | J875: 100.00 | K875: 5 | L875: =RC[-3]/100*RC[-1] -> 2.41
A876: 6 | B876: K17195-С | C876: Ремень 3-точ.тактический G3/M4/M15/M16 койот [Производитель: ACM] ||M51617195-TAN | D876: 156 | E876: * | F876: 1 | G876: 360.00 | H876: 2.31 | I876: 360.00 | J876: 204.00 | K876: 5 | L876: =RC[-3]/100*RC[-1] -> 2.31
A877: 7 | B877: H9711 | C877: Рюкзак RACCOON 20л койот ||PL-RCN-PO-11 | D877: 460 | E877: * | F877: 1 | G877: 1012.00 | H877: 2.20 | I877: 809.60 | J877: 349.60 | K877: 5 | L877: =RC[-3]/100*RC[-1] -> 2.20
A878: 8 | B878: K13048-M | C878: Кобура набедренная мультикам ||M51613048-CP | D878: 97 | E878: * | F878: 1 | G878: 223.00 | H878: 2.30 | I878: 223.00 | J878: 126.00 | K878: 5 | L878: =RC[-3]/100*RC[-1] -> 2.30 | M878: =SUM(R[-8]C[-1]:RC[-1]) -> 
A880: #11912 (2015-01-27) магазин Зброя - Відправлено-Продано
A881: N | B881: арт | C881: назва | D881: закуп | F881: к-ть | G881: цiна | H881: кф | I881: продж | J881: дохiд | K881: % | L881: з-та
A882: 1 | B882: GF8705 | C882: Фонарик GRAND FIRE | D882: 35 | E882: * | F882: 1 | G882: 62.00 | H882: 1.77 | I882: 62.00 | J882: 27.00 | K882: 5 | L882: =RC[-3]/100*RC[-1] -> 1.77
A883: 2 | B883: AA44 | C883: Батарейка DURACELL Base AA ||_58163 | D883: 4 | E883: * | F883: 2 | G883: 7.00 | H883: 1.75 | I883: 14.00 | J883: 6.00 | K883: 5 | L883: =RC[-3]/100*RC[-1] -> 1.75
A884: 3 | B884: _G620-G2 | C884: Нож GANZO G620-G2 | D884: 135 | E884: * | F884: 1 | G884: 223.00 | H884: 1.65 | I884: 223.00 | J884: 88.00 | K884: 5 | L884: =RC[-3]/100*RC[-1] -> 1.65
A885: 4 | B885: _00825 | C885: Кріпленя БК YUKON Weaver-Бк | D885: 537 | E885: * | F885: 1 | G885: 867.00 | H885: 1.61 | I885: 780.30 | J885: 243.30 | K885: 5 | L885: =RC[-3]/100*RC[-1] -> 1.61
A886: 5 | B886: _65161 | C886: Чохол для мисливського ножа №1 короткий | D886: 50 | E886: * | F886: 1 | G886: 72.00 | H886: 1.44 | I886: 72.00 | J886: 22.00 | K886: 5 | L886: =RC[-3]/100*RC[-1] -> 1.44
A887: 6 | B887: _N14086-5 | C887: Нож складной балисонг | D887: 72 | E887: * | F887: 1 | G887: 110.00 | H887: 1.53 | I887: 110.00 | J887: 38.00 | K887: 5 | L887: =RC[-3]/100*RC[-1] -> 1.53
A888: 7 | B888: GW2270 | C888: Нож GRAND WAY | D888: 82 | E888: * | F888: 1 | G888: 133.00 | H888: 1.62 | I888: 133.00 | J888: 51.00 | K888: 5 | L888: =RC[-3]/100*RC[-1] -> 1.62
A889: 8 | B889: _N5051 | C889: Нож Stiletto | D889: 125 | E889: * | F889: 1 | G889: 148.00 | H889: 1.18 | I889: 148.00 | J889: 23.00 | K889: 5 | L889: =RC[-3]/100*RC[-1] -> 1.18
A890: 9 | B890: _21033 | C890: BRUNOX масло для оружия подовженої дії 100 мл | D890: 62 | E890: * | F890: 1 | G890: 103.00 | H890: 1.66 | I890: 92.70 | J890: 30.70 | K890: 5 | L890: =RC[-3]/100*RC[-1] -> 1.66 | M890: =SUM(R[-9]C[-1]:RC[-1]) -> 
A892: #11914 (2015-01-27) Магазин Уніформи - Відправлено-Продано
A893: N | B893: арт | C893: назва | D893: закуп | F893: к-ть | G893: цiна | H893: кф | I893: продж | J893: дохiд | K893: % | L893: з-та
A894: 1 | B894: H7902 | C894: Шапка флисовая олива ||CZ-DOK-FL-02 | D894: 2.00 | E894: usd | F894: 1 | G894: 100.00 | H894: 2.50 | I894: 100.00 | J894: 60.00 | K894: 5 | L894: =RC[-3]/100*RC[-1] -> 2.50
A895: 2 | B895: H6501/SR | C895: US М65 штаны чёрные (NYCO) ||SP-M65-NY-01 | D895: 19.44 | E895: usd | F895: 1 | G895: 855.00 | H895: 2.20 | I895: 855.00 | J895: 466.20 | K895: 5 | L895: =RC[-3]/100*RC[-1] -> 2.20
A896: 3 | B896: _608-0202/XL | C896: Перчатки тактические олива (без палые) | D896: 17.25 | E896: Инт | F896: 1 | G896: 517.00 | H896: 1.50 | I896: 465.30 | J896: 120.30 | K896: 5 | L896: =RC[-3]/100*RC[-1] -> 1.50
A897: 4 | B897: K17222-C | C897: Балаклава SKULL type C-чёрная [Производитель: ACM] ||M51617222-C | D897: 2.65 | E897: usd | F897: 1 | G897: 117.00 | H897: 2.21 | I897: 117.00 | J897: 64.00 | K897: 5 | L897: =RC[-3]/100*RC[-1] -> 2.21
A898: 5 | B898: A0199 | C898: Значок Спеціаліста підривника вищої категорії ||170403 | D898: 3.70 | E898: euro | F898: 1 | G898: 55.00 | H898: 0.59 | I898: 55.00 | J898: -37.50 | K898: 5 | L898: =RC[-3]/100*RC[-1] -> 0.59
A899: 6 | B899: H47101/LR | C899: US ACU китель ACU (PolyCotton) ||BL-ACU-PR-10 | D899: 17.43 | E899: usd | F899: 2 | G899: 767.00 | H899: 2.20 | I899: 1225.00 | J899: 527.80 | K899: 5 | L899: =RC[-3]/100*RC[-1] -> 2.20
A900: 7 | B900: H4710/LR | C900: US ACU штаны ACU (PolyCotton) ||SP-ACU-PR-10 | D900: 17.43 | E900: usd | F900: 2 | G900: 767.00 | H900: 2.20 | I900: 1225.00 | J900: 527.80 | K900: 5 | L900: =RC[-3]/100*RC[-1] -> 2.20
A901: 8 | B901: H0613 | C901: Резиновая кружка хаки ||TK-FOL-PP-13 | D901: 1.15 | E901: usd | F901: 1 | G901: 51.00 | H901: 2.22 | I901: 51.00 | J901: 28.00 | K901: 5 | L901: =RC[-3]/100*RC[-1] -> 2.22
A902: 9 | B902: H3410/L | C902: Футболка ACU ||TS-TSH-CO-10 | D902: 4.06 | E902: usd | F902: 2 | G902: 179.00 | H902: 2.21 | I902: 280.00 | J902: 117.70 | K902: 5 | L902: =RC[-3]/100*RC[-1] -> 2.21
A903: 10 | B903: H4001/MR | C903: URBAN TACTICAL штаны чёрные ||SP-UTL-CO-01 | D903: 37.13 | E903: usd | F903: 1 | G903: 1634.00 | H903: 2.20 | I903: 1470.60 | J903: 728.00 | K903: 5 | L903: =RC[-3]/100*RC[-1] -> 2.20
A904: 11 | B904: H7904 | C904: Шапка флисовая пол.вудлэнд ||CZ-DOK-FL-04 | D904: 3.00 | E904: usd | F904: 1 | G904: 150.00 | H904: 2.50 | I904: 141.00 | J904: 81.00 | K904: 5 | L904: =RC[-3]/100*RC[-1] -> 2.50
A905: 12 | B905: _12550 | C905: Перчатки THINSULATE акриловые без пальцев олива ||12540001 | D905: 2.00 | E905: euro | F905: 1 | G905: 120.00 | H905: 2.40 | I905: 112.80 | J905: 62.80 | K905: 5 | L905: =RC[-3]/100*RC[-1] -> 2.40
A906: 13 | B906: H59041/SR | C906: CPU китель польский вудлэнд (PolyCotton) ||BL-CPU-PR-04 | D906: 20.10 | E906: usd | F906: 1 | G906: 884.00 | H906: 2.20 | I906: 830.96 | J906: 428.96 | K906: 5 | L906: =RC[-3]/100*RC[-1] -> 2.20
A907: 14 | B907: H5904/SR | C907: CPU штаны польский вудлэнд (PolyCotton) ||SP-CPU-PR-04 | D907: 20.10 | E907: usd | F907: 1 | G907: 884.00 | H907: 2.20 | I907: 830.96 | J907: 428.96 | K907: 5 | L907: =RC[-3]/100*RC[-1] -> 2.20
A908: 15 | B908: H3404/S | C908: Футболка польский вудлэнд ||TS-TSH-CO-04 | D908: 4.06 | E908: usd | F908: 1 | G908: 179.00 | H908: 2.21 | I908: 168.26 | J908: 87.11 | K908: 5 | L908: =RC[-3]/100*RC[-1] -> 2.21
A909: 16 | B909: H3301/M | C909: Комплект термобілизни (95% полиэстер 5% спандекс) чёрный ||KP-UN2-PO-01/M | D909: 19.99 | E909: usd | F909: 1 | G909: 880.00 | H909: 2.20 | I909: 827.20 | J909: 427.40 | K909: 5 | L909: =RC[-3]/100*RC[-1] -> 2.20 | M909: =SUM(R[-16]C[-1]:RC[-1]) -> 
A911: #11930 (2015-01-28) Магазин Уніформи - Відправлено-Продано
A912: N | B912: арт | C912: назва | D912: закуп | F912: к-ть | G912: цiна | H912: кф | I912: продж | J912: дохiд | K912: % | L912: з-та
A913: 1 | B913: H7014/M | C913: US GI панама мультикам (NYCO) ||7 1/4 ||KA-USM-NT-14 | D913: 92 | E913: * | F913: 1 | G913: 202.00 | H913: 2.20 | I913: 202.00 | J913: 110.00 | K913: 5 | L913: =RC[-3]/100*RC[-1] -> 2.20
A914: 2 | B914: H3410/XL | C914: Футболка ACU ||TS-TSH-CO-10 | D914: 81 | E914: * | F914: 1 | G914: 179.00 | H914: 2.21 | I914: 179.00 | J914: 98.00 | K914: 5 | L914: =RC[-3]/100*RC[-1] -> 2.21
A915: 3 | B915: _108195/50(3) | C915: Тельник морской с голуб.полосами длинный рукав (байковый) | D915: 1100 | E915: * | F915: 1 | G915: 133.00 | H915: 0.12 | I915: 133.00 | J915: -967.00 | K915: 5 | L915: =RC[-3]/100*RC[-1] -> 0.12
A916: 4 | B916: _108195/52(2) | C916: Тельник морской с голуб.полосами длинный рукав (байковый) | D916: 55 | E916: * | F916: 1 | G916: 120.00 | H916: 2.18 | I916: 120.00 | J916: 65.00 | K916: 5 | L916: =RC[-3]/100*RC[-1] -> 2.18
A917: 5 | B917: X4011 | C917: Балаклава чёрная с 1-м отв. нинзя(100%хлопок) ||X76011 | D917: 63 | E917: * | F917: 1 | G917: 80.00 | H917: 1.27 | I917: 80.00 | J917: 17.00 | K917: 5 | L917: =RC[-3]/100*RC[-1] -> 1.27
A918: 6 | B918: _17811 | C918: Нашивка текст.Флаг US олива ||16851500 | D918: 12 | E918: * | F918: 1 | G918: 38.00 | H918: 3.17 | I918: 38.00 | J918: 26.00 | K918: 5 | L918: =RC[-3]/100*RC[-1] -> 3.17
A919: 7 | B919: A0273 | C919: Нашивка 49-а Бронетанкова дивізія армии США (кол.) ||140581 | D919: 30 | E919: * | F919: 1 | G919: 21.00 | H919: 0.70 | I919: 21.00 | J919: -9.00 | K919: 5 | L919: =RC[-3]/100*RC[-1] -> 0.70
A920: 8 | B920: A0272 | C920: Знак 49-а Бронетанкова дивізія армии США ||140493 | D920: 93 | E920: * | F920: 1 | G920: 64.00 | H920: 0.69 | I920: 64.00 | J920: -29.00 | K920: 5 | L920: =RC[-3]/100*RC[-1] -> 0.69
A921: 9 | B921: _108190/52(3) | C921: Тельник морской с голуб.полосами длинный рукав | D921: 125 | E921: * | F921: 1 | G921: 50.00 | H921: 0.40 | I921: 50.00 | J921: -75.00 | K921: 5 | L921: =RC[-3]/100*RC[-1] -> 0.40
A922: 10 | B922: H7214/L-59 | C922: US ACU кепка мультикам (NYCO R/S) ||CZ-ACU-PR-14 | D922: 86 | E922: * | F922: 1 | G922: 190.00 | H922: 2.21 | I922: 152.00 | J922: 66.00 | K922: 5 | L922: =RC[-3]/100*RC[-1] -> 2.21
A923: 11 | B923: 40484-1 | C923: Балаклава чёрная вязаная | D923: 51 | E923: * | F923: 1 | G923: 94.00 | H923: 1.84 | I923: 94.00 | J923: 43.00 | K923: 5 | L923: =RC[-3]/100*RC[-1] -> 1.84
A924: 12 | B924: Паккуль-1 | C924: Паккуль беж. | D924: 120 | E924: * | F924: 1 | G924: 185.00 | H924: 1.54 | I924: 185.00 | J924: 65.00 | K924: 5 | L924: =RC[-3]/100*RC[-1] -> 1.54
A925: 13 | B925: A16661/L | C925: Шлем кевларовий б/у | D925: 3500 | E925: * | F925: 1 | G925: 5796.00 | H925: 1.66 | I925: 4926.60 | J925: 1426.60 | K925: 5 | L925: =RC[-3]/100*RC[-1] -> 1.66
A926: 14 | B926: H7811 | C926: Хустка SHEMAGH койот/чёрная ||CZ-ARF-CO-11 | D926: 72 | E926: * | F926: 1 | G926: 159.00 | H926: 2.21 | I926: 127.20 | J926: 55.20 | K926: 5 | L926: =RC[-3]/100*RC[-1] -> 2.21
A927: 15 | B927: H59141/LR | C927: CPU китель мультикамо (PolyCotton) ||BL-CPU-PR-14 | D927: 431 | E927: * | F927: 1 | G927: 949.00 | H927: 2.20 | I927: 759.20 | J927: 328.20 | K927: 5 | L927: =RC[-3]/100*RC[-1] -> 2.20
A928: 16 | B928: H5914/LR | C928: CPU штаны мультикамо (PolyCotton) ||SP-CPU-PR-14 | D928: 431 | E928: * | F928: 1 | G928: 949.00 | H928: 2.20 | I928: 759.20 | J928: 328.20 | K928: 5 | L928: =RC[-3]/100*RC[-1] -> 2.20
A929: 17 | B929: H3301/L | C929: Комплект термобілизни (95% полиэстер 5% спандекс) чёрный ||KP-UN2-PO-01/L | D929: 400 | E929: * | F929: 1 | G929: 880.00 | H929: 2.20 | I929: 704.00 | J929: 304.00 | K929: 5 | L929: =RC[-3]/100*RC[-1] -> 2.20
A930: 18 | B930: G4502/92-175 | C930: Комплект теплого нательного белья (100% полиэстер) олива | D930: 90 | E930: * | F930: 1 | G930: 250.00 | H930: 2.78 | I930: 200.00 | J930: 110.00 | K930: 5 | L930: =RC[-3]/100*RC[-1] -> 2.78
A931: 19 | B931: _608-0202/L | C931: Перчатки тактические олива (без палые) | D931: 345 | E931: * | F931: 1 | G931: 517.00 | H931: 1.50 | I931: 413.60 | J931: 68.60 | K931: 5 | L931: =RC[-3]/100*RC[-1] -> 1.50
A932: 20 | B932: X601 | C932: Шапка шерстяная камуфляжна | D932: 40 | E932: * | F932: 1 | G932: 120.00 | H932: 3.00 | I932: 120.00 | J932: 80.00 | K932: 5 | L932: =RC[-3]/100*RC[-1] -> 3.00
A933: 21 | B933: _TRC-029 | C933: Термос TRAMP 1,6 л | D933: 399 | E933: * | F933: 1 | G933: 559.00 | H933: 1.40 | I933: 559.00 | J933: 160.00 | K933: 5 | L933: =RC[-3]/100*RC[-1] -> 1.40 | M933: =SUM(R[-21]C[-1]:RC[-1]) -> 
A935: #11931 (2015-01-28) Магазин Верхнього одягу - Відправлено-Продано
A936: N | B936: арт | C936: назва | D936: закуп | F936: к-ть | G936: цiна | H936: кф | I936: продж | J936: дохiд | K936: % | L936: з-та
A937: 1 | B937: H2233/2XL | C937: Куртка GUNFIGHTER MP Camo||KU-GUN-FM-33 | D937: 1116 | E937: * | F937: 1 | G937: 2456.00 | H937: 2.20 | I937: 2210.40 | J937: 1094.40 | K937: 5 | L937: =RC[-3]/100*RC[-1] -> 2.20
A938: 2 | B938: H2033/XL | C938: Куртка LIBERTY флисовая MP Camo 390г/м (superfine) ||BL-LIB-HF-33 | D938: 621 | E938: * | F938: 1 | G938: 1365.00 | H938: 2.20 | I938: 1228.50 | J938: 607.50 | K938: 5 | L938: =RC[-3]/100*RC[-1] -> 2.20
A939: 3 | B939: H6101/41 | C939: Берцы FIELD CUIR WATERPROOF GK ||BU-FCW-LE-01 | D939: 1278 | E939: * | F939: 1 | G939: 2812.00 | H939: 2.20 | I939: 2812.00 | J939: 1534.00 | K939: 5 | L939: =RC[-3]/100*RC[-1] -> 2.20
A940: 4 | B940: R1284/42 | C940: Берци кожа чёрные утепленные Украина | D940: 1400 | E940: * | F940: 1 | G940: 2001.00 | H940: 1.43 | I940: 1600.80 | J940: 200.80 | K940: 5 | L940: =RC[-3]/100*RC[-1] -> 1.43
A941: 5 | B941: H2033/L | C941: Куртка LIBERTY флисовая MP Camo 390г/м (superfine) ||BL-LIB-HF-33 | D941: 621 | E941: * | F941: 1 | G941: 1365.00 | H941: 2.20 | I941: 1092.00 | J941: 471.00 | K941: 5 | L941: =RC[-3]/100*RC[-1] -> 2.20
A942: 6 | B942: H2033/M | C942: Куртка LIBERTY флисовая MP Camo 390г/м (superfine) ||BL-LIB-HF-33 | D942: 621 | E942: * | F942: 1 | G942: 1365.00 | H942: 2.20 | I942: 1365.00 | J942: 744.00 | K942: 5 | L942: =RC[-3]/100*RC[-1] -> 2.20
A943: 7 | B943: _10147/G/01 | C943: BW куртка флектарн б/у ||91010500 | D943: 80 | E943: * | F943: 1 | G943: 184.00 | H943: 2.30 | I943: 184.00 | J943: 104.00 | K943: 5 | L943: =RC[-3]/100*RC[-1] -> 2.30 | M943: =SUM(R[-7]C[-1]:RC[-1]) -> 
A945: #11932 (2015-01-28) Магазин туризму - Відправлено-Продано
A946: N | B946: арт | C946: назва | D946: закуп | F946: к-ть | G946: цiна | H946: кф | I946: продж | J946: дохiд | K946: % | L946: з-та
A947: 1 | B947: K12216-W | C947: Панель набедренная MOLLE вудлэнд [A.C.M] ||M51612216-WL | D947: 142 | E947: * | F947: 1 | G947: 313.00 | H947: 2.20 | I947: 313.00 | J947: 171.00 | K947: 5 | L947: =RC[-3]/100*RC[-1] -> 2.20
A948: 2 | B948: A19-190 | C948: Подсумок аптечка ACROPOLIS||ПМ-1 | D948: 100 | E948: * | F948: 1 | G948: 145.00 | H948: 1.45 | I948: 145.00 | J948: 45.00 | K948: 5 | L948: =RC[-3]/100*RC[-1] -> 1.45
A949: 3 | B949: K13048-F | C949: Кобура набедренная флектарн ||M51613048-GF | D949: 97 | E949: * | F949: 1 | G949: 223.00 | H949: 2.30 | I949: 223.00 | J949: 126.00 | K949: 5 | L949: =RC[-3]/100*RC[-1] -> 2.30
A950: 4 | B950: A19-201 | C950: Нагрудник олива ACROPOLIS ||РЗ-5 | D950: 1211 | E950: * | F950: 1 | G950: 1695.00 | H950: 1.40 | I950: 1610.25 | J950: 399.25 | K950: 5 | L950: =RC[-3]/100*RC[-1] -> 1.40 | M950: =SUM(R[-4]C[-1]:RC[-1]) -> 
A952: #11933 (2015-01-28) магазин Зброя - Відправлено-Продано
A953: N | B953: арт | C953: назва | D953: закуп | F953: к-ть | G953: цiна | H953: кф | I953: продж | J953: дохiд | K953: % | L953: з-та
A954: 1 | B954: _G616 | C954: Нож GANZO G616 | D954: 107 | E954: * | F954: 1 | G954: 177.00 | H954: 1.65 | I954: 177.00 | J954: 70.00 | K954: 5 | L954: =RC[-3]/100*RC[-1] -> 1.65
A955: 2 | B955: _N1090GH | C955: Нож Kershaw (копія) | D955: 157 | E955: * | F955: 1 | G955: 185.00 | H955: 1.18 | I955: 185.00 | J955: 28.00 | K955: 5 | L955: =RC[-3]/100*RC[-1] -> 1.18
A956: 3 | B956: _4.1687 | C956: Балон СО-2 UMAREX 12г | D956: 8 | E956: * | F956: 1 | G956: 12.00 | H956: 1.50 | I956: 12.00 | J956: 4.00 | K956: 5 | L956: =RC[-3]/100*RC[-1] -> 1.50
A957: 4 | B957: _G105 | C957: Мультитул GANZO G105 | D957: 262 | E957: * | F957: 1 | G957: 433.00 | H957: 1.65 | I957: 433.00 | J957: 171.00 | K957: 5 | L957: =RC[-3]/100*RC[-1] -> 1.65
A958: 5 | B958: _2002-10 | C958: Моноблок H=21mm-d=25.4 ласт.хв | D958: 80 | E958: * | F958: 1 | G958: 213.00 | H958: 2.66 | I958: 213.00 | J958: 133.00 | K958: 5 | L958: =RC[-3]/100*RC[-1] -> 2.66
A959: 6 | B959: _18396 | C959: Фонарик TOPEX | D959: 19 | E959: * | F959: 2 | G959: 38.00 | H959: 2.00 | I959: 76.00 | J959: 38.00 | K959: 5 | L959: =RC[-3]/100*RC[-1] -> 2.00
A960: 7 | B960: AA55 | C960: Батарейка DURACELL Turbo AA ||_80317 | D960: 7 | E960: * | F960: 2 | G960: 11.00 | H960: 1.57 | I960: 22.00 | J960: 8.00 | K960: 5 | L960: =RC[-3]/100*RC[-1] -> 1.57
A961: 8 | B961: _217-30 | C961: Фонарь Armytek Partner A1 LIMITED XM-L2 390/700lm | D961: 606 | E961: * | F961: 1 | G961: 909.00 | H961: 1.50 | I961: 818.10 | J961: 212.10 | K961: 5 | L961: =RC[-3]/100*RC[-1] -> 1.50
A962: 9 | B962: GF8817 | C962: Фонарик GRAND FIRE | D962: 22 | E962: * | F962: 1 | G962: 40.00 | H962: 1.82 | I962: 40.00 | J962: 18.00 | K962: 5 | L962: =RC[-3]/100*RC[-1] -> 1.82
A963: 10 | B963: _N602 | C963: Нож CENBER серый | D963: 53 | E963: * | F963: 1 | G963: 92.00 | H963: 1.74 | I963: 92.00 | J963: 39.00 | K963: 5 | L963: =RC[-3]/100*RC[-1] -> 1.74
A964: 11 | B964: _0537 | C964: Копії на дер. підставці | D964: 175 | E964: * | F964: 1 | G964: 233.00 | H964: 1.33 | I964: 198.05 | J964: 23.05 | K964: 5 | L964: =RC[-3]/100*RC[-1] -> 1.33
A965: 12 | B965: _7793 | C965: Револьвер под патрон Флобера САФАРІ РФ-461 (бук) | D965: 1714 | E965: * | F965: 1 | G965: 2854.00 | H965: 1.67 | I965: 2854.00 | J965: 1140.00 | K965: 5 | L965: =RC[-3]/100*RC[-1] -> 1.67
A966: 13 | B966: _429.00.02 | C966: Масло для чистки Clever BALLISTOL 50мл спрей | D966: 73 | E966: * | F966: 1 | G966: 120.00 | H966: 1.64 | I966: 120.00 | J966: 47.00 | K966: 5 | L966: =RC[-3]/100*RC[-1] -> 1.64
A967: 14 | B967: _898-9130 | C967: Набор для чистки оружия 4.5 мм | D967: 83 | E967: * | F967: 1 | G967: 137.00 | H967: 1.65 | I967: 137.00 | J967: 54.00 | K967: 5 | L967: =RC[-3]/100*RC[-1] -> 1.65
A968: 15 | B968: _1684 | C968: Патрон Флобера 4мм Нобель | D968: 4 | E968: * | F968: 25 | G968: 6.00 | H968: 1.50 | I968: 150.00 | J968: 50.00 | K968: 5 | L968: =RC[-3]/100*RC[-1] -> 1.50 | M968: =SUM(R[-15]C[-1]:RC[-1]) -> 