Sheet:  name
D1: Вхiднi данi | H1: Зкореговано
C2: Закуп: | D2: 5631802 | G2: грн
C3: Продано: | D3: 5164668 | G3: грн
C4: Дохiд-Коефiцiент: | D4: -467134(0.92)
C5: Процент з-ти: | D5: 0 | G5: %
C6: Нараховано з-ти: | D6: 0.00 | G6: грн | H6: =SUM(R[4]C[4]:R[1363]C[4]) -> 
B7: курси: Все 0 , грн 1 , usd 20 , euro 25 , zl 5 , Инт 20 ,
A9: #147 (2014-01-10) Акрополіс - Прихід товару
A10: N | B10: арт | C10: назва | D10: закуп | F10: к-ть | G10: цiна | H10: кф | I10: продж | J10: дохiд | K10: % | L10: з-та
A11: 1 | B11: A19-105 | C11: Карповий бокс ACROPOLIS ||КБ-2 | D11: 116.00 | E11: грн | F11: 2 | G11: 80.00 | H11: 0.69 | I11: 204.00 | J11: -28.00 | K11: 0 | L11: =RC[-3]/100*RC[-1] -> 0.69
A12: 2 | B12: A19-105 | C12: Карповий бокс ACROPOLIS ||КБ-2 | D12: 116.00 | E12: грн | F12: 1 | G12: 80.00 | H12: 0.69 | I12: 0.00 | J12: -116.00 | K12: 0 | L12: =RC[-3]/100*RC[-1] -> 0.69
A13: 3 | B13: A19-11 | C13: Кофр для вудочок жорсткий ACROPOLIS ||КВ-1 | D13: 495.00 | E13: грн | F13: 1 | G13: 460.62 | H13: 0.93 | I13: 783.05 | J13: 288.05 | K13: 0 | L13: =RC[-3]/100*RC[-1] -> 0.93
A14: 4 | B14: A19-11 | C14: Кофр для вудочок жорсткий ACROPOLIS ||КВ-1 | D14: 495.00 | E14: грн | F14: 1 | G14: 460.62 | H14: 0.93 | I14: 0.00 | J14: -495.00 | K14: 0 | L14: =RC[-3]/100*RC[-1] -> 0.93
A15: 5 | B15: A19-02 | C15: Відро рибальське ACROPOLIS (Д-40см) ||ВР-1б | D15: 38.00 | E15: грн | F15: 1 | G15: 30.60 | H15: 0.81 | I15: 52.02 | J15: 14.02 | K15: 0 | L15: =RC[-3]/100*RC[-1] -> 0.81
A16: 6 | B16: A19-02 | C16: Відро рибальське ACROPOLIS (Д-40см) ||ВР-1б | D16: 38.00 | E16: грн | F16: 1 | G16: 30.60 | H16: 0.81 | I16: 0.00 | J16: -38.00 | K16: 0 | L16: =RC[-3]/100*RC[-1] -> 0.81
A17: 7 | B17: A19-36 | C17: Стул для відпочинку ACROPOLIS ||СТ-1 | D17: 220.00 | E17: грн | F17: 1 | G17: 193.56 | H17: 0.88 | I17: 329.05 | J17: 109.05 | K17: 0 | L17: =RC[-3]/100*RC[-1] -> 0.88
A18: 8 | B18: A19-36 | C18: Стул для відпочинку ACROPOLIS ||СТ-1 | D18: 220.00 | E18: грн | F18: 1 | G18: 193.56 | H18: 0.88 | I18: 0.00 | J18: -220.00 | K18: 0 | L18: =RC[-3]/100*RC[-1] -> 0.88
A19: 9 | B19: A19-37 | C19: Стул для відпочинку ACROPOLIS ||СТ-1Ш | D19: 328.00 | E19: грн | F19: 1 | G19: 290.28 | H19: 0.89 | I19: 493.48 | J19: 165.48 | K19: 0 | L19: =RC[-3]/100*RC[-1] -> 0.89
A20: 10 | B20: A19-37 | C20: Стул для відпочинку ACROPOLIS ||СТ-1Ш | D20: 328.00 | E20: грн | F20: 1 | G20: 290.28 | H20: 0.89 | I20: 0.00 | J20: -328.00 | K20: 0 | L20: =RC[-3]/100*RC[-1] -> 0.89
A21: 11 | B21: A19-47 | C21: Футляр (L-120) ACROPOLIS ||ФЗ-8/30 | D21: 526.84 | E21: грн | F21: 2 | G21: 618.36 | H21: 1.17 | I21: 1576.82 | J21: 523.14 | K21: 0 | L21: =RC[-3]/100*RC[-1] -> 1.17
A22: 12 | B22: A19-47 | C22: Футляр (L-120) ACROPOLIS ||ФЗ-8/30 | D22: 526.84 | E22: грн | F22: 1 | G22: 618.36 | H22: 1.17 | I22: 0.00 | J22: -526.84 | K22: 0 | L22: =RC[-3]/100*RC[-1] -> 1.17
A23: 13 | B23: A19-121 | C23: Футляр для оружия ACROPOLIS ||ФЗ-11ан | D23: 564.00 | E23: грн | F23: 1 | G23: 513.12 | H23: 0.91 | I23: 872.30 | J23: 308.30 | K23: 0 | L23: =RC[-3]/100*RC[-1] -> 0.91
A24: 14 | B24: A19-121 | C24: Футляр для оружия ACROPOLIS ||ФЗ-11ан | D24: 564.00 | E24: грн | F24: 1 | G24: 513.12 | H24: 0.91 | I24: 0.00 | J24: -564.00 | K24: 0 | L24: =RC[-3]/100*RC[-1] -> 0.91
A25: 15 | B25: A19-49 | C25: Футляр для карабіна (L-110) ACROPOLIS ||ФЗ-11н | D25: 513.12 | E25: грн | F25: 1 | G25: 513.12 | H25: 1.00 | I25: 872.30 | J25: 359.18 | K25: 0 | L25: =RC[-3]/100*RC[-1] -> 1.00
A26: 16 | B26: A19-49 | C26: Футляр для карабіна (L-110) ACROPOLIS ||ФЗ-11н | D26: 513.12 | E26: грн | F26: 1 | G26: 513.12 | H26: 1.00 | I26: 0.00 | J26: -513.12 | K26: 0 | L26: =RC[-3]/100*RC[-1] -> 1.00
A27: 17 | B27: A19-122 | C27: Футляр для карабіна ACROPOLIS ||ФЗ-9а | D27: 561.00 | E27: грн | F27: 0 | G27: 447.72 | H27: 0.80 | I27: 380.56 | J27: 380.56 | K27: 0 | L27: =RC[-3]/100*RC[-1] -> 0.80
A28: 18 | B28: A19-122 | C28: Футляр для карабіна ACROPOLIS ||ФЗ-9а | D28: 561.00 | E28: грн | F28: 1 | G28: 447.72 | H28: 0.80 | I28: 0.00 | J28: -561.00 | K28: 0 | L28: =RC[-3]/100*RC[-1] -> 0.80
A29: 19 | B29: A19-59 | C29: Футляр для підводної рушниці ACROPOLIS ||ФПР-1 | D29: 210.00 | E29: грн | F29: 1 | G29: 210.00 | H29: 1.00 | I29: 357.00 | J29: 147.00 | K29: 0 | L29: =RC[-3]/100*RC[-1] -> 1.00
A30: 20 | B30: A19-59 | C30: Футляр для підводної рушниці ACROPOLIS ||ФПР-1 | D30: 210.00 | E30: грн | F30: 1 | G30: 210.00 | H30: 1.00 | I30: 0.00 | J30: -210.00 | K30: 0 | L30: =RC[-3]/100*RC[-1] -> 1.00
A31: 21 | B31: A19-117 | C31: Футляр для винтовки ACROPOLIS ||ФЗ-8б | D31: 461.00 | E31: грн | F31: 0 | G31: 448.20 | H31: 0.97 | I31: 380.97 | J31: 380.97 | K31: 0 | L31: =RC[-3]/100*RC[-1] -> 0.97
A32: 22 | B32: A19-117 | C32: Футляр для винтовки ACROPOLIS ||ФЗ-8б | D32: 461.00 | E32: грн | F32: 1 | G32: 448.20 | H32: 0.97 | I32: 0.00 | J32: -461.00 | K32: 0 | L32: =RC[-3]/100*RC[-1] -> 0.97
A33: 23 | B33: A19-78 | C33: Чохол для оружия (L-118) ACROPOLIS ||ЧДЗ-1 | D33: 136.00 | E33: грн | F33: 1 | G33: 96.48 | H33: 0.71 | I33: 164.02 | J33: 28.02 | K33: 0 | L33: =RC[-3]/100*RC[-1] -> 0.71
A34: 24 | B34: A19-78 | C34: Чохол для оружия (L-118) ACROPOLIS ||ЧДЗ-1 | D34: 136.00 | E34: грн | F34: 1 | G34: 96.48 | H34: 0.71 | I34: 0.00 | J34: -136.00 | K34: 0 | L34: =RC[-3]/100*RC[-1] -> 0.71
A35: 25 | B35: A19-79 | C35: Чохол для оружия (L-132) ACROPOLIS ||ЧДЗ-3 | D35: 112.00 | E35: грн | F35: 1 | G35: 96.48 | H35: 0.86 | I35: 164.02 | J35: 52.02 | K35: 0 | L35: =RC[-3]/100*RC[-1] -> 0.86
A36: 26 | B36: A19-79 | C36: Чохол для оружия (L-132) ACROPOLIS ||ЧДЗ-3 | D36: 112.00 | E36: грн | F36: 1 | G36: 96.48 | H36: 0.86 | I36: 0.00 | J36: -112.00 | K36: 0 | L36: =RC[-3]/100*RC[-1] -> 0.86
A37: 27 | B37: A19-85 | C37: Чохол на опт. приціл (L340-385) ACROPOLIS ||ЧОП-3 | D37: 38.00 | E37: грн | F37: 1 | G37: 35.04 | H37: 0.92 | I37: 59.57 | J37: 21.57 | K37: 0 | L37: =RC[-3]/100*RC[-1] -> 0.92
A38: 28 | B38: A19-85 | C38: Чохол на опт. приціл (L340-385) ACROPOLIS ||ЧОП-3 | D38: 38.00 | E38: грн | F38: 1 | G38: 35.04 | H38: 0.92 | I38: 0.00 | J38: -38.00 | K38: 0 | L38: =RC[-3]/100*RC[-1] -> 0.92
A39: 29 | B39: A19-41 | C39: Сумка рибальська ACROPOLIS ||РС-4 | D39: 220.44 | E39: грн | F39: 1 | G39: 200.40 | H39: 0.91 | I39: 340.68 | J39: 120.24 | K39: 0 | L39: =RC[-3]/100*RC[-1] -> 0.91
A40: 30 | B40: A19-41 | C40: Сумка рибальська ACROPOLIS ||РС-4 | D40: 220.44 | E40: грн | F40: 1 | G40: 200.40 | H40: 0.91 | I40: 0.00 | J40: -220.44 | K40: 0 | L40: =RC[-3]/100*RC[-1] -> 0.91 | M40: =SUM(R[-30]C[-1]:RC[-1]) -> 
A42: #243 (2014-01-14) Акрополіс - Прихід товару
A43: N | B43: арт | C43: назва | D43: закуп | F43: к-ть | G43: цiна | H43: кф | I43: продж | J43: дохiд | K43: % | L43: з-та
A44: 1 | B44: A19-140 | C44: Декоративна дошка для трофеїв ACROPOLIS ||ДТ-56 | D44: 450.00 | E44: грн | F44: 1 | G44: 529.08 | H44: 1.18 | I44: 449.72 | J44: -0.28 | K44: 0 | L44: =RC[-3]/100*RC[-1] -> 1.18
A45: 2 | B45: A19-141 | C45: Декоративна дошка для трофеїв ACROPOLIS ||ДТ-57 | D45: 450.50 | E45: грн | F45: 1 | G45: 529.08 | H45: 1.17 | I45: 449.72 | J45: -0.78 | K45: 0 | L45: =RC[-3]/100*RC[-1] -> 1.17
A46: 3 | B46: A19-163/34-32 | C46: Джинси с підтяжками зелёные ACROPOLIS ||ДПР-32/33 | D46: 537.48 | E46: грн | F46: 1 | G46: 537.48 | H46: 1.00 | I46: 456.86 | J46: -80.62 | K46: 0 | L46: =RC[-3]/100*RC[-1] -> 1.00
A47: 4 | B47: A19-142 | C47: Нож-скребок ACROPOLIS||НС-1 | D47: 136.86 | E47: грн | F47: 3 | G47: 136.86 | H47: 1.00 | I47: 348.99 | J47: -61.59 | K47: 0 | L47: =RC[-3]/100*RC[-1] -> 1.00
A48: 5 | B48: A19-144 | C48: Патронташ кожаный ACROPOLIS ||ПК-1 | D48: 260.00 | E48: грн | F48: 1 | G48: 254.82 | H48: 0.98 | I48: 216.60 | J48: -43.40 | K48: 0 | L48: =RC[-3]/100*RC[-1] -> 0.98
A49: 6 | B49: A19-143 | C49: Стакан металический маленький ACROPOLIS ||СХМ-1з | D49: 17.42 | E49: грн | F49: 2 | G49: 20.58 | H49: 1.18 | I49: 34.99 | J49: 0.15 | K49: 0 | L49: =RC[-3]/100*RC[-1] -> 1.18
A50: 7 | B50: A19-161 | C50: Сумка гігієнічна ACROPOLIS ||СГ-1 | D50: 31.50 | E50: грн | F50: 1 | G50: 37.44 | H50: 1.19 | I50: 31.82 | J50: 0.32 | K50: 0 | L50: =RC[-3]/100*RC[-1] -> 1.19
A51: 8 | B51: A19-146 | C51: Сумка охотничья ACROPOLIS ||РМ-5 | D51: 604.92 | E51: грн | F51: 1 | G51: 604.92 | H51: 1.00 | I51: 514.18 | J51: -90.74 | K51: 0 | L51: =RC[-3]/100*RC[-1] -> 1.00
A52: 9 | B52: A19-172 | C52: Сумка рибальська карпова ACROPOLIS ||РСК-1 | D52: 458.85 | E52: грн | F52: 1 | G52: 458.85 | H52: 1.00 | I52: 458.85 | J52: 0.00 | K52: 0 | L52: =RC[-3]/100*RC[-1] -> 1.00
A53: 10 | B53: A19-145 | C53: Фуляр на патрони ACROPOLIS ||ПП-2 | D53: 254.00 | E53: грн | F53: 2 | G53: 246.66 | H53: 0.97 | I53: 419.32 | J53: -88.68 | K53: 0 | L53: =RC[-3]/100*RC[-1] -> 0.97
A54: 11 | B54: A19-147 | C54: Футляр для вудочок ACROPOLIS ||КВ-5а | D54: 37.40 | E54: грн | F54: 1 | G54: 44.04 | H54: 1.18 | I54: 37.43 | J54: 0.03 | K54: 0 | L54: =RC[-3]/100*RC[-1] -> 1.18
A55: 12 | B55: A19-148 | C55: Футляр для вудочок ACROPOLIS ||КВ-5б | D55: 48.00 | E55: грн | F55: 1 | G55: 44.04 | H55: 0.92 | I55: 37.43 | J55: -10.57 | K55: 0 | L55: =RC[-3]/100*RC[-1] -> 0.92
A56: 13 | B56: A19-171 | C56: Футляр для удилищ ACROPOLIS ||КВ-7бн | D56: 513.00 | E56: грн | F56: 1 | G56: 602.52 | H56: 1.17 | I56: 512.14 | J56: -0.86 | K56: 0 | L56: =RC[-3]/100*RC[-1] -> 1.17
A57: 14 | B57: A19-52 | C57: Футляр для котушок ACROPOLIS ||ФБК-2а | D57: 24.18 | E57: грн | F57: 1 | G57: 24.18 | H57: 1.00 | I57: 20.55 | J57: -3.63 | K57: 0 | L57: =RC[-3]/100*RC[-1] -> 1.00
A58: 15 | B58: A19-53 | C58: Футляр для котушок ACROPOLIS ||ФБК-3а | D58: 23.00 | E58: грн | F58: 1 | G58: 21.72 | H58: 0.94 | I58: 18.46 | J58: -4.54 | K58: 0 | L58: =RC[-3]/100*RC[-1] -> 0.94
A59: 16 | B59: A19-51 | C59: Футляр для котушок ACROPOLIS||ФБК-1а | D59: 26.10 | E59: грн | F59: 1 | G59: 25.38 | H59: 0.97 | I59: 21.57 | J59: -4.53 | K59: 0 | L59: =RC[-3]/100*RC[-1] -> 0.97
A60: 17 | B60: A19-150 | C60: Чехол для двигателя ACROPOLIS ||ЧДД-1 | D60: 187.00 | E60: грн | F60: 1 | G60: 220.14 | H60: 1.18 | I60: 187.12 | J60: 0.12 | K60: 0 | L60: =RC[-3]/100*RC[-1] -> 1.18
A61: 18 | B61: A19-151 | C61: Чохол для двигателя ACROPOLIS ||ЧДД-2 | D61: 230.35 | E61: грн | F61: 1 | G61: 271.68 | H61: 1.18 | I61: 230.93 | J61: 0.58 | K61: 0 | L61: =RC[-3]/100*RC[-1] -> 1.18
A62: 19 | B62: A19-152 | C62: Чохол для льодобура ACROPOLIS ||ЧДЛ-1 | D62: 45.18 | E62: грн | F62: 1 | G62: 45.18 | H62: 1.00 | I62: 38.40 | J62: -6.78 | K62: 0 | L62: =RC[-3]/100*RC[-1] -> 1.00
A63: 20 | B63: A19-156 | C63: Чохол для льодобура ACROPOLIS ||ЧДЛ-11 | D63: 61.32 | E63: грн | F63: 1 | G63: 61.32 | H63: 1.00 | I63: 52.12 | J63: -9.20 | K63: 0 | L63: =RC[-3]/100*RC[-1] -> 1.00
A64: 21 | B64: A19-153 | C64: Чохол для льодобура ACROPOLIS ||ЧДЛ-2 | D64: 57.12 | E64: грн | F64: 1 | G64: 51.90 | H64: 0.91 | I64: 44.12 | J64: -13.00 | K64: 0 | L64: =RC[-3]/100*RC[-1] -> 0.91
A65: 22 | B65: A19-154 | C65: Чохол для льодобура ACROPOLIS ||ЧДЛ-3 | D65: 88.08 | E65: грн | F65: 1 | G65: 88.08 | H65: 1.00 | I65: 74.87 | J65: -13.21 | K65: 0 | L65: =RC[-3]/100*RC[-1] -> 1.00
A66: 23 | B66: A19-155 | C66: Чохол для льодобура ACROPOLIS ||ЧДЛ-6 | D66: 88.68 | E66: грн | F66: 1 | G66: 88.68 | H66: 1.00 | I66: 75.38 | J66: -13.30 | K66: 0 | L66: =RC[-3]/100*RC[-1] -> 1.00
A67: 24 | B67: A19-168/27-29 | C67: Носки охотничьи ACROPOLIS ||ШКМ-1/27-29 | D67: 15.00 | E67: грн | F67: 2 | G67: 15.00 | H67: 1.00 | I67: 25.50 | J67: -4.50 | K67: 0 | L67: =RC[-3]/100*RC[-1] -> 1.00
A68: 25 | B68: A19-169/25-27 | C68: Носки охотничьи зимние ACROPOLIS ||ШКМ-2/25-27 | D68: 21.42 | E68: грн | F68: 2 | G68: 21.42 | H68: 1.00 | I68: 36.41 | J68: -6.43 | K68: 0 | L68: =RC[-3]/100*RC[-1] -> 1.00
A69: 26 | B69: A19-164/25-27 | C69: Носки-гольфи ACROPOLIS ||ШКМ-3/25-27 | D69: 29.52 | E69: грн | F69: 2 | G69: 29.52 | H69: 1.00 | I69: 50.18 | J69: -8.86 | K69: 0 | L69: =RC[-3]/100*RC[-1] -> 1.00
A70: 27 | B70: A19-164/27-29 | C70: Носки-гольфи ACROPOLIS ||ШКМ-3/27-29 | D70: 29.52 | E70: грн | F70: 2 | G70: 29.52 | H70: 1.00 | I70: 50.18 | J70: -8.86 | K70: 0 | L70: =RC[-3]/100*RC[-1] -> 1.00
A71: 28 | B71: A19-164/29-31 | C71: Носки-гольфи ACROPOLIS ||ШКМ-3/29-31 | D71: 29.52 | E71: грн | F71: 2 | G71: 29.52 | H71: 1.00 | I71: 50.18 | J71: -8.86 | K71: 0 | L71: =RC[-3]/100*RC[-1] -> 1.00
A72: 29 | B72: A19-164/31-33 | C72: Носки-гольфи ACROPOLIS ||ШКМ-3/31-33 | D72: 29.52 | E72: грн | F72: 2 | G72: 29.52 | H72: 1.00 | I72: 50.18 | J72: -8.86 | K72: 0 | L72: =RC[-3]/100*RC[-1] -> 1.00
A73: 30 | B73: A19-81 | C73: Чохол для шпуль ACROPOLIS ||ЧШ-1 | D73: 19.55 | E73: грн | F73: 1 | G73: 22.32 | H73: 1.14 | I73: 18.97 | J73: -0.58 | K73: 0 | L73: =RC[-3]/100*RC[-1] -> 1.14
A74: 31 | B74: A19-76 | C74: Футляр сумка жорсткий ACROPOLIS ||ФБК-4 | D74: 60.00 | E74: грн | F74: 1 | G74: 55.44 | H74: 0.92 | I74: 47.12 | J74: -12.88 | K74: 0 | L74: =RC[-3]/100*RC[-1] -> 0.92 | M74: =SUM(R[-31]C[-1]:RC[-1]) -> 
A76: #342 (2014-01-16) Акрополіс - Прихід товару
A77: N | B77: арт | C77: назва | D77: закуп | F77: к-ть | G77: цiна | H77: кф | I77: продж | J77: дохiд | K77: % | L77: з-та
A78: 1 | B78: A19-137 | C78: Охотничий ремень ACROPOLIS ||МР-7 | D78: 118.15 | E78: грн | F78: 1 | G78: 113.28 | H78: 0.96 | I78: 0.00 | J78: -118.15 | K78: 0 | L78: =RC[-3]/100*RC[-1] -> 0.96
A79: 2 | B79: A19-21 | C79: Охотничий рюкзак ACROPOLIS ||РМ-2 | D79: 576.00 | E79: грн | F79: 1 | G79: 528.48 | H79: 0.92 | I79: 898.42 | J79: 322.42 | K79: 0 | L79: =RC[-3]/100*RC[-1] -> 0.92
A80: 3 | B80: A19-21 | C80: Охотничий рюкзак ACROPOLIS ||РМ-2 | D80: 576.00 | E80: грн | F80: 1 | G80: 528.48 | H80: 0.92 | I80: 0.00 | J80: -576.00 | K80: 0 | L80: =RC[-3]/100*RC[-1] -> 0.92
A81: 4 | B81: A19-173/XXL | C81: Пуловер охотничий ACROPOLIS ||ОПМ/XXL | D81: 153.00 | E81: грн | F81: 1 | G81: 178.08 | H81: 1.16 | I81: 302.74 | J81: 149.74 | K81: 0 | L81: =RC[-3]/100*RC[-1] -> 1.16
A82: 5 | B82: A19-173/XXL | C82: Пуловер охотничий ACROPOLIS ||ОПМ/XXL | D82: 153.00 | E82: грн | F82: 1 | G82: 178.08 | H82: 1.16 | I82: 0.00 | J82: -153.00 | K82: 0 | L82: =RC[-3]/100*RC[-1] -> 1.16
A83: 6 | B83: A19-172 | C83: Сумка рибальська карпова ACROPOLIS ||РСК-1 | D83: 458.85 | E83: грн | F83: 1 | G83: 458.85 | H83: 1.00 | I83: 0.00 | J83: -458.85 | K83: 0 | L83: =RC[-3]/100*RC[-1] -> 1.00
A84: 7 | B84: A19-172 | C84: Сумка рибальська карпова ACROPOLIS ||РСК-1 | D84: 458.85 | E84: грн | F84: 1 | G84: 458.85 | H84: 1.00 | I84: 780.05 | J84: 321.20 | K84: 0 | L84: =RC[-3]/100*RC[-1] -> 1.00
A85: 8 | B85: A19-174/XL | C85: Футболка охотничья ACROPOLIS ||ОФМ/XL | D85: 55.28 | E85: грн | F85: 1 | G85: 65.04 | H85: 1.18 | I85: 55.28 | J85: 0.00 | K85: 0 | L85: =RC[-3]/100*RC[-1] -> 1.18
A86: 9 | B86: A19-174/L | C86: Футболка охотничья ACROPOLIS ||ОФМ/L | D86: 55.25 | E86: грн | F86: 1 | G86: 65.04 | H86: 1.18 | I86: 55.28 | J86: 0.03 | K86: 0 | L86: =RC[-3]/100*RC[-1] -> 1.18
A87: 10 | B87: A19-174/XXL | C87: Футболка охотничья ACROPOLIS ||ОФМ/XXL | D87: 65.04 | E87: грн | F87: 1 | G87: 65.04 | H87: 1.00 | I87: 55.28 | J87: -9.76 | K87: 0 | L87: =RC[-3]/100*RC[-1] -> 1.00
A88: 11 | B88: A19-175/XXL | C88: Худі охотничьи ACROPOLIS ||ОХМ/XXL | D88: 237.00 | E88: грн | F88: 1 | G88: 237.00 | H88: 1.00 | I88: 201.45 | J88: -35.55 | K88: 0 | L88: =RC[-3]/100*RC[-1] -> 1.00
A89: 12 | B89: A19-128 | C89: Чохол для оружия ACROPOLIS ||ЧДЗ-4 | D89: 106.00 | E89: грн | F89: 1 | G89: 96.48 | H89: 0.91 | I89: 0.00 | J89: -106.00 | K89: 0 | L89: =RC[-3]/100*RC[-1] -> 0.91
A90: 13 | B90: A19-128 | C90: Чохол для оружия ACROPOLIS ||ЧДЗ-4 | D90: 106.00 | E90: грн | F90: 1 | G90: 96.48 | H90: 0.91 | I90: 164.02 | J90: 58.02 | K90: 0 | L90: =RC[-3]/100*RC[-1] -> 0.91
A91: 14 | B91: A19-137 | C91: Охотничий ремень ACROPOLIS ||МР-7 | D91: 118.15 | E91: грн | F91: 1 | G91: 113.28 | H91: 0.96 | I91: 192.58 | J91: 74.43 | K91: 0 | L91: =RC[-3]/100*RC[-1] -> 0.96 | M91: =SUM(R[-14]C[-1]:RC[-1]) -> 
A93: #545 (2014-01-23) Назаренко Андрей Сергеевич - Прихід товару
A94: N | B94: арт | C94: назва | D94: закуп | F94: к-ть | G94: цiна | H94: кф | I94: продж | J94: дохiд | K94: % | L94: з-та
A95: 1 | B95: _18791R | C95: Бинт медичний в гермітичній упаковке CPCP | D95: 10.00 | E95: грн | F95: 19 | G95: 16.00 | H95: 1.60 | I95: 304.00 | J95: 114.00 | K95: 0 | L95: =RC[-3]/100*RC[-1] -> 1.60
A96: 2 | B96: R0415 | C96: Тарелка алюминиевая глубокая СССР | D96: 1.28 | E96: Инт | F96: 49 | G96: 24.00 | H96: 0.94 | I96: 1200.00 | J96: -54.40 | K96: 0 | L96: =RC[-3]/100*RC[-1] -> 0.94
A97: 3 | B97: R0415 | C97: Тарелка алюминиевая глубокая СССР | D97: 1.28 | E97: Инт | F97: 1 | G97: 24.00 | H97: 0.94 | I97: 0.00 | J97: -25.60 | K97: 0 | L97: =RC[-3]/100*RC[-1] -> 0.94
A98: 4 | B98: R04151 | C98: Тарелка алюминиевая мілка СССР | D98: 1.12 | E98: Инт | F98: 50 | G98: 24.00 | H98: 1.07 | I98: 1200.00 | J98: 80.00 | K98: 0 | L98: =RC[-3]/100*RC[-1] -> 1.07 | M98: =SUM(R[-4]C[-1]:RC[-1]) -> 
A100: #590 (2014-01-24) Radioprofi - Прихід товару
A101: N | B101: арт | C101: назва | D101: закуп | F101: к-ть | G101: цiна | H101: кф | I101: продж | J101: дохiд | K101: % | L101: з-та
A102: 1 | B102: _26-0691 | C102: Рация QUANSHENG TG-6A FM-radio, 400-470 МГц, 5Вт, 1500mAp Li-ion | D102: 63.00 | E102: usd | F102: 10 | G102: 780.00 | H102: 0.62 | I102: 7800.00 | J102: -4800.00 | K102: 0 | L102: =RC[-3]/100*RC[-1] -> 0.62
A103: 2 | B103: 26-0710 | C103: Рация VOYAGER AirSoft (136-174 / 400-470)МГц, 5Вт,2200mAp Li-ion (+гарнітура) | D103: 85.00 | E103: usd | F103: 10 | G103: 650.00 | H103: 0.38 | I103: 6500.00 | J103: -10500.00 | K103: 0 | L103: =RC[-3]/100*RC[-1] -> 0.38
A104: 3 | B104: 26-0714 | C104: Рация VOYAGER CTCSS/DCS PMR+ 2Вт,1500mAp Li-ion + гірнітура | D104: 27.00 | E104: usd | F104: 4 | G104: 330.00 | H104: 0.61 | I104: 1320.00 | J104: -840.00 | K104: 0 | L104: =RC[-3]/100*RC[-1] -> 0.61
A105: 4 | B105: 26-0716 | C105: Рация VOYAGER UF-Q7 5W 400-480,1800mAp Li-ion водостійка | D105: 60.00 | E105: usd | F105: 10 | G105: 780.00 | H105: 0.65 | I105: 7800.00 | J105: -4200.00 | K105: 0 | L105: =RC[-3]/100*RC[-1] -> 0.65
A106: 5 | B106: H7904 | C106: Шапка флисовая пол.вудлэнд ||CZ-DOK-FL-04 | D106: 3.00 | E106: usd | F106: 150 | G106: 65.00 | H106: 1.08 | I106: 9750.00 | J106: 750.00 | K106: 0 | L106: =RC[-3]/100*RC[-1] -> 1.08
A107: 6 | B107: H7904 | C107: Шапка флисовая пол.вудлэнд ||CZ-DOK-FL-04 | D107: 3.00 | E107: usd | F107: 50 | G107: 65.00 | H107: 1.08 | I107: 3250.00 | J107: 250.00 | K107: 0 | L107: =RC[-3]/100*RC[-1] -> 1.08
A108: 7 | B108: _13564/B | C108: BW карабін алюминиевый | D108: 3.00 | E108: usd | F108: 1 | G108: 67.00 | H108: 1.12 | I108: 67.00 | J108: 7.00 | K108: 0 | L108: =RC[-3]/100*RC[-1] -> 1.12 | M108: =SUM(R[-7]C[-1]:RC[-1]) -> 
A110: #688 (2014-01-27) Назаренко Андрей Сергеевич - Прихід товару
A111: N | B111: арт | C111: назва | D111: закуп | F111: к-ть | G111: цiна | H111: кф | I111: продж | J111: дохiд | K111: % | L111: з-та
A112: 1 | B112: Г-6Б3 | C112: Бронежилет 6Б3 оригинал с екранами и монтаж. пластинами | D112: 350.00 | E112: грн | F112: 4 | G112: 660.00 | H112: 1.89 | I112: 2640.00 | J112: 1240.00 | K112: 0 | L112: =RC[-3]/100*RC[-1] -> 1.89
A113: 2 | B113: Г-6Б5 | C113: Бронежилет 6Б5 оригинал с екранами и монтаж. пластинами | D113: 500.00 | E113: грн | F113: 14 | G113: 850.00 | H113: 1.70 | I113: 11900.00 | J113: 4900.00 | K113: 0 | L113: =RC[-3]/100*RC[-1] -> 1.70
A114: 3 | B114: _166817/G | C114: Рос. шлем СШ-60 | D114: 50.00 | E114: usd | F114: 40 | G114: 100.00 | H114: 0.10 | I114: 4000.00 | J114: -36000.00 | K114: 0 | L114: =RC[-3]/100*RC[-1] -> 0.10
A115: 4 | B115: R17074 | C115: Комплект захисту наколенники | D115: 350.00 | E115: zl | F115: 2 | G115: 700.00 | H115: 0.40 | I115: 1400.00 | J115: -2100.00 | K115: 0 | L115: =RC[-3]/100*RC[-1] -> 0.40 | M115: =SUM(R[-4]C[-1]:RC[-1]) -> 
A117: #701 (2014-01-27) зі сторони - Прихід товару
A118: N | B118: арт | C118: назва | D118: закуп | F118: к-ть | G118: цiна | H118: кф | I118: продж | J118: дохiд | K118: % | L118: з-та
A119: 1 | B119: _166817/G | C119: Рос. шлем СШ-60 | D119: 50.00 | E119: usd | F119: 13 | G119: 80.00 | H119: 0.08 | I119: 1040.00 | J119: -11960.00 | K119: 0 | L119: =RC[-3]/100*RC[-1] -> 0.08 | M119: =SUM(R[-1]C[-1]:RC[-1]) -> 
A121: #747 (2014-01-28) зі сторони - Прихід товару
A122: N | B122: арт | C122: назва | D122: закуп | F122: к-ть | G122: цiна | H122: кф | I122: продж | J122: дохiд | K122: % | L122: з-та
A123: 1 | B123: K5-1176 | C123: Магазин страйкбольный механический к MP5 G-55 (Green Gas) | D123: 19.00 | E123: usd | F123: 4 | G123: 320.00 | H123: 0.84 | I123: 1280.00 | J123: -240.00 | K123: 0 | L123: =RC[-3]/100*RC[-1] -> 0.84 | M123: =SUM(R[-1]C[-1]:RC[-1]) -> 
A125: #797 (2014-01-29) зі сторони - Прихід товару
A126: N | B126: арт | C126: назва | D126: закуп | F126: к-ть | G126: цiна | H126: кф | I126: продж | J126: дохiд | K126: % | L126: з-та
A127: 1 | B127: _LBB90 | C127: Фонарик-бита BAILONG 200W (3xAAA, 18650) | D127: 25.00 | E127: Инт | F127: 4 | G127: 200.00 | H127: 0.40 | I127: 800.00 | J127: -1200.00 | K127: 0 | L127: =RC[-3]/100*RC[-1] -> 0.40
A128: 2 | B128: _LBB90 | C128: Фонарик-бита BAILONG 200W (3xAAA, 18650) | D128: 25.00 | E128: Инт | F128: 1 | G128: 200.00 | H128: 0.40 | I128: 200.00 | J128: -300.00 | K128: 0 | L128: =RC[-3]/100*RC[-1] -> 0.40 | M128: =SUM(R[-2]C[-1]:RC[-1]) -> 
A130: #811 (2014-01-29) Гелікон Helikon-Tex Геликон - Прихід товару
A131: N | B131: арт | C131: назва | D131: закуп | F131: к-ть | G131: цiна | H131: кф | I131: продж | J131: дохiд | K131: % | L131: з-та
A132: 1 | B132: H5940/LL | C132: CPU штаны A-TACS AU (PolyCotton) ||SP-CPU-PR-40 | D132: 32.12 | E132: usd | F132: 20 | G132: 32.12 | H132: 0.05 | I132: 642.40 | J132: -12205.60 | K132: 0 | L132: =RC[-3]/100*RC[-1] -> 0.05
A133: 2 | B133: H5940/LR | C133: CPU штаны A-TACS AU (PolyCotton) ||SP-CPU-PR-40 | D133: 32.12 | E133: usd | F133: 20 | G133: 32.12 | H133: 0.05 | I133: 642.40 | J133: -12205.60 | K133: 0 | L133: =RC[-3]/100*RC[-1] -> 0.05
A134: 3 | B134: H5940/LR | C134: CPU штаны A-TACS AU (PolyCotton) ||SP-CPU-PR-40 | D134: 32.12 | E134: usd | F134: 20 | G134: 32.12 | H134: 0.05 | I134: 642.40 | J134: -12205.60 | K134: 0 | L134: =RC[-3]/100*RC[-1] -> 0.05
A135: 4 | B135: H5940/ML | C135: CPU штаны A-TACS AU (PolyCotton) ||SP-CPU-PR-40 | D135: 32.12 | E135: usd | F135: 20 | G135: 32.12 | H135: 0.05 | I135: 642.40 | J135: -12205.60 | K135: 0 | L135: =RC[-3]/100*RC[-1] -> 0.05
A136: 5 | B136: H5940/MR | C136: CPU штаны A-TACS AU (PolyCotton) ||SP-CPU-PR-40 | D136: 32.12 | E136: usd | F136: 20 | G136: 32.12 | H136: 0.05 | I136: 642.40 | J136: -12205.60 | K136: 0 | L136: =RC[-3]/100*RC[-1] -> 0.05
A137: 6 | B137: H5940/MR | C137: CPU штаны A-TACS AU (PolyCotton) ||SP-CPU-PR-40 | D137: 32.12 | E137: usd | F137: 20 | G137: 32.12 | H137: 0.05 | I137: 642.40 | J137: -12205.60 | K137: 0 | L137: =RC[-3]/100*RC[-1] -> 0.05
A138: 7 | B138: H5940/SL | C138: CPU штаны A-TACS AU (PolyCotton) ||SP-CPU-PR-40 | D138: 32.12 | E138: usd | F138: 10 | G138: 32.12 | H138: 0.05 | I138: 321.20 | J138: -6102.80 | K138: 0 | L138: =RC[-3]/100*RC[-1] -> 0.05
A139: 8 | B139: H5940/SR | C139: CPU штаны A-TACS AU (PolyCotton) ||SP-CPU-PR-40 | D139: 32.12 | E139: usd | F139: 20 | G139: 32.12 | H139: 0.05 | I139: 642.40 | J139: -12205.60 | K139: 0 | L139: =RC[-3]/100*RC[-1] -> 0.05
A140: 9 | B140: H5940/XLL | C140: CPU штаны A-TACS AU (PolyCotton) ||SP-CPU-PR-40 | D140: 32.12 | E140: usd | F140: 20 | G140: 32.12 | H140: 0.05 | I140: 642.40 | J140: -12205.60 | K140: 0 | L140: =RC[-3]/100*RC[-1] -> 0.05
A141: 10 | B141: H5940/XLR | C141: CPU штаны A-TACS AU (PolyCotton) ||SP-CPU-PR-40 | D141: 32.12 | E141: usd | F141: 20 | G141: 32.12 | H141: 0.05 | I141: 642.40 | J141: -12205.60 | K141: 0 | L141: =RC[-3]/100*RC[-1] -> 0.05
A142: 11 | B142: H5940/XLR | C142: CPU штаны A-TACS AU (PolyCotton) ||SP-CPU-PR-40 | D142: 32.12 | E142: usd | F142: 20 | G142: 32.12 | H142: 0.05 | I142: 642.40 | J142: -12205.60 | K142: 0 | L142: =RC[-3]/100*RC[-1] -> 0.05
A143: 12 | B143: H5940/XXLR | C143: CPU штаны A-TACS AU (PolyCotton) ||SP-CPU-PR-40 | D143: 32.12 | E143: usd | F143: 20 | G143: 32.12 | H143: 0.05 | I143: 642.40 | J143: -12205.60 | K143: 0 | L143: =RC[-3]/100*RC[-1] -> 0.05
A144: 13 | B144: H5939/LL | C144: CPU штаны A-TACS FG (PolyCotton) ||SP-CPU-PR-39 | D144: 32.12 | E144: usd | F144: 20 | G144: 32.12 | H144: 0.05 | I144: 642.40 | J144: -12205.60 | K144: 0 | L144: =RC[-3]/100*RC[-1] -> 0.05
A145: 14 | B145: H5939/LR | C145: CPU штаны A-TACS FG (PolyCotton) ||SP-CPU-PR-39 | D145: 32.12 | E145: usd | F145: 20 | G145: 32.12 | H145: 0.05 | I145: 642.40 | J145: -12205.60 | K145: 0 | L145: =RC[-3]/100*RC[-1] -> 0.05
A146: 15 | B146: H5939/LR | C146: CPU штаны A-TACS FG (PolyCotton) ||SP-CPU-PR-39 | D146: 32.12 | E146: usd | F146: 20 | G146: 32.12 | H146: 0.05 | I146: 642.40 | J146: -12205.60 | K146: 0 | L146: =RC[-3]/100*RC[-1] -> 0.05
A147: 16 | B147: H5939/ML | C147: CPU штаны A-TACS FG (PolyCotton) ||SP-CPU-PR-39 | D147: 32.12 | E147: usd | F147: 8 | G147: 32.12 | H147: 0.05 | I147: 256.96 | J147: -4882.24 | K147: 0 | L147: =RC[-3]/100*RC[-1] -> 0.05
A148: 17 | B148: H5939/MR | C148: CPU штаны A-TACS FG (PolyCotton) ||SP-CPU-PR-39 | D148: 32.12 | E148: usd | F148: 20 | G148: 32.12 | H148: 0.05 | I148: 642.40 | J148: -12205.60 | K148: 0 | L148: =RC[-3]/100*RC[-1] -> 0.05
A149: 18 | B149: H5939/MR | C149: CPU штаны A-TACS FG (PolyCotton) ||SP-CPU-PR-39 | D149: 32.12 | E149: usd | F149: 20 | G149: 32.12 | H149: 0.05 | I149: 642.40 | J149: -12205.60 | K149: 0 | L149: =RC[-3]/100*RC[-1] -> 0.05
A150: 19 | B150: H5939/SR | C150: CPU штаны A-TACS FG (PolyCotton) ||SP-CPU-PR-39 | D150: 32.12 | E150: usd | F150: 20 | G150: 32.12 | H150: 0.05 | I150: 642.40 | J150: -12205.60 | K150: 0 | L150: =RC[-3]/100*RC[-1] -> 0.05
A151: 20 | B151: H5939/XLL | C151: CPU штаны A-TACS FG (PolyCotton) ||SP-CPU-PR-39 | D151: 32.12 | E151: usd | F151: 10 | G151: 32.12 | H151: 0.05 | I151: 321.20 | J151: -6102.80 | K151: 0 | L151: =RC[-3]/100*RC[-1] -> 0.05
A152: 21 | B152: H5939/XLR | C152: CPU штаны A-TACS FG (PolyCotton) ||SP-CPU-PR-39 | D152: 32.12 | E152: usd | F152: 16 | G152: 32.12 | H152: 0.05 | I152: 513.92 | J152: -9764.48 | K152: 0 | L152: =RC[-3]/100*RC[-1] -> 0.05
A153: 22 | B153: H5939/XLR | C153: CPU штаны A-TACS FG (PolyCotton) ||SP-CPU-PR-39 | D153: 32.12 | E153: usd | F153: 10 | G153: 32.12 | H153: 0.05 | I153: 321.20 | J153: -6102.80 | K153: 0 | L153: =RC[-3]/100*RC[-1] -> 0.05
A154: 23 | B154: H5939/XXLR | C154: CPU штаны A-TACS FG (PolyCotton) ||SP-CPU-PR-39 | D154: 32.12 | E154: usd | F154: 4 | G154: 32.12 | H154: 0.05 | I154: 128.48 | J154: -2441.12 | K154: 0 | L154: =RC[-3]/100*RC[-1] -> 0.05
A155: 24 | B155: H5941/LL | C155: CPU штаны PenCott GreenZone (PolyCotton) ||SP-CPU-NR-41 | D155: 36.35 | E155: usd | F155: 20 | G155: 36.35 | H155: 0.05 | I155: 727.00 | J155: -13813.00 | K155: 0 | L155: =RC[-3]/100*RC[-1] -> 0.05
A156: 25 | B156: H5941/LR | C156: CPU штаны PenCott GreenZone (PolyCotton) ||SP-CPU-NR-41 | D156: 36.35 | E156: usd | F156: 20 | G156: 36.35 | H156: 0.05 | I156: 727.00 | J156: -13813.00 | K156: 0 | L156: =RC[-3]/100*RC[-1] -> 0.05
A157: 26 | B157: H5941/LR | C157: CPU штаны PenCott GreenZone (PolyCotton) ||SP-CPU-NR-41 | D157: 36.35 | E157: usd | F157: 20 | G157: 36.35 | H157: 0.05 | I157: 727.00 | J157: -13813.00 | K157: 0 | L157: =RC[-3]/100*RC[-1] -> 0.05
A158: 27 | B158: H5941/ML | C158: CPU штаны PenCott GreenZone (PolyCotton) ||SP-CPU-NR-41 | D158: 36.35 | E158: usd | F158: 20 | G158: 36.35 | H158: 0.05 | I158: 727.00 | J158: -13813.00 | K158: 0 | L158: =RC[-3]/100*RC[-1] -> 0.05
A159: 28 | B159: H5941/MR | C159: CPU штаны PenCott GreenZone (PolyCotton) ||SP-CPU-NR-41 | D159: 36.35 | E159: usd | F159: 20 | G159: 36.35 | H159: 0.05 | I159: 727.00 | J159: -13813.00 | K159: 0 | L159: =RC[-3]/100*RC[-1] -> 0.05
A160: 29 | B160: H5941/MR | C160: CPU штаны PenCott GreenZone (PolyCotton) ||SP-CPU-NR-41 | D160: 36.35 | E160: usd | F160: 20 | G160: 36.35 | H160: 0.05 | I160: 727.00 | J160: -13813.00 | K160: 0 | L160: =RC[-3]/100*RC[-1] -> 0.05
A161: 30 | B161: H5941/SL | C161: CPU штаны PenCott GreenZone (PolyCotton) ||SP-CPU-NR-41 | D161: 36.35 | E161: usd | F161: 9 | G161: 36.35 | H161: 0.05 | I161: 327.15 | J161: -6215.85 | K161: 0 | L161: =RC[-3]/100*RC[-1] -> 0.05
A162: 31 | B162: H5941/SR | C162: CPU штаны PenCott GreenZone (PolyCotton) ||SP-CPU-NR-41 | D162: 36.35 | E162: usd | F162: 16 | G162: 36.35 | H162: 0.05 | I162: 581.60 | J162: -11050.40 | K162: 0 | L162: =RC[-3]/100*RC[-1] -> 0.05
A163: 32 | B163: H5941/XLR | C163: CPU штаны PenCott GreenZone (PolyCotton) ||SP-CPU-NR-41 | D163: 36.35 | E163: usd | F163: 20 | G163: 36.35 | H163: 0.05 | I163: 727.00 | J163: -13813.00 | K163: 0 | L163: =RC[-3]/100*RC[-1] -> 0.05
A164: 33 | B164: H5941/XXLR | C164: CPU штаны PenCott GreenZone (PolyCotton) ||SP-CPU-NR-41 | D164: 36.35 | E164: usd | F164: 9 | G164: 36.35 | H164: 0.05 | I164: 327.15 | J164: -6215.85 | K164: 0 | L164: =RC[-3]/100*RC[-1] -> 0.05
A165: 34 | B165: H10011/2XL | C165: ECWCS куртка TRILAMINAT чёрная с підстібкою POLAR ||KU-EC2-NP-01 | D165: 47.53 | E165: usd | F165: 5 | G165: 45.18 | H165: 0.05 | I165: 225.90 | J165: -4526.85 | K165: 0 | L165: =RC[-3]/100*RC[-1] -> 0.05
A166: 35 | B166: H10011/L | C166: ECWCS куртка TRILAMINAT чёрная с підстібкою POLAR ||KU-EC2-NP-01 | D166: 47.53 | E166: usd | F166: 5 | G166: 45.18 | H166: 0.05 | I166: 225.90 | J166: -4526.85 | K166: 0 | L166: =RC[-3]/100*RC[-1] -> 0.05
A167: 36 | B167: H4311/LL | C167: US SFU штаны койот (PolyCotton) ||SP-SFU-PR-11 | D167: 15.03 | E167: usd | F167: 10 | G167: 15.03 | H167: 0.05 | I167: 150.30 | J167: -2855.70 | K167: 0 | L167: =RC[-3]/100*RC[-1] -> 0.05
A168: 37 | B168: H4311/LR | C168: US SFU штаны койот (PolyCotton) ||SP-SFU-PR-11 | D168: 15.03 | E168: usd | F168: 20 | G168: 15.03 | H168: 0.05 | I168: 300.60 | J168: -5711.40 | K168: 0 | L168: =RC[-3]/100*RC[-1] -> 0.05
A169: 38 | B169: H4311/ML | C169: US SFU штаны койот (PolyCotton) ||SP-SFU-PR-11 | D169: 15.03 | E169: usd | F169: 10 | G169: 15.03 | H169: 0.05 | I169: 150.30 | J169: -2855.70 | K169: 0 | L169: =RC[-3]/100*RC[-1] -> 0.05
A170: 39 | B170: H4311/MR | C170: US SFU штаны койот (PolyCotton) ||SP-SFU-PR-11 | D170: 15.03 | E170: usd | F170: 20 | G170: 15.03 | H170: 0.05 | I170: 300.60 | J170: -5711.40 | K170: 0 | L170: =RC[-3]/100*RC[-1] -> 0.05
A171: 40 | B171: H4314/2XLL | C171: US SFU штаны мультикам (NYCO R/S) ||SP-SFU-PR-14 | D171: 16.64 | E171: usd | F171: 10 | G171: 16.46 | H171: 0.05 | I171: 164.60 | J171: -3163.40 | K171: 0 | L171: =RC[-3]/100*RC[-1] -> 0.05
A172: 41 | B172: H4314/2XLR | C172: US SFU штаны мультикам (NYCO R/S) ||SP-SFU-PR-14 | D172: 16.64 | E172: usd | F172: 20 | G172: 16.46 | H172: 0.05 | I172: 329.20 | J172: -6326.80 | K172: 0 | L172: =RC[-3]/100*RC[-1] -> 0.05
A173: 42 | B173: H4314/LL | C173: US SFU штаны мультикам (NYCO R/S) ||SP-SFU-PR-14 | D173: 16.64 | E173: usd | F173: 20 | G173: 16.46 | H173: 0.05 | I173: 329.20 | J173: -6326.80 | K173: 0 | L173: =RC[-3]/100*RC[-1] -> 0.05
A174: 43 | B174: H4314/LR | C174: US SFU штаны мультикам (NYCO R/S) ||SP-SFU-PR-14 | D174: 16.64 | E174: usd | F174: 20 | G174: 16.46 | H174: 0.05 | I174: 329.20 | J174: -6326.80 | K174: 0 | L174: =RC[-3]/100*RC[-1] -> 0.05
A175: 44 | B175: H4314/LR | C175: US SFU штаны мультикам (NYCO R/S) ||SP-SFU-PR-14 | D175: 16.64 | E175: usd | F175: 20 | G175: 16.46 | H175: 0.05 | I175: 329.20 | J175: -6326.80 | K175: 0 | L175: =RC[-3]/100*RC[-1] -> 0.05
A176: 45 | B176: H4314/ML | C176: US SFU штаны мультикам (NYCO R/S) ||SP-SFU-PR-14 | D176: 16.64 | E176: usd | F176: 20 | G176: 16.46 | H176: 0.05 | I176: 329.20 | J176: -6326.80 | K176: 0 | L176: =RC[-3]/100*RC[-1] -> 0.05
A177: 46 | B177: H4314/MR | C177: US SFU штаны мультикам (NYCO R/S) ||SP-SFU-PR-14 | D177: 16.64 | E177: usd | F177: 20 | G177: 16.46 | H177: 0.05 | I177: 329.20 | J177: -6326.80 | K177: 0 | L177: =RC[-3]/100*RC[-1] -> 0.05
A178: 47 | B178: H4314/MR | C178: US SFU штаны мультикам (NYCO R/S) ||SP-SFU-PR-14 | D178: 16.64 | E178: usd | F178: 20 | G178: 16.46 | H178: 0.05 | I178: 329.20 | J178: -6326.80 | K178: 0 | L178: =RC[-3]/100*RC[-1] -> 0.05
A179: 48 | B179: H4314/SR | C179: US SFU штаны мультикам (NYCO R/S) ||SP-SFU-PR-14 | D179: 16.64 | E179: usd | F179: 20 | G179: 16.46 | H179: 0.05 | I179: 329.20 | J179: -6326.80 | K179: 0 | L179: =RC[-3]/100*RC[-1] -> 0.05
A180: 49 | B180: H4314/XLL | C180: US SFU штаны мультикам (NYCO R/S) ||SP-SFU-PR-14 | D180: 16.64 | E180: usd | F180: 20 | G180: 16.46 | H180: 0.05 | I180: 329.20 | J180: -6326.80 | K180: 0 | L180: =RC[-3]/100*RC[-1] -> 0.05
A181: 50 | B181: H4314/XLR | C181: US SFU штаны мультикам (NYCO R/S) ||SP-SFU-PR-14 | D181: 16.64 | E181: usd | F181: 20 | G181: 16.46 | H181: 0.05 | I181: 329.20 | J181: -6326.80 | K181: 0 | L181: =RC[-3]/100*RC[-1] -> 0.05
A182: 51 | B182: H4314/XLR | C182: US SFU штаны мультикам (NYCO R/S) ||SP-SFU-PR-14 | D182: 16.64 | E182: usd | F182: 20 | G182: 16.46 | H182: 0.05 | I182: 329.20 | J182: -6326.80 | K182: 0 | L182: =RC[-3]/100*RC[-1] -> 0.05
A183: 52 | B183: H7602 | C183: Балаклава олива с 1-м отв.(96%хлопок, 4%лайкра) ||CZ-KO1-CO-02 | D183: 1.82 | E183: usd | F183: 148 | G183: 1.77 | H183: 0.05 | I183: 261.96 | J183: -5125.24 | K183: 0 | L183: =RC[-3]/100*RC[-1] -> 0.05
A184: 53 | B184: H7602 | C184: Балаклава олива с 1-м отв.(96%хлопок, 4%лайкра) ||CZ-KO1-CO-02 | D184: 1.82 | E184: usd | F184: 200 | G184: 1.77 | H184: 0.05 | I184: 354.00 | J184: -6926.00 | K184: 0 | L184: =RC[-3]/100*RC[-1] -> 0.05
A185: 54 | B185: H3302/L | C185: Комплект термобілизни (95% полиэстер 5% спандекс) олива ||KP-UN2-PO-02/L | D185: 19.99 | E185: usd | F185: 156 | G185: 19.99 | H185: 0.05 | I185: 3118.44 | J185: -59250.36 | K185: 0 | L185: =RC[-3]/100*RC[-1] -> 0.05
A186: 55 | B186: H3302/M | C186: Комплект термобілизни (95% полиэстер 5% спандекс) олива ||KP-UN2-PO-02/M | D186: 19.99 | E186: usd | F186: 108 | G186: 19.99 | H186: 0.05 | I186: 2158.92 | J186: -41019.48 | K186: 0 | L186: =RC[-3]/100*RC[-1] -> 0.05
A187: 56 | B187: H3302/XL | C187: Комплект термобілизни (95% полиэстер 5% спандекс) олива ||KP-UN2-PO-02/XL | D187: 19.99 | E187: usd | F187: 108 | G187: 19.99 | H187: 0.05 | I187: 2158.92 | J187: -41019.48 | K187: 0 | L187: =RC[-3]/100*RC[-1] -> 0.05
A188: 57 | B188: H3301/2XL | C188: Комплект термобілизни (95% полиэстер 5% спандекс) чёрный ||KP-UN2-PO-01/2XL | D188: 19.99 | E188: usd | F188: 48 | G188: 19.99 | H188: 0.05 | I188: 959.52 | J188: -18230.88 | K188: 0 | L188: =RC[-3]/100*RC[-1] -> 0.05
A189: 58 | B189: H3301/L | C189: Комплект термобілизни (95% полиэстер 5% спандекс) чёрный ||KP-UN2-PO-01/L | D189: 19.99 | E189: usd | F189: 108 | G189: 19.99 | H189: 0.05 | I189: 2158.92 | J189: -41019.48 | K189: 0 | L189: =RC[-3]/100*RC[-1] -> 0.05
A190: 59 | B190: H3301/M | C190: Комплект термобілизни (95% полиэстер 5% спандекс) чёрный ||KP-UN2-PO-01/M | D190: 19.99 | E190: usd | F190: 108 | G190: 19.99 | H190: 0.05 | I190: 2158.92 | J190: -41019.48 | K190: 0 | L190: =RC[-3]/100*RC[-1] -> 0.05
A191: 60 | B191: H3301/XL | C191: Комплект термобілизни (95% полиэстер 5% спандекс) чёрный ||KP-UN2-PO-01/XL | D191: 19.99 | E191: usd | F191: 108 | G191: 19.99 | H191: 0.05 | I191: 2158.92 | J191: -41019.48 | K191: 0 | L191: =RC[-3]/100*RC[-1] -> 0.05
A192: 61 | B192: H26111/L | C192: Куртка PATRIOT флисовая койот 390г/м (superfine) ||BL-PAT-HF-11 | D192: 27.00 | E192: usd | F192: 10 | G192: 27.84 | H192: 0.05 | I192: 278.40 | J192: -5121.60 | K192: 0 | L192: =RC[-3]/100*RC[-1] -> 0.05
A193: 62 | B193: H26111/L | C193: Куртка PATRIOT флисовая койот 390г/м (superfine) ||BL-PAT-HF-11 | D193: 27.00 | E193: usd | F193: 10 | G193: 27.84 | H193: 0.05 | I193: 278.40 | J193: -5121.60 | K193: 0 | L193: =RC[-3]/100*RC[-1] -> 0.05
A194: 63 | B194: H26211/2XL | C194: Куртка PATRIOT флисовая фоліаж 390г/м (superfine) ||BL-PAT-HF-21 | D194: 27.00 | E194: usd | F194: 10 | G194: 27.84 | H194: 0.05 | I194: 278.40 | J194: -5121.60 | K194: 0 | L194: =RC[-3]/100*RC[-1] -> 0.05
A195: 64 | B195: H26211/S | C195: Куртка PATRIOT флисовая фоліаж 390г/м (superfine) ||BL-PAT-HF-21 | D195: 27.00 | E195: usd | F195: 10 | G195: 27.84 | H195: 0.05 | I195: 278.40 | J195: -5121.60 | K195: 0 | L195: =RC[-3]/100*RC[-1] -> 0.05
A196: 65 | B196: H26211/XL | C196: Куртка PATRIOT флисовая фоліаж 390г/м (superfine) ||BL-PAT-HF-21 | D196: 27.00 | E196: usd | F196: 10 | G196: 27.84 | H196: 0.05 | I196: 278.40 | J196: -5121.60 | K196: 0 | L196: =RC[-3]/100*RC[-1] -> 0.05
A197: 66 | B197: H26011/L | C197: Куртка PATRIOT флисовая чёрная 390г/м (superfine) ||BL-PAT-HF-01 | D197: 27.00 | E197: usd | F197: 10 | G197: 27.84 | H197: 0.05 | I197: 278.40 | J197: -5121.60 | K197: 0 | L197: =RC[-3]/100*RC[-1] -> 0.05
A198: 67 | B198: H26011/L | C198: Куртка PATRIOT флисовая чёрная 390г/м (superfine) ||BL-PAT-HF-01 | D198: 27.00 | E198: usd | F198: 10 | G198: 27.84 | H198: 0.05 | I198: 278.40 | J198: -5121.60 | K198: 0 | L198: =RC[-3]/100*RC[-1] -> 0.05
A199: 68 | B199: H26011/XL | C199: Куртка PATRIOT флисовая чёрная 390г/м (superfine) ||BL-PAT-HF-01 | D199: 27.00 | E199: usd | F199: 10 | G199: 27.84 | H199: 0.05 | I199: 278.40 | J199: -5121.60 | K199: 0 | L199: =RC[-3]/100*RC[-1] -> 0.05
A200: 69 | B200: H65021/LL | C200: Куртка М65 с отстегивающейся курткой олива (NYCO) ||KU-M65-NY-02 | D200: 38.39 | E200: usd | F200: 10 | G200: 37.22 | H200: 0.05 | I200: 372.20 | J200: -7305.80 | K200: 0 | L200: =RC[-3]/100*RC[-1] -> 0.05
A201: 70 | B201: H65021/MR | C201: Куртка М65 с отстегивающейся курткой олива (NYCO) ||KU-M65-NY-02 | D201: 38.39 | E201: usd | F201: 10 | G201: 37.22 | H201: 0.05 | I201: 372.20 | J201: -7305.80 | K201: 0 | L201: =RC[-3]/100*RC[-1] -> 0.05
A202: 71 | B202: H65021/MR | C202: Куртка М65 с отстегивающейся курткой олива (NYCO) ||KU-M65-NY-02 | D202: 38.39 | E202: usd | F202: 20 | G202: 37.22 | H202: 0.05 | I202: 744.40 | J202: -14611.60 | K202: 0 | L202: =RC[-3]/100*RC[-1] -> 0.05
A203: 72 | B203: H65021/XLL | C203: Куртка М65 с отстегивающейся курткой олива (NYCO) ||KU-M65-NY-02 | D203: 38.39 | E203: usd | F203: 10 | G203: 37.22 | H203: 0.05 | I203: 372.20 | J203: -7305.80 | K203: 0 | L203: =RC[-3]/100*RC[-1] -> 0.05
A204: 73 | B204: H65021/XLR | C204: Куртка М65 с отстегивающейся курткой олива (NYCO) ||KU-M65-NY-02 | D204: 38.39 | E204: usd | F204: 10 | G204: 37.22 | H204: 0.05 | I204: 372.20 | J204: -7305.80 | K204: 0 | L204: =RC[-3]/100*RC[-1] -> 0.05
A205: 74 | B205: H65021/XLR | C205: Куртка М65 с отстегивающейся курткой олива (NYCO) ||KU-M65-NY-02 | D205: 38.39 | E205: usd | F205: 20 | G205: 37.22 | H205: 0.05 | I205: 744.40 | J205: -14611.60 | K205: 0 | L205: =RC[-3]/100*RC[-1] -> 0.05
A206: 75 | B206: H65011/M | C206: Куртка М65 с отстегивающейся курткой чёрная (NYCO) ||KU-M65-NY-01 | D206: 38.39 | E206: usd | F206: 10 | G206: 37.22 | H206: 0.05 | I206: 372.20 | J206: -7305.80 | K206: 0 | L206: =RC[-3]/100*RC[-1] -> 0.05
A207: 76 | B207: H02101/M | C207: Носки высокие HEAVYWEIGHT ||р39-42 ||SK-HWT-WA-01 | D207: 4.83 | E207: usd | F207: 21 | G207: 100.00 | H207: 1.04 | I207: 2100.00 | J207: 71.40 | K207: 0 | L207: =RC[-3]/100*RC[-1] -> 1.04
A208: 77 | B208: H02101/M | C208: Носки высокие HEAVYWEIGHT ||р39-42 ||SK-HWT-WA-01 | D208: 4.83 | E208: usd | F208: 30 | G208: 100.00 | H208: 1.04 | I208: 3000.00 | J208: 102.00 | K208: 0 | L208: =RC[-3]/100*RC[-1] -> 1.04
A209: 78 | B209: H02101/L | C209: Носки высокие HEAVYWEIGHT ||р43-46 ||SK-HWT-WA-01 | D209: 4.83 | E209: usd | F209: 19 | G209: 100.00 | H209: 1.04 | I209: 1900.00 | J209: 64.60 | K209: 0 | L209: =RC[-3]/100*RC[-1] -> 1.04
A210: 79 | B210: H02101/L | C210: Носки высокие HEAVYWEIGHT ||р43-46 ||SK-HWT-WA-01 | D210: 4.83 | E210: usd | F210: 30 | G210: 100.00 | H210: 1.04 | I210: 3000.00 | J210: 102.00 | K210: 0 | L210: =RC[-3]/100*RC[-1] -> 1.04 | M210: =SUM(R[-79]C[-1]:RC[-1]) -> 
A212: #818 (2014-01-29) зі сторони - Прихід товару
A213: N | B213: арт | C213: назва | D213: закуп | F213: к-ть | G213: цiна | H213: кф | I213: продж | J213: дохiд | K213: % | L213: з-та
A214: 1 | B214: _525250 | C214: Окуляри жёлтые [OREGON] | D214: 55.00 | E214: zl | F214: 50 | G214: 85.00 | H214: 0.31 | I214: 4250.00 | J214: -9500.00 | K214: 0 | L214: =RC[-3]/100*RC[-1] -> 0.31
A215: 2 | B215: _525249 | C215: Очки прозрачные [OREGON] | D215: 4.58 | E215: Инт | F215: 200 | G215: 85.00 | H215: 0.93 | I215: 17000.00 | J215: -1333.32 | K215: 0 | L215: =RC[-3]/100*RC[-1] -> 0.93
A216: 3 | B216: _545830 | C216: Окуляри прозрачные [OREGON] | D216: 4.58 | E216: Инт | F216: 50 | G216: 85.00 | H216: 0.93 | I216: 4250.00 | J216: -333.33 | K216: 0 | L216: =RC[-3]/100*RC[-1] -> 0.93 | M216: =SUM(R[-3]C[-1]:RC[-1]) -> 
A218: #822 (2014-01-29) Вялко Виктор ХимГрелки - Прихід товару
A219: N | B219: арт | C219: назва | D219: закуп | F219: к-ть | G219: цiна | H219: кф | I219: продж | J219: дохiд | K219: % | L219: з-та
A220: 1 | B220: TER002 | C220: Грелка хімічна для пільців ніг самоклеюча | D220: 0.45 | E220: грн | F220: 50 | G220: 10.00 | H220: 22.22 | I220: 500.00 | J220: 477.50 | K220: 0 | L220: =RC[-3]/100*RC[-1] -> 22.22
A221: 2 | B221: TER001 | C221: Грелка хімічна для тіла самоклеюча | D221: 0.34 | E221: грн | F221: 50 | G221: 10.00 | H221: 29.41 | I221: 500.00 | J221: 483.00 | K221: 0 | L221: =RC[-3]/100*RC[-1] -> 29.41
A222: 3 | B222: TER004 | C222: Грелка хімічна для тіла и рук самоклеюча | D222: 0.22 | E222: грн | F222: 50 | G222: 6.00 | H222: 27.27 | I222: 300.00 | J222: 289.00 | K222: 0 | L222: =RC[-3]/100*RC[-1] -> 27.27 | M222: =SUM(R[-3]C[-1]:RC[-1]) -> 
A224: #886 (2014-01-31) Станислав. Харьков - Прихід товару
A225: N | B225: арт | C225: назва | D225: закуп | F225: к-ть | G225: цiна | H225: кф | I225: продж | J225: дохiд | K225: % | L225: з-та
A226: 1 | B226: X401 | C226: Балаклава чёрная с 1-м отв.(100%хлопок) ||X7601 | D226: 3.15 | E226: Инт | F226: 200 | G226: 35.00 | H226: 0.56 | I226: 7000.00 | J226: -5600.00 | K226: 0 | L226: =RC[-3]/100*RC[-1] -> 0.56 | M226: =SUM(R[-1]C[-1]:RC[-1]) -> 
A228: #969 (2014-02-04) Акрополіс - Прихід товару
A229: N | B229: арт | C229: назва | D229: закуп | F229: к-ть | G229: цiна | H229: кф | I229: продж | J229: дохiд | K229: % | L229: з-та
A230: 1 | B230: A19-17 | C230: Охотничий ремень (L-84-113) ACROPOLIS ||МР-3 | D230: 141.00 | E230: грн | F230: 1 | G230: 130.50 | H230: 0.93 | I230: 110.92 | J230: -30.08 | K230: 0 | L230: =RC[-3]/100*RC[-1] -> 0.93
A231: 2 | B231: A19-17 | C231: Охотничий ремень (L-84-113) ACROPOLIS ||МР-3 | D231: 141.00 | E231: грн | F231: 1 | G231: 130.50 | H231: 0.93 | I231: 110.92 | J231: -30.08 | K231: 0 | L231: =RC[-3]/100*RC[-1] -> 0.93
A232: 3 | B232: A19-29 | C232: Пояс-патронташ ACROPOLIS ||ПП-1ан | D232: 123.00 | E232: грн | F232: 2 | G232: 119.52 | H232: 0.97 | I232: 203.18 | J232: -42.82 | K232: 0 | L232: =RC[-3]/100*RC[-1] -> 0.97
A233: 4 | B233: A19-29 | C233: Пояс-патронташ ACROPOLIS ||ПП-1ан | D233: 123.00 | E233: грн | F233: 1 | G233: 119.52 | H233: 0.97 | I233: 101.59 | J233: -21.41 | K233: 0 | L233: =RC[-3]/100*RC[-1] -> 0.97
A234: 5 | B234: A19-87 | C234: Сумка для дипов ACROPOLIS ||СД-1н | D234: 142.05 | E234: грн | F234: 1 | G234: 167.04 | H234: 1.18 | I234: 141.98 | J234: -0.07 | K234: 0 | L234: =RC[-3]/100*RC[-1] -> 1.18
A235: 6 | B235: A19-87 | C235: Сумка для дипов ACROPOLIS ||СД-1н | D235: 142.05 | E235: грн | F235: 1 | G235: 167.04 | H235: 1.18 | I235: 141.98 | J235: -0.07 | K235: 0 | L235: =RC[-3]/100*RC[-1] -> 1.18
A236: 7 | B236: A19-38 | C236: Сумка для зберігання документов ACROPOLIS ||СДД-1 | D236: 78.00 | E236: грн | F236: 2 | G236: 72.90 | H236: 0.93 | I236: 123.93 | J236: -32.07 | K236: 0 | L236: =RC[-3]/100*RC[-1] -> 0.93
A237: 8 | B237: A19-38 | C237: Сумка для зберігання документов ACROPOLIS ||СДД-1 | D237: 78.00 | E237: грн | F237: 1 | G237: 72.90 | H237: 0.93 | I237: 61.97 | J237: -16.03 | K237: 0 | L237: =RC[-3]/100*RC[-1] -> 0.93
A238: 9 | B238: A19-42 | C238: Термосумка для дипов ACROPOLIS ||СД-2 | D238: 248.00 | E238: грн | F238: 2 | G238: 177.20 | H238: 0.71 | I238: 354.40 | J238: -141.60 | K238: 0 | L238: =RC[-3]/100*RC[-1] -> 0.71
A239: 10 | B239: A19-171 | C239: Футляр для удилищ ACROPOLIS ||КВ-7бн | D239: 513.00 | E239: грн | F239: 1 | G239: 602.52 | H239: 1.17 | I239: 512.14 | J239: -0.86 | K239: 0 | L239: =RC[-3]/100*RC[-1] -> 1.17
A240: 11 | B240: A19-171 | C240: Футляр для удилищ ACROPOLIS ||КВ-7бн | D240: 513.00 | E240: грн | F240: 1 | G240: 602.52 | H240: 1.17 | I240: 512.14 | J240: -0.86 | K240: 0 | L240: =RC[-3]/100*RC[-1] -> 1.17
A241: 12 | B241: A19-123 | C241: Футляр для винтовки ACROPOLIS ||ФЗ-8а | D241: 460.70 | E241: грн | F241: 1 | G241: 448.20 | H241: 0.97 | I241: 380.97 | J241: -79.73 | K241: 0 | L241: =RC[-3]/100*RC[-1] -> 0.97
A242: 13 | B242: A19-123 | C242: Футляр для винтовки ACROPOLIS ||ФЗ-8а | D242: 460.70 | E242: грн | F242: 1 | G242: 448.20 | H242: 0.97 | I242: 380.97 | J242: -79.73 | K242: 0 | L242: =RC[-3]/100*RC[-1] -> 0.97
A243: 14 | B243: A19-33 | C243: Серветка с мікрофібри ACROPOLIS ||А-90/07 | D243: 7.00 | E243: грн | F243: 5 | G243: 7.56 | H243: 1.08 | I243: 32.13 | J243: -2.87 | K243: 0 | L243: =RC[-3]/100*RC[-1] -> 1.08
A244: 15 | B244: A19-33 | C244: Серветка с мікрофібри ACROPOLIS ||А-90/07 | D244: 7.00 | E244: грн | F244: 1 | G244: 7.56 | H244: 1.08 | I244: 6.43 | J244: -0.57 | K244: 0 | L244: =RC[-3]/100*RC[-1] -> 1.08
A245: 16 | B245: A19-165/33-34 | C245: Джинси с підтяжками коричневые ACROPOLIS ||ДПМ-33/34 | D245: 537.48 | E245: грн | F245: 1 | G245: 537.48 | H245: 1.00 | I245: 456.86 | J245: -80.62 | K245: 0 | L245: =RC[-3]/100*RC[-1] -> 1.00
A246: 17 | B246: A19-168/27-29 | C246: Носки охотничьи ACROPOLIS ||ШКМ-1/27-29 | D246: 15.00 | E246: грн | F246: 5 | G246: 15.00 | H246: 1.00 | I246: 63.75 | J246: -11.25 | K246: 0 | L246: =RC[-3]/100*RC[-1] -> 1.00
A247: 18 | B247: A19-168/25-27 | C247: Носки охотничьи ACROPOLIS ||ШКМ-1/25-27 | D247: 15.00 | E247: грн | F247: 5 | G247: 15.00 | H247: 1.00 | I247: 63.75 | J247: -11.25 | K247: 0 | L247: =RC[-3]/100*RC[-1] -> 1.00
A248: 19 | B248: A19-168/31-33 | C248: Носки охотничьи ACROPOLIS ||ШКМ-1/31-33 | D248: 15.00 | E248: грн | F248: 5 | G248: 15.00 | H248: 1.00 | I248: 63.75 | J248: -11.25 | K248: 0 | L248: =RC[-3]/100*RC[-1] -> 1.00
A249: 20 | B249: A19-169/25-27 | C249: Носки охотничьи зимние ACROPOLIS ||ШКМ-2/25-27 | D249: 21.42 | E249: грн | F249: 5 | G249: 21.42 | H249: 1.00 | I249: 91.04 | J249: -16.06 | K249: 0 | L249: =RC[-3]/100*RC[-1] -> 1.00
A250: 21 | B250: A19-164/25-27 | C250: Носки-гольфи ACROPOLIS ||ШКМ-3/25-27 | D250: 29.52 | E250: грн | F250: 5 | G250: 29.52 | H250: 1.00 | I250: 125.46 | J250: -22.14 | K250: 0 | L250: =RC[-3]/100*RC[-1] -> 1.00
A251: 22 | B251: A19-164/27-29 | C251: Носки-гольфи ACROPOLIS ||ШКМ-3/27-29 | D251: 29.52 | E251: грн | F251: 5 | G251: 29.52 | H251: 1.00 | I251: 125.46 | J251: -22.14 | K251: 0 | L251: =RC[-3]/100*RC[-1] -> 1.00
A252: 23 | B252: A19-164/29-31 | C252: Носки-гольфи ACROPOLIS ||ШКМ-3/29-31 | D252: 29.52 | E252: грн | F252: 5 | G252: 29.52 | H252: 1.00 | I252: 125.46 | J252: -22.14 | K252: 0 | L252: =RC[-3]/100*RC[-1] -> 1.00
A253: 24 | B253: A19-164/31-33 | C253: Носки-гольфи ACROPOLIS ||ШКМ-3/31-33 | D253: 29.52 | E253: грн | F253: 5 | G253: 29.52 | H253: 1.00 | I253: 125.46 | J253: -22.14 | K253: 0 | L253: =RC[-3]/100*RC[-1] -> 1.00 | M253: =SUM(R[-24]C[-1]:RC[-1]) -> 
A255: #983 (2014-02-04) Станислав. Харьков - Прихід товару
A256: N | B256: арт | C256: назва | D256: закуп | F256: к-ть | G256: цiна | H256: кф | I256: продж | J256: дохiд | K256: % | L256: з-та
A257: 1 | B257: X401 | C257: Балаклава чёрная с 1-м отв.(100%хлопок) ||X7601 | D257: 3.15 | E257: Инт | F257: 300 | G257: 35.00 | H257: 0.56 | I257: 10500.00 | J257: -8400.00 | K257: 0 | L257: =RC[-3]/100*RC[-1] -> 0.56 | M257: =SUM(R[-1]C[-1]:RC[-1]) -> 
A259: #1016 (2014-02-05) FENIX LIGTH - Прихід товару
A260: N | B260: арт | C260: назва | D260: закуп | F260: к-ть | G260: цiна | H260: кф | I260: продж | J260: дохiд | K260: % | L260: з-та
A261: 1 | B261: _FK2871 | C261: Крепление для фонарей пластик 2871, діам. 25-31мм | D261: 10.33 | E261: Инт | F261: 3 | G261: 71.10 | H261: 0.34 | I261: 213.30 | J261: -406.70 | K261: 0 | L261: =RC[-3]/100*RC[-1] -> 0.34
A262: 2 | B262: _E01/Y | C262: Фонарик FENIX E01 жёлный | D262: 9.10 | E262: usd | F262: 2 | G262: 81.90 | H262: 0.45 | I262: 163.80 | J262: -200.20 | K262: 0 | L262: =RC[-3]/100*RC[-1] -> 0.45
A263: 3 | B263: _E01/P | C263: Фонарик FENIX E01 рожевий | D263: 9.10 | E263: usd | F263: 2 | G263: 81.90 | H263: 0.45 | I263: 163.80 | J263: -200.20 | K263: 0 | L263: =RC[-3]/100*RC[-1] -> 0.45
A264: 4 | B264: _E05 | C264: Фонарик FENIX E05 чёрный | D264: 13.35 | E264: usd | F264: 5 | G264: 120.00 | H264: 0.45 | I264: 600.00 | J264: -735.00 | K264: 0 | L264: =RC[-3]/100*RC[-1] -> 0.45
A265: 5 | B265: _E05bp | C265: Фонарик FENIX E05 чёрный (подарункова упаковка) | D265: 13.35 | E265: usd | F265: 5 | G265: 119.70 | H265: 0.45 | I265: 598.50 | J265: -736.50 | K265: 0 | L265: =RC[-3]/100*RC[-1] -> 0.45
A266: 6 | B266: _E11bp | C266: Фонарь FENIX E11 чёрный в подарочной упаковке | D266: 19.41 | E266: usd | F266: 3 | G266: 174.60 | H266: 0.45 | I266: 523.80 | J266: -640.80 | K266: 0 | L266: =RC[-3]/100*RC[-1] -> 0.45
A267: 7 | B267: _E25 | C267: Фонарик FENIX E25 | D267: 28.51 | E267: usd | F267: 2 | G267: 256.50 | H267: 0.45 | I267: 513.00 | J267: -627.40 | K267: 0 | L267: =RC[-3]/100*RC[-1] -> 0.45
A268: 8 | B268: _TK15S2 | C268: Фонарь светодиодный FENIX ТК15 S2 | D268: 66.28 | E268: usd | F268: 4 | G268: 600.30 | H268: 0.45 | I268: 2401.20 | J268: -2901.20 | K268: 0 | L268: =RC[-3]/100*RC[-1] -> 0.45
A269: 9 | B269: _HP15y | C269: Фонарь налобный FENIX HL15 жёлтый | D269: 54.00 | E269: usd | F269: 2 | G269: 540.00 | H269: 0.50 | I269: 1080.00 | J269: -1080.00 | K269: 0 | L269: =RC[-3]/100*RC[-1] -> 0.50
A270: 10 | B270: _HL21-B | C270: Фонарик налобний FENIX HL21 R2 чёрный | D270: 29.27 | E270: usd | F270: 2 | G270: 267.30 | H270: 0.46 | I270: 534.60 | J270: -636.20 | K270: 0 | L270: =RC[-3]/100*RC[-1] -> 0.46
A271: 11 | B271: _PD35U2 | C271: Фонарь светодиодный FENIX PD35U2 | D271: 65.70 | E271: usd | F271: 4 | G271: 594.90 | H271: 0.45 | I271: 2379.60 | J271: -2876.40 | K271: 0 | L271: =RC[-3]/100*RC[-1] -> 0.45
A272: 12 | B272: EGO_L.D | C272: Лопата EGO Tools Luxury | D272: 107.14 | E272: usd | F272: 1 | G272: 818.10 | H272: 0.38 | I272: 818.10 | J272: -1324.70 | K272: 0 | L272: =RC[-3]/100*RC[-1] -> 0.38
A273: 13 | B273: EGO_L.A | C273: Лопата EGO Tools Simple | D273: 42.86 | E273: usd | F273: 2 | G273: 327.60 | H273: 0.38 | I273: 655.20 | J273: -1059.20 | K273: 0 | L273: =RC[-3]/100*RC[-1] -> 0.38
A274: 14 | B274: EGO_L.C | C274: Лопата EGO Tools Utility | D274: 62.14 | E274: usd | F274: 2 | G274: 474.30 | H274: 0.38 | I274: 948.60 | J274: -1537.00 | K274: 0 | L274: =RC[-3]/100*RC[-1] -> 0.38
A275: 15 | B275: _ST60300ES | C275: Мікротул Swiss+Tech 7-in-1 Key Ring Multi-Tool Silver | D275: 4.72 | E275: Инт | F275: 3 | G275: 76.50 | H275: 0.81 | I275: 229.50 | J275: -53.83 | K275: 0 | L275: =RC[-3]/100*RC[-1] -> 0.81
A276: 16 | B276: _ST60508ES | C276: Микротул Swiss+Tech Micro-Pro XL900 9-in-1 *Aus* | D276: 7.59 | E276: Инт | F276: 2 | G276: 95.40 | H276: 0.63 | I276: 190.80 | J276: -112.76 | K276: 0 | L276: =RC[-3]/100*RC[-1] -> 0.63
A277: 17 | B277: _ST50022ES | C277: Микротул Swiss+Tech Micro-Tech 6-in-1 | D277: 3.82 | E277: Инт | F277: 3 | G277: 54.90 | H277: 0.72 | I277: 164.70 | J277: -64.63 | K277: 0 | L277: =RC[-3]/100*RC[-1] -> 0.72
A278: 18 | B278: _ST35000ES | C278: Микротул Swiss+Tech Mini Multi-tool 8-in-1 | D278: 7.16 | E278: Инт | F278: 2 | G278: 84.60 | H278: 0.59 | I278: 169.20 | J278: -117.02 | K278: 0 | L278: =RC[-3]/100*RC[-1] -> 0.59
A279: 19 | B279: _HTK22U2 | C279: Набор FENIX TK22 + кнопка AR102 +Акум Fenix 2600 + Зарядка TF002 | D279: 97.64 | E279: usd | F279: 3 | G279: 905.50 | H279: 0.46 | I279: 2716.50 | J279: -3141.90 | K279: 0 | L279: =RC[-3]/100*RC[-1] -> 0.46
A280: 20 | B280: _31-000700 | C280: Набор для виживання GERBER Bear Grylls Survival Basic Kit | D280: 14.52 | E280: usd | F280: 2 | G280: 217.80 | H280: 0.75 | I280: 435.60 | J280: -145.20 | K280: 0 | L280: =RC[-3]/100*RC[-1] -> 0.75
A281: 21 | B281: _A03r | C281: Нож EGO Tools брелок красный | D281: 7.14 | E281: usd | F281: 2 | G281: 54.90 | H281: 0.38 | I281: 109.80 | J281: -175.80 | K281: 0 | L281: =RC[-3]/100*RC[-1] -> 0.38
A282: 22 | B282: _A03y | C282: Нож EGO Tools брелок жёлный | D282: 7.14 | E282: usd | F282: 2 | G282: 54.90 | H282: 0.38 | I282: 109.80 | J282: -175.80 | K282: 0 | L282: =RC[-3]/100*RC[-1] -> 0.38
A283: 23 | B283: _A03c | C283: Нож EGO Tools брелок камо | D283: 7.86 | E283: usd | F283: 2 | G283: 60.30 | H283: 0.38 | I283: 120.60 | J283: -193.80 | K283: 0 | L283: =RC[-3]/100*RC[-1] -> 0.38
A284: 24 | B284: _A03b | C284: Нож EGO Tools брелок синий | D284: 7.14 | E284: usd | F284: 2 | G284: 54.90 | H284: 0.38 | I284: 109.80 | J284: -175.80 | K284: 0 | L284: =RC[-3]/100*RC[-1] -> 0.38
A285: 25 | B285: _A03bl | C285: Нож EGO Tools брелок чёрный | D285: 7.14 | E285: usd | F285: 2 | G285: 54.90 | H285: 0.38 | I285: 109.80 | J285: -175.80 | K285: 0 | L285: =RC[-3]/100*RC[-1] -> 0.38
A286: 26 | B286: _A01.12c | C286: Нож EGO Tools камо | D286: 19.29 | E286: usd | F286: 2 | G286: 147.60 | H286: 0.38 | I286: 295.20 | J286: -476.40 | K286: 0 | L286: =RC[-3]/100*RC[-1] -> 0.38
A287: 27 | B287: _IT.01 | C287: Нож EGO Tools синий с набором біт | D287: 19.29 | E287: usd | F287: 2 | G287: 147.60 | H287: 0.38 | I287: 295.20 | J287: -476.40 | K287: 0 | L287: =RC[-3]/100*RC[-1] -> 0.38
A288: 28 | B288: _A01.10 | C288: Нож EGO Tools красный | D288: 15.00 | E288: usd | F288: 2 | G288: 114.30 | H288: 0.38 | I288: 228.60 | J288: -371.40 | K288: 0 | L288: =RC[-3]/100*RC[-1] -> 0.38
A289: 29 | B289: _A01.10.1 | C289: Нож EGO Tools красный | D289: 12.86 | E289: usd | F289: 2 | G289: 98.10 | H289: 0.38 | I289: 196.20 | J289: -318.20 | K289: 0 | L289: =RC[-3]/100*RC[-1] -> 0.38
A290: 30 | B290: _A01.10.2 | C290: Нож EGO Tools красный | D290: 15.00 | E290: usd | F290: 2 | G290: 114.30 | H290: 0.38 | I290: 228.60 | J290: -371.40 | K290: 0 | L290: =RC[-3]/100*RC[-1] -> 0.38
A291: 31 | B291: _A01.11.1 | C291: Нож EGO Tools красный | D291: 16.43 | E291: usd | F291: 1 | G291: 125.10 | H291: 0.38 | I291: 125.10 | J291: -203.50 | K291: 0 | L291: =RC[-3]/100*RC[-1] -> 0.38
A292: 32 | B292: _A01.12.1 | C292: Нож EGO Tools красный | D292: 16.07 | E292: usd | F292: 2 | G292: 122.40 | H292: 0.38 | I292: 244.80 | J292: -398.00 | K292: 0 | L292: =RC[-3]/100*RC[-1] -> 0.38
A293: 33 | B293: _A01.8 | C293: Нож EGO Tools красный | D293: 9.64 | E293: usd | F293: 2 | G293: 73.80 | H293: 0.38 | I293: 147.60 | J293: -238.00 | K293: 0 | L293: =RC[-3]/100*RC[-1] -> 0.38
A294: 34 | B294: _A01.9 | C294: Нож EGO Tools красный | D294: 12.14 | E294: usd | F294: 2 | G294: 92.70 | H294: 0.38 | I294: 185.40 | J294: -300.20 | K294: 0 | L294: =RC[-3]/100*RC[-1] -> 0.38
A295: 35 | B295: _A01.11 | C295: Нож EGO Tools красный | D295: 15.71 | E295: usd | F295: 2 | G295: 119.70 | H295: 0.38 | I295: 239.40 | J295: -389.00 | K295: 0 | L295: =RC[-3]/100*RC[-1] -> 0.38
A296: 36 | B296: _IT.02 | C296: Нож EGO Tools красный с набором біт | D296: 24.29 | E296: usd | F296: 2 | G296: 185.40 | H296: 0.38 | I296: 370.80 | J296: -600.80 | K296: 0 | L296: =RC[-3]/100*RC[-1] -> 0.38
A297: 37 | B297: _G613 | C297: Нож GANZO G613 | D297: 5.36 | E297: usd | F297: 2 | G297: 52.20 | H297: 0.49 | I297: 104.40 | J297: -110.00 | K297: 0 | L297: =RC[-3]/100*RC[-1] -> 0.49
A298: 38 | B298: _G614 | C298: Нож GANZO G614 | D298: 5.36 | E298: usd | F298: 2 | G298: 52.20 | H298: 0.49 | I298: 104.40 | J298: -110.00 | K298: 0 | L298: =RC[-3]/100*RC[-1] -> 0.49
A299: 39 | B299: _G615 | C299: Нож GANZO G615 | D299: 5.36 | E299: usd | F299: 2 | G299: 52.20 | H299: 0.49 | I299: 104.40 | J299: -110.00 | K299: 0 | L299: =RC[-3]/100*RC[-1] -> 0.49
A300: 40 | B300: _G616 | C300: Нож GANZO G616 | D300: 5.36 | E300: usd | F300: 2 | G300: 52.20 | H300: 0.49 | I300: 104.40 | J300: -110.00 | K300: 0 | L300: =RC[-3]/100*RC[-1] -> 0.49
A301: 41 | B301: _G617 | C301: Нож GANZO G617 | D301: 5.36 | E301: usd | F301: 2 | G301: 52.20 | H301: 0.49 | I301: 104.40 | J301: -110.00 | K301: 0 | L301: =RC[-3]/100*RC[-1] -> 0.49
A302: 42 | B302: _G618 | C302: Нож GANZO G618 | D302: 5.36 | E302: usd | F302: 2 | G302: 52.20 | H302: 0.49 | I302: 104.40 | J302: -110.00 | K302: 0 | L302: =RC[-3]/100*RC[-1] -> 0.49
A303: 43 | B303: _G619 | C303: Нож GANZO G619 | D303: 5.36 | E303: usd | F303: 2 | G303: 52.20 | H303: 0.49 | I303: 104.40 | J303: -110.00 | K303: 0 | L303: =RC[-3]/100*RC[-1] -> 0.49
A304: 44 | B304: _G701 | C304: Нож GANZO G701 | D304: 13.65 | E304: usd | F304: 4 | G304: 153.00 | H304: 0.56 | I304: 612.00 | J304: -480.00 | K304: 0 | L304: =RC[-3]/100*RC[-1] -> 0.56
A305: 45 | B305: _G701W | C305: Нож GANZO G701 White | D305: 13.65 | E305: usd | F305: 2 | G305: 153.00 | H305: 0.56 | I305: 306.00 | J305: -240.00 | K305: 0 | L305: =RC[-3]/100*RC[-1] -> 0.56
A306: 46 | B306: _G702B | C306: Нож GANZO G702B | D306: 13.65 | E306: usd | F306: 4 | G306: 152.73 | H306: 0.56 | I306: 610.92 | J306: -481.08 | K306: 0 | L306: =RC[-3]/100*RC[-1] -> 0.56
A307: 47 | B307: _G704g | C307: Нож GANZO G704g | D307: 16.51 | E307: usd | F307: 2 | G307: 163.80 | H307: 0.50 | I307: 327.60 | J307: -332.80 | K307: 0 | L307: =RC[-3]/100*RC[-1] -> 0.50
A308: 48 | B308: _G704y | C308: Нож GANZO G704y | D308: 16.51 | E308: usd | F308: 2 | G308: 163.80 | H308: 0.50 | I308: 327.60 | J308: -332.80 | K308: 0 | L308: =RC[-3]/100*RC[-1] -> 0.50
A309: 49 | B309: _G716-S | C309: Нож GANZO G716-S | D309: 24.40 | E309: usd | F309: 2 | G309: 240.30 | H309: 0.49 | I309: 480.60 | J309: -495.40 | K309: 0 | L309: =RC[-3]/100*RC[-1] -> 0.49
A310: 50 | B310: _G717b | C310: Нож GANZO G717b | D310: 23.84 | E310: usd | F310: 2 | G310: 234.90 | H310: 0.49 | I310: 469.80 | J310: -483.80 | K310: 0 | L310: =RC[-3]/100*RC[-1] -> 0.49
A311: 51 | B311: _G717y | C311: Нож GANZO G717y | D311: 23.84 | E311: usd | F311: 2 | G311: 234.90 | H311: 0.49 | I311: 469.80 | J311: -483.80 | K311: 0 | L311: =RC[-3]/100*RC[-1] -> 0.49
A312: 52 | B312: DS8828N/M | C312: Водонепроницаемые носки DexShell Coolvent new | D312: 20.00 | E312: usd | F312: 5 | G312: 180.00 | H312: 0.45 | I312: 900.00 | J312: -1100.00 | K312: 0 | L312: =RC[-3]/100*RC[-1] -> 0.45
A313: 53 | B313: DS8828N/L | C313: Водонепроницаемые носки DexShell Coolvent new | D313: 20.00 | E313: usd | F313: 5 | G313: 180.00 | H313: 0.45 | I313: 900.00 | J313: -1100.00 | K313: 0 | L313: =RC[-3]/100*RC[-1] -> 0.45
A314: 54 | B314: DS8826/L | C314: Носки водонепроницаемые Dexshell Thermlite (Зима) | D314: 16.94 | E314: usd | F314: 5 | G314: 180.00 | H314: 0.53 | I314: 900.00 | J314: -794.44 | K314: 0 | L314: =RC[-3]/100*RC[-1] -> 0.53
A315: 55 | B315: _E01/B | C315: Фонарик FENIX E01 синий | D315: 9.10 | E315: usd | F315: 2 | G315: 81.90 | H315: 0.45 | I315: 163.80 | J315: -200.20 | K315: 0 | L315: =RC[-3]/100*RC[-1] -> 0.45 | M315: =SUM(R[-55]C[-1]:RC[-1]) -> 
A317: #1221 (2014-02-11) Станислав. Харьков - Прихід товару
A318: N | B318: арт | C318: назва | D318: закуп | F318: к-ть | G318: цiна | H318: кф | I318: продж | J318: дохiд | K318: % | L318: з-та
A319: 1 | B319: X406 | C319: Балаклава чёрная с 1-м отв. тепла (100%хлопок) || | D319: 3.15 | E319: Инт | F319: 120 | G319: 50.00 | H319: 0.79 | I319: 6000.00 | J319: -1560.00 | K319: 0 | L319: =RC[-3]/100*RC[-1] -> 0.79
A320: 2 | B320: X406 | C320: Балаклава чёрная с 1-м отв. тепла (100%хлопок) || | D320: 3.15 | E320: Инт | F320: 60 | G320: 50.00 | H320: 0.79 | I320: 3000.00 | J320: -780.00 | K320: 0 | L320: =RC[-3]/100*RC[-1] -> 0.79
A321: 3 | B321: X406 | C321: Балаклава чёрная с 1-м отв. тепла (100%хлопок) || | D321: 3.15 | E321: Инт | F321: 5 | G321: 50.00 | H321: 0.79 | I321: 250.00 | J321: -65.00 | K321: 0 | L321: =RC[-3]/100*RC[-1] -> 0.79
A322: 4 | B322: X406 | C322: Балаклава чёрная с 1-м отв. тепла (100%хлопок) || | D322: 3.15 | E322: Инт | F322: 1 | G322: 50.00 | H322: 0.79 | I322: 50.00 | J322: -13.00 | K322: 0 | L322: =RC[-3]/100*RC[-1] -> 0.79
A323: 5 | B323: X401 | C323: Балаклава чёрная с 1-м отв.(100%хлопок) ||X7601 | D323: 3.15 | E323: Инт | F323: 1000 | G323: 35.00 | H323: 0.56 | I323: 35000.00 | J323: -28000.00 | K323: 0 | L323: =RC[-3]/100*RC[-1] -> 0.56
A324: 6 | B324: X401 | C324: Балаклава чёрная с 1-м отв.(100%хлопок) ||X7601 | D324: 3.15 | E324: Инт | F324: 1 | G324: 35.00 | H324: 0.56 | I324: 35.00 | J324: -28.00 | K324: 0 | L324: =RC[-3]/100*RC[-1] -> 0.56 | M324: =SUM(R[-6]C[-1]:RC[-1]) -> 
A326: #1308 (2014-02-14) Федик Тарас - Прихід товару
A327: N | B327: арт | C327: назва | D327: закуп | F327: к-ть | G327: цiна | H327: кф | I327: продж | J327: дохiд | K327: % | L327: з-та
A328: 1 | B328: _TRA-024 | C328: Гермопакет 18x25 см | D328: 1.92 | E328: Инт | F328: 3 | G328: 26.88 | H328: 0.70 | I328: 80.64 | J328: -34.56 | K328: 0 | L328: =RC[-3]/100*RC[-1] -> 0.70
A329: 2 | B329: _TRA-025 | C329: Гермопакет 12.7x18.4 см | D329: 3.21 | E329: Инт | F329: 3 | G329: 25.81 | H329: 0.40 | I329: 77.43 | J329: -115.43 | K329: 0 | L329: =RC[-3]/100*RC[-1] -> 0.40
A330: 3 | B330: TRG-008 | C330: Горелка складная TRAMP | D330: 14.93 | E330: Инт | F330: 2 | G330: 186.63 | H330: 0.63 | I330: 373.26 | J330: -223.96 | K330: 0 | L330: =RC[-3]/100*RC[-1] -> 0.63
A331: 4 | B331: TRG-009 | C331: Горелка складная TRAMP | D331: 12.54 | E331: Инт | F331: 2 | G331: 175.69 | H331: 0.70 | I331: 351.38 | J331: -150.22 | K331: 0 | L331: =RC[-3]/100*RC[-1] -> 0.70
A332: 5 | B332: TRG-016 | C332: Горелка портативная бензиновая TRAMP | D332: 59.53 | E332: Инт | F332: 1 | G332: 744.13 | H332: 0.63 | I332: 744.13 | J332: -446.48 | K332: 0 | L332: =RC[-3]/100*RC[-1] -> 0.63
A333: 6 | B333: TRI-008 | C333: Подушка самонадувная TRAMP | D333: 4.55 | E333: Инт | F333: 3 | G333: 56.87 | H333: 0.63 | I333: 170.61 | J333: -102.37 | K333: 0 | L333: =RC[-3]/100*RC[-1] -> 0.63
A334: 7 | B334: _TRC-004 | C334: Автокружка TRAMP 450 ml | D334: 3.71 | E334: Инт | F334: 5 | G334: 34.09 | H334: 0.46 | I334: 170.45 | J334: -200.27 | K334: 0 | L334: =RC[-3]/100*RC[-1] -> 0.46
A335: 8 | B335: _TRC-064 | C335: Автокружка TRAMP 12 v сталь/пластик | D335: 4.88 | E335: Инт | F335: 5 | G335: 60.97 | H335: 0.63 | I335: 304.85 | J335: -182.91 | K335: 0 | L335: =RC[-3]/100*RC[-1] -> 0.63
A336: 9 | B336: _TRC-005 | C336: Автокружка TRAMP 12 v сталь/пластик | D336: 4.55 | E336: Инт | F336: 5 | G336: 56.87 | H336: 0.63 | I336: 284.35 | J336: -170.61 | K336: 0 | L336: =RC[-3]/100*RC[-1] -> 0.63
A337: 10 | B337: _TRC-012 | C337: Кружка TRAMP с карабином 300 мл | D337: 3.60 | E337: Инт | F337: 4 | G337: 27.15 | H337: 0.38 | I337: 108.60 | J337: -179.40 | K337: 0 | L337: =RC[-3]/100*RC[-1] -> 0.38
A338: 11 | B338: _TRC-007 | C338: Термокружка TRAMP с кришкою и подставкой 400мл | D338: 6.40 | E338: Инт | F338: 4 | G338: 54.74 | H338: 0.43 | I338: 218.96 | J338: -293.04 | K338: 0 | L338: =RC[-3]/100*RC[-1] -> 0.43
A339: 12 | B339: _TRC-018 | C339: Термокружка TRAMP с напувалкою 300 мл | D339: 5.60 | E339: Инт | F339: 4 | G339: 42.45 | H339: 0.38 | I339: 169.80 | J339: -278.20 | K339: 0 | L339: =RC[-3]/100*RC[-1] -> 0.38
A340: 13 | B340: _TRC-020 | C340: Термокружка TRAMP с поилкой и застежкой 350мл | D340: 6.16 | E340: Инт | F340: 5 | G340: 46.73 | H340: 0.38 | I340: 233.65 | J340: -382.35 | K340: 0 | L340: =RC[-3]/100*RC[-1] -> 0.38
A341: 14 | B341: _TRC-046 | C341: Термокружка TRAMP подарунковий 450мл | D341: 10.34 | E341: Инт | F341: 3 | G341: 129.23 | H341: 0.63 | I341: 387.69 | J341: -232.61 | K341: 0 | L341: =RC[-3]/100*RC[-1] -> 0.63
A342: 15 | B342: _TRC-030 | C342: Термос TRAMP 0,5 л | D342: 11.60 | E342: Инт | F342: 5 | G342: 99.50 | H342: 0.43 | I342: 497.50 | J342: -662.50 | K342: 0 | L342: =RC[-3]/100*RC[-1] -> 0.43
A343: 16 | B343: _TRC-029 | C343: Термос TRAMP 1,6 л | D343: 19.97 | E343: usd | F343: 5 | G343: 177.73 | H343: 0.44 | I343: 888.65 | J343: -1108.35 | K343: 0 | L343: =RC[-3]/100*RC[-1] -> 0.44
A344: 17 | B344: _TRP002.06 | C344: Рюкзак CAMEL 110 | D344: 108.55 | E344: Инт | F344: 1 | G344: 965.74 | H344: 0.44 | I344: 965.74 | J344: -1205.30 | K344: 0 | L344: =RC[-3]/100*RC[-1] -> 0.44
A345: 18 | B345: _TRP005.06 | C345: Рюкзак BACKPACKER | D345: 33.45 | E345: Инт | F345: 1 | G345: 297.17 | H345: 0.44 | I345: 297.17 | J345: -371.80 | K345: 0 | L345: =RC[-3]/100*RC[-1] -> 0.44
A346: 19 | B346: _TRP004.01 | C346: Рюкзак STORM 40 | D346: 48.97 | E346: Инт | F346: 1 | G346: 435.57 | H346: 0.44 | I346: 435.57 | J346: -543.74 | K346: 0 | L346: =RC[-3]/100*RC[-1] -> 0.44
A347: 20 | B347: _TRP001.04 | C347: Рюкзак TOURIST 90 | D347: 44.25 | E347: Инт | F347: 1 | G347: 641.69 | H347: 0.72 | I347: 641.69 | J347: -243.40 | K347: 0 | L347: =RC[-3]/100*RC[-1] -> 0.72
A348: 21 | B348: _TRP006.10 | C348: Рюкзак TRUSTY | D348: 17.35 | E348: Инт | F348: 1 | G348: 251.51 | H348: 0.73 | I348: 251.51 | J348: -95.40 | K348: 0 | L348: =RC[-3]/100*RC[-1] -> 0.73
A349: 22 | B349: _TRP012.08 | C349: Рюкзак ULTRA | D349: 5.31 | E349: Инт | F349: 5 | G349: 56.87 | H349: 0.54 | I349: 284.35 | J349: -246.68 | K349: 0 | L349: =RC[-3]/100*RC[-1] -> 0.54
A350: 23 | B350: _TRC-006 | C350: Термокружка TRAMP с кришкою 400мл | D350: 5.44 | E350: Инт | F350: 3 | G350: 41.39 | H350: 0.38 | I350: 124.17 | J350: -202.23 | K350: 0 | L350: =RC[-3]/100*RC[-1] -> 0.38
A351: 24 | B351: SLI-009 | C351: Подушка надувная | D351: 3.52 | E351: Инт | F351: 3 | G351: 26.97 | H351: 0.38 | I351: 80.91 | J351: -130.29 | K351: 0 | L351: =RC[-3]/100*RC[-1] -> 0.38
A352: 25 | B352: _TRP008.01 | C352: Рюкзак SASHBAG | D352: 5.99 | E352: Инт | F352: 2 | G352: 86.86 | H352: 0.72 | I352: 173.72 | J352: -65.89 | K352: 0 | L352: =RC[-3]/100*RC[-1] -> 0.72
A353: 26 | B353: _TRC-010 | C353: Термокружка TRAMP 450 мл | D353: 6.96 | E353: Инт | F353: 1 | G353: 54.78 | H353: 0.39 | I353: 54.78 | J353: -84.42 | K353: 0 | L353: =RC[-3]/100*RC[-1] -> 0.39 | M353: =SUM(R[-26]C[-1]:RC[-1]) -> 
A355: #1317 (2014-02-14) Klarus - Прихід товару
A356: N | B356: арт | C356: назва | D356: закуп | F356: к-ть | G356: цiна | H356: кф | I356: продж | J356: дохiд | K356: % | L356: з-та
A357: 1 | B357: _KRS11 | C357: Фонарик KLARUS RS11 | D357: 85.00 | E357: usd | F357: 1 | G357: 713.00 | H357: 0.42 | I357: 713.00 | J357: -987.00 | K357: 0 | L357: =RC[-3]/100*RC[-1] -> 0.42
A358: 2 | B358: _KRS80 | C358: Фонарик KLARUS RS80 | D358: 250.00 | E358: usd | F358: 1 | G358: 2436.00 | H358: 0.49 | I358: 2436.00 | J358: -2564.00 | K358: 0 | L358: =RC[-3]/100*RC[-1] -> 0.49 | M358: =SUM(R[-2]C[-1]:RC[-1]) -> 
A360: #1322 (2014-02-17) Кракман - Прихід товару
A361: N | B361: арт | C361: назва | D361: закуп | F361: к-ть | G361: цiна | H361: кф | I361: продж | J361: дохiд | K361: % | L361: з-та
A362: 1 | B362: K17222-C | C362: Балаклава SKULL type C-чёрная [Производитель: ACM] ||M51617222-C | D362: 2.65 | E362: usd | F362: 100 | G362: 2.65 | H362: 0.05 | I362: 265.00 | J362: -5035.00 | K362: 0 | L362: =RC[-3]/100*RC[-1] -> 0.05
A363: 2 | B363: K11020-A | C363: Жилет MOLLE type ARMOR VEST ACU ||M51611020-ACU | D363: 29.24 | E363: usd | F363: 2 | G363: 27.59 | H363: 0.05 | I363: 55.18 | J363: -1114.42 | K363: 0 | L363: =RC[-3]/100*RC[-1] -> 0.05
A364: 3 | B364: K11020-AT | C364: Жилет MOLLE type ARMOR VEST ATACS ||M51611020-ATACS | D364: 30.52 | E364: usd | F364: 2 | G364: 30.52 | H364: 0.05 | I364: 61.04 | J364: -1159.76 | K364: 0 | L364: =RC[-3]/100*RC[-1] -> 0.05
A365: 4 | B365: K11020-F | C365: Жилет MOLLE type ARMOR VEST флектарн ||M51611020-GF | D365: 29.24 | E365: usd | F365: 10 | G365: 27.74 | H365: 0.05 | I365: 277.40 | J365: -5570.60 | K365: 0 | L365: =RC[-3]/100*RC[-1] -> 0.05
A366: 5 | B366: K11014-A | C366: Жилет PT Tactical Body Armor ACU ||M51611014-ACU | D366: 13.21 | E366: usd | F366: 5 | G366: 12.06 | H366: 0.05 | I366: 60.30 | J366: -1260.70 | K366: 0 | L366: =RC[-3]/100*RC[-1] -> 0.05
A367: 6 | B367: K11014-C | C367: Жилет PT Tactical Body Armor койот ||M51611014-TAN | D367: 13.21 | E367: usd | F367: 49 | G367: 12.62 | H367: 0.05 | I367: 618.38 | J367: -12327.42 | K367: 0 | L367: =RC[-3]/100*RC[-1] -> 0.05
A368: 7 | B368: K11014-C | C368: Жилет PT Tactical Body Armor койот ||M51611014-TAN | D368: 13.21 | E368: usd | F368: 11 | G368: 12.62 | H368: 0.05 | I368: 138.82 | J368: -2767.38 | K368: 0 | L368: =RC[-3]/100*RC[-1] -> 0.05
A369: 8 | B369: K11014-O | C369: Жилет PT Tactical Body Armor олива ||M51611014-OD | D369: 13.21 | E369: usd | F369: 91 | G369: 12.62 | H369: 0.05 | I369: 1148.42 | J369: -22893.78 | K369: 0 | L369: =RC[-3]/100*RC[-1] -> 0.05
A370: 9 | B370: K11014-O | C370: Жилет PT Tactical Body Armor олива ||M51611014-OD | D370: 13.21 | E370: usd | F370: 9 | G370: 12.62 | H370: 0.05 | I370: 113.58 | J370: -2264.22 | K370: 0 | L370: =RC[-3]/100*RC[-1] -> 0.05
A371: 10 | B371: K11014-B | C371: Жилет PT Tactical Body Armor чёрный ||M51611014-BK | D371: 13.21 | E371: usd | F371: 14 | G371: 12.62 | H371: 0.05 | I371: 176.68 | J371: -3522.12 | K371: 0 | L371: =RC[-3]/100*RC[-1] -> 0.05
A372: 11 | B372: K11014-B | C372: Жилет PT Tactical Body Armor чёрный ||M51611014-BK | D372: 13.21 | E372: usd | F372: 6 | G372: 12.62 | H372: 0.05 | I372: 75.72 | J372: -1509.48 | K372: 0 | L372: =RC[-3]/100*RC[-1] -> 0.05
A373: 12 | B373: K17074-O | C373: Комплект (наколенники и налокотники) олива ||M51617074-OD | D373: 9.00 | E373: usd | F373: 88 | G373: 11.04 | H373: 0.06 | I373: 971.52 | J373: -14868.48 | K373: 0 | L373: =RC[-3]/100*RC[-1] -> 0.06
A374: 13 | B374: K17074-O | C374: Комплект (наколенники и налокотники) олива ||M51617074-OD | D374: 9.00 | E374: usd | F374: 12 | G374: 11.04 | H374: 0.06 | I374: 132.48 | J374: -2027.52 | K374: 0 | L374: =RC[-3]/100*RC[-1] -> 0.06
A375: 14 | B375: K17081-O | C375: Комплект (наколенники и налокотники) олива ||M51617081-OD | D375: 5.07 | E375: usd | F375: 75 | G375: 5.07 | H375: 0.05 | I375: 380.25 | J375: -7224.75 | K375: 0 | L375: =RC[-3]/100*RC[-1] -> 0.05
A376: 15 | B376: K17081-O | C376: Комплект (наколенники и налокотники) олива ||M51617081-OD | D376: 5.07 | E376: usd | F376: 25 | G376: 5.07 | H376: 0.05 | I376: 126.75 | J376: -2408.25 | K376: 0 | L376: =RC[-3]/100*RC[-1] -> 0.05
A377: 16 | B377: K17074-B | C377: Комплект (наколенники и налокотники) чёрные ||M51617074-BK | D377: 9.00 | E377: usd | F377: 58 | G377: 12.08 | H377: 0.07 | I377: 700.64 | J377: -9739.36 | K377: 0 | L377: =RC[-3]/100*RC[-1] -> 0.07
A378: 17 | B378: K17074-B | C378: Комплект (наколенники и налокотники) чёрные ||M51617074-BK | D378: 9.00 | E378: usd | F378: 12 | G378: 12.08 | H378: 0.07 | I378: 144.96 | J378: -2015.04 | K378: 0 | L378: =RC[-3]/100*RC[-1] -> 0.07
A379: 18 | B379: _BD2452 | C379: Очки FA02 goggle-trasparent [Производитель: ACM] | D379: 3.42 | E379: usd | F379: 50 | G379: 3.52 | H379: 0.05 | I379: 176.00 | J379: -3244.00 | K379: 0 | L379: =RC[-3]/100*RC[-1] -> 0.05
A380: 19 | B380: _BD2454 | C380: Очки FA02 goggle-yellow [Производитель: ACM] | D380: 3.45 | E380: usd | F380: 50 | G380: 3.52 | H380: 0.05 | I380: 176.00 | J380: -3274.00 | K380: 0 | L380: =RC[-3]/100*RC[-1] -> 0.05
A381: 20 | B381: _K17122-Y | C381: Очки FL8008 жёлтые ||M51617122-YELLOW | D381: 3.70 | E381: usd | F381: 20 | G381: 3.48 | H381: 0.05 | I381: 69.60 | J381: -1410.40 | K381: 0 | L381: =RC[-3]/100*RC[-1] -> 0.05
A382: 21 | B382: _K17122-T | C382: Очки FL8008 прозрачные ||M51617122-TRANSP | D382: 3.48 | E382: usd | F382: 40 | G382: 3.48 | H382: 0.05 | I382: 139.20 | J382: -2644.80 | K382: 0 | L382: =RC[-3]/100*RC[-1] -> 0.05
A383: 22 | B383: _K17063-TE | C383: Очки GX-1000 димчасті ||M51617063-TEA BD2446 | D383: 5.80 | E383: usd | F383: 40 | G383: 5.98 | H383: 0.05 | I383: 239.20 | J383: -4400.80 | K383: 0 | L383: =RC[-3]/100*RC[-1] -> 0.05
A384: 23 | B384: _K17063-TE | C384: Очки GX-1000 димчасті ||M51617063-TEA BD2446 | D384: 5.80 | E384: usd | F384: 10 | G384: 5.98 | H384: 0.05 | I384: 59.80 | J384: -1100.20 | K384: 0 | L384: =RC[-3]/100*RC[-1] -> 0.05
A385: 24 | B385: _K17063-Y | C385: Очки GX-1000 жёлтые ||M51617063-YELLOW BD2448 | D385: 5.80 | E385: usd | F385: 40 | G385: 5.80 | H385: 0.05 | I385: 232.00 | J385: -4408.00 | K385: 0 | L385: =RC[-3]/100*RC[-1] -> 0.05
A386: 25 | B386: _K17063-Y | C386: Очки GX-1000 жёлтые ||M51617063-YELLOW BD2448 | D386: 5.80 | E386: usd | F386: 10 | G386: 5.80 | H386: 0.05 | I386: 58.00 | J386: -1102.00 | K386: 0 | L386: =RC[-3]/100*RC[-1] -> 0.05
A387: 26 | B387: BD6472 | C387: Очки защитные PROFILE койот [Производитель: ACM] | D387: 9.40 | E387: usd | F387: 20 | G387: 9.40 | H387: 0.05 | I387: 188.00 | J387: -3572.00 | K387: 0 | L387: =RC[-3]/100*RC[-1] -> 0.05
A388: 27 | B388: BD6471 | C388: Очки защитные PROFILE олива [Производитель: ACM] | D388: 9.40 | E388: usd | F388: 70 | G388: 9.40 | H388: 0.05 | I388: 658.00 | J388: -12502.00 | K388: 0 | L388: =RC[-3]/100*RC[-1] -> 0.05
A389: 28 | B389: BD6471 | C389: Очки защитные PROFILE олива [Производитель: ACM] | D389: 9.40 | E389: usd | F389: 20 | G389: 9.40 | H389: 0.05 | I389: 188.00 | J389: -3572.00 | K389: 0 | L389: =RC[-3]/100*RC[-1] -> 0.05
A390: 29 | B390: BD6470 | C390: Очки защитные PROFILE чёрные [Производитель: ACM] | D390: 9.40 | E390: usd | F390: 20 | G390: 9.40 | H390: 0.05 | I390: 188.00 | J390: -3572.00 | K390: 0 | L390: =RC[-3]/100*RC[-1] -> 0.05
A391: 30 | B391: BD6470 | C391: Очки защитные PROFILE чёрные [Производитель: ACM] | D391: 9.40 | E391: usd | F391: 20 | G391: 9.40 | H391: 0.05 | I391: 188.00 | J391: -3572.00 | K391: 0 | L391: =RC[-3]/100*RC[-1] -> 0.05
A392: 31 | B392: BD2503 | C392: Очки защитные RAZOR койот [Производитель: ACM] | D392: 12.65 | E392: usd | F392: 10 | G392: 12.92 | H392: 0.05 | I392: 129.20 | J392: -2400.80 | K392: 0 | L392: =RC[-3]/100*RC[-1] -> 0.05
A393: 32 | B393: BD2502 | C393: Очки защитные RAZOR олива [Производитель: ACM] | D393: 11.98 | E393: usd | F393: 20 | G393: 12.92 | H393: 0.05 | I393: 258.40 | J393: -4533.60 | K393: 0 | L393: =RC[-3]/100*RC[-1] -> 0.05
A394: 33 | B394: BD2501 | C394: Очки защитные RAZOR чёрные [Производитель: ACM] | D394: 12.65 | E394: usd | F394: 20 | G394: 12.92 | H394: 0.05 | I394: 258.40 | J394: -4801.60 | K394: 0 | L394: =RC[-3]/100*RC[-1] -> 0.05
A395: 34 | B395: BD2501 | C395: Очки защитные RAZOR чёрные [Производитель: ACM] | D395: 12.65 | E395: usd | F395: 20 | G395: 12.92 | H395: 0.05 | I395: 258.40 | J395: -4801.60 | K395: 0 | L395: =RC[-3]/100*RC[-1] -> 0.05
A396: 35 | B396: _K17066-W | C396: Очки защитные жёлтые ||M51617066-YELLOW | D396: 2.97 | E396: usd | F396: 40 | G396: 2.93 | H396: 0.05 | I396: 117.20 | J396: -2258.80 | K396: 0 | L396: =RC[-3]/100*RC[-1] -> 0.05
A397: 36 | B397: _K17066-B | C397: Окуляри защитные чёрные ||M51617066-TEA | D397: 2.97 | E397: usd | F397: 40 | G397: 2.93 | H397: 0.05 | I397: 117.20 | J397: -2258.80 | K397: 0 | L397: =RC[-3]/100*RC[-1] -> 0.05
A398: 37 | B398: K11010-W | C398: Плечеременная разгрузочная система вудлэнд ||M51611010-WL | D398: 24.23 | E398: usd | F398: 10 | G398: 24.23 | H398: 0.05 | I398: 242.30 | J398: -4603.70 | K398: 0 | L398: =RC[-3]/100*RC[-1] -> 0.05
A399: 38 | B399: K11010-C | C399: Плечеременная разгрузочная система койот ||M51611010-TAN | D399: 24.23 | E399: usd | F399: 10 | G399: 24.23 | H399: 0.05 | I399: 242.30 | J399: -4603.70 | K399: 0 | L399: =RC[-3]/100*RC[-1] -> 0.05
A400: 39 | B400: K11010-B | C400: Плечеременная разгрузочная система чёрная ||M51611010-BK | D400: 24.23 | E400: usd | F400: 10 | G400: 24.23 | H400: 0.05 | I400: 242.30 | J400: -4603.70 | K400: 0 | L400: =RC[-3]/100*RC[-1] -> 0.05
A401: 40 | B401: K11010-B | C401: Плечеременная разгрузочная система чёрная ||M51611010-BK | D401: 24.23 | E401: usd | F401: 10 | G401: 24.23 | H401: 0.05 | I401: 242.30 | J401: -4603.70 | K401: 0 | L401: =RC[-3]/100*RC[-1] -> 0.05
A402: 41 | B402: K12085-O | C402: Подсумок ремн. універс. для оружия олива [A.C.M] ||M51612085-OD | D402: 11.09 | E402: usd | F402: 2 | G402: 11.32 | H402: 0.05 | I402: 22.64 | J402: -420.96 | K402: 0 | L402: =RC[-3]/100*RC[-1] -> 0.05
A403: 42 | B403: K12085-B | C403: Подсумок ремн. універс. для оружия чёрный [A.C.M] ||M51612085-BK | D403: 11.09 | E403: usd | F403: 5 | G403: 11.32 | H403: 0.05 | I403: 56.60 | J403: -1052.40 | K403: 0 | L403: =RC[-3]/100*RC[-1] -> 0.05
A404: 43 | B404: K12085-B | C404: Подсумок ремн. універс. для оружия чёрный [A.C.M] ||M51612085-BK | D404: 11.09 | E404: usd | F404: 9 | G404: 11.32 | H404: 0.05 | I404: 101.88 | J404: -1894.32 | K404: 0 | L404: =RC[-3]/100*RC[-1] -> 0.05
A405: 44 | B405: K17083-O | C405: Реплика шлема MICH2000 ABS олива ||M51617083-OD | D405: 18.20 | E405: usd | F405: 15 | G405: 18.20 | H405: 0.05 | I405: 273.00 | J405: -5187.00 | K405: 0 | L405: =RC[-3]/100*RC[-1] -> 0.05
A406: 45 | B406: K17083-O | C406: Реплика шлема MICH2000 ABS олива ||M51617083-OD | D406: 18.20 | E406: usd | F406: 5 | G406: 18.20 | H406: 0.05 | I406: 91.00 | J406: -1729.00 | K406: 0 | L406: =RC[-3]/100*RC[-1] -> 0.05
A407: 46 | B407: K17083-B | C407: Реплика шлема MICH2000 ABS чёрный ||M51617083-BK | D407: 18.20 | E407: usd | F407: 40 | G407: 18.20 | H407: 0.05 | I407: 728.00 | J407: -13832.00 | K407: 0 | L407: =RC[-3]/100*RC[-1] -> 0.05
A408: 47 | B408: K17083-B | C408: Реплика шлема MICH2000 ABS чёрный ||M51617083-BK | D408: 18.20 | E408: usd | F408: 15 | G408: 18.20 | H408: 0.05 | I408: 273.00 | J408: -5187.00 | K408: 0 | L408: =RC[-3]/100*RC[-1] -> 0.05
A409: 48 | B409: K17083-B | C409: Реплика шлема MICH2000 ABS чёрный ||M51617083-BK | D409: 18.20 | E409: usd | F409: 5 | G409: 18.20 | H409: 0.05 | I409: 91.00 | J409: -1729.00 | K409: 0 | L409: =RC[-3]/100*RC[-1] -> 0.05
A410: 49 | B410: K17084-C | C410: Реплика шлема MICH2002 койот ||M51617084-TAN (K5-0261-O) | D410: 18.20 | E410: usd | F410: 5 | G410: 18.20 | H410: 0.05 | I410: 91.00 | J410: -1729.00 | K410: 0 | L410: =RC[-3]/100*RC[-1] -> 0.05
A411: 50 | B411: K17084-C | C411: Реплика шлема MICH2002 койот ||M51617084-TAN (K5-0261-O) | D411: 18.20 | E411: usd | F411: 5 | G411: 18.20 | H411: 0.05 | I411: 91.00 | J411: -1729.00 | K411: 0 | L411: =RC[-3]/100*RC[-1] -> 0.05
A412: 51 | B412: K17084-O | C412: Реплика шлема MICH2002 олива ||M51617084-OD (K5-0261-O) | D412: 18.20 | E412: usd | F412: 5 | G412: 18.20 | H412: 0.05 | I412: 91.00 | J412: -1729.00 | K412: 0 | L412: =RC[-3]/100*RC[-1] -> 0.05
A413: 52 | B413: K17084-O | C413: Реплика шлема MICH2002 олива ||M51617084-OD (K5-0261-O) | D413: 18.20 | E413: usd | F413: 5 | G413: 18.20 | H413: 0.05 | I413: 91.00 | J413: -1729.00 | K413: 0 | L413: =RC[-3]/100*RC[-1] -> 0.05
A414: 53 | B414: K17084-B | C414: Реплика шлема MICH2002 чёрный ||M51617084-BK (K5-0261-B) | D414: 18.20 | E414: usd | F414: 15 | G414: 18.20 | H414: 0.05 | I414: 273.00 | J414: -5187.00 | K414: 0 | L414: =RC[-3]/100*RC[-1] -> 0.05
A415: 54 | B415: K17084-B | C415: Реплика шлема MICH2002 чёрный ||M51617084-BK (K5-0261-B) | D415: 18.20 | E415: usd | F415: 5 | G415: 18.20 | H415: 0.05 | I415: 91.00 | J415: -1729.00 | K415: 0 | L415: =RC[-3]/100*RC[-1] -> 0.05
A416: 55 | B416: K11161-A | C416: Розгруз. Hard Armor Plate Carrier ACU ||M51611161-ACU | D416: 12.53 | E416: usd | F416: 14 | G416: 12.53 | H416: 0.05 | I416: 175.42 | J416: -3332.98 | K416: 0 | L416: =RC[-3]/100*RC[-1] -> 0.05
A417: 56 | B417: K11161-A | C417: Розгруз. Hard Armor Plate Carrier ACU ||M51611161-ACU | D417: 12.53 | E417: usd | F417: 6 | G417: 12.53 | H417: 0.05 | I417: 75.18 | J417: -1428.42 | K417: 0 | L417: =RC[-3]/100*RC[-1] -> 0.05
A418: 57 | B418: K11161-F | C418: Розгруз. Hard Armor Plate Carrier флектарн ||M51611161-GF | D418: 12.53 | E418: usd | F418: 14 | G418: 12.53 | H418: 0.05 | I418: 175.42 | J418: -3332.98 | K418: 0 | L418: =RC[-3]/100*RC[-1] -> 0.05
A419: 58 | B419: K11161-F | C419: Розгруз. Hard Armor Plate Carrier флектарн ||M51611161-GF | D419: 12.53 | E419: usd | F419: 6 | G419: 12.53 | H419: 0.05 | I419: 75.18 | J419: -1428.42 | K419: 0 | L419: =RC[-3]/100*RC[-1] -> 0.05
A420: 59 | B420: K11162-A | C420: Розгруз. Interceptor Body Armour ACU [A.C.M] ||M51611162-ACU | D420: 39.00 | E420: usd | F420: 6 | G420: 39.00 | H420: 0.05 | I420: 234.00 | J420: -4446.00 | K420: 0 | L420: =RC[-3]/100*RC[-1] -> 0.05
A421: 60 | B421: K11162-W | C421: Розгруз. Interceptor Body Armour вудлэнд [A.C.M] ||M51611162-WL | D421: 39.00 | E421: usd | F421: 6 | G421: 39.00 | H421: 0.05 | I421: 234.00 | J421: -4446.00 | K421: 0 | L421: =RC[-3]/100*RC[-1] -> 0.05
A422: 61 | B422: K11162-C | C422: Розгруз. Interceptor Body Armour койот [A.C.M] ||M51611162-TAN | D422: 39.00 | E422: usd | F422: 6 | G422: 39.00 | H422: 0.05 | I422: 234.00 | J422: -4446.00 | K422: 0 | L422: =RC[-3]/100*RC[-1] -> 0.05
A423: 62 | B423: K11162-O | C423: Розгруз. Interceptor Body Armour олива [A.C.M] ||M51611162-OD | D423: 39.00 | E423: usd | F423: 6 | G423: 39.00 | H423: 0.05 | I423: 234.00 | J423: -4446.00 | K423: 0 | L423: =RC[-3]/100*RC[-1] -> 0.05
A424: 63 | B424: K11162-B | C424: Розгруз. Interceptor Body Armour чёрный [A.C.M] ||M51611162-BK | D424: 39.00 | E424: usd | F424: 6 | G424: 39.00 | H424: 0.05 | I424: 234.00 | J424: -4446.00 | K424: 0 | L424: =RC[-3]/100*RC[-1] -> 0.05
A425: 64 | B425: K11008-B | C425: Розгруз. Plate Carrier Side Cummerbund чёрный ||M51611008-BK | D425: 29.00 | E425: usd | F425: 26 | G425: 28.68 | H425: 0.05 | I425: 745.68 | J425: -14334.32 | K425: 0 | L425: =RC[-3]/100*RC[-1] -> 0.05
A426: 65 | B426: K11008-B | C426: Розгруз. Plate Carrier Side Cummerbund чёрный ||M51611008-BK | D426: 29.00 | E426: usd | F426: 8 | G426: 28.68 | H426: 0.05 | I426: 229.44 | J426: -4410.56 | K426: 0 | L426: =RC[-3]/100*RC[-1] -> 0.05 | M426: =SUM(R[-65]C[-1]:RC[-1]) -> 
A428: #1514 (2014-02-20) Radioprofi - Прихід товару
A429: N | B429: арт | C429: назва | D429: закуп | F429: к-ть | G429: цiна | H429: кф | I429: продж | J429: дохiд | K429: % | L429: з-та
A430: 1 | B430: _26-0694 | C430: Батарея к рации KENWOOD кітай TH-K2AT / TH-K4AT Li-ion 1300mAp [Китай] | D430: 8.00 | E430: usd | F430: 10 | G430: 8.00 | H430: 0.05 | I430: 80.00 | J430: -1520.00 | K430: 0 | L430: =RC[-3]/100*RC[-1] -> 0.05
A431: 2 | B431: _26-0008 | C431: Гарнитура к KENWOOD Quansheng Puxing Motorola GP-888(3х провод.) [Китай] | D431: 13.00 | E431: usd | F431: 10 | G431: 8.00 | H431: 0.03 | I431: 80.00 | J431: -2520.00 | K431: 0 | L431: =RC[-3]/100*RC[-1] -> 0.03
A432: 3 | B432: _26-0014 | C432: Гарнитура к KENWOOD Quansheng Puxing Motorola GP-888(кн.палец, воздуховод) [Китай] | D432: 9.00 | E432: usd | F432: 10 | G432: 9.00 | H432: 0.05 | I432: 90.00 | J432: -1710.00 | K432: 0 | L432: =RC[-3]/100*RC[-1] -> 0.05
A433: 4 | B433: _26-0696 | C433: Рация PUXING PX-2R 400-470МГц, 3Вт, FM | D433: 52.80 | E433: usd | F433: 10 | G433: 35.00 | H433: 0.03 | I433: 350.00 | J433: -10210.00 | K433: 0 | L433: =RC[-3]/100*RC[-1] -> 0.03
A434: 5 | B434: 26-0710 | C434: Рация VOYAGER AirSoft (136-174 / 400-470)МГц, 5Вт,2200mAp Li-ion (+гарнітура) | D434: 85.00 | E434: usd | F434: 45 | G434: 50.00 | H434: 0.03 | I434: 2250.00 | J434: -74250.00 | K434: 0 | L434: =RC[-3]/100*RC[-1] -> 0.03
A435: 6 | B435: 26-0714 | C435: Рация VOYAGER CTCSS/DCS PMR+ 2Вт,1500mAp Li-ion + гірнітура | D435: 27.00 | E435: usd | F435: 10 | G435: 27.00 | H435: 0.05 | I435: 270.00 | J435: -5130.00 | K435: 0 | L435: =RC[-3]/100*RC[-1] -> 0.05
A436: 7 | B436: 26-0716 | C436: Рация VOYAGER UF-Q7 5W 400-480,1800mAp Li-ion водостійка | D436: 60.00 | E436: usd | F436: 23 | G436: 60.00 | H436: 0.05 | I436: 1380.00 | J436: -26220.00 | K436: 0 | L436: =RC[-3]/100*RC[-1] -> 0.05 | M436: =SUM(R[-7]C[-1]:RC[-1]) -> 
A438: #1559 (2014-02-21) ЛАТЕК - Прихід товару
A439: N | B439: арт | C439: назва | D439: закуп | F439: к-ть | G439: цiна | H439: кф | I439: продж | J439: дохiд | K439: % | L439: з-та
A440: 1 | B440: _10065 | C440: Кобура поясная C-11 (скоба) | D440: 4.75 | E440: Инт | F440: 0 | G440: 54.00 | H440: 0.57 | I440: 0.00 | J440: 0.00 | K440: 0 | L440: =RC[-3]/100*RC[-1] -> 0.57
A441: 2 | B441: _10065 | C441: Кобура поясная C-11 (скоба) | D441: 4.75 | E441: Инт | F441: 2 | G441: 54.00 | H441: 0.57 | I441: 108.00 | J441: -82.00 | K441: 0 | L441: =RC[-3]/100*RC[-1] -> 0.57
A442: 3 | B442: _10065 | C442: Кобура поясная C-11 (скоба) | D442: 4.75 | E442: Инт | F442: 1 | G442: 54.00 | H442: 0.57 | I442: 54.00 | J442: -41.00 | K442: 0 | L442: =RC[-3]/100*RC[-1] -> 0.57
A443: 4 | B443: _1592 | C443: Кобура поясная Флобер (Лягушка) | D443: 3.40 | E443: Инт | F443: 0 | G443: 41.00 | H443: 0.60 | I443: 0.00 | J443: 0.00 | K443: 0 | L443: =RC[-3]/100*RC[-1] -> 0.60
A444: 5 | B444: _1592 | C444: Кобура поясная Флобер (Лягушка) | D444: 3.40 | E444: Инт | F444: 2 | G444: 41.00 | H444: 0.60 | I444: 82.00 | J444: -54.00 | K444: 0 | L444: =RC[-3]/100*RC[-1] -> 0.60
A445: 6 | B445: _1592 | C445: Кобура поясная Флобер (Лягушка) | D445: 3.40 | E445: Инт | F445: 1 | G445: 41.00 | H445: 0.60 | I445: 41.00 | J445: -27.00 | K445: 0 | L445: =RC[-3]/100*RC[-1] -> 0.60
A446: 7 | B446: _1559 | C446: Кобура універсальна А-111 ФОРТ-17 (чёрная) | D446: 8.64 | E446: Инт | F446: 0 | G446: 108.00 | H446: 0.63 | I446: 0.00 | J446: 0.00 | K446: 0 | L446: =RC[-3]/100*RC[-1] -> 0.63
A447: 8 | B447: _1559 | C447: Кобура універсальна А-111 ФОРТ-17 (чёрная) | D447: 8.64 | E447: Инт | F447: 2 | G447: 108.00 | H447: 0.63 | I447: 216.00 | J447: -129.60 | K447: 0 | L447: =RC[-3]/100*RC[-1] -> 0.63
A448: 9 | B448: _1559 | C448: Кобура універсальна А-111 ФОРТ-17 (чёрная) | D448: 8.64 | E448: Инт | F448: 1 | G448: 108.00 | H448: 0.63 | I448: 108.00 | J448: -64.80 | K448: 0 | L448: =RC[-3]/100*RC[-1] -> 0.63
A449: 10 | B449: _1575 | C449: Кобура универсальная ПМ (с чехлом под магазин и наручники) | D449: 16.50 | E449: Инт | F449: 0 | G449: 198.00 | H449: 0.60 | I449: 0.00 | J449: 0.00 | K449: 0 | L449: =RC[-3]/100*RC[-1] -> 0.60
A450: 11 | B450: _1575 | C450: Кобура универсальная ПМ (с чехлом под магазин и наручники) | D450: 16.50 | E450: Инт | F450: 3 | G450: 198.00 | H450: 0.60 | I450: 594.00 | J450: -396.00 | K450: 0 | L450: =RC[-3]/100*RC[-1] -> 0.60
A451: 12 | B451: _1555 | C451: Кобура универсальная ПМ (чёрная) | D451: 9.00 | E451: Инт | F451: 0 | G451: 107.00 | H451: 0.59 | I451: 0.00 | J451: 0.00 | K451: 0 | L451: =RC[-3]/100*RC[-1] -> 0.59
A452: 13 | B452: _1555 | C452: Кобура универсальная ПМ (чёрная) | D452: 9.00 | E452: Инт | F452: 6 | G452: 107.00 | H452: 0.59 | I452: 642.00 | J452: -438.00 | K452: 0 | L452: =RC[-3]/100*RC[-1] -> 0.59
A453: 14 | B453: _1555 | C453: Кобура универсальная ПМ (чёрная) | D453: 9.00 | E453: Инт | F453: 1 | G453: 107.00 | H453: 0.59 | I453: 107.00 | J453: -73.00 | K453: 0 | L453: =RC[-3]/100*RC[-1] -> 0.59
A454: 15 | B454: _1564 | C454: Кобура универсальная Флобер чёрная | D454: 8.90 | E454: Инт | F454: 0 | G454: 107.00 | H454: 0.60 | I454: 0.00 | J454: 0.00 | K454: 0 | L454: =RC[-3]/100*RC[-1] -> 0.60
A455: 16 | B455: _1564 | C455: Кобура универсальная Флобер чёрная | D455: 8.90 | E455: Инт | F455: 9 | G455: 107.00 | H455: 0.60 | I455: 963.00 | J455: -639.00 | K455: 0 | L455: =RC[-3]/100*RC[-1] -> 0.60
A456: 17 | B456: _1564 | C456: Кобура универсальная Флобер чёрная | D456: 8.90 | E456: Инт | F456: 1 | G456: 107.00 | H456: 0.60 | I456: 107.00 | J456: -71.00 | K456: 0 | L456: =RC[-3]/100*RC[-1] -> 0.60
A457: 18 | B457: _18914 | C457: Пістолет сигнальный EKOL ARAS compact (хром с позолотою) | D457: 61.71 | E457: Инт | F457: 0 | G457: 80.00 | H457: 0.06 | I457: 0.00 | J457: 0.00 | K457: 0 | L457: =RC[-3]/100*RC[-1] -> 0.06
A458: 19 | B458: _18914 | C458: Пістолет сигнальный EKOL ARAS compact (хром с позолотою) | D458: 61.71 | E458: Инт | F458: 2 | G458: 80.00 | H458: 0.06 | I458: 160.00 | J458: -2308.57 | K458: 0 | L458: =RC[-3]/100*RC[-1] -> 0.06
A459: 20 | B459: _19754 | C459: Пістолет сигнальный EKOL Lady (сатин с позолотой) | D459: 51.43 | E459: Инт | F459: 0 | G459: 60.00 | H459: 0.06 | I459: 0.00 | J459: 0.00 | K459: 0 | L459: =RC[-3]/100*RC[-1] -> 0.06
A460: 21 | B460: _19754 | C460: Пістолет сигнальный EKOL Lady (сатин с позолотой) | D460: 51.43 | E460: Инт | F460: 1 | G460: 60.00 | H460: 0.06 | I460: 60.00 | J460: -968.57 | K460: 0 | L460: =RC[-3]/100*RC[-1] -> 0.06
A461: 22 | B461: _19754 | C461: Пістолет сигнальный EKOL Lady (сатин с позолотой) | D461: 51.43 | E461: Инт | F461: 1 | G461: 60.00 | H461: 0.06 | I461: 60.00 | J461: -968.57 | K461: 0 | L461: =RC[-3]/100*RC[-1] -> 0.06
A462: 23 | B462: _6573 | C462: Пістолет сигнальный EKOL Lady (чёрный) | D462: 4.29 | E462: Инт | F462: 0 | G462: 53.00 | H462: 0.62 | I462: 0.00 | J462: 0.00 | K462: 0 | L462: =RC[-3]/100*RC[-1] -> 0.62
A463: 24 | B463: _6573 | C463: Пістолет сигнальный EKOL Lady (чёрный) | D463: 4.29 | E463: Инт | F463: 1 | G463: 53.00 | H463: 0.62 | I463: 53.00 | J463: -32.71 | K463: 0 | L463: =RC[-3]/100*RC[-1] -> 0.62
A464: 25 | B464: _6573 | C464: Пістолет сигнальный EKOL Lady (чёрный) | D464: 4.29 | E464: Инт | F464: 1 | G464: 53.00 | H464: 0.62 | I464: 53.00 | J464: -32.71 | K464: 0 | L464: =RC[-3]/100*RC[-1] -> 0.62
A465: 26 | B465: _19178 | C465: Револьвер под патрон Флобера Voltran EKOL Arda (чёрный) | D465: 913.50 | E465: zl | F465: 0 | G465: 65.00 | H465: 0.01 | I465: 0.00 | J465: 0.00 | K465: 0 | L465: =RC[-3]/100*RC[-1] -> 0.01
A466: 27 | B466: _19178 | C466: Револьвер под патрон Флобера Voltran EKOL Arda (чёрный) | D466: 913.50 | E466: zl | F466: 1 | G466: 65.00 | H466: 0.01 | I466: 65.00 | J466: -4502.50 | K466: 0 | L466: =RC[-3]/100*RC[-1] -> 0.01 | M466: =SUM(R[-27]C[-1]:RC[-1]) -> 
A468: #1560 (2014-02-21) Федик Тарас - Прихід товару
A469: N | B469: арт | C469: назва | D469: закуп | F469: к-ть | G469: цiна | H469: кф | I469: продж | J469: дохiд | K469: % | L469: з-та
A470: 1 | B470: _Tr-3008 | C470: Каремат туристический Optima Light ППЭ НХ 3008 | D470: 3.76 | E470: Инт | F470: 2 | G470: 52.70 | H470: 0.70 | I470: 105.40 | J470: -45.17 | K470: 0 | L470: =RC[-3]/100*RC[-1] -> 0.70
A471: 2 | B471: _Tr-3008 | C471: Каремат туристический Optima Light ППЭ НХ 3008 | D471: 3.76 | E471: Инт | F471: 1 | G471: 52.70 | H471: 0.70 | I471: 52.70 | J471: -22.59 | K471: 0 | L471: =RC[-3]/100*RC[-1] -> 0.70
A472: 3 | B472: _Tr-1508-1 | C472: Каремат туристический Tourist Profi ППЭ НР 1508 | D472: 6.84 | E472: Инт | F472: 1 | G472: 95.80 | H472: 0.70 | I472: 95.80 | J472: -41.06 | K472: 0 | L472: =RC[-3]/100*RC[-1] -> 0.70
A473: 4 | B473: _Tr-1508-1 | C473: Каремат туристический Tourist Profi ППЭ НР 1508 | D473: 6.84 | E473: Инт | F473: 1 | G473: 95.80 | H473: 0.70 | I473: 95.80 | J473: -41.06 | K473: 0 | L473: =RC[-3]/100*RC[-1] -> 0.70
A474: 5 | B474: _Tr-3008-1 | C474: Каремат туристический Decor Камуфляж ППЭ НХ 3008 | D474: 4.84 | E474: Инт | F474: 4 | G474: 67.80 | H474: 0.70 | I474: 271.20 | J474: -116.23 | K474: 0 | L474: =RC[-3]/100*RC[-1] -> 0.70
A475: 6 | B475: _Tr-3008-1 | C475: Каремат туристический Decor Камуфляж ППЭ НХ 3008 | D475: 4.84 | E475: Инт | F475: 1 | G475: 67.80 | H475: 0.70 | I475: 67.80 | J475: -29.06 | K475: 0 | L475: =RC[-3]/100*RC[-1] -> 0.70 | M475: =SUM(R[-6]C[-1]:RC[-1]) -> 
A477: #1631 (2014-02-24) ЛАТЕК - Прихід товару
A478: N | B478: арт | C478: назва | D478: закуп | F478: к-ть | G478: цiна | H478: кф | I478: продж | J478: дохiд | K478: % | L478: з-та
A479: 1 | B479: _PR25031 | C479: Револьвер под патрон Флобера PROFI 3 (сатин/пласт) | D479: 124.40 | E479: usd | F479: 0 | G479: 124.40 | H479: 0.05 | I479: 0.00 | J479: 0.00 | K479: 0 | L479: =RC[-3]/100*RC[-1] -> 0.05
A480: 2 | B480: _PR25031 | C480: Револьвер под патрон Флобера PROFI 3 (сатин/пласт) | D480: 124.40 | E480: usd | F480: 1 | G480: 124.40 | H480: 0.05 | I480: 124.40 | J480: -2363.60 | K480: 0 | L480: =RC[-3]/100*RC[-1] -> 0.05
A481: 3 | B481: _PR2503 | C481: Револьвер под патрон Флобера PROFI 3 (бук) | D481: 119.21 | E481: Инт | F481: 0 | G481: 116.70 | H481: 0.05 | I481: 0.00 | J481: 0.00 | K481: 0 | L481: =RC[-3]/100*RC[-1] -> 0.05
A482: 4 | B482: _PR2503 | C482: Револьвер под патрон Флобера PROFI 3 (бук) | D482: 119.21 | E482: Инт | F482: 1 | G482: 116.70 | H482: 0.05 | I482: 116.70 | J482: -2267.58 | K482: 0 | L482: =RC[-3]/100*RC[-1] -> 0.05
A483: 5 | B483: _PR2501 | C483: Револьвер под патрон Флобера PROFI 3 (пластик чёрный) | D483: 117.64 | E483: Инт | F483: 0 | G483: 112.20 | H483: 0.05 | I483: 0.00 | J483: 0.00 | K483: 0 | L483: =RC[-3]/100*RC[-1] -> 0.05
A484: 6 | B484: _PR2501 | C484: Револьвер под патрон Флобера PROFI 3 (пластик чёрный) | D484: 117.64 | E484: Инт | F484: 1 | G484: 112.20 | H484: 0.05 | I484: 112.20 | J484: -2240.66 | K484: 0 | L484: =RC[-3]/100*RC[-1] -> 0.05
A485: 7 | B485: _PR2504 | C485: Револьвер под патрон Флобера PROFI 4.5 (бук) | D485: 125.00 | E485: usd | F485: 0 | G485: 118.90 | H485: 0.05 | I485: 0.00 | J485: 0.00 | K485: 0 | L485: =RC[-3]/100*RC[-1] -> 0.05
A486: 8 | B486: _PR2504 | C486: Револьвер под патрон Флобера PROFI 4.5 (бук) | D486: 125.00 | E486: usd | F486: 1 | G486: 118.90 | H486: 0.05 | I486: 118.90 | J486: -2381.10 | K486: 0 | L486: =RC[-3]/100*RC[-1] -> 0.05
A487: 9 | B487: _PR2505 | C487: Револьвер под патрон Флобера PROFI 4.5 (пластик чёрный) | D487: 116.71 | E487: Инт | F487: 0 | G487: 114.40 | H487: 0.05 | I487: 0.00 | J487: 0.00 | K487: 0 | L487: =RC[-3]/100*RC[-1] -> 0.05
A488: 10 | B488: _PR2505 | C488: Револьвер под патрон Флобера PROFI 4.5 (пластик чёрный) | D488: 116.71 | E488: Инт | F488: 1 | G488: 114.40 | H488: 0.05 | I488: 114.40 | J488: -2219.88 | K488: 0 | L488: =RC[-3]/100*RC[-1] -> 0.05
A489: 11 | B489: _17811 | C489: Револьвер под патрон Флобера SNIPE - 6" (бук) | D489: 182.48 | E489: Инт | F489: 0 | G489: 190.18 | H489: 0.05 | I489: 0.00 | J489: 0.00 | K489: 0 | L489: =RC[-3]/100*RC[-1] -> 0.05
A490: 12 | B490: _17811 | C490: Револьвер под патрон Флобера SNIPE - 6" (бук) | D490: 182.48 | E490: Инт | F490: 1 | G490: 190.18 | H490: 0.05 | I490: 190.18 | J490: -3459.48 | K490: 0 | L490: =RC[-3]/100*RC[-1] -> 0.05
A491: 13 | B491: _17810 | C491: Револьвер под патрон Флобера SNIPE - 6" (пластик) | D491: 177.45 | E491: Инт | F491: 0 | G491: 184.00 | H491: 0.05 | I491: 0.00 | J491: 0.00 | K491: 0 | L491: =RC[-3]/100*RC[-1] -> 0.05
A492: 14 | B492: _17810 | C492: Револьвер под патрон Флобера SNIPE - 6" (пластик) | D492: 177.45 | E492: Инт | F492: 1 | G492: 184.00 | H492: 0.05 | I492: 184.00 | J492: -3364.96 | K492: 0 | L492: =RC[-3]/100*RC[-1] -> 0.05 | M492: =SUM(R[-14]C[-1]:RC[-1]) -> 
A494: #1868 (2014-03-04) Акрополіс - Прихід товару
A495: N | B495: арт | C495: назва | D495: закуп | F495: к-ть | G495: цiна | H495: кф | I495: продж | J495: дохiд | K495: % | L495: з-та
A496: 1 | B496: A19-13 | C496: Охотничий ремень ACROPOLIS ||МРБ-1 | D496: 200.60 | E496: грн | F496: 2 | G496: 235.62 | H496: 1.17 | I496: 400.55 | J496: -0.65 | K496: 0 | L496: =RC[-3]/100*RC[-1] -> 1.17
A497: 2 | B497: A19-100 | C497: Стакан ACROPOLIS ||СБК-1 | D497: 34.12 | E497: грн | F497: 4 | G497: 40.68 | H497: 1.19 | I497: 138.31 | J497: 1.83 | K497: 0 | L497: =RC[-3]/100*RC[-1] -> 1.19
A498: 3 | B498: A19-100 | C498: Стакан ACROPOLIS ||СБК-1 | D498: 34.12 | E498: грн | F498: 1 | G498: 40.68 | H498: 1.19 | I498: 34.58 | J498: 0.46 | K498: 0 | L498: =RC[-3]/100*RC[-1] -> 1.19
A499: 4 | B499: A19-101 | C499: Стакан большой ACROPOLIS ||СХБ-1 | D499: 66.35 | E499: грн | F499: 3 | G499: 78.06 | H499: 1.18 | I499: 199.05 | J499: 0.00 | K499: 0 | L499: =RC[-3]/100*RC[-1] -> 1.18
A500: 5 | B500: A19-54 | C500: Футляр для котушок с неопрену ACROPOLIS ||ФБК-5н | D500: 33.15 | E500: грн | F500: 1 | G500: 39.06 | H500: 1.18 | I500: 33.20 | J500: 0.05 | K500: 0 | L500: =RC[-3]/100*RC[-1] -> 1.18
A501: 6 | B501: A19-54 | C501: Футляр для котушок с неопрену ACROPOLIS ||ФБК-5н | D501: 33.15 | E501: грн | F501: 1 | G501: 39.06 | H501: 1.18 | I501: 33.20 | J501: 0.05 | K501: 0 | L501: =RC[-3]/100*RC[-1] -> 1.18
A502: 7 | B502: A19-62 | C502: Футляр для ствола гладк. оружия с 2ств. (12кал.) ACROPOLIS ||ФС-3/12 | D502: 46.98 | E502: грн | F502: 1 | G502: 46.98 | H502: 1.00 | I502: 39.93 | J502: -7.05 | K502: 0 | L502: =RC[-3]/100*RC[-1] -> 1.00
A503: 8 | B503: A19-62 | C503: Футляр для ствола гладк. оружия с 2ств. (12кал.) ACROPOLIS ||ФС-3/12 | D503: 46.98 | E503: грн | F503: 1 | G503: 46.98 | H503: 1.00 | I503: 39.93 | J503: -7.05 | K503: 0 | L503: =RC[-3]/100*RC[-1] -> 1.00
A504: 9 | B504: A19-78 | C504: Чохол для оружия (L-118) ACROPOLIS ||ЧДЗ-1 | D504: 136.00 | E504: грн | F504: 1 | G504: 106.14 | H504: 0.78 | I504: 90.22 | J504: -45.78 | K504: 0 | L504: =RC[-3]/100*RC[-1] -> 0.78
A505: 10 | B505: A19-78 | C505: Чохол для оружия (L-118) ACROPOLIS ||ЧДЗ-1 | D505: 136.00 | E505: грн | F505: 1 | G505: 106.14 | H505: 0.78 | I505: 90.22 | J505: -45.78 | K505: 0 | L505: =RC[-3]/100*RC[-1] -> 0.78
A506: 11 | B506: A19-153 | C506: Чохол для льодобура ACROPOLIS ||ЧДЛ-2 | D506: 57.12 | E506: грн | F506: 0 | G506: 57.12 | H506: 1.00 | I506: 0.00 | J506: 0.00 | K506: 0 | L506: =RC[-3]/100*RC[-1] -> 1.00
A507: 12 | B507: A19-153 | C507: Чохол для льодобура ACROPOLIS ||ЧДЛ-2 | D507: 57.12 | E507: грн | F507: 1 | G507: 57.12 | H507: 1.00 | I507: 48.55 | J507: -8.57 | K507: 0 | L507: =RC[-3]/100*RC[-1] -> 1.00
A508: 13 | B508: A19-80 | C508: Чохол для садка (шир 0.1м) ACROPOLIS ||ЧДС-1 | D508: 93.84 | E508: грн | F508: 1 | G508: 93.84 | H508: 1.00 | I508: 79.76 | J508: -14.08 | K508: 0 | L508: =RC[-3]/100*RC[-1] -> 1.00
A509: 14 | B509: A19-80 | C509: Чохол для садка (шир 0.1м) ACROPOLIS ||ЧДС-1 | D509: 93.84 | E509: грн | F509: 1 | G509: 93.84 | H509: 1.00 | I509: 79.76 | J509: -14.08 | K509: 0 | L509: =RC[-3]/100*RC[-1] -> 1.00 | M509: =SUM(R[-14]C[-1]:RC[-1]) -> 
A511: #1901 (2014-03-05) Федик Тарас - Прихід товару
A512: N | B512: арт | C512: назва | D512: закуп | F512: к-ть | G512: цiна | H512: кф | I512: продж | J512: дохiд | K512: % | L512: з-та
A513: 1 | B513: _Tr-3008 | C513: Каремат туристический Optima Light ППЭ НХ 3008 | D513: 3.76 | E513: Инт | F513: 5 | G513: 52.70 | H513: 0.70 | I513: 263.50 | J513: -112.93 | K513: 0 | L513: =RC[-3]/100*RC[-1] -> 0.70
A514: 2 | B514: _Tr-1508-1 | C514: Каремат туристический Tourist Profi ППЭ НР 1508 | D514: 6.84 | E514: Инт | F514: 4 | G514: 95.80 | H514: 0.70 | I514: 383.20 | J514: -164.23 | K514: 0 | L514: =RC[-3]/100*RC[-1] -> 0.70 | M514: =SUM(R[-2]C[-1]:RC[-1]) -> 
A516: #2025 (2014-03-07) Radioprofi - Прихід товару
A517: N | B517: арт | C517: назва | D517: закуп | F517: к-ть | G517: цiна | H517: кф | I517: продж | J517: дохiд | K517: % | L517: з-та
A518: 1 | B518: 26-0718 | C518: Блок живлення 220/15 В 23А к рации | D518: 50.00 | E518: usd | F518: 2 | G518: 50.00 | H518: 0.05 | I518: 100.00 | J518: -1900.00 | K518: 0 | L518: =RC[-3]/100*RC[-1] -> 0.05
A519: 2 | B519: _RA506 | C519: Выносная антена к рации 433MHz 50см (506) 5/8 | D519: 12.00 | E519: usd | F519: 4 | G519: 12.00 | H519: 0.05 | I519: 48.00 | J519: -912.00 | K519: 0 | L519: =RC[-3]/100*RC[-1] -> 0.05
A520: 3 | B520: 26-0717 | C520: Рация VOYAGER 400-470 MHz, 60W | D520: 200.00 | E520: usd | F520: 4 | G520: 200.00 | H520: 0.05 | I520: 800.00 | J520: -15200.00 | K520: 0 | L520: =RC[-3]/100*RC[-1] -> 0.05
A521: 4 | B521: 26-0710 | C521: Рация VOYAGER AirSoft (136-174 / 400-470)МГц, 5Вт,2200mAp Li-ion (+гарнітура) | D521: 85.00 | E521: usd | F521: 49 | G521: 50.00 | H521: 0.03 | I521: 2450.00 | J521: -80850.00 | K521: 0 | L521: =RC[-3]/100*RC[-1] -> 0.03 | M521: =SUM(R[-4]C[-1]:RC[-1]) -> 
A523: #2161 (2014-03-12) Акрополіс - Прихід товару
A524: N | B524: арт | C524: назва | D524: закуп | F524: к-ть | G524: цiна | H524: кф | I524: продж | J524: дохiд | K524: % | L524: з-та
A525: 1 | B525: A19-176/M | C525: Дощовик для мисливців ACROPOLIS ||ОПДМ-1/M | D525: 216.96 | E525: грн | F525: 1 | G525: 216.96 | H525: 1.00 | I525: 216.96 | J525: 0.00 | K525: 0 | L525: =RC[-3]/100*RC[-1] -> 1.00
A526: 2 | B526: A19-176/XL | C526: Дощовик для мисливців ACROPOLIS ||ОПДМ-1/XL | D526: 216.96 | E526: грн | F526: 1 | G526: 216.96 | H526: 1.00 | I526: 216.96 | J526: 0.00 | K526: 0 | L526: =RC[-3]/100*RC[-1] -> 1.00
A527: 3 | B527: A19-176/XXL | C527: Дощовик для мисливців ACROPOLIS ||ОПДМ-1/XXL | D527: 216.96 | E527: грн | F527: 1 | G527: 216.96 | H527: 1.00 | I527: 216.96 | J527: 0.00 | K527: 0 | L527: =RC[-3]/100*RC[-1] -> 1.00
A528: 4 | B528: A19-177 | C528: Капелюх ACROPOLIS ||ОКМ-1 | D528: 549.96 | E528: грн | F528: 1 | G528: 549.96 | H528: 1.00 | I528: 549.96 | J528: 0.00 | K528: 0 | L528: =RC[-3]/100*RC[-1] -> 1.00
A529: 5 | B529: A19-138 | C529: Охотничий ремень ACROPOLIS ||МР-6 | D529: 120.36 | E529: грн | F529: 1 | G529: 120.36 | H529: 1.00 | I529: 204.61 | J529: 84.25 | K529: 0 | L529: =RC[-3]/100*RC[-1] -> 1.00
A530: 6 | B530: A19-138 | C530: Охотничий ремень ACROPOLIS ||МР-6 | D530: 120.36 | E530: грн | F530: 1 | G530: 120.36 | H530: 1.00 | I530: 0.00 | J530: -120.36 | K530: 0 | L530: =RC[-3]/100*RC[-1] -> 1.00
A531: 7 | B531: A19-125 | C531: Сумка для документов ACROPOLIS ||СДД-ш | D531: 115.00 | E531: грн | F531: 1 | G531: 122.76 | H531: 1.07 | I531: 208.69 | J531: 93.69 | K531: 0 | L531: =RC[-3]/100*RC[-1] -> 1.07
A532: 8 | B532: A19-125 | C532: Сумка для документов ACROPOLIS ||СДД-ш | D532: 115.00 | E532: грн | F532: 1 | G532: 122.76 | H532: 1.07 | I532: 0.00 | J532: -115.00 | K532: 0 | L532: =RC[-3]/100*RC[-1] -> 1.07
A533: 9 | B533: A19-41 | C533: Сумка рибальська ACROPOLIS ||РС-4 | D533: 220.44 | E533: грн | F533: 2 | G533: 220.44 | H533: 1.00 | I533: 374.75 | J533: -66.13 | K533: 0 | L533: =RC[-3]/100*RC[-1] -> 1.00
A534: 10 | B534: A19-178/L | C534: Футболка охотничья ACROPOLIS ||ОФМ-2/L | D534: 93.96 | E534: грн | F534: 1 | G534: 93.96 | H534: 1.00 | I534: 93.96 | J534: 0.00 | K534: 0 | L534: =RC[-3]/100*RC[-1] -> 1.00
A535: 11 | B535: A19-178/XXL | C535: Футболка охотничья ACROPOLIS ||ОФМ-2/XXL | D535: 93.96 | E535: грн | F535: 1 | G535: 93.96 | H535: 1.00 | I535: 93.96 | J535: 0.00 | K535: 0 | L535: =RC[-3]/100*RC[-1] -> 1.00
A536: 12 | B536: A19-179/L | C536: Футболка охотничья ACROPOLIS ||ОФМ-3/L | D536: 177.54 | E536: грн | F536: 1 | G536: 177.54 | H536: 1.00 | I536: 177.54 | J536: 0.00 | K536: 0 | L536: =RC[-3]/100*RC[-1] -> 1.00
A537: 13 | B537: A19-179/XL | C537: Футболка охотничья ACROPOLIS ||ОФМ-3/XL | D537: 177.54 | E537: грн | F537: 1 | G537: 177.54 | H537: 1.00 | I537: 177.54 | J537: 0.00 | K537: 0 | L537: =RC[-3]/100*RC[-1] -> 1.00
A538: 14 | B538: A19-180/L | C538: Футболка рибальська ACROPOLIS ||ОФР/L | D538: 65.04 | E538: грн | F538: 1 | G538: 65.04 | H538: 1.00 | I538: 65.04 | J538: 0.00 | K538: 0 | L538: =RC[-3]/100*RC[-1] -> 1.00
A539: 15 | B539: A19-181/L | C539: Футболка рибальська ACROPOLIS ||ОФР-2/L | D539: 93.96 | E539: грн | F539: 1 | G539: 93.96 | H539: 1.00 | I539: 93.96 | J539: 0.00 | K539: 0 | L539: =RC[-3]/100*RC[-1] -> 1.00
A540: 16 | B540: A19-181/XXL | C540: Футболка рибальська ACROPOLIS ||ОФР-2/XXL | D540: 93.96 | E540: грн | F540: 1 | G540: 93.96 | H540: 1.00 | I540: 93.96 | J540: 0.00 | K540: 0 | L540: =RC[-3]/100*RC[-1] -> 1.00
A541: 17 | B541: A19-148 | C541: Футляр для вудочок ACROPOLIS ||КВ-5б | D541: 48.00 | E541: грн | F541: 1 | G541: 48.42 | H541: 1.01 | I541: 82.31 | J541: 34.31 | K541: 0 | L541: =RC[-3]/100*RC[-1] -> 1.01
A542: 18 | B542: A19-148 | C542: Футляр для вудочок ACROPOLIS ||КВ-5б | D542: 48.00 | E542: грн | F542: 1 | G542: 48.42 | H542: 1.01 | I542: 0.00 | J542: -48.00 | K542: 0 | L542: =RC[-3]/100*RC[-1] -> 1.01
A543: 19 | B543: A19-116 | C543: Футляр для винтовки ACROPOLIS ||ФЗ-8в | D543: 419.20 | E543: грн | F543: 1 | G543: 493.02 | H543: 1.18 | I543: 838.13 | J543: 418.93 | K543: 0 | L543: =RC[-3]/100*RC[-1] -> 1.18
A544: 20 | B544: A19-116 | C544: Футляр для винтовки ACROPOLIS ||ФЗ-8в | D544: 419.20 | E544: грн | F544: 1 | G544: 493.02 | H544: 1.18 | I544: 0.00 | J544: -419.20 | K544: 0 | L544: =RC[-3]/100*RC[-1] -> 1.18
A545: 21 | B545: A19-182/XL | C545: Футболка рибальська ACROPOLIS ||ОФР-3/XL | D545: 177.54 | E545: грн | F545: 1 | G545: 177.54 | H545: 1.00 | I545: 177.54 | J545: 0.00 | K545: 0 | L545: =RC[-3]/100*RC[-1] -> 1.00
A546: 22 | B546: A19-182/L | C546: Футболка рибальська ACROPOLIS ||ОФР-3/L | D546: 177.54 | E546: грн | F546: 1 | G546: 177.54 | H546: 1.00 | I546: 177.54 | J546: 0.00 | K546: 0 | L546: =RC[-3]/100*RC[-1] -> 1.00 | M546: =SUM(R[-22]C[-1]:RC[-1]) -> 
A548: #2173 (2014-03-12) Агрон постач - Прихід товару
A549: N | B549: арт | C549: назва | D549: закуп | F549: к-ть | G549: цiна | H549: кф | I549: продж | J549: дохiд | K549: % | L549: з-та
A550: 1 | B550: _01603 | C550: ПНВ Монокуляр EXELON 4x50||ПС | D550: 2820.00 | E550: грн | F550: 4 | G550: 2143.00 | H550: 0.76 | I550: 8572.00 | J550: -2708.00 | K550: 0 | L550: =RC[-3]/100*RC[-1] -> 0.76 | M550: =SUM(R[-1]C[-1]:RC[-1]) -> 
A552: #2222 (2014-03-13) Фанатік Спорт - Прихід товару
A553: N | B553: арт | C553: назва | D553: закуп | F553: к-ть | G553: цiна | H553: кф | I553: продж | J553: дохiд | K553: % | L553: з-та
A554: 1 | B554: _26-0622 | C554: Балон газовый BT-2 | D554: 17.00 | E554: euro | F554: 1 | G554: 17.00 | H554: 0.04 | I554: 17.00 | J554: -408.00 | K554: 0 | L554: =RC[-3]/100*RC[-1] -> 0.04
A555: 2 | B555: _26-0628 | C555: Горелка газовая GUCIO big (d=18) | D555: 7.00 | E555: euro | F555: 1 | G555: 7.00 | H555: 0.04 | I555: 7.00 | J555: -168.00 | K555: 0 | L555: =RC[-3]/100*RC[-1] -> 0.04
A556: 3 | B556: _26-0630 | C556: Горелка газовая NURGAZ NG-419 (d=21) | D556: 7.00 | E556: euro | F556: 1 | G556: 7.00 | H556: 0.04 | I556: 7.00 | J556: -168.00 | K556: 0 | L556: =RC[-3]/100*RC[-1] -> 0.04 | M556: =SUM(R[-3]C[-1]:RC[-1]) -> 
A558: #2223 (2014-03-13) Чохли ПП Касіянчук І.В. - Прихід товару
A559: N | B559: арт | C559: назва | D559: закуп | F559: к-ть | G559: цiна | H559: кф | I559: продж | J559: дохiд | K559: % | L559: з-та
A560: 1 | B560: _19-11303 | C560: Чохол 115см с тканини (під оптику) woodland | D560: 140.00 | E560: грн | F560: 2 | G560: 140.00 | H560: 1.00 | I560: 280.00 | J560: 0.00 | K560: 0 | L560: =RC[-3]/100*RC[-1] -> 1.00
A561: 2 | B561: _19-11303 | C561: Чохол 115см с тканини (під оптику) woodland | D561: 140.00 | E561: грн | F561: 1 | G561: 140.00 | H561: 1.00 | I561: 140.00 | J561: 0.00 | K561: 0 | L561: =RC[-3]/100*RC[-1] -> 1.00
A562: 3 | B562: _19-1130 | C562: Чохол 115см с тканини (під оптику) дубок | D562: 140.00 | E562: грн | F562: 1 | G562: 140.00 | H562: 1.00 | I562: 140.00 | J562: 0.00 | K562: 0 | L562: =RC[-3]/100*RC[-1] -> 1.00
A563: 4 | B563: _19-11321 | C563: Чохол 130см с тканини (під оптику) woodland | D563: 180.00 | E563: грн | F563: 2 | G563: 140.00 | H563: 0.78 | I563: 280.00 | J563: -80.00 | K563: 0 | L563: =RC[-3]/100*RC[-1] -> 0.78
A564: 5 | B564: _19-11321 | C564: Чохол 130см с тканини (під оптику) woodland | D564: 180.00 | E564: грн | F564: 1 | G564: 140.00 | H564: 0.78 | I564: 140.00 | J564: -40.00 | K564: 0 | L564: =RC[-3]/100*RC[-1] -> 0.78
A565: 6 | B565: _19-1133 | C565: Чохол 130см с шкірзамінника (під оптику) | D565: 140.00 | E565: грн | F565: 1 | G565: 140.00 | H565: 1.00 | I565: 140.00 | J565: 0.00 | K565: 0 | L565: =RC[-3]/100*RC[-1] -> 1.00
A566: 7 | B566: _19-1133 | C566: Чохол 130см с шкірзамінника (під оптику) | D566: 140.00 | E566: грн | F566: 1 | G566: 140.00 | H566: 1.00 | I566: 140.00 | J566: 0.00 | K566: 0 | L566: =RC[-3]/100*RC[-1] -> 1.00
A567: 8 | B567: _19-1144 | C567: Чохол ІЖ прямокутний (шкірзаміник) | D567: 130.00 | E567: грн | F567: 1 | G567: 130.00 | H567: 1.00 | I567: 130.00 | J567: 0.00 | K567: 0 | L567: =RC[-3]/100*RC[-1] -> 1.00
A568: 9 | B568: _19-1144 | C568: Чохол ІЖ прямокутний (шкірзаміник) | D568: 130.00 | E568: грн | F568: 1 | G568: 130.00 | H568: 1.00 | I568: 130.00 | J568: 0.00 | K568: 0 | L568: =RC[-3]/100*RC[-1] -> 1.00 | M568: =SUM(R[-9]C[-1]:RC[-1]) -> 
A570: #2497 (2014-03-20) Агрон постач - Прихід товару
A571: N | B571: арт | C571: назва | D571: закуп | F571: к-ть | G571: цiна | H571: кф | I571: продж | J571: дохiд | K571: % | L571: з-та
A572: 1 | B572: _01603 | C572: ПНВ Монокуляр EXELON 4x50||ПС | D572: 2820.00 | E572: грн | F572: 2 | G572: 2143.00 | H572: 0.76 | I572: 4286.00 | J572: -1354.00 | K572: 0 | L572: =RC[-3]/100*RC[-1] -> 0.76 | M572: =SUM(R[-1]C[-1]:RC[-1]) -> 
A574: #2563 (2014-03-21) Станислав. Харьков - Прихід товару
A575: N | B575: арт | C575: назва | D575: закуп | F575: к-ть | G575: цiна | H575: кф | I575: продж | J575: дохiд | K575: % | L575: з-та
A576: 1 | B576: X101/48 | C576: BW пуловер (акриловый) чёрный (3 нитки) ||X10839/48 | D576: 18.75 | E576: Инт | F576: 10 | G576: 240.00 | H576: 0.64 | I576: 2400.00 | J576: -1350.00 | K576: 0 | L576: =RC[-3]/100*RC[-1] -> 0.64
A577: 2 | B577: X101/46 | C577: BW пуловер (акриловый) чёрный (3 нитки) ||X10839/48 | D577: 18.75 | E577: Инт | F577: 15 | G577: 240.00 | H577: 0.64 | I577: 3600.00 | J577: -2025.00 | K577: 0 | L577: =RC[-3]/100*RC[-1] -> 0.64
A578: 3 | B578: X406 | C578: Балаклава чёрная с 1-м отв. тепла (100%хлопок) || | D578: 3.15 | E578: Инт | F578: 130 | G578: 64.00 | H578: 1.02 | I578: 22464.00 | J578: 14274.00 | K578: 0 | L578: =RC[-3]/100*RC[-1] -> 1.02
A579: 4 | B579: X406 | C579: Балаклава чёрная с 1-м отв. тепла (100%хлопок) || | D579: 3.15 | E579: Инт | F579: 221 | G579: 64.00 | H579: 1.02 | I579: 0.00 | J579: -13923.00 | K579: 0 | L579: =RC[-3]/100*RC[-1] -> 1.02 | M579: =SUM(R[-4]C[-1]:RC[-1]) -> 
A581: #2684 (2014-03-25) Armytek - Прихід товару
A582: N | B582: арт | C582: назва | D582: закуп | F582: к-ть | G582: цiна | H582: кф | I582: продж | J582: дохiд | K582: % | L582: з-та
A583: 1 | B583: _G101-H | C583: Мультитул GANZO G101-H | D583: 14.81 | E583: usd | F583: 3 | G583: 174.68 | H583: 0.59 | I583: 524.04 | J583: -364.56 | K583: 0 | L583: =RC[-3]/100*RC[-1] -> 0.59
A584: 2 | B584: _G105 | C584: Мультитул GANZO G105 | D584: 13.12 | E584: usd | F584: 5 | G584: 155.32 | H584: 0.59 | I584: 776.60 | J584: -535.40 | K584: 0 | L584: =RC[-3]/100*RC[-1] -> 0.59
A585: 3 | B585: _G108 | C585: Мультитул GANZO G108 | D585: 13.12 | E585: usd | F585: 5 | G585: 155.32 | H585: 0.59 | I585: 776.60 | J585: -535.40 | K585: 0 | L585: =RC[-3]/100*RC[-1] -> 0.59
A586: 4 | B586: _G109 | C586: Мультитул GANZO G109 | D586: 14.02 | E586: usd | F586: 3 | G586: 135.85 | H586: 0.48 | I586: 407.55 | J586: -433.65 | K586: 0 | L586: =RC[-3]/100*RC[-1] -> 0.48
A587: 5 | B587: _G201 | C587: Мультитул GANZO G201 | D587: 15.93 | E587: usd | F587: 3 | G587: 187.66 | H587: 0.59 | I587: 562.98 | J587: -392.82 | K587: 0 | L587: =RC[-3]/100*RC[-1] -> 0.59
A588: 6 | B588: _G201-H | C588: Мультитул GANZO G201-H | D588: 15.93 | E588: usd | F588: 3 | G588: 187.66 | H588: 0.59 | I588: 562.98 | J588: -392.82 | K588: 0 | L588: =RC[-3]/100*RC[-1] -> 0.59
A589: 7 | B589: _G2016-P | C589: Мультитул GANZO G2016-P | D589: 12.00 | E589: usd | F589: 3 | G589: 142.34 | H589: 0.59 | I589: 427.02 | J589: -292.98 | K589: 0 | L589: =RC[-3]/100*RC[-1] -> 0.59
A590: 8 | B590: _G2019 | C590: Мультитул GANZO G2019 | D590: 8.46 | E590: usd | F590: 2 | G590: 97.02 | H590: 0.57 | I590: 194.04 | J590: -144.36 | K590: 0 | L590: =RC[-3]/100*RC[-1] -> 0.57
A591: 9 | B591: _G2019S | C591: Мультитул GANZO 2019S | D591: 8.46 | E591: usd | F591: 2 | G591: 165.00 | H591: 0.98 | I591: 330.00 | J591: -8.40 | K591: 0 | L591: =RC[-3]/100*RC[-1] -> 0.98
A592: 10 | B592: _G202 | C592: Мультитул GANZO G202 | D592: 16.51 | E592: usd | F592: 5 | G592: 194.15 | H592: 0.59 | I592: 970.75 | J592: -680.25 | K592: 0 | L592: =RC[-3]/100*RC[-1] -> 0.59
A593: 11 | B593: _G202B | C593: Мультитул GANZO G202B | D593: 17.10 | E593: usd | F593: 7 | G593: 200.64 | H593: 0.59 | I593: 1404.48 | J593: -989.52 | K593: 0 | L593: =RC[-3]/100*RC[-1] -> 0.59
A594: 12 | B594: _G203 | C594: Мультитул GANZO G203 | D594: 16.51 | E594: usd | F594: 3 | G594: 181.17 | H594: 0.55 | I594: 543.51 | J594: -447.09 | K594: 0 | L594: =RC[-3]/100*RC[-1] -> 0.55
A595: 13 | B595: _G204 | C595: Мультитул GANZO G204 | D595: 16.51 | E595: usd | F595: 3 | G595: 181.17 | H595: 0.55 | I595: 543.51 | J595: -447.09 | K595: 0 | L595: =RC[-3]/100*RC[-1] -> 0.55
A596: 14 | B596: _G301 | C596: Мультитул GANZO G301 | D596: 27.23 | E596: usd | F596: 2 | G596: 317.02 | H596: 0.58 | I596: 634.04 | J596: -455.16 | K596: 0 | L596: =RC[-3]/100*RC[-1] -> 0.58
A597: 15 | B597: _G301B | C597: Мультитул GANZO G301B | D597: 31.14 | E597: usd | F597: 2 | G597: 362.34 | H597: 0.58 | I597: 724.68 | J597: -520.92 | K597: 0 | L597: =RC[-3]/100*RC[-1] -> 0.58
A598: 16 | B598: _G301H | C598: Мультитул GANZO G301H | D598: 27.23 | E598: usd | F598: 2 | G598: 317.02 | H598: 0.58 | I598: 634.04 | J598: -455.16 | K598: 0 | L598: =RC[-3]/100*RC[-1] -> 0.58
A599: 17 | B599: _G611B | C599: Нож GANZO G611 Black | D599: 5.64 | E599: usd | F599: 3 | G599: 64.68 | H599: 0.57 | I599: 194.04 | J599: -144.36 | K599: 0 | L599: =RC[-3]/100*RC[-1] -> 0.57
A600: 18 | B600: _G611G | C600: Нож GANZO G611 Green | D600: 5.64 | E600: usd | F600: 3 | G600: 64.68 | H600: 0.57 | I600: 194.04 | J600: -144.36 | K600: 0 | L600: =RC[-3]/100*RC[-1] -> 0.57
A601: 19 | B601: _G612 | C601: Нож GANZO G612 | D601: 10.50 | E601: usd | F601: 3 | G601: 129.36 | H601: 0.62 | I601: 388.08 | J601: -241.92 | K601: 0 | L601: =RC[-3]/100*RC[-1] -> 0.62
A602: 20 | B602: _G613 | C602: Нож GANZO G613 | D602: 5.36 | E602: usd | F602: 5 | G602: 61.49 | H602: 0.57 | I602: 307.45 | J602: -228.55 | K602: 0 | L602: =RC[-3]/100*RC[-1] -> 0.57
A603: 21 | B603: _G614 | C603: Нож GANZO G614 | D603: 5.36 | E603: usd | F603: 5 | G603: 61.49 | H603: 0.57 | I603: 307.45 | J603: -228.55 | K603: 0 | L603: =RC[-3]/100*RC[-1] -> 0.57
A604: 22 | B604: _G615 | C604: Нож GANZO G615 | D604: 5.36 | E604: usd | F604: 5 | G604: 61.49 | H604: 0.57 | I604: 307.45 | J604: -228.55 | K604: 0 | L604: =RC[-3]/100*RC[-1] -> 0.57
A605: 23 | B605: _G616 | C605: Нож GANZO G616 | D605: 5.36 | E605: usd | F605: 5 | G605: 61.49 | H605: 0.57 | I605: 307.45 | J605: -228.55 | K605: 0 | L605: =RC[-3]/100*RC[-1] -> 0.57
A606: 24 | B606: _G617 | C606: Нож GANZO G617 | D606: 5.36 | E606: usd | F606: 5 | G606: 61.49 | H606: 0.57 | I606: 307.45 | J606: -228.55 | K606: 0 | L606: =RC[-3]/100*RC[-1] -> 0.57
A607: 25 | B607: _G618 | C607: Нож GANZO G618 | D607: 5.36 | E607: usd | F607: 5 | G607: 61.49 | H607: 0.57 | I607: 307.45 | J607: -228.55 | K607: 0 | L607: =RC[-3]/100*RC[-1] -> 0.57
A608: 26 | B608: _G619 | C608: Нож GANZO G619 | D608: 5.36 | E608: usd | F608: 5 | G608: 61.49 | H608: 0.57 | I608: 307.45 | J608: -228.55 | K608: 0 | L608: =RC[-3]/100*RC[-1] -> 0.57
A609: 27 | B609: _G704g | C609: Нож GANZO G704g | D609: 16.51 | E609: usd | F609: 3 | G609: 194.15 | H609: 0.59 | I609: 582.45 | J609: -408.15 | K609: 0 | L609: =RC[-3]/100*RC[-1] -> 0.59
A610: 28 | B610: _G704y | C610: Нож GANZO G704y | D610: 16.51 | E610: usd | F610: 3 | G610: 194.15 | H610: 0.59 | I610: 582.45 | J610: -408.15 | K610: 0 | L610: =RC[-3]/100*RC[-1] -> 0.59
A611: 29 | B611: _G707 | C611: Нож GANZO G707 | D611: 15.93 | E611: usd | F611: 3 | G611: 187.66 | H611: 0.59 | I611: 562.98 | J611: -392.82 | K611: 0 | L611: =RC[-3]/100*RC[-1] -> 0.59
A612: 30 | B612: _G710 | C612: Нож GANZO G710 | D612: 17.63 | E612: usd | F612: 3 | G612: 245.85 | H612: 0.70 | I612: 737.55 | J612: -320.25 | K612: 0 | L612: =RC[-3]/100*RC[-1] -> 0.70
A613: 31 | B613: _G716-S | C613: Нож GANZO G716-S | D613: 24.40 | E613: usd | F613: 3 | G613: 284.68 | H613: 0.58 | I613: 854.04 | J613: -609.96 | K613: 0 | L613: =RC[-3]/100*RC[-1] -> 0.58
A614: 32 | B614: _G717b | C614: Нож GANZO G717b | D614: 23.84 | E614: usd | F614: 3 | G614: 245.85 | H614: 0.52 | I614: 737.55 | J614: -692.85 | K614: 0 | L614: =RC[-3]/100*RC[-1] -> 0.52
A615: 33 | B615: _G717y | C615: Нож GANZO G717y | D615: 23.84 | E615: usd | F615: 3 | G615: 245.85 | H615: 0.52 | I615: 737.55 | J615: -692.85 | K615: 0 | L615: =RC[-3]/100*RC[-1] -> 0.52 | M615: =SUM(R[-33]C[-1]:RC[-1]) -> 
A617: #2693 (2014-03-26) Armytek - Прихід товару
A618: N | B618: арт | C618: назва | D618: закуп | F618: к-ть | G618: цiна | H618: кф | I618: продж | J618: дохiд | K618: % | L618: з-та
A619: 1 | B619: _217-01 | C619: Выносная кнопка Armytek ARS-01 25-70cm ||ARS01B | D619: 10.91 | E619: usd | F619: 1 | G619: 10.91 | H619: 0.05 | I619: 54.55 | J619: -163.65 | K619: 0 | L619: =RC[-3]/100*RC[-1] -> 0.05
A620: 2 | B620: _217-02 | C620: Фонарь Armytek Barracuda Black XM-L2 (Warm) 1240lm ||01-2bW | D620: 84.85 | E620: usd | F620: 1 | G620: 84.85 | H620: 0.05 | I620: 84.85 | J620: -1612.15 | K620: 0 | L620: =RC[-3]/100*RC[-1] -> 0.05
A621: 3 | B621: _217-23 | C621: Фонарь Armytek Barracuda Gold XM-L2 1390lm ||01-2G | D621: 84.85 | E621: usd | F621: 1 | G621: 84.85 | H621: 0.05 | I621: 84.85 | J621: -1612.15 | K621: 0 | L621: =RC[-3]/100*RC[-1] -> 0.05
A622: 4 | B622: _217-04 | C622: Фонарь Armytek Partner A1 XP-G 230lm ||A1XPG | D622: 24.24 | E622: usd | F622: 1 | G622: 24.24 | H622: 0.05 | I622: 24.24 | J622: -460.56 | K622: 0 | L622: =RC[-3]/100*RC[-1] -> 0.05
A623: 5 | B623: _217-05 | C623: Фонарь Armytek Partner A1 XM-L 260lm ||A1XML | D623: 26.50 | E623: usd | F623: 1 | G623: 25.45 | H623: 0.05 | I623: 25.45 | J623: -504.55 | K623: 0 | L623: =RC[-3]/100*RC[-1] -> 0.05
A624: 6 | B624: _217-06 | C624: Фонарь Armytek Partner A2 XM-L 330lm ||A2XML | D624: 28.00 | E624: usd | F624: 1 | G624: 27.27 | H624: 0.05 | I624: 27.27 | J624: -532.73 | K624: 0 | L624: =RC[-3]/100*RC[-1] -> 0.05
A625: 7 | B625: _217-07 | C625: Фонарь Armytek Partner A2 XP-G 280lm ||A2XPG | D625: 26.06 | E625: usd | F625: 1 | G625: 26.06 | H625: 0.05 | I625: 26.06 | J625: -495.14 | K625: 0 | L625: =RC[-3]/100*RC[-1] -> 0.05
A626: 8 | B626: _217-08 | C626: Фонарь Armytek Predator Pro v2.5 Gold XP-G2 670lm ||APPG | D626: 63.64 | E626: usd | F626: 1 | G626: 63.64 | H626: 0.05 | I626: 63.64 | J626: -1209.16 | K626: 0 | L626: =RC[-3]/100*RC[-1] -> 0.05
A627: 9 | B627: _217-09 | C627: Фонарь Armytek Predator Pro v2.5 Silver XP-G2 670lm ||APPS | D627: 63.64 | E627: usd | F627: 1 | G627: 63.64 | H627: 0.05 | I627: 63.64 | J627: -1209.16 | K627: 0 | L627: =RC[-3]/100*RC[-1] -> 0.05
A628: 10 | B628: _217-10 | C628: Фонарь Armytek Predator Pro v2.5 Black XP-G2 (Warm) 640lm ||APPBW | D628: 63.64 | E628: usd | F628: 1 | G628: 63.64 | H628: 0.05 | I628: 63.64 | J628: -1209.16 | K628: 0 | L628: =RC[-3]/100*RC[-1] -> 0.05
A629: 11 | B629: _217-26 | C629: Фонарь Armytek Predator v2.5 Black XP-E (Green) 270lm ||APBG | D629: 51.52 | E629: usd | F629: 1 | G629: 51.52 | H629: 0.05 | I629: 51.52 | J629: -978.88 | K629: 0 | L629: =RC[-3]/100*RC[-1] -> 0.05
A630: 12 | B630: _217-12 | C630: Фонарь Armytek Viking Pro v2.5 Black XM-L2 850lm ||AVPB | D630: 72.73 | E630: usd | F630: 1 | G630: 72.73 | H630: 0.05 | I630: 72.73 | J630: -1381.87 | K630: 0 | L630: =RC[-3]/100*RC[-1] -> 0.05
A631: 13 | B631: _217-13 | C631: Фонарь Armytek Viking Pro v2.5 Gold XM-L2 850lm ||AVPG | D631: 72.73 | E631: usd | F631: 1 | G631: 72.73 | H631: 0.05 | I631: 72.73 | J631: -1381.87 | K631: 0 | L631: =RC[-3]/100*RC[-1] -> 0.05
A632: 14 | B632: _217-14 | C632: Фонарь Armytek Viking v2.5 Black XM-L2 1010lm ||AVB | D632: 54.55 | E632: usd | F632: 1 | G632: 54.55 | H632: 0.05 | I632: 54.55 | J632: -1036.45 | K632: 0 | L632: =RC[-3]/100*RC[-1] -> 0.05
A633: 15 | B633: _217-15 | C633: Фонарь Armytek Wizard Pro Gold XM-L2 1010lm ||AWPG | D633: 60.61 | E633: usd | F633: 1 | G633: 60.61 | H633: 0.05 | I633: 60.61 | J633: -1151.59 | K633: 0 | L633: =RC[-3]/100*RC[-1] -> 0.05
A634: 16 | B634: _217-16 | C634: Фонарь Armytek Wizard Pro Silver XM-L2 (Warm) 870lm ||AWPSW | D634: 60.61 | E634: usd | F634: 1 | G634: 60.61 | H634: 0.05 | I634: 60.61 | J634: -1151.59 | K634: 0 | L634: =RC[-3]/100*RC[-1] -> 0.05
A635: 17 | B635: _217-17 | C635: Фонарь Armytek Barracuda Silver XM-L2 1390lm ||01-2s | D635: 84.85 | E635: usd | F635: 1 | G635: 84.85 | H635: 0.05 | I635: 84.85 | J635: -1612.15 | K635: 0 | L635: =RC[-3]/100*RC[-1] -> 0.05
A636: 18 | B636: _217-01 | C636: Выносная кнопка Armytek ARS-01 25-70cm ||ARS01B | D636: 10.91 | E636: usd | F636: 4 | G636: 141.83 | H636: 0.65 | I636: 567.32 | J636: -305.48 | K636: 0 | L636: =RC[-3]/100*RC[-1] -> 0.65 | M636: =SUM(R[-18]C[-1]:RC[-1]) -> 
A638: #2731 (2014-03-27) FENIX LIGTH - Прихід товару
A639: N | B639: арт | C639: назва | D639: закуп | F639: к-ть | G639: цiна | H639: кф | I639: продж | J639: дохiд | K639: % | L639: з-та
A640: 1 | B640: _ARB-L2 | C640: Аккумулятор FENIX 18650 2600mAh | D640: 8.07 | E640: Инт | F640: 10 | G640: 94.50 | H640: 0.59 | I640: 945.00 | J640: -668.79 | K640: 0 | L640: =RC[-3]/100*RC[-1] -> 0.59
A641: 2 | B641: _ARB-L2S | C641: Аккумулятор FENIX 18650 3400mAh | D641: 15.38 | E641: Инт | F641: 15 | G641: 159.60 | H641: 0.52 | I641: 2394.00 | J641: -2219.79 | K641: 0 | L641: =RC[-3]/100*RC[-1] -> 0.52
A642: 3 | B642: DS8828N/S | C642: Водонепроницаемые носки DexShell Coolvent new | D642: 16.39 | E642: usd | F642: 3 | G642: 210.00 | H642: 0.64 | I642: 630.00 | J642: -353.33 | K642: 0 | L642: =RC[-3]/100*RC[-1] -> 0.64
A643: 4 | B643: _WF200 | C643: Зарядное устройство 2*18650 Ultrafire WF-200 | D643: 18.20 | E643: usd | F643: 5 | G643: 191.10 | H643: 0.53 | I643: 955.50 | J643: -864.50 | K643: 0 | L643: =RC[-3]/100*RC[-1] -> 0.53
A644: 5 | B644: _TR001 | C644: Зарядное устройство 2x18650, 16340 TrustFire TR-001 | D644: 8.62 | E644: Инт | F644: 5 | G644: 82.95 | H644: 0.48 | I644: 414.75 | J644: -447.32 | K644: 0 | L644: =RC[-3]/100*RC[-1] -> 0.48
A645: 6 | B645: _ARE-C1 | C645: Зарядное устройство Fenix Charger ARE-C1 2x18650 | D645: 12.14 | E645: usd | F645: 10 | G645: 127.05 | H645: 0.52 | I645: 1270.50 | J645: -1157.50 | K645: 0 | L645: =RC[-3]/100*RC[-1] -> 0.52
A646: 7 | B646: _ARE-C2 | C646: Зарядное устройство Fenix Charger ARE-C2 4x18650 | D646: 30.30 | E646: usd | F646: 5 | G646: 318.15 | H646: 0.53 | I646: 1590.75 | J646: -1439.25 | K646: 0 | L646: =RC[-3]/100*RC[-1] -> 0.53
A647: 8 | B647: _ST35000ES | C647: Микротул Swiss+Tech Mini Multi-tool 8-in-1 | D647: 7.16 | E647: Инт | F647: 2 | G647: 98.70 | H647: 0.69 | I647: 197.40 | J647: -88.82 | K647: 0 | L647: =RC[-3]/100*RC[-1] -> 0.69
A648: 9 | B648: _ST66676ES | C648: Микротул Swiss+Tech Utili-Key 6-in-1 | D648: 8.64 | E648: Инт | F648: 2 | G648: 115.50 | H648: 0.67 | I648: 231.00 | J648: -114.78 | K648: 0 | L648: =RC[-3]/100*RC[-1] -> 0.67
A649: 10 | B649: _1568.06.51 | C649: Точило LANSKY Cold Steel Knife Sharpener LTRIM | D649: 5.80 | E649: usd | F649: 2 | G649: 60.90 | H649: 0.53 | I649: 121.80 | J649: -110.20 | K649: 0 | L649: =RC[-3]/100*RC[-1] -> 0.53
A650: 11 | B650: _1568.06.35 | C650: Точило LANSKY Deluxe Quick Edge | D650: 6.40 | E650: usd | F650: 2 | G650: 67.20 | H650: 0.53 | I650: 134.40 | J650: -121.60 | K650: 0 | L650: =RC[-3]/100*RC[-1] -> 0.53
A651: 12 | B651: _1568.06.02 | C651: Точило LANSKY Deluxe Sharpening System | D651: 40.90 | E651: usd | F651: 2 | G651: 429.45 | H651: 0.53 | I651: 858.90 | J651: -777.10 | K651: 0 | L651: =RC[-3]/100*RC[-1] -> 0.53
A652: 13 | B652: _1568.06.21 | C652: Точило LANSKY Folding Diamond Paddle MD/FN, складное | D652: 20.00 | E652: usd | F652: 2 | G652: 210.00 | H652: 0.53 | I652: 420.00 | J652: -380.00 | K652: 0 | L652: =RC[-3]/100*RC[-1] -> 0.53
A653: 14 | B653: _1568.06.04 | C653: Точило LANSKY Professional Sharpening System | D653: 53.00 | E653: usd | F653: 2 | G653: 438.90 | H653: 0.41 | I653: 877.80 | J653: -1242.20 | K653: 0 | L653: =RC[-3]/100*RC[-1] -> 0.41
A654: 15 | B654: _1568.06.34 | C654: Точило LANSKY Quick Edge | D654: 5.70 | E654: usd | F654: 2 | G654: 59.85 | H654: 0.53 | I654: 119.70 | J654: -108.30 | K654: 0 | L654: =RC[-3]/100*RC[-1] -> 0.53
A655: 16 | B655: _1568.06.52 | C655: Точило LANSKY Spyderco Knife Sharpener | D655: 6.20 | E655: usd | F655: 2 | G655: 65.10 | H655: 0.53 | I655: 130.20 | J655: -117.80 | K655: 0 | L655: =RC[-3]/100*RC[-1] -> 0.53
A656: 17 | B656: _1568.06.00 | C656: Точило LANSKY Standard Sharpening System | D656: 28.10 | E656: usd | F656: 4 | G656: 295.05 | H656: 0.53 | I656: 1180.20 | J656: -1067.80 | K656: 0 | L656: =RC[-3]/100*RC[-1] -> 0.53
A657: 18 | B657: _E01/BL | C657: Фонарь FENIX E01 чёрный | D657: 9.10 | E657: usd | F657: 4 | G657: 94.50 | H657: 0.52 | I657: 378.00 | J657: -350.00 | K657: 0 | L657: =RC[-3]/100*RC[-1] -> 0.52
A658: 19 | B658: _E35 | C658: Фонарь FENIX E35 | D658: 30.94 | E658: usd | F658: 1 | G658: 324.45 | H658: 0.52 | I658: 324.45 | J658: -294.35 | K658: 0 | L658: =RC[-3]/100*RC[-1] -> 0.52
A659: 20 | B659: _TK76 | C659: Фонарь FENIX TK76 | D659: 223.00 | E659: usd | F659: 1 | G659: 2341.50 | H659: 0.53 | I659: 2341.50 | J659: -2118.50 | K659: 0 | L659: =RC[-3]/100*RC[-1] -> 0.53
A660: 21 | B660: _HL10 | C660: Фонарь налобный FENIX HL10 | D660: 25.03 | E660: usd | F660: 3 | G660: 262.50 | H660: 0.52 | I660: 787.50 | J660: -714.30 | K660: 0 | L660: =RC[-3]/100*RC[-1] -> 0.52
A661: 22 | B661: _HL22R4y | C661: Фонарь налобный FENIX HL22R4 жёлтый | D661: 26.24 | E661: usd | F661: 2 | G661: 280.35 | H661: 0.53 | I661: 560.70 | J661: -488.90 | K661: 0 | L661: =RC[-3]/100*RC[-1] -> 0.53
A662: 23 | B662: _HL22R4s | C662: Фонарь налобный FENIX HL22R4 серый | D662: 26.24 | E662: usd | F662: 2 | G662: 280.35 | H662: 0.53 | I662: 560.70 | J662: -488.90 | K662: 0 | L662: =RC[-3]/100*RC[-1] -> 0.53
A663: 24 | B663: _HL30 | C663: Фонарь налобный FENIX HL30 оранж | D663: 38.98 | E663: usd | F663: 2 | G663: 413.70 | H663: 0.53 | I663: 827.40 | J663: -731.80 | K663: 0 | L663: =RC[-3]/100*RC[-1] -> 0.53
A664: 25 | B664: _HP01y | C664: Фонарь налобный FENIX HP01 жёлтый | D664: 38.98 | E664: usd | F664: 2 | G664: 413.70 | H664: 0.53 | I664: 827.40 | J664: -731.80 | K664: 0 | L664: =RC[-3]/100*RC[-1] -> 0.53
A665: 26 | B665: _HP05y | C665: Фонарь налобный FENIX HP05 жёлтый | D665: 43.83 | E665: usd | F665: 1 | G665: 464.10 | H665: 0.53 | I665: 464.10 | J665: -412.50 | K665: 0 | L665: =RC[-3]/100*RC[-1] -> 0.53
A666: 27 | B666: _HP05s | C666: Фонарь налобный FENIX HP05 серый | D666: 44.20 | E666: usd | F666: 1 | G666: 464.10 | H666: 0.53 | I666: 464.10 | J666: -419.90 | K666: 0 | L666: =RC[-3]/100*RC[-1] -> 0.53
A667: 28 | B667: _HP30y | C667: Фонарь налобный FENIX HP30 жёлтый | D667: 69.31 | E667: usd | F667: 1 | G667: 731.85 | H667: 0.53 | I667: 731.85 | J667: -654.35 | K667: 0 | L667: =RC[-3]/100*RC[-1] -> 0.53
A668: 29 | B668: _HP30s | C668: Фонарь налобный FENIX HP30 серый | D668: 69.31 | E668: usd | F668: 1 | G668: 731.85 | H668: 0.53 | I668: 731.85 | J668: -654.35 | K668: 0 | L668: =RC[-3]/100*RC[-1] -> 0.53
A669: 30 | B669: _PD32G2 | C669: Фонарь светодиодный FENIX PD32G2 | D669: 59.61 | E669: usd | F669: 1 | G669: 630.00 | H669: 0.53 | I669: 630.00 | J669: -562.20 | K669: 0 | L669: =RC[-3]/100*RC[-1] -> 0.53
A670: 31 | B670: _PD35U2 | C670: Фонарь светодиодный FENIX PD35U2 | D670: 65.70 | E670: usd | F670: 1 | G670: 694.05 | H670: 0.53 | I670: 694.05 | J670: -619.95 | K670: 0 | L670: =RC[-3]/100*RC[-1] -> 0.53
A671: 32 | B671: _UC40G2 | C671: Фонарь светодиодный FENIX UC40G2 | D671: 71.74 | E671: usd | F671: 2 | G671: 757.05 | H671: 0.53 | I671: 1514.10 | J671: -1355.50 | K671: 0 | L671: =RC[-3]/100*RC[-1] -> 0.53
A672: 33 | B672: _TK15S2 | C672: Фонарь светодиодный FENIX ТК15 S2 | D672: 66.28 | E672: usd | F672: 1 | G672: 700.35 | H672: 0.53 | I672: 700.35 | J672: -625.25 | K672: 0 | L672: =RC[-3]/100*RC[-1] -> 0.53
A673: 34 | B673: _TK22L2ol | C673: Фонарь светодиодный FENIX ТК22 L2T6 oliv | D673: 78.80 | E673: usd | F673: 2 | G673: 827.40 | H673: 0.53 | I673: 1654.80 | J673: -1497.20 | K673: 0 | L673: =RC[-3]/100*RC[-1] -> 0.53
A674: 35 | B674: _TK51 | C674: Фонарь светодиодный FENIX ТК51 | D674: 120.76 | E674: usd | F674: 2 | G674: 1260.00 | H674: 0.52 | I674: 2520.00 | J674: -2310.40 | K674: 0 | L674: =RC[-3]/100*RC[-1] -> 0.52 | M674: =SUM(R[-35]C[-1]:RC[-1]) -> 
A676: #2793 (2014-03-28) Львів Назар Максимович - Прихід товару
A677: N | B677: арт | C677: назва | D677: закуп | F677: к-ть | G677: цiна | H677: кф | I677: продж | J677: дохiд | K677: % | L677: з-та
A678: 1 | B678: _21906 | C678: Баллон Borner СО-2 12г | D678: 0.31 | E678: Инт | F678: 150 | G678: 4.50 | H678: 0.72 | I678: 675.00 | J678: -256.04 | K678: 0 | L678: =RC[-3]/100*RC[-1] -> 0.72
A679: 2 | B679: _KWC-0548 | C679: Пістолет пневматичний KWC PM (KM-44 DHN) | D679: 41.70 | E679: Инт | F679: 5 | G679: 475.00 | H679: 0.57 | I679: 2375.00 | J679: -1795.00 | K679: 0 | L679: =RC[-3]/100*RC[-1] -> 0.57 | M679: =SUM(R[-2]C[-1]:RC[-1]) -> 
A681: #2881 (2014-04-01) Львів Назар Максимович - Прихід товару
A682: N | B682: арт | C682: назва | D682: закуп | F682: к-ть | G682: цiна | H682: кф | I682: продж | J682: дохiд | K682: % | L682: з-та
A683: 1 | B683: _21906 | C683: Баллон Borner СО-2 12г | D683: 0.31 | E683: Инт | F683: 1524 | G683: 4.50 | H683: 0.72 | I683: 6858.00 | J683: -2601.32 | K683: 0 | L683: =RC[-3]/100*RC[-1] -> 0.72
A684: 2 | B684: _162087 | C684: Баллон перцовый Anti-Hund -Sprey 50мл | D684: 3.05 | E684: Инт | F684: 50 | G684: 25.00 | H684: 0.41 | I684: 1250.00 | J684: -1798.78 | K684: 0 | L684: =RC[-3]/100*RC[-1] -> 0.41
A685: 3 | B685: _162083 | C685: Балон перцевий DEFENOL 40мл | D685: 3.29 | E685: Инт | F685: 50 | G685: 24.00 | H685: 0.36 | I685: 1200.00 | J685: -2092.68 | K685: 0 | L685: =RC[-3]/100*RC[-1] -> 0.36
A686: 4 | B686: _162085 | C686: Баллон перцовый KO-CS 40мл | D686: 3.29 | E686: Инт | F686: 50 | G686: 24.00 | H686: 0.36 | I686: 1200.00 | J686: -2092.68 | K686: 0 | L686: =RC[-3]/100*RC[-1] -> 0.36
A687: 5 | B687: _16215 | C687: Баллон перцовый PEPPER SPRAY K.O. FOG 40мл ||16223040 | D687: 2.93 | E687: Инт | F687: 50 | G687: 24.00 | H687: 0.41 | I687: 1200.00 | J687: -1726.83 | K687: 0 | L687: =RC[-3]/100*RC[-1] -> 0.41
A688: 6 | B688: _16213 | C688: Баллон перцовый К.О JET 40мл ||16224040 | D688: 2.93 | E688: Инт | F688: 50 | G688: 24.00 | H688: 0.41 | I688: 1200.00 | J688: -1726.83 | K688: 0 | L688: =RC[-3]/100*RC[-1] -> 0.41
A689: 7 | B689: _100SH-1 | C689: Шарик "Шаровая молния" 4.5мм 0.57г (100шт) | D689: 0.35 | E689: Инт | F689: 50 | G689: 3.50 | H689: 0.51 | I689: 175.00 | J689: -170.46 | K689: 0 | L689: =RC[-3]/100*RC[-1] -> 0.51
A690: 8 | B690: _6805 | C690: Пульки для пнев. оружия ЛЮМАН 4.5мм 0.55г Field Target (500шт) | D690: 4.00 | E690: usd | F690: 25 | G690: 39.00 | H690: 0.49 | I690: 975.00 | J690: -1025.00 | K690: 0 | L690: =RC[-3]/100*RC[-1] -> 0.49
A691: 9 | B691: _24-0422 | C691: Пульки для пнев. оружия ЛЮМАН 4.5мм 0.57г гостроголові (500шт) | D691: 2.27 | E691: Инт | F691: 5 | G691: 25.00 | H691: 0.55 | I691: 125.00 | J691: -102.27 | K691: 0 | L691: =RC[-3]/100*RC[-1] -> 0.55
A692: 10 | B692: _24-0417 | C692: Пульки для пнев. оружия ЛЮМАН 4.5мм 0.57г круглоголові (300шт) | D692: 1.55 | E692: Инт | F692: 13 | G692: 17.00 | H692: 0.55 | I692: 221.00 | J692: -180.82 | K692: 0 | L692: =RC[-3]/100*RC[-1] -> 0.55
A693: 11 | B693: _24-0421 | C693: Пульки для пнев. оружия ЛЮМАН 4.5мм 0.57г круглоголові (500шт) | D693: 2.55 | E693: Инт | F693: 6 | G693: 28.00 | H693: 0.55 | I693: 168.00 | J693: -137.45 | K693: 0 | L693: =RC[-3]/100*RC[-1] -> 0.55
A694: 12 | B694: _24-0416 | C694: Пульки для пнев. оружия ЛЮМАН 4.5мм 0.68г гостроголові (300шт) | D694: 2.00 | E694: Инт | F694: 13 | G694: 22.00 | H694: 0.55 | I694: 286.00 | J694: -234.00 | K694: 0 | L694: =RC[-3]/100*RC[-1] -> 0.55
A695: 13 | B695: _24-0420 | C695: Пульки для пнев. оружия ЛЮМАН 4.5мм 0.68г гостроголові (500шт) | D695: 2.91 | E695: Инт | F695: 40 | G695: 32.00 | H695: 0.55 | I695: 1280.00 | J695: -1047.27 | K695: 0 | L695: =RC[-3]/100*RC[-1] -> 0.55
A696: 14 | B696: _500SH-1 | C696: Шарік "Шаровая молния" 4.5мм 0.57г (500шт) | D696: 1.18 | E696: Инт | F696: 50 | G696: 13.00 | H696: 0.55 | I696: 650.00 | J696: -531.82 | K696: 0 | L696: =RC[-3]/100*RC[-1] -> 0.55
A697: 15 | B697: _207-997 | C697: Шарик ЛЮМАН 4.5мм 0.34г стальной, омеднённый (600шт) | D697: 2.00 | E697: Инт | F697: 25 | G697: 22.00 | H697: 0.55 | I697: 550.00 | J697: -450.00 | K697: 0 | L697: =RC[-3]/100*RC[-1] -> 0.55 | M697: =SUM(R[-15]C[-1]:RC[-1]) -> 
A699: #3183 (2014-04-10) Акрополіс - Прихід товару
A700: N | B700: арт | C700: назва | D700: закуп | F700: к-ть | G700: цiна | H700: кф | I700: продж | J700: дохiд | K700: % | L700: з-та
A701: 1 | B701: A19-16 | C701: Охотничий ремень (L-110-127) ACROPOLIS ||МР-5 | D701: 91.00 | E701: грн | F701: 3 | G701: 91.00 | H701: 1.00 | I701: 232.05 | J701: -40.95 | K701: 0 | L701: =RC[-3]/100*RC[-1] -> 1.00
A702: 2 | B702: A19-137 | C702: Охотничий ремень ACROPOLIS ||МР-7 | D702: 118.15 | E702: грн | F702: 3 | G702: 139.00 | H702: 1.18 | I702: 354.45 | J702: -0.00 | K702: 0 | L702: =RC[-3]/100*RC[-1] -> 1.18
A703: 3 | B703: A19-113 | C703: Охотничий ремень ACROPOLIS ||МРБ-1н | D703: 173.00 | E703: грн | F703: 3 | G703: 203.00 | H703: 1.17 | I703: 517.65 | J703: -1.35 | K703: 0 | L703: =RC[-3]/100*RC[-1] -> 1.17
A704: 4 | B704: A19-22 | C704: Охотничий рюкзак ACROPOLIS ||РМ-2Т | D704: 590.00 | E704: грн | F704: 2 | G704: 590.00 | H704: 1.00 | I704: 1003.00 | J704: -177.00 | K704: 0 | L704: =RC[-3]/100*RC[-1] -> 1.00
A705: 5 | B705: A19-29 | C705: Пояс-патронташ ACROPOLIS ||ПП-1ан | D705: 123.00 | E705: грн | F705: 2 | G705: 131.00 | H705: 1.07 | I705: 222.70 | J705: -23.30 | K705: 0 | L705: =RC[-3]/100*RC[-1] -> 1.07
A706: 6 | B706: A19-129 | C706: Футляр для винтовки ACROPOLIS ||ФЗ-14 | D706: 244.00 | E706: грн | F706: 2 | G706: 286.00 | H706: 1.17 | I706: 486.20 | J706: -1.80 | K706: 0 | L706: =RC[-3]/100*RC[-1] -> 1.17
A707: 7 | B707: A19-119 | C707: Футляр для винтовки ACROPOLIS ||ФЗ-7а/30 | D707: 578.00 | E707: грн | F707: 1 | G707: 680.00 | H707: 1.18 | I707: 578.00 | J707: 0.00 | K707: 0 | L707: =RC[-3]/100*RC[-1] -> 1.18
A708: 8 | B708: A19-120 | C708: Футляр для винтовки ACROPOLIS ||ФЗ-7б/30 | D708: 619.50 | E708: грн | F708: 1 | G708: 680.00 | H708: 1.10 | I708: 578.00 | J708: -41.50 | K708: 0 | L708: =RC[-3]/100*RC[-1] -> 1.10
A709: 9 | B709: A19-117 | C709: Футляр для винтовки ACROPOLIS ||ФЗ-8б | D709: 461.00 | E709: грн | F709: 1 | G709: 493.00 | H709: 1.07 | I709: 419.05 | J709: -41.95 | K709: 0 | L709: =RC[-3]/100*RC[-1] -> 1.07
A710: 10 | B710: A19-61 | C710: Футляр для ствола гладк. ACROPOLIS ||ФС-2 | D710: 46.00 | E710: грн | F710: 3 | G710: 46.00 | H710: 1.00 | I710: 117.30 | J710: -20.70 | K710: 0 | L710: =RC[-3]/100*RC[-1] -> 1.00
A711: 11 | B711: A19-65 | C711: Футляр для ствола нарізн. ACROPOLIS ||ФС-1 | D711: 46.00 | E711: грн | F711: 3 | G711: 46.00 | H711: 1.00 | I711: 117.30 | J711: -20.70 | K711: 0 | L711: =RC[-3]/100*RC[-1] -> 1.00
A712: 12 | B712: A19-128 | C712: Чохол для оружия ACROPOLIS ||ЧДЗ-4 | D712: 106.00 | E712: грн | F712: 3 | G712: 106.00 | H712: 1.00 | I712: 270.30 | J712: -47.70 | K712: 0 | L712: =RC[-3]/100*RC[-1] -> 1.00 | M712: =SUM(R[-12]C[-1]:RC[-1]) -> 
A714: #3320 (2014-04-15) Гелікон Helikon-Tex Геликон - Прихід товару
A715: N | B715: арт | C715: назва | D715: закуп | F715: к-ть | G715: цiна | H715: кф | I715: продж | J715: дохiд | K715: % | L715: з-та
A716: 1 | B716: H11071/M | C716: APECS USMC куртка TRILAMINAT марпат ||KU-APE-NL-07 | D716: 38.25 | E716: usd | F716: 17 | G716: 1287.00 | H716: 1.68 | I716: 21879.00 | J716: 8874.00 | K716: 0 | L716: =RC[-3]/100*RC[-1] -> 1.68
A717: 2 | B717: H0419 | C717: BW столовий набір 4-предметный (оригинал) ||NZ-BSW-SS-15 | D717: 2.59 | E717: usd | F717: 198 | G717: 111.00 | H717: 2.14 | I717: 21978.00 | J717: 11721.60 | K717: 0 | L717: =RC[-3]/100*RC[-1] -> 2.14
A718: 3 | B718: H59141/LR | C718: CPU китель мультикамо (PolyCotton) ||BL-CPU-PR-14 | D718: 21.56 | E718: usd | F718: 5 | G718: 641.00 | H718: 1.49 | I718: 3205.00 | J718: 1049.00 | K718: 0 | L718: =RC[-3]/100*RC[-1] -> 1.49
A719: 4 | B719: H59141/MR | C719: CPU китель мультикамо (PolyCotton) ||BL-CPU-PR-14 | D719: 21.56 | E719: usd | F719: 10 | G719: 641.00 | H719: 1.49 | I719: 6410.00 | J719: 2098.00 | K719: 0 | L719: =RC[-3]/100*RC[-1] -> 1.49
A720: 5 | B720: H59141/XLR | C720: CPU китель мультикамо (PolyCotton) ||BL-CPU-PR-14 | D720: 21.56 | E720: usd | F720: 10 | G720: 641.00 | H720: 1.49 | I720: 6410.00 | J720: 2098.00 | K720: 0 | L720: =RC[-3]/100*RC[-1] -> 1.49
A721: 6 | B721: H5914/MR | C721: CPU штаны мультикамо (PolyCotton) ||SP-CPU-PR-14 | D721: 21.56 | E721: usd | F721: 10 | G721: 641.00 | H721: 1.49 | I721: 6410.00 | J721: 2098.00 | K721: 0 | L721: =RC[-3]/100*RC[-1] -> 1.49
A722: 7 | B722: H5904/LL | C722: CPU штаны польский вудлэнд (PolyCotton) ||SP-CPU-PR-04 | D722: 20.10 | E722: usd | F722: 10 | G722: 600.00 | H722: 1.49 | I722: 6000.00 | J722: 1980.00 | K722: 0 | L722: =RC[-3]/100*RC[-1] -> 1.49
A723: 8 | B723: H5904/LR | C723: CPU штаны польский вудлэнд (PolyCotton) ||SP-CPU-PR-04 | D723: 20.10 | E723: usd | F723: 21 | G723: 600.00 | H723: 1.49 | I723: 12600.00 | J723: 4158.00 | K723: 0 | L723: =RC[-3]/100*RC[-1] -> 1.49
A724: 9 | B724: H5904/ML | C724: CPU штаны польский вудлэнд (PolyCotton) ||SP-CPU-PR-04 | D724: 20.10 | E724: usd | F724: 10 | G724: 600.00 | H724: 1.49 | I724: 6000.00 | J724: 1980.00 | K724: 0 | L724: =RC[-3]/100*RC[-1] -> 1.49
A725: 10 | B725: H5904/MR | C725: CPU штаны польский вудлэнд (PolyCotton) ||SP-CPU-PR-04 | D725: 20.10 | E725: usd | F725: 20 | G725: 600.00 | H725: 1.49 | I725: 12000.00 | J725: 3960.00 | K725: 0 | L725: =RC[-3]/100*RC[-1] -> 1.49
A726: 11 | B726: H5904/SL | C726: CPU штаны польский вудлэнд (PolyCotton) ||SP-CPU-PR-04 | D726: 20.10 | E726: usd | F726: 10 | G726: 600.00 | H726: 1.49 | I726: 6000.00 | J726: 1980.00 | K726: 0 | L726: =RC[-3]/100*RC[-1] -> 1.49
A727: 12 | B727: H5904/SR | C727: CPU штаны польский вудлэнд (PolyCotton) ||SP-CPU-PR-04 | D727: 20.10 | E727: usd | F727: 20 | G727: 600.00 | H727: 1.49 | I727: 12000.00 | J727: 3960.00 | K727: 0 | L727: =RC[-3]/100*RC[-1] -> 1.49
A728: 13 | B728: H5904/XLR | C728: CPU штаны польский вудлэнд (PolyCotton) ||SP-CPU-PR-04 | D728: 20.10 | E728: usd | F728: 20 | G728: 600.00 | H728: 1.49 | I728: 12000.00 | J728: 3960.00 | K728: 0 | L728: =RC[-3]/100*RC[-1] -> 1.49
A729: 14 | B729: H12101/L | C729: ECWCS куртка TRILAMINAT ACU ||KU-EC2-NL-10 | D729: 43.99 | E729: usd | F729: 10 | G729: 1315.00 | H729: 1.49 | I729: 13150.00 | J729: 4352.00 | K729: 0 | L729: =RC[-3]/100*RC[-1] -> 1.49
A730: 15 | B730: H12101/M | C730: ECWCS куртка TRILAMINAT ACU ||KU-EC2-NL-10 | D730: 43.99 | E730: usd | F730: 10 | G730: 1315.00 | H730: 1.49 | I730: 13150.00 | J730: 4352.00 | K730: 0 | L730: =RC[-3]/100*RC[-1] -> 1.49
A731: 16 | B731: H12101/XL | C731: ECWCS куртка TRILAMINAT ACU ||KU-EC2-NL-10 | D731: 43.99 | E731: usd | F731: 10 | G731: 1315.00 | H731: 1.49 | I731: 13150.00 | J731: 4352.00 | K731: 0 | L731: =RC[-3]/100*RC[-1] -> 1.49
A732: 17 | B732: H12101/XXL | C732: ECWCS куртка TRILAMINAT ACU ||KU-EC2-NL-10 | D732: 43.99 | E732: usd | F732: 5 | G732: 1315.00 | H732: 1.49 | I732: 6575.00 | J732: 2176.00 | K732: 0 | L732: =RC[-3]/100*RC[-1] -> 1.49
A733: 18 | B733: H12021/2XL | C733: ECWCS куртка TRILAMINAT Gen.2 олива ||KU-EC2-NL-02 | D733: 43.99 | E733: usd | F733: 5 | G733: 1315.00 | H733: 1.49 | I733: 6575.00 | J733: 2176.00 | K733: 0 | L733: =RC[-3]/100*RC[-1] -> 1.49
A734: 19 | B734: H12021/L | C734: ECWCS куртка TRILAMINAT Gen.2 олива ||KU-EC2-NL-02 | D734: 43.99 | E734: usd | F734: 23 | G734: 1315.00 | H734: 1.49 | I734: 30245.00 | J734: 10009.60 | K734: 0 | L734: =RC[-3]/100*RC[-1] -> 1.49
A735: 20 | B735: H12021/M | C735: ECWCS куртка TRILAMINAT Gen.2 олива ||KU-EC2-NL-02 | D735: 43.99 | E735: usd | F735: 32 | G735: 1315.00 | H735: 1.49 | I735: 42080.00 | J735: 13926.40 | K735: 0 | L735: =RC[-3]/100*RC[-1] -> 1.49
A736: 21 | B736: H12021/XL | C736: ECWCS куртка TRILAMINAT Gen.2 олива ||KU-EC2-NL-02 | D736: 43.99 | E736: usd | F736: 19 | G736: 1315.00 | H736: 1.49 | I736: 24985.00 | J736: 8268.80 | K736: 0 | L736: =RC[-3]/100*RC[-1] -> 1.49
A737: 22 | B737: H12041/2XL | C737: ECWCS куртка TRILAMINAT польский вудлєнд ||KU-EC2-NL-04 | D737: 43.99 | E737: usd | F737: 10 | G737: 1315.00 | H737: 1.49 | I737: 13150.00 | J737: 4352.00 | K737: 0 | L737: =RC[-3]/100*RC[-1] -> 1.49
A738: 23 | B738: H12041/L | C738: ECWCS куртка TRILAMINAT польский вудлєнд ||KU-EC2-NL-04 | D738: 43.99 | E738: usd | F738: 19 | G738: 1315.00 | H738: 1.49 | I738: 24985.00 | J738: 8268.80 | K738: 0 | L738: =RC[-3]/100*RC[-1] -> 1.49
A739: 24 | B739: H12041/M | C739: ECWCS куртка TRILAMINAT польский вудлєнд ||KU-EC2-NL-04 | D739: 43.99 | E739: usd | F739: 20 | G739: 1315.00 | H739: 1.49 | I739: 26300.00 | J739: 8704.00 | K739: 0 | L739: =RC[-3]/100*RC[-1] -> 1.49
A740: 25 | B740: H12041/S | C740: ECWCS куртка TRILAMINAT польский вудлєнд ||KU-EC2-NL-04 | D740: 43.99 | E740: usd | F740: 10 | G740: 1315.00 | H740: 1.49 | I740: 13150.00 | J740: 4352.00 | K740: 0 | L740: =RC[-3]/100*RC[-1] -> 1.49
A741: 26 | B741: H12041/XL | C741: ECWCS куртка TRILAMINAT польский вудлєнд ||KU-EC2-NL-04 | D741: 43.99 | E741: usd | F741: 20 | G741: 1315.00 | H741: 1.49 | I741: 26300.00 | J741: 8704.00 | K741: 0 | L741: =RC[-3]/100*RC[-1] -> 1.49
A742: 27 | B742: H12061/2XL | C742: ECWCS куртка TRILAMINAT польский дезерт||KU-EC2-NL-06 | D742: 43.99 | E742: usd | F742: 5 | G742: 1315.00 | H742: 1.49 | I742: 6575.00 | J742: 2176.00 | K742: 0 | L742: =RC[-3]/100*RC[-1] -> 1.49
A743: 28 | B743: H12061/L | C743: ECWCS куртка TRILAMINAT польский дезерт||KU-EC2-NL-06 | D743: 43.99 | E743: usd | F743: 10 | G743: 1315.00 | H743: 1.49 | I743: 13150.00 | J743: 4352.00 | K743: 0 | L743: =RC[-3]/100*RC[-1] -> 1.49
A744: 29 | B744: H12061/M | C744: ECWCS куртка TRILAMINAT польский дезерт||KU-EC2-NL-06 | D744: 43.99 | E744: usd | F744: 10 | G744: 1315.00 | H744: 1.49 | I744: 13150.00 | J744: 4352.00 | K744: 0 | L744: =RC[-3]/100*RC[-1] -> 1.49
A745: 30 | B745: H12061/XL | C745: ECWCS куртка TRILAMINAT польский дезерт||KU-EC2-NL-06 | D745: 43.99 | E745: usd | F745: 10 | G745: 1315.00 | H745: 1.49 | I745: 13150.00 | J745: 4352.00 | K745: 0 | L745: =RC[-3]/100*RC[-1] -> 1.49
A746: 31 | B746: H1204/2XL | C746: ECWCS штаны TRILAMINAT PL Woodland ||SP-EC2-NL-04 | D746: 36.63 | E746: usd | F746: 5 | G746: 1114.00 | H746: 1.52 | I746: 5570.00 | J746: 1907.00 | K746: 0 | L746: =RC[-3]/100*RC[-1] -> 1.52
A747: 32 | B747: H1204/L | C747: ECWCS штаны TRILAMINAT PL Woodland ||SP-EC2-NL-04 | D747: 36.63 | E747: usd | F747: 10 | G747: 1114.00 | H747: 1.52 | I747: 11140.00 | J747: 3814.00 | K747: 0 | L747: =RC[-3]/100*RC[-1] -> 1.52
A748: 33 | B748: H1204/M | C748: ECWCS штаны TRILAMINAT PL Woodland ||SP-EC2-NL-04 | D748: 36.63 | E748: usd | F748: 10 | G748: 1114.00 | H748: 1.52 | I748: 11140.00 | J748: 3814.00 | K748: 0 | L748: =RC[-3]/100*RC[-1] -> 1.52
A749: 34 | B749: H1204/XL | C749: ECWCS штаны TRILAMINAT PL Woodland ||SP-EC2-NL-04 | D749: 36.63 | E749: usd | F749: 10 | G749: 1114.00 | H749: 1.52 | I749: 11140.00 | J749: 3814.00 | K749: 0 | L749: =RC[-3]/100*RC[-1] -> 1.52
A750: 35 | B750: H1202/L | C750: ECWCS штаны TRILAMINAT олива ||SP-EC2-NL-02 | D750: 35.80 | E750: usd | F750: 10 | G750: 1071.00 | H750: 1.50 | I750: 10710.00 | J750: 3550.00 | K750: 0 | L750: =RC[-3]/100*RC[-1] -> 1.50
A751: 36 | B751: H1202/S | C751: ECWCS штаны TRILAMINAT олива ||SP-EC2-NL-02 | D751: 35.80 | E751: usd | F751: 5 | G751: 1071.00 | H751: 1.50 | I751: 5355.00 | J751: 1775.00 | K751: 0 | L751: =RC[-3]/100*RC[-1] -> 1.50
A752: 37 | B752: H5827/2XLL | C752: URBAN TACTICAL штаны Jungle Green PolyCotton ||SP-UTL-PR-27 | D752: 28.43 | E752: usd | F752: 10 | G752: 565.00 | H752: 0.99 | I752: 5650.00 | J752: -36.00 | K752: 0 | L752: =RC[-3]/100*RC[-1] -> 0.99
A753: 38 | B753: H5827/2XLR | C753: URBAN TACTICAL штаны Jungle Green PolyCotton ||SP-UTL-PR-27 | D753: 28.43 | E753: usd | F753: 10 | G753: 565.00 | H753: 0.99 | I753: 5650.00 | J753: -36.00 | K753: 0 | L753: =RC[-3]/100*RC[-1] -> 0.99
A754: 39 | B754: H5827/3XLL | C754: URBAN TACTICAL штаны Jungle Green PolyCotton ||SP-UTL-PR-27 | D754: 28.43 | E754: usd | F754: 6 | G754: 565.00 | H754: 0.99 | I754: 3390.00 | J754: -21.60 | K754: 0 | L754: =RC[-3]/100*RC[-1] -> 0.99
A755: 40 | B755: H5827/3XLR | C755: URBAN TACTICAL штаны Jungle Green PolyCotton ||SP-UTL-PR-27 | D755: 28.43 | E755: usd | F755: 10 | G755: 565.00 | H755: 0.99 | I755: 5650.00 | J755: -36.00 | K755: 0 | L755: =RC[-3]/100*RC[-1] -> 0.99
A756: 41 | B756: H5827/LL | C756: URBAN TACTICAL штаны Jungle Green PolyCotton ||SP-UTL-PR-27 | D756: 28.43 | E756: usd | F756: 10 | G756: 565.00 | H756: 0.99 | I756: 5650.00 | J756: -36.00 | K756: 0 | L756: =RC[-3]/100*RC[-1] -> 0.99
A757: 42 | B757: H5827/LR | C757: URBAN TACTICAL штаны Jungle Green PolyCotton ||SP-UTL-PR-27 | D757: 28.43 | E757: usd | F757: 10 | G757: 565.00 | H757: 0.99 | I757: 5650.00 | J757: -36.00 | K757: 0 | L757: =RC[-3]/100*RC[-1] -> 0.99
A758: 43 | B758: H5827/ML | C758: URBAN TACTICAL штаны Jungle Green PolyCotton ||SP-UTL-PR-27 | D758: 28.43 | E758: usd | F758: 10 | G758: 565.00 | H758: 0.99 | I758: 5650.00 | J758: -36.00 | K758: 0 | L758: =RC[-3]/100*RC[-1] -> 0.99
A759: 44 | B759: H5827/MR | C759: URBAN TACTICAL штаны Jungle Green PolyCotton ||SP-UTL-PR-27 | D759: 28.43 | E759: usd | F759: 10 | G759: 565.00 | H759: 0.99 | I759: 5650.00 | J759: -36.00 | K759: 0 | L759: =RC[-3]/100*RC[-1] -> 0.99
A760: 45 | B760: H5827/SR | C760: URBAN TACTICAL штаны Jungle Green PolyCotton ||SP-UTL-PR-27 | D760: 28.43 | E760: usd | F760: 10 | G760: 565.00 | H760: 0.99 | I760: 5650.00 | J760: -36.00 | K760: 0 | L760: =RC[-3]/100*RC[-1] -> 0.99
A761: 46 | B761: H5827/XLL | C761: URBAN TACTICAL штаны Jungle Green PolyCotton ||SP-UTL-PR-27 | D761: 28.43 | E761: usd | F761: 10 | G761: 850.00 | H761: 1.49 | I761: 8500.00 | J761: 2814.00 | K761: 0 | L761: =RC[-3]/100*RC[-1] -> 1.49
A762: 47 | B762: H5827/XLR | C762: URBAN TACTICAL штаны Jungle Green PolyCotton ||SP-UTL-PR-27 | D762: 28.43 | E762: usd | F762: 10 | G762: 565.00 | H762: 0.99 | I762: 5650.00 | J762: -36.00 | K762: 0 | L762: =RC[-3]/100*RC[-1] -> 0.99
A763: 48 | B763: H5811/2XLL | C763: URBAN TACTICAL штаны койот PolyCotton ||SP-UTL-PR-11 | D763: 28.43 | E763: usd | F763: 10 | G763: 565.00 | H763: 0.99 | I763: 5650.00 | J763: -36.00 | K763: 0 | L763: =RC[-3]/100*RC[-1] -> 0.99
A764: 49 | B764: H5811/3XLL | C764: URBAN TACTICAL штаны койот PolyCotton ||SP-UTL-PR-11 | D764: 28.43 | E764: usd | F764: 10 | G764: 565.00 | H764: 0.99 | I764: 5650.00 | J764: -36.00 | K764: 0 | L764: =RC[-3]/100*RC[-1] -> 0.99
A765: 50 | B765: H5811/ML | C765: URBAN TACTICAL штаны койот PolyCotton ||SP-UTL-PR-11 | D765: 28.43 | E765: usd | F765: 10 | G765: 565.00 | H765: 0.99 | I765: 5650.00 | J765: -36.00 | K765: 0 | L765: =RC[-3]/100*RC[-1] -> 0.99
A766: 51 | B766: H5811/SL | C766: URBAN TACTICAL штаны койот PolyCotton ||SP-UTL-PR-11 | D766: 28.43 | E766: usd | F766: 10 | G766: 869.00 | H766: 1.53 | I766: 8690.00 | J766: 3004.00 | K766: 0 | L766: =RC[-3]/100*RC[-1] -> 1.53
A767: 52 | B767: H5811/XLL | C767: URBAN TACTICAL штаны койот PolyCotton ||SP-UTL-PR-11 | D767: 28.43 | E767: usd | F767: 10 | G767: 565.00 | H767: 0.99 | I767: 5650.00 | J767: -36.00 | K767: 0 | L767: =RC[-3]/100*RC[-1] -> 0.99
A768: 53 | B768: H7105 | C768: US BDU кепка 3-х цветный дезерт (R/S) ||CZ-COM-CR-05 | D768: 2.33 | E768: usd | F768: 200 | G768: 72.00 | H768: 1.55 | I768: 14400.00 | J768: 5080.00 | K768: 0 | L768: =RC[-3]/100*RC[-1] -> 1.55
A769: 54 | B769: H7104 | C769: US BDU кепка польский вудлэнд ( PolyCotton Ripstop) ||CZ-COM-PR-04 | D769: 2.33 | E769: usd | F769: 200 | G769: 72.00 | H769: 1.55 | I769: 14400.00 | J769: 5080.00 | K769: 0 | L769: =RC[-3]/100*RC[-1] -> 1.55
A770: 55 | B770: H7010/L | C770: US GI панама ACU (NYCO R/S) / 7 1/2 ||KA-ACU-NR-10 | D770: 4.06 | E770: usd | F770: 50 | G770: 121.00 | H770: 1.49 | I770: 6050.00 | J770: 1990.00 | K770: 0 | L770: =RC[-3]/100*RC[-1] -> 1.49
A771: 56 | B771: H7010/M | C771: US GI панама ACU (NYCO R/S) / 7 1/4 ||KA-BON-NR-10 | D771: 4.06 | E771: usd | F771: 50 | G771: 121.00 | H771: 1.49 | I771: 6050.00 | J771: 1990.00 | K771: 0 | L771: =RC[-3]/100*RC[-1] -> 1.49
A772: 57 | B772: H7010/XL | C772: US GI панама ACU (NYCO R/S) / 7 3/4 ||KA-BON-NR-10 | D772: 4.06 | E772: usd | F772: 14 | G772: 121.00 | H772: 1.49 | I772: 1694.00 | J772: 557.20 | K772: 0 | L772: =RC[-3]/100*RC[-1] -> 1.49
A773: 58 | B773: H7010/S | C773: US GI панама ACU (NYCO R/S) / 7 ||KA-BON-NR-10 | D773: 4.06 | E773: usd | F773: 25 | G773: 121.00 | H773: 1.49 | I773: 3025.00 | J773: 995.00 | K773: 0 | L773: =RC[-3]/100*RC[-1] -> 1.49
A774: 59 | B774: H7005/L | C774: US GI панама с шейной защитой 3-кол.дезерт (R/S) / 7 1/2 ||KA-BON-CR-05 | D774: 4.06 | E774: usd | F774: 50 | G774: 121.00 | H774: 1.49 | I774: 6050.00 | J774: 1990.00 | K774: 0 | L774: =RC[-3]/100*RC[-1] -> 1.49
A775: 60 | B775: H7005/M | C775: US GI панама с шейной защитой 3-кол.дезерт (R/S) / 7 1/4 ||KA-BON-CR-05 | D775: 4.06 | E775: usd | F775: 50 | G775: 121.00 | H775: 1.49 | I775: 6050.00 | J775: 1990.00 | K775: 0 | L775: =RC[-3]/100*RC[-1] -> 1.49
A776: 61 | B776: H7005/XL | C776: US GI панама с шейной защитой 3-кол.дезерт (R/S) / 7 3/4 ||KA-BON-CR-05 | D776: 4.06 | E776: usd | F776: 50 | G776: 121.00 | H776: 1.49 | I776: 6050.00 | J776: 1990.00 | K776: 0 | L776: =RC[-3]/100*RC[-1] -> 1.49
A777: 62 | B777: H7003/L | C777: US GI панама с шейной защитой вудлэнд (R/S) / 7 1/2 ||KA-BON-CR-03 | D777: 4.06 | E777: usd | F777: 50 | G777: 121.00 | H777: 1.49 | I777: 6050.00 | J777: 1990.00 | K777: 0 | L777: =RC[-3]/100*RC[-1] -> 1.49
A778: 63 | B778: H7003/M | C778: US GI панама с шейной защитой вудлэнд (R/S) / 7 1/4 ||KA-BON-CR-03 | D778: 4.06 | E778: usd | F778: 50 | G778: 121.00 | H778: 1.49 | I778: 6050.00 | J778: 1990.00 | K778: 0 | L778: =RC[-3]/100*RC[-1] -> 1.49
A779: 64 | B779: H7003/XL | C779: US GI панама с шейной защитой вудлэнд (R/S) / 7 3/4 ||KA-BON-CR-03 | D779: 4.06 | E779: usd | F779: 50 | G779: 121.00 | H779: 1.49 | I779: 6050.00 | J779: 1990.00 | K779: 0 | L779: =RC[-3]/100*RC[-1] -> 1.49
A780: 65 | B780: H70142/L | C780: US GI панама с шейной защитой мультикам (NYCO) ||7 1/2 ||KA-BON-NT-14 | D780: 4.58 | E780: usd | F780: 32 | G780: 137.00 | H780: 1.50 | I780: 4384.00 | J780: 1452.80 | K780: 0 | L780: =RC[-3]/100*RC[-1] -> 1.50
A781: 66 | B781: H70142/M | C781: US GI панама с шейной защитой мультикам (NYCO) ||7 1/4 ||KA-BON-NT-14 | D781: 4.58 | E781: usd | F781: 50 | G781: 137.00 | H781: 1.50 | I781: 6850.00 | J781: 2270.00 | K781: 0 | L781: =RC[-3]/100*RC[-1] -> 1.50
A782: 67 | B782: H7002/L | C782: US GI панама с шейной защитой олива (R/S) / 7 1/2 ||KA-BON-CR-02 | D782: 4.06 | E782: usd | F782: 50 | G782: 121.00 | H782: 1.49 | I782: 6050.00 | J782: 1990.00 | K782: 0 | L782: =RC[-3]/100*RC[-1] -> 1.49
A783: 68 | B783: H7002/M | C783: US GI панама с шейной защитой олива (R/S) / 7 1/4 ||KA-BON-CR-02 | D783: 4.06 | E783: usd | F783: 7 | G783: 121.00 | H783: 1.49 | I783: 847.00 | J783: 278.60 | K783: 0 | L783: =RC[-3]/100*RC[-1] -> 1.49
A784: 69 | B784: H7002/XL | C784: US GI панама с шейной защитой олива (R/S) / 7 3/4 ||KA-BON-CR-02 | D784: 4.06 | E784: usd | F784: 50 | G784: 121.00 | H784: 1.49 | I784: 6050.00 | J784: 1990.00 | K784: 0 | L784: =RC[-3]/100*RC[-1] -> 1.49
A785: 70 | B785: H7002/S | C785: US GI панама с шейной защитой олива (R/S) / 7 ||KA-BON-CR-02 | D785: 4.06 | E785: usd | F785: 25 | G785: 121.00 | H785: 1.49 | I785: 3025.00 | J785: 995.00 | K785: 0 | L785: =RC[-3]/100*RC[-1] -> 1.49
A786: 71 | B786: H7007/L | C786: US MC панама марпат (NYCO) ||KA-USM-NT-07 | D786: 4.58 | E786: usd | F786: 50 | G786: 137.00 | H786: 1.50 | I786: 6850.00 | J786: 2270.00 | K786: 0 | L786: =RC[-3]/100*RC[-1] -> 1.50
A787: 72 | B787: H7007/M | C787: US MC панама марпат (NYCO) ||KA-USM-NT-07 | D787: 4.58 | E787: usd | F787: 14 | G787: 137.00 | H787: 1.50 | I787: 1918.00 | J787: 635.60 | K787: 0 | L787: =RC[-3]/100*RC[-1] -> 1.50
A788: 73 | B788: H7007/S | C788: US MC панама марпат (NYCO) ||KA-USM-NT-07 | D788: 4.58 | E788: usd | F788: 25 | G788: 137.00 | H788: 1.50 | I788: 3425.00 | J788: 1135.00 | K788: 0 | L788: =RC[-3]/100*RC[-1] -> 1.50
A789: 74 | B789: H43111/XLR | C789: US SFU китель койот (PolyCotton) ||BL-SFU-PR-11 | D789: 15.03 | E789: usd | F789: 10 | G789: 433.00 | H789: 1.44 | I789: 4330.00 | J789: 1324.00 | K789: 0 | L789: =RC[-3]/100*RC[-1] -> 1.44
A790: 75 | B790: H43021/LR | C790: US SFU китель олива (PolyCotton) ||BL-SFU-PR-02 | D790: 15.03 | E790: usd | F790: 40 | G790: 433.00 | H790: 1.44 | I790: 17320.00 | J790: 5296.00 | K790: 0 | L790: =RC[-3]/100*RC[-1] -> 1.44
A791: 76 | B791: H43021/MR | C791: US SFU китель олива (PolyCotton) ||BL-SFU-PR-02 | D791: 15.03 | E791: usd | F791: 40 | G791: 433.00 | H791: 1.44 | I791: 17320.00 | J791: 5296.00 | K791: 0 | L791: =RC[-3]/100*RC[-1] -> 1.44
A792: 77 | B792: H43021/XLR | C792: US SFU китель олива (PolyCotton) ||BL-SFU-PR-02 | D792: 15.03 | E792: usd | F792: 20 | G792: 433.00 | H792: 1.44 | I792: 8660.00 | J792: 2648.00 | K792: 0 | L792: =RC[-3]/100*RC[-1] -> 1.44
A793: 78 | B793: H43041/LR | C793: US SFU китель польский вудлэнд (PolyCotton) ||BL-SFU-PR-04 | D793: 14.49 | E793: usd | F793: 40 | G793: 433.00 | H793: 1.49 | I793: 17320.00 | J793: 5728.00 | K793: 0 | L793: =RC[-3]/100*RC[-1] -> 1.49
A794: 79 | B794: H43041/MR | C794: US SFU китель польский вудлэнд (PolyCotton) ||BL-SFU-PR-04 | D794: 14.49 | E794: usd | F794: 40 | G794: 433.00 | H794: 1.49 | I794: 17320.00 | J794: 5728.00 | K794: 0 | L794: =RC[-3]/100*RC[-1] -> 1.49
A795: 80 | B795: H43041/XLR | C795: US SFU китель польский вудлэнд (PolyCotton) ||BL-SFU-PR-04 | D795: 14.49 | E795: usd | F795: 19 | G795: 433.00 | H795: 1.49 | I795: 8227.00 | J795: 2720.80 | K795: 0 | L795: =RC[-3]/100*RC[-1] -> 1.49
A796: 81 | B796: H43011/LR | C796: US SFU китель чёрный (PolyCotton) ||BL-SFU-PR-01 | D796: 15.03 | E796: usd | F796: 40 | G796: 433.00 | H796: 1.44 | I796: 17320.00 | J796: 5296.00 | K796: 0 | L796: =RC[-3]/100*RC[-1] -> 1.44
A797: 82 | B797: H43011/MR | C797: US SFU китель чёрный (PolyCotton) ||BL-SFU-PR-01 | D797: 15.03 | E797: usd | F797: 40 | G797: 433.00 | H797: 1.44 | I797: 17320.00 | J797: 5296.00 | K797: 0 | L797: =RC[-3]/100*RC[-1] -> 1.44
A798: 83 | B798: H43011/SR | C798: US SFU китель чёрный (PolyCotton) ||BL-SFU-PR-01 | D798: 15.03 | E798: usd | F798: 20 | G798: 433.00 | H798: 1.44 | I798: 8660.00 | J798: 2648.00 | K798: 0 | L798: =RC[-3]/100*RC[-1] -> 1.44
A799: 84 | B799: H43011/XLR | C799: US SFU китель чёрный (PolyCotton) ||BL-SFU-PR-01 | D799: 15.03 | E799: usd | F799: 40 | G799: 433.00 | H799: 1.44 | I799: 17320.00 | J799: 5296.00 | K799: 0 | L799: =RC[-3]/100*RC[-1] -> 1.44
A800: 85 | B800: H43011/XXLR | C800: US SFU китель чёрный (PolyCotton) ||BL-SFU-PR-01 | D800: 15.03 | E800: usd | F800: 20 | G800: 433.00 | H800: 1.44 | I800: 8660.00 | J800: 2648.00 | K800: 0 | L800: =RC[-3]/100*RC[-1] -> 1.44
A801: 86 | B801: H4304/MR | C801: US SFU штаны польский вудлэнд (PolyCotton) ||SP-SFU-PR-04 | D801: 14.49 | E801: usd | F801: 40 | G801: 433.00 | H801: 1.49 | I801: 17320.00 | J801: 5728.00 | K801: 0 | L801: =RC[-3]/100*RC[-1] -> 1.49
A802: 87 | B802: H4304/SR | C802: US SFU штаны польский вудлэнд (PolyCotton) ||SP-SFU-PR-04 | D802: 14.49 | E802: usd | F802: 20 | G802: 433.00 | H802: 1.49 | I802: 8660.00 | J802: 2864.00 | K802: 0 | L802: =RC[-3]/100*RC[-1] -> 1.49
A803: 88 | B803: H4113/LL | C803: US SFU штаны хаки (R/S) ||SP-SFU-CR-13 | D803: 14.49 | E803: usd | F803: 10 | G803: 433.00 | H803: 1.49 | I803: 4330.00 | J803: 1432.00 | K803: 0 | L803: =RC[-3]/100*RC[-1] -> 1.49
A804: 89 | B804: H4113/ML | C804: US SFU штаны хаки (R/S) ||SP-SFU-CR-13 | D804: 14.49 | E804: usd | F804: 10 | G804: 433.00 | H804: 1.49 | I804: 4330.00 | J804: 1432.00 | K804: 0 | L804: =RC[-3]/100*RC[-1] -> 1.49
A805: 90 | B805: H4301/MR | C805: US SFU штаны чёрные (PolyCotton) ||SP-SFU-PR-01 | D805: 15.03 | E805: usd | F805: 40 | G805: 433.00 | H805: 1.44 | I805: 17320.00 | J805: 5296.00 | K805: 0 | L805: =RC[-3]/100*RC[-1] -> 1.44
A806: 91 | B806: H6502/LR | C806: US М65 штаны олива (NYCO) ||SP-M65-NY-02 | D806: 19.44 | E806: usd | F806: 5 | G806: 667.00 | H806: 1.72 | I806: 3335.00 | J806: 1391.00 | K806: 0 | L806: =RC[-3]/100*RC[-1] -> 1.72
A807: 92 | B807: H5001/L | C807: US шорты URBAN TACTICAL чёрные (PolyCotton ) ||SP-UTK-PR-01 | D807: 18.91 | E807: usd | F807: 10 | G807: 551.00 | H807: 1.46 | I807: 5510.00 | J807: 1728.00 | K807: 0 | L807: =RC[-3]/100*RC[-1] -> 1.46
A808: 93 | B808: H5001/M | C808: US шорты URBAN TACTICAL чёрные (PolyCotton ) ||SP-UTK-PR-01 | D808: 18.91 | E808: usd | F808: 10 | G808: 551.00 | H808: 1.46 | I808: 5510.00 | J808: 1728.00 | K808: 0 | L808: =RC[-3]/100*RC[-1] -> 1.46
A809: 94 | B809: H5001/S | C809: US шорты URBAN TACTICAL чёрные (PolyCotton ) ||SP-UTK-PR-01 | D809: 18.91 | E809: usd | F809: 20 | G809: 551.00 | H809: 1.46 | I809: 11020.00 | J809: 3456.00 | K809: 0 | L809: =RC[-3]/100*RC[-1] -> 1.46
A810: 95 | B810: H5001/XL | C810: US шорты URBAN TACTICAL чёрные (PolyCotton ) ||SP-UTK-PR-01 | D810: 18.91 | E810: usd | F810: 20 | G810: 551.00 | H810: 1.46 | I810: 11020.00 | J810: 3456.00 | K810: 0 | L810: =RC[-3]/100*RC[-1] -> 1.46
A811: 96 | B811: H6936/2XL | C811: Безрукавка Alpha Green Lightweight Vest - Climashield ||KK-MMT-NL-36 | D811: 36.14 | E811: usd | F811: 5 | G811: 1081.00 | H811: 1.50 | I811: 5405.00 | J811: 1791.00 | K811: 0 | L811: =RC[-3]/100*RC[-1] -> 1.50
A812: 97 | B812: H6936/L | C812: Безрукавка Alpha Green Lightweight Vest - Climashield ||KK-MMT-NL-36 | D812: 36.14 | E812: usd | F812: 5 | G812: 1081.00 | H812: 1.50 | I812: 5405.00 | J812: 1791.00 | K812: 0 | L812: =RC[-3]/100*RC[-1] -> 1.50
A813: 98 | B813: H6936/M | C813: Безрукавка Alpha Green Lightweight Vest - Climashield ||KK-MMT-NL-36 | D813: 36.14 | E813: usd | F813: 5 | G813: 1081.00 | H813: 1.50 | I813: 5405.00 | J813: 1791.00 | K813: 0 | L813: =RC[-3]/100*RC[-1] -> 1.50
A814: 99 | B814: H6936/S | C814: Безрукавка Alpha Green Lightweight Vest - Climashield ||KK-MMT-NL-36 | D814: 36.14 | E814: usd | F814: 5 | G814: 1081.00 | H814: 1.50 | I814: 5405.00 | J814: 1791.00 | K814: 0 | L814: =RC[-3]/100*RC[-1] -> 1.50
A815: 100 | B815: H6936/XL | C815: Безрукавка Alpha Green Lightweight Vest - Climashield ||KK-MMT-NL-36 | D815: 36.14 | E815: usd | F815: 5 | G815: 1081.00 | H815: 1.50 | I815: 5405.00 | J815: 1791.00 | K815: 0 | L815: =RC[-3]/100*RC[-1] -> 1.50
A816: 101 | B816: H6911/2XL | C816: Безрукавка коет Lightweight Vest - Climashield ||KK-MMT-NL-11 | D816: 36.14 | E816: usd | F816: 5 | G816: 1081.00 | H816: 1.50 | I816: 5405.00 | J816: 1791.00 | K816: 0 | L816: =RC[-3]/100*RC[-1] -> 1.50
A817: 102 | B817: H6911/L | C817: Безрукавка коет Lightweight Vest - Climashield ||KK-MMT-NL-11 | D817: 36.14 | E817: usd | F817: 5 | G817: 1081.00 | H817: 1.50 | I817: 5405.00 | J817: 1791.00 | K817: 0 | L817: =RC[-3]/100*RC[-1] -> 1.50
A818: 103 | B818: H6911/M | C818: Безрукавка коет Lightweight Vest - Climashield ||KK-MMT-NL-11 | D818: 36.14 | E818: usd | F818: 5 | G818: 1081.00 | H818: 1.50 | I818: 5405.00 | J818: 1791.00 | K818: 0 | L818: =RC[-3]/100*RC[-1] -> 1.50
A819: 104 | B819: H6911/S | C819: Безрукавка коет Lightweight Vest - Climashield ||KK-MMT-NL-11 | D819: 36.14 | E819: usd | F819: 5 | G819: 1081.00 | H819: 1.50 | I819: 5405.00 | J819: 1791.00 | K819: 0 | L819: =RC[-3]/100*RC[-1] -> 1.50
A820: 105 | B820: H6911/XL | C820: Безрукавка коет Lightweight Vest - Climashield ||KK-MMT-NL-11 | D820: 36.14 | E820: usd | F820: 5 | G820: 1081.00 | H820: 1.50 | I820: 5405.00 | J820: 1791.00 | K820: 0 | L820: =RC[-3]/100*RC[-1] -> 1.50
A821: 106 | B821: H6901/2XL | C821: Безрукавка черная Lightweight Vest - Climashield ||KK-MMT-NL-01 | D821: 36.14 | E821: usd | F821: 5 | G821: 1081.00 | H821: 1.50 | I821: 5405.00 | J821: 1791.00 | K821: 0 | L821: =RC[-3]/100*RC[-1] -> 1.50
A822: 107 | B822: H6901/L | C822: Безрукавка черная Lightweight Vest - Climashield ||KK-MMT-NL-01 | D822: 36.14 | E822: usd | F822: 5 | G822: 1081.00 | H822: 1.50 | I822: 5405.00 | J822: 1791.00 | K822: 0 | L822: =RC[-3]/100*RC[-1] -> 1.50
A823: 108 | B823: H6901/M | C823: Безрукавка черная Lightweight Vest - Climashield ||KK-MMT-NL-01 | D823: 36.14 | E823: usd | F823: 5 | G823: 1081.00 | H823: 1.50 | I823: 5405.00 | J823: 1791.00 | K823: 0 | L823: =RC[-3]/100*RC[-1] -> 1.50
A824: 109 | B824: H6901/S | C824: Безрукавка черная Lightweight Vest - Climashield ||KK-MMT-NL-01 | D824: 36.14 | E824: usd | F824: 5 | G824: 1081.00 | H824: 1.50 | I824: 5405.00 | J824: 1791.00 | K824: 0 | L824: =RC[-3]/100*RC[-1] -> 1.50
A825: 110 | B825: H6901/XL | C825: Безрукавка черная Lightweight Vest - Climashield ||KK-MMT-NL-01 | D825: 36.14 | E825: usd | F825: 5 | G825: 1081.00 | H825: 1.50 | I825: 5405.00 | J825: 1791.00 | K825: 0 | L825: =RC[-3]/100*RC[-1] -> 1.50
A826: 111 | B826: H7542 | C826: Блайзер PenCott Badlands (NYCO+R/S) ||CZ-BBC-NR-42 | D826: 10.00 | E826: usd | F826: 2 | G826: 276.00 | H826: 1.38 | I826: 552.00 | J826: 152.00 | K826: 0 | L826: =RC[-3]/100*RC[-1] -> 1.38
A827: 112 | B827: H23011/L | C827: Куртка CLASSIC ARMY (флис-кордура) чёрная ||BL-CAF-FM-01 | D827: 37.52 | E827: usd | F827: 34 | G827: 1122.00 | H827: 1.50 | I827: 38148.00 | J827: 12634.40 | K827: 0 | L827: =RC[-3]/100*RC[-1] -> 1.50
A828: 113 | B828: H23011/M | C828: Куртка CLASSIC ARMY (флис-кордура) чёрная ||BL-CAF-FM-01 | D828: 37.52 | E828: usd | F828: 26 | G828: 1122.00 | H828: 1.50 | I828: 29172.00 | J828: 9661.60 | K828: 0 | L828: =RC[-3]/100*RC[-1] -> 1.50
A829: 114 | B829: H23011/XL | C829: Куртка CLASSIC ARMY (флис-кордура) чёрная ||BL-CAF-FM-01 | D829: 37.52 | E829: usd | F829: 4 | G829: 1122.00 | H829: 1.50 | I829: 4488.00 | J829: 1486.40 | K829: 0 | L829: =RC[-3]/100*RC[-1] -> 1.50
A830: 115 | B830: H2302/L | C830: Куртка CLASSIC ARMY флисовая олива ||BL-CAF-FL-02 | D830: 18.29 | E830: usd | F830: 20 | G830: 547.00 | H830: 1.50 | I830: 10940.00 | J830: 3624.00 | K830: 0 | L830: =RC[-3]/100*RC[-1] -> 1.50
A831: 116 | B831: H2301/L | C831: Куртка CLASSIC ARMY флисовая чёрная ||BL-CAF-FL-01 | D831: 18.29 | E831: usd | F831: 40 | G831: 547.00 | H831: 1.50 | I831: 21880.00 | J831: 7248.00 | K831: 0 | L831: =RC[-3]/100*RC[-1] -> 1.50
A832: 117 | B832: H2301/M | C832: Куртка CLASSIC ARMY флисовая чёрная ||BL-CAF-FL-01 | D832: 18.29 | E832: usd | F832: 40 | G832: 547.00 | H832: 1.50 | I832: 21880.00 | J832: 7248.00 | K832: 0 | L832: =RC[-3]/100*RC[-1] -> 1.50
A833: 118 | B833: H2301/XL | C833: Куртка CLASSIC ARMY флисовая чёрная ||BL-CAF-FL-01 | D833: 18.29 | E833: usd | F833: 20 | G833: 547.00 | H833: 1.50 | I833: 10940.00 | J833: 3624.00 | K833: 0 | L833: =RC[-3]/100*RC[-1] -> 1.50
A834: 119 | B834: H2727/2XL | C834: Куртка COMMANDER Jungle Green||BL-CMR-FM-27 | D834: 36.66 | E834: usd | F834: 10 | G834: 1096.00 | H834: 1.49 | I834: 10960.00 | J834: 3628.00 | K834: 0 | L834: =RC[-3]/100*RC[-1] -> 1.49
A835: 120 | B835: H2727/L | C835: Куртка COMMANDER Jungle Green||BL-CMR-FM-27 | D835: 36.66 | E835: usd | F835: 10 | G835: 1096.00 | H835: 1.49 | I835: 10960.00 | J835: 3628.00 | K835: 0 | L835: =RC[-3]/100*RC[-1] -> 1.49
A836: 121 | B836: H2727/M | C836: Куртка COMMANDER Jungle Green||BL-CMR-FM-27 | D836: 36.66 | E836: usd | F836: 10 | G836: 1096.00 | H836: 1.49 | I836: 10960.00 | J836: 3628.00 | K836: 0 | L836: =RC[-3]/100*RC[-1] -> 1.49
A837: 122 | B837: H2727/XL | C837: Куртка COMMANDER Jungle Green||BL-CMR-FM-27 | D837: 36.66 | E837: usd | F837: 10 | G837: 1096.00 | H837: 1.49 | I837: 10960.00 | J837: 3628.00 | K837: 0 | L837: =RC[-3]/100*RC[-1] -> 1.49
A838: 123 | B838: H2227/2XL | C838: Куртка GUNFIGHTER Jungle Green||KU-GUN-FM-27 | D838: 50.89 | E838: usd | F838: 5 | G838: 1522.00 | H838: 1.50 | I838: 7610.00 | J838: 2521.00 | K838: 0 | L838: =RC[-3]/100*RC[-1] -> 1.50
A839: 124 | B839: H2227/L | C839: Куртка GUNFIGHTER Jungle Green||KU-GUN-FM-27 | D839: 50.89 | E839: usd | F839: 5 | G839: 1522.00 | H839: 1.50 | I839: 7610.00 | J839: 2521.00 | K839: 0 | L839: =RC[-3]/100*RC[-1] -> 1.50
A840: 125 | B840: H2227/M | C840: Куртка GUNFIGHTER Jungle Green||KU-GUN-FM-27 | D840: 50.89 | E840: usd | F840: 5 | G840: 1522.00 | H840: 1.50 | I840: 7610.00 | J840: 2521.00 | K840: 0 | L840: =RC[-3]/100*RC[-1] -> 1.50
A841: 126 | B841: H2227/S | C841: Куртка GUNFIGHTER Jungle Green||KU-GUN-FM-27 | D841: 50.89 | E841: usd | F841: 5 | G841: 1522.00 | H841: 1.50 | I841: 7610.00 | J841: 2521.00 | K841: 0 | L841: =RC[-3]/100*RC[-1] -> 1.50
A842: 127 | B842: H2227/XL | C842: Куртка GUNFIGHTER Jungle Green||KU-GUN-FM-27 | D842: 50.89 | E842: usd | F842: 1 | G842: 1522.00 | H842: 1.50 | I842: 1522.00 | J842: 504.20 | K842: 0 | L842: =RC[-3]/100*RC[-1] -> 1.50
A843: 128 | B843: H2233/2XL | C843: Куртка GUNFIGHTER MP Camo||KU-GUN-FM-33 | D843: 55.81 | E843: usd | F843: 5 | G843: 1522.00 | H843: 1.36 | I843: 7610.00 | J843: 2029.00 | K843: 0 | L843: =RC[-3]/100*RC[-1] -> 1.36
A844: 129 | B844: H2233/L | C844: Куртка GUNFIGHTER MP Camo||KU-GUN-FM-33 | D844: 55.81 | E844: usd | F844: 10 | G844: 1522.00 | H844: 1.36 | I844: 15220.00 | J844: 4058.00 | K844: 0 | L844: =RC[-3]/100*RC[-1] -> 1.36
A845: 130 | B845: H2233/M | C845: Куртка GUNFIGHTER MP Camo||KU-GUN-FM-33 | D845: 55.81 | E845: usd | F845: 10 | G845: 1522.00 | H845: 1.36 | I845: 15220.00 | J845: 4058.00 | K845: 0 | L845: =RC[-3]/100*RC[-1] -> 1.36
A846: 131 | B846: H2233/S | C846: Куртка GUNFIGHTER MP Camo||KU-GUN-FM-33 | D846: 55.81 | E846: usd | F846: 5 | G846: 1522.00 | H846: 1.36 | I846: 7610.00 | J846: 2029.00 | K846: 0 | L846: =RC[-3]/100*RC[-1] -> 1.36
A847: 132 | B847: H2233/XL | C847: Куртка GUNFIGHTER MP Camo||KU-GUN-FM-33 | D847: 55.81 | E847: usd | F847: 10 | G847: 1522.00 | H847: 1.36 | I847: 15220.00 | J847: 4058.00 | K847: 0 | L847: =RC[-3]/100*RC[-1] -> 1.36
A848: 133 | B848: H2237/2XL | C848: Куртка GUNFIGHTER Navy Blue||KU-GUN-FM-37 | D848: 50.89 | E848: usd | F848: 5 | G848: 1522.00 | H848: 1.50 | I848: 7610.00 | J848: 2521.00 | K848: 0 | L848: =RC[-3]/100*RC[-1] -> 1.50
A849: 134 | B849: H2237/L | C849: Куртка GUNFIGHTER Navy Blue||KU-GUN-FM-37 | D849: 50.89 | E849: usd | F849: 5 | G849: 1522.00 | H849: 1.50 | I849: 7610.00 | J849: 2521.00 | K849: 0 | L849: =RC[-3]/100*RC[-1] -> 1.50
A850: 135 | B850: H2237/M | C850: Куртка GUNFIGHTER Navy Blue||KU-GUN-FM-37 | D850: 50.89 | E850: usd | F850: 5 | G850: 1522.00 | H850: 1.50 | I850: 7610.00 | J850: 2521.00 | K850: 0 | L850: =RC[-3]/100*RC[-1] -> 1.50
A851: 136 | B851: H2237/S | C851: Куртка GUNFIGHTER Navy Blue||KU-GUN-FM-37 | D851: 50.89 | E851: usd | F851: 5 | G851: 1522.00 | H851: 1.50 | I851: 7610.00 | J851: 2521.00 | K851: 0 | L851: =RC[-3]/100*RC[-1] -> 1.50
A852: 137 | B852: H2237/XL | C852: Куртка GUNFIGHTER Navy Blue||KU-GUN-FM-37 | D852: 50.89 | E852: usd | F852: 5 | G852: 1522.00 | H852: 1.50 | I852: 7610.00 | J852: 2521.00 | K852: 0 | L852: =RC[-3]/100*RC[-1] -> 1.50
A853: 138 | B853: H2211/L | C853: Куртка GUNFIGHTER койот ||KU-GUN-FM-11 | D853: 50.89 | E853: usd | F853: 10 | G853: 1522.00 | H853: 1.50 | I853: 15220.00 | J853: 5042.00 | K853: 0 | L853: =RC[-3]/100*RC[-1] -> 1.50
A854: 139 | B854: H2211/M | C854: Куртка GUNFIGHTER койот ||KU-GUN-FM-11 | D854: 50.89 | E854: usd | F854: 10 | G854: 1522.00 | H854: 1.50 | I854: 15220.00 | J854: 5042.00 | K854: 0 | L854: =RC[-3]/100*RC[-1] -> 1.50
A855: 140 | B855: H2211/XL | C855: Куртка GUNFIGHTER койот ||KU-GUN-FM-11 | D855: 50.89 | E855: usd | F855: 10 | G855: 1522.00 | H855: 1.50 | I855: 15220.00 | J855: 5042.00 | K855: 0 | L855: =RC[-3]/100*RC[-1] -> 1.50
A856: 141 | B856: H2214/2XL | C856: Куртка GUNFIGHTER мультикам ||KU-GUN-FM-14 | D856: 55.81 | E856: usd | F856: 5 | G856: 1522.00 | H856: 1.36 | I856: 7610.00 | J856: 2029.00 | K856: 0 | L856: =RC[-3]/100*RC[-1] -> 1.36
A857: 142 | B857: H2214/L | C857: Куртка GUNFIGHTER мультикам ||KU-GUN-FM-14 | D857: 55.81 | E857: usd | F857: 10 | G857: 1522.00 | H857: 1.36 | I857: 15220.00 | J857: 4058.00 | K857: 0 | L857: =RC[-3]/100*RC[-1] -> 1.36
A858: 143 | B858: H2214/M | C858: Куртка GUNFIGHTER мультикам ||KU-GUN-FM-14 | D858: 55.81 | E858: usd | F858: 10 | G858: 1522.00 | H858: 1.36 | I858: 15220.00 | J858: 4058.00 | K858: 0 | L858: =RC[-3]/100*RC[-1] -> 1.36
A859: 144 | B859: H2214/S | C859: Куртка GUNFIGHTER мультикам ||KU-GUN-FM-14 | D859: 55.81 | E859: usd | F859: 5 | G859: 1522.00 | H859: 1.36 | I859: 7610.00 | J859: 2029.00 | K859: 0 | L859: =RC[-3]/100*RC[-1] -> 1.36
A860: 145 | B860: H2214/XL | C860: Куртка GUNFIGHTER мультикам ||KU-GUN-FM-14 | D860: 55.81 | E860: usd | F860: 10 | G860: 1522.00 | H860: 1.36 | I860: 15220.00 | J860: 4058.00 | K860: 0 | L860: =RC[-3]/100*RC[-1] -> 1.36
A861: 146 | B861: H2201/L | C861: Куртка GUNFIGHTER чёрная ||KU-GUN-FM-01 | D861: 50.89 | E861: usd | F861: 20 | G861: 1522.00 | H861: 1.50 | I861: 30440.00 | J861: 10084.00 | K861: 0 | L861: =RC[-3]/100*RC[-1] -> 1.50
A862: 147 | B862: H2004/2XL | C862: Куртка LIBERTY флисовая польский вудлєнд 390г/м (superfine) ||BL-LIB-HF-04 | D862: 28.04 | E862: usd | F862: 10 | G862: 838.00 | H862: 1.49 | I862: 8380.00 | J862: 2772.00 | K862: 0 | L862: =RC[-3]/100*RC[-1] -> 1.49
A863: 148 | B863: H2004/L | C863: Куртка LIBERTY флисовая польский вудлєнд 390г/м (superfine) ||BL-LIB-HF-04 | D863: 28.04 | E863: usd | F863: 20 | G863: 838.00 | H863: 1.49 | I863: 16760.00 | J863: 5544.00 | K863: 0 | L863: =RC[-3]/100*RC[-1] -> 1.49
A864: 149 | B864: H2004/M | C864: Куртка LIBERTY флисовая польский вудлєнд 390г/м (superfine) ||BL-LIB-HF-04 | D864: 28.04 | E864: usd | F864: 20 | G864: 838.00 | H864: 1.49 | I864: 16760.00 | J864: 5544.00 | K864: 0 | L864: =RC[-3]/100*RC[-1] -> 1.49
A865: 150 | B865: H2004/S | C865: Куртка LIBERTY флисовая польский вудлєнд 390г/м (superfine) ||BL-LIB-HF-04 | D865: 28.04 | E865: usd | F865: 10 | G865: 838.00 | H865: 1.49 | I865: 8380.00 | J865: 2772.00 | K865: 0 | L865: =RC[-3]/100*RC[-1] -> 1.49
A866: 151 | B866: H2004/XL | C866: Куртка LIBERTY флисовая польский вудлєнд 390г/м (superfine) ||BL-LIB-HF-04 | D866: 28.04 | E866: usd | F866: 20 | G866: 838.00 | H866: 1.49 | I866: 16760.00 | J866: 5544.00 | K866: 0 | L866: =RC[-3]/100*RC[-1] -> 1.49
A867: 152 | B867: H2016/XL | C867: Куртка LIBERTY флисовая чорн/олива 390г/м (superfine) ||BL-LIB-HF-16 | D867: 28.04 | E867: usd | F867: 20 | G867: 838.00 | H867: 1.49 | I867: 16760.00 | J867: 5546.00 | K867: 0 | L867: =RC[-3]/100*RC[-1] -> 1.49
A868: 153 | B868: H26041/2XL | C868: Куртка PATRIOT флисовая польский вудлэнд 390г/м (superfine) ||BL-PAT-HF-04 | D868: 27.00 | E868: usd | F868: 10 | G868: 840.00 | H868: 1.56 | I868: 8400.00 | J868: 3000.00 | K868: 0 | L868: =RC[-3]/100*RC[-1] -> 1.56
A869: 154 | B869: H26041/L | C869: Куртка PATRIOT флисовая польский вудлэнд 390г/м (superfine) ||BL-PAT-HF-04 | D869: 27.00 | E869: usd | F869: 20 | G869: 840.00 | H869: 1.56 | I869: 16800.00 | J869: 6000.00 | K869: 0 | L869: =RC[-3]/100*RC[-1] -> 1.56
A870: 155 | B870: H26041/M | C870: Куртка PATRIOT флисовая польский вудлэнд 390г/м (superfine) ||BL-PAT-HF-04 | D870: 27.00 | E870: usd | F870: 20 | G870: 840.00 | H870: 1.56 | I870: 16800.00 | J870: 6000.00 | K870: 0 | L870: =RC[-3]/100*RC[-1] -> 1.56
A871: 156 | B871: H26041/S | C871: Куртка PATRIOT флисовая польский вудлэнд 390г/м (superfine) ||BL-PAT-HF-04 | D871: 27.00 | E871: usd | F871: 10 | G871: 840.00 | H871: 1.56 | I871: 8400.00 | J871: 3000.00 | K871: 0 | L871: =RC[-3]/100*RC[-1] -> 1.56
A872: 157 | B872: H26041/XL | C872: Куртка PATRIOT флисовая польский вудлэнд 390г/м (superfine) ||BL-PAT-HF-04 | D872: 27.00 | E872: usd | F872: 20 | G872: 840.00 | H872: 1.56 | I872: 16800.00 | J872: 6000.00 | K872: 0 | L872: =RC[-3]/100*RC[-1] -> 1.56
A873: 158 | B873: H38041/2XL | C873: Куртка SOFT SHELL TROOPER пол.вудлэнд ||KU-TRP-NL-04 | D873: 40.47 | E873: usd | F873: 10 | G873: 1200.00 | H873: 1.48 | I873: 12000.00 | J873: 3906.00 | K873: 0 | L873: =RC[-3]/100*RC[-1] -> 1.48
A874: 159 | B874: H38041/S | C874: Куртка SOFT SHELL TROOPER пол.вудлэнд ||KU-TRP-NL-04 | D874: 40.47 | E874: usd | F874: 5 | G874: 1200.00 | H874: 1.48 | I874: 6000.00 | J874: 1953.00 | K874: 0 | L874: =RC[-3]/100*RC[-1] -> 1.48
A875: 160 | B875: H55141/M | C875: Куртка SOLDIER-2008 мультикам (PolyCotton) ||KU-FP8-PR-14 | D875: 45.71 | E875: usd | F875: 10 | G875: 1367.00 | H875: 1.50 | I875: 13670.00 | J875: 4528.00 | K875: 0 | L875: =RC[-3]/100*RC[-1] -> 1.50
A876: 161 | B876: H1901/L | C876: Куртка URBAN TACTICAL LINE DELTA чёрная ||BL-DLT-FS-01 | D876: 33.19 | E876: usd | F876: 10 | G876: 993.00 | H876: 1.50 | I876: 9930.00 | J876: 3292.00 | K876: 0 | L876: =RC[-3]/100*RC[-1] -> 1.50
A877: 162 | B877: H1901/M | C877: Куртка URBAN TACTICAL LINE DELTA чёрная ||BL-DLT-FS-01 | D877: 33.19 | E877: usd | F877: 5 | G877: 993.00 | H877: 1.50 | I877: 4965.00 | J877: 1646.00 | K877: 0 | L877: =RC[-3]/100*RC[-1] -> 1.50
A878: 163 | B878: H1901/XL | C878: Куртка URBAN TACTICAL LINE DELTA чёрная ||BL-DLT-FS-01 | D878: 33.19 | E878: usd | F878: 10 | G878: 993.00 | H878: 1.50 | I878: 9930.00 | J878: 3292.00 | K878: 0 | L878: =RC[-3]/100*RC[-1] -> 1.50
A879: 164 | B879: H65011/L | C879: Куртка М65 с отстегивающейся курткой чёрная (NYCO) ||KU-M65-NY-01 | D879: 38.39 | E879: usd | F879: 10 | G879: 1148.00 | H879: 1.50 | I879: 11480.00 | J879: 3802.00 | K879: 0 | L879: =RC[-3]/100*RC[-1] -> 1.50
A880: 165 | B880: H65011/XL | C880: Куртка М65 с отстегивающейся курткой чёрная (NYCO) ||KU-M65-NY-01 | D880: 38.39 | E880: usd | F880: 10 | G880: 1148.00 | H880: 1.50 | I880: 11480.00 | J880: 3802.00 | K880: 0 | L880: =RC[-3]/100*RC[-1] -> 1.50
A881: 166 | B881: 52913-14 | C881: Наколінники AltaCOUNTOUR Flexible койот [ALTA] ||OK-ACL-CD-11 | D881: 22.41 | E881: usd | F881: 8 | G881: 670.00 | H881: 1.49 | I881: 5360.00 | J881: 1774.40 | K881: 0 | L881: =RC[-3]/100*RC[-1] -> 1.49
A882: 167 | B882: 50413-08 | C882: Наколінники AltaFLEX Long Cap вудлэнд [ALTA] ||OK-AFL-CD-03 | D882: 17.01 | E882: usd | F882: 20 | G882: 509.00 | H882: 1.50 | I882: 10180.00 | J882: 3376.00 | K882: 0 | L882: =RC[-3]/100*RC[-1] -> 1.50
A883: 168 | B883: 50413-14 | C883: Наколінники AltaFLEX Long Cap койот [ALTA] ||OK-AFL-CD-11 | D883: 17.01 | E883: usd | F883: 20 | G883: 509.00 | H883: 1.50 | I883: 10180.00 | J883: 3376.00 | K883: 0 | L883: =RC[-3]/100*RC[-1] -> 1.50
A884: 169 | B884: 50413-16 | C884: Наколінники AltaFLEX Long Cap мультикам [ALTA] ||OK-AFL-CD-34 | D884: 17.55 | E884: usd | F884: 20 | G884: 525.00 | H884: 1.50 | I884: 10500.00 | J884: 3480.00 | K884: 0 | L884: =RC[-3]/100*RC[-1] -> 1.50
A885: 170 | B885: 50413-09 | C885: Наколінники AltaFLEX Long Cap олива [ALTA] ||OK-AFL-CD-02 | D885: 17.01 | E885: usd | F885: 20 | G885: 509.00 | H885: 1.50 | I885: 10180.00 | J885: 3376.00 | K885: 0 | L885: =RC[-3]/100*RC[-1] -> 1.50
A886: 171 | B886: 50413-00 | C886: Наколінники AltaFLEX Long Cap чёрные [ALTA] ||OK-AFL-CD-01 | D886: 16.11 | E886: usd | F886: 10 | G886: 482.00 | H886: 1.50 | I886: 4820.00 | J886: 1598.00 | K886: 0 | L886: =RC[-3]/100*RC[-1] -> 1.50
A887: 172 | B887: 50703-14 | C887: Наколінники AltaSOFT Flexline койот [ALTA] ||OK-ASL-CD-11 | D887: 13.95 | E887: usd | F887: 13 | G887: 417.00 | H887: 1.49 | I887: 5421.00 | J887: 1794.00 | K887: 0 | L887: =RC[-3]/100*RC[-1] -> 1.49
A888: 173 | B888: 53112-00 | C888: Налокотники AltaCONTOUR чёрные [ALTA] ||OL-ACV-CD-01 | D888: 20.25 | E888: usd | F888: 20 | G888: 605.00 | H888: 1.49 | I888: 12100.00 | J888: 4000.00 | K888: 0 | L888: =RC[-3]/100*RC[-1] -> 1.49
A889: 174 | B889: H7733/L | C889: Панама British Army Style MP Camo(PolyCotton) 7 1/2 ||KA-S95-PT-33 | D889: 4.14 | E889: usd | F889: 50 | G889: 124.00 | H889: 1.50 | I889: 6200.00 | J889: 2060.00 | K889: 0 | L889: =RC[-3]/100*RC[-1] -> 1.50
A890: 175 | B890: H7733/M | C890: Панама British Army Style MP Camo(PolyCotton) 7 1/4 ||KA-S95-PT-33 | D890: 4.14 | E890: usd | F890: 50 | G890: 124.00 | H890: 1.50 | I890: 6200.00 | J890: 2060.00 | K890: 0 | L890: =RC[-3]/100*RC[-1] -> 1.50
A891: 176 | B891: H7733/XL | C891: Панама British Army Style MP Camo(PolyCotton) 7 3/4 ||KA-S95-PT-33 | D891: 4.14 | E891: usd | F891: 25 | G891: 124.00 | H891: 1.50 | I891: 3100.00 | J891: 1030.00 | K891: 0 | L891: =RC[-3]/100*RC[-1] -> 1.50
A892: 177 | B892: H7733/S | C892: Панама British Army Style MP Camo(PolyCotton) 7 ||KA-S95-PT-33 | D892: 4.14 | E892: usd | F892: 25 | G892: 124.00 | H892: 1.50 | I892: 3100.00 | J892: 1030.00 | K892: 0 | L892: =RC[-3]/100*RC[-1] -> 1.50
A893: 178 | B893: H7713/L | C893: Панама British Army Style бежевая (NYCO R/S) 7 1/2 ||KA-S95-CR-13 | D893: 4.14 | E893: usd | F893: 50 | G893: 124.00 | H893: 1.50 | I893: 6200.00 | J893: 2060.00 | K893: 0 | L893: =RC[-3]/100*RC[-1] -> 1.50
A894: 179 | B894: H7713/M | C894: Панама British Army Style бежевая (NYCO R/S) 7 1/4 ||KA-S95-CR-13 | D894: 4.14 | E894: usd | F894: 50 | G894: 124.00 | H894: 1.50 | I894: 6200.00 | J894: 2060.00 | K894: 0 | L894: =RC[-3]/100*RC[-1] -> 1.50
A895: 180 | B895: H7713/XL | C895: Панама British Army Style бежевая (NYCO R/S) 7 3/4 ||KA-S95-CR-13 | D895: 4.14 | E895: usd | F895: 50 | G895: 124.00 | H895: 1.50 | I895: 6200.00 | J895: 2060.00 | K895: 0 | L895: =RC[-3]/100*RC[-1] -> 1.50
A896: 181 | B896: H7714/M | C896: Панама British Army Style мультикам (NYCO) 7 1/4 ||KA-S95-NT-14 | D896: 4.14 | E896: usd | F896: 25 | G896: 124.00 | H896: 1.50 | I896: 3100.00 | J896: 1030.00 | K896: 0 | L896: =RC[-3]/100*RC[-1] -> 1.50
A897: 182 | B897: H7723/L | C897: Панама British Army Style флектарн (NYCO R/S) 7 1/2 ||KA-S95-NR-23 | D897: 4.14 | E897: usd | F897: 50 | G897: 124.00 | H897: 1.50 | I897: 6200.00 | J897: 2060.00 | K897: 0 | L897: =RC[-3]/100*RC[-1] -> 1.50
A898: 183 | B898: H155021 | C898: Пилка туристическая с кільцями ||PD-PD1-SS-15 | D898: 1.90 | E898: usd | F898: 100 | G898: 63.00 | H898: 1.66 | I898: 6300.00 | J898: 2500.00 | K898: 0 | L898: =RC[-3]/100*RC[-1] -> 1.66
A899: 184 | B899: H9002/120 | C899: Ремень ARMY BELT олива ||PS-ARM-CO-02 | D899: 4.23 | E899: usd | F899: 100 | G899: 126.00 | H899: 1.49 | I899: 12600.00 | J899: 4140.00 | K899: 0 | L899: =RC[-3]/100*RC[-1] -> 1.49
A900: 185 | B900: H9002/130 | C900: Ремень ARMY BELT олива ||PS-ARM-CO-02 | D900: 4.23 | E900: usd | F900: 100 | G900: 126.00 | H900: 1.49 | I900: 12600.00 | J900: 4140.00 | K900: 0 | L900: =RC[-3]/100*RC[-1] -> 1.49
A901: 186 | B901: H9002/140 | C901: Ремень ARMY BELT олива ||PS-ARM-CO-02 | D901: 4.23 | E901: usd | F901: 50 | G901: 126.00 | H901: 1.49 | I901: 6300.00 | J901: 2070.00 | K901: 0 | L901: =RC[-3]/100*RC[-1] -> 1.49
A902: 187 | B902: H9001/120 | C902: Ремень ARMY BELT чёрный ||PS-ARM-CO-01 | D902: 4.23 | E902: usd | F902: 100 | G902: 126.00 | H902: 1.49 | I902: 12600.00 | J902: 4140.00 | K902: 0 | L902: =RC[-3]/100*RC[-1] -> 1.49
A903: 188 | B903: H9001/130 | C903: Ремень ARMY BELT чёрный ||PS-ARM-CO-01 | D903: 4.23 | E903: usd | F903: 100 | G903: 126.00 | H903: 1.49 | I903: 12600.00 | J903: 4140.00 | K903: 0 | L903: =RC[-3]/100*RC[-1] -> 1.49
A904: 189 | B904: H9001/140 | C904: Ремень ARMY BELT чёрный ||PS-ARM-CO-01 | D904: 4.23 | E904: usd | F904: 50 | G904: 126.00 | H904: 1.49 | I904: 6300.00 | J904: 2070.00 | K904: 0 | L904: =RC[-3]/100*RC[-1] -> 1.49
A905: 190 | B905: H8013/120 | C905: Ремень HKN койот ||PS-HKN-CO-13 | D905: 3.30 | E905: usd | F905: 100 | G905: 128.00 | H905: 1.94 | I905: 12800.00 | J905: 6200.00 | K905: 0 | L905: =RC[-3]/100*RC[-1] -> 1.94
A906: 191 | B906: H8013/130 | C906: Ремень HKN койот ||PS-HKN-CO-13 | D906: 3.30 | E906: usd | F906: 100 | G906: 128.00 | H906: 1.94 | I906: 12800.00 | J906: 6200.00 | K906: 0 | L906: =RC[-3]/100*RC[-1] -> 1.94
A907: 192 | B907: H8002/120 | C907: Ремень HKN олива ||PS-HKN-CO-02 | D907: 3.30 | E907: usd | F907: 100 | G907: 128.00 | H907: 1.94 | I907: 12800.00 | J907: 6200.00 | K907: 0 | L907: =RC[-3]/100*RC[-1] -> 1.94
A908: 193 | B908: H8002/130 | C908: Ремень HKN олива ||PS-HKN-CO-02 | D908: 3.30 | E908: usd | F908: 100 | G908: 128.00 | H908: 1.94 | I908: 12800.00 | J908: 6200.00 | K908: 0 | L908: =RC[-3]/100*RC[-1] -> 1.94
A909: 194 | B909: H8001/120 | C909: Ремень HKN чёрный ||PS-HKN-CO-01 | D909: 3.30 | E909: usd | F909: 100 | G909: 128.00 | H909: 1.94 | I909: 12800.00 | J909: 6200.00 | K909: 0 | L909: =RC[-3]/100*RC[-1] -> 1.94
A910: 195 | B910: H8001/130 | C910: Ремень HKN чёрный ||PS-HKN-CO-01 | D910: 3.30 | E910: usd | F910: 100 | G910: 128.00 | H910: 1.94 | I910: 12800.00 | J910: 6200.00 | K910: 0 | L910: =RC[-3]/100*RC[-1] -> 1.94
A911: 196 | B911: H8602/120 | C911: Ремень TOUGH NAVY SEAL олива ||PS-NAV-CO-01 | D911: 4.23 | E911: usd | F911: 100 | G911: 126.00 | H911: 1.49 | I911: 12600.00 | J911: 4140.00 | K911: 0 | L911: =RC[-3]/100*RC[-1] -> 1.49
A912: 197 | B912: H8602/130 | C912: Ремень TOUGH NAVY SEAL олива ||PS-NAV-CO-01 | D912: 4.23 | E912: usd | F912: 100 | G912: 126.00 | H912: 1.49 | I912: 12600.00 | J912: 4140.00 | K912: 0 | L912: =RC[-3]/100*RC[-1] -> 1.49
A913: 198 | B913: H8602/140 | C913: Ремень TOUGH NAVY SEAL олива ||PS-NAV-CO-01 | D913: 4.23 | E913: usd | F913: 100 | G913: 126.00 | H913: 1.49 | I913: 12600.00 | J913: 4140.00 | K913: 0 | L913: =RC[-3]/100*RC[-1] -> 1.49
A914: 199 | B914: H8613/120 | C914: Ремень TOUGH NAVY SEAL хаки ||PS-NAV-CO-13 | D914: 4.23 | E914: usd | F914: 100 | G914: 126.00 | H914: 1.49 | I914: 12600.00 | J914: 4140.00 | K914: 0 | L914: =RC[-3]/100*RC[-1] -> 1.49
A915: 200 | B915: H8613/130 | C915: Ремень TOUGH NAVY SEAL хаки ||PS-NAV-CO-13 | D915: 4.23 | E915: usd | F915: 100 | G915: 126.00 | H915: 1.49 | I915: 12600.00 | J915: 4140.00 | K915: 0 | L915: =RC[-3]/100*RC[-1] -> 1.49
A916: 201 | B916: H8613/140 | C916: Ремень TOUGH NAVY SEAL хаки ||PS-NAV-CO-13 | D916: 4.23 | E916: usd | F916: 100 | G916: 126.00 | H916: 1.49 | I916: 12600.00 | J916: 4140.00 | K916: 0 | L916: =RC[-3]/100*RC[-1] -> 1.49
A917: 202 | B917: H8601/120 | C917: Ремень TOUGH NAVY SEAL чёрный ||PS-NAV-CO-02 | D917: 4.23 | E917: usd | F917: 100 | G917: 126.00 | H917: 1.49 | I917: 12600.00 | J917: 4140.00 | K917: 0 | L917: =RC[-3]/100*RC[-1] -> 1.49
A918: 203 | B918: H8601/130 | C918: Ремень TOUGH NAVY SEAL чёрный ||PS-NAV-CO-02 | D918: 4.23 | E918: usd | F918: 100 | G918: 126.00 | H918: 1.49 | I918: 12600.00 | J918: 4140.00 | K918: 0 | L918: =RC[-3]/100*RC[-1] -> 1.49
A919: 204 | B919: H8601/140 | C919: Ремень TOUGH NAVY SEAL чёрный ||PS-NAV-CO-02 | D919: 4.23 | E919: usd | F919: 100 | G919: 126.00 | H919: 1.49 | I919: 12600.00 | J919: 4140.00 | K919: 0 | L919: =RC[-3]/100*RC[-1] -> 1.49
A920: 205 | B920: H8913/120 | C920: Ремень TOUGH US MARINES койот ||PS-USM-CO-13 | D920: 3.68 | E920: usd | F920: 100 | G920: 126.00 | H920: 1.71 | I920: 12600.00 | J920: 5240.00 | K920: 0 | L920: =RC[-3]/100*RC[-1] -> 1.71
A921: 206 | B921: H8913/130 | C921: Ремень TOUGH US MARINES койот ||PS-USM-CO-13 | D921: 3.68 | E921: usd | F921: 100 | G921: 126.00 | H921: 1.71 | I921: 12600.00 | J921: 5240.00 | K921: 0 | L921: =RC[-3]/100*RC[-1] -> 1.71
A922: 207 | B922: H8913/140 | C922: Ремень TOUGH US MARINES койот ||PS-USM-CO-13 | D922: 3.68 | E922: usd | F922: 99 | G922: 126.00 | H922: 1.71 | I922: 12474.00 | J922: 5187.60 | K922: 0 | L922: =RC[-3]/100*RC[-1] -> 1.71
A923: 208 | B923: H8902/120 | C923: Ремень TOUGH US MARINES олива ||PS-USM-CO-02 | D923: 3.68 | E923: usd | F923: 100 | G923: 126.00 | H923: 1.71 | I923: 12600.00 | J923: 5240.00 | K923: 0 | L923: =RC[-3]/100*RC[-1] -> 1.71
A924: 209 | B924: H8902/130 | C924: Ремень TOUGH US MARINES олива ||PS-USM-CO-02 | D924: 3.68 | E924: usd | F924: 99 | G924: 126.00 | H924: 1.71 | I924: 12474.00 | J924: 5187.60 | K924: 0 | L924: =RC[-3]/100*RC[-1] -> 1.71
A925: 210 | B925: H8902/140 | C925: Ремень TOUGH US MARINES олива ||PS-USM-CO-02 | D925: 3.68 | E925: usd | F925: 100 | G925: 126.00 | H925: 1.71 | I925: 12600.00 | J925: 5240.00 | K925: 0 | L925: =RC[-3]/100*RC[-1] -> 1.71
A926: 211 | B926: H8901/120 | C926: Ремень TOUGH US MARINES чёрный ||PS-USM-CO-01 | D926: 3.68 | E926: usd | F926: 100 | G926: 126.00 | H926: 1.71 | I926: 12600.00 | J926: 5240.00 | K926: 0 | L926: =RC[-3]/100*RC[-1] -> 1.71
A927: 212 | B927: H8901/130 | C927: Ремень TOUGH US MARINES чёрный ||PS-USM-CO-01 | D927: 3.68 | E927: usd | F927: 100 | G927: 126.00 | H927: 1.71 | I927: 12600.00 | J927: 5240.00 | K927: 0 | L927: =RC[-3]/100*RC[-1] -> 1.71
A928: 213 | B928: H8901/140 | C928: Ремень TOUGH US MARINES чёрный ||PS-USM-CO-01 | D928: 3.68 | E928: usd | F928: 100 | G928: 126.00 | H928: 1.71 | I928: 12600.00 | J928: 5240.00 | K928: 0 | L928: =RC[-3]/100*RC[-1] -> 1.71
A929: 214 | B929: H30130/2XL | C929: Рубашка DEFENDER короткий рукав бежевая||KO-DES-CO-13 | D929: 17.71 | E929: usd | F929: 3 | G929: 591.00 | H929: 1.67 | I929: 1773.00 | J929: 710.40 | K929: 0 | L929: =RC[-3]/100*RC[-1] -> 1.67
A930: 215 | B930: H30130/L | C930: Рубашка DEFENDER короткий рукав бежевая||KO-DES-CO-13 | D930: 17.71 | E930: usd | F930: 10 | G930: 591.00 | H930: 1.67 | I930: 5910.00 | J930: 2368.00 | K930: 0 | L930: =RC[-3]/100*RC[-1] -> 1.67
A931: 216 | B931: H30130/M | C931: Рубашка DEFENDER короткий рукав бежевая||KO-DES-CO-13 | D931: 17.71 | E931: usd | F931: 10 | G931: 591.00 | H931: 1.67 | I931: 5910.00 | J931: 2368.00 | K931: 0 | L931: =RC[-3]/100*RC[-1] -> 1.67
A932: 217 | B932: H30130/S | C932: Рубашка DEFENDER короткий рукав бежевая||KO-DES-CO-13 | D932: 17.71 | E932: usd | F932: 10 | G932: 591.00 | H932: 1.67 | I932: 5910.00 | J932: 2368.00 | K932: 0 | L932: =RC[-3]/100*RC[-1] -> 1.67
A933: 218 | B933: H30130/XL | C933: Рубашка DEFENDER короткий рукав бежевая||KO-DES-CO-13 | D933: 17.71 | E933: usd | F933: 10 | G933: 591.00 | H933: 1.67 | I933: 5910.00 | J933: 2368.00 | K933: 0 | L933: =RC[-3]/100*RC[-1] -> 1.67
A934: 219 | B934: H30110/2XL | C934: Рубашка DEFENDER короткий рукав коет||KO-DES-CO-11 | D934: 17.71 | E934: usd | F934: 4 | G934: 591.00 | H934: 1.67 | I934: 2364.00 | J934: 947.20 | K934: 0 | L934: =RC[-3]/100*RC[-1] -> 1.67
A935: 220 | B935: H30110/L | C935: Рубашка DEFENDER короткий рукав коет||KO-DES-CO-11 | D935: 17.71 | E935: usd | F935: 10 | G935: 591.00 | H935: 1.67 | I935: 5910.00 | J935: 2368.00 | K935: 0 | L935: =RC[-3]/100*RC[-1] -> 1.67
A936: 221 | B936: H30110/M | C936: Рубашка DEFENDER короткий рукав коет||KO-DES-CO-11 | D936: 17.71 | E936: usd | F936: 10 | G936: 591.00 | H936: 1.67 | I936: 5910.00 | J936: 2368.00 | K936: 0 | L936: =RC[-3]/100*RC[-1] -> 1.67
A937: 222 | B937: H30110/S | C937: Рубашка DEFENDER короткий рукав коет||KO-DES-CO-11 | D937: 17.71 | E937: usd | F937: 10 | G937: 591.00 | H937: 1.67 | I937: 5910.00 | J937: 2368.00 | K937: 0 | L937: =RC[-3]/100*RC[-1] -> 1.67
A938: 223 | B938: H30110/XL | C938: Рубашка DEFENDER короткий рукав коет||KO-DES-CO-11 | D938: 17.71 | E938: usd | F938: 10 | G938: 591.00 | H938: 1.67 | I938: 5910.00 | J938: 2368.00 | K938: 0 | L938: =RC[-3]/100*RC[-1] -> 1.67
A939: 224 | B939: H30020/2XL | C939: Рубашка DEFENDER короткий рукав олива||KO-DES-CO-02 | D939: 17.71 | E939: usd | F939: 10 | G939: 591.00 | H939: 1.67 | I939: 5910.00 | J939: 2368.00 | K939: 0 | L939: =RC[-3]/100*RC[-1] -> 1.67
A940: 225 | B940: H30020/L | C940: Рубашка DEFENDER короткий рукав олива||KO-DES-CO-02 | D940: 17.71 | E940: usd | F940: 10 | G940: 591.00 | H940: 1.67 | I940: 5910.00 | J940: 2368.00 | K940: 0 | L940: =RC[-3]/100*RC[-1] -> 1.67
A941: 226 | B941: H30020/M | C941: Рубашка DEFENDER короткий рукав олива||KO-DES-CO-02 | D941: 17.71 | E941: usd | F941: 10 | G941: 591.00 | H941: 1.67 | I941: 5910.00 | J941: 2368.00 | K941: 0 | L941: =RC[-3]/100*RC[-1] -> 1.67
A942: 227 | B942: H30020/S | C942: Рубашка DEFENDER короткий рукав олива||KO-DES-CO-02 | D942: 17.71 | E942: usd | F942: 10 | G942: 591.00 | H942: 1.67 | I942: 5910.00 | J942: 2368.00 | K942: 0 | L942: =RC[-3]/100*RC[-1] -> 1.67
A943: 228 | B943: H30020/XL | C943: Рубашка DEFENDER короткий рукав олива||KO-DES-CO-02 | D943: 17.71 | E943: usd | F943: 10 | G943: 591.00 | H943: 1.67 | I943: 5910.00 | J943: 2368.00 | K943: 0 | L943: =RC[-3]/100*RC[-1] -> 1.67
A944: 229 | B944: H30010/2XL | C944: Рубашка DEFENDER короткий рукав черная||KO-DES-CO-01 | D944: 17.71 | E944: usd | F944: 7 | G944: 591.00 | H944: 1.67 | I944: 4137.00 | J944: 1657.60 | K944: 0 | L944: =RC[-3]/100*RC[-1] -> 1.67
A945: 230 | B945: H30010/L | C945: Рубашка DEFENDER короткий рукав черная||KO-DES-CO-01 | D945: 17.71 | E945: usd | F945: 10 | G945: 591.00 | H945: 1.67 | I945: 5910.00 | J945: 2368.00 | K945: 0 | L945: =RC[-3]/100*RC[-1] -> 1.67
A946: 231 | B946: H30010/M | C946: Рубашка DEFENDER короткий рукав черная||KO-DES-CO-01 | D946: 17.71 | E946: usd | F946: 10 | G946: 591.00 | H946: 1.67 | I946: 5910.00 | J946: 2368.00 | K946: 0 | L946: =RC[-3]/100*RC[-1] -> 1.67
A947: 232 | B947: H30010/S | C947: Рубашка DEFENDER короткий рукав черная||KO-DES-CO-01 | D947: 17.71 | E947: usd | F947: 10 | G947: 591.00 | H947: 1.67 | I947: 5910.00 | J947: 2368.00 | K947: 0 | L947: =RC[-3]/100*RC[-1] -> 1.67
A948: 233 | B948: H30010/XL | C948: Рубашка DEFENDER короткий рукав черная||KO-DES-CO-01 | D948: 17.71 | E948: usd | F948: 10 | G948: 591.00 | H948: 1.67 | I948: 5910.00 | J948: 2368.00 | K948: 0 | L948: =RC[-3]/100*RC[-1] -> 1.67
A949: 234 | B949: H9733 | C949: Рюкзак RACCOON 20л MP Camo ||PL-RCN-PO-33 | D949: 29.93 | E949: usd | F949: 10 | G949: 894.00 | H949: 1.49 | I949: 8940.00 | J949: 2954.00 | K949: 0 | L949: =RC[-3]/100*RC[-1] -> 1.49
A950: 235 | B950: H9704 | C950: Рюкзак RACCOON 20л PL Woodland ||PL-RCN-PO-04 | D950: 23.00 | E950: usd | F950: 10 | G950: 687.00 | H950: 1.49 | I950: 6870.00 | J950: 2270.00 | K950: 0 | L950: =RC[-3]/100*RC[-1] -> 1.49
A951: 236 | B951: H9711 | C951: Рюкзак RACCOON 20л койот ||PL-RCN-PO-11 | D951: 23.00 | E951: usd | F951: 10 | G951: 687.00 | H951: 1.49 | I951: 6870.00 | J951: 2270.00 | K951: 0 | L951: =RC[-3]/100*RC[-1] -> 1.49
A952: 237 | B952: H9714 | C952: Рюкзак RACCOON 20л мультикам ||PL-RCN-PO-14 | D952: 29.93 | E952: usd | F952: 10 | G952: 894.00 | H952: 1.49 | I952: 8940.00 | J952: 2954.00 | K952: 0 | L952: =RC[-3]/100*RC[-1] -> 1.49
A953: 238 | B953: H9702 | C953: Рюкзак RACCOON 20л олива ||PL-RCN-PO-02 | D953: 23.00 | E953: usd | F953: 10 | G953: 687.00 | H953: 1.49 | I953: 6870.00 | J953: 2270.00 | K953: 0 | L953: =RC[-3]/100*RC[-1] -> 1.49
A954: 239 | B954: H97401 | C954: Рюкзак RATEL 25л Cordura A-TACS® AU ||PL-RTL-CD-40 | D954: 39.27 | E954: usd | F954: 5 | G954: 1149.00 | H954: 1.46 | I954: 5745.00 | J954: 1818.00 | K954: 0 | L954: =RC[-3]/100*RC[-1] -> 1.46
A955: 240 | B955: H97111 | C955: Рюкзак RATEL 25л койот ||PL-RTL-PO-11 | D955: 28.65 | E955: usd | F955: 4 | G955: 764.00 | H955: 1.33 | I955: 3056.00 | J955: 764.00 | K955: 0 | L955: =RC[-3]/100*RC[-1] -> 1.33
A956: 241 | B956: H97021 | C956: Рюкзак RATEL 25л олива ||PL-RTL-PO-02 | D956: 28.65 | E956: usd | F956: 10 | G956: 764.00 | H956: 1.33 | I956: 7640.00 | J956: 1910.00 | K956: 0 | L956: =RC[-3]/100*RC[-1] -> 1.33
A957: 242 | B957: H0202 | C957: Сумка на ремне 38x29x19cm олива ||TB-WBT-PO-02 | D957: 20.24 | E957: usd | F957: 10 | G957: 582.00 | H957: 1.44 | I957: 5820.00 | J957: 1772.00 | K957: 0 | L957: =RC[-3]/100*RC[-1] -> 1.44
A958: 243 | B958: H3421/2XL | C958: Футболка Foliage Green ||TS-TSH-CO-21 | D958: 4.06 | E958: usd | F958: 100 | G958: 121.00 | H958: 1.49 | I958: 12100.00 | J958: 3985.00 | K958: 0 | L958: =RC[-3]/100*RC[-1] -> 1.49
A959: 244 | B959: H3421/3XL | C959: Футболка Foliage Green ||TS-TSH-CO-21 | D959: 4.06 | E959: usd | F959: 44 | G959: 121.00 | H959: 1.49 | I959: 5324.00 | J959: 1753.40 | K959: 0 | L959: =RC[-3]/100*RC[-1] -> 1.49
A960: 245 | B960: H3413/2XL | C960: Футболка хаки ||TS-TSH-CO-13 | D960: 4.06 | E960: usd | F960: 100 | G960: 121.00 | H960: 1.49 | I960: 12100.00 | J960: 3985.00 | K960: 0 | L960: =RC[-3]/100*RC[-1] -> 1.49
A961: 246 | B961: H3413/3XL | C961: Футболка хаки ||TS-TSH-CO-13 | D961: 4.06 | E961: usd | F961: 50 | G961: 121.00 | H961: 1.49 | I961: 6050.00 | J961: 1992.50 | K961: 0 | L961: =RC[-3]/100*RC[-1] -> 1.49
A962: 247 | B962: H7904 | C962: Шапка флисовая пол.вудлэнд ||CZ-DOK-FL-04 | D962: 3.00 | E962: usd | F962: 50 | G962: 99.00 | H962: 1.65 | I962: 4950.00 | J962: 1950.00 | K962: 0 | L962: =RC[-3]/100*RC[-1] -> 1.65
A963: 248 | B963: H02201/M | C963: Носки высокие LIGHTWEIGHT ||р39-42 ||SK-LWT-CM-01 | D963: 4.19 | E963: usd | F963: 50 | G963: 129.00 | H963: 1.54 | I963: 6450.00 | J963: 2260.00 | K963: 0 | L963: =RC[-3]/100*RC[-1] -> 1.54
A964: 249 | B964: H02201/L | C964: Носки высокие LIGHTWEIGHT ||р43-46 ||SK-LWT-CM-01 | D964: 4.19 | E964: usd | F964: 50 | G964: 129.00 | H964: 1.54 | I964: 6450.00 | J964: 2260.00 | K964: 0 | L964: =RC[-3]/100*RC[-1] -> 1.54
A965: 250 | B965: H02301/M | C965: Носки высокие MEDIUMWEIGHT ||р39-42 ||SK-MWT-WA-01 | D965: 4.58 | E965: usd | F965: 20 | G965: 137.00 | H965: 1.50 | I965: 2740.00 | J965: 908.00 | K965: 0 | L965: =RC[-3]/100*RC[-1] -> 1.50
A966: 251 | B966: H02301/L | C966: Носки высокие MEDIUMWEIGHT ||р43-46 ||SK-MWT-WA-01 | D966: 4.58 | E966: usd | F966: 20 | G966: 137.00 | H966: 1.50 | I966: 2740.00 | J966: 908.00 | K966: 0 | L966: =RC[-3]/100*RC[-1] -> 1.50 | M966: =SUM(R[-251]C[-1]:RC[-1]) -> 
A968: #3383 (2014-04-16) Гелікон Helikon-Tex Геликон - Прихід товару
A969: N | B969: арт | C969: назва | D969: закуп | F969: к-ть | G969: цiна | H969: кф | I969: продж | J969: дохiд | K969: % | L969: з-та
A970: 1 | B970: H0419 | C970: BW столовий набір 4-предметный (оригинал) ||NZ-BSW-SS-15 | D970: 2.59 | E970: usd | F970: 2 | G970: 2.59 | H970: 0.05 | I970: 5.18 | J970: -98.42 | K970: 0 | L970: =RC[-3]/100*RC[-1] -> 0.05
A971: 2 | B971: H12041/L | C971: ECWCS куртка TRILAMINAT польский вудлєнд ||KU-EC2-NL-04 | D971: 43.99 | E971: usd | F971: 1 | G971: 43.99 | H971: 0.05 | I971: 43.99 | J971: -835.81 | K971: 0 | L971: =RC[-3]/100*RC[-1] -> 0.05
A972: 3 | B972: H5827/3XLR | C972: URBAN TACTICAL штаны Jungle Green PolyCotton ||SP-UTL-PR-27 | D972: 28.43 | E972: usd | F972: 4 | G972: 28.43 | H972: 0.05 | I972: 113.72 | J972: -2160.68 | K972: 0 | L972: =RC[-3]/100*RC[-1] -> 0.05
A973: 4 | B973: H1314 | C973: US пончо мультикам (R/S) ||PO-MUS-PO-14 | D973: 12.25 | E973: usd | F973: 3 | G973: 220.50 | H973: 0.90 | I973: 661.50 | J973: -73.50 | K973: 0 | L973: =RC[-3]/100*RC[-1] -> 0.90
A974: 5 | B974: H8913/140 | C974: Ремень TOUGH US MARINES койот ||PS-USM-CO-13 | D974: 3.68 | E974: usd | F974: 1 | G974: 3.68 | H974: 0.05 | I974: 3.68 | J974: -69.92 | K974: 0 | L974: =RC[-3]/100*RC[-1] -> 0.05
A975: 6 | B975: H8902/140 | C975: Ремень TOUGH US MARINES олива ||PS-USM-CO-02 | D975: 3.68 | E975: usd | F975: 1 | G975: 3.68 | H975: 0.05 | I975: 3.68 | J975: -69.92 | K975: 0 | L975: =RC[-3]/100*RC[-1] -> 0.05
A976: 7 | B976: H3421/3XL | C976: Футболка Foliage Green ||TS-TSH-CO-21 | D976: 4.06 | E976: usd | F976: 1 | G976: 4.06 | H976: 0.05 | I976: 4.06 | J976: -77.09 | K976: 0 | L976: =RC[-3]/100*RC[-1] -> 0.05 | M976: =SUM(R[-7]C[-1]:RC[-1]) -> 
A978: #3427 (2014-04-17) Кракман - Прихід товару
A979: N | B979: арт | C979: назва | D979: закуп | F979: к-ть | G979: цiна | H979: кф | I979: продж | J979: дохiд | K979: % | L979: з-та
A980: 1 | B980: VL151311 | C980: Аккумулятор 11,1V 1300mAh/LiPo 15-30C | D980: 12.96 | E980: usd | F980: 40 | G980: 259.00 | H980: 1.00 | I980: 10360.00 | J980: -8.00 | K980: 0 | L980: =RC[-3]/100*RC[-1] -> 1.00
A981: 2 | B981: VL152011 | C981: Аккумулятор 11,1V 2000mAh/LiPo 15-30C | D981: 23.67 | E981: usd | F981: 10 | G981: 473.00 | H981: 1.00 | I981: 4730.00 | J981: -4.00 | K981: 0 | L981: =RC[-3]/100*RC[-1] -> 1.00
A982: 3 | B982: VNT231696 | C982: Аккумулятор 9.6V 1600mAh/NiMH | D982: 10.37 | E982: usd | F982: 20 | G982: 207.00 | H982: 1.00 | I982: 4140.00 | J982: -8.00 | K982: 0 | L982: =RC[-3]/100*RC[-1] -> 1.00
A983: 4 | B983: VNS231696 | C983: Аккумулятор 9.6V 1600mAh/NiMH stick | D983: 10.37 | E983: usd | F983: 19 | G983: 134.81 | H983: 0.65 | I983: 2561.39 | J983: -1379.21 | K983: 0 | L983: =RC[-3]/100*RC[-1] -> 0.65
A984: 5 | B984: VNS45A2396 | C984: Аккумулятор 9.6V 2300mAh/NiMH | D984: 12.74 | E984: usd | F984: 20 | G984: 255.00 | H984: 1.00 | I984: 5100.00 | J984: 4.00 | K984: 0 | L984: =RC[-3]/100*RC[-1] -> 1.00
A985: 6 | B985: K17222-A | C985: Балаклава SKULL type A-чёрная [Производитель: ACM] ||M51617222-A | D985: 2.65 | E985: usd | F985: 50 | G985: 81.00 | H985: 1.53 | I985: 4050.00 | J985: 1400.00 | K985: 0 | L985: =RC[-3]/100*RC[-1] -> 1.53
A986: 7 | B986: K17222-D | C986: Балаклава SKULL type D-чёрная [Производитель: ACM] ||M51617222-D | D986: 2.65 | E986: usd | F986: 50 | G986: 81.00 | H986: 1.53 | I986: 4050.00 | J986: 1400.00 | K986: 0 | L986: =RC[-3]/100*RC[-1] -> 1.53
A987: 8 | B987: K17222-E | C987: Балаклава SKULL type E-чёрная [Производитель: ACM] ||M51617222-E | D987: 2.65 | E987: usd | F987: 78 | G987: 81.00 | H987: 1.53 | I987: 6318.00 | J987: 2184.00 | K987: 0 | L987: =RC[-3]/100*RC[-1] -> 1.53
A988: 9 | B988: K17222-F | C988: Балаклава SKULL type F-чёрная [Производитель: ACM] ||M51617222-F | D988: 2.65 | E988: usd | F988: 50 | G988: 81.00 | H988: 1.53 | I988: 4050.00 | J988: 1400.00 | K988: 0 | L988: =RC[-3]/100*RC[-1] -> 1.53
A989: 10 | B989: K4-2917 | C989: Винтовка пневматическая страйкбольна MP5 Курц G5K G-55 Green Gas [Well] | D989: 63.00 | E989: usd | F989: 2 | G989: 1515.00 | H989: 1.20 | I989: 3030.00 | J989: 510.00 | K989: 0 | L989: =RC[-3]/100*RC[-1] -> 1.20
A990: 11 | B990: K4-1764 | C990: Винтовка пневматическая страйкбольна SHOTGUN полноприкладный ABS (3 обоймы) Long 003 [производитель: AGM] | D990: 11.15 | E990: usd | F990: 50 | G990: 316.00 | H990: 1.42 | I990: 15800.00 | J990: 4650.00 | K990: 0 | L990: =RC[-3]/100*RC[-1] -> 1.42
A991: 12 | B991: K4-2083 | C991: Винтовка электропневматическая страйкбольная AK105 (метал+металопласт) [Производитель: CYMA.031B] | D991: 86.85 | E991: usd | F991: 12 | G991: 1818.00 | H991: 1.05 | I991: 21816.00 | J991: 972.00 | K991: 0 | L991: =RC[-3]/100*RC[-1] -> 1.05
A992: 13 | B992: K4-2756 | C992: Винтовка электропневматическая страйкбольная AK105 рам.приклад складий [Производитель: CYMA.040B] | D992: 132.31 | E992: usd | F992: 6 | G992: 3130.00 | H992: 1.18 | I992: 18780.00 | J992: 2902.80 | K992: 0 | L992: =RC[-3]/100*RC[-1] -> 1.18
A993: 14 | B993: K4-2550 | C993: Винтовка электропневматическая страйкбольная AK74 полноприкладный ад (метал+дерево) RK06 [P tune] | D993: 125.00 | E993: usd | F993: 16 | G993: 3169.00 | H993: 1.27 | I993: 50704.00 | J993: 10704.00 | K993: 0 | L993: =RC[-3]/100*RC[-1] -> 1.27
A994: 15 | B994: K4-2356 | C994: Винтовка электропневматическая страйкбольная AK74 полноприкладный ад складной (метал) [RK05] | D994: 109.00 | E994: usd | F994: 12 | G994: 2735.00 | H994: 1.25 | I994: 32820.00 | J994: 6660.00 | K994: 0 | L994: =RC[-3]/100*RC[-1] -> 1.25
A995: 16 | B995: K4-2757 | C995: Винтовка электропневматическая страйкбольная AK74 полноприкладный складий [Производитель: CYMA CM.040C] | D995: 132.31 | E995: usd | F995: 12 | G995: 2786.00 | H995: 1.05 | I995: 33432.00 | J995: 1677.60 | K995: 0 | L995: =RC[-3]/100*RC[-1] -> 1.05
A996: 17 | B996: K4-2104 | C996: Винтовка электропневматическая страйкбольная AK74 рам.приклад (метал) RK02 [P tune] | D996: 104.91 | E996: usd | F996: 12 | G996: 2482.00 | H996: 1.18 | I996: 29784.00 | J996: 4605.60 | K996: 0 | L996: =RC[-3]/100*RC[-1] -> 1.18
A997: 18 | B997: K4-2105 | C997: Винтовка электропневматическая страйкбольная AK74 рам.приклад (метал+дерево) [RK03] | D997: 115.46 | E997: usd | F997: 12 | G997: 2987.00 | H997: 1.29 | I997: 35844.00 | J997: 8133.60 | K997: 0 | L997: =RC[-3]/100*RC[-1] -> 1.29
A998: 19 | B998: K4-2729 | C998: Винтовка электропневматическая страйкбольная AK74 рам.приклад складий [Производитель: CYMA.040] | D998: 132.31 | E998: usd | F998: 12 | G998: 3130.00 | H998: 1.18 | I998: 37560.00 | J998: 5805.60 | K998: 0 | L998: =RC[-3]/100*RC[-1] -> 1.18
A999: 20 | B999: K4-3104 | C999: Винтовка электропневматическая страйкбольная AKMS складной приклад (метал+дерево) RK10 [P tune] | D999: 115.31 | E999: usd | F999: 6 | G999: 2683.00 | H999: 1.16 | I999: 16098.00 | J999: 2260.80 | K999: 0 | L999: =RC[-3]/100*RC[-1] -> 1.16
A1000: 21 | B1000: K4-2759 | C1000: Винтовка электропневматическая страйкбольная AKS74U (метал+ABS) [Производитель: CYMA.045] | D1000: 107.64 | E1000: usd | F1000: 6 | G1000: 2673.00 | H1000: 1.24 | I1000: 16038.00 | J1000: 3121.20 | K1000: 0 | L1000: =RC[-3]/100*RC[-1] -> 1.24
A1001: 22 | B1001: K4-2717 | C1001: Винтовка электропневматическая страйкбольная H G36 [Производитель: Jing Gong0938] - JG(G608-4) | D1001: 107.07 | E1001: usd | F1001: 4 | G1001: 2519.00 | H1001: 1.18 | I1001: 10076.00 | J1001: 1510.40 | K1001: 0 | L1001: =RC[-3]/100*RC[-1] -> 1.18
A1002: 23 | B1002: K4-3352 | C1002: Винтовка электропневматическая страйкбольная M16A3 FULL METAL(Aluminum) NYLON [Производитель: CYMA.009] | D1002: 136.00 | E1002: usd | F1002: 4 | G1002: 3271.00 | H1002: 1.20 | I1002: 13084.00 | J1002: 2204.00 | K1002: 0 | L1002: =RC[-3]/100*RC[-1] -> 1.20
A1003: 24 | B1003: K4-2355 | C1003: Винтовка электропневматическая страйкбольная M4 CQB посилена (метал) BI3981M [DB+P tune] | D1003: 135.20 | E1003: usd | F1003: 8 | G1003: 3515.00 | H1003: 1.30 | I1003: 28120.00 | J1003: 6488.00 | K1003: 0 | L1003: =RC[-3]/100*RC[-1] -> 1.30
A1004: 25 | B1004: K4-1803 | C1004: Винтовка электропневматическая страйкбольная M4 R.I.S. (метал) [DBoys] ||5181 | D1004: 132.47 | E1004: usd | F1004: 8 | G1004: 3255.00 | H1004: 1.23 | I1004: 26040.00 | J1004: 4844.80 | K1004: 0 | L1004: =RC[-3]/100*RC[-1] -> 1.23
A1005: 26 | B1005: K4-3348 | C1005: Винтовка электропневматическая страйкбольная M4A1 Full metal(Aluminum) Nylon [Производитель: CYMA.002A1] | D1005: 127.00 | E1005: usd | F1005: 6 | G1005: 3054.00 | H1005: 1.20 | I1005: 18324.00 | J1005: 3084.00 | K1005: 0 | L1005: =RC[-3]/100*RC[-1] -> 1.20
A1006: 27 | B1006: K4-2674 | C1006: Винтовка электропневматическая страйкбольная M4CQB (Firefox 9.6V2000mah;420-430FPS) [PJ] | D1006: 147.13 | E1006: usd | F1006: 12 | G1006: 3405.00 | H1006: 1.16 | I1006: 40860.00 | J1006: 5548.80 | K1006: 0 | L1006: =RC[-3]/100*RC[-1] -> 1.16
A1007: 28 | B1007: K4-3350 | C1007: Винтовка электропневматическая страйкбольная M4RIS FULL METAL(Aluminum) NYLON [Производитель: CYMA.007] | D1007: 136.00 | E1007: usd | F1007: 12 | G1007: 3182.00 | H1007: 1.17 | I1007: 38184.00 | J1007: 5544.00 | K1007: 0 | L1007: =RC[-3]/100*RC[-1] -> 1.17
A1008: 29 | B1008: K4-3394 | C1008: Винтовка электропневматическая страйкбольная ВАЛ [KOER] | D1008: 144.00 | E1008: usd | F1008: 6 | G1008: 3201.00 | H1008: 1.11 | I1008: 19206.00 | J1008: 1926.00 | K1008: 0 | L1008: =RC[-3]/100*RC[-1] -> 1.11
A1009: 30 | B1009: K4-3393 | C1009: Винтовка электропневматическая страйкбольная ВИНТОРЕЗ VSS AEG (Fixed Stock) [KOER] | D1009: 144.00 | E1009: usd | F1009: 6 | G1009: 3201.00 | H1009: 1.11 | I1009: 19206.00 | J1009: 1926.00 | K1009: 0 | L1009: =RC[-3]/100*RC[-1] -> 1.11
A1010: 31 | B1010: BD3253 | C1010: Картрідж к гранаты 40мм | D1010: 3.66 | E1010: usd | F1010: 0 | G1010: 92.00 | H1010: 1.26 | I1010: 0.00 | J1010: 0.00 | K1010: 0 | L1010: =RC[-3]/100*RC[-1] -> 1.26
A1011: 32 | B1011: K17074-A | C1011: Комплект (наколенники и налокотники) ACU ||M51617074-ACU | D1011: 9.00 | E1011: usd | F1011: 30 | G1011: 293.00 | H1011: 1.63 | I1011: 8790.00 | J1011: 3390.00 | K1011: 0 | L1011: =RC[-3]/100*RC[-1] -> 1.63
A1012: 33 | B1012: K17074-W | C1012: Комплект (наколенники и налокотники) вудлэнд ||M51617074-WL | D1012: 9.00 | E1012: usd | F1012: 122 | G1012: 293.00 | H1012: 1.63 | I1012: 35746.00 | J1012: 13786.00 | K1012: 0 | L1012: =RC[-3]/100*RC[-1] -> 1.63
A1013: 34 | B1013: K17081-W | C1013: Комплект (наколенники и налокотники) вудлэнд ||M51617081-WL | D1013: 5.07 | E1013: usd | F1013: 160 | G1013: 188.00 | H1013: 1.85 | I1013: 30080.00 | J1013: 13856.00 | K1013: 0 | L1013: =RC[-3]/100*RC[-1] -> 1.85
A1014: 35 | B1014: K17074-C | C1014: Комплект (наколенники и налокотники) койот ||M51617074-TAN | D1014: 9.00 | E1014: usd | F1014: 51 | G1014: 293.00 | H1014: 1.63 | I1014: 14943.00 | J1014: 5763.00 | K1014: 0 | L1014: =RC[-3]/100*RC[-1] -> 1.63
A1015: 36 | B1015: K17081-C | C1015: Комплект (наколенники и налокотники) койот ||M51617081-TAN | D1015: 5.07 | E1015: usd | F1015: 32 | G1015: 188.00 | H1015: 1.85 | I1015: 6016.00 | J1015: 2771.20 | K1015: 0 | L1015: =RC[-3]/100*RC[-1] -> 1.85
A1016: 37 | B1016: K17168-C | C1016: Комплект (наколенники и налокотники) койот типу ALTA ||M51617168-TAN | D1016: 9.62 | E1016: usd | F1016: 9 | G1016: 297.00 | H1016: 1.54 | I1016: 2673.00 | J1016: 941.40 | K1016: 0 | L1016: =RC[-3]/100*RC[-1] -> 1.54
A1017: 38 | B1017: K17074-D | C1017: Комплект (наколенники и налокотники) марпат ||M51617074-DW | D1017: 9.00 | E1017: usd | F1017: 60 | G1017: 293.00 | H1017: 1.63 | I1017: 17580.00 | J1017: 6780.00 | K1017: 0 | L1017: =RC[-3]/100*RC[-1] -> 1.63
A1018: 39 | B1018: K17074-M | C1018: Комплект (наколенники и налокотники) мультикам ||M51617074-CP | D1018: 9.00 | E1018: usd | F1018: 93 | G1018: 293.00 | H1018: 1.63 | I1018: 27249.00 | J1018: 10509.00 | K1018: 0 | L1018: =RC[-3]/100*RC[-1] -> 1.63
A1019: 40 | B1019: K17081-M | C1019: Комплект (наколенники и налокотники) мультикам ||M51617081-CP | D1019: 5.07 | E1019: usd | F1019: 140 | G1019: 188.00 | H1019: 1.85 | I1019: 26320.00 | J1019: 12124.00 | K1019: 0 | L1019: =RC[-3]/100*RC[-1] -> 1.85
A1020: 41 | B1020: K17074-O | C1020: Комплект (наколенники и налокотники) олива ||M51617074-OD | D1020: 9.00 | E1020: usd | F1020: 27 | G1020: 293.00 | H1020: 1.63 | I1020: 7911.00 | J1020: 3051.00 | K1020: 0 | L1020: =RC[-3]/100*RC[-1] -> 1.63
A1021: 42 | B1021: K17081-O | C1021: Комплект (наколенники и налокотники) олива ||M51617081-OD | D1021: 5.07 | E1021: usd | F1021: 27 | G1021: 188.00 | H1021: 1.85 | I1021: 5076.00 | J1021: 2338.20 | K1021: 0 | L1021: =RC[-3]/100*RC[-1] -> 1.85
A1022: 43 | B1022: K17168-O | C1022: Комплект (наколенники и налокотники) олива типу ALTA ||M51617168-OD | D1022: 9.62 | E1022: usd | F1022: 294 | G1022: 125.06 | H1022: 0.65 | I1022: 36767.60 | J1022: -19798.00 | K1022: 0 | L1022: =RC[-3]/100*RC[-1] -> 0.65
A1023: 44 | B1023: K17081-B | C1023: Комплект (наколенники и налокотники) чёрный ||M51617081-BK | D1023: 5.07 | E1023: usd | F1023: 36 | G1023: 188.00 | H1023: 1.85 | I1023: 6768.00 | J1023: 3117.60 | K1023: 0 | L1023: =RC[-3]/100*RC[-1] -> 1.85
A1024: 45 | B1024: K17168-B | C1024: Комплект (наколенники и налокотники) чёрный типу ALTA ||M51617168-BK | D1024: 9.62 | E1024: usd | F1024: 135 | G1024: 125.06 | H1024: 0.65 | I1024: 16883.10 | J1024: -9090.90 | K1024: 0 | L1024: =RC[-3]/100*RC[-1] -> 0.65
A1025: 46 | B1025: K5-1581 | C1025: Магазин страйкбольный бункерный AK короткий (120шар) [CM] | D1025: 5.51 | E1025: usd | F1025: 9 | G1025: 130.00 | H1025: 1.18 | I1025: 1170.00 | J1025: 178.20 | K1025: 0 | L1025: =RC[-3]/100*RC[-1] -> 1.18
A1026: 47 | B1026: K17112-B | C1026: Маска-сетка короткая чёрная ||M51617112-BK | D1026: 4.00 | E1026: usd | F1026: 50 | G1026: 115.00 | H1026: 1.44 | I1026: 5750.00 | J1026: 1750.00 | K1026: 0 | L1026: =RC[-3]/100*RC[-1] -> 1.44
A1027: 48 | B1027: EM5283 | C1027: Муляж рации PRC-152 | D1027: 8.22 | E1027: usd | F1027: 10 | G1027: 214.00 | H1027: 1.30 | I1027: 2140.00 | J1027: 496.00 | K1027: 0 | L1027: =RC[-3]/100*RC[-1] -> 1.30
A1028: 49 | B1028: _BD2453 | C1028: Очки FA02 goggle-tinted [Производитель: ACM] | D1028: 3.45 | E1028: usd | F1028: 100 | G1028: 99.00 | H1028: 1.43 | I1028: 9900.00 | J1028: 3000.00 | K1028: 0 | L1028: =RC[-3]/100*RC[-1] -> 1.43
A1029: 50 | B1029: K17061A | C1029: Очки GX-2000 ||M51617061A BD2474 | D1029: 8.06 | E1029: usd | F1029: 100 | G1029: 195.00 | H1029: 1.21 | I1029: 19500.00 | J1029: 3380.00 | K1029: 0 | L1029: =RC[-3]/100*RC[-1] -> 1.21
A1030: 51 | B1030: BD2502 | C1030: Очки защитные RAZOR олива [Производитель: ACM] | D1030: 11.98 | E1030: usd | F1030: 50 | G1030: 396.00 | H1030: 1.65 | I1030: 19800.00 | J1030: 7820.00 | K1030: 0 | L1030: =RC[-3]/100*RC[-1] -> 1.65
A1031: 52 | B1031: K11010-W | C1031: Плечеременная разгрузочная система вудлэнд ||M51611010-WL | D1031: 24.23 | E1031: usd | F1031: 80 | G1031: 716.00 | H1031: 1.48 | I1031: 57280.00 | J1031: 18512.00 | K1031: 0 | L1031: =RC[-3]/100*RC[-1] -> 1.48
A1032: 53 | B1032: K11010-O | C1032: Плечеременная разгрузочная система олива || M51611010-OD | D1032: 24.23 | E1032: usd | F1032: 100 | G1032: 716.00 | H1032: 1.48 | I1032: 71600.00 | J1032: 23140.00 | K1032: 0 | L1032: =RC[-3]/100*RC[-1] -> 1.48
A1033: 54 | B1033: K13002-A | C1033: Подсумок MOLLE 12 кал. 6 шт ACU [A.C.M] ||M51613002-ACU | D1033: 4.70 | E1033: usd | F1033: 3 | G1033: 140.00 | H1033: 1.49 | I1033: 420.00 | J1033: 138.00 | K1033: 0 | L1033: =RC[-3]/100*RC[-1] -> 1.49
A1034: 55 | B1034: K13002-AT | C1034: Подсумок MOLLE 12 кал. 6 шт Atacs [A.C.M] ||M51613002-ATACS | D1034: 4.70 | E1034: usd | F1034: 10 | G1034: 140.00 | H1034: 1.49 | I1034: 1400.00 | J1034: 460.00 | K1034: 0 | L1034: =RC[-3]/100*RC[-1] -> 1.49
A1035: 56 | B1035: K13002-TAN | C1035: Подсумок MOLLE 12 кал. 6 шт коёт [A.C.M] ||M51613002-TAN | D1035: 4.70 | E1035: usd | F1035: 10 | G1035: 140.00 | H1035: 1.49 | I1035: 1400.00 | J1035: 460.00 | K1035: 0 | L1035: =RC[-3]/100*RC[-1] -> 1.49
A1036: 57 | B1036: K13002-D | C1036: Подсумок MOLLE 12 кал. 6 шт марпат [A.C.M] ||M51613002-DW | D1036: 4.70 | E1036: usd | F1036: 10 | G1036: 140.00 | H1036: 1.49 | I1036: 1400.00 | J1036: 460.00 | K1036: 0 | L1036: =RC[-3]/100*RC[-1] -> 1.49
A1037: 58 | B1037: K13002-M | C1037: Подсумок MOLLE 12 кал. 6 шт мультикам [A.C.M] ||M51613002-CP | D1037: 4.70 | E1037: usd | F1037: 10 | G1037: 140.00 | H1037: 1.49 | I1037: 1400.00 | J1037: 460.00 | K1037: 0 | L1037: =RC[-3]/100*RC[-1] -> 1.49
A1038: 59 | B1038: K13002-O | C1038: Подсумок MOLLE 12 кал. 6 шт олива [A.C.M] ||M51613002-OD | D1038: 4.70 | E1038: usd | F1038: 1 | G1038: 140.00 | H1038: 1.49 | I1038: 140.00 | J1038: 46.00 | K1038: 0 | L1038: =RC[-3]/100*RC[-1] -> 1.49
A1039: 60 | B1039: K13002-F | C1039: Подсумок MOLLE 12 кал. 6 шт флектарн [A.C.M] ||M51613002-FG | D1039: 4.70 | E1039: usd | F1039: 10 | G1039: 140.00 | H1039: 1.49 | I1039: 1400.00 | J1039: 460.00 | K1039: 0 | L1039: =RC[-3]/100*RC[-1] -> 1.49
A1040: 61 | B1040: K13002-B | C1040: Подсумок MOLLE 12 кал. 6 шт чёрный [A.C.M] ||M51613002-BK | D1040: 4.70 | E1040: usd | F1040: 4 | G1040: 140.00 | H1040: 1.49 | I1040: 560.00 | J1040: 184.00 | K1040: 0 | L1040: =RC[-3]/100*RC[-1] -> 1.49
A1041: 62 | B1041: K13001-A | C1041: Подсумок-пояс 12 кал. 12 шт ACU [A.C.M] ||M51613001-ACU | D1041: 3.60 | E1041: usd | F1041: 3 | G1041: 107.00 | H1041: 1.49 | I1041: 321.00 | J1041: 105.00 | K1041: 0 | L1041: =RC[-3]/100*RC[-1] -> 1.49
A1042: 63 | B1042: K13001-AT | C1042: Подсумок-пояс 12 кал. 12 шт Atacs [A.C.M] ||M51613001-ATACS | D1042: 3.60 | E1042: usd | F1042: 10 | G1042: 107.00 | H1042: 1.49 | I1042: 1070.00 | J1042: 350.00 | K1042: 0 | L1042: =RC[-3]/100*RC[-1] -> 1.49
A1043: 64 | B1043: K13001-W | C1043: Подсумок-пояс 12 кал. 12 шт вудлэнд [A.C.M] ||M51613001-WL | D1043: 3.60 | E1043: usd | F1043: 9 | G1043: 107.00 | H1043: 1.49 | I1043: 963.00 | J1043: 315.00 | K1043: 0 | L1043: =RC[-3]/100*RC[-1] -> 1.49
A1044: 65 | B1044: K13001-TAN | C1044: Подсумок-пояс 12 кал. 12 шт коёт [A.C.M] ||M51613001-TAN | D1044: 3.60 | E1044: usd | F1044: 10 | G1044: 107.00 | H1044: 1.49 | I1044: 1070.00 | J1044: 350.00 | K1044: 0 | L1044: =RC[-3]/100*RC[-1] -> 1.49
A1045: 66 | B1045: K13001-D | C1045: Подсумок-пояс 12 кал. 12 шт марпат [A.C.M] ||M51613001-DW | D1045: 3.60 | E1045: usd | F1045: 10 | G1045: 107.00 | H1045: 1.49 | I1045: 1070.00 | J1045: 350.00 | K1045: 0 | L1045: =RC[-3]/100*RC[-1] -> 1.49
A1046: 67 | B1046: K13001-M | C1046: Подсумок-пояс 12 кал. 12 шт мультикам [A.C.M] ||M51613001-CP | D1046: 3.60 | E1046: usd | F1046: 10 | G1046: 107.00 | H1046: 1.49 | I1046: 1070.00 | J1046: 350.00 | K1046: 0 | L1046: =RC[-3]/100*RC[-1] -> 1.49
A1047: 68 | B1047: K13001-O | C1047: Подсумок-пояс 12 кал. 12 шт олива [A.C.M] ||M51613001-OD | D1047: 3.60 | E1047: usd | F1047: 4 | G1047: 107.00 | H1047: 1.49 | I1047: 428.00 | J1047: 140.00 | K1047: 0 | L1047: =RC[-3]/100*RC[-1] -> 1.49
A1048: 69 | B1048: K13001-F | C1048: Подсумок-пояс 12 кал. 12 шт флектарн [A.C.M] ||M51613001-FG | D1048: 3.60 | E1048: usd | F1048: 10 | G1048: 107.00 | H1048: 1.49 | I1048: 1070.00 | J1048: 350.00 | K1048: 0 | L1048: =RC[-3]/100*RC[-1] -> 1.49
A1049: 70 | B1049: K13001-B | C1049: Подсумок-пояс 12 кал. 12 шт чёрный [A.C.M] ||M51613001-BK | D1049: 3.60 | E1049: usd | F1049: 1 | G1049: 107.00 | H1049: 1.49 | I1049: 107.00 | J1049: 35.00 | K1049: 0 | L1049: =RC[-3]/100*RC[-1] -> 1.49
A1050: 71 | B1050: K4-1097 | C1050: Пістолет электропневматичний страйкбольний GLOCK CM.030 [CM] | D1050: 44.32 | E1050: usd | F1050: 12 | G1050: 1175.00 | H1050: 1.33 | I1050: 14100.00 | J1050: 3463.20 | K1050: 0 | L1050: =RC[-3]/100*RC[-1] -> 1.33
A1051: 72 | B1051: K11007-A | C1051: Розгруз. AAV FSBE ACU [A.C.M] ||M51611007-ACU | D1051: 27.21 | E1051: usd | F1051: 46 | G1051: 760.00 | H1051: 1.40 | I1051: 34960.00 | J1051: 9926.80 | K1051: 0 | L1051: =RC[-3]/100*RC[-1] -> 1.40
A1052: 73 | B1052: K11007-AT | C1052: Розгруз. AAV FSBE Atacs [A.C.M] ||M51611007-ATACS | D1052: 30.00 | E1052: usd | F1052: 10 | G1052: 877.00 | H1052: 1.46 | I1052: 8770.00 | J1052: 2770.00 | K1052: 0 | L1052: =RC[-3]/100*RC[-1] -> 1.46
A1053: 74 | B1053: K11007-W | C1053: Розгруз. AAV FSBE вудлэнд [A.C.M] ||M51611007-WL | D1053: 27.21 | E1053: usd | F1053: 50 | G1053: 760.00 | H1053: 1.40 | I1053: 38000.00 | J1053: 10790.00 | K1053: 0 | L1053: =RC[-3]/100*RC[-1] -> 1.40
A1054: 75 | B1054: K11007-C | C1054: Розгруз. AAV FSBE койот [A.C.M] ||M51611007-TAN | D1054: 27.21 | E1054: usd | F1054: 50 | G1054: 760.00 | H1054: 1.40 | I1054: 38000.00 | J1054: 10790.00 | K1054: 0 | L1054: =RC[-3]/100*RC[-1] -> 1.40
A1055: 76 | B1055: K11007-D | C1055: Розгруз. AAV FSBE марпат [A.C.M] ||M51611007-DW | D1055: 27.21 | E1055: usd | F1055: 50 | G1055: 760.00 | H1055: 1.40 | I1055: 38000.00 | J1055: 10790.00 | K1055: 0 | L1055: =RC[-3]/100*RC[-1] -> 1.40
A1056: 77 | B1056: K11007-M | C1056: Розгруз. AAV FSBE мультикам [A.C.M] ||M51611007-CP | D1056: 27.21 | E1056: usd | F1056: 50 | G1056: 760.00 | H1056: 1.40 | I1056: 38000.00 | J1056: 10790.00 | K1056: 0 | L1056: =RC[-3]/100*RC[-1] -> 1.40
A1057: 78 | B1057: K11007-B | C1057: Розгруз. AAV FSBE чёрный [A.C.M] ||M51611007-BK | D1057: 27.21 | E1057: usd | F1057: 50 | G1057: 760.00 | H1057: 1.40 | I1057: 38000.00 | J1057: 10790.00 | K1057: 0 | L1057: =RC[-3]/100*RC[-1] -> 1.40
A1058: 79 | B1058: K11017-AT | C1058: Розгруз. Chest Rig без верхнего кармана Atacs[A.C.M] ||M51611017-ATACS | D1058: 8.39 | E1058: usd | F1058: 6 | G1058: 274.00 | H1058: 1.63 | I1058: 1644.00 | J1058: 637.20 | K1058: 0 | L1058: =RC[-3]/100*RC[-1] -> 1.63
A1059: 80 | B1059: K11017-C | C1059: Розгруз. Chest Rig без верхнего кармана койот [A.C.M] ||M51611017-TAN | D1059: 7.28 | E1059: usd | F1059: 6 | G1059: 238.00 | H1059: 1.63 | I1059: 1428.00 | J1059: 554.40 | K1059: 0 | L1059: =RC[-3]/100*RC[-1] -> 1.63
A1060: 81 | B1060: K11017-O | C1060: Розгруз. Chest Rig без верхнего кармана олива [A.C.M] ||M51611017-OD | D1060: 7.28 | E1060: usd | F1060: 6 | G1060: 238.00 | H1060: 1.63 | I1060: 1428.00 | J1060: 554.40 | K1060: 0 | L1060: =RC[-3]/100*RC[-1] -> 1.63
A1061: 82 | B1061: K11006-O | C1061: Розгруз. Chest Rig олива [A.C.M] ||M51611006-OD | D1061: 21.36 | E1061: usd | F1061: 10 | G1061: 639.00 | H1061: 1.50 | I1061: 6390.00 | J1061: 2118.00 | K1061: 0 | L1061: =RC[-3]/100*RC[-1] -> 1.50
A1062: 83 | B1062: K11018-W | C1062: Розгруз. Chest Rigg AK с подсумками вудлэнд ||M51611018-WL | D1062: 13.80 | E1062: usd | F1062: 46 | G1062: 547.00 | H1062: 1.98 | I1062: 25162.00 | J1062: 12466.00 | K1062: 0 | L1062: =RC[-3]/100*RC[-1] -> 1.98
A1063: 84 | B1063: K11018-C | C1063: Розгруз. Chest Rigg AK с подсумками койот ||M51611018-TAN | D1063: 13.80 | E1063: usd | F1063: 10 | G1063: 547.00 | H1063: 1.98 | I1063: 5470.00 | J1063: 2710.00 | K1063: 0 | L1063: =RC[-3]/100*RC[-1] -> 1.98
A1064: 85 | B1064: K11018-M | C1064: Розгруз. Chest Rigg AK с подсумками мультикам ||M51611018-CP | D1064: 13.80 | E1064: usd | F1064: 1 | G1064: 547.00 | H1064: 1.98 | I1064: 547.00 | J1064: 271.00 | K1064: 0 | L1064: =RC[-3]/100*RC[-1] -> 1.98
A1065: 86 | B1065: K11018-O | C1065: Розгруз. Chest Rigg AK с подсумками олива ||M51611018-OD | D1065: 13.80 | E1065: usd | F1065: 50 | G1065: 547.00 | H1065: 1.98 | I1065: 27350.00 | J1065: 13550.00 | K1065: 0 | L1065: =RC[-3]/100*RC[-1] -> 1.98
A1066: 87 | B1066: K11162-A | C1066: Розгруз. Interceptor Body Armour ACU [A.C.M] ||M51611162-ACU | D1066: 39.00 | E1066: usd | F1066: 4 | G1066: 1145.00 | H1066: 1.47 | I1066: 4580.00 | J1066: 1460.00 | K1066: 0 | L1066: =RC[-3]/100*RC[-1] -> 1.47
A1067: 88 | B1067: K11162-W | C1067: Розгруз. Interceptor Body Armour вудлэнд [A.C.M] ||M51611162-WL | D1067: 39.00 | E1067: usd | F1067: 8 | G1067: 1145.00 | H1067: 1.47 | I1067: 9160.00 | J1067: 2920.00 | K1067: 0 | L1067: =RC[-3]/100*RC[-1] -> 1.47
A1068: 89 | B1068: K11162-O | C1068: Розгруз. Interceptor Body Armour олива [A.C.M] ||M51611162-OD | D1068: 39.00 | E1068: usd | F1068: 10 | G1068: 1145.00 | H1068: 1.47 | I1068: 11450.00 | J1068: 3650.00 | K1068: 0 | L1068: =RC[-3]/100*RC[-1] -> 1.47
A1069: 90 | B1069: K11162-B | C1069: Розгруз. Interceptor Body Armour чёрный [A.C.M] ||M51611162-BK | D1069: 39.00 | E1069: usd | F1069: 10 | G1069: 1145.00 | H1069: 1.47 | I1069: 11450.00 | J1069: 3650.00 | K1069: 0 | L1069: =RC[-3]/100*RC[-1] -> 1.47
A1070: 91 | B1070: K11008-A | C1070: Розгруз. Plate Carrier Side Cummerbund ACU ||M51611008-ACU | D1070: 29.00 | E1070: usd | F1070: 22 | G1070: 862.00 | H1070: 1.49 | I1070: 18964.00 | J1070: 6204.00 | K1070: 0 | L1070: =RC[-3]/100*RC[-1] -> 1.49
A1071: 92 | B1071: K11021-AT | C1071: Розгрузочна система тактическая Jump Plate с подсумками Atacs ||M51611021-ATACS | D1071: 33.32 | E1071: usd | F1071: 10 | G1071: 988.00 | H1071: 1.48 | I1071: 9880.00 | J1071: 3216.00 | K1071: 0 | L1071: =RC[-3]/100*RC[-1] -> 1.48
A1072: 93 | B1072: K11021-D | C1072: Розгрузочна система тактическая Jump Plate с подсумками марпат ||M51611021-DW | D1072: 30.31 | E1072: usd | F1072: 10 | G1072: 903.00 | H1072: 1.49 | I1072: 9030.00 | J1072: 2968.00 | K1072: 0 | L1072: =RC[-3]/100*RC[-1] -> 1.49
A1073: 94 | B1073: K11021-F | C1073: Розгрузочна система тактическая Jump Plate с подсумками флектарн ||M51611021-GF | D1073: 30.31 | E1073: usd | F1073: 10 | G1073: 903.00 | H1073: 1.49 | I1073: 9030.00 | J1073: 2968.00 | K1073: 0 | L1073: =RC[-3]/100*RC[-1] -> 1.49
A1074: 95 | B1074: K11005-B | C1074: Розгрузочна система тактическая STRIKE с подсумками чёрный ||M51611005-BK | D1074: 18.19 | E1074: usd | F1074: 50 | G1074: 610.00 | H1074: 1.68 | I1074: 30500.00 | J1074: 12310.00 | K1074: 0 | L1074: =RC[-3]/100*RC[-1] -> 1.68
A1075: 96 | B1075: K12025-AT | C1075: Рюкзак 3-Day Assault 30л ATACS ||M51612025-ATACS | D1075: 19.44 | E1075: usd | F1075: 10 | G1075: 571.00 | H1075: 1.47 | I1075: 5710.00 | J1075: 1822.00 | K1075: 0 | L1075: =RC[-3]/100*RC[-1] -> 1.47
A1076: 97 | B1076: K12025-W | C1076: Рюкзак 3-Day Assault 30л вудлэнд ||M51612025-WL | D1076: 17.67 | E1076: usd | F1076: 30 | G1076: 519.00 | H1076: 1.47 | I1076: 15570.00 | J1076: 4968.00 | K1076: 0 | L1076: =RC[-3]/100*RC[-1] -> 1.47
A1077: 98 | B1077: K12025-С | C1077: Рюкзак 3-Day Assault 30л койот ||M51612025-TAN | D1077: 17.67 | E1077: usd | F1077: 60 | G1077: 519.00 | H1077: 1.47 | I1077: 31140.00 | J1077: 9936.00 | K1077: 0 | L1077: =RC[-3]/100*RC[-1] -> 1.47
A1078: 99 | B1078: K12025-D | C1078: Рюкзак 3-Day Assault 30л марпат ||M51612025-DW | D1078: 17.67 | E1078: usd | F1078: 15 | G1078: 519.00 | H1078: 1.47 | I1078: 7785.00 | J1078: 2484.00 | K1078: 0 | L1078: =RC[-3]/100*RC[-1] -> 1.47
A1079: 100 | B1079: K12025-M | C1079: Рюкзак 3-Day Assault 30л мультикам ||M51612025-CP | D1079: 17.67 | E1079: usd | F1079: 50 | G1079: 519.00 | H1079: 1.47 | I1079: 25950.00 | J1079: 8280.00 | K1079: 0 | L1079: =RC[-3]/100*RC[-1] -> 1.47
A1080: 101 | B1080: K12025-O | C1080: Рюкзак 3-Day Assault 30л олива ||M51612025-OD | D1080: 17.67 | E1080: usd | F1080: 80 | G1080: 519.00 | H1080: 1.47 | I1080: 41520.00 | J1080: 13248.00 | K1080: 0 | L1080: =RC[-3]/100*RC[-1] -> 1.47
A1081: 102 | B1081: K12025-B | C1081: Рюкзак 3-Day Assault 30л чёрный ||M51612025-BK | D1081: 17.67 | E1081: usd | F1081: 20 | G1081: 519.00 | H1081: 1.47 | I1081: 10380.00 | J1081: 3312.00 | K1081: 0 | L1081: =RC[-3]/100*RC[-1] -> 1.47
A1082: 103 | B1082: K12024-A | C1082: Рюкзак 3-Day Assault 36л ACU ||M51612024-ACU | D1082: 26.00 | E1082: usd | F1082: 10 | G1082: 778.00 | H1082: 1.50 | I1082: 7780.00 | J1082: 2580.00 | K1082: 0 | L1082: =RC[-3]/100*RC[-1] -> 1.50
A1083: 104 | B1083: K12024-С | C1083: Рюкзак 3-Day Assault 36л койот ||M51612024-TAN | D1083: 26.00 | E1083: usd | F1083: 10 | G1083: 778.00 | H1083: 1.50 | I1083: 7780.00 | J1083: 2580.00 | K1083: 0 | L1083: =RC[-3]/100*RC[-1] -> 1.50
A1084: 105 | B1084: K12024-D | C1084: Рюкзак 3-Day Assault 36л марпат ||M51612024-DW | D1084: 26.00 | E1084: usd | F1084: 10 | G1084: 778.00 | H1084: 1.50 | I1084: 7780.00 | J1084: 2580.00 | K1084: 0 | L1084: =RC[-3]/100*RC[-1] -> 1.50
A1085: 106 | B1085: K12024-O | C1085: Рюкзак 3-Day Assault 36л олива ||M51612024-OD | D1085: 26.00 | E1085: usd | F1085: 10 | G1085: 778.00 | H1085: 1.50 | I1085: 7780.00 | J1085: 2580.00 | K1085: 0 | L1085: =RC[-3]/100*RC[-1] -> 1.50
A1086: 107 | B1086: K12024-B | C1086: Рюкзак 3-Day Assault 36л чёрный ||M51612024-BK | D1086: 26.00 | E1086: usd | F1086: 10 | G1086: 778.00 | H1086: 1.50 | I1086: 7780.00 | J1086: 2580.00 | K1086: 0 | L1086: =RC[-3]/100*RC[-1] -> 1.50
A1087: 108 | B1087: K12029-A | C1087: Рюкзак ACADEMY ACU N-600D ||M51612029-ACU | D1087: 24.16 | E1087: usd | F1087: 5 | G1087: 780.00 | H1087: 1.61 | I1087: 3900.00 | J1087: 1484.00 | K1087: 0 | L1087: =RC[-3]/100*RC[-1] -> 1.61
A1088: 109 | B1088: K12029-FG | C1088: Рюкзак ACADEMY ATAK-FG N-600D ||M51612029-FG | D1088: 24.16 | E1088: usd | F1088: 5 | G1088: 780.00 | H1088: 1.61 | I1088: 3900.00 | J1088: 1484.00 | K1088: 0 | L1088: =RC[-3]/100*RC[-1] -> 1.61
A1089: 110 | B1089: K12029-AT | C1089: Рюкзак ACADEMY Atacs N-600D ||M51612029-ATACS | D1089: 26.57 | E1089: usd | F1089: 5 | G1089: 780.00 | H1089: 1.47 | I1089: 3900.00 | J1089: 1243.00 | K1089: 0 | L1089: =RC[-3]/100*RC[-1] -> 1.47
A1090: 111 | B1090: K12029-W | C1090: Рюкзак ACADEMY вудлэнд N-600D ||M51612029-WL | D1090: 24.16 | E1090: usd | F1090: 5 | G1090: 780.00 | H1090: 1.61 | I1090: 3900.00 | J1090: 1484.00 | K1090: 0 | L1090: =RC[-3]/100*RC[-1] -> 1.61
A1091: 112 | B1091: K12029-C | C1091: Рюкзак ACADEMY коёт N-600D ||M51612029-TAN | D1091: 24.16 | E1091: usd | F1091: 5 | G1091: 780.00 | H1091: 1.61 | I1091: 3900.00 | J1091: 1484.00 | K1091: 0 | L1091: =RC[-3]/100*RC[-1] -> 1.61
A1092: 113 | B1092: K12029-D | C1092: Рюкзак ACADEMY марпат N-600D ||M51612029-DW | D1092: 24.16 | E1092: usd | F1092: 5 | G1092: 780.00 | H1092: 1.61 | I1092: 3900.00 | J1092: 1484.00 | K1092: 0 | L1092: =RC[-3]/100*RC[-1] -> 1.61
A1093: 114 | B1093: K12029-O | C1093: Рюкзак ACADEMY олива N-600D ||M51612029-OD | D1093: 24.16 | E1093: usd | F1093: 10 | G1093: 780.00 | H1093: 1.61 | I1093: 7800.00 | J1093: 2968.00 | K1093: 0 | L1093: =RC[-3]/100*RC[-1] -> 1.61
A1094: 115 | B1094: K12029-BK | C1094: Рюкзак ACADEMY чёрный N-600D ||M51612029-BK | D1094: 24.16 | E1094: usd | F1094: 5 | G1094: 780.00 | H1094: 1.61 | I1094: 3900.00 | J1094: 1484.00 | K1094: 0 | L1094: =RC[-3]/100*RC[-1] -> 1.61
A1095: 116 | B1095: K12035-A | C1095: Рюкзак Backpack 20l Mod.2 20л ACU ||M51612035-ACU | D1095: 22.46 | E1095: usd | F1095: 10 | G1095: 671.00 | H1095: 1.49 | I1095: 6710.00 | J1095: 2218.00 | K1095: 0 | L1095: =RC[-3]/100*RC[-1] -> 1.49
A1096: 117 | B1096: K12035-AT | C1096: Рюкзак Backpack 20l Mod.2 20л ATACS ||M51612035-ATACS | D1096: 24.71 | E1096: usd | F1096: 10 | G1096: 735.00 | H1096: 1.49 | I1096: 7350.00 | J1096: 2408.00 | K1096: 0 | L1096: =RC[-3]/100*RC[-1] -> 1.49
A1097: 118 | B1097: K12035-FG | C1097: Рюкзак Backpack 20l Mod.2 20л ATACS-FG ||M51612035-FG | D1097: 22.46 | E1097: usd | F1097: 10 | G1097: 671.00 | H1097: 1.49 | I1097: 6710.00 | J1097: 2218.00 | K1097: 0 | L1097: =RC[-3]/100*RC[-1] -> 1.49
A1098: 119 | B1098: K12035-W | C1098: Рюкзак Backpack 20l Mod.2 20л вудлэнд ||M51612035-WL | D1098: 22.46 | E1098: usd | F1098: 10 | G1098: 671.00 | H1098: 1.49 | I1098: 6710.00 | J1098: 2218.00 | K1098: 0 | L1098: =RC[-3]/100*RC[-1] -> 1.49
A1099: 120 | B1099: K12035-С | C1099: Рюкзак Backpack 20l Mod.2 20л койот ||M51612035-TAN | D1099: 22.46 | E1099: usd | F1099: 10 | G1099: 671.00 | H1099: 1.49 | I1099: 6710.00 | J1099: 2218.00 | K1099: 0 | L1099: =RC[-3]/100*RC[-1] -> 1.49
A1100: 121 | B1100: K12035-D | C1100: Рюкзак Backpack 20l Mod.2 20л марпат ||M51612035-DW | D1100: 22.46 | E1100: usd | F1100: 2 | G1100: 671.00 | H1100: 1.49 | I1100: 1342.00 | J1100: 443.60 | K1100: 0 | L1100: =RC[-3]/100*RC[-1] -> 1.49
A1101: 122 | B1101: K12035-M | C1101: Рюкзак Backpack 20l Mod.2 20л мультикам ||M51612035-CP | D1101: 22.46 | E1101: usd | F1101: 10 | G1101: 671.00 | H1101: 1.49 | I1101: 6710.00 | J1101: 2218.00 | K1101: 0 | L1101: =RC[-3]/100*RC[-1] -> 1.49
A1102: 123 | B1102: K12035-O | C1102: Рюкзак Backpack 20l Mod.2 20л олива ||M51612035-OD | D1102: 22.46 | E1102: usd | F1102: 10 | G1102: 671.00 | H1102: 1.49 | I1102: 6710.00 | J1102: 2218.00 | K1102: 0 | L1102: =RC[-3]/100*RC[-1] -> 1.49
A1103: 124 | B1103: K12035-B | C1103: Рюкзак Backpack 20l Mod.2 20л чёрный ||M51612035-BK | D1103: 22.46 | E1103: usd | F1103: 10 | G1103: 671.00 | H1103: 1.49 | I1103: 6710.00 | J1103: 2218.00 | K1103: 0 | L1103: =RC[-3]/100*RC[-1] -> 1.49
A1104: 125 | B1104: K12030-A | C1104: Рюкзак MOLLE Mod.3 20л. ACU N-600D ||M51612030-ACU | D1104: 22.38 | E1104: usd | F1104: 20 | G1104: 669.00 | H1104: 1.49 | I1104: 13380.00 | J1104: 4428.00 | K1104: 0 | L1104: =RC[-3]/100*RC[-1] -> 1.49
A1105: 126 | B1105: K12030-W | C1105: Рюкзак MOLLE Mod.3 20л. вудлэнд N-600D ||M51612030-WL | D1105: 22.38 | E1105: usd | F1105: 10 | G1105: 669.00 | H1105: 1.49 | I1105: 6690.00 | J1105: 2214.00 | K1105: 0 | L1105: =RC[-3]/100*RC[-1] -> 1.49
A1106: 127 | B1106: K12030-C | C1106: Рюкзак MOLLE Mod.3 20л. коёт N-600D ||M51612030-TAN | D1106: 22.38 | E1106: usd | F1106: 10 | G1106: 669.00 | H1106: 1.49 | I1106: 6690.00 | J1106: 2214.00 | K1106: 0 | L1106: =RC[-3]/100*RC[-1] -> 1.49
A1107: 128 | B1107: K12030-D | C1107: Рюкзак MOLLE Mod.3 20л. марпат N-600D ||M51612030-DW | D1107: 22.38 | E1107: usd | F1107: 10 | G1107: 669.00 | H1107: 1.49 | I1107: 6690.00 | J1107: 2214.00 | K1107: 0 | L1107: =RC[-3]/100*RC[-1] -> 1.49
A1108: 129 | B1108: K12030-M | C1108: Рюкзак MOLLE Mod.3 20л. мультикамо N-600D ||M51612030-CP | D1108: 22.38 | E1108: usd | F1108: 10 | G1108: 669.00 | H1108: 1.49 | I1108: 6690.00 | J1108: 2214.00 | K1108: 0 | L1108: =RC[-3]/100*RC[-1] -> 1.49
A1109: 130 | B1109: K12030-O | C1109: Рюкзак MOLLE Mod.3 20л. олива N-600D ||M51612030-OD | D1109: 22.38 | E1109: usd | F1109: 10 | G1109: 669.00 | H1109: 1.49 | I1109: 6690.00 | J1109: 2214.00 | K1109: 0 | L1109: =RC[-3]/100*RC[-1] -> 1.49
A1110: 131 | B1110: K12030-BK | C1110: Рюкзак MOLLE Mod.3 20л. чёрный N-600D ||M51612030-BK | D1110: 22.38 | E1110: usd | F1110: 10 | G1110: 669.00 | H1110: 1.49 | I1110: 6690.00 | J1110: 2214.00 | K1110: 0 | L1110: =RC[-3]/100*RC[-1] -> 1.49
A1111: 132 | B1111: K12082-B | C1111: Рюкзак MOLLE Tactical Backpack чёрный ||M51612082-BK | D1111: 19.01 | E1111: usd | F1111: 10 | G1111: 596.00 | H1111: 1.57 | I1111: 5960.00 | J1111: 2158.00 | K1111: 0 | L1111: =RC[-3]/100*RC[-1] -> 1.57
A1112: 133 | B1112: K12028-AT | C1112: Рюкзак Modular System снайперский Atacs N-600D ||M51612028-ATACS | D1112: 29.42 | E1112: usd | F1112: 6 | G1112: 869.00 | H1112: 1.48 | I1112: 5214.00 | J1112: 1683.60 | K1112: 0 | L1112: =RC[-3]/100*RC[-1] -> 1.48
A1113: 134 | B1113: K12028-С | C1113: Рюкзак Modular System снайперский койот N-600D ||M51612028-TAN | D1113: 26.42 | E1113: usd | F1113: 2 | G1113: 780.00 | H1113: 1.48 | I1113: 1560.00 | J1113: 503.20 | K1113: 0 | L1113: =RC[-3]/100*RC[-1] -> 1.48
A1114: 135 | B1114: K12028-O | C1114: Рюкзак Modular System снайперский олива N-600D ||M51612028-OD | D1114: 26.42 | E1114: usd | F1114: 1 | G1114: 780.00 | H1114: 1.48 | I1114: 780.00 | J1114: 251.60 | K1114: 0 | L1114: =RC[-3]/100*RC[-1] -> 1.48
A1115: 136 | B1115: K12028-F | C1115: Рюкзак Modular System снайперский флектарн N-600D ||M51612028-GF | D1115: 26.42 | E1115: usd | F1115: 10 | G1115: 780.00 | H1115: 1.48 | I1115: 7800.00 | J1115: 2516.00 | K1115: 0 | L1115: =RC[-3]/100*RC[-1] -> 1.48
A1116: 137 | B1116: K12034-A | C1116: Рюкзак RANGER Mod.3 20л. ACU N-600D ||M51612034-ACU | D1116: 22.38 | E1116: usd | F1116: 10 | G1116: 669.00 | H1116: 1.49 | I1116: 6690.00 | J1116: 2214.00 | K1116: 0 | L1116: =RC[-3]/100*RC[-1] -> 1.49
A1117: 138 | B1117: K12034-FG | C1117: Рюкзак RANGER Mod.3 20л. ATAK-FG N-600D ||M51612034-FG | D1117: 22.38 | E1117: usd | F1117: 10 | G1117: 669.00 | H1117: 1.49 | I1117: 6690.00 | J1117: 2214.00 | K1117: 0 | L1117: =RC[-3]/100*RC[-1] -> 1.49
A1118: 139 | B1118: K12034-W | C1118: Рюкзак RANGER Mod.3 20л. вудлэнд N-600D ||M51612034-WL | D1118: 22.38 | E1118: usd | F1118: 10 | G1118: 669.00 | H1118: 1.49 | I1118: 6690.00 | J1118: 2214.00 | K1118: 0 | L1118: =RC[-3]/100*RC[-1] -> 1.49
A1119: 140 | B1119: K12034-C | C1119: Рюкзак RANGER Mod.3 20л. коёт N-600D ||M51612034-TAN | D1119: 22.38 | E1119: usd | F1119: 10 | G1119: 669.00 | H1119: 1.49 | I1119: 6690.00 | J1119: 2214.00 | K1119: 0 | L1119: =RC[-3]/100*RC[-1] -> 1.49
A1120: 141 | B1120: K12034-D | C1120: Рюкзак RANGER Mod.3 20л. марпат N-600D ||M51612034-DW | D1120: 22.38 | E1120: usd | F1120: 10 | G1120: 669.00 | H1120: 1.49 | I1120: 6690.00 | J1120: 2214.00 | K1120: 0 | L1120: =RC[-3]/100*RC[-1] -> 1.49
A1121: 142 | B1121: K12034-M | C1121: Рюкзак RANGER Mod.3 20л. мультикамо N-600D ||M51612034-CP | D1121: 22.38 | E1121: usd | F1121: 10 | G1121: 669.00 | H1121: 1.49 | I1121: 6690.00 | J1121: 2214.00 | K1121: 0 | L1121: =RC[-3]/100*RC[-1] -> 1.49
A1122: 143 | B1122: K12034-O | C1122: Рюкзак RANGER Mod.3 20л. олива N-600D ||M51612034-OD | D1122: 22.38 | E1122: usd | F1122: 10 | G1122: 669.00 | H1122: 1.49 | I1122: 6690.00 | J1122: 2214.00 | K1122: 0 | L1122: =RC[-3]/100*RC[-1] -> 1.49
A1123: 144 | B1123: K12034-BK | C1123: Рюкзак RANGER Mod.3 20л. чёрный N-600D ||M51612034-BK | D1123: 22.38 | E1123: usd | F1123: 10 | G1123: 669.00 | H1123: 1.49 | I1123: 6690.00 | J1123: 2214.00 | K1123: 0 | L1123: =RC[-3]/100*RC[-1] -> 1.49
A1124: 145 | B1124: K12088-С | C1124: Рюкзак Tactical Backpack for 13" laptop койот ||M51612088-TAN | D1124: 21.61 | E1124: usd | F1124: 10 | G1124: 646.00 | H1124: 1.49 | I1124: 6460.00 | J1124: 2138.00 | K1124: 0 | L1124: =RC[-3]/100*RC[-1] -> 1.49
A1125: 146 | B1125: K12088-B | C1125: Рюкзак Tactical Backpack for 13" laptop чёрный ||M51612088-BK | D1125: 21.61 | E1125: usd | F1125: 10 | G1125: 646.00 | H1125: 1.49 | I1125: 6460.00 | J1125: 2138.00 | K1125: 0 | L1125: =RC[-3]/100*RC[-1] -> 1.49
A1126: 147 | B1126: K12026-A | C1126: Рюкзак под камелбек 20л ACU ||M51612026-ACU | D1126: 15.65 | E1126: usd | F1126: 20 | G1126: 456.00 | H1126: 1.46 | I1126: 9120.00 | J1126: 2860.00 | K1126: 0 | L1126: =RC[-3]/100*RC[-1] -> 1.46
A1127: 148 | B1127: K12026-AT | C1127: Рюкзак под камелбек 20л ATACS ||M51612026-ATACS | D1127: 17.16 | E1127: usd | F1127: 10 | G1127: 506.00 | H1127: 1.47 | I1127: 5060.00 | J1127: 1628.00 | K1127: 0 | L1127: =RC[-3]/100*RC[-1] -> 1.47
A1128: 149 | B1128: K12026-C | C1128: Рюкзак под камелбек 20л койот ||M51612026-TAN | D1128: 15.65 | E1128: usd | F1128: 10 | G1128: 456.00 | H1128: 1.46 | I1128: 4560.00 | J1128: 1430.00 | K1128: 0 | L1128: =RC[-3]/100*RC[-1] -> 1.46
A1129: 150 | B1129: K12026-M | C1129: Рюкзак под камелбек 20л мультикам ||M51612026-CP | D1129: 15.65 | E1129: usd | F1129: 10 | G1129: 456.00 | H1129: 1.46 | I1129: 4560.00 | J1129: 1430.00 | K1129: 0 | L1129: =RC[-3]/100*RC[-1] -> 1.46
A1130: 151 | B1130: K12026-O | C1130: Рюкзак под камелбек 20л олива ||M51612026-OD | D1130: 15.65 | E1130: usd | F1130: 10 | G1130: 456.00 | H1130: 1.46 | I1130: 4560.00 | J1130: 1430.00 | K1130: 0 | L1130: =RC[-3]/100*RC[-1] -> 1.46
A1131: 152 | B1131: K12026-B | C1131: Рюкзак под камелбек 20л чёрный ||M51612026-BK | D1131: 15.65 | E1131: usd | F1131: 10 | G1131: 456.00 | H1131: 1.46 | I1131: 4560.00 | J1131: 1430.00 | K1131: 0 | L1131: =RC[-3]/100*RC[-1] -> 1.46
A1132: 153 | B1132: K5-1229 | C1132: Сошки R.I.S. [Производитель: ACM] | D1132: 9.62 | E1132: usd | F1132: 10 | G1132: 285.00 | H1132: 1.48 | I1132: 2850.00 | J1132: 926.00 | K1132: 0 | L1132: =RC[-3]/100*RC[-1] -> 1.48
A1133: 154 | B1133: K5-1589 | C1133: Сошки СВД [Производитель: ACM] | D1133: 32.41 | E1133: usd | F1133: 5 | G1133: 843.00 | H1133: 1.30 | I1133: 4215.00 | J1133: 974.00 | K1133: 0 | L1133: =RC[-3]/100*RC[-1] -> 1.30
A1134: 155 | B1134: K5-1590 | C1134: Сошки СВД [Производитель: ACM] | D1134: 32.41 | E1134: usd | F1134: 10 | G1134: 421.00 | H1134: 0.65 | I1134: 4210.00 | J1134: -2272.00 | K1134: 0 | L1134: =RC[-3]/100*RC[-1] -> 0.65
A1135: 156 | B1135: K5-0168W | C1135: Сошки к страйкбольной снайперской винтовке R.I.S. L96A1 [Производитель: P] | D1135: 12.28 | E1135: usd | F1135: 10 | G1135: 348.00 | H1135: 1.42 | I1135: 3480.00 | J1135: 1024.00 | K1135: 0 | L1135: =RC[-3]/100*RC[-1] -> 1.42
A1136: 157 | B1136: K4-3363 | C1136: Страйкбольний пулемет электропневматичний M1918A2 Browning | D1136: 253.48 | E1136: usd | F1136: 6 | G1136: 6162.00 | H1136: 1.22 | I1136: 36972.00 | J1136: 6554.40 | K1136: 0 | L1136: =RC[-3]/100*RC[-1] -> 1.22
A1137: 158 | B1137: K4-3395 | C1137: Страйкбольний пулемет электропневматичний MG 042 Full Metal [Производитель: AGM] | D1137: 421.00 | E1137: usd | F1137: 1 | G1137: 10235.00 | H1137: 1.22 | I1137: 10235.00 | J1137: 1815.00 | K1137: 0 | L1137: =RC[-3]/100*RC[-1] -> 1.22
A1138: 159 | B1138: BD8888 | C1138: Хронограф E9800 PLUS [Производитель: ACM] | D1138: 65.00 | E1138: usd | F1138: 1 | G1138: 1437.00 | H1138: 1.11 | I1138: 1437.00 | J1138: 137.00 | K1138: 0 | L1138: =RC[-3]/100*RC[-1] -> 1.11
A1139: 160 | B1139: BD9900 | C1139: Хронограф E9900-V SHOOTING [Производитель: ACM] | D1139: 87.66 | E1139: usd | F1139: 1 | G1139: 1937.00 | H1139: 1.10 | I1139: 1937.00 | J1139: 183.80 | K1139: 0 | L1139: =RC[-3]/100*RC[-1] -> 1.10
A1140: 161 | B1140: KBB-25 | C1140: Шарики BB 6мм 0,25x4000 [GUARDER] ||BB-25(BAG) | D1140: 7.87 | E1140: usd | F1140: 100 | G1140: 151.00 | H1140: 0.96 | I1140: 15100.00 | J1140: -640.00 | K1140: 0 | L1140: =RC[-3]/100*RC[-1] -> 0.96
A1141: 162 | B1141: KBB-30 | C1141: Шарики BB 6мм 0,30x1000 [GUARDER] ||BB-30(BAG) | D1141: 4.95 | E1141: usd | F1141: 30 | G1141: 98.00 | H1141: 0.99 | I1141: 2940.00 | J1141: -30.00 | K1141: 0 | L1141: =RC[-3]/100*RC[-1] -> 0.99
A1142: 163 | B1142: KBB-36 | C1142: Шарики BB 6мм 0,36x1000 [GUARDER] ||BB-36(BAG) | D1142: 4.95 | E1142: usd | F1142: 10 | G1142: 98.00 | H1142: 0.99 | I1142: 980.00 | J1142: -10.00 | K1142: 0 | L1142: =RC[-3]/100*RC[-1] -> 0.99
A1143: 164 | B1143: KBB-40 | C1143: Шарики BB 6мм 0,43x1000 [GUARDER] ||BB-43(BAG) | D1143: 8.58 | E1143: usd | F1143: 10 | G1143: 170.00 | H1143: 0.99 | I1143: 1700.00 | J1143: -16.00 | K1143: 0 | L1143: =RC[-3]/100*RC[-1] -> 0.99
A1144: 165 | B1144: K5-0372 | C1144: Шина AK-R.I.S. к винтовке AK-серии (алюм.) [Производитель: ACM] ||BD0877 M51616235 | D1144: 10.20 | E1144: usd | F1144: 50 | G1144: 251.00 | H1144: 1.23 | I1144: 12550.00 | J1144: 2350.00 | K1144: 0 | L1144: =RC[-3]/100*RC[-1] -> 1.23
A1145: 166 | B1145: K5-0349 | C1145: Шина-крышка к пулемету M249 [Производитель: P] | D1145: 27.10 | E1145: usd | F1145: 5 | G1145: 672.00 | H1145: 1.24 | I1145: 3360.00 | J1145: 650.00 | K1145: 0 | L1145: =RC[-3]/100*RC[-1] -> 1.24
A1146: 167 | B1146: K4-3253 | C1146: Пістолет электропневматичний страйкбольний Кольт CM.123 [Производитель: CYMA.123] | D1146: 43.73 | E1146: usd | F1146: 12 | G1146: 43.73 | H1146: 0.05 | I1146: 524.76 | J1146: -9970.44 | K1146: 0 | L1146: =RC[-3]/100*RC[-1] -> 0.05 | M1146: =SUM(R[-167]C[-1]:RC[-1]) -> 
A1148: #3461 (2014-04-18) Львів Назар Максимович - Прихід товару
A1149: N | B1149: арт | C1149: назва | D1149: закуп | F1149: к-ть | G1149: цiна | H1149: кф | I1149: продж | J1149: дохiд | K1149: % | L1149: з-та
A1150: 1 | B1150: _455500 | C1150: Набор для чистки оружия 4.5/5.5 мм | D1150: 7.24 | E1150: Инт | F1150: 3 | G1150: 7.00 | H1150: 0.05 | I1150: 21.00 | J1150: -413.48 | K1150: 0 | L1150: =RC[-3]/100*RC[-1] -> 0.05
A1151: 2 | B1151: _5619 | C1151: Пістолет сигнальный EKOL ARAS compact (чёрный) | D1151: 56.57 | E1151: Инт | F1151: 3 | G1151: 73.00 | H1151: 0.06 | I1151: 219.00 | J1151: -3175.28 | K1151: 0 | L1151: =RC[-3]/100*RC[-1] -> 0.06
A1152: 3 | B1152: _6573 | C1152: Пістолет сигнальный EKOL Lady (чёрный) | D1152: 4.29 | E1152: Инт | F1152: 3 | G1152: 60.00 | H1152: 0.70 | I1152: 180.00 | J1152: -77.14 | K1152: 0 | L1152: =RC[-3]/100*RC[-1] -> 0.70
A1153: 4 | B1153: _6577 | C1153: Пістолет сигнальный EKOL Major (чёрный) | D1153: 45.57 | E1153: Инт | F1153: 2 | G1153: 64.00 | H1153: 0.07 | I1153: 128.00 | J1153: -1694.86 | K1153: 0 | L1153: =RC[-3]/100*RC[-1] -> 0.07
A1154: 5 | B1154: _33401 | C1154: Револьвер под патрон Флобера Ekol Viper 3 Black | D1154: 83.00 | E1154: usd | F1154: 7 | G1154: 83.00 | H1154: 0.05 | I1154: 581.00 | J1154: -11039.00 | K1154: 0 | L1154: =RC[-3]/100*RC[-1] -> 0.05
A1155: 6 | B1155: _33402 | C1155: Револьвер под патрон Флобера Ekol Viper 3 Chrome | D1155: 85.00 | E1155: usd | F1155: 2 | G1155: 85.00 | H1155: 0.05 | I1155: 170.00 | J1155: -3230.00 | K1155: 0 | L1155: =RC[-3]/100*RC[-1] -> 0.05
A1156: 7 | B1156: _33403 | C1156: Револьвер под патрон Флобера Ekol Viper 4.5 Black | D1156: 85.00 | E1156: usd | F1156: 4 | G1156: 85.00 | H1156: 0.05 | I1156: 340.00 | J1156: -6460.00 | K1156: 0 | L1156: =RC[-3]/100*RC[-1] -> 0.05
A1157: 8 | B1157: _33404 | C1157: Револьвер под патрон Флобера Ekol Viper 4.5 Chrome | D1157: 87.00 | E1157: usd | F1157: 2 | G1157: 87.00 | H1157: 0.05 | I1157: 174.00 | J1157: -3306.00 | K1157: 0 | L1157: =RC[-3]/100*RC[-1] -> 0.05
A1158: 9 | B1158: _PR2503 | C1158: Револьвер под патрон Флобера PROFI 3 (бук) | D1158: 119.21 | E1158: Инт | F1158: 3 | G1158: 125.00 | H1158: 0.05 | I1158: 375.00 | J1158: -6777.84 | K1158: 0 | L1158: =RC[-3]/100*RC[-1] -> 0.05
A1159: 10 | B1159: _PR2501 | C1159: Револьвер под патрон Флобера PROFI 3 (пластик чёрный) | D1159: 117.64 | E1159: Инт | F1159: 3 | G1159: 120.00 | H1159: 0.05 | I1159: 360.00 | J1159: -6698.58 | K1159: 0 | L1159: =RC[-3]/100*RC[-1] -> 0.05
A1160: 11 | B1160: _PR2504 | C1160: Револьвер под патрон Флобера PROFI 4.5 (бук) | D1160: 125.00 | E1160: usd | F1160: 2 | G1160: 125.00 | H1160: 0.05 | I1160: 250.00 | J1160: -4750.00 | K1160: 0 | L1160: =RC[-3]/100*RC[-1] -> 0.05
A1161: 12 | B1161: _PR2505 | C1161: Револьвер под патрон Флобера PROFI 4.5 (пластик чёрный) | D1161: 116.71 | E1161: Инт | F1161: 2 | G1161: 120.00 | H1161: 0.05 | I1161: 240.00 | J1161: -4428.56 | K1161: 0 | L1161: =RC[-3]/100*RC[-1] -> 0.05 | M1161: =SUM(R[-12]C[-1]:RC[-1]) -> 
A1163: #3618 (2014-04-25) Львів Назар Максимович - Прихід товару
A1164: N | B1164: арт | C1164: назва | D1164: закуп | F1164: к-ть | G1164: цiна | H1164: кф | I1164: продж | J1164: дохiд | K1164: % | L1164: з-та
A1165: 1 | B1165: _21906 | C1165: Баллон Borner СО-2 12г | D1165: 0.31 | E1165: Инт | F1165: 500 | G1165: 7.00 | H1165: 1.13 | I1165: 2450.00 | J1165: -653.45 | K1165: 0 | L1165: =RC[-3]/100*RC[-1] -> 1.13 | M1165: =SUM(R[-1]C[-1]:RC[-1]) -> 
A1167: #3638 (2014-04-25) Львів Назар Максимович - Прихід товару
A1168: N | B1168: арт | C1168: назва | D1168: закуп | F1168: к-ть | G1168: цiна | H1168: кф | I1168: продж | J1168: дохiд | K1168: % | L1168: з-та
A1169: 1 | B1169: _1.0903 | C1169: Бинокль GALILEO 22x36 ||18-0112 | D1169: 180.00 | E1169: грн | F1169: 10 | G1169: 180.00 | H1169: 1.00 | I1169: 1800.00 | J1169: 0.00 | K1169: 0 | L1169: =RC[-3]/100*RC[-1] -> 1.00
A1170: 2 | B1170: _898-9130 | C1170: Набор для чистки оружия 4.5 мм | D1170: 4.14 | E1170: Инт | F1170: 53 | G1170: 99.00 | H1170: 1.20 | I1170: 3672.90 | J1170: -713.31 | K1170: 0 | L1170: =RC[-3]/100*RC[-1] -> 1.20
A1171: 3 | B1171: _01603 | C1171: ПНВ Монокуляр EXELON 4x50||ПС | D1171: 2820.00 | E1171: грн | F1171: 2 | G1171: 3750.00 | H1171: 1.33 | I1171: 5250.00 | J1171: -390.00 | K1171: 0 | L1171: =RC[-3]/100*RC[-1] -> 1.33
A1172: 4 | B1172: _03438 | C1172: ПНВ Монокуляр NVMT Spartan 1x24 с маской | D1172: 2487.00 | E1172: грн | F1172: 1 | G1172: 3399.00 | H1172: 1.37 | I1172: 2379.30 | J1172: -107.70 | K1172: 0 | L1172: =RC[-3]/100*RC[-1] -> 1.37
A1173: 5 | B1173: _KWC-0548 | C1173: Пістолет пневматичний KWC PM (KM-44 DHN) | D1173: 41.70 | E1173: Инт | F1173: 4 | G1173: 765.00 | H1173: 0.92 | I1173: 2142.00 | J1173: -1194.00 | K1173: 0 | L1173: =RC[-3]/100*RC[-1] -> 0.92
A1174: 6 | B1174: _N8200-C | C1174: Стульчик со спинкой AQUATECH | D1174: 6.80 | E1174: Инт | F1174: 5 | G1174: 135.00 | H1174: 0.99 | I1174: 472.50 | J1174: -207.50 | K1174: 0 | L1174: =RC[-3]/100*RC[-1] -> 0.99
A1175: 7 | B1175: _N8200 | C1175: Стульчик-табурет AQUATECH | D1175: 4.40 | E1175: Инт | F1175: 5 | G1175: 95.00 | H1175: 1.08 | I1175: 332.50 | J1175: -107.50 | K1175: 0 | L1175: =RC[-3]/100*RC[-1] -> 1.08 | M1175: =SUM(R[-7]C[-1]:RC[-1]) -> 
A1177: #3646 (2014-04-25) Львів Назар Максимович - Прихід товару
A1178: N | B1178: арт | C1178: назва | D1178: закуп | F1178: к-ть | G1178: цiна | H1178: кф | I1178: продж | J1178: дохiд | K1178: % | L1178: з-та
A1179: 1 | B1179: _1.1801 | C1179: Бинокль YUKON 10x50 WA ||ПС 22022 | D1179: 863.00 | E1179: грн | F1179: 1 | G1179: 805.00 | H1179: 0.93 | I1179: 805.00 | J1179: -58.00 | K1179: 0 | L1179: =RC[-3]/100*RC[-1] -> 0.93 | M1179: =SUM(R[-1]C[-1]:RC[-1]) -> 
A1181: #3742 (2014-04-29) Агрон постач - Прихід товару
A1182: N | B1182: арт | C1182: назва | D1182: закуп | F1182: к-ть | G1182: цiна | H1182: кф | I1182: продж | J1182: дохiд | K1182: % | L1182: з-та
A1183: 1 | B1183: _1.1801 | C1183: Бинокль YUKON 10x50 WA ||ПС 22022 | D1183: 863.00 | E1183: грн | F1183: 8 | G1183: 750.00 | H1183: 0.87 | I1183: 6000.00 | J1183: -904.00 | K1183: 0 | L1183: =RC[-3]/100*RC[-1] -> 0.87 | M1183: =SUM(R[-1]C[-1]:RC[-1]) -> 
A1185: #3794 (2014-04-30) Гелікон Helikon-Tex Геликон - Прихід товару
A1186: N | B1186: арт | C1186: назва | D1186: закуп | F1186: к-ть | G1186: цiна | H1186: кф | I1186: продж | J1186: дохiд | K1186: % | L1186: з-та
A1187: 1 | B1187: H3410/XL | C1187: Футболка ACU ||TS-TSH-CO-10 | D1187: 4.06 | E1187: usd | F1187: 100 | G1187: 121.00 | H1187: 1.49 | I1187: 12100.00 | J1187: 3985.00 | K1187: 0 | L1187: =RC[-3]/100*RC[-1] -> 1.49 | M1187: =SUM(R[-1]C[-1]:RC[-1]) -> 
A1189: #3837 (2014-05-05) Фанатік Спорт - Прихід товару
A1190: N | B1190: арт | C1190: назва | D1190: закуп | F1190: к-ть | G1190: цiна | H1190: кф | I1190: продж | J1190: дохiд | K1190: % | L1190: з-та
A1191: 1 | B1191: _26-0621 | C1191: Балон газовый BT-1 | D1191: 19.68 | E1191: Инт | F1191: 2 | G1191: 279.00 | H1191: 0.71 | I1191: 558.00 | J1191: -229.20 | K1191: 0 | L1191: =RC[-3]/100*RC[-1] -> 0.71
A1192: 2 | B1192: _26-0623 | C1192: Балон газовый BT-3 | D1192: 23.60 | E1192: Инт | F1192: 2 | G1192: 339.00 | H1192: 0.72 | I1192: 678.00 | J1192: -266.00 | K1192: 0 | L1192: =RC[-3]/100*RC[-1] -> 0.72
A1193: 3 | B1193: _26-0628 | C1193: Горелка газовая GUCIO big (d=18) | D1193: 7.00 | E1193: euro | F1193: 2 | G1193: 136.00 | H1193: 0.78 | I1193: 272.00 | J1193: -78.00 | K1193: 0 | L1193: =RC[-3]/100*RC[-1] -> 0.78
A1194: 4 | B1194: _26-0627 | C1194: Переходник для заправки балона | D1194: 4.00 | E1194: Инт | F1194: 5 | G1194: 45.00 | H1194: 0.56 | I1194: 225.00 | J1194: -175.00 | K1194: 0 | L1194: =RC[-3]/100*RC[-1] -> 0.56
A1195: 5 | B1195: _26-0626 | C1195: Переходник на різьбу типу "Kovea" | D1195: 4.00 | E1195: Инт | F1195: 5 | G1195: 45.00 | H1195: 0.56 | I1195: 225.00 | J1195: -175.00 | K1195: 0 | L1195: =RC[-3]/100*RC[-1] -> 0.56 | M1195: =SUM(R[-5]C[-1]:RC[-1]) -> 
A1197: #3839 (2014-05-05) Федик Тарас - Прихід товару
A1198: N | B1198: арт | C1198: назва | D1198: закуп | F1198: к-ть | G1198: цiна | H1198: кф | I1198: продж | J1198: дохiд | K1198: % | L1198: з-та
A1199: 1 | B1199: _TRM-001 | C1199: Спальный мешок-одеяло ||СП-1 | D1199: 11.79 | E1199: Инт | F1199: 5 | G1199: 255.00 | H1199: 1.08 | I1199: 1275.00 | J1199: 96.43 | K1199: 0 | L1199: =RC[-3]/100*RC[-1] -> 1.08
A1200: 2 | B1200: _TRM-002 | C1200: Спальный мешок-одеяло | D1200: 11.79 | E1200: Инт | F1200: 5 | G1200: 275.00 | H1200: 1.17 | I1200: 1375.00 | J1200: 196.43 | K1200: 0 | L1200: =RC[-3]/100*RC[-1] -> 1.17
A1201: 3 | B1201: _TRM-003 | C1201: Спальный мешок-одеяло | D1201: 15.36 | E1201: Инт | F1201: 5 | G1201: 350.00 | H1201: 1.14 | I1201: 1750.00 | J1201: 214.29 | K1201: 0 | L1201: =RC[-3]/100*RC[-1] -> 1.14 | M1201: =SUM(R[-3]C[-1]:RC[-1]) -> 
A1203: #3863 (2014-05-05) ЛАТЕК - Прихід товару
A1204: N | B1204: арт | C1204: назва | D1204: закуп | F1204: к-ть | G1204: цiна | H1204: кф | I1204: продж | J1204: дохiд | K1204: % | L1204: з-та
A1205: 1 | B1205: _1592 | C1205: Кобура поясная Флобер (Лягушка) | D1205: 3.40 | E1205: Инт | F1205: 2 | G1205: 49.00 | H1205: 0.72 | I1205: 98.00 | J1205: -38.00 | K1205: 0 | L1205: =RC[-3]/100*RC[-1] -> 0.72
A1206: 2 | B1206: _1580 | C1206: Кобура универсальная Флобер чёрная (левая) | D1206: 8.90 | E1206: Инт | F1206: 3 | G1206: 127.00 | H1206: 0.71 | I1206: 381.00 | J1206: -153.00 | K1206: 0 | L1206: =RC[-3]/100*RC[-1] -> 0.71
A1207: 3 | B1207: _6178 | C1207: Кобура универсальная C11 (чёрная) | D1207: 9.27 | E1207: Инт | F1207: 4 | G1207: 128.00 | H1207: 0.69 | I1207: 512.00 | J1207: -229.60 | K1207: 0 | L1207: =RC[-3]/100*RC[-1] -> 0.69
A1208: 4 | B1208: _1572 | C1208: Кобура универсальная ФОРТ (черная) | D1208: 9.00 | E1208: Инт | F1208: 2 | G1208: 128.00 | H1208: 0.71 | I1208: 256.00 | J1208: -104.00 | K1208: 0 | L1208: =RC[-3]/100*RC[-1] -> 0.71 | M1208: =SUM(R[-4]C[-1]:RC[-1]) -> 
A1210: #3896 (2014-05-06) Акрополіс - Прихід товару
A1211: N | B1211: арт | C1211: назва | D1211: закуп | F1211: к-ть | G1211: цiна | H1211: кф | I1211: продж | J1211: дохiд | K1211: % | L1211: з-та
A1212: 1 | B1212: A19-01 | C1212: Відро рибальське ACROPOLIS (Д-30см) ||ВР-1а | D1212: 35.30 | E1212: грн | F1212: 2 | G1212: 30.00 | H1212: 0.85 | I1212: 51.00 | J1212: -19.60 | K1212: 0 | L1212: =RC[-3]/100*RC[-1] -> 0.85
A1213: 2 | B1213: A19-02 | C1213: Відро рибальське ACROPOLIS (Д-40см) ||ВР-1б | D1213: 38.00 | E1213: грн | F1213: 2 | G1213: 33.00 | H1213: 0.87 | I1213: 56.10 | J1213: -19.90 | K1213: 0 | L1213: =RC[-3]/100*RC[-1] -> 0.87
A1214: 3 | B1214: A19-86 | C1214: Відро рибальське ACROPOLIS (Д-50см) ||ВР-1 | D1214: 38.25 | E1214: грн | F1214: 2 | G1214: 44.64 | H1214: 1.17 | I1214: 75.89 | J1214: -0.61 | K1214: 0 | L1214: =RC[-3]/100*RC[-1] -> 1.17
A1215: 4 | B1215: A19-08 | C1215: Комб. футляр для патронів (12кал.) ACROPOLIS ||ФП-12 | D1215: 106.00 | E1215: грн | F1215: 2 | G1215: 106.00 | H1215: 1.00 | I1215: 180.20 | J1215: -31.80 | K1215: 0 | L1215: =RC[-3]/100*RC[-1] -> 1.00
A1216: 5 | B1216: A19-14 | C1216: Охотничий ремень (L-101) ACROPOLIS ||МР-1 | D1216: 113.00 | E1216: грн | F1216: 2 | G1216: 113.00 | H1216: 1.00 | I1216: 192.10 | J1216: -33.90 | K1216: 0 | L1216: =RC[-3]/100*RC[-1] -> 1.00
A1217: 6 | B1217: A19-26 | C1217: Муфта на приклад (нарізна) ACROPOLIS ||МНП-н | D1217: 46.00 | E1217: грн | F1217: 3 | G1217: 45.00 | H1217: 0.98 | I1217: 114.75 | J1217: -23.25 | K1217: 0 | L1217: =RC[-3]/100*RC[-1] -> 0.98
A1218: 7 | B1218: A19-31 | C1218: Рибальський рюкзак ACROPOLIS ||РР-1 | D1218: 368.00 | E1218: грн | F1218: 2 | G1218: 393.00 | H1218: 1.07 | I1218: 668.10 | J1218: -67.90 | K1218: 0 | L1218: =RC[-3]/100*RC[-1] -> 1.07
A1219: 8 | B1219: A19-181/XXL | C1219: Футболка рибальська ACROPOLIS ||ОФР-2/XXL | D1219: 93.96 | E1219: грн | F1219: 2 | G1219: 93.96 | H1219: 1.00 | I1219: 187.92 | J1219: 0.00 | K1219: 0 | L1219: =RC[-3]/100*RC[-1] -> 1.00
A1220: 9 | B1220: A19-182/XL | C1220: Футболка рибальська ACROPOLIS ||ОФР-3/XL | D1220: 177.54 | E1220: грн | F1220: 1 | G1220: 177.54 | H1220: 1.00 | I1220: 177.54 | J1220: 0.00 | K1220: 0 | L1220: =RC[-3]/100*RC[-1] -> 1.00
A1221: 10 | B1221: A19-134 | C1221: Футляр для винтовки ACROPOLIS ||ФЗ-7 | D1221: 474.30 | E1221: грн | F1221: 1 | G1221: 485.00 | H1221: 1.02 | I1221: 412.25 | J1221: -62.05 | K1221: 0 | L1221: =RC[-3]/100*RC[-1] -> 1.02
A1222: 11 | B1222: A19-121 | C1222: Футляр для оружия ACROPOLIS ||ФЗ-11ан | D1222: 564.00 | E1222: грн | F1222: 1 | G1222: 564.00 | H1222: 1.00 | I1222: 479.40 | J1222: -84.60 | K1222: 0 | L1222: =RC[-3]/100*RC[-1] -> 1.00
A1223: 12 | B1223: A19-85 | C1223: Чохол на опт. приціл (L340-385) ACROPOLIS ||ЧОП-3 | D1223: 38.00 | E1223: грн | F1223: 3 | G1223: 38.00 | H1223: 1.00 | I1223: 96.90 | J1223: -17.10 | K1223: 0 | L1223: =RC[-3]/100*RC[-1] -> 1.00
A1224: 13 | B1224: A19-168/25-27 | C1224: Носки охотничьи ACROPOLIS ||ШКМ-1/25-27 | D1224: 15.00 | E1224: грн | F1224: 2 | G1224: 15.00 | H1224: 1.00 | I1224: 30.00 | J1224: 0.00 | K1224: 0 | L1224: =RC[-3]/100*RC[-1] -> 1.00 | M1224: =SUM(R[-13]C[-1]:RC[-1]) -> 
A1226: #3905 (2014-05-06) Федик Тарас - Прихід товару
A1227: N | B1227: арт | C1227: назва | D1227: закуп | F1227: к-ть | G1227: цiна | H1227: кф | I1227: продж | J1227: дохiд | K1227: % | L1227: з-та
A1228: 1 | B1228: _TRC-004 | C1228: Автокружка TRAMP 450 ml | D1228: 3.71 | E1228: Инт | F1228: 5 | G1228: 46.34 | H1228: 0.63 | I1228: 231.70 | J1228: -139.02 | K1228: 0 | L1228: =RC[-3]/100*RC[-1] -> 0.63
A1229: 2 | B1229: _TRG-001 | C1229: Балон газовый 220 г. шток Tramp | D1229: 1.50 | E1229: Инт | F1229: 112 | G1229: 18.80 | H1229: 0.63 | I1229: 2105.60 | J1229: -1263.36 | K1229: 0 | L1229: =RC[-3]/100*RC[-1] -> 0.63
A1230: 3 | B1230: TRG-007 | C1230: Горелка складная TRAMP | D1230: 12.92 | E1230: Инт | F1230: 5 | G1230: 161.50 | H1230: 0.63 | I1230: 807.50 | J1230: -484.50 | K1230: 0 | L1230: =RC[-3]/100*RC[-1] -> 0.63
A1231: 4 | B1231: _TRC-011 | C1231: Кружка TRAMP 300 мл, складные ручки | D1231: 3.60 | E1231: Инт | F1231: 5 | G1231: 37.00 | H1231: 0.51 | I1231: 185.00 | J1231: -175.00 | K1231: 0 | L1231: =RC[-3]/100*RC[-1] -> 0.51
A1232: 5 | B1232: _TRC-037 | C1232: Кружка TRAMP 500 мл, складные ручки | D1232: 7.04 | E1232: Инт | F1232: 5 | G1232: 73.00 | H1232: 0.52 | I1232: 365.00 | J1232: -339.00 | K1232: 0 | L1232: =RC[-3]/100*RC[-1] -> 0.52
A1233: 6 | B1233: _TRC-012 | C1233: Кружка TRAMP с карабином 300 мл | D1233: 3.60 | E1233: Инт | F1233: 5 | G1233: 37.00 | H1233: 0.51 | I1233: 185.00 | J1233: -175.00 | K1233: 0 | L1233: =RC[-3]/100*RC[-1] -> 0.51
A1234: 7 | B1234: _SLT-007.06 | C1234: Палатка Camp 3 Sol | D1234: 62.57 | E1234: Инт | F1234: 2 | G1234: 876.00 | H1234: 0.70 | I1234: 1752.00 | J1234: -750.86 | K1234: 0 | L1234: =RC[-3]/100*RC[-1] -> 0.70
A1235: 8 | B1235: _SLT-022.06 | C1235: Палатка Camp 4 Sol | D1235: 75.14 | E1235: Инт | F1235: 2 | G1235: 1052.00 | H1235: 0.70 | I1235: 2104.00 | J1235: -901.72 | K1235: 0 | L1235: =RC[-3]/100*RC[-1] -> 0.70
A1236: 9 | B1236: _001.11 | C1236: Палатка HUNTER | D1236: 6.71 | E1236: Инт | F1236: 2 | G1236: 750.00 | H1236: 5.59 | I1236: 1500.00 | J1236: 1231.43 | K1236: 0 | L1236: =RC[-3]/100*RC[-1] -> 5.59
A1237: 10 | B1237: _TTT-005.09 | C1237: Палатка HURONE 4-местная | D1237: 95.93 | E1237: Инт | F1237: 1 | G1237: 1343.00 | H1237: 0.70 | I1237: 1343.00 | J1237: -575.57 | K1237: 0 | L1237: =RC[-3]/100*RC[-1] -> 0.70
A1238: 11 | B1238: _TRT-003.04 | C1238: Палатка Nishe 2 Tramp | D1238: 64.93 | E1238: Инт | F1238: 1 | G1238: 909.00 | H1238: 0.70 | I1238: 909.00 | J1238: -389.57 | K1238: 0 | L1238: =RC[-3]/100*RC[-1] -> 0.70
A1239: 12 | B1239: _TRT-003.03 | C1239: Палатка Nishe 3 Tramp | D1239: 73.29 | E1239: Инт | F1239: 1 | G1239: 1026.00 | H1239: 0.70 | I1239: 1026.00 | J1239: -439.71 | K1239: 0 | L1239: =RC[-3]/100*RC[-1] -> 0.70
A1240: 13 | B1240: _TRT-001.04 | C1240: Палатка Scout 2 Tramp | D1240: 61.43 | E1240: Инт | F1240: 1 | G1240: 860.00 | H1240: 0.70 | I1240: 860.00 | J1240: -368.57 | K1240: 0 | L1240: =RC[-3]/100*RC[-1] -> 0.70
A1241: 14 | B1241: _TRT-002.04 | C1241: Палатка Scout 3 Tramp | D1241: 66.57 | E1241: Инт | F1241: 1 | G1241: 932.00 | H1241: 0.70 | I1241: 932.00 | J1241: -399.43 | K1241: 0 | L1241: =RC[-3]/100*RC[-1] -> 0.70
A1242: 15 | B1242: _SLT-038.06 | C1242: Палатка Summer | D1242: 22.29 | E1242: Инт | F1242: 2 | G1242: 312.00 | H1242: 0.70 | I1242: 624.00 | J1242: -267.43 | K1242: 0 | L1242: =RC[-3]/100*RC[-1] -> 0.70
A1243: 16 | B1243: _TTT-003.09 | C1243: Палатка TEPPE 2+1-местная | D1243: 37.14 | E1243: Инт | F1243: 1 | G1243: 520.00 | H1243: 0.70 | I1243: 520.00 | J1243: -222.86 | K1243: 0 | L1243: =RC[-3]/100*RC[-1] -> 0.70
A1244: 17 | B1244: _SLT-004.06 | C1244: Палатка Tourist Sol | D1244: 43.50 | E1244: Инт | F1244: 2 | G1244: 609.00 | H1244: 0.70 | I1244: 1218.00 | J1244: -522.00 | K1244: 0 | L1244: =RC[-3]/100*RC[-1] -> 0.70
A1245: 18 | B1245: _SLT-005.06 | C1245: Палатка Wonder 2 Sol | D1245: 42.36 | E1245: Инт | F1245: 2 | G1245: 593.00 | H1245: 0.70 | I1245: 1186.00 | J1245: -508.28 | K1245: 0 | L1245: =RC[-3]/100*RC[-1] -> 0.70
A1246: 19 | B1246: _SLT-006.06 | C1246: Палатка Wonder 3 Sol | D1246: 47.36 | E1246: Инт | F1246: 2 | G1246: 663.00 | H1246: 0.70 | I1246: 1326.00 | J1246: -568.28 | K1246: 0 | L1246: =RC[-3]/100*RC[-1] -> 0.70
A1247: 20 | B1247: _TRG-004 | C1247: Плита газовая портативная TRAMP | D1247: 17.76 | E1247: Инт | F1247: 12 | G1247: 222.00 | H1247: 0.62 | I1247: 2664.00 | J1247: -1598.78 | K1247: 0 | L1247: =RC[-3]/100*RC[-1] -> 0.62
A1248: 21 | B1248: _TRG-006 | C1248: Плита газовая портативная TRAMP с переходником на большой баллон | D1248: 20.80 | E1248: Инт | F1248: 6 | G1248: 260.00 | H1248: 0.63 | I1248: 1560.00 | J1248: -936.00 | K1248: 0 | L1248: =RC[-3]/100*RC[-1] -> 0.63
A1249: 22 | B1249: SLI-011 | C1249: Подушка под шею SLI-011 | D1249: 2.88 | E1249: Инт | F1249: 5 | G1249: 36.00 | H1249: 0.63 | I1249: 180.00 | J1249: -108.00 | K1249: 0 | L1249: =RC[-3]/100*RC[-1] -> 0.63
A1250: 23 | B1250: TRG-017 | C1250: Резак газовый | D1250: 11.60 | E1250: Инт | F1250: 2 | G1250: 225.00 | H1250: 0.97 | I1250: 450.00 | J1250: -14.00 | K1250: 0 | L1250: =RC[-3]/100*RC[-1] -> 0.97
A1251: 24 | B1251: TRG-023 | C1251: Резак газовый | D1251: 6.64 | E1251: Инт | F1251: 3 | G1251: 77.50 | H1251: 0.58 | I1251: 232.50 | J1251: -165.90 | K1251: 0 | L1251: =RC[-3]/100*RC[-1] -> 0.58
A1252: 25 | B1252: TRG-029 | C1252: Резак газовый | D1252: 11.28 | E1252: Инт | F1252: 2 | G1252: 141.00 | H1252: 0.63 | I1252: 282.00 | J1252: -169.20 | K1252: 0 | L1252: =RC[-3]/100*RC[-1] -> 0.63
A1253: 26 | B1253: _TRP012.08 | C1253: Рюкзак ULTRA | D1253: 5.31 | E1253: Инт | F1253: 5 | G1253: 77.00 | H1253: 0.73 | I1253: 385.00 | J1253: -146.03 | K1253: 0 | L1253: =RC[-3]/100*RC[-1] -> 0.73
A1254: 27 | B1254: _TRS 010.02 | C1254: Спальный мешок SIBERIA 7000 | D1254: 38.11 | E1254: Инт | F1254: 2 | G1254: 533.60 | H1254: 0.70 | I1254: 1067.20 | J1254: -457.37 | K1254: 0 | L1254: =RC[-3]/100*RC[-1] -> 0.70
A1255: 28 | B1255: _TRS 020.02 | C1255: Спальный мешок SIBERIA 7000 XXL | D1255: 42.00 | E1255: Инт | F1255: 4 | G1255: 588.00 | H1255: 0.70 | I1255: 2352.00 | J1255: -1008.00 | K1255: 0 | L1255: =RC[-3]/100*RC[-1] -> 0.70
A1256: 29 | B1256: _TRC-008 | C1256: Термокружка TRAMP 225 мл | D1256: 4.64 | E1256: Инт | F1256: 5 | G1256: 58.00 | H1256: 0.63 | I1256: 290.00 | J1256: -174.00 | K1256: 0 | L1256: =RC[-3]/100*RC[-1] -> 0.63
A1257: 30 | B1257: _TRC-009 | C1257: Термокружка TRAMP 300 мл | D1257: 5.60 | E1257: Инт | F1257: 5 | G1257: 65.00 | H1257: 0.58 | I1257: 325.00 | J1257: -235.00 | K1257: 0 | L1257: =RC[-3]/100*RC[-1] -> 0.58
A1258: 31 | B1258: _TRC-045 | C1258: Термокружка TRAMP 320 мл, с крышкой и складными ручками | D1258: 6.40 | E1258: Инт | F1258: 5 | G1258: 75.00 | H1258: 0.59 | I1258: 375.00 | J1258: -265.00 | K1258: 0 | L1258: =RC[-3]/100*RC[-1] -> 0.59
A1259: 32 | B1259: _TRC-010 | C1259: Термокружка TRAMP 450 мл | D1259: 6.96 | E1259: Инт | F1259: 5 | G1259: 81.00 | H1259: 0.58 | I1259: 405.00 | J1259: -291.00 | K1259: 0 | L1259: =RC[-3]/100*RC[-1] -> 0.58
A1260: 33 | B1260: _TRC-031 | C1260: Термос TRAMP 0,75 л | D1260: 12.65 | E1260: usd | F1260: 5 | G1260: 153.00 | H1260: 0.60 | I1260: 765.00 | J1260: -500.00 | K1260: 0 | L1260: =RC[-3]/100*RC[-1] -> 0.60
A1261: 34 | B1261: _TRC-027 | C1261: Термос TRAMP 0,9 л | D1261: 13.79 | E1261: usd | F1261: 5 | G1261: 167.00 | H1261: 0.61 | I1261: 835.00 | J1261: -544.00 | K1261: 0 | L1261: =RC[-3]/100*RC[-1] -> 0.61
A1262: 35 | B1262: _TRC-028 | C1262: Термос TRAMP 1,2 л | D1262: 16.61 | E1262: usd | F1262: 5 | G1262: 201.00 | H1262: 0.61 | I1262: 1005.00 | J1262: -656.00 | K1262: 0 | L1262: =RC[-3]/100*RC[-1] -> 0.61
A1263: 36 | B1263: _TRC-029 | C1263: Термос TRAMP 1,6 л | D1263: 19.97 | E1263: usd | F1263: 5 | G1263: 242.00 | H1263: 0.61 | I1263: 1210.00 | J1263: -787.00 | K1263: 0 | L1263: =RC[-3]/100*RC[-1] -> 0.61 | M1263: =SUM(R[-36]C[-1]:RC[-1]) -> 
A1265: #4060 (2014-05-12) Fiskars - Прихід товару
A1266: N | B1266: арт | C1266: назва | D1266: закуп | F1266: к-ть | G1266: цiна | H1266: кф | I1266: продж | J1266: дохiд | K1266: % | L1266: з-та
A1267: 1 | B1267: 125860 | C1267: Нож FISKARS | D1267: 5.79 | E1267: Инт | F1267: 2 | G1267: 105.00 | H1267: 0.91 | I1267: 210.00 | J1267: -21.72 | K1267: 0 | L1267: =RC[-3]/100*RC[-1] -> 0.91
A1268: 2 | B1268: 121420 | C1268: Топор FISKARS для кемпинга Х7 | D1268: 23.86 | E1268: Инт | F1268: 2 | G1268: 450.00 | H1268: 0.94 | I1268: 900.00 | J1268: -54.48 | K1268: 0 | L1268: =RC[-3]/100*RC[-1] -> 0.94
A1269: 3 | B1269: 122480 | C1269: Топор FISKARS колун Х25 | D1269: 62.48 | E1269: Инт | F1269: 2 | G1269: 899.50 | H1269: 0.72 | I1269: 1799.00 | J1269: -700.31 | K1269: 0 | L1269: =RC[-3]/100*RC[-1] -> 0.72 | M1269: =SUM(R[-3]C[-1]:RC[-1]) -> 
A1271: #4066 (2014-05-12) Станислав. Харьков - Прихід товару
A1272: N | B1272: арт | C1272: назва | D1272: закуп | F1272: к-ть | G1272: цiна | H1272: кф | I1272: продж | J1272: дохiд | K1272: % | L1272: з-та
A1273: 1 | B1273: X401 | C1273: Балаклава чёрная с 1-м отв.(100%хлопок) ||X7601 | D1273: 3.15 | E1273: Инт | F1273: 350 | G1273: 45.00 | H1273: 0.71 | I1273: 15750.00 | J1273: -6300.00 | K1273: 0 | L1273: =RC[-3]/100*RC[-1] -> 0.71
A1274: 2 | B1274: X4011 | C1274: Балаклава чёрная с 1-м отв. нинзя(100%хлопок) ||X76011 | D1274: 3.15 | E1274: Инт | F1274: 360 | G1274: 45.00 | H1274: 0.71 | I1274: 16200.00 | J1274: -6480.00 | K1274: 0 | L1274: =RC[-3]/100*RC[-1] -> 0.71 | M1274: =SUM(R[-2]C[-1]:RC[-1]) -> 
A1276: #4154 (2014-05-14) Львів Назар Максимович - Прихід товару
A1277: N | B1277: арт | C1277: назва | D1277: закуп | F1277: к-ть | G1277: цiна | H1277: кф | I1277: продж | J1277: дохiд | K1277: % | L1277: з-та
A1278: 1 | B1278: _K780000T | C1278: Нож Viking Norway Birynkov desing | D1278: 30.72 | E1278: Инт | F1278: 2 | G1278: 384.00 | H1278: 0.63 | I1278: 768.00 | J1278: -460.80 | K1278: 0 | L1278: =RC[-3]/100*RC[-1] -> 0.63
A1279: 2 | B1279: _1684 | C1279: Патрон Флобера 4мм Нобель | D1279: 0.20 | E1279: Инт | F1279: 1000 | G1279: 2.70 | H1279: 0.66 | I1279: 2700.00 | J1279: -1371.42 | K1279: 0 | L1279: =RC[-3]/100*RC[-1] -> 0.66
A1280: 3 | B1280: _273-1200 | C1280: Пістолет пневматичний SAS Makarov PM | D1280: 40.84 | E1280: Инт | F1280: 12 | G1280: 540.00 | H1280: 0.66 | I1280: 6480.00 | J1280: -3321.60 | K1280: 0 | L1280: =RC[-3]/100*RC[-1] -> 0.66
A1281: 4 | B1281: _3680.00.02 | C1281: Револьвер под патрон Флобера STALKER 4мм 4.5" syntetic | D1281: 75.00 | E1281: Инт | F1281: 2 | G1281: 1050.00 | H1281: 0.70 | I1281: 2100.00 | J1281: -900.00 | K1281: 0 | L1281: =RC[-3]/100*RC[-1] -> 0.70
A1282: 5 | B1282: _3680.00.03 | C1282: Револьвер под патрон Флобера STALKER 4мм 4.5" wood | D1282: 75.00 | E1282: Инт | F1282: 2 | G1282: 1050.00 | H1282: 0.70 | I1282: 2100.00 | J1282: -900.00 | K1282: 0 | L1282: =RC[-3]/100*RC[-1] -> 0.70
A1283: 6 | B1283: _3680.00.05 | C1283: Револьвер под патрон Флобера STALKER Titanium 4мм 4.5" wood | D1283: 75.00 | E1283: Инт | F1283: 2 | G1283: 1050.00 | H1283: 0.70 | I1283: 2100.00 | J1283: -900.00 | K1283: 0 | L1283: =RC[-3]/100*RC[-1] -> 0.70
A1284: 7 | B1284: _372-1505 | C1284: Револьвер под патрон Флобера STALKER Titanium 4мм 2.5" syntetic | D1284: 72.86 | E1284: Инт | F1284: 2 | G1284: 1020.00 | H1284: 0.70 | I1284: 2040.00 | J1284: -874.28 | K1284: 0 | L1284: =RC[-3]/100*RC[-1] -> 0.70
A1285: 8 | B1285: _372-1506 | C1285: Револьвер под патрон Флобера STALKER Titanium 4мм 2.5" wood | D1285: 72.86 | E1285: Инт | F1285: 2 | G1285: 1020.00 | H1285: 0.70 | I1285: 2040.00 | J1285: -874.28 | K1285: 0 | L1285: =RC[-3]/100*RC[-1] -> 0.70 | M1285: =SUM(R[-8]C[-1]:RC[-1]) -> 
A1287: #4163 (2014-05-14) Львів Назар Максимович - Прихід товару
A1288: N | B1288: арт | C1288: назва | D1288: закуп | F1288: к-ть | G1288: цiна | H1288: кф | I1288: продж | J1288: дохiд | K1288: % | L1288: з-та
A1289: 1 | B1289: _200116 | C1289: Стульчик со спинкой алюминиевый Legend Fishing Gear | D1289: 11.60 | E1289: Инт | F1289: 3 | G1289: 145.00 | H1289: 0.63 | I1289: 435.00 | J1289: -261.00 | K1289: 0 | L1289: =RC[-3]/100*RC[-1] -> 0.63
A1290: 2 | B1290: _200120 | C1290: Стульчик-табурет алюминиевый Legend Fishing Gear | D1290: 8.72 | E1290: Инт | F1290: 3 | G1290: 109.00 | H1290: 0.63 | I1290: 327.00 | J1290: -196.20 | K1290: 0 | L1290: =RC[-3]/100*RC[-1] -> 0.63 | M1290: =SUM(R[-2]C[-1]:RC[-1]) -> 
A1292: #4289 (2014-05-19) Станислав. Харьков - Прихід товару
A1293: N | B1293: арт | C1293: назва | D1293: закуп | F1293: к-ть | G1293: цiна | H1293: кф | I1293: продж | J1293: дохiд | K1293: % | L1293: з-та
A1294: 1 | B1294: X4041 | C1294: Балаклава дубок с 1-м отв. нинзя (100%хлопок) ||X7600 | D1294: 3.15 | E1294: Инт | F1294: 217 | G1294: 35.00 | H1294: 0.56 | I1294: 7595.00 | J1294: -6076.00 | K1294: 0 | L1294: =RC[-3]/100*RC[-1] -> 0.56
A1295: 2 | B1295: X4021 | C1295: Балаклава олива с 1-м отв. нинзя (100%хлопок) ||X76012 | D1295: 3.15 | E1295: Инт | F1295: 214 | G1295: 35.00 | H1295: 0.56 | I1295: 7490.00 | J1295: -5992.00 | K1295: 0 | L1295: =RC[-3]/100*RC[-1] -> 0.56
A1296: 3 | B1296: X402 | C1296: Балаклава олива с 1-м отв.(100%хлопок) ||X76012 | D1296: 3.15 | E1296: Инт | F1296: 66 | G1296: 35.00 | H1296: 0.56 | I1296: 2310.00 | J1296: -1848.00 | K1296: 0 | L1296: =RC[-3]/100*RC[-1] -> 0.56
A1297: 4 | B1297: X4011 | C1297: Балаклава чёрная с 1-м отв. нинзя(100%хлопок) ||X76011 | D1297: 3.15 | E1297: Инт | F1297: 100 | G1297: 45.00 | H1297: 0.71 | I1297: 4500.00 | J1297: -1800.00 | K1297: 0 | L1297: =RC[-3]/100*RC[-1] -> 0.71
A1298: 5 | B1298: X401 | C1298: Балаклава чёрная с 1-м отв.(100%хлопок) ||X7601 | D1298: 3.15 | E1298: Инт | F1298: 190 | G1298: 45.00 | H1298: 0.71 | I1298: 8550.00 | J1298: -3420.00 | K1298: 0 | L1298: =RC[-3]/100*RC[-1] -> 0.71 | M1298: =SUM(R[-5]C[-1]:RC[-1]) -> 
A1300: #4296 (2014-05-19) Radioprofi - Прихід товару
A1301: N | B1301: арт | C1301: назва | D1301: закуп | F1301: к-ть | G1301: цiна | H1301: кф | I1301: продж | J1301: дохiд | K1301: % | L1301: з-та
A1302: 1 | B1302: _26-0696 | C1302: Рация PUXING PX-2R 400-470МГц, 3Вт, FM | D1302: 52.80 | E1302: usd | F1302: 50 | G1302: 1250.00 | H1302: 1.18 | I1302: 62500.00 | J1302: 9700.00 | K1302: 0 | L1302: =RC[-3]/100*RC[-1] -> 1.18
A1303: 2 | B1303: 26-0710 | C1303: Рация VOYAGER AirSoft (136-174 / 400-470)МГц, 5Вт,2200mAp Li-ion (+гарнітура) | D1303: 85.00 | E1303: usd | F1303: 30 | G1303: 1850.00 | H1303: 1.09 | I1303: 55500.00 | J1303: 4500.00 | K1303: 0 | L1303: =RC[-3]/100*RC[-1] -> 1.09 | M1303: =SUM(R[-2]C[-1]:RC[-1]) -> 
A1305: #4360 (2014-05-21) Федик Тарас - Прихід товару
A1306: N | B1306: арт | C1306: назва | D1306: закуп | F1306: к-ть | G1306: цiна | H1306: кф | I1306: продж | J1306: дохiд | K1306: % | L1306: з-та
A1307: 1 | B1307: _T4060 | C1307: Тент TRAMP (4х6м) | D1307: 37.36 | E1307: Инт | F1307: 5 | G1307: 523.00 | H1307: 0.70 | I1307: 2615.00 | J1307: -1120.71 | K1307: 0 | L1307: =RC[-3]/100*RC[-1] -> 0.70 | M1307: =SUM(R[-1]C[-1]:RC[-1]) -> 
A1309: #4362 (2014-05-21) Львів Назар Максимович - Прихід товару
A1310: N | B1310: арт | C1310: назва | D1310: закуп | F1310: к-ть | G1310: цiна | H1310: кф | I1310: продж | J1310: дохiд | K1310: % | L1310: з-та
A1311: 1 | B1311: _508882-1 | C1311: Очки антифары Marksmen с чехлом | D1311: 7.42 | E1311: Инт | F1311: 10 | G1311: 89.00 | H1311: 0.60 | I1311: 890.00 | J1311: -593.33 | K1311: 0 | L1311: =RC[-3]/100*RC[-1] -> 0.60
A1312: 2 | B1312: _508882-2 | C1312: Очки антифары Marksmen с чехлом | D1312: 7.42 | E1312: Инт | F1312: 9 | G1312: 89.00 | H1312: 0.60 | I1312: 801.00 | J1312: -534.00 | K1312: 0 | L1312: =RC[-3]/100*RC[-1] -> 0.60
A1313: 3 | B1313: _508882-3 | C1313: Очки антифары Marksmen с чехлом | D1313: 7.42 | E1313: Инт | F1313: 4 | G1313: 89.00 | H1313: 0.60 | I1313: 356.00 | J1313: -237.33 | K1313: 0 | L1313: =RC[-3]/100*RC[-1] -> 0.60
A1314: 4 | B1314: _508882-4 | C1314: Очки антифары Marksmen с чехлом | D1314: 7.42 | E1314: Инт | F1314: 3 | G1314: 89.00 | H1314: 0.60 | I1314: 267.00 | J1314: -178.00 | K1314: 0 | L1314: =RC[-3]/100*RC[-1] -> 0.60
A1315: 5 | B1315: _508882-5 | C1315: Очки антифары Marksmen с чехлом | D1315: 7.42 | E1315: Инт | F1315: 4 | G1315: 89.00 | H1315: 0.60 | I1315: 356.00 | J1315: -237.33 | K1315: 0 | L1315: =RC[-3]/100*RC[-1] -> 0.60 | M1315: =SUM(R[-5]C[-1]:RC[-1]) -> 
A1317: #4542 (2014-05-27) Львів Назар Максимович - Прихід товару
A1318: N | B1318: арт | C1318: назва | D1318: закуп | F1318: к-ть | G1318: цiна | H1318: кф | I1318: продж | J1318: дохiд | K1318: % | L1318: з-та
A1319: 1 | B1319: _18-0300 | C1319: Моноблок високий 11/25.4/25 | D1319: 5.00 | E1319: Инт | F1319: 10 | G1319: 78.65 | H1319: 0.79 | I1319: 786.50 | J1319: -213.50 | K1319: 0 | L1319: =RC[-3]/100*RC[-1] -> 0.79
A1320: 2 | B1320: _273-1294 | C1320: Пистолет пневматический SAS 24/7 | D1320: 33.86 | E1320: Инт | F1320: 6 | G1320: 474.00 | H1320: 0.70 | I1320: 2844.00 | J1320: -1218.85 | K1320: 0 | L1320: =RC[-3]/100*RC[-1] -> 0.70
A1321: 3 | B1321: _273-1262 | C1321: Пистолет пневматический SAS Jerico 941 | D1321: 46.79 | E1321: Инт | F1321: 3 | G1321: 655.00 | H1321: 0.70 | I1321: 1965.00 | J1321: -842.14 | K1321: 0 | L1321: =RC[-3]/100*RC[-1] -> 0.70
A1322: 4 | B1322: _273-1240 | C1322: Пистолет пневматический SAS M1911Tactical (KM-77AHN) | D1322: 90.00 | E1322: Инт | F1322: 3 | G1322: 1260.00 | H1322: 0.70 | I1322: 3780.00 | J1322: -1620.00 | K1322: 0 | L1322: =RC[-3]/100*RC[-1] -> 0.70
A1323: 5 | B1323: _273-1285 | C1323: Пистолет пневматический SAS MP40 ( KM-48HN ) | D1323: 33.86 | E1323: Инт | F1323: 6 | G1323: 474.00 | H1323: 0.70 | I1323: 2844.00 | J1323: -1218.85 | K1323: 0 | L1323: =RC[-3]/100*RC[-1] -> 0.70
A1324: 6 | B1324: _273-1293 | C1324: Пистолет пневматический SAS PT99 ( KMB-15AHNS ) | D1324: 81.36 | E1324: Инт | F1324: 3 | G1324: 1139.00 | H1324: 0.70 | I1324: 3417.00 | J1324: -1464.60 | K1324: 0 | L1324: =RC[-3]/100*RC[-1] -> 0.70
A1325: 7 | B1325: _273-1284 | C1325: Пистолет пневматический SAS Pro 2022 (KM-47HN) | D1325: 33.86 | E1325: Инт | F1325: 6 | G1325: 474.00 | H1325: 0.70 | I1325: 2844.00 | J1325: -1218.85 | K1325: 0 | L1325: =RC[-3]/100*RC[-1] -> 0.70
A1326: 8 | B1326: _18913 | C1326: Пистолет сигнальный EKOL Major (хром) | D1326: 57.86 | E1326: Инт | F1326: 2 | G1326: 810.00 | H1326: 0.70 | I1326: 1620.00 | J1326: -694.28 | K1326: 0 | L1326: =RC[-3]/100*RC[-1] -> 0.70
A1327: 9 | B1327: _N254-2542 | C1327: Пулеуловитель | D1327: 3.82 | E1327: Инт | F1327: 3 | G1327: 42.00 | H1327: 0.55 | I1327: 126.00 | J1327: -103.09 | K1327: 0 | L1327: =RC[-3]/100*RC[-1] -> 0.55
A1328: 10 | B1328: _KWC-0548 | C1328: Пістолет пневматичний KWC PM (KM-44 DHN) | D1328: 41.70 | E1328: Инт | F1328: 5 | G1328: 558.00 | H1328: 0.67 | I1328: 2790.00 | J1328: -1380.00 | K1328: 0 | L1328: =RC[-3]/100*RC[-1] -> 0.67
A1329: 11 | B1329: _N150-150 | C1329: Стульчик-табурет алюминиевый к 150 кг | D1329: 12.00 | E1329: Инт | F1329: 3 | G1329: 150.00 | H1329: 0.63 | I1329: 450.00 | J1329: -270.00 | K1329: 0 | L1329: =RC[-3]/100*RC[-1] -> 0.63
A1330: 12 | B1330: _N254-2543 | C1330: Термоодеяло | D1330: 2.73 | E1330: Инт | F1330: 3 | G1330: 30.25 | H1330: 0.55 | I1330: 90.75 | J1330: -73.05 | K1330: 0 | L1330: =RC[-3]/100*RC[-1] -> 0.55
A1331: 13 | B1331: _500SH-1 | C1331: Шарік "Шаровая молния" 4.5мм 0.57г (500шт) | D1331: 1.18 | E1331: Инт | F1331: 50 | G1331: 13.00 | H1331: 0.55 | I1331: 650.00 | J1331: -531.82 | K1331: 0 | L1331: =RC[-3]/100*RC[-1] -> 0.55
A1332: 14 | B1332: _2317322 | C1332: Патрон шумовой 9мм OZKURSAN | D1332: 0.33 | E1332: Инт | F1332: 250 | G1332: 4.60 | H1332: 0.70 | I1332: 1150.00 | J1332: -500.00 | K1332: 0 | L1332: =RC[-3]/100*RC[-1] -> 0.70 | M1332: =SUM(R[-14]C[-1]:RC[-1]) -> 
A1334: #4559 (2014-05-27) Львів Назар Максимович - Прихід товару
A1335: N | B1335: арт | C1335: назва | D1335: закуп | F1335: к-ть | G1335: цiна | H1335: кф | I1335: продж | J1335: дохiд | K1335: % | L1335: з-та
A1336: 1 | B1336: _C101 | C1336: Пистолет пневматичний CROSMAN C-TT | D1336: 63.14 | E1336: Инт | F1336: 5 | G1336: 884.00 | H1336: 0.70 | I1336: 4420.00 | J1336: -1894.29 | K1336: 0 | L1336: =RC[-3]/100*RC[-1] -> 0.70
A1337: 2 | B1337: _83083 | C1337: Пульки Maksnipe кал. 4.5мм (1000шт) 0.825гр | D1337: 19.91 | E1337: Инт | F1337: 13 | G1337: 219.00 | H1337: 0.55 | I1337: 2847.00 | J1337: -2329.60 | K1337: 0 | L1337: =RC[-3]/100*RC[-1] -> 0.55
A1338: 3 | B1338: _N254-2543 | C1338: Термоодеяло | D1338: 2.73 | E1338: Инт | F1338: 30 | G1338: 30.25 | H1338: 0.55 | I1338: 907.50 | J1338: -730.50 | K1338: 0 | L1338: =RC[-3]/100*RC[-1] -> 0.55 | M1338: =SUM(R[-3]C[-1]:RC[-1]) -> 
A1340: #4566 (2014-05-27) Акрополіс - Прихід товару
A1341: N | B1341: арт | C1341: назва | D1341: закуп | F1341: к-ть | G1341: цiна | H1341: кф | I1341: продж | J1341: дохiд | K1341: % | L1341: з-та
A1342: 1 | B1342: A19-126 | C1342: Ключниця ACROPOLIS ||АШ-1 | D1342: 96.00 | E1342: грн | F1342: 3 | G1342: 96.00 | H1342: 1.00 | I1342: 244.80 | J1342: -43.20 | K1342: 0 | L1342: =RC[-3]/100*RC[-1] -> 1.00
A1343: 2 | B1343: A19-174/L | C1343: Футболка охотничья ACROPOLIS ||ОФМ/L | D1343: 55.25 | E1343: грн | F1343: 2 | G1343: 65.04 | H1343: 1.18 | I1343: 130.08 | J1343: 19.58 | K1343: 0 | L1343: =RC[-3]/100*RC[-1] -> 1.18
A1344: 3 | B1344: A19-174/M | C1344: Футболка охотничья ACROPOLIS ||ОФМ/M | D1344: 55.28 | E1344: грн | F1344: 2 | G1344: 65.04 | H1344: 1.18 | I1344: 130.08 | J1344: 19.52 | K1344: 0 | L1344: =RC[-3]/100*RC[-1] -> 1.18
A1345: 4 | B1345: A19-174/XL | C1345: Футболка охотничья ACROPOLIS ||ОФМ/XL | D1345: 55.28 | E1345: грн | F1345: 2 | G1345: 65.04 | H1345: 1.18 | I1345: 130.08 | J1345: 19.52 | K1345: 0 | L1345: =RC[-3]/100*RC[-1] -> 1.18
A1346: 5 | B1346: A19-174/XXL | C1346: Футболка охотничья ACROPOLIS ||ОФМ/XXL | D1346: 65.04 | E1346: грн | F1346: 2 | G1346: 65.04 | H1346: 1.00 | I1346: 130.08 | J1346: 0.00 | K1346: 0 | L1346: =RC[-3]/100*RC[-1] -> 1.00
A1347: 6 | B1347: A19-44 | C1347: Футляр (L-110) ACROPOLIS ||ФЗ-7/30 | D1347: 665.00 | E1347: грн | F1347: 2 | G1347: 782.00 | H1347: 1.18 | I1347: 1329.40 | J1347: -0.60 | K1347: 0 | L1347: =RC[-3]/100*RC[-1] -> 1.18
A1348: 7 | B1348: A19-123 | C1348: Футляр для винтовки ACROPOLIS ||ФЗ-8а | D1348: 460.70 | E1348: грн | F1348: 1 | G1348: 493.00 | H1348: 1.07 | I1348: 419.05 | J1348: -41.65 | K1348: 0 | L1348: =RC[-3]/100*RC[-1] -> 1.07
A1349: 8 | B1349: A19-77 | C1349: Чохол для оружия (L-108) ACROPOLIS ||ЧДЗ-2 | D1349: 129.00 | E1349: грн | F1349: 4 | G1349: 132.00 | H1349: 1.02 | I1349: 448.80 | J1349: -67.20 | K1349: 0 | L1349: =RC[-3]/100*RC[-1] -> 1.02
A1350: 9 | B1350: A19-168/25-27 | C1350: Носки охотничьи ACROPOLIS ||ШКМ-1/25-27 | D1350: 15.00 | E1350: грн | F1350: 5 | G1350: 15.00 | H1350: 1.00 | I1350: 75.00 | J1350: 0.00 | K1350: 0 | L1350: =RC[-3]/100*RC[-1] -> 1.00
A1351: 10 | B1351: A19-168/27-29 | C1351: Носки охотничьи ACROPOLIS ||ШКМ-1/27-29 | D1351: 15.00 | E1351: грн | F1351: 5 | G1351: 15.00 | H1351: 1.00 | I1351: 75.00 | J1351: 0.00 | K1351: 0 | L1351: =RC[-3]/100*RC[-1] -> 1.00
A1352: 11 | B1352: A19-168/31-33 | C1352: Носки охотничьи ACROPOLIS ||ШКМ-1/31-33 | D1352: 15.00 | E1352: грн | F1352: 5 | G1352: 15.00 | H1352: 1.00 | I1352: 75.00 | J1352: 0.00 | K1352: 0 | L1352: =RC[-3]/100*RC[-1] -> 1.00 | M1352: =SUM(R[-11]C[-1]:RC[-1]) -> 