Sheet:  name
D1: Вхiднi данi | H1: Зкореговано
C2: Закуп: | D2: 13951 | G2: грн
C3: Продано: | D3: 25928 | G3: грн
C4: Дохiд-Коефiцiент: | D4: 11976(1.86)
C5: Процент з-ти: | D5: 5 | G5: %
C6: Нараховано з-ти: | D6: 1296.38 | G6: грн | H6: =SUM(R[4]C[4]:R[132]C[4]) -> 
B7: курси: Все 0 , грн 1 , usd 20 , euro 25 , zl 5 , Инт 20 ,
A9: #11576 (2015-01-09) Шевчук Олександр Миколайович - Відправлено-Продано
A10: N | B10: арт | C10: назва | D10: закуп | F10: к-ть | G10: цiна | H10: кф | I10: продж | J10: дохiд | K10: % | L10: з-та
A11: 1 | B11: H4714/LL | C11: US ACU штаны мультикам (PolyCotton) ||SP-ACU-PR-14 | D11: 23.03 | E11: usd | F11: 1 | G11: 1013.00 | H11: 2.20 | I11: 1013.00 | J11: 552.40 | K11: 5 | L11: =RC[-3]/100*RC[-1] -> 2.20
A12: 2 | B12: H47141/LR | C12: US ACU китель мультикам (NYCO R/S) ||BL-ACU-PR-14 | D12: 23.03 | E12: usd | F12: 1 | G12: 1013.00 | H12: 2.20 | I12: 1013.00 | J12: 552.40 | K12: 5 | L12: =RC[-3]/100*RC[-1] -> 2.20 | M12: =SUM(R[-2]C[-1]:RC[-1]) -> 
A14: #11588 (2015-01-09) Мацык Сергей Александрович - Відправлено-Продано
A15: N | B15: арт | C15: назва | D15: закуп | F15: к-ть | G15: цiна | H15: кф | I15: продж | J15: дохiд | K15: % | L15: з-та
A16: 1 | B16: H2014/M | C16: Куртка LIBERTY флисовая мультикам 390г/м (superfine) ||BL-LIB-HF-14 | D16: 31.00 | E16: usd | F16: 1 | G16: 1364.00 | H16: 2.20 | I16: 1264.52 | J16: 644.52 | K16: 5 | L16: =RC[-3]/100*RC[-1] -> 2.20
A17: 2 | B17: H7911 | C17: Шапка флисовая койот ||CZ-DOK-FL-11 | D17: 2.00 | E17: usd | F17: 1 | G17: 100.00 | H17: 2.50 | I17: 100.00 | J17: 60.00 | K17: 5 | L17: =RC[-3]/100*RC[-1] -> 2.50 | M17: =SUM(R[-2]C[-1]:RC[-1]) -> 
A19: #11604 (2015-01-11) Дехтяр Андрій Олександрович - Відправлено-Продано
A20: N | B20: арт | C20: назва | D20: закуп | F20: к-ть | G20: цiна | H20: кф | I20: продж | J20: дохiд | K20: % | L20: з-та
A21: 1 | B21: K13192-O | C21: Подсумок магазинный двойной к P-90 олива [A.C.M] ||M51613192-OD | D21: 6.06 | E21: usd | F21: 1 | G21: 267.00 | H21: 2.20 | I21: 267.00 | J21: 145.80 | K21: 5 | L21: =RC[-3]/100*RC[-1] -> 2.20
A22: 2 | B22: K5-1022 | C22: Магазин страйкбольный механический к P-90 | D22: 6.52 | E22: usd | F22: 1 | G22: 233.00 | H22: 1.79 | I22: 233.00 | J22: 102.60 | K22: 5 | L22: =RC[-3]/100*RC[-1] -> 1.79 | M22: =SUM(R[-2]C[-1]:RC[-1]) -> 
A24: #11606 (2015-01-11) Гордиенко Аркадий Викторович - Відправлено-Продано
A25: N | B25: арт | C25: назва | D25: закуп | F25: к-ть | G25: цiна | H25: кф | I25: продж | J25: дохiд | K25: % | L25: з-та
A26: 1 | B26: _16172 | C26: Шарики BB 6мм 0,20x6000 [BLASTER-DEVIL] - бутылка | D26: 34.14 | E26: zl | F26: 1 | G26: 180.00 | H26: 1.05 | I26: 180.00 | J26: 9.30 | K26: 5 | L26: =RC[-3]/100*RC[-1] -> 1.05 | M26: =SUM(R[-1]C[-1]:RC[-1]) -> 
A28: #11607 (2015-01-11) Антонюк Ирина Васильевна - Відправлено-Продано
A29: N | B29: арт | C29: назва | D29: закуп | F29: к-ть | G29: цiна | H29: кф | I29: продж | J29: дохiд | K29: % | L29: з-та
A30: 1 | B30: A19-204/44 | C30: Ботинки ACROPOLIS зелёные (овчина) | D30: 1700.00 | E30: грн | F30: 1 | G30: 2856.00 | H30: 1.68 | I30: 2856.00 | J30: 1156.00 | K30: 5 | L30: =RC[-3]/100*RC[-1] -> 1.68 | M30: =SUM(R[-1]C[-1]:RC[-1]) -> 
A32: #11629 (2015-01-12) Стамбул Андрей Васильевич - Відправлено-Продано
A33: N | B33: арт | C33: назва | D33: закуп | F33: к-ть | G33: цiна | H33: кф | I33: продж | J33: дохiд | K33: % | L33: з-та
A34: 1 | B34: H9001/120 | C34: Ремень ARMY BELT чёрный ||PS-ARM-CO-01 | D34: 4.23 | E34: usd | F34: 1 | G34: 193.00 | H34: 2.28 | I34: 193.00 | J34: 108.40 | K34: 5 | L34: =RC[-3]/100*RC[-1] -> 2.28
A35: 2 | B35: H9013/120 | C35: Ремень ARMY BELT хаки ||PS-ARM-CO-13 | D35: 4.23 | E35: usd | F35: 1 | G35: 193.00 | H35: 2.28 | I35: 193.00 | J35: 108.40 | K35: 5 | L35: =RC[-3]/100*RC[-1] -> 2.28 | M35: =SUM(R[-2]C[-1]:RC[-1]) -> 
A37: #11631 (2015-01-13) Сусский Е.А. - Відправлено-Продано
A38: N | B38: арт | C38: назва | D38: закуп | F38: к-ть | G38: цiна | H38: кф | I38: продж | J38: дохiд | K38: % | L38: з-та
A39: 1 | B39: H55141/L | C39: Куртка SOLDIER-2008 мультикам (PolyCotton) ||KU-FP8-PR-14 | D39: 45.71 | E39: usd | F39: 1 | G39: 2011.00 | H39: 2.20 | I39: 2011.00 | J39: 1096.80 | K39: 5 | L39: =RC[-3]/100*RC[-1] -> 2.20 | M39: =SUM(R[-1]C[-1]:RC[-1]) -> 
A41: #11649 (2015-01-13) Деньгуб Владимир Владимирович - Відправлено-Продано
A42: N | B42: арт | C42: назва | D42: закуп | F42: к-ть | G42: цiна | H42: кф | I42: продж | J42: дохiд | K42: % | L42: з-та
A43: 1 | B43: _16171 | C43: Шарики BB 6мм 0,20x3000 [BLASTER-DEVIL] бутылка | D43: 18.11 | E43: zl | F43: 1 | G43: 90.00 | H43: 0.99 | I43: 90.00 | J43: -0.55 | K43: 5 | L43: =RC[-3]/100*RC[-1] -> 0.99 | M43: =SUM(R[-1]C[-1]:RC[-1]) -> 
A45: #11672 (2015-01-15) Рябоконь Михаил Владимирович - Відправлено-Продано
A46: N | B46: арт | C46: назва | D46: закуп | F46: к-ть | G46: цiна | H46: кф | I46: продж | J46: дохiд | K46: % | L46: з-та
A47: 1 | B47: H3011/XXL | C47: Рубашка DEFENDER длинный рукав койот ||KO-DEF-CO-11 | D47: 19.76 | E47: usd | F47: 1 | G47: 869.00 | H47: 2.20 | I47: 869.00 | J47: 473.90 | K47: 5 | L47: =RC[-3]/100*RC[-1] -> 2.20 | M47: =SUM(R[-1]C[-1]:RC[-1]) -> 
A49: #11682 (2015-01-15) Ланчук Олександр Николаевич - Відправлено-Продано
A50: N | B50: арт | C50: назва | D50: закуп | F50: к-ть | G50: цiна | H50: кф | I50: продж | J50: дохiд | K50: % | L50: з-та
A51: 1 | B51: M800332/45 | C51: Берцы MAGNUM Precision Ultra Lite CT WPI Wide | D51: 53.25 | E51: usd | F51: 1 | G51: 1887.00 | H51: 1.77 | I51: 1887.00 | J51: 822.00 | K51: 5 | L51: =RC[-3]/100*RC[-1] -> 1.77 | M51: =SUM(R[-1]C[-1]:RC[-1]) -> 
A53: #11688 (2015-01-15) Іван Перегенський Іванович - Відправлено-Продано
A54: N | B54: арт | C54: назва | D54: закуп | F54: к-ть | G54: цiна | H54: кф | I54: продж | J54: дохiд | K54: % | L54: з-та
A55: 1 | B55: _16172 | C55: Шарики BB 6мм 0,20x6000 [BLASTER-DEVIL] - бутылка | D55: 34.14 | E55: zl | F55: 5 | G55: 180.00 | H55: 1.05 | I55: 900.00 | J55: 46.50 | K55: 5 | L55: =RC[-3]/100*RC[-1] -> 1.05
A56: 2 | B56: _16172 | C56: Шарики BB 6мм 0,20x6000 [BLASTER-DEVIL] - бутылка | D56: 34.14 | E56: zl | F56: 2 | G56: 180.00 | H56: 1.05 | I56: 360.00 | J56: 18.60 | K56: 5 | L56: =RC[-3]/100*RC[-1] -> 1.05 | M56: =SUM(R[-2]C[-1]:RC[-1]) -> 
A58: #11694 (2015-01-15) Яшанов Максим Сергеевич - Відправлено-Продано
A59: N | B59: арт | C59: назва | D59: закуп | F59: к-ть | G59: цiна | H59: кф | I59: продж | J59: дохiд | K59: % | L59: з-та
A60: 1 | B60: H7901 | C60: Шапка флисовая чёрная ||CZ-DOK-FL-01 | D60: 2.00 | E60: usd | F60: 1 | G60: 100.00 | H60: 2.50 | I60: 100.00 | J60: 60.00 | K60: 5 | L60: =RC[-3]/100*RC[-1] -> 2.50
A61: 2 | B61: H7911 | C61: Шапка флисовая койот ||CZ-DOK-FL-11 | D61: 2.00 | E61: usd | F61: 1 | G61: 100.00 | H61: 2.50 | I61: 100.00 | J61: 60.00 | K61: 5 | L61: =RC[-3]/100*RC[-1] -> 2.50
A62: 3 | B62: _703025-G | C62: Перчатки флисовые серые | D62: 1.78 | E62: Инт | F62: 1 | G62: 61.00 | H62: 1.71 | I62: 61.00 | J62: 25.40 | K62: 5 | L62: =RC[-3]/100*RC[-1] -> 1.71 | M62: =SUM(R[-3]C[-1]:RC[-1]) -> 
A64: #11702 (2015-01-16) Запорожец Евгений - Відправлено-Продано
A65: N | B65: арт | C65: назва | D65: закуп | F65: к-ть | G65: цiна | H65: кф | I65: продж | J65: дохiд | K65: % | L65: з-та
A66: 1 | B66: M800114/47 | C66: Берцы MAGNUM Elite Spider 8.0(EU) Desert | D66: 47.75 | E66: usd | F66: 1 | G66: 1680.00 | H66: 1.76 | I66: 1680.00 | J66: 725.00 | K66: 5 | L66: =RC[-3]/100*RC[-1] -> 1.76 | M66: =SUM(R[-1]C[-1]:RC[-1]) -> 
A68: #11715 (2015-01-17) Поезд Владимир Петрович - Відправлено-Продано
A69: N | B69: арт | C69: назва | D69: закуп | F69: к-ть | G69: цiна | H69: кф | I69: продж | J69: дохiд | K69: % | L69: з-та
A70: 1 | B70: K8-9606 | C70: Пістолет газопневматический страйкбольний (Green Gas) BERETTA M92F/M9 (ABS+метал) [KJW] ||GGB-9606 | D70: 35.22 | E70: usd | F70: 1 | G70: 1445.00 | H70: 2.05 | I70: 1445.00 | J70: 740.60 | K70: 5 | L70: =RC[-3]/100*RC[-1] -> 2.05
A71: 2 | B71: K4-2083 | C71: Винтовка электропневматическая страйкбольная AK105 (метал+металопласт) [Производитель: CYMA.031B] | D71: 86.85 | E71: usd | F71: 1 | G71: 2797.00 | H71: 1.61 | I71: 2797.00 | J71: 1060.00 | K71: 5 | L71: =RC[-3]/100*RC[-1] -> 1.61
A72: 3 | B72: K5-1351-В | C72: Магазин страйкбольный механический к AK/AKM (150шар) чёрный [CM]||K5-1351 BK | D72: 4.64 | E72: usd | F72: 1 | G72: 200.00 | H72: 2.16 | I72: 200.00 | J72: 107.20 | K72: 5 | L72: =RC[-3]/100*RC[-1] -> 2.16
A73: 4 | B73: KBB-25 | C73: Шарики BB 6мм 0,25x4000 [GUARDER] ||BB-25(BAG) | D73: 7.87 | E73: usd | F73: 1 | G73: 232.00 | H73: 1.47 | I73: 232.00 | J73: 74.60 | K73: 5 | L73: =RC[-3]/100*RC[-1] -> 1.47
A74: 5 | B74: KG-1000 | C74: GREEN GAS 1000мл | D74: 4.70 | E74: usd | F74: 1 | G74: 248.00 | H74: 2.64 | I74: 248.00 | J74: 154.00 | K74: 5 | L74: =RC[-3]/100*RC[-1] -> 2.64
A75: 6 | B75: K17087-O | C75: Ремень 2-точ.(Bungee) олива [Производитель: ACM] ||M51617087-OD | D75: 3.20 | E75: usd | F75: 1 | G75: 147.00 | H75: 2.30 | I75: 147.00 | J75: 83.00 | K75: 5 | L75: =RC[-3]/100*RC[-1] -> 2.30 | M75: =SUM(R[-6]C[-1]:RC[-1]) -> 
A77: #11757 (2015-01-20) Рябоконь Михаил Владимирович - Відправлено-Продано
A78: N | B78: арт | C78: назва | D78: закуп | F78: к-ть | G78: цiна | H78: кф | I78: продж | J78: дохiд | K78: % | L78: з-та
A79: 1 | B79: H30130/2XL | C79: Рубашка DEFENDER короткий рукав бежевая||KO-DES-CO-13 | D79: 17.71 | E79: usd | F79: 1 | G79: 779.00 | H79: 2.20 | I79: 779.00 | J79: 424.80 | K79: 5 | L79: =RC[-3]/100*RC[-1] -> 2.20 | M79: =SUM(R[-1]C[-1]:RC[-1]) -> 
A81: #11761 (2015-01-20) Матвєєв Руслан Васильович - Відправлено-Продано
A82: N | B82: арт | C82: назва | D82: закуп | F82: к-ть | G82: цiна | H82: кф | I82: продж | J82: дохiд | K82: % | L82: з-та
A83: 1 | B83: H7233/S-55 | C83: PCS кепка MP CAMO ||CZ-PCS-PT-33 | D83: 4.58 | E83: usd | F83: 1 | G83: 202.00 | H83: 2.21 | I83: 202.00 | J83: 110.40 | K83: 5 | L83: =RC[-3]/100*RC[-1] -> 2.21 | M83: =SUM(R[-1]C[-1]:RC[-1]) -> 
A85: #11772 (2015-01-20) Біляєв Олег Васильович - Відправлено-Продано
A86: N | B86: арт | C86: назва | D86: закуп | F86: к-ть | G86: цiна | H86: кф | I86: продж | J86: дохiд | K86: % | L86: з-та
A87: 1 | B87: K5-0176-B-500 | C87: Магазин страйкбольный бункерный к AK74 (500шар) чёрный [Производитель: P] | D87: 3.70 | E87: usd | F87: 1 | G87: 200.00 | H87: 2.70 | I87: 200.00 | J87: 126.00 | K87: 5 | L87: =RC[-3]/100*RC[-1] -> 2.70
A88: 2 | B88: K5-1351-В | C88: Магазин страйкбольный механический к AK/AKM (150шар) чёрный [CM]||K5-1351 BK | D88: 4.64 | E88: usd | F88: 1 | G88: 200.00 | H88: 2.16 | I88: 200.00 | J88: 107.20 | K88: 5 | L88: =RC[-3]/100*RC[-1] -> 2.16 | M88: =SUM(R[-2]C[-1]:RC[-1]) -> 
A90: #11786 (2015-01-21) Максімов Роман Володимирович - Відправлено-Продано
A91: N | B91: арт | C91: назва | D91: закуп | F91: к-ть | G91: цiна | H91: кф | I91: продж | J91: дохiд | K91: % | L91: з-та
A92: 1 | B92: H4102/ML | C92: US SFU штаны олива (R/S) ||SP-SFU-CR-02 | D92: 14.49 | E92: usd | F92: 1 | G92: 638.00 | H92: 2.20 | I92: 638.00 | J92: 348.20 | K92: 5 | L92: =RC[-3]/100*RC[-1] -> 2.20 | M92: =SUM(R[-1]C[-1]:RC[-1]) -> 
A94: #11795 (2015-01-21) cинявская елена ивановна - Відправлено-Продано
A95: N | B95: арт | C95: назва | D95: закуп | F95: к-ть | G95: цiна | H95: кф | I95: продж | J95: дохiд | K95: % | L95: з-та
A96: 1 | B96: BD7967F | C96: Брелок со страховочним тросом [Производитель: ACM] | D96: 4.83 | E96: usd | F96: 2 | G96: 243.00 | H96: 2.52 | I96: 486.00 | J96: 292.80 | K96: 5 | L96: =RC[-3]/100*RC[-1] -> 2.52 | M96: =SUM(R[-1]C[-1]:RC[-1]) -> 
A98: #11830 (2015-01-22) Бацагула Сергей Викторович - Відправлено-Продано
A99: N | B99: арт | C99: назва | D99: закуп | F99: к-ть | G99: цiна | H99: кф | I99: продж | J99: дохiд | K99: % | L99: з-та
A100: 1 | B100: К16159-B | C100: Сошки к винтовок СВД [Производитель: P] алюминий ||M51616159-BK | D100: 16.74 | E100: usd | F100: 1 | G100: 1024.00 | H100: 3.06 | I100: 1024.00 | J100: 689.20 | K100: 5 | L100: =RC[-3]/100*RC[-1] -> 3.06 | M100: =SUM(R[-1]C[-1]:RC[-1]) -> 
A102: #11833 (2015-01-22) Баланчук Микола Анатолійович - Відправлено-Продано
A103: N | B103: арт | C103: назва | D103: закуп | F103: к-ть | G103: цiна | H103: кф | I103: продж | J103: дохiд | K103: % | L103: з-та
A104: 1 | B104: H3301/M | C104: Комплект термобілизни (95% полиэстер 5% спандекс) чёрный ||KP-UN2-PO-01/M | D104: 19.99 | E104: usd | F104: 1 | G104: 880.00 | H104: 2.20 | I104: 880.00 | J104: 480.20 | K104: 5 | L104: =RC[-3]/100*RC[-1] -> 2.20 | M104: =SUM(R[-1]C[-1]:RC[-1]) -> 
A106: #11837 (2015-01-22) Козинчук Андрей Викторович - Відправлено-Продано
A107: N | B107: арт | C107: назва | D107: закуп | F107: к-ть | G107: цiна | H107: кф | I107: продж | J107: дохiд | K107: % | L107: з-та
A108: 1 | B108: K12212-O | C108: Подсумок магазинный двойной G36/M4/AK олива [A.C.M] ||M51612212-OD | D108: 5.10 | E108: usd | F108: 1 | G108: 224.00 | H108: 2.20 | I108: 224.00 | J108: 122.00 | K108: 5 | L108: =RC[-3]/100*RC[-1] -> 2.20
A109: 2 | B109: _18799 | C109: СССР подсумок гранатный (REPRO) | D109: 10.00 | E109: usd | F109: 1 | G109: 20.00 | H109: 0.10 | I109: 20.00 | J109: -180.00 | K109: 5 | L109: =RC[-3]/100*RC[-1] -> 0.10 | M109: =SUM(R[-2]C[-1]:RC[-1]) -> 
A111: #11864 (2015-01-24) Кравченко - Відправлено-Продано
A112: N | B112: арт | C112: назва | D112: закуп | F112: к-ть | G112: цiна | H112: кф | I112: продж | J112: дохiд | K112: % | L112: з-та
A113: 1 | B113: K13028-O | C113: Кобура набедренная MOLLE tactical backpack олива ||M51613028-OD | D113: 7.61 | E113: usd | F113: 1 | G113: 350.00 | H113: 2.30 | I113: 350.00 | J113: 197.80 | K113: 5 | L113: =RC[-3]/100*RC[-1] -> 2.30 | M113: =SUM(R[-1]C[-1]:RC[-1]) -> 
A115: #11866 (2015-01-25) Марчук Сергій Вікторович - Відправлено-Продано
A116: N | B116: арт | C116: назва | D116: закуп | F116: к-ть | G116: цiна | H116: кф | I116: продж | J116: дохiд | K116: % | L116: з-та
A117: 1 | B117: K13048-B | C117: Кобура набедренная чёрная ||M51613048-BK | D117: 4.85 | E117: usd | F117: 2 | G117: 223.00 | H117: 2.30 | I117: 446.00 | J117: 252.00 | K117: 5 | L117: =RC[-3]/100*RC[-1] -> 2.30 | M117: =SUM(R[-1]C[-1]:RC[-1]) -> 
A119: #11879 (2015-01-26) Савка Максим Володимирович - Відправлено-Продано
A120: N | B120: арт | C120: назва | D120: закуп | F120: к-ть | G120: цiна | H120: кф | I120: продж | J120: дохiд | K120: % | L120: з-та
A121: 1 | B121: K0001-MF | C121: Переходник T-to-Mini [MINI F]||VB MINI F | D121: 1.00 | E121: usd | F121: 1 | G121: 39.00 | H121: 1.95 | I121: 39.00 | J121: 19.00 | K121: 5 | L121: =RC[-3]/100*RC[-1] -> 1.95 | M121: =SUM(R[-1]C[-1]:RC[-1]) -> 