Sheet:  name
D1: Вхiднi данi | H1: Зкореговано
C2: Закуп: | D2: 14900 | G2: грн
C3: Продано: | D3: 27684 | G3: грн
C4: Дохiд-Коефiцiент: | D4: 12783(1.86)
C5: Процент з-ти: | D5: 5 | G5: %
C6: Нараховано з-ти: | D6: 1384.18 | G6: грн | H6: =SUM(R[4]C[4]:R[56]C[4]) -> 
B7: курси: Все 0 , грн 1 , usd 20 , euro 25 , zl 5 , Инт 20 ,
A9: #11582 (2015-01-09) Лис Василь Іванович - Відправлено-Продано
A10: N | B10: арт | C10: назва | D10: закуп | F10: к-ть | G10: цiна | H10: кф | I10: продж | J10: дохiд | K10: % | L10: з-та
A11: 1 | B11: H6201/S | C11: Куртка LEVEL 7 - Climashield® Apex 100g чёрная ||KU-L70-NL-01 | D11: 72.20 | E11: usd | F11: 1 | G11: 3177.00 | H11: 2.20 | I11: 2700.45 | J11: 1256.45 | K11: 5 | L11: =RC[-3]/100*RC[-1] -> 2.20
A12: 2 | B12: H6201/M | C12: Куртка LEVEL 7 - Climashield® Apex 100g чёрная ||KU-L70-NL-01 | D12: 72.20 | E12: usd | F12: 1 | G12: 3177.00 | H12: 2.20 | I12: 2700.45 | J12: 1256.45 | K12: 5 | L12: =RC[-3]/100*RC[-1] -> 2.20
A13: 3 | B13: H6201/XL | C13: Куртка LEVEL 7 - Climashield® Apex 100g чёрная ||KU-L70-NL-01 | D13: 72.20 | E13: usd | F13: 1 | G13: 3177.00 | H13: 2.20 | I13: 2700.45 | J13: 1256.45 | K13: 5 | L13: =RC[-3]/100*RC[-1] -> 2.20
A14: 4 | B14: H6201/2XL | C14: Куртка LEVEL 7 - Climashield® Apex 100g чёрная ||KU-L70-NL-01 | D14: 72.20 | E14: usd | F14: 1 | G14: 3177.00 | H14: 2.20 | I14: 2700.45 | J14: 1256.45 | K14: 5 | L14: =RC[-3]/100*RC[-1] -> 2.20
A15: 5 | B15: H4013/MR | C15: URBAN TACTICAL штаны хаки ||SP-UTL-CO-13 | D15: 37.13 | E15: usd | F15: 1 | G15: 1634.00 | H15: 2.20 | I15: 1388.90 | J15: 646.30 | K15: 5 | L15: =RC[-3]/100*RC[-1] -> 2.20
A16: 6 | B16: H3302/2XL | C16: Комплект термобілизни (95% полиэстер 5% спандекс) олива ||KP-UN2-PO-02/2XL | D16: 19.99 | E16: usd | F16: 1 | G16: 880.00 | H16: 2.20 | I16: 748.00 | J16: 348.20 | K16: 5 | L16: =RC[-3]/100*RC[-1] -> 2.20
A17: 7 | B17: H3301/2XL | C17: Комплект термобілизни (95% полиэстер 5% спандекс) чёрный ||KP-UN2-PO-01/2XL | D17: 19.99 | E17: usd | F17: 1 | G17: 880.00 | H17: 2.20 | I17: 748.00 | J17: 348.20 | K17: 5 | L17: =RC[-3]/100*RC[-1] -> 2.20
A18: 8 | B18: H2014/XL | C18: Куртка LIBERTY флисовая мультикам 390г/м (superfine) ||BL-LIB-HF-14 | D18: 31.00 | E18: usd | F18: 1 | G18: 1364.00 | H18: 2.20 | I18: 1159.40 | J18: 539.40 | K18: 5 | L18: =RC[-3]/100*RC[-1] -> 2.20
A19: 9 | B19: H2014/2XL | C19: Куртка LIBERTY флисовая мультикам 390г/м (superfine) ||BL-LIB-HF-14 | D19: 31.00 | E19: usd | F19: 1 | G19: 1364.00 | H19: 2.20 | I19: 1159.40 | J19: 539.40 | K19: 5 | L19: =RC[-3]/100*RC[-1] -> 2.20
A20: 10 | B20: H2004/2XL | C20: Куртка LIBERTY флисовая польский вудлєнд 390г/м (superfine) ||BL-LIB-HF-04 | D20: 28.04 | E20: usd | F20: 1 | G20: 1234.00 | H20: 2.20 | I20: 1048.90 | J20: 488.10 | K20: 5 | L20: =RC[-3]/100*RC[-1] -> 2.20
A21: 11 | B21: H52332/180-104 | C21: PCS куртка SMOCK MP CAMO ||KU-PCS-PT-33 | D21: 48.03 | E21: usd | F21: 1 | G21: 2113.00 | H21: 2.20 | I21: 1796.05 | J21: 835.45 | K21: 5 | L21: =RC[-3]/100*RC[-1] -> 2.20
A22: 12 | B22: H88001/L | C22: Ремень US UTILITY чёрный нейлон ||PS-UTL-NL-01 | D22: 5.59 | E22: usd | F22: 1 | G22: 257.00 | H22: 2.30 | I22: 218.45 | J22: 106.65 | K22: 5 | L22: =RC[-3]/100*RC[-1] -> 2.30
A23: 13 | B23: H2033/M | C23: Куртка LIBERTY флисовая MP Camo 390г/м (superfine) ||BL-LIB-HF-33 | D23: 31.03 | E23: usd | F23: 1 | G23: 1365.00 | H23: 2.20 | I23: 1160.25 | J23: 539.65 | K23: 5 | L23: =RC[-3]/100*RC[-1] -> 2.20
A24: 14 | B24: H2033/S | C24: Куртка LIBERTY флисовая MP Camo 390г/м (superfine) ||BL-LIB-HF-33 | D24: 31.03 | E24: usd | F24: 1 | G24: 1365.00 | H24: 2.20 | I24: 1160.25 | J24: 539.65 | K24: 5 | L24: =RC[-3]/100*RC[-1] -> 2.20 | M24: =SUM(R[-14]C[-1]:RC[-1]) -> 
A26: #11602 (2015-01-11) Абросимов Александр Николаевич - Відправлено-Продано
A27: N | B27: арт | C27: назва | D27: закуп | F27: к-ть | G27: цiна | H27: кф | I27: продж | J27: дохiд | K27: % | L27: з-та
A28: 1 | B28: H0415 | C28: Набор посуды 3 предметн. из нержавеющей стали||ME-MEN-SS-15 | D28: 6.38 | E28: usd | F28: 1 | G28: 281.00 | H28: 2.20 | I28: 252.90 | J28: 125.30 | K28: 5 | L28: =RC[-3]/100*RC[-1] -> 2.20
A29: 2 | B29: _138252 | C29: Сумка-сетка для посуды олива | D29: 0.50 | E29: euro | F29: 1 | G29: 57.00 | H29: 4.56 | I29: 51.30 | J29: 38.80 | K29: 5 | L29: =RC[-3]/100*RC[-1] -> 4.56 | M29: =SUM(R[-2]C[-1]:RC[-1]) -> 
A31: #11681 (2015-01-15) Львів Куркін - Відправлено-Продано
A32: N | B32: арт | C32: назва | D32: закуп | F32: к-ть | G32: цiна | H32: кф | I32: продж | J32: дохiд | K32: % | L32: з-та
A33: 1 | B33: H6201/M | C33: Куртка LEVEL 7 - Climashield® Apex 100g чёрная ||KU-L70-NL-01 | D33: 72.20 | E33: usd | F33: 1 | G33: 3177.00 | H33: 2.20 | I33: 2541.60 | J33: 1097.60 | K33: 5 | L33: =RC[-3]/100*RC[-1] -> 2.20 | M33: =SUM(R[-1]C[-1]:RC[-1]) -> 
A35: #11732 (2015-01-19) Львів Куркін - Відправлено-Продано
A36: N | B36: арт | C36: назва | D36: закуп | F36: к-ть | G36: цiна | H36: кф | I36: продж | J36: дохiд | K36: % | L36: з-та
A37: 1 | B37: H59391/MR | C37: CPU китель A-TACS FG (PolyCotton) ||BL-CPU-PR-39 | D37: 32.12 | E37: usd | F37: 1 | G37: 1413.00 | H37: 2.20 | I37: 1130.40 | J37: 488.00 | K37: 5 | L37: =RC[-3]/100*RC[-1] -> 2.20 | M37: =SUM(R[-1]C[-1]:RC[-1]) -> 
A39: #11791 (2015-01-21) Лис Василь Іванович - Відправлено-Продано
A40: N | B40: арт | C40: назва | D40: закуп | F40: к-ть | G40: цiна | H40: кф | I40: продж | J40: дохiд | K40: % | L40: з-та
A41: 1 | B41: H2214/M | C41: Куртка GUNFIGHTER мультикам ||KU-GUN-FM-14 | D41: 55.81 | E41: usd | F41: 1 | G41: 2456.00 | H41: 2.20 | I41: 2087.60 | J41: 971.40 | K41: 5 | L41: =RC[-3]/100*RC[-1] -> 2.20 | M41: =SUM(R[-1]C[-1]:RC[-1]) -> 
A43: #11801 (2015-01-21) Львів Куркін - Відправлено-Продано
A44: N | B44: арт | C44: назва | D44: закуп | F44: к-ть | G44: цiна | H44: кф | I44: продж | J44: дохiд | K44: % | L44: з-та
A45: 1 | B45: _18222 | C45: WH ременной продовжувач (допнік) ||18222000 | D45: 2.50 | E45: euro | F45: 2 | G45: 144.00 | H45: 2.30 | I45: 230.40 | J45: 105.40 | K45: 5 | L45: =RC[-3]/100*RC[-1] -> 2.30 | M45: =SUM(R[-1]C[-1]:RC[-1]) -> 