Sheet:  name
D1: Вхiднi данi | H1: Зкореговано
C2: Закуп: | D2: 3051 | G2: грн
C3: Продано: | D3: 4135 | G3: грн
C4: Дохiд-Коефiцiент: | D4: 1084(1.36)
C5: Процент з-ти: | D5: 5 | G5: %
C6: Нараховано з-ти: | D6: 206.75 | G6: грн | H6: =SUM(R[4]C[4]:R[32]C[4]) -> 
B7: курси: Все 0 , грн 1 , usd 20 , euro 25 , zl 5 , Инт 20 ,
A9: #11792 (2015-01-21) Батальйон "СІЧ" - Відправлено-Продано
A10: N | B10: арт | C10: назва | D10: закуп | F10: к-ть | G10: цiна | H10: кф | I10: продж | J10: дохiд | K10: % | L10: з-та
A11: 1 | B11: H5914/MR | C11: CPU штаны мультикамо (PolyCotton) ||SP-CPU-PR-14 | D11: 21.56 | E11: usd | F11: 2 | G11: 949.00 | H11: 2.20 | I11: 1290.64 | J11: 428.24 | K11: 5 | L11: =RC[-3]/100*RC[-1] -> 2.20
A12: 2 | B12: H7214/M-57 | C12: US ACU кепка мультикам (NYCO R/S) ||CZ-ACU-PR-14 | D12: 4.31 | E12: usd | F12: 1 | G12: 190.00 | H12: 2.20 | I12: 129.20 | J12: 43.00 | K12: 5 | L12: =RC[-3]/100*RC[-1] -> 2.20
A13: 3 | B13: H7214/XL-61 | C13: US ACU кепка мультикам (NYCO R/S) ||CZ-ACU-PR-14 | D13: 4.31 | E13: usd | F13: 1 | G13: 190.00 | H13: 2.20 | I13: 129.20 | J13: 43.00 | K13: 5 | L13: =RC[-3]/100*RC[-1] -> 2.20
A14: 4 | B14: H47141/MR | C14: US ACU китель мультикам (NYCO R/S) ||BL-ACU-PR-14 | D14: 23.03 | E14: usd | F14: 2 | G14: 1013.00 | H14: 2.20 | I14: 1377.68 | J14: 456.48 | K14: 5 | L14: =RC[-3]/100*RC[-1] -> 2.20
A15: 5 | B15: K13028-M | C15: Кобура набедренная MOLLE tactical backpack мультикам ||M51613028-CP | D15: 7.61 | E15: usd | F15: 1 | G15: 350.00 | H15: 2.30 | I15: 238.00 | J15: 85.80 | K15: 5 | L15: =RC[-3]/100*RC[-1] -> 2.30 | M15: =SUM(R[-5]C[-1]:RC[-1]) -> 
A17: #11915 (2015-01-27) Батальйон "СІЧ" - Відправлено-Продано
A18: N | B18: арт | C18: назва | D18: закуп | F18: к-ть | G18: цiна | H18: кф | I18: продж | J18: дохiд | K18: % | L18: з-та
A19: 1 | B19: H7611N | C19: Балаклава коет с 1-м отв.(ComfortDry) ||CZ-KO2-FG-11 | D19: 5.66 | E19: usd | F19: 1 | G19: 183.00 | H19: 1.62 | I19: 124.44 | J19: 11.24 | K19: 5 | L19: =RC[-3]/100*RC[-1] -> 1.62
A20: 2 | B20: H26141/2XL | C20: Куртка PATRIOT флисовая мультикам 390г/м (superfine) ||BL-PAT-HF-14 | D20: 31.03 | E20: usd | F20: 1 | G20: 932.00 | H20: 1.50 | I20: 633.76 | J20: 13.16 | K20: 5 | L20: =RC[-3]/100*RC[-1] -> 1.50
A21: 3 | B21: H33111/2XL | C21: Термофутболка (95% полиэстер 5% спандекс) койот ||BL-UN2-PO-11/2XL | D21: 10.44 | E21: usd | F21: 1 | G21: 312.00 | H21: 1.49 | I21: 212.16 | J21: 3.36 | K21: 5 | L21: =RC[-3]/100*RC[-1] -> 1.49 | M21: =SUM(R[-3]C[-1]:RC[-1]) -> 