Sheet:  name
D1: Вхiднi данi | H1: Зкореговано
C2: Закуп: | D2: 110530 | G2: грн
C3: Продано: | D3: 210922 | G3: грн
C4: Дохiд-Коефiцiент: | D4: 100392(1.91)
C5: Процент з-ти: | D5: 2 | G5: %
C6: Нараховано з-ти: | D6: 4218.44 | G6: грн | H6: =SUM(R[4]C[4]:R[229]C[4]) -> 
B7: курси: Все 0 , грн 1 , usd 20 , euro 25 , zl 5 , Инт 20 ,
A9: #11566 (2015-01-09) Магазин Верхнього одягу - Відправлено-Продано
A10: N | B10: арт | C10: назва | D10: закуп | F10: к-ть | G10: цiна | H10: кф | I10: продж | J10: дохiд | K10: % | L10: з-та
A11: 1 | B11: H12101/L | C11: ECWCS куртка TRILAMINAT ACU ||KU-EC2-NL-10 | D11: 43.99 | E11: usd | F11: 1 | G11: 1936.00 | H11: 2.20 | I11: 1742.40 | J11: 862.60 | K11: 2 | L11: =RC[-3]/100*RC[-1] -> 2.20
A12: 2 | B12: H1210/L | C12: ECWCS штаны TRILAMINAT ACU ||SP-EC2-NL-10 | D12: 35.80 | E12: usd | F12: 1 | G12: 1575.00 | H12: 2.20 | I12: 1417.50 | J12: 701.50 | K12: 2 | L12: =RC[-3]/100*RC[-1] -> 2.20
A13: 3 | B13: H14302/M | C13: Безрукавка охотничья WILD BOAR ||KK-WIL-PO-02 | D13: 19.32 | E13: usd | F13: 1 | G13: 850.00 | H13: 2.20 | I13: 850.00 | J13: 463.60 | K13: 2 | L13: =RC[-3]/100*RC[-1] -> 2.20
A14: 4 | B14: R1284/40 | C14: Берци кожа чёрные утепленные Украина | D14: 70.00 | E14: usd | F14: 1 | G14: 2001.00 | H14: 1.43 | I14: 2000.00 | J14: 600.00 | K14: 2 | L14: =RC[-3]/100*RC[-1] -> 1.43
A15: 5 | B15: T7308880/42 | C15: Берци кожанные с замком чёрные TEMPEX Hanrath | D15: 26.50 | E15: Инт | F15: 1 | G15: 909.00 | H15: 1.72 | I15: 909.00 | J15: 379.00 | K15: 2 | L15: =RC[-3]/100*RC[-1] -> 1.72
A16: 6 | B16: M800332/43 | C16: Берцы MAGNUM Precision Ultra Lite CT WPI Wide | D16: 53.25 | E16: usd | F16: 1 | G16: 1887.00 | H16: 1.77 | I16: 1887.00 | J16: 822.00 | K16: 2 | L16: =RC[-3]/100*RC[-1] -> 1.77
A17: 7 | B17: C7335/39 | C17: Кросівки | D17: 55.00 | E17: грн | F17: 1 | G17: 167.00 | H17: 3.04 | I17: 140.90 | J17: 85.90 | K17: 2 | L17: =RC[-3]/100*RC[-1] -> 3.04
A18: 8 | B18: H65031/L | C18: Куртка М65 с отстегивающейся курткой вудлэнд (NYCO) ||KU-M65-NY-03 | D18: 37.22 | E18: usd | F18: 1 | G18: 1638.00 | H18: 2.20 | I18: 1474.20 | J18: 729.80 | K18: 2 | L18: =RC[-3]/100*RC[-1] -> 2.20
A19: 9 | B19: H65021/2XLR | C19: Куртка М65 с отстегивающейся курткой олива (NYCO) ||KU-M65-NY-02 | D19: 38.39 | E19: usd | F19: 1 | G19: 1689.00 | H19: 2.20 | I19: 1689.00 | J19: 921.20 | K19: 2 | L19: =RC[-3]/100*RC[-1] -> 2.20
A20: 10 | B20: Бабки | C20: Прихід Грошей | D20: 0.00 | E20: грн | F20: 1 | G20: 0.00 | H20: 0.00 | I20: 14990.00 | J20: 14989.00 | K20: 2 | L20: =RC[-3]/100*RC[-1] -> 0.00 | M20: =SUM(R[-10]C[-1]:RC[-1]) -> 
A22: #11594 (2015-01-10) Магазин Верхнього одягу - Відправлено-Продано
A23: N | B23: арт | C23: назва | D23: закуп | F23: к-ть | G23: цiна | H23: кф | I23: продж | J23: дохiд | K23: % | L23: з-та
A24: 1 | B24: R1284/44 | C24: Берци кожа чёрные утепленные Украина | D24: 1400 | E24: * | F24: 1 | G24: 2001.00 | H24: 1.43 | I24: 2000.00 | J24: 600.00 | K24: 2 | L24: =RC[-3]/100*RC[-1] -> 1.43
A25: 2 | B25: X1011/48 | C25: BW пуловер (полушерсть) чёрный (3 нитки) | D25: 500 | E25: * | F25: 1 | G25: 686.00 | H25: 1.37 | I25: 686.00 | J25: 186.00 | K25: 2 | L25: =RC[-3]/100*RC[-1] -> 1.37
A26: 3 | B26: H2316/3XL | C26: Куртка CLASSIC ARMY флисовая чорн/олива ||BL-CAF-FL-16 | D26: 366 | E26: * | F26: 1 | G26: 805.00 | H26: 2.20 | I26: 800.00 | J26: 434.00 | K26: 2 | L26: =RC[-3]/100*RC[-1] -> 2.20
A27: 4 | B27: H2316/2XL | C27: Куртка CLASSIC ARMY флисовая чорн/олива ||BL-CAF-FL-16 | D27: 366 | E27: * | F27: 1 | G27: 805.00 | H27: 2.20 | I27: 644.00 | J27: 278.00 | K27: 2 | L27: =RC[-3]/100*RC[-1] -> 2.20
A28: 5 | B28: H2316/L | C28: Куртка CLASSIC ARMY флисовая чорн/олива ||BL-CAF-FL-16 | D28: 366 | E28: * | F28: 1 | G28: 805.00 | H28: 2.20 | I28: 644.00 | J28: 278.00 | K28: 2 | L28: =RC[-3]/100*RC[-1] -> 2.20 | M28: =SUM(R[-5]C[-1]:RC[-1]) -> 
A30: #11609 (2015-01-12) Магазин Верхнього одягу - Відправлено-Продано
A31: N | B31: арт | C31: назва | D31: закуп | F31: к-ть | G31: цiна | H31: кф | I31: продж | J31: дохiд | K31: % | L31: з-та
A32: 1 | B32: H2227/M | C32: Куртка GUNFIGHTER Jungle Green||KU-GUN-FM-27 | D32: 1018 | E32: * | F32: 1 | G32: 2239.00 | H32: 2.20 | I32: 2015.10 | J32: 997.10 | K32: 2 | L32: =RC[-3]/100*RC[-1] -> 2.20
A33: 2 | B33: T7308880/42 | C33: Берци кожанные с замком чёрные TEMPEX Hanrath | D33: 530 | E33: * | F33: 1 | G33: 909.00 | H33: 1.72 | I33: 0.00 | J33: -530.00 | K33: 2 | L33: =RC[-3]/100*RC[-1] -> 1.72 | M33: =SUM(R[-2]C[-1]:RC[-1]) -> 
A35: #11632 (2015-01-13) Магазин Верхнього одягу - Відправлено-Продано
A36: N | B36: арт | C36: назва | D36: закуп | F36: к-ть | G36: цiна | H36: кф | I36: продж | J36: дохiд | K36: % | L36: з-та
A37: 1 | B37: R1284/42 | C37: Берци кожа чёрные утепленные Украина | D37: 1400 | E37: * | F37: 1 | G37: 2001.00 | H37: 1.43 | I37: 2001.00 | J37: 601.00 | K37: 2 | L37: =RC[-3]/100*RC[-1] -> 1.43
A38: 2 | B38: H2214/M | C38: Куртка GUNFIGHTER мультикам ||KU-GUN-FM-14 | D38: 1116 | E38: * | F38: 1 | G38: 2456.00 | H38: 2.20 | I38: 2210.40 | J38: 1094.40 | K38: 2 | L38: =RC[-3]/100*RC[-1] -> 2.20
A39: 3 | B39: H2233/L | C39: Куртка GUNFIGHTER MP Camo||KU-GUN-FM-33 | D39: 1116 | E39: * | F39: 1 | G39: 2456.00 | H39: 2.20 | I39: 2210.40 | J39: 1094.40 | K39: 2 | L39: =RC[-3]/100*RC[-1] -> 2.20
A40: 4 | B40: H49141/LR | C40: Рубашка COMBAT мультикам с налокотниками (NYCO POL) ||KO-CS2-PO-14 | D40: 518 | E40: * | F40: 1 | G40: 1139.00 | H40: 2.20 | I40: 1025.10 | J40: 507.10 | K40: 2 | L40: =RC[-3]/100*RC[-1] -> 2.20
A41: 5 | B41: H49141/MR | C41: Рубашка COMBAT мультикам с налокотниками (NYCO POL) ||KO-CS2-PO-14 | D41: 518 | E41: * | F41: 1 | G41: 1139.00 | H41: 2.20 | I41: 1025.10 | J41: 507.10 | K41: 2 | L41: =RC[-3]/100*RC[-1] -> 2.20 | M41: =SUM(R[-5]C[-1]:RC[-1]) -> 
A43: #11650 (2015-01-14) Магазин Верхнього одягу - Відправлено-Продано
A44: N | B44: арт | C44: назва | D44: закуп | F44: к-ть | G44: цiна | H44: кф | I44: продж | J44: дохiд | K44: % | L44: з-та
A45: 1 | B45: H2014/L | C45: Куртка LIBERTY флисовая мультикам 390г/м (superfine) ||BL-LIB-HF-14 | D45: 620 | E45: * | F45: 1 | G45: 1364.00 | H45: 2.20 | I45: 1364.00 | J45: 744.00 | K45: 2 | L45: =RC[-3]/100*RC[-1] -> 2.20
A46: 2 | B46: R1283/44 | C46: Берци кожа чёрные Украина | D46: 1400 | E46: * | F46: 1 | G46: 2001.00 | H46: 1.43 | I46: 2001.00 | J46: 601.00 | K46: 2 | L46: =RC[-3]/100*RC[-1] -> 1.43
A47: 3 | B47: _12002/XXL | C47: US BDU детские штаны вудлэнд р.176 ||12031020-906 | D47: 200 | E47: * | F47: 1 | G47: 540.00 | H47: 2.70 | I47: 540.00 | J47: 340.00 | K47: 2 | L47: =RC[-3]/100*RC[-1] -> 2.70
A48: 4 | B48: H65031/L | C48: Куртка М65 с отстегивающейся курткой вудлэнд (NYCO) ||KU-M65-NY-03 | D48: 744 | E48: * | F48: 1 | G48: 1638.00 | H48: 2.20 | I48: 0.00 | J48: -744.00 | K48: 2 | L48: =RC[-3]/100*RC[-1] -> 2.20 | M48: =SUM(R[-4]C[-1]:RC[-1]) -> 
A50: #11654 (2015-01-14) Магазин Верхнього одягу - Відправлено-Продано
A51: N | B51: арт | C51: назва | D51: закуп | F51: к-ть | G51: цiна | H51: кф | I51: продж | J51: дохiд | K51: % | L51: з-та
A52: 1 | B52: G4501/L | C52: Комплект термобелья GRENE (100% полиэстер) чёрный | D52: 1000 | E52: * | F52: 1 | G52: 350.00 | H52: 0.35 | I52: 350.00 | J52: -650.00 | K52: 2 | L52: =RC[-3]/100*RC[-1] -> 0.35
A53: 2 | B53: H5914/LR | C53: CPU штаны мультикамо (PolyCotton) ||SP-CPU-PR-14 | D53: 428 | E53: * | F53: 1 | G53: 942.00 | H53: 2.20 | I53: 942.00 | J53: 514.00 | K53: 2 | L53: =RC[-3]/100*RC[-1] -> 2.20
A54: 3 | B54: _155155-B | C54: Перчатки флисовые чёрные | D54: 37 | E54: * | F54: 1 | G54: 83.00 | H54: 2.24 | I54: 83.00 | J54: 46.00 | K54: 2 | L54: =RC[-3]/100*RC[-1] -> 2.24
A55: 4 | B55: _11601/G/04 | C55: BW китель флектарн б/у ||91160121-004 | D55: 30 | E55: * | F55: 1 | G55: 70.00 | H55: 2.33 | I55: 70.00 | J55: 40.00 | K55: 2 | L55: =RC[-3]/100*RC[-1] -> 2.33
A56: 5 | B56: _11957/Р/2 | C56: Рос.костюм маскировочный белый | D56: 70 | E56: * | F56: 1 | G56: 164.00 | H56: 2.34 | I56: 164.00 | J56: 94.00 | K56: 2 | L56: =RC[-3]/100*RC[-1] -> 2.34
A57: 6 | B57: H7911 | C57: Шапка флисовая койот ||CZ-DOK-FL-11 | D57: 40 | E57: * | F57: 1 | G57: 100.00 | H57: 2.50 | I57: 100.00 | J57: 60.00 | K57: 2 | L57: =RC[-3]/100*RC[-1] -> 2.50
A58: 7 | B58: X4011 | C58: Балаклава чёрная с 1-м отв. нинзя(100%хлопок) ||X76011 | D58: 63 | E58: * | F58: 1 | G58: 80.00 | H58: 1.27 | I58: 80.00 | J58: 17.00 | K58: 2 | L58: =RC[-3]/100*RC[-1] -> 1.27
A59: 8 | B59: H7202 | C59: US BDU кепка олива (NYCO R/S) ||CZ-COM-CR-02 | D59: 47 | E59: * | F59: 1 | G59: 103.00 | H59: 2.19 | I59: 103.00 | J59: 56.00 | K59: 2 | L59: =RC[-3]/100*RC[-1] -> 2.19
A60: 9 | B60: X4011 | C60: Балаклава чёрная с 1-м отв. нинзя(100%хлопок) ||X76011 | D60: 63 | E60: * | F60: 1 | G60: 80.00 | H60: 1.27 | I60: 80.00 | J60: 17.00 | K60: 2 | L60: =RC[-3]/100*RC[-1] -> 1.27
A61: 10 | B61: A0122 | C61: Аксельбант срібно-чёрный ||69944 | D61: 93 | E61: * | F61: 1 | G61: 28.00 | H61: 0.30 | I61: 28.00 | J61: -65.00 | K61: 2 | L61: =RC[-3]/100*RC[-1] -> 0.30
A62: 11 | B62: A0101 | C62: Кластер ЗІРКА (3 разом) 188941 | D62: 8 | E62: * | F62: 1 | G62: 3.00 | H62: 0.38 | I62: 3.00 | J62: -5.00 | K62: 2 | L62: =RC[-3]/100*RC[-1] -> 0.38
A63: 12 | B63: A0108 | C63: Кластер ЗІРКА срібна 1 ||180941 | D63: 2 | E63: * | F63: 1 | G63: 1.00 | H63: 0.50 | I63: 1.00 | J63: -1.00 | K63: 2 | L63: =RC[-3]/100*RC[-1] -> 0.50
A64: 13 | B64: A0083 | C64: Кластер Літера "V" бронзова ||180241 | D64: 5 | E64: * | F64: 1 | G64: 3.00 | H64: 0.60 | I64: 3.00 | J64: -2.00 | K64: 2 | L64: =RC[-3]/100*RC[-1] -> 0.60
A65: 14 | B65: K104707/SR | C65: Комплект формы марпат ACU китель, штаны, кепка (R/S) ||KP-ACU-PR-07 | D65: 280 | E65: * | F65: 1 | G65: 616.00 | H65: 2.20 | I65: 616.00 | J65: 336.00 | K65: 2 | L65: =RC[-3]/100*RC[-1] -> 2.20
A66: 15 | B66: H3407/S | C66: Футболка марпат ||TS-TSH-CO-07 | D66: 83 | E66: * | F66: 1 | G66: 182.00 | H66: 2.19 | I66: 182.00 | J66: 99.00 | K66: 2 | L66: =RC[-3]/100*RC[-1] -> 2.19
A67: 16 | B67: X4021 | C67: Балаклава олива с 1-м отв. нинзя (100%хлопок) ||X76012 | D67: 63 | E67: * | F67: 1 | G67: 80.00 | H67: 1.27 | I67: 80.00 | J67: 17.00 | K67: 2 | L67: =RC[-3]/100*RC[-1] -> 1.27 | M67: =SUM(R[-16]C[-1]:RC[-1]) -> 
A69: #11677 (2015-01-15) Магазин Верхнього одягу - Відправлено-Продано
A70: N | B70: арт | C70: назва | D70: закуп | F70: к-ть | G70: цiна | H70: кф | I70: продж | J70: дохiд | K70: % | L70: з-та
A71: 1 | B71: H65021/XLR | C71: Куртка М65 с отстегивающейся курткой олива (NYCO) ||KU-M65-NY-02 | D71: 768 | E71: * | F71: 1 | G71: 1689.00 | H71: 2.20 | I71: 0.00 | J71: -768.00 | K71: 2 | L71: =RC[-3]/100*RC[-1] -> 2.20
A72: 2 | B72: H2502/112C | C72: Куртка FRENCH ARMY флисовая олива (оригинал) ||BL-FRF-HF-02 | D72: 483 | E72: * | F72: 1 | G72: 1063.00 | H72: 2.20 | I72: 1063.00 | J72: 580.00 | K72: 2 | L72: =RC[-3]/100*RC[-1] -> 2.20
A73: 3 | B73: _12864/250 | C73: BW берцы горные (на мембране) ||12801000-250 | D73: 812 | E73: * | F73: 1 | G73: 1869.00 | H73: 2.30 | I73: 1869.00 | J73: 1057.00 | K73: 2 | L73: =RC[-3]/100*RC[-1] -> 2.30
A74: 4 | B74: H12041/XL | C74: ECWCS куртка TRILAMINAT польский вудлєнд ||KU-EC2-NL-04 | D74: 880 | E74: * | F74: 1 | G74: 1936.00 | H74: 2.20 | I74: 1936.00 | J74: 1056.00 | K74: 2 | L74: =RC[-3]/100*RC[-1] -> 2.20
A75: 5 | B75: M800004/37 | C75: Берцы MAGNUM Spider 8.1 Urban SZ(USA Version) | D75: 1185 | E75: * | F75: 1 | G75: 2108.00 | H75: 1.78 | I75: 2108.00 | J75: 923.00 | K75: 2 | L75: =RC[-3]/100*RC[-1] -> 1.78 | M75: =SUM(R[-5]C[-1]:RC[-1]) -> 
A77: #11698 (2015-01-16) Магазин Верхнього одягу - Відправлено-Продано
A78: N | B78: арт | C78: назва | D78: закуп | F78: к-ть | G78: цiна | H78: кф | I78: продж | J78: дохiд | K78: % | L78: з-та
A79: 1 | B79: _3378-1/45 | C79: Берцы STAR FORCE THUNDERSTORM HI чёрные | D79: 33.53 | E79: euro | F79: 1 | G79: 1894.00 | H79: 2.26 | I79: 1894.00 | J79: 1055.75 | K79: 2 | L79: =RC[-3]/100*RC[-1] -> 2.26
A80: 2 | B80: 91604/42 | C80: Ботинки Trekking North Track brown | D80: 41.00 | E80: Инт | F80: 1 | G80: 1272.00 | H80: 1.55 | I80: 1270.00 | J80: 450.00 | K80: 2 | L80: =RC[-3]/100*RC[-1] -> 1.55
A81: 3 | B81: H5601/M | C81: Куртка CWU чёрная ||KU-CWU-NL-01 | D81: 26.12 | E81: usd | F81: 1 | G81: 1149.00 | H81: 2.20 | I81: 1149.00 | J81: 626.60 | K81: 2 | L81: =RC[-3]/100*RC[-1] -> 2.20
A82: 4 | B82: H2214/M | C82: Куртка GUNFIGHTER мультикам ||KU-GUN-FM-14 | D82: 55.81 | E82: usd | F82: 1 | G82: 2456.00 | H82: 2.20 | I82: 2456.00 | J82: 1339.80 | K82: 2 | L82: =RC[-3]/100*RC[-1] -> 2.20
A83: 5 | B83: H2202/S | C83: Куртка GUNFIGHTER олива ||KU-GUN-FM-02 | D83: 50.89 | E83: usd | F83: 1 | G83: 2239.00 | H83: 2.20 | I83: 2239.00 | J83: 1221.20 | K83: 2 | L83: =RC[-3]/100*RC[-1] -> 2.20
A84: 6 | B84: H2201/M | C84: Куртка GUNFIGHTER чёрная ||KU-GUN-FM-01 | D84: 50.89 | E84: usd | F84: 1 | G84: 2239.00 | H84: 2.20 | I84: 2015.10 | J84: 997.30 | K84: 2 | L84: =RC[-3]/100*RC[-1] -> 2.20
A85: 7 | B85: H49141/LR | C85: Рубашка COMBAT мультикам с налокотниками (NYCO POL) ||KO-CS2-PO-14 | D85: 25.88 | E85: usd | F85: 1 | G85: 1139.00 | H85: 2.20 | I85: 1139.00 | J85: 621.40 | K85: 2 | L85: =RC[-3]/100*RC[-1] -> 2.20
A86: 8 | B86: H2014/L | C86: Куртка LIBERTY флисовая мультикам 390г/м (superfine) ||BL-LIB-HF-14 | D86: 620 | E86: * | F86: 1 | G86: 1364.00 | H86: 2.20 | I86: 1364.00 | J86: 744.00 | K86: 2 | L86: =RC[-3]/100*RC[-1] -> 2.20 | M86: =SUM(R[-8]C[-1]:RC[-1]) -> 
A88: #11719 (2015-01-19) Магазин Верхнього одягу - Відправлено-Продано
A89: N | B89: арт | C89: назва | D89: закуп | F89: к-ть | G89: цiна | H89: кф | I89: продж | J89: дохiд | K89: % | L89: з-та
A90: 1 | B90: X1011/52 | C90: BW пуловер (полушерсть) чёрный (3 нитки) | D90: 500 | E90: * | F90: 1 | G90: 686.00 | H90: 1.37 | I90: 617.40 | J90: 117.40 | K90: 2 | L90: =RC[-3]/100*RC[-1] -> 1.37
A91: 2 | B91: H2033/L | C91: Куртка LIBERTY флисовая MP Camo 390г/м (superfine) ||BL-LIB-HF-33 | D91: 621 | E91: * | F91: 1 | G91: 1365.00 | H91: 2.20 | I91: 1365.00 | J91: 744.00 | K91: 2 | L91: =RC[-3]/100*RC[-1] -> 2.20
A92: 3 | B92: _12846/310 | C92: Канадские резиновые сапоги (с носком) | D92: 488 | E92: * | F92: 1 | G92: 829.00 | H92: 1.70 | I92: 746.10 | J92: 258.10 | K92: 2 | L92: =RC[-3]/100*RC[-1] -> 1.70
A93: 4 | B93: A19-205/42 | C93: Ботинки ACROPOLIS коричневые | D93: 1300 | E93: * | F93: 1 | G93: 1820.00 | H93: 1.40 | I93: 1820.00 | J93: 520.00 | K93: 2 | L93: =RC[-3]/100*RC[-1] -> 1.40 | M93: =SUM(R[-4]C[-1]:RC[-1]) -> 
A95: #11723 (2015-01-19) Магазин Верхнього одягу - Відправлено-Продано
A96: N | B96: арт | C96: назва | D96: закуп | F96: к-ть | G96: цiна | H96: кф | I96: продж | J96: дохiд | K96: % | L96: з-та
A97: 1 | B97: H2233/2XL | C97: Куртка GUNFIGHTER MP Camo||KU-GUN-FM-33 | D97: 55.81 | E97: usd | F97: 1 | G97: 2456.00 | H97: 2.20 | I97: 1964.80 | J97: 848.60 | K97: 2 | L97: =RC[-3]/100*RC[-1] -> 2.20
A98: 2 | B98: H12141/XL | C98: ECWCS куртка TRILAMINAT Gen.2 мультикам ||KU-EC2-NL-14 | D98: 43.99 | E98: usd | F98: 1 | G98: 1936.00 | H98: 2.20 | I98: 1742.40 | J98: 862.60 | K98: 2 | L98: =RC[-3]/100*RC[-1] -> 2.20
A99: 3 | B99: H55141/L | C99: Куртка SOLDIER-2008 мультикам (PolyCotton) ||KU-FP8-PR-14 | D99: 45.71 | E99: usd | F99: 1 | G99: 2011.00 | H99: 2.20 | I99: 1809.90 | J99: 895.70 | K99: 2 | L99: =RC[-3]/100*RC[-1] -> 2.20
A100: 4 | B100: H2702/2XL | C100: Куртка COMMANDER олива ||BL-CMR-FM-02 | D100: 36.66 | E100: usd | F100: 1 | G100: 1613.00 | H100: 2.20 | I100: 1613.00 | J100: 879.80 | K100: 2 | L100: =RC[-3]/100*RC[-1] -> 2.20
A101: 5 | B101: _12002/L | C101: US BDU детские штаны вудлэнд р.152 ||12031020-904 | D101: 8.00 | E101: euro | F101: 1 | G101: 540.00 | H101: 2.70 | I101: 540.00 | J101: 340.00 | K101: 2 | L101: =RC[-3]/100*RC[-1] -> 2.70 | M101: =SUM(R[-5]C[-1]:RC[-1]) -> 
A103: #11749 (2015-01-20) Магазин Верхнього одягу - Відправлено-Продано
A104: N | B104: арт | C104: назва | D104: закуп | F104: к-ть | G104: цiна | H104: кф | I104: продж | J104: дохiд | K104: % | L104: з-та
A105: 1 | B105: H12141/XXL | C105: ECWCS куртка TRILAMINAT Gen.2 мультикам ||KU-EC2-NL-14 | D105: 43.99 | E105: usd | F105: 1 | G105: 1936.00 | H105: 2.20 | I105: 1742.40 | J105: 862.60 | K105: 2 | L105: =RC[-3]/100*RC[-1] -> 2.20
A106: 2 | B106: H2014/L | C106: Куртка LIBERTY флисовая мультикам 390г/м (superfine) ||BL-LIB-HF-14 | D106: 31.00 | E106: usd | F106: 1 | G106: 1364.00 | H106: 2.20 | I106: 1227.60 | J106: 607.60 | K106: 2 | L106: =RC[-3]/100*RC[-1] -> 2.20
A107: 3 | B107: H65031/3XL | C107: Куртка М65 с отстегивающейся курткой вудлэнд (NYCO) ||KU-M65-NY-03 | D107: 37.22 | E107: usd | F107: 1 | G107: 1638.00 | H107: 2.20 | I107: 1638.00 | J107: 893.60 | K107: 2 | L107: =RC[-3]/100*RC[-1] -> 2.20
A108: 4 | B108: _10721/XXL | C108: Безрукавка вудлэнд ||10701020-906 | D108: 12.00 | E108: euro | F108: 1 | G108: 684.00 | H108: 2.28 | I108: 684.00 | J108: 384.00 | K108: 2 | L108: =RC[-3]/100*RC[-1] -> 2.28
A109: 5 | B109: _10147/G/01 | C109: BW куртка флектарн б/у ||91010500 | D109: 80.00 | E109: грн | F109: 1 | G109: 184.00 | H109: 2.30 | I109: 184.00 | J109: 104.00 | K109: 2 | L109: =RC[-3]/100*RC[-1] -> 2.30
A110: 6 | B110: _160581/XXL | C110: US костюм TRILAMINAT вудлэнд ||10620020/906 | D110: 45.00 | E110: euro | F110: 1 | G110: 2892.00 | H110: 2.57 | I110: 2602.80 | J110: 1477.80 | K110: 2 | L110: =RC[-3]/100*RC[-1] -> 2.57 | M110: =SUM(R[-6]C[-1]:RC[-1]) -> 
A112: #11812 (2015-01-22) Магазин Верхнього одягу - Відправлено-Продано
A113: N | B113: арт | C113: назва | D113: закуп | F113: к-ть | G113: цiна | H113: кф | I113: продж | J113: дохiд | K113: % | L113: з-та
A114: 1 | B114: _10147/G/13 | C114: BW куртка флектарн б/у ||91010500 | D114: 80 | E114: * | F114: 1 | G114: 184.00 | H114: 2.30 | I114: 184.00 | J114: 104.00 | K114: 2 | L114: =RC[-3]/100*RC[-1] -> 2.30
A115: 2 | B115: H2016/L | C115: Куртка LIBERTY флисовая чорн/олива 390г/м (superfine) ||BL-LIB-HF-16 | D115: 561 | E115: * | F115: 1 | G115: 1234.00 | H115: 2.20 | I115: 1234.00 | J115: 673.00 | K115: 2 | L115: =RC[-3]/100*RC[-1] -> 2.20
A116: 3 | B116: H12061/M | C116: ECWCS куртка TRILAMINAT польский дезерт||KU-EC2-NL-06 | D116: 880 | E116: * | F116: 1 | G116: 1936.00 | H116: 2.20 | I116: 0.00 | J116: -880.00 | K116: 2 | L116: =RC[-3]/100*RC[-1] -> 2.20
A117: 4 | B117: H51101/S | C117: Куртка М65 с отстегивающейся курткой ACU (NYCO) PROPER | D117: 1000 | E117: * | F117: 1 | G117: 2200.00 | H117: 2.20 | I117: 2200.00 | J117: 1200.00 | K117: 2 | L117: =RC[-3]/100*RC[-1] -> 2.20
A118: 5 | B118: H2301/L | C118: Куртка CLASSIC ARMY флисовая чёрная ||BL-CAF-FL-01 | D118: 366 | E118: * | F118: 1 | G118: 805.00 | H118: 2.20 | I118: 724.50 | J118: 358.50 | K118: 2 | L118: =RC[-3]/100*RC[-1] -> 2.20 | M118: =SUM(R[-5]C[-1]:RC[-1]) -> 
A120: #11842 (2015-01-23) Магазин Верхнього одягу - Відправлено-Продано
A121: N | B121: арт | C121: назва | D121: закуп | F121: к-ть | G121: цiна | H121: кф | I121: продж | J121: дохiд | K121: % | L121: з-та
A122: 1 | B122: _114441/XXL | C122: Штани спортивные зелёные | D122: 112 | E122: * | F122: 1 | G122: 76.00 | H122: 0.68 | I122: 76.00 | J122: -36.00 | K122: 2 | L122: =RC[-3]/100*RC[-1] -> 0.68
A123: 2 | B123: M800332/42.5 | C123: Берцы MAGNUM Precision Ultra Lite CT WPI Wide | D123: 1065 | E123: * | F123: 1 | G123: 1887.00 | H123: 1.77 | I123: 1887.00 | J123: 822.00 | K123: 2 | L123: =RC[-3]/100*RC[-1] -> 1.77
A124: 3 | B124: H2301/3XL | C124: Куртка CLASSIC ARMY флисовая чёрная ||BL-CAF-FL-01 | D124: 366 | E124: * | F124: 1 | G124: 805.00 | H124: 2.20 | I124: 805.00 | J124: 439.00 | K124: 2 | L124: =RC[-3]/100*RC[-1] -> 2.20 | M124: =SUM(R[-3]C[-1]:RC[-1]) -> 
A126: #11858 (2015-01-24) Магазин Верхнього одягу - Відправлено-Продано
A127: N | B127: арт | C127: назва | D127: закуп | F127: к-ть | G127: цiна | H127: кф | I127: продж | J127: дохiд | K127: % | L127: з-та
A128: 1 | B128: H55071/M | C128: Куртка SOLDIER-2008 марпат (NYCO R/S) ||KU-FP8-NR-07 | D128: 45.71 | E128: usd | F128: -1 | G128: 2011.00 | H128: 2.20 | I128: -2011.00 | J128: -1096.80 | K128: 2 | L128: =RC[-3]/100*RC[-1] -> 2.20
A129: 2 | B129: H55071/XL | C129: Куртка SOLDIER-2008 марпат (NYCO R/S) ||KU-FP8-NR-07 | D129: 45.71 | E129: usd | F129: 1 | G129: 2011.00 | H129: 2.20 | I129: 2011.00 | J129: 1096.80 | K129: 2 | L129: =RC[-3]/100*RC[-1] -> 2.20
A130: 3 | B130: H65031/2XL | C130: Куртка М65 с отстегивающейся курткой вудлэнд (NYCO) ||KU-M65-NY-03 | D130: 37.22 | E130: usd | F130: 1 | G130: 1638.00 | H130: 2.20 | I130: 1474.00 | J130: 729.60 | K130: 2 | L130: =RC[-3]/100*RC[-1] -> 2.20
A131: 4 | B131: H55041/XL | C131: Куртка SOLDIER-2008 польский вудлэнд (NYCO) ||KU-FP8-NT-04 | D131: 43.99 | E131: usd | F131: 1 | G131: 1936.00 | H131: 2.20 | I131: 1742.00 | J131: 862.20 | K131: 2 | L131: =RC[-3]/100*RC[-1] -> 2.20
A132: 5 | B132: H12041/L | C132: ECWCS куртка TRILAMINAT польский вудлєнд ||KU-EC2-NL-04 | D132: 43.99 | E132: usd | F132: 1 | G132: 1936.00 | H132: 2.20 | I132: 1742.40 | J132: 862.60 | K132: 2 | L132: =RC[-3]/100*RC[-1] -> 2.20
A133: 6 | B133: H6130/43 | C133: Берцы Trekking YUKON коричневые ||BU-TYU-LE-30 | D133: 99.00 | E133: usd | F133: 1 | G133: 4356.00 | H133: 2.20 | I133: 4356.00 | J133: 2376.00 | K133: 2 | L133: =RC[-3]/100*RC[-1] -> 2.20
A134: 7 | B134: H2033/XL | C134: Куртка LIBERTY флисовая MP Camo 390г/м (superfine) ||BL-LIB-HF-33 | D134: 31.03 | E134: usd | F134: 1 | G134: 1365.00 | H134: 2.20 | I134: 1365.00 | J134: 744.40 | K134: 2 | L134: =RC[-3]/100*RC[-1] -> 2.20
A135: 8 | B135: H6211/L | C135: Куртка LEVEL 7 - Climashield® Apex 100g койот ||KU-L70-NL-11 | D135: 72.20 | E135: usd | F135: 1 | G135: 3177.00 | H135: 2.20 | I135: 3018.00 | J135: 1574.00 | K135: 2 | L135: =RC[-3]/100*RC[-1] -> 2.20
A136: 9 | B136: H6911/L | C136: Безрукавка коет Lightweight Vest - Climashield ||KK-MMT-NL-11 | D136: 36.14 | E136: usd | F136: 1 | G136: 1590.00 | H136: 2.20 | I136: 1510.50 | J136: 787.70 | K136: 2 | L136: =RC[-3]/100*RC[-1] -> 2.20
A137: 10 | B137: H6936/L | C137: Безрукавка Alpha Green Lightweight Vest - Climashield ||KK-MMT-NL-36 | D137: 36.14 | E137: usd | F137: 1 | G137: 1590.00 | H137: 2.20 | I137: 1510.50 | J137: 787.70 | K137: 2 | L137: =RC[-3]/100*RC[-1] -> 2.20
A138: 11 | B138: H2227/L | C138: Куртка GUNFIGHTER Jungle Green||KU-GUN-FM-27 | D138: 50.89 | E138: usd | F138: 1 | G138: 2239.00 | H138: 2.20 | I138: 2127.00 | J138: 1109.20 | K138: 2 | L138: =RC[-3]/100*RC[-1] -> 2.20
A139: 12 | B139: _10147/G/14 | C139: BW куртка флектарн б/у ||91010500 | D139: 80.00 | E139: грн | F139: 1 | G139: 184.00 | H139: 2.30 | I139: 184.00 | J139: 104.00 | K139: 2 | L139: =RC[-3]/100*RC[-1] -> 2.30 | M139: =SUM(R[-12]C[-1]:RC[-1]) -> 
A141: #11872 (2015-01-26) Магазин Верхнього одягу - Відправлено-Продано
A142: N | B142: арт | C142: назва | D142: закуп | F142: к-ть | G142: цiна | H142: кф | I142: продж | J142: дохiд | K142: % | L142: з-та
A143: 1 | B143: H2014/S | C143: Куртка LIBERTY флисовая мультикам 390г/м (superfine) ||BL-LIB-HF-14 | D143: 620 | E143: * | F143: 1 | G143: 1364.00 | H143: 2.20 | I143: 1227.60 | J143: 607.60 | K143: 2 | L143: =RC[-3]/100*RC[-1] -> 2.20
A144: 2 | B144: H2214/M | C144: Куртка GUNFIGHTER мультикам ||KU-GUN-FM-14 | D144: 1116 | E144: * | F144: 1 | G144: 2456.00 | H144: 2.20 | I144: 2210.40 | J144: 1094.40 | K144: 2 | L144: =RC[-3]/100*RC[-1] -> 2.20
A145: 3 | B145: H11071/2XL | C145: APECS USMC куртка TRILAMINAT марпат ||KU-APE-NL-07 | D145: 765 | E145: * | F145: 1 | G145: 1683.00 | H145: 2.20 | I145: 1683.00 | J145: 918.00 | K145: 2 | L145: =RC[-3]/100*RC[-1] -> 2.20
A146: 4 | B146: H2233/XL | C146: Куртка GUNFIGHTER MP Camo||KU-GUN-FM-33 | D146: 1116 | E146: * | F146: 1 | G146: 2456.00 | H146: 2.20 | I146: 2210.40 | J146: 1094.40 | K146: 2 | L146: =RC[-3]/100*RC[-1] -> 2.20
A147: 5 | B147: H2014/2XL | C147: Куртка LIBERTY флисовая мультикам 390г/м (superfine) ||BL-LIB-HF-14 | D147: 620 | E147: * | F147: 1 | G147: 1364.00 | H147: 2.20 | I147: 1227.60 | J147: 607.60 | K147: 2 | L147: =RC[-3]/100*RC[-1] -> 2.20
A148: 6 | B148: B12004/2XL | C148: Дорожній светловідбівний жилет помаранч ГАБАРИТ | D148: 17 | E148: * | F148: 2 | G148: 50.00 | H148: 2.94 | I148: 100.00 | J148: 66.00 | K148: 2 | L148: =RC[-3]/100*RC[-1] -> 2.94
A149: 7 | B149: M800332/45 | C149: Берцы MAGNUM Precision Ultra Lite CT WPI Wide | D149: 1065 | E149: * | F149: 1 | G149: 1887.00 | H149: 1.77 | I149: 1792.65 | J149: 727.65 | K149: 2 | L149: =RC[-3]/100*RC[-1] -> 1.77
A150: 8 | B150: R1283/43 | C150: Берци кожа чёрные Украина | D150: 1400 | E150: * | F150: -1 | G150: 2001.00 | H150: 1.43 | I150: -2001.00 | J150: -601.00 | K150: 2 | L150: =RC[-3]/100*RC[-1] -> 1.43
A151: 9 | B151: R1283/44 | C151: Берци кожа чёрные Украина | D151: 1400 | E151: * | F151: 1 | G151: 2001.00 | H151: 1.43 | I151: 2001.00 | J151: 601.00 | K151: 2 | L151: =RC[-3]/100*RC[-1] -> 1.43 | M151: =SUM(R[-9]C[-1]:RC[-1]) -> 
A153: #11910 (2015-01-27) Магазин Верхнього одягу - Відправлено-Продано
A154: N | B154: арт | C154: назва | D154: закуп | F154: к-ть | G154: цiна | H154: кф | I154: продж | J154: дохiд | K154: % | L154: з-та
A155: 1 | B155: R1284/42 | C155: Берци кожа чёрные утепленные Украина | D155: 1400 | E155: * | F155: 1 | G155: 2001.00 | H155: 1.43 | I155: 2001.00 | J155: 601.00 | K155: 2 | L155: =RC[-3]/100*RC[-1] -> 1.43
A156: 2 | B156: H2033/XL | C156: Куртка LIBERTY флисовая MP Camo 390г/м (superfine) ||BL-LIB-HF-33 | D156: 621 | E156: * | F156: 1 | G156: 1365.00 | H156: 2.20 | I156: 1296.75 | J156: 675.75 | K156: 2 | L156: =RC[-3]/100*RC[-1] -> 2.20
A157: 3 | B157: R1283/42 | C157: Берци кожа чёрные Украина | D157: 1400 | E157: * | F157: 1 | G157: 2001.00 | H157: 1.43 | I157: 1900.95 | J157: 500.95 | K157: 2 | L157: =RC[-3]/100*RC[-1] -> 1.43
A158: 4 | B158: R1283/43 | C158: Берци кожа чёрные Украина | D158: 1400 | E158: * | F158: 1 | G158: 2001.00 | H158: 1.43 | I158: 1900.95 | J158: 500.95 | K158: 2 | L158: =RC[-3]/100*RC[-1] -> 1.43
A159: 5 | B159: _10852/L | C159: BW куртка M.BRUSTTA флисовая олива ||10852001/904 | D159: 275 | E159: * | F159: 1 | G159: 490.00 | H159: 1.78 | I159: 343.00 | J159: 68.00 | K159: 2 | L159: =RC[-3]/100*RC[-1] -> 1.78
A160: 6 | B160: X1021/56 | C160: BW пуловер (полушерсть) олива (3 нитки) | D160: 500 | E160: * | F160: 1 | G160: 686.00 | H160: 1.37 | I160: 686.00 | J160: 186.00 | K160: 2 | L160: =RC[-3]/100*RC[-1] -> 1.37
A161: 7 | B161: M800332/42.5 | C161: Берцы MAGNUM Precision Ultra Lite CT WPI Wide | D161: 1065 | E161: * | F161: 6 | G161: 1887.00 | H161: 1.77 | I161: 9057.60 | J161: 2667.60 | K161: 2 | L161: =RC[-3]/100*RC[-1] -> 1.77
A162: 8 | B162: M800332/43 | C162: Берцы MAGNUM Precision Ultra Lite CT WPI Wide | D162: 1065 | E162: * | F162: 2 | G162: 1887.00 | H162: 1.77 | I162: 3019.20 | J162: 889.20 | K162: 2 | L162: =RC[-3]/100*RC[-1] -> 1.77
A163: 9 | B163: M800332/44 | C163: Берцы MAGNUM Precision Ultra Lite CT WPI Wide | D163: 1065 | E163: * | F163: 1 | G163: 1887.00 | H163: 1.77 | I163: 1509.60 | J163: 444.60 | K163: 2 | L163: =RC[-3]/100*RC[-1] -> 1.77
A164: 10 | B164: H65031/L | C164: Куртка М65 с отстегивающейся курткой вудлэнд (NYCO) ||KU-M65-NY-03 | D164: 744 | E164: * | F164: 1 | G164: 1638.00 | H164: 2.20 | I164: 1638.00 | J164: 894.00 | K164: 2 | L164: =RC[-3]/100*RC[-1] -> 2.20
A165: 11 | B165: H65031/M | C165: Куртка М65 с отстегивающейся курткой вудлэнд (NYCO) ||KU-M65-NY-03 | D165: 744 | E165: * | F165: -1 | G165: 1638.00 | H165: 2.20 | I165: -1638.00 | J165: -894.00 | K165: 2 | L165: =RC[-3]/100*RC[-1] -> 2.20
A166: 12 | B166: H12041/M | C166: ECWCS куртка TRILAMINAT польский вудлєнд ||KU-EC2-NL-04 | D166: 880 | E166: * | F166: 1 | G166: 1936.00 | H166: 2.20 | I166: 1819.84 | J166: 939.84 | K166: 2 | L166: =RC[-3]/100*RC[-1] -> 2.20
A167: 13 | B167: H2004/M | C167: Куртка LIBERTY флисовая польский вудлєнд 390г/м (superfine) ||BL-LIB-HF-04 | D167: 561 | E167: * | F167: 1 | G167: 1234.00 | H167: 2.20 | I167: 1159.96 | J167: 598.96 | K167: 2 | L167: =RC[-3]/100*RC[-1] -> 2.20
A168: 14 | B168: H55141/S | C168: Куртка SOLDIER-2008 мультикам (PolyCotton) ||KU-FP8-PR-14 | D168: 914 | E168: * | F168: 1 | G168: 2011.00 | H168: 2.20 | I168: 1809.90 | J168: 895.90 | K168: 2 | L168: =RC[-3]/100*RC[-1] -> 2.20 | M168: =SUM(R[-14]C[-1]:RC[-1]) -> 
A170: #11931 (2015-01-28) Магазин Верхнього одягу - Відправлено-Продано
A171: N | B171: арт | C171: назва | D171: закуп | F171: к-ть | G171: цiна | H171: кф | I171: продж | J171: дохiд | K171: % | L171: з-та
A172: 1 | B172: H2233/2XL | C172: Куртка GUNFIGHTER MP Camo||KU-GUN-FM-33 | D172: 1116 | E172: * | F172: 1 | G172: 2456.00 | H172: 2.20 | I172: 2210.40 | J172: 1094.40 | K172: 2 | L172: =RC[-3]/100*RC[-1] -> 2.20
A173: 2 | B173: H2033/XL | C173: Куртка LIBERTY флисовая MP Camo 390г/м (superfine) ||BL-LIB-HF-33 | D173: 621 | E173: * | F173: 1 | G173: 1365.00 | H173: 2.20 | I173: 1228.50 | J173: 607.50 | K173: 2 | L173: =RC[-3]/100*RC[-1] -> 2.20
A174: 3 | B174: H6101/41 | C174: Берцы FIELD CUIR WATERPROOF GK ||BU-FCW-LE-01 | D174: 1278 | E174: * | F174: 1 | G174: 2812.00 | H174: 2.20 | I174: 2812.00 | J174: 1534.00 | K174: 2 | L174: =RC[-3]/100*RC[-1] -> 2.20
A175: 4 | B175: R1284/42 | C175: Берци кожа чёрные утепленные Украина | D175: 1400 | E175: * | F175: 1 | G175: 2001.00 | H175: 1.43 | I175: 1600.80 | J175: 200.80 | K175: 2 | L175: =RC[-3]/100*RC[-1] -> 1.43
A176: 5 | B176: H2033/L | C176: Куртка LIBERTY флисовая MP Camo 390г/м (superfine) ||BL-LIB-HF-33 | D176: 621 | E176: * | F176: 1 | G176: 1365.00 | H176: 2.20 | I176: 1092.00 | J176: 471.00 | K176: 2 | L176: =RC[-3]/100*RC[-1] -> 2.20
A177: 6 | B177: H2033/M | C177: Куртка LIBERTY флисовая MP Camo 390г/м (superfine) ||BL-LIB-HF-33 | D177: 621 | E177: * | F177: 1 | G177: 1365.00 | H177: 2.20 | I177: 1365.00 | J177: 744.00 | K177: 2 | L177: =RC[-3]/100*RC[-1] -> 2.20
A178: 7 | B178: _10147/G/01 | C178: BW куртка флектарн б/у ||91010500 | D178: 80 | E178: * | F178: 1 | G178: 184.00 | H178: 2.30 | I178: 184.00 | J178: 104.00 | K178: 2 | L178: =RC[-3]/100*RC[-1] -> 2.30 | M178: =SUM(R[-7]C[-1]:RC[-1]) -> 
A180: #11964 (2015-01-29) Магазин Верхнього одягу - Відправлено-Продано
A181: N | B181: арт | C181: назва | D181: закуп | F181: к-ть | G181: цiна | H181: кф | I181: продж | J181: дохiд | K181: % | L181: з-та
A182: 1 | B182: _10147/G/14 | C182: BW куртка флектарн б/у ||91010500 | D182: 80 | E182: * | F182: 1 | G182: 184.00 | H182: 2.30 | I182: 184.00 | J182: 104.00 | K182: 2 | L182: =RC[-3]/100*RC[-1] -> 2.30
A183: 2 | B183: H6130/41 | C183: Берцы Trekking YUKON коричневые ||BU-TYU-LE-30 | D183: 1980 | E183: * | F183: 1 | G183: 4356.00 | H183: 2.20 | I183: 4356.00 | J183: 2376.00 | K183: 2 | L183: =RC[-3]/100*RC[-1] -> 2.20 | M183: =SUM(R[-2]C[-1]:RC[-1]) -> 
A185: #11998 (2015-01-30) Магазин Верхнього одягу - Відправлено-Продано
A186: N | B186: арт | C186: назва | D186: закуп | F186: к-ть | G186: цiна | H186: кф | I186: продж | J186: дохiд | K186: % | L186: з-та
A187: 1 | B187: _114441/XXL | C187: Штани спортивные зелёные | D187: 112 | E187: * | F187: 1 | G187: 76.00 | H187: 0.68 | I187: 76.00 | J187: -36.00 | K187: 2 | L187: =RC[-3]/100*RC[-1] -> 0.68
A188: 2 | B188: H2014/M | C188: Куртка LIBERTY флисовая мультикам 390г/м (superfine) ||BL-LIB-HF-14 | D188: 620 | E188: * | F188: 1 | G188: 1364.00 | H188: 2.20 | I188: 1364.00 | J188: 744.00 | K188: 2 | L188: =RC[-3]/100*RC[-1] -> 2.20
A189: 3 | B189: M800114/44.5 | C189: Берцы MAGNUM Elite Spider 8.0(EU) Desert | D189: 955 | E189: * | F189: 1 | G189: 1680.00 | H189: 1.76 | I189: 1680.00 | J189: 725.00 | K189: 2 | L189: =RC[-3]/100*RC[-1] -> 1.76
A190: 4 | B190: R1284/43 | C190: Берци кожа чёрные утепленные Украина | D190: 1400 | E190: * | F190: 1 | G190: 2001.00 | H190: 1.43 | I190: 1800.90 | J190: 400.90 | K190: 2 | L190: =RC[-3]/100*RC[-1] -> 1.43
A191: 5 | B191: H55141/L | C191: Куртка SOLDIER-2008 мультикам (PolyCotton) ||KU-FP8-PR-14 | D191: 914 | E191: * | F191: 1 | G191: 2011.00 | H191: 2.20 | I191: 2011.00 | J191: 1097.00 | K191: 2 | L191: =RC[-3]/100*RC[-1] -> 2.20
A192: 6 | B192: H10011/XL | C192: ECWCS куртка TRILAMINAT чёрная с підстібкою POLAR ||KU-EC2-NP-01 | D192: 951 | E192: * | F192: 1 | G192: 2091.00 | H192: 2.20 | I192: 1672.80 | J192: 721.80 | K192: 2 | L192: =RC[-3]/100*RC[-1] -> 2.20
A193: 7 | B193: 91604/44 | C193: Ботинки Trekking North Track brown | D193: 820 | E193: * | F193: 1 | G193: 1272.00 | H193: 1.55 | I193: 1144.80 | J193: 324.80 | K193: 2 | L193: =RC[-3]/100*RC[-1] -> 1.55
A194: 8 | B194: H26141/L | C194: Куртка PATRIOT флисовая мультикам 390г/м (superfine) ||BL-PAT-HF-14 | D194: 621 | E194: * | F194: 3 | G194: 1365.00 | H194: 2.20 | I194: 3276.00 | J194: 1413.00 | K194: 2 | L194: =RC[-3]/100*RC[-1] -> 2.20
A195: 9 | B195: H26141/M | C195: Куртка PATRIOT флисовая мультикам 390г/м (superfine) ||BL-PAT-HF-14 | D195: 621 | E195: * | F195: 7 | G195: 1365.00 | H195: 2.20 | I195: 7644.00 | J195: 3297.00 | K195: 2 | L195: =RC[-3]/100*RC[-1] -> 2.20 | M195: =SUM(R[-9]C[-1]:RC[-1]) -> 
A197: #12014 (2015-01-31) Магазин Верхнього одягу - Відправлено-Продано
A198: N | B198: арт | C198: назва | D198: закуп | F198: к-ть | G198: цiна | H198: кф | I198: продж | J198: дохiд | K198: % | L198: з-та
A199: 1 | B199: L10147/190-112 | C199: Куртка дезерт DPM с капюшоном | D199: 362 | E199: * | F199: 1 | G199: 675.00 | H199: 1.86 | I199: 675.00 | J199: 313.00 | K199: 2 | L199: =RC[-3]/100*RC[-1] -> 1.86
A200: 2 | B200: H2233/S | C200: Куртка GUNFIGHTER MP Camo||KU-GUN-FM-33 | D200: 1116 | E200: * | F200: 1 | G200: 2456.00 | H200: 2.20 | I200: 2456.00 | J200: 1340.00 | K200: 2 | L200: =RC[-3]/100*RC[-1] -> 2.20
A201: 3 | B201: H6001/45 | C201: Берцы FIELD CUIR TOILE GK ||BU-FCT-LE-01 | D201: 888 | E201: * | F201: 1 | G201: 1954.00 | H201: 2.20 | I201: 1856.30 | J201: 968.30 | K201: 2 | L201: =RC[-3]/100*RC[-1] -> 2.20
A202: 4 | B202: R1283/40 | C202: Берци кожа чёрные Украина | D202: 1400 | E202: * | F202: 1 | G202: 2001.00 | H202: 1.43 | I202: 1800.90 | J202: 400.90 | K202: 2 | L202: =RC[-3]/100*RC[-1] -> 1.43
A203: 5 | B203: H2004/S | C203: Куртка LIBERTY флисовая польский вудлєнд 390г/м (superfine) ||BL-LIB-HF-04 | D203: 561 | E203: * | F203: 1 | G203: 1234.00 | H203: 2.20 | I203: 1110.60 | J203: 549.60 | K203: 2 | L203: =RC[-3]/100*RC[-1] -> 2.20
A204: 6 | B204: H65031/S | C204: Куртка М65 с отстегивающейся курткой вудлэнд (NYCO) ||KU-M65-NY-03 | D204: 744 | E204: * | F204: 1 | G204: 1638.00 | H204: 2.20 | I204: 1474.20 | J204: 730.20 | K204: 2 | L204: =RC[-3]/100*RC[-1] -> 2.20
A205: 7 | B205: H2014/M | C205: Куртка LIBERTY флисовая мультикам 390г/м (superfine) ||BL-LIB-HF-14 | D205: 620 | E205: * | F205: 1 | G205: 1364.00 | H205: 2.20 | I205: 1365.00 | J205: 745.00 | K205: 2 | L205: =RC[-3]/100*RC[-1] -> 2.20
A206: 8 | B206: H2027/S | C206: Куртка LIBERTY флисовая Jungle Green 390г/м (superfine) ||BL-LIB-HF-27 | D206: 561 | E206: * | F206: 1 | G206: 1234.00 | H206: 2.20 | I206: 1234.00 | J206: 673.00 | K206: 2 | L206: =RC[-3]/100*RC[-1] -> 2.20
A207: 9 | B207: R1284/42 | C207: Берци кожа чёрные утепленные Украина | D207: 1400 | E207: * | F207: 1 | G207: 2001.00 | H207: 1.43 | I207: 2001.00 | J207: 601.00 | K207: 2 | L207: =RC[-3]/100*RC[-1] -> 1.43
A208: 10 | B208: A19-173/XXL | C208: Пуловер охотничий ACROPOLIS ||ОПМ/XXL | D208: 153 | E208: * | F208: 1 | G208: 214.00 | H208: 1.40 | I208: 214.00 | J208: 61.00 | K208: 2 | L208: =RC[-3]/100*RC[-1] -> 1.40
A209: 11 | B209: H14202/L | C209: Безрукавка охотничья FOX ||KK-FOX-PO-02 | D209: 297 | E209: * | F209: 1 | G209: 653.00 | H209: 2.20 | I209: 653.00 | J209: 356.00 | K209: 2 | L209: =RC[-3]/100*RC[-1] -> 2.20 | M209: =SUM(R[-11]C[-1]:RC[-1]) -> 
A211: #12024 (2015-02-02) Магазин Верхнього одягу - Відправлено-Продано
A212: N | B212: арт | C212: назва | D212: закуп | F212: к-ть | G212: цiна | H212: кф | I212: продж | J212: дохiд | K212: % | L212: з-та
A213: 1 | B213: 833774/L | C213: Костюм дождевик Adventure | D213: 275 | E213: * | F213: 1 | G213: 435.00 | H213: 1.58 | I213: 435.00 | J213: 160.00 | K213: 2 | L213: =RC[-3]/100*RC[-1] -> 1.58
A214: 2 | B214: H2033/L | C214: Куртка LIBERTY флисовая MP Camo 390г/м (superfine) ||BL-LIB-HF-33 | D214: 621 | E214: * | F214: 1 | G214: 1365.00 | H214: 2.20 | I214: 1228.50 | J214: 607.50 | K214: 2 | L214: =RC[-3]/100*RC[-1] -> 2.20
A215: 3 | B215: H65021/3XLR | C215: Куртка М65 с отстегивающейся курткой олива (NYCO) ||KU-M65-NY-02 | D215: 768 | E215: * | F215: 1 | G215: 1689.00 | H215: 2.20 | I215: 1435.65 | J215: 667.65 | K215: 2 | L215: =RC[-3]/100*RC[-1] -> 2.20
A216: 4 | B216: H12141/XXL | C216: ECWCS куртка TRILAMINAT Gen.2 мультикам ||KU-EC2-NL-14 | D216: 880 | E216: * | F216: 1 | G216: 1936.00 | H216: 2.20 | I216: 1645.60 | J216: 765.60 | K216: 2 | L216: =RC[-3]/100*RC[-1] -> 2.20
A217: 5 | B217: H26141/3XL | C217: Куртка PATRIOT флисовая мультикам 390г/м (superfine) ||BL-PAT-HF-14 | D217: 621 | E217: * | F217: 1 | G217: 1365.00 | H217: 2.20 | I217: 1160.25 | J217: 539.25 | K217: 2 | L217: =RC[-3]/100*RC[-1] -> 2.20
A218: 6 | B218: M800114/46 | C218: Берцы MAGNUM Elite Spider 8.0(EU) Desert | D218: 955 | E218: * | F218: 1 | G218: 1680.00 | H218: 1.76 | I218: 1428.00 | J218: 473.00 | K218: 2 | L218: =RC[-3]/100*RC[-1] -> 1.76 | M218: =SUM(R[-6]C[-1]:RC[-1]) -> 