Sheet:  name
D1: Вхiднi данi | H1: Зкореговано
C2: Закуп: | D2: 51344 | G2: грн
C3: Продано: | D3: 76533 | G3: грн
C4: Дохiд-Коефiцiент: | D4: 25189(1.49)
C5: Процент з-ти: | D5: 2 | G5: %
C6: Нараховано з-ти: | D6: 1530.65 | G6: грн | H6: =SUM(R[4]C[4]:R[283]C[4]) -> 
B7: курси: Все 0 , грн 1 , usd 20 , euro 25 , zl 5 , Инт 20 ,
A9: #11569 (2015-01-09) магазин Зброя - Відправлено-Продано
A10: N | B10: арт | C10: назва | D10: закуп | F10: к-ть | G10: цiна | H10: кф | I10: продж | J10: дохiд | K10: % | L10: з-та
A11: 1 | B11: GW2086 | C11: Плоскогубцы GRAND WAY | D11: 10.98 | E11: Инт | F11: 1 | G11: 365.00 | H11: 1.66 | I11: 365.00 | J11: 145.49 | K11: 2 | L11: =RC[-3]/100*RC[-1] -> 1.66
A12: 2 | B12: _M015 | C12: Нож NAVY Enlan | D12: 4.96 | E12: Инт | F12: 1 | G12: 122.00 | H12: 1.23 | I12: 122.00 | J12: 22.80 | K12: 2 | L12: =RC[-3]/100*RC[-1] -> 1.23
A13: 3 | B13: GW6241BCS | C13: Нож GRAND WAY складной | D13: 3.97 | E13: Инт | F13: 1 | G13: 132.00 | H13: 1.66 | I13: 132.00 | J13: 52.59 | K13: 2 | L13: =RC[-3]/100*RC[-1] -> 1.66
A14: 4 | B14: _N14086-5 | C14: Нож складной балисонг | D14: 3.60 | E14: Инт | F14: 1 | G14: 110.00 | H14: 1.53 | I14: 110.00 | J14: 38.00 | K14: 2 | L14: =RC[-3]/100*RC[-1] -> 1.53
A15: 5 | B15: _2514HW | C15: Дартс 46х3,5см | D15: 62.00 | E15: usd | F15: 1 | G15: 1215.00 | H15: 0.98 | I15: 1215.00 | J15: -25.00 | K15: 2 | L15: =RC[-3]/100*RC[-1] -> 0.98
A16: 6 | B16: _204.78.94 | C16: Нож OPINEL Outdoor зеленый | D16: 16.00 | E16: euro | F16: 1 | G16: 600.00 | H16: 1.50 | I16: 600.00 | J16: 200.00 | K16: 2 | L16: =RC[-3]/100*RC[-1] -> 1.50
A17: 7 | B17: _204.78.92 | C17: Нож OPINEL Outdoor синий | D17: 16.00 | E17: euro | F17: 1 | G17: 600.00 | H17: 1.50 | I17: 600.00 | J17: 200.00 | K17: 2 | L17: =RC[-3]/100*RC[-1] -> 1.50
A18: 8 | B18: _21021 | C18: BRUNOX масло для оружия 100 мл | D18: 3.76 | E18: Инт | F18: 1 | G18: 113.00 | H18: 1.50 | I18: 113.00 | J18: 37.90 | K18: 2 | L18: =RC[-3]/100*RC[-1] -> 1.50
A19: 9 | B19: _82-25 | C19: OXYDA засіб для холодного вороніння NU-BLAK 25г | D19: 4.00 | E19: Инт | F19: 1 | G19: 121.00 | H19: 1.51 | I19: 121.00 | J19: 41.00 | K19: 2 | L19: =RC[-3]/100*RC[-1] -> 1.51
A20: 10 | B20: _82-50R | C20: OXYDA засіб для холодного вороніння NU-BLAK 50г (рідкий) | D20: 3.81 | E20: Инт | F20: 1 | G20: 124.00 | H20: 1.63 | I20: 124.00 | J20: 47.79 | K20: 2 | L20: =RC[-3]/100*RC[-1] -> 1.63
A21: 11 | B21: _82-00 | C21: OXYDA активатор для холодного вороніння NU-BLAK 50г | D21: 2.69 | E21: Инт | F21: 1 | G21: 82.00 | H21: 1.52 | I21: 82.00 | J21: 28.21 | K21: 2 | L21: =RC[-3]/100*RC[-1] -> 1.52
A22: 12 | B22: _82-00 | C22: OXYDA активатор для холодного вороніння NU-BLAK 50г | D22: 2.69 | E22: Инт | F22: 1 | G22: 82.00 | H22: 1.52 | I22: 0.00 | J22: -53.79 | K22: 2 | L22: =RC[-3]/100*RC[-1] -> 1.52
A23: 13 | B23: _1684 | C23: Патрон Флобера 4мм Нобель | D23: 0.20 | E23: Инт | F23: 9 | G23: 6.00 | H23: 1.47 | I23: 54.00 | J23: 17.36 | K23: 2 | L23: =RC[-3]/100*RC[-1] -> 1.47
A24: 14 | B24: _4.1687 | C24: Балон СО-2 UMAREX 12г | D24: 0.39 | E24: Инт | F24: 4 | G24: 12.00 | H24: 1.54 | I24: 48.00 | J24: 16.83 | K24: 2 | L24: =RC[-3]/100*RC[-1] -> 1.54
A25: 15 | B25: _15479200 | C25: WH багнет 98K в піхвах (репро) новий прихід||15479200 | D25: 29.50 | E25: euro | F25: 1 | G25: 1564.00 | H25: 2.12 | I25: 1251.20 | J25: 513.70 | K25: 2 | L25: =RC[-3]/100*RC[-1] -> 2.12
A26: 16 | B26: _18774 | C26: Чохол на багнет ||18281100 | D26: 6.00 | E26: euro | F26: 1 | G26: 369.00 | H26: 2.46 | I26: 295.20 | J26: 145.20 | K26: 2 | L26: =RC[-3]/100*RC[-1] -> 2.46
A27: 17 | B27: _2317322 | C27: Патрон шумовой 9мм OZKURSAN | D27: 0.33 | E27: Инт | F27: 2 | G27: 10.00 | H27: 1.52 | I27: 20.00 | J27: 6.80 | K27: 2 | L27: =RC[-3]/100*RC[-1] -> 1.52
A28: 18 | B28: _K17122-E | C28: Очки FL8008 затемненные ||M51617122-TEA | D28: 3.70 | E28: usd | F28: 1 | G28: 159.00 | H28: 2.15 | I28: 159.00 | J28: 85.00 | K28: 2 | L28: =RC[-3]/100*RC[-1] -> 2.15
A29: 19 | B29: _1684 | C29: Патрон Флобера 4мм Нобель | D29: 0.20 | E29: Инт | F29: 32 | G29: 6.00 | H29: 1.47 | I29: 192.00 | J29: 61.71 | K29: 2 | L29: =RC[-3]/100*RC[-1] -> 1.47
A30: 20 | B30: GW5011D | C30: Нож многофункциональный GRAND WAY | D30: 1.19 | E30: Инт | F30: 1 | G30: 40.00 | H30: 1.68 | I30: 40.00 | J30: 16.22 | K30: 2 | L30: =RC[-3]/100*RC[-1] -> 1.68 | M30: =SUM(R[-20]C[-1]:RC[-1]) -> 
A32: #11595 (2015-01-10) магазин Зброя - Відправлено-Продано
A33: N | B33: арт | C33: назва | D33: закуп | F33: к-ть | G33: цiна | H33: кф | I33: продж | J33: дохiд | K33: % | L33: з-та
A34: 1 | B34: _1.1802 | C34: Бинокль YUKON 12x50WA ||ПС 22023 | D34: 914 | E34: * | F34: 1 | G34: 1715.00 | H34: 1.88 | I34: 1715.00 | J34: 801.00 | K34: 2 | L34: =RC[-3]/100*RC[-1] -> 1.88
A35: 2 | B35: _D910 | C35: Нож м-р ГРАЄВСЬКИЙ складной | D35: 425 | E35: * | F35: 1 | G35: 555.00 | H35: 1.31 | I35: 555.00 | J35: 130.00 | K35: 2 | L35: =RC[-3]/100*RC[-1] -> 1.31
A36: 3 | B36: K16182L | C36: Кольцо для оптики низьке 30 mm RIS [Производитель: ACM] ||M51616182 | D36: 42 | E36: * | F36: 1 | G36: 107.00 | H36: 2.55 | I36: 107.00 | J36: 65.00 | K36: 2 | L36: =RC[-3]/100*RC[-1] -> 2.55
A37: 4 | B37: _1684 | C37: Патрон Флобера 4мм Нобель | D37: 4 | E37: * | F37: 15 | G37: 6.00 | H37: 1.50 | I37: 90.00 | J37: 30.00 | K37: 2 | L37: =RC[-3]/100*RC[-1] -> 1.50
A38: 5 | B38: _1201 | C38: Винтовка кремниевая Кентуки США 19ст. (110см) | D38: 1330 | E38: * | F38: 1 | G38: 1733.00 | H38: 1.30 | I38: 1559.70 | J38: 229.70 | K38: 2 | L38: =RC[-3]/100*RC[-1] -> 1.30
A39: 6 | B39: _048B | C39: Сабля SHAMSHIR | D39: 618 | E39: * | F39: 1 | G39: 926.00 | H39: 1.50 | I39: 833.40 | J39: 215.40 | K39: 2 | L39: =RC[-3]/100*RC[-1] -> 1.50
A40: 7 | B40: 120740 | C40: Точило FISKARS | D40: 221 | E40: * | F40: 1 | G40: 309.00 | H40: 1.40 | I40: 309.00 | J40: 88.00 | K40: 2 | L40: =RC[-3]/100*RC[-1] -> 1.40
A41: 8 | B41: AA55 | C41: Батарейка DURACELL Turbo AA ||_80317 | D41: 7 | E41: * | F41: 3 | G41: 11.00 | H41: 1.57 | I41: 33.00 | J41: 12.00 | K41: 2 | L41: =RC[-3]/100*RC[-1] -> 1.57
A42: 9 | B42: _297386 | C42: Батарейка ENERGIZER Base AAA | D42: 5 | E42: * | F42: 4 | G42: 8.00 | H42: 1.60 | I42: 32.00 | J42: 12.00 | K42: 2 | L42: =RC[-3]/100*RC[-1] -> 1.60
A43: 10 | B43: _1.1810 | C43: Бинокль YUKON 8-24x50 WA ||22121 | D43: 1401 | E43: * | F43: 1 | G43: 1966.00 | H43: 1.40 | I43: 1828.38 | J43: 427.38 | K43: 2 | L43: =RC[-3]/100*RC[-1] -> 1.40
A44: 11 | B44: _DS-0.752 | C44: Пульки ШЕРШЕНЬ 4.5мм 0.75г (200шт) | D44: 20 | E44: * | F44: 1 | G44: 37.00 | H44: 1.85 | I44: 37.00 | J44: 17.00 | K44: 2 | L44: =RC[-3]/100*RC[-1] -> 1.85
A45: 12 | B45: _4.1687 | C45: Балон СО-2 UMAREX 12г | D45: 8 | E45: * | F45: 1 | G45: 12.00 | H45: 1.50 | I45: 12.00 | J45: 4.00 | K45: 2 | L45: =RC[-3]/100*RC[-1] -> 1.50
A46: 13 | B46: _DS-0.282 | C46: Пульки ШЕРШЕНЬ 4.5мм 0.28г (2500шт) | D46: 65 | E46: * | F46: 1 | G46: 108.00 | H46: 1.66 | I46: 108.00 | J46: 43.00 | K46: 2 | L46: =RC[-3]/100*RC[-1] -> 1.66
A47: 14 | B47: _141425 | C47: Мишень 14x14cм (25шт) | D47: 9 | E47: * | F47: 4 | G47: 23.00 | H47: 2.56 | I47: 92.00 | J47: 56.00 | K47: 2 | L47: =RC[-3]/100*RC[-1] -> 2.56
A48: 15 | B48: _429.00.02 | C48: Масло для чистки Clever BALLISTOL 50мл спрей | D48: 73 | E48: * | F48: 1 | G48: 120.00 | H48: 1.64 | I48: 120.00 | J48: 47.00 | K48: 2 | L48: =RC[-3]/100*RC[-1] -> 1.64
A49: 16 | B49: _898-9130 | C49: Набор для чистки оружия 4.5 мм | D49: 83 | E49: * | F49: 1 | G49: 137.00 | H49: 1.65 | I49: 137.00 | J49: 54.00 | K49: 2 | L49: =RC[-3]/100*RC[-1] -> 1.65
A50: 17 | B50: _TiA9 | C50: Фонарик TIABLO A09 | D50: 1333 | E50: * | F50: 1 | G50: 1867.00 | H50: 1.40 | I50: 1867.00 | J50: 534.00 | K50: 2 | L50: =RC[-3]/100*RC[-1] -> 1.40
A51: 18 | B51: _XT-B2 | C51: Винтовка пневматическая XTSG XT-B2 | D51: 657 | E51: * | F51: 1 | G51: 988.00 | H51: 1.50 | I51: 988.00 | J51: 331.00 | K51: 2 | L51: =RC[-3]/100*RC[-1] -> 1.50 | M51: =SUM(R[-18]C[-1]:RC[-1]) -> 
A53: #11611 (2015-01-12) магазин Зброя - Відправлено-Продано
A54: N | B54: арт | C54: назва | D54: закуп | F54: к-ть | G54: цiна | H54: кф | I54: продж | J54: дохiд | K54: % | L54: з-та
A55: 1 | B55: _DS-0.286 | C55: Пульки ШЕРШЕНЬ 4.5мм 0.28г (600шт) | D55: 16 | E55: * | F55: 1 | G55: 30.00 | H55: 1.88 | I55: 30.00 | J55: 14.00 | K55: 2 | L55: =RC[-3]/100*RC[-1] -> 1.88
A56: 2 | B56: _4.0524.31 | C56: Чохол VICTORINOX поясной кожаный чёрный | D56: 200 | E56: * | F56: 1 | G56: 310.00 | H56: 1.55 | I56: 310.00 | J56: 110.00 | K56: 2 | L56: =RC[-3]/100*RC[-1] -> 1.55
A57: 3 | B57: _N1920S | C57: Нож NAVY (с викруткою) (синий) | D57: 147 | E57: * | F57: 1 | G57: 178.00 | H57: 1.21 | I57: 160.00 | J57: 13.00 | K57: 2 | L57: =RC[-3]/100*RC[-1] -> 1.21
A58: 4 | B58: _N3893S | C58: Нож FlipZip (2 леза) | D58: 195 | E58: * | F58: 1 | G58: 239.00 | H58: 1.23 | I58: 239.00 | J58: 44.00 | K58: 2 | L58: =RC[-3]/100*RC[-1] -> 1.23
A59: 5 | B59: _N939393 | C59: Нож нескладной | D59: 83 | E59: * | F59: 1 | G59: 133.00 | H59: 1.60 | I59: 133.00 | J59: 50.00 | K59: 2 | L59: =RC[-3]/100*RC[-1] -> 1.60
A60: 6 | B60: _YF045 | C60: Нож метательный (комплект 3 шт) | D60: 109 | E60: * | F60: 1 | G60: 178.00 | H60: 1.63 | I60: 178.00 | J60: 69.00 | K60: 2 | L60: =RC[-3]/100*RC[-1] -> 1.63
A61: 7 | B61: _6320024 | C61: Пульки GAMO Match 4.5мм 0.5г (250шт) | D61: 24 | E61: * | F61: 1 | G61: 38.00 | H61: 1.58 | I61: 38.00 | J61: 14.00 | K61: 2 | L61: =RC[-3]/100*RC[-1] -> 1.58 | M61: =SUM(R[-7]C[-1]:RC[-1]) -> 
A63: #11634 (2015-01-13) магазин Зброя - Відправлено-Продано
A64: N | B64: арт | C64: назва | D64: закуп | F64: к-ть | G64: цiна | H64: кф | I64: продж | J64: дохiд | K64: % | L64: з-та
A65: 1 | B65: _G620-Y2 | C65: Нож GANZO G620-Y2 | D65: 135 | E65: * | F65: 1 | G65: 223.00 | H65: 1.65 | I65: 223.00 | J65: 88.00 | K65: 2 | L65: =RC[-3]/100*RC[-1] -> 1.65
A66: 2 | B66: _1.1606 | C66: Бинокль TASCO 22x36 ||B-22 | D66: 322 | E66: * | F66: 1 | G66: 516.00 | H66: 1.60 | I66: 464.40 | J66: 142.40 | K66: 2 | L66: =RC[-3]/100*RC[-1] -> 1.60
A67: 3 | B67: _K17122-E | C67: Очки FL8008 затемненные ||M51617122-TEA | D67: 74 | E67: * | F67: 1 | G67: 159.00 | H67: 2.15 | I67: 143.10 | J67: 69.10 | K67: 2 | L67: =RC[-3]/100*RC[-1] -> 2.15
A68: 4 | B68: _204.78.55 | C68: Нож OPINEL 7VRI блистер | D68: 165 | E68: * | F68: 1 | G68: 248.00 | H68: 1.50 | I68: 248.00 | J68: 83.00 | K68: 2 | L68: =RC[-3]/100*RC[-1] -> 1.50
A69: 5 | B69: _K17066-B | C69: Окуляри защитные чёрные ||M51617066-TEA | D69: 59 | E69: * | F69: 1 | G69: 152.00 | H69: 2.58 | I69: 136.80 | J69: 77.80 | K69: 2 | L69: =RC[-3]/100*RC[-1] -> 2.58
A70: 6 | B70: _DS-0.406 | C70: Пульки ШЕРШЕНЬ 4.5мм 0.40г (600шт) | D70: 18 | E70: * | F70: 1 | G70: 33.00 | H70: 1.83 | I70: 33.00 | J70: 15.00 | K70: 2 | L70: =RC[-3]/100*RC[-1] -> 1.83
A71: 7 | B71: _DS-0.752 | C71: Пульки ШЕРШЕНЬ 4.5мм 0.75г (200шт) | D71: 20 | E71: * | F71: 1 | G71: 37.00 | H71: 1.85 | I71: 37.00 | J71: 17.00 | K71: 2 | L71: =RC[-3]/100*RC[-1] -> 1.85
A72: 8 | B72: _X-1000-SV | C72: Винтовка пневматическая HATSAN Striker 1000S Vortex | D72: 1640 | E72: * | F72: 1 | G72: 2296.00 | H72: 1.40 | I72: 2296.00 | J72: 656.00 | K72: 2 | L72: =RC[-3]/100*RC[-1] -> 1.40
A73: 9 | B73: _G702B | C73: Нож GANZO G702B | D73: 273 | E73: * | F73: 1 | G73: 450.00 | H73: 1.65 | I73: 405.00 | J73: 132.00 | K73: 2 | L73: =RC[-3]/100*RC[-1] -> 1.65
A74: 10 | B74: _GM4x28 | C74: Прицел оптический GAMO 4x28 | D74: 152 | E74: * | F74: 1 | G74: 228.00 | H74: 1.50 | I74: 228.00 | J74: 76.00 | K74: 2 | L74: =RC[-3]/100*RC[-1] -> 1.50 | M74: =SUM(R[-10]C[-1]:RC[-1]) -> 
A76: #11653 (2015-01-14) магазин Зброя - Відправлено-Продано
A77: N | B77: арт | C77: назва | D77: закуп | F77: к-ть | G77: цiна | H77: кф | I77: продж | J77: дохiд | K77: % | L77: з-та
A78: 1 | B78: Бабки | C78: Прихід Грошей | D78: 0.00 | E78: грн | F78: 1 | G78: 0.00 | H78: 0.00 | I78: 83.00 | J78: 82.00 | K78: 2 | L78: =RC[-3]/100*RC[-1] -> 0.00
A79: 2 | B79: _M11746 | C79: Нож Morakniv™ Companion HeavyDuty MG | D79: 183 | E79: * | F79: 1 | G79: 284.00 | H79: 1.55 | I79: 284.00 | J79: 101.00 | K79: 2 | L79: =RC[-3]/100*RC[-1] -> 1.55
A80: 3 | B80: GW4321-2 | C80: Нож GRAND WAY НДТР-2 (псевдодамаск) | D80: 588 | E80: * | F80: 1 | G80: 978.00 | H80: 1.66 | I80: 978.00 | J80: 390.00 | K80: 2 | L80: =RC[-3]/100*RC[-1] -> 1.66
A81: 4 | B81: _E01/BL | C81: Фонарь FENIX E01 чёрный | D81: 182 | E81: * | F81: 1 | G81: 273.00 | H81: 1.50 | I81: 273.00 | J81: 91.00 | K81: 2 | L81: =RC[-3]/100*RC[-1] -> 1.50
A82: 5 | B82: _DS-0.683 | C82: Пульки ШЕРШЕНЬ HUNTER 4.5мм 0.68г (360шт) | D82: 33 | E82: * | F82: 1 | G82: 59.00 | H82: 1.79 | I82: 59.00 | J82: 26.00 | K82: 2 | L82: =RC[-3]/100*RC[-1] -> 1.79
A83: 6 | B83: GW6241BCS | C83: Нож GRAND WAY складной | D83: 79 | E83: * | F83: 1 | G83: 132.00 | H83: 1.67 | I83: 131.00 | J83: 52.00 | K83: 2 | L83: =RC[-3]/100*RC[-1] -> 1.67
A84: 7 | B84: _409409 | C84: Нож складной COLUMBIA | D84: 91 | E84: * | F84: 1 | G84: 150.00 | H84: 1.65 | I84: 150.00 | J84: 59.00 | K84: 2 | L84: =RC[-3]/100*RC[-1] -> 1.65 | M84: =SUM(R[-7]C[-1]:RC[-1]) -> 
A86: #11675 (2015-01-15) магазин Зброя - Відправлено-Продано
A87: N | B87: арт | C87: назва | D87: закуп | F87: к-ть | G87: цiна | H87: кф | I87: продж | J87: дохiд | K87: % | L87: з-та
A88: 1 | B88: _1.2000 | C88: Нож MORA 2000 Stainless Steel K J Eriksson ||NZ-200-ST-02 | D88: 343 | E88: * | F88: 1 | G88: 531.00 | H88: 1.55 | I88: 531.00 | J88: 188.00 | K88: 2 | L88: =RC[-3]/100*RC[-1] -> 1.55
A89: 2 | B89: _1.1808 | C89: Бинокль YUKON 30x50 ||00609 | D89: 1258 | E89: * | F89: 1 | G89: 1765.00 | H89: 1.40 | I89: 1765.00 | J89: 507.00 | K89: 2 | L89: =RC[-3]/100*RC[-1] -> 1.40
A90: 3 | B90: _G702B | C90: Нож GANZO G702B | D90: 273 | E90: * | F90: 1 | G90: 450.00 | H90: 1.65 | I90: 450.00 | J90: 177.00 | K90: 2 | L90: =RC[-3]/100*RC[-1] -> 1.65
A91: 4 | B91: _G620-B2 | C91: Нож GANZO G620-B2 | D91: 135 | E91: * | F91: 1 | G91: 223.00 | H91: 1.65 | I91: 223.00 | J91: 88.00 | K91: 2 | L91: =RC[-3]/100*RC[-1] -> 1.65
A92: 5 | B92: _K17121-TR | C92: Очки FL8013 прозрачные ||M51617121-TRANSP | D92: 60 | E92: * | F92: 1 | G92: 152.00 | H92: 2.53 | I92: 152.00 | J92: 92.00 | K92: 2 | L92: =RC[-3]/100*RC[-1] -> 2.53
A93: 6 | B93: _KWC-0548 | C93: Пістолет пневматичний KWC PM (KM-44 DHN) | D93: 834 | E93: * | F93: 1 | G93: 1250.00 | H93: 1.50 | I93: 1250.00 | J93: 416.00 | K93: 2 | L93: =RC[-3]/100*RC[-1] -> 1.50
A94: 7 | B94: _4.1687 | C94: Балон СО-2 UMAREX 12г | D94: 8 | E94: * | F94: 3 | G94: 12.00 | H94: 1.50 | I94: 36.00 | J94: 12.00 | K94: 2 | L94: =RC[-3]/100*RC[-1] -> 1.50
A95: 8 | B95: _429.00.02 | C95: Масло для чистки Clever BALLISTOL 50мл спрей | D95: 73 | E95: * | F95: 1 | G95: 120.00 | H95: 1.64 | I95: 0.00 | J95: -73.00 | K95: 2 | L95: =RC[-3]/100*RC[-1] -> 1.64 | M95: =SUM(R[-8]C[-1]:RC[-1]) -> 
A97: #11696 (2015-01-16) магазин Зброя - Відправлено-Продано
A98: N | B98: арт | C98: назва | D98: закуп | F98: к-ть | G98: цiна | H98: кф | I98: продж | J98: дохiд | K98: % | L98: з-та
A99: 1 | B99: _1684 | C99: Патрон Флобера 4мм Нобель | D99: 4 | E99: * | F99: 55 | G99: 6.00 | H99: 1.50 | I99: 330.00 | J99: 110.00 | K99: 2 | L99: =RC[-3]/100*RC[-1] -> 1.50
A100: 2 | B100: _G202 | C100: Мультитул GANZO G202 | D100: 330 | E100: * | F100: 1 | G100: 544.00 | H100: 1.65 | I100: 544.00 | J100: 214.00 | K100: 2 | L100: =RC[-3]/100*RC[-1] -> 1.65
A101: 3 | B101: _G620-B2 | C101: Нож GANZO G620-B2 | D101: 135 | E101: * | F101: 1 | G101: 223.00 | H101: 1.65 | I101: 223.00 | J101: 88.00 | K101: 2 | L101: =RC[-3]/100*RC[-1] -> 1.65
A102: 4 | B102: _DS-0.282 | C102: Пульки ШЕРШЕНЬ 4.5мм 0.28г (2500шт) | D102: 65 | E102: * | F102: 1 | G102: 108.00 | H102: 1.66 | I102: 108.00 | J102: 43.00 | K102: 2 | L102: =RC[-3]/100*RC[-1] -> 1.66
A103: 5 | B103: _N3890 | C103: Нож NAVY CT002 | D103: 170 | E103: * | F103: 1 | G103: 200.00 | H103: 1.18 | I103: 200.00 | J103: 30.00 | K103: 2 | L103: =RC[-3]/100*RC[-1] -> 1.18
A104: 6 | B104: _2200133 | C104: Нож нескладной BEAR GRYLLS GERBER mod. 31-000752 (копия) | D104: 254 | E104: * | F104: 1 | G104: 417.00 | H104: 1.64 | I104: 417.00 | J104: 163.00 | K104: 2 | L104: =RC[-3]/100*RC[-1] -> 1.64
A105: 7 | B105: _1.05212 | C105: Монокуляр KANDAR 6X30 ||18-0120 | D105: 480 | E105: * | F105: 1 | G105: 723.00 | H105: 1.51 | I105: 723.00 | J105: 243.00 | K105: 2 | L105: =RC[-3]/100*RC[-1] -> 1.51
A106: 8 | B106: _03438 | C106: ПНВ Монокуляр NVMT Spartan 1x24 с маской | D106: 2487 | E106: * | F106: 1 | G106: 4720.00 | H106: 1.90 | I106: 4720.00 | J106: 2233.00 | K106: 2 | L106: =RC[-3]/100*RC[-1] -> 1.90
A107: 9 | B107: _95FB | C107: Нож COLD STEEL Pocket Bushman | D107: 630 | E107: * | F107: 1 | G107: 882.00 | H107: 1.40 | I107: 882.00 | J107: 252.00 | K107: 2 | L107: =RC[-3]/100*RC[-1] -> 1.40
A108: 10 | B108: _6321748 | C108: Пульки GAMO Master TS-10 4.5мм 0.68г (200шт) | D108: 45 | E108: * | F108: 1 | G108: 73.00 | H108: 1.62 | I108: 73.00 | J108: 28.00 | K108: 2 | L108: =RC[-3]/100*RC[-1] -> 1.62 | M108: =SUM(R[-10]C[-1]:RC[-1]) -> 
A110: #11720 (2015-01-19) магазин Зброя - Відправлено-Продано
A111: N | B111: арт | C111: назва | D111: закуп | F111: к-ть | G111: цiна | H111: кф | I111: продж | J111: дохiд | K111: % | L111: з-та
A112: 1 | B112: _297386 | C112: Батарейка ENERGIZER Base AAA | D112: 5 | E112: * | F112: 1 | G112: 8.00 | H112: 1.60 | I112: 8.00 | J112: 3.00 | K112: 2 | L112: =RC[-3]/100*RC[-1] -> 1.60
A113: 2 | B113: _DS-0.683 | C113: Пульки ШЕРШЕНЬ HUNTER 4.5мм 0.68г (360шт) | D113: 33 | E113: * | F113: 1 | G113: 59.00 | H113: 1.79 | I113: 59.00 | J113: 26.00 | K113: 2 | L113: =RC[-3]/100*RC[-1] -> 1.79
A114: 3 | B114: _141425 | C114: Мишень 14x14cм (25шт) | D114: 9 | E114: * | F114: 1 | G114: 23.00 | H114: 2.56 | I114: 23.00 | J114: 14.00 | K114: 2 | L114: =RC[-3]/100*RC[-1] -> 2.56
A115: 4 | B115: _K17066-B | C115: Окуляри защитные чёрные ||M51617066-TEA | D115: 59 | E115: * | F115: 1 | G115: 152.00 | H115: 2.58 | I115: 152.00 | J115: 93.00 | K115: 2 | L115: =RC[-3]/100*RC[-1] -> 2.58
A116: 5 | B116: _18-0401 | C116: Прицел коллиматорный 1x30 Red | D116: 220 | E116: * | F116: 1 | G116: 278.00 | H116: 1.26 | I116: 278.00 | J116: 58.00 | K116: 2 | L116: =RC[-3]/100*RC[-1] -> 1.26
A117: 6 | B117: _M07 | C117: Нож Enlan M07 (8Cr13Mov) пластикова ручка | D117: 109 | E117: * | F117: 1 | G117: 133.00 | H117: 1.22 | I117: 133.00 | J117: 24.00 | K117: 2 | L117: =RC[-3]/100*RC[-1] -> 1.22
A118: 7 | B118: _M08 | C118: Нож NAVY 8Cn13Mov | D118: 87 | E118: * | F118: 1 | G118: 121.00 | H118: 1.39 | I118: 121.00 | J118: 34.00 | K118: 2 | L118: =RC[-3]/100*RC[-1] -> 1.39 | M118: =SUM(R[-7]C[-1]:RC[-1]) -> 
A120: #11726 (2015-01-19) магазин Зброя - Відправлено-Продано
A121: N | B121: арт | C121: назва | D121: закуп | F121: к-ть | G121: цiна | H121: кф | I121: продж | J121: дохiд | K121: % | L121: з-та
A122: 1 | B122: GW5017KL | C122: Нож GRAND WAY складной | D122: 71 | E122: * | F122: 1 | G122: 118.00 | H122: 1.66 | I122: 118.00 | J122: 47.00 | K122: 2 | L122: =RC[-3]/100*RC[-1] -> 1.66
A123: 2 | B123: _G108 | C123: Мультитул GANZO G108 | D123: 262 | E123: * | F123: 1 | G123: 433.00 | H123: 1.65 | I123: 433.00 | J123: 171.00 | K123: 2 | L123: =RC[-3]/100*RC[-1] -> 1.65
A124: 3 | B124: _PR2505 | C124: Револьвер под патрон Флобера PROFI 4.5 (пластик чёрный) | D124: 2334 | E124: * | F124: 1 | G124: 3270.00 | H124: 1.40 | I124: 3270.00 | J124: 936.00 | K124: 2 | L124: =RC[-3]/100*RC[-1] -> 1.40
A125: 4 | B125: _1684 | C125: Патрон Флобера 4мм Нобель | D125: 4 | E125: * | F125: 100 | G125: 6.00 | H125: 1.50 | I125: 600.00 | J125: 200.00 | K125: 2 | L125: =RC[-3]/100*RC[-1] -> 1.50
A126: 5 | B126: _429.00.02 | C126: Масло для чистки Clever BALLISTOL 50мл спрей | D126: 73 | E126: * | F126: 1 | G126: 120.00 | H126: 1.64 | I126: 120.00 | J126: 47.00 | K126: 2 | L126: =RC[-3]/100*RC[-1] -> 1.64
A127: 6 | B127: _201-3406 | C127: Бинокль KONUS Army 7x50 | D127: 32 | E127: * | F127: 1 | G127: 580.00 | H127: 18.13 | I127: 580.00 | J127: 548.00 | K127: 2 | L127: =RC[-3]/100*RC[-1] -> 18.13 | M127: =SUM(R[-6]C[-1]:RC[-1]) -> 
A129: #11747 (2015-01-20) магазин Зброя - Відправлено-Продано
A130: N | B130: арт | C130: назва | D130: закуп | F130: к-ть | G130: цiна | H130: кф | I130: продж | J130: дохiд | K130: % | L130: з-та
A131: 1 | B131: _6321934 | C131: Пульки GAMO Pro-Hunter 4.5мм 0.51г (500шт) | D131: 63 | E131: * | F131: 1 | G131: 102.00 | H131: 1.62 | I131: 102.00 | J131: 39.00 | K131: 2 | L131: =RC[-3]/100*RC[-1] -> 1.62
A132: 2 | B132: _G614 | C132: Нож GANZO G614 | D132: 107 | E132: * | F132: 1 | G132: 177.00 | H132: 1.65 | I132: 164.61 | J132: 57.61 | K132: 2 | L132: =RC[-3]/100*RC[-1] -> 1.65
A133: 3 | B133: _BE-211 | C133: Нож BENCHMADE Snody Activator** | D133: 1800 | E133: * | F133: 1 | G133: 1080.00 | H133: 0.60 | I133: 1026.00 | J133: -774.00 | K133: 2 | L133: =RC[-3]/100*RC[-1] -> 0.60
A134: 4 | B134: _1568.06.34 | C134: Точило LANSKY Quick Edge | D134: 114 | E134: * | F134: 1 | G134: 166.00 | H134: 1.46 | I134: 166.00 | J134: 52.00 | K134: 2 | L134: =RC[-3]/100*RC[-1] -> 1.46 | M134: =SUM(R[-4]C[-1]:RC[-1]) -> 
A136: #11784 (2015-01-21) магазин Зброя - Відправлено-Продано
A137: N | B137: арт | C137: назва | D137: закуп | F137: к-ть | G137: цiна | H137: кф | I137: продж | J137: дохiд | K137: % | L137: з-та
A138: 1 | B138: _DS-0.752 | C138: Пульки ШЕРШЕНЬ 4.5мм 0.75г (200шт) | D138: 20 | E138: * | F138: 2 | G138: 37.00 | H138: 1.85 | I138: 74.00 | J138: 34.00 | K138: 2 | L138: =RC[-3]/100*RC[-1] -> 1.85
A139: 2 | B139: 123870 | C139: Пила FISKARS с кліпсою Xtrack SW73 | D139: 300 | E139: * | F139: 1 | G139: 420.00 | H139: 1.40 | I139: 420.00 | J139: 120.00 | K139: 2 | L139: =RC[-3]/100*RC[-1] -> 1.40
A140: 3 | B140: _N98-341 | C140: Нож Витязь Диверсант | D140: 467 | E140: * | F140: 1 | G140: 534.00 | H140: 1.14 | I140: 534.00 | J140: 67.00 | K140: 2 | L140: =RC[-3]/100*RC[-1] -> 1.14
A141: 4 | B141: _M12051 | C141: Нож Morakniv™ Bushcraft Survival Orange | D141: 702 | E141: * | F141: 1 | G141: 1087.00 | H141: 1.55 | I141: 1087.00 | J141: 385.00 | K141: 2 | L141: =RC[-3]/100*RC[-1] -> 1.55
A142: 5 | B142: _NEDC | C142: Нож NAVY (копія Boker) | D142: 45 | E142: * | F142: 1 | G142: 56.00 | H142: 1.24 | I142: 56.00 | J142: 11.00 | K142: 2 | L142: =RC[-3]/100*RC[-1] -> 1.24
A143: 6 | B143: _429.00.04 | C143: Масло для чистки Clever BALLISTOL 200мл спрей | D143: 146 | E143: * | F143: 1 | G143: 243.00 | H143: 1.66 | I143: 0.00 | J143: -146.00 | K143: 2 | L143: =RC[-3]/100*RC[-1] -> 1.66 | M143: =SUM(R[-6]C[-1]:RC[-1]) -> 
A145: #11824 (2015-01-22) магазин Зброя - Відправлено-Продано
A146: N | B146: арт | C146: назва | D146: закуп | F146: к-ть | G146: цiна | H146: кф | I146: продж | J146: дохiд | K146: % | L146: з-та
A147: 1 | B147: GF8609-2 | C147: Фонарик GRAND FIRE | D147: 31 | E147: * | F147: 1 | G147: 56.00 | H147: 1.81 | I147: 56.00 | J147: 25.00 | K147: 2 | L147: =RC[-3]/100*RC[-1] -> 1.81
A148: 2 | B148: GF8609-2 | C148: Фонарик GRAND FIRE | D148: 31 | E148: * | F148: 1 | G148: 56.00 | H148: 1.81 | I148: 56.00 | J148: 25.00 | K148: 2 | L148: =RC[-3]/100*RC[-1] -> 1.81
A149: 3 | B149: _297386 | C149: Батарейка ENERGIZER Base AAA | D149: 5 | E149: * | F149: 3 | G149: 8.00 | H149: 1.60 | I149: 24.00 | J149: 9.00 | K149: 2 | L149: =RC[-3]/100*RC[-1] -> 1.60
A150: 4 | B150: AA03 | C150: Батарейка MAXUS AAA/LR03 1.5V ||_240573 | D150: 4 | E150: * | F150: 1 | G150: 7.00 | H150: 1.75 | I150: 7.00 | J150: 3.00 | K150: 2 | L150: =RC[-3]/100*RC[-1] -> 1.75
A151: 5 | B151: GET001 | C151: Жетон стальной с набивкой + цепочка | D151: 35 | E151: * | F151: 1 | G151: 60.00 | H151: 1.71 | I151: 65.00 | J151: 30.00 | K151: 2 | L151: =RC[-3]/100*RC[-1] -> 1.71
A152: 6 | B152: K17177A | C152: Очки GX-1000 с 3-мя сменніми стеклами ||M51617177A | D152: 176 | E152: * | F152: 1 | G152: 431.00 | H152: 2.45 | I152: 431.00 | J152: 255.00 | K152: 2 | L152: =RC[-3]/100*RC[-1] -> 2.45
A153: 7 | B153: _217-21 | C153: Фонарь Armytek Tiara A1 Silver XM-L2 550lm | D153: 727 | E153: * | F153: 1 | G153: 1091.00 | H153: 1.50 | I153: 1090.00 | J153: 363.00 | K153: 2 | L153: =RC[-3]/100*RC[-1] -> 1.50
A154: 8 | B154: GW1025 | C154: Плоскогубцы GRAND WAY набір | D154: 183 | E154: * | F154: 1 | G154: 305.00 | H154: 1.67 | I154: 305.00 | J154: 122.00 | K154: 2 | L154: =RC[-3]/100*RC[-1] -> 1.67
A155: 9 | B155: _217-05 | C155: Фонарь Armytek Partner A1 XM-L 260lm ||A1XML | D155: 530 | E155: * | F155: 1 | G155: 796.00 | H155: 1.50 | I155: 636.80 | J155: 106.80 | K155: 2 | L155: =RC[-3]/100*RC[-1] -> 1.50
A156: 10 | B156: AA03 | C156: Батарейка MAXUS AAA/LR03 1.5V ||_240573 | D156: 4 | E156: * | F156: 3 | G156: 7.00 | H156: 1.75 | I156: 21.00 | J156: 9.00 | K156: 2 | L156: =RC[-3]/100*RC[-1] -> 1.75
A157: 11 | B157: _L353013 | C157: Фонарь-лампа FORREST | D157: 66 | E157: * | F157: 1 | G157: 139.00 | H157: 2.11 | I157: 139.00 | J157: 73.00 | K157: 2 | L157: =RC[-3]/100*RC[-1] -> 2.11 | M157: =SUM(R[-11]C[-1]:RC[-1]) -> 
A159: #11840 (2015-01-23) магазин Зброя - Відправлено-Продано
A160: N | B160: арт | C160: назва | D160: закуп | F160: к-ть | G160: цiна | H160: кф | I160: продж | J160: дохiд | K160: % | L160: з-та
A161: 1 | B161: _SAR | C161: Нож NAVY | D161: 7.68 | E161: Инт | F161: 1 | G161: 213.00 | H161: 1.39 | I161: 213.00 | J161: 59.40 | K161: 2 | L161: =RC[-3]/100*RC[-1] -> 1.39
A162: 2 | B162: _M11602 | C162: Нож MORA® Bushcraft Forest | D162: 19.06 | E162: usd | F162: 1 | G162: 591.00 | H162: 1.55 | I162: 591.00 | J162: 209.81 | K162: 2 | L162: =RC[-3]/100*RC[-1] -> 1.55
A163: 3 | B163: K17177A | C163: Очки GX-1000 с 3-мя сменніми стеклами ||M51617177A | D163: 8.80 | E163: usd | F163: 1 | G163: 431.00 | H163: 2.45 | I163: 431.00 | J163: 255.00 | K163: 2 | L163: =RC[-3]/100*RC[-1] -> 2.45
A164: 4 | B164: _20747 | C164: Шарики BB Copperhead (2500шт) | D164: 0.45 | E164: Инт | F164: 1 | G164: 144.00 | H164: 16.00 | I164: 144.00 | J164: 135.00 | K164: 2 | L164: =RC[-3]/100*RC[-1] -> 16.00
A165: 5 | B165: _4.1687 | C165: Балон СО-2 UMAREX 12г | D165: 0.39 | E165: Инт | F165: 3 | G165: 12.00 | H165: 1.54 | I165: 36.00 | J165: 12.62 | K165: 2 | L165: =RC[-3]/100*RC[-1] -> 1.54
A166: 6 | B166: _50701 | C166: Мишень 50x70cм | D166: 0.11 | E166: Инт | F166: 5 | G166: 4.00 | H166: 1.83 | I166: 20.00 | J166: 9.06 | K166: 2 | L166: =RC[-3]/100*RC[-1] -> 1.83
A167: 7 | B167: _1684 | C167: Патрон Флобера 4мм Нобель | D167: 0.20 | E167: Инт | F167: 30 | G167: 6.00 | H167: 1.47 | I167: 180.00 | J167: 57.86 | K167: 2 | L167: =RC[-3]/100*RC[-1] -> 1.47
A168: 8 | B168: _SAR | C168: Нож NAVY | D168: 7.68 | E168: Инт | F168: 1 | G168: 213.00 | H168: 1.39 | I168: 213.00 | J168: 59.40 | K168: 2 | L168: =RC[-3]/100*RC[-1] -> 1.39 | M168: =SUM(R[-8]C[-1]:RC[-1]) -> 
A170: #11859 (2015-01-24) магазин Зброя - Відправлено-Продано
A171: N | B171: арт | C171: назва | D171: закуп | F171: к-ть | G171: цiна | H171: кф | I171: продж | J171: дохiд | K171: % | L171: з-та
A172: 1 | B172: _015508 | C172: Батарейка Таблетка 2032 | D172: 0.45 | E172: Инт | F172: 1 | G172: 12.00 | H172: 1.34 | I172: 12.00 | J172: 3.05 | K172: 2 | L172: =RC[-3]/100*RC[-1] -> 1.34
A173: 2 | B173: _G105 | C173: Мультитул GANZO G105 | D173: 13.12 | E173: usd | F173: 1 | G173: 433.00 | H173: 1.65 | I173: 433.00 | J173: 170.60 | K173: 2 | L173: =RC[-3]/100*RC[-1] -> 1.65
A174: 3 | B174: _4.1687 | C174: Балон СО-2 UMAREX 12г | D174: 8 | E174: * | F174: 2 | G174: 12.00 | H174: 1.50 | I174: 24.00 | J174: 8.00 | K174: 2 | L174: =RC[-3]/100*RC[-1] -> 1.50
A175: 4 | B175: GW6034APS | C175: Нож GRAND WAY выкидной | D175: 38 | E175: * | F175: 2 | G175: 64.00 | H175: 1.68 | I175: 128.00 | J175: 52.00 | K175: 2 | L175: =RC[-3]/100*RC[-1] -> 1.68
A176: 5 | B176: _15479200 | C176: WH багнет 98K в піхвах (репро) новий прихід||15479200 | D176: 738 | E176: * | F176: 1 | G176: 1564.00 | H176: 2.12 | I176: 1411.00 | J176: 673.00 | K176: 2 | L176: =RC[-3]/100*RC[-1] -> 2.12
A177: 6 | B177: _N001001 | C177: Нож Puma TEC | D177: 192 | E177: * | F177: 1 | G177: 233.00 | H177: 1.21 | I177: 233.00 | J177: 41.00 | K177: 2 | L177: =RC[-3]/100*RC[-1] -> 1.21
A178: 7 | B178: _1684 | C178: Патрон Флобера 4мм Нобель | D178: 4 | E178: * | F178: 50 | G178: 6.00 | H178: 1.50 | I178: 300.00 | J178: 100.00 | K178: 2 | L178: =RC[-3]/100*RC[-1] -> 1.50
A179: 8 | B179: _K17122-E | C179: Очки FL8008 затемненные ||M51617122-TEA | D179: 74 | E179: * | F179: 1 | G179: 159.00 | H179: 2.15 | I179: 143.10 | J179: 69.10 | K179: 2 | L179: =RC[-3]/100*RC[-1] -> 2.15
A180: 9 | B180: _545830 | C180: Окуляри прозрачные [OREGON] | D180: 92 | E180: * | F180: 1 | G180: 141.00 | H180: 1.53 | I180: 141.00 | J180: 49.00 | K180: 2 | L180: =RC[-3]/100*RC[-1] -> 1.53
A181: 10 | B181: _G202 | C181: Мультитул GANZO G202 | D181: 330 | E181: * | F181: 1 | G181: 544.00 | H181: 1.65 | I181: 435.20 | J181: 105.20 | K181: 2 | L181: =RC[-3]/100*RC[-1] -> 1.65 | M181: =SUM(R[-10]C[-1]:RC[-1]) -> 
A183: #11871 (2015-01-26) магазин Зброя - Відправлено-Продано
A184: N | B184: арт | C184: назва | D184: закуп | F184: к-ть | G184: цiна | H184: кф | I184: продж | J184: дохiд | K184: % | L184: з-та
A185: 1 | B185: _201-3404 | C185: Бинокль KONUS Newzoom 7-21x40 | D185: 30 | E185: * | F185: 1 | G185: 555.00 | H185: 18.50 | I185: 527.25 | J185: 497.25 | K185: 2 | L185: =RC[-3]/100*RC[-1] -> 18.50
A186: 2 | B186: _G704y | C186: Нож GANZO G704y | D186: 330 | E186: * | F186: 1 | G186: 544.00 | H186: 1.65 | I186: 544.00 | J186: 214.00 | K186: 2 | L186: =RC[-3]/100*RC[-1] -> 1.65
A187: 3 | B187: _20-0985 | C187: Нож WENGER Motorist 39||1 39 09 300 | D187: 595 | E187: * | F187: 1 | G187: 946.00 | H187: 1.59 | I187: 946.00 | J187: 351.00 | K187: 2 | L187: =RC[-3]/100*RC[-1] -> 1.59
A188: 4 | B188: _OTF-R | C188: Нож MICROTECH красный (копія) | D188: 236 | E188: * | F188: 1 | G188: 413.00 | H188: 1.75 | I188: 330.40 | J188: 94.40 | K188: 2 | L188: =RC[-3]/100*RC[-1] -> 1.75
A189: 5 | B189: _5.0749 | C189: Нож WALTHER P99, 440 SS | D189: 518 | E189: * | F189: 1 | G189: 750.00 | H189: 1.45 | I189: 712.50 | J189: 194.50 | K189: 2 | L189: =RC[-3]/100*RC[-1] -> 1.45
A190: 6 | B190: GF8710 | C190: Фонарик GRAND FIRE | D190: 35 | E190: * | F190: 1 | G190: 62.00 | H190: 1.77 | I190: 62.00 | J190: 27.00 | K190: 2 | L190: =RC[-3]/100*RC[-1] -> 1.77
A191: 7 | B191: GET001 | C191: Жетон стальной с набивкой + цепочка | D191: 35 | E191: * | F191: 1 | G191: 60.00 | H191: 1.71 | I191: 60.00 | J191: 25.00 | K191: 2 | L191: =RC[-3]/100*RC[-1] -> 1.71 | M191: =SUM(R[-7]C[-1]:RC[-1]) -> 
A193: #11912 (2015-01-27) магазин Зброя - Відправлено-Продано
A194: N | B194: арт | C194: назва | D194: закуп | F194: к-ть | G194: цiна | H194: кф | I194: продж | J194: дохiд | K194: % | L194: з-та
A195: 1 | B195: GF8705 | C195: Фонарик GRAND FIRE | D195: 35 | E195: * | F195: 1 | G195: 62.00 | H195: 1.77 | I195: 62.00 | J195: 27.00 | K195: 2 | L195: =RC[-3]/100*RC[-1] -> 1.77
A196: 2 | B196: AA44 | C196: Батарейка DURACELL Base AA ||_58163 | D196: 4 | E196: * | F196: 2 | G196: 7.00 | H196: 1.75 | I196: 14.00 | J196: 6.00 | K196: 2 | L196: =RC[-3]/100*RC[-1] -> 1.75
A197: 3 | B197: _G620-G2 | C197: Нож GANZO G620-G2 | D197: 135 | E197: * | F197: 1 | G197: 223.00 | H197: 1.65 | I197: 223.00 | J197: 88.00 | K197: 2 | L197: =RC[-3]/100*RC[-1] -> 1.65
A198: 4 | B198: _00825 | C198: Кріпленя БК YUKON Weaver-Бк | D198: 537 | E198: * | F198: 1 | G198: 867.00 | H198: 1.61 | I198: 780.30 | J198: 243.30 | K198: 2 | L198: =RC[-3]/100*RC[-1] -> 1.61
A199: 5 | B199: _65161 | C199: Чохол для мисливського ножа №1 короткий | D199: 50 | E199: * | F199: 1 | G199: 72.00 | H199: 1.44 | I199: 72.00 | J199: 22.00 | K199: 2 | L199: =RC[-3]/100*RC[-1] -> 1.44
A200: 6 | B200: _N14086-5 | C200: Нож складной балисонг | D200: 72 | E200: * | F200: 1 | G200: 110.00 | H200: 1.53 | I200: 110.00 | J200: 38.00 | K200: 2 | L200: =RC[-3]/100*RC[-1] -> 1.53
A201: 7 | B201: GW2270 | C201: Нож GRAND WAY | D201: 82 | E201: * | F201: 1 | G201: 133.00 | H201: 1.62 | I201: 133.00 | J201: 51.00 | K201: 2 | L201: =RC[-3]/100*RC[-1] -> 1.62
A202: 8 | B202: _N5051 | C202: Нож Stiletto | D202: 125 | E202: * | F202: 1 | G202: 148.00 | H202: 1.18 | I202: 148.00 | J202: 23.00 | K202: 2 | L202: =RC[-3]/100*RC[-1] -> 1.18
A203: 9 | B203: _21033 | C203: BRUNOX масло для оружия подовженої дії 100 мл | D203: 62 | E203: * | F203: 1 | G203: 103.00 | H203: 1.66 | I203: 92.70 | J203: 30.70 | K203: 2 | L203: =RC[-3]/100*RC[-1] -> 1.66 | M203: =SUM(R[-9]C[-1]:RC[-1]) -> 
A205: #11933 (2015-01-28) магазин Зброя - Відправлено-Продано
A206: N | B206: арт | C206: назва | D206: закуп | F206: к-ть | G206: цiна | H206: кф | I206: продж | J206: дохiд | K206: % | L206: з-та
A207: 1 | B207: _G616 | C207: Нож GANZO G616 | D207: 107 | E207: * | F207: 1 | G207: 177.00 | H207: 1.65 | I207: 177.00 | J207: 70.00 | K207: 2 | L207: =RC[-3]/100*RC[-1] -> 1.65
A208: 2 | B208: _N1090GH | C208: Нож Kershaw (копія) | D208: 157 | E208: * | F208: 1 | G208: 185.00 | H208: 1.18 | I208: 185.00 | J208: 28.00 | K208: 2 | L208: =RC[-3]/100*RC[-1] -> 1.18
A209: 3 | B209: _4.1687 | C209: Балон СО-2 UMAREX 12г | D209: 8 | E209: * | F209: 1 | G209: 12.00 | H209: 1.50 | I209: 12.00 | J209: 4.00 | K209: 2 | L209: =RC[-3]/100*RC[-1] -> 1.50
A210: 4 | B210: _G105 | C210: Мультитул GANZO G105 | D210: 262 | E210: * | F210: 1 | G210: 433.00 | H210: 1.65 | I210: 433.00 | J210: 171.00 | K210: 2 | L210: =RC[-3]/100*RC[-1] -> 1.65
A211: 5 | B211: _2002-10 | C211: Моноблок H=21mm-d=25.4 ласт.хв | D211: 80 | E211: * | F211: 1 | G211: 213.00 | H211: 2.66 | I211: 213.00 | J211: 133.00 | K211: 2 | L211: =RC[-3]/100*RC[-1] -> 2.66
A212: 6 | B212: _18396 | C212: Фонарик TOPEX | D212: 19 | E212: * | F212: 2 | G212: 38.00 | H212: 2.00 | I212: 76.00 | J212: 38.00 | K212: 2 | L212: =RC[-3]/100*RC[-1] -> 2.00
A213: 7 | B213: AA55 | C213: Батарейка DURACELL Turbo AA ||_80317 | D213: 7 | E213: * | F213: 2 | G213: 11.00 | H213: 1.57 | I213: 22.00 | J213: 8.00 | K213: 2 | L213: =RC[-3]/100*RC[-1] -> 1.57
A214: 8 | B214: _217-30 | C214: Фонарь Armytek Partner A1 LIMITED XM-L2 390/700lm | D214: 606 | E214: * | F214: 1 | G214: 909.00 | H214: 1.50 | I214: 818.10 | J214: 212.10 | K214: 2 | L214: =RC[-3]/100*RC[-1] -> 1.50
A215: 9 | B215: GF8817 | C215: Фонарик GRAND FIRE | D215: 22 | E215: * | F215: 1 | G215: 40.00 | H215: 1.82 | I215: 40.00 | J215: 18.00 | K215: 2 | L215: =RC[-3]/100*RC[-1] -> 1.82
A216: 10 | B216: _N602 | C216: Нож CENBER серый | D216: 53 | E216: * | F216: 1 | G216: 92.00 | H216: 1.74 | I216: 92.00 | J216: 39.00 | K216: 2 | L216: =RC[-3]/100*RC[-1] -> 1.74
A217: 11 | B217: _0537 | C217: Копії на дер. підставці | D217: 175 | E217: * | F217: 1 | G217: 233.00 | H217: 1.33 | I217: 198.05 | J217: 23.05 | K217: 2 | L217: =RC[-3]/100*RC[-1] -> 1.33
A218: 12 | B218: _7793 | C218: Револьвер под патрон Флобера САФАРІ РФ-461 (бук) | D218: 1714 | E218: * | F218: 1 | G218: 2854.00 | H218: 1.67 | I218: 2854.00 | J218: 1140.00 | K218: 2 | L218: =RC[-3]/100*RC[-1] -> 1.67
A219: 13 | B219: _429.00.02 | C219: Масло для чистки Clever BALLISTOL 50мл спрей | D219: 73 | E219: * | F219: 1 | G219: 120.00 | H219: 1.64 | I219: 120.00 | J219: 47.00 | K219: 2 | L219: =RC[-3]/100*RC[-1] -> 1.64
A220: 14 | B220: _898-9130 | C220: Набор для чистки оружия 4.5 мм | D220: 83 | E220: * | F220: 1 | G220: 137.00 | H220: 1.65 | I220: 137.00 | J220: 54.00 | K220: 2 | L220: =RC[-3]/100*RC[-1] -> 1.65
A221: 15 | B221: _1684 | C221: Патрон Флобера 4мм Нобель | D221: 4 | E221: * | F221: 25 | G221: 6.00 | H221: 1.50 | I221: 150.00 | J221: 50.00 | K221: 2 | L221: =RC[-3]/100*RC[-1] -> 1.50 | M221: =SUM(R[-15]C[-1]:RC[-1]) -> 
A223: #11965 (2015-01-29) магазин Зброя - Відправлено-Продано
A224: N | B224: арт | C224: назва | D224: закуп | F224: к-ть | G224: цiна | H224: кф | I224: продж | J224: дохiд | K224: % | L224: з-та
A225: 1 | B225: _M11746 | C225: Нож Morakniv™ Companion HeavyDuty MG | D225: 183 | E225: * | F225: 1 | G225: 284.00 | H225: 1.55 | I225: 284.00 | J225: 101.00 | K225: 2 | L225: =RC[-3]/100*RC[-1] -> 1.55
A226: 2 | B226: GW311M | C226: Нож GRAND WAY складной | D226: 28 | E226: * | F226: 1 | G226: 47.00 | H226: 1.68 | I226: 47.00 | J226: 19.00 | K226: 2 | L226: =RC[-3]/100*RC[-1] -> 1.68
A227: 3 | B227: _1568.06.36 | C227: Точило LANSKY Quick Fix | D227: 114 | E227: * | F227: 1 | G227: 166.00 | H227: 1.46 | I227: 166.00 | J227: 52.00 | K227: 2 | L227: =RC[-3]/100*RC[-1] -> 1.46
A228: 4 | B228: _M11602 | C228: Нож MORA® Bushcraft Forest | D228: 381 | E228: * | F228: 1 | G228: 591.00 | H228: 1.55 | I228: 591.00 | J228: 210.00 | K228: 2 | L228: =RC[-3]/100*RC[-1] -> 1.55
A229: 5 | B229: _1.1808 | C229: Бинокль YUKON 30x50 ||00609 | D229: 1258 | E229: * | F229: 1 | G229: 1765.00 | H229: 1.40 | I229: 1765.00 | J229: 507.00 | K229: 2 | L229: =RC[-3]/100*RC[-1] -> 1.40
A230: 6 | B230: _DS-0.752 | C230: Пульки ШЕРШЕНЬ 4.5мм 0.75г (200шт) | D230: 20 | E230: * | F230: 1 | G230: 37.00 | H230: 1.85 | I230: 37.00 | J230: 17.00 | K230: 2 | L230: =RC[-3]/100*RC[-1] -> 1.85
A231: 7 | B231: _G620-Y1 | C231: Нож GANZO G620-Y1 | D231: 113 | E231: * | F231: 1 | G231: 187.00 | H231: 1.65 | I231: 187.00 | J231: 74.00 | K231: 2 | L231: =RC[-3]/100*RC[-1] -> 1.65 | M231: =SUM(R[-7]C[-1]:RC[-1]) -> 
A233: #11996 (2015-01-30) магазин Зброя - Відправлено-Продано
A234: N | B234: арт | C234: назва | D234: закуп | F234: к-ть | G234: цiна | H234: кф | I234: продж | J234: дохiд | K234: % | L234: з-та
A235: 1 | B235: _QQ005 | C235: Крепление для подствольного фонаря||QQ 005 | D235: 74 | E235: * | F235: 2 | G235: 125.00 | H235: 1.69 | I235: 250.00 | J235: 102.00 | K235: 2 | L235: =RC[-3]/100*RC[-1] -> 1.69
A236: 2 | B236: _M4KW | C236: Нож GERBER | D236: 115 | E236: * | F236: 1 | G236: 201.00 | H236: 1.75 | I236: 201.00 | J236: 86.00 | K236: 2 | L236: =RC[-3]/100*RC[-1] -> 1.75
A237: 3 | B237: _4.1687 | C237: Балон СО-2 UMAREX 12г | D237: 8 | E237: * | F237: 2 | G237: 12.00 | H237: 1.50 | I237: 24.00 | J237: 8.00 | K237: 2 | L237: =RC[-3]/100*RC[-1] -> 1.50
A238: 4 | B238: _DS-0.683 | C238: Пульки ШЕРШЕНЬ HUNTER 4.5мм 0.68г (360шт) | D238: 33 | E238: * | F238: 1 | G238: 59.00 | H238: 1.79 | I238: 59.00 | J238: 26.00 | K238: 2 | L238: =RC[-3]/100*RC[-1] -> 1.79
A239: 5 | B239: _100SH-1 | C239: Шарик "Шаровая молния" 4.5мм 0.57г (100шт) | D239: 7 | E239: * | F239: 2 | G239: 14.00 | H239: 2.00 | I239: 28.00 | J239: 14.00 | K239: 2 | L239: =RC[-3]/100*RC[-1] -> 2.00
A240: 6 | B240: _K17066-B | C240: Окуляри защитные чёрные ||M51617066-TEA | D240: 59 | E240: * | F240: 1 | G240: 152.00 | H240: 2.58 | I240: 152.00 | J240: 93.00 | K240: 2 | L240: =RC[-3]/100*RC[-1] -> 2.58
A241: 7 | B241: GW2253LP | C241: Нож GRAND WAY Hunting (кожа) | D241: 217 | E241: * | F241: 1 | G241: 361.00 | H241: 1.66 | I241: 361.00 | J241: 144.00 | K241: 2 | L241: =RC[-3]/100*RC[-1] -> 1.66 | M241: =SUM(R[-7]C[-1]:RC[-1]) -> 
A243: #12013 (2015-01-31) магазин Зброя - Відправлено-Продано
A244: N | B244: арт | C244: назва | D244: закуп | F244: к-ть | G244: цiна | H244: кф | I244: продж | J244: дохiд | K244: % | L244: з-та
A245: 1 | B245: A19-99 | C245: Декоративна дошка для трофеїв ACROPOLIS ||ДТ-52 | D245: 136 | E245: * | F245: 1 | G245: 192.00 | H245: 1.41 | I245: 192.00 | J245: 56.00 | K245: 2 | L245: =RC[-3]/100*RC[-1] -> 1.41
A246: 2 | B246: 125860 | C246: Нож FISKARS | D246: 116 | E246: * | F246: 1 | G246: 162.00 | H246: 1.40 | I246: 162.00 | J246: 46.00 | K246: 2 | L246: =RC[-3]/100*RC[-1] -> 1.40
A247: 3 | B247: GW24045 | C247: Нож GRAND WAY нескладной | D247: 71 | E247: * | F247: 1 | G247: 118.00 | H247: 1.66 | I247: 118.00 | J247: 47.00 | K247: 2 | L247: =RC[-3]/100*RC[-1] -> 1.66
A248: 4 | B248: _4.1687 | C248: Балон СО-2 UMAREX 12г | D248: 8 | E248: * | F248: 2 | G248: 12.00 | H248: 1.50 | I248: 24.00 | J248: 8.00 | K248: 2 | L248: =RC[-3]/100*RC[-1] -> 1.50
A249: 5 | B249: _4.1687 | C249: Балон СО-2 UMAREX 12г | D249: 8 | E249: * | F249: 3 | G249: 12.00 | H249: 1.50 | I249: 36.00 | J249: 12.00 | K249: 2 | L249: =RC[-3]/100*RC[-1] -> 1.50
A250: 6 | B250: GW3189 | C250: Нож GRAND WAY складной | D250: 37 | E250: * | F250: 1 | G250: 62.00 | H250: 1.68 | I250: 62.00 | J250: 25.00 | K250: 2 | L250: =RC[-3]/100*RC[-1] -> 1.68
A251: 7 | B251: _82-50 | C251: OXYDA засіб для холодного вороніння NU-BLAK 50г | D251: 93 | E251: * | F251: 1 | G251: 152.00 | H251: 1.63 | I251: 152.00 | J251: 59.00 | K251: 2 | L251: =RC[-3]/100*RC[-1] -> 1.63
A252: 8 | B252: _429.00.12 | C252: Масло для чистки BALLISTOL Gunex-2000 400мл спрей | D252: 279 | E252: * | F252: 1 | G252: 449.00 | H252: 1.61 | I252: 0.00 | J252: -279.00 | K252: 2 | L252: =RC[-3]/100*RC[-1] -> 1.61
A253: 9 | B253: _842842 | C253: Мультитул TRAVELER | D253: 138 | E253: * | F253: 1 | G253: 228.00 | H253: 1.65 | I253: 228.00 | J253: 90.00 | K253: 2 | L253: =RC[-3]/100*RC[-1] -> 1.65
A254: 10 | B254: _P1500-26 | C254: Паракорд 5м | D254: 18 | E254: * | F254: 1 | G254: 27.00 | H254: 1.50 | I254: 27.00 | J254: 9.00 | K254: 2 | L254: =RC[-3]/100*RC[-1] -> 1.50
A255: 11 | B255: BD3229 | C255: Багнет резиновый к M4 чёрный | D255: 100 | E255: * | F255: 1 | G255: 233.00 | H255: 2.33 | I255: 233.00 | J255: 133.00 | K255: 2 | L255: =RC[-3]/100*RC[-1] -> 2.33 | M255: =SUM(R[-11]C[-1]:RC[-1]) -> 
A257: #12026 (2015-02-02) магазин Зброя - Відправлено-Продано
A258: N | B258: арт | C258: назва | D258: закуп | F258: к-ть | G258: цiна | H258: кф | I258: продж | J258: дохiд | K258: % | L258: з-та
A259: 1 | B259: _KWC-0548 | C259: Пістолет пневматичний KWC PM (KM-44 DHN) | D259: 834 | E259: * | F259: 1 | G259: 1250.00 | H259: 1.50 | I259: 1250.00 | J259: 416.00 | K259: 2 | L259: =RC[-3]/100*RC[-1] -> 1.50
A260: 2 | B260: _100SH-1 | C260: Шарик "Шаровая молния" 4.5мм 0.57г (100шт) | D260: 7 | E260: * | F260: 1 | G260: 14.00 | H260: 2.00 | I260: 14.00 | J260: 7.00 | K260: 2 | L260: =RC[-3]/100*RC[-1] -> 2.00
A261: 3 | B261: _4.1687 | C261: Балон СО-2 UMAREX 12г | D261: 8 | E261: * | F261: 3 | G261: 12.00 | H261: 1.50 | I261: 36.00 | J261: 12.00 | K261: 2 | L261: =RC[-3]/100*RC[-1] -> 1.50
A262: 4 | B262: _100SH-1 | C262: Шарик "Шаровая молния" 4.5мм 0.57г (100шт) | D262: 7 | E262: * | F262: 1 | G262: 14.00 | H262: 2.00 | I262: 14.00 | J262: 7.00 | K262: 2 | L262: =RC[-3]/100*RC[-1] -> 2.00
A263: 5 | B263: _4.1687 | C263: Балон СО-2 UMAREX 12г | D263: 8 | E263: * | F263: 1 | G263: 12.00 | H263: 1.50 | I263: 12.00 | J263: 4.00 | K263: 2 | L263: =RC[-3]/100*RC[-1] -> 1.50
A264: 6 | B264: _1.3613.71 | C264: Нож VICTORINOX Swiss Army Camper (красный) | D264: 303 | E264: * | F264: 1 | G264: 469.00 | H264: 1.55 | I264: 469.00 | J264: 166.00 | K264: 2 | L264: =RC[-3]/100*RC[-1] -> 1.55
A265: 7 | B265: _509509 | C265: Мультитул-плоскогубцы TRAVELER | D265: 121 | E265: * | F265: 1 | G265: 200.00 | H265: 1.65 | I265: 200.00 | J265: 79.00 | K265: 2 | L265: =RC[-3]/100*RC[-1] -> 1.65
A266: 8 | B266: _X-200SC | C266: Винтовка пневматическая HATSAN-200SCarb Dominator | D266: 2460 | E266: * | F266: 1 | G266: 3692.00 | H266: 1.50 | I266: 3507.40 | J266: 1047.40 | K266: 2 | L266: =RC[-3]/100*RC[-1] -> 1.50
A267: 9 | B267: _23006 | C267: Прицел оптический ZOS 3-9x40E (арбалетная сетка, 2 підсвідки) | D267: 440 | E267: * | F267: 1 | G267: 660.00 | H267: 1.50 | I267: 660.00 | J267: 220.00 | K267: 2 | L267: =RC[-3]/100*RC[-1] -> 1.50
A268: 10 | B268: K16220L | C268: Кольца для оптики низьке 25mm [Производитель: ACM] ||M51616220 | D268: 35 | E268: * | F268: 1 | G268: 96.00 | H268: 2.74 | I268: 96.00 | J268: 61.00 | K268: 2 | L268: =RC[-3]/100*RC[-1] -> 2.74
A269: 11 | B269: _DS-0.683 | C269: Пульки ШЕРШЕНЬ HUNTER 4.5мм 0.68г (360шт) | D269: 33 | E269: * | F269: 1 | G269: 59.00 | H269: 1.79 | I269: 59.00 | J269: 26.00 | K269: 2 | L269: =RC[-3]/100*RC[-1] -> 1.79
A270: 12 | B270: _M11602 | C270: Нож MORA® Bushcraft Forest | D270: 381 | E270: * | F270: 1 | G270: 591.00 | H270: 1.55 | I270: 591.00 | J270: 210.00 | K270: 2 | L270: =RC[-3]/100*RC[-1] -> 1.55
A271: 13 | B271: GW2265LP | C271: Нож GRAND WAY Hunting (кожа) | D271: 247 | E271: * | F271: 1 | G271: 411.00 | H271: 1.66 | I271: 411.00 | J271: 164.00 | K271: 2 | L271: =RC[-3]/100*RC[-1] -> 1.66
A272: 14 | B272: _8006-057 | C272: Пульки для пнев. оружия WINNER 0.57 гр ( 500 шт ) 4.5мм | D272: 55 | E272: * | F272: 1 | G272: 85.00 | H272: 1.55 | I272: 85.00 | J272: 30.00 | K272: 2 | L272: =RC[-3]/100*RC[-1] -> 1.55 | M272: =SUM(R[-14]C[-1]:RC[-1]) -> 