Sheet:  name
D1: Вхiднi данi | H1: Зкореговано
C2: Закуп: | D2: 2608905 | G2: грн
C3: Продано: | D3: 2120277 | G3: грн
C4: Дохiд-Коефiцiент: | D4: -488628(0.81)
C5: Процент з-ти: | D5: 5 | G5: %
C6: Нараховано з-ти: | D6: 106013.87 | G6: грн | H6: =SUM(R[4]C[4]:R[3147]C[4]) -> 
B7: курси: Все 0 , грн 1 , usd 20 , euro 25 , zl 5 , Инт 20 ,
A9: #1042 (2014-02-05) Львів Назар Максимович - Відправлено-Продано
A10: N | B10: арт | C10: назва | D10: закуп | F10: к-ть | G10: цiна | H10: кф | I10: продж | J10: дохiд | K10: % | L10: з-та
A11: 1 | B11: _E01/Y | C11: Фонарик FENIX E01 жёлный | D11: 9.10 | E11: usd | F11: 1 | G11: 86.00 | H11: 0.47 | I11: 86.00 | J11: -96.00 | K11: 5 | L11: =RC[-3]/100*RC[-1] -> 0.47
A12: 2 | B12: _E01/S | C12: Фонарик FENIX E01 серый | D12: 9.10 | E12: usd | F12: 1 | G12: 104.18 | H12: 0.57 | I12: 104.18 | J12: -77.82 | K12: 5 | L12: =RC[-3]/100*RC[-1] -> 0.57
A13: 3 | B13: _E05B | C13: Фонарик FENIX E05 синий | D13: 13.35 | E13: usd | F13: 1 | G13: 130.87 | H13: 0.49 | I13: 130.87 | J13: -136.13 | K13: 5 | L13: =RC[-3]/100*RC[-1] -> 0.49
A14: 4 | B14: _E05bp | C14: Фонарик FENIX E05 чёрный (подарункова упаковка) | D14: 13.35 | E14: usd | F14: 1 | G14: 125.69 | H14: 0.47 | I14: 125.68 | J14: -141.32 | K14: 5 | L14: =RC[-3]/100*RC[-1] -> 0.47
A15: 5 | B15: _E11bp | C15: Фонарь FENIX E11 чёрный в подарочной упаковке | D15: 19.41 | E15: usd | F15: 1 | G15: 183.33 | H15: 0.47 | I15: 183.33 | J15: -204.87 | K15: 5 | L15: =RC[-3]/100*RC[-1] -> 0.47
A16: 6 | B16: _LD15R4 | C16: Фонарик FENIX LD15 Cree XP-G LED R4 | D16: 33.33 | E16: usd | F16: 1 | G16: 35.00 | H16: 0.05 | I16: 35.00 | J16: -631.60 | K16: 5 | L16: =RC[-3]/100*RC[-1] -> 0.05
A17: 7 | B17: _LD20R5 | C17: Фонарик FENIX LD20 R5 | D17: 26.38 | E17: usd | F17: 1 | G17: 394.14 | H17: 0.75 | I17: 394.14 | J17: -133.46 | K17: 5 | L17: =RC[-3]/100*RC[-1] -> 0.75
A18: 8 | B18: _HL10 | C18: Фонарь налобный FENIX HL10 | D18: 25.03 | E18: usd | F18: 1 | G18: 219.56 | H18: 0.44 | I18: 219.56 | J18: -281.04 | K18: 5 | L18: =RC[-3]/100*RC[-1] -> 0.44
A19: 9 | B19: _ST60300ES | C19: Мікротул Swiss+Tech 7-in-1 Key Ring Multi-Tool Silver | D19: 4.72 | E19: Инт | F19: 1 | G19: 80.33 | H19: 0.85 | I19: 80.33 | J19: -14.11 | K19: 5 | L19: =RC[-3]/100*RC[-1] -> 0.85
A20: 10 | B20: _ST81010ES | C20: Микротул Swiss+Tech BodyGard PTX 3-in-1 | D20: 7.78 | E20: Инт | F20: 1 | G20: 101.60 | H20: 0.65 | I20: 101.60 | J20: -53.96 | K20: 5 | L20: =RC[-3]/100*RC[-1] -> 0.65
A21: 11 | B21: _ST50016ES | C21: Микротул Swiss+Tech Micro-Plus EX 9-in-1 | D21: 6.23 | E21: Инт | F21: 1 | G21: 86.10 | H21: 0.69 | I21: 86.10 | J21: -38.57 | K21: 5 | L21: =RC[-3]/100*RC[-1] -> 0.69
A22: 12 | B22: _ST60508ES | C22: Микротул Swiss+Tech Micro-Pro XL900 9-in-1 *Aus* | D22: 7.59 | E22: Инт | F22: 1 | G22: 100.17 | H22: 0.66 | I22: 100.17 | J22: -51.61 | K22: 5 | L22: =RC[-3]/100*RC[-1] -> 0.66
A23: 13 | B23: _ST67100ES | C23: Мікротул Swiss+Tech Micro-Slim 9-in-1 Key Ring Tool Kit | D23: 9.32 | E23: Инт | F23: 1 | G23: 100.98 | H23: 0.54 | I23: 100.98 | J23: -85.46 | K23: 5 | L23: =RC[-3]/100*RC[-1] -> 0.54
A24: 14 | B24: _ST50022ES | C24: Микротул Swiss+Tech Micro-Tech 6-in-1 | D24: 3.82 | E24: Инт | F24: 1 | G24: 57.65 | H24: 0.75 | I24: 57.65 | J24: -18.79 | K24: 5 | L24: =RC[-3]/100*RC[-1] -> 0.75
A25: 15 | B25: _ST35000ES | C25: Микротул Swiss+Tech Mini Multi-tool 8-in-1 | D25: 7.16 | E25: Инт | F25: 1 | G25: 88.83 | H25: 0.62 | I25: 88.83 | J25: -54.28 | K25: 5 | L25: =RC[-3]/100*RC[-1] -> 0.62
A26: 16 | B26: _ST35015ES | C26: Микротул Swiss+Tech Pocket Multi-Tool 12-in-1, blue | D26: 7.78 | E26: Инт | F26: 1 | G26: 100.98 | H26: 0.65 | I26: 100.98 | J26: -54.58 | K26: 5 | L26: =RC[-3]/100*RC[-1] -> 0.65
A27: 17 | B27: _ST10606ES | C27: Микротул Swiss+Tech Smart Clip Ultra | D27: 7.79 | E27: Инт | F27: 1 | G27: 100.98 | H27: 0.65 | I27: 100.98 | J27: -54.80 | K27: 5 | L27: =RC[-3]/100*RC[-1] -> 0.65
A28: 18 | B28: _ST66676ES | C28: Микротул Swiss+Tech Utili-Key 6-in-1 | D28: 8.64 | E28: Инт | F28: 1 | G28: 105.84 | H28: 0.61 | I28: 105.84 | J28: -67.05 | K28: 5 | L28: =RC[-3]/100*RC[-1] -> 0.61
A29: 19 | B29: _G2015-0 | C29: Мультитул GANZO 2015-0 | D29: 7.00 | E29: usd | F29: 1 | G29: 92.40 | H29: 0.66 | I29: 92.40 | J29: -47.60 | K29: 5 | L29: =RC[-3]/100*RC[-1] -> 0.66
A30: 20 | B30: _G2019S | C30: Мультитул GANZO 2019S | D30: 8.46 | E30: usd | F30: 1 | G30: 78.33 | H30: 0.46 | I30: 78.33 | J30: -90.87 | K30: 5 | L30: =RC[-3]/100*RC[-1] -> 0.46
A31: 21 | B31: _G30280 | C31: Мультитул GANZO 30280 | D31: 7.00 | E31: usd | F31: 1 | G31: 92.40 | H31: 0.66 | I31: 92.40 | J31: -47.60 | K31: 5 | L31: =RC[-3]/100*RC[-1] -> 0.66
A32: 22 | B32: _G3029-0 | C32: Мультитул GANZO 3029-0 | D32: 7.00 | E32: usd | F32: 1 | G32: 92.40 | H32: 0.66 | I32: 92.40 | J32: -47.60 | K32: 5 | L32: =RC[-3]/100*RC[-1] -> 0.66
A33: 23 | B33: _G3050 | C33: Мультитул GANZO 3050 | D33: 7.00 | E33: usd | F33: 1 | G33: 92.40 | H33: 0.66 | I33: 92.40 | J33: -47.60 | K33: 5 | L33: =RC[-3]/100*RC[-1] -> 0.66
A34: 24 | B34: _G104-S | C34: Мультитул GANZO G104-S | D34: 8.46 | E34: usd | F34: 1 | G34: 78.35 | H34: 0.46 | I34: 78.35 | J34: -90.85 | K34: 5 | L34: =RC[-3]/100*RC[-1] -> 0.46
A35: 25 | B35: _G2016-P | C35: Мультитул GANZO G2016-P | D35: 12.00 | E35: usd | F35: 1 | G35: 114.51 | H35: 0.48 | I35: 114.51 | J35: -125.49 | K35: 5 | L35: =RC[-3]/100*RC[-1] -> 0.48
A36: 26 | B36: _G202 | C36: Мультитул GANZO G202 | D36: 16.51 | E36: usd | F36: 1 | G36: 156.70 | H36: 0.47 | I36: 156.70 | J36: -173.50 | K36: 5 | L36: =RC[-3]/100*RC[-1] -> 0.47
A37: 27 | B37: _G202B | C37: Мультитул GANZO G202B | D37: 17.10 | E37: usd | F37: 1 | G37: 162.75 | H37: 0.48 | I37: 162.75 | J37: -179.25 | K37: 5 | L37: =RC[-3]/100*RC[-1] -> 0.48
A38: 28 | B38: _HTK15S2 | C38: Набор FENIX TK15 + кнопка AR102 +Акум Fenix 2600 + Зарядка TF002 | D38: 88.09 | E38: usd | F38: 1 | G38: 761.99 | H38: 0.43 | I38: 761.99 | J38: -999.81 | K38: 5 | L38: =RC[-3]/100*RC[-1] -> 0.43
A39: 29 | B39: _A03r | C39: Нож EGO Tools брелок красный | D39: 7.14 | E39: usd | F39: 1 | G39: 57.65 | H39: 0.40 | I39: 57.65 | J39: -85.15 | K39: 5 | L39: =RC[-3]/100*RC[-1] -> 0.40
A40: 30 | B40: _A03y | C40: Нож EGO Tools брелок жёлный | D40: 7.14 | E40: usd | F40: 1 | G40: 57.65 | H40: 0.40 | I40: 57.65 | J40: -85.15 | K40: 5 | L40: =RC[-3]/100*RC[-1] -> 0.40
A41: 31 | B41: _A03c | C41: Нож EGO Tools брелок камо | D41: 7.86 | E41: usd | F41: 1 | G41: 63.32 | H41: 0.40 | I41: 63.31 | J41: -93.89 | K41: 5 | L41: =RC[-3]/100*RC[-1] -> 0.40
A42: 32 | B42: _A03b | C42: Нож EGO Tools брелок синий | D42: 7.14 | E42: usd | F42: 1 | G42: 57.65 | H42: 0.40 | I42: 57.65 | J42: -85.15 | K42: 5 | L42: =RC[-3]/100*RC[-1] -> 0.40
A43: 33 | B43: _A03bl | C43: Нож EGO Tools брелок чёрный | D43: 7.14 | E43: usd | F43: 1 | G43: 57.65 | H43: 0.40 | I43: 57.65 | J43: -85.15 | K43: 5 | L43: =RC[-3]/100*RC[-1] -> 0.40
A44: 34 | B44: _A01.12c | C44: Нож EGO Tools камо | D44: 19.29 | E44: usd | F44: 1 | G44: 154.98 | H44: 0.40 | I44: 154.98 | J44: -230.82 | K44: 5 | L44: =RC[-3]/100*RC[-1] -> 0.40
A45: 35 | B45: _IT.01 | C45: Нож EGO Tools синий с набором біт | D45: 19.29 | E45: usd | F45: 1 | G45: 154.98 | H45: 0.40 | I45: 154.98 | J45: -230.82 | K45: 5 | L45: =RC[-3]/100*RC[-1] -> 0.40
A46: 36 | B46: _A01.10 | C46: Нож EGO Tools красный | D46: 15.00 | E46: usd | F46: 1 | G46: 120.02 | H46: 0.40 | I46: 120.02 | J46: -179.98 | K46: 5 | L46: =RC[-3]/100*RC[-1] -> 0.40
A47: 37 | B47: _A01.10.1 | C47: Нож EGO Tools красный | D47: 12.86 | E47: usd | F47: 1 | G47: 103.01 | H47: 0.40 | I47: 103.00 | J47: -154.20 | K47: 5 | L47: =RC[-3]/100*RC[-1] -> 0.40
A48: 38 | B48: _A01.10.2 | C48: Нож EGO Tools красный | D48: 15.00 | E48: usd | F48: 1 | G48: 120.02 | H48: 0.40 | I48: 120.02 | J48: -179.98 | K48: 5 | L48: =RC[-3]/100*RC[-1] -> 0.40
A49: 39 | B49: _A01.12.1 | C49: Нож EGO Tools красный | D49: 16.07 | E49: usd | F49: 1 | G49: 128.52 | H49: 0.40 | I49: 128.52 | J49: -192.88 | K49: 5 | L49: =RC[-3]/100*RC[-1] -> 0.40
A50: 40 | B50: _A01.8 | C50: Нож EGO Tools красный | D50: 9.64 | E50: usd | F50: 1 | G50: 77.49 | H50: 0.40 | I50: 77.49 | J50: -115.31 | K50: 5 | L50: =RC[-3]/100*RC[-1] -> 0.40
A51: 41 | B51: _A01.9 | C51: Нож EGO Tools красный | D51: 12.14 | E51: usd | F51: 1 | G51: 97.34 | H51: 0.40 | I51: 97.33 | J51: -145.47 | K51: 5 | L51: =RC[-3]/100*RC[-1] -> 0.40
A52: 42 | B52: _A01.11 | C52: Нож EGO Tools красный | D52: 15.71 | E52: usd | F52: 1 | G52: 125.69 | H52: 0.40 | I52: 125.68 | J52: -188.52 | K52: 5 | L52: =RC[-3]/100*RC[-1] -> 0.40
A53: 43 | B53: _IT.02 | C53: Нож EGO Tools красный с набором біт | D53: 24.29 | E53: usd | F53: 1 | G53: 194.67 | H53: 0.40 | I53: 194.67 | J53: -291.13 | K53: 5 | L53: =RC[-3]/100*RC[-1] -> 0.40
A54: 44 | B54: _G613 | C54: Нож GANZO G613 | D54: 5.36 | E54: usd | F54: 1 | G54: 54.81 | H54: 0.51 | I54: 54.81 | J54: -52.39 | K54: 5 | L54: =RC[-3]/100*RC[-1] -> 0.51
A55: 45 | B55: _G614 | C55: Нож GANZO G614 | D55: 5.36 | E55: usd | F55: 1 | G55: 54.81 | H55: 0.51 | I55: 54.81 | J55: -52.39 | K55: 5 | L55: =RC[-3]/100*RC[-1] -> 0.51
A56: 46 | B56: _G615 | C56: Нож GANZO G615 | D56: 5.36 | E56: usd | F56: 1 | G56: 54.81 | H56: 0.51 | I56: 54.81 | J56: -52.39 | K56: 5 | L56: =RC[-3]/100*RC[-1] -> 0.51
A57: 47 | B57: _G616 | C57: Нож GANZO G616 | D57: 5.36 | E57: usd | F57: 1 | G57: 54.81 | H57: 0.51 | I57: 54.81 | J57: -52.39 | K57: 5 | L57: =RC[-3]/100*RC[-1] -> 0.51
A58: 48 | B58: _G617 | C58: Нож GANZO G617 | D58: 5.36 | E58: usd | F58: 1 | G58: 54.81 | H58: 0.51 | I58: 54.81 | J58: -52.39 | K58: 5 | L58: =RC[-3]/100*RC[-1] -> 0.51
A59: 49 | B59: _G618 | C59: Нож GANZO G618 | D59: 5.36 | E59: usd | F59: 1 | G59: 54.81 | H59: 0.51 | I59: 54.81 | J59: -52.39 | K59: 5 | L59: =RC[-3]/100*RC[-1] -> 0.51
A60: 50 | B60: _G619 | C60: Нож GANZO G619 | D60: 5.36 | E60: usd | F60: 1 | G60: 54.81 | H60: 0.51 | I60: 54.81 | J60: -52.39 | K60: 5 | L60: =RC[-3]/100*RC[-1] -> 0.51
A61: 51 | B61: _G701 | C61: Нож GANZO G701 | D61: 13.65 | E61: usd | F61: 1 | G61: 160.65 | H61: 0.59 | I61: 160.65 | J61: -112.35 | K61: 5 | L61: =RC[-3]/100*RC[-1] -> 0.59
A62: 52 | B62: _G701W | C62: Нож GANZO G701 White | D62: 13.65 | E62: usd | F62: 1 | G62: 160.65 | H62: 0.59 | I62: 160.65 | J62: -112.35 | K62: 5 | L62: =RC[-3]/100*RC[-1] -> 0.59
A63: 53 | B63: _G702B | C63: Нож GANZO G702B | D63: 13.65 | E63: usd | F63: 1 | G63: 160.37 | H63: 0.59 | I63: 160.37 | J63: -112.63 | K63: 5 | L63: =RC[-3]/100*RC[-1] -> 0.59
A64: 54 | B64: _G704g | C64: Нож GANZO G704g | D64: 16.51 | E64: usd | F64: 1 | G64: 171.99 | H64: 0.52 | I64: 171.99 | J64: -158.21 | K64: 5 | L64: =RC[-3]/100*RC[-1] -> 0.52
A65: 55 | B65: _G704y | C65: Нож GANZO G704y | D65: 16.51 | E65: usd | F65: 1 | G65: 171.99 | H65: 0.52 | I65: 171.99 | J65: -158.21 | K65: 5 | L65: =RC[-3]/100*RC[-1] -> 0.52
A66: 56 | B66: _G708 | C66: Нож GANZO G708 | D66: 17.07 | E66: usd | F66: 1 | G66: 161.87 | H66: 0.47 | I66: 161.87 | J66: -179.53 | K66: 5 | L66: =RC[-3]/100*RC[-1] -> 0.47
A67: 57 | B67: _G710 | C67: Нож GANZO G710 | D67: 17.63 | E67: usd | F67: 1 | G67: 198.45 | H67: 0.56 | I67: 198.45 | J67: -154.15 | K67: 5 | L67: =RC[-3]/100*RC[-1] -> 0.56
A68: 58 | B68: _G711 | C68: Нож GANZO G711 | D68: 17.63 | E68: usd | F68: 1 | G68: 208.36 | H68: 0.59 | I68: 208.36 | J68: -144.24 | K68: 5 | L68: =RC[-3]/100*RC[-1] -> 0.59
A69: 59 | B69: _G712 | C69: Нож GANZO G712 | D69: 17.63 | E69: usd | F69: 1 | G69: 198.03 | H69: 0.56 | I69: 198.03 | J69: -154.57 | K69: 5 | L69: =RC[-3]/100*RC[-1] -> 0.56
A70: 60 | B70: _G713 | C70: Нож GANZO G713 | D70: 19.89 | E70: usd | F70: 1 | G70: 187.70 | H70: 0.47 | I70: 187.70 | J70: -210.10 | K70: 5 | L70: =RC[-3]/100*RC[-1] -> 0.47
A71: 61 | B71: _G715 | C71: Нож GANZO G715 | D71: 19.89 | E71: usd | F71: 1 | G71: 188.84 | H71: 0.47 | I71: 188.84 | J71: -208.96 | K71: 5 | L71: =RC[-3]/100*RC[-1] -> 0.47
A72: 62 | B72: _G716-S | C72: Нож GANZO G716-S | D72: 24.40 | E72: usd | F72: 1 | G72: 252.32 | H72: 0.52 | I72: 252.32 | J72: -235.68 | K72: 5 | L72: =RC[-3]/100*RC[-1] -> 0.52
A73: 63 | B73: _G717b | C73: Нож GANZO G717b | D73: 23.84 | E73: usd | F73: 1 | G73: 246.65 | H73: 0.52 | I73: 246.64 | J73: -230.16 | K73: 5 | L73: =RC[-3]/100*RC[-1] -> 0.52
A74: 64 | B74: _G717y | C74: Нож GANZO G717y | D74: 23.84 | E74: usd | F74: 1 | G74: 246.65 | H74: 0.52 | I74: 246.64 | J74: -230.16 | K74: 5 | L74: =RC[-3]/100*RC[-1] -> 0.52 | M74: =SUM(R[-64]C[-1]:RC[-1]) -> 
A76: #1043 (2014-02-05) Львів Назар Максимович - Відправлено-Продано
A77: N | B77: арт | C77: назва | D77: закуп | F77: к-ть | G77: цiна | H77: кф | I77: продж | J77: дохiд | K77: % | L77: з-та
A78: 1 | B78: _GWAR2005A | C78: Арбалет 2005 camo | D78: 37.94 | E78: Инт | F78: 1 | G78: 340.00 | H78: 0.45 | I78: 340.00 | J78: -418.82 | K78: 5 | L78: =RC[-3]/100*RC[-1] -> 0.45
A79: 2 | B79: _544 | C79: Набор стріл алюмін.МК-AL (12шт.) ||Стрелы-AL (алюминий) | D79: 3.53 | E79: Инт | F79: 1 | G79: 32.00 | H79: 0.45 | I79: 32.00 | J79: -38.59 | K79: 5 | L79: =RC[-3]/100*RC[-1] -> 0.45 | M79: =SUM(R[-2]C[-1]:RC[-1]) -> 
A81: #1080 (2014-02-06) Львів Назар Максимович - Відправлено-Продано
A82: N | B82: арт | C82: назва | D82: закуп | F82: к-ть | G82: цiна | H82: кф | I82: продж | J82: дохiд | K82: % | L82: з-та
A83: 1 | B83: H5832/2XLR | C83: URBAN TACTICAL штаны олива драп (NYCO R/S) ||SP-UTL-NR-32 | D83: 29.06 | E83: usd | F83: 1 | G83: 602.00 | H83: 1.04 | I83: 421.40 | J83: -159.80 | K83: 5 | L83: =RC[-3]/100*RC[-1] -> 1.04 | M83: =SUM(R[-1]C[-1]:RC[-1]) -> 
A85: #1183 (2014-02-10) Львів Назар Максимович - Відправлено-Продано
A86: N | B86: арт | C86: назва | D86: закуп | F86: к-ть | G86: цiна | H86: кф | I86: продж | J86: дохiд | K86: % | L86: з-та
A87: 1 | B87: _G202B | C87: Мультитул GANZO G202B | D87: 17.10 | E87: usd | F87: 1 | G87: 170.00 | H87: 0.50 | I87: 170.00 | J87: -172.00 | K87: 5 | L87: =RC[-3]/100*RC[-1] -> 0.50 | M87: =SUM(R[-1]C[-1]:RC[-1]) -> 
A89: #1252 (2014-02-12) Львів Назар Максимович - Відправлено-Продано
A90: N | B90: арт | C90: назва | D90: закуп | F90: к-ть | G90: цiна | H90: кф | I90: продж | J90: дохiд | K90: % | L90: з-та
A91: 1 | B91: H4001/MR | C91: URBAN TACTICAL штаны чёрные ||SP-UTL-CO-01 | D91: 37.13 | E91: usd | F91: 1 | G91: 769.00 | H91: 1.04 | I91: 538.30 | J91: -204.30 | K91: 5 | L91: =RC[-3]/100*RC[-1] -> 1.04
A92: 2 | B92: X401 | C92: Балаклава чёрная с 1-м отв.(100%хлопок) ||X7601 | D92: 3.15 | E92: Инт | F92: 4 | G92: 35.00 | H92: 0.56 | I92: 98.00 | J92: -154.00 | K92: 5 | L92: =RC[-3]/100*RC[-1] -> 0.56
A93: 3 | B93: H0131/L | C93: Перчатки тактические Half Finger чёрные ||RK-HFG-PO-01 | D93: 7.88 | E93: usd | F93: 1 | G93: 163.00 | H93: 1.03 | I93: 114.10 | J93: -43.50 | K93: 5 | L93: =RC[-3]/100*RC[-1] -> 1.03
A94: 4 | B94: H75141 | C94: Блайзер HELIKON мультикам ||CZ-BBC-NT-14-HELIKON | D94: 2.76 | E94: usd | F94: 1 | G94: 89.00 | H94: 1.61 | I94: 62.30 | J94: 7.10 | K94: 5 | L94: =RC[-3]/100*RC[-1] -> 1.61
A95: 5 | B95: H7210/M | C95: US BDU кепка ACU (NYCO R/S) ||CZ-ACU-NR-10 | D95: 4.31 | E95: usd | F95: 1 | G95: 89.00 | H95: 1.03 | I95: 62.30 | J95: -23.90 | K95: 5 | L95: =RC[-3]/100*RC[-1] -> 1.03
A96: 6 | B96: H7105 | C96: US BDU кепка 3-х цветный дезерт (R/S) ||CZ-COM-CR-05 | D96: 2.33 | E96: usd | F96: 1 | G96: 50.00 | H96: 1.07 | I96: 35.00 | J96: -11.60 | K96: 5 | L96: =RC[-3]/100*RC[-1] -> 1.07 | M96: =SUM(R[-6]C[-1]:RC[-1]) -> 
A98: #1630 (2014-02-24) Львів Назар Максимович - Відправлено-Продано
A99: N | B99: арт | C99: назва | D99: закуп | F99: к-ть | G99: цiна | H99: кф | I99: продж | J99: дохiд | K99: % | L99: з-та
A100: 1 | B100: H3407/S | C100: Футболка марпат ||TS-TSH-CO-07 | D100: 4.13 | E100: usd | F100: 1 | G100: 84.00 | H100: 1.02 | I100: 58.80 | J100: -23.80 | K100: 5 | L100: =RC[-3]/100*RC[-1] -> 1.02
A101: 2 | B101: H3407/XL | C101: Футболка марпат ||TS-TSH-CO-07 | D101: 4.13 | E101: usd | F101: 1 | G101: 84.00 | H101: 1.02 | I101: 58.80 | J101: -23.80 | K101: 5 | L101: =RC[-3]/100*RC[-1] -> 1.02
A102: 3 | B102: H3405/S | C102: Футболка 3-кол.дезерт ||TS-TSH-CO-05 | D102: 4.06 | E102: usd | F102: 1 | G102: 84.00 | H102: 1.04 | I102: 58.80 | J102: -22.35 | K102: 5 | L102: =RC[-3]/100*RC[-1] -> 1.04
A103: 4 | B103: H3405/L | C103: Футболка 3-кол.дезерт ||TS-TSH-CO-05 | D103: 4.06 | E103: usd | F103: 1 | G103: 84.00 | H103: 1.04 | I103: 58.80 | J103: -22.35 | K103: 5 | L103: =RC[-3]/100*RC[-1] -> 1.04
A104: 5 | B104: H3412/S | C104: Футболка Black Camo ||TS-TSH-CO-12 | D104: 4.06 | E104: usd | F104: 1 | G104: 84.00 | H104: 1.04 | I104: 58.80 | J104: -22.35 | K104: 5 | L104: =RC[-3]/100*RC[-1] -> 1.04
A105: 6 | B105: H3412/XL | C105: Футболка Black Camo ||TS-TSH-CO-12 | D105: 4.06 | E105: usd | F105: 1 | G105: 84.00 | H105: 1.04 | I105: 58.80 | J105: -22.35 | K105: 5 | L105: =RC[-3]/100*RC[-1] -> 1.04
A106: 7 | B106: H3403/S | C106: Футболка вудлэнд ||TS-TSH-CO-03 | D106: 4.06 | E106: usd | F106: 1 | G106: 84.00 | H106: 1.04 | I106: 58.80 | J106: -22.35 | K106: 5 | L106: =RC[-3]/100*RC[-1] -> 1.04
A107: 8 | B107: _12549/M | C107: Перчатки SECURITY без пальцев кожаные чёрные ||12515002/903 | D107: 6.75 | E107: euro | F107: 1 | G107: 195.00 | H107: 1.16 | I107: 136.50 | J107: -32.25 | K107: 5 | L107: =RC[-3]/100*RC[-1] -> 1.16
A108: 9 | B108: H3410/S | C108: Футболка ACU ||TS-TSH-CO-10 | D108: 4.06 | E108: usd | F108: 1 | G108: 84.00 | H108: 1.04 | I108: 58.80 | J108: -22.35 | K108: 5 | L108: =RC[-3]/100*RC[-1] -> 1.04
A109: 10 | B109: H3410/XL | C109: Футболка ACU ||TS-TSH-CO-10 | D109: 4.06 | E109: usd | F109: 1 | G109: 84.00 | H109: 1.04 | I109: 58.80 | J109: -22.35 | K109: 5 | L109: =RC[-3]/100*RC[-1] -> 1.04
A110: 11 | B110: H3410/2XL | C110: Футболка ACU ||TS-TSH-CO-10 | D110: 4.06 | E110: usd | F110: 1 | G110: 84.00 | H110: 1.04 | I110: 58.80 | J110: -22.35 | K110: 5 | L110: =RC[-3]/100*RC[-1] -> 1.04
A111: 12 | B111: H3410/3XL | C111: Футболка ACU ||TS-TSH-CO-10 | D111: 4.06 | E111: usd | F111: 1 | G111: 84.00 | H111: 1.04 | I111: 58.80 | J111: -22.35 | K111: 5 | L111: =RC[-3]/100*RC[-1] -> 1.04
A112: 13 | B112: H3404/S | C112: Футболка польский вудлэнд ||TS-TSH-CO-04 | D112: 4.06 | E112: usd | F112: 1 | G112: 84.00 | H112: 1.04 | I112: 58.80 | J112: -22.35 | K112: 5 | L112: =RC[-3]/100*RC[-1] -> 1.04
A113: 14 | B113: H3404/XL | C113: Футболка польский вудлэнд ||TS-TSH-CO-04 | D113: 4.06 | E113: usd | F113: 1 | G113: 84.00 | H113: 1.04 | I113: 58.80 | J113: -22.35 | K113: 5 | L113: =RC[-3]/100*RC[-1] -> 1.04
A114: 15 | B114: H3404/2XL | C114: Футболка польский вудлэнд ||TS-TSH-CO-04 | D114: 4.06 | E114: usd | F114: 1 | G114: 84.00 | H114: 1.04 | I114: 58.80 | J114: -22.35 | K114: 5 | L114: =RC[-3]/100*RC[-1] -> 1.04
A115: 16 | B115: H3409/M | C115: Футболка урбан ||TS-TSH-CO-09 | D115: 4.06 | E115: usd | F115: 2 | G115: 84.00 | H115: 1.04 | I115: 117.60 | J115: -44.70 | K115: 5 | L115: =RC[-3]/100*RC[-1] -> 1.04
A116: 17 | B116: H44031/2XLR | C116: US BDU китель вудлэнд (R/S) ||BL-BDU-CR-03 | D116: 14.06 | E116: usd | F116: 1 | G116: 291.00 | H116: 1.03 | I116: 203.70 | J116: -77.50 | K116: 5 | L116: =RC[-3]/100*RC[-1] -> 1.03
A117: 18 | B117: H7811 | C117: Хустка SHEMAGH койот/чёрная ||CZ-ARF-CO-11 | D117: 3.62 | E117: usd | F117: 1 | G117: 82.00 | H117: 1.13 | I117: 57.40 | J117: -15.00 | K117: 5 | L117: =RC[-3]/100*RC[-1] -> 1.13
A118: 19 | B118: _12365 | C118: Блайзер чёрный ||12315002 | D118: 1.50 | E118: euro | F118: 5 | G118: 65.00 | H118: 1.73 | I118: 227.50 | J118: 40.00 | K118: 5 | L118: =RC[-3]/100*RC[-1] -> 1.73
A119: 20 | B119: _12366 | C119: Блайзер вудлэнд ||12315020 | D119: 1.50 | E119: euro | F119: 5 | G119: 56.00 | H119: 1.49 | I119: 196.00 | J119: 8.50 | K119: 5 | L119: =RC[-3]/100*RC[-1] -> 1.49
A120: 21 | B120: _12369 | C120: Блайзер урбан ||12315022 | D120: 1.50 | E120: euro | F120: 4 | G120: 56.00 | H120: 1.49 | I120: 156.80 | J120: 6.80 | K120: 5 | L120: =RC[-3]/100*RC[-1] -> 1.49
A121: 22 | B121: H7232 | C121: US BDU кепка олива драп ( PolyCotton Ripstop) ||CZ-COM-NR-32 | D121: 2.33 | E121: usd | F121: 2 | G121: 50.00 | H121: 1.07 | I121: 70.00 | J121: -23.20 | K121: 5 | L121: =RC[-3]/100*RC[-1] -> 1.07
A122: 23 | B122: _BD2454 | C122: Очки FA02 goggle-yellow [Производитель: ACM] | D122: 3.45 | E122: usd | F122: 2 | G122: 69.00 | H122: 1.00 | I122: 96.60 | J122: -41.40 | K122: 5 | L122: =RC[-3]/100*RC[-1] -> 1.00
A123: 24 | B123: _K17066-W | C123: Очки защитные жёлтые ||M51617066-YELLOW | D123: 2.97 | E123: usd | F123: 1 | G123: 69.00 | H123: 1.16 | I123: 48.30 | J123: -11.10 | K123: 5 | L123: =RC[-3]/100*RC[-1] -> 1.16
A124: 25 | B124: K17081-O | C124: Комплект (наколенники и налокотники) олива ||M51617081-OD | D124: 5.07 | E124: usd | F124: 1 | G124: 130.00 | H124: 1.28 | I124: 91.00 | J124: -10.40 | K124: 5 | L124: =RC[-3]/100*RC[-1] -> 1.28
A125: 26 | B125: H4113/SR | C125: US SFU штаны хаки (R/S) ||SP-SFU-CR-13 | D125: 14.49 | E125: usd | F125: 1 | G125: 300.00 | H125: 1.04 | I125: 210.00 | J125: -79.80 | K125: 5 | L125: =RC[-3]/100*RC[-1] -> 1.04
A126: 27 | B126: H0141/L | C126: Перчатки тактические US Model чёрные ||RK-USM-PO-01 | D126: 10.43 | E126: usd | F126: 1 | G126: 216.00 | H126: 1.04 | I126: 151.20 | J126: -57.40 | K126: 5 | L126: =RC[-3]/100*RC[-1] -> 1.04 | M126: =SUM(R[-27]C[-1]:RC[-1]) -> 
A128: #1682 (2014-02-25) Львів Назар Максимович - Відправлено-Продано
A129: N | B129: арт | C129: назва | D129: закуп | F129: к-ть | G129: цiна | H129: кф | I129: продж | J129: дохiд | K129: % | L129: з-та
A130: 1 | B130: _2069 | C130: Патрон Флобера 4мм Чехія (200шт) | D130: 0.13 | E130: Инт | F130: 2000 | G130: 1.25 | H130: 0.47 | I130: 2500.00 | J130: -2785.72 | K130: 5 | L130: =RC[-3]/100*RC[-1] -> 0.47 | M130: =SUM(R[-1]C[-1]:RC[-1]) -> 
A132: #1864 (2014-03-04) Львів Назар Максимович - Відправлено-Продано
A133: N | B133: арт | C133: назва | D133: закуп | F133: к-ть | G133: цiна | H133: кф | I133: продж | J133: дохiд | K133: % | L133: з-та
A134: 1 | B134: H5801/2XLR | C134: URBAN TACTICAL штаны чёрные (NYCO R/S) ||SP-UTL-NR-01 | D134: 29.06 | E134: usd | F134: 2 | G134: 702.00 | H134: 1.21 | I134: 982.80 | J134: -179.60 | K134: 5 | L134: =RC[-3]/100*RC[-1] -> 1.21
A135: 2 | B135: K17222-B | C135: Балаклава SKULL type B-чёрная [Производитель: ACM] ||M51617222-B | D135: 2.65 | E135: usd | F135: 1 | G135: 61.00 | H135: 1.15 | I135: 42.70 | J135: -10.30 | K135: 5 | L135: =RC[-3]/100*RC[-1] -> 1.15
A136: 3 | B136: K17222-D | C136: Балаклава SKULL type D-чёрная [Производитель: ACM] ||M51617222-D | D136: 2.65 | E136: usd | F136: 1 | G136: 61.00 | H136: 1.15 | I136: 42.70 | J136: -10.30 | K136: 5 | L136: =RC[-3]/100*RC[-1] -> 1.15
A137: 4 | B137: H7602 | C137: Балаклава олива с 1-м отв.(96%хлопок, 4%лайкра) ||CZ-KO1-CO-02 | D137: 1.82 | E137: usd | F137: 4 | G137: 48.00 | H137: 1.32 | I137: 134.40 | J137: -11.20 | K137: 5 | L137: =RC[-3]/100*RC[-1] -> 1.32
A138: 5 | B138: X401 | C138: Балаклава чёрная с 1-м отв.(100%хлопок) ||X7601 | D138: 3.15 | E138: Инт | F138: 4 | G138: 35.00 | H138: 0.56 | I138: 98.00 | J138: -154.00 | K138: 5 | L138: =RC[-3]/100*RC[-1] -> 0.56
A139: 6 | B139: H14202/XL | C139: Безрукавка охотничья FOX ||KK-FOX-PO-02 | D139: 14.84 | E139: usd | F139: 1 | G139: 358.00 | H139: 1.21 | I139: 250.60 | J139: -46.20 | K139: 5 | L139: =RC[-3]/100*RC[-1] -> 1.21
A140: 7 | B140: K17081-O | C140: Комплект (наколенники и налокотники) олива ||M51617081-OD | D140: 5.07 | E140: usd | F140: 1 | G140: 152.00 | H140: 1.50 | I140: 106.40 | J140: 5.00 | K140: 5 | L140: =RC[-3]/100*RC[-1] -> 1.50
A141: 8 | B141: K17074-B | C141: Комплект (наколенники и налокотники) чёрные ||M51617074-BK | D141: 9.00 | E141: usd | F141: 2 | G141: 292.00 | H141: 1.62 | I141: 408.80 | J141: 48.80 | K141: 5 | L141: =RC[-3]/100*RC[-1] -> 1.62
A142: 9 | B142: H29J011/XL | C142: Куртка Jackal Soft Shell чёрная ||BL-JCK-FS-01 | D142: 37.10 | E142: usd | F142: 1 | G142: 888.00 | H142: 1.20 | I142: 621.60 | J142: -120.40 | K142: 5 | L142: =RC[-3]/100*RC[-1] -> 1.20
A143: 10 | B143: 56413-00 | C143: Наколінники AltaGUARD чёрные [ALTA] ||OK-AGL-CD-01 | D143: 24.21 | E143: usd | F143: 1 | G143: 585.00 | H143: 1.21 | I143: 409.50 | J143: -74.70 | K143: 5 | L143: =RC[-3]/100*RC[-1] -> 1.21
A144: 11 | B144: 53010-00 | C144: Налокотники AltaFLEX чёрные [ALTA] ||OL-AFV-CD-01 | D144: 10.26 | E144: usd | F144: 1 | G144: 255.00 | H144: 1.24 | I144: 178.50 | J144: -26.70 | K144: 5 | L144: =RC[-3]/100*RC[-1] -> 1.24
A145: 12 | B145: H88001/L | C145: Ремень US UTILITY чёрный нейлон ||PS-UTL-NL-01 | D145: 5.59 | E145: usd | F145: 2 | G145: 135.00 | H145: 1.21 | I145: 189.00 | J145: -34.60 | K145: 5 | L145: =RC[-3]/100*RC[-1] -> 1.21
A146: 13 | B146: H9601 | C146: Рюкзак COMPACT ASSAULT PACK 20л чёрный ||PL-CAP-PO-01 | D146: 22.37 | E146: usd | F146: 5 | G146: 540.00 | H146: 1.21 | I146: 1890.00 | J146: -347.00 | K146: 5 | L146: =RC[-3]/100*RC[-1] -> 1.21
A147: 14 | B147: H3401/2XL | C147: Футболка чёрная ||TS-TSH-CO-01 | D147: 4.06 | E147: usd | F147: 2 | G147: 98.00 | H147: 1.21 | I147: 137.20 | J147: -25.10 | K147: 5 | L147: =RC[-3]/100*RC[-1] -> 1.21 | M147: =SUM(R[-14]C[-1]:RC[-1]) -> 
A149: #1970 (2014-03-06) Львів Назар Максимович - Відправлено-Продано
A150: N | B150: арт | C150: назва | D150: закуп | F150: к-ть | G150: цiна | H150: кф | I150: продж | J150: дохiд | K150: % | L150: з-та
A151: 1 | B151: _P1500-70 | C151: Паракорд 5м с светловідбиваючим елементом красный | D151: 22.50 | E151: грн | F151: 1 | G151: 22.50 | H151: 1.00 | I151: 22.50 | J151: 0.00 | K151: 5 | L151: =RC[-3]/100*RC[-1] -> 1.00
A152: 2 | B152: _P1500-69 | C152: Паракорд 5м с светловідбиваючим елементом олива | D152: 22.50 | E152: грн | F152: 1 | G152: 22.50 | H152: 1.00 | I152: 22.50 | J152: 0.00 | K152: 5 | L152: =RC[-3]/100*RC[-1] -> 1.00
A153: 3 | B153: _P1500-10 | C153: Паракорд 5м | D153: 17.50 | E153: грн | F153: 1 | G153: 17.50 | H153: 1.00 | I153: 17.50 | J153: 0.00 | K153: 5 | L153: =RC[-3]/100*RC[-1] -> 1.00
A154: 4 | B154: _P1500-15 | C154: Паракорд 5м | D154: 17.50 | E154: грн | F154: 1 | G154: 17.50 | H154: 1.00 | I154: 17.50 | J154: 0.00 | K154: 5 | L154: =RC[-3]/100*RC[-1] -> 1.00
A155: 5 | B155: _P1500-42 | C155: Паракорд 5м | D155: 17.50 | E155: грн | F155: 1 | G155: 17.50 | H155: 1.00 | I155: 17.50 | J155: 0.00 | K155: 5 | L155: =RC[-3]/100*RC[-1] -> 1.00
A156: 6 | B156: _P1500-41 | C156: Паракорд 5м | D156: 17.50 | E156: грн | F156: 1 | G156: 17.50 | H156: 1.00 | I156: 17.50 | J156: 0.00 | K156: 5 | L156: =RC[-3]/100*RC[-1] -> 1.00
A157: 7 | B157: _P1500-48 | C157: Паракорд 5м | D157: 17.50 | E157: грн | F157: 1 | G157: 17.50 | H157: 1.00 | I157: 17.50 | J157: 0.00 | K157: 5 | L157: =RC[-3]/100*RC[-1] -> 1.00
A158: 8 | B158: _P1500-44 | C158: Паракорд 5м | D158: 17.50 | E158: грн | F158: 1 | G158: 17.50 | H158: 1.00 | I158: 17.50 | J158: 0.00 | K158: 5 | L158: =RC[-3]/100*RC[-1] -> 1.00
A159: 9 | B159: _P1500-55 | C159: Паракорд 5м | D159: 17.50 | E159: грн | F159: 1 | G159: 17.50 | H159: 1.00 | I159: 17.50 | J159: 0.00 | K159: 5 | L159: =RC[-3]/100*RC[-1] -> 1.00
A160: 10 | B160: _P1500-57 | C160: Паракорд 5м | D160: 17.50 | E160: грн | F160: 1 | G160: 17.50 | H160: 1.00 | I160: 17.50 | J160: 0.00 | K160: 5 | L160: =RC[-3]/100*RC[-1] -> 1.00 | M160: =SUM(R[-10]C[-1]:RC[-1]) -> 
A162: #1974 (2014-03-06) Львів Назар Максимович - Відправлено-Продано
A163: N | B163: арт | C163: назва | D163: закуп | F163: к-ть | G163: цiна | H163: кф | I163: продж | J163: дохiд | K163: % | L163: з-та
A164: 1 | B164: H48061/XLR | C164: TCU китель PL-des (R/S) ||BL-TCU-CR-06 | D164: 20.10 | E164: usd | F164: 1 | G164: 485.00 | H164: 1.21 | I164: 339.50 | J164: -62.50 | K164: 5 | L164: =RC[-3]/100*RC[-1] -> 1.21
A165: 2 | B165: H7106 | C165: US BDU кепка польский дезерт (R/S) ||CZ-COM-CR-06 | D165: 2.33 | E165: usd | F165: 2 | G165: 58.00 | H165: 1.24 | I165: 81.20 | J165: -12.00 | K165: 5 | L165: =RC[-3]/100*RC[-1] -> 1.24
A166: 3 | B166: H7007/L | C166: US MC панама марпат (NYCO) ||KA-USM-NT-07 | D166: 4.58 | E166: usd | F166: 1 | G166: 111.00 | H166: 1.21 | I166: 77.70 | J166: -13.90 | K166: 5 | L166: =RC[-3]/100*RC[-1] -> 1.21
A167: 4 | B167: H4302/LR | C167: US SFU штаны олива (NYCO R/S) ||SP-SFU-NR-02 SP-SFU-PR-02 | D167: 15.03 | E167: usd | F167: 1 | G167: 350.00 | H167: 1.16 | I167: 245.00 | J167: -55.60 | K167: 5 | L167: =RC[-3]/100*RC[-1] -> 1.16
A168: 5 | B168: H4106/LR | C168: US SFU штаны польский дезерт (R/S) ||SP-SFU-CR-06 | D168: 14.49 | E168: usd | F168: 1 | G168: 350.00 | H168: 1.21 | I168: 245.00 | J168: -44.80 | K168: 5 | L168: =RC[-3]/100*RC[-1] -> 1.21
A169: 6 | B169: H7407/L | C169: USMC кепка марпат (NYCO) ||CZ-USM-NT-07 | D169: 4.47 | E169: usd | F169: 1 | G169: 104.00 | H169: 1.16 | I169: 72.80 | J169: -16.60 | K169: 5 | L169: =RC[-3]/100*RC[-1] -> 1.16
A170: 7 | B170: H47071/XLR | C170: USMC китель марпат (NYCO) ||BL-USM-NT-07 | D170: 17.32 | E170: usd | F170: 1 | G170: 390.00 | H170: 1.13 | I170: 273.00 | J170: -73.40 | K170: 5 | L170: =RC[-3]/100*RC[-1] -> 1.13
A171: 8 | B171: H4707/LR | C171: USMC штаны марпат (NYCO) ||SP-USM-NT-07 | D171: 17.32 | E171: usd | F171: 1 | G171: 390.00 | H171: 1.13 | I171: 273.00 | J171: -73.40 | K171: 5 | L171: =RC[-3]/100*RC[-1] -> 1.13
A172: 9 | B172: H295061/XL | C172: Куртка SOFT SHELL LEVEL 5 польск.дезерт ||BL-SS2-NL-06 | D172: 34.88 | E172: usd | F172: 1 | G172: 842.00 | H172: 1.21 | I172: 589.40 | J172: -108.20 | K172: 5 | L172: =RC[-3]/100*RC[-1] -> 1.21
A173: 10 | B173: H55071/XL | C173: Куртка SOLDIER-2008 марпат (NYCO R/S) ||KU-FP8-NR-07 | D173: 45.71 | E173: usd | F173: 1 | G173: 1104.00 | H173: 1.21 | I173: 772.80 | J173: -141.40 | K173: 5 | L173: =RC[-3]/100*RC[-1] -> 1.21
A174: 11 | B174: H3412/L | C174: Футболка Black Camo ||TS-TSH-CO-12 | D174: 4.06 | E174: usd | F174: 1 | G174: 98.00 | H174: 1.21 | I174: 68.60 | J174: -12.55 | K174: 5 | L174: =RC[-3]/100*RC[-1] -> 1.21
A175: 12 | B175: H3412/S | C175: Футболка Black Camo ||TS-TSH-CO-12 | D175: 4.06 | E175: usd | F175: 1 | G175: 98.00 | H175: 1.21 | I175: 68.60 | J175: -12.55 | K175: 5 | L175: =RC[-3]/100*RC[-1] -> 1.21
A176: 13 | B176: H3407/L | C176: Футболка марпат ||TS-TSH-CO-07 | D176: 4.13 | E176: usd | F176: 1 | G176: 98.00 | H176: 1.19 | I176: 68.60 | J176: -14.00 | K176: 5 | L176: =RC[-3]/100*RC[-1] -> 1.19
A177: 14 | B177: H3407/XL | C177: Футболка марпат ||TS-TSH-CO-07 | D177: 4.13 | E177: usd | F177: 1 | G177: 98.00 | H177: 1.19 | I177: 68.60 | J177: -14.00 | K177: 5 | L177: =RC[-3]/100*RC[-1] -> 1.19
A178: 15 | B178: H3406/XL | C178: Футболка польский дезерт ||TS-TSH-CO-06 | D178: 4.06 | E178: usd | F178: 1 | G178: 98.00 | H178: 1.21 | I178: 68.60 | J178: -12.55 | K178: 5 | L178: =RC[-3]/100*RC[-1] -> 1.21 | M178: =SUM(R[-15]C[-1]:RC[-1]) -> 
A180: #2158 (2014-03-12) Львів Назар Максимович - Відправлено-Продано
A181: N | B181: арт | C181: назва | D181: закуп | F181: к-ть | G181: цiна | H181: кф | I181: продж | J181: дохiд | K181: % | L181: з-та
A182: 1 | B182: _12676 | C182: BW бандана (оригинал) олива ||12601001 | D182: 2.75 | E182: euro | F182: 1 | G182: 79.00 | H182: 1.15 | I182: 55.30 | J182: -13.45 | K182: 5 | L182: =RC[-3]/100*RC[-1] -> 1.15
A183: 2 | B183: H4710/MR | C183: US ACU штаны ACU (PolyCotton) ||SP-ACU-PR-10 | D183: 17.43 | E183: usd | F183: 1 | G183: 421.00 | H183: 1.21 | I183: 294.70 | J183: -53.90 | K183: 5 | L183: =RC[-3]/100*RC[-1] -> 1.21
A184: 3 | B184: H4710/LR | C184: US ACU штаны ACU (PolyCotton) ||SP-ACU-PR-10 | D184: 17.43 | E184: usd | F184: 1 | G184: 421.00 | H184: 1.21 | I184: 294.70 | J184: -53.90 | K184: 5 | L184: =RC[-3]/100*RC[-1] -> 1.21
A185: 4 | B185: H7210/M | C185: US BDU кепка ACU (NYCO R/S) ||CZ-ACU-NR-10 | D185: 4.31 | E185: usd | F185: 1 | G185: 104.00 | H185: 1.21 | I185: 72.80 | J185: -13.40 | K185: 5 | L185: =RC[-3]/100*RC[-1] -> 1.21
A186: 5 | B186: H7210/L | C186: US BDU кепка ACU (NYCO R/S) ||CZ-ACU-NR-10 | D186: 4.31 | E186: usd | F186: 1 | G186: 104.00 | H186: 1.21 | I186: 72.80 | J186: -13.40 | K186: 5 | L186: =RC[-3]/100*RC[-1] -> 1.21
A187: 6 | B187: H7210/XL | C187: US BDU кепка ACU (NYCO R/S) ||CZ-ACU-NR-10 | D187: 4.31 | E187: usd | F187: 1 | G187: 104.00 | H187: 1.21 | I187: 72.80 | J187: -13.40 | K187: 5 | L187: =RC[-3]/100*RC[-1] -> 1.21
A188: 7 | B188: H7211 | C188: US BDU кепка койот (NYCO R/S) ||CZ-COM-NR-11 | D188: 2.33 | E188: usd | F188: 1 | G188: 58.00 | H188: 1.24 | I188: 40.60 | J188: -6.00 | K188: 5 | L188: =RC[-3]/100*RC[-1] -> 1.24
A189: 8 | B189: H7214/M-57 | C189: US ACU кепка мультикам (NYCO R/S) ||CZ-ACU-PR-14 | D189: 4.31 | E189: usd | F189: 1 | G189: 104.00 | H189: 1.21 | I189: 72.80 | J189: -13.40 | K189: 5 | L189: =RC[-3]/100*RC[-1] -> 1.21
A190: 9 | B190: H7214/L-59 | C190: US ACU кепка мультикам (NYCO R/S) ||CZ-ACU-PR-14 | D190: 4.31 | E190: usd | F190: 1 | G190: 104.00 | H190: 1.21 | I190: 72.80 | J190: -13.40 | K190: 5 | L190: =RC[-3]/100*RC[-1] -> 1.21
A191: 10 | B191: H7214/XL-61 | C191: US ACU кепка мультикам (NYCO R/S) ||CZ-ACU-PR-14 | D191: 4.31 | E191: usd | F191: 1 | G191: 104.00 | H191: 1.21 | I191: 72.80 | J191: -13.40 | K191: 5 | L191: =RC[-3]/100*RC[-1] -> 1.21
A192: 11 | B192: H1927/M | C192: Куртка URBAN TACTICAL LINE DELTA Jungle Green ||BL-DLT-FS-27 | D192: 33.19 | E192: usd | F192: 1 | G192: 802.00 | H192: 1.21 | I192: 561.40 | J192: -102.40 | K192: 5 | L192: =RC[-3]/100*RC[-1] -> 1.21
A193: 12 | B193: H0500/UA | C193: Ліпучка Флаг України резина ||OD-FUA-RB-26 | D193: 2.92 | E193: usd | F193: 1 | G193: 62.00 | H193: 1.06 | I193: 43.40 | J193: -15.00 | K193: 5 | L193: =RC[-3]/100*RC[-1] -> 1.06
A194: 13 | B194: 56413-00 | C194: Наколінники AltaGUARD чёрные [ALTA] ||OK-AGL-CD-01 | D194: 24.21 | E194: usd | F194: 2 | G194: 585.00 | H194: 1.21 | I194: 819.00 | J194: -149.40 | K194: 5 | L194: =RC[-3]/100*RC[-1] -> 1.21
A195: 14 | B195: 53010-00 | C195: Налокотники AltaFLEX чёрные [ALTA] ||OL-AFV-CD-01 | D195: 10.26 | E195: usd | F195: 2 | G195: 255.00 | H195: 1.24 | I195: 357.00 | J195: -53.40 | K195: 5 | L195: =RC[-3]/100*RC[-1] -> 1.24
A196: 15 | B196: _525250 | C196: Окуляри жёлтые [OREGON] | D196: 55.00 | E196: zl | F196: 1 | G196: 85.00 | H196: 0.31 | I196: 72.25 | J196: -202.75 | K196: 5 | L196: =RC[-3]/100*RC[-1] -> 0.31
A197: 16 | B197: _525252 | C197: Окуляри затемненные [OREGON] | D197: 55.00 | E197: zl | F197: 1 | G197: 85.00 | H197: 0.31 | I197: 72.25 | J197: -202.75 | K197: 5 | L197: =RC[-3]/100*RC[-1] -> 0.31
A198: 17 | B198: _K17066-W | C198: Очки защитные жёлтые ||M51617066-YELLOW | D198: 2.97 | E198: usd | F198: 2 | G198: 80.00 | H198: 1.35 | I198: 112.00 | J198: -6.80 | K198: 5 | L198: =RC[-3]/100*RC[-1] -> 1.35
A199: 18 | B199: H88001/L | C199: Ремень US UTILITY чёрный нейлон ||PS-UTL-NL-01 | D199: 5.59 | E199: usd | F199: 1 | G199: 135.00 | H199: 1.21 | I199: 94.50 | J199: -17.30 | K199: 5 | L199: =RC[-3]/100*RC[-1] -> 1.21 | M199: =SUM(R[-18]C[-1]:RC[-1]) -> 
A201: #2211 (2014-03-13) Львів Назар Максимович - Відправлено-Продано
A202: N | B202: арт | C202: назва | D202: закуп | F202: к-ть | G202: цiна | H202: кф | I202: продж | J202: дохiд | K202: % | L202: з-та
A203: 1 | B203: H2011/M | C203: Куртка LIBERTY флисовая койот 390г/м (superfine) ||BL-LIB-HF-11 | D203: 28.04 | E203: usd | F203: 1 | G203: 677.00 | H203: 1.21 | I203: 473.90 | J203: -86.80 | K203: 5 | L203: =RC[-3]/100*RC[-1] -> 1.21
A204: 2 | B204: H2011/XL | C204: Куртка LIBERTY флисовая койот 390г/м (superfine) ||BL-LIB-HF-11 | D204: 28.04 | E204: usd | F204: 1 | G204: 677.00 | H204: 1.21 | I204: 473.90 | J204: -86.80 | K204: 5 | L204: =RC[-3]/100*RC[-1] -> 1.21
A205: 3 | B205: H4402/LR | C205: US BDU штаны олива (R/S) ||SP-BDU-CR-02 | D205: 14.06 | E205: usd | F205: 1 | G205: 340.00 | H205: 1.21 | I205: 238.00 | J205: -43.20 | K205: 5 | L205: =RC[-3]/100*RC[-1] -> 1.21
A206: 4 | B206: H4113/SL | C206: US SFU штаны хаки (R/S) ||SP-SFU-CR-13 | D206: 14.49 | E206: usd | F206: 1 | G206: 350.00 | H206: 1.21 | I206: 245.00 | J206: -44.80 | K206: 5 | L206: =RC[-3]/100*RC[-1] -> 1.21
A207: 5 | B207: H8913/120 | C207: Ремень TOUGH US MARINES койот ||PS-USM-CO-13 | D207: 3.68 | E207: usd | F207: 1 | G207: 102.00 | H207: 1.39 | I207: 71.40 | J207: -2.20 | K207: 5 | L207: =RC[-3]/100*RC[-1] -> 1.39 | M207: =SUM(R[-5]C[-1]:RC[-1]) -> 
A209: #2212 (2014-03-13) Львів Назар Максимович - Відправлено-Продано
A210: N | B210: арт | C210: назва | D210: закуп | F210: к-ть | G210: цiна | H210: кф | I210: продж | J210: дохiд | K210: % | L210: з-та
A211: 1 | B211: GWK09А | C211: Набор кухонных ножей GRAND WAY 09 А | D211: 31.76 | E211: Инт | F211: 1 | G211: 290.00 | H211: 0.46 | I211: 290.00 | J211: -345.29 | K211: 5 | L211: =RC[-3]/100*RC[-1] -> 0.46 | M211: =SUM(R[-1]C[-1]:RC[-1]) -> 
A213: #2230 (2014-03-13) Львів Назар Максимович - Клієнт повернув
A214: N | B214: арт | C214: назва | D214: закуп | F214: к-ть | G214: цiна | H214: кф | I214: продж | J214: дохiд | K214: % | L214: з-та
A215: 1 | B215: H5801/2XLR | C215: URBAN TACTICAL штаны чёрные (NYCO R/S) ||SP-UTL-NR-01 | D215: 29.06 | E215: usd | F215: 1 | G215: 702.00 | H215: 1.21 | I215: 491.40 | J215: -89.80 | K215: 5 | L215: =RC[-3]/100*RC[-1] -> 1.21 | M215: =SUM(R[-1]C[-1]:RC[-1]) -> 
A217: #2233 (2014-03-13) Львів Назар Максимович - Відправлено-Продано
A218: N | B218: арт | C218: назва | D218: закуп | F218: к-ть | G218: цiна | H218: кф | I218: продж | J218: дохiд | K218: % | L218: з-та
A219: 1 | B219: _ST50016ES | C219: Микротул Swiss+Tech Micro-Plus EX 9-in-1 | D219: 6.23 | E219: Инт | F219: 1 | G219: 86.10 | H219: 0.69 | I219: 86.10 | J219: -38.57 | K219: 5 | L219: =RC[-3]/100*RC[-1] -> 0.69
A220: 2 | B220: _G30280 | C220: Мультитул GANZO 30280 | D220: 7.00 | E220: usd | F220: 1 | G220: 92.40 | H220: 0.66 | I220: 92.40 | J220: -47.60 | K220: 5 | L220: =RC[-3]/100*RC[-1] -> 0.66
A221: 3 | B221: _G202 | C221: Мультитул GANZO G202 | D221: 16.51 | E221: usd | F221: 1 | G221: 156.70 | H221: 0.47 | I221: 156.70 | J221: -173.50 | K221: 5 | L221: =RC[-3]/100*RC[-1] -> 0.47
A222: 4 | B222: _G708 | C222: Нож GANZO G708 | D222: 17.07 | E222: usd | F222: 1 | G222: 161.87 | H222: 0.47 | I222: 161.87 | J222: -179.53 | K222: 5 | L222: =RC[-3]/100*RC[-1] -> 0.47
A223: 5 | B223: GW3509B | C223: Нож GRAND WAY метальний | D223: 2.12 | E223: Инт | F223: 2 | G223: 18.90 | H223: 0.45 | I223: 37.80 | J223: -46.91 | K223: 5 | L223: =RC[-3]/100*RC[-1] -> 0.45
A224: 6 | B224: GW5827 | C224: Нож GRAND WAY метальний | D224: 2.29 | E224: Инт | F224: 2 | G224: 20.48 | H224: 0.45 | I224: 40.95 | J224: -50.81 | K224: 5 | L224: =RC[-3]/100*RC[-1] -> 0.45
A225: 7 | B225: GW6810 | C225: Нож GRAND WAY метальний||6810 | D225: 3.35 | E225: Инт | F225: 2 | G225: 29.93 | H225: 0.45 | I225: 59.85 | J225: -74.27 | K225: 5 | L225: =RC[-3]/100*RC[-1] -> 0.45
A226: 8 | B226: GWE52 | C226: Плоскогубцы GRAND WAY | D226: 7.77 | E226: Инт | F226: 1 | G226: 66.94 | H226: 0.43 | I226: 66.94 | J226: -88.46 | K226: 5 | L226: =RC[-3]/100*RC[-1] -> 0.43
A227: 9 | B227: GWE54 | C227: Плоскогубцы GRAND WAY | D227: 7.32 | E227: Инт | F227: 1 | G227: 63.00 | H227: 0.43 | I227: 63.00 | J227: -83.40 | K227: 5 | L227: =RC[-3]/100*RC[-1] -> 0.43
A228: 10 | B228: GWE50 | C228: Плоскогубцы GRAND WAY | D228: 4.57 | E228: Инт | F228: 1 | G228: 39.38 | H228: 0.43 | I228: 39.38 | J228: -52.08 | K228: 5 | L228: =RC[-3]/100*RC[-1] -> 0.43
A229: 11 | B229: GW1064 | C229: Плоскогубцы GRAND WAY | D229: 6.40 | E229: Инт | F229: 1 | G229: 55.13 | H229: 0.43 | I229: 55.13 | J229: -72.87 | K229: 5 | L229: =RC[-3]/100*RC[-1] -> 0.43
A230: 12 | B230: GW10465 | C230: Плоскогубцы GRAND WAY | D230: 4.76 | E230: Инт | F230: 1 | G230: 40.95 | H230: 0.43 | I230: 40.95 | J230: -54.17 | K230: 5 | L230: =RC[-3]/100*RC[-1] -> 0.43
A231: 13 | B231: GW2611BS | C231: Плоскогубцы GRAND WAY | D231: 5.49 | E231: Инт | F231: 1 | G231: 47.25 | H231: 0.43 | I231: 47.25 | J231: -62.51 | K231: 5 | L231: =RC[-3]/100*RC[-1] -> 0.43
A232: 14 | B232: GW2611C | C232: Плоскогубцы GRAND WAY | D232: 8.69 | E232: Инт | F232: 1 | G232: 74.81 | H232: 0.43 | I232: 74.81 | J232: -98.97 | K232: 5 | L232: =RC[-3]/100*RC[-1] -> 0.43
A233: 15 | B233: GW2611A-1 | C233: Плоскогубцы GRAND WAY | D233: 8.69 | E233: Инт | F233: 1 | G233: 74.81 | H233: 0.43 | I233: 74.81 | J233: -98.97 | K233: 5 | L233: =RC[-3]/100*RC[-1] -> 0.43
A234: 16 | B234: GW10329 | C234: Плоскогубцы GRAND WAY | D234: 5.67 | E234: Инт | F234: 1 | G234: 48.83 | H234: 0.43 | I234: 48.83 | J234: -64.58 | K234: 5 | L234: =RC[-3]/100*RC[-1] -> 0.43
A235: 17 | B235: GW1025 | C235: Плоскогубцы GRAND WAY набір | D235: 9.15 | E235: Инт | F235: 1 | G235: 78.75 | H235: 0.43 | I235: 78.75 | J235: -104.18 | K235: 5 | L235: =RC[-3]/100*RC[-1] -> 0.43 | M235: =SUM(R[-17]C[-1]:RC[-1]) -> 
A237: #2266 (2014-03-14) Львів Назар Максимович - Відправлено-Продано
A238: N | B238: арт | C238: назва | D238: закуп | F238: к-ть | G238: цiна | H238: кф | I238: продж | J238: дохiд | K238: % | L238: з-та
A239: 1 | B239: H4601/2XLR | C239: US BDU штаны чёрные (PolyCotton) ||SP-BDU-PR-01 | D239: 13.64 | E239: usd | F239: 1 | G239: 340.00 | H239: 1.25 | I239: 238.00 | J239: -34.80 | K239: 5 | L239: =RC[-3]/100*RC[-1] -> 1.25
A240: 2 | B240: H29J021/2XL | C240: Куртка Jackal Soft Shell фоліаж ||BL-JCK-FS-21 | D240: 37.10 | E240: usd | F240: 1 | G240: 888.00 | H240: 1.20 | I240: 621.60 | J240: -120.40 | K240: 5 | L240: =RC[-3]/100*RC[-1] -> 1.20
A241: 3 | B241: H29J021/L | C241: Куртка Jackal Soft Shell фоліаж ||BL-JCK-FS-21 | D241: 37.10 | E241: usd | F241: 1 | G241: 888.00 | H241: 1.20 | I241: 621.60 | J241: -120.40 | K241: 5 | L241: =RC[-3]/100*RC[-1] -> 1.20
A242: 4 | B242: X401 | C242: Балаклава чёрная с 1-м отв.(100%хлопок) ||X7601 | D242: 3.15 | E242: Инт | F242: 1 | G242: 35.00 | H242: 0.56 | I242: 24.50 | J242: -38.50 | K242: 5 | L242: =RC[-3]/100*RC[-1] -> 0.56
A243: 5 | B243: H4311/XLR | C243: US SFU штаны койот (PolyCotton) ||SP-SFU-PR-11 | D243: 15.03 | E243: usd | F243: 1 | G243: 350.00 | H243: 1.16 | I243: 245.00 | J243: -55.60 | K243: 5 | L243: =RC[-3]/100*RC[-1] -> 1.16
A244: 6 | B244: H5801/XLR | C244: URBAN TACTICAL штаны чёрные (NYCO R/S) ||SP-UTL-NR-01 | D244: 29.06 | E244: usd | F244: 1 | G244: 702.00 | H244: 1.21 | I244: 491.40 | J244: -89.80 | K244: 5 | L244: =RC[-3]/100*RC[-1] -> 1.21
A245: 7 | B245: H7106 | C245: US BDU кепка польский дезерт (R/S) ||CZ-COM-CR-06 | D245: 2.33 | E245: usd | F245: 3 | G245: 58.00 | H245: 1.24 | I245: 121.80 | J245: -18.00 | K245: 5 | L245: =RC[-3]/100*RC[-1] -> 1.24
A246: 8 | B246: H7541 | C246: Блайзер PenCott GreenZone (NYCO+R/S) ||CZ-BBC-NR-41 | D246: 10.00 | E246: usd | F246: 1 | G246: 223.00 | H246: 1.12 | I246: 156.10 | J246: -43.90 | K246: 5 | L246: =RC[-3]/100*RC[-1] -> 1.12
A247: 9 | B247: H0131/L | C247: Перчатки тактические Half Finger чёрные ||RK-HFG-PO-01 | D247: 7.88 | E247: usd | F247: 2 | G247: 190.00 | H247: 1.21 | I247: 266.00 | J247: -49.20 | K247: 5 | L247: =RC[-3]/100*RC[-1] -> 1.21 | M247: =SUM(R[-9]C[-1]:RC[-1]) -> 
A249: #2393 (2014-03-18) Львів Назар Максимович - Відправлено-Продано
A250: N | B250: арт | C250: назва | D250: закуп | F250: к-ть | G250: цiна | H250: кф | I250: продж | J250: дохiд | K250: % | L250: з-та
A251: 1 | B251: H4402/XLR | C251: US BDU штаны олива (R/S) ||SP-BDU-CR-02 | D251: 14.06 | E251: usd | F251: 1 | G251: 340.00 | H251: 1.21 | I251: 238.00 | J251: -43.20 | K251: 5 | L251: =RC[-3]/100*RC[-1] -> 1.21
A252: 2 | B252: _BD2454 | C252: Очки FA02 goggle-yellow [Производитель: ACM] | D252: 3.45 | E252: usd | F252: 4 | G252: 80.00 | H252: 1.16 | I252: 224.00 | J252: -52.00 | K252: 5 | L252: =RC[-3]/100*RC[-1] -> 1.16
A253: 3 | B253: H88001/L | C253: Ремень US UTILITY чёрный нейлон ||PS-UTL-NL-01 | D253: 5.59 | E253: usd | F253: 1 | G253: 135.00 | H253: 1.21 | I253: 94.50 | J253: -17.30 | K253: 5 | L253: =RC[-3]/100*RC[-1] -> 1.21
A254: 4 | B254: _2069 | C254: Патрон Флобера 4мм Чехія (200шт) | D254: 0.13 | E254: Инт | F254: 2000 | G254: 1.25 | H254: 0.47 | I254: 2500.00 | J254: -2785.72 | K254: 5 | L254: =RC[-3]/100*RC[-1] -> 0.47 | M254: =SUM(R[-4]C[-1]:RC[-1]) -> 
A256: #2556 (2014-03-21) Львів Назар Максимович - Відправлено-Продано
A257: N | B257: арт | C257: назва | D257: закуп | F257: к-ть | G257: цiна | H257: кф | I257: продж | J257: дохiд | K257: % | L257: з-та
A258: 1 | B258: H59011/XXLR | C258: CPU китель чёрный (PolyCotton) ||BL-CPU-PR-01 | D258: 20.10 | E258: usd | F258: 1 | G258: 485.00 | H258: 1.21 | I258: 339.50 | J258: -62.50 | K258: 5 | L258: =RC[-3]/100*RC[-1] -> 1.21
A259: 2 | B259: H59011/XLR | C259: CPU китель чёрный (PolyCotton) ||BL-CPU-PR-01 | D259: 20.10 | E259: usd | F259: 1 | G259: 485.00 | H259: 1.21 | I259: 339.50 | J259: -62.50 | K259: 5 | L259: =RC[-3]/100*RC[-1] -> 1.21
A260: 3 | B260: H59011/MR | C260: CPU китель чёрный (PolyCotton) ||BL-CPU-PR-01 | D260: 20.10 | E260: usd | F260: 1 | G260: 485.00 | H260: 1.21 | I260: 339.50 | J260: -62.50 | K260: 5 | L260: =RC[-3]/100*RC[-1] -> 1.21
A261: 4 | B261: H59011/SR | C261: CPU китель чёрный (PolyCotton) ||BL-CPU-PR-01 | D261: 20.10 | E261: usd | F261: 1 | G261: 485.00 | H261: 1.21 | I261: 339.50 | J261: -62.50 | K261: 5 | L261: =RC[-3]/100*RC[-1] -> 1.21
A262: 5 | B262: H5901/XXLR | C262: CPU штаны чёрные (PolyCotton) ||SP-CPU-PR-01 | D262: 20.10 | E262: usd | F262: 1 | G262: 485.00 | H262: 1.21 | I262: 339.50 | J262: -62.50 | K262: 5 | L262: =RC[-3]/100*RC[-1] -> 1.21
A263: 6 | B263: H5901/XLR | C263: CPU штаны чёрные (PolyCotton) ||SP-CPU-PR-01 | D263: 20.10 | E263: usd | F263: 1 | G263: 485.00 | H263: 1.21 | I263: 339.50 | J263: -62.50 | K263: 5 | L263: =RC[-3]/100*RC[-1] -> 1.21
A264: 7 | B264: H5901/MR | C264: CPU штаны чёрные (PolyCotton) ||SP-CPU-PR-01 | D264: 20.10 | E264: usd | F264: 1 | G264: 485.00 | H264: 1.21 | I264: 339.50 | J264: -62.50 | K264: 5 | L264: =RC[-3]/100*RC[-1] -> 1.21
A265: 8 | B265: H5901/SR | C265: CPU штаны чёрные (PolyCotton) ||SP-CPU-PR-01 | D265: 20.10 | E265: usd | F265: 1 | G265: 485.00 | H265: 1.21 | I265: 339.50 | J265: -62.50 | K265: 5 | L265: =RC[-3]/100*RC[-1] -> 1.21 | M265: =SUM(R[-8]C[-1]:RC[-1]) -> 
A267: #2616 (2014-03-24) Львів Назар Максимович - Відправлено-Продано
A268: N | B268: арт | C268: назва | D268: закуп | F268: к-ть | G268: цiна | H268: кф | I268: продж | J268: дохiд | K268: % | L268: з-та
A269: 1 | B269: 50413-15 | C269: Наколінники AltaFLEX Long Cap UCP(R) [ALTA] ||OK-AFL-CD-10 | D269: 17.55 | E269: usd | F269: 1 | G269: 424.00 | H269: 1.21 | I269: 296.80 | J269: -54.20 | K269: 5 | L269: =RC[-3]/100*RC[-1] -> 1.21
A270: 2 | B270: H88001/L | C270: Ремень US UTILITY чёрный нейлон ||PS-UTL-NL-01 | D270: 5.59 | E270: usd | F270: 1 | G270: 135.00 | H270: 1.21 | I270: 94.50 | J270: -17.30 | K270: 5 | L270: =RC[-3]/100*RC[-1] -> 1.21
A271: 3 | B271: H7202 | C271: US BDU кепка олива (NYCO R/S) ||CZ-COM-CR-02 | D271: 2.33 | E271: usd | F271: 3 | G271: 58.00 | H271: 1.24 | I271: 121.80 | J271: -18.00 | K271: 5 | L271: =RC[-3]/100*RC[-1] -> 1.24
A272: 4 | B272: H7201 | C272: US BDU кепка чёрная ( PolyCotton Ripstop) ||CZ-COM-NR-01 | D272: 2.33 | E272: usd | F272: 2 | G272: 58.00 | H272: 1.24 | I272: 81.20 | J272: -12.00 | K272: 5 | L272: =RC[-3]/100*RC[-1] -> 1.24
A273: 5 | B273: H7232 | C273: US BDU кепка олива драп ( PolyCotton Ripstop) ||CZ-COM-NR-32 | D273: 2.33 | E273: usd | F273: 3 | G273: 58.00 | H273: 1.24 | I273: 121.80 | J273: -18.00 | K273: 5 | L273: =RC[-3]/100*RC[-1] -> 1.24
A274: 6 | B274: _107715 | C274: Общевойсковая Розгрузочна система ACU ||10711070 | D274: 13.50 | E274: euro | F274: 1 | G274: 392.00 | H274: 1.16 | I274: 274.40 | J274: -63.10 | K274: 5 | L274: =RC[-3]/100*RC[-1] -> 1.16 | M274: =SUM(R[-6]C[-1]:RC[-1]) -> 
A276: #2792 (2014-03-28) Львів Назар Максимович - Відправлено-Продано
A277: N | B277: арт | C277: назва | D277: закуп | F277: к-ть | G277: цiна | H277: кф | I277: продж | J277: дохiд | K277: % | L277: з-та
A278: 1 | B278: H3001/XL | C278: Рубашка DEFENDER длинный рукав чёрная (170г/м) ||KO-DEF-CO-01 | D278: 19.76 | E278: usd | F278: 1 | G278: 477.00 | H278: 1.21 | I278: 333.90 | J278: -61.20 | K278: 5 | L278: =RC[-3]/100*RC[-1] -> 1.21
A279: 2 | B279: H4710/LR | C279: US ACU штаны ACU (PolyCotton) ||SP-ACU-PR-10 | D279: 17.43 | E279: usd | F279: 1 | G279: 421.00 | H279: 1.21 | I279: 294.70 | J279: -53.90 | K279: 5 | L279: =RC[-3]/100*RC[-1] -> 1.21
A280: 3 | B280: H3404/L | C280: Футболка польский вудлэнд ||TS-TSH-CO-04 | D280: 4.06 | E280: usd | F280: 1 | G280: 98.00 | H280: 1.21 | I280: 68.60 | J280: -12.55 | K280: 5 | L280: =RC[-3]/100*RC[-1] -> 1.21 | M280: =SUM(R[-3]C[-1]:RC[-1]) -> 
A282: #2793 (2014-03-28) Львів Назар Максимович - Прихід товару
A283: N | B283: арт | C283: назва | D283: закуп | F283: к-ть | G283: цiна | H283: кф | I283: продж | J283: дохiд | K283: % | L283: з-та
A284: 1 | B284: _21906 | C284: Баллон Borner СО-2 12г | D284: 0.31 | E284: Инт | F284: 150 | G284: 4.50 | H284: 0.72 | I284: 675.00 | J284: -256.04 | K284: 5 | L284: =RC[-3]/100*RC[-1] -> 0.72
A285: 2 | B285: _KWC-0548 | C285: Пістолет пневматичний KWC PM (KM-44 DHN) | D285: 41.70 | E285: Инт | F285: 5 | G285: 475.00 | H285: 0.57 | I285: 2375.00 | J285: -1795.00 | K285: 5 | L285: =RC[-3]/100*RC[-1] -> 0.57 | M285: =SUM(R[-2]C[-1]:RC[-1]) -> 
A287: #2817 (2014-03-31) Львів Назар Максимович - Відправлено-Продано
A288: N | B288: арт | C288: назва | D288: закуп | F288: к-ть | G288: цiна | H288: кф | I288: продж | J288: дохiд | K288: % | L288: з-та
A289: 1 | B289: H47101/LR | C289: US ACU китель ACU (PolyCotton) ||BL-ACU-PR-10 | D289: 17.43 | E289: usd | F289: 1 | G289: 421.00 | H289: 1.21 | I289: 294.70 | J289: -53.90 | K289: 5 | L289: =RC[-3]/100*RC[-1] -> 1.21
A290: 2 | B290: _145521 | C290: US фляга в термочехле с кухлем чёрная ||14506002 | D290: 4.50 | E290: euro | F290: 1 | G290: 178.00 | H290: 1.58 | I290: 124.60 | J290: 12.10 | K290: 5 | L290: =RC[-3]/100*RC[-1] -> 1.58
A291: 3 | B291: H2316/L | C291: Куртка CLASSIC ARMY флисовая чорн/олива ||BL-CAF-FL-16 | D291: 18.29 | E291: usd | F291: 1 | G291: 442.00 | H291: 1.21 | I291: 309.40 | J291: -56.40 | K291: 5 | L291: =RC[-3]/100*RC[-1] -> 1.21
A292: 4 | B292: H9013/120 | C292: Ремень ARMY BELT хаки ||PS-ARM-CO-13 | D292: 4.23 | E292: usd | F292: 2 | G292: 102.00 | H292: 1.21 | I292: 142.80 | J292: -26.40 | K292: 5 | L292: =RC[-3]/100*RC[-1] -> 1.21
A293: 5 | B293: H0141/M | C293: Перчатки тактические US Model чёрные ||RK-USM-PO-01 | D293: 10.43 | E293: usd | F293: 1 | G293: 252.00 | H293: 1.21 | I293: 176.40 | J293: -32.20 | K293: 5 | L293: =RC[-3]/100*RC[-1] -> 1.21
A294: 6 | B294: H97011 | C294: Рюкзак RATEL 25л чёрный ||PL-RTL-PO-01 | D294: 28.65 | E294: usd | F294: 1 | G294: 617.00 | H294: 1.08 | I294: 431.90 | J294: -141.10 | K294: 5 | L294: =RC[-3]/100*RC[-1] -> 1.08
A295: 7 | B295: H49101/LR | C295: Рубашка COMBAT ACU с налокотниками (NYCO POL) ||KO-CS2-PO-10 | D295: 25.88 | E295: usd | F295: 1 | G295: 625.00 | H295: 1.21 | I295: 437.50 | J295: -80.10 | K295: 5 | L295: =RC[-3]/100*RC[-1] -> 1.21
A296: 8 | B296: H3410/2XL | C296: Футболка ACU ||TS-TSH-CO-10 | D296: 4.06 | E296: usd | F296: 2 | G296: 98.00 | H296: 1.21 | I296: 137.20 | J296: -25.10 | K296: 5 | L296: =RC[-3]/100*RC[-1] -> 1.21
A297: 9 | B297: H3410/3XL | C297: Футболка ACU ||TS-TSH-CO-10 | D297: 4.06 | E297: usd | F297: 2 | G297: 98.00 | H297: 1.21 | I297: 137.20 | J297: -25.10 | K297: 5 | L297: =RC[-3]/100*RC[-1] -> 1.21 | M297: =SUM(R[-9]C[-1]:RC[-1]) -> 
A299: #2826 (2014-03-31) Львів Назар Максимович - Відправлено-Продано
A300: N | B300: арт | C300: назва | D300: закуп | F300: к-ть | G300: цiна | H300: кф | I300: продж | J300: дохiд | K300: % | L300: з-та
A301: 1 | B301: _LD40R4 | C301: Фонарь FENIX LD40 Cree XP-G LED R4 new | D301: 35.00 | E301: usd | F301: 2 | G301: 458.00 | H301: 0.65 | I301: 916.00 | J301: -484.00 | K301: 5 | L301: =RC[-3]/100*RC[-1] -> 0.65
A302: 2 | B302: _LD41U2 | C302: Фонарь FENIX LD41 U2 | D302: 50.96 | E302: usd | F302: 2 | G302: 618.00 | H302: 0.61 | I302: 1236.00 | J302: -802.40 | K302: 5 | L302: =RC[-3]/100*RC[-1] -> 0.61
A303: 3 | B303: _TK15S2 | C303: Фонарь светодиодный FENIX ТК15 S2 | D303: 66.28 | E303: usd | F303: 2 | G303: 806.00 | H303: 0.61 | I303: 1612.00 | J303: -1039.20 | K303: 5 | L303: =RC[-3]/100*RC[-1] -> 0.61 | M303: =SUM(R[-3]C[-1]:RC[-1]) -> 
A305: #2881 (2014-04-01) Львів Назар Максимович - Прихід товару
A306: N | B306: арт | C306: назва | D306: закуп | F306: к-ть | G306: цiна | H306: кф | I306: продж | J306: дохiд | K306: % | L306: з-та
A307: 1 | B307: _21906 | C307: Баллон Borner СО-2 12г | D307: 0.31 | E307: Инт | F307: 1524 | G307: 4.50 | H307: 0.72 | I307: 6858.00 | J307: -2601.32 | K307: 5 | L307: =RC[-3]/100*RC[-1] -> 0.72
A308: 2 | B308: _162087 | C308: Баллон перцовый Anti-Hund -Sprey 50мл | D308: 3.05 | E308: Инт | F308: 50 | G308: 25.00 | H308: 0.41 | I308: 1250.00 | J308: -1798.78 | K308: 5 | L308: =RC[-3]/100*RC[-1] -> 0.41
A309: 3 | B309: _162083 | C309: Балон перцевий DEFENOL 40мл | D309: 3.29 | E309: Инт | F309: 50 | G309: 24.00 | H309: 0.36 | I309: 1200.00 | J309: -2092.68 | K309: 5 | L309: =RC[-3]/100*RC[-1] -> 0.36
A310: 4 | B310: _162085 | C310: Баллон перцовый KO-CS 40мл | D310: 3.29 | E310: Инт | F310: 50 | G310: 24.00 | H310: 0.36 | I310: 1200.00 | J310: -2092.68 | K310: 5 | L310: =RC[-3]/100*RC[-1] -> 0.36
A311: 5 | B311: _16215 | C311: Баллон перцовый PEPPER SPRAY K.O. FOG 40мл ||16223040 | D311: 2.93 | E311: Инт | F311: 50 | G311: 24.00 | H311: 0.41 | I311: 1200.00 | J311: -1726.83 | K311: 5 | L311: =RC[-3]/100*RC[-1] -> 0.41
A312: 6 | B312: _16213 | C312: Баллон перцовый К.О JET 40мл ||16224040 | D312: 2.93 | E312: Инт | F312: 50 | G312: 24.00 | H312: 0.41 | I312: 1200.00 | J312: -1726.83 | K312: 5 | L312: =RC[-3]/100*RC[-1] -> 0.41
A313: 7 | B313: _100SH-1 | C313: Шарик "Шаровая молния" 4.5мм 0.57г (100шт) | D313: 0.35 | E313: Инт | F313: 50 | G313: 3.50 | H313: 0.51 | I313: 175.00 | J313: -170.46 | K313: 5 | L313: =RC[-3]/100*RC[-1] -> 0.51
A314: 8 | B314: _6805 | C314: Пульки для пнев. оружия ЛЮМАН 4.5мм 0.55г Field Target (500шт) | D314: 4.00 | E314: usd | F314: 25 | G314: 39.00 | H314: 0.49 | I314: 975.00 | J314: -1025.00 | K314: 5 | L314: =RC[-3]/100*RC[-1] -> 0.49
A315: 9 | B315: _24-0422 | C315: Пульки для пнев. оружия ЛЮМАН 4.5мм 0.57г гостроголові (500шт) | D315: 2.27 | E315: Инт | F315: 5 | G315: 25.00 | H315: 0.55 | I315: 125.00 | J315: -102.27 | K315: 5 | L315: =RC[-3]/100*RC[-1] -> 0.55
A316: 10 | B316: _24-0417 | C316: Пульки для пнев. оружия ЛЮМАН 4.5мм 0.57г круглоголові (300шт) | D316: 1.55 | E316: Инт | F316: 13 | G316: 17.00 | H316: 0.55 | I316: 221.00 | J316: -180.82 | K316: 5 | L316: =RC[-3]/100*RC[-1] -> 0.55
A317: 11 | B317: _24-0421 | C317: Пульки для пнев. оружия ЛЮМАН 4.5мм 0.57г круглоголові (500шт) | D317: 2.55 | E317: Инт | F317: 6 | G317: 28.00 | H317: 0.55 | I317: 168.00 | J317: -137.45 | K317: 5 | L317: =RC[-3]/100*RC[-1] -> 0.55
A318: 12 | B318: _24-0416 | C318: Пульки для пнев. оружия ЛЮМАН 4.5мм 0.68г гостроголові (300шт) | D318: 2.00 | E318: Инт | F318: 13 | G318: 22.00 | H318: 0.55 | I318: 286.00 | J318: -234.00 | K318: 5 | L318: =RC[-3]/100*RC[-1] -> 0.55
A319: 13 | B319: _24-0420 | C319: Пульки для пнев. оружия ЛЮМАН 4.5мм 0.68г гостроголові (500шт) | D319: 2.91 | E319: Инт | F319: 40 | G319: 32.00 | H319: 0.55 | I319: 1280.00 | J319: -1047.27 | K319: 5 | L319: =RC[-3]/100*RC[-1] -> 0.55
A320: 14 | B320: _500SH-1 | C320: Шарік "Шаровая молния" 4.5мм 0.57г (500шт) | D320: 1.18 | E320: Инт | F320: 50 | G320: 13.00 | H320: 0.55 | I320: 650.00 | J320: -531.82 | K320: 5 | L320: =RC[-3]/100*RC[-1] -> 0.55
A321: 15 | B321: _207-997 | C321: Шарик ЛЮМАН 4.5мм 0.34г стальной, омеднённый (600шт) | D321: 2.00 | E321: Инт | F321: 25 | G321: 22.00 | H321: 0.55 | I321: 550.00 | J321: -450.00 | K321: 5 | L321: =RC[-3]/100*RC[-1] -> 0.55 | M321: =SUM(R[-15]C[-1]:RC[-1]) -> 
A323: #2912 (2014-04-02) Львів Назар Максимович - Відправлено-Продано
A324: N | B324: арт | C324: назва | D324: закуп | F324: к-ть | G324: цiна | H324: кф | I324: продж | J324: дохiд | K324: % | L324: з-та
A325: 1 | B325: H42011/MR | C325: US SFU китель чёрный (NYCO) ||BL-SFU-NT-01 | D325: 14.49 | E325: usd | F325: 1 | G325: 350.00 | H325: 1.21 | I325: 245.00 | J325: -44.80 | K325: 5 | L325: =RC[-3]/100*RC[-1] -> 1.21
A326: 2 | B326: H44011/MR | C326: US BDU китель чёрный (R/S) ||BL-BDU-CR-01 | D326: 14.06 | E326: usd | F326: 1 | G326: 340.00 | H326: 1.21 | I326: 238.00 | J326: -43.20 | K326: 5 | L326: =RC[-3]/100*RC[-1] -> 1.21
A327: 3 | B327: H4601/MR | C327: US BDU штаны чёрные (PolyCotton) ||SP-BDU-PR-01 | D327: 13.64 | E327: usd | F327: 1 | G327: 340.00 | H327: 1.25 | I327: 238.00 | J327: -34.80 | K327: 5 | L327: =RC[-3]/100*RC[-1] -> 1.25
A328: 4 | B328: H4311/ML | C328: US SFU штаны койот (PolyCotton) ||SP-SFU-PR-11 | D328: 15.03 | E328: usd | F328: 1 | G328: 350.00 | H328: 1.16 | I328: 245.00 | J328: -55.60 | K328: 5 | L328: =RC[-3]/100*RC[-1] -> 1.16
A329: 5 | B329: H65031/L | C329: Куртка М65 с отстегивающейся курткой вудлэнд (NYCO) ||KU-M65-NY-03 | D329: 37.22 | E329: usd | F329: 1 | G329: 927.00 | H329: 1.25 | I329: 648.90 | J329: -95.50 | K329: 5 | L329: =RC[-3]/100*RC[-1] -> 1.25
A330: 6 | B330: H4603/LL | C330: US BDU штаны вудлэнд (PolyCotton) ||SP-BDU-PR-03 | D330: 13.64 | E330: usd | F330: 1 | G330: 340.00 | H330: 1.25 | I330: 238.00 | J330: -34.80 | K330: 5 | L330: =RC[-3]/100*RC[-1] -> 1.25
A331: 7 | B331: H4403/LL | C331: US BDU штаны вудлэнд (R/S) ||SP-BDU-CR-03 | D331: 14.06 | E331: usd | F331: 1 | G331: 340.00 | H331: 1.21 | I331: 238.00 | J331: -43.20 | K331: 5 | L331: =RC[-3]/100*RC[-1] -> 1.21
A332: 8 | B332: H7202 | C332: US BDU кепка олива (NYCO R/S) ||CZ-COM-CR-02 | D332: 2.33 | E332: usd | F332: 5 | G332: 58.00 | H332: 1.24 | I332: 203.00 | J332: -30.00 | K332: 5 | L332: =RC[-3]/100*RC[-1] -> 1.24
A333: 9 | B333: H7232 | C333: US BDU кепка олива драп ( PolyCotton Ripstop) ||CZ-COM-NR-32 | D333: 2.33 | E333: usd | F333: 5 | G333: 58.00 | H333: 1.24 | I333: 203.00 | J333: -30.00 | K333: 5 | L333: =RC[-3]/100*RC[-1] -> 1.24
A334: 10 | B334: H3410/2XL | C334: Футболка ACU ||TS-TSH-CO-10 | D334: 4.06 | E334: usd | F334: 2 | G334: 98.00 | H334: 1.21 | I334: 137.20 | J334: -25.10 | K334: 5 | L334: =RC[-3]/100*RC[-1] -> 1.21 | M334: =SUM(R[-10]C[-1]:RC[-1]) -> 
A336: #2913 (2014-04-02) Львів Назар Максимович - Відправлено-Продано
A337: N | B337: арт | C337: назва | D337: закуп | F337: к-ть | G337: цiна | H337: кф | I337: продж | J337: дохiд | K337: % | L337: з-та
A338: 1 | B338: H5832/LR | C338: URBAN TACTICAL штаны олива драп (NYCO R/S) ||SP-UTL-NR-32 | D338: 29.06 | E338: usd | F338: 2 | G338: 702.00 | H338: 1.21 | I338: 982.80 | J338: -179.60 | K338: 5 | L338: =RC[-3]/100*RC[-1] -> 1.21
A339: 2 | B339: H5832/XLR | C339: URBAN TACTICAL штаны олива драп (NYCO R/S) ||SP-UTL-NR-32 | D339: 29.06 | E339: usd | F339: 1 | G339: 702.00 | H339: 1.21 | I339: 491.40 | J339: -89.80 | K339: 5 | L339: =RC[-3]/100*RC[-1] -> 1.21
A340: 3 | B340: H4710/LR | C340: US ACU штаны ACU (PolyCotton) ||SP-ACU-PR-10 | D340: 17.43 | E340: usd | F340: 1 | G340: 421.00 | H340: 1.21 | I340: 294.70 | J340: -53.90 | K340: 5 | L340: =RC[-3]/100*RC[-1] -> 1.21
A341: 4 | B341: H7210/S | C341: US BDU кепка ACU (NYCO R/S) ||CZ-ACU-NR-10 | D341: 4.31 | E341: usd | F341: 1 | G341: 104.00 | H341: 1.21 | I341: 72.80 | J341: -13.40 | K341: 5 | L341: =RC[-3]/100*RC[-1] -> 1.21
A342: 5 | B342: H70141/M | C342: US GI панама с шейной защитой мультикам (NYCO R/S) ||7 1/4 ||KA-BON-PR-14 | D342: 4.58 | E342: usd | F342: 2 | G342: 111.00 | H342: 1.21 | I342: 155.40 | J342: -27.80 | K342: 5 | L342: =RC[-3]/100*RC[-1] -> 1.21
A343: 6 | B343: H7407/M | C343: USMC кепка марпат (NYCO) ||CZ-USM-NT-07 | D343: 4.47 | E343: usd | F343: 1 | G343: 104.00 | H343: 1.16 | I343: 72.80 | J343: -16.60 | K343: 5 | L343: =RC[-3]/100*RC[-1] -> 1.16
A344: 7 | B344: H7407/S | C344: USMC кепка марпат (NYCO) ||CZ-USM-NT-07 | D344: 4.47 | E344: usd | F344: 1 | G344: 104.00 | H344: 1.16 | I344: 72.80 | J344: -16.60 | K344: 5 | L344: =RC[-3]/100*RC[-1] -> 1.16
A345: 8 | B345: X401 | C345: Балаклава чёрная с 1-м отв.(100%хлопок) ||X7601 | D345: 3.15 | E345: Инт | F345: 4 | G345: 40.00 | H345: 0.63 | I345: 112.00 | J345: -140.00 | K345: 5 | L345: =RC[-3]/100*RC[-1] -> 0.63
A346: 9 | B346: H1012 | C346: Каталог Геликон(2012р) | D346: 1.00 | E346: usd | F346: 1 | G346: 12.00 | H346: 0.60 | I346: 0.00 | J346: -20.00 | K346: 5 | L346: =RC[-3]/100*RC[-1] -> 0.60
A347: 10 | B347: H29J021/L | C347: Куртка Jackal Soft Shell фоліаж ||BL-JCK-FS-21 | D347: 37.10 | E347: usd | F347: 1 | G347: 888.00 | H347: 1.20 | I347: 621.60 | J347: -120.40 | K347: 5 | L347: =RC[-3]/100*RC[-1] -> 1.20
A348: 11 | B348: H29J021/M | C348: Куртка Jackal Soft Shell фоліаж ||BL-JCK-FS-21 | D348: 37.10 | E348: usd | F348: 1 | G348: 888.00 | H348: 1.20 | I348: 621.60 | J348: -120.40 | K348: 5 | L348: =RC[-3]/100*RC[-1] -> 1.20
A349: 12 | B349: H3013/XL | C349: Рубашка DEFENDER длинный рукав хаки (170г/м) ||KO-DEF-CO-13 | D349: 19.76 | E349: usd | F349: 1 | G349: 477.00 | H349: 1.21 | I349: 333.90 | J349: -61.20 | K349: 5 | L349: =RC[-3]/100*RC[-1] -> 1.21
A350: 13 | B350: H0141/L | C350: Перчатки тактические US Model чёрные ||RK-USM-PO-01 | D350: 10.43 | E350: usd | F350: 1 | G350: 252.00 | H350: 1.21 | I350: 176.40 | J350: -32.20 | K350: 5 | L350: =RC[-3]/100*RC[-1] -> 1.21
A351: 14 | B351: H0151/XL | C351: Перчатки тактические Urban Tactical Line чёрные ||RK-UTL-PU-01 | D351: 10.50 | E351: usd | F351: 1 | G351: 254.00 | H351: 1.21 | I351: 177.80 | J351: -32.20 | K351: 5 | L351: =RC[-3]/100*RC[-1] -> 1.21
A352: 15 | B352: H3414/L | C352: Футболка мультикам ||TS-TSH-CO-14 | D352: 4.06 | E352: usd | F352: 1 | G352: 98.00 | H352: 1.21 | I352: 68.60 | J352: -12.55 | K352: 5 | L352: =RC[-3]/100*RC[-1] -> 1.21
A353: 16 | B353: H3429/L | C353: Футболка олива-драп ||TS-TSH-CO-02 | D353: 4.06 | E353: usd | F353: 1 | G353: 98.00 | H353: 1.21 | I353: 68.60 | J353: -12.55 | K353: 5 | L353: =RC[-3]/100*RC[-1] -> 1.21
A354: 17 | B354: H3429/M | C354: Футболка олива-драп ||TS-TSH-CO-02 | D354: 4.06 | E354: usd | F354: 1 | G354: 98.00 | H354: 1.21 | I354: 68.60 | J354: -12.55 | K354: 5 | L354: =RC[-3]/100*RC[-1] -> 1.21
A355: 18 | B355: H3429/XL | C355: Футболка олива-драп ||TS-TSH-CO-02 | D355: 4.06 | E355: usd | F355: 1 | G355: 98.00 | H355: 1.21 | I355: 68.60 | J355: -12.55 | K355: 5 | L355: =RC[-3]/100*RC[-1] -> 1.21
A356: 19 | B356: H3413/3XL | C356: Футболка хаки ||TS-TSH-CO-13 | D356: 4.06 | E356: usd | F356: 1 | G356: 98.00 | H356: 1.21 | I356: 68.60 | J356: -12.55 | K356: 5 | L356: =RC[-3]/100*RC[-1] -> 1.21
A357: 20 | B357: H3413/XL | C357: Футболка хаки ||TS-TSH-CO-13 | D357: 4.06 | E357: usd | F357: 1 | G357: 98.00 | H357: 1.21 | I357: 68.60 | J357: -12.55 | K357: 5 | L357: =RC[-3]/100*RC[-1] -> 1.21 | M357: =SUM(R[-20]C[-1]:RC[-1]) -> 
A359: #2953 (2014-04-03) Львів Назар Максимович - Відправлено-Продано
A360: N | B360: арт | C360: назва | D360: закуп | F360: к-ть | G360: цiна | H360: кф | I360: продж | J360: дохiд | K360: % | L360: з-та
A361: 1 | B361: K5-0378B | C361: Шарики BB 6мм 0,20x4000 [PREMIUM] ||PJBB 0,2-4000 | D361: 3.57 | E361: usd | F361: 5 | G361: 90.00 | H361: 1.26 | I361: 315.00 | J361: -42.00 | K361: 5 | L361: =RC[-3]/100*RC[-1] -> 1.26 | M361: =SUM(R[-1]C[-1]:RC[-1]) -> 
A363: #3004 (2014-04-04) Львів Назар Максимович - Відправлено-Продано
A364: N | B364: арт | C364: назва | D364: закуп | F364: к-ть | G364: цiна | H364: кф | I364: продж | J364: дохiд | K364: % | L364: з-та
A365: 1 | B365: _107715 | C365: Общевойсковая Розгрузочна система ACU ||10711070 | D365: 13.50 | E365: euro | F365: 1 | G365: 392.00 | H365: 1.16 | I365: 274.40 | J365: -63.10 | K365: 5 | L365: =RC[-3]/100*RC[-1] -> 1.16
A366: 2 | B366: M800114/42 | C366: Берцы MAGNUM Elite Spider 8.0(EU) Desert | D366: 47.75 | E366: usd | F366: 1 | G366: 1092.00 | H366: 1.14 | I366: 764.40 | J366: -190.60 | K366: 5 | L366: =RC[-3]/100*RC[-1] -> 1.14
A367: 3 | B367: K17069/TAN-L | C367: Перчатки Military Combat Gloves mod. III койот||M51617069-TAN-L | D367: 7.48 | E367: usd | F367: 1 | G367: 185.00 | H367: 1.24 | I367: 129.50 | J367: -20.10 | K367: 5 | L367: =RC[-3]/100*RC[-1] -> 1.24
A368: 4 | B368: H2316/XL | C368: Куртка CLASSIC ARMY флисовая чорн/олива ||BL-CAF-FL-16 | D368: 18.29 | E368: usd | F368: 1 | G368: 442.00 | H368: 1.21 | I368: 309.40 | J368: -56.40 | K368: 5 | L368: =RC[-3]/100*RC[-1] -> 1.21 | M368: =SUM(R[-4]C[-1]:RC[-1]) -> 
A370: #3044 (2014-04-07) Львів Назар Максимович - Відправлено-Продано
A371: N | B371: арт | C371: назва | D371: закуп | F371: к-ть | G371: цiна | H371: кф | I371: продж | J371: дохiд | K371: % | L371: з-та
A372: 1 | B372: H5832/LL | C372: URBAN TACTICAL штаны олива драп (NYCO R/S) ||SP-UTL-NR-32 | D372: 29.06 | E372: usd | F372: 1 | G372: 702.00 | H372: 1.21 | I372: 491.40 | J372: -89.80 | K372: 5 | L372: =RC[-3]/100*RC[-1] -> 1.21
A373: 2 | B373: H47141/XLR | C373: US ACU китель мультикам (NYCO R/S) ||BL-ACU-PR-14 | D373: 23.03 | E373: usd | F373: 1 | G373: 556.00 | H373: 1.21 | I373: 389.20 | J373: -71.40 | K373: 5 | L373: =RC[-3]/100*RC[-1] -> 1.21
A374: 3 | B374: H7202 | C374: US BDU кепка олива (NYCO R/S) ||CZ-COM-CR-02 | D374: 2.33 | E374: usd | F374: 3 | G374: 58.00 | H374: 1.24 | I374: 121.80 | J374: -18.00 | K374: 5 | L374: =RC[-3]/100*RC[-1] -> 1.24
A375: 4 | B375: H70142/L | C375: US GI панама с шейной защитой мультикам (NYCO) ||7 1/2 ||KA-BON-NT-14 | D375: 4.58 | E375: usd | F375: 1 | G375: 111.00 | H375: 1.21 | I375: 77.70 | J375: -13.90 | K375: 5 | L375: =RC[-3]/100*RC[-1] -> 1.21
A376: 5 | B376: H4314/LL | C376: US SFU штаны мультикам (NYCO R/S) ||SP-SFU-PR-14 | D376: 16.64 | E376: usd | F376: 1 | G376: 407.00 | H376: 1.22 | I376: 284.90 | J376: -47.90 | K376: 5 | L376: =RC[-3]/100*RC[-1] -> 1.22
A377: 6 | B377: H7422/55 | C377: USMC кепка тайгер (R/S) | D377: 2.00 | E377: usd | F377: 1 | G377: 48.00 | H377: 1.20 | I377: 33.60 | J377: -6.40 | K377: 5 | L377: =RC[-3]/100*RC[-1] -> 1.20
A378: 7 | B378: H29J021/L | C378: Куртка Jackal Soft Shell фоліаж ||BL-JCK-FS-21 | D378: 37.10 | E378: usd | F378: 1 | G378: 888.00 | H378: 1.20 | I378: 621.60 | J378: -120.40 | K378: 5 | L378: =RC[-3]/100*RC[-1] -> 1.20
A379: 8 | B379: H88001/L | C379: Ремень US UTILITY чёрный нейлон ||PS-UTL-NL-01 | D379: 5.59 | E379: usd | F379: 1 | G379: 135.00 | H379: 1.21 | I379: 94.50 | J379: -17.30 | K379: 5 | L379: =RC[-3]/100*RC[-1] -> 1.21 | M379: =SUM(R[-8]C[-1]:RC[-1]) -> 
A381: #3085 (2014-04-08) Львів Назар Максимович - Відправлено-Продано
A382: N | B382: арт | C382: назва | D382: закуп | F382: к-ть | G382: цiна | H382: кф | I382: продж | J382: дохiд | K382: % | L382: з-та
A383: 1 | B383: K17222-D | C383: Балаклава SKULL type D-чёрная [Производитель: ACM] ||M51617222-D | D383: 2.65 | E383: usd | F383: 1 | G383: 64.00 | H383: 1.21 | I383: 44.80 | J383: -8.20 | K383: 5 | L383: =RC[-3]/100*RC[-1] -> 1.21
A384: 2 | B384: X401 | C384: Балаклава чёрная с 1-м отв.(100%хлопок) ||X7601 | D384: 3.15 | E384: Инт | F384: 6 | G384: 40.00 | H384: 0.63 | I384: 168.00 | J384: -210.00 | K384: 5 | L384: =RC[-3]/100*RC[-1] -> 0.63
A385: 3 | B385: 50703-14 | C385: Наколінники AltaSOFT Flexline койот [ALTA] ||OK-ASL-CD-11 | D385: 13.95 | E385: usd | F385: 10 | G385: 353.00 | H385: 1.27 | I385: 2471.00 | J385: -319.00 | K385: 5 | L385: =RC[-3]/100*RC[-1] -> 1.27
A386: 4 | B386: 50703-14 | C386: Наколінники AltaSOFT Flexline койот [ALTA] ||OK-ASL-CD-11 | D386: 13.95 | E386: usd | F386: 8 | G386: 353.00 | H386: 1.27 | I386: 1976.80 | J386: -255.20 | K386: 5 | L386: =RC[-3]/100*RC[-1] -> 1.27
A387: 5 | B387: 50703-16 | C387: Наколінники AltaSOFT Flexline мультикам [ALTA] ||OK-ASL-CD-34 | D387: 14.85 | E387: usd | F387: 2 | G387: 376.00 | H387: 1.27 | I387: 526.40 | J387: -67.60 | K387: 5 | L387: =RC[-3]/100*RC[-1] -> 1.27
A388: 6 | B388: _TRT-003.03 | C388: Палатка Nishe 3 Tramp | D388: 73.29 | E388: Инт | F388: 1 | G388: 1000.00 | H388: 0.68 | I388: 900.00 | J388: -565.71 | K388: 5 | L388: =RC[-3]/100*RC[-1] -> 0.68
A389: 7 | B389: _TRT-003.03 | C389: Палатка Nishe 3 Tramp | D389: 73.29 | E389: Инт | F389: 1 | G389: 1000.00 | H389: 0.68 | I389: 900.00 | J389: -565.71 | K389: 5 | L389: =RC[-3]/100*RC[-1] -> 0.68
A390: 8 | B390: _SLT-005.06 | C390: Палатка Wonder 2 Sol | D390: 42.36 | E390: Инт | F390: 1 | G390: 625.00 | H390: 0.74 | I390: 531.25 | J390: -315.89 | K390: 5 | L390: =RC[-3]/100*RC[-1] -> 0.74 | M390: =SUM(R[-8]C[-1]:RC[-1]) -> 
A392: #3112 (2014-04-09) Львів Назар Максимович - Відправлено-Продано
A393: N | B393: арт | C393: назва | D393: закуп | F393: к-ть | G393: цiна | H393: кф | I393: продж | J393: дохiд | K393: % | L393: з-та
A394: 1 | B394: H3410/2XL | C394: Футболка ACU ||TS-TSH-CO-10 | D394: 4.06 | E394: usd | F394: 1 | G394: 103.00 | H394: 1.27 | I394: 72.10 | J394: -9.05 | K394: 5 | L394: =RC[-3]/100*RC[-1] -> 1.27
A395: 2 | B395: H3403/XL | C395: Футболка вудлэнд ||TS-TSH-CO-03 | D395: 4.06 | E395: usd | F395: 2 | G395: 103.00 | H395: 1.27 | I395: 144.20 | J395: -18.10 | K395: 5 | L395: =RC[-3]/100*RC[-1] -> 1.27
A396: 3 | B396: H4403/XLL | C396: US BDU штаны вудлэнд (R/S) ||SP-BDU-CR-03 | D396: 14.06 | E396: usd | F396: 1 | G396: 356.00 | H396: 1.27 | I396: 249.20 | J396: -32.00 | K396: 5 | L396: =RC[-3]/100*RC[-1] -> 1.27
A397: 4 | B397: H26211/L | C397: Куртка PATRIOT флисовая фоліаж 390г/м (superfine) ||BL-PAT-HF-21 | D397: 27.00 | E397: usd | F397: 1 | G397: 710.00 | H397: 1.31 | I397: 497.00 | J397: -43.00 | K397: 5 | L397: =RC[-3]/100*RC[-1] -> 1.31
A398: 5 | B398: H4301/XLL | C398: US SFU штаны чёрные (PolyCotton) ||SP-SFU-PR-01 | D398: 15.03 | E398: usd | F398: 1 | G398: 367.00 | H398: 1.22 | I398: 256.90 | J398: -43.70 | K398: 5 | L398: =RC[-3]/100*RC[-1] -> 1.22
A399: 6 | B399: H43011/XLR | C399: US SFU китель чёрный (PolyCotton) ||BL-SFU-PR-01 | D399: 15.03 | E399: usd | F399: 1 | G399: 367.00 | H399: 1.22 | I399: 256.90 | J399: -43.70 | K399: 5 | L399: =RC[-3]/100*RC[-1] -> 1.22
A400: 7 | B400: H4311/XLR | C400: US SFU штаны койот (PolyCotton) ||SP-SFU-PR-11 | D400: 15.03 | E400: usd | F400: 1 | G400: 367.00 | H400: 1.22 | I400: 256.90 | J400: -43.70 | K400: 5 | L400: =RC[-3]/100*RC[-1] -> 1.22
A401: 8 | B401: H4314/XLR | C401: US SFU штаны мультикам (NYCO R/S) ||SP-SFU-PR-14 | D401: 16.64 | E401: usd | F401: 1 | G401: 426.00 | H401: 1.28 | I401: 298.20 | J401: -34.60 | K401: 5 | L401: =RC[-3]/100*RC[-1] -> 1.28
A402: 9 | B402: H43141/XLR | C402: US SFU китель мультикам (PolyCotton) ||BL-SFU-PR-14 | D402: 16.64 | E402: usd | F402: 1 | G402: 426.00 | H402: 1.28 | I402: 298.20 | J402: -34.60 | K402: 5 | L402: =RC[-3]/100*RC[-1] -> 1.28
A403: 10 | B403: H9013/120 | C403: Ремень ARMY BELT хаки ||PS-ARM-CO-13 | D403: 4.23 | E403: usd | F403: 2 | G403: 107.00 | H403: 1.26 | I403: 149.80 | J403: -19.40 | K403: 5 | L403: =RC[-3]/100*RC[-1] -> 1.26
A404: 11 | B404: H7210/M | C404: US BDU кепка ACU (NYCO R/S) ||CZ-ACU-NR-10 | D404: 4.31 | E404: usd | F404: 1 | G404: 109.00 | H404: 1.26 | I404: 76.30 | J404: -9.90 | K404: 5 | L404: =RC[-3]/100*RC[-1] -> 1.26
A405: 12 | B405: H701410/XL | C405: US GI панама мультикам (NYCO R/S) ||7 3/4 ||KA-ACU-NR-14 | D405: 4.58 | E405: usd | F405: 1 | G405: 116.00 | H405: 1.27 | I405: 81.20 | J405: -10.40 | K405: 5 | L405: =RC[-3]/100*RC[-1] -> 1.27 | M405: =SUM(R[-12]C[-1]:RC[-1]) -> 
A407: #3276 (2014-04-14) Львів Назар Максимович - Відправлено-Продано
A408: N | B408: арт | C408: назва | D408: закуп | F408: к-ть | G408: цiна | H408: кф | I408: продж | J408: дохiд | K408: % | L408: з-та
A409: 1 | B409: H4311/SL | C409: US SFU штаны койот (PolyCotton) ||SP-SFU-PR-11 | D409: 15.03 | E409: usd | F409: 1 | G409: 433.00 | H409: 1.44 | I409: 303.10 | J409: 2.50 | K409: 5 | L409: =RC[-3]/100*RC[-1] -> 1.44
A410: 2 | B410: H4302/ML | C410: US SFU штаны олива (NYCO R/S) ||SP-SFU-NR-02 SP-SFU-PR-02 | D410: 15.03 | E410: usd | F410: 1 | G410: 433.00 | H410: 1.44 | I410: 303.10 | J410: 2.50 | K410: 5 | L410: =RC[-3]/100*RC[-1] -> 1.44
A411: 3 | B411: 50413-15 | C411: Наколінники AltaFLEX Long Cap UCP(R) [ALTA] ||OK-AFL-CD-10 | D411: 17.55 | E411: usd | F411: 1 | G411: 525.00 | H411: 1.50 | I411: 367.50 | J411: 16.50 | K411: 5 | L411: =RC[-3]/100*RC[-1] -> 1.50
A412: 4 | B412: _21906 | C412: Баллон Borner СО-2 12г | D412: 0.31 | E412: Инт | F412: 500 | G412: 7.00 | H412: 1.13 | I412: 2450.00 | J412: -653.45 | K412: 5 | L412: =RC[-3]/100*RC[-1] -> 1.13 | M412: =SUM(R[-4]C[-1]:RC[-1]) -> 
A414: #3375 (2014-04-16) Львів Назар Максимович - Клієнт повернув
A415: N | B415: арт | C415: назва | D415: закуп | F415: к-ть | G415: цiна | H415: кф | I415: продж | J415: дохiд | K415: % | L415: з-та
A416: 1 | B416: H3001/XL | C416: Рубашка DEFENDER длинный рукав чёрная (170г/м) ||KO-DEF-CO-01 | D416: 19.76 | E416: usd | F416: 1 | G416: 591.00 | H416: 1.50 | I416: 333.90 | J416: -61.20 | K416: 5 | L416: =RC[-3]/100*RC[-1] -> 1.50 | M416: =SUM(R[-1]C[-1]:RC[-1]) -> 
A418: #3389 (2014-04-16) Львів Назар Максимович - Відправлено-Продано
A419: N | B419: арт | C419: назва | D419: закуп | F419: к-ть | G419: цiна | H419: кф | I419: продж | J419: дохiд | K419: % | L419: з-та
A420: 1 | B420: _2069 | C420: Патрон Флобера 4мм Чехія (200шт) | D420: 0.13 | E420: Инт | F420: 1000 | G420: 2.50 | H420: 0.95 | I420: 1750.00 | J420: -892.86 | K420: 5 | L420: =RC[-3]/100*RC[-1] -> 0.95 | M420: =SUM(R[-1]C[-1]:RC[-1]) -> 
A422: #3405 (2014-04-17) Львів Назар Максимович - Відправлено-Продано
A423: N | B423: арт | C423: назва | D423: закуп | F423: к-ть | G423: цiна | H423: кф | I423: продж | J423: дохiд | K423: % | L423: з-та
A424: 1 | B424: H0419 | C424: BW столовий набір 4-предметный (оригинал) ||NZ-BSW-SS-15 | D424: 2.59 | E424: usd | F424: 2 | G424: 111.00 | H424: 2.14 | I424: 155.40 | J424: 51.80 | K424: 5 | L424: =RC[-3]/100*RC[-1] -> 2.14
A425: 2 | B425: H7232 | C425: US BDU кепка олива драп ( PolyCotton Ripstop) ||CZ-COM-NR-32 | D425: 2.33 | E425: usd | F425: 2 | G425: 72.00 | H425: 1.55 | I425: 100.80 | J425: 7.60 | K425: 5 | L425: =RC[-3]/100*RC[-1] -> 1.55
A426: 3 | B426: H7104 | C426: US BDU кепка польский вудлэнд ( PolyCotton Ripstop) ||CZ-COM-PR-04 | D426: 2.33 | E426: usd | F426: 4 | G426: 72.00 | H426: 1.55 | I426: 201.60 | J426: 15.20 | K426: 5 | L426: =RC[-3]/100*RC[-1] -> 1.55
A427: 4 | B427: H7106 | C427: US BDU кепка польский дезерт (R/S) ||CZ-COM-CR-06 | D427: 2.33 | E427: usd | F427: 1 | G427: 72.00 | H427: 1.55 | I427: 50.40 | J427: 3.80 | K427: 5 | L427: =RC[-3]/100*RC[-1] -> 1.55
A428: 5 | B428: H701410/XL | C428: US GI панама мультикам (NYCO R/S) ||7 3/4 ||KA-ACU-NR-14 | D428: 4.58 | E428: usd | F428: 1 | G428: 137.00 | H428: 1.50 | I428: 95.90 | J428: 4.30 | K428: 5 | L428: =RC[-3]/100*RC[-1] -> 1.50
A429: 6 | B429: H4314/LR | C429: US SFU штаны мультикам (NYCO R/S) ||SP-SFU-PR-14 | D429: 16.64 | E429: usd | F429: 1 | G429: 504.00 | H429: 1.51 | I429: 352.80 | J429: 20.00 | K429: 5 | L429: =RC[-3]/100*RC[-1] -> 1.51
A430: 7 | B430: _BD2454 | C430: Очки FA02 goggle-yellow [Производитель: ACM] | D430: 3.45 | E430: usd | F430: 2 | G430: 99.00 | H430: 1.43 | I430: 138.60 | J430: 0.60 | K430: 5 | L430: =RC[-3]/100*RC[-1] -> 1.43
A431: 8 | B431: H7713/L | C431: Панама British Army Style бежевая (NYCO R/S) 7 1/2 ||KA-S95-CR-13 | D431: 4.14 | E431: usd | F431: 1 | G431: 124.00 | H431: 1.50 | I431: 86.80 | J431: 4.00 | K431: 5 | L431: =RC[-3]/100*RC[-1] -> 1.50
A432: 9 | B432: H7713/M | C432: Панама British Army Style бежевая (NYCO R/S) 7 1/4 ||KA-S95-CR-13 | D432: 4.14 | E432: usd | F432: 1 | G432: 124.00 | H432: 1.50 | I432: 86.80 | J432: 4.00 | K432: 5 | L432: =RC[-3]/100*RC[-1] -> 1.50
A433: 10 | B433: H7723/L | C433: Панама British Army Style флектарн (NYCO R/S) 7 1/2 ||KA-S95-NR-23 | D433: 4.14 | E433: usd | F433: 1 | G433: 124.00 | H433: 1.50 | I433: 86.80 | J433: 4.00 | K433: 5 | L433: =RC[-3]/100*RC[-1] -> 1.50
A434: 11 | B434: H9002/130 | C434: Ремень ARMY BELT олива ||PS-ARM-CO-02 | D434: 4.23 | E434: usd | F434: 1 | G434: 126.00 | H434: 1.49 | I434: 88.20 | J434: 3.60 | K434: 5 | L434: =RC[-3]/100*RC[-1] -> 1.49
A435: 12 | B435: H9002/140 | C435: Ремень ARMY BELT олива ||PS-ARM-CO-02 | D435: 4.23 | E435: usd | F435: 1 | G435: 126.00 | H435: 1.49 | I435: 88.20 | J435: 3.60 | K435: 5 | L435: =RC[-3]/100*RC[-1] -> 1.49
A436: 13 | B436: H9001/130 | C436: Ремень ARMY BELT чёрный ||PS-ARM-CO-01 | D436: 4.23 | E436: usd | F436: 1 | G436: 126.00 | H436: 1.49 | I436: 88.20 | J436: 3.60 | K436: 5 | L436: =RC[-3]/100*RC[-1] -> 1.49
A437: 14 | B437: H9001/140 | C437: Ремень ARMY BELT чёрный ||PS-ARM-CO-01 | D437: 4.23 | E437: usd | F437: 1 | G437: 126.00 | H437: 1.49 | I437: 88.20 | J437: 3.60 | K437: 5 | L437: =RC[-3]/100*RC[-1] -> 1.49
A438: 15 | B438: H8013/130 | C438: Ремень HKN койот ||PS-HKN-CO-13 | D438: 3.30 | E438: usd | F438: 2 | G438: 128.00 | H438: 1.94 | I438: 179.20 | J438: 47.20 | K438: 5 | L438: =RC[-3]/100*RC[-1] -> 1.94
A439: 16 | B439: H8002/130 | C439: Ремень HKN олива ||PS-HKN-CO-02 | D439: 3.30 | E439: usd | F439: 2 | G439: 128.00 | H439: 1.94 | I439: 179.20 | J439: 47.20 | K439: 5 | L439: =RC[-3]/100*RC[-1] -> 1.94
A440: 17 | B440: H8001/130 | C440: Ремень HKN чёрный ||PS-HKN-CO-01 | D440: 3.30 | E440: usd | F440: 2 | G440: 128.00 | H440: 1.94 | I440: 179.20 | J440: 47.20 | K440: 5 | L440: =RC[-3]/100*RC[-1] -> 1.94
A441: 18 | B441: H8602/130 | C441: Ремень TOUGH NAVY SEAL олива ||PS-NAV-CO-01 | D441: 4.23 | E441: usd | F441: 1 | G441: 126.00 | H441: 1.49 | I441: 88.20 | J441: 3.60 | K441: 5 | L441: =RC[-3]/100*RC[-1] -> 1.49
A442: 19 | B442: H8602/140 | C442: Ремень TOUGH NAVY SEAL олива ||PS-NAV-CO-01 | D442: 4.23 | E442: usd | F442: 1 | G442: 126.00 | H442: 1.49 | I442: 88.20 | J442: 3.60 | K442: 5 | L442: =RC[-3]/100*RC[-1] -> 1.49
A443: 20 | B443: H8601/130 | C443: Ремень TOUGH NAVY SEAL чёрный ||PS-NAV-CO-02 | D443: 4.23 | E443: usd | F443: 1 | G443: 126.00 | H443: 1.49 | I443: 88.20 | J443: 3.60 | K443: 5 | L443: =RC[-3]/100*RC[-1] -> 1.49
A444: 21 | B444: H8601/140 | C444: Ремень TOUGH NAVY SEAL чёрный ||PS-NAV-CO-02 | D444: 4.23 | E444: usd | F444: 1 | G444: 126.00 | H444: 1.49 | I444: 88.20 | J444: 3.60 | K444: 5 | L444: =RC[-3]/100*RC[-1] -> 1.49
A445: 22 | B445: _15688 | C445: Футляр для очков SWISS EYE вудлэнд ||15691020 | D445: 2.50 | E445: euro | F445: 1 | G445: 71.00 | H445: 1.14 | I445: 49.70 | J445: -12.80 | K445: 5 | L445: =RC[-3]/100*RC[-1] -> 1.14 | M445: =SUM(R[-22]C[-1]:RC[-1]) -> 
A447: #3461 (2014-04-18) Львів Назар Максимович - Прихід товару
A448: N | B448: арт | C448: назва | D448: закуп | F448: к-ть | G448: цiна | H448: кф | I448: продж | J448: дохiд | K448: % | L448: з-та
A449: 1 | B449: _455500 | C449: Набор для чистки оружия 4.5/5.5 мм | D449: 7.24 | E449: Инт | F449: 3 | G449: 7.00 | H449: 0.05 | I449: 21.00 | J449: -413.48 | K449: 5 | L449: =RC[-3]/100*RC[-1] -> 0.05
A450: 2 | B450: _5619 | C450: Пістолет сигнальный EKOL ARAS compact (чёрный) | D450: 56.57 | E450: Инт | F450: 3 | G450: 73.00 | H450: 0.06 | I450: 219.00 | J450: -3175.28 | K450: 5 | L450: =RC[-3]/100*RC[-1] -> 0.06
A451: 3 | B451: _6573 | C451: Пістолет сигнальный EKOL Lady (чёрный) | D451: 4.29 | E451: Инт | F451: 3 | G451: 60.00 | H451: 0.70 | I451: 180.00 | J451: -77.14 | K451: 5 | L451: =RC[-3]/100*RC[-1] -> 0.70
A452: 4 | B452: _6577 | C452: Пістолет сигнальный EKOL Major (чёрный) | D452: 45.57 | E452: Инт | F452: 2 | G452: 64.00 | H452: 0.07 | I452: 128.00 | J452: -1694.86 | K452: 5 | L452: =RC[-3]/100*RC[-1] -> 0.07
A453: 5 | B453: _33401 | C453: Револьвер под патрон Флобера Ekol Viper 3 Black | D453: 83.00 | E453: usd | F453: 7 | G453: 83.00 | H453: 0.05 | I453: 581.00 | J453: -11039.00 | K453: 5 | L453: =RC[-3]/100*RC[-1] -> 0.05
A454: 6 | B454: _33402 | C454: Револьвер под патрон Флобера Ekol Viper 3 Chrome | D454: 85.00 | E454: usd | F454: 2 | G454: 85.00 | H454: 0.05 | I454: 170.00 | J454: -3230.00 | K454: 5 | L454: =RC[-3]/100*RC[-1] -> 0.05
A455: 7 | B455: _33403 | C455: Револьвер под патрон Флобера Ekol Viper 4.5 Black | D455: 85.00 | E455: usd | F455: 4 | G455: 85.00 | H455: 0.05 | I455: 340.00 | J455: -6460.00 | K455: 5 | L455: =RC[-3]/100*RC[-1] -> 0.05
A456: 8 | B456: _33404 | C456: Револьвер под патрон Флобера Ekol Viper 4.5 Chrome | D456: 87.00 | E456: usd | F456: 2 | G456: 87.00 | H456: 0.05 | I456: 174.00 | J456: -3306.00 | K456: 5 | L456: =RC[-3]/100*RC[-1] -> 0.05
A457: 9 | B457: _PR2503 | C457: Револьвер под патрон Флобера PROFI 3 (бук) | D457: 119.21 | E457: Инт | F457: 3 | G457: 125.00 | H457: 0.05 | I457: 375.00 | J457: -6777.84 | K457: 5 | L457: =RC[-3]/100*RC[-1] -> 0.05
A458: 10 | B458: _PR2501 | C458: Револьвер под патрон Флобера PROFI 3 (пластик чёрный) | D458: 117.64 | E458: Инт | F458: 3 | G458: 120.00 | H458: 0.05 | I458: 360.00 | J458: -6698.58 | K458: 5 | L458: =RC[-3]/100*RC[-1] -> 0.05
A459: 11 | B459: _PR2504 | C459: Револьвер под патрон Флобера PROFI 4.5 (бук) | D459: 125.00 | E459: usd | F459: 2 | G459: 125.00 | H459: 0.05 | I459: 250.00 | J459: -4750.00 | K459: 5 | L459: =RC[-3]/100*RC[-1] -> 0.05
A460: 12 | B460: _PR2505 | C460: Револьвер под патрон Флобера PROFI 4.5 (пластик чёрный) | D460: 116.71 | E460: Инт | F460: 2 | G460: 120.00 | H460: 0.05 | I460: 240.00 | J460: -4428.56 | K460: 5 | L460: =RC[-3]/100*RC[-1] -> 0.05 | M460: =SUM(R[-12]C[-1]:RC[-1]) -> 
A462: #3463 (2014-04-18) Львів Назар Максимович - Відправлено-Продано
A463: N | B463: арт | C463: назва | D463: закуп | F463: к-ть | G463: цiна | H463: кф | I463: продж | J463: дохiд | K463: % | L463: з-та
A464: 1 | B464: Бабки | C464: Прихід Грошей | D464: 0.00 | E464: грн | F464: 1 | G464: 3038.00 | H464: 3038.00 | I464: 3038.00 | J464: 3037.00 | K464: 5 | L464: =RC[-3]/100*RC[-1] -> 3038.00 | M464: =SUM(R[-1]C[-1]:RC[-1]) -> 
A466: #3473 (2014-04-18) Львів Назар Максимович - Відправлено-Продано
A467: N | B467: арт | C467: назва | D467: закуп | F467: к-ть | G467: цiна | H467: кф | I467: продж | J467: дохiд | K467: % | L467: з-та
A468: 1 | B468: _2069 | C468: Патрон Флобера 4мм Чехія (200шт) | D468: 0.13 | E468: Инт | F468: 1000 | G468: 2.50 | H468: 0.95 | I468: 1750.00 | J468: -892.86 | K468: 5 | L468: =RC[-3]/100*RC[-1] -> 0.95 | M468: =SUM(R[-1]C[-1]:RC[-1]) -> 
A470: #3506 (2014-04-22) Львів Назар Максимович - Відправлено-Продано
A471: N | B471: арт | C471: назва | D471: закуп | F471: к-ть | G471: цiна | H471: кф | I471: продж | J471: дохiд | K471: % | L471: з-та
A472: 1 | B472: H7201 | C472: US BDU кепка чёрная ( PolyCotton Ripstop) ||CZ-COM-NR-01 | D472: 2.33 | E472: usd | F472: 4 | G472: 72.00 | H472: 1.55 | I472: 201.60 | J472: 15.20 | K472: 5 | L472: =RC[-3]/100*RC[-1] -> 1.55
A473: 2 | B473: K17222-F | C473: Балаклава SKULL type F-чёрная [Производитель: ACM] ||M51617222-F | D473: 2.65 | E473: usd | F473: 2 | G473: 81.00 | H473: 1.53 | I473: 113.40 | J473: 7.40 | K473: 5 | L473: =RC[-3]/100*RC[-1] -> 1.53
A474: 3 | B474: X401 | C474: Балаклава чёрная с 1-м отв.(100%хлопок) ||X7601 | D474: 3.15 | E474: Инт | F474: 10 | G474: 40.00 | H474: 0.63 | I474: 280.00 | J474: -350.00 | K474: 5 | L474: =RC[-3]/100*RC[-1] -> 0.63
A475: 4 | B475: H29J021/L | C475: Куртка Jackal Soft Shell фоліаж ||BL-JCK-FS-21 | D475: 37.10 | E475: usd | F475: 1 | G475: 1100.00 | H475: 1.48 | I475: 770.00 | J475: 28.00 | K475: 5 | L475: =RC[-3]/100*RC[-1] -> 1.48
A476: 5 | B476: H88001/L | C476: Ремень US UTILITY чёрный нейлон ||PS-UTL-NL-01 | D476: 5.59 | E476: usd | F476: 2 | G476: 167.00 | H476: 1.49 | I476: 233.80 | J476: 10.20 | K476: 5 | L476: =RC[-3]/100*RC[-1] -> 1.49
A477: 6 | B477: H3613/S | C477: Футболка DEFENDER Polo хаки ||PD-DEF-CO-13 | D477: 12.69 | E477: usd | F477: 1 | G477: 379.00 | H477: 1.49 | I477: 265.30 | J477: 11.50 | K477: 5 | L477: =RC[-3]/100*RC[-1] -> 1.49
A478: 7 | B478: H3421/M | C478: Футболка Foliage Green ||TS-TSH-CO-21 | D478: 4.06 | E478: usd | F478: 1 | G478: 121.00 | H478: 1.49 | I478: 84.70 | J478: 3.55 | K478: 5 | L478: =RC[-3]/100*RC[-1] -> 1.49
A479: 8 | B479: H3421/S | C479: Футболка Foliage Green ||TS-TSH-CO-21 | D479: 4.06 | E479: usd | F479: 1 | G479: 121.00 | H479: 1.49 | I479: 84.70 | J479: 3.55 | K479: 5 | L479: =RC[-3]/100*RC[-1] -> 1.49
A480: 9 | B480: H3413/S | C480: Футболка хаки ||TS-TSH-CO-13 | D480: 4.06 | E480: usd | F480: 1 | G480: 121.00 | H480: 1.49 | I480: 84.70 | J480: 3.55 | K480: 5 | L480: =RC[-3]/100*RC[-1] -> 1.49 | M480: =SUM(R[-9]C[-1]:RC[-1]) -> 
A482: #3599 (2014-04-24) Львів Назар Максимович - Відправлено-Продано
A483: N | B483: арт | C483: назва | D483: закуп | F483: к-ть | G483: цiна | H483: кф | I483: продж | J483: дохiд | K483: % | L483: з-та
A484: 1 | B484: H3404/L | C484: Футболка польский вудлэнд ||TS-TSH-CO-04 | D484: 4.06 | E484: usd | F484: 1 | G484: 121.00 | H484: 1.49 | I484: 84.70 | J484: 3.55 | K484: 5 | L484: =RC[-3]/100*RC[-1] -> 1.49
A485: 2 | B485: H3404/M | C485: Футболка польский вудлэнд ||TS-TSH-CO-04 | D485: 4.06 | E485: usd | F485: 1 | G485: 121.00 | H485: 1.49 | I485: 84.70 | J485: 3.55 | K485: 5 | L485: =RC[-3]/100*RC[-1] -> 1.49
A486: 3 | B486: H3404/XL | C486: Футболка польский вудлэнд ||TS-TSH-CO-04 | D486: 4.06 | E486: usd | F486: 1 | G486: 121.00 | H486: 1.49 | I486: 84.70 | J486: 3.55 | K486: 5 | L486: =RC[-3]/100*RC[-1] -> 1.49
A487: 4 | B487: H3403/L | C487: Футболка вудлэнд ||TS-TSH-CO-03 | D487: 4.06 | E487: usd | F487: 1 | G487: 121.00 | H487: 1.49 | I487: 84.70 | J487: 3.55 | K487: 5 | L487: =RC[-3]/100*RC[-1] -> 1.49
A488: 5 | B488: H3403/M | C488: Футболка вудлэнд ||TS-TSH-CO-03 | D488: 4.06 | E488: usd | F488: 1 | G488: 121.00 | H488: 1.49 | I488: 84.70 | J488: 3.55 | K488: 5 | L488: =RC[-3]/100*RC[-1] -> 1.49
A489: 6 | B489: H3403/XL | C489: Футболка вудлэнд ||TS-TSH-CO-03 | D489: 4.06 | E489: usd | F489: 2 | G489: 121.00 | H489: 1.49 | I489: 169.40 | J489: 7.10 | K489: 5 | L489: =RC[-3]/100*RC[-1] -> 1.49
A490: 7 | B490: H3402/L | C490: Футболка олива ||TS-TSH-CO-29 | D490: 4.06 | E490: usd | F490: 2 | G490: 121.00 | H490: 1.49 | I490: 169.40 | J490: 7.10 | K490: 5 | L490: =RC[-3]/100*RC[-1] -> 1.49
A491: 8 | B491: H3402/M | C491: Футболка олива ||TS-TSH-CO-29 | D491: 4.06 | E491: usd | F491: 1 | G491: 121.00 | H491: 1.49 | I491: 84.70 | J491: 3.55 | K491: 5 | L491: =RC[-3]/100*RC[-1] -> 1.49
A492: 9 | B492: H3402/XL | C492: Футболка олива ||TS-TSH-CO-29 | D492: 4.06 | E492: usd | F492: 1 | G492: 121.00 | H492: 1.49 | I492: 84.70 | J492: 3.55 | K492: 5 | L492: =RC[-3]/100*RC[-1] -> 1.49
A493: 10 | B493: H7202 | C493: US BDU кепка олива (NYCO R/S) ||CZ-COM-CR-02 | D493: 2.33 | E493: usd | F493: 1 | G493: 72.00 | H493: 1.55 | I493: 50.40 | J493: 3.80 | K493: 5 | L493: =RC[-3]/100*RC[-1] -> 1.55
A494: 11 | B494: H7002/L | C494: US GI панама с шейной защитой олива (R/S) / 7 1/2 ||KA-BON-CR-02 | D494: 4.06 | E494: usd | F494: 1 | G494: 121.00 | H494: 1.49 | I494: 84.70 | J494: 3.50 | K494: 5 | L494: =RC[-3]/100*RC[-1] -> 1.49
A495: 12 | B495: H7002/XL | C495: US GI панама с шейной защитой олива (R/S) / 7 3/4 ||KA-BON-CR-02 | D495: 4.06 | E495: usd | F495: 1 | G495: 121.00 | H495: 1.49 | I495: 84.70 | J495: 3.50 | K495: 5 | L495: =RC[-3]/100*RC[-1] -> 1.49
A496: 13 | B496: H7003/L | C496: US GI панама с шейной защитой вудлэнд (R/S) / 7 1/2 ||KA-BON-CR-03 | D496: 4.06 | E496: usd | F496: 1 | G496: 121.00 | H496: 1.49 | I496: 84.70 | J496: 3.50 | K496: 5 | L496: =RC[-3]/100*RC[-1] -> 1.49
A497: 14 | B497: H7003/XL | C497: US GI панама с шейной защитой вудлэнд (R/S) / 7 3/4 ||KA-BON-CR-03 | D497: 4.06 | E497: usd | F497: 1 | G497: 121.00 | H497: 1.49 | I497: 84.70 | J497: 3.50 | K497: 5 | L497: =RC[-3]/100*RC[-1] -> 1.49
A498: 15 | B498: H3401/L | C498: Футболка чёрная ||TS-TSH-CO-01 | D498: 4.06 | E498: usd | F498: 2 | G498: 121.00 | H498: 1.49 | I498: 169.40 | J498: 7.10 | K498: 5 | L498: =RC[-3]/100*RC[-1] -> 1.49
A499: 16 | B499: H3401/M | C499: Футболка чёрная ||TS-TSH-CO-01 | D499: 4.06 | E499: usd | F499: 1 | G499: 121.00 | H499: 1.49 | I499: 84.70 | J499: 3.55 | K499: 5 | L499: =RC[-3]/100*RC[-1] -> 1.49
A500: 17 | B500: H3401/XL | C500: Футболка чёрная ||TS-TSH-CO-01 | D500: 4.06 | E500: usd | F500: 1 | G500: 121.00 | H500: 1.49 | I500: 84.70 | J500: 3.55 | K500: 5 | L500: =RC[-3]/100*RC[-1] -> 1.49 | M500: =SUM(R[-17]C[-1]:RC[-1]) -> 
A502: #3602 (2014-04-24) Львів Назар Максимович - Відправлено-Продано
A503: N | B503: арт | C503: назва | D503: закуп | F503: к-ть | G503: цiна | H503: кф | I503: продж | J503: дохiд | K503: % | L503: з-та
A504: 1 | B504: H7202 | C504: US BDU кепка олива (NYCO R/S) ||CZ-COM-CR-02 | D504: 2.33 | E504: usd | F504: 5 | G504: 72.00 | H504: 1.55 | I504: 252.00 | J504: 19.00 | K504: 5 | L504: =RC[-3]/100*RC[-1] -> 1.55
A505: 2 | B505: H7104 | C505: US BDU кепка польский вудлэнд ( PolyCotton Ripstop) ||CZ-COM-PR-04 | D505: 2.33 | E505: usd | F505: 4 | G505: 72.00 | H505: 1.55 | I505: 201.60 | J505: 15.20 | K505: 5 | L505: =RC[-3]/100*RC[-1] -> 1.55
A506: 3 | B506: H43021/XLR | C506: US SFU китель олива (PolyCotton) ||BL-SFU-PR-02 | D506: 15.03 | E506: usd | F506: 1 | G506: 433.00 | H506: 1.44 | I506: 303.10 | J506: 2.50 | K506: 5 | L506: =RC[-3]/100*RC[-1] -> 1.44
A507: 4 | B507: H4302/XLL | C507: US SFU штаны олива (NYCO R/S) ||SP-SFU-NR-02 SP-SFU-PR-02 | D507: 15.03 | E507: usd | F507: 1 | G507: 433.00 | H507: 1.44 | I507: 303.10 | J507: 2.50 | K507: 5 | L507: =RC[-3]/100*RC[-1] -> 1.44
A508: 5 | B508: H0815 | C508: US жетон стальной с резинкой||NS-NS1-SS-15 | D508: 1.30 | E508: usd | F508: 4 | G508: 38.00 | H508: 1.46 | I508: 106.40 | J508: 2.40 | K508: 5 | L508: =RC[-3]/100*RC[-1] -> 1.46
A509: 6 | B509: H5303/XXL | C509: US шорты вудлэнд (R/S) ||SP-BDK-CR-03 | D509: 12.17 | E509: usd | F509: 1 | G509: 364.00 | H509: 1.50 | I509: 254.80 | J509: 11.40 | K509: 5 | L509: =RC[-3]/100*RC[-1] -> 1.50
A510: 7 | B510: K13048-B | C510: Кобура набедренная чёрная ||M51613048-BK | D510: 4.85 | E510: usd | F510: 3 | G510: 166.00 | H510: 1.71 | I510: 348.60 | J510: 57.60 | K510: 5 | L510: =RC[-3]/100*RC[-1] -> 1.71
A511: 8 | B511: H0015 | C511: Кресало магний ||KR-MFS-AL-15 | D511: 5.52 | E511: usd | F511: 1 | G511: 165.00 | H511: 1.49 | I511: 115.50 | J511: 5.10 | K511: 5 | L511: =RC[-3]/100*RC[-1] -> 1.49
A512: 9 | B512: H8002/130 | C512: Ремень HKN олива ||PS-HKN-CO-02 | D512: 3.30 | E512: usd | F512: 1 | G512: 128.00 | H512: 1.94 | I512: 89.60 | J512: 23.60 | K512: 5 | L512: =RC[-3]/100*RC[-1] -> 1.94
A513: 10 | B513: H8602/130 | C513: Ремень TOUGH NAVY SEAL олива ||PS-NAV-CO-01 | D513: 4.23 | E513: usd | F513: 2 | G513: 126.00 | H513: 1.49 | I513: 176.40 | J513: 7.20 | K513: 5 | L513: =RC[-3]/100*RC[-1] -> 1.49
A514: 11 | B514: H8601/130 | C514: Ремень TOUGH NAVY SEAL чёрный ||PS-NAV-CO-02 | D514: 4.23 | E514: usd | F514: 2 | G514: 126.00 | H514: 1.49 | I514: 176.40 | J514: 7.20 | K514: 5 | L514: =RC[-3]/100*RC[-1] -> 1.49
A515: 12 | B515: H8913/130 | C515: Ремень TOUGH US MARINES койот ||PS-USM-CO-13 | D515: 3.68 | E515: usd | F515: 2 | G515: 126.00 | H515: 1.71 | I515: 176.40 | J515: 29.20 | K515: 5 | L515: =RC[-3]/100*RC[-1] -> 1.71
A516: 13 | B516: H49141/XLR | C516: Рубашка COMBAT мультикам с налокотниками (NYCO POL) ||KO-CS2-PO-14 | D516: 25.88 | E516: usd | F516: 1 | G516: 774.00 | H516: 1.50 | I516: 541.80 | J516: 24.20 | K516: 5 | L516: =RC[-3]/100*RC[-1] -> 1.50
A517: 14 | B517: _12501/11 | C517: Перчатки SECURITY кожаные чёрные ||12501002-011 | D517: 7.75 | E517: euro | F517: 1 | G517: 248.00 | H517: 1.28 | I517: 173.60 | J517: -20.15 | K517: 5 | L517: =RC[-3]/100*RC[-1] -> 1.28
A518: 15 | B518: H3403/L | C518: Футболка вудлэнд ||TS-TSH-CO-03 | D518: 4.06 | E518: usd | F518: 1 | G518: 121.00 | H518: 1.49 | I518: 84.70 | J518: 3.55 | K518: 5 | L518: =RC[-3]/100*RC[-1] -> 1.49
A519: 16 | B519: H3403/XL | C519: Футболка вудлэнд ||TS-TSH-CO-03 | D519: 4.06 | E519: usd | F519: 1 | G519: 121.00 | H519: 1.49 | I519: 84.70 | J519: 3.55 | K519: 5 | L519: =RC[-3]/100*RC[-1] -> 1.49
A520: 17 | B520: _3378-1/42 | C520: Берцы STAR FORCE THUNDERSTORM HI чёрные | D520: 33.53 | E520: euro | F520: 3 | G520: 947.00 | H520: 1.13 | I520: 1988.70 | J520: -526.05 | K520: 5 | L520: =RC[-3]/100*RC[-1] -> 1.13
A521: 18 | B521: _3378-1/44 | C521: Берцы STAR FORCE THUNDERSTORM HI чёрные | D521: 33.53 | E521: euro | F521: 2 | G521: 947.00 | H521: 1.13 | I521: 1325.80 | J521: -350.70 | K521: 5 | L521: =RC[-3]/100*RC[-1] -> 1.13 | M521: =SUM(R[-18]C[-1]:RC[-1]) -> 
A523: #3618 (2014-04-25) Львів Назар Максимович - Прихід товару
A524: N | B524: арт | C524: назва | D524: закуп | F524: к-ть | G524: цiна | H524: кф | I524: продж | J524: дохiд | K524: % | L524: з-та
A525: 1 | B525: _21906 | C525: Баллон Borner СО-2 12г | D525: 0.31 | E525: Инт | F525: 500 | G525: 7.00 | H525: 1.13 | I525: 2450.00 | J525: -653.45 | K525: 5 | L525: =RC[-3]/100*RC[-1] -> 1.13 | M525: =SUM(R[-1]C[-1]:RC[-1]) -> 
A527: #3638 (2014-04-25) Львів Назар Максимович - Прихід товару
A528: N | B528: арт | C528: назва | D528: закуп | F528: к-ть | G528: цiна | H528: кф | I528: продж | J528: дохiд | K528: % | L528: з-та
A529: 1 | B529: _1.0903 | C529: Бинокль GALILEO 22x36 ||18-0112 | D529: 180.00 | E529: грн | F529: 10 | G529: 180.00 | H529: 1.00 | I529: 1800.00 | J529: 0.00 | K529: 5 | L529: =RC[-3]/100*RC[-1] -> 1.00
A530: 2 | B530: _898-9130 | C530: Набор для чистки оружия 4.5 мм | D530: 4.14 | E530: Инт | F530: 53 | G530: 99.00 | H530: 1.20 | I530: 3672.90 | J530: -713.31 | K530: 5 | L530: =RC[-3]/100*RC[-1] -> 1.20
A531: 3 | B531: _01603 | C531: ПНВ Монокуляр EXELON 4x50||ПС | D531: 2820.00 | E531: грн | F531: 2 | G531: 3750.00 | H531: 1.33 | I531: 5250.00 | J531: -390.00 | K531: 5 | L531: =RC[-3]/100*RC[-1] -> 1.33
A532: 4 | B532: _03438 | C532: ПНВ Монокуляр NVMT Spartan 1x24 с маской | D532: 2487.00 | E532: грн | F532: 1 | G532: 3399.00 | H532: 1.37 | I532: 2379.30 | J532: -107.70 | K532: 5 | L532: =RC[-3]/100*RC[-1] -> 1.37
A533: 5 | B533: _KWC-0548 | C533: Пістолет пневматичний KWC PM (KM-44 DHN) | D533: 41.70 | E533: Инт | F533: 4 | G533: 765.00 | H533: 0.92 | I533: 2142.00 | J533: -1194.00 | K533: 5 | L533: =RC[-3]/100*RC[-1] -> 0.92
A534: 6 | B534: _N8200-C | C534: Стульчик со спинкой AQUATECH | D534: 6.80 | E534: Инт | F534: 5 | G534: 135.00 | H534: 0.99 | I534: 472.50 | J534: -207.50 | K534: 5 | L534: =RC[-3]/100*RC[-1] -> 0.99
A535: 7 | B535: _N8200 | C535: Стульчик-табурет AQUATECH | D535: 4.40 | E535: Инт | F535: 5 | G535: 95.00 | H535: 1.08 | I535: 332.50 | J535: -107.50 | K535: 5 | L535: =RC[-3]/100*RC[-1] -> 1.08 | M535: =SUM(R[-7]C[-1]:RC[-1]) -> 
A537: #3646 (2014-04-25) Львів Назар Максимович - Прихід товару
A538: N | B538: арт | C538: назва | D538: закуп | F538: к-ть | G538: цiна | H538: кф | I538: продж | J538: дохiд | K538: % | L538: з-та
A539: 1 | B539: _1.1801 | C539: Бинокль YUKON 10x50 WA ||ПС 22022 | D539: 863.00 | E539: грн | F539: 1 | G539: 805.00 | H539: 0.93 | I539: 805.00 | J539: -58.00 | K539: 5 | L539: =RC[-3]/100*RC[-1] -> 0.93 | M539: =SUM(R[-1]C[-1]:RC[-1]) -> 
A541: #3677 (2014-04-28) Львів Назар Максимович - Відправлено-Продано
A542: N | B542: арт | C542: назва | D542: закуп | F542: к-ть | G542: цiна | H542: кф | I542: продж | J542: дохiд | K542: % | L542: з-та
A543: 1 | B543: H7105 | C543: US BDU кепка 3-х цветный дезерт (R/S) ||CZ-COM-CR-05 | D543: 2.33 | E543: usd | F543: 10 | G543: 72.00 | H543: 1.55 | I543: 504.00 | J543: 38.00 | K543: 5 | L543: =RC[-3]/100*RC[-1] -> 1.55
A544: 2 | B544: H7202 | C544: US BDU кепка олива (NYCO R/S) ||CZ-COM-CR-02 | D544: 2.33 | E544: usd | F544: 10 | G544: 72.00 | H544: 1.55 | I544: 504.00 | J544: 38.00 | K544: 5 | L544: =RC[-3]/100*RC[-1] -> 1.55
A545: 3 | B545: H7104 | C545: US BDU кепка польский вудлэнд ( PolyCotton Ripstop) ||CZ-COM-PR-04 | D545: 2.33 | E545: usd | F545: 10 | G545: 72.00 | H545: 1.55 | I545: 504.00 | J545: 38.00 | K545: 5 | L545: =RC[-3]/100*RC[-1] -> 1.55
A546: 4 | B546: H7005/L | C546: US GI панама с шейной защитой 3-кол.дезерт (R/S) / 7 1/2 ||KA-BON-CR-05 | D546: 4.06 | E546: usd | F546: 1 | G546: 121.00 | H546: 1.49 | I546: 84.70 | J546: 3.50 | K546: 5 | L546: =RC[-3]/100*RC[-1] -> 1.49
A547: 5 | B547: H7003/XL | C547: US GI панама с шейной защитой вудлэнд (R/S) / 7 3/4 ||KA-BON-CR-03 | D547: 4.06 | E547: usd | F547: 1 | G547: 121.00 | H547: 1.49 | I547: 84.70 | J547: 3.50 | K547: 5 | L547: =RC[-3]/100*RC[-1] -> 1.49
A548: 6 | B548: H7011/XL | C548: US GI панама с шейной защитой койот (NYCO R/S) / 7 3/4 ||KA-BON-NR-11 | D548: 4.06 | E548: usd | F548: 1 | G548: 121.00 | H548: 1.49 | I548: 84.70 | J548: 3.50 | K548: 5 | L548: =RC[-3]/100*RC[-1] -> 1.49
A549: 7 | B549: H43141/MR | C549: US SFU китель мультикам (PolyCotton) ||BL-SFU-PR-14 | D549: 16.64 | E549: usd | F549: 1 | G549: 504.00 | H549: 1.51 | I549: 352.80 | J549: 20.00 | K549: 5 | L549: =RC[-3]/100*RC[-1] -> 1.51
A550: 8 | B550: H4314/ML | C550: US SFU штаны мультикам (NYCO R/S) ||SP-SFU-PR-14 | D550: 16.64 | E550: usd | F550: 1 | G550: 504.00 | H550: 1.51 | I550: 352.80 | J550: 20.00 | K550: 5 | L550: =RC[-3]/100*RC[-1] -> 1.51
A551: 9 | B551: K13048-M | C551: Кобура набедренная мультикам ||M51613048-CP | D551: 4.85 | E551: usd | F551: 2 | G551: 166.00 | H551: 1.71 | I551: 232.40 | J551: 38.40 | K551: 5 | L551: =RC[-3]/100*RC[-1] -> 1.71
A552: 10 | B552: K13048-B | C552: Кобура набедренная чёрная ||M51613048-BK | D552: 4.85 | E552: usd | F552: 2 | G552: 166.00 | H552: 1.71 | I552: 232.40 | J552: 38.40 | K552: 5 | L552: =RC[-3]/100*RC[-1] -> 1.71
A553: 11 | B553: DS8838/L | C553: Носки водонепроницаемые Dexshell Coolvent Lite | D553: 10.83 | E553: usd | F553: 2 | G553: 286.00 | H553: 1.32 | I553: 400.40 | J553: -32.93 | K553: 5 | L553: =RC[-3]/100*RC[-1] -> 1.32 | M553: =SUM(R[-11]C[-1]:RC[-1]) -> 
A555: #3697 (2014-04-28) Львів Назар Максимович - Відправлено-Продано
A556: N | B556: арт | C556: назва | D556: закуп | F556: к-ть | G556: цiна | H556: кф | I556: продж | J556: дохiд | K556: % | L556: з-та
A557: 1 | B557: K13048-M | C557: Кобура набедренная мультикам ||M51613048-CP | D557: 4.85 | E557: usd | F557: 2 | G557: 166.00 | H557: 1.71 | I557: 232.40 | J557: 38.40 | K557: 5 | L557: =RC[-3]/100*RC[-1] -> 1.71
A558: 2 | B558: H9001/130 | C558: Ремень ARMY BELT чёрный ||PS-ARM-CO-01 | D558: 4.23 | E558: usd | F558: 2 | G558: 126.00 | H558: 1.49 | I558: 176.40 | J558: 7.20 | K558: 5 | L558: =RC[-3]/100*RC[-1] -> 1.49
A559: 3 | B559: H8602/130 | C559: Ремень TOUGH NAVY SEAL олива ||PS-NAV-CO-01 | D559: 4.23 | E559: usd | F559: 2 | G559: 126.00 | H559: 1.49 | I559: 176.40 | J559: 7.20 | K559: 5 | L559: =RC[-3]/100*RC[-1] -> 1.49
A560: 4 | B560: H8601/130 | C560: Ремень TOUGH NAVY SEAL чёрный ||PS-NAV-CO-02 | D560: 4.23 | E560: usd | F560: 2 | G560: 126.00 | H560: 1.49 | I560: 176.40 | J560: 7.20 | K560: 5 | L560: =RC[-3]/100*RC[-1] -> 1.49 | M560: =SUM(R[-4]C[-1]:RC[-1]) -> 
A562: #3736 (2014-04-29) Львів Назар Максимович - Відправлено-Продано
A563: N | B563: арт | C563: назва | D563: закуп | F563: к-ть | G563: цiна | H563: кф | I563: продж | J563: дохiд | K563: % | L563: з-та
A564: 1 | B564: _TK15R5 | C564: Фонарик FENIX ТК15 Cree XP-G LED R5 new | D564: 66.28 | E564: usd | F564: 1 | G564: 571.00 | H564: 0.43 | I564: 571.00 | J564: -754.60 | K564: 5 | L564: =RC[-3]/100*RC[-1] -> 0.43
A565: 2 | B565: _HTK15ATF | C565: Набор FENIX TK15 + кнопка AR102 +Акум Fenix 2600 + Зарядка TF002 | D565: 88.09 | E565: usd | F565: 1 | G565: 785.00 | H565: 0.45 | I565: 785.00 | J565: -976.80 | K565: 5 | L565: =RC[-3]/100*RC[-1] -> 0.45
A566: 3 | B566: _TK15S2 | C566: Фонарь светодиодный FENIX ТК15 S2 | D566: 66.28 | E566: usd | F566: 1 | G566: 845.00 | H566: 0.64 | I566: 845.00 | J566: -480.60 | K566: 5 | L566: =RC[-3]/100*RC[-1] -> 0.64
A567: 4 | B567: _3378-1/42 | C567: Берцы STAR FORCE THUNDERSTORM HI чёрные | D567: 33.53 | E567: euro | F567: 1 | G567: 947.00 | H567: 1.13 | I567: 662.90 | J567: -175.35 | K567: 5 | L567: =RC[-3]/100*RC[-1] -> 1.13 | M567: =SUM(R[-4]C[-1]:RC[-1]) -> 
A569: #3793 (2014-04-30) Львів Назар Максимович - Відправлено-Продано
A570: N | B570: арт | C570: назва | D570: закуп | F570: к-ть | G570: цiна | H570: кф | I570: продж | J570: дохiд | K570: % | L570: з-та
A571: 1 | B571: H5827/2XLR | C571: URBAN TACTICAL штаны Jungle Green PolyCotton ||SP-UTL-PR-27 | D571: 28.43 | E571: usd | F571: 1 | G571: 850.00 | H571: 1.49 | I571: 595.00 | J571: 26.40 | K571: 5 | L571: =RC[-3]/100*RC[-1] -> 1.49
A572: 2 | B572: K17081-W | C572: Комплект (наколенники и налокотники) вудлэнд ||M51617081-WL | D572: 5.07 | E572: usd | F572: 1 | G572: 188.00 | H572: 1.85 | I572: 131.60 | J572: 30.20 | K572: 5 | L572: =RC[-3]/100*RC[-1] -> 1.85
A573: 3 | B573: H29J021/XL | C573: Куртка Jackal Soft Shell фоліаж ||BL-JCK-FS-21 | D573: 37.10 | E573: usd | F573: 1 | G573: 1100.00 | H573: 1.48 | I573: 770.00 | J573: 28.00 | K573: 5 | L573: =RC[-3]/100*RC[-1] -> 1.48
A574: 4 | B574: H7811 | C574: Хустка SHEMAGH койот/чёрная ||CZ-ARF-CO-11 | D574: 3.62 | E574: usd | F574: 1 | G574: 119.00 | H574: 1.64 | I574: 83.30 | J574: 10.90 | K574: 5 | L574: =RC[-3]/100*RC[-1] -> 1.64 | M574: =SUM(R[-4]C[-1]:RC[-1]) -> 
A576: #3899 (2014-05-06) Львів Назар Максимович - Відправлено-Продано
A577: N | B577: арт | C577: назва | D577: закуп | F577: к-ть | G577: цiна | H577: кф | I577: продж | J577: дохiд | K577: % | L577: з-та
A578: 1 | B578: H5310/L | C578: US шорты ACU (NYCO R/S) ||SP-ACK-NR-10 | D578: 12.34 | E578: usd | F578: 1 | G578: 369.00 | H578: 1.50 | I578: 258.30 | J578: 11.55 | K578: 5 | L578: =RC[-3]/100*RC[-1] -> 1.50
A579: 2 | B579: H5001/L | C579: US шорты URBAN TACTICAL чёрные (PolyCotton ) ||SP-UTK-PR-01 | D579: 18.91 | E579: usd | F579: 1 | G579: 551.00 | H579: 1.46 | I579: 385.70 | J579: 7.50 | K579: 5 | L579: =RC[-3]/100*RC[-1] -> 1.46
A580: 3 | B580: H5307/XL | C580: US шорты марпат (NYCO R/S)||SP-USK-NR-07 | D580: 12.34 | E580: usd | F580: 1 | G580: 369.00 | H580: 1.50 | I580: 258.30 | J580: 11.50 | K580: 5 | L580: =RC[-3]/100*RC[-1] -> 1.50
A581: 4 | B581: H1013 | C581: Каталог Гелікон(2013р) ||AD-K13-EN-00 | D581: 2.98 | E581: usd | F581: 1 | G581: 0.00 | H581: 0.00 | I581: 0.00 | J581: -59.60 | K581: 5 | L581: =RC[-3]/100*RC[-1] -> 0.00
A582: 5 | B582: H1927/M | C582: Куртка URBAN TACTICAL LINE DELTA Jungle Green ||BL-DLT-FS-27 | D582: 33.19 | E582: usd | F582: 1 | G582: 993.00 | H582: 1.50 | I582: 695.10 | J582: 31.30 | K582: 5 | L582: =RC[-3]/100*RC[-1] -> 1.50 | M582: =SUM(R[-5]C[-1]:RC[-1]) -> 
A584: #3956 (2014-05-07) Львів Назар Максимович - Відправлено-Продано
A585: N | B585: арт | C585: назва | D585: закуп | F585: к-ть | G585: цiна | H585: кф | I585: продж | J585: дохiд | K585: % | L585: з-та
A586: 1 | B586: _14472/G | C586: BW каремат-книжка олива б/у ||91443500 | D586: 4.00 | E586: euro | F586: 6 | G586: 150.00 | H586: 1.50 | I586: 630.00 | J586: 30.00 | K586: 5 | L586: =RC[-3]/100*RC[-1] -> 1.50
A587: 2 | B587: K11007-B | C587: Розгруз. AAV FSBE чёрный [A.C.M] ||M51611007-BK | D587: 27.21 | E587: usd | F587: 1 | G587: 760.00 | H587: 1.40 | I587: 532.00 | J587: -12.20 | K587: 5 | L587: =RC[-3]/100*RC[-1] -> 1.40
A588: 3 | B588: H1002 | C588: Спальний мешок M.I.S.H. 2 (кокон) ||SR-MH2-NL-02 | D588: 32.95 | E588: usd | F588: 15 | G588: 857.00 | H588: 1.30 | I588: 8998.50 | J588: -886.50 | K588: 5 | L588: =RC[-3]/100*RC[-1] -> 1.30
A589: 4 | B589: H48031/XLR | C589: TCU китель вудлэнд (NYCO R/S) ||BL-TCU-NR-03 | D589: 20.10 | E589: usd | F589: 1 | G589: 600.00 | H589: 1.49 | I589: 420.00 | J589: 18.00 | K589: 5 | L589: =RC[-3]/100*RC[-1] -> 1.49 | M589: =SUM(R[-4]C[-1]:RC[-1]) -> 
A591: #3985 (2014-05-08) Львів Назар Максимович - Відправлено-Продано
A592: N | B592: арт | C592: назва | D592: закуп | F592: к-ть | G592: цiна | H592: кф | I592: продж | J592: дохiд | K592: % | L592: з-та
A593: 1 | B593: _GWAR250A1 | C593: Арбалет блочний ||Арбалет-250 A1 | D593: 141.18 | E593: Инт | F593: 1 | G593: 1260.00 | H593: 0.45 | I593: 1260.00 | J593: -1563.52 | K593: 5 | L593: =RC[-3]/100*RC[-1] -> 0.45 | M593: =SUM(R[-1]C[-1]:RC[-1]) -> 
A595: #3987 (2014-05-08) Львів Назар Максимович - Відправлено-Продано
A596: N | B596: арт | C596: назва | D596: закуп | F596: к-ть | G596: цiна | H596: кф | I596: продж | J596: дохiд | K596: % | L596: з-та
A597: 1 | B597: H43011/LR | C597: US SFU китель чёрный (PolyCotton) ||BL-SFU-PR-01 | D597: 15.03 | E597: usd | F597: 2 | G597: 433.00 | H597: 1.44 | I597: 606.20 | J597: 5.00 | K597: 5 | L597: =RC[-3]/100*RC[-1] -> 1.44
A598: 2 | B598: H43011/MR | C598: US SFU китель чёрный (PolyCotton) ||BL-SFU-PR-01 | D598: 15.03 | E598: usd | F598: 1 | G598: 433.00 | H598: 1.44 | I598: 303.10 | J598: 2.50 | K598: 5 | L598: =RC[-3]/100*RC[-1] -> 1.44
A599: 3 | B599: H43011/XLR | C599: US SFU китель чёрный (PolyCotton) ||BL-SFU-PR-01 | D599: 15.03 | E599: usd | F599: 1 | G599: 433.00 | H599: 1.44 | I599: 303.10 | J599: 2.50 | K599: 5 | L599: =RC[-3]/100*RC[-1] -> 1.44
A600: 4 | B600: H43011/XXLR | C600: US SFU китель чёрный (PolyCotton) ||BL-SFU-PR-01 | D600: 15.03 | E600: usd | F600: 1 | G600: 433.00 | H600: 1.44 | I600: 303.10 | J600: 2.50 | K600: 5 | L600: =RC[-3]/100*RC[-1] -> 1.44
A601: 5 | B601: H4301/LR | C601: US SFU штаны чёрные (PolyCotton) ||SP-SFU-PR-01 | D601: 15.03 | E601: usd | F601: 2 | G601: 433.00 | H601: 1.44 | I601: 606.20 | J601: 5.00 | K601: 5 | L601: =RC[-3]/100*RC[-1] -> 1.44
A602: 6 | B602: H4301/MR | C602: US SFU штаны чёрные (PolyCotton) ||SP-SFU-PR-01 | D602: 15.03 | E602: usd | F602: 1 | G602: 433.00 | H602: 1.44 | I602: 303.10 | J602: 2.50 | K602: 5 | L602: =RC[-3]/100*RC[-1] -> 1.44
A603: 7 | B603: H4301/XLR | C603: US SFU штаны чёрные (PolyCotton) ||SP-SFU-PR-01 | D603: 15.03 | E603: usd | F603: 1 | G603: 433.00 | H603: 1.44 | I603: 303.10 | J603: 2.50 | K603: 5 | L603: =RC[-3]/100*RC[-1] -> 1.44
A604: 8 | B604: H4301/XXLR | C604: US SFU штаны чёрные (PolyCotton) ||SP-SFU-PR-01 | D604: 15.03 | E604: usd | F604: 1 | G604: 433.00 | H604: 1.44 | I604: 303.10 | J604: 2.50 | K604: 5 | L604: =RC[-3]/100*RC[-1] -> 1.44 | M604: =SUM(R[-8]C[-1]:RC[-1]) -> 
A606: #4021 (2014-05-12) Львів Назар Максимович - Відправлено-Продано
A607: N | B607: арт | C607: назва | D607: закуп | F607: к-ть | G607: цiна | H607: кф | I607: продж | J607: дохiд | K607: % | L607: з-та
A608: 1 | B608: H7104 | C608: US BDU кепка польский вудлэнд ( PolyCotton Ripstop) ||CZ-COM-PR-04 | D608: 2.33 | E608: usd | F608: 1 | G608: 72.00 | H608: 1.55 | I608: 50.40 | J608: 3.80 | K608: 5 | L608: =RC[-3]/100*RC[-1] -> 1.55
A609: 2 | B609: H4603/LR | C609: US BDU штаны вудлэнд (PolyCotton) ||SP-BDU-PR-03 | D609: 13.64 | E609: usd | F609: 1 | G609: 421.00 | H609: 1.54 | I609: 294.70 | J609: 21.90 | K609: 5 | L609: =RC[-3]/100*RC[-1] -> 1.54
A610: 3 | B610: K17222-D | C610: Балаклава SKULL type D-чёрная [Производитель: ACM] ||M51617222-D | D610: 2.65 | E610: usd | F610: 1 | G610: 81.00 | H610: 1.53 | I610: 56.70 | J610: 3.70 | K610: 5 | L610: =RC[-3]/100*RC[-1] -> 1.53
A611: 4 | B611: H7540 | C611: Блайзер A-TACS AU (R/S) ||CZ-BBC-PR-40 | D611: 8.18 | E611: usd | F611: 1 | G611: 230.00 | H611: 1.41 | I611: 161.00 | J611: -2.60 | K611: 5 | L611: =RC[-3]/100*RC[-1] -> 1.41
A612: 5 | B612: H2711/L | C612: Куртка COMMANDER койот ||BL-CMR-FM-11 | D612: 36.66 | E612: usd | F612: 1 | G612: 1096.00 | H612: 1.49 | I612: 767.20 | J612: 34.00 | K612: 5 | L612: =RC[-3]/100*RC[-1] -> 1.49
A613: 6 | B613: H65031/M | C613: Куртка М65 с отстегивающейся курткой вудлэнд (NYCO) ||KU-M65-NY-03 | D613: 37.22 | E613: usd | F613: 1 | G613: 1148.00 | H613: 1.54 | I613: 803.60 | J613: 59.20 | K613: 5 | L613: =RC[-3]/100*RC[-1] -> 1.54
A614: 7 | B614: 50413-15 | C614: Наколінники AltaFLEX Long Cap UCP(R) [ALTA] ||OK-AFL-CD-10 | D614: 17.55 | E614: usd | F614: 1 | G614: 525.00 | H614: 1.50 | I614: 367.50 | J614: 16.50 | K614: 5 | L614: =RC[-3]/100*RC[-1] -> 1.50
A615: 8 | B615: _BD2453 | C615: Очки FA02 goggle-tinted [Производитель: ACM] | D615: 3.45 | E615: usd | F615: 1 | G615: 99.00 | H615: 1.43 | I615: 69.30 | J615: 0.30 | K615: 5 | L615: =RC[-3]/100*RC[-1] -> 1.43
A616: 9 | B616: H88001/L | C616: Ремень US UTILITY чёрный нейлон ||PS-UTL-NL-01 | D616: 5.59 | E616: usd | F616: 1 | G616: 167.00 | H616: 1.49 | I616: 116.90 | J616: 5.10 | K616: 5 | L616: =RC[-3]/100*RC[-1] -> 1.49
A617: 10 | B617: H3407/M | C617: Футболка марпат ||TS-TSH-CO-07 | D617: 4.13 | E617: usd | F617: 1 | G617: 121.00 | H617: 1.46 | I617: 84.70 | J617: 2.10 | K617: 5 | L617: =RC[-3]/100*RC[-1] -> 1.46
A618: 11 | B618: H3414/M | C618: Футболка мультикам ||TS-TSH-CO-14 | D618: 4.06 | E618: usd | F618: 1 | G618: 121.00 | H618: 1.49 | I618: 84.70 | J618: 3.55 | K618: 5 | L618: =RC[-3]/100*RC[-1] -> 1.49 | M618: =SUM(R[-11]C[-1]:RC[-1]) -> 
A620: #4029 (2014-05-12) Львів Назар Максимович - Відправлено-Продано
A621: N | B621: арт | C621: назва | D621: закуп | F621: к-ть | G621: цiна | H621: кф | I621: продж | J621: дохiд | K621: % | L621: з-та
A622: 1 | B622: H7105 | C622: US BDU кепка 3-х цветный дезерт (R/S) ||CZ-COM-CR-05 | D622: 2.33 | E622: usd | F622: 8 | G622: 72.00 | H622: 1.55 | I622: 403.20 | J622: 30.40 | K622: 5 | L622: =RC[-3]/100*RC[-1] -> 1.55
A623: 2 | B623: H7202 | C623: US BDU кепка олива (NYCO R/S) ||CZ-COM-CR-02 | D623: 2.33 | E623: usd | F623: 8 | G623: 72.00 | H623: 1.55 | I623: 403.20 | J623: 30.40 | K623: 5 | L623: =RC[-3]/100*RC[-1] -> 1.55
A624: 3 | B624: H7104 | C624: US BDU кепка польский вудлэнд ( PolyCotton Ripstop) ||CZ-COM-PR-04 | D624: 2.33 | E624: usd | F624: 8 | G624: 72.00 | H624: 1.55 | I624: 403.20 | J624: 30.40 | K624: 5 | L624: =RC[-3]/100*RC[-1] -> 1.55
A625: 4 | B625: H7201 | C625: US BDU кепка чёрная ( PolyCotton Ripstop) ||CZ-COM-NR-01 | D625: 2.33 | E625: usd | F625: 8 | G625: 72.00 | H625: 1.55 | I625: 403.20 | J625: 30.40 | K625: 5 | L625: =RC[-3]/100*RC[-1] -> 1.55
A626: 5 | B626: H46031/SR | C626: US BDU китель вудлэнд (PolyCotton) ||BL-BDU-PR-03 | D626: 13.64 | E626: usd | F626: 1 | G626: 421.00 | H626: 1.54 | I626: 294.70 | J626: 21.90 | K626: 5 | L626: =RC[-3]/100*RC[-1] -> 1.54
A627: 6 | B627: H41991/LL | C627: US SFU китель укр.-цифра (PolyCotton) ||BL-SFU-PR-99 | D627: 15.44 | E627: usd | F627: 1 | G627: 462.00 | H627: 1.50 | I627: 323.40 | J627: 14.60 | K627: 5 | L627: =RC[-3]/100*RC[-1] -> 1.50
A628: 7 | B628: H4103/SR | C628: US SFU штаны вудлэнд (R/S) ||SP-SFU-CR-03 | D628: 14.49 | E628: usd | F628: 1 | G628: 433.00 | H628: 1.49 | I628: 303.10 | J628: 13.30 | K628: 5 | L628: =RC[-3]/100*RC[-1] -> 1.49
A629: 8 | B629: H4314/MR | C629: US SFU штаны мультикам (NYCO R/S) ||SP-SFU-PR-14 | D629: 16.64 | E629: usd | F629: 1 | G629: 504.00 | H629: 1.51 | I629: 352.80 | J629: 20.00 | K629: 5 | L629: =RC[-3]/100*RC[-1] -> 1.51
A630: 9 | B630: H4199/LL | C630: US SFU штаны укр.-цифра (PolyCotton) ||SP-SFU-PR-99 | D630: 15.44 | E630: usd | F630: 1 | G630: 462.00 | H630: 1.50 | I630: 323.40 | J630: 14.60 | K630: 5 | L630: =RC[-3]/100*RC[-1] -> 1.50
A631: 10 | B631: K13047-W | C631: Кобура набедренная вудлэнд (большая) для Desert Egle, МР7, UZI ||M51613047-WL | D631: 7.76 | E631: usd | F631: 1 | G631: 232.00 | H631: 1.49 | I631: 162.40 | J631: 7.20 | K631: 5 | L631: =RC[-3]/100*RC[-1] -> 1.49
A632: 11 | B632: H65021/LR | C632: Куртка М65 с отстегивающейся курткой олива (NYCO) ||KU-M65-NY-02 | D632: 38.39 | E632: usd | F632: 1 | G632: 1148.00 | H632: 1.50 | I632: 803.60 | J632: 35.80 | K632: 5 | L632: =RC[-3]/100*RC[-1] -> 1.50
A633: 12 | B633: H65021/SR | C633: Куртка М65 с отстегивающейся курткой олива (NYCO) ||KU-M65-NY-02 | D633: 38.39 | E633: usd | F633: 1 | G633: 1148.00 | H633: 1.50 | I633: 803.60 | J633: 35.80 | K633: 5 | L633: =RC[-3]/100*RC[-1] -> 1.50
A634: 13 | B634: H7714/L | C634: Панама British Army Style мультикам (NYCO) 7 1/2 ||KA-S95-NT-14 | D634: 4.14 | E634: usd | F634: 1 | G634: 124.00 | H634: 1.50 | I634: 86.80 | J634: 4.00 | K634: 5 | L634: =RC[-3]/100*RC[-1] -> 1.50
A635: 14 | B635: H9002/120 | C635: Ремень ARMY BELT олива ||PS-ARM-CO-02 | D635: 4.23 | E635: usd | F635: 2 | G635: 126.00 | H635: 1.49 | I635: 176.40 | J635: 7.20 | K635: 5 | L635: =RC[-3]/100*RC[-1] -> 1.49
A636: 15 | B636: H8602/120 | C636: Ремень TOUGH NAVY SEAL олива ||PS-NAV-CO-01 | D636: 4.23 | E636: usd | F636: 4 | G636: 126.00 | H636: 1.49 | I636: 352.80 | J636: 14.40 | K636: 5 | L636: =RC[-3]/100*RC[-1] -> 1.49
A637: 16 | B637: H8601/120 | C637: Ремень TOUGH NAVY SEAL чёрный ||PS-NAV-CO-02 | D637: 4.23 | E637: usd | F637: 4 | G637: 126.00 | H637: 1.49 | I637: 352.80 | J637: 14.40 | K637: 5 | L637: =RC[-3]/100*RC[-1] -> 1.49
A638: 17 | B638: H8913/120 | C638: Ремень TOUGH US MARINES койот ||PS-USM-CO-13 | D638: 3.68 | E638: usd | F638: 2 | G638: 126.00 | H638: 1.71 | I638: 176.40 | J638: 29.20 | K638: 5 | L638: =RC[-3]/100*RC[-1] -> 1.71
A639: 18 | B639: H8902/130 | C639: Ремень TOUGH US MARINES олива ||PS-USM-CO-02 | D639: 3.68 | E639: usd | F639: 4 | G639: 126.00 | H639: 1.71 | I639: 352.80 | J639: 58.40 | K639: 5 | L639: =RC[-3]/100*RC[-1] -> 1.71
A640: 19 | B640: H8901/120 | C640: Ремень TOUGH US MARINES чёрный ||PS-USM-CO-01 | D640: 3.68 | E640: usd | F640: 4 | G640: 126.00 | H640: 1.71 | I640: 352.80 | J640: 58.40 | K640: 5 | L640: =RC[-3]/100*RC[-1] -> 1.71
A641: 20 | B641: H3405/L | C641: Футболка 3-кол.дезерт ||TS-TSH-CO-05 | D641: 4.06 | E641: usd | F641: 1 | G641: 121.00 | H641: 1.49 | I641: 84.70 | J641: 3.55 | K641: 5 | L641: =RC[-3]/100*RC[-1] -> 1.49
A642: 21 | B642: H3405/XL | C642: Футболка 3-кол.дезерт ||TS-TSH-CO-05 | D642: 4.06 | E642: usd | F642: 1 | G642: 121.00 | H642: 1.49 | I642: 84.70 | J642: 3.55 | K642: 5 | L642: =RC[-3]/100*RC[-1] -> 1.49
A643: 22 | B643: H3410/L | C643: Футболка ACU ||TS-TSH-CO-10 | D643: 4.06 | E643: usd | F643: 1 | G643: 121.00 | H643: 1.49 | I643: 84.70 | J643: 3.55 | K643: 5 | L643: =RC[-3]/100*RC[-1] -> 1.49
A644: 23 | B644: H3410/XL | C644: Футболка ACU ||TS-TSH-CO-10 | D644: 4.06 | E644: usd | F644: 1 | G644: 121.00 | H644: 1.49 | I644: 84.70 | J644: 3.55 | K644: 5 | L644: =RC[-3]/100*RC[-1] -> 1.49
A645: 24 | B645: H3421/L | C645: Футболка Foliage Green ||TS-TSH-CO-21 | D645: 4.06 | E645: usd | F645: 1 | G645: 121.00 | H645: 1.49 | I645: 84.70 | J645: 3.55 | K645: 5 | L645: =RC[-3]/100*RC[-1] -> 1.49
A646: 25 | B646: H3403/2XL | C646: Футболка вудлэнд ||TS-TSH-CO-03 | D646: 4.06 | E646: usd | F646: 1 | G646: 121.00 | H646: 1.49 | I646: 84.70 | J646: 3.55 | K646: 5 | L646: =RC[-3]/100*RC[-1] -> 1.49
A647: 26 | B647: H3403/L | C647: Футболка вудлэнд ||TS-TSH-CO-03 | D647: 4.06 | E647: usd | F647: 1 | G647: 121.00 | H647: 1.49 | I647: 84.70 | J647: 3.55 | K647: 5 | L647: =RC[-3]/100*RC[-1] -> 1.49
A648: 27 | B648: H3403/M | C648: Футболка вудлэнд ||TS-TSH-CO-03 | D648: 4.06 | E648: usd | F648: 1 | G648: 121.00 | H648: 1.49 | I648: 84.70 | J648: 3.55 | K648: 5 | L648: =RC[-3]/100*RC[-1] -> 1.49
A649: 28 | B649: H3430/L | C649: Футболка койот-браун ||TS-TSH-CO-30 | D649: 4.06 | E649: usd | F649: 1 | G649: 121.00 | H649: 1.49 | I649: 84.70 | J649: 3.55 | K649: 5 | L649: =RC[-3]/100*RC[-1] -> 1.49
A650: 29 | B650: H3430/M | C650: Футболка койот-браун ||TS-TSH-CO-30 | D650: 4.06 | E650: usd | F650: 1 | G650: 121.00 | H650: 1.49 | I650: 84.70 | J650: 3.55 | K650: 5 | L650: =RC[-3]/100*RC[-1] -> 1.49
A651: 30 | B651: _3378-1/43 | C651: Берцы STAR FORCE THUNDERSTORM HI чёрные | D651: 33.53 | E651: euro | F651: 1 | G651: 947.00 | H651: 1.13 | I651: 662.90 | J651: -175.35 | K651: 5 | L651: =RC[-3]/100*RC[-1] -> 1.13 | M651: =SUM(R[-30]C[-1]:RC[-1]) -> 
A653: #4081 (2014-05-13) Львів Назар Максимович - Відправлено-Продано
A654: N | B654: арт | C654: назва | D654: закуп | F654: к-ть | G654: цiна | H654: кф | I654: продж | J654: дохiд | K654: % | L654: з-та
A655: 1 | B655: H7214/XL-61 | C655: US ACU кепка мультикам (NYCO R/S) ||CZ-ACU-PR-14 | D655: 4.31 | E655: usd | F655: 1 | G655: 129.00 | H655: 1.50 | I655: 90.30 | J655: 4.10 | K655: 5 | L655: =RC[-3]/100*RC[-1] -> 1.50
A656: 2 | B656: H43141/2XLR | C656: US SFU китель мультикам (PolyCotton) ||BL-SFU-PR-14 | D656: 16.64 | E656: usd | F656: 1 | G656: 504.00 | H656: 1.51 | I656: 352.80 | J656: 20.00 | K656: 5 | L656: =RC[-3]/100*RC[-1] -> 1.51
A657: 3 | B657: H4314/2XLR | C657: US SFU штаны мультикам (NYCO R/S) ||SP-SFU-PR-14 | D657: 16.64 | E657: usd | F657: 1 | G657: 504.00 | H657: 1.51 | I657: 352.80 | J657: 20.00 | K657: 5 | L657: =RC[-3]/100*RC[-1] -> 1.51
A658: 4 | B658: H29J027/L | C658: Куртка Jackal Soft Shell jungle green ||BL-JCK-FS-27 | D658: 37.10 | E658: usd | F658: 1 | G658: 1100.00 | H658: 1.48 | I658: 770.00 | J658: 28.00 | K658: 5 | L658: =RC[-3]/100*RC[-1] -> 1.48
A659: 5 | B659: H0151/2XL | C659: Перчатки тактические Urban Tactical Line чёрные ||RK-UTL-PU-01 | D659: 10.50 | E659: usd | F659: 2 | G659: 314.00 | H659: 1.50 | I659: 439.60 | J659: 19.60 | K659: 5 | L659: =RC[-3]/100*RC[-1] -> 1.50 | M659: =SUM(R[-5]C[-1]:RC[-1]) -> 
A661: #4102 (2014-05-13) Львів Назар Максимович - Відправлено-Продано
A662: N | B662: арт | C662: назва | D662: закуп | F662: к-ть | G662: цiна | H662: кф | I662: продж | J662: дохiд | K662: % | L662: з-та
A663: 1 | B663: _10180/L | C663: Куртка-аляска US N3B длинная чёрная ||10181002/904 | D663: 34.50 | E663: euro | F663: 1 | G663: 1078.00 | H663: 1.25 | I663: 754.60 | J663: -107.90 | K663: 5 | L663: =RC[-3]/100*RC[-1] -> 1.25
A664: 2 | B664: H4301/LR | C664: US SFU штаны чёрные (PolyCotton) ||SP-SFU-PR-01 | D664: 15.03 | E664: usd | F664: 1 | G664: 433.00 | H664: 1.44 | I664: 303.10 | J664: 2.50 | K664: 5 | L664: =RC[-3]/100*RC[-1] -> 1.44
A665: 3 | B665: H43011/XLR | C665: US SFU китель чёрный (PolyCotton) ||BL-SFU-PR-01 | D665: 15.03 | E665: usd | F665: 1 | G665: 433.00 | H665: 1.44 | I665: 303.10 | J665: 2.50 | K665: 5 | L665: =RC[-3]/100*RC[-1] -> 1.44
A666: 4 | B666: H43021/MR | C666: US SFU китель олива (PolyCotton) ||BL-SFU-PR-02 | D666: 15.03 | E666: usd | F666: 1 | G666: 433.00 | H666: 1.44 | I666: 303.10 | J666: 2.50 | K666: 5 | L666: =RC[-3]/100*RC[-1] -> 1.44
A667: 5 | B667: H4302/MR | C667: US SFU штаны олива (NYCO R/S) ||SP-SFU-NR-02 SP-SFU-PR-02 | D667: 15.03 | E667: usd | F667: 1 | G667: 433.00 | H667: 1.44 | I667: 303.10 | J667: 2.50 | K667: 5 | L667: =RC[-3]/100*RC[-1] -> 1.44
A668: 6 | B668: H41991/LL | C668: US SFU китель укр.-цифра (PolyCotton) ||BL-SFU-PR-99 | D668: 15.44 | E668: usd | F668: 1 | G668: 462.00 | H668: 1.50 | I668: 323.40 | J668: 14.60 | K668: 5 | L668: =RC[-3]/100*RC[-1] -> 1.50
A669: 7 | B669: H4199/LL | C669: US SFU штаны укр.-цифра (PolyCotton) ||SP-SFU-PR-99 | D669: 15.44 | E669: usd | F669: 1 | G669: 462.00 | H669: 1.50 | I669: 323.40 | J669: 14.60 | K669: 5 | L669: =RC[-3]/100*RC[-1] -> 1.50
A670: 8 | B670: H3402/L | C670: Футболка олива ||TS-TSH-CO-29 | D670: 4.06 | E670: usd | F670: 2 | G670: 121.00 | H670: 1.49 | I670: 169.40 | J670: 7.10 | K670: 5 | L670: =RC[-3]/100*RC[-1] -> 1.49
A671: 9 | B671: H3429/L | C671: Футболка олива-драп ||TS-TSH-CO-02 | D671: 4.06 | E671: usd | F671: 2 | G671: 121.00 | H671: 1.49 | I671: 169.40 | J671: 7.10 | K671: 5 | L671: =RC[-3]/100*RC[-1] -> 1.49
A672: 10 | B672: K17131-B | C672: Ремень 1-точ.(Bungee) чёрный ||M51617131-BK | D672: 7.35 | E672: usd | F672: 1 | G672: 222.00 | H672: 1.51 | I672: 155.40 | J672: 8.40 | K672: 5 | L672: =RC[-3]/100*RC[-1] -> 1.51 | M672: =SUM(R[-10]C[-1]:RC[-1]) -> 
A674: #4154 (2014-05-14) Львів Назар Максимович - Прихід товару
A675: N | B675: арт | C675: назва | D675: закуп | F675: к-ть | G675: цiна | H675: кф | I675: продж | J675: дохiд | K675: % | L675: з-та
A676: 1 | B676: _K780000T | C676: Нож Viking Norway Birynkov desing | D676: 30.72 | E676: Инт | F676: 2 | G676: 384.00 | H676: 0.63 | I676: 768.00 | J676: -460.80 | K676: 5 | L676: =RC[-3]/100*RC[-1] -> 0.63
A677: 2 | B677: _1684 | C677: Патрон Флобера 4мм Нобель | D677: 0.20 | E677: Инт | F677: 1000 | G677: 2.70 | H677: 0.66 | I677: 2700.00 | J677: -1371.42 | K677: 5 | L677: =RC[-3]/100*RC[-1] -> 0.66
A678: 3 | B678: _273-1200 | C678: Пістолет пневматичний SAS Makarov PM | D678: 40.84 | E678: Инт | F678: 12 | G678: 540.00 | H678: 0.66 | I678: 6480.00 | J678: -3321.60 | K678: 5 | L678: =RC[-3]/100*RC[-1] -> 0.66
A679: 4 | B679: _3680.00.02 | C679: Револьвер под патрон Флобера STALKER 4мм 4.5" syntetic | D679: 75.00 | E679: Инт | F679: 2 | G679: 1050.00 | H679: 0.70 | I679: 2100.00 | J679: -900.00 | K679: 5 | L679: =RC[-3]/100*RC[-1] -> 0.70
A680: 5 | B680: _3680.00.03 | C680: Револьвер под патрон Флобера STALKER 4мм 4.5" wood | D680: 75.00 | E680: Инт | F680: 2 | G680: 1050.00 | H680: 0.70 | I680: 2100.00 | J680: -900.00 | K680: 5 | L680: =RC[-3]/100*RC[-1] -> 0.70
A681: 6 | B681: _3680.00.05 | C681: Револьвер под патрон Флобера STALKER Titanium 4мм 4.5" wood | D681: 75.00 | E681: Инт | F681: 2 | G681: 1050.00 | H681: 0.70 | I681: 2100.00 | J681: -900.00 | K681: 5 | L681: =RC[-3]/100*RC[-1] -> 0.70
A682: 7 | B682: _372-1505 | C682: Револьвер под патрон Флобера STALKER Titanium 4мм 2.5" syntetic | D682: 72.86 | E682: Инт | F682: 2 | G682: 1020.00 | H682: 0.70 | I682: 2040.00 | J682: -874.28 | K682: 5 | L682: =RC[-3]/100*RC[-1] -> 0.70
A683: 8 | B683: _372-1506 | C683: Револьвер под патрон Флобера STALKER Titanium 4мм 2.5" wood | D683: 72.86 | E683: Инт | F683: 2 | G683: 1020.00 | H683: 0.70 | I683: 2040.00 | J683: -874.28 | K683: 5 | L683: =RC[-3]/100*RC[-1] -> 0.70 | M683: =SUM(R[-8]C[-1]:RC[-1]) -> 
A685: #4163 (2014-05-14) Львів Назар Максимович - Прихід товару
A686: N | B686: арт | C686: назва | D686: закуп | F686: к-ть | G686: цiна | H686: кф | I686: продж | J686: дохiд | K686: % | L686: з-та
A687: 1 | B687: _200116 | C687: Стульчик со спинкой алюминиевый Legend Fishing Gear | D687: 11.60 | E687: Инт | F687: 3 | G687: 145.00 | H687: 0.63 | I687: 435.00 | J687: -261.00 | K687: 5 | L687: =RC[-3]/100*RC[-1] -> 0.63
A688: 2 | B688: _200120 | C688: Стульчик-табурет алюминиевый Legend Fishing Gear | D688: 8.72 | E688: Инт | F688: 3 | G688: 109.00 | H688: 0.63 | I688: 327.00 | J688: -196.20 | K688: 5 | L688: =RC[-3]/100*RC[-1] -> 0.63 | M688: =SUM(R[-2]C[-1]:RC[-1]) -> 
A690: #4227 (2014-05-16) Львів Назар Максимович - Відправлено-Продано
A691: N | B691: арт | C691: назва | D691: закуп | F691: к-ть | G691: цiна | H691: кф | I691: продж | J691: дохiд | K691: % | L691: з-та
A692: 1 | B692: H5813/LR | C692: URBAN TACTICAL штаны хаки (NYCO R/S) ||SP-UTL-NR-13 | D692: 29.06 | E692: usd | F692: 1 | G692: 869.00 | H692: 1.50 | I692: 608.30 | J692: 27.10 | K692: 5 | L692: =RC[-3]/100*RC[-1] -> 1.50
A693: 2 | B693: H5310/L | C693: US шорты ACU (NYCO R/S) ||SP-ACK-NR-10 | D693: 12.34 | E693: usd | F693: 1 | G693: 369.00 | H693: 1.50 | I693: 258.30 | J693: 11.55 | K693: 5 | L693: =RC[-3]/100*RC[-1] -> 1.50
A694: 3 | B694: H5310/XL | C694: US шорты ACU (NYCO R/S) ||SP-ACK-NR-10 | D694: 12.34 | E694: usd | F694: 1 | G694: 369.00 | H694: 1.50 | I694: 258.30 | J694: 11.55 | K694: 5 | L694: =RC[-3]/100*RC[-1] -> 1.50
A695: 4 | B695: X401 | C695: Балаклава чёрная с 1-м отв.(100%хлопок) ||X7601 | D695: 3.15 | E695: Инт | F695: 6 | G695: 45.00 | H695: 0.71 | I695: 189.00 | J695: -189.00 | K695: 5 | L695: =RC[-3]/100*RC[-1] -> 0.71
A696: 5 | B696: K17081-W | C696: Комплект (наколенники и налокотники) вудлэнд ||M51617081-WL | D696: 5.07 | E696: usd | F696: 1 | G696: 188.00 | H696: 1.85 | I696: 131.60 | J696: 30.20 | K696: 5 | L696: =RC[-3]/100*RC[-1] -> 1.85
A697: 6 | B697: X301/52 | C697: Майка-тельник т.синя смужка | D697: 4.40 | E697: Инт | F697: 1 | G697: 58.00 | H697: 0.66 | I697: 46.40 | J697: -41.60 | K697: 5 | L697: =RC[-3]/100*RC[-1] -> 0.66
A698: 7 | B698: X301/54 | C698: Майка-тельник т.синя смужка | D698: 4.40 | E698: Инт | F698: 1 | G698: 58.00 | H698: 0.66 | I698: 46.40 | J698: -41.60 | K698: 5 | L698: =RC[-3]/100*RC[-1] -> 0.66
A699: 8 | B699: X301/56 | C699: Майка-тельник т.синя смужка | D699: 4.40 | E699: Инт | F699: 1 | G699: 58.00 | H699: 0.66 | I699: 46.40 | J699: -41.60 | K699: 5 | L699: =RC[-3]/100*RC[-1] -> 0.66
A700: 9 | B700: X301/58 | C700: Майка-тельник т.синя смужка | D700: 4.40 | E700: Инт | F700: 1 | G700: 58.00 | H700: 0.66 | I700: 46.40 | J700: -41.60 | K700: 5 | L700: =RC[-3]/100*RC[-1] -> 0.66
A701: 10 | B701: H8602/140 | C701: Ремень TOUGH NAVY SEAL олива ||PS-NAV-CO-01 | D701: 4.23 | E701: usd | F701: 1 | G701: 126.00 | H701: 1.49 | I701: 88.20 | J701: 3.60 | K701: 5 | L701: =RC[-3]/100*RC[-1] -> 1.49
A702: 11 | B702: H3410/2XL | C702: Футболка ACU ||TS-TSH-CO-10 | D702: 4.06 | E702: usd | F702: 1 | G702: 121.00 | H702: 1.49 | I702: 84.70 | J702: 3.55 | K702: 5 | L702: =RC[-3]/100*RC[-1] -> 1.49
A703: 12 | B703: H3410/M | C703: Футболка ACU ||TS-TSH-CO-10 | D703: 4.06 | E703: usd | F703: 1 | G703: 121.00 | H703: 1.49 | I703: 84.70 | J703: 3.55 | K703: 5 | L703: =RC[-3]/100*RC[-1] -> 1.49
A704: 13 | B704: H3403/2XL | C704: Футболка вудлэнд ||TS-TSH-CO-03 | D704: 4.06 | E704: usd | F704: 1 | G704: 121.00 | H704: 1.49 | I704: 84.70 | J704: 3.55 | K704: 5 | L704: =RC[-3]/100*RC[-1] -> 1.49
A705: 14 | B705: H3403/L | C705: Футболка вудлэнд ||TS-TSH-CO-03 | D705: 4.06 | E705: usd | F705: 1 | G705: 121.00 | H705: 1.49 | I705: 84.70 | J705: 3.55 | K705: 5 | L705: =RC[-3]/100*RC[-1] -> 1.49
A706: 15 | B706: H3403/XL | C706: Футболка вудлэнд ||TS-TSH-CO-03 | D706: 4.06 | E706: usd | F706: 1 | G706: 121.00 | H706: 1.49 | I706: 84.70 | J706: 3.55 | K706: 5 | L706: =RC[-3]/100*RC[-1] -> 1.49
A707: 16 | B707: H3406/S | C707: Футболка польский дезерт ||TS-TSH-CO-06 | D707: 4.06 | E707: usd | F707: 1 | G707: 121.00 | H707: 1.49 | I707: 84.70 | J707: 3.55 | K707: 5 | L707: =RC[-3]/100*RC[-1] -> 1.49
A708: 17 | B708: H3406/XL | C708: Футболка польский дезерт ||TS-TSH-CO-06 | D708: 4.06 | E708: usd | F708: 1 | G708: 121.00 | H708: 1.49 | I708: 84.70 | J708: 3.55 | K708: 5 | L708: =RC[-3]/100*RC[-1] -> 1.49 | M708: =SUM(R[-17]C[-1]:RC[-1]) -> 
A710: #4263 (2014-05-16) Львів Назар Максимович - Клієнт повернув
A711: N | B711: арт | C711: назва | D711: закуп | F711: к-ть | G711: цiна | H711: кф | I711: продж | J711: дохiд | K711: % | L711: з-та
A712: 1 | B712: _2069 | C712: Патрон Флобера 4мм Чехія (200шт) | D712: 0.13 | E712: Инт | F712: 200 | G712: 2.50 | H712: 0.95 | I712: 350.00 | J712: -178.57 | K712: 5 | L712: =RC[-3]/100*RC[-1] -> 0.95
A713: 2 | B713: _2069 | C713: Патрон Флобера 4мм Чехія (200шт) | D713: 0.13 | E713: Инт | F713: 1800 | G713: 2.50 | H713: 0.95 | I713: 3150.00 | J713: -1607.15 | K713: 5 | L713: =RC[-3]/100*RC[-1] -> 0.95 | M713: =SUM(R[-2]C[-1]:RC[-1]) -> 
A715: #4265 (2014-05-16) Львів Назар Максимович - Відправлено-Продано
A716: N | B716: арт | C716: назва | D716: закуп | F716: к-ть | G716: цiна | H716: кф | I716: продж | J716: дохiд | K716: % | L716: з-та
A717: 1 | B717: _896 | C717: Нож MORAKNIV™ Fishing Comfort 896 | D717: 10.22 | E717: usd | F717: 3 | G717: 178.00 | H717: 0.87 | I717: 534.00 | J717: -79.20 | K717: 5 | L717: =RC[-3]/100*RC[-1] -> 0.87 | M717: =SUM(R[-1]C[-1]:RC[-1]) -> 
A719: #4314 (2014-05-20) Львів Назар Максимович - Відправлено-Продано
A720: N | B720: арт | C720: назва | D720: закуп | F720: к-ть | G720: цiна | H720: кф | I720: продж | J720: дохiд | K720: % | L720: з-та
A721: 1 | B721: H43141/MR | C721: US SFU китель мультикам (PolyCotton) ||BL-SFU-PR-14 | D721: 16.64 | E721: usd | F721: 1 | G721: 504.00 | H721: 1.51 | I721: 352.80 | J721: 20.00 | K721: 5 | L721: =RC[-3]/100*RC[-1] -> 1.51
A722: 2 | B722: H4314/LR | C722: US SFU штаны мультикам (NYCO R/S) ||SP-SFU-PR-14 | D722: 16.64 | E722: usd | F722: 1 | G722: 504.00 | H722: 1.51 | I722: 352.80 | J722: 20.00 | K722: 5 | L722: =RC[-3]/100*RC[-1] -> 1.51
A723: 3 | B723: _3378-1/42 | C723: Берцы STAR FORCE THUNDERSTORM HI чёрные | D723: 33.53 | E723: euro | F723: 1 | G723: 947.00 | H723: 1.13 | I723: 662.90 | J723: -175.35 | K723: 5 | L723: =RC[-3]/100*RC[-1] -> 1.13
A724: 4 | B724: H7002/XL | C724: US GI панама с шейной защитой олива (R/S) / 7 3/4 ||KA-BON-CR-02 | D724: 4.06 | E724: usd | F724: 2 | G724: 121.00 | H724: 1.49 | I724: 169.40 | J724: 7.00 | K724: 5 | L724: =RC[-3]/100*RC[-1] -> 1.49
A725: 5 | B725: H7011/XL | C725: US GI панама с шейной защитой койот (NYCO R/S) / 7 3/4 ||KA-BON-NR-11 | D725: 4.06 | E725: usd | F725: 2 | G725: 121.00 | H725: 1.49 | I725: 169.40 | J725: 7.00 | K725: 5 | L725: =RC[-3]/100*RC[-1] -> 1.49
A726: 6 | B726: H3405/L | C726: Футболка 3-кол.дезерт ||TS-TSH-CO-05 | D726: 4.06 | E726: usd | F726: 1 | G726: 121.00 | H726: 1.49 | I726: 84.70 | J726: 3.55 | K726: 5 | L726: =RC[-3]/100*RC[-1] -> 1.49
A727: 7 | B727: H3405/M | C727: Футболка 3-кол.дезерт ||TS-TSH-CO-05 | D727: 4.06 | E727: usd | F727: 1 | G727: 121.00 | H727: 1.49 | I727: 84.70 | J727: 3.55 | K727: 5 | L727: =RC[-3]/100*RC[-1] -> 1.49
A728: 8 | B728: H3405/XL | C728: Футболка 3-кол.дезерт ||TS-TSH-CO-05 | D728: 4.06 | E728: usd | F728: 1 | G728: 121.00 | H728: 1.49 | I728: 84.70 | J728: 3.55 | K728: 5 | L728: =RC[-3]/100*RC[-1] -> 1.49
A729: 9 | B729: H3410/2XL | C729: Футболка ACU ||TS-TSH-CO-10 | D729: 4.06 | E729: usd | F729: 1 | G729: 121.00 | H729: 1.49 | I729: 84.70 | J729: 3.55 | K729: 5 | L729: =RC[-3]/100*RC[-1] -> 1.49
A730: 10 | B730: H3410/3XL | C730: Футболка ACU ||TS-TSH-CO-10 | D730: 4.06 | E730: usd | F730: 1 | G730: 121.00 | H730: 1.49 | I730: 84.70 | J730: 3.55 | K730: 5 | L730: =RC[-3]/100*RC[-1] -> 1.49
A731: 11 | B731: H3410/M | C731: Футболка ACU ||TS-TSH-CO-10 | D731: 4.06 | E731: usd | F731: 1 | G731: 121.00 | H731: 1.49 | I731: 84.70 | J731: 3.55 | K731: 5 | L731: =RC[-3]/100*RC[-1] -> 1.49
A732: 12 | B732: H3407/L | C732: Футболка марпат ||TS-TSH-CO-07 | D732: 4.13 | E732: usd | F732: 1 | G732: 121.00 | H732: 1.46 | I732: 84.70 | J732: 2.10 | K732: 5 | L732: =RC[-3]/100*RC[-1] -> 1.46
A733: 13 | B733: H3407/M | C733: Футболка марпат ||TS-TSH-CO-07 | D733: 4.13 | E733: usd | F733: 1 | G733: 121.00 | H733: 1.46 | I733: 84.70 | J733: 2.10 | K733: 5 | L733: =RC[-3]/100*RC[-1] -> 1.46
A734: 14 | B734: H3407/XL | C734: Футболка марпат ||TS-TSH-CO-07 | D734: 4.13 | E734: usd | F734: 1 | G734: 121.00 | H734: 1.46 | I734: 84.70 | J734: 2.10 | K734: 5 | L734: =RC[-3]/100*RC[-1] -> 1.46
A735: 15 | B735: H3403/S | C735: Футболка вудлэнд ||TS-TSH-CO-03 | D735: 4.06 | E735: usd | F735: 2 | G735: 121.00 | H735: 1.49 | I735: 169.40 | J735: 7.10 | K735: 5 | L735: =RC[-3]/100*RC[-1] -> 1.49
A736: 16 | B736: H4304/LR | C736: US SFU штаны польский вудлэнд (PolyCotton) ||SP-SFU-PR-04 | D736: 14.49 | E736: usd | F736: 1 | G736: 433.00 | H736: 1.49 | I736: 303.10 | J736: 13.30 | K736: 5 | L736: =RC[-3]/100*RC[-1] -> 1.49
A737: 17 | B737: H4302/ML | C737: US SFU штаны олива (NYCO R/S) ||SP-SFU-NR-02 SP-SFU-PR-02 | D737: 15.03 | E737: usd | F737: 1 | G737: 433.00 | H737: 1.44 | I737: 303.10 | J737: 2.50 | K737: 5 | L737: =RC[-3]/100*RC[-1] -> 1.44
A738: 18 | B738: H4405/LL | C738: US BDU штаны 3-х цветный дезерт (R/S) ||SP-BDU-CR-05 | D738: 14.06 | E738: usd | F738: 1 | G738: 421.00 | H738: 1.50 | I738: 294.70 | J738: 13.50 | K738: 5 | L738: =RC[-3]/100*RC[-1] -> 1.50
A739: 19 | B739: H44051/MR | C739: US BDU китель 3-х цветный дезерт (R/S) ||BL-BDU-CR-05 | D739: 14.06 | E739: usd | F739: 1 | G739: 421.00 | H739: 1.50 | I739: 294.70 | J739: 13.50 | K739: 5 | L739: =RC[-3]/100*RC[-1] -> 1.50
A740: 20 | B740: H4311/LL | C740: US SFU штаны койот (PolyCotton) ||SP-SFU-PR-11 | D740: 15.03 | E740: usd | F740: 1 | G740: 433.00 | H740: 1.44 | I740: 303.10 | J740: 2.50 | K740: 5 | L740: =RC[-3]/100*RC[-1] -> 1.44
A741: 21 | B741: H41991/LL | C741: US SFU китель укр.-цифра (PolyCotton) ||BL-SFU-PR-99 | D741: 15.44 | E741: usd | F741: 1 | G741: 462.00 | H741: 1.50 | I741: 323.40 | J741: 14.60 | K741: 5 | L741: =RC[-3]/100*RC[-1] -> 1.50
A742: 22 | B742: H4199/LL | C742: US SFU штаны укр.-цифра (PolyCotton) ||SP-SFU-PR-99 | D742: 15.44 | E742: usd | F742: 1 | G742: 462.00 | H742: 1.50 | I742: 323.40 | J742: 14.60 | K742: 5 | L742: =RC[-3]/100*RC[-1] -> 1.50
A743: 23 | B743: H4405/LL | C743: US BDU штаны 3-х цветный дезерт (R/S) ||SP-BDU-CR-05 | D743: 14.06 | E743: usd | F743: 1 | G743: 421.00 | H743: 1.50 | I743: 294.70 | J743: 13.50 | K743: 5 | L743: =RC[-3]/100*RC[-1] -> 1.50
A744: 24 | B744: H9001/130 | C744: Ремень ARMY BELT чёрный ||PS-ARM-CO-01 | D744: 4.23 | E744: usd | F744: 5 | G744: 126.00 | H744: 1.49 | I744: 441.00 | J744: 18.00 | K744: 5 | L744: =RC[-3]/100*RC[-1] -> 1.49
A745: 25 | B745: H9002/120 | C745: Ремень ARMY BELT олива ||PS-ARM-CO-02 | D745: 4.23 | E745: usd | F745: 5 | G745: 126.00 | H745: 1.49 | I745: 441.00 | J745: 18.00 | K745: 5 | L745: =RC[-3]/100*RC[-1] -> 1.49
A746: 26 | B746: H8602/130 | C746: Ремень TOUGH NAVY SEAL олива ||PS-NAV-CO-01 | D746: 4.23 | E746: usd | F746: 5 | G746: 126.00 | H746: 1.49 | I746: 441.00 | J746: 18.00 | K746: 5 | L746: =RC[-3]/100*RC[-1] -> 1.49
A747: 27 | B747: H8913/130 | C747: Ремень TOUGH US MARINES койот ||PS-USM-CO-13 | D747: 3.68 | E747: usd | F747: 5 | G747: 126.00 | H747: 1.71 | I747: 441.00 | J747: 73.00 | K747: 5 | L747: =RC[-3]/100*RC[-1] -> 1.71
A748: 28 | B748: H8901/120 | C748: Ремень TOUGH US MARINES чёрный ||PS-USM-CO-01 | D748: 3.68 | E748: usd | F748: 5 | G748: 126.00 | H748: 1.71 | I748: 441.00 | J748: 73.00 | K748: 5 | L748: =RC[-3]/100*RC[-1] -> 1.71
A749: 29 | B749: H0815 | C749: US жетон стальной с резинкой||NS-NS1-SS-15 | D749: 1.30 | E749: usd | F749: 5 | G749: 38.00 | H749: 1.46 | I749: 133.00 | J749: 3.00 | K749: 5 | L749: =RC[-3]/100*RC[-1] -> 1.46
A750: 30 | B750: _12835/11 | C750: US берцы PANAMA JUNGLE чёрные ||12826002-011/45 | D750: 18.50 | E750: euro | F750: 1 | G750: 523.00 | H750: 1.13 | I750: 366.10 | J750: -96.40 | K750: 5 | L750: =RC[-3]/100*RC[-1] -> 1.13 | M750: =SUM(R[-30]C[-1]:RC[-1]) -> 
A752: #4362 (2014-05-21) Львів Назар Максимович - Прихід товару
A753: N | B753: арт | C753: назва | D753: закуп | F753: к-ть | G753: цiна | H753: кф | I753: продж | J753: дохiд | K753: % | L753: з-та
A754: 1 | B754: _508882-1 | C754: Очки антифары Marksmen с чехлом | D754: 7.42 | E754: Инт | F754: 10 | G754: 89.00 | H754: 0.60 | I754: 890.00 | J754: -593.33 | K754: 5 | L754: =RC[-3]/100*RC[-1] -> 0.60
A755: 2 | B755: _508882-2 | C755: Очки антифары Marksmen с чехлом | D755: 7.42 | E755: Инт | F755: 9 | G755: 89.00 | H755: 0.60 | I755: 801.00 | J755: -534.00 | K755: 5 | L755: =RC[-3]/100*RC[-1] -> 0.60
A756: 3 | B756: _508882-3 | C756: Очки антифары Marksmen с чехлом | D756: 7.42 | E756: Инт | F756: 4 | G756: 89.00 | H756: 0.60 | I756: 356.00 | J756: -237.33 | K756: 5 | L756: =RC[-3]/100*RC[-1] -> 0.60
A757: 4 | B757: _508882-4 | C757: Очки антифары Marksmen с чехлом | D757: 7.42 | E757: Инт | F757: 3 | G757: 89.00 | H757: 0.60 | I757: 267.00 | J757: -178.00 | K757: 5 | L757: =RC[-3]/100*RC[-1] -> 0.60
A758: 5 | B758: _508882-5 | C758: Очки антифары Marksmen с чехлом | D758: 7.42 | E758: Инт | F758: 4 | G758: 89.00 | H758: 0.60 | I758: 356.00 | J758: -237.33 | K758: 5 | L758: =RC[-3]/100*RC[-1] -> 0.60 | M758: =SUM(R[-5]C[-1]:RC[-1]) -> 
A760: #4407 (2014-05-22) Львів Назар Максимович - Відправлено-Продано
A761: N | B761: арт | C761: назва | D761: закуп | F761: к-ть | G761: цiна | H761: кф | I761: продж | J761: дохiд | K761: % | L761: з-та
A762: 1 | B762: H41061/2XLR | C762: US SFU китель польский дезерт (R/S) ||BL-SFU-CR-06 | D762: 14.49 | E762: usd | F762: 1 | G762: 433.00 | H762: 1.49 | I762: 303.10 | J762: 13.30 | K762: 5 | L762: =RC[-3]/100*RC[-1] -> 1.49
A763: 2 | B763: H4106/XLR | C763: US SFU штаны польский дезерт (R/S) ||SP-SFU-CR-06 | D763: 14.49 | E763: usd | F763: 1 | G763: 433.00 | H763: 1.49 | I763: 303.10 | J763: 13.30 | K763: 5 | L763: =RC[-3]/100*RC[-1] -> 1.49
A764: 3 | B764: H7713/M | C764: Панама British Army Style бежевая (NYCO R/S) 7 1/4 ||KA-S95-CR-13 | D764: 4.14 | E764: usd | F764: 1 | G764: 124.00 | H764: 1.50 | I764: 86.80 | J764: 4.00 | K764: 5 | L764: =RC[-3]/100*RC[-1] -> 1.50
A765: 4 | B765: H0151/2XL | C765: Перчатки тактические Urban Tactical Line чёрные ||RK-UTL-PU-01 | D765: 10.50 | E765: usd | F765: 1 | G765: 314.00 | H765: 1.50 | I765: 219.80 | J765: 9.80 | K765: 5 | L765: =RC[-3]/100*RC[-1] -> 1.50 | M765: =SUM(R[-4]C[-1]:RC[-1]) -> 
A767: #4408 (2014-05-22) Львів Назар Максимович - Відправлено-Продано
A768: N | B768: арт | C768: назва | D768: закуп | F768: к-ть | G768: цiна | H768: кф | I768: продж | J768: дохiд | K768: % | L768: з-та
A769: 1 | B769: H4311/LR | C769: US SFU штаны койот (PolyCotton) ||SP-SFU-PR-11 | D769: 15.03 | E769: usd | F769: 1 | G769: 433.00 | H769: 1.44 | I769: 303.10 | J769: 2.50 | K769: 5 | L769: =RC[-3]/100*RC[-1] -> 1.44
A770: 2 | B770: K11010-W | C770: Плечеременная разгрузочная система вудлэнд ||M51611010-WL | D770: 24.23 | E770: usd | F770: 1 | G770: 716.00 | H770: 1.48 | I770: 501.20 | J770: 16.60 | K770: 5 | L770: =RC[-3]/100*RC[-1] -> 1.48
A771: 3 | B771: K13047-W | C771: Кобура набедренная вудлэнд (большая) для Desert Egle, МР7, UZI ||M51613047-WL | D771: 7.76 | E771: usd | F771: 2 | G771: 232.00 | H771: 1.49 | I771: 324.80 | J771: 14.40 | K771: 5 | L771: =RC[-3]/100*RC[-1] -> 1.49 | M771: =SUM(R[-3]C[-1]:RC[-1]) -> 
A773: #4435 (2014-05-23) Львів Назар Максимович - Відправлено-Продано
A774: N | B774: арт | C774: назва | D774: закуп | F774: к-ть | G774: цiна | H774: кф | I774: продж | J774: дохiд | K774: % | L774: з-та
A775: 1 | B775: H5814/ML | C775: URBAN TACTICAL штаны мультикам (NYCO R/S) ||SP-UTL-NR-14 | D775: 30.75 | E775: usd | F775: 1 | G775: 920.00 | H775: 1.50 | I775: 644.00 | J775: 29.00 | K775: 5 | L775: =RC[-3]/100*RC[-1] -> 1.50
A776: 2 | B776: H5814/SL | C776: URBAN TACTICAL штаны мультикам (NYCO R/S) ||SP-UTL-NR-14 | D776: 30.75 | E776: usd | F776: 1 | G776: 920.00 | H776: 1.50 | I776: 644.00 | J776: 29.00 | K776: 5 | L776: =RC[-3]/100*RC[-1] -> 1.50
A777: 3 | B777: H5813/MR | C777: URBAN TACTICAL штаны хаки (NYCO R/S) ||SP-UTL-NR-13 | D777: 29.06 | E777: usd | F777: 1 | G777: 869.00 | H777: 1.50 | I777: 608.30 | J777: 27.10 | K777: 5 | L777: =RC[-3]/100*RC[-1] -> 1.50
A778: 4 | B778: _13375/W/L/L | C778: US ремень LC2 вудлэнд размер L/W/904/904 ||13310020 | D778: 3.25 | E778: euro | F778: 1 | G778: 101.00 | H778: 1.24 | I778: 70.70 | J778: -10.55 | K778: 5 | L778: =RC[-3]/100*RC[-1] -> 1.24
A779: 5 | B779: _111710/L | C779: Майка женская 3-кол.дезерт ||11112060/904 | D779: 2.00 | E779: euro | F779: 1 | G779: 82.00 | H779: 1.64 | I779: 57.40 | J779: 7.40 | K779: 5 | L779: =RC[-3]/100*RC[-1] -> 1.64
A780: 6 | B780: _111712/L | C780: Майка женская скайблу ||11112023/904 | D780: 3.00 | E780: euro | F780: 1 | G780: 86.00 | H780: 1.15 | I780: 60.20 | J780: -14.80 | K780: 5 | L780: =RC[-3]/100*RC[-1] -> 1.15
A781: 7 | B781: X301/56 | C781: Майка-тельник т.синя смужка | D781: 4.40 | E781: Инт | F781: 1 | G781: 58.00 | H781: 0.66 | I781: 40.60 | J781: -47.40 | K781: 5 | L781: =RC[-3]/100*RC[-1] -> 0.66
A782: 8 | B782: X301/58 | C782: Майка-тельник т.синя смужка | D782: 4.40 | E782: Инт | F782: 1 | G782: 58.00 | H782: 0.66 | I782: 40.60 | J782: -47.40 | K782: 5 | L782: =RC[-3]/100*RC[-1] -> 0.66
A783: 9 | B783: _107711 | C783: Общевойсковая Розгрузочна система чёрный ||10711002 | D783: 13.50 | E783: euro | F783: 1 | G783: 392.00 | H783: 1.16 | I783: 274.40 | J783: -63.10 | K783: 5 | L783: =RC[-3]/100*RC[-1] -> 1.16
A784: 10 | B784: K11010-W | C784: Плечеременная разгрузочная система вудлэнд ||M51611010-WL | D784: 24.23 | E784: usd | F784: 1 | G784: 716.00 | H784: 1.48 | I784: 501.20 | J784: 16.60 | K784: 5 | L784: =RC[-3]/100*RC[-1] -> 1.48
A785: 11 | B785: H8013/130 | C785: Ремень HKN койот ||PS-HKN-CO-13 | D785: 3.30 | E785: usd | F785: 1 | G785: 128.00 | H785: 1.94 | I785: 89.60 | J785: 23.60 | K785: 5 | L785: =RC[-3]/100*RC[-1] -> 1.94
A786: 12 | B786: H8002/130 | C786: Ремень HKN олива ||PS-HKN-CO-02 | D786: 3.30 | E786: usd | F786: 1 | G786: 128.00 | H786: 1.94 | I786: 89.60 | J786: 23.60 | K786: 5 | L786: =RC[-3]/100*RC[-1] -> 1.94
A787: 13 | B787: H8602/130 | C787: Ремень TOUGH NAVY SEAL олива ||PS-NAV-CO-01 | D787: 4.23 | E787: usd | F787: 1 | G787: 126.00 | H787: 1.49 | I787: 88.20 | J787: 3.60 | K787: 5 | L787: =RC[-3]/100*RC[-1] -> 1.49
A788: 14 | B788: H0141/L | C788: Перчатки тактические US Model чёрные ||RK-USM-PO-01 | D788: 10.43 | E788: usd | F788: 1 | G788: 312.00 | H788: 1.50 | I788: 218.40 | J788: 9.80 | K788: 5 | L788: =RC[-3]/100*RC[-1] -> 1.50
A789: 15 | B789: H0141/XL | C789: Перчатки тактические US Model чёрные ||RK-USM-PO-01 | D789: 10.43 | E789: usd | F789: 1 | G789: 312.00 | H789: 1.50 | I789: 218.40 | J789: 9.80 | K789: 5 | L789: =RC[-3]/100*RC[-1] -> 1.50
A790: 16 | B790: K12025-B | C790: Рюкзак 3-Day Assault 30л чёрный ||M51612025-BK | D790: 17.67 | E790: usd | F790: 1 | G790: 519.00 | H790: 1.47 | I790: 363.30 | J790: 9.90 | K790: 5 | L790: =RC[-3]/100*RC[-1] -> 1.47
A791: 17 | B791: H3405/S | C791: Футболка 3-кол.дезерт ||TS-TSH-CO-05 | D791: 4.06 | E791: usd | F791: 1 | G791: 121.00 | H791: 1.49 | I791: 84.70 | J791: 3.55 | K791: 5 | L791: =RC[-3]/100*RC[-1] -> 1.49
A792: 18 | B792: H3410/L | C792: Футболка ACU ||TS-TSH-CO-10 | D792: 4.06 | E792: usd | F792: 1 | G792: 121.00 | H792: 1.49 | I792: 84.70 | J792: 3.55 | K792: 5 | L792: =RC[-3]/100*RC[-1] -> 1.49
A793: 19 | B793: H3403/3XL | C793: Футболка вудлэнд ||TS-TSH-CO-03 | D793: 4.06 | E793: usd | F793: 1 | G793: 121.00 | H793: 1.49 | I793: 84.70 | J793: 3.55 | K793: 5 | L793: =RC[-3]/100*RC[-1] -> 1.49
A794: 20 | B794: H3414/2XL | C794: Футболка мультикам ||TS-TSH-CO-14 | D794: 4.06 | E794: usd | F794: 1 | G794: 121.00 | H794: 1.49 | I794: 84.70 | J794: 3.55 | K794: 5 | L794: =RC[-3]/100*RC[-1] -> 1.49
A795: 21 | B795: H3413/3XL | C795: Футболка хаки ||TS-TSH-CO-13 | D795: 4.06 | E795: usd | F795: 1 | G795: 121.00 | H795: 1.49 | I795: 84.70 | J795: 3.55 | K795: 5 | L795: =RC[-3]/100*RC[-1] -> 1.49 | M795: =SUM(R[-21]C[-1]:RC[-1]) -> 
A797: #4502 (2014-05-26) Львів Назар Максимович - Відправлено-Продано
A798: N | B798: арт | C798: назва | D798: закуп | F798: к-ть | G798: цiна | H798: кф | I798: продж | J798: дохiд | K798: % | L798: з-та
A799: 1 | B799: K11018-O | C799: Розгруз. Chest Rigg AK с подсумками олива ||M51611018-OD | D799: 13.80 | E799: usd | F799: 3 | G799: 450.00 | H799: 1.63 | I799: 945.00 | J799: 117.00 | K799: 5 | L799: =RC[-3]/100*RC[-1] -> 1.63 | M799: =SUM(R[-1]C[-1]:RC[-1]) -> 
A801: #4516 (2014-05-26) Львів Назар Максимович - Відправлено-Продано
A802: N | B802: арт | C802: назва | D802: закуп | F802: к-ть | G802: цiна | H802: кф | I802: продж | J802: дохiд | K802: % | L802: з-та
A803: 1 | B803: H3404/3XL | C803: Футболка польский вудлэнд ||TS-TSH-CO-04 | D803: 4.06 | E803: usd | F803: 2 | G803: 121.00 | H803: 1.49 | I803: 169.40 | J803: 7.10 | K803: 5 | L803: =RC[-3]/100*RC[-1] -> 1.49
A804: 2 | B804: H3404/L | C804: Футболка польский вудлэнд ||TS-TSH-CO-04 | D804: 4.06 | E804: usd | F804: 2 | G804: 121.00 | H804: 1.49 | I804: 169.40 | J804: 7.10 | K804: 5 | L804: =RC[-3]/100*RC[-1] -> 1.49
A805: 3 | B805: H3404/M | C805: Футболка польский вудлэнд ||TS-TSH-CO-04 | D805: 4.06 | E805: usd | F805: 1 | G805: 121.00 | H805: 1.49 | I805: 84.70 | J805: 3.55 | K805: 5 | L805: =RC[-3]/100*RC[-1] -> 1.49
A806: 4 | B806: H3404/S | C806: Футболка польский вудлэнд ||TS-TSH-CO-04 | D806: 4.06 | E806: usd | F806: 1 | G806: 121.00 | H806: 1.49 | I806: 84.70 | J806: 3.55 | K806: 5 | L806: =RC[-3]/100*RC[-1] -> 1.49
A807: 5 | B807: H3404/XL | C807: Футболка польский вудлэнд ||TS-TSH-CO-04 | D807: 4.06 | E807: usd | F807: 2 | G807: 121.00 | H807: 1.49 | I807: 169.40 | J807: 7.10 | K807: 5 | L807: =RC[-3]/100*RC[-1] -> 1.49
A808: 6 | B808: H3410/2XL | C808: Футболка ACU ||TS-TSH-CO-10 | D808: 4.06 | E808: usd | F808: 2 | G808: 121.00 | H808: 1.49 | I808: 169.40 | J808: 7.10 | K808: 5 | L808: =RC[-3]/100*RC[-1] -> 1.49
A809: 7 | B809: H3410/3XL | C809: Футболка ACU ||TS-TSH-CO-10 | D809: 4.06 | E809: usd | F809: 2 | G809: 121.00 | H809: 1.49 | I809: 169.40 | J809: 7.10 | K809: 5 | L809: =RC[-3]/100*RC[-1] -> 1.49
A810: 8 | B810: H3410/L | C810: Футболка ACU ||TS-TSH-CO-10 | D810: 4.06 | E810: usd | F810: 2 | G810: 121.00 | H810: 1.49 | I810: 169.40 | J810: 7.10 | K810: 5 | L810: =RC[-3]/100*RC[-1] -> 1.49
A811: 9 | B811: H3410/M | C811: Футболка ACU ||TS-TSH-CO-10 | D811: 4.06 | E811: usd | F811: 2 | G811: 121.00 | H811: 1.49 | I811: 169.40 | J811: 7.10 | K811: 5 | L811: =RC[-3]/100*RC[-1] -> 1.49
A812: 10 | B812: H3410/S | C812: Футболка ACU ||TS-TSH-CO-10 | D812: 4.06 | E812: usd | F812: 2 | G812: 121.00 | H812: 1.49 | I812: 169.40 | J812: 7.10 | K812: 5 | L812: =RC[-3]/100*RC[-1] -> 1.49
A813: 11 | B813: H3410/XL | C813: Футболка ACU ||TS-TSH-CO-10 | D813: 4.06 | E813: usd | F813: 2 | G813: 121.00 | H813: 1.49 | I813: 169.40 | J813: 7.10 | K813: 5 | L813: =RC[-3]/100*RC[-1] -> 1.49
A814: 12 | B814: H3407/3XL | C814: Футболка марпат ||TS-TSH-CO-07 | D814: 4.13 | E814: usd | F814: 1 | G814: 121.00 | H814: 1.46 | I814: 84.70 | J814: 2.10 | K814: 5 | L814: =RC[-3]/100*RC[-1] -> 1.46
A815: 13 | B815: H3407/L | C815: Футболка марпат ||TS-TSH-CO-07 | D815: 4.13 | E815: usd | F815: 1 | G815: 121.00 | H815: 1.46 | I815: 84.70 | J815: 2.10 | K815: 5 | L815: =RC[-3]/100*RC[-1] -> 1.46
A816: 14 | B816: H3407/M | C816: Футболка марпат ||TS-TSH-CO-07 | D816: 4.13 | E816: usd | F816: 1 | G816: 121.00 | H816: 1.46 | I816: 84.70 | J816: 2.10 | K816: 5 | L816: =RC[-3]/100*RC[-1] -> 1.46
A817: 15 | B817: H3407/S | C817: Футболка марпат ||TS-TSH-CO-07 | D817: 4.13 | E817: usd | F817: 1 | G817: 121.00 | H817: 1.46 | I817: 84.70 | J817: 2.10 | K817: 5 | L817: =RC[-3]/100*RC[-1] -> 1.46
A818: 16 | B818: H3407/XL | C818: Футболка марпат ||TS-TSH-CO-07 | D818: 4.13 | E818: usd | F818: 1 | G818: 121.00 | H818: 1.46 | I818: 84.70 | J818: 2.10 | K818: 5 | L818: =RC[-3]/100*RC[-1] -> 1.46
A819: 17 | B819: H3403/2XL | C819: Футболка вудлэнд ||TS-TSH-CO-03 | D819: 4.06 | E819: usd | F819: 1 | G819: 121.00 | H819: 1.49 | I819: 84.70 | J819: 3.55 | K819: 5 | L819: =RC[-3]/100*RC[-1] -> 1.49
A820: 18 | B820: H3403/3XL | C820: Футболка вудлэнд ||TS-TSH-CO-03 | D820: 4.06 | E820: usd | F820: 1 | G820: 121.00 | H820: 1.49 | I820: 84.70 | J820: 3.55 | K820: 5 | L820: =RC[-3]/100*RC[-1] -> 1.49
A821: 19 | B821: H3403/L | C821: Футболка вудлэнд ||TS-TSH-CO-03 | D821: 4.06 | E821: usd | F821: 1 | G821: 121.00 | H821: 1.49 | I821: 84.70 | J821: 3.55 | K821: 5 | L821: =RC[-3]/100*RC[-1] -> 1.49
A822: 20 | B822: H3403/S | C822: Футболка вудлэнд ||TS-TSH-CO-03 | D822: 4.06 | E822: usd | F822: 1 | G822: 121.00 | H822: 1.49 | I822: 84.70 | J822: 3.55 | K822: 5 | L822: =RC[-3]/100*RC[-1] -> 1.49
A823: 21 | B823: H3403/XL | C823: Футболка вудлэнд ||TS-TSH-CO-03 | D823: 4.06 | E823: usd | F823: 1 | G823: 121.00 | H823: 1.49 | I823: 84.70 | J823: 3.55 | K823: 5 | L823: =RC[-3]/100*RC[-1] -> 1.49
A824: 22 | B824: H3414/M | C824: Футболка мультикам ||TS-TSH-CO-14 | D824: 4.06 | E824: usd | F824: 1 | G824: 121.00 | H824: 1.49 | I824: 84.70 | J824: 3.55 | K824: 5 | L824: =RC[-3]/100*RC[-1] -> 1.49
A825: 23 | B825: H3414/S | C825: Футболка мультикам ||TS-TSH-CO-14 | D825: 4.06 | E825: usd | F825: 1 | G825: 121.00 | H825: 1.49 | I825: 84.70 | J825: 3.55 | K825: 5 | L825: =RC[-3]/100*RC[-1] -> 1.49
A826: 24 | B826: H3405/L | C826: Футболка 3-кол.дезерт ||TS-TSH-CO-05 | D826: 4.06 | E826: usd | F826: 1 | G826: 121.00 | H826: 1.49 | I826: 84.70 | J826: 3.55 | K826: 5 | L826: =RC[-3]/100*RC[-1] -> 1.49
A827: 25 | B827: H3405/XL | C827: Футболка 3-кол.дезерт ||TS-TSH-CO-05 | D827: 4.06 | E827: usd | F827: 1 | G827: 121.00 | H827: 1.49 | I827: 84.70 | J827: 3.55 | K827: 5 | L827: =RC[-3]/100*RC[-1] -> 1.49
A828: 26 | B828: H3402/L | C828: Футболка олива ||TS-TSH-CO-29 | D828: 4.06 | E828: usd | F828: 1 | G828: 121.00 | H828: 1.49 | I828: 84.70 | J828: 3.55 | K828: 5 | L828: =RC[-3]/100*RC[-1] -> 1.49
A829: 27 | B829: H3429/M | C829: Футболка олива-драп ||TS-TSH-CO-02 | D829: 4.06 | E829: usd | F829: 1 | G829: 121.00 | H829: 1.49 | I829: 84.70 | J829: 3.55 | K829: 5 | L829: =RC[-3]/100*RC[-1] -> 1.49 | M829: =SUM(R[-27]C[-1]:RC[-1]) -> 
A831: #4520 (2014-05-26) Львів Назар Максимович - Відправлено-Продано
A832: N | B832: арт | C832: назва | D832: закуп | F832: к-ть | G832: цiна | H832: кф | I832: продж | J832: дохiд | K832: % | L832: з-та
A833: 1 | B833: _49407-5 | C833: Ракети к ракетницы (великі) красные (5 пострілів) | D833: 7.33 | E833: Инт | F833: 20 | G833: 35.00 | H833: 0.24 | I833: 700.00 | J833: -2233.33 | K833: 5 | L833: =RC[-3]/100*RC[-1] -> 0.24 | M833: =SUM(R[-1]C[-1]:RC[-1]) -> 
A835: #4542 (2014-05-27) Львів Назар Максимович - Прихід товару
A836: N | B836: арт | C836: назва | D836: закуп | F836: к-ть | G836: цiна | H836: кф | I836: продж | J836: дохiд | K836: % | L836: з-та
A837: 1 | B837: _18-0300 | C837: Моноблок високий 11/25.4/25 | D837: 5.00 | E837: Инт | F837: 10 | G837: 78.65 | H837: 0.79 | I837: 786.50 | J837: -213.50 | K837: 5 | L837: =RC[-3]/100*RC[-1] -> 0.79
A838: 2 | B838: _273-1294 | C838: Пистолет пневматический SAS 24/7 | D838: 33.86 | E838: Инт | F838: 6 | G838: 474.00 | H838: 0.70 | I838: 2844.00 | J838: -1218.85 | K838: 5 | L838: =RC[-3]/100*RC[-1] -> 0.70
A839: 3 | B839: _273-1262 | C839: Пистолет пневматический SAS Jerico 941 | D839: 46.79 | E839: Инт | F839: 3 | G839: 655.00 | H839: 0.70 | I839: 1965.00 | J839: -842.14 | K839: 5 | L839: =RC[-3]/100*RC[-1] -> 0.70
A840: 4 | B840: _273-1240 | C840: Пистолет пневматический SAS M1911Tactical (KM-77AHN) | D840: 90.00 | E840: Инт | F840: 3 | G840: 1260.00 | H840: 0.70 | I840: 3780.00 | J840: -1620.00 | K840: 5 | L840: =RC[-3]/100*RC[-1] -> 0.70
A841: 5 | B841: _273-1285 | C841: Пистолет пневматический SAS MP40 ( KM-48HN ) | D841: 33.86 | E841: Инт | F841: 6 | G841: 474.00 | H841: 0.70 | I841: 2844.00 | J841: -1218.85 | K841: 5 | L841: =RC[-3]/100*RC[-1] -> 0.70
A842: 6 | B842: _273-1293 | C842: Пистолет пневматический SAS PT99 ( KMB-15AHNS ) | D842: 81.36 | E842: Инт | F842: 3 | G842: 1139.00 | H842: 0.70 | I842: 3417.00 | J842: -1464.60 | K842: 5 | L842: =RC[-3]/100*RC[-1] -> 0.70
A843: 7 | B843: _273-1284 | C843: Пистолет пневматический SAS Pro 2022 (KM-47HN) | D843: 33.86 | E843: Инт | F843: 6 | G843: 474.00 | H843: 0.70 | I843: 2844.00 | J843: -1218.85 | K843: 5 | L843: =RC[-3]/100*RC[-1] -> 0.70
A844: 8 | B844: _18913 | C844: Пистолет сигнальный EKOL Major (хром) | D844: 57.86 | E844: Инт | F844: 2 | G844: 810.00 | H844: 0.70 | I844: 1620.00 | J844: -694.28 | K844: 5 | L844: =RC[-3]/100*RC[-1] -> 0.70
A845: 9 | B845: _N254-2542 | C845: Пулеуловитель | D845: 3.82 | E845: Инт | F845: 3 | G845: 42.00 | H845: 0.55 | I845: 126.00 | J845: -103.09 | K845: 5 | L845: =RC[-3]/100*RC[-1] -> 0.55
A846: 10 | B846: _KWC-0548 | C846: Пістолет пневматичний KWC PM (KM-44 DHN) | D846: 41.70 | E846: Инт | F846: 5 | G846: 558.00 | H846: 0.67 | I846: 2790.00 | J846: -1380.00 | K846: 5 | L846: =RC[-3]/100*RC[-1] -> 0.67
A847: 11 | B847: _N150-150 | C847: Стульчик-табурет алюминиевый к 150 кг | D847: 12.00 | E847: Инт | F847: 3 | G847: 150.00 | H847: 0.63 | I847: 450.00 | J847: -270.00 | K847: 5 | L847: =RC[-3]/100*RC[-1] -> 0.63
A848: 12 | B848: _N254-2543 | C848: Термоодеяло | D848: 2.73 | E848: Инт | F848: 3 | G848: 30.25 | H848: 0.55 | I848: 90.75 | J848: -73.05 | K848: 5 | L848: =RC[-3]/100*RC[-1] -> 0.55
A849: 13 | B849: _500SH-1 | C849: Шарік "Шаровая молния" 4.5мм 0.57г (500шт) | D849: 1.18 | E849: Инт | F849: 50 | G849: 13.00 | H849: 0.55 | I849: 650.00 | J849: -531.82 | K849: 5 | L849: =RC[-3]/100*RC[-1] -> 0.55
A850: 14 | B850: _2317322 | C850: Патрон шумовой 9мм OZKURSAN | D850: 0.33 | E850: Инт | F850: 250 | G850: 4.60 | H850: 0.70 | I850: 1150.00 | J850: -500.00 | K850: 5 | L850: =RC[-3]/100*RC[-1] -> 0.70 | M850: =SUM(R[-14]C[-1]:RC[-1]) -> 
A852: #4559 (2014-05-27) Львів Назар Максимович - Прихід товару
A853: N | B853: арт | C853: назва | D853: закуп | F853: к-ть | G853: цiна | H853: кф | I853: продж | J853: дохiд | K853: % | L853: з-та
A854: 1 | B854: _C101 | C854: Пистолет пневматичний CROSMAN C-TT | D854: 63.14 | E854: Инт | F854: 5 | G854: 884.00 | H854: 0.70 | I854: 4420.00 | J854: -1894.29 | K854: 5 | L854: =RC[-3]/100*RC[-1] -> 0.70
A855: 2 | B855: _83083 | C855: Пульки Maksnipe кал. 4.5мм (1000шт) 0.825гр | D855: 19.91 | E855: Инт | F855: 13 | G855: 219.00 | H855: 0.55 | I855: 2847.00 | J855: -2329.60 | K855: 5 | L855: =RC[-3]/100*RC[-1] -> 0.55
A856: 3 | B856: _N254-2543 | C856: Термоодеяло | D856: 2.73 | E856: Инт | F856: 30 | G856: 30.25 | H856: 0.55 | I856: 907.50 | J856: -730.50 | K856: 5 | L856: =RC[-3]/100*RC[-1] -> 0.55 | M856: =SUM(R[-3]C[-1]:RC[-1]) -> 
A858: #4585 (2014-05-28) Львів Назар Максимович - Відправлено-Продано
A859: N | B859: арт | C859: назва | D859: закуп | F859: к-ть | G859: цiна | H859: кф | I859: продж | J859: дохiд | K859: % | L859: з-та
A860: 1 | B860: H3402/M | C860: Футболка олива ||TS-TSH-CO-29 | D860: 4.06 | E860: usd | F860: 1 | G860: 121.00 | H860: 1.49 | I860: 84.70 | J860: 3.55 | K860: 5 | L860: =RC[-3]/100*RC[-1] -> 1.49
A861: 2 | B861: H3402/XL | C861: Футболка олива ||TS-TSH-CO-29 | D861: 4.06 | E861: usd | F861: 1 | G861: 121.00 | H861: 1.49 | I861: 84.70 | J861: 3.55 | K861: 5 | L861: =RC[-3]/100*RC[-1] -> 1.49
A862: 3 | B862: H3402/2XL | C862: Футболка олива ||TS-TSH-CO-29 | D862: 4.06 | E862: usd | F862: 1 | G862: 121.00 | H862: 1.49 | I862: 84.70 | J862: 3.55 | K862: 5 | L862: =RC[-3]/100*RC[-1] -> 1.49
A863: 4 | B863: H3403/S | C863: Футболка вудлэнд ||TS-TSH-CO-03 | D863: 4.06 | E863: usd | F863: 2 | G863: 121.00 | H863: 1.49 | I863: 169.40 | J863: 7.10 | K863: 5 | L863: =RC[-3]/100*RC[-1] -> 1.49
A864: 5 | B864: H3405/XL | C864: Футболка 3-кол.дезерт ||TS-TSH-CO-05 | D864: 4.06 | E864: usd | F864: 1 | G864: 121.00 | H864: 1.49 | I864: 84.70 | J864: 3.55 | K864: 5 | L864: =RC[-3]/100*RC[-1] -> 1.49
A865: 6 | B865: H3410/M | C865: Футболка ACU ||TS-TSH-CO-10 | D865: 4.06 | E865: usd | F865: 2 | G865: 121.00 | H865: 1.49 | I865: 169.40 | J865: 7.10 | K865: 5 | L865: =RC[-3]/100*RC[-1] -> 1.49
A866: 7 | B866: H3410/L | C866: Футболка ACU ||TS-TSH-CO-10 | D866: 4.06 | E866: usd | F866: 2 | G866: 121.00 | H866: 1.49 | I866: 169.40 | J866: 7.10 | K866: 5 | L866: =RC[-3]/100*RC[-1] -> 1.49
A867: 8 | B867: H3410/2XL | C867: Футболка ACU ||TS-TSH-CO-10 | D867: 4.06 | E867: usd | F867: 2 | G867: 121.00 | H867: 1.49 | I867: 169.40 | J867: 7.10 | K867: 5 | L867: =RC[-3]/100*RC[-1] -> 1.49
A868: 9 | B868: H3429/M | C868: Футболка олива-драп ||TS-TSH-CO-02 | D868: 4.06 | E868: usd | F868: 1 | G868: 121.00 | H868: 1.49 | I868: 84.70 | J868: 3.55 | K868: 5 | L868: =RC[-3]/100*RC[-1] -> 1.49
A869: 10 | B869: H3429/XL | C869: Футболка олива-драп ||TS-TSH-CO-02 | D869: 4.06 | E869: usd | F869: 1 | G869: 121.00 | H869: 1.49 | I869: 84.70 | J869: 3.55 | K869: 5 | L869: =RC[-3]/100*RC[-1] -> 1.49
A870: 11 | B870: H3404/L | C870: Футболка польский вудлэнд ||TS-TSH-CO-04 | D870: 4.06 | E870: usd | F870: 1 | G870: 121.00 | H870: 1.49 | I870: 84.70 | J870: 3.55 | K870: 5 | L870: =RC[-3]/100*RC[-1] -> 1.49
A871: 12 | B871: H3404/XL | C871: Футболка польский вудлэнд ||TS-TSH-CO-04 | D871: 4.06 | E871: usd | F871: 1 | G871: 121.00 | H871: 1.49 | I871: 84.70 | J871: 3.55 | K871: 5 | L871: =RC[-3]/100*RC[-1] -> 1.49
A872: 13 | B872: H7202 | C872: US BDU кепка олива (NYCO R/S) ||CZ-COM-CR-02 | D872: 2.33 | E872: usd | F872: 10 | G872: 72.00 | H872: 1.55 | I872: 504.00 | J872: 38.00 | K872: 5 | L872: =RC[-3]/100*RC[-1] -> 1.55
A873: 14 | B873: H7201 | C873: US BDU кепка чёрная ( PolyCotton Ripstop) ||CZ-COM-NR-01 | D873: 2.33 | E873: usd | F873: 5 | G873: 72.00 | H873: 1.55 | I873: 252.00 | J873: 19.00 | K873: 5 | L873: =RC[-3]/100*RC[-1] -> 1.55
A874: 15 | B874: H7104 | C874: US BDU кепка польский вудлэнд ( PolyCotton Ripstop) ||CZ-COM-PR-04 | D874: 2.33 | E874: usd | F874: 10 | G874: 72.00 | H874: 1.55 | I874: 504.00 | J874: 38.00 | K874: 5 | L874: =RC[-3]/100*RC[-1] -> 1.55
A875: 16 | B875: H4301/LL | C875: US SFU штаны чёрные (PolyCotton) ||SP-SFU-PR-01 | D875: 15.03 | E875: usd | F875: 1 | G875: 433.00 | H875: 1.44 | I875: 303.10 | J875: 2.50 | K875: 5 | L875: =RC[-3]/100*RC[-1] -> 1.44
A876: 17 | B876: H43011/LR | C876: US SFU китель чёрный (PolyCotton) ||BL-SFU-PR-01 | D876: 15.03 | E876: usd | F876: 1 | G876: 433.00 | H876: 1.44 | I876: 303.10 | J876: 2.50 | K876: 5 | L876: =RC[-3]/100*RC[-1] -> 1.44
A877: 18 | B877: _3378-1/43 | C877: Берцы STAR FORCE THUNDERSTORM HI чёрные | D877: 33.53 | E877: euro | F877: 1 | G877: 947.00 | H877: 1.13 | I877: 662.90 | J877: -175.35 | K877: 5 | L877: =RC[-3]/100*RC[-1] -> 1.13
A878: 19 | B878: H3403/3XL | C878: Футболка вудлэнд ||TS-TSH-CO-03 | D878: 4.06 | E878: usd | F878: 2 | G878: 121.00 | H878: 1.49 | I878: 169.40 | J878: 7.10 | K878: 5 | L878: =RC[-3]/100*RC[-1] -> 1.49
A879: 20 | B879: _3378-1/41 | C879: Берцы STAR FORCE THUNDERSTORM HI чёрные | D879: 33.53 | E879: euro | F879: 1 | G879: 947.00 | H879: 1.13 | I879: 662.90 | J879: -175.35 | K879: 5 | L879: =RC[-3]/100*RC[-1] -> 1.13
A880: 21 | B880: H3410/XL | C880: Футболка ACU ||TS-TSH-CO-10 | D880: 4.06 | E880: usd | F880: 2 | G880: 121.00 | H880: 1.49 | I880: 169.40 | J880: 7.10 | K880: 5 | L880: =RC[-3]/100*RC[-1] -> 1.49 | M880: =SUM(R[-21]C[-1]:RC[-1]) -> 
A882: #4603 (2014-05-28) Львів Назар Максимович - Відправлено-Продано
A883: N | B883: арт | C883: назва | D883: закуп | F883: к-ть | G883: цiна | H883: кф | I883: продж | J883: дохiд | K883: % | L883: з-та
A884: 1 | B884: H5813/LL | C884: URBAN TACTICAL штаны хаки (NYCO R/S) ||SP-UTL-NR-13 | D884: 29.06 | E884: usd | F884: 1 | G884: 869.00 | H884: 1.50 | I884: 608.30 | J884: 27.10 | K884: 5 | L884: =RC[-3]/100*RC[-1] -> 1.50
A885: 2 | B885: H4113/ML | C885: US SFU штаны хаки (R/S) ||SP-SFU-CR-13 | D885: 14.49 | E885: usd | F885: 1 | G885: 433.00 | H885: 1.49 | I885: 303.10 | J885: 13.30 | K885: 5 | L885: =RC[-3]/100*RC[-1] -> 1.49
A886: 3 | B886: H5303/L | C886: US шорты вудлэнд (R/S) ||SP-BDK-CR-03 | D886: 12.17 | E886: usd | F886: 1 | G886: 364.00 | H886: 1.50 | I886: 254.80 | J886: 11.40 | K886: 5 | L886: =RC[-3]/100*RC[-1] -> 1.50
A887: 4 | B887: X401 | C887: Балаклава чёрная с 1-м отв.(100%хлопок) ||X7601 | D887: 3.15 | E887: Инт | F887: 4 | G887: 50.00 | H887: 0.79 | I887: 140.00 | J887: -112.00 | K887: 5 | L887: =RC[-3]/100*RC[-1] -> 0.79
A888: 5 | B888: _BD2453 | C888: Очки FA02 goggle-tinted [Производитель: ACM] | D888: 3.45 | E888: usd | F888: 2 | G888: 99.00 | H888: 1.43 | I888: 138.60 | J888: 0.60 | K888: 5 | L888: =RC[-3]/100*RC[-1] -> 1.43
A889: 6 | B889: _525250 | C889: Окуляри жёлтые [OREGON] | D889: 55.00 | E889: zl | F889: 1 | G889: 85.00 | H889: 0.31 | I889: 59.50 | J889: -215.50 | K889: 5 | L889: =RC[-3]/100*RC[-1] -> 0.31 | M889: =SUM(R[-6]C[-1]:RC[-1]) -> 
A891: #4624 (2014-05-29) Львів Назар Максимович - Відправлено-Продано
A892: N | B892: арт | C892: назва | D892: закуп | F892: к-ть | G892: цiна | H892: кф | I892: продж | J892: дохiд | K892: % | L892: з-та
A893: 1 | B893: H7233/L-59 | C893: PCS кепка MP CAMO ||CZ-PCS-PT-33 | D893: 4.58 | E893: usd | F893: 1 | G893: 137.00 | H893: 1.50 | I893: 95.90 | J893: 4.30 | K893: 5 | L893: =RC[-3]/100*RC[-1] -> 1.50
A894: 2 | B894: H7233/XL-61 | C894: PCS кепка MP CAMO ||CZ-PCS-PT-33 | D894: 4.58 | E894: usd | F894: 1 | G894: 137.00 | H894: 1.50 | I894: 95.90 | J894: 4.30 | K894: 5 | L894: =RC[-3]/100*RC[-1] -> 1.50
A895: 3 | B895: H7105 | C895: US BDU кепка 3-х цветный дезерт (R/S) ||CZ-COM-CR-05 | D895: 2.33 | E895: usd | F895: 2 | G895: 72.00 | H895: 1.55 | I895: 100.80 | J895: 7.60 | K895: 5 | L895: =RC[-3]/100*RC[-1] -> 1.55
A896: 4 | B896: H7210/M | C896: US BDU кепка ACU (NYCO R/S) ||CZ-ACU-NR-10 | D896: 4.31 | E896: usd | F896: 1 | G896: 129.00 | H896: 1.50 | I896: 90.30 | J896: 4.10 | K896: 5 | L896: =RC[-3]/100*RC[-1] -> 1.50
A897: 5 | B897: H7210/S | C897: US BDU кепка ACU (NYCO R/S) ||CZ-ACU-NR-10 | D897: 4.31 | E897: usd | F897: 1 | G897: 129.00 | H897: 1.50 | I897: 90.30 | J897: 4.10 | K897: 5 | L897: =RC[-3]/100*RC[-1] -> 1.50
A898: 6 | B898: H7214/S-55 | C898: US ACU кепка мультикам (NYCO R/S) ||CZ-ACU-PR-14 | D898: 4.31 | E898: usd | F898: 1 | G898: 129.00 | H898: 1.50 | I898: 90.30 | J898: 4.10 | K898: 5 | L898: =RC[-3]/100*RC[-1] -> 1.50
A899: 7 | B899: H7214/XL-61 | C899: US ACU кепка мультикам (NYCO R/S) ||CZ-ACU-PR-14 | D899: 4.31 | E899: usd | F899: 1 | G899: 129.00 | H899: 1.50 | I899: 90.30 | J899: 4.10 | K899: 5 | L899: =RC[-3]/100*RC[-1] -> 1.50
A900: 8 | B900: H7106 | C900: US BDU кепка польский дезерт (R/S) ||CZ-COM-CR-06 | D900: 2.33 | E900: usd | F900: 2 | G900: 72.00 | H900: 1.55 | I900: 100.80 | J900: 7.60 | K900: 5 | L900: =RC[-3]/100*RC[-1] -> 1.55
A901: 9 | B901: H7232 | C901: US BDU кепка олива драп ( PolyCotton Ripstop) ||CZ-COM-NR-32 | D901: 2.33 | E901: usd | F901: 2 | G901: 72.00 | H901: 1.55 | I901: 100.80 | J901: 7.60 | K901: 5 | L901: =RC[-3]/100*RC[-1] -> 1.55 | M901: =SUM(R[-9]C[-1]:RC[-1]) -> 
A903: #4635 (2014-05-29) Львів Назар Максимович - Відправлено-Продано
A904: N | B904: арт | C904: назва | D904: закуп | F904: к-ть | G904: цiна | H904: кф | I904: продж | J904: дохiд | K904: % | L904: з-та
A905: 1 | B905: H43011/LR | C905: US SFU китель чёрный (PolyCotton) ||BL-SFU-PR-01 | D905: 15.03 | E905: usd | F905: 1 | G905: 433.00 | H905: 1.44 | I905: 303.10 | J905: 2.50 | K905: 5 | L905: =RC[-3]/100*RC[-1] -> 1.44
A906: 2 | B906: H4301/LL | C906: US SFU штаны чёрные (PolyCotton) ||SP-SFU-PR-01 | D906: 15.03 | E906: usd | F906: 1 | G906: 433.00 | H906: 1.44 | I906: 303.10 | J906: 2.50 | K906: 5 | L906: =RC[-3]/100*RC[-1] -> 1.44 | M906: =SUM(R[-2]C[-1]:RC[-1]) -> 
A908: #4663 (2014-05-30) Львів Назар Максимович - Відправлено-Продано
A909: N | B909: арт | C909: назва | D909: закуп | F909: к-ть | G909: цiна | H909: кф | I909: продж | J909: дохiд | K909: % | L909: з-та
A910: 1 | B910: H5813/MR | C910: URBAN TACTICAL штаны хаки (NYCO R/S) ||SP-UTL-NR-13 | D910: 29.06 | E910: usd | F910: 1 | G910: 869.00 | H910: 1.50 | I910: 608.30 | J910: 27.10 | K910: 5 | L910: =RC[-3]/100*RC[-1] -> 1.50
A911: 2 | B911: _13375/W/L/L | C911: US ремень LC2 вудлэнд размер L/W/904/904 ||13310020 | D911: 3.25 | E911: euro | F911: 1 | G911: 101.00 | H911: 1.24 | I911: 70.70 | J911: -10.55 | K911: 5 | L911: =RC[-3]/100*RC[-1] -> 1.24
A912: 3 | B912: K17081-M | C912: Комплект (наколенники и налокотники) мультикам ||M51617081-CP | D912: 5.07 | E912: usd | F912: 1 | G912: 188.00 | H912: 1.85 | I912: 131.60 | J912: 30.20 | K912: 5 | L912: =RC[-3]/100*RC[-1] -> 1.85
A913: 4 | B913: K17168-B | C913: Комплект (наколенники и налокотники) чёрный типу ALTA ||M51617168-BK | D913: 9.62 | E913: usd | F913: 1 | G913: 297.00 | H913: 1.54 | I913: 207.90 | J913: 15.50 | K913: 5 | L913: =RC[-3]/100*RC[-1] -> 1.54
A914: 5 | B914: X301/58 | C914: Майка-тельник т.синя смужка | D914: 4.40 | E914: Инт | F914: 1 | G914: 58.00 | H914: 0.66 | I914: 46.40 | J914: -41.60 | K914: 5 | L914: =RC[-3]/100*RC[-1] -> 0.66
A915: 6 | B915: H7713/L | C915: Панама British Army Style бежевая (NYCO R/S) 7 1/2 ||KA-S95-CR-13 | D915: 4.14 | E915: usd | F915: 1 | G915: 124.00 | H915: 1.50 | I915: 86.80 | J915: 4.00 | K915: 5 | L915: =RC[-3]/100*RC[-1] -> 1.50
A916: 7 | B916: K11010-W | C916: Плечеременная разгрузочная система вудлэнд ||M51611010-WL | D916: 24.23 | E916: usd | F916: 1 | G916: 716.00 | H916: 1.48 | I916: 501.20 | J916: 16.60 | K916: 5 | L916: =RC[-3]/100*RC[-1] -> 1.48
A917: 8 | B917: K17067/TAN-L | C917: Перчатки Military Combat Gloves mod. I койот браун ||M51617067-TAN-L | D917: 8.01 | E917: usd | F917: 2 | G917: 245.00 | H917: 1.53 | I917: 343.00 | J917: 22.60 | K917: 5 | L917: =RC[-3]/100*RC[-1] -> 1.53
A918: 9 | B918: H0141/M | C918: Перчатки тактические US Model чёрные ||RK-USM-PO-01 | D918: 10.43 | E918: usd | F918: 1 | G918: 312.00 | H918: 1.50 | I918: 218.40 | J918: 9.80 | K918: 5 | L918: =RC[-3]/100*RC[-1] -> 1.50
A919: 10 | B919: H0151/2XL | C919: Перчатки тактические Urban Tactical Line чёрные ||RK-UTL-PU-01 | D919: 10.50 | E919: usd | F919: 1 | G919: 314.00 | H919: 1.50 | I919: 219.80 | J919: 9.80 | K919: 5 | L919: =RC[-3]/100*RC[-1] -> 1.50 | M919: =SUM(R[-10]C[-1]:RC[-1]) -> 
A921: #4672 (2014-05-30) Львів Назар Максимович - Відправлено-Продано
A922: N | B922: арт | C922: назва | D922: закуп | F922: к-ть | G922: цiна | H922: кф | I922: продж | J922: дохiд | K922: % | L922: з-та
A923: 1 | B923: H43141/MR | C923: US SFU китель мультикам (PolyCotton) ||BL-SFU-PR-14 | D923: 16.64 | E923: usd | F923: 2 | G923: 504.00 | H923: 1.51 | I923: 705.60 | J923: 40.00 | K923: 5 | L923: =RC[-3]/100*RC[-1] -> 1.51
A924: 2 | B924: H43141/SR | C924: US SFU китель мультикам (PolyCotton) ||BL-SFU-PR-14 | D924: 16.64 | E924: usd | F924: 1 | G924: 504.00 | H924: 1.51 | I924: 352.80 | J924: 20.00 | K924: 5 | L924: =RC[-3]/100*RC[-1] -> 1.51
A925: 3 | B925: H4314/SR | C925: US SFU штаны мультикам (NYCO R/S) ||SP-SFU-PR-14 | D925: 16.64 | E925: usd | F925: 3 | G925: 504.00 | H925: 1.51 | I925: 1058.40 | J925: 60.00 | K925: 5 | L925: =RC[-3]/100*RC[-1] -> 1.51 | M925: =SUM(R[-3]C[-1]:RC[-1]) -> 
A927: #4736 (2014-06-02) Львів Назар Максимович - Відправлено-Продано
A928: N | B928: арт | C928: назва | D928: закуп | F928: к-ть | G928: цiна | H928: кф | I928: продж | J928: дохiд | K928: % | L928: з-та
A929: 1 | B929: K17081-W | C929: Комплект (наколенники и налокотники) вудлэнд ||M51617081-WL | D929: 5.07 | E929: usd | F929: 10 | G929: 188.00 | H929: 1.85 | I929: 1316.00 | J929: 302.00 | K929: 5 | L929: =RC[-3]/100*RC[-1] -> 1.85
A930: 2 | B930: K17081-B | C930: Комплект (наколенники и налокотники) чёрный ||M51617081-BK | D930: 5.07 | E930: usd | F930: 3 | G930: 188.00 | H930: 1.85 | I930: 394.80 | J930: 90.60 | K930: 5 | L930: =RC[-3]/100*RC[-1] -> 1.85
A931: 3 | B931: K17081-B | C931: Комплект (наколенники и налокотники) чёрный ||M51617081-BK | D931: 5.07 | E931: usd | F931: 2 | G931: 188.00 | H931: 1.85 | I931: 263.20 | J931: 60.40 | K931: 5 | L931: =RC[-3]/100*RC[-1] -> 1.85 | M931: =SUM(R[-3]C[-1]:RC[-1]) -> 
A933: #4757 (2014-06-03) Львів Назар Максимович - Відправлено-Продано
A934: N | B934: арт | C934: назва | D934: закуп | F934: к-ть | G934: цiна | H934: кф | I934: продж | J934: дохiд | K934: % | L934: з-та
A935: 1 | B935: Брон | C935: Бронепластина 4-й класс | D935: 70.00 | E935: usd | F935: 6 | G935: 1200.00 | H935: 0.86 | I935: 6840.00 | J935: -1560.00 | K935: 5 | L935: =RC[-3]/100*RC[-1] -> 0.86
A936: 2 | B936: K11010-W | C936: Плечеременная разгрузочная система вудлэнд ||M51611010-WL | D936: 24.23 | E936: usd | F936: 1 | G936: 716.00 | H936: 1.48 | I936: 501.20 | J936: 16.60 | K936: 5 | L936: =RC[-3]/100*RC[-1] -> 1.48
A937: 3 | B937: K11002-AT | C937: Розгруз. FA Atacs [WwCH] ||M51611002-ATACS | D937: 63.60 | E937: usd | F937: 1 | G937: 1425.00 | H937: 1.12 | I937: 997.50 | J937: -274.50 | K937: 5 | L937: =RC[-3]/100*RC[-1] -> 1.12
A938: 4 | B938: K11008-A | C938: Розгруз. Plate Carrier Side Cummerbund ACU ||M51611008-ACU | D938: 29.00 | E938: usd | F938: 2 | G938: 905.00 | H938: 1.56 | I938: 1267.00 | J938: 107.00 | K938: 5 | L938: =RC[-3]/100*RC[-1] -> 1.56 | M938: =SUM(R[-4]C[-1]:RC[-1]) -> 
A940: #4816 (2014-06-04) Львів Назар Максимович - Відправлено-Продано
A941: N | B941: арт | C941: назва | D941: закуп | F941: к-ть | G941: цiна | H941: кф | I941: продж | J941: дохiд | K941: % | L941: з-та
A942: 1 | B942: Брон | C942: Бронепластина 4-й класс | D942: 70.00 | E942: usd | F942: 10 | G942: 1200.00 | H942: 0.86 | I942: 11400.00 | J942: -2600.00 | K942: 5 | L942: =RC[-3]/100*RC[-1] -> 0.86
A943: 2 | B943: K11007-AT | C943: Розгруз. AAV FSBE Atacs [A.C.M] ||M51611007-ATACS | D943: 30.00 | E943: usd | F943: 1 | G943: 877.00 | H943: 1.46 | I943: 613.90 | J943: 13.90 | K943: 5 | L943: =RC[-3]/100*RC[-1] -> 1.46
A944: 3 | B944: K11007-C | C944: Розгруз. AAV FSBE койот [A.C.M] ||M51611007-TAN | D944: 27.21 | E944: usd | F944: 1 | G944: 760.00 | H944: 1.40 | I944: 532.00 | J944: -12.20 | K944: 5 | L944: =RC[-3]/100*RC[-1] -> 1.40
A945: 4 | B945: K11008-W | C945: Розгруз. Plate Carrier Side Cummerbund вудлэнд ||M51611008-WL | D945: 29.00 | E945: usd | F945: 3 | G945: 905.00 | H945: 1.56 | I945: 1900.50 | J945: 160.50 | K945: 5 | L945: =RC[-3]/100*RC[-1] -> 1.56 | M945: =SUM(R[-4]C[-1]:RC[-1]) -> 
A947: #4817 (2014-06-04) Львів Назар Максимович - Прихід товару
A948: N | B948: арт | C948: назва | D948: закуп | F948: к-ть | G948: цiна | H948: кф | I948: продж | J948: дохiд | K948: % | L948: з-та
A949: 1 | B949: _3680.00.01 | C949: Револьвер под патрон Флобера STALKER 4мм 2.5" wood | D949: 76.07 | E949: Инт | F949: 2 | G949: 1599.00 | H949: 1.05 | I949: 2238.60 | J949: -804.20 | K949: 5 | L949: =RC[-3]/100*RC[-1] -> 1.05
A950: 2 | B950: _3680.00.01 | C950: Револьвер под патрон Флобера STALKER 4мм 2.5" wood | D950: 76.07 | E950: Инт | F950: 1 | G950: 1599.00 | H950: 1.05 | I950: 1119.30 | J950: -402.10 | K950: 5 | L950: =RC[-3]/100*RC[-1] -> 1.05 | M950: =SUM(R[-2]C[-1]:RC[-1]) -> 
A952: #4855 (2014-06-05) Львів Назар Максимович - Відправлено-Продано
A953: N | B953: арт | C953: назва | D953: закуп | F953: к-ть | G953: цiна | H953: кф | I953: продж | J953: дохiд | K953: % | L953: з-та
A954: 1 | B954: Брон | C954: Бронепластина 4-й класс | D954: 70.00 | E954: usd | F954: 20 | G954: 1200.00 | H954: 0.86 | I954: 22800.00 | J954: -5200.00 | K954: 5 | L954: =RC[-3]/100*RC[-1] -> 0.86
A955: 2 | B955: K11007-C | C955: Розгруз. AAV FSBE койот [A.C.M] ||M51611007-TAN | D955: 27.21 | E955: usd | F955: 2 | G955: 760.00 | H955: 1.40 | I955: 1064.00 | J955: -24.40 | K955: 5 | L955: =RC[-3]/100*RC[-1] -> 1.40
A956: 3 | B956: K11008-W | C956: Розгруз. Plate Carrier Side Cummerbund вудлэнд ||M51611008-WL | D956: 29.00 | E956: usd | F956: 8 | G956: 905.00 | H956: 1.56 | I956: 5068.00 | J956: 428.00 | K956: 5 | L956: =RC[-3]/100*RC[-1] -> 1.56 | M956: =SUM(R[-3]C[-1]:RC[-1]) -> 
A958: #4882 (2014-06-05) Львів Назар Максимович - Відправлено-Продано
A959: N | B959: арт | C959: назва | D959: закуп | F959: к-ть | G959: цiна | H959: кф | I959: продж | J959: дохiд | K959: % | L959: з-та
A960: 1 | B960: Брон | C960: Бронепластина 4-й класс | D960: 70.00 | E960: usd | F960: 10 | G960: 1200.00 | H960: 0.86 | I960: 11400.00 | J960: -2600.00 | K960: 5 | L960: =RC[-3]/100*RC[-1] -> 0.86
A961: 2 | B961: K11007-C | C961: Розгруз. AAV FSBE койот [A.C.M] ||M51611007-TAN | D961: 27.21 | E961: usd | F961: 2 | G961: 760.00 | H961: 1.40 | I961: 1064.00 | J961: -24.40 | K961: 5 | L961: =RC[-3]/100*RC[-1] -> 1.40
A962: 3 | B962: K11008-W | C962: Розгруз. Plate Carrier Side Cummerbund вудлэнд ||M51611008-WL | D962: 29.00 | E962: usd | F962: 4 | G962: 905.00 | H962: 1.56 | I962: 2534.00 | J962: 214.00 | K962: 5 | L962: =RC[-3]/100*RC[-1] -> 1.56 | M962: =SUM(R[-3]C[-1]:RC[-1]) -> 
A964: #4895 (2014-06-06) Львів Назар Максимович - Відправлено-Продано
A965: N | B965: арт | C965: назва | D965: закуп | F965: к-ть | G965: цiна | H965: кф | I965: продж | J965: дохiд | K965: % | L965: з-та
A966: 1 | B966: H43011/LR | C966: US SFU китель чёрный (PolyCotton) ||BL-SFU-PR-01 | D966: 15.03 | E966: usd | F966: 10 | G966: 433.00 | H966: 1.44 | I966: 2879.45 | J966: -126.55 | K966: 5 | L966: =RC[-3]/100*RC[-1] -> 1.44
A967: 2 | B967: H43011/XLR | C967: US SFU китель чёрный (PolyCotton) ||BL-SFU-PR-01 | D967: 15.03 | E967: usd | F967: 10 | G967: 433.00 | H967: 1.44 | I967: 2879.45 | J967: -126.55 | K967: 5 | L967: =RC[-3]/100*RC[-1] -> 1.44
A968: 3 | B968: H43011/XXLR | C968: US SFU китель чёрный (PolyCotton) ||BL-SFU-PR-01 | D968: 15.03 | E968: usd | F968: 10 | G968: 433.00 | H968: 1.44 | I968: 2879.45 | J968: -126.55 | K968: 5 | L968: =RC[-3]/100*RC[-1] -> 1.44
A969: 4 | B969: H4301/LL | C969: US SFU штаны чёрные (PolyCotton) ||SP-SFU-PR-01 | D969: 15.03 | E969: usd | F969: 4 | G969: 433.00 | H969: 1.44 | I969: 1151.78 | J969: -50.62 | K969: 5 | L969: =RC[-3]/100*RC[-1] -> 1.44
A970: 5 | B970: H4301/LR | C970: US SFU штаны чёрные (PolyCotton) ||SP-SFU-PR-01 | D970: 15.03 | E970: usd | F970: 6 | G970: 433.00 | H970: 1.44 | I970: 1727.67 | J970: -75.93 | K970: 5 | L970: =RC[-3]/100*RC[-1] -> 1.44
A971: 6 | B971: H4301/XLL | C971: US SFU штаны чёрные (PolyCotton) ||SP-SFU-PR-01 | D971: 15.03 | E971: usd | F971: 5 | G971: 433.00 | H971: 1.44 | I971: 1439.72 | J971: -63.28 | K971: 5 | L971: =RC[-3]/100*RC[-1] -> 1.44
A972: 7 | B972: H4301/XLR | C972: US SFU штаны чёрные (PolyCotton) ||SP-SFU-PR-01 | D972: 15.03 | E972: usd | F972: 5 | G972: 433.00 | H972: 1.44 | I972: 1439.72 | J972: -63.28 | K972: 5 | L972: =RC[-3]/100*RC[-1] -> 1.44
A973: 8 | B973: H4301/XXLL | C973: US SFU штаны чёрные (PolyCotton) ||SP-SFU-PR-01 | D973: 15.03 | E973: usd | F973: 5 | G973: 433.00 | H973: 1.44 | I973: 1439.72 | J973: -63.28 | K973: 5 | L973: =RC[-3]/100*RC[-1] -> 1.44
A974: 9 | B974: H4301/XXLR | C974: US SFU штаны чёрные (PolyCotton) ||SP-SFU-PR-01 | D974: 15.03 | E974: usd | F974: 5 | G974: 433.00 | H974: 1.44 | I974: 1439.72 | J974: -63.28 | K974: 5 | L974: =RC[-3]/100*RC[-1] -> 1.44 | M974: =SUM(R[-9]C[-1]:RC[-1]) -> 
A976: #4896 (2014-06-06) Львів Назар Максимович - Прихід товару
A977: N | B977: арт | C977: назва | D977: закуп | F977: к-ть | G977: цiна | H977: кф | I977: продж | J977: дохiд | K977: % | L977: з-та
A978: 1 | B978: _3680.00.00 | C978: Револьвер под патрон Флобера STALKER 4мм 2.5" syntetic | D978: 76.07 | E978: Инт | F978: 1 | G978: 1065.00 | H978: 0.70 | I978: 1065.00 | J978: -456.43 | K978: 5 | L978: =RC[-3]/100*RC[-1] -> 0.70
A979: 2 | B979: _3680.00.00 | C979: Револьвер под патрон Флобера STALKER 4мм 2.5" syntetic | D979: 76.07 | E979: Инт | F979: 4 | G979: 1065.00 | H979: 0.70 | I979: 4260.00 | J979: -1825.71 | K979: 5 | L979: =RC[-3]/100*RC[-1] -> 0.70 | M979: =SUM(R[-2]C[-1]:RC[-1]) -> 
A981: #4932 (2014-06-06) Львів Назар Максимович - Відправлено-Продано
A982: N | B982: арт | C982: назва | D982: закуп | F982: к-ть | G982: цiна | H982: кф | I982: продж | J982: дохiд | K982: % | L982: з-та
A983: 1 | B983: H43141/XLR | C983: US SFU китель мультикам (PolyCotton) ||BL-SFU-PR-14 | D983: 16.64 | E983: usd | F983: 2 | G983: 504.00 | H983: 1.51 | I983: 705.60 | J983: 40.00 | K983: 5 | L983: =RC[-3]/100*RC[-1] -> 1.51
A984: 2 | B984: H4314/XLL | C984: US SFU штаны мультикам (NYCO R/S) ||SP-SFU-PR-14 | D984: 16.64 | E984: usd | F984: 1 | G984: 504.00 | H984: 1.51 | I984: 352.80 | J984: 20.00 | K984: 5 | L984: =RC[-3]/100*RC[-1] -> 1.51
A985: 3 | B985: H4314/XLR | C985: US SFU штаны мультикам (NYCO R/S) ||SP-SFU-PR-14 | D985: 16.64 | E985: usd | F985: 1 | G985: 504.00 | H985: 1.51 | I985: 352.80 | J985: 20.00 | K985: 5 | L985: =RC[-3]/100*RC[-1] -> 1.51
A986: 4 | B986: K11010-W | C986: Плечеременная разгрузочная система вудлэнд ||M51611010-WL | D986: 24.23 | E986: usd | F986: 1 | G986: 716.00 | H986: 1.48 | I986: 501.20 | J986: 16.60 | K986: 5 | L986: =RC[-3]/100*RC[-1] -> 1.48
A987: 5 | B987: H3401/L | C987: Футболка чёрная ||TS-TSH-CO-01 | D987: 4.06 | E987: usd | F987: 2 | G987: 121.00 | H987: 1.49 | I987: 169.40 | J987: 7.10 | K987: 5 | L987: =RC[-3]/100*RC[-1] -> 1.49
A988: 6 | B988: H3401/XL | C988: Футболка чёрная ||TS-TSH-CO-01 | D988: 4.06 | E988: usd | F988: 1 | G988: 121.00 | H988: 1.49 | I988: 84.70 | J988: 3.55 | K988: 5 | L988: =RC[-3]/100*RC[-1] -> 1.49
A989: 7 | B989: H43141/MR | C989: US SFU китель мультикам (PolyCotton) ||BL-SFU-PR-14 | D989: 16.64 | E989: usd | F989: 1 | G989: 504.00 | H989: 1.51 | I989: 352.80 | J989: 20.00 | K989: 5 | L989: =RC[-3]/100*RC[-1] -> 1.51 | M989: =SUM(R[-7]C[-1]:RC[-1]) -> 
A991: #4957 (2014-06-09) Львів Назар Максимович - Відправлено-Продано
A992: N | B992: арт | C992: назва | D992: закуп | F992: к-ть | G992: цiна | H992: кф | I992: продж | J992: дохiд | K992: % | L992: з-та
A993: 1 | B993: K11008-W | C993: Розгруз. Plate Carrier Side Cummerbund вудлэнд ||M51611008-WL | D993: 29.00 | E993: usd | F993: 3 | G993: 905.00 | H993: 1.56 | I993: 1900.50 | J993: 160.50 | K993: 5 | L993: =RC[-3]/100*RC[-1] -> 1.56
A994: 2 | B994: K12025-С | C994: Рюкзак 3-Day Assault 30л койот ||M51612025-TAN | D994: 17.67 | E994: usd | F994: 1 | G994: 519.00 | H994: 1.47 | I994: 363.30 | J994: 9.90 | K994: 5 | L994: =RC[-3]/100*RC[-1] -> 1.47
A995: 3 | B995: K12025-M | C995: Рюкзак 3-Day Assault 30л мультикам ||M51612025-CP | D995: 17.67 | E995: usd | F995: 2 | G995: 519.00 | H995: 1.47 | I995: 726.60 | J995: 19.80 | K995: 5 | L995: =RC[-3]/100*RC[-1] -> 1.47
A996: 4 | B996: K12022-W | C996: Рюкзак Tactical Backpack 20л вудлэнд ||M51612022-WL | D996: 19.17 | E996: usd | F996: 1 | G996: 573.00 | H996: 1.49 | I996: 401.10 | J996: 17.70 | K996: 5 | L996: =RC[-3]/100*RC[-1] -> 1.49 | M996: =SUM(R[-4]C[-1]:RC[-1]) -> 
A998: #5030 (2014-06-10) Львів Назар Максимович - Прихід товару
A999: N | B999: арт | C999: назва | D999: закуп | F999: к-ть | G999: цiна | H999: кф | I999: продж | J999: дохiд | K999: % | L999: з-та
A1000: 1 | B1000: _1.1606 | C1000: Бинокль TASCO 22x36 ||B-22 | D1000: 16.10 | E1000: Инт | F1000: 5 | G1000: 178.00 | H1000: 0.55 | I1000: 890.00 | J1000: -720.00 | K1000: 5 | L1000: =RC[-3]/100*RC[-1] -> 0.55
A1001: 2 | B1001: _90131-111 | C1001: Прицел коллиматорный LEUPOLD MARK 4 8888SC (22mm) (копия) | D1001: 41.00 | E1001: Инт | F1001: 1 | G1001: 484.00 | H1001: 0.59 | I1001: 484.00 | J1001: -336.00 | K1001: 5 | L1001: =RC[-3]/100*RC[-1] -> 0.59
A1002: 3 | B1002: _90131-1 | C1002: Прицел коллиматорный Zos 1X22X33 (11mm) | D1002: 32.00 | E1002: Инт | F1002: 1 | G1002: 375.00 | H1002: 0.59 | I1002: 375.00 | J1002: -265.00 | K1002: 5 | L1002: =RC[-3]/100*RC[-1] -> 0.59
A1003: 4 | B1003: _510900 | C1003: Прицел оптический BSA 4x32 | D1003: 30.25 | E1003: Инт | F1003: 4 | G1003: 363.00 | H1003: 0.60 | I1003: 1452.00 | J1003: -968.00 | K1003: 5 | L1003: =RC[-3]/100*RC[-1] -> 0.60
A1004: 5 | B1004: _720038 | C1004: Прицел оптический BUSHNELL 3-9x32 (арб.сетка) | D1004: 26.16 | E1004: Инт | F1004: 5 | G1004: 327.00 | H1004: 0.63 | I1004: 1635.00 | J1004: -981.00 | K1004: 5 | L1004: =RC[-3]/100*RC[-1] -> 0.63
A1005: 6 | B1005: _G3-7-20 | C1005: Прицел оптический GAMO 3-7x20 | D1005: 11.20 | E1005: Инт | F1005: 4 | G1005: 225.00 | H1005: 1.00 | I1005: 900.00 | J1005: 4.00 | K1005: 5 | L1005: =RC[-3]/100*RC[-1] -> 1.00
A1006: 7 | B1006: _G3-7-28 | C1006: Прицел оптический GAMO 3-7x28 | D1006: 14.56 | E1006: Инт | F1006: 4 | G1006: 182.00 | H1006: 0.63 | I1006: 728.00 | J1006: -436.80 | K1006: 5 | L1006: =RC[-3]/100*RC[-1] -> 0.63
A1007: 8 | B1007: _GM4x15 | C1007: Прицел оптический GAMO 4x15 | D1007: 3.98 | E1007: Инт | F1007: 4 | G1007: 49.70 | H1007: 0.62 | I1007: 198.80 | J1007: -119.60 | K1007: 5 | L1007: =RC[-3]/100*RC[-1] -> 0.62
A1008: 9 | B1008: _G4X20 | C1008: Прицел оптический GAMO 4x20 | D1008: 4.84 | E1008: Инт | F1008: 5 | G1008: 60.50 | H1008: 0.63 | I1008: 302.50 | J1008: -181.50 | K1008: 5 | L1008: =RC[-3]/100*RC[-1] -> 0.63
A1009: 10 | B1009: _GM4x28 | C1009: Прицел оптический GAMO 4x28 | D1009: 7.60 | E1009: Инт | F1009: 3 | G1009: 95.00 | H1009: 0.63 | I1009: 285.00 | J1009: -171.00 | K1009: 5 | L1009: =RC[-3]/100*RC[-1] -> 0.63
A1010: 11 | B1010: _G4X32 | C1010: Прицел оптический GAMO 4x32 | D1010: 24.20 | E1010: Инт | F1010: 4 | G1010: 302.50 | H1010: 0.63 | I1010: 1210.00 | J1010: -726.00 | K1010: 5 | L1010: =RC[-3]/100*RC[-1] -> 0.63
A1011: 12 | B1011: _23-0350 | C1011: Прицел оптический GAMO 4x32 AR! AO R6 | D1011: 33.92 | E1011: Инт | F1011: 4 | G1011: 424.00 | H1011: 0.63 | I1011: 1696.00 | J1011: -1017.60 | K1011: 5 | L1011: =RC[-3]/100*RC[-1] -> 0.63
A1012: 13 | B1012: _3932-11 | C1012: Прицел оптический TASCO 3-9x32 Mil-Dot | D1012: 26.16 | E1012: Инт | F1012: 4 | G1012: 327.00 | H1012: 0.63 | I1012: 1308.00 | J1012: -784.80 | K1012: 5 | L1012: =RC[-3]/100*RC[-1] -> 0.63
A1013: 14 | B1013: _511000 | C1013: Прицел оптический TASCO 3-9x32E Mil Dot | D1013: 31.92 | E1013: Инт | F1013: 3 | G1013: 399.00 | H1013: 0.63 | I1013: 1197.00 | J1013: -718.20 | K1013: 5 | L1013: =RC[-3]/100*RC[-1] -> 0.63
A1014: 15 | B1014: _511100 | C1014: Прицел оптический TASCO 3-9x42CE Mini | D1014: 36.80 | E1014: Инт | F1014: 4 | G1014: 460.00 | H1014: 0.63 | I1014: 1840.00 | J1014: -1104.00 | K1014: 5 | L1014: =RC[-3]/100*RC[-1] -> 0.63
A1015: 16 | B1015: _23005 | C1015: Прицел оптический WALTHER ZF 6x42E(с подсветкой, кільця 11мм) | D1015: 38.33 | E1015: Инт | F1015: 4 | G1015: 460.00 | H1015: 0.60 | I1015: 1840.00 | J1015: -1226.40 | K1015: 5 | L1015: =RC[-3]/100*RC[-1] -> 0.60
A1016: 17 | B1016: _PR2503 | C1016: Револьвер под патрон Флобера PROFI 3 (бук) | D1016: 119.21 | E1016: Инт | F1016: 2 | G1016: 1669.00 | H1016: 0.70 | I1016: 3338.00 | J1016: -1430.56 | K1016: 5 | L1016: =RC[-3]/100*RC[-1] -> 0.70
A1017: 18 | B1017: _PR2501 | C1017: Револьвер под патрон Флобера PROFI 3 (пластик чёрный) | D1017: 117.64 | E1017: Инт | F1017: 2 | G1017: 1633.00 | H1017: 0.69 | I1017: 3266.00 | J1017: -1439.72 | K1017: 5 | L1017: =RC[-3]/100*RC[-1] -> 0.69 | M1017: =SUM(R[-18]C[-1]:RC[-1]) -> 
A1019: #5073 (2014-06-11) Львів Назар Максимович - Прихід товару
A1020: N | B1020: арт | C1020: назва | D1020: закуп | F1020: к-ть | G1020: цiна | H1020: кф | I1020: продж | J1020: дохiд | K1020: % | L1020: з-та
A1021: 1 | B1021: _1.0705 | C1021: Бинокль CANON 8x40 ||18-0102 | D1021: 36.00 | E1021: Инт | F1021: 1 | G1021: 435.60 | H1021: 0.61 | I1021: 435.60 | J1021: -284.40 | K1021: 5 | L1021: =RC[-3]/100*RC[-1] -> 0.61
A1022: 2 | B1022: _1.0904 | C1022: Бинокль GALILEO 26x50 | D1022: 34.00 | E1022: Инт | F1022: 1 | G1022: 290.40 | H1022: 0.43 | I1022: 290.40 | J1022: -389.60 | K1022: 5 | L1022: =RC[-3]/100*RC[-1] -> 0.43
A1023: 3 | B1023: _1.1001 | C1023: Бинокль NIKON 10-50x50 black ||N10-50-50 | D1023: 387.00 | E1023: грн | F1023: 1 | G1023: 387.00 | H1023: 1.00 | I1023: 387.00 | J1023: 0.00 | K1023: 5 | L1023: =RC[-3]/100*RC[-1] -> 1.00
A1024: 4 | B1024: _1.10032 | C1024: Бинокль NIKON 10x42 Waterproof ( Monarh) копия | D1024: 55.00 | E1024: Инт | F1024: 1 | G1024: 544.00 | H1024: 0.49 | I1024: 544.00 | J1024: -556.00 | K1024: 5 | L1024: =RC[-3]/100*RC[-1] -> 0.49
A1025: 5 | B1025: _1.1003 | C1025: Бинокль NIKON (копия) 10x42 black ||N10X42 | D1025: 30.00 | E1025: Инт | F1025: 1 | G1025: 302.50 | H1025: 0.50 | I1025: 302.50 | J1025: -297.50 | K1025: 5 | L1025: =RC[-3]/100*RC[-1] -> 0.50
A1026: 6 | B1026: _1.0508 | C1026: Бинокль Tasco 20x50 | D1026: 273.00 | E1026: грн | F1026: 1 | G1026: 266.20 | H1026: 0.98 | I1026: 266.20 | J1026: -6.80 | K1026: 5 | L1026: =RC[-3]/100*RC[-1] -> 0.98
A1027: 7 | B1027: _102410 | C1027: Бинокль ZEISS 10x24 (копия) чёрный | D1027: 20.00 | E1027: Инт | F1027: 1 | G1027: 242.00 | H1027: 0.61 | I1027: 242.00 | J1027: -158.00 | K1027: 5 | L1027: =RC[-3]/100*RC[-1] -> 0.61
A1028: 8 | B1028: _N550200 | C1028: Кобура оперативная ПМ с подсумком | D1028: 13.52 | E1028: Инт | F1028: 1 | G1028: 169.00 | H1028: 0.63 | I1028: 169.00 | J1028: -101.40 | K1028: 5 | L1028: =RC[-3]/100*RC[-1] -> 0.63
A1029: 9 | B1029: _N550000 | C1029: Кобура оперативная ПМ с подсумком | D1029: 13.20 | E1029: Инт | F1029: 1 | G1029: 165.00 | H1029: 0.63 | I1029: 165.00 | J1029: -99.00 | K1029: 5 | L1029: =RC[-3]/100*RC[-1] -> 0.63
A1030: 10 | B1030: _N550300 | C1030: Кобура оперативная Универсальная | D1030: 16.16 | E1030: Инт | F1030: 1 | G1030: 202.00 | H1030: 0.63 | I1030: 202.00 | J1030: -121.20 | K1030: 5 | L1030: =RC[-3]/100*RC[-1] -> 0.63
A1031: 11 | B1031: _N550500 | C1031: Кобура поясная ПМ (скоба) | D1031: 7.68 | E1031: Инт | F1031: 1 | G1031: 96.00 | H1031: 0.63 | I1031: 96.00 | J1031: -57.60 | K1031: 5 | L1031: =RC[-3]/100*RC[-1] -> 0.63
A1032: 12 | B1032: _N21234 | C1032: Кобура поясная ПМ открытая (скоба) | D1032: 5.76 | E1032: Инт | F1032: 1 | G1032: 72.00 | H1032: 0.63 | I1032: 72.00 | J1032: -43.20 | K1032: 5 | L1032: =RC[-3]/100*RC[-1] -> 0.63
A1033: 13 | B1033: _N603000 | C1033: Набор нож, ложка, вилка в чехле | D1033: 4.39 | E1033: Инт | F1033: 12 | G1033: 36.00 | H1033: 0.41 | I1033: 432.00 | J1033: -621.66 | K1033: 5 | L1033: =RC[-3]/100*RC[-1] -> 0.41
A1034: 14 | B1034: NYK-06 | C1034: Нож многофункциональный ||YK-06 | D1034: 5.24 | E1034: Инт | F1034: 12 | G1034: 43.00 | H1034: 0.41 | I1034: 516.00 | J1034: -742.54 | K1034: 5 | L1034: =RC[-3]/100*RC[-1] -> 0.41
A1035: 15 | B1035: _NZ3187 | C1035: Стульчик со спинкой | D1035: 11.60 | E1035: Инт | F1035: 5 | G1035: 145.00 | H1035: 0.63 | I1035: 725.00 | J1035: -435.00 | K1035: 5 | L1035: =RC[-3]/100*RC[-1] -> 0.63 | M1035: =SUM(R[-15]C[-1]:RC[-1]) -> 
A1037: #5138 (2014-06-13) Львів Назар Максимович - Відправлено-Продано
A1038: N | B1038: арт | C1038: назва | D1038: закуп | F1038: к-ть | G1038: цiна | H1038: кф | I1038: продж | J1038: дохiд | K1038: % | L1038: з-та
A1039: 1 | B1039: K12025-M | C1039: Рюкзак 3-Day Assault 30л мультикам ||M51612025-CP | D1039: 17.67 | E1039: usd | F1039: 4 | G1039: 519.00 | H1039: 1.47 | I1039: 1453.20 | J1039: 39.60 | K1039: 5 | L1039: =RC[-3]/100*RC[-1] -> 1.47
A1040: 2 | B1040: П-3-95М | C1040: Бронежилет "Панцирь 3-95М" ТЕМП 3000 2-й класс | D1040: 1600.00 | E1040: zl | F1040: 3 | G1040: 2100.00 | H1040: 0.26 | I1040: 6300.00 | J1040: -17700.00 | K1040: 5 | L1040: =RC[-3]/100*RC[-1] -> 0.26 | M1040: =SUM(R[-2]C[-1]:RC[-1]) -> 
A1042: #5186 (2014-06-16) Львів Назар Максимович - Відправлено-Продано
A1043: N | B1043: арт | C1043: назва | D1043: закуп | F1043: к-ть | G1043: цiна | H1043: кф | I1043: продж | J1043: дохiд | K1043: % | L1043: з-та
A1044: 1 | B1044: П-3-95М | C1044: Бронежилет "Панцирь 3-95М" ТЕМП 3000 2-й класс | D1044: 1600.00 | E1044: zl | F1044: 15 | G1044: 2000.00 | H1044: 0.25 | I1044: 30000.00 | J1044: -90000.00 | K1044: 5 | L1044: =RC[-3]/100*RC[-1] -> 0.25 | M1044: =SUM(R[-1]C[-1]:RC[-1]) -> 
A1046: #5191 (2014-06-16) Львів Назар Максимович - Відправлено-Продано
A1047: N | B1047: арт | C1047: назва | D1047: закуп | F1047: к-ть | G1047: цiна | H1047: кф | I1047: продж | J1047: дохiд | K1047: % | L1047: з-та
A1048: 1 | B1048: H3430/L | C1048: Футболка койот-браун ||TS-TSH-CO-30 | D1048: 4.06 | E1048: usd | F1048: 1 | G1048: 121.00 | H1048: 1.49 | I1048: 84.70 | J1048: 3.55 | K1048: 5 | L1048: =RC[-3]/100*RC[-1] -> 1.49
A1049: 2 | B1049: H3430/XL | C1049: Футболка койот-браун ||TS-TSH-CO-30 | D1049: 4.06 | E1049: usd | F1049: 1 | G1049: 121.00 | H1049: 1.49 | I1049: 84.70 | J1049: 3.55 | K1049: 5 | L1049: =RC[-3]/100*RC[-1] -> 1.49
A1050: 3 | B1050: H7105 | C1050: US BDU кепка 3-х цветный дезерт (R/S) ||CZ-COM-CR-05 | D1050: 2.33 | E1050: usd | F1050: 10 | G1050: 72.00 | H1050: 1.55 | I1050: 504.00 | J1050: 38.00 | K1050: 5 | L1050: =RC[-3]/100*RC[-1] -> 1.55
A1051: 4 | B1051: K17081-M | C1051: Комплект (наколенники и налокотники) мультикам ||M51617081-CP | D1051: 5.07 | E1051: usd | F1051: 2 | G1051: 188.00 | H1051: 1.85 | I1051: 263.20 | J1051: 60.40 | K1051: 5 | L1051: =RC[-3]/100*RC[-1] -> 1.85
A1052: 5 | B1052: H70141/XL | C1052: US GI панама с шейной защитой мультикам (NYCO R/S) ||7 3/4 ||KA-BON-PR-14 | D1052: 4.58 | E1052: usd | F1052: 1 | G1052: 137.00 | H1052: 1.50 | I1052: 95.90 | J1052: 4.30 | K1052: 5 | L1052: =RC[-3]/100*RC[-1] -> 1.50
A1053: 6 | B1053: H70141/L | C1053: US GI панама с шейной защитой мультикам (NYCO R/S) ||7 1/2 ||KA-BON-PR-14 | D1053: 4.58 | E1053: usd | F1053: 1 | G1053: 137.00 | H1053: 1.50 | I1053: 95.90 | J1053: 4.30 | K1053: 5 | L1053: =RC[-3]/100*RC[-1] -> 1.50
A1054: 7 | B1054: H7005/L | C1054: US GI панама с шейной защитой 3-кол.дезерт (R/S) / 7 1/2 ||KA-BON-CR-05 | D1054: 4.06 | E1054: usd | F1054: 1 | G1054: 121.00 | H1054: 1.49 | I1054: 84.70 | J1054: 3.50 | K1054: 5 | L1054: =RC[-3]/100*RC[-1] -> 1.49
A1055: 8 | B1055: H7005/XL | C1055: US GI панама с шейной защитой 3-кол.дезерт (R/S) / 7 3/4 ||KA-BON-CR-05 | D1055: 4.06 | E1055: usd | F1055: 1 | G1055: 121.00 | H1055: 1.49 | I1055: 84.70 | J1055: 3.50 | K1055: 5 | L1055: =RC[-3]/100*RC[-1] -> 1.49
A1056: 9 | B1056: H7003/XL | C1056: US GI панама с шейной защитой вудлэнд (R/S) / 7 3/4 ||KA-BON-CR-03 | D1056: 4.06 | E1056: usd | F1056: 1 | G1056: 121.00 | H1056: 1.49 | I1056: 84.70 | J1056: 3.50 | K1056: 5 | L1056: =RC[-3]/100*RC[-1] -> 1.49
A1057: 10 | B1057: H7003/M | C1057: US GI панама с шейной защитой вудлэнд (R/S) / 7 1/4 ||KA-BON-CR-03 | D1057: 4.06 | E1057: usd | F1057: 1 | G1057: 121.00 | H1057: 1.49 | I1057: 84.70 | J1057: 3.50 | K1057: 5 | L1057: =RC[-3]/100*RC[-1] -> 1.49
A1058: 11 | B1058: H3421/M | C1058: Футболка Foliage Green ||TS-TSH-CO-21 | D1058: 4.06 | E1058: usd | F1058: 1 | G1058: 121.00 | H1058: 1.49 | I1058: 84.70 | J1058: 3.55 | K1058: 5 | L1058: =RC[-3]/100*RC[-1] -> 1.49
A1059: 12 | B1059: H3421/L | C1059: Футболка Foliage Green ||TS-TSH-CO-21 | D1059: 4.06 | E1059: usd | F1059: 1 | G1059: 121.00 | H1059: 1.49 | I1059: 84.70 | J1059: 3.55 | K1059: 5 | L1059: =RC[-3]/100*RC[-1] -> 1.49
A1060: 13 | B1060: H3421/XL | C1060: Футболка Foliage Green ||TS-TSH-CO-21 | D1060: 4.06 | E1060: usd | F1060: 1 | G1060: 121.00 | H1060: 1.49 | I1060: 84.70 | J1060: 3.55 | K1060: 5 | L1060: =RC[-3]/100*RC[-1] -> 1.49
A1061: 14 | B1061: H3421/2XL | C1061: Футболка Foliage Green ||TS-TSH-CO-21 | D1061: 4.06 | E1061: usd | F1061: 1 | G1061: 121.00 | H1061: 1.49 | I1061: 84.70 | J1061: 3.55 | K1061: 5 | L1061: =RC[-3]/100*RC[-1] -> 1.49
A1062: 15 | B1062: H3421/3XL | C1062: Футболка Foliage Green ||TS-TSH-CO-21 | D1062: 4.06 | E1062: usd | F1062: 1 | G1062: 121.00 | H1062: 1.49 | I1062: 84.70 | J1062: 3.55 | K1062: 5 | L1062: =RC[-3]/100*RC[-1] -> 1.49
A1063: 16 | B1063: H3403/XL | C1063: Футболка вудлэнд ||TS-TSH-CO-03 | D1063: 4.06 | E1063: usd | F1063: 1 | G1063: 121.00 | H1063: 1.49 | I1063: 84.70 | J1063: 3.55 | K1063: 5 | L1063: =RC[-3]/100*RC[-1] -> 1.49
A1064: 17 | B1064: H3405/M | C1064: Футболка 3-кол.дезерт ||TS-TSH-CO-05 | D1064: 4.06 | E1064: usd | F1064: 1 | G1064: 121.00 | H1064: 1.49 | I1064: 84.70 | J1064: 3.55 | K1064: 5 | L1064: =RC[-3]/100*RC[-1] -> 1.49
A1065: 18 | B1065: H3405/L | C1065: Футболка 3-кол.дезерт ||TS-TSH-CO-05 | D1065: 4.06 | E1065: usd | F1065: 1 | G1065: 121.00 | H1065: 1.49 | I1065: 84.70 | J1065: 3.55 | K1065: 5 | L1065: =RC[-3]/100*RC[-1] -> 1.49
A1066: 19 | B1066: H3405/XL | C1066: Футболка 3-кол.дезерт ||TS-TSH-CO-05 | D1066: 4.06 | E1066: usd | F1066: 1 | G1066: 121.00 | H1066: 1.49 | I1066: 84.70 | J1066: 3.55 | K1066: 5 | L1066: =RC[-3]/100*RC[-1] -> 1.49
A1067: 20 | B1067: K5-0335-B | C1067: Камелбэк 2.0л чёрный | D1067: 11.07 | E1067: usd | F1067: 1 | G1067: 331.00 | H1067: 1.50 | I1067: 231.70 | J1067: 10.30 | K1067: 5 | L1067: =RC[-3]/100*RC[-1] -> 1.50
A1068: 21 | B1068: X4011 | C1068: Балаклава чёрная с 1-м отв. нинзя(100%хлопок) ||X76011 | D1068: 3.15 | E1068: Инт | F1068: 5 | G1068: 50.00 | H1068: 0.79 | I1068: 175.00 | J1068: -140.00 | K1068: 5 | L1068: =RC[-3]/100*RC[-1] -> 0.79
A1069: 22 | B1069: H8902/130 | C1069: Ремень TOUGH US MARINES олива ||PS-USM-CO-02 | D1069: 3.68 | E1069: usd | F1069: 4 | G1069: 126.00 | H1069: 1.71 | I1069: 352.80 | J1069: 58.40 | K1069: 5 | L1069: =RC[-3]/100*RC[-1] -> 1.71
A1070: 23 | B1070: H8913/130 | C1070: Ремень TOUGH US MARINES койот ||PS-USM-CO-13 | D1070: 3.68 | E1070: usd | F1070: 4 | G1070: 126.00 | H1070: 1.71 | I1070: 352.80 | J1070: 58.40 | K1070: 5 | L1070: =RC[-3]/100*RC[-1] -> 1.71
A1071: 24 | B1071: H9002/130 | C1071: Ремень ARMY BELT олива ||PS-ARM-CO-02 | D1071: 4.23 | E1071: usd | F1071: 4 | G1071: 126.00 | H1071: 1.49 | I1071: 352.80 | J1071: 14.40 | K1071: 5 | L1071: =RC[-3]/100*RC[-1] -> 1.49
A1072: 25 | B1072: H8602/130 | C1072: Ремень TOUGH NAVY SEAL олива ||PS-NAV-CO-01 | D1072: 4.23 | E1072: usd | F1072: 4 | G1072: 126.00 | H1072: 1.49 | I1072: 352.80 | J1072: 14.40 | K1072: 5 | L1072: =RC[-3]/100*RC[-1] -> 1.49 | M1072: =SUM(R[-25]C[-1]:RC[-1]) -> 
A1074: #5200 (2014-06-16) Львів Назар Максимович - Відправлено-Продано
A1075: N | B1075: арт | C1075: назва | D1075: закуп | F1075: к-ть | G1075: цiна | H1075: кф | I1075: продж | J1075: дохiд | K1075: % | L1075: з-та
A1076: 1 | B1076: H3410/3XL | C1076: Футболка ACU ||TS-TSH-CO-10 | D1076: 4.06 | E1076: usd | F1076: 2 | G1076: 121.00 | H1076: 1.49 | I1076: 169.40 | J1076: 7.10 | K1076: 5 | L1076: =RC[-3]/100*RC[-1] -> 1.49
A1077: 2 | B1077: K13166-F | C1077: Кобура набедренная многовункционал. флектарн ||M51613166-GF | D1077: 8.62 | E1077: usd | F1077: 1 | G1077: 258.00 | H1077: 1.50 | I1077: 180.60 | J1077: 8.20 | K1077: 5 | L1077: =RC[-3]/100*RC[-1] -> 1.50
A1078: 3 | B1078: K17074-O | C1078: Комплект (наколенники и налокотники) олива ||M51617074-OD | D1078: 9.00 | E1078: usd | F1078: 1 | G1078: 293.00 | H1078: 1.63 | I1078: 205.10 | J1078: 25.10 | K1078: 5 | L1078: =RC[-3]/100*RC[-1] -> 1.63
A1079: 4 | B1079: K12026-O | C1079: Рюкзак под камелбек 20л олива ||M51612026-OD | D1079: 15.65 | E1079: usd | F1079: 1 | G1079: 456.00 | H1079: 1.46 | I1079: 319.20 | J1079: 6.20 | K1079: 5 | L1079: =RC[-3]/100*RC[-1] -> 1.46 | M1079: =SUM(R[-4]C[-1]:RC[-1]) -> 
A1081: #5260 (2014-06-17) Львів Назар Максимович - Відправлено-Продано
A1082: N | B1082: арт | C1082: назва | D1082: закуп | F1082: к-ть | G1082: цiна | H1082: кф | I1082: продж | J1082: дохiд | K1082: % | L1082: з-та
A1083: 1 | B1083: H1002 | C1083: Спальний мешок M.I.S.H. 2 (кокон) ||SR-MH2-NL-02 | D1083: 32.95 | E1083: usd | F1083: 1 | G1083: 857.00 | H1083: 1.30 | I1083: 599.90 | J1083: -59.10 | K1083: 5 | L1083: =RC[-3]/100*RC[-1] -> 1.30
A1084: 2 | B1084: H0240 | C1084: Сумка на ремне 38x29x19cm A-TACS® AU ||TB-WBT-CD-40 | D1084: 25.00 | E1084: usd | F1084: 1 | G1084: 718.00 | H1084: 1.44 | I1084: 502.60 | J1084: 2.60 | K1084: 5 | L1084: =RC[-3]/100*RC[-1] -> 1.44 | M1084: =SUM(R[-2]C[-1]:RC[-1]) -> 
A1086: #5386 (2014-06-20) Львів Назар Максимович - Відправлено-Продано
A1087: N | B1087: арт | C1087: назва | D1087: закуп | F1087: к-ть | G1087: цiна | H1087: кф | I1087: продж | J1087: дохiд | K1087: % | L1087: з-та
A1088: 1 | B1088: H7211 | C1088: US BDU кепка койот (NYCO R/S) ||CZ-COM-NR-11 | D1088: 2.33 | E1088: usd | F1088: 3 | G1088: 72.00 | H1088: 1.55 | I1088: 151.20 | J1088: 11.40 | K1088: 5 | L1088: =RC[-3]/100*RC[-1] -> 1.55
A1089: 2 | B1089: H7104 | C1089: US BDU кепка польский вудлэнд ( PolyCotton Ripstop) ||CZ-COM-PR-04 | D1089: 2.33 | E1089: usd | F1089: 4 | G1089: 72.00 | H1089: 1.55 | I1089: 201.60 | J1089: 15.20 | K1089: 5 | L1089: =RC[-3]/100*RC[-1] -> 1.55
A1090: 3 | B1090: H7005/L | C1090: US GI панама с шейной защитой 3-кол.дезерт (R/S) / 7 1/2 ||KA-BON-CR-05 | D1090: 4.06 | E1090: usd | F1090: 1 | G1090: 121.00 | H1090: 1.49 | I1090: 84.70 | J1090: 3.50 | K1090: 5 | L1090: =RC[-3]/100*RC[-1] -> 1.49
A1091: 4 | B1091: H7005/XL | C1091: US GI панама с шейной защитой 3-кол.дезерт (R/S) / 7 3/4 ||KA-BON-CR-05 | D1091: 4.06 | E1091: usd | F1091: 1 | G1091: 121.00 | H1091: 1.49 | I1091: 84.70 | J1091: 3.50 | K1091: 5 | L1091: =RC[-3]/100*RC[-1] -> 1.49
A1092: 5 | B1092: H7003/L | C1092: US GI панама с шейной защитой вудлэнд (R/S) / 7 1/2 ||KA-BON-CR-03 | D1092: 4.06 | E1092: usd | F1092: 2 | G1092: 121.00 | H1092: 1.49 | I1092: 169.40 | J1092: 7.00 | K1092: 5 | L1092: =RC[-3]/100*RC[-1] -> 1.49
A1093: 6 | B1093: H7003/XL | C1093: US GI панама с шейной защитой вудлэнд (R/S) / 7 3/4 ||KA-BON-CR-03 | D1093: 4.06 | E1093: usd | F1093: 2 | G1093: 121.00 | H1093: 1.49 | I1093: 169.40 | J1093: 7.00 | K1093: 5 | L1093: =RC[-3]/100*RC[-1] -> 1.49
A1094: 7 | B1094: H70141/L | C1094: US GI панама с шейной защитой мультикам (NYCO R/S) ||7 1/2 ||KA-BON-PR-14 | D1094: 4.58 | E1094: usd | F1094: 2 | G1094: 137.00 | H1094: 1.50 | I1094: 191.80 | J1094: 8.60 | K1094: 5 | L1094: =RC[-3]/100*RC[-1] -> 1.50
A1095: 8 | B1095: H70141/XL | C1095: US GI панама с шейной защитой мультикам (NYCO R/S) ||7 3/4 ||KA-BON-PR-14 | D1095: 4.58 | E1095: usd | F1095: 2 | G1095: 137.00 | H1095: 1.50 | I1095: 191.80 | J1095: 8.60 | K1095: 5 | L1095: =RC[-3]/100*RC[-1] -> 1.50
A1096: 9 | B1096: H7002/L | C1096: US GI панама с шейной защитой олива (R/S) / 7 1/2 ||KA-BON-CR-02 | D1096: 4.06 | E1096: usd | F1096: 1 | G1096: 121.00 | H1096: 1.49 | I1096: 84.70 | J1096: 3.50 | K1096: 5 | L1096: =RC[-3]/100*RC[-1] -> 1.49
A1097: 10 | B1097: H7002/XL | C1097: US GI панама с шейной защитой олива (R/S) / 7 3/4 ||KA-BON-CR-02 | D1097: 4.06 | E1097: usd | F1097: 1 | G1097: 121.00 | H1097: 1.49 | I1097: 84.70 | J1097: 3.50 | K1097: 5 | L1097: =RC[-3]/100*RC[-1] -> 1.49
A1098: 11 | B1098: H8602/130 | C1098: Ремень TOUGH NAVY SEAL олива ||PS-NAV-CO-01 | D1098: 4.23 | E1098: usd | F1098: 3 | G1098: 126.00 | H1098: 1.49 | I1098: 264.60 | J1098: 10.80 | K1098: 5 | L1098: =RC[-3]/100*RC[-1] -> 1.49
A1099: 12 | B1099: H8913/130 | C1099: Ремень TOUGH US MARINES койот ||PS-USM-CO-13 | D1099: 3.68 | E1099: usd | F1099: 2 | G1099: 126.00 | H1099: 1.71 | I1099: 176.40 | J1099: 29.20 | K1099: 5 | L1099: =RC[-3]/100*RC[-1] -> 1.71
A1100: 13 | B1100: H3405/3XL | C1100: Футболка 3-кол.дезерт ||TS-TSH-CO-05 | D1100: 4.06 | E1100: usd | F1100: 1 | G1100: 121.00 | H1100: 1.49 | I1100: 84.70 | J1100: 3.55 | K1100: 5 | L1100: =RC[-3]/100*RC[-1] -> 1.49
A1101: 14 | B1101: H3405/L | C1101: Футболка 3-кол.дезерт ||TS-TSH-CO-05 | D1101: 4.06 | E1101: usd | F1101: 1 | G1101: 121.00 | H1101: 1.49 | I1101: 84.70 | J1101: 3.55 | K1101: 5 | L1101: =RC[-3]/100*RC[-1] -> 1.49
A1102: 15 | B1102: H3405/M | C1102: Футболка 3-кол.дезерт ||TS-TSH-CO-05 | D1102: 4.06 | E1102: usd | F1102: 1 | G1102: 121.00 | H1102: 1.49 | I1102: 84.70 | J1102: 3.55 | K1102: 5 | L1102: =RC[-3]/100*RC[-1] -> 1.49
A1103: 16 | B1103: H3405/S | C1103: Футболка 3-кол.дезерт ||TS-TSH-CO-05 | D1103: 4.06 | E1103: usd | F1103: 1 | G1103: 121.00 | H1103: 1.49 | I1103: 84.70 | J1103: 3.55 | K1103: 5 | L1103: =RC[-3]/100*RC[-1] -> 1.49
A1104: 17 | B1104: H3405/XL | C1104: Футболка 3-кол.дезерт ||TS-TSH-CO-05 | D1104: 4.06 | E1104: usd | F1104: 1 | G1104: 121.00 | H1104: 1.49 | I1104: 84.70 | J1104: 3.55 | K1104: 5 | L1104: =RC[-3]/100*RC[-1] -> 1.49
A1105: 18 | B1105: H3410/2XL | C1105: Футболка ACU ||TS-TSH-CO-10 | D1105: 4.06 | E1105: usd | F1105: 1 | G1105: 121.00 | H1105: 1.49 | I1105: 84.70 | J1105: 3.55 | K1105: 5 | L1105: =RC[-3]/100*RC[-1] -> 1.49
A1106: 19 | B1106: H3410/3XL | C1106: Футболка ACU ||TS-TSH-CO-10 | D1106: 4.06 | E1106: usd | F1106: 1 | G1106: 121.00 | H1106: 1.49 | I1106: 84.70 | J1106: 3.55 | K1106: 5 | L1106: =RC[-3]/100*RC[-1] -> 1.49
A1107: 20 | B1107: H3410/L | C1107: Футболка ACU ||TS-TSH-CO-10 | D1107: 4.06 | E1107: usd | F1107: 1 | G1107: 121.00 | H1107: 1.49 | I1107: 84.70 | J1107: 3.55 | K1107: 5 | L1107: =RC[-3]/100*RC[-1] -> 1.49
A1108: 21 | B1108: H3410/M | C1108: Футболка ACU ||TS-TSH-CO-10 | D1108: 4.06 | E1108: usd | F1108: 1 | G1108: 121.00 | H1108: 1.49 | I1108: 84.70 | J1108: 3.55 | K1108: 5 | L1108: =RC[-3]/100*RC[-1] -> 1.49
A1109: 22 | B1109: H3410/S | C1109: Футболка ACU ||TS-TSH-CO-10 | D1109: 4.06 | E1109: usd | F1109: 1 | G1109: 121.00 | H1109: 1.49 | I1109: 84.70 | J1109: 3.55 | K1109: 5 | L1109: =RC[-3]/100*RC[-1] -> 1.49
A1110: 23 | B1110: H3410/XL | C1110: Футболка ACU ||TS-TSH-CO-10 | D1110: 4.06 | E1110: usd | F1110: 1 | G1110: 121.00 | H1110: 1.49 | I1110: 84.70 | J1110: 3.55 | K1110: 5 | L1110: =RC[-3]/100*RC[-1] -> 1.49
A1111: 24 | B1111: H3403/S | C1111: Футболка вудлэнд ||TS-TSH-CO-03 | D1111: 4.06 | E1111: usd | F1111: 1 | G1111: 121.00 | H1111: 1.49 | I1111: 84.70 | J1111: 3.55 | K1111: 5 | L1111: =RC[-3]/100*RC[-1] -> 1.49
A1112: 25 | B1112: H3403/XL | C1112: Футболка вудлэнд ||TS-TSH-CO-03 | D1112: 4.06 | E1112: usd | F1112: 1 | G1112: 121.00 | H1112: 1.49 | I1112: 84.70 | J1112: 3.55 | K1112: 5 | L1112: =RC[-3]/100*RC[-1] -> 1.49 | M1112: =SUM(R[-25]C[-1]:RC[-1]) -> 
A1114: #5474 (2014-06-22) Львів Назар Максимович - Відправлено-Продано
A1115: N | B1115: арт | C1115: назва | D1115: закуп | F1115: к-ть | G1115: цiна | H1115: кф | I1115: продж | J1115: дохiд | K1115: % | L1115: з-та
A1116: 1 | B1116: Брон | C1116: Бронепластина 4-й класс | D1116: 70.00 | E1116: usd | F1116: 2 | G1116: 1200.00 | H1116: 0.86 | I1116: 2200.00 | J1116: -600.00 | K1116: 5 | L1116: =RC[-3]/100*RC[-1] -> 0.86
A1117: 2 | B1117: _M860-2 | C1117: Нож MORAKNIV® Companion MG Stainless ||NZ-860-ST-02 | D1117: 6.94 | E1117: usd | F1117: 20 | G1117: 100.00 | H1117: 0.72 | I1117: 2000.00 | J1117: -776.56 | K1117: 5 | L1117: =RC[-3]/100*RC[-1] -> 0.72
A1118: 3 | B1118: K11007-AT | C1118: Розгруз. AAV FSBE Atacs [A.C.M] ||M51611007-ATACS | D1118: 30.00 | E1118: usd | F1118: 1 | G1118: 600.00 | H1118: 1.00 | I1118: 600.00 | J1118: 0.00 | K1118: 5 | L1118: =RC[-3]/100*RC[-1] -> 1.00
A1119: 4 | B1119: K11005-B | C1119: Розгрузочна система тактическая STRIKE с подсумками чёрный ||M51611005-BK | D1119: 18.19 | E1119: usd | F1119: 1 | G1119: 610.00 | H1119: 1.68 | I1119: 427.00 | J1119: 63.20 | K1119: 5 | L1119: =RC[-3]/100*RC[-1] -> 1.68 | M1119: =SUM(R[-4]C[-1]:RC[-1]) -> 
A1121: #5475 (2014-06-22) Львів Назар Максимович - Відправлено-Продано
A1122: N | B1122: арт | C1122: назва | D1122: закуп | F1122: к-ть | G1122: цiна | H1122: кф | I1122: продж | J1122: дохiд | K1122: % | L1122: з-та
A1123: 1 | B1123: H7109 | C1123: US BDU кепка мэтро ( PolyCotton Ripstop) ||CZ-COM-PR-09 | D1123: 2.33 | E1123: usd | F1123: 5 | G1123: 72.00 | H1123: 1.55 | I1123: 252.00 | J1123: 19.00 | K1123: 5 | L1123: =RC[-3]/100*RC[-1] -> 1.55
A1124: 2 | B1124: H7232 | C1124: US BDU кепка олива драп ( PolyCotton Ripstop) ||CZ-COM-NR-32 | D1124: 2.33 | E1124: usd | F1124: 5 | G1124: 72.00 | H1124: 1.55 | I1124: 252.00 | J1124: 19.00 | K1124: 5 | L1124: =RC[-3]/100*RC[-1] -> 1.55
A1125: 3 | B1125: H7104 | C1125: US BDU кепка польский вудлэнд ( PolyCotton Ripstop) ||CZ-COM-PR-04 | D1125: 2.33 | E1125: usd | F1125: 5 | G1125: 72.00 | H1125: 1.55 | I1125: 252.00 | J1125: 19.00 | K1125: 5 | L1125: =RC[-3]/100*RC[-1] -> 1.55
A1126: 4 | B1126: H7106 | C1126: US BDU кепка польский дезерт (R/S) ||CZ-COM-CR-06 | D1126: 2.33 | E1126: usd | F1126: 5 | G1126: 72.00 | H1126: 1.55 | I1126: 252.00 | J1126: 19.00 | K1126: 5 | L1126: =RC[-3]/100*RC[-1] -> 1.55
A1127: 5 | B1127: H7201 | C1127: US BDU кепка чёрная ( PolyCotton Ripstop) ||CZ-COM-NR-01 | D1127: 2.33 | E1127: usd | F1127: 5 | G1127: 72.00 | H1127: 1.55 | I1127: 252.00 | J1127: 19.00 | K1127: 5 | L1127: =RC[-3]/100*RC[-1] -> 1.55
A1128: 6 | B1128: H26021/L | C1128: Куртка PATRIOT флисовая олива 390г/м (superfine) ||BL-PAT-HF-02 | D1128: 27.00 | E1128: usd | F1128: 2 | G1128: 840.00 | H1128: 1.56 | I1128: 1176.00 | J1128: 96.00 | K1128: 5 | L1128: =RC[-3]/100*RC[-1] -> 1.56
A1129: 7 | B1129: H26021/M | C1129: Куртка PATRIOT флисовая олива 390г/м (superfine) ||BL-PAT-HF-02 | D1129: 27.00 | E1129: usd | F1129: 2 | G1129: 840.00 | H1129: 1.56 | I1129: 1176.00 | J1129: 96.00 | K1129: 5 | L1129: =RC[-3]/100*RC[-1] -> 1.56
A1130: 8 | B1130: K12025-С | C1130: Рюкзак 3-Day Assault 30л койот ||M51612025-TAN | D1130: 17.67 | E1130: usd | F1130: 1 | G1130: 519.00 | H1130: 1.47 | I1130: 363.30 | J1130: 9.90 | K1130: 5 | L1130: =RC[-3]/100*RC[-1] -> 1.47
A1131: 9 | B1131: K12025-M | C1131: Рюкзак 3-Day Assault 30л мультикам ||M51612025-CP | D1131: 17.67 | E1131: usd | F1131: 1 | G1131: 519.00 | H1131: 1.47 | I1131: 363.30 | J1131: 9.90 | K1131: 5 | L1131: =RC[-3]/100*RC[-1] -> 1.47
A1132: 10 | B1132: _M860-2 | C1132: Нож MORAKNIV® Companion MG Stainless ||NZ-860-ST-02 | D1132: 6.94 | E1132: usd | F1132: 15 | G1132: 110.00 | H1132: 0.79 | I1132: 1650.00 | J1132: -432.42 | K1132: 5 | L1132: =RC[-3]/100*RC[-1] -> 0.79 | M1132: =SUM(R[-10]C[-1]:RC[-1]) -> 
A1134: #5495 (2014-06-24) Львів Назар Максимович - Прихід товару
A1135: N | B1135: арт | C1135: назва | D1135: закуп | F1135: к-ть | G1135: цiна | H1135: кф | I1135: продж | J1135: дохiд | K1135: % | L1135: з-та
A1136: 1 | B1136: _B-004TN | C1136: Винтовка пневматическая BENJAMIN Titan NP прицел 4x32 | D1136: 179.86 | E1136: Инт | F1136: 2 | G1136: 2518.00 | H1136: 0.70 | I1136: 5036.00 | J1136: -2158.28 | K1136: 5 | L1136: =RC[-3]/100*RC[-1] -> 0.70
A1137: 2 | B1137: _116-1340 | C1137: Винтовка пневматическая Beeman Bear Claw X2 прицел 3-9X32 | D1137: 151.43 | E1137: Инт | F1137: 2 | G1137: 2120.00 | H1137: 0.70 | I1137: 4240.00 | J1137: -1817.16 | K1137: 5 | L1137: =RC[-3]/100*RC[-1] -> 0.70
A1138: 3 | B1138: _116-1340-1 | C1138: Винтовка пневматическая Beeman Bear Claw прицел 3-9X32 | D1138: 153.43 | E1138: Инт | F1138: 2 | G1138: 2148.00 | H1138: 0.70 | I1138: 4296.00 | J1138: -1841.16 | K1138: 5 | L1138: =RC[-3]/100*RC[-1] -> 0.70
A1139: 4 | B1139: _116-1320 | C1139: Винтовка пневматическая Beeman Crizzly X2 прицел 4X32 | D1139: 143.86 | E1139: Инт | F1139: 2 | G1139: 2014.00 | H1139: 0.70 | I1139: 4028.00 | J1139: -1726.28 | K1139: 5 | L1139: =RC[-3]/100*RC[-1] -> 0.70
A1140: 5 | B1140: _116-1310 | C1140: Винтовка пневматическая Beeman Elkhorn прицел 3-9X32 | D1140: 158.14 | E1140: Инт | F1140: 2 | G1140: 2214.00 | H1140: 0.70 | I1140: 4428.00 | J1140: -1897.72 | K1140: 5 | L1140: =RC[-3]/100*RC[-1] -> 0.70
A1141: 6 | B1141: _116-1330 | C1141: Винтовка пневматическая Beeman Kodiak X2 прицел 4X32 | D1141: 118.36 | E1141: Инт | F1141: 2 | G1141: 1657.00 | H1141: 0.70 | I1141: 3314.00 | J1141: -1420.28 | K1141: 5 | L1141: =RC[-3]/100*RC[-1] -> 0.70
A1142: 7 | B1142: _116-1345 | C1142: Винтовка пневматическая Beeman Mach 12.5 прицел 3-9X40 | D1142: 181.79 | E1142: Инт | F1142: 3 | G1142: 2545.00 | H1142: 0.70 | I1142: 7635.00 | J1142: -3272.16 | K1142: 5 | L1142: =RC[-3]/100*RC[-1] -> 0.70
A1143: 8 | B1143: _116-1325 | C1143: Винтовка пневматическая Beeman Silver Kodiak X2 прицел 4X32 | D1143: 126.93 | E1143: Инт | F1143: 2 | G1143: 1777.00 | H1143: 0.70 | I1143: 3554.00 | J1143: -1523.16 | K1143: 5 | L1143: =RC[-3]/100*RC[-1] -> 0.70
A1144: 9 | B1144: _116-1305 | C1144: Винтовка пневматическая Beeman Teton | D1144: 102.21 | E1144: Инт | F1144: 2 | G1144: 1431.00 | H1144: 0.70 | I1144: 2862.00 | J1144: -1226.56 | K1144: 5 | L1144: =RC[-3]/100*RC[-1] -> 0.70
A1145: 10 | B1145: _116-13051 | C1145: Винтовка пневматическая Beeman Teton прицел 4X32 | D1145: 126.07 | E1145: Инт | F1145: 2 | G1145: 1765.00 | H1145: 0.70 | I1145: 3530.00 | J1145: -1512.84 | K1145: 5 | L1145: =RC[-3]/100*RC[-1] -> 0.70
A1146: 11 | B1146: _116-1315 | C1146: Винтовка пневматическая Beeman Wolwerine | D1146: 87.07 | E1146: Инт | F1146: 3 | G1146: 1219.00 | H1146: 0.70 | I1146: 3657.00 | J1146: -1567.28 | K1146: 5 | L1146: =RC[-3]/100*RC[-1] -> 0.70
A1147: 12 | B1147: _CF1K77X | C1147: Винтовка пневматическая Crosman (RM) Fury прицел 4x32 | D1147: 89.93 | E1147: Инт | F1147: 2 | G1147: 1259.00 | H1147: 0.70 | I1147: 2518.00 | J1147: -1079.14 | K1147: 5 | L1147: =RC[-3]/100*RC[-1] -> 0.70
A1148: 13 | B1148: _MTR77 | C1148: Винтовка пневматическая Crosman MTR 77 | D1148: 104.14 | E1148: Инт | F1148: 3 | G1148: 1458.00 | H1148: 0.70 | I1148: 4374.00 | J1148: -1874.58 | K1148: 5 | L1148: =RC[-3]/100*RC[-1] -> 0.70
A1149: 14 | B1149: _TR77 | C1149: Винтовка пневматическая Crosman TR77 прицел 4x32 | D1149: 104.14 | E1149: Инт | F1149: 2 | G1149: 1458.00 | H1149: 0.70 | I1149: 2916.00 | J1149: -1249.72 | K1149: 5 | L1149: =RC[-3]/100*RC[-1] -> 0.70
A1150: 15 | B1150: _TR77NPS | C1150: Винтовка пневматическая Crosman TR77NPS прицел 4x32 | D1150: 137.21 | E1150: Инт | F1150: 2 | G1150: 1921.00 | H1150: 0.70 | I1150: 3842.00 | J1150: -1646.56 | K1150: 5 | L1150: =RC[-3]/100*RC[-1] -> 0.70
A1151: 16 | B1151: _X-1000-E | C1151: Винтовка пневматическая HATSAN Striker Edge | D1151: 80.43 | E1151: Инт | F1151: 2 | G1151: 1126.00 | H1151: 0.70 | I1151: 2252.00 | J1151: -965.14 | K1151: 5 | L1151: =RC[-3]/100*RC[-1] -> 0.70
A1152: 17 | B1152: _X-125 | C1152: Винтовка пневматическая HATSAN-125 | D1152: 170.86 | E1152: Инт | F1152: 3 | G1152: 1988.00 | H1152: 0.58 | I1152: 5964.00 | J1152: -4287.42 | K1152: 5 | L1152: =RC[-3]/100*RC[-1] -> 0.58
A1153: 18 | B1153: _X-125TH | C1153: Винтовка пневматическая HATSAN-125TH | D1153: 170.86 | E1153: Инт | F1153: 1 | G1153: 1988.00 | H1153: 0.58 | I1153: 1988.00 | J1153: -1429.14 | K1153: 5 | L1153: =RC[-3]/100*RC[-1] -> 0.58
A1154: 19 | B1154: _95BBUSS | C1154: Нож COLD STEEL Bowie Bushman | D1154: 29.50 | E1154: Инт | F1154: 2 | G1154: 391.00 | H1154: 0.66 | I1154: 782.00 | J1154: -398.00 | K1154: 5 | L1154: =RC[-3]/100*RC[-1] -> 0.66
A1155: 20 | B1155: _26AST | C1155: Нож COLD STEEL Ti-Lite 4" Aluminum | D1155: 85.00 | E1155: Инт | F1155: 1 | G1155: 1127.00 | H1155: 0.66 | I1155: 1127.00 | J1155: -573.00 | K1155: 5 | L1155: =RC[-3]/100*RC[-1] -> 0.66
A1156: 21 | B1156: _43LS | C1156: Нож COLD STEEL Urban Pal | D1156: 26.00 | E1156: Инт | F1156: 1 | G1156: 345.00 | H1156: 0.66 | I1156: 241.50 | J1156: -278.50 | K1156: 5 | L1156: =RC[-3]/100*RC[-1] -> 0.66
A1157: 22 | B1157: _1670S30V | C1157: Нож KERSHAW Blur, Aluminium Handle S30V | D1157: 82.00 | E1157: usd | F1157: 1 | G1157: 1140.00 | H1157: 0.70 | I1157: 1140.00 | J1157: -500.00 | K1157: 5 | L1157: =RC[-3]/100*RC[-1] -> 0.70
A1158: 23 | B1158: _1670BLK | C1158: Нож KERSHAW Blur, Black Aluminium Sandvick | D1158: 102.75 | E1158: usd | F1158: 1 | G1158: 822.00 | H1158: 0.40 | I1158: 822.00 | J1158: -1233.00 | K1158: 5 | L1158: =RC[-3]/100*RC[-1] -> 0.40
A1159: 24 | B1159: _3410 | C1159: Нож KERSHAW Chill (8CR13MOV, plain) | D1159: 28.00 | E1159: Инт | F1159: 1 | G1159: 312.00 | H1159: 0.56 | I1159: 312.00 | J1159: -248.00 | K1159: 5 | L1159: =RC[-3]/100*RC[-1] -> 0.56
A1160: 25 | B1160: _1530 | C1160: Нож KERSHAW G-10 Hawk (8CR13MOV) | D1160: 32.38 | E1160: Инт | F1160: 1 | G1160: 259.00 | H1160: 0.40 | I1160: 259.00 | J1160: -388.50 | K1160: 5 | L1160: =RC[-3]/100*RC[-1] -> 0.40
A1161: 26 | B1161: _1660CB | C1161: Нож KERSHAW Leek Composite Blade (Sandvik 14C28N+CPM-D2) | D1161: 74.00 | E1161: Инт | F1161: 1 | G1161: 1034.00 | H1161: 0.70 | I1161: 1034.00 | J1161: -446.00 | K1161: 5 | L1161: =RC[-3]/100*RC[-1] -> 0.70
A1162: 27 | B1162: _K3420 | C1162: Нож KERSHAW Nerve (8CR13MOV) | D1162: 43.00 | E1162: Инт | F1162: 1 | G1162: 344.00 | H1162: 0.40 | I1162: 344.00 | J1162: -516.00 | K1162: 5 | L1162: =RC[-3]/100*RC[-1] -> 0.40
A1163: 28 | B1163: _1830 | C1163: Нож KERSHAW Oso Sweet 1830 | D1163: 26.00 | E1163: Инт | F1163: 1 | G1163: 352.00 | H1163: 0.68 | I1163: 352.00 | J1163: -168.00 | K1163: 5 | L1163: =RC[-3]/100*RC[-1] -> 0.68
A1164: 29 | B1164: _1760 | C1164: Нож KERSHAW Skyline (Sandvik 14C28N) | D1164: 44.50 | E1164: Инт | F1164: 1 | G1164: 623.00 | H1164: 0.70 | I1164: 623.00 | J1164: -267.00 | K1164: 5 | L1164: =RC[-3]/100*RC[-1] -> 0.70
A1165: 30 | B1165: _1790 | C1165: Нож KERSHAW Turbulence (Sandvik 14C28N) | D1165: 63.00 | E1165: Инт | F1165: 1 | G1165: 888.00 | H1165: 0.70 | I1165: 888.00 | J1165: -372.00 | K1165: 5 | L1165: =RC[-3]/100*RC[-1] -> 0.70
A1166: 31 | B1166: _1735 | C1166: Нож KERSHAW Zing | D1166: 58.00 | E1166: Инт | F1166: 1 | G1166: 835.00 | H1166: 0.72 | I1166: 835.00 | J1166: -325.00 | K1166: 5 | L1166: =RC[-3]/100*RC[-1] -> 0.72
A1167: 32 | B1167: _MC-0012 | C1167: Нож MCUSTA Basic | D1167: 116.00 | E1167: Инт | F1167: 1 | G1167: 1392.00 | H1167: 0.60 | I1167: 1392.00 | J1167: -928.00 | K1167: 5 | L1167: =RC[-3]/100*RC[-1] -> 0.60
A1168: 33 | B1168: _MC-0171D | C1168: Нож MCUSTA Jazz Damasscus [MC-0171D] | D1168: 241.92 | E1168: usd | F1168: 1 | G1168: 2903.00 | H1168: 0.60 | I1168: 2903.00 | J1168: -1935.34 | K1168: 5 | L1168: =RC[-3]/100*RC[-1] -> 0.60
A1169: 34 | B1169: _MC-0022 | C1169: Нож MCUSTA MC-0022 | D1169: 125.92 | E1169: usd | F1169: 1 | G1169: 1511.00 | H1169: 0.60 | I1169: 1511.00 | J1169: -1007.34 | K1169: 5 | L1169: =RC[-3]/100*RC[-1] -> 0.60
A1170: 35 | B1170: _12GS | C1170: Нож SPYDERCO Civilian | D1170: 176.00 | E1170: Инт | F1170: 1 | G1170: 2333.00 | H1170: 0.66 | I1170: 2333.00 | J1170: -1187.00 | K1170: 5 | L1170: =RC[-3]/100*RC[-1] -> 0.66
A1171: 36 | B1171: _10FPOR | C1171: Нож SPYDERCO Endura Orange | D1171: 67.00 | E1171: Инт | F1171: 1 | G1171: 888.00 | H1171: 0.66 | I1171: 888.00 | J1171: -452.00 | K1171: 5 | L1171: =RC[-3]/100*RC[-1] -> 0.66
A1172: 37 | B1172: _10PBK | C1172: Нож SPYDERCO Endura Plain FRN | D1172: 73.00 | E1172: Инт | F1172: 1 | G1172: 968.00 | H1172: 0.66 | I1172: 968.00 | J1172: -492.00 | K1172: 5 | L1172: =RC[-3]/100*RC[-1] -> 0.66
A1173: 38 | B1173: _08S | C1173: Нож SPYDERCO Harpy, Stainless Handle, Full Serrated Edge | D1173: 89.00 | E1173: Инт | F1173: 1 | G1173: 1180.00 | H1173: 0.66 | I1173: 1180.00 | J1173: -600.00 | K1173: 5 | L1173: =RC[-3]/100*RC[-1] -> 0.66
A1174: 39 | B1174: _142GP | C1174: Нож SPYDERCO Resilience, G-10 | D1174: 57.00 | E1174: Инт | F1174: 1 | G1174: 756.00 | H1174: 0.66 | I1174: 756.00 | J1174: -384.00 | K1174: 5 | L1174: =RC[-3]/100*RC[-1] -> 0.66
A1175: 40 | B1175: _122GP | C1175: Нож SPYDERCO Tenacious | D1175: 41.50 | E1175: Инт | F1175: 3 | G1175: 550.00 | H1175: 0.66 | I1175: 1650.00 | J1175: -840.00 | K1175: 5 | L1175: =RC[-3]/100*RC[-1] -> 0.66
A1176: 41 | B1176: _122GBBKP | C1176: Нож SPYDERCO Tenacious G-10 Black Blade | D1176: 590.00 | E1176: грн | F1176: 3 | G1176: 590.00 | H1176: 1.00 | I1176: 1770.00 | J1176: 0.00 | K1176: 5 | L1176: =RC[-3]/100*RC[-1] -> 1.00
A1177: 42 | B1177: _122GPS | C1177: Нож SPYDERCO Tenacious полусеррейтор | D1177: 41.50 | E1177: Инт | F1177: 1 | G1177: 550.00 | H1177: 0.66 | I1177: 550.00 | J1177: -280.00 | K1177: 5 | L1177: =RC[-3]/100*RC[-1] -> 0.66
A1178: 43 | B1178: _65CFP | C1178: Нож Spyderco Chinese Folder, Carbon, VG-10 | D1178: 98.00 | E1178: Инт | F1178: 1 | G1178: 1299.00 | H1178: 0.66 | I1178: 1299.00 | J1178: -661.00 | K1178: 5 | L1178: =RC[-3]/100*RC[-1] -> 0.66
A1179: 44 | B1179: _12SBK2W | C1179: Нож Spyderco MATRIARCH 2 Emerson Open Serr FRN | D1179: 89.00 | E1179: Инт | F1179: 1 | G1179: 1180.00 | H1179: 0.66 | I1179: 1180.00 | J1179: -600.00 | K1179: 5 | L1179: =RC[-3]/100*RC[-1] -> 0.66
A1180: 45 | B1180: _12SBK2 | C1180: Нож Spyderco Matriarch 2, FRN, VG-10 | D1180: 86.00 | E1180: Инт | F1180: 1 | G1180: 1140.00 | H1180: 0.66 | I1180: 1140.00 | J1180: -580.00 | K1180: 5 | L1180: =RC[-3]/100*RC[-1] -> 0.66
A1181: 46 | B1181: _81GPBK2 | C1181: Нож Spyderco Para-Military 2, S30V, Black Blade | D1181: 1803.00 | E1181: грн | F1181: 1 | G1181: 1803.00 | H1181: 1.00 | I1181: 1803.00 | J1181: 0.00 | K1181: 5 | L1181: =RC[-3]/100*RC[-1] -> 1.00
A1182: 47 | B1182: _81GPCMOBK | C1182: Нож Spyderco Para-Military 2, S30V, Camo, Black Blade | D1182: 1803.00 | E1182: грн | F1182: 1 | G1182: 1803.00 | H1182: 1.00 | I1182: 1803.00 | J1182: 0.00 | K1182: 5 | L1182: =RC[-3]/100*RC[-1] -> 1.00
A1183: 48 | B1183: _122GBBKPS | C1183: Нож Spyderco Tenacious, G-10 Black Blade, полусеррейтор | D1183: 556.00 | E1183: грн | F1183: 2 | G1183: 556.00 | H1183: 1.00 | I1183: 1112.00 | J1183: 0.00 | K1183: 5 | L1183: =RC[-3]/100*RC[-1] -> 1.00
A1184: 49 | B1184: _149GP | C1184: Нож Spyderco Valloton Sub-Hilt, S30V | D1184: 196.00 | E1184: Инт | F1184: 1 | G1184: 2598.00 | H1184: 0.66 | I1184: 2598.00 | J1184: -1322.00 | K1184: 5 | L1184: =RC[-3]/100*RC[-1] -> 0.66
A1185: 50 | B1185: _K0770 | C1185: Нож ZT Folder Assist | D1185: 233.63 | E1185: Инт | F1185: 1 | G1185: 1869.00 | H1185: 0.40 | I1185: 1869.00 | J1185: -2803.50 | K1185: 5 | L1185: =RC[-3]/100*RC[-1] -> 0.40
A1186: 51 | B1186: _1725CB | C1186: Нож KERSHAW Junkyard Dog II Composite Sandvik 13C26+CPM-D2 | D1186: 85.00 | E1186: Инт | F1186: 1 | G1186: 1180.00 | H1186: 0.69 | I1186: 1180.00 | J1186: -520.00 | K1186: 5 | L1186: =RC[-3]/100*RC[-1] -> 0.69
A1187: 52 | B1187: _KWC-07U | C1187: Пистолет пневматический KWC UZI с сумкой | D1187: 104.14 | E1187: Инт | F1187: 2 | G1187: 1458.00 | H1187: 0.70 | I1187: 2916.00 | J1187: -1249.72 | K1187: 5 | L1187: =RC[-3]/100*RC[-1] -> 0.70
A1188: 53 | B1188: _XT-S3 | C1188: Пистолет пневматичнеский XT-S3 | D1188: 30.36 | E1188: Инт | F1188: 4 | G1188: 425.00 | H1188: 0.70 | I1188: 1700.00 | J1188: -728.57 | K1188: 5 | L1188: =RC[-3]/100*RC[-1] -> 0.70
A1189: 54 | B1189: _PC77B | C1189: Пістолет CROSMAN PC77B | D1189: 62.71 | E1189: Инт | F1189: 2 | G1189: 730.00 | H1189: 0.58 | I1189: 1460.00 | J1189: -1048.57 | K1189: 5 | L1189: =RC[-3]/100*RC[-1] -> 0.58
A1190: 55 | B1190: _1429.00.30 | C1190: Рогатка Marksman Folding Slingshot cкладная [3040] | D1190: 8.41 | E1190: Инт | F1190: 5 | G1190: 122.00 | H1190: 0.73 | I1190: 610.00 | J1190: -231.38 | K1190: 5 | L1190: =RC[-3]/100*RC[-1] -> 0.73
A1191: 56 | B1191: _1429.00.31 | C1191: Рогатка Marksman Folding Slingshot складная с магнитным кожетком [3055] | D1191: 9.24 | E1191: Инт | F1191: 5 | G1191: 119.00 | H1191: 0.64 | I1191: 595.00 | J1191: -329.14 | K1191: 5 | L1191: =RC[-3]/100*RC[-1] -> 0.64
A1192: 57 | B1192: _1429.00.41 | C1192: Рогатка Marksman Pocket Hunter [3075] | D1192: 21.03 | E1192: Инт | F1192: 3 | G1192: 305.00 | H1192: 0.72 | I1192: 915.00 | J1192: -347.07 | K1192: 5 | L1192: =RC[-3]/100*RC[-1] -> 0.72
A1193: 58 | B1193: _BEAD1 | C1193: Фурнитура для темляка Spyderco | D1193: 122.00 | E1193: грн | F1193: 1 | G1193: 122.00 | H1193: 1.00 | I1193: 122.00 | J1193: 0.00 | K1193: 5 | L1193: =RC[-3]/100*RC[-1] -> 1.00
A1194: 59 | B1194: _2000SH | C1194: Шарики BB KWC - 2000шт. в "гранате" оцинкованные | D1194: 6.27 | E1194: Инт | F1194: 10 | G1194: 56.00 | H1194: 0.45 | I1194: 560.00 | J1194: -694.55 | K1194: 5 | L1194: =RC[-3]/100*RC[-1] -> 0.45 | M1194: =SUM(R[-59]C[-1]:RC[-1]) -> 
A1196: #5536 (2014-06-24) Львів Назар Максимович - Прихід товару
A1197: N | B1197: арт | C1197: назва | D1197: закуп | F1197: к-ть | G1197: цiна | H1197: кф | I1197: продж | J1197: дохiд | K1197: % | L1197: з-та
A1198: 1 | B1198: _460.00.40 | C1198: Винтовка пневматическая 4,5мм. Walther Lever Action black | D1198: 298.21 | E1198: Инт | F1198: 1 | G1198: 4175.00 | H1198: 0.70 | I1198: 4175.00 | J1198: -1789.28 | K1198: 5 | L1198: =RC[-3]/100*RC[-1] -> 0.70
A1199: 2 | B1199: _01BO001 | C1199: Нож Boker Plus Exskelibur 1 | D1199: 52.00 | E1199: euro | F1199: 1 | G1199: 944.00 | H1199: 0.73 | I1199: 944.00 | J1199: -356.00 | K1199: 5 | L1199: =RC[-3]/100*RC[-1] -> 0.73
A1200: 3 | B1200: _01AK74B | C1200: Нож Boker Plus Kalashnikov AK74 | D1200: 36.50 | E1200: euro | F1200: 1 | G1200: 663.00 | H1200: 0.73 | I1200: 663.00 | J1200: -249.50 | K1200: 5 | L1200: =RC[-3]/100*RC[-1] -> 0.73
A1201: 4 | B1201: _01BO188 | C1201: Нож Boker Plus Titan Drop | D1201: 599.00 | E1201: грн | F1201: 1 | G1201: 599.00 | H1201: 1.00 | I1201: 599.00 | J1201: 0.00 | K1201: 5 | L1201: =RC[-3]/100*RC[-1] -> 1.00
A1202: 5 | B1202: _204.47.35 | C1202: Нож OPINEL 10VRI | D1202: 8.00 | E1202: euro | F1202: 5 | G1202: 137.00 | H1202: 0.69 | I1202: 685.00 | J1202: -315.00 | K1202: 5 | L1202: =RC[-3]/100*RC[-1] -> 0.69
A1203: 6 | B1203: _204.63.31 | C1203: Нож OPINEL 10VRN | D1203: 7.20 | E1203: euro | F1203: 5 | G1203: 119.00 | H1203: 0.66 | I1203: 595.00 | J1203: -305.00 | K1203: 5 | L1203: =RC[-3]/100*RC[-1] -> 0.66
A1204: 7 | B1204: _204.59.87 | C1204: Нож OPINEL 12VRI | D1204: 10.50 | E1204: euro | F1204: 5 | G1204: 174.00 | H1204: 0.66 | I1204: 870.00 | J1204: -442.50 | K1204: 5 | L1204: =RC[-3]/100*RC[-1] -> 0.66
A1205: 8 | B1205: _204.63.32 | C1205: Нож OPINEL 12VRN | D1205: 9.50 | E1205: euro | F1205: 3 | G1205: 157.00 | H1205: 0.66 | I1205: 471.00 | J1205: -241.50 | K1205: 5 | L1205: =RC[-3]/100*RC[-1] -> 0.66
A1206: 9 | B1206: _204.78.35 | C1206: Нож OPINEL 7VRI | D1206: 6.00 | E1206: euro | F1206: 3 | G1206: 99.00 | H1206: 0.66 | I1206: 297.00 | J1206: -153.00 | K1206: 5 | L1206: =RC[-3]/100*RC[-1] -> 0.66
A1207: 10 | B1207: _204.78.36 | C1207: Нож OPINEL 7VRN | D1207: 5.20 | E1207: euro | F1207: 4 | G1207: 91.00 | H1207: 0.70 | I1207: 364.00 | J1207: -156.00 | K1207: 5 | L1207: =RC[-3]/100*RC[-1] -> 0.70
A1208: 11 | B1208: _204.00.10 | C1208: Нож OPINEL 8VRI | D1208: 6.00 | E1208: euro | F1208: 5 | G1208: 99.00 | H1208: 0.66 | I1208: 495.00 | J1208: -255.00 | K1208: 5 | L1208: =RC[-3]/100*RC[-1] -> 0.66
A1209: 12 | B1209: _204.78.16 | C1209: Нож OPINEL 8VRI кожаный чехол, в пенале | D1209: 28.00 | E1209: euro | F1209: 1 | G1209: 364.00 | H1209: 0.52 | I1209: 364.00 | J1209: -336.00 | K1209: 5 | L1209: =RC[-3]/100*RC[-1] -> 0.52
A1210: 13 | B1210: _204.78.66 | C1210: Нож OPINEL 8VRI красный | D1210: 6.70 | E1210: euro | F1210: 3 | G1210: 111.00 | H1210: 0.66 | I1210: 333.00 | J1210: -169.50 | K1210: 5 | L1210: =RC[-3]/100*RC[-1] -> 0.66
A1211: 14 | B1211: _204.78.65 | C1211: Нож OPINEL 8VRI синий | D1211: 6.70 | E1211: euro | F1211: 3 | G1211: 111.00 | H1211: 0.66 | I1211: 333.00 | J1211: -169.50 | K1211: 5 | L1211: =RC[-3]/100*RC[-1] -> 0.66
A1212: 15 | B1212: _204.63.29 | C1212: Нож OPINEL 8VRN | D1212: 5.30 | E1212: euro | F1212: 5 | G1212: 88.00 | H1212: 0.66 | I1212: 440.00 | J1212: -222.50 | K1212: 5 | L1212: =RC[-3]/100*RC[-1] -> 0.66
A1213: 16 | B1213: _204.78.06 | C1213: Нож OPINEL 8VRN Chapighon | D1213: 9.50 | E1213: euro | F1213: 1 | G1213: 207.00 | H1213: 0.87 | I1213: 207.00 | J1213: -30.50 | K1213: 5 | L1213: =RC[-3]/100*RC[-1] -> 0.87
A1214: 17 | B1214: _204.78.03 | C1214: Нож OPINEL 9VRI | D1214: 7.00 | E1214: euro | F1214: 5 | G1214: 116.00 | H1214: 0.66 | I1214: 580.00 | J1214: -295.00 | K1214: 5 | L1214: =RC[-3]/100*RC[-1] -> 0.66
A1215: 18 | B1215: _204.63.28 | C1215: Нож OPINEL 9VRN | D1215: 6.00 | E1215: euro | F1215: 5 | G1215: 99.00 | H1215: 0.66 | I1215: 495.00 | J1215: -255.00 | K1215: 5 | L1215: =RC[-3]/100*RC[-1] -> 0.66
A1216: 19 | B1216: _204.78.50 | C1216: Нож OPINEL 9VRN, блистер | D1216: 7.50 | E1216: euro | F1216: 3 | G1216: 111.00 | H1216: 0.59 | I1216: 333.00 | J1216: -229.50 | K1216: 5 | L1216: =RC[-3]/100*RC[-1] -> 0.59
A1217: 20 | B1217: _204.78.94 | C1217: Нож OPINEL Outdoor зеленый | D1217: 16.00 | E1217: euro | F1217: 2 | G1217: 264.00 | H1217: 0.66 | I1217: 528.00 | J1217: -272.00 | K1217: 5 | L1217: =RC[-3]/100*RC[-1] -> 0.66
A1218: 21 | B1218: _204.78.93 | C1218: Нож OPINEL Outdoor оранжевый | D1218: 16.00 | E1218: euro | F1218: 2 | G1218: 264.00 | H1218: 0.66 | I1218: 528.00 | J1218: -272.00 | K1218: 5 | L1218: =RC[-3]/100*RC[-1] -> 0.66
A1219: 22 | B1219: _204.78.95 | C1219: Нож OPINEL Outdoor серый | D1219: 16.00 | E1219: euro | F1219: 2 | G1219: 264.00 | H1219: 0.66 | I1219: 528.00 | J1219: -272.00 | K1219: 5 | L1219: =RC[-3]/100*RC[-1] -> 0.66
A1220: 23 | B1220: _204.78.92 | C1220: Нож OPINEL Outdoor синий | D1220: 16.00 | E1220: euro | F1220: 2 | G1220: 264.00 | H1220: 0.66 | I1220: 528.00 | J1220: -272.00 | K1220: 5 | L1220: =RC[-3]/100*RC[-1] -> 0.66
A1221: 24 | B1221: _204.78.24 | C1221: Нож OPINEL №10 с штопором | D1221: 14.50 | E1221: euro | F1221: 2 | G1221: 240.00 | H1221: 0.66 | I1221: 480.00 | J1221: -245.00 | K1221: 5 | L1221: =RC[-3]/100*RC[-1] -> 0.66
A1222: 25 | B1222: _204.78.98 | C1222: Нож OPINEL №8VRI c чехлом | D1222: 11.50 | E1222: euro | F1222: 2 | G1222: 198.00 | H1222: 0.69 | I1222: 396.00 | J1222: -179.00 | K1222: 5 | L1222: =RC[-3]/100*RC[-1] -> 0.69
A1223: 26 | B1223: _204.78.87 | C1223: Нож OPINEL"Заяц", дуб | D1223: 10.00 | E1223: euro | F1223: 1 | G1223: 165.00 | H1223: 0.66 | I1223: 165.00 | J1223: -85.00 | K1223: 5 | L1223: =RC[-3]/100*RC[-1] -> 0.66
A1224: 27 | B1224: _204.78.88 | C1224: Нож OPINEL"Кабан", дуб | D1224: 10.00 | E1224: euro | F1224: 1 | G1224: 165.00 | H1224: 0.66 | I1224: 165.00 | J1224: -85.00 | K1224: 5 | L1224: =RC[-3]/100*RC[-1] -> 0.66
A1225: 28 | B1225: _204.78.85 | C1225: Нож OPINEL"Олень", дуб | D1225: 10.00 | E1225: euro | F1225: 1 | G1225: 165.00 | H1225: 0.66 | I1225: 165.00 | J1225: -85.00 | K1225: 5 | L1225: =RC[-3]/100*RC[-1] -> 0.66
A1226: 29 | B1226: _204.78.86 | C1226: Нож OPINEL"Собака", дуб | D1226: 10.00 | E1226: euro | F1226: 1 | G1226: 165.00 | H1226: 0.66 | I1226: 165.00 | J1226: -85.00 | K1226: 5 | L1226: =RC[-3]/100*RC[-1] -> 0.66
A1227: 30 | B1227: _204.78.89 | C1227: Нож OPINEL"Форель", дуб | D1227: 10.00 | E1227: euro | F1227: 1 | G1227: 165.00 | H1227: 0.66 | I1227: 165.00 | J1227: -85.00 | K1227: 5 | L1227: =RC[-3]/100*RC[-1] -> 0.66
A1228: 31 | B1228: _5.0716 | C1228: Нож WALTHER Black Tack Tanto | D1228: 20.65 | E1228: euro | F1228: 3 | G1228: 327.00 | H1228: 0.63 | I1228: 981.00 | J1228: -567.65 | K1228: 5 | L1228: =RC[-3]/100*RC[-1] -> 0.63
A1229: 32 | B1229: _5.0729 | C1229: Нож WALTHER ERC blackyellow, 440 SS | D1229: 20.70 | E1229: euro | F1229: 2 | G1229: 327.00 | H1229: 0.63 | I1229: 654.00 | J1229: -381.14 | K1229: 5 | L1229: =RC[-3]/100*RC[-1] -> 0.63
A1230: 33 | B1230: _5.0908 | C1230: Нож WALTHER Elite Force EF104, SS | D1230: 9.19 | E1230: euro | F1230: 3 | G1230: 145.00 | H1230: 0.63 | I1230: 435.00 | J1230: -254.19 | K1230: 5 | L1230: =RC[-3]/100*RC[-1] -> 0.63
A1231: 34 | B1231: _5.0718 | C1231: Нож WALTHER Multy Tac | D1231: 20.79 | E1231: euro | F1231: 2 | G1231: 418.00 | H1231: 0.80 | I1231: 836.00 | J1231: -203.50 | K1231: 5 | L1231: =RC[-3]/100*RC[-1] -> 0.80
A1232: 35 | B1232: _5.0749 | C1232: Нож WALTHER P99, 440 SS | D1232: 20.70 | E1232: euro | F1232: 2 | G1232: 309.00 | H1232: 0.60 | I1232: 618.00 | J1232: -417.14 | K1232: 5 | L1232: =RC[-3]/100*RC[-1] -> 0.60
A1233: 36 | B1233: _5.0746 | C1233: Нож WALTHER PPQ, 440 SS | D1233: 19.57 | E1233: euro | F1233: 2 | G1233: 309.00 | H1233: 0.63 | I1233: 618.00 | J1233: -360.38 | K1233: 5 | L1233: =RC[-3]/100*RC[-1] -> 0.63
A1234: 37 | B1234: _5.0719 | C1234: Нож WALTHER SUB Companion Knife | D1234: 14.97 | E1234: euro | F1234: 3 | G1234: 236.00 | H1234: 0.63 | I1234: 708.00 | J1234: -414.98 | K1234: 5 | L1234: =RC[-3]/100*RC[-1] -> 0.63
A1235: 38 | B1235: _5.0717 | C1235: Нож WALTHER Silver Tack | D1235: 19.05 | E1235: euro | F1235: 3 | G1235: 327.00 | H1235: 0.69 | I1235: 981.00 | J1235: -447.75 | K1235: 5 | L1235: =RC[-3]/100*RC[-1] -> 0.69
A1236: 39 | B1236: _5.0753 | C1236: Нож WALTHER Silver Tack XL | D1236: 20.70 | E1236: euro | F1236: 3 | G1236: 327.00 | H1236: 0.63 | I1236: 981.00 | J1236: -571.70 | K1236: 5 | L1236: =RC[-3]/100*RC[-1] -> 0.63
A1237: 40 | B1237: _5.8132 | C1237: Пистолет пневматический Umarex АПС | D1237: 58.36 | E1237: Инт | F1237: 2 | G1237: 817.00 | H1237: 0.70 | I1237: 1634.00 | J1237: -700.28 | K1237: 5 | L1237: =RC[-3]/100*RC[-1] -> 0.70
A1238: 41 | B1238: _5.8064 | C1238: Пистолет пневматический WALTHER CP99 Compact | D1238: 90.71 | E1238: Инт | F1238: 2 | G1238: 1270.00 | H1238: 0.70 | I1238: 2540.00 | J1238: -1088.57 | K1238: 5 | L1238: =RC[-3]/100*RC[-1] -> 0.70
A1239: 42 | B1239: _5.8060 | C1239: Пистолет пневматический WALTHER PPK/S чёрный | D1239: 63.57 | E1239: Инт | F1239: 3 | G1239: 890.00 | H1239: 0.70 | I1239: 2670.00 | J1239: -1144.28 | K1239: 5 | L1239: =RC[-3]/100*RC[-1] -> 0.70
A1240: 43 | B1240: _47058-1 | C1240: Пульки RABBIT MAGNUM 2 Power 4.5мм 1.04г (200шт) | D1240: 10.73 | E1240: Инт | F1240: 5 | G1240: 118.00 | H1240: 0.55 | I1240: 590.00 | J1240: -482.73 | K1240: 5 | L1240: =RC[-3]/100*RC[-1] -> 0.55
A1241: 44 | B1241: _47058 | C1241: Пульки RABBIT MAGNUM-2 4.5мм 1.02г (200шт) | D1241: 9.91 | E1241: Инт | F1241: 10 | G1241: 109.00 | H1241: 0.55 | I1241: 1090.00 | J1241: -891.82 | K1241: 5 | L1241: =RC[-3]/100*RC[-1] -> 0.55 | M1241: =SUM(R[-44]C[-1]:RC[-1]) -> 
A1243: #5576 (2014-06-25) Львів Назар Максимович - Відправлено-Продано
A1244: N | B1244: арт | C1244: назва | D1244: закуп | F1244: к-ть | G1244: цiна | H1244: кф | I1244: продж | J1244: дохiд | K1244: % | L1244: з-та
A1245: 1 | B1245: H5305/XL | C1245: US шорты 3-кол.дезерт (R/S) ||SP-BDK-CR-05 | D1245: 12.17 | E1245: usd | F1245: 1 | G1245: 364.00 | H1245: 1.50 | I1245: 254.80 | J1245: 11.40 | K1245: 5 | L1245: =RC[-3]/100*RC[-1] -> 1.50
A1246: 2 | B1246: K5-0378B | C1246: Шарики BB 6мм 0,20x4000 [PREMIUM] ||PJBB 0,2-4000 | D1246: 3.57 | E1246: usd | F1246: 3 | G1246: 111.00 | H1246: 1.55 | I1246: 233.10 | J1246: 18.90 | K1246: 5 | L1246: =RC[-3]/100*RC[-1] -> 1.55
A1247: 3 | B1247: K5-0772 | C1247: Шарики BB 6мм 0,23x3000 [PREMIUM] ||PJBB 0,23-3000 | D1247: 3.57 | E1247: usd | F1247: 1 | G1247: 111.00 | H1247: 1.55 | I1247: 77.70 | J1247: 6.30 | K1247: 5 | L1247: =RC[-3]/100*RC[-1] -> 1.55
A1248: 4 | B1248: H7105 | C1248: US BDU кепка 3-х цветный дезерт (R/S) ||CZ-COM-CR-05 | D1248: 2.33 | E1248: usd | F1248: 15 | G1248: 72.00 | H1248: 1.55 | I1248: 756.00 | J1248: 57.00 | K1248: 5 | L1248: =RC[-3]/100*RC[-1] -> 1.55
A1249: 5 | B1249: H7104 | C1249: US BDU кепка польский вудлэнд ( PolyCotton Ripstop) ||CZ-COM-PR-04 | D1249: 2.33 | E1249: usd | F1249: 20 | G1249: 72.00 | H1249: 1.55 | I1249: 1008.00 | J1249: 76.00 | K1249: 5 | L1249: =RC[-3]/100*RC[-1] -> 1.55
A1250: 6 | B1250: H7232 | C1250: US BDU кепка олива драп ( PolyCotton Ripstop) ||CZ-COM-NR-32 | D1250: 2.33 | E1250: usd | F1250: 15 | G1250: 72.00 | H1250: 1.55 | I1250: 756.00 | J1250: 57.00 | K1250: 5 | L1250: =RC[-3]/100*RC[-1] -> 1.55
A1251: 7 | B1251: X4011 | C1251: Балаклава чёрная с 1-м отв. нинзя(100%хлопок) ||X76011 | D1251: 3.15 | E1251: Инт | F1251: 10 | G1251: 50.00 | H1251: 0.79 | I1251: 350.00 | J1251: -280.00 | K1251: 5 | L1251: =RC[-3]/100*RC[-1] -> 0.79
A1252: 8 | B1252: H7820 | C1252: Хустка SHEMAGH біло/чёрная ||CZ-ARF-CO-20 | D1252: 3.62 | E1252: usd | F1252: 1 | G1252: 119.00 | H1252: 1.64 | I1252: 83.30 | J1252: 10.90 | K1252: 5 | L1252: =RC[-3]/100*RC[-1] -> 1.64
A1253: 9 | B1253: H7811 | C1253: Хустка SHEMAGH койот/чёрная ||CZ-ARF-CO-11 | D1253: 3.62 | E1253: usd | F1253: 1 | G1253: 119.00 | H1253: 1.64 | I1253: 83.30 | J1253: 10.90 | K1253: 5 | L1253: =RC[-3]/100*RC[-1] -> 1.64
A1254: 10 | B1254: _HL22R4s | C1254: Фонарь налобный FENIX HL22R4 серый | D1254: 26.24 | E1254: usd | F1254: 1 | G1254: 365.00 | H1254: 0.70 | I1254: 365.00 | J1254: -159.80 | K1254: 5 | L1254: =RC[-3]/100*RC[-1] -> 0.70 | M1254: =SUM(R[-10]C[-1]:RC[-1]) -> 
A1256: #5593 (2014-06-25) Львів Назар Максимович - Відправлено-Продано
A1257: N | B1257: арт | C1257: назва | D1257: закуп | F1257: к-ть | G1257: цiна | H1257: кф | I1257: продж | J1257: дохiд | K1257: % | L1257: з-та
A1258: 1 | B1258: 53010-16 | C1258: Налокотники AltaFLEX мультикам [ALTA] ||OL-AFV-CD-34 | D1258: 10.98 | E1258: usd | F1258: 4 | G1258: 328.00 | H1258: 1.49 | I1258: 918.40 | J1258: 40.00 | K1258: 5 | L1258: =RC[-3]/100*RC[-1] -> 1.49
A1259: 2 | B1259: K12025-M | C1259: Рюкзак 3-Day Assault 30л мультикам ||M51612025-CP | D1259: 17.67 | E1259: usd | F1259: 1 | G1259: 519.00 | H1259: 1.47 | I1259: 363.30 | J1259: 9.90 | K1259: 5 | L1259: =RC[-3]/100*RC[-1] -> 1.47 | M1259: =SUM(R[-2]C[-1]:RC[-1]) -> 
A1261: #5653 (2014-06-26) Львів Назар Максимович - Відправлено-Продано
A1262: N | B1262: арт | C1262: назва | D1262: закуп | F1262: к-ть | G1262: цiна | H1262: кф | I1262: продж | J1262: дохiд | K1262: % | L1262: з-та
A1263: 1 | B1263: H7003/L | C1263: US GI панама с шейной защитой вудлэнд (R/S) / 7 1/2 ||KA-BON-CR-03 | D1263: 4.06 | E1263: usd | F1263: 1 | G1263: 121.00 | H1263: 1.49 | I1263: 84.70 | J1263: 3.50 | K1263: 5 | L1263: =RC[-3]/100*RC[-1] -> 1.49
A1264: 2 | B1264: H7003/XL | C1264: US GI панама с шейной защитой вудлэнд (R/S) / 7 3/4 ||KA-BON-CR-03 | D1264: 4.06 | E1264: usd | F1264: 1 | G1264: 121.00 | H1264: 1.49 | I1264: 84.70 | J1264: 3.50 | K1264: 5 | L1264: =RC[-3]/100*RC[-1] -> 1.49
A1265: 3 | B1265: H7002/L | C1265: US GI панама с шейной защитой олива (R/S) / 7 1/2 ||KA-BON-CR-02 | D1265: 4.06 | E1265: usd | F1265: 1 | G1265: 121.00 | H1265: 1.49 | I1265: 84.70 | J1265: 3.50 | K1265: 5 | L1265: =RC[-3]/100*RC[-1] -> 1.49
A1266: 4 | B1266: H7002/XL | C1266: US GI панама с шейной защитой олива (R/S) / 7 3/4 ||KA-BON-CR-02 | D1266: 4.06 | E1266: usd | F1266: 1 | G1266: 121.00 | H1266: 1.49 | I1266: 84.70 | J1266: 3.50 | K1266: 5 | L1266: =RC[-3]/100*RC[-1] -> 1.49
A1267: 5 | B1267: _3378-1/41 | C1267: Берцы STAR FORCE THUNDERSTORM HI чёрные | D1267: 33.53 | E1267: euro | F1267: 1 | G1267: 947.00 | H1267: 1.13 | I1267: 662.90 | J1267: -175.35 | K1267: 5 | L1267: =RC[-3]/100*RC[-1] -> 1.13
A1268: 6 | B1268: _3378-1/42 | C1268: Берцы STAR FORCE THUNDERSTORM HI чёрные | D1268: 33.53 | E1268: euro | F1268: 1 | G1268: 947.00 | H1268: 1.13 | I1268: 662.90 | J1268: -175.35 | K1268: 5 | L1268: =RC[-3]/100*RC[-1] -> 1.13
A1269: 7 | B1269: _3378-1/43 | C1269: Берцы STAR FORCE THUNDERSTORM HI чёрные | D1269: 33.53 | E1269: euro | F1269: 1 | G1269: 947.00 | H1269: 1.13 | I1269: 662.90 | J1269: -175.35 | K1269: 5 | L1269: =RC[-3]/100*RC[-1] -> 1.13
A1270: 8 | B1270: H3410/M | C1270: Футболка ACU ||TS-TSH-CO-10 | D1270: 4.06 | E1270: usd | F1270: 1 | G1270: 121.00 | H1270: 1.49 | I1270: 84.70 | J1270: 3.55 | K1270: 5 | L1270: =RC[-3]/100*RC[-1] -> 1.49
A1271: 9 | B1271: H3410/L | C1271: Футболка ACU ||TS-TSH-CO-10 | D1271: 4.06 | E1271: usd | F1271: 1 | G1271: 121.00 | H1271: 1.49 | I1271: 84.70 | J1271: 3.55 | K1271: 5 | L1271: =RC[-3]/100*RC[-1] -> 1.49
A1272: 10 | B1272: H3410/XL | C1272: Футболка ACU ||TS-TSH-CO-10 | D1272: 4.06 | E1272: usd | F1272: 1 | G1272: 121.00 | H1272: 1.49 | I1272: 84.70 | J1272: 3.55 | K1272: 5 | L1272: =RC[-3]/100*RC[-1] -> 1.49
A1273: 11 | B1273: H3410/2XL | C1273: Футболка ACU ||TS-TSH-CO-10 | D1273: 4.06 | E1273: usd | F1273: 1 | G1273: 121.00 | H1273: 1.49 | I1273: 84.70 | J1273: 3.55 | K1273: 5 | L1273: =RC[-3]/100*RC[-1] -> 1.49
A1274: 12 | B1274: H3410/3XL | C1274: Футболка ACU ||TS-TSH-CO-10 | D1274: 4.06 | E1274: usd | F1274: 1 | G1274: 121.00 | H1274: 1.49 | I1274: 84.70 | J1274: 3.55 | K1274: 5 | L1274: =RC[-3]/100*RC[-1] -> 1.49
A1275: 13 | B1275: H3430/3XL | C1275: Футболка койот-браун ||TS-TSH-CO-30 | D1275: 4.06 | E1275: usd | F1275: 2 | G1275: 121.00 | H1275: 1.49 | I1275: 169.40 | J1275: 7.10 | K1275: 5 | L1275: =RC[-3]/100*RC[-1] -> 1.49
A1276: 14 | B1276: H4199/LL | C1276: US SFU штаны укр.-цифра (PolyCotton) ||SP-SFU-PR-99 | D1276: 15.44 | E1276: usd | F1276: 1 | G1276: 462.00 | H1276: 1.50 | I1276: 323.40 | J1276: 14.60 | K1276: 5 | L1276: =RC[-3]/100*RC[-1] -> 1.50
A1277: 15 | B1277: H4203/ML | C1277: US SFU штаны вудлэнд (NYCO) ||SP-SFU-NT-03 | D1277: 14.49 | E1277: usd | F1277: 1 | G1277: 433.00 | H1277: 1.49 | I1277: 303.10 | J1277: 13.30 | K1277: 5 | L1277: =RC[-3]/100*RC[-1] -> 1.49
A1278: 16 | B1278: X4011 | C1278: Балаклава чёрная с 1-м отв. нинзя(100%хлопок) ||X76011 | D1278: 3.15 | E1278: Инт | F1278: 20 | G1278: 50.00 | H1278: 0.79 | I1278: 700.00 | J1278: -560.00 | K1278: 5 | L1278: =RC[-3]/100*RC[-1] -> 0.79 | M1278: =SUM(R[-16]C[-1]:RC[-1]) -> 
A1280: #5659 (2014-06-26) Львів Назар Максимович - Відправлено-Продано
A1281: N | B1281: арт | C1281: назва | D1281: закуп | F1281: к-ть | G1281: цiна | H1281: кф | I1281: продж | J1281: дохiд | K1281: % | L1281: з-та
A1282: 1 | B1282: Бабки | C1282: Прихід Грошей | D1282: 0.00 | E1282: грн | F1282: 1 | G1282: 25000.00 | H1282: 25000.00 | I1282: 25000.00 | J1282: 24999.00 | K1282: 5 | L1282: =RC[-3]/100*RC[-1] -> 25000.00 | M1282: =SUM(R[-1]C[-1]:RC[-1]) -> 
A1284: #5660 (2014-06-26) Львів Назар Максимович - Відправлено-Продано
A1285: N | B1285: арт | C1285: назва | D1285: закуп | F1285: к-ть | G1285: цiна | H1285: кф | I1285: продж | J1285: дохiд | K1285: % | L1285: з-та
A1286: 1 | B1286: Брон | C1286: Бронепластина 4-й класс | D1286: 70.00 | E1286: usd | F1286: 30 | G1286: 1200.00 | H1286: 0.86 | I1286: 36000.00 | J1286: -6000.00 | K1286: 5 | L1286: =RC[-3]/100*RC[-1] -> 0.86
A1287: 2 | B1287: K11005-W | C1287: Розгрузочна система тактическая STRIKE с подсумками вудлэнд ||M51611005-WL | D1287: 18.19 | E1287: usd | F1287: 15 | G1287: 400.00 | H1287: 1.10 | I1287: 6000.00 | J1287: 543.00 | K1287: 5 | L1287: =RC[-3]/100*RC[-1] -> 1.10 | M1287: =SUM(R[-2]C[-1]:RC[-1]) -> 
A1289: #5672 (2014-06-27) Львів Назар Максимович - Відправлено-Продано
A1290: N | B1290: арт | C1290: назва | D1290: закуп | F1290: к-ть | G1290: цiна | H1290: кф | I1290: продж | J1290: дохiд | K1290: % | L1290: з-та
A1291: 1 | B1291: X4011 | C1291: Балаклава чёрная с 1-м отв. нинзя(100%хлопок) ||X76011 | D1291: 3.15 | E1291: Инт | F1291: 10 | G1291: 50.00 | H1291: 0.79 | I1291: 350.00 | J1291: -280.00 | K1291: 5 | L1291: =RC[-3]/100*RC[-1] -> 0.79
A1292: 2 | B1292: X402 | C1292: Балаклава олива с 1-м отв.(100%хлопок) ||X76012 | D1292: 3.15 | E1292: Инт | F1292: 5 | G1292: 50.00 | H1292: 0.79 | I1292: 175.00 | J1292: -140.00 | K1292: 5 | L1292: =RC[-3]/100*RC[-1] -> 0.79
A1293: 3 | B1293: H8901/130 | C1293: Ремень TOUGH US MARINES чёрный ||PS-USM-CO-01 | D1293: 3.68 | E1293: usd | F1293: 5 | G1293: 126.00 | H1293: 1.71 | I1293: 441.00 | J1293: 73.00 | K1293: 5 | L1293: =RC[-3]/100*RC[-1] -> 1.71
A1294: 4 | B1294: H7210/M | C1294: US BDU кепка ACU (NYCO R/S) ||CZ-ACU-NR-10 | D1294: 4.31 | E1294: usd | F1294: 2 | G1294: 129.00 | H1294: 1.50 | I1294: 180.60 | J1294: 8.20 | K1294: 5 | L1294: =RC[-3]/100*RC[-1] -> 1.50
A1295: 5 | B1295: H7210/S | C1295: US BDU кепка ACU (NYCO R/S) ||CZ-ACU-NR-10 | D1295: 4.31 | E1295: usd | F1295: 1 | G1295: 129.00 | H1295: 1.50 | I1295: 90.30 | J1295: 4.10 | K1295: 5 | L1295: =RC[-3]/100*RC[-1] -> 1.50
A1296: 6 | B1296: H7210/XL | C1296: US BDU кепка ACU (NYCO R/S) ||CZ-ACU-NR-10 | D1296: 4.31 | E1296: usd | F1296: 2 | G1296: 129.00 | H1296: 1.50 | I1296: 180.60 | J1296: 8.20 | K1296: 5 | L1296: =RC[-3]/100*RC[-1] -> 1.50 | M1296: =SUM(R[-6]C[-1]:RC[-1]) -> 
A1298: #5789 (2014-07-02) Львів Назар Максимович - Відправлено-Продано
A1299: N | B1299: арт | C1299: назва | D1299: закуп | F1299: к-ть | G1299: цiна | H1299: кф | I1299: продж | J1299: дохiд | K1299: % | L1299: з-та
A1300: 1 | B1300: H41991/ML | C1300: US SFU китель укр.-цифра (PolyCotton) ||BL-SFU-PR-99 | D1300: 15.44 | E1300: usd | F1300: 1 | G1300: 462.00 | H1300: 1.50 | I1300: 323.40 | J1300: 14.60 | K1300: 5 | L1300: =RC[-3]/100*RC[-1] -> 1.50
A1301: 2 | B1301: H4199/ML | C1301: US SFU штаны укр.-цифра (PolyCotton) ||SP-SFU-PR-99 | D1301: 15.44 | E1301: usd | F1301: 1 | G1301: 462.00 | H1301: 1.50 | I1301: 323.40 | J1301: 14.60 | K1301: 5 | L1301: =RC[-3]/100*RC[-1] -> 1.50
A1302: 3 | B1302: _12835/11 | C1302: US берцы PANAMA JUNGLE чёрные ||12826002-011/45 | D1302: 18.50 | E1302: euro | F1302: 1 | G1302: 523.00 | H1302: 1.13 | I1302: 366.10 | J1302: -96.40 | K1302: 5 | L1302: =RC[-3]/100*RC[-1] -> 1.13
A1303: 4 | B1303: H1302 | C1303: US пончо олива (R/S) ||PO-MUS-PO-02 | D1303: 12.25 | E1303: usd | F1303: 28 | G1303: 366.00 | H1303: 1.49 | I1303: 7173.60 | J1303: 313.60 | K1303: 5 | L1303: =RC[-3]/100*RC[-1] -> 1.49
A1304: 5 | B1304: H1333 | C1304: US пончо MP CAMO (R/S) ||PO-MUS-PO-33 | D1304: 12.25 | E1304: usd | F1304: 3 | G1304: 366.00 | H1304: 1.49 | I1304: 768.60 | J1304: 33.60 | K1304: 5 | L1304: =RC[-3]/100*RC[-1] -> 1.49
A1305: 6 | B1305: H1304 | C1305: US пончо пол. вудлэнд (R/S) ||PO-MUS-PO-04 | D1305: 12.25 | E1305: usd | F1305: 12 | G1305: 366.00 | H1305: 1.49 | I1305: 3074.40 | J1305: 134.40 | K1305: 5 | L1305: =RC[-3]/100*RC[-1] -> 1.49
A1306: 7 | B1306: X4011 | C1306: Балаклава чёрная с 1-м отв. нинзя(100%хлопок) ||X76011 | D1306: 3.15 | E1306: Инт | F1306: 20 | G1306: 50.00 | H1306: 0.79 | I1306: 700.00 | J1306: -560.00 | K1306: 5 | L1306: =RC[-3]/100*RC[-1] -> 0.79
A1307: 8 | B1307: K11020-B | C1307: Жилет MOLLE type ARMOR VEST чёрный ||M51611020-BK | D1307: 29.24 | E1307: usd | F1307: 1 | G1307: 873.00 | H1307: 1.49 | I1307: 611.10 | J1307: 26.30 | K1307: 5 | L1307: =RC[-3]/100*RC[-1] -> 1.49
A1308: 9 | B1308: K5-0095 | C1308: Ремень 3-точ.тактический к серии MP5 [Производитель: P] | D1308: 4.42 | E1308: usd | F1308: 1 | G1308: 133.00 | H1308: 1.50 | I1308: 93.10 | J1308: 4.70 | K1308: 5 | L1308: =RC[-3]/100*RC[-1] -> 1.50
A1309: 10 | B1309: K12025-O | C1309: Рюкзак 3-Day Assault 30л олива ||M51612025-OD | D1309: 17.67 | E1309: usd | F1309: 1 | G1309: 519.00 | H1309: 1.47 | I1309: 363.30 | J1309: 9.90 | K1309: 5 | L1309: =RC[-3]/100*RC[-1] -> 1.47
A1310: 11 | B1310: _3378-1/41 | C1310: Берцы STAR FORCE THUNDERSTORM HI чёрные | D1310: 33.53 | E1310: euro | F1310: 1 | G1310: 947.00 | H1310: 1.13 | I1310: 662.90 | J1310: -175.35 | K1310: 5 | L1310: =RC[-3]/100*RC[-1] -> 1.13 | M1310: =SUM(R[-11]C[-1]:RC[-1]) -> 
A1312: #5813 (2014-07-02) Львів Назар Максимович - Відправлено-Продано
A1313: N | B1313: арт | C1313: назва | D1313: закуп | F1313: к-ть | G1313: цiна | H1313: кф | I1313: продж | J1313: дохiд | K1313: % | L1313: з-та
A1314: 1 | B1314: M800331/43 | C1314: Берцы MAGNUM Viper II 8" SZ Wide | D1314: 41.15 | E1314: usd | F1314: 1 | G1314: 948.00 | H1314: 1.15 | I1314: 663.60 | J1314: -159.40 | K1314: 5 | L1314: =RC[-3]/100*RC[-1] -> 1.15 | M1314: =SUM(R[-1]C[-1]:RC[-1]) -> 
A1316: #5859 (2014-07-03) Львів Назар Максимович - Відправлено-Продано
A1317: N | B1317: арт | C1317: назва | D1317: закуп | F1317: к-ть | G1317: цiна | H1317: кф | I1317: продж | J1317: дохiд | K1317: % | L1317: з-та
A1318: 1 | B1318: X5099 | C1318: Бандана-платок укр-цифра ||X7545 | D1318: 1.25 | E1318: Инт | F1318: 15 | G1318: 35.00 | H1318: 1.40 | I1318: 367.50 | J1318: -7.50 | K1318: 5 | L1318: =RC[-3]/100*RC[-1] -> 1.40
A1319: 2 | B1319: H0008/XL-2XL | C1319: Костюм маскировочный CHILLIE USMC digital dezert||KP-GHL-PO-08 | D1319: 35.27 | E1319: usd | F1319: 1 | G1319: 1055.00 | H1319: 1.50 | I1319: 738.50 | J1319: 33.10 | K1319: 5 | L1319: =RC[-3]/100*RC[-1] -> 1.50
A1320: 3 | B1320: K13049-B | C1320: Кобура набедренная чёрная ||M51613049-BK | D1320: 6.06 | E1320: usd | F1320: 10 | G1320: 198.00 | H1320: 1.63 | I1320: 1386.00 | J1320: 174.00 | K1320: 5 | L1320: =RC[-3]/100*RC[-1] -> 1.63 | M1320: =SUM(R[-3]C[-1]:RC[-1]) -> 
A1322: #5886 (2014-07-04) Львів Назар Максимович - Прихід товару
A1323: N | B1323: арт | C1323: назва | D1323: закуп | F1323: к-ть | G1323: цiна | H1323: кф | I1323: продж | J1323: дохiд | K1323: % | L1323: з-та
A1324: 1 | B1324: _N550000 | C1324: Кобура оперативная ПМ с подсумком | D1324: 13.20 | E1324: Инт | F1324: 54 | G1324: 165.00 | H1324: 0.63 | I1324: 8910.00 | J1324: -5346.00 | K1324: 5 | L1324: =RC[-3]/100*RC[-1] -> 0.63
A1325: 2 | B1325: _N550200 | C1325: Кобура оперативная ПМ с подсумком | D1325: 13.52 | E1325: Инт | F1325: 33 | G1325: 169.00 | H1325: 0.63 | I1325: 5577.00 | J1325: -3346.20 | K1325: 5 | L1325: =RC[-3]/100*RC[-1] -> 0.63
A1326: 3 | B1326: _N550300 | C1326: Кобура оперативная Универсальная | D1326: 16.16 | E1326: Инт | F1326: 26 | G1326: 202.00 | H1326: 0.63 | I1326: 5252.00 | J1326: -3151.20 | K1326: 5 | L1326: =RC[-3]/100*RC[-1] -> 0.63
A1327: 4 | B1327: _N550500 | C1327: Кобура поясная ПМ (скоба) | D1327: 7.68 | E1327: Инт | F1327: 17 | G1327: 96.00 | H1327: 0.63 | I1327: 1632.00 | J1327: -979.20 | K1327: 5 | L1327: =RC[-3]/100*RC[-1] -> 0.63 | M1327: =SUM(R[-4]C[-1]:RC[-1]) -> 
A1329: #5887 (2014-07-04) Львів Назар Максимович - Відправлено-Продано
A1330: N | B1330: арт | C1330: назва | D1330: закуп | F1330: к-ть | G1330: цiна | H1330: кф | I1330: продж | J1330: дохiд | K1330: % | L1330: з-та
A1331: 1 | B1331: B12002/XL | C1331: Дорожній светловідбівний жилет жёлный ГАБАРИТ | D1331: 0.83 | E1331: Инт | F1331: 2 | G1331: 20.00 | H1331: 1.20 | I1331: 28.00 | J1331: -5.20 | K1331: 5 | L1331: =RC[-3]/100*RC[-1] -> 1.20
A1332: 2 | B1332: B12003/2XL | C1332: Дорожній светловідбівний жилет помаранч ГАРД | D1332: 0.83 | E1332: Инт | F1332: 2 | G1332: 20.00 | H1332: 1.20 | I1332: 28.00 | J1332: -5.20 | K1332: 5 | L1332: =RC[-3]/100*RC[-1] -> 1.20
A1333: 3 | B1333: K13049-C | C1333: Кобура набедренная койот ||M51613049-TAN | D1333: 6.06 | E1333: usd | F1333: 2 | G1333: 198.00 | H1333: 1.63 | I1333: 277.20 | J1333: 34.80 | K1333: 5 | L1333: =RC[-3]/100*RC[-1] -> 1.63 | M1333: =SUM(R[-3]C[-1]:RC[-1]) -> 
A1335: #5928 (2014-07-07) Львів Назар Максимович - Відправлено-Продано
A1336: N | B1336: арт | C1336: назва | D1336: закуп | F1336: к-ть | G1336: цiна | H1336: кф | I1336: продж | J1336: дохiд | K1336: % | L1336: з-та
A1337: 1 | B1337: H7104 | C1337: US BDU кепка польский вудлэнд ( PolyCotton Ripstop) ||CZ-COM-PR-04 | D1337: 2.33 | E1337: usd | F1337: 20 | G1337: 72.00 | H1337: 1.55 | I1337: 1008.00 | J1337: 76.00 | K1337: 5 | L1337: =RC[-3]/100*RC[-1] -> 1.55
A1338: 2 | B1338: H3403/XL | C1338: Футболка вудлэнд ||TS-TSH-CO-03 | D1338: 4.06 | E1338: usd | F1338: 3 | G1338: 121.00 | H1338: 1.49 | I1338: 254.10 | J1338: 10.65 | K1338: 5 | L1338: =RC[-3]/100*RC[-1] -> 1.49
A1339: 3 | B1339: H3421/3XL | C1339: Футболка Foliage Green ||TS-TSH-CO-21 | D1339: 4.06 | E1339: usd | F1339: 2 | G1339: 121.00 | H1339: 1.49 | I1339: 169.40 | J1339: 7.10 | K1339: 5 | L1339: =RC[-3]/100*RC[-1] -> 1.49
A1340: 4 | B1340: H3405/XL | C1340: Футболка 3-кол.дезерт ||TS-TSH-CO-05 | D1340: 4.06 | E1340: usd | F1340: 2 | G1340: 121.00 | H1340: 1.49 | I1340: 169.40 | J1340: 7.10 | K1340: 5 | L1340: =RC[-3]/100*RC[-1] -> 1.49
A1341: 5 | B1341: H3402/3XL | C1341: Футболка олива ||TS-TSH-CO-29 | D1341: 4.06 | E1341: usd | F1341: 2 | G1341: 121.00 | H1341: 1.49 | I1341: 169.40 | J1341: 7.10 | K1341: 5 | L1341: =RC[-3]/100*RC[-1] -> 1.49
A1342: 6 | B1342: X2099/54 | C1342: Футболка укр-цифра | D1342: 3.75 | E1342: Инт | F1342: 1 | G1342: 80.00 | H1342: 1.07 | I1342: 56.00 | J1342: -19.00 | K1342: 5 | L1342: =RC[-3]/100*RC[-1] -> 1.07
A1343: 7 | B1343: X2099/56 | C1343: Футболка укр-цифра | D1343: 3.75 | E1343: Инт | F1343: 1 | G1343: 80.00 | H1343: 1.07 | I1343: 56.00 | J1343: -19.00 | K1343: 5 | L1343: =RC[-3]/100*RC[-1] -> 1.07
A1344: 8 | B1344: H3404/L | C1344: Футболка польский вудлэнд ||TS-TSH-CO-04 | D1344: 4.06 | E1344: usd | F1344: 2 | G1344: 121.00 | H1344: 1.49 | I1344: 169.40 | J1344: 7.10 | K1344: 5 | L1344: =RC[-3]/100*RC[-1] -> 1.49
A1345: 9 | B1345: H3404/XL | C1345: Футболка польский вудлэнд ||TS-TSH-CO-04 | D1345: 4.06 | E1345: usd | F1345: 2 | G1345: 121.00 | H1345: 1.49 | I1345: 169.40 | J1345: 7.10 | K1345: 5 | L1345: =RC[-3]/100*RC[-1] -> 1.49
A1346: 10 | B1346: H3430/L | C1346: Футболка койот-браун ||TS-TSH-CO-30 | D1346: 4.06 | E1346: usd | F1346: 2 | G1346: 121.00 | H1346: 1.49 | I1346: 169.40 | J1346: 7.10 | K1346: 5 | L1346: =RC[-3]/100*RC[-1] -> 1.49
A1347: 11 | B1347: H3430/XL | C1347: Футболка койот-браун ||TS-TSH-CO-30 | D1347: 4.06 | E1347: usd | F1347: 2 | G1347: 121.00 | H1347: 1.49 | I1347: 169.40 | J1347: 7.10 | K1347: 5 | L1347: =RC[-3]/100*RC[-1] -> 1.49
A1348: 12 | B1348: H3430/3XL | C1348: Футболка койот-браун ||TS-TSH-CO-30 | D1348: 4.06 | E1348: usd | F1348: 2 | G1348: 121.00 | H1348: 1.49 | I1348: 169.40 | J1348: 7.10 | K1348: 5 | L1348: =RC[-3]/100*RC[-1] -> 1.49
A1349: 13 | B1349: M800331/43 | C1349: Берцы MAGNUM Viper II 8" SZ Wide | D1349: 41.15 | E1349: usd | F1349: 1 | G1349: 948.00 | H1349: 1.15 | I1349: 663.60 | J1349: -159.40 | K1349: 5 | L1349: =RC[-3]/100*RC[-1] -> 1.15
A1350: 14 | B1350: H3421/L | C1350: Футболка Foliage Green ||TS-TSH-CO-21 | D1350: 4.06 | E1350: usd | F1350: 2 | G1350: 121.00 | H1350: 1.49 | I1350: 169.40 | J1350: 7.10 | K1350: 5 | L1350: =RC[-3]/100*RC[-1] -> 1.49
A1351: 15 | B1351: H3421/XL | C1351: Футболка Foliage Green ||TS-TSH-CO-21 | D1351: 4.06 | E1351: usd | F1351: 2 | G1351: 121.00 | H1351: 1.49 | I1351: 169.40 | J1351: 7.10 | K1351: 5 | L1351: =RC[-3]/100*RC[-1] -> 1.49
A1352: 16 | B1352: H3421/2XL | C1352: Футболка Foliage Green ||TS-TSH-CO-21 | D1352: 4.06 | E1352: usd | F1352: 2 | G1352: 121.00 | H1352: 1.49 | I1352: 169.40 | J1352: 7.10 | K1352: 5 | L1352: =RC[-3]/100*RC[-1] -> 1.49
A1353: 17 | B1353: H3405/M | C1353: Футболка 3-кол.дезерт ||TS-TSH-CO-05 | D1353: 4.06 | E1353: usd | F1353: 2 | G1353: 121.00 | H1353: 1.49 | I1353: 169.40 | J1353: 7.10 | K1353: 5 | L1353: =RC[-3]/100*RC[-1] -> 1.49
A1354: 18 | B1354: H3402/M | C1354: Футболка олива ||TS-TSH-CO-29 | D1354: 4.06 | E1354: usd | F1354: 2 | G1354: 121.00 | H1354: 1.49 | I1354: 169.40 | J1354: 7.10 | K1354: 5 | L1354: =RC[-3]/100*RC[-1] -> 1.49
A1355: 19 | B1355: H3402/XL | C1355: Футболка олива ||TS-TSH-CO-29 | D1355: 4.06 | E1355: usd | F1355: 2 | G1355: 121.00 | H1355: 1.49 | I1355: 169.40 | J1355: 7.10 | K1355: 5 | L1355: =RC[-3]/100*RC[-1] -> 1.49
A1356: 20 | B1356: H3402/2XL | C1356: Футболка олива ||TS-TSH-CO-29 | D1356: 4.06 | E1356: usd | F1356: 2 | G1356: 121.00 | H1356: 1.49 | I1356: 169.40 | J1356: 7.10 | K1356: 5 | L1356: =RC[-3]/100*RC[-1] -> 1.49
A1357: 21 | B1357: H3407/M | C1357: Футболка марпат ||TS-TSH-CO-07 | D1357: 4.13 | E1357: usd | F1357: 2 | G1357: 121.00 | H1357: 1.46 | I1357: 169.40 | J1357: 4.20 | K1357: 5 | L1357: =RC[-3]/100*RC[-1] -> 1.46
A1358: 22 | B1358: H3407/L | C1358: Футболка марпат ||TS-TSH-CO-07 | D1358: 4.13 | E1358: usd | F1358: 2 | G1358: 121.00 | H1358: 1.46 | I1358: 169.40 | J1358: 4.20 | K1358: 5 | L1358: =RC[-3]/100*RC[-1] -> 1.46
A1359: 23 | B1359: H3407/XL | C1359: Футболка марпат ||TS-TSH-CO-07 | D1359: 4.13 | E1359: usd | F1359: 2 | G1359: 121.00 | H1359: 1.46 | I1359: 169.40 | J1359: 4.20 | K1359: 5 | L1359: =RC[-3]/100*RC[-1] -> 1.46 | M1359: =SUM(R[-23]C[-1]:RC[-1]) -> 
A1361: #5956 (2014-07-07) Львів Назар Максимович - Відправлено-Продано
A1362: N | B1362: арт | C1362: назва | D1362: закуп | F1362: к-ть | G1362: цiна | H1362: кф | I1362: продж | J1362: дохiд | K1362: % | L1362: з-та
A1363: 1 | B1363: H155021 | C1363: Пилка туристическая с кільцями ||PD-PD1-SS-15 | D1363: 1.90 | E1363: usd | F1363: 15 | G1363: 63.00 | H1363: 1.66 | I1363: 661.50 | J1363: 91.50 | K1363: 5 | L1363: =RC[-3]/100*RC[-1] -> 1.66 | M1363: =SUM(R[-1]C[-1]:RC[-1]) -> 
A1365: #6020 (2014-07-09) Львів Назар Максимович - Відправлено-Продано
A1366: N | B1366: арт | C1366: назва | D1366: закуп | F1366: к-ть | G1366: цiна | H1366: кф | I1366: продж | J1366: дохiд | K1366: % | L1366: з-та
A1367: 1 | B1367: K11005-W | C1367: Розгрузочна система тактическая STRIKE с подсумками вудлэнд ||M51611005-WL | D1367: 18.19 | E1367: usd | F1367: 4 | G1367: 610.00 | H1367: 1.68 | I1367: 1708.00 | J1367: 252.80 | K1367: 5 | L1367: =RC[-3]/100*RC[-1] -> 1.68 | M1367: =SUM(R[-1]C[-1]:RC[-1]) -> 
A1369: #6051 (2014-07-10) Львів Назар Максимович - Відправлено-Продано
A1370: N | B1370: арт | C1370: назва | D1370: закуп | F1370: к-ть | G1370: цiна | H1370: кф | I1370: продж | J1370: дохiд | K1370: % | L1370: з-та
A1371: 1 | B1371: _3378-1/45 | C1371: Берцы STAR FORCE THUNDERSTORM HI чёрные | D1371: 33.53 | E1371: euro | F1371: 1 | G1371: 947.00 | H1371: 1.13 | I1371: 662.90 | J1371: -175.35 | K1371: 5 | L1371: =RC[-3]/100*RC[-1] -> 1.13 | M1371: =SUM(R[-1]C[-1]:RC[-1]) -> 
A1373: #6056 (2014-07-10) Львів Назар Максимович - Відправлено-Продано
A1374: N | B1374: арт | C1374: назва | D1374: закуп | F1374: к-ть | G1374: цiна | H1374: кф | I1374: продж | J1374: дохiд | K1374: % | L1374: з-та
A1375: 1 | B1375: _12835/10 | C1375: US берцы PANAMA JUNGLE чёрные ||12826002-010/44 | D1375: 18.50 | E1375: euro | F1375: 1 | G1375: 523.00 | H1375: 1.13 | I1375: 366.10 | J1375: -96.40 | K1375: 5 | L1375: =RC[-3]/100*RC[-1] -> 1.13
A1376: 2 | B1376: _3378-1/43 | C1376: Берцы STAR FORCE THUNDERSTORM HI чёрные | D1376: 33.53 | E1376: euro | F1376: 1 | G1376: 947.00 | H1376: 1.13 | I1376: 662.90 | J1376: -175.35 | K1376: 5 | L1376: =RC[-3]/100*RC[-1] -> 1.13
A1377: 3 | B1377: _3378-1/44 | C1377: Берцы STAR FORCE THUNDERSTORM HI чёрные | D1377: 33.53 | E1377: euro | F1377: 1 | G1377: 947.00 | H1377: 1.13 | I1377: 662.90 | J1377: -175.35 | K1377: 5 | L1377: =RC[-3]/100*RC[-1] -> 1.13 | M1377: =SUM(R[-3]C[-1]:RC[-1]) -> 
A1379: #6079 (2014-07-11) Львів Назар Максимович - Відправлено-Продано
A1380: N | B1380: арт | C1380: назва | D1380: закуп | F1380: к-ть | G1380: цiна | H1380: кф | I1380: продж | J1380: дохiд | K1380: % | L1380: з-та
A1381: 1 | B1381: H41991/ML | C1381: US SFU китель укр.-цифра (PolyCotton) ||BL-SFU-PR-99 | D1381: 15.44 | E1381: usd | F1381: 1 | G1381: 462.00 | H1381: 1.50 | I1381: 323.40 | J1381: 14.60 | K1381: 5 | L1381: =RC[-3]/100*RC[-1] -> 1.50
A1382: 2 | B1382: H4199/ML | C1382: US SFU штаны укр.-цифра (PolyCotton) ||SP-SFU-PR-99 | D1382: 15.44 | E1382: usd | F1382: 1 | G1382: 462.00 | H1382: 1.50 | I1382: 323.40 | J1382: 14.60 | K1382: 5 | L1382: =RC[-3]/100*RC[-1] -> 1.50
A1383: 3 | B1383: _12835/11 | C1383: US берцы PANAMA JUNGLE чёрные ||12826002-011/45 | D1383: 18.50 | E1383: euro | F1383: 1 | G1383: 523.00 | H1383: 1.13 | I1383: 366.10 | J1383: -96.40 | K1383: 5 | L1383: =RC[-3]/100*RC[-1] -> 1.13
A1384: 4 | B1384: X4011 | C1384: Балаклава чёрная с 1-м отв. нинзя(100%хлопок) ||X76011 | D1384: 3.15 | E1384: Инт | F1384: 20 | G1384: 50.00 | H1384: 0.79 | I1384: 700.00 | J1384: -560.00 | K1384: 5 | L1384: =RC[-3]/100*RC[-1] -> 0.79
A1385: 5 | B1385: K11020-B | C1385: Жилет MOLLE type ARMOR VEST чёрный ||M51611020-BK | D1385: 29.24 | E1385: usd | F1385: 1 | G1385: 873.00 | H1385: 1.49 | I1385: 611.10 | J1385: 26.30 | K1385: 5 | L1385: =RC[-3]/100*RC[-1] -> 1.49
A1386: 6 | B1386: K5-0095 | C1386: Ремень 3-точ.тактический к серии MP5 [Производитель: P] | D1386: 4.42 | E1386: usd | F1386: 1 | G1386: 133.00 | H1386: 1.50 | I1386: 93.10 | J1386: 4.70 | K1386: 5 | L1386: =RC[-3]/100*RC[-1] -> 1.50
A1387: 7 | B1387: K12025-O | C1387: Рюкзак 3-Day Assault 30л олива ||M51612025-OD | D1387: 17.67 | E1387: usd | F1387: 1 | G1387: 519.00 | H1387: 1.47 | I1387: 363.30 | J1387: 9.90 | K1387: 5 | L1387: =RC[-3]/100*RC[-1] -> 1.47 | M1387: =SUM(R[-7]C[-1]:RC[-1]) -> 
A1389: #6240 (2014-07-16) Львів Назар Максимович - Відправлено-Продано
A1390: N | B1390: арт | C1390: назва | D1390: закуп | F1390: к-ть | G1390: цiна | H1390: кф | I1390: продж | J1390: дохiд | K1390: % | L1390: з-та
A1391: 1 | B1391: H41991/LL | C1391: US SFU китель укр.-цифра (PolyCotton) ||BL-SFU-PR-99 | D1391: 15.44 | E1391: usd | F1391: 1 | G1391: 462.00 | H1391: 1.50 | I1391: 323.40 | J1391: 14.60 | K1391: 5 | L1391: =RC[-3]/100*RC[-1] -> 1.50
A1392: 2 | B1392: H47071/XLR | C1392: USMC китель марпат (NYCO) ||BL-USM-NT-07 | D1392: 17.32 | E1392: usd | F1392: 1 | G1392: 483.00 | H1392: 1.39 | I1392: 338.10 | J1392: -8.30 | K1392: 5 | L1392: =RC[-3]/100*RC[-1] -> 1.39
A1393: 3 | B1393: K12088-С | C1393: Рюкзак Tactical Backpack for 13" laptop койот ||M51612088-TAN | D1393: 21.61 | E1393: usd | F1393: 1 | G1393: 646.00 | H1393: 1.49 | I1393: 452.20 | J1393: 20.00 | K1393: 5 | L1393: =RC[-3]/100*RC[-1] -> 1.49
A1394: 4 | B1394: K12088-O | C1394: Рюкзак Tactical Backpack for 13" laptop олива ||M51612088-OD | D1394: 21.61 | E1394: usd | F1394: 1 | G1394: 646.00 | H1394: 1.49 | I1394: 452.20 | J1394: 20.00 | K1394: 5 | L1394: =RC[-3]/100*RC[-1] -> 1.49
A1395: 5 | B1395: K12088-B | C1395: Рюкзак Tactical Backpack for 13" laptop чёрный ||M51612088-BK | D1395: 21.61 | E1395: usd | F1395: 1 | G1395: 646.00 | H1395: 1.49 | I1395: 452.20 | J1395: 20.00 | K1395: 5 | L1395: =RC[-3]/100*RC[-1] -> 1.49
A1396: 6 | B1396: H3405/L | C1396: Футболка 3-кол.дезерт ||TS-TSH-CO-05 | D1396: 4.06 | E1396: usd | F1396: 2 | G1396: 121.00 | H1396: 1.49 | I1396: 169.40 | J1396: 7.10 | K1396: 5 | L1396: =RC[-3]/100*RC[-1] -> 1.49
A1397: 7 | B1397: H3405/S | C1397: Футболка 3-кол.дезерт ||TS-TSH-CO-05 | D1397: 4.06 | E1397: usd | F1397: 1 | G1397: 121.00 | H1397: 1.49 | I1397: 84.70 | J1397: 3.55 | K1397: 5 | L1397: =RC[-3]/100*RC[-1] -> 1.49
A1398: 8 | B1398: H3410/2XL | C1398: Футболка ACU ||TS-TSH-CO-10 | D1398: 4.06 | E1398: usd | F1398: 1 | G1398: 121.00 | H1398: 1.49 | I1398: 84.70 | J1398: 3.55 | K1398: 5 | L1398: =RC[-3]/100*RC[-1] -> 1.49
A1399: 9 | B1399: H3410/3XL | C1399: Футболка ACU ||TS-TSH-CO-10 | D1399: 4.06 | E1399: usd | F1399: 1 | G1399: 121.00 | H1399: 1.49 | I1399: 84.70 | J1399: 3.55 | K1399: 5 | L1399: =RC[-3]/100*RC[-1] -> 1.49
A1400: 10 | B1400: H3410/L | C1400: Футболка ACU ||TS-TSH-CO-10 | D1400: 4.06 | E1400: usd | F1400: 1 | G1400: 121.00 | H1400: 1.49 | I1400: 84.70 | J1400: 3.55 | K1400: 5 | L1400: =RC[-3]/100*RC[-1] -> 1.49
A1401: 11 | B1401: H3410/M | C1401: Футболка ACU ||TS-TSH-CO-10 | D1401: 4.06 | E1401: usd | F1401: 1 | G1401: 121.00 | H1401: 1.49 | I1401: 84.70 | J1401: 3.55 | K1401: 5 | L1401: =RC[-3]/100*RC[-1] -> 1.49
A1402: 12 | B1402: H3410/XL | C1402: Футболка ACU ||TS-TSH-CO-10 | D1402: 4.06 | E1402: usd | F1402: 1 | G1402: 121.00 | H1402: 1.49 | I1402: 84.70 | J1402: 3.55 | K1402: 5 | L1402: =RC[-3]/100*RC[-1] -> 1.49
A1403: 13 | B1403: H3403/2XL | C1403: Футболка вудлэнд ||TS-TSH-CO-03 | D1403: 4.06 | E1403: usd | F1403: 3 | G1403: 121.00 | H1403: 1.49 | I1403: 254.10 | J1403: 10.65 | K1403: 5 | L1403: =RC[-3]/100*RC[-1] -> 1.49
A1404: 14 | B1404: H3403/3XL | C1404: Футболка вудлэнд ||TS-TSH-CO-03 | D1404: 4.06 | E1404: usd | F1404: 3 | G1404: 121.00 | H1404: 1.49 | I1404: 254.10 | J1404: 10.65 | K1404: 5 | L1404: =RC[-3]/100*RC[-1] -> 1.49
A1405: 15 | B1405: H3403/L | C1405: Футболка вудлэнд ||TS-TSH-CO-03 | D1405: 4.06 | E1405: usd | F1405: 3 | G1405: 121.00 | H1405: 1.49 | I1405: 254.10 | J1405: 10.65 | K1405: 5 | L1405: =RC[-3]/100*RC[-1] -> 1.49
A1406: 16 | B1406: H3403/XL | C1406: Футболка вудлэнд ||TS-TSH-CO-03 | D1406: 4.06 | E1406: usd | F1406: 3 | G1406: 121.00 | H1406: 1.49 | I1406: 254.10 | J1406: 10.65 | K1406: 5 | L1406: =RC[-3]/100*RC[-1] -> 1.49
A1407: 17 | B1407: H3402/L | C1407: Футболка олива ||TS-TSH-CO-29 | D1407: 4.06 | E1407: usd | F1407: 1 | G1407: 121.00 | H1407: 1.49 | I1407: 84.70 | J1407: 3.55 | K1407: 5 | L1407: =RC[-3]/100*RC[-1] -> 1.49
A1408: 18 | B1408: H3402/M | C1408: Футболка олива ||TS-TSH-CO-29 | D1408: 4.06 | E1408: usd | F1408: 1 | G1408: 121.00 | H1408: 1.49 | I1408: 84.70 | J1408: 3.55 | K1408: 5 | L1408: =RC[-3]/100*RC[-1] -> 1.49
A1409: 19 | B1409: H3402/S | C1409: Футболка олива ||TS-TSH-CO-29 | D1409: 4.06 | E1409: usd | F1409: 1 | G1409: 121.00 | H1409: 1.49 | I1409: 84.70 | J1409: 3.55 | K1409: 5 | L1409: =RC[-3]/100*RC[-1] -> 1.49
A1410: 20 | B1410: H3402/S | C1410: Футболка олива ||TS-TSH-CO-29 | D1410: 4.06 | E1410: usd | F1410: 1 | G1410: 121.00 | H1410: 1.49 | I1410: 84.70 | J1410: 3.55 | K1410: 5 | L1410: =RC[-3]/100*RC[-1] -> 1.49
A1411: 21 | B1411: M800331/44 | C1411: Берцы MAGNUM Viper II 8" SZ Wide | D1411: 41.15 | E1411: usd | F1411: 1 | G1411: 948.00 | H1411: 1.15 | I1411: 663.60 | J1411: -159.40 | K1411: 5 | L1411: =RC[-3]/100*RC[-1] -> 1.15
A1412: 22 | B1412: _3378-1/43 | C1412: Берцы STAR FORCE THUNDERSTORM HI чёрные | D1412: 33.53 | E1412: euro | F1412: 3 | G1412: 947.00 | H1412: 1.13 | I1412: 1988.70 | J1412: -526.05 | K1412: 5 | L1412: =RC[-3]/100*RC[-1] -> 1.13
A1413: 23 | B1413: _3378-1/44 | C1413: Берцы STAR FORCE THUNDERSTORM HI чёрные | D1413: 33.53 | E1413: euro | F1413: 2 | G1413: 947.00 | H1413: 1.13 | I1413: 1325.80 | J1413: -350.70 | K1413: 5 | L1413: =RC[-3]/100*RC[-1] -> 1.13 | M1413: =SUM(R[-23]C[-1]:RC[-1]) -> 
A1415: #6242 (2014-07-16) Львів Назар Максимович - Відправлено-Продано
A1416: N | B1416: арт | C1416: назва | D1416: закуп | F1416: к-ть | G1416: цiна | H1416: кф | I1416: продж | J1416: дохiд | K1416: % | L1416: з-та
A1417: 1 | B1417: H4332/SL | C1417: US SFU штаны олива-драп (NYCO R/S) ||SP-SFU-PR-32 | D1417: 14.49 | E1417: usd | F1417: 1 | G1417: 433.00 | H1417: 1.49 | I1417: 303.10 | J1417: 13.30 | K1417: 5 | L1417: =RC[-3]/100*RC[-1] -> 1.49 | M1417: =SUM(R[-1]C[-1]:RC[-1]) -> 
A1419: #6260 (2014-07-17) Львів Назар Максимович - Відправлено-Продано
A1420: N | B1420: арт | C1420: назва | D1420: закуп | F1420: к-ть | G1420: цiна | H1420: кф | I1420: продж | J1420: дохiд | K1420: % | L1420: з-та
A1421: 1 | B1421: H7105 | C1421: US BDU кепка 3-х цветный дезерт (R/S) ||CZ-COM-CR-05 | D1421: 2.33 | E1421: usd | F1421: 4 | G1421: 72.00 | H1421: 1.55 | I1421: 201.60 | J1421: 15.20 | K1421: 5 | L1421: =RC[-3]/100*RC[-1] -> 1.55
A1422: 2 | B1422: H7232 | C1422: US BDU кепка олива драп ( PolyCotton Ripstop) ||CZ-COM-NR-32 | D1422: 2.33 | E1422: usd | F1422: 4 | G1422: 72.00 | H1422: 1.55 | I1422: 201.60 | J1422: 15.20 | K1422: 5 | L1422: =RC[-3]/100*RC[-1] -> 1.55
A1423: 3 | B1423: H7104 | C1423: US BDU кепка польский вудлэнд ( PolyCotton Ripstop) ||CZ-COM-PR-04 | D1423: 2.33 | E1423: usd | F1423: 4 | G1423: 72.00 | H1423: 1.55 | I1423: 201.60 | J1423: 15.20 | K1423: 5 | L1423: =RC[-3]/100*RC[-1] -> 1.55
A1424: 4 | B1424: H7106 | C1424: US BDU кепка польский дезерт (R/S) ||CZ-COM-CR-06 | D1424: 2.33 | E1424: usd | F1424: 4 | G1424: 72.00 | H1424: 1.55 | I1424: 201.60 | J1424: 15.20 | K1424: 5 | L1424: =RC[-3]/100*RC[-1] -> 1.55
A1425: 5 | B1425: _ARE-C1 | C1425: Зарядное устройство Fenix Charger ARE-C1 2x18650 | D1425: 12.14 | E1425: usd | F1425: 5 | G1425: 166.00 | H1425: 0.68 | I1425: 830.00 | J1425: -384.00 | K1425: 5 | L1425: =RC[-3]/100*RC[-1] -> 0.68
A1426: 6 | B1426: _LD40R4 | C1426: Фонарь FENIX LD40 Cree XP-G LED R4 new | D1426: 35.00 | E1426: usd | F1426: 1 | G1426: 459.00 | H1426: 0.66 | I1426: 459.00 | J1426: -241.00 | K1426: 5 | L1426: =RC[-3]/100*RC[-1] -> 0.66
A1427: 7 | B1427: _TK30 | C1427: Фонарик FENIX TK30 Cree MC-E LED | D1427: 85.00 | E1427: usd | F1427: 1 | G1427: 888.00 | H1427: 0.52 | I1427: 888.00 | J1427: -812.00 | K1427: 5 | L1427: =RC[-3]/100*RC[-1] -> 0.52
A1428: 8 | B1428: _HTK15S2 | C1428: Набор FENIX TK15 + кнопка AR102 +Акум Fenix 2600 + Зарядка TF002 | D1428: 88.09 | E1428: usd | F1428: 1 | G1428: 763.00 | H1428: 0.43 | I1428: 763.00 | J1428: -998.80 | K1428: 5 | L1428: =RC[-3]/100*RC[-1] -> 0.43
A1429: 9 | B1429: _TK60 | C1429: Фонарь FENIX TK60 R5 | D1429: 120.00 | E1429: usd | F1429: 1 | G1429: 888.00 | H1429: 0.37 | I1429: 888.00 | J1429: -1512.00 | K1429: 5 | L1429: =RC[-3]/100*RC[-1] -> 0.37
A1430: 10 | B1430: H3405/L | C1430: Футболка 3-кол.дезерт ||TS-TSH-CO-05 | D1430: 4.06 | E1430: usd | F1430: 2 | G1430: 121.00 | H1430: 1.49 | I1430: 169.40 | J1430: 7.10 | K1430: 5 | L1430: =RC[-3]/100*RC[-1] -> 1.49
A1431: 11 | B1431: H3405/M | C1431: Футболка 3-кол.дезерт ||TS-TSH-CO-05 | D1431: 4.06 | E1431: usd | F1431: 2 | G1431: 121.00 | H1431: 1.49 | I1431: 169.40 | J1431: 7.10 | K1431: 5 | L1431: =RC[-3]/100*RC[-1] -> 1.49
A1432: 12 | B1432: H3410/L | C1432: Футболка ACU ||TS-TSH-CO-10 | D1432: 4.06 | E1432: usd | F1432: 2 | G1432: 121.00 | H1432: 1.49 | I1432: 169.40 | J1432: 7.10 | K1432: 5 | L1432: =RC[-3]/100*RC[-1] -> 1.49
A1433: 13 | B1433: H3410/M | C1433: Футболка ACU ||TS-TSH-CO-10 | D1433: 4.06 | E1433: usd | F1433: 2 | G1433: 121.00 | H1433: 1.49 | I1433: 169.40 | J1433: 7.10 | K1433: 5 | L1433: =RC[-3]/100*RC[-1] -> 1.49
A1434: 14 | B1434: H3410/XL | C1434: Футболка ACU ||TS-TSH-CO-10 | D1434: 4.06 | E1434: usd | F1434: 2 | G1434: 121.00 | H1434: 1.49 | I1434: 169.40 | J1434: 7.10 | K1434: 5 | L1434: =RC[-3]/100*RC[-1] -> 1.49
A1435: 15 | B1435: H3421/L | C1435: Футболка Foliage Green ||TS-TSH-CO-21 | D1435: 4.06 | E1435: usd | F1435: 2 | G1435: 121.00 | H1435: 1.49 | I1435: 169.40 | J1435: 7.10 | K1435: 5 | L1435: =RC[-3]/100*RC[-1] -> 1.49
A1436: 16 | B1436: H3421/M | C1436: Футболка Foliage Green ||TS-TSH-CO-21 | D1436: 4.06 | E1436: usd | F1436: 2 | G1436: 121.00 | H1436: 1.49 | I1436: 169.40 | J1436: 7.10 | K1436: 5 | L1436: =RC[-3]/100*RC[-1] -> 1.49
A1437: 17 | B1437: H3421/XL | C1437: Футболка Foliage Green ||TS-TSH-CO-21 | D1437: 4.06 | E1437: usd | F1437: 2 | G1437: 121.00 | H1437: 1.49 | I1437: 169.40 | J1437: 7.10 | K1437: 5 | L1437: =RC[-3]/100*RC[-1] -> 1.49
A1438: 18 | B1438: H3403/L | C1438: Футболка вудлэнд ||TS-TSH-CO-03 | D1438: 4.06 | E1438: usd | F1438: 2 | G1438: 121.00 | H1438: 1.49 | I1438: 169.40 | J1438: 7.10 | K1438: 5 | L1438: =RC[-3]/100*RC[-1] -> 1.49
A1439: 19 | B1439: H3403/XL | C1439: Футболка вудлэнд ||TS-TSH-CO-03 | D1439: 4.06 | E1439: usd | F1439: 2 | G1439: 121.00 | H1439: 1.49 | I1439: 169.40 | J1439: 7.10 | K1439: 5 | L1439: =RC[-3]/100*RC[-1] -> 1.49
A1440: 20 | B1440: H3407/2XL | C1440: Футболка марпат ||TS-TSH-CO-07 | D1440: 4.13 | E1440: usd | F1440: 2 | G1440: 121.00 | H1440: 1.46 | I1440: 169.40 | J1440: 4.20 | K1440: 5 | L1440: =RC[-3]/100*RC[-1] -> 1.46
A1441: 21 | B1441: H3407/L | C1441: Футболка марпат ||TS-TSH-CO-07 | D1441: 4.13 | E1441: usd | F1441: 2 | G1441: 121.00 | H1441: 1.46 | I1441: 169.40 | J1441: 4.20 | K1441: 5 | L1441: =RC[-3]/100*RC[-1] -> 1.46
A1442: 22 | B1442: H3407/M | C1442: Футболка марпат ||TS-TSH-CO-07 | D1442: 4.13 | E1442: usd | F1442: 2 | G1442: 121.00 | H1442: 1.46 | I1442: 169.40 | J1442: 4.20 | K1442: 5 | L1442: =RC[-3]/100*RC[-1] -> 1.46
A1443: 23 | B1443: H3407/XL | C1443: Футболка марпат ||TS-TSH-CO-07 | D1443: 4.13 | E1443: usd | F1443: 2 | G1443: 121.00 | H1443: 1.46 | I1443: 169.40 | J1443: 4.20 | K1443: 5 | L1443: =RC[-3]/100*RC[-1] -> 1.46
A1444: 24 | B1444: H3414/L | C1444: Футболка мультикам ||TS-TSH-CO-14 | D1444: 4.06 | E1444: usd | F1444: 2 | G1444: 121.00 | H1444: 1.49 | I1444: 169.40 | J1444: 7.10 | K1444: 5 | L1444: =RC[-3]/100*RC[-1] -> 1.49
A1445: 25 | B1445: H3414/M | C1445: Футболка мультикам ||TS-TSH-CO-14 | D1445: 4.06 | E1445: usd | F1445: 2 | G1445: 121.00 | H1445: 1.49 | I1445: 169.40 | J1445: 7.10 | K1445: 5 | L1445: =RC[-3]/100*RC[-1] -> 1.49
A1446: 26 | B1446: H3414/XL | C1446: Футболка мультикам ||TS-TSH-CO-14 | D1446: 4.06 | E1446: usd | F1446: 2 | G1446: 121.00 | H1446: 1.49 | I1446: 169.40 | J1446: 7.10 | K1446: 5 | L1446: =RC[-3]/100*RC[-1] -> 1.49
A1447: 27 | B1447: H3402/L | C1447: Футболка олива ||TS-TSH-CO-29 | D1447: 4.06 | E1447: usd | F1447: 2 | G1447: 121.00 | H1447: 1.49 | I1447: 169.40 | J1447: 7.10 | K1447: 5 | L1447: =RC[-3]/100*RC[-1] -> 1.49
A1448: 28 | B1448: H3402/M | C1448: Футболка олива ||TS-TSH-CO-29 | D1448: 4.06 | E1448: usd | F1448: 2 | G1448: 121.00 | H1448: 1.49 | I1448: 169.40 | J1448: 7.10 | K1448: 5 | L1448: =RC[-3]/100*RC[-1] -> 1.49
A1449: 29 | B1449: H3402/XL | C1449: Футболка олива ||TS-TSH-CO-29 | D1449: 4.06 | E1449: usd | F1449: 2 | G1449: 121.00 | H1449: 1.49 | I1449: 169.40 | J1449: 7.10 | K1449: 5 | L1449: =RC[-3]/100*RC[-1] -> 1.49
A1450: 30 | B1450: H3404/L | C1450: Футболка польский вудлэнд ||TS-TSH-CO-04 | D1450: 4.06 | E1450: usd | F1450: 2 | G1450: 121.00 | H1450: 1.49 | I1450: 169.40 | J1450: 7.10 | K1450: 5 | L1450: =RC[-3]/100*RC[-1] -> 1.49
A1451: 31 | B1451: H3404/M | C1451: Футболка польский вудлэнд ||TS-TSH-CO-04 | D1451: 4.06 | E1451: usd | F1451: 2 | G1451: 121.00 | H1451: 1.49 | I1451: 169.40 | J1451: 7.10 | K1451: 5 | L1451: =RC[-3]/100*RC[-1] -> 1.49
A1452: 32 | B1452: H3404/XL | C1452: Футболка польский вудлэнд ||TS-TSH-CO-04 | D1452: 4.06 | E1452: usd | F1452: 2 | G1452: 121.00 | H1452: 1.49 | I1452: 169.40 | J1452: 7.10 | K1452: 5 | L1452: =RC[-3]/100*RC[-1] -> 1.49
A1453: 33 | B1453: H3406/L | C1453: Футболка польский дезерт ||TS-TSH-CO-06 | D1453: 4.06 | E1453: usd | F1453: 2 | G1453: 121.00 | H1453: 1.49 | I1453: 169.40 | J1453: 7.10 | K1453: 5 | L1453: =RC[-3]/100*RC[-1] -> 1.49
A1454: 34 | B1454: H3406/M | C1454: Футболка польский дезерт ||TS-TSH-CO-06 | D1454: 4.06 | E1454: usd | F1454: 2 | G1454: 121.00 | H1454: 1.49 | I1454: 169.40 | J1454: 7.10 | K1454: 5 | L1454: =RC[-3]/100*RC[-1] -> 1.49
A1455: 35 | B1455: H3406/XL | C1455: Футболка польский дезерт ||TS-TSH-CO-06 | D1455: 4.06 | E1455: usd | F1455: 2 | G1455: 121.00 | H1455: 1.49 | I1455: 169.40 | J1455: 7.10 | K1455: 5 | L1455: =RC[-3]/100*RC[-1] -> 1.49 | M1455: =SUM(R[-35]C[-1]:RC[-1]) -> 
A1457: #6286 (2014-07-17) Львів Назар Максимович - Відправлено-Продано
A1458: N | B1458: арт | C1458: назва | D1458: закуп | F1458: к-ть | G1458: цiна | H1458: кф | I1458: продж | J1458: дохiд | K1458: % | L1458: з-та
A1459: 1 | B1459: Брон | C1459: Бронепластина 4-й класс | D1459: 70.00 | E1459: usd | F1459: 20 | G1459: 1200.00 | H1459: 0.86 | I1459: 22800.00 | J1459: -5200.00 | K1459: 5 | L1459: =RC[-3]/100*RC[-1] -> 0.86
A1460: 2 | B1460: K11005-W | C1460: Розгрузочна система тактическая STRIKE с подсумками вудлэнд ||M51611005-WL | D1460: 18.19 | E1460: usd | F1460: 5 | G1460: 610.00 | H1460: 1.68 | I1460: 2135.00 | J1460: 316.00 | K1460: 5 | L1460: =RC[-3]/100*RC[-1] -> 1.68
A1461: 3 | B1461: K11005-O | C1461: Розгрузочна система тактическая STRIKE с подсумками олива ||M51611005-OD | D1461: 18.19 | E1461: usd | F1461: 5 | G1461: 610.00 | H1461: 1.68 | I1461: 2135.00 | J1461: 316.00 | K1461: 5 | L1461: =RC[-3]/100*RC[-1] -> 1.68 | M1461: =SUM(R[-3]C[-1]:RC[-1]) -> 
A1463: #6323 (2014-07-18) Львів Назар Максимович - Відправлено-Продано
A1464: N | B1464: арт | C1464: назва | D1464: закуп | F1464: к-ть | G1464: цiна | H1464: кф | I1464: продж | J1464: дохiд | K1464: % | L1464: з-та
A1465: 1 | B1465: H2302/M | C1465: Куртка CLASSIC ARMY флисовая олива ||BL-CAF-FL-02 | D1465: 18.29 | E1465: usd | F1465: 1 | G1465: 547.00 | H1465: 1.50 | I1465: 382.90 | J1465: 17.10 | K1465: 5 | L1465: =RC[-3]/100*RC[-1] -> 1.50 | M1465: =SUM(R[-1]C[-1]:RC[-1]) -> 
A1467: #6347 (2014-07-21) Львів Назар Максимович - Відправлено-Продано
A1468: N | B1468: арт | C1468: назва | D1468: закуп | F1468: к-ть | G1468: цiна | H1468: кф | I1468: продж | J1468: дохiд | K1468: % | L1468: з-та
A1469: 1 | B1469: H7214/L-59 | C1469: US ACU кепка мультикам (NYCO R/S) ||CZ-ACU-PR-14 | D1469: 4.31 | E1469: usd | F1469: 2 | G1469: 129.00 | H1469: 1.50 | I1469: 180.60 | J1469: 8.20 | K1469: 5 | L1469: =RC[-3]/100*RC[-1] -> 1.50
A1470: 2 | B1470: H7105 | C1470: US BDU кепка 3-х цветный дезерт (R/S) ||CZ-COM-CR-05 | D1470: 2.33 | E1470: usd | F1470: 10 | G1470: 72.00 | H1470: 1.55 | I1470: 504.00 | J1470: 38.00 | K1470: 5 | L1470: =RC[-3]/100*RC[-1] -> 1.55
A1471: 3 | B1471: H7104 | C1471: US BDU кепка польский вудлэнд ( PolyCotton Ripstop) ||CZ-COM-PR-04 | D1471: 2.33 | E1471: usd | F1471: 10 | G1471: 72.00 | H1471: 1.55 | I1471: 504.00 | J1471: 38.00 | K1471: 5 | L1471: =RC[-3]/100*RC[-1] -> 1.55
A1472: 4 | B1472: H7003/L | C1472: US GI панама с шейной защитой вудлэнд (R/S) / 7 1/2 ||KA-BON-CR-03 | D1472: 4.06 | E1472: usd | F1472: 2 | G1472: 121.00 | H1472: 1.49 | I1472: 169.40 | J1472: 7.00 | K1472: 5 | L1472: =RC[-3]/100*RC[-1] -> 1.49
A1473: 5 | B1473: H7003/XL | C1473: US GI панама с шейной защитой вудлэнд (R/S) / 7 3/4 ||KA-BON-CR-03 | D1473: 4.06 | E1473: usd | F1473: 2 | G1473: 121.00 | H1473: 1.49 | I1473: 169.40 | J1473: 7.00 | K1473: 5 | L1473: =RC[-3]/100*RC[-1] -> 1.49
A1474: 6 | B1474: H70141/L | C1474: US GI панама с шейной защитой мультикам (NYCO R/S) ||7 1/2 ||KA-BON-PR-14 | D1474: 4.58 | E1474: usd | F1474: 2 | G1474: 137.00 | H1474: 1.50 | I1474: 191.80 | J1474: 8.60 | K1474: 5 | L1474: =RC[-3]/100*RC[-1] -> 1.50
A1475: 7 | B1475: H70141/XL | C1475: US GI панама с шейной защитой мультикам (NYCO R/S) ||7 3/4 ||KA-BON-PR-14 | D1475: 4.58 | E1475: usd | F1475: 2 | G1475: 137.00 | H1475: 1.50 | I1475: 191.80 | J1475: 8.60 | K1475: 5 | L1475: =RC[-3]/100*RC[-1] -> 1.50
A1476: 8 | B1476: X402 | C1476: Балаклава олива с 1-м отв.(100%хлопок) ||X76012 | D1476: 3.15 | E1476: Инт | F1476: 20 | G1476: 50.00 | H1476: 0.79 | I1476: 700.00 | J1476: -560.00 | K1476: 5 | L1476: =RC[-3]/100*RC[-1] -> 0.79
A1477: 9 | B1477: X402 | C1477: Балаклава олива с 1-м отв.(100%хлопок) ||X76012 | D1477: 3.15 | E1477: Инт | F1477: 10 | G1477: 50.00 | H1477: 0.79 | I1477: 350.00 | J1477: -280.00 | K1477: 5 | L1477: =RC[-3]/100*RC[-1] -> 0.79
A1478: 10 | B1478: X5099 | C1478: Бандана-платок укр-цифра ||X7545 | D1478: 1.25 | E1478: Инт | F1478: 7 | G1478: 35.00 | H1478: 1.40 | I1478: 171.50 | J1478: -3.50 | K1478: 5 | L1478: =RC[-3]/100*RC[-1] -> 1.40
A1479: 11 | B1479: K12088-O | C1479: Рюкзак Tactical Backpack for 13" laptop олива ||M51612088-OD | D1479: 21.61 | E1479: usd | F1479: 1 | G1479: 646.00 | H1479: 1.49 | I1479: 452.20 | J1479: 20.00 | K1479: 5 | L1479: =RC[-3]/100*RC[-1] -> 1.49
A1480: 12 | B1480: H3404/2XL | C1480: Футболка польский вудлэнд ||TS-TSH-CO-04 | D1480: 4.06 | E1480: usd | F1480: 2 | G1480: 121.00 | H1480: 1.49 | I1480: 169.40 | J1480: 7.10 | K1480: 5 | L1480: =RC[-3]/100*RC[-1] -> 1.49
A1481: 13 | B1481: H3404/L | C1481: Футболка польский вудлэнд ||TS-TSH-CO-04 | D1481: 4.06 | E1481: usd | F1481: 2 | G1481: 121.00 | H1481: 1.49 | I1481: 169.40 | J1481: 7.10 | K1481: 5 | L1481: =RC[-3]/100*RC[-1] -> 1.49
A1482: 14 | B1482: H3404/M | C1482: Футболка польский вудлэнд ||TS-TSH-CO-04 | D1482: 4.06 | E1482: usd | F1482: 2 | G1482: 121.00 | H1482: 1.49 | I1482: 169.40 | J1482: 7.10 | K1482: 5 | L1482: =RC[-3]/100*RC[-1] -> 1.49
A1483: 15 | B1483: H3404/S | C1483: Футболка польский вудлэнд ||TS-TSH-CO-04 | D1483: 4.06 | E1483: usd | F1483: 2 | G1483: 121.00 | H1483: 1.49 | I1483: 169.40 | J1483: 7.10 | K1483: 5 | L1483: =RC[-3]/100*RC[-1] -> 1.49
A1484: 16 | B1484: H3404/XL | C1484: Футболка польский вудлэнд ||TS-TSH-CO-04 | D1484: 4.06 | E1484: usd | F1484: 2 | G1484: 121.00 | H1484: 1.49 | I1484: 169.40 | J1484: 7.10 | K1484: 5 | L1484: =RC[-3]/100*RC[-1] -> 1.49 | M1484: =SUM(R[-16]C[-1]:RC[-1]) -> 
A1486: #6414 (2014-07-22) Львів Назар Максимович - Відправлено-Продано
A1487: N | B1487: арт | C1487: назва | D1487: закуп | F1487: к-ть | G1487: цiна | H1487: кф | I1487: продж | J1487: дохiд | K1487: % | L1487: з-та
A1488: 1 | B1488: M800331/43 | C1488: Берцы MAGNUM Viper II 8" SZ Wide | D1488: 41.15 | E1488: usd | F1488: 1 | G1488: 948.00 | H1488: 1.15 | I1488: 663.60 | J1488: -159.40 | K1488: 5 | L1488: =RC[-3]/100*RC[-1] -> 1.15
A1489: 2 | B1489: _3378-1/41 | C1489: Берцы STAR FORCE THUNDERSTORM HI чёрные | D1489: 33.53 | E1489: euro | F1489: 1 | G1489: 947.00 | H1489: 1.13 | I1489: 662.90 | J1489: -175.35 | K1489: 5 | L1489: =RC[-3]/100*RC[-1] -> 1.13
A1490: 3 | B1490: H41991/LL | C1490: US SFU китель укр.-цифра (PolyCotton) ||BL-SFU-PR-99 | D1490: 15.44 | E1490: usd | F1490: 1 | G1490: 462.00 | H1490: 1.50 | I1490: 323.40 | J1490: 14.60 | K1490: 5 | L1490: =RC[-3]/100*RC[-1] -> 1.50
A1491: 4 | B1491: H4199/LL | C1491: US SFU штаны укр.-цифра (PolyCotton) ||SP-SFU-PR-99 | D1491: 15.44 | E1491: usd | F1491: 1 | G1491: 462.00 | H1491: 1.50 | I1491: 323.40 | J1491: 14.60 | K1491: 5 | L1491: =RC[-3]/100*RC[-1] -> 1.50 | M1491: =SUM(R[-4]C[-1]:RC[-1]) -> 
A1493: #6416 (2014-07-22) Львів Назар Максимович - Відправлено-Продано
A1494: N | B1494: арт | C1494: назва | D1494: закуп | F1494: к-ть | G1494: цiна | H1494: кф | I1494: продж | J1494: дохiд | K1494: % | L1494: з-та
A1495: 1 | B1495: H7002/L | C1495: US GI панама с шейной защитой олива (R/S) / 7 1/2 ||KA-BON-CR-02 | D1495: 4.06 | E1495: usd | F1495: 1 | G1495: 121.00 | H1495: 1.49 | I1495: 84.70 | J1495: 3.50 | K1495: 5 | L1495: =RC[-3]/100*RC[-1] -> 1.49
A1496: 2 | B1496: H7002/XL | C1496: US GI панама с шейной защитой олива (R/S) / 7 3/4 ||KA-BON-CR-02 | D1496: 4.06 | E1496: usd | F1496: 2 | G1496: 121.00 | H1496: 1.49 | I1496: 169.40 | J1496: 7.00 | K1496: 5 | L1496: =RC[-3]/100*RC[-1] -> 1.49
A1497: 3 | B1497: H7005/L | C1497: US GI панама с шейной защитой 3-кол.дезерт (R/S) / 7 1/2 ||KA-BON-CR-05 | D1497: 4.06 | E1497: usd | F1497: 1 | G1497: 121.00 | H1497: 1.49 | I1497: 84.70 | J1497: 3.50 | K1497: 5 | L1497: =RC[-3]/100*RC[-1] -> 1.49
A1498: 4 | B1498: H7005/XL | C1498: US GI панама с шейной защитой 3-кол.дезерт (R/S) / 7 3/4 ||KA-BON-CR-05 | D1498: 4.06 | E1498: usd | F1498: 2 | G1498: 121.00 | H1498: 1.49 | I1498: 169.40 | J1498: 7.00 | K1498: 5 | L1498: =RC[-3]/100*RC[-1] -> 1.49
A1499: 5 | B1499: H155021 | C1499: Пилка туристическая с кільцями ||PD-PD1-SS-15 | D1499: 1.90 | E1499: usd | F1499: 5 | G1499: 63.00 | H1499: 1.66 | I1499: 220.50 | J1499: 30.50 | K1499: 5 | L1499: =RC[-3]/100*RC[-1] -> 1.66
A1500: 6 | B1500: _125502 | C1500: Перчатки THINSULATE акриловые без пальцев вудлэнд ||12540020 | D1500: 2.25 | E1500: euro | F1500: 2 | G1500: 65.00 | H1500: 1.16 | I1500: 91.00 | J1500: -21.50 | K1500: 5 | L1500: =RC[-3]/100*RC[-1] -> 1.16
A1501: 7 | B1501: _125501 | C1501: Перчатки THINSULATE акриловые без пальцев чёрные ||12540002 | D1501: 2.00 | E1501: euro | F1501: 1 | G1501: 60.00 | H1501: 1.20 | I1501: 42.00 | J1501: -8.00 | K1501: 5 | L1501: =RC[-3]/100*RC[-1] -> 1.20
A1502: 8 | B1502: H0901 | C1502: US розкладна лопатка чёрная ||SA-SA1-ST-01 | D1502: 5.44 | E1502: usd | F1502: 1 | G1502: 175.00 | H1502: 1.61 | I1502: 122.50 | J1502: 13.70 | K1502: 5 | L1502: =RC[-3]/100*RC[-1] -> 1.61
A1503: 9 | B1503: H70141/L | C1503: US GI панама с шейной защитой мультикам (NYCO R/S) ||7 1/2 ||KA-BON-PR-14 | D1503: 4.58 | E1503: usd | F1503: 2 | G1503: 137.00 | H1503: 1.50 | I1503: 191.80 | J1503: 8.60 | K1503: 5 | L1503: =RC[-3]/100*RC[-1] -> 1.50
A1504: 10 | B1504: H70141/XL | C1504: US GI панама с шейной защитой мультикам (NYCO R/S) ||7 3/4 ||KA-BON-PR-14 | D1504: 4.58 | E1504: usd | F1504: 2 | G1504: 137.00 | H1504: 1.50 | I1504: 191.80 | J1504: 8.60 | K1504: 5 | L1504: =RC[-3]/100*RC[-1] -> 1.50 | M1504: =SUM(R[-10]C[-1]:RC[-1]) -> 
A1506: #6573 (2014-07-25) Львів Назар Максимович - Відправлено-Продано
A1507: N | B1507: арт | C1507: назва | D1507: закуп | F1507: к-ть | G1507: цiна | H1507: кф | I1507: продж | J1507: дохiд | K1507: % | L1507: з-та
A1508: 1 | B1508: K12025-С | C1508: Рюкзак 3-Day Assault 30л койот ||M51612025-TAN | D1508: 17.67 | E1508: usd | F1508: 1 | G1508: 519.00 | H1508: 1.47 | I1508: 363.30 | J1508: 9.90 | K1508: 5 | L1508: =RC[-3]/100*RC[-1] -> 1.47
A1509: 2 | B1509: K12025-O | C1509: Рюкзак 3-Day Assault 30л олива ||M51612025-OD | D1509: 17.67 | E1509: usd | F1509: 2 | G1509: 519.00 | H1509: 1.47 | I1509: 726.60 | J1509: 19.80 | K1509: 5 | L1509: =RC[-3]/100*RC[-1] -> 1.47
A1510: 3 | B1510: K12022-С | C1510: Рюкзак Tactical Backpack 20л койот ||M51612022-TAN | D1510: 19.17 | E1510: usd | F1510: 2 | G1510: 573.00 | H1510: 1.49 | I1510: 802.20 | J1510: 35.40 | K1510: 5 | L1510: =RC[-3]/100*RC[-1] -> 1.49 | M1510: =SUM(R[-3]C[-1]:RC[-1]) -> 
A1512: #6581 (2014-07-25) Львів Назар Максимович - Відправлено-Продано
A1513: N | B1513: арт | C1513: назва | D1513: закуп | F1513: к-ть | G1513: цiна | H1513: кф | I1513: продж | J1513: дохiд | K1513: % | L1513: з-та
A1514: 1 | B1514: KG-1000 | C1514: GREEN GAS 1000мл | D1514: 4.70 | E1514: usd | F1514: 2 | G1514: 161.00 | H1514: 1.71 | I1514: 225.40 | J1514: 37.40 | K1514: 5 | L1514: =RC[-3]/100*RC[-1] -> 1.71 | M1514: =SUM(R[-1]C[-1]:RC[-1]) -> 
A1516: #6623 (2014-07-28) Львів Назар Максимович - Прихід товару
A1517: N | B1517: арт | C1517: назва | D1517: закуп | F1517: к-ть | G1517: цiна | H1517: кф | I1517: продж | J1517: дохiд | K1517: % | L1517: з-та
A1518: 1 | B1518: _1.1907 | C1518: Бинокль Galileo 22x32 | D1518: 14.00 | E1518: Инт | F1518: 10 | G1518: 147.00 | H1518: 0.53 | I1518: 1470.00 | J1518: -1330.00 | K1518: 5 | L1518: =RC[-3]/100*RC[-1] -> 0.53
A1519: 2 | B1519: _1.1004 | C1519: Бинокль NIKON (копия) 16x50 black ||N16X50 | D1519: 32.00 | E1519: Инт | F1519: 10 | G1519: 330.00 | H1519: 0.52 | I1519: 3300.00 | J1519: -3100.00 | K1519: 5 | L1519: =RC[-3]/100*RC[-1] -> 0.52
A1520: 3 | B1520: _1.1606 | C1520: Бинокль TASCO 22x36 ||B-22 | D1520: 16.10 | E1520: Инт | F1520: 10 | G1520: 178.00 | H1520: 0.55 | I1520: 1780.00 | J1520: -1440.00 | K1520: 5 | L1520: =RC[-3]/100*RC[-1] -> 0.55
A1521: 4 | B1521: _N21234 | C1521: Кобура поясная ПМ открытая (скоба) | D1521: 5.76 | E1521: Инт | F1521: 37 | G1521: 72.00 | H1521: 0.63 | I1521: 2664.00 | J1521: -1598.40 | K1521: 5 | L1521: =RC[-3]/100*RC[-1] -> 0.63
A1522: 5 | B1522: _NA668 | C1522: Нож складной (копия Gerber) | D1522: 8.72 | E1522: Инт | F1522: 3 | G1522: 109.00 | H1522: 0.63 | I1522: 327.00 | J1522: -196.20 | K1522: 5 | L1522: =RC[-3]/100*RC[-1] -> 0.63
A1523: 6 | B1523: _N14086-2 | C1523: Нож складной Columbia (копия Gerber) резиновая рукоять | D1523: 3.60 | E1523: Инт | F1523: 6 | G1523: 45.00 | H1523: 0.63 | I1523: 270.00 | J1523: -162.00 | K1523: 5 | L1523: =RC[-3]/100*RC[-1] -> 0.63
A1524: 7 | B1524: _NK617 | C1524: Нож складной NAVY | D1524: 14.50 | E1524: Инт | F1524: 5 | G1524: 220.00 | H1524: 0.76 | I1524: 1100.00 | J1524: -350.00 | K1524: 5 | L1524: =RC[-3]/100*RC[-1] -> 0.76
A1525: 8 | B1525: _NK632 | C1525: Нож складной NAVY | D1525: 14.50 | E1525: Инт | F1525: 3 | G1525: 220.00 | H1525: 0.76 | I1525: 660.00 | J1525: -210.00 | K1525: 5 | L1525: =RC[-3]/100*RC[-1] -> 0.76
A1526: 9 | B1526: _NK801 | C1526: Нож складной NAVY | D1526: 14.60 | E1526: Инт | F1526: 3 | G1526: 220.00 | H1526: 0.75 | I1526: 660.00 | J1526: -216.00 | K1526: 5 | L1526: =RC[-3]/100*RC[-1] -> 0.75
A1527: 10 | B1527: _N14086-5 | C1527: Нож складной балисонг | D1527: 3.60 | E1527: Инт | F1527: 10 | G1527: 45.00 | H1527: 0.63 | I1527: 450.00 | J1527: -270.00 | K1527: 5 | L1527: =RC[-3]/100*RC[-1] -> 0.63
A1528: 11 | B1528: _PR2501 | C1528: Револьвер под патрон Флобера PROFI 3 (пластик чёрный) | D1528: 117.64 | E1528: Инт | F1528: 4 | G1528: 1647.00 | H1528: 0.70 | I1528: 6588.00 | J1528: -2823.44 | K1528: 5 | L1528: =RC[-3]/100*RC[-1] -> 0.70
A1529: 12 | B1529: _PR2505 | C1529: Револьвер под патрон Флобера PROFI 4.5 (пластик чёрный) | D1529: 116.71 | E1529: Инт | F1529: 3 | G1529: 1634.00 | H1529: 0.70 | I1529: 4902.00 | J1529: -2100.84 | K1529: 5 | L1529: =RC[-3]/100*RC[-1] -> 0.70 | M1529: =SUM(R[-12]C[-1]:RC[-1]) -> 
A1531: #6668 (2014-07-29) Львів Назар Максимович - Відправлено-Продано
A1532: N | B1532: арт | C1532: назва | D1532: закуп | F1532: к-ть | G1532: цiна | H1532: кф | I1532: продж | J1532: дохiд | K1532: % | L1532: з-та
A1533: 1 | B1533: H3410/2XL | C1533: Футболка ACU ||TS-TSH-CO-10 | D1533: 4.06 | E1533: usd | F1533: 1 | G1533: 121.00 | H1533: 1.49 | I1533: 84.70 | J1533: 3.55 | K1533: 5 | L1533: =RC[-3]/100*RC[-1] -> 1.49
A1534: 2 | B1534: H3410/3XL | C1534: Футболка ACU ||TS-TSH-CO-10 | D1534: 4.06 | E1534: usd | F1534: 1 | G1534: 121.00 | H1534: 1.49 | I1534: 84.70 | J1534: 3.55 | K1534: 5 | L1534: =RC[-3]/100*RC[-1] -> 1.49
A1535: 3 | B1535: H3410/L | C1535: Футболка ACU ||TS-TSH-CO-10 | D1535: 4.06 | E1535: usd | F1535: 1 | G1535: 121.00 | H1535: 1.49 | I1535: 84.70 | J1535: 3.55 | K1535: 5 | L1535: =RC[-3]/100*RC[-1] -> 1.49
A1536: 4 | B1536: H3410/XL | C1536: Футболка ACU ||TS-TSH-CO-10 | D1536: 4.06 | E1536: usd | F1536: 1 | G1536: 121.00 | H1536: 1.49 | I1536: 84.70 | J1536: 3.55 | K1536: 5 | L1536: =RC[-3]/100*RC[-1] -> 1.49
A1537: 5 | B1537: H3407/2XL | C1537: Футболка марпат ||TS-TSH-CO-07 | D1537: 4.13 | E1537: usd | F1537: 1 | G1537: 121.00 | H1537: 1.46 | I1537: 84.70 | J1537: 2.10 | K1537: 5 | L1537: =RC[-3]/100*RC[-1] -> 1.46
A1538: 6 | B1538: H3407/L | C1538: Футболка марпат ||TS-TSH-CO-07 | D1538: 4.13 | E1538: usd | F1538: 1 | G1538: 121.00 | H1538: 1.46 | I1538: 84.70 | J1538: 2.10 | K1538: 5 | L1538: =RC[-3]/100*RC[-1] -> 1.46
A1539: 7 | B1539: H3403/L | C1539: Футболка вудлэнд ||TS-TSH-CO-03 | D1539: 4.06 | E1539: usd | F1539: 2 | G1539: 121.00 | H1539: 1.49 | I1539: 169.40 | J1539: 7.10 | K1539: 5 | L1539: =RC[-3]/100*RC[-1] -> 1.49
A1540: 8 | B1540: H3403/XL | C1540: Футболка вудлэнд ||TS-TSH-CO-03 | D1540: 4.06 | E1540: usd | F1540: 2 | G1540: 121.00 | H1540: 1.49 | I1540: 169.40 | J1540: 7.10 | K1540: 5 | L1540: =RC[-3]/100*RC[-1] -> 1.49
A1541: 9 | B1541: H41991/XLR | C1541: US SFU китель укр.-цифра (PolyCotton) ||BL-SFU-PR-99 | D1541: 15.44 | E1541: usd | F1541: 1 | G1541: 462.00 | H1541: 1.50 | I1541: 323.40 | J1541: 14.60 | K1541: 5 | L1541: =RC[-3]/100*RC[-1] -> 1.50
A1542: 10 | B1542: H4199/LL | C1542: US SFU штаны укр.-цифра (PolyCotton) ||SP-SFU-PR-99 | D1542: 15.44 | E1542: usd | F1542: 1 | G1542: 462.00 | H1542: 1.50 | I1542: 323.40 | J1542: 14.60 | K1542: 5 | L1542: =RC[-3]/100*RC[-1] -> 1.50
A1543: 11 | B1543: M800331/43 | C1543: Берцы MAGNUM Viper II 8" SZ Wide | D1543: 41.15 | E1543: usd | F1543: 1 | G1543: 948.00 | H1543: 1.15 | I1543: 663.60 | J1543: -159.40 | K1543: 5 | L1543: =RC[-3]/100*RC[-1] -> 1.15
A1544: 12 | B1544: H3433/L | C1544: Футболка MP-CAMO ||TS-TSH-CO-33 | D1544: 4.06 | E1544: usd | F1544: 1 | G1544: 121.00 | H1544: 1.49 | I1544: 84.70 | J1544: 3.55 | K1544: 5 | L1544: =RC[-3]/100*RC[-1] -> 1.49
A1545: 13 | B1545: H5233/80-96-112 | C1545: PCS штаны MP CAMO ||SP-PCS-PT-33 | D1545: 19.61 | E1545: usd | F1545: 1 | G1545: 587.00 | H1545: 1.50 | I1545: 410.90 | J1545: 18.70 | K1545: 5 | L1545: =RC[-3]/100*RC[-1] -> 1.50 | M1545: =SUM(R[-13]C[-1]:RC[-1]) -> 
A1547: #6771 (2014-07-31) Львів Назар Максимович - Відправлено-Продано
A1548: N | B1548: арт | C1548: назва | D1548: закуп | F1548: к-ть | G1548: цiна | H1548: кф | I1548: продж | J1548: дохiд | K1548: % | L1548: з-та
A1549: 1 | B1549: _01046 | C1549: Прицел оптический YUKON Craft 3-12x56 | D1549: 2849.00 | E1549: грн | F1549: 1 | G1549: 3025.00 | H1549: 1.06 | I1549: 2571.25 | J1549: -277.75 | K1549: 5 | L1549: =RC[-3]/100*RC[-1] -> 1.06
A1550: 2 | B1550: _10104 | C1550: ПНВ Прицел Digisight N750 weaver | D1550: 10716.00 | E1550: грн | F1550: 1 | G1550: 15500.00 | H1550: 1.45 | I1550: 13950.00 | J1550: 3234.00 | K1550: 5 | L1550: =RC[-3]/100*RC[-1] -> 1.45
A1551: 3 | B1551: _01145 | C1551: ПНВ Монокуляр EXELON 3x50 | D1551: 2617.00 | E1551: грн | F1551: 1 | G1551: 3850.00 | H1551: 1.47 | I1551: 3465.00 | J1551: 848.00 | K1551: 5 | L1551: =RC[-3]/100*RC[-1] -> 1.47 | M1551: =SUM(R[-3]C[-1]:RC[-1]) -> 
A1553: #6871 (2014-08-04) Львів Назар Максимович - Відправлено-Продано
A1554: N | B1554: арт | C1554: назва | D1554: закуп | F1554: к-ть | G1554: цiна | H1554: кф | I1554: продж | J1554: дохiд | K1554: % | L1554: з-та
A1555: 1 | B1555: K11005-O | C1555: Розгрузочна система тактическая STRIKE с подсумками олива ||M51611005-OD | D1555: 18.19 | E1555: usd | F1555: 10 | G1555: 610.00 | H1555: 1.68 | I1555: 4270.00 | J1555: 632.00 | K1555: 5 | L1555: =RC[-3]/100*RC[-1] -> 1.68
A1556: 2 | B1556: H7005/L | C1556: US GI панама с шейной защитой 3-кол.дезерт (R/S) / 7 1/2 ||KA-BON-CR-05 | D1556: 4.06 | E1556: usd | F1556: 1 | G1556: 121.00 | H1556: 1.49 | I1556: 84.70 | J1556: 3.50 | K1556: 5 | L1556: =RC[-3]/100*RC[-1] -> 1.49
A1557: 3 | B1557: H41991/XLR | C1557: US SFU китель укр.-цифра (PolyCotton) ||BL-SFU-PR-99 | D1557: 15.44 | E1557: usd | F1557: 1 | G1557: 462.00 | H1557: 1.50 | I1557: 323.40 | J1557: 14.60 | K1557: 5 | L1557: =RC[-3]/100*RC[-1] -> 1.50
A1558: 4 | B1558: H4199/2XLR | C1558: US SFU штаны укр.-цифра (PolyCotton) ||SP-SFU-PR-99 | D1558: 15.44 | E1558: usd | F1558: 1 | G1558: 462.00 | H1558: 1.50 | I1558: 323.40 | J1558: 14.60 | K1558: 5 | L1558: =RC[-3]/100*RC[-1] -> 1.50
A1559: 5 | B1559: X509 | C1559: Бандана-платок урбан ||X7609 | D1559: 1.25 | E1559: Инт | F1559: 2 | G1559: 35.00 | H1559: 1.40 | I1559: 49.00 | J1559: -1.00 | K1559: 5 | L1559: =RC[-3]/100*RC[-1] -> 1.40
A1560: 6 | B1560: H2302/XL | C1560: Куртка CLASSIC ARMY флисовая олива ||BL-CAF-FL-02 | D1560: 18.29 | E1560: usd | F1560: 1 | G1560: 547.00 | H1560: 1.50 | I1560: 382.90 | J1560: 17.10 | K1560: 5 | L1560: =RC[-3]/100*RC[-1] -> 1.50
A1561: 7 | B1561: H9002/120 | C1561: Ремень ARMY BELT олива ||PS-ARM-CO-02 | D1561: 4.23 | E1561: usd | F1561: 5 | G1561: 126.00 | H1561: 1.49 | I1561: 441.00 | J1561: 18.00 | K1561: 5 | L1561: =RC[-3]/100*RC[-1] -> 1.49
A1562: 8 | B1562: H9002/140 | C1562: Ремень ARMY BELT олива ||PS-ARM-CO-02 | D1562: 4.23 | E1562: usd | F1562: 5 | G1562: 126.00 | H1562: 1.49 | I1562: 441.00 | J1562: 18.00 | K1562: 5 | L1562: =RC[-3]/100*RC[-1] -> 1.49
A1563: 9 | B1563: K12088-С | C1563: Рюкзак Tactical Backpack for 13" laptop койот ||M51612088-TAN | D1563: 21.61 | E1563: usd | F1563: 1 | G1563: 646.00 | H1563: 1.49 | I1563: 452.20 | J1563: 20.00 | K1563: 5 | L1563: =RC[-3]/100*RC[-1] -> 1.49
A1564: 10 | B1564: K12088-O | C1564: Рюкзак Tactical Backpack for 13" laptop олива ||M51612088-OD | D1564: 21.61 | E1564: usd | F1564: 1 | G1564: 646.00 | H1564: 1.49 | I1564: 452.20 | J1564: 20.00 | K1564: 5 | L1564: =RC[-3]/100*RC[-1] -> 1.49 | M1564: =SUM(R[-10]C[-1]:RC[-1]) -> 
A1566: #6894 (2014-08-04) Львів Назар Максимович - Відправлено-Продано
A1567: N | B1567: арт | C1567: назва | D1567: закуп | F1567: к-ть | G1567: цiна | H1567: кф | I1567: продж | J1567: дохiд | K1567: % | L1567: з-та
A1568: 1 | B1568: H29141/M | C1568: Куртка SOFT SHELL мультикам ||BL-SS1-NL-14 | D1568: 32.95 | E1568: usd | F1568: 2 | G1568: 986.00 | H1568: 1.50 | I1568: 1380.40 | J1568: 62.40 | K1568: 5 | L1568: =RC[-3]/100*RC[-1] -> 1.50
A1569: 2 | B1569: H29141/S | C1569: Куртка SOFT SHELL мультикам ||BL-SS1-NL-14 | D1569: 32.95 | E1569: usd | F1569: 1 | G1569: 986.00 | H1569: 1.50 | I1569: 690.20 | J1569: 31.20 | K1569: 5 | L1569: =RC[-3]/100*RC[-1] -> 1.50
A1570: 3 | B1570: H29021/XL | C1570: Куртка SOFT SHELL олива ||BL-SS1-NL-02 | D1570: 32.95 | E1570: usd | F1570: 1 | G1570: 986.00 | H1570: 1.50 | I1570: 690.20 | J1570: 31.20 | K1570: 5 | L1570: =RC[-3]/100*RC[-1] -> 1.50
A1571: 4 | B1571: _RC10S | C1571: Фонарик FENIX RC10 Set | D1571: 91.01 | E1571: usd | F1571: 1 | G1571: 930.00 | H1571: 0.51 | I1571: 930.00 | J1571: -890.20 | K1571: 5 | L1571: =RC[-3]/100*RC[-1] -> 0.51
A1572: 5 | B1572: H8002/130 | C1572: Ремень HKN олива ||PS-HKN-CO-02 | D1572: 3.30 | E1572: usd | F1572: 3 | G1572: 128.00 | H1572: 1.94 | I1572: 268.80 | J1572: 70.80 | K1572: 5 | L1572: =RC[-3]/100*RC[-1] -> 1.94
A1573: 6 | B1573: H8001/130 | C1573: Ремень HKN чёрный ||PS-HKN-CO-01 | D1573: 3.30 | E1573: usd | F1573: 3 | G1573: 128.00 | H1573: 1.94 | I1573: 268.80 | J1573: 70.80 | K1573: 5 | L1573: =RC[-3]/100*RC[-1] -> 1.94
A1574: 7 | B1574: _LD40R4 | C1574: Фонарь FENIX LD40 Cree XP-G LED R4 new | D1574: 35.00 | E1574: usd | F1574: 1 | G1574: 435.00 | H1574: 0.62 | I1574: 435.00 | J1574: -265.00 | K1574: 5 | L1574: =RC[-3]/100*RC[-1] -> 0.62
A1575: 8 | B1575: _LD41U2 | C1575: Фонарь FENIX LD41 U2 | D1575: 50.96 | E1575: usd | F1575: 1 | G1575: 756.00 | H1575: 0.74 | I1575: 756.00 | J1575: -263.20 | K1575: 5 | L1575: =RC[-3]/100*RC[-1] -> 0.74
A1576: 9 | B1576: _TK60 | C1576: Фонарь FENIX TK60 R5 | D1576: 120.00 | E1576: usd | F1576: 1 | G1576: 1305.00 | H1576: 0.54 | I1576: 1305.00 | J1576: -1095.00 | K1576: 5 | L1576: =RC[-3]/100*RC[-1] -> 0.54
A1577: 10 | B1577: _TK61 | C1577: Фонарь светодиодный Fenix TK61 | D1577: 103.40 | E1577: usd | F1577: 1 | G1577: 1306.00 | H1577: 0.63 | I1577: 1306.00 | J1577: -762.00 | K1577: 5 | L1577: =RC[-3]/100*RC[-1] -> 0.63
A1578: 11 | B1578: X2099/50 | C1578: Футболка укр-цифра | D1578: 3.75 | E1578: Инт | F1578: 3 | G1578: 80.00 | H1578: 1.07 | I1578: 168.00 | J1578: -57.00 | K1578: 5 | L1578: =RC[-3]/100*RC[-1] -> 1.07
A1579: 12 | B1579: X2099/52 | C1579: Футболка укр-цифра | D1579: 3.75 | E1579: Инт | F1579: 3 | G1579: 80.00 | H1579: 1.07 | I1579: 168.00 | J1579: -57.00 | K1579: 5 | L1579: =RC[-3]/100*RC[-1] -> 1.07
A1580: 13 | B1580: X2099/56 | C1580: Футболка укр-цифра | D1580: 3.75 | E1580: Инт | F1580: 3 | G1580: 80.00 | H1580: 1.07 | I1580: 168.00 | J1580: -57.00 | K1580: 5 | L1580: =RC[-3]/100*RC[-1] -> 1.07
A1581: 14 | B1581: X2099/48 | C1581: Футболка укр-цифра X3445/48 | D1581: 3.75 | E1581: Инт | F1581: 3 | G1581: 80.00 | H1581: 1.07 | I1581: 168.00 | J1581: -57.00 | K1581: 5 | L1581: =RC[-3]/100*RC[-1] -> 1.07
A1582: 15 | B1582: DS8826/L | C1582: Носки водонепроницаемые Dexshell Thermlite (Зима) | D1582: 16.94 | E1582: usd | F1582: 2 | G1582: 190.00 | H1582: 0.56 | I1582: 380.00 | J1582: -297.78 | K1582: 5 | L1582: =RC[-3]/100*RC[-1] -> 0.56
A1583: 16 | B1583: DS8826/M | C1583: Носки водонепроницаемые Dexshell Thermlite (Зима) | D1583: 16.94 | E1583: usd | F1583: 2 | G1583: 190.00 | H1583: 0.56 | I1583: 380.00 | J1583: -297.78 | K1583: 5 | L1583: =RC[-3]/100*RC[-1] -> 0.56
A1584: 17 | B1584: DS8836/L | C1584: Носки водонепроницаемые Dexshell Trekking (Зима высокие) | D1584: 10.52 | E1584: usd | F1584: 2 | G1584: 194.00 | H1584: 0.92 | I1584: 388.00 | J1584: -32.93 | K1584: 5 | L1584: =RC[-3]/100*RC[-1] -> 0.92
A1585: 18 | B1585: DS8836/M | C1585: Носки водонепроницаемые Dexshell Trekking (Зима высокие) | D1585: 15.44 | E1585: usd | F1585: 2 | G1585: 194.00 | H1585: 0.63 | I1585: 388.00 | J1585: -229.78 | K1585: 5 | L1585: =RC[-3]/100*RC[-1] -> 0.63 | M1585: =SUM(R[-18]C[-1]:RC[-1]) -> 
A1587: #6952 (2014-08-06) Львів Назар Максимович - Відправлено-Продано
A1588: N | B1588: арт | C1588: назва | D1588: закуп | F1588: к-ть | G1588: цiна | H1588: кф | I1588: продж | J1588: дохiд | K1588: % | L1588: з-та
A1589: 1 | B1589: _3378-1/43 | C1589: Берцы STAR FORCE THUNDERSTORM HI чёрные | D1589: 33.53 | E1589: euro | F1589: 3 | G1589: 947.00 | H1589: 1.13 | I1589: 1988.70 | J1589: -526.05 | K1589: 5 | L1589: =RC[-3]/100*RC[-1] -> 1.13
A1590: 2 | B1590: H3403/L | C1590: Футболка вудлэнд ||TS-TSH-CO-03 | D1590: 4.06 | E1590: usd | F1590: 1 | G1590: 121.00 | H1590: 1.49 | I1590: 84.70 | J1590: 3.55 | K1590: 5 | L1590: =RC[-3]/100*RC[-1] -> 1.49
A1591: 3 | B1591: H3403/XL | C1591: Футболка вудлэнд ||TS-TSH-CO-03 | D1591: 4.06 | E1591: usd | F1591: 1 | G1591: 121.00 | H1591: 1.49 | I1591: 84.70 | J1591: 3.55 | K1591: 5 | L1591: =RC[-3]/100*RC[-1] -> 1.49
A1592: 4 | B1592: H3403/2XL | C1592: Футболка вудлэнд ||TS-TSH-CO-03 | D1592: 4.06 | E1592: usd | F1592: 1 | G1592: 121.00 | H1592: 1.49 | I1592: 84.70 | J1592: 3.55 | K1592: 5 | L1592: =RC[-3]/100*RC[-1] -> 1.49
A1593: 5 | B1593: H3402/L | C1593: Футболка олива ||TS-TSH-CO-29 | D1593: 4.06 | E1593: usd | F1593: 1 | G1593: 121.00 | H1593: 1.49 | I1593: 84.70 | J1593: 3.55 | K1593: 5 | L1593: =RC[-3]/100*RC[-1] -> 1.49
A1594: 6 | B1594: H3402/XL | C1594: Футболка олива ||TS-TSH-CO-29 | D1594: 4.06 | E1594: usd | F1594: 1 | G1594: 121.00 | H1594: 1.49 | I1594: 84.70 | J1594: 3.55 | K1594: 5 | L1594: =RC[-3]/100*RC[-1] -> 1.49
A1595: 7 | B1595: H3402/2XL | C1595: Футболка олива ||TS-TSH-CO-29 | D1595: 4.06 | E1595: usd | F1595: 1 | G1595: 121.00 | H1595: 1.49 | I1595: 84.70 | J1595: 3.55 | K1595: 5 | L1595: =RC[-3]/100*RC[-1] -> 1.49
A1596: 8 | B1596: H3433/L | C1596: Футболка MP-CAMO ||TS-TSH-CO-33 | D1596: 4.06 | E1596: usd | F1596: 1 | G1596: 121.00 | H1596: 1.49 | I1596: 84.70 | J1596: 3.55 | K1596: 5 | L1596: =RC[-3]/100*RC[-1] -> 1.49
A1597: 9 | B1597: H3433/XL | C1597: Футболка MP-CAMO ||TS-TSH-CO-33 | D1597: 4.06 | E1597: usd | F1597: 1 | G1597: 121.00 | H1597: 1.49 | I1597: 84.70 | J1597: 3.55 | K1597: 5 | L1597: =RC[-3]/100*RC[-1] -> 1.49
A1598: 10 | B1598: K12088-O | C1598: Рюкзак Tactical Backpack for 13" laptop олива ||M51612088-OD | D1598: 21.61 | E1598: usd | F1598: 1 | G1598: 646.00 | H1598: 1.49 | I1598: 452.20 | J1598: 20.00 | K1598: 5 | L1598: =RC[-3]/100*RC[-1] -> 1.49 | M1598: =SUM(R[-10]C[-1]:RC[-1]) -> 
A1600: #6972 (2014-08-07) Львів Назар Максимович - Відправлено-Продано
A1601: N | B1601: арт | C1601: назва | D1601: закуп | F1601: к-ть | G1601: цiна | H1601: кф | I1601: продж | J1601: дохiд | K1601: % | L1601: з-та
A1602: 1 | B1602: _3378-1/43 | C1602: Берцы STAR FORCE THUNDERSTORM HI чёрные | D1602: 33.53 | E1602: euro | F1602: 3 | G1602: 947.00 | H1602: 1.13 | I1602: 1988.70 | J1602: -526.05 | K1602: 5 | L1602: =RC[-3]/100*RC[-1] -> 1.13
A1603: 2 | B1603: _3378-1/44 | C1603: Берцы STAR FORCE THUNDERSTORM HI чёрные | D1603: 33.53 | E1603: euro | F1603: 3 | G1603: 947.00 | H1603: 1.13 | I1603: 1988.70 | J1603: -526.05 | K1603: 5 | L1603: =RC[-3]/100*RC[-1] -> 1.13
A1604: 3 | B1604: H65031/S | C1604: Куртка М65 с отстегивающейся курткой вудлэнд (NYCO) ||KU-M65-NY-03 | D1604: 37.22 | E1604: usd | F1604: 1 | G1604: 1148.00 | H1604: 1.54 | I1604: 803.60 | J1604: 59.20 | K1604: 5 | L1604: =RC[-3]/100*RC[-1] -> 1.54
A1605: 4 | B1605: _M11602 | C1605: Нож MORA® Bushcraft Forest | D1605: 19.06 | E1605: usd | F1605: 1 | G1605: 370.00 | H1605: 0.97 | I1605: 296.00 | J1605: -85.19 | K1605: 5 | L1605: =RC[-3]/100*RC[-1] -> 0.97
A1606: 5 | B1606: _M12043 | C1606: Нож Morakniv™ Bushcraft Black | D1606: 22.25 | E1606: usd | F1606: 1 | G1606: 406.00 | H1606: 0.91 | I1606: 324.80 | J1606: -120.17 | K1606: 5 | L1606: =RC[-3]/100*RC[-1] -> 0.91
A1607: 6 | B1607: _M11832 | C1607: Нож Morakniv™ Bushcraft Desert Camo | D1607: 22.25 | E1607: usd | F1607: 1 | G1607: 406.00 | H1607: 0.91 | I1607: 324.80 | J1607: -120.20 | K1607: 5 | L1607: =RC[-3]/100*RC[-1] -> 0.91
A1608: 7 | B1608: _M11920 | C1608: Нож Morakniv™ Bushcraft Forest Camo | D1608: 22.25 | E1608: usd | F1608: 1 | G1608: 406.00 | H1608: 0.91 | I1608: 324.80 | J1608: -120.20 | K1608: 5 | L1608: =RC[-3]/100*RC[-1] -> 0.91
A1609: 8 | B1609: _M12049 | C1609: Нож Morakniv™ Bushcraft Orange | D1609: 20.65 | E1609: usd | F1609: 1 | G1609: 384.00 | H1609: 0.93 | I1609: 307.20 | J1609: -105.88 | K1609: 5 | L1609: =RC[-3]/100*RC[-1] -> 0.93
A1610: 9 | B1610: _M11742 | C1610: Нож Morakniv™ Bushcraft Survival Black | D1610: 39.07 | E1610: usd | F1610: 1 | G1610: 697.00 | H1610: 0.89 | I1610: 557.60 | J1610: -223.71 | K1610: 5 | L1610: =RC[-3]/100*RC[-1] -> 0.89
A1611: 10 | B1611: _M12051 | C1611: Нож Morakniv™ Bushcraft Survival Orange | D1611: 35.08 | E1611: usd | F1611: 1 | G1611: 641.00 | H1611: 0.91 | I1611: 512.80 | J1611: -188.78 | K1611: 5 | L1611: =RC[-3]/100*RC[-1] -> 0.91
A1612: 11 | B1612: _M860-1 | C1612: Нож MORAKNIV® Companion MG Carbon ||NZ-860-ST-02 | D1612: 6.06 | E1612: usd | F1612: 10 | G1612: 122.00 | H1612: 1.01 | I1612: 854.00 | J1612: -357.82 | K1612: 5 | L1612: =RC[-3]/100*RC[-1] -> 1.01 | M1612: =SUM(R[-11]C[-1]:RC[-1]) -> 
A1614: #7000 (2014-08-07) Львів Назар Максимович - Відправлено-Продано
A1615: N | B1615: арт | C1615: назва | D1615: закуп | F1615: к-ть | G1615: цiна | H1615: кф | I1615: продж | J1615: дохiд | K1615: % | L1615: з-та
A1616: 1 | B1616: _3378-1/43 | C1616: Берцы STAR FORCE THUNDERSTORM HI чёрные | D1616: 33.53 | E1616: euro | F1616: 1 | G1616: 947.00 | H1616: 1.13 | I1616: 662.90 | J1616: -175.35 | K1616: 5 | L1616: =RC[-3]/100*RC[-1] -> 1.13
A1617: 2 | B1617: H3401/M | C1617: Футболка чёрная ||TS-TSH-CO-01 | D1617: 4.06 | E1617: usd | F1617: 2 | G1617: 121.00 | H1617: 1.49 | I1617: 169.40 | J1617: 7.10 | K1617: 5 | L1617: =RC[-3]/100*RC[-1] -> 1.49
A1618: 3 | B1618: H3401/L | C1618: Футболка чёрная ||TS-TSH-CO-01 | D1618: 4.06 | E1618: usd | F1618: 2 | G1618: 121.00 | H1618: 1.49 | I1618: 169.40 | J1618: 7.10 | K1618: 5 | L1618: =RC[-3]/100*RC[-1] -> 1.49
A1619: 4 | B1619: H41991/XLR | C1619: US SFU китель укр.-цифра (PolyCotton) ||BL-SFU-PR-99 | D1619: 15.44 | E1619: usd | F1619: 1 | G1619: 462.00 | H1619: 1.50 | I1619: 323.40 | J1619: 14.60 | K1619: 5 | L1619: =RC[-3]/100*RC[-1] -> 1.50
A1620: 5 | B1620: H4199/LL | C1620: US SFU штаны укр.-цифра (PolyCotton) ||SP-SFU-PR-99 | D1620: 15.44 | E1620: usd | F1620: 1 | G1620: 462.00 | H1620: 1.50 | I1620: 323.40 | J1620: 14.60 | K1620: 5 | L1620: =RC[-3]/100*RC[-1] -> 1.50
A1621: 6 | B1621: H4103/XLR | C1621: US SFU штаны вудлэнд (R/S) ||SP-SFU-CR-03 | D1621: 14.49 | E1621: usd | F1621: 1 | G1621: 433.00 | H1621: 1.49 | I1621: 303.10 | J1621: 13.30 | K1621: 5 | L1621: =RC[-3]/100*RC[-1] -> 1.49 | M1621: =SUM(R[-6]C[-1]:RC[-1]) -> 
A1623: #7048 (2014-08-08) Львів Назар Максимович - Відправлено-Продано
A1624: N | B1624: арт | C1624: назва | D1624: закуп | F1624: к-ть | G1624: цiна | H1624: кф | I1624: продж | J1624: дохiд | K1624: % | L1624: з-та
A1625: 1 | B1625: K4-2105 | C1625: Винтовка электропневматическая страйкбольная AK74 рам.приклад (метал+дерево) [RK03] | D1625: 115.46 | E1625: usd | F1625: 1 | G1625: 2987.00 | H1625: 1.29 | I1625: 2538.95 | J1625: 229.75 | K1625: 5 | L1625: =RC[-3]/100*RC[-1] -> 1.29
A1626: 2 | B1626: K8-9606 | C1626: Пістолет газопневматический страйкбольний (Green Gas) BERETTA M92F/M9 (ABS+метал) [KJW] ||GGB-9606 | D1626: 35.22 | E1626: usd | F1626: 1 | G1626: 939.00 | H1626: 1.33 | I1626: 751.20 | J1626: 46.80 | K1626: 5 | L1626: =RC[-3]/100*RC[-1] -> 1.33
A1627: 3 | B1627: _1400020 | C1627: Каремат туристический 10мм | D1627: 4.15 | E1627: Инт | F1627: 10 | G1627: 70.00 | H1627: 0.84 | I1627: 700.00 | J1627: -130.00 | K1627: 5 | L1627: =RC[-3]/100*RC[-1] -> 0.84
A1628: 4 | B1628: _1400021 | C1628: Каремат-сидушка туристический 8мм олива | D1628: 1.00 | E1628: Инт | F1628: 10 | G1628: 40.00 | H1628: 2.00 | I1628: 280.00 | J1628: 80.00 | K1628: 5 | L1628: =RC[-3]/100*RC[-1] -> 2.00 | M1628: =SUM(R[-4]C[-1]:RC[-1]) -> 
A1630: #7049 (2014-08-08) Львів Назар Максимович - Прихід товару
A1631: N | B1631: арт | C1631: назва | D1631: закуп | F1631: к-ть | G1631: цiна | H1631: кф | I1631: продж | J1631: дохiд | K1631: % | L1631: з-та
A1632: 1 | B1632: _1.1402 | C1632: Бинокль SAKURA 30x60 ||B-20 | D1632: 9.00 | E1632: Инт | F1632: 1 | G1632: 175.00 | H1632: 0.97 | I1632: 175.00 | J1632: -5.00 | K1632: 5 | L1632: =RC[-3]/100*RC[-1] -> 0.97
A1633: 2 | B1633: _1.1402 | C1633: Бинокль SAKURA 30x60 ||B-20 | D1633: 9.00 | E1633: Инт | F1633: 9 | G1633: 175.00 | H1633: 0.97 | I1633: 1575.00 | J1633: -45.00 | K1633: 5 | L1633: =RC[-3]/100*RC[-1] -> 0.97
A1634: 3 | B1634: _1.0508 | C1634: Бинокль Tasco 20x50 | D1634: 273.00 | E1634: грн | F1634: 2 | G1634: 273.00 | H1634: 1.00 | I1634: 546.00 | J1634: 0.00 | K1634: 5 | L1634: =RC[-3]/100*RC[-1] -> 1.00
A1635: 4 | B1635: _1.05211 | C1635: Монокуляр BUSHNELL 6x18 ||18-0120 | D1635: 8.00 | E1635: Инт | F1635: 5 | G1635: 96.00 | H1635: 0.60 | I1635: 480.00 | J1635: -320.00 | K1635: 5 | L1635: =RC[-3]/100*RC[-1] -> 0.60
A1636: 5 | B1636: _1.052111 | C1636: Монокуляр Bushnell 16x52 ||18-0120 | D1636: 19.20 | E1636: Инт | F1636: 5 | G1636: 236.00 | H1636: 0.61 | I1636: 1180.00 | J1636: -740.00 | K1636: 5 | L1636: =RC[-3]/100*RC[-1] -> 0.61
A1637: 6 | B1637: _1.05212 | C1637: Монокуляр KANDAR 6X30 ||18-0120 | D1637: 24.00 | E1637: Инт | F1637: 5 | G1637: 312.00 | H1637: 0.65 | I1637: 1560.00 | J1637: -840.00 | K1637: 5 | L1637: =RC[-3]/100*RC[-1] -> 0.65
A1638: 7 | B1638: _1.0521 | C1638: Монокуляр NIKULA 7x18 ||18-0120 | D1638: 13.00 | E1638: Инт | F1638: 5 | G1638: 169.00 | H1638: 0.65 | I1638: 845.00 | J1638: -455.00 | K1638: 5 | L1638: =RC[-3]/100*RC[-1] -> 0.65
A1639: 8 | B1639: _1.1615 | C1639: Монокуляр TASCO 22x32 black | D1639: 98.00 | E1639: грн | F1639: 2 | G1639: 98.00 | H1639: 1.00 | I1639: 196.00 | J1639: 0.00 | K1639: 5 | L1639: =RC[-3]/100*RC[-1] -> 1.00
A1640: 9 | B1640: _1.16151 | C1640: Монокуляр TASCO 22x32 woodland | D1640: 7.60 | E1640: Инт | F1640: 1 | G1640: 98.00 | H1640: 0.64 | I1640: 98.00 | J1640: -54.00 | K1640: 5 | L1640: =RC[-3]/100*RC[-1] -> 0.64
A1641: 10 | B1641: _1.16151 | C1641: Монокуляр TASCO 22x32 woodland | D1641: 7.60 | E1641: Инт | F1641: 2 | G1641: 98.00 | H1641: 0.64 | I1641: 196.00 | J1641: -108.00 | K1641: 5 | L1641: =RC[-3]/100*RC[-1] -> 0.64
A1642: 11 | B1642: _1684 | C1642: Патрон Флобера 4мм Нобель | D1642: 0.20 | E1642: Инт | F1642: 2000 | G1642: 2.85 | H1642: 0.70 | I1642: 5700.00 | J1642: -2442.84 | K1642: 5 | L1642: =RC[-3]/100*RC[-1] -> 0.70
A1643: 12 | B1643: _2069 | C1643: Патрон Флобера 4мм Чехія (200шт) | D1643: 0.13 | E1643: Инт | F1643: 2000 | G1643: 1.85 | H1643: 0.70 | I1643: 3700.00 | J1643: -1585.72 | K1643: 5 | L1643: =RC[-3]/100*RC[-1] -> 0.70
A1644: 13 | B1644: _273-1200 | C1644: Пістолет пневматичний SAS Makarov PM | D1644: 40.84 | E1644: Инт | F1644: 5 | G1644: 585.00 | H1644: 0.72 | I1644: 2925.00 | J1644: -1159.00 | K1644: 5 | L1644: =RC[-3]/100*RC[-1] -> 0.72 | M1644: =SUM(R[-13]C[-1]:RC[-1]) -> 
A1646: #7085 (2014-08-11) Львів Назар Максимович - Відправлено-Продано
A1647: N | B1647: арт | C1647: назва | D1647: закуп | F1647: к-ть | G1647: цiна | H1647: кф | I1647: продж | J1647: дохiд | K1647: % | L1647: з-та
A1648: 1 | B1648: H3403/L | C1648: Футболка вудлэнд ||TS-TSH-CO-03 | D1648: 4.06 | E1648: usd | F1648: 1 | G1648: 121.00 | H1648: 1.49 | I1648: 84.70 | J1648: 3.55 | K1648: 5 | L1648: =RC[-3]/100*RC[-1] -> 1.49
A1649: 2 | B1649: H3403/XL | C1649: Футболка вудлэнд ||TS-TSH-CO-03 | D1649: 4.06 | E1649: usd | F1649: 3 | G1649: 121.00 | H1649: 1.49 | I1649: 254.10 | J1649: 10.65 | K1649: 5 | L1649: =RC[-3]/100*RC[-1] -> 1.49
A1650: 3 | B1650: H3403/2XL | C1650: Футболка вудлэнд ||TS-TSH-CO-03 | D1650: 4.06 | E1650: usd | F1650: 6 | G1650: 121.00 | H1650: 1.49 | I1650: 508.20 | J1650: 21.30 | K1650: 5 | L1650: =RC[-3]/100*RC[-1] -> 1.49
A1651: 4 | B1651: H3403/3XL | C1651: Футболка вудлэнд ||TS-TSH-CO-03 | D1651: 4.06 | E1651: usd | F1651: 1 | G1651: 121.00 | H1651: 1.49 | I1651: 84.70 | J1651: 3.55 | K1651: 5 | L1651: =RC[-3]/100*RC[-1] -> 1.49
A1652: 5 | B1652: H3404/L | C1652: Футболка польский вудлэнд ||TS-TSH-CO-04 | D1652: 4.06 | E1652: usd | F1652: 1 | G1652: 121.00 | H1652: 1.49 | I1652: 84.70 | J1652: 3.55 | K1652: 5 | L1652: =RC[-3]/100*RC[-1] -> 1.49
A1653: 6 | B1653: H3404/XL | C1653: Футболка польский вудлэнд ||TS-TSH-CO-04 | D1653: 4.06 | E1653: usd | F1653: 1 | G1653: 121.00 | H1653: 1.49 | I1653: 84.70 | J1653: 3.55 | K1653: 5 | L1653: =RC[-3]/100*RC[-1] -> 1.49
A1654: 7 | B1654: H3404/2XL | C1654: Футболка польский вудлэнд ||TS-TSH-CO-04 | D1654: 4.06 | E1654: usd | F1654: 2 | G1654: 121.00 | H1654: 1.49 | I1654: 169.40 | J1654: 7.10 | K1654: 5 | L1654: =RC[-3]/100*RC[-1] -> 1.49
A1655: 8 | B1655: H3410/M | C1655: Футболка ACU ||TS-TSH-CO-10 | D1655: 4.06 | E1655: usd | F1655: 1 | G1655: 121.00 | H1655: 1.49 | I1655: 84.70 | J1655: 3.55 | K1655: 5 | L1655: =RC[-3]/100*RC[-1] -> 1.49
A1656: 9 | B1656: H3410/L | C1656: Футболка ACU ||TS-TSH-CO-10 | D1656: 4.06 | E1656: usd | F1656: 1 | G1656: 121.00 | H1656: 1.49 | I1656: 84.70 | J1656: 3.55 | K1656: 5 | L1656: =RC[-3]/100*RC[-1] -> 1.49
A1657: 10 | B1657: H3410/XL | C1657: Футболка ACU ||TS-TSH-CO-10 | D1657: 4.06 | E1657: usd | F1657: 1 | G1657: 121.00 | H1657: 1.49 | I1657: 84.70 | J1657: 3.55 | K1657: 5 | L1657: =RC[-3]/100*RC[-1] -> 1.49
A1658: 11 | B1658: H3410/2XL | C1658: Футболка ACU ||TS-TSH-CO-10 | D1658: 4.06 | E1658: usd | F1658: 1 | G1658: 121.00 | H1658: 1.49 | I1658: 84.70 | J1658: 3.55 | K1658: 5 | L1658: =RC[-3]/100*RC[-1] -> 1.49
A1659: 12 | B1659: _3378-1/45 | C1659: Берцы STAR FORCE THUNDERSTORM HI чёрные | D1659: 33.53 | E1659: euro | F1659: 1 | G1659: 947.00 | H1659: 1.13 | I1659: 662.90 | J1659: -175.35 | K1659: 5 | L1659: =RC[-3]/100*RC[-1] -> 1.13
A1660: 13 | B1660: _3378-1/46 | C1660: Берцы STAR FORCE THUNDERSTORM HI чёрные | D1660: 33.53 | E1660: euro | F1660: 1 | G1660: 947.00 | H1660: 1.13 | I1660: 662.90 | J1660: -175.35 | K1660: 5 | L1660: =RC[-3]/100*RC[-1] -> 1.13
A1661: 14 | B1661: X402 | C1661: Балаклава олива с 1-м отв.(100%хлопок) ||X76012 | D1661: 3.15 | E1661: Инт | F1661: 10 | G1661: 50.00 | H1661: 0.79 | I1661: 350.00 | J1661: -280.00 | K1661: 5 | L1661: =RC[-3]/100*RC[-1] -> 0.79
A1662: 15 | B1662: X401 | C1662: Балаклава чёрная с 1-м отв.(100%хлопок) ||X7601 | D1662: 3.15 | E1662: Инт | F1662: 10 | G1662: 50.00 | H1662: 0.79 | I1662: 350.00 | J1662: -280.00 | K1662: 5 | L1662: =RC[-3]/100*RC[-1] -> 0.79
A1663: 16 | B1663: H7003/L | C1663: US GI панама с шейной защитой вудлэнд (R/S) / 7 1/2 ||KA-BON-CR-03 | D1663: 4.06 | E1663: usd | F1663: 2 | G1663: 121.00 | H1663: 1.49 | I1663: 169.40 | J1663: 7.00 | K1663: 5 | L1663: =RC[-3]/100*RC[-1] -> 1.49
A1664: 17 | B1664: H7003/XL | C1664: US GI панама с шейной защитой вудлэнд (R/S) / 7 3/4 ||KA-BON-CR-03 | D1664: 4.06 | E1664: usd | F1664: 2 | G1664: 121.00 | H1664: 1.49 | I1664: 169.40 | J1664: 7.00 | K1664: 5 | L1664: =RC[-3]/100*RC[-1] -> 1.49
A1665: 18 | B1665: _H1000 | C1665: Пила дуговая 30" Bow Saw Army Tools | D1665: 5.00 | E1665: usd | F1665: 5 | G1665: 59.00 | H1665: 0.59 | I1665: 206.50 | J1665: -293.50 | K1665: 5 | L1665: =RC[-3]/100*RC[-1] -> 0.59 | M1665: =SUM(R[-18]C[-1]:RC[-1]) -> 
A1667: #7089 (2014-08-11) Львів Назар Максимович - Відправлено-Продано
A1668: N | B1668: арт | C1668: назва | D1668: закуп | F1668: к-ть | G1668: цiна | H1668: кф | I1668: продж | J1668: дохiд | K1668: % | L1668: з-та
A1669: 1 | B1669: H43141/2XLR | C1669: US SFU китель мультикам (PolyCotton) ||BL-SFU-PR-14 | D1669: 16.64 | E1669: usd | F1669: 1 | G1669: 504.00 | H1669: 1.51 | I1669: 352.80 | J1669: 20.00 | K1669: 5 | L1669: =RC[-3]/100*RC[-1] -> 1.51
A1670: 2 | B1670: H4314/2XLR | C1670: US SFU штаны мультикам (NYCO R/S) ||SP-SFU-PR-14 | D1670: 16.64 | E1670: usd | F1670: 1 | G1670: 504.00 | H1670: 1.51 | I1670: 352.80 | J1670: 20.00 | K1670: 5 | L1670: =RC[-3]/100*RC[-1] -> 1.51
A1671: 3 | B1671: H4199/SR | C1671: US SFU штаны укр.-цифра (PolyCotton) ||SP-SFU-PR-99 | D1671: 15.44 | E1671: usd | F1671: 1 | G1671: 462.00 | H1671: 1.50 | I1671: 323.40 | J1671: 14.60 | K1671: 5 | L1671: =RC[-3]/100*RC[-1] -> 1.50
A1672: 4 | B1672: H4199/MR | C1672: US SFU штаны укр.-цифра (PolyCotton) ||SP-SFU-PR-99 | D1672: 15.44 | E1672: usd | F1672: 1 | G1672: 462.00 | H1672: 1.50 | I1672: 323.40 | J1672: 14.60 | K1672: 5 | L1672: =RC[-3]/100*RC[-1] -> 1.50
A1673: 5 | B1673: H4199/LR | C1673: US SFU штаны укр.-цифра (PolyCotton) ||SP-SFU-PR-99 | D1673: 15.44 | E1673: usd | F1673: 1 | G1673: 462.00 | H1673: 1.50 | I1673: 323.40 | J1673: 14.60 | K1673: 5 | L1673: =RC[-3]/100*RC[-1] -> 1.50
A1674: 6 | B1674: H4199/2XLR | C1674: US SFU штаны укр.-цифра (PolyCotton) ||SP-SFU-PR-99 | D1674: 15.44 | E1674: usd | F1674: 1 | G1674: 462.00 | H1674: 1.50 | I1674: 323.40 | J1674: 14.60 | K1674: 5 | L1674: =RC[-3]/100*RC[-1] -> 1.50
A1675: 7 | B1675: H41991/SR | C1675: US SFU китель укр.-цифра (PolyCotton) ||BL-SFU-PR-99 | D1675: 15.44 | E1675: usd | F1675: 1 | G1675: 462.00 | H1675: 1.50 | I1675: 323.40 | J1675: 14.60 | K1675: 5 | L1675: =RC[-3]/100*RC[-1] -> 1.50
A1676: 8 | B1676: H41991/MR | C1676: US SFU китель укр.-цифра (PolyCotton) ||BL-SFU-PR-99 | D1676: 15.44 | E1676: usd | F1676: 1 | G1676: 462.00 | H1676: 1.50 | I1676: 323.40 | J1676: 14.60 | K1676: 5 | L1676: =RC[-3]/100*RC[-1] -> 1.50
A1677: 9 | B1677: H41991/LR | C1677: US SFU китель укр.-цифра (PolyCotton) ||BL-SFU-PR-99 | D1677: 15.44 | E1677: usd | F1677: 1 | G1677: 462.00 | H1677: 1.50 | I1677: 323.40 | J1677: 14.60 | K1677: 5 | L1677: =RC[-3]/100*RC[-1] -> 1.50
A1678: 10 | B1678: H41991/XLR | C1678: US SFU китель укр.-цифра (PolyCotton) ||BL-SFU-PR-99 | D1678: 15.44 | E1678: usd | F1678: 1 | G1678: 462.00 | H1678: 1.50 | I1678: 323.40 | J1678: 14.60 | K1678: 5 | L1678: =RC[-3]/100*RC[-1] -> 1.50
A1679: 11 | B1679: H41991/2XLR | C1679: US SFU китель укр.-цифра (PolyCotton) ||BL-SFU-PR-99 | D1679: 15.44 | E1679: usd | F1679: 1 | G1679: 462.00 | H1679: 1.50 | I1679: 323.40 | J1679: 14.60 | K1679: 5 | L1679: =RC[-3]/100*RC[-1] -> 1.50
A1680: 12 | B1680: H4199/XLR | C1680: US SFU штаны укр.-цифра (PolyCotton) ||SP-SFU-PR-99 | D1680: 15.44 | E1680: usd | F1680: 1 | G1680: 462.00 | H1680: 1.50 | I1680: 323.40 | J1680: 14.60 | K1680: 5 | L1680: =RC[-3]/100*RC[-1] -> 1.50 | M1680: =SUM(R[-12]C[-1]:RC[-1]) -> 
A1682: #7108 (2014-08-11) Львів Назар Максимович - Відправлено-Продано
A1683: N | B1683: арт | C1683: назва | D1683: закуп | F1683: к-ть | G1683: цiна | H1683: кф | I1683: продж | J1683: дохiд | K1683: % | L1683: з-та
A1684: 1 | B1684: _18-02922 | C1684: ПНВ Монокуляр CHALLENGER GS 4.5x60 | D1684: 3762.00 | E1684: грн | F1684: 2 | G1684: 5320.00 | H1684: 1.41 | I1684: 9044.00 | J1684: 1520.00 | K1684: 5 | L1684: =RC[-3]/100*RC[-1] -> 1.41 | M1684: =SUM(R[-1]C[-1]:RC[-1]) -> 
A1686: #7117 (2014-08-11) Львів Назар Максимович - Відправлено-Продано
A1687: N | B1687: арт | C1687: назва | D1687: закуп | F1687: к-ть | G1687: цiна | H1687: кф | I1687: продж | J1687: дохiд | K1687: % | L1687: з-та
A1688: 1 | B1688: H5914/XLR | C1688: CPU штаны мультикамо (PolyCotton) ||SP-CPU-PR-14 | D1688: 21.56 | E1688: usd | F1688: 18 | G1688: 641.00 | H1688: 1.49 | I1688: 8076.60 | J1688: 315.00 | K1688: 5 | L1688: =RC[-3]/100*RC[-1] -> 1.49
A1689: 2 | B1689: H43141/2XLR | C1689: US SFU китель мультикам (PolyCotton) ||BL-SFU-PR-14 | D1689: 16.64 | E1689: usd | F1689: 4 | G1689: 504.00 | H1689: 1.51 | I1689: 1411.20 | J1689: 80.00 | K1689: 5 | L1689: =RC[-3]/100*RC[-1] -> 1.51
A1690: 3 | B1690: H43141/LR | C1690: US SFU китель мультикам (PolyCotton) ||BL-SFU-PR-14 | D1690: 16.64 | E1690: usd | F1690: 17 | G1690: 504.00 | H1690: 1.51 | I1690: 5997.60 | J1690: 340.00 | K1690: 5 | L1690: =RC[-3]/100*RC[-1] -> 1.51
A1691: 4 | B1691: H43141/MR | C1691: US SFU китель мультикам (PolyCotton) ||BL-SFU-PR-14 | D1691: 16.64 | E1691: usd | F1691: 1 | G1691: 504.00 | H1691: 1.51 | I1691: 352.80 | J1691: 20.00 | K1691: 5 | L1691: =RC[-3]/100*RC[-1] -> 1.51
A1692: 5 | B1692: H4314/2XLR | C1692: US SFU штаны мультикам (NYCO R/S) ||SP-SFU-PR-14 | D1692: 16.64 | E1692: usd | F1692: 4 | G1692: 504.00 | H1692: 1.51 | I1692: 1411.20 | J1692: 80.00 | K1692: 5 | L1692: =RC[-3]/100*RC[-1] -> 1.51 | M1692: =SUM(R[-5]C[-1]:RC[-1]) -> 
A1694: #7130 (2014-08-12) Львів Назар Максимович - Відправлено-Продано
A1695: N | B1695: арт | C1695: назва | D1695: закуп | F1695: к-ть | G1695: цiна | H1695: кф | I1695: продж | J1695: дохiд | K1695: % | L1695: з-та
A1696: 1 | B1696: H43011/LR | C1696: US SFU китель чёрный (PolyCotton) ||BL-SFU-PR-01 | D1696: 15.03 | E1696: usd | F1696: 60 | G1696: 433.00 | H1696: 1.44 | I1696: 16887.00 | J1696: -1149.00 | K1696: 5 | L1696: =RC[-3]/100*RC[-1] -> 1.44
A1697: 2 | B1697: H43011/MR | C1697: US SFU китель чёрный (PolyCotton) ||BL-SFU-PR-01 | D1697: 15.03 | E1697: usd | F1697: 60 | G1697: 433.00 | H1697: 1.44 | I1697: 16887.00 | J1697: -1149.00 | K1697: 5 | L1697: =RC[-3]/100*RC[-1] -> 1.44
A1698: 3 | B1698: H43011/SR | C1698: US SFU китель чёрный (PolyCotton) ||BL-SFU-PR-01 | D1698: 15.03 | E1698: usd | F1698: 20 | G1698: 433.00 | H1698: 1.44 | I1698: 5629.00 | J1698: -383.00 | K1698: 5 | L1698: =RC[-3]/100*RC[-1] -> 1.44
A1699: 4 | B1699: H4301/LL | C1699: US SFU штаны чёрные (PolyCotton) ||SP-SFU-PR-01 | D1699: 15.03 | E1699: usd | F1699: 20 | G1699: 433.00 | H1699: 1.44 | I1699: 5629.00 | J1699: -383.00 | K1699: 5 | L1699: =RC[-3]/100*RC[-1] -> 1.44
A1700: 5 | B1700: H4301/LR | C1700: US SFU штаны чёрные (PolyCotton) ||SP-SFU-PR-01 | D1700: 15.03 | E1700: usd | F1700: 40 | G1700: 433.00 | H1700: 1.44 | I1700: 11258.00 | J1700: -766.00 | K1700: 5 | L1700: =RC[-3]/100*RC[-1] -> 1.44
A1701: 6 | B1701: H4301/ML | C1701: US SFU штаны чёрные (PolyCotton) ||SP-SFU-PR-01 | D1701: 15.03 | E1701: usd | F1701: 25 | G1701: 433.00 | H1701: 1.44 | I1701: 7036.25 | J1701: -478.75 | K1701: 5 | L1701: =RC[-3]/100*RC[-1] -> 1.44
A1702: 7 | B1702: H4301/MR | C1702: US SFU штаны чёрные (PolyCotton) ||SP-SFU-PR-01 | D1702: 15.03 | E1702: usd | F1702: 55 | G1702: 433.00 | H1702: 1.44 | I1702: 15479.80 | J1702: -1053.20 | K1702: 5 | L1702: =RC[-3]/100*RC[-1] -> 1.44 | M1702: =SUM(R[-7]C[-1]:RC[-1]) -> 
A1704: #7146 (2014-08-12) Львів Назар Максимович - Відправлено-Продано
A1705: N | B1705: арт | C1705: назва | D1705: закуп | F1705: к-ть | G1705: цiна | H1705: кф | I1705: продж | J1705: дохiд | K1705: % | L1705: з-та
A1706: 1 | B1706: M800331/44 | C1706: Берцы MAGNUM Viper II 8" SZ Wide | D1706: 41.15 | E1706: usd | F1706: 2 | G1706: 948.00 | H1706: 1.15 | I1706: 1327.20 | J1706: -318.80 | K1706: 5 | L1706: =RC[-3]/100*RC[-1] -> 1.15
A1707: 2 | B1707: M800331/45 | C1707: Берцы MAGNUM Viper II 8" SZ Wide | D1707: 41.15 | E1707: usd | F1707: 3 | G1707: 948.00 | H1707: 1.15 | I1707: 1990.80 | J1707: -478.20 | K1707: 5 | L1707: =RC[-3]/100*RC[-1] -> 1.15
A1708: 3 | B1708: _3378-1/43 | C1708: Берцы STAR FORCE THUNDERSTORM HI чёрные | D1708: 33.53 | E1708: euro | F1708: 3 | G1708: 947.00 | H1708: 1.13 | I1708: 1988.70 | J1708: -526.05 | K1708: 5 | L1708: =RC[-3]/100*RC[-1] -> 1.13
A1709: 4 | B1709: _3378-1/44 | C1709: Берцы STAR FORCE THUNDERSTORM HI чёрные | D1709: 33.53 | E1709: euro | F1709: 1 | G1709: 947.00 | H1709: 1.13 | I1709: 662.90 | J1709: -175.35 | K1709: 5 | L1709: =RC[-3]/100*RC[-1] -> 1.13
A1710: 5 | B1710: _3378-1/45 | C1710: Берцы STAR FORCE THUNDERSTORM HI чёрные | D1710: 33.53 | E1710: euro | F1710: 1 | G1710: 947.00 | H1710: 1.13 | I1710: 662.90 | J1710: -175.35 | K1710: 5 | L1710: =RC[-3]/100*RC[-1] -> 1.13
A1711: 6 | B1711: H41991/SR | C1711: US SFU китель укр.-цифра (PolyCotton) ||BL-SFU-PR-99 | D1711: 15.44 | E1711: usd | F1711: 1 | G1711: 462.00 | H1711: 1.50 | I1711: 323.40 | J1711: 14.60 | K1711: 5 | L1711: =RC[-3]/100*RC[-1] -> 1.50
A1712: 7 | B1712: H41991/MR | C1712: US SFU китель укр.-цифра (PolyCotton) ||BL-SFU-PR-99 | D1712: 15.44 | E1712: usd | F1712: 1 | G1712: 462.00 | H1712: 1.50 | I1712: 323.40 | J1712: 14.60 | K1712: 5 | L1712: =RC[-3]/100*RC[-1] -> 1.50
A1713: 8 | B1713: H41991/LR | C1713: US SFU китель укр.-цифра (PolyCotton) ||BL-SFU-PR-99 | D1713: 15.44 | E1713: usd | F1713: 1 | G1713: 462.00 | H1713: 1.50 | I1713: 323.40 | J1713: 14.60 | K1713: 5 | L1713: =RC[-3]/100*RC[-1] -> 1.50
A1714: 9 | B1714: H41991/XLR | C1714: US SFU китель укр.-цифра (PolyCotton) ||BL-SFU-PR-99 | D1714: 15.44 | E1714: usd | F1714: 1 | G1714: 462.00 | H1714: 1.50 | I1714: 323.40 | J1714: 14.60 | K1714: 5 | L1714: =RC[-3]/100*RC[-1] -> 1.50
A1715: 10 | B1715: H41991/2XLR | C1715: US SFU китель укр.-цифра (PolyCotton) ||BL-SFU-PR-99 | D1715: 15.44 | E1715: usd | F1715: 1 | G1715: 462.00 | H1715: 1.50 | I1715: 323.40 | J1715: 14.60 | K1715: 5 | L1715: =RC[-3]/100*RC[-1] -> 1.50
A1716: 11 | B1716: H4199/SR | C1716: US SFU штаны укр.-цифра (PolyCotton) ||SP-SFU-PR-99 | D1716: 15.44 | E1716: usd | F1716: 1 | G1716: 462.00 | H1716: 1.50 | I1716: 323.40 | J1716: 14.60 | K1716: 5 | L1716: =RC[-3]/100*RC[-1] -> 1.50
A1717: 12 | B1717: H4199/MR | C1717: US SFU штаны укр.-цифра (PolyCotton) ||SP-SFU-PR-99 | D1717: 15.44 | E1717: usd | F1717: 1 | G1717: 462.00 | H1717: 1.50 | I1717: 323.40 | J1717: 14.60 | K1717: 5 | L1717: =RC[-3]/100*RC[-1] -> 1.50
A1718: 13 | B1718: H4199/LR | C1718: US SFU штаны укр.-цифра (PolyCotton) ||SP-SFU-PR-99 | D1718: 15.44 | E1718: usd | F1718: 1 | G1718: 462.00 | H1718: 1.50 | I1718: 323.40 | J1718: 14.60 | K1718: 5 | L1718: =RC[-3]/100*RC[-1] -> 1.50
A1719: 14 | B1719: H4199/XLR | C1719: US SFU штаны укр.-цифра (PolyCotton) ||SP-SFU-PR-99 | D1719: 15.44 | E1719: usd | F1719: 1 | G1719: 462.00 | H1719: 1.50 | I1719: 323.40 | J1719: 14.60 | K1719: 5 | L1719: =RC[-3]/100*RC[-1] -> 1.50
A1720: 15 | B1720: H4199/2XLR | C1720: US SFU штаны укр.-цифра (PolyCotton) ||SP-SFU-PR-99 | D1720: 15.44 | E1720: usd | F1720: 1 | G1720: 462.00 | H1720: 1.50 | I1720: 323.40 | J1720: 14.60 | K1720: 5 | L1720: =RC[-3]/100*RC[-1] -> 1.50 | M1720: =SUM(R[-15]C[-1]:RC[-1]) -> 
A1722: #7198 (2014-08-13) Львів Назар Максимович - Відправлено-Продано
A1723: N | B1723: арт | C1723: назва | D1723: закуп | F1723: к-ть | G1723: цiна | H1723: кф | I1723: продж | J1723: дохiд | K1723: % | L1723: з-та
A1724: 1 | B1724: H0815 | C1724: US жетон стальной с резинкой||NS-NS1-SS-15 | D1724: 1.30 | E1724: usd | F1724: 5 | G1724: 38.00 | H1724: 1.46 | I1724: 133.00 | J1724: 3.00 | K1724: 5 | L1724: =RC[-3]/100*RC[-1] -> 1.46
A1725: 2 | B1725: X402 | C1725: Балаклава олива с 1-м отв.(100%хлопок) ||X76012 | D1725: 3.15 | E1725: Инт | F1725: 25 | G1725: 50.00 | H1725: 0.79 | I1725: 875.00 | J1725: -700.00 | K1725: 5 | L1725: =RC[-3]/100*RC[-1] -> 0.79
A1726: 3 | B1726: X401 | C1726: Балаклава чёрная с 1-м отв.(100%хлопок) ||X7601 | D1726: 3.15 | E1726: Инт | F1726: 25 | G1726: 50.00 | H1726: 0.79 | I1726: 875.00 | J1726: -700.00 | K1726: 5 | L1726: =RC[-3]/100*RC[-1] -> 0.79
A1727: 4 | B1727: H41991/LR | C1727: US SFU китель укр.-цифра (PolyCotton) ||BL-SFU-PR-99 | D1727: 15.44 | E1727: usd | F1727: 1 | G1727: 462.00 | H1727: 1.50 | I1727: 323.40 | J1727: 14.60 | K1727: 5 | L1727: =RC[-3]/100*RC[-1] -> 1.50
A1728: 5 | B1728: H41991/ML | C1728: US SFU китель укр.-цифра (PolyCotton) ||BL-SFU-PR-99 | D1728: 15.44 | E1728: usd | F1728: 1 | G1728: 462.00 | H1728: 1.50 | I1728: 323.40 | J1728: 14.60 | K1728: 5 | L1728: =RC[-3]/100*RC[-1] -> 1.50
A1729: 6 | B1729: H4199/MR | C1729: US SFU штаны укр.-цифра (PolyCotton) ||SP-SFU-PR-99 | D1729: 15.44 | E1729: usd | F1729: 1 | G1729: 462.00 | H1729: 1.50 | I1729: 323.40 | J1729: 14.60 | K1729: 5 | L1729: =RC[-3]/100*RC[-1] -> 1.50
A1730: 7 | B1730: H4199/XLR | C1730: US SFU штаны укр.-цифра (PolyCotton) ||SP-SFU-PR-99 | D1730: 15.44 | E1730: usd | F1730: 1 | G1730: 462.00 | H1730: 1.50 | I1730: 323.40 | J1730: 14.60 | K1730: 5 | L1730: =RC[-3]/100*RC[-1] -> 1.50
A1731: 8 | B1731: H4199/ML | C1731: US SFU штаны укр.-цифра (PolyCotton) ||SP-SFU-PR-99 | D1731: 15.44 | E1731: usd | F1731: 1 | G1731: 462.00 | H1731: 1.50 | I1731: 323.40 | J1731: 14.60 | K1731: 5 | L1731: =RC[-3]/100*RC[-1] -> 1.50
A1732: 9 | B1732: H41991/ML | C1732: US SFU китель укр.-цифра (PolyCotton) ||BL-SFU-PR-99 | D1732: 15.44 | E1732: usd | F1732: 1 | G1732: 462.00 | H1732: 1.50 | I1732: 323.40 | J1732: 14.60 | K1732: 5 | L1732: =RC[-3]/100*RC[-1] -> 1.50
A1733: 10 | B1733: M800331/44.5 | C1733: Берцы MAGNUM Viper II 8" SZ Wide | D1733: 41.15 | E1733: usd | F1733: 1 | G1733: 948.00 | H1733: 1.15 | I1733: 663.60 | J1733: -159.40 | K1733: 5 | L1733: =RC[-3]/100*RC[-1] -> 1.15
A1734: 11 | B1734: _3378-1/44 | C1734: Берцы STAR FORCE THUNDERSTORM HI чёрные | D1734: 33.53 | E1734: euro | F1734: 1 | G1734: 947.00 | H1734: 1.13 | I1734: 662.90 | J1734: -175.35 | K1734: 5 | L1734: =RC[-3]/100*RC[-1] -> 1.13
A1735: 12 | B1735: H9002/130 | C1735: Ремень ARMY BELT олива ||PS-ARM-CO-02 | D1735: 4.23 | E1735: usd | F1735: 10 | G1735: 126.00 | H1735: 1.49 | I1735: 882.00 | J1735: 36.00 | K1735: 5 | L1735: =RC[-3]/100*RC[-1] -> 1.49
A1736: 13 | B1736: H8913/140 | C1736: Ремень TOUGH US MARINES койот ||PS-USM-CO-13 | D1736: 3.68 | E1736: usd | F1736: 5 | G1736: 126.00 | H1736: 1.71 | I1736: 441.00 | J1736: 73.00 | K1736: 5 | L1736: =RC[-3]/100*RC[-1] -> 1.71
A1737: 14 | B1737: H3407/L | C1737: Футболка марпат ||TS-TSH-CO-07 | D1737: 4.13 | E1737: usd | F1737: 2 | G1737: 121.00 | H1737: 1.46 | I1737: 169.40 | J1737: 4.20 | K1737: 5 | L1737: =RC[-3]/100*RC[-1] -> 1.46
A1738: 15 | B1738: H3407/2XL | C1738: Футболка марпат ||TS-TSH-CO-07 | D1738: 4.13 | E1738: usd | F1738: 2 | G1738: 121.00 | H1738: 1.46 | I1738: 169.40 | J1738: 4.20 | K1738: 5 | L1738: =RC[-3]/100*RC[-1] -> 1.46
A1739: 16 | B1739: H3401/M | C1739: Футболка чёрная ||TS-TSH-CO-01 | D1739: 4.06 | E1739: usd | F1739: 2 | G1739: 121.00 | H1739: 1.49 | I1739: 169.40 | J1739: 7.10 | K1739: 5 | L1739: =RC[-3]/100*RC[-1] -> 1.49
A1740: 17 | B1740: H3401/XL | C1740: Футболка чёрная ||TS-TSH-CO-01 | D1740: 4.06 | E1740: usd | F1740: 1 | G1740: 121.00 | H1740: 1.49 | I1740: 84.70 | J1740: 3.55 | K1740: 5 | L1740: =RC[-3]/100*RC[-1] -> 1.49
A1741: 18 | B1741: H3401/2XL | C1741: Футболка чёрная ||TS-TSH-CO-01 | D1741: 4.06 | E1741: usd | F1741: 1 | G1741: 121.00 | H1741: 1.49 | I1741: 84.70 | J1741: 3.55 | K1741: 5 | L1741: =RC[-3]/100*RC[-1] -> 1.49
A1742: 19 | B1742: H3433/M | C1742: Футболка MP-CAMO ||TS-TSH-CO-33 | D1742: 4.06 | E1742: usd | F1742: 1 | G1742: 121.00 | H1742: 1.49 | I1742: 84.70 | J1742: 3.55 | K1742: 5 | L1742: =RC[-3]/100*RC[-1] -> 1.49
A1743: 20 | B1743: H3433/L | C1743: Футболка MP-CAMO ||TS-TSH-CO-33 | D1743: 4.06 | E1743: usd | F1743: 1 | G1743: 121.00 | H1743: 1.49 | I1743: 84.70 | J1743: 3.55 | K1743: 5 | L1743: =RC[-3]/100*RC[-1] -> 1.49
A1744: 21 | B1744: H3433/XL | C1744: Футболка MP-CAMO ||TS-TSH-CO-33 | D1744: 4.06 | E1744: usd | F1744: 1 | G1744: 121.00 | H1744: 1.49 | I1744: 84.70 | J1744: 3.55 | K1744: 5 | L1744: =RC[-3]/100*RC[-1] -> 1.49
A1745: 22 | B1745: H3403/L | C1745: Футболка вудлэнд ||TS-TSH-CO-03 | D1745: 4.06 | E1745: usd | F1745: 2 | G1745: 121.00 | H1745: 1.49 | I1745: 169.40 | J1745: 7.10 | K1745: 5 | L1745: =RC[-3]/100*RC[-1] -> 1.49
A1746: 23 | B1746: H3403/3XL | C1746: Футболка вудлэнд ||TS-TSH-CO-03 | D1746: 4.06 | E1746: usd | F1746: 1 | G1746: 121.00 | H1746: 1.49 | I1746: 84.70 | J1746: 3.55 | K1746: 5 | L1746: =RC[-3]/100*RC[-1] -> 1.49
A1747: 24 | B1747: H3404/M | C1747: Футболка польский вудлэнд ||TS-TSH-CO-04 | D1747: 4.06 | E1747: usd | F1747: 1 | G1747: 121.00 | H1747: 1.49 | I1747: 84.70 | J1747: 3.55 | K1747: 5 | L1747: =RC[-3]/100*RC[-1] -> 1.49
A1748: 25 | B1748: H3404/L | C1748: Футболка польский вудлэнд ||TS-TSH-CO-04 | D1748: 4.06 | E1748: usd | F1748: 1 | G1748: 121.00 | H1748: 1.49 | I1748: 84.70 | J1748: 3.55 | K1748: 5 | L1748: =RC[-3]/100*RC[-1] -> 1.49
A1749: 26 | B1749: H43141/LR | C1749: US SFU китель мультикам (PolyCotton) ||BL-SFU-PR-14 | D1749: 16.64 | E1749: usd | F1749: 1 | G1749: 504.00 | H1749: 1.51 | I1749: 352.80 | J1749: 20.00 | K1749: 5 | L1749: =RC[-3]/100*RC[-1] -> 1.51 | M1749: =SUM(R[-26]C[-1]:RC[-1]) -> 
A1751: #7220 (2014-08-14) Львів Назар Максимович - Відправлено-Продано
A1752: N | B1752: арт | C1752: назва | D1752: закуп | F1752: к-ть | G1752: цiна | H1752: кф | I1752: продж | J1752: дохiд | K1752: % | L1752: з-та
A1753: 1 | B1753: H44051/MR | C1753: US BDU китель 3-х цветный дезерт (R/S) ||BL-BDU-CR-05 | D1753: 14.06 | E1753: usd | F1753: 1 | G1753: 421.00 | H1753: 1.50 | I1753: 294.70 | J1753: 13.50 | K1753: 5 | L1753: =RC[-3]/100*RC[-1] -> 1.50
A1754: 2 | B1754: H44051/LR | C1754: US BDU китель 3-х цветный дезерт (R/S) ||BL-BDU-CR-05 | D1754: 14.06 | E1754: usd | F1754: 1 | G1754: 421.00 | H1754: 1.50 | I1754: 294.70 | J1754: 13.50 | K1754: 5 | L1754: =RC[-3]/100*RC[-1] -> 1.50
A1755: 3 | B1755: H44051/XLR | C1755: US BDU китель 3-х цветный дезерт (R/S) ||BL-BDU-CR-05 | D1755: 14.06 | E1755: usd | F1755: 1 | G1755: 421.00 | H1755: 1.50 | I1755: 294.70 | J1755: 13.50 | K1755: 5 | L1755: =RC[-3]/100*RC[-1] -> 1.50
A1756: 4 | B1756: H4405/ML | C1756: US BDU штаны 3-х цветный дезерт (R/S) ||SP-BDU-CR-05 | D1756: 14.06 | E1756: usd | F1756: 1 | G1756: 421.00 | H1756: 1.50 | I1756: 294.70 | J1756: 13.50 | K1756: 5 | L1756: =RC[-3]/100*RC[-1] -> 1.50
A1757: 5 | B1757: H4405/LL | C1757: US BDU штаны 3-х цветный дезерт (R/S) ||SP-BDU-CR-05 | D1757: 14.06 | E1757: usd | F1757: 1 | G1757: 421.00 | H1757: 1.50 | I1757: 294.70 | J1757: 13.50 | K1757: 5 | L1757: =RC[-3]/100*RC[-1] -> 1.50
A1758: 6 | B1758: H4405/XLL | C1758: US BDU штаны 3-х цветный дезерт (R/S) ||SP-BDU-CR-05 | D1758: 14.06 | E1758: usd | F1758: 1 | G1758: 421.00 | H1758: 1.50 | I1758: 294.70 | J1758: 13.50 | K1758: 5 | L1758: =RC[-3]/100*RC[-1] -> 1.50
A1759: 7 | B1759: H3410/3XL | C1759: Футболка ACU ||TS-TSH-CO-10 | D1759: 4.06 | E1759: usd | F1759: 3 | G1759: 121.00 | H1759: 1.49 | I1759: 254.10 | J1759: 10.65 | K1759: 5 | L1759: =RC[-3]/100*RC[-1] -> 1.49
A1760: 8 | B1760: H3410/2XL | C1760: Футболка ACU ||TS-TSH-CO-10 | D1760: 4.06 | E1760: usd | F1760: 2 | G1760: 121.00 | H1760: 1.49 | I1760: 169.40 | J1760: 7.10 | K1760: 5 | L1760: =RC[-3]/100*RC[-1] -> 1.49
A1761: 9 | B1761: H3410/XL | C1761: Футболка ACU ||TS-TSH-CO-10 | D1761: 4.06 | E1761: usd | F1761: 2 | G1761: 121.00 | H1761: 1.49 | I1761: 169.40 | J1761: 7.10 | K1761: 5 | L1761: =RC[-3]/100*RC[-1] -> 1.49
A1762: 10 | B1762: H3407/2XL | C1762: Футболка марпат ||TS-TSH-CO-07 | D1762: 4.13 | E1762: usd | F1762: 2 | G1762: 121.00 | H1762: 1.46 | I1762: 169.40 | J1762: 4.20 | K1762: 5 | L1762: =RC[-3]/100*RC[-1] -> 1.46
A1763: 11 | B1763: H3414/L | C1763: Футболка мультикам ||TS-TSH-CO-14 | D1763: 4.06 | E1763: usd | F1763: 1 | G1763: 121.00 | H1763: 1.49 | I1763: 84.70 | J1763: 3.55 | K1763: 5 | L1763: =RC[-3]/100*RC[-1] -> 1.49
A1764: 12 | B1764: H3414/XL | C1764: Футболка мультикам ||TS-TSH-CO-14 | D1764: 4.06 | E1764: usd | F1764: 2 | G1764: 121.00 | H1764: 1.49 | I1764: 169.40 | J1764: 7.10 | K1764: 5 | L1764: =RC[-3]/100*RC[-1] -> 1.49
A1765: 13 | B1765: H3414/2XL | C1765: Футболка мультикам ||TS-TSH-CO-14 | D1765: 4.06 | E1765: usd | F1765: 1 | G1765: 121.00 | H1765: 1.49 | I1765: 84.70 | J1765: 3.55 | K1765: 5 | L1765: =RC[-3]/100*RC[-1] -> 1.49
A1766: 14 | B1766: H7232 | C1766: US BDU кепка олива драп ( PolyCotton Ripstop) ||CZ-COM-NR-32 | D1766: 2.33 | E1766: usd | F1766: 5 | G1766: 72.00 | H1766: 1.55 | I1766: 252.00 | J1766: 19.00 | K1766: 5 | L1766: =RC[-3]/100*RC[-1] -> 1.55 | M1766: =SUM(R[-14]C[-1]:RC[-1]) -> 
A1768: #7223 (2014-08-14) Львів Назар Максимович - Відправлено-Продано
A1769: N | B1769: арт | C1769: назва | D1769: закуп | F1769: к-ть | G1769: цiна | H1769: кф | I1769: продж | J1769: дохiд | K1769: % | L1769: з-та
A1770: 1 | B1770: H41991/MR | C1770: US SFU китель укр.-цифра (PolyCotton) ||BL-SFU-PR-99 | D1770: 15.44 | E1770: usd | F1770: 2 | G1770: 462.00 | H1770: 1.50 | I1770: 646.80 | J1770: 29.20 | K1770: 5 | L1770: =RC[-3]/100*RC[-1] -> 1.50
A1771: 2 | B1771: H41991/LR | C1771: US SFU китель укр.-цифра (PolyCotton) ||BL-SFU-PR-99 | D1771: 15.44 | E1771: usd | F1771: 2 | G1771: 462.00 | H1771: 1.50 | I1771: 646.80 | J1771: 29.20 | K1771: 5 | L1771: =RC[-3]/100*RC[-1] -> 1.50
A1772: 3 | B1772: H41991/XLR | C1772: US SFU китель укр.-цифра (PolyCotton) ||BL-SFU-PR-99 | D1772: 15.44 | E1772: usd | F1772: 2 | G1772: 462.00 | H1772: 1.50 | I1772: 646.80 | J1772: 29.20 | K1772: 5 | L1772: =RC[-3]/100*RC[-1] -> 1.50
A1773: 4 | B1773: H4199/MR | C1773: US SFU штаны укр.-цифра (PolyCotton) ||SP-SFU-PR-99 | D1773: 15.44 | E1773: usd | F1773: 2 | G1773: 462.00 | H1773: 1.50 | I1773: 646.80 | J1773: 29.20 | K1773: 5 | L1773: =RC[-3]/100*RC[-1] -> 1.50
A1774: 5 | B1774: H4199/LR | C1774: US SFU штаны укр.-цифра (PolyCotton) ||SP-SFU-PR-99 | D1774: 15.44 | E1774: usd | F1774: 2 | G1774: 462.00 | H1774: 1.50 | I1774: 646.80 | J1774: 29.20 | K1774: 5 | L1774: =RC[-3]/100*RC[-1] -> 1.50
A1775: 6 | B1775: H4199/XLR | C1775: US SFU штаны укр.-цифра (PolyCotton) ||SP-SFU-PR-99 | D1775: 15.44 | E1775: usd | F1775: 2 | G1775: 462.00 | H1775: 1.50 | I1775: 646.80 | J1775: 29.20 | K1775: 5 | L1775: =RC[-3]/100*RC[-1] -> 1.50
A1776: 7 | B1776: H4199/2XLR | C1776: US SFU штаны укр.-цифра (PolyCotton) ||SP-SFU-PR-99 | D1776: 15.44 | E1776: usd | F1776: 1 | G1776: 462.00 | H1776: 1.50 | I1776: 323.40 | J1776: 14.60 | K1776: 5 | L1776: =RC[-3]/100*RC[-1] -> 1.50
A1777: 8 | B1777: H41991/2XLR | C1777: US SFU китель укр.-цифра (PolyCotton) ||BL-SFU-PR-99 | D1777: 15.44 | E1777: usd | F1777: 1 | G1777: 462.00 | H1777: 1.50 | I1777: 323.40 | J1777: 14.60 | K1777: 5 | L1777: =RC[-3]/100*RC[-1] -> 1.50 | M1777: =SUM(R[-8]C[-1]:RC[-1]) -> 
A1779: #7241 (2014-08-14) Львів Назар Максимович - Прихід товару
A1780: N | B1780: арт | C1780: назва | D1780: закуп | F1780: к-ть | G1780: цiна | H1780: кф | I1780: продж | J1780: дохiд | K1780: % | L1780: з-та
A1781: 1 | B1781: _3680.00.02 | C1781: Револьвер под патрон Флобера STALKER 4мм 4.5" syntetic | D1781: 75.00 | E1781: Инт | F1781: 5 | G1781: 1575.00 | H1781: 1.05 | I1781: 7875.00 | J1781: 375.00 | K1781: 5 | L1781: =RC[-3]/100*RC[-1] -> 1.05 | M1781: =SUM(R[-1]C[-1]:RC[-1]) -> 
A1783: #7292 (2014-08-15) Львів Назар Максимович - Відправлено-Продано
A1784: N | B1784: арт | C1784: назва | D1784: закуп | F1784: к-ть | G1784: цiна | H1784: кф | I1784: продж | J1784: дохiд | K1784: % | L1784: з-та
A1785: 1 | B1785: _1400021 | C1785: Каремат-сидушка туристический 8мм олива | D1785: 1.00 | E1785: Инт | F1785: 10 | G1785: 40.00 | H1785: 2.00 | I1785: 280.00 | J1785: 80.00 | K1785: 5 | L1785: =RC[-3]/100*RC[-1] -> 2.00 | M1785: =SUM(R[-1]C[-1]:RC[-1]) -> 
A1787: #7320 (2014-08-18) Львів Назар Максимович - Відправлено-Продано
A1788: N | B1788: арт | C1788: назва | D1788: закуп | F1788: к-ть | G1788: цiна | H1788: кф | I1788: продж | J1788: дохiд | K1788: % | L1788: з-та
A1789: 1 | B1789: H5914/MR | C1789: CPU штаны мультикамо (PolyCotton) ||SP-CPU-PR-14 | D1789: 21.56 | E1789: usd | F1789: 1 | G1789: 641.00 | H1789: 1.49 | I1789: 448.70 | J1789: 17.50 | K1789: 5 | L1789: =RC[-3]/100*RC[-1] -> 1.49
A1790: 2 | B1790: H5914/SR | C1790: CPU штаны мультикамо (PolyCotton) ||SP-CPU-PR-14 | D1790: 21.56 | E1790: usd | F1790: 1 | G1790: 641.00 | H1790: 1.49 | I1790: 448.70 | J1790: 17.50 | K1790: 5 | L1790: =RC[-3]/100*RC[-1] -> 1.49
A1791: 3 | B1791: H5914/XLR | C1791: CPU штаны мультикамо (PolyCotton) ||SP-CPU-PR-14 | D1791: 21.56 | E1791: usd | F1791: 2 | G1791: 641.00 | H1791: 1.49 | I1791: 897.40 | J1791: 35.00 | K1791: 5 | L1791: =RC[-3]/100*RC[-1] -> 1.49
A1792: 4 | B1792: H43141/LR | C1792: US SFU китель мультикам (PolyCotton) ||BL-SFU-PR-14 | D1792: 16.64 | E1792: usd | F1792: 2 | G1792: 504.00 | H1792: 1.51 | I1792: 705.60 | J1792: 40.00 | K1792: 5 | L1792: =RC[-3]/100*RC[-1] -> 1.51
A1793: 5 | B1793: H43141/MR | C1793: US SFU китель мультикам (PolyCotton) ||BL-SFU-PR-14 | D1793: 16.64 | E1793: usd | F1793: 1 | G1793: 504.00 | H1793: 1.51 | I1793: 352.80 | J1793: 20.00 | K1793: 5 | L1793: =RC[-3]/100*RC[-1] -> 1.51
A1794: 6 | B1794: H43141/SR | C1794: US SFU китель мультикам (PolyCotton) ||BL-SFU-PR-14 | D1794: 16.64 | E1794: usd | F1794: 1 | G1794: 504.00 | H1794: 1.51 | I1794: 352.80 | J1794: 20.00 | K1794: 5 | L1794: =RC[-3]/100*RC[-1] -> 1.51 | M1794: =SUM(R[-6]C[-1]:RC[-1]) -> 
A1796: #7343 (2014-08-18) Львів Назар Максимович - Відправлено-Продано
A1797: N | B1797: арт | C1797: назва | D1797: закуп | F1797: к-ть | G1797: цiна | H1797: кф | I1797: продж | J1797: дохiд | K1797: % | L1797: з-та
A1798: 1 | B1798: H1301 | C1798: US пончо чорное (R/S) ||PO-MUS-PO-01 | D1798: 12.25 | E1798: usd | F1798: 15 | G1798: 366.00 | H1798: 1.49 | I1798: 3843.00 | J1798: 168.00 | K1798: 5 | L1798: =RC[-3]/100*RC[-1] -> 1.49
A1799: 2 | B1799: H7232 | C1799: US BDU кепка олива драп ( PolyCotton Ripstop) ||CZ-COM-NR-32 | D1799: 2.33 | E1799: usd | F1799: 6 | G1799: 72.00 | H1799: 1.55 | I1799: 302.40 | J1799: 22.80 | K1799: 5 | L1799: =RC[-3]/100*RC[-1] -> 1.55 | M1799: =SUM(R[-2]C[-1]:RC[-1]) -> 
A1801: #7347 (2014-08-18) Львів Назар Максимович - Відправлено-Продано
A1802: N | B1802: арт | C1802: назва | D1802: закуп | F1802: к-ть | G1802: цiна | H1802: кф | I1802: продж | J1802: дохiд | K1802: % | L1802: з-та
A1803: 1 | B1803: H6001/41 | C1803: Берцы FIELD CUIR TOILE GK ||BU-FCT-LE-01 | D1803: 44.40 | E1803: usd | F1803: 1 | G1803: 1327.00 | H1803: 1.49 | I1803: 928.90 | J1803: 40.90 | K1803: 5 | L1803: =RC[-3]/100*RC[-1] -> 1.49
A1804: 2 | B1804: H6001/42 | C1804: Берцы FIELD CUIR TOILE GK ||BU-FCT-LE-01 | D1804: 44.40 | E1804: usd | F1804: 1 | G1804: 1327.00 | H1804: 1.49 | I1804: 928.90 | J1804: 40.90 | K1804: 5 | L1804: =RC[-3]/100*RC[-1] -> 1.49
A1805: 3 | B1805: H6001/44 | C1805: Берцы FIELD CUIR TOILE GK ||BU-FCT-LE-01 | D1805: 44.40 | E1805: usd | F1805: 1 | G1805: 1327.00 | H1805: 1.49 | I1805: 928.90 | J1805: 40.90 | K1805: 5 | L1805: =RC[-3]/100*RC[-1] -> 1.49
A1806: 4 | B1806: H6001/45 | C1806: Берцы FIELD CUIR TOILE GK ||BU-FCT-LE-01 | D1806: 44.40 | E1806: usd | F1806: 1 | G1806: 1327.00 | H1806: 1.49 | I1806: 928.90 | J1806: 40.90 | K1806: 5 | L1806: =RC[-3]/100*RC[-1] -> 1.49
A1807: 5 | B1807: M800114/44.5 | C1807: Берцы MAGNUM Elite Spider 8.0(EU) Desert | D1807: 47.75 | E1807: usd | F1807: 1 | G1807: 1092.00 | H1807: 1.14 | I1807: 764.40 | J1807: -190.60 | K1807: 5 | L1807: =RC[-3]/100*RC[-1] -> 1.14
A1808: 6 | B1808: M800114/46 | C1808: Берцы MAGNUM Elite Spider 8.0(EU) Desert | D1808: 47.75 | E1808: usd | F1808: 1 | G1808: 1092.00 | H1808: 1.14 | I1808: 764.40 | J1808: -190.60 | K1808: 5 | L1808: =RC[-3]/100*RC[-1] -> 1.14
A1809: 7 | B1809: _3378-1/44 | C1809: Берцы STAR FORCE THUNDERSTORM HI чёрные | D1809: 33.53 | E1809: euro | F1809: 2 | G1809: 947.00 | H1809: 1.13 | I1809: 1325.80 | J1809: -350.70 | K1809: 5 | L1809: =RC[-3]/100*RC[-1] -> 1.13
A1810: 8 | B1810: _3378-1/45 | C1810: Берцы STAR FORCE THUNDERSTORM HI чёрные | D1810: 33.53 | E1810: euro | F1810: 2 | G1810: 947.00 | H1810: 1.13 | I1810: 1325.80 | J1810: -350.70 | K1810: 5 | L1810: =RC[-3]/100*RC[-1] -> 1.13
A1811: 9 | B1811: _3378-1/46 | C1811: Берцы STAR FORCE THUNDERSTORM HI чёрные | D1811: 33.53 | E1811: euro | F1811: 2 | G1811: 947.00 | H1811: 1.13 | I1811: 1325.80 | J1811: -350.70 | K1811: 5 | L1811: =RC[-3]/100*RC[-1] -> 1.13
A1812: 10 | B1812: X402 | C1812: Балаклава олива с 1-м отв.(100%хлопок) ||X76012 | D1812: 3.15 | E1812: Инт | F1812: 20 | G1812: 50.00 | H1812: 0.79 | I1812: 700.00 | J1812: -560.00 | K1812: 5 | L1812: =RC[-3]/100*RC[-1] -> 0.79
A1813: 11 | B1813: X401 | C1813: Балаклава чёрная с 1-м отв.(100%хлопок) ||X7601 | D1813: 3.15 | E1813: Инт | F1813: 10 | G1813: 50.00 | H1813: 0.79 | I1813: 350.00 | J1813: -280.00 | K1813: 5 | L1813: =RC[-3]/100*RC[-1] -> 0.79 | M1813: =SUM(R[-11]C[-1]:RC[-1]) -> 
A1815: #7379 (2014-08-19) Львів Назар Максимович - Відправлено-Продано
A1816: N | B1816: арт | C1816: назва | D1816: закуп | F1816: к-ть | G1816: цiна | H1816: кф | I1816: продж | J1816: дохiд | K1816: % | L1816: з-та
A1817: 1 | B1817: H5914/LR | C1817: CPU штаны мультикамо (PolyCotton) ||SP-CPU-PR-14 | D1817: 21.56 | E1817: usd | F1817: 1 | G1817: 641.00 | H1817: 1.49 | I1817: 448.70 | J1817: 17.50 | K1817: 5 | L1817: =RC[-3]/100*RC[-1] -> 1.49
A1818: 2 | B1818: H5914/MR | C1818: CPU штаны мультикамо (PolyCotton) ||SP-CPU-PR-14 | D1818: 21.56 | E1818: usd | F1818: 1 | G1818: 641.00 | H1818: 1.49 | I1818: 448.70 | J1818: 17.50 | K1818: 5 | L1818: =RC[-3]/100*RC[-1] -> 1.49
A1819: 3 | B1819: H5914/SR | C1819: CPU штаны мультикамо (PolyCotton) ||SP-CPU-PR-14 | D1819: 21.56 | E1819: usd | F1819: 1 | G1819: 641.00 | H1819: 1.49 | I1819: 448.70 | J1819: 17.50 | K1819: 5 | L1819: =RC[-3]/100*RC[-1] -> 1.49
A1820: 4 | B1820: H43141/MR | C1820: US SFU китель мультикам (PolyCotton) ||BL-SFU-PR-14 | D1820: 16.64 | E1820: usd | F1820: 1 | G1820: 504.00 | H1820: 1.51 | I1820: 352.80 | J1820: 20.00 | K1820: 5 | L1820: =RC[-3]/100*RC[-1] -> 1.51
A1821: 5 | B1821: H43141/MR | C1821: US SFU китель мультикам (PolyCotton) ||BL-SFU-PR-14 | D1821: 16.64 | E1821: usd | F1821: 1 | G1821: 504.00 | H1821: 1.51 | I1821: 352.80 | J1821: 20.00 | K1821: 5 | L1821: =RC[-3]/100*RC[-1] -> 1.51
A1822: 6 | B1822: H43141/SR | C1822: US SFU китель мультикам (PolyCotton) ||BL-SFU-PR-14 | D1822: 16.64 | E1822: usd | F1822: 1 | G1822: 504.00 | H1822: 1.51 | I1822: 352.80 | J1822: 20.00 | K1822: 5 | L1822: =RC[-3]/100*RC[-1] -> 1.51
A1823: 7 | B1823: H43141/XLR | C1823: US SFU китель мультикам (PolyCotton) ||BL-SFU-PR-14 | D1823: 16.64 | E1823: usd | F1823: 1 | G1823: 504.00 | H1823: 1.51 | I1823: 352.80 | J1823: 20.00 | K1823: 5 | L1823: =RC[-3]/100*RC[-1] -> 1.51
A1824: 8 | B1824: _1.1606 | C1824: Бинокль TASCO 22x36 ||B-22 | D1824: 16.10 | E1824: Инт | F1824: 1 | G1824: 178.00 | H1824: 0.55 | I1824: 178.00 | J1824: -144.00 | K1824: 5 | L1824: =RC[-3]/100*RC[-1] -> 0.55
A1825: 9 | B1825: H26331/L | C1825: Куртка PATRIOT флисовая MP CAMO 390г/м (superfine) ||BL-PAT-HF-33 | D1825: 31.03 | E1825: usd | F1825: 1 | G1825: 932.00 | H1825: 1.50 | I1825: 652.40 | J1825: 31.80 | K1825: 5 | L1825: =RC[-3]/100*RC[-1] -> 1.50
A1826: 10 | B1826: H55041/2XL | C1826: Куртка SOLDIER-2008 польский вудлэнд (NYCO) ||KU-FP8-NT-04 | D1826: 43.99 | E1826: usd | F1826: 1 | G1826: 1315.00 | H1826: 1.49 | I1826: 920.50 | J1826: 40.70 | K1826: 5 | L1826: =RC[-3]/100*RC[-1] -> 1.49
A1827: 11 | B1827: K12088-O | C1827: Рюкзак Tactical Backpack for 13" laptop олива ||M51612088-OD | D1827: 21.61 | E1827: usd | F1827: 3 | G1827: 646.00 | H1827: 1.49 | I1827: 1356.60 | J1827: 60.00 | K1827: 5 | L1827: =RC[-3]/100*RC[-1] -> 1.49
A1828: 12 | B1828: H3433/2XL | C1828: Футболка MP-CAMO ||TS-TSH-CO-33 | D1828: 4.06 | E1828: usd | F1828: 2 | G1828: 121.00 | H1828: 1.49 | I1828: 169.40 | J1828: 7.10 | K1828: 5 | L1828: =RC[-3]/100*RC[-1] -> 1.49
A1829: 13 | B1829: H3433/L | C1829: Футболка MP-CAMO ||TS-TSH-CO-33 | D1829: 4.06 | E1829: usd | F1829: 1 | G1829: 121.00 | H1829: 1.49 | I1829: 84.70 | J1829: 3.55 | K1829: 5 | L1829: =RC[-3]/100*RC[-1] -> 1.49
A1830: 14 | B1830: H3433/M | C1830: Футболка MP-CAMO ||TS-TSH-CO-33 | D1830: 4.06 | E1830: usd | F1830: 4 | G1830: 121.00 | H1830: 1.49 | I1830: 338.80 | J1830: 14.20 | K1830: 5 | L1830: =RC[-3]/100*RC[-1] -> 1.49
A1831: 15 | B1831: H3433/S | C1831: Футболка MP-CAMO ||TS-TSH-CO-33 | D1831: 4.06 | E1831: usd | F1831: 1 | G1831: 121.00 | H1831: 1.49 | I1831: 84.70 | J1831: 3.55 | K1831: 5 | L1831: =RC[-3]/100*RC[-1] -> 1.49
A1832: 16 | B1832: _3378-1/44 | C1832: Берцы STAR FORCE THUNDERSTORM HI чёрные | D1832: 33.53 | E1832: euro | F1832: 2 | G1832: 947.00 | H1832: 1.13 | I1832: 1325.80 | J1832: -350.70 | K1832: 5 | L1832: =RC[-3]/100*RC[-1] -> 1.13
A1833: 17 | B1833: _3378-1/46 | C1833: Берцы STAR FORCE THUNDERSTORM HI чёрные | D1833: 33.53 | E1833: euro | F1833: 1 | G1833: 947.00 | H1833: 1.13 | I1833: 662.90 | J1833: -175.35 | K1833: 5 | L1833: =RC[-3]/100*RC[-1] -> 1.13 | M1833: =SUM(R[-17]C[-1]:RC[-1]) -> 
A1835: #7384 (2014-08-19) Львів Назар Максимович - Відправлено-Продано
A1836: N | B1836: арт | C1836: назва | D1836: закуп | F1836: к-ть | G1836: цiна | H1836: кф | I1836: продж | J1836: дохiд | K1836: % | L1836: з-та
A1837: 1 | B1837: H4301/MR | C1837: US SFU штаны чёрные (PolyCotton) ||SP-SFU-PR-01 | D1837: 15.03 | E1837: usd | F1837: 1 | G1837: 433.00 | H1837: 1.44 | I1837: 303.10 | J1837: 2.50 | K1837: 5 | L1837: =RC[-3]/100*RC[-1] -> 1.44
A1838: 2 | B1838: H43011/MR | C1838: US SFU китель чёрный (PolyCotton) ||BL-SFU-PR-01 | D1838: 15.03 | E1838: usd | F1838: 1 | G1838: 433.00 | H1838: 1.44 | I1838: 303.10 | J1838: 2.50 | K1838: 5 | L1838: =RC[-3]/100*RC[-1] -> 1.44 | M1838: =SUM(R[-2]C[-1]:RC[-1]) -> 
A1840: #7395 (2014-08-19) Львів Назар Максимович - Відправлено-Продано
A1841: N | B1841: арт | C1841: назва | D1841: закуп | F1841: к-ть | G1841: цiна | H1841: кф | I1841: продж | J1841: дохiд | K1841: % | L1841: з-та
A1842: 1 | B1842: H9002/120 | C1842: Ремень ARMY BELT олива ||PS-ARM-CO-02 | D1842: 4.23 | E1842: usd | F1842: 1 | G1842: 126.00 | H1842: 1.49 | I1842: 88.20 | J1842: 3.60 | K1842: 5 | L1842: =RC[-3]/100*RC[-1] -> 1.49
A1843: 2 | B1843: H9002/120 | C1843: Ремень ARMY BELT олива ||PS-ARM-CO-02 | D1843: 4.23 | E1843: usd | F1843: 2 | G1843: 126.00 | H1843: 1.49 | I1843: 176.40 | J1843: 7.20 | K1843: 5 | L1843: =RC[-3]/100*RC[-1] -> 1.49
A1844: 3 | B1844: H9002/130 | C1844: Ремень ARMY BELT олива ||PS-ARM-CO-02 | D1844: 4.23 | E1844: usd | F1844: 3 | G1844: 126.00 | H1844: 1.49 | I1844: 264.60 | J1844: 10.80 | K1844: 5 | L1844: =RC[-3]/100*RC[-1] -> 1.49
A1845: 4 | B1845: H9001/120 | C1845: Ремень ARMY BELT чёрный ||PS-ARM-CO-01 | D1845: 4.23 | E1845: usd | F1845: 2 | G1845: 126.00 | H1845: 1.49 | I1845: 176.40 | J1845: 7.20 | K1845: 5 | L1845: =RC[-3]/100*RC[-1] -> 1.49
A1846: 5 | B1846: H9001/130 | C1846: Ремень ARMY BELT чёрный ||PS-ARM-CO-01 | D1846: 4.23 | E1846: usd | F1846: 2 | G1846: 126.00 | H1846: 1.49 | I1846: 176.40 | J1846: 7.20 | K1846: 5 | L1846: =RC[-3]/100*RC[-1] -> 1.49
A1847: 6 | B1847: H9001/140 | C1847: Ремень ARMY BELT чёрный ||PS-ARM-CO-01 | D1847: 4.23 | E1847: usd | F1847: 2 | G1847: 126.00 | H1847: 1.49 | I1847: 176.40 | J1847: 7.20 | K1847: 5 | L1847: =RC[-3]/100*RC[-1] -> 1.49 | M1847: =SUM(R[-6]C[-1]:RC[-1]) -> 
A1849: #7425 (2014-08-20) Львів Назар Максимович - Відправлено-Продано
A1850: N | B1850: арт | C1850: назва | D1850: закуп | F1850: к-ть | G1850: цiна | H1850: кф | I1850: продж | J1850: дохiд | K1850: % | L1850: з-та
A1851: 1 | B1851: G0001 | C1851: Комплект (наколенники и налокотники) койот | D1851: 350.00 | E1851: грн | F1851: 5 | G1851: 600.00 | H1851: 1.71 | I1851: 2250.00 | J1851: 500.00 | K1851: 5 | L1851: =RC[-3]/100*RC[-1] -> 1.71 | M1851: =SUM(R[-1]C[-1]:RC[-1]) -> 
A1853: #7453 (2014-08-21) Львів Назар Максимович - Відправлено-Продано
A1854: N | B1854: арт | C1854: назва | D1854: закуп | F1854: к-ть | G1854: цiна | H1854: кф | I1854: продж | J1854: дохiд | K1854: % | L1854: з-та
A1855: 1 | B1855: H41991/LR | C1855: US SFU китель укр.-цифра (PolyCotton) ||BL-SFU-PR-99 | D1855: 15.44 | E1855: usd | F1855: 3 | G1855: 462.00 | H1855: 1.50 | I1855: 970.20 | J1855: 43.80 | K1855: 5 | L1855: =RC[-3]/100*RC[-1] -> 1.50
A1856: 2 | B1856: H41991/XLR | C1856: US SFU китель укр.-цифра (PolyCotton) ||BL-SFU-PR-99 | D1856: 15.44 | E1856: usd | F1856: 3 | G1856: 462.00 | H1856: 1.50 | I1856: 970.20 | J1856: 43.80 | K1856: 5 | L1856: =RC[-3]/100*RC[-1] -> 1.50
A1857: 3 | B1857: H4199/LR | C1857: US SFU штаны укр.-цифра (PolyCotton) ||SP-SFU-PR-99 | D1857: 15.44 | E1857: usd | F1857: 3 | G1857: 462.00 | H1857: 1.50 | I1857: 970.20 | J1857: 43.80 | K1857: 5 | L1857: =RC[-3]/100*RC[-1] -> 1.50
A1858: 4 | B1858: H4199/XLR | C1858: US SFU штаны укр.-цифра (PolyCotton) ||SP-SFU-PR-99 | D1858: 15.44 | E1858: usd | F1858: 3 | G1858: 462.00 | H1858: 1.50 | I1858: 970.20 | J1858: 43.80 | K1858: 5 | L1858: =RC[-3]/100*RC[-1] -> 1.50
A1859: 5 | B1859: X402 | C1859: Балаклава олива с 1-м отв.(100%хлопок) ||X76012 | D1859: 3.15 | E1859: Инт | F1859: 30 | G1859: 50.00 | H1859: 0.79 | I1859: 1050.00 | J1859: -840.00 | K1859: 5 | L1859: =RC[-3]/100*RC[-1] -> 0.79
A1860: 6 | B1860: M800114/44.5 | C1860: Берцы MAGNUM Elite Spider 8.0(EU) Desert | D1860: 47.75 | E1860: usd | F1860: 3 | G1860: 1092.00 | H1860: 1.14 | I1860: 2293.20 | J1860: -571.80 | K1860: 5 | L1860: =RC[-3]/100*RC[-1] -> 1.14
A1861: 7 | B1861: H26331/2XL | C1861: Куртка PATRIOT флисовая MP CAMO 390г/м (superfine) ||BL-PAT-HF-33 | D1861: 31.03 | E1861: usd | F1861: 1 | G1861: 932.00 | H1861: 1.50 | I1861: 652.40 | J1861: 31.80 | K1861: 5 | L1861: =RC[-3]/100*RC[-1] -> 1.50
A1862: 8 | B1862: H26331/L | C1862: Куртка PATRIOT флисовая MP CAMO 390г/м (superfine) ||BL-PAT-HF-33 | D1862: 31.03 | E1862: usd | F1862: 1 | G1862: 932.00 | H1862: 1.50 | I1862: 652.40 | J1862: 31.80 | K1862: 5 | L1862: =RC[-3]/100*RC[-1] -> 1.50
A1863: 9 | B1863: H26331/M | C1863: Куртка PATRIOT флисовая MP CAMO 390г/м (superfine) ||BL-PAT-HF-33 | D1863: 31.03 | E1863: usd | F1863: 1 | G1863: 932.00 | H1863: 1.50 | I1863: 652.40 | J1863: 31.80 | K1863: 5 | L1863: =RC[-3]/100*RC[-1] -> 1.50
A1864: 10 | B1864: K11005-O | C1864: Розгрузочна система тактическая STRIKE с подсумками олива ||M51611005-OD | D1864: 18.19 | E1864: usd | F1864: 10 | G1864: 610.00 | H1864: 1.68 | I1864: 4270.00 | J1864: 632.00 | K1864: 5 | L1864: =RC[-3]/100*RC[-1] -> 1.68 | M1864: =SUM(R[-10]C[-1]:RC[-1]) -> 
A1866: #7456 (2014-08-21) Львів Назар Максимович - Відправлено-Продано
A1867: N | B1867: арт | C1867: назва | D1867: закуп | F1867: к-ть | G1867: цiна | H1867: кф | I1867: продж | J1867: дохiд | K1867: % | L1867: з-та
A1868: 1 | B1868: H3502/S | C1868: Комплект термобілизни (100% полиэстер) олива ||KP-UN1-PO-02 | D1868: 13.71 | E1868: usd | F1868: 2 | G1868: 423.00 | H1868: 1.54 | I1868: 592.20 | J1868: 43.80 | K1868: 5 | L1868: =RC[-3]/100*RC[-1] -> 1.54
A1869: 2 | B1869: H3502/M | C1869: Комплект термобілизни (100% полиэстер) олива ||KP-UN1-PO-02 | D1869: 13.71 | E1869: usd | F1869: 1 | G1869: 423.00 | H1869: 1.54 | I1869: 296.10 | J1869: 21.90 | K1869: 5 | L1869: =RC[-3]/100*RC[-1] -> 1.54
A1870: 3 | B1870: H3502/L | C1870: Комплект термобілизни (100% полиэстер) олива ||KP-UN1-PO-02 | D1870: 13.71 | E1870: usd | F1870: 1 | G1870: 423.00 | H1870: 1.54 | I1870: 296.10 | J1870: 21.90 | K1870: 5 | L1870: =RC[-3]/100*RC[-1] -> 1.54
A1871: 4 | B1871: H7106 | C1871: US BDU кепка польский дезерт (R/S) ||CZ-COM-CR-06 | D1871: 2.33 | E1871: usd | F1871: 4 | G1871: 72.00 | H1871: 1.55 | I1871: 201.60 | J1871: 15.20 | K1871: 5 | L1871: =RC[-3]/100*RC[-1] -> 1.55 | M1871: =SUM(R[-4]C[-1]:RC[-1]) -> 
A1873: #7541 (2014-08-25) Львів Назар Максимович - Відправлено-Продано
A1874: N | B1874: арт | C1874: назва | D1874: закуп | F1874: к-ть | G1874: цiна | H1874: кф | I1874: продж | J1874: дохiд | K1874: % | L1874: з-та
A1875: 1 | B1875: H7201 | C1875: US BDU кепка чёрная ( PolyCotton Ripstop) ||CZ-COM-NR-01 | D1875: 2.33 | E1875: usd | F1875: 5 | G1875: 72.00 | H1875: 1.55 | I1875: 252.00 | J1875: 19.00 | K1875: 5 | L1875: =RC[-3]/100*RC[-1] -> 1.55
A1876: 2 | B1876: H41991/XLR | C1876: US SFU китель укр.-цифра (PolyCotton) ||BL-SFU-PR-99 | D1876: 15.44 | E1876: usd | F1876: 1 | G1876: 462.00 | H1876: 1.50 | I1876: 323.40 | J1876: 14.60 | K1876: 5 | L1876: =RC[-3]/100*RC[-1] -> 1.50
A1877: 3 | B1877: H4103/2XLR | C1877: US SFU штаны вудлэнд (R/S) ||SP-SFU-CR-03 | D1877: 14.49 | E1877: usd | F1877: 1 | G1877: 433.00 | H1877: 1.49 | I1877: 303.10 | J1877: 13.30 | K1877: 5 | L1877: =RC[-3]/100*RC[-1] -> 1.49
A1878: 4 | B1878: H4304/LR | C1878: US SFU штаны польский вудлэнд (PolyCotton) ||SP-SFU-PR-04 | D1878: 14.49 | E1878: usd | F1878: 1 | G1878: 433.00 | H1878: 1.49 | I1878: 303.10 | J1878: 13.30 | K1878: 5 | L1878: =RC[-3]/100*RC[-1] -> 1.49
A1879: 5 | B1879: H4199/LL | C1879: US SFU штаны укр.-цифра (PolyCotton) ||SP-SFU-PR-99 | D1879: 15.44 | E1879: usd | F1879: 1 | G1879: 462.00 | H1879: 1.50 | I1879: 323.40 | J1879: 14.60 | K1879: 5 | L1879: =RC[-3]/100*RC[-1] -> 1.50
A1880: 6 | B1880: _12834/11 | C1880: US берцы PANAMA JUNGLE олива ||12826001-011/45 | D1880: 16.50 | E1880: euro | F1880: 1 | G1880: 413.00 | H1880: 1.00 | I1880: 289.10 | J1880: -123.40 | K1880: 5 | L1880: =RC[-3]/100*RC[-1] -> 1.00
A1881: 7 | B1881: _10705/3XL | C1881: Безрукавка утепленная вудлэнд ||10706020/907 | D1881: 13.50 | E1881: euro | F1881: 1 | G1881: 388.00 | H1881: 1.15 | I1881: 271.60 | J1881: -65.90 | K1881: 5 | L1881: =RC[-3]/100*RC[-1] -> 1.15
A1882: 8 | B1882: H3502/XL | C1882: Комплект термобілизни (100% полиэстер) олива ||KP-UN1-PO-02 | D1882: 13.71 | E1882: usd | F1882: 1 | G1882: 423.00 | H1882: 1.54 | I1882: 296.10 | J1882: 21.90 | K1882: 5 | L1882: =RC[-3]/100*RC[-1] -> 1.54
A1883: 9 | B1883: H3302/L | C1883: Комплект термобілизни (95% полиэстер 5% спандекс) олива ||KP-UN2-PO-02/L | D1883: 19.99 | E1883: usd | F1883: 1 | G1883: 617.00 | H1883: 1.54 | I1883: 431.90 | J1883: 32.10 | K1883: 5 | L1883: =RC[-3]/100*RC[-1] -> 1.54
A1884: 10 | B1884: H26331/L | C1884: Куртка PATRIOT флисовая MP CAMO 390г/м (superfine) ||BL-PAT-HF-33 | D1884: 31.03 | E1884: usd | F1884: 1 | G1884: 932.00 | H1884: 1.50 | I1884: 652.40 | J1884: 31.80 | K1884: 5 | L1884: =RC[-3]/100*RC[-1] -> 1.50
A1885: 11 | B1885: 50703-14 | C1885: Наколінники AltaSOFT Flexline койот [ALTA] ||OK-ASL-CD-11 | D1885: 13.95 | E1885: usd | F1885: 1 | G1885: 417.00 | H1885: 1.49 | I1885: 291.90 | J1885: 12.90 | K1885: 5 | L1885: =RC[-3]/100*RC[-1] -> 1.49
A1886: 12 | B1886: K12213-C | C1886: Подсумок для ножа койот [A.C.M] ||M51612213-TAN | D1886: 3.70 | E1886: usd | F1886: 1 | G1886: 110.00 | H1886: 1.49 | I1886: 77.00 | J1886: 3.00 | K1886: 5 | L1886: =RC[-3]/100*RC[-1] -> 1.49
A1887: 13 | B1887: h97611 | C1887: Подсумок Modular System аптечка койот First Aid Kit ||MO-M01-PO-11 | D1887: 7.45 | E1887: usd | F1887: 1 | G1887: 222.00 | H1887: 1.49 | I1887: 155.40 | J1887: 6.40 | K1887: 5 | L1887: =RC[-3]/100*RC[-1] -> 1.49
A1888: 14 | B1888: K12088-С | C1888: Рюкзак Tactical Backpack for 13" laptop койот ||M51612088-TAN | D1888: 21.61 | E1888: usd | F1888: 1 | G1888: 646.00 | H1888: 1.49 | I1888: 452.20 | J1888: 20.00 | K1888: 5 | L1888: =RC[-3]/100*RC[-1] -> 1.49
A1889: 15 | B1889: K12088-B | C1889: Рюкзак Tactical Backpack for 13" laptop чёрный ||M51612088-BK | D1889: 21.61 | E1889: usd | F1889: 1 | G1889: 646.00 | H1889: 1.49 | I1889: 452.20 | J1889: 20.00 | K1889: 5 | L1889: =RC[-3]/100*RC[-1] -> 1.49
A1890: 16 | B1890: H3433/2XL | C1890: Футболка MP-CAMO ||TS-TSH-CO-33 | D1890: 4.06 | E1890: usd | F1890: 1 | G1890: 121.00 | H1890: 1.49 | I1890: 84.70 | J1890: 3.55 | K1890: 5 | L1890: =RC[-3]/100*RC[-1] -> 1.49
A1891: 17 | B1891: H3433/L | C1891: Футболка MP-CAMO ||TS-TSH-CO-33 | D1891: 4.06 | E1891: usd | F1891: 1 | G1891: 121.00 | H1891: 1.49 | I1891: 84.70 | J1891: 3.55 | K1891: 5 | L1891: =RC[-3]/100*RC[-1] -> 1.49
A1892: 18 | B1892: H3433/M | C1892: Футболка MP-CAMO ||TS-TSH-CO-33 | D1892: 4.06 | E1892: usd | F1892: 1 | G1892: 121.00 | H1892: 1.49 | I1892: 84.70 | J1892: 3.55 | K1892: 5 | L1892: =RC[-3]/100*RC[-1] -> 1.49
A1893: 19 | B1893: H3433/XL | C1893: Футболка MP-CAMO ||TS-TSH-CO-33 | D1893: 4.06 | E1893: usd | F1893: 1 | G1893: 121.00 | H1893: 1.49 | I1893: 84.70 | J1893: 3.55 | K1893: 5 | L1893: =RC[-3]/100*RC[-1] -> 1.49
A1894: 20 | B1894: H3403/L | C1894: Футболка вудлэнд ||TS-TSH-CO-03 | D1894: 4.06 | E1894: usd | F1894: 1 | G1894: 121.00 | H1894: 1.49 | I1894: 84.70 | J1894: 3.55 | K1894: 5 | L1894: =RC[-3]/100*RC[-1] -> 1.49
A1895: 21 | B1895: H3403/XL | C1895: Футболка вудлэнд ||TS-TSH-CO-03 | D1895: 4.06 | E1895: usd | F1895: 1 | G1895: 121.00 | H1895: 1.49 | I1895: 84.70 | J1895: 3.55 | K1895: 5 | L1895: =RC[-3]/100*RC[-1] -> 1.49
A1896: 22 | B1896: H7802 | C1896: Хустка SHEMAGH олива/чёрная ||CZ-ARF-CO-02 | D1896: 3.62 | E1896: usd | F1896: 1 | G1896: 119.00 | H1896: 1.64 | I1896: 83.30 | J1896: 10.90 | K1896: 5 | L1896: =RC[-3]/100*RC[-1] -> 1.64
A1897: 23 | B1897: H7933 | C1897: Шапка флисовая MP Camo ||CZ-DOK-FL-33 | D1897: 4.00 | E1897: usd | F1897: 1 | G1897: 115.00 | H1897: 1.44 | I1897: 80.50 | J1897: 0.50 | K1897: 5 | L1897: =RC[-3]/100*RC[-1] -> 1.44
A1898: 24 | B1898: H7922 | C1898: Шапка флисовая вегетато ||CZ-DOK-FL-22 | D1898: 3.00 | E1898: usd | F1898: 1 | G1898: 99.00 | H1898: 1.65 | I1898: 69.30 | J1898: 9.30 | K1898: 5 | L1898: =RC[-3]/100*RC[-1] -> 1.65
A1899: 25 | B1899: H7911 | C1899: Шапка флисовая койот ||CZ-DOK-FL-11 | D1899: 2.00 | E1899: usd | F1899: 1 | G1899: 99.00 | H1899: 2.48 | I1899: 69.30 | J1899: 29.30 | K1899: 5 | L1899: =RC[-3]/100*RC[-1] -> 2.48
A1900: 26 | B1900: H7914 | C1900: Шапка флисовая мультикам ||CZ-DOK-FL-14 | D1900: 4.00 | E1900: usd | F1900: 1 | G1900: 115.00 | H1900: 1.44 | I1900: 80.50 | J1900: 0.50 | K1900: 5 | L1900: =RC[-3]/100*RC[-1] -> 1.44
A1901: 27 | B1901: H7901 | C1901: Шапка флисовая чёрная ||CZ-DOK-FL-01 | D1901: 2.00 | E1901: usd | F1901: 1 | G1901: 99.00 | H1901: 2.48 | I1901: 69.30 | J1901: 29.30 | K1901: 5 | L1901: =RC[-3]/100*RC[-1] -> 2.48 | M1901: =SUM(R[-27]C[-1]:RC[-1]) -> 
A1903: #7567 (2014-08-26) Львів Назар Максимович - Відправлено-Продано
A1904: N | B1904: арт | C1904: назва | D1904: закуп | F1904: к-ть | G1904: цiна | H1904: кф | I1904: продж | J1904: дохiд | K1904: % | L1904: з-та
A1905: 1 | B1905: H3302/M | C1905: Комплект термобілизни (95% полиэстер 5% спандекс) олива ||KP-UN2-PO-02/M | D1905: 19.99 | E1905: usd | F1905: 2 | G1905: 617.00 | H1905: 1.54 | I1905: 863.80 | J1905: 64.20 | K1905: 5 | L1905: =RC[-3]/100*RC[-1] -> 1.54
A1906: 2 | B1906: H3302/L | C1906: Комплект термобілизни (95% полиэстер 5% спандекс) олива ||KP-UN2-PO-02/L | D1906: 19.99 | E1906: usd | F1906: 5 | G1906: 617.00 | H1906: 1.54 | I1906: 2159.50 | J1906: 160.50 | K1906: 5 | L1906: =RC[-3]/100*RC[-1] -> 1.54
A1907: 3 | B1907: H3302/XL | C1907: Комплект термобілизни (95% полиэстер 5% спандекс) олива ||KP-UN2-PO-02/XL | D1907: 19.99 | E1907: usd | F1907: 4 | G1907: 617.00 | H1907: 1.54 | I1907: 1727.60 | J1907: 128.40 | K1907: 5 | L1907: =RC[-3]/100*RC[-1] -> 1.54
A1908: 4 | B1908: H3311/L | C1908: Комплект термобілизни (95% полиэстер 5% спандекс) койот ||KP-UN2-PO-11/L | D1908: 19.99 | E1908: usd | F1908: 5 | G1908: 617.00 | H1908: 1.54 | I1908: 2159.50 | J1908: 160.50 | K1908: 5 | L1908: =RC[-3]/100*RC[-1] -> 1.54
A1909: 5 | B1909: H3302/M | C1909: Комплект термобілизни (95% полиэстер 5% спандекс) олива ||KP-UN2-PO-02/M | D1909: 19.99 | E1909: usd | F1909: 1 | G1909: 617.00 | H1909: 1.54 | I1909: 431.90 | J1909: 32.10 | K1909: 5 | L1909: =RC[-3]/100*RC[-1] -> 1.54
A1910: 6 | B1910: H3311/XL | C1910: Комплект термобілизни (95% полиэстер 5% спандекс) койот ||KP-UN2-PO-11/XL | D1910: 19.99 | E1910: usd | F1910: 3 | G1910: 617.00 | H1910: 1.54 | I1910: 1295.70 | J1910: 96.30 | K1910: 5 | L1910: =RC[-3]/100*RC[-1] -> 1.54 | M1910: =SUM(R[-6]C[-1]:RC[-1]) -> 
A1912: #7604 (2014-08-26) Львів Назар Максимович - Відправлено-Продано
A1913: N | B1913: арт | C1913: назва | D1913: закуп | F1913: к-ть | G1913: цiна | H1913: кф | I1913: продж | J1913: дохiд | K1913: % | L1913: з-та
A1914: 1 | B1914: _3378-1/44 | C1914: Берцы STAR FORCE THUNDERSTORM HI чёрные | D1914: 33.53 | E1914: euro | F1914: 1 | G1914: 947.00 | H1914: 1.13 | I1914: 662.90 | J1914: -175.35 | K1914: 5 | L1914: =RC[-3]/100*RC[-1] -> 1.13
A1915: 2 | B1915: _3378-1/45 | C1915: Берцы STAR FORCE THUNDERSTORM HI чёрные | D1915: 33.53 | E1915: euro | F1915: 1 | G1915: 947.00 | H1915: 1.13 | I1915: 662.90 | J1915: -175.35 | K1915: 5 | L1915: =RC[-3]/100*RC[-1] -> 1.13 | M1915: =SUM(R[-2]C[-1]:RC[-1]) -> 
A1917: #7610 (2014-08-26) Львів Назар Максимович - Відправлено-Продано
A1918: N | B1918: арт | C1918: назва | D1918: закуп | F1918: к-ть | G1918: цiна | H1918: кф | I1918: продж | J1918: дохiд | K1918: % | L1918: з-та
A1919: 1 | B1919: H97401 | C1919: Рюкзак RATEL 25л Cordura A-TACS® AU ||PL-RTL-CD-40 | D1919: 39.27 | E1919: usd | F1919: 1 | G1919: 1149.00 | H1919: 1.46 | I1919: 804.30 | J1919: 18.90 | K1919: 5 | L1919: =RC[-3]/100*RC[-1] -> 1.46 | M1919: =SUM(R[-1]C[-1]:RC[-1]) -> 
A1921: #7635 (2014-08-27) Львів Назар Максимович - Відправлено-Продано
A1922: N | B1922: арт | C1922: назва | D1922: закуп | F1922: к-ть | G1922: цiна | H1922: кф | I1922: продж | J1922: дохiд | K1922: % | L1922: з-та
A1923: 1 | B1923: _3378-1/44 | C1923: Берцы STAR FORCE THUNDERSTORM HI чёрные | D1923: 33.53 | E1923: euro | F1923: 2 | G1923: 947.00 | H1923: 1.13 | I1923: 1325.80 | J1923: -350.70 | K1923: 5 | L1923: =RC[-3]/100*RC[-1] -> 1.13
A1924: 2 | B1924: _3378-1/45 | C1924: Берцы STAR FORCE THUNDERSTORM HI чёрные | D1924: 33.53 | E1924: euro | F1924: 2 | G1924: 947.00 | H1924: 1.13 | I1924: 1325.80 | J1924: -350.70 | K1924: 5 | L1924: =RC[-3]/100*RC[-1] -> 1.13
A1925: 3 | B1925: H10021 | C1925: Спальний мешок M.I.S.H. 3 (кокон -7) ||SR-MH3-NL-02 | D1925: 35.71 | E1925: usd | F1925: 8 | G1925: 928.00 | H1925: 1.30 | I1925: 5196.80 | J1925: -516.80 | K1925: 5 | L1925: =RC[-3]/100*RC[-1] -> 1.30 | M1925: =SUM(R[-3]C[-1]:RC[-1]) -> 
A1927: #7666 (2014-08-27) Львів Назар Максимович - Прихід товару
A1928: N | B1928: арт | C1928: назва | D1928: закуп | F1928: к-ть | G1928: цiна | H1928: кф | I1928: продж | J1928: дохiд | K1928: % | L1928: з-та
A1929: 1 | B1929: _4.1687 | C1929: Балон СО-2 UMAREX 12г | D1929: 0.39 | E1929: Инт | F1929: 1975 | G1929: 5.65 | H1929: 0.73 | I1929: 11158.80 | J1929: -4232.57 | K1929: 5 | L1929: =RC[-3]/100*RC[-1] -> 0.73
A1930: 2 | B1930: _4.1687 | C1930: Балон СО-2 UMAREX 12г | D1930: 0.39 | E1930: Инт | F1930: 45 | G1930: 5.65 | H1930: 0.73 | I1930: 254.25 | J1930: -96.44 | K1930: 5 | L1930: =RC[-3]/100*RC[-1] -> 0.73
A1931: 3 | B1931: _100SH-1 | C1931: Шарик "Шаровая молния" 4.5мм 0.57г (100шт) | D1931: 0.35 | E1931: Инт | F1931: 2 | G1931: 3.80 | H1931: 0.55 | I1931: 7.60 | J1931: -6.22 | K1931: 5 | L1931: =RC[-3]/100*RC[-1] -> 0.55
A1932: 4 | B1932: _100SH-1 | C1932: Шарик "Шаровая молния" 4.5мм 0.57г (100шт) | D1932: 0.35 | E1932: Инт | F1932: 298 | G1932: 3.80 | H1932: 0.55 | I1932: 1132.40 | J1932: -926.51 | K1932: 5 | L1932: =RC[-3]/100*RC[-1] -> 0.55 | M1932: =SUM(R[-4]C[-1]:RC[-1]) -> 
A1934: #7714 (2014-08-28) Львів Назар Максимович - Відправлено-Продано
A1935: N | B1935: арт | C1935: назва | D1935: закуп | F1935: к-ть | G1935: цiна | H1935: кф | I1935: продж | J1935: дохiд | K1935: % | L1935: з-та
A1936: 1 | B1936: G0001 | C1936: Комплект (наколенники и налокотники) койот | D1936: 350.00 | E1936: грн | F1936: 10 | G1936: 600.00 | H1936: 1.71 | I1936: 4500.00 | J1936: 1000.00 | K1936: 5 | L1936: =RC[-3]/100*RC[-1] -> 1.71
A1937: 2 | B1937: M17079-BK | C1937: Перчатки без палые чорные [Производитель: ACM] ||M51617079-BK | D1937: 4.17 | E1937: usd | F1937: 5 | G1937: 195.00 | H1937: 2.34 | I1937: 682.50 | J1937: 265.50 | K1937: 5 | L1937: =RC[-3]/100*RC[-1] -> 2.34 | M1937: =SUM(R[-2]C[-1]:RC[-1]) -> 
A1939: #7754 (2014-08-29) Львів Назар Максимович - Відправлено-Продано
A1940: N | B1940: арт | C1940: назва | D1940: закуп | F1940: к-ть | G1940: цiна | H1940: кф | I1940: продж | J1940: дохiд | K1940: % | L1940: з-та
A1941: 1 | B1941: H4199/ML | C1941: US SFU штаны укр.-цифра (PolyCotton) ||SP-SFU-PR-99 | D1941: 15.44 | E1941: usd | F1941: 1 | G1941: 462.00 | H1941: 1.50 | I1941: 323.40 | J1941: 14.60 | K1941: 5 | L1941: =RC[-3]/100*RC[-1] -> 1.50
A1942: 2 | B1942: H4199/LR | C1942: US SFU штаны укр.-цифра (PolyCotton) ||SP-SFU-PR-99 | D1942: 15.44 | E1942: usd | F1942: 1 | G1942: 462.00 | H1942: 1.50 | I1942: 323.40 | J1942: 14.60 | K1942: 5 | L1942: =RC[-3]/100*RC[-1] -> 1.50
A1943: 3 | B1943: H4199/XLR | C1943: US SFU штаны укр.-цифра (PolyCotton) ||SP-SFU-PR-99 | D1943: 15.44 | E1943: usd | F1943: 1 | G1943: 462.00 | H1943: 1.50 | I1943: 323.40 | J1943: 14.60 | K1943: 5 | L1943: =RC[-3]/100*RC[-1] -> 1.50
A1944: 4 | B1944: H41991/LR | C1944: US SFU китель укр.-цифра (PolyCotton) ||BL-SFU-PR-99 | D1944: 15.44 | E1944: usd | F1944: 1 | G1944: 462.00 | H1944: 1.50 | I1944: 323.40 | J1944: 14.60 | K1944: 5 | L1944: =RC[-3]/100*RC[-1] -> 1.50
A1945: 5 | B1945: H41991/ML | C1945: US SFU китель укр.-цифра (PolyCotton) ||BL-SFU-PR-99 | D1945: 15.44 | E1945: usd | F1945: 1 | G1945: 462.00 | H1945: 1.50 | I1945: 323.40 | J1945: 14.60 | K1945: 5 | L1945: =RC[-3]/100*RC[-1] -> 1.50
A1946: 6 | B1946: H0220/11 | C1946: Носки шерстяные высокие (белые) ||SK-NOR-WA-20 | D1946: 5.27 | E1946: usd | F1946: 5 | G1946: 157.00 | H1946: 1.49 | I1946: 549.50 | J1946: 22.50 | K1946: 5 | L1946: =RC[-3]/100*RC[-1] -> 1.49
A1947: 7 | B1947: H3301/M | C1947: Комплект термобілизни (95% полиэстер 5% спандекс) чёрный ||KP-UN2-PO-01/M | D1947: 19.99 | E1947: usd | F1947: 1 | G1947: 617.00 | H1947: 1.54 | I1947: 431.90 | J1947: 32.10 | K1947: 5 | L1947: =RC[-3]/100*RC[-1] -> 1.54
A1948: 8 | B1948: H3501/M | C1948: Комплект термобілизни (100% полиэстер) чёрный ||KP-UN1-PO-01 | D1948: 13.71 | E1948: usd | F1948: 1 | G1948: 423.00 | H1948: 1.54 | I1948: 296.10 | J1948: 21.90 | K1948: 5 | L1948: =RC[-3]/100*RC[-1] -> 1.54
A1949: 9 | B1949: _3378-1/44 | C1949: Берцы STAR FORCE THUNDERSTORM HI чёрные | D1949: 33.53 | E1949: euro | F1949: 1 | G1949: 947.00 | H1949: 1.13 | I1949: 662.90 | J1949: -175.35 | K1949: 5 | L1949: =RC[-3]/100*RC[-1] -> 1.13
A1950: 10 | B1950: K13051-W | C1950: Кобура MOLLE вудлэнд ||M51613051-WL | D1950: 4.86 | E1950: usd | F1950: 1 | G1950: 166.00 | H1950: 1.71 | I1950: 116.20 | J1950: 19.00 | K1950: 5 | L1950: =RC[-3]/100*RC[-1] -> 1.71
A1951: 11 | B1951: K13051-F | C1951: Кобура MOLLE флектарн ||M51613051-GF | D1951: 4.86 | E1951: usd | F1951: 1 | G1951: 166.00 | H1951: 1.71 | I1951: 116.20 | J1951: 19.00 | K1951: 5 | L1951: =RC[-3]/100*RC[-1] -> 1.71
A1952: 12 | B1952: K13048-AT | C1952: Кобура набедренная A-TACS ||M51613048-ATACS | D1952: 5.25 | E1952: usd | F1952: 1 | G1952: 183.00 | H1952: 1.74 | I1952: 128.10 | J1952: 23.10 | K1952: 5 | L1952: =RC[-3]/100*RC[-1] -> 1.74
A1953: 13 | B1953: K13049-A | C1953: Кобура набедренная ACU ||M51613049-ACU | D1953: 6.06 | E1953: usd | F1953: 1 | G1953: 198.00 | H1953: 1.63 | I1953: 138.60 | J1953: 17.40 | K1953: 5 | L1953: =RC[-3]/100*RC[-1] -> 1.63
A1954: 14 | B1954: K13049-AT | C1954: Кобура набедренная ATACS ||M51613049-ATACS | D1954: 6.06 | E1954: usd | F1954: 1 | G1954: 198.00 | H1954: 1.63 | I1954: 138.60 | J1954: 17.40 | K1954: 5 | L1954: =RC[-3]/100*RC[-1] -> 1.63
A1955: 15 | B1955: K13086-A | C1955: Кобура тактическая NEW UNIVERSAL ACU ||M51613086-ACU | D1955: 5.29 | E1955: usd | F1955: 1 | G1955: 183.00 | H1955: 1.73 | I1955: 128.10 | J1955: 22.30 | K1955: 5 | L1955: =RC[-3]/100*RC[-1] -> 1.73
A1956: 16 | B1956: K13086-F | C1956: Кобура тактическая NEW UNIVERSAL флектарн ||M51613086-GF | D1956: 4.98 | E1956: usd | F1956: 1 | G1956: 167.00 | H1956: 1.68 | I1956: 116.90 | J1956: 17.30 | K1956: 5 | L1956: =RC[-3]/100*RC[-1] -> 1.68 | M1956: =SUM(R[-16]C[-1]:RC[-1]) -> 
A1958: #7779 (2014-08-30) Львів Назар Максимович - Відправлено-Продано
A1959: N | B1959: арт | C1959: назва | D1959: закуп | F1959: к-ть | G1959: цiна | H1959: кф | I1959: продж | J1959: дохiд | K1959: % | L1959: з-та
A1960: 1 | B1960: K12088-B | C1960: Рюкзак Tactical Backpack for 13" laptop чёрный ||M51612088-BK | D1960: 21.61 | E1960: usd | F1960: 1 | G1960: 646.00 | H1960: 1.49 | I1960: 452.20 | J1960: 20.00 | K1960: 5 | L1960: =RC[-3]/100*RC[-1] -> 1.49
A1961: 2 | B1961: H3311/XL | C1961: Комплект термобілизни (95% полиэстер 5% спандекс) койот ||KP-UN2-PO-11/XL | D1961: 19.99 | E1961: usd | F1961: 1 | G1961: 617.00 | H1961: 1.54 | I1961: 431.90 | J1961: 32.10 | K1961: 5 | L1961: =RC[-3]/100*RC[-1] -> 1.54
A1962: 3 | B1962: H3302/XL | C1962: Комплект термобілизни (95% полиэстер 5% спандекс) олива ||KP-UN2-PO-02/XL | D1962: 19.99 | E1962: usd | F1962: 1 | G1962: 617.00 | H1962: 1.54 | I1962: 431.90 | J1962: 32.10 | K1962: 5 | L1962: =RC[-3]/100*RC[-1] -> 1.54
A1963: 4 | B1963: X402 | C1963: Балаклава олива с 1-м отв.(100%хлопок) ||X76012 | D1963: 3.15 | E1963: Инт | F1963: 25 | G1963: 50.00 | H1963: 0.79 | I1963: 875.00 | J1963: -700.00 | K1963: 5 | L1963: =RC[-3]/100*RC[-1] -> 0.79
A1964: 5 | B1964: H4199/LR | C1964: US SFU штаны укр.-цифра (PolyCotton) ||SP-SFU-PR-99 | D1964: 15.44 | E1964: usd | F1964: 1 | G1964: 462.00 | H1964: 1.50 | I1964: 323.40 | J1964: 14.60 | K1964: 5 | L1964: =RC[-3]/100*RC[-1] -> 1.50
A1965: 6 | B1965: H41991/LR | C1965: US SFU китель укр.-цифра (PolyCotton) ||BL-SFU-PR-99 | D1965: 15.44 | E1965: usd | F1965: 1 | G1965: 462.00 | H1965: 1.50 | I1965: 323.40 | J1965: 14.60 | K1965: 5 | L1965: =RC[-3]/100*RC[-1] -> 1.50
A1966: 7 | B1966: H7611N | C1966: Балаклава коет с 1-м отв.(ComfortDry) ||CZ-KO2-FG-11 | D1966: 5.66 | E1966: usd | F1966: 1 | G1966: 183.00 | H1966: 1.62 | I1966: 128.10 | J1966: 14.90 | K1966: 5 | L1966: =RC[-3]/100*RC[-1] -> 1.62
A1967: 8 | B1967: H7601N | C1967: Балаклава чёрная с 1-м отв.(ComfortDry) ||CZ-KO2-FG-01 | D1967: 5.66 | E1967: usd | F1967: 1 | G1967: 183.00 | H1967: 1.62 | I1967: 128.10 | J1967: 14.90 | K1967: 5 | L1967: =RC[-3]/100*RC[-1] -> 1.62 | M1967: =SUM(R[-8]C[-1]:RC[-1]) -> 
A1969: #7783 (2014-08-30) Львів Назар Максимович - Відправлено-Продано
A1970: N | B1970: арт | C1970: назва | D1970: закуп | F1970: к-ть | G1970: цiна | H1970: кф | I1970: продж | J1970: дохiд | K1970: % | L1970: з-та
A1971: 1 | B1971: H3302/M | C1971: Комплект термобілизни (95% полиэстер 5% спандекс) олива ||KP-UN2-PO-02/M | D1971: 19.99 | E1971: usd | F1971: 2 | G1971: 617.00 | H1971: 1.54 | I1971: 863.80 | J1971: 64.20 | K1971: 5 | L1971: =RC[-3]/100*RC[-1] -> 1.54
A1972: 2 | B1972: H3302/L | C1972: Комплект термобілизни (95% полиэстер 5% спандекс) олива ||KP-UN2-PO-02/L | D1972: 19.99 | E1972: usd | F1972: 2 | G1972: 617.00 | H1972: 1.54 | I1972: 863.80 | J1972: 64.20 | K1972: 5 | L1972: =RC[-3]/100*RC[-1] -> 1.54
A1973: 3 | B1973: H3302/XL | C1973: Комплект термобілизни (95% полиэстер 5% спандекс) олива ||KP-UN2-PO-02/XL | D1973: 19.99 | E1973: usd | F1973: 2 | G1973: 617.00 | H1973: 1.54 | I1973: 863.80 | J1973: 64.20 | K1973: 5 | L1973: =RC[-3]/100*RC[-1] -> 1.54
A1974: 4 | B1974: H3302/2XL | C1974: Комплект термобілизни (95% полиэстер 5% спандекс) олива ||KP-UN2-PO-02/2XL | D1974: 19.99 | E1974: usd | F1974: 2 | G1974: 617.00 | H1974: 1.54 | I1974: 863.80 | J1974: 64.20 | K1974: 5 | L1974: =RC[-3]/100*RC[-1] -> 1.54
A1975: 5 | B1975: H7911 | C1975: Шапка флисовая койот ||CZ-DOK-FL-11 | D1975: 2.00 | E1975: usd | F1975: 4 | G1975: 99.00 | H1975: 2.48 | I1975: 277.20 | J1975: 117.20 | K1975: 5 | L1975: =RC[-3]/100*RC[-1] -> 2.48
A1976: 6 | B1976: H7901 | C1976: Шапка флисовая чёрная ||CZ-DOK-FL-01 | D1976: 2.00 | E1976: usd | F1976: 4 | G1976: 99.00 | H1976: 2.48 | I1976: 277.20 | J1976: 117.20 | K1976: 5 | L1976: =RC[-3]/100*RC[-1] -> 2.48
A1977: 7 | B1977: _10444/L | C1977: Куртка МА-1 олива ||10401001/904 | D1977: 21.50 | E1977: euro | F1977: 1 | G1977: 672.00 | H1977: 1.25 | I1977: 470.40 | J1977: -67.10 | K1977: 5 | L1977: =RC[-3]/100*RC[-1] -> 1.25
A1978: 8 | B1978: H43041/LR | C1978: US SFU китель польский вудлэнд (PolyCotton) ||BL-SFU-PR-04 | D1978: 14.49 | E1978: usd | F1978: 2 | G1978: 433.00 | H1978: 1.49 | I1978: 606.20 | J1978: 26.60 | K1978: 5 | L1978: =RC[-3]/100*RC[-1] -> 1.49
A1979: 9 | B1979: H4304/LR | C1979: US SFU штаны польский вудлэнд (PolyCotton) ||SP-SFU-PR-04 | D1979: 14.49 | E1979: usd | F1979: 1 | G1979: 433.00 | H1979: 1.49 | I1979: 303.10 | J1979: 13.30 | K1979: 5 | L1979: =RC[-3]/100*RC[-1] -> 1.49
A1980: 10 | B1980: _3378-1/44 | C1980: Берцы STAR FORCE THUNDERSTORM HI чёрные | D1980: 33.53 | E1980: euro | F1980: 1 | G1980: 947.00 | H1980: 1.13 | I1980: 662.90 | J1980: -175.35 | K1980: 5 | L1980: =RC[-3]/100*RC[-1] -> 1.13 | M1980: =SUM(R[-10]C[-1]:RC[-1]) -> 
A1982: #7806 (2014-09-01) Львів Назар Максимович - Відправлено-Продано
A1983: N | B1983: арт | C1983: назва | D1983: закуп | F1983: к-ть | G1983: цiна | H1983: кф | I1983: продж | J1983: дохiд | K1983: % | L1983: з-та
A1984: 1 | B1984: _3378-1/44 | C1984: Берцы STAR FORCE THUNDERSTORM HI чёрные | D1984: 33.53 | E1984: euro | F1984: 10 | G1984: 947.00 | H1984: 1.13 | I1984: 6629.00 | J1984: -1753.50 | K1984: 5 | L1984: =RC[-3]/100*RC[-1] -> 1.13 | M1984: =SUM(R[-1]C[-1]:RC[-1]) -> 
A1986: #7835 (2014-09-01) Львів Назар Максимович - Відправлено-Продано
A1987: N | B1987: арт | C1987: назва | D1987: закуп | F1987: к-ть | G1987: цiна | H1987: кф | I1987: продж | J1987: дохiд | K1987: % | L1987: з-та
A1988: 1 | B1988: _12676 | C1988: BW бандана (оригинал) олива ||12601001 | D1988: 2.75 | E1988: euro | F1988: 3 | G1988: 79.00 | H1988: 1.15 | I1988: 165.90 | J1988: -40.35 | K1988: 5 | L1988: =RC[-3]/100*RC[-1] -> 1.15
A1989: 2 | B1989: H41991/LR | C1989: US SFU китель укр.-цифра (PolyCotton) ||BL-SFU-PR-99 | D1989: 15.44 | E1989: usd | F1989: 2 | G1989: 462.00 | H1989: 1.50 | I1989: 646.80 | J1989: 29.20 | K1989: 5 | L1989: =RC[-3]/100*RC[-1] -> 1.50
A1990: 3 | B1990: H41991/MR | C1990: US SFU китель укр.-цифра (PolyCotton) ||BL-SFU-PR-99 | D1990: 15.44 | E1990: usd | F1990: 2 | G1990: 462.00 | H1990: 1.50 | I1990: 646.80 | J1990: 29.20 | K1990: 5 | L1990: =RC[-3]/100*RC[-1] -> 1.50
A1991: 4 | B1991: H41991/XLR | C1991: US SFU китель укр.-цифра (PolyCotton) ||BL-SFU-PR-99 | D1991: 15.44 | E1991: usd | F1991: 2 | G1991: 462.00 | H1991: 1.50 | I1991: 646.80 | J1991: 29.20 | K1991: 5 | L1991: =RC[-3]/100*RC[-1] -> 1.50
A1992: 5 | B1992: H4199/LR | C1992: US SFU штаны укр.-цифра (PolyCotton) ||SP-SFU-PR-99 | D1992: 15.44 | E1992: usd | F1992: 2 | G1992: 462.00 | H1992: 1.50 | I1992: 646.80 | J1992: 29.20 | K1992: 5 | L1992: =RC[-3]/100*RC[-1] -> 1.50
A1993: 6 | B1993: H4199/MR | C1993: US SFU штаны укр.-цифра (PolyCotton) ||SP-SFU-PR-99 | D1993: 15.44 | E1993: usd | F1993: 2 | G1993: 462.00 | H1993: 1.50 | I1993: 646.80 | J1993: 29.20 | K1993: 5 | L1993: =RC[-3]/100*RC[-1] -> 1.50
A1994: 7 | B1994: H4199/XLR | C1994: US SFU штаны укр.-цифра (PolyCotton) ||SP-SFU-PR-99 | D1994: 15.44 | E1994: usd | F1994: 2 | G1994: 462.00 | H1994: 1.50 | I1994: 646.80 | J1994: 29.20 | K1994: 5 | L1994: =RC[-3]/100*RC[-1] -> 1.50
A1995: 8 | B1995: _3378-1/44 | C1995: Берцы STAR FORCE THUNDERSTORM HI чёрные | D1995: 33.53 | E1995: euro | F1995: 5 | G1995: 947.00 | H1995: 1.13 | I1995: 3314.50 | J1995: -876.75 | K1995: 5 | L1995: =RC[-3]/100*RC[-1] -> 1.13
A1996: 9 | B1996: M17079-BK | C1996: Перчатки без палые чорные [Производитель: ACM] ||M51617079-BK | D1996: 4.17 | E1996: usd | F1996: 5 | G1996: 195.00 | H1996: 2.34 | I1996: 682.50 | J1996: 265.50 | K1996: 5 | L1996: =RC[-3]/100*RC[-1] -> 2.34 | M1996: =SUM(R[-9]C[-1]:RC[-1]) -> 
A1998: #7899 (2014-09-02) Львів Назар Максимович - Відправлено-Продано
A1999: N | B1999: арт | C1999: назва | D1999: закуп | F1999: к-ть | G1999: цiна | H1999: кф | I1999: продж | J1999: дохiд | K1999: % | L1999: з-та
A2000: 1 | B2000: H3404/M | C2000: Футболка польский вудлэнд ||TS-TSH-CO-04 | D2000: 4.06 | E2000: usd | F2000: 1 | G2000: 121.00 | H2000: 1.49 | I2000: 84.70 | J2000: 3.55 | K2000: 5 | L2000: =RC[-3]/100*RC[-1] -> 1.49
A2001: 2 | B2001: H3404/XL | C2001: Футболка польский вудлэнд ||TS-TSH-CO-04 | D2001: 4.06 | E2001: usd | F2001: 1 | G2001: 121.00 | H2001: 1.49 | I2001: 84.70 | J2001: 3.55 | K2001: 5 | L2001: =RC[-3]/100*RC[-1] -> 1.49
A2002: 3 | B2002: H3404/2XL | C2002: Футболка польский вудлэнд ||TS-TSH-CO-04 | D2002: 4.06 | E2002: usd | F2002: 1 | G2002: 121.00 | H2002: 1.49 | I2002: 84.70 | J2002: 3.55 | K2002: 5 | L2002: =RC[-3]/100*RC[-1] -> 1.49
A2003: 4 | B2003: H3410/S | C2003: Футболка ACU ||TS-TSH-CO-10 | D2003: 4.06 | E2003: usd | F2003: 1 | G2003: 121.00 | H2003: 1.49 | I2003: 84.70 | J2003: 3.55 | K2003: 5 | L2003: =RC[-3]/100*RC[-1] -> 1.49
A2004: 5 | B2004: H3410/M | C2004: Футболка ACU ||TS-TSH-CO-10 | D2004: 4.06 | E2004: usd | F2004: 1 | G2004: 121.00 | H2004: 1.49 | I2004: 84.70 | J2004: 3.55 | K2004: 5 | L2004: =RC[-3]/100*RC[-1] -> 1.49
A2005: 6 | B2005: H3410/3XL | C2005: Футболка ACU ||TS-TSH-CO-10 | D2005: 4.06 | E2005: usd | F2005: 1 | G2005: 121.00 | H2005: 1.49 | I2005: 84.70 | J2005: 3.55 | K2005: 5 | L2005: =RC[-3]/100*RC[-1] -> 1.49
A2006: 7 | B2006: H3433/XL | C2006: Футболка MP-CAMO ||TS-TSH-CO-33 | D2006: 4.06 | E2006: usd | F2006: 1 | G2006: 121.00 | H2006: 1.49 | I2006: 84.70 | J2006: 3.55 | K2006: 5 | L2006: =RC[-3]/100*RC[-1] -> 1.49
A2007: 8 | B2007: H3407/2XL | C2007: Футболка марпат ||TS-TSH-CO-07 | D2007: 4.13 | E2007: usd | F2007: 1 | G2007: 121.00 | H2007: 1.46 | I2007: 84.70 | J2007: 2.10 | K2007: 5 | L2007: =RC[-3]/100*RC[-1] -> 1.46
A2008: 9 | B2008: H3403/L | C2008: Футболка вудлэнд ||TS-TSH-CO-03 | D2008: 4.06 | E2008: usd | F2008: 1 | G2008: 121.00 | H2008: 1.49 | I2008: 84.70 | J2008: 3.55 | K2008: 5 | L2008: =RC[-3]/100*RC[-1] -> 1.49
A2009: 10 | B2009: H3403/XL | C2009: Футболка вудлэнд ||TS-TSH-CO-03 | D2009: 4.06 | E2009: usd | F2009: 1 | G2009: 121.00 | H2009: 1.49 | I2009: 84.70 | J2009: 3.55 | K2009: 5 | L2009: =RC[-3]/100*RC[-1] -> 1.49
A2010: 11 | B2010: H3403/2XL | C2010: Футболка вудлэнд ||TS-TSH-CO-03 | D2010: 4.06 | E2010: usd | F2010: 1 | G2010: 121.00 | H2010: 1.49 | I2010: 84.70 | J2010: 3.55 | K2010: 5 | L2010: =RC[-3]/100*RC[-1] -> 1.49
A2011: 12 | B2011: H3406/M | C2011: Футболка польский дезерт ||TS-TSH-CO-06 | D2011: 4.06 | E2011: usd | F2011: 1 | G2011: 121.00 | H2011: 1.49 | I2011: 84.70 | J2011: 3.55 | K2011: 5 | L2011: =RC[-3]/100*RC[-1] -> 1.49
A2012: 13 | B2012: H3406/XL | C2012: Футболка польский дезерт ||TS-TSH-CO-06 | D2012: 4.06 | E2012: usd | F2012: 1 | G2012: 121.00 | H2012: 1.49 | I2012: 84.70 | J2012: 3.55 | K2012: 5 | L2012: =RC[-3]/100*RC[-1] -> 1.49
A2013: 14 | B2013: H3406/2XL | C2013: Футболка польский дезерт ||TS-TSH-CO-06 | D2013: 4.06 | E2013: usd | F2013: 1 | G2013: 121.00 | H2013: 1.49 | I2013: 84.70 | J2013: 3.55 | K2013: 5 | L2013: =RC[-3]/100*RC[-1] -> 1.49 | M2013: =SUM(R[-14]C[-1]:RC[-1]) -> 
A2015: #7903 (2014-09-02) Львів Назар Максимович - Відправлено-Продано
A2016: N | B2016: арт | C2016: назва | D2016: закуп | F2016: к-ть | G2016: цiна | H2016: кф | I2016: продж | J2016: дохiд | K2016: % | L2016: з-та
A2017: 1 | B2017: H7106 | C2017: US BDU кепка польский дезерт (R/S) ||CZ-COM-CR-06 | D2017: 2.33 | E2017: usd | F2017: 2 | G2017: 72.00 | H2017: 1.55 | I2017: 100.80 | J2017: 7.60 | K2017: 5 | L2017: =RC[-3]/100*RC[-1] -> 1.55 | M2017: =SUM(R[-1]C[-1]:RC[-1]) -> 
A2019: #7931 (2014-09-02) Львів Назар Максимович - Відправлено-Продано
A2020: N | B2020: арт | C2020: назва | D2020: закуп | F2020: к-ть | G2020: цiна | H2020: кф | I2020: продж | J2020: дохiд | K2020: % | L2020: з-та
A2021: 1 | B2021: _3378-1/46 | C2021: Берцы STAR FORCE THUNDERSTORM HI чёрные | D2021: 33.53 | E2021: euro | F2021: 1 | G2021: 947.00 | H2021: 1.13 | I2021: 662.90 | J2021: -175.35 | K2021: 5 | L2021: =RC[-3]/100*RC[-1] -> 1.13
A2022: 2 | B2022: G0001 | C2022: Комплект (наколенники и налокотники) койот | D2022: 350.00 | E2022: грн | F2022: 10 | G2022: 600.00 | H2022: 1.71 | I2022: 4500.00 | J2022: 1000.00 | K2022: 5 | L2022: =RC[-3]/100*RC[-1] -> 1.71 | M2022: =SUM(R[-2]C[-1]:RC[-1]) -> 
A2024: #7978 (2014-09-03) Львів Назар Максимович - Відправлено-Продано
A2025: N | B2025: арт | C2025: назва | D2025: закуп | F2025: к-ть | G2025: цiна | H2025: кф | I2025: продж | J2025: дохiд | K2025: % | L2025: з-та
A2026: 1 | B2026: H43141/LR | C2026: US SFU китель мультикам (PolyCotton) ||BL-SFU-PR-14 | D2026: 16.64 | E2026: usd | F2026: 1 | G2026: 504.00 | H2026: 1.51 | I2026: 352.80 | J2026: 20.00 | K2026: 5 | L2026: =RC[-3]/100*RC[-1] -> 1.51
A2027: 2 | B2027: H4314/ML | C2027: US SFU штаны мультикам (NYCO R/S) ||SP-SFU-PR-14 | D2027: 16.64 | E2027: usd | F2027: 1 | G2027: 504.00 | H2027: 1.51 | I2027: 352.80 | J2027: 20.00 | K2027: 5 | L2027: =RC[-3]/100*RC[-1] -> 1.51 | M2027: =SUM(R[-2]C[-1]:RC[-1]) -> 
A2029: #7981 (2014-09-03) Львів Назар Максимович - Відправлено-Продано
A2030: N | B2030: арт | C2030: назва | D2030: закуп | F2030: к-ть | G2030: цiна | H2030: кф | I2030: продж | J2030: дохiд | K2030: % | L2030: з-та
A2031: 1 | B2031: H43041/LR | C2031: US SFU китель польский вудлэнд (PolyCotton) ||BL-SFU-PR-04 | D2031: 14.49 | E2031: usd | F2031: 1 | G2031: 433.00 | H2031: 1.49 | I2031: 303.10 | J2031: 13.30 | K2031: 5 | L2031: =RC[-3]/100*RC[-1] -> 1.49
A2032: 2 | B2032: H41991/LR | C2032: US SFU китель укр.-цифра (PolyCotton) ||BL-SFU-PR-99 | D2032: 15.44 | E2032: usd | F2032: 2 | G2032: 462.00 | H2032: 1.50 | I2032: 646.80 | J2032: 29.20 | K2032: 5 | L2032: =RC[-3]/100*RC[-1] -> 1.50
A2033: 3 | B2033: H41991/MR | C2033: US SFU китель укр.-цифра (PolyCotton) ||BL-SFU-PR-99 | D2033: 15.44 | E2033: usd | F2033: 1 | G2033: 462.00 | H2033: 1.50 | I2033: 323.40 | J2033: 14.60 | K2033: 5 | L2033: =RC[-3]/100*RC[-1] -> 1.50
A2034: 4 | B2034: H41991/XLR | C2034: US SFU китель укр.-цифра (PolyCotton) ||BL-SFU-PR-99 | D2034: 15.44 | E2034: usd | F2034: 1 | G2034: 462.00 | H2034: 1.50 | I2034: 323.40 | J2034: 14.60 | K2034: 5 | L2034: =RC[-3]/100*RC[-1] -> 1.50
A2035: 5 | B2035: H43011/LR | C2035: US SFU китель чёрный (PolyCotton) ||BL-SFU-PR-01 | D2035: 15.03 | E2035: usd | F2035: 1 | G2035: 433.00 | H2035: 1.44 | I2035: 303.10 | J2035: 2.50 | K2035: 5 | L2035: =RC[-3]/100*RC[-1] -> 1.44
A2036: 6 | B2036: H4304/LR | C2036: US SFU штаны польский вудлэнд (PolyCotton) ||SP-SFU-PR-04 | D2036: 14.49 | E2036: usd | F2036: 1 | G2036: 433.00 | H2036: 1.49 | I2036: 303.10 | J2036: 13.30 | K2036: 5 | L2036: =RC[-3]/100*RC[-1] -> 1.49
A2037: 7 | B2037: H4199/LR | C2037: US SFU штаны укр.-цифра (PolyCotton) ||SP-SFU-PR-99 | D2037: 15.44 | E2037: usd | F2037: 1 | G2037: 462.00 | H2037: 1.50 | I2037: 323.40 | J2037: 14.60 | K2037: 5 | L2037: =RC[-3]/100*RC[-1] -> 1.50
A2038: 8 | B2038: H4199/ML | C2038: US SFU штаны укр.-цифра (PolyCotton) ||SP-SFU-PR-99 | D2038: 15.44 | E2038: usd | F2038: 1 | G2038: 462.00 | H2038: 1.50 | I2038: 323.40 | J2038: 14.60 | K2038: 5 | L2038: =RC[-3]/100*RC[-1] -> 1.50
A2039: 9 | B2039: H4199/XLR | C2039: US SFU штаны укр.-цифра (PolyCotton) ||SP-SFU-PR-99 | D2039: 15.44 | E2039: usd | F2039: 1 | G2039: 462.00 | H2039: 1.50 | I2039: 323.40 | J2039: 14.60 | K2039: 5 | L2039: =RC[-3]/100*RC[-1] -> 1.50
A2040: 10 | B2040: H4301/LL | C2040: US SFU штаны чёрные (PolyCotton) ||SP-SFU-PR-01 | D2040: 15.03 | E2040: usd | F2040: 1 | G2040: 433.00 | H2040: 1.44 | I2040: 303.10 | J2040: 2.50 | K2040: 5 | L2040: =RC[-3]/100*RC[-1] -> 1.44
A2041: 11 | B2041: K12088-С | C2041: Рюкзак Tactical Backpack for 13" laptop койот ||M51612088-TAN | D2041: 21.61 | E2041: usd | F2041: 2 | G2041: 646.00 | H2041: 1.49 | I2041: 904.40 | J2041: 40.00 | K2041: 5 | L2041: =RC[-3]/100*RC[-1] -> 1.49
A2042: 12 | B2042: K12088-B | C2042: Рюкзак Tactical Backpack for 13" laptop чёрный ||M51612088-BK | D2042: 21.61 | E2042: usd | F2042: 1 | G2042: 646.00 | H2042: 1.49 | I2042: 452.20 | J2042: 20.00 | K2042: 5 | L2042: =RC[-3]/100*RC[-1] -> 1.49 | M2042: =SUM(R[-12]C[-1]:RC[-1]) -> 
A2044: #7986 (2014-09-03) Львів Назар Максимович - Відправлено-Продано
A2045: N | B2045: арт | C2045: назва | D2045: закуп | F2045: к-ть | G2045: цiна | H2045: кф | I2045: продж | J2045: дохiд | K2045: % | L2045: з-та
A2046: 1 | B2046: H2214/M | C2046: Куртка GUNFIGHTER мультикам ||KU-GUN-FM-14 | D2046: 55.81 | E2046: usd | F2046: 1 | G2046: 1522.00 | H2046: 1.36 | I2046: 1065.40 | J2046: -50.80 | K2046: 5 | L2046: =RC[-3]/100*RC[-1] -> 1.36 | M2046: =SUM(R[-1]C[-1]:RC[-1]) -> 
A2048: #7994 (2014-09-03) Львів Назар Максимович - Відправлено-Продано
A2049: N | B2049: арт | C2049: назва | D2049: закуп | F2049: к-ть | G2049: цiна | H2049: кф | I2049: продж | J2049: дохiд | K2049: % | L2049: з-та
A2050: 1 | B2050: H5914/XXLR | C2050: CPU штаны мультикамо (PolyCotton) ||SP-CPU-PR-14 | D2050: 21.56 | E2050: usd | F2050: 1 | G2050: 641.00 | H2050: 1.49 | I2050: 448.70 | J2050: 17.50 | K2050: 5 | L2050: =RC[-3]/100*RC[-1] -> 1.49
A2051: 2 | B2051: H59141/XXLR | C2051: CPU китель мультикамо (PolyCotton) ||BL-CPU-PR-14 | D2051: 21.56 | E2051: usd | F2051: 1 | G2051: 641.00 | H2051: 1.49 | I2051: 448.70 | J2051: 17.50 | K2051: 5 | L2051: =RC[-3]/100*RC[-1] -> 1.49 | M2051: =SUM(R[-2]C[-1]:RC[-1]) -> 
A2053: #8009 (2014-09-04) Львів Назар Максимович - Відправлено-Продано
A2054: N | B2054: арт | C2054: назва | D2054: закуп | F2054: к-ть | G2054: цiна | H2054: кф | I2054: продж | J2054: дохiд | K2054: % | L2054: з-та
A2055: 1 | B2055: K11014-M | C2055: Жилет PT Tactical Body Armor мультикам ||M51611014-CP | D2055: 13.21 | E2055: usd | F2055: 1 | G2055: 375.00 | H2055: 1.42 | I2055: 262.50 | J2055: -1.70 | K2055: 5 | L2055: =RC[-3]/100*RC[-1] -> 1.42
A2056: 2 | B2056: K13049-AT | C2056: Кобура набедренная ATACS ||M51613049-ATACS | D2056: 6.06 | E2056: usd | F2056: 1 | G2056: 198.00 | H2056: 1.63 | I2056: 138.60 | J2056: 17.40 | K2056: 5 | L2056: =RC[-3]/100*RC[-1] -> 1.63
A2057: 3 | B2057: G0001 | C2057: Комплект (наколенники и налокотники) койот | D2057: 350.00 | E2057: грн | F2057: 2 | G2057: 600.00 | H2057: 1.71 | I2057: 900.00 | J2057: 200.00 | K2057: 5 | L2057: =RC[-3]/100*RC[-1] -> 1.71
A2058: 4 | B2058: M17079-BK | C2058: Перчатки без палые чорные [Производитель: ACM] ||M51617079-BK | D2058: 4.17 | E2058: usd | F2058: 5 | G2058: 195.00 | H2058: 2.34 | I2058: 682.50 | J2058: 265.50 | K2058: 5 | L2058: =RC[-3]/100*RC[-1] -> 2.34
A2059: 5 | B2059: EM8270A | C2059: Ремень 2-точ.тактический койот [Производитель: ACM] | D2059: 8.14 | E2059: usd | F2059: 2 | G2059: 229.00 | H2059: 1.41 | I2059: 320.60 | J2059: -5.00 | K2059: 5 | L2059: =RC[-3]/100*RC[-1] -> 1.41
A2060: 6 | B2060: K17088-С | C2060: Ремень 3-точ.тактический MP5/G3/M4 койот (котон)[Производитель: ACM] ||M51617088-TAN | D2060: 3.20 | E2060: usd | F2060: 2 | G2060: 135.00 | H2060: 2.11 | I2060: 189.00 | J2060: 61.00 | K2060: 5 | L2060: =RC[-3]/100*RC[-1] -> 2.11
A2061: 7 | B2061: K11004-AT | C2061: Розгруз. Ciras Mar ATACS [Производитель: ACM] ||M51611004-ATACS | D2061: 51.75 | E2061: usd | F2061: 1 | G2061: 1604.00 | H2061: 1.55 | I2061: 1122.80 | J2061: 87.80 | K2061: 5 | L2061: =RC[-3]/100*RC[-1] -> 1.55
A2062: 8 | B2062: 850.002 | C2062: Очки DEFENDER | D2062: 21.00 | E2062: euro | F2062: 1 | G2062: 450.00 | H2062: 0.86 | I2062: 450.00 | J2062: -75.00 | K2062: 5 | L2062: =RC[-3]/100*RC[-1] -> 0.86 | M2062: =SUM(R[-8]C[-1]:RC[-1]) -> 
A2064: #8022 (2014-09-04) Львів Назар Максимович - Відправлено-Продано
A2065: N | B2065: арт | C2065: назва | D2065: закуп | F2065: к-ть | G2065: цiна | H2065: кф | I2065: продж | J2065: дохiд | K2065: % | L2065: з-та
A2066: 1 | B2066: K12216-M | C2066: Панель набедренная MOLLE мультикам [A.C.M] ||M51612216-CP | D2066: 7.12 | E2066: usd | F2066: 1 | G2066: 207.00 | H2066: 1.45 | I2066: 144.90 | J2066: 2.50 | K2066: 5 | L2066: =RC[-3]/100*RC[-1] -> 1.45
A2067: 2 | B2067: A19-191 | C2067: Подсумок для магазинов РПК двойнойACROPOLIS||РПК-2 | D2067: 83.00 | E2067: грн | F2067: 1 | G2067: 115.00 | H2067: 1.39 | I2067: 97.75 | J2067: 14.75 | K2067: 5 | L2067: =RC[-3]/100*RC[-1] -> 1.39
A2068: 3 | B2068: K17195-O | C2068: Ремень 3-точ.тактический G3/M4/M15/M16 олива [Производитель: ACM] ||M51617195-OD | D2068: 7.81 | E2068: usd | F2068: 1 | G2068: 234.00 | H2068: 1.50 | I2068: 163.80 | J2068: 7.60 | K2068: 5 | L2068: =RC[-3]/100*RC[-1] -> 1.50 | M2068: =SUM(R[-3]C[-1]:RC[-1]) -> 
A2070: #8053 (2014-09-04) Львів Назар Максимович - Відправлено-Продано
A2071: N | B2071: арт | C2071: назва | D2071: закуп | F2071: к-ть | G2071: цiна | H2071: кф | I2071: продж | J2071: дохiд | K2071: % | L2071: з-та
A2072: 1 | B2072: Брон | C2072: Бронепластина 4-й класс | D2072: 70.00 | E2072: usd | F2072: 10 | G2072: 1200.00 | H2072: 0.86 | I2072: 11400.00 | J2072: -2600.00 | K2072: 5 | L2072: =RC[-3]/100*RC[-1] -> 0.86
A2073: 2 | B2073: K11005-O | C2073: Розгрузочна система тактическая STRIKE с подсумками олива ||M51611005-OD | D2073: 18.19 | E2073: usd | F2073: 5 | G2073: 610.00 | H2073: 1.68 | I2073: 2135.00 | J2073: 316.00 | K2073: 5 | L2073: =RC[-3]/100*RC[-1] -> 1.68 | M2073: =SUM(R[-2]C[-1]:RC[-1]) -> 
A2075: #8062 (2014-09-04) Львів Назар Максимович - Відправлено-Продано
A2076: N | B2076: арт | C2076: назва | D2076: закуп | F2076: к-ть | G2076: цiна | H2076: кф | I2076: продж | J2076: дохiд | K2076: % | L2076: з-та
A2077: 1 | B2077: H41991/SR | C2077: US SFU китель укр.-цифра (PolyCotton) ||BL-SFU-PR-99 | D2077: 15.44 | E2077: usd | F2077: 1 | G2077: 462.00 | H2077: 1.50 | I2077: 323.40 | J2077: 14.60 | K2077: 5 | L2077: =RC[-3]/100*RC[-1] -> 1.50
A2078: 2 | B2078: H4199/SR | C2078: US SFU штаны укр.-цифра (PolyCotton) ||SP-SFU-PR-99 | D2078: 15.44 | E2078: usd | F2078: 1 | G2078: 462.00 | H2078: 1.50 | I2078: 323.40 | J2078: 14.60 | K2078: 5 | L2078: =RC[-3]/100*RC[-1] -> 1.50 | M2078: =SUM(R[-2]C[-1]:RC[-1]) -> 
A2080: #8087 (2014-09-05) Львів Назар Максимович - Відправлено-Продано
A2081: N | B2081: арт | C2081: назва | D2081: закуп | F2081: к-ть | G2081: цiна | H2081: кф | I2081: продж | J2081: дохiд | K2081: % | L2081: з-та
A2082: 1 | B2082: H41991/MR | C2082: US SFU китель укр.-цифра (PolyCotton) ||BL-SFU-PR-99 | D2082: 15.44 | E2082: usd | F2082: 5 | G2082: 462.00 | H2082: 1.50 | I2082: 1617.00 | J2082: 73.00 | K2082: 5 | L2082: =RC[-3]/100*RC[-1] -> 1.50
A2083: 2 | B2083: H4199/LR | C2083: US SFU штаны укр.-цифра (PolyCotton) ||SP-SFU-PR-99 | D2083: 15.44 | E2083: usd | F2083: 5 | G2083: 462.00 | H2083: 1.50 | I2083: 1617.00 | J2083: 73.00 | K2083: 5 | L2083: =RC[-3]/100*RC[-1] -> 1.50
A2084: 3 | B2084: H4199/MR | C2084: US SFU штаны укр.-цифра (PolyCotton) ||SP-SFU-PR-99 | D2084: 15.44 | E2084: usd | F2084: 5 | G2084: 462.00 | H2084: 1.50 | I2084: 1617.00 | J2084: 73.00 | K2084: 5 | L2084: =RC[-3]/100*RC[-1] -> 1.50
A2085: 4 | B2085: _3378-1/45 | C2085: Берцы STAR FORCE THUNDERSTORM HI чёрные | D2085: 33.53 | E2085: euro | F2085: 8 | G2085: 947.00 | H2085: 1.13 | I2085: 5303.20 | J2085: -1402.80 | K2085: 5 | L2085: =RC[-3]/100*RC[-1] -> 1.13 | M2085: =SUM(R[-4]C[-1]:RC[-1]) -> 
A2087: #8115 (2014-09-05) Львів Назар Максимович - Відправлено-Продано
A2088: N | B2088: арт | C2088: назва | D2088: закуп | F2088: к-ть | G2088: цiна | H2088: кф | I2088: продж | J2088: дохiд | K2088: % | L2088: з-та
A2089: 1 | B2089: H1214/L | C2089: ECWCS штаны TRILAMINAT Gen.2 мультикам ||SP-EC2-NL-14 | D2089: 35.80 | E2089: usd | F2089: 1 | G2089: 1071.00 | H2089: 1.50 | I2089: 749.70 | J2089: 33.70 | K2089: 5 | L2089: =RC[-3]/100*RC[-1] -> 1.50
A2090: 2 | B2090: H43041/LR | C2090: US SFU китель польский вудлэнд (PolyCotton) ||BL-SFU-PR-04 | D2090: 14.49 | E2090: usd | F2090: 1 | G2090: 433.00 | H2090: 1.49 | I2090: 303.10 | J2090: 13.30 | K2090: 5 | L2090: =RC[-3]/100*RC[-1] -> 1.49
A2091: 3 | B2091: H43041/XLR | C2091: US SFU китель польский вудлэнд (PolyCotton) ||BL-SFU-PR-04 | D2091: 14.49 | E2091: usd | F2091: 1 | G2091: 433.00 | H2091: 1.49 | I2091: 303.10 | J2091: 13.30 | K2091: 5 | L2091: =RC[-3]/100*RC[-1] -> 1.49
A2092: 4 | B2092: H4304/LR | C2092: US SFU штаны польский вудлэнд (PolyCotton) ||SP-SFU-PR-04 | D2092: 14.49 | E2092: usd | F2092: 1 | G2092: 433.00 | H2092: 1.49 | I2092: 303.10 | J2092: 13.30 | K2092: 5 | L2092: =RC[-3]/100*RC[-1] -> 1.49
A2093: 5 | B2093: H4304/XLR | C2093: US SFU штаны польский вудлэнд (PolyCotton) ||SP-SFU-PR-04 | D2093: 14.49 | E2093: usd | F2093: 1 | G2093: 433.00 | H2093: 1.49 | I2093: 303.10 | J2093: 13.30 | K2093: 5 | L2093: =RC[-3]/100*RC[-1] -> 1.49
A2094: 6 | B2094: H7933 | C2094: Шапка флисовая MP Camo ||CZ-DOK-FL-33 | D2094: 4.00 | E2094: usd | F2094: 5 | G2094: 115.00 | H2094: 1.44 | I2094: 402.50 | J2094: 2.50 | K2094: 5 | L2094: =RC[-3]/100*RC[-1] -> 1.44
A2095: 7 | B2095: H7922 | C2095: Шапка флисовая вегетато ||CZ-DOK-FL-22 | D2095: 3.00 | E2095: usd | F2095: 5 | G2095: 99.00 | H2095: 1.65 | I2095: 346.50 | J2095: 46.50 | K2095: 5 | L2095: =RC[-3]/100*RC[-1] -> 1.65
A2096: 8 | B2096: H7914 | C2096: Шапка флисовая мультикам ||CZ-DOK-FL-14 | D2096: 4.00 | E2096: usd | F2096: 5 | G2096: 115.00 | H2096: 1.44 | I2096: 402.50 | J2096: 2.50 | K2096: 5 | L2096: =RC[-3]/100*RC[-1] -> 1.44 | M2096: =SUM(R[-8]C[-1]:RC[-1]) -> 
A2098: #8117 (2014-09-05) Львів Назар Максимович - Відправлено-Продано
A2099: N | B2099: арт | C2099: назва | D2099: закуп | F2099: к-ть | G2099: цiна | H2099: кф | I2099: продж | J2099: дохiд | K2099: % | L2099: з-та
A2100: 1 | B2100: H41991/MR | C2100: US SFU китель укр.-цифра (PolyCotton) ||BL-SFU-PR-99 | D2100: 15.44 | E2100: usd | F2100: 3 | G2100: 462.00 | H2100: 1.50 | I2100: 970.20 | J2100: 43.80 | K2100: 5 | L2100: =RC[-3]/100*RC[-1] -> 1.50
A2101: 2 | B2101: H41991/ML | C2101: US SFU китель укр.-цифра (PolyCotton) ||BL-SFU-PR-99 | D2101: 15.44 | E2101: usd | F2101: 1 | G2101: 462.00 | H2101: 1.50 | I2101: 323.40 | J2101: 14.60 | K2101: 5 | L2101: =RC[-3]/100*RC[-1] -> 1.50
A2102: 3 | B2102: H41991/LR | C2102: US SFU китель укр.-цифра (PolyCotton) ||BL-SFU-PR-99 | D2102: 15.44 | E2102: usd | F2102: 14 | G2102: 462.00 | H2102: 1.50 | I2102: 4527.60 | J2102: 204.40 | K2102: 5 | L2102: =RC[-3]/100*RC[-1] -> 1.50
A2103: 4 | B2103: H41991/XLR | C2103: US SFU китель укр.-цифра (PolyCotton) ||BL-SFU-PR-99 | D2103: 15.44 | E2103: usd | F2103: 23 | G2103: 462.00 | H2103: 1.50 | I2103: 7438.20 | J2103: 335.80 | K2103: 5 | L2103: =RC[-3]/100*RC[-1] -> 1.50
A2104: 5 | B2104: H41991/2XLR | C2104: US SFU китель укр.-цифра (PolyCotton) ||BL-SFU-PR-99 | D2104: 15.44 | E2104: usd | F2104: 30 | G2104: 462.00 | H2104: 1.50 | I2104: 9702.00 | J2104: 438.00 | K2104: 5 | L2104: =RC[-3]/100*RC[-1] -> 1.50
A2105: 6 | B2105: H4199/ML | C2105: US SFU штаны укр.-цифра (PolyCotton) ||SP-SFU-PR-99 | D2105: 15.44 | E2105: usd | F2105: 4 | G2105: 462.00 | H2105: 1.50 | I2105: 1293.60 | J2105: 58.40 | K2105: 5 | L2105: =RC[-3]/100*RC[-1] -> 1.50
A2106: 7 | B2106: H4199/LR | C2106: US SFU штаны укр.-цифра (PolyCotton) ||SP-SFU-PR-99 | D2106: 15.44 | E2106: usd | F2106: 14 | G2106: 462.00 | H2106: 1.50 | I2106: 4527.60 | J2106: 204.40 | K2106: 5 | L2106: =RC[-3]/100*RC[-1] -> 1.50
A2107: 8 | B2107: H4199/XLR | C2107: US SFU штаны укр.-цифра (PolyCotton) ||SP-SFU-PR-99 | D2107: 15.44 | E2107: usd | F2107: 23 | G2107: 462.00 | H2107: 1.50 | I2107: 7438.20 | J2107: 335.80 | K2107: 5 | L2107: =RC[-3]/100*RC[-1] -> 1.50
A2108: 9 | B2108: H4199/2XLR | C2108: US SFU штаны укр.-цифра (PolyCotton) ||SP-SFU-PR-99 | D2108: 15.44 | E2108: usd | F2108: 30 | G2108: 462.00 | H2108: 1.50 | I2108: 9702.00 | J2108: 438.00 | K2108: 5 | L2108: =RC[-3]/100*RC[-1] -> 1.50 | M2108: =SUM(R[-9]C[-1]:RC[-1]) -> 
A2110: #8119 (2014-09-05) Львів Назар Максимович - Відправлено-Продано
A2111: N | B2111: арт | C2111: назва | D2111: закуп | F2111: к-ть | G2111: цiна | H2111: кф | I2111: продж | J2111: дохiд | K2111: % | L2111: з-та
A2112: 1 | B2112: H4301/ML | C2112: US SFU штаны чёрные (PolyCotton) ||SP-SFU-PR-01 | D2112: 15.03 | E2112: usd | F2112: 1 | G2112: 433.00 | H2112: 1.44 | I2112: 303.10 | J2112: 2.50 | K2112: 5 | L2112: =RC[-3]/100*RC[-1] -> 1.44
A2113: 2 | B2113: H4301/XLL | C2113: US SFU штаны чёрные (PolyCotton) ||SP-SFU-PR-01 | D2113: 15.03 | E2113: usd | F2113: 1 | G2113: 433.00 | H2113: 1.44 | I2113: 303.10 | J2113: 2.50 | K2113: 5 | L2113: =RC[-3]/100*RC[-1] -> 1.44
A2114: 3 | B2114: H43011/MR | C2114: US SFU китель чёрный (PolyCotton) ||BL-SFU-PR-01 | D2114: 15.03 | E2114: usd | F2114: 1 | G2114: 433.00 | H2114: 1.44 | I2114: 303.10 | J2114: 2.50 | K2114: 5 | L2114: =RC[-3]/100*RC[-1] -> 1.44
A2115: 4 | B2115: H43011/XLR | C2115: US SFU китель чёрный (PolyCotton) ||BL-SFU-PR-01 | D2115: 15.03 | E2115: usd | F2115: 1 | G2115: 433.00 | H2115: 1.44 | I2115: 303.10 | J2115: 2.50 | K2115: 5 | L2115: =RC[-3]/100*RC[-1] -> 1.44 | M2115: =SUM(R[-4]C[-1]:RC[-1]) -> 
A2117: #8142 (2014-09-06) Львів Назар Максимович - Відправлено-Продано
A2118: N | B2118: арт | C2118: назва | D2118: закуп | F2118: к-ть | G2118: цiна | H2118: кф | I2118: продж | J2118: дохiд | K2118: % | L2118: з-та
A2119: 1 | B2119: _10476/M | C2119: Куртка-аляска US N2B короткая синя ||10410003/903 | D2119: 32.00 | E2119: euro | F2119: 1 | G2119: 1000.00 | H2119: 1.25 | I2119: 700.00 | J2119: -100.00 | K2119: 5 | L2119: =RC[-3]/100*RC[-1] -> 1.25
A2120: 2 | B2120: K12088-С | C2120: Рюкзак Tactical Backpack for 13" laptop койот ||M51612088-TAN | D2120: 21.61 | E2120: usd | F2120: 2 | G2120: 646.00 | H2120: 1.49 | I2120: 904.40 | J2120: 40.00 | K2120: 5 | L2120: =RC[-3]/100*RC[-1] -> 1.49 | M2120: =SUM(R[-2]C[-1]:RC[-1]) -> 
A2122: #8160 (2014-09-08) Львів Назар Максимович - Відправлено-Продано
A2123: N | B2123: арт | C2123: назва | D2123: закуп | F2123: к-ть | G2123: цiна | H2123: кф | I2123: продж | J2123: дохiд | K2123: % | L2123: з-та
A2124: 1 | B2124: H3404/L | C2124: Футболка польский вудлэнд ||TS-TSH-CO-04 | D2124: 4.06 | E2124: usd | F2124: 1 | G2124: 121.00 | H2124: 1.49 | I2124: 84.70 | J2124: 3.55 | K2124: 5 | L2124: =RC[-3]/100*RC[-1] -> 1.49
A2125: 2 | B2125: H3404/XL | C2125: Футболка польский вудлэнд ||TS-TSH-CO-04 | D2125: 4.06 | E2125: usd | F2125: 1 | G2125: 121.00 | H2125: 1.49 | I2125: 84.70 | J2125: 3.55 | K2125: 5 | L2125: =RC[-3]/100*RC[-1] -> 1.49
A2126: 3 | B2126: H3404/2XL | C2126: Футболка польский вудлэнд ||TS-TSH-CO-04 | D2126: 4.06 | E2126: usd | F2126: 1 | G2126: 121.00 | H2126: 1.49 | I2126: 84.70 | J2126: 3.55 | K2126: 5 | L2126: =RC[-3]/100*RC[-1] -> 1.49
A2127: 4 | B2127: H3433/XL | C2127: Футболка MP-CAMO ||TS-TSH-CO-33 | D2127: 4.06 | E2127: usd | F2127: 1 | G2127: 121.00 | H2127: 1.49 | I2127: 84.70 | J2127: 3.55 | K2127: 5 | L2127: =RC[-3]/100*RC[-1] -> 1.49
A2128: 5 | B2128: H3433/2XL | C2128: Футболка MP-CAMO ||TS-TSH-CO-33 | D2128: 4.06 | E2128: usd | F2128: 1 | G2128: 121.00 | H2128: 1.49 | I2128: 84.70 | J2128: 3.55 | K2128: 5 | L2128: =RC[-3]/100*RC[-1] -> 1.49
A2129: 6 | B2129: H3433/3XL | C2129: Футболка MP-CAMO ||TS-TSH-CO-33 | D2129: 4.06 | E2129: usd | F2129: 1 | G2129: 121.00 | H2129: 1.49 | I2129: 84.70 | J2129: 3.55 | K2129: 5 | L2129: =RC[-3]/100*RC[-1] -> 1.49
A2130: 7 | B2130: H3403/L | C2130: Футболка вудлэнд ||TS-TSH-CO-03 | D2130: 4.06 | E2130: usd | F2130: 1 | G2130: 121.00 | H2130: 1.49 | I2130: 84.70 | J2130: 3.55 | K2130: 5 | L2130: =RC[-3]/100*RC[-1] -> 1.49
A2131: 8 | B2131: H3403/XL | C2131: Футболка вудлэнд ||TS-TSH-CO-03 | D2131: 4.06 | E2131: usd | F2131: 1 | G2131: 121.00 | H2131: 1.49 | I2131: 84.70 | J2131: 3.55 | K2131: 5 | L2131: =RC[-3]/100*RC[-1] -> 1.49
A2132: 9 | B2132: H3403/2XL | C2132: Футболка вудлэнд ||TS-TSH-CO-03 | D2132: 4.06 | E2132: usd | F2132: 1 | G2132: 121.00 | H2132: 1.49 | I2132: 84.70 | J2132: 3.55 | K2132: 5 | L2132: =RC[-3]/100*RC[-1] -> 1.49
A2133: 10 | B2133: H3403/3XL | C2133: Футболка вудлэнд ||TS-TSH-CO-03 | D2133: 4.06 | E2133: usd | F2133: 1 | G2133: 121.00 | H2133: 1.49 | I2133: 84.70 | J2133: 3.55 | K2133: 5 | L2133: =RC[-3]/100*RC[-1] -> 1.49
A2134: 11 | B2134: H3406/S | C2134: Футболка польский дезерт ||TS-TSH-CO-06 | D2134: 4.06 | E2134: usd | F2134: 1 | G2134: 121.00 | H2134: 1.49 | I2134: 84.70 | J2134: 3.55 | K2134: 5 | L2134: =RC[-3]/100*RC[-1] -> 1.49
A2135: 12 | B2135: H3406/L | C2135: Футболка польский дезерт ||TS-TSH-CO-06 | D2135: 4.06 | E2135: usd | F2135: 1 | G2135: 121.00 | H2135: 1.49 | I2135: 84.70 | J2135: 3.55 | K2135: 5 | L2135: =RC[-3]/100*RC[-1] -> 1.49
A2136: 13 | B2136: H3406/M | C2136: Футболка польский дезерт ||TS-TSH-CO-06 | D2136: 4.06 | E2136: usd | F2136: 1 | G2136: 121.00 | H2136: 1.49 | I2136: 84.70 | J2136: 3.55 | K2136: 5 | L2136: =RC[-3]/100*RC[-1] -> 1.49
A2137: 14 | B2137: H3406/XL | C2137: Футболка польский дезерт ||TS-TSH-CO-06 | D2137: 4.06 | E2137: usd | F2137: 1 | G2137: 121.00 | H2137: 1.49 | I2137: 84.70 | J2137: 3.55 | K2137: 5 | L2137: =RC[-3]/100*RC[-1] -> 1.49
A2138: 15 | B2138: H3406/2XL | C2138: Футболка польский дезерт ||TS-TSH-CO-06 | D2138: 4.06 | E2138: usd | F2138: 1 | G2138: 121.00 | H2138: 1.49 | I2138: 84.70 | J2138: 3.55 | K2138: 5 | L2138: =RC[-3]/100*RC[-1] -> 1.49
A2139: 16 | B2139: H3429/XL | C2139: Футболка олива-драп ||TS-TSH-CO-02 | D2139: 4.06 | E2139: usd | F2139: 1 | G2139: 121.00 | H2139: 1.49 | I2139: 84.70 | J2139: 3.55 | K2139: 5 | L2139: =RC[-3]/100*RC[-1] -> 1.49
A2140: 17 | B2140: H3429/3XL | C2140: Футболка олива-драп ||TS-TSH-CO-02 | D2140: 4.06 | E2140: usd | F2140: 1 | G2140: 121.00 | H2140: 1.49 | I2140: 84.70 | J2140: 3.55 | K2140: 5 | L2140: =RC[-3]/100*RC[-1] -> 1.49
A2141: 18 | B2141: H3402/M | C2141: Футболка олива ||TS-TSH-CO-29 | D2141: 4.06 | E2141: usd | F2141: 1 | G2141: 121.00 | H2141: 1.49 | I2141: 84.70 | J2141: 3.55 | K2141: 5 | L2141: =RC[-3]/100*RC[-1] -> 1.49
A2142: 19 | B2142: H3402/L | C2142: Футболка олива ||TS-TSH-CO-29 | D2142: 4.06 | E2142: usd | F2142: 1 | G2142: 121.00 | H2142: 1.49 | I2142: 84.70 | J2142: 3.55 | K2142: 5 | L2142: =RC[-3]/100*RC[-1] -> 1.49
A2143: 20 | B2143: H3402/XL | C2143: Футболка олива ||TS-TSH-CO-29 | D2143: 4.06 | E2143: usd | F2143: 1 | G2143: 121.00 | H2143: 1.49 | I2143: 84.70 | J2143: 3.55 | K2143: 5 | L2143: =RC[-3]/100*RC[-1] -> 1.49 | M2143: =SUM(R[-20]C[-1]:RC[-1]) -> 
A2145: #8179 (2014-09-08) Львів Назар Максимович - Відправлено-Продано
A2146: N | B2146: арт | C2146: назва | D2146: закуп | F2146: к-ть | G2146: цiна | H2146: кф | I2146: продж | J2146: дохiд | K2146: % | L2146: з-та
A2147: 1 | B2147: 50413-08 | C2147: Наколінники AltaFLEX Long Cap вудлэнд [ALTA] ||OK-AFL-CD-03 | D2147: 17.01 | E2147: usd | F2147: 1 | G2147: 509.00 | H2147: 1.50 | I2147: 356.30 | J2147: 16.10 | K2147: 5 | L2147: =RC[-3]/100*RC[-1] -> 1.50 | M2147: =SUM(R[-1]C[-1]:RC[-1]) -> 
A2149: #8184 (2014-09-08) Львів Назар Максимович - Відправлено-Продано
A2150: N | B2150: арт | C2150: назва | D2150: закуп | F2150: к-ть | G2150: цiна | H2150: кф | I2150: продж | J2150: дохiд | K2150: % | L2150: з-та
A2151: 1 | B2151: _3378-1/46 | C2151: Берцы STAR FORCE THUNDERSTORM HI чёрные | D2151: 33.53 | E2151: euro | F2151: 1 | G2151: 947.00 | H2151: 1.13 | I2151: 662.90 | J2151: -175.35 | K2151: 5 | L2151: =RC[-3]/100*RC[-1] -> 1.13
A2152: 2 | B2152: H41991/ML | C2152: US SFU китель укр.-цифра (PolyCotton) ||BL-SFU-PR-99 | D2152: 15.44 | E2152: usd | F2152: 1 | G2152: 462.00 | H2152: 1.50 | I2152: 323.40 | J2152: 14.60 | K2152: 5 | L2152: =RC[-3]/100*RC[-1] -> 1.50
A2153: 3 | B2153: H4199/ML | C2153: US SFU штаны укр.-цифра (PolyCotton) ||SP-SFU-PR-99 | D2153: 15.44 | E2153: usd | F2153: 1 | G2153: 462.00 | H2153: 1.50 | I2153: 323.40 | J2153: 14.60 | K2153: 5 | L2153: =RC[-3]/100*RC[-1] -> 1.50
A2154: 4 | B2154: H59391/XLR | C2154: CPU китель A-TACS FG (PolyCotton) ||BL-CPU-PR-39 | D2154: 32.12 | E2154: usd | F2154: 1 | G2154: 940.00 | H2154: 1.46 | I2154: 658.00 | J2154: 15.60 | K2154: 5 | L2154: =RC[-3]/100*RC[-1] -> 1.46
A2155: 5 | B2155: H5939/LR | C2155: CPU штаны A-TACS FG (PolyCotton) ||SP-CPU-PR-39 | D2155: 32.12 | E2155: usd | F2155: 1 | G2155: 940.00 | H2155: 1.46 | I2155: 658.00 | J2155: 15.60 | K2155: 5 | L2155: =RC[-3]/100*RC[-1] -> 1.46
A2156: 6 | B2156: H5940/LL | C2156: CPU штаны A-TACS AU (PolyCotton) ||SP-CPU-PR-40 | D2156: 32.12 | E2156: usd | F2156: 1 | G2156: 940.00 | H2156: 1.46 | I2156: 658.00 | J2156: 15.60 | K2156: 5 | L2156: =RC[-3]/100*RC[-1] -> 1.46
A2157: 7 | B2157: H59401/LR | C2157: CPU китель A-TACS AU (PolyCotton) ||BL-CPU-PR-40 | D2157: 32.12 | E2157: usd | F2157: 1 | G2157: 940.00 | H2157: 1.46 | I2157: 658.00 | J2157: 15.60 | K2157: 5 | L2157: =RC[-3]/100*RC[-1] -> 1.46 | M2157: =SUM(R[-7]C[-1]:RC[-1]) -> 
A2159: #8201 (2014-09-08) Львів Назар Максимович - Клієнт повернув
A2160: N | B2160: арт | C2160: назва | D2160: закуп | F2160: к-ть | G2160: цiна | H2160: кф | I2160: продж | J2160: дохiд | K2160: % | L2160: з-та
A2161: 1 | B2161: П-3-95М | C2161: Бронежилет "Панцирь 3-95М" ТЕМП 3000 2-й класс | D2161: 1600.00 | E2161: zl | F2161: 1 | G2161: 2100.00 | H2161: 0.26 | I2161: 2000.00 | J2161: -6000.00 | K2161: 5 | L2161: =RC[-3]/100*RC[-1] -> 0.26 | M2161: =SUM(R[-1]C[-1]:RC[-1]) -> 
A2163: #8279 (2014-09-10) Львів Назар Максимович - Відправлено-Продано
A2164: N | B2164: арт | C2164: назва | D2164: закуп | F2164: к-ть | G2164: цiна | H2164: кф | I2164: продж | J2164: дохiд | K2164: % | L2164: з-та
A2165: 1 | B2165: H7202 | C2165: US BDU кепка олива (NYCO R/S) ||CZ-COM-CR-02 | D2165: 2.33 | E2165: usd | F2165: 10 | G2165: 72.00 | H2165: 1.55 | I2165: 504.00 | J2165: 38.00 | K2165: 5 | L2165: =RC[-3]/100*RC[-1] -> 1.55
A2166: 2 | B2166: H41991/LR | C2166: US SFU китель укр.-цифра (PolyCotton) ||BL-SFU-PR-99 | D2166: 15.44 | E2166: usd | F2166: 1 | G2166: 462.00 | H2166: 1.50 | I2166: 323.40 | J2166: 14.60 | K2166: 5 | L2166: =RC[-3]/100*RC[-1] -> 1.50
A2167: 3 | B2167: _10705/L | C2167: Безрукавка утепленная вудлэнд ||10706020/904 | D2167: 13.50 | E2167: euro | F2167: 1 | G2167: 388.00 | H2167: 1.15 | I2167: 271.60 | J2167: -65.90 | K2167: 5 | L2167: =RC[-3]/100*RC[-1] -> 1.15
A2168: 4 | B2168: _10705/3XL | C2168: Безрукавка утепленная вудлэнд ||10706020/907 | D2168: 13.50 | E2168: euro | F2168: 1 | G2168: 388.00 | H2168: 1.15 | I2168: 271.60 | J2168: -65.90 | K2168: 5 | L2168: =RC[-3]/100*RC[-1] -> 1.15
A2169: 5 | B2169: H65031/2XL | C2169: Куртка М65 с отстегивающейся курткой вудлэнд (NYCO) ||KU-M65-NY-03 | D2169: 37.22 | E2169: usd | F2169: 1 | G2169: 1148.00 | H2169: 1.54 | I2169: 803.60 | J2169: 59.20 | K2169: 5 | L2169: =RC[-3]/100*RC[-1] -> 1.54
A2170: 6 | B2170: H65031/XL | C2170: Куртка М65 с отстегивающейся курткой вудлэнд (NYCO) ||KU-M65-NY-03 | D2170: 37.22 | E2170: usd | F2170: 1 | G2170: 1148.00 | H2170: 1.54 | I2170: 803.60 | J2170: 59.20 | K2170: 5 | L2170: =RC[-3]/100*RC[-1] -> 1.54
A2171: 7 | B2171: H65021/LR | C2171: Куртка М65 с отстегивающейся курткой олива (NYCO) ||KU-M65-NY-02 | D2171: 38.39 | E2171: usd | F2171: 1 | G2171: 1148.00 | H2171: 1.50 | I2171: 803.60 | J2171: 35.80 | K2171: 5 | L2171: =RC[-3]/100*RC[-1] -> 1.50
A2172: 8 | B2172: H65021/MR | C2172: Куртка М65 с отстегивающейся курткой олива (NYCO) ||KU-M65-NY-02 | D2172: 38.39 | E2172: usd | F2172: 1 | G2172: 1148.00 | H2172: 1.50 | I2172: 803.60 | J2172: 35.80 | K2172: 5 | L2172: =RC[-3]/100*RC[-1] -> 1.50
A2173: 9 | B2173: _10444/L | C2173: Куртка МА-1 олива ||10401001/904 | D2173: 21.50 | E2173: euro | F2173: 1 | G2173: 672.00 | H2173: 1.25 | I2173: 470.40 | J2173: -67.10 | K2173: 5 | L2173: =RC[-3]/100*RC[-1] -> 1.25
A2174: 10 | B2174: _10449/XL | C2174: Куртка МА-1 синя ||10401003/905 | D2174: 21.50 | E2174: euro | F2174: 1 | G2174: 672.00 | H2174: 1.25 | I2174: 470.40 | J2174: -67.10 | K2174: 5 | L2174: =RC[-3]/100*RC[-1] -> 1.25
A2175: 11 | B2175: _10180/L | C2175: Куртка-аляска US N3B длинная чёрная ||10181002/904 | D2175: 34.50 | E2175: euro | F2175: 1 | G2175: 1078.00 | H2175: 1.25 | I2175: 754.60 | J2175: -107.90 | K2175: 5 | L2175: =RC[-3]/100*RC[-1] -> 1.25
A2176: 12 | B2176: _10180/XL | C2176: Куртка-аляска US N3B длинная чёрная ||10181002/905 | D2176: 34.50 | E2176: euro | F2176: 1 | G2176: 1078.00 | H2176: 1.25 | I2176: 754.60 | J2176: -107.90 | K2176: 5 | L2176: =RC[-3]/100*RC[-1] -> 1.25
A2177: 13 | B2177: _10180/XXL | C2177: Куртка-аляска US N3B длинная чёрная ||10181002/906 | D2177: 34.50 | E2177: euro | F2177: 1 | G2177: 1078.00 | H2177: 1.25 | I2177: 754.60 | J2177: -107.90 | K2177: 5 | L2177: =RC[-3]/100*RC[-1] -> 1.25
A2178: 14 | B2178: _125502 | C2178: Перчатки THINSULATE акриловые без пальцев вудлэнд ||12540020 | D2178: 2.25 | E2178: euro | F2178: 3 | G2178: 65.00 | H2178: 1.16 | I2178: 136.50 | J2178: -32.25 | K2178: 5 | L2178: =RC[-3]/100*RC[-1] -> 1.16
A2179: 15 | B2179: _12550 | C2179: Перчатки THINSULATE акриловые без пальцев олива ||12540001 | D2179: 2.00 | E2179: euro | F2179: 5 | G2179: 60.00 | H2179: 1.20 | I2179: 210.00 | J2179: -40.00 | K2179: 5 | L2179: =RC[-3]/100*RC[-1] -> 1.20
A2180: 16 | B2180: H8602/120 | C2180: Ремень TOUGH NAVY SEAL олива ||PS-NAV-CO-01 | D2180: 4.23 | E2180: usd | F2180: 5 | G2180: 126.00 | H2180: 1.49 | I2180: 441.00 | J2180: 18.00 | K2180: 5 | L2180: =RC[-3]/100*RC[-1] -> 1.49
A2181: 17 | B2181: H8602/130 | C2181: Ремень TOUGH NAVY SEAL олива ||PS-NAV-CO-01 | D2181: 4.23 | E2181: usd | F2181: 5 | G2181: 126.00 | H2181: 1.49 | I2181: 441.00 | J2181: 18.00 | K2181: 5 | L2181: =RC[-3]/100*RC[-1] -> 1.49
A2182: 18 | B2182: H8601/130 | C2182: Ремень TOUGH NAVY SEAL чёрный ||PS-NAV-CO-02 | D2182: 4.23 | E2182: usd | F2182: 5 | G2182: 126.00 | H2182: 1.49 | I2182: 441.00 | J2182: 18.00 | K2182: 5 | L2182: =RC[-3]/100*RC[-1] -> 1.49
A2183: 19 | B2183: H8902/140 | C2183: Ремень TOUGH US MARINES олива ||PS-USM-CO-02 | D2183: 3.68 | E2183: usd | F2183: 5 | G2183: 126.00 | H2183: 1.71 | I2183: 441.00 | J2183: 73.00 | K2183: 5 | L2183: =RC[-3]/100*RC[-1] -> 1.71 | M2183: =SUM(R[-19]C[-1]:RC[-1]) -> 
A2185: #8282 (2014-09-10) Львів Назар Максимович - Відправлено-Продано
A2186: N | B2186: арт | C2186: назва | D2186: закуп | F2186: к-ть | G2186: цiна | H2186: кф | I2186: продж | J2186: дохiд | K2186: % | L2186: з-та
A2187: 1 | B2187: H41991/LR | C2187: US SFU китель укр.-цифра (PolyCotton) ||BL-SFU-PR-99 | D2187: 15.44 | E2187: usd | F2187: 2 | G2187: 462.00 | H2187: 1.50 | I2187: 646.80 | J2187: 29.20 | K2187: 5 | L2187: =RC[-3]/100*RC[-1] -> 1.50
A2188: 2 | B2188: _1400020 | C2188: Каремат туристический 10мм | D2188: 4.15 | E2188: Инт | F2188: 10 | G2188: 95.00 | H2188: 1.14 | I2188: 665.00 | J2188: -165.00 | K2188: 5 | L2188: =RC[-3]/100*RC[-1] -> 1.14
A2189: 3 | B2189: _125502 | C2189: Перчатки THINSULATE акриловые без пальцев вудлэнд ||12540020 | D2189: 2.25 | E2189: euro | F2189: 5 | G2189: 65.00 | H2189: 1.16 | I2189: 227.50 | J2189: -53.75 | K2189: 5 | L2189: =RC[-3]/100*RC[-1] -> 1.16
A2190: 4 | B2190: M17079-BK | C2190: Перчатки без палые чорные [Производитель: ACM] ||M51617079-BK | D2190: 4.17 | E2190: usd | F2190: 5 | G2190: 195.00 | H2190: 2.34 | I2190: 682.50 | J2190: 265.50 | K2190: 5 | L2190: =RC[-3]/100*RC[-1] -> 2.34 | M2190: =SUM(R[-4]C[-1]:RC[-1]) -> 
A2192: #8304 (2014-09-10) Львів Назар Максимович - Прихід товару
A2193: N | B2193: арт | C2193: назва | D2193: закуп | F2193: к-ть | G2193: цiна | H2193: кф | I2193: продж | J2193: дохiд | K2193: % | L2193: з-та
A2194: 1 | B2194: 833774/L | C2194: Костюм дождевик Adventure | D2194: 275.00 | E2194: грн | F2194: 8 | G2194: 250.00 | H2194: 0.91 | I2194: 2000.00 | J2194: -200.00 | K2194: 5 | L2194: =RC[-3]/100*RC[-1] -> 0.91
A2195: 2 | B2195: 833774/M | C2195: Костюм дождевик Adventure | D2195: 275.00 | E2195: грн | F2195: 9 | G2195: 250.00 | H2195: 0.91 | I2195: 2250.00 | J2195: -225.00 | K2195: 5 | L2195: =RC[-3]/100*RC[-1] -> 0.91
A2196: 3 | B2196: 833675 | C2196: Пончо Adventure | D2196: 175.00 | E2196: грн | F2196: 1 | G2196: 155.00 | H2196: 0.89 | I2196: 155.00 | J2196: -20.00 | K2196: 5 | L2196: =RC[-3]/100*RC[-1] -> 0.89
A2197: 4 | B2197: 833668 | C2197: Пончо камо | D2197: 55.00 | E2197: грн | F2197: 30 | G2197: 55.00 | H2197: 1.00 | I2197: 1650.00 | J2197: 0.00 | K2197: 5 | L2197: =RC[-3]/100*RC[-1] -> 1.00 | M2197: =SUM(R[-4]C[-1]:RC[-1]) -> 
A2199: #8323 (2014-09-11) Львів Назар Максимович - Відправлено-Продано
A2200: N | B2200: арт | C2200: назва | D2200: закуп | F2200: к-ть | G2200: цiна | H2200: кф | I2200: продж | J2200: дохiд | K2200: % | L2200: з-та
A2201: 1 | B2201: H59401/MR | C2201: CPU китель A-TACS AU (PolyCotton) ||BL-CPU-PR-40 | D2201: 32.12 | E2201: usd | F2201: 1 | G2201: 940.00 | H2201: 1.46 | I2201: 658.00 | J2201: 15.60 | K2201: 5 | L2201: =RC[-3]/100*RC[-1] -> 1.46
A2202: 2 | B2202: H5940/MR | C2202: CPU штаны A-TACS AU (PolyCotton) ||SP-CPU-PR-40 | D2202: 32.12 | E2202: usd | F2202: 1 | G2202: 940.00 | H2202: 1.46 | I2202: 658.00 | J2202: 15.60 | K2202: 5 | L2202: =RC[-3]/100*RC[-1] -> 1.46
A2203: 3 | B2203: H5940/ML | C2203: CPU штаны A-TACS AU (PolyCotton) ||SP-CPU-PR-40 | D2203: 32.12 | E2203: usd | F2203: 1 | G2203: 940.00 | H2203: 1.46 | I2203: 658.00 | J2203: 15.60 | K2203: 5 | L2203: =RC[-3]/100*RC[-1] -> 1.46
A2204: 4 | B2204: H5940/ML | C2204: CPU штаны A-TACS AU (PolyCotton) ||SP-CPU-PR-40 | D2204: 32.12 | E2204: usd | F2204: 2 | G2204: 940.00 | H2204: 1.46 | I2204: 1316.00 | J2204: 31.20 | K2204: 5 | L2204: =RC[-3]/100*RC[-1] -> 1.46
A2205: 5 | B2205: H5940/LL | C2205: CPU штаны A-TACS AU (PolyCotton) ||SP-CPU-PR-40 | D2205: 32.12 | E2205: usd | F2205: 3 | G2205: 940.00 | H2205: 1.46 | I2205: 1974.00 | J2205: 46.80 | K2205: 5 | L2205: =RC[-3]/100*RC[-1] -> 1.46
A2206: 6 | B2206: H5940/XLL | C2206: CPU штаны A-TACS AU (PolyCotton) ||SP-CPU-PR-40 | D2206: 32.12 | E2206: usd | F2206: 3 | G2206: 940.00 | H2206: 1.46 | I2206: 1974.00 | J2206: 46.80 | K2206: 5 | L2206: =RC[-3]/100*RC[-1] -> 1.46
A2207: 7 | B2207: H59401/MR | C2207: CPU китель A-TACS AU (PolyCotton) ||BL-CPU-PR-40 | D2207: 32.12 | E2207: usd | F2207: 3 | G2207: 940.00 | H2207: 1.46 | I2207: 1974.00 | J2207: 46.80 | K2207: 5 | L2207: =RC[-3]/100*RC[-1] -> 1.46
A2208: 8 | B2208: H59401/LR | C2208: CPU китель A-TACS AU (PolyCotton) ||BL-CPU-PR-40 | D2208: 32.12 | E2208: usd | F2208: 3 | G2208: 940.00 | H2208: 1.46 | I2208: 1974.00 | J2208: 46.80 | K2208: 5 | L2208: =RC[-3]/100*RC[-1] -> 1.46
A2209: 9 | B2209: H59401/XLR | C2209: CPU китель A-TACS AU (PolyCotton) ||BL-CPU-PR-40 | D2209: 32.12 | E2209: usd | F2209: 3 | G2209: 940.00 | H2209: 1.46 | I2209: 1974.00 | J2209: 46.80 | K2209: 5 | L2209: =RC[-3]/100*RC[-1] -> 1.46 | M2209: =SUM(R[-9]C[-1]:RC[-1]) -> 
A2211: #8324 (2014-09-11) Львів Назар Максимович - Відправлено-Продано
A2212: N | B2212: арт | C2212: назва | D2212: закуп | F2212: к-ть | G2212: цiна | H2212: кф | I2212: продж | J2212: дохiд | K2212: % | L2212: з-та
A2213: 1 | B2213: H0220/11 | C2213: Носки шерстяные высокие (белые) ||SK-NOR-WA-20 | D2213: 5.27 | E2213: usd | F2213: 3 | G2213: 157.00 | H2213: 1.49 | I2213: 329.70 | J2213: 13.50 | K2213: 5 | L2213: =RC[-3]/100*RC[-1] -> 1.49
A2214: 2 | B2214: H3433/M | C2214: Футболка MP-CAMO ||TS-TSH-CO-33 | D2214: 4.06 | E2214: usd | F2214: 1 | G2214: 121.00 | H2214: 1.49 | I2214: 84.70 | J2214: 3.55 | K2214: 5 | L2214: =RC[-3]/100*RC[-1] -> 1.49
A2215: 3 | B2215: H3403/L | C2215: Футболка вудлэнд ||TS-TSH-CO-03 | D2215: 4.06 | E2215: usd | F2215: 2 | G2215: 121.00 | H2215: 1.49 | I2215: 169.40 | J2215: 7.10 | K2215: 5 | L2215: =RC[-3]/100*RC[-1] -> 1.49
A2216: 4 | B2216: H3402/M | C2216: Футболка олива ||TS-TSH-CO-29 | D2216: 4.06 | E2216: usd | F2216: 1 | G2216: 121.00 | H2216: 1.49 | I2216: 84.70 | J2216: 3.55 | K2216: 5 | L2216: =RC[-3]/100*RC[-1] -> 1.49
A2217: 5 | B2217: H3404/L | C2217: Футболка польский вудлэнд ||TS-TSH-CO-04 | D2217: 4.06 | E2217: usd | F2217: 1 | G2217: 121.00 | H2217: 1.49 | I2217: 84.70 | J2217: 3.55 | K2217: 5 | L2217: =RC[-3]/100*RC[-1] -> 1.49
A2218: 6 | B2218: H3404/M | C2218: Футболка польский вудлэнд ||TS-TSH-CO-04 | D2218: 4.06 | E2218: usd | F2218: 1 | G2218: 121.00 | H2218: 1.49 | I2218: 84.70 | J2218: 3.55 | K2218: 5 | L2218: =RC[-3]/100*RC[-1] -> 1.49 | M2218: =SUM(R[-6]C[-1]:RC[-1]) -> 
A2220: #8332 (2014-09-11) Львів Назар Максимович - Відправлено-Продано
A2221: N | B2221: арт | C2221: назва | D2221: закуп | F2221: к-ть | G2221: цiна | H2221: кф | I2221: продж | J2221: дохiд | K2221: % | L2221: з-та
A2222: 1 | B2222: _M860-1 | C2222: Нож MORAKNIV® Companion MG Carbon ||NZ-860-ST-02 | D2222: 6.06 | E2222: usd | F2222: 15 | G2222: 122.00 | H2222: 1.01 | I2222: 1464.00 | J2222: -353.73 | K2222: 5 | L2222: =RC[-3]/100*RC[-1] -> 1.01
A2223: 2 | B2223: K17177A | C2223: Очки GX-1000 с 3-мя сменніми стеклами ||M51617177A | D2223: 8.80 | E2223: usd | F2223: 5 | G2223: 280.00 | H2223: 1.59 | I2223: 980.00 | J2223: 100.00 | K2223: 5 | L2223: =RC[-3]/100*RC[-1] -> 1.59 | M2223: =SUM(R[-2]C[-1]:RC[-1]) -> 
A2225: #8373 (2014-09-11) Львів Назар Максимович - Відправлено-Продано
A2226: N | B2226: арт | C2226: назва | D2226: закуп | F2226: к-ть | G2226: цiна | H2226: кф | I2226: продж | J2226: дохiд | K2226: % | L2226: з-та
A2227: 1 | B2227: K11005-O | C2227: Розгрузочна система тактическая STRIKE с подсумками олива ||M51611005-OD | D2227: 18.19 | E2227: usd | F2227: 7 | G2227: 610.00 | H2227: 1.68 | I2227: 2989.00 | J2227: 442.40 | K2227: 5 | L2227: =RC[-3]/100*RC[-1] -> 1.68 | M2227: =SUM(R[-1]C[-1]:RC[-1]) -> 
A2229: #8397 (2014-09-12) Львів Назар Максимович - Відправлено-Продано
A2230: N | B2230: арт | C2230: назва | D2230: закуп | F2230: к-ть | G2230: цiна | H2230: кф | I2230: продж | J2230: дохiд | K2230: % | L2230: з-та
A2231: 1 | B2231: H6101/41 | C2231: Берцы FIELD CUIR WATERPROOF GK ||BU-FCW-LE-01 | D2231: 63.90 | E2231: usd | F2231: 1 | G2231: 1911.00 | H2231: 1.50 | I2231: 1337.70 | J2231: 59.70 | K2231: 5 | L2231: =RC[-3]/100*RC[-1] -> 1.50
A2232: 2 | B2232: H6101/42 | C2232: Берцы FIELD CUIR WATERPROOF GK ||BU-FCW-LE-01 | D2232: 63.90 | E2232: usd | F2232: 1 | G2232: 1911.00 | H2232: 1.50 | I2232: 1337.70 | J2232: 59.70 | K2232: 5 | L2232: =RC[-3]/100*RC[-1] -> 1.50
A2233: 3 | B2233: H6101/43 | C2233: Берцы FIELD CUIR WATERPROOF GK ||BU-FCW-LE-01 | D2233: 63.90 | E2233: usd | F2233: 1 | G2233: 1911.00 | H2233: 1.50 | I2233: 1337.70 | J2233: 59.70 | K2233: 5 | L2233: =RC[-3]/100*RC[-1] -> 1.50
A2234: 4 | B2234: H29231/L | C2234: Куртка SOFT SHELL флектарн ||BL-SS1-NL-23 | D2234: 32.95 | E2234: usd | F2234: 1 | G2234: 986.00 | H2234: 1.50 | I2234: 690.20 | J2234: 31.20 | K2234: 5 | L2234: =RC[-3]/100*RC[-1] -> 1.50
A2235: 5 | B2235: H29231/M | C2235: Куртка SOFT SHELL флектарн ||BL-SS1-NL-23 | D2235: 32.95 | E2235: usd | F2235: 1 | G2235: 986.00 | H2235: 1.50 | I2235: 690.20 | J2235: 31.20 | K2235: 5 | L2235: =RC[-3]/100*RC[-1] -> 1.50
A2236: 6 | B2236: _HTK21ATF | C2236: Набор FENIX TK21 + Акум 2х Avant + Зарядка TF002 | D2236: 75.00 | E2236: usd | F2236: 1 | G2236: 1427.00 | H2236: 0.95 | I2236: 998.90 | J2236: -501.10 | K2236: 5 | L2236: =RC[-3]/100*RC[-1] -> 0.95
A2237: 7 | B2237: _LD41U2 | C2237: Фонарь FENIX LD41 U2 | D2237: 50.96 | E2237: usd | F2237: 1 | G2237: 1084.00 | H2237: 1.06 | I2237: 758.80 | J2237: -260.40 | K2237: 5 | L2237: =RC[-3]/100*RC[-1] -> 1.06
A2238: 8 | B2238: H2923/L | C2238: Штани SOFT SHELL флектарн ||SP-SS1-NL-23 | D2238: 32.95 | E2238: usd | F2238: 1 | G2238: 986.00 | H2238: 1.50 | I2238: 690.20 | J2238: 31.20 | K2238: 5 | L2238: =RC[-3]/100*RC[-1] -> 1.50
A2239: 9 | B2239: H2923/L | C2239: Штани SOFT SHELL флектарн ||SP-SS1-NL-23 | D2239: 32.95 | E2239: usd | F2239: 1 | G2239: 986.00 | H2239: 1.50 | I2239: 690.20 | J2239: 31.20 | K2239: 5 | L2239: =RC[-3]/100*RC[-1] -> 1.50
A2240: 10 | B2240: H2923/M | C2240: Штани SOFT SHELL флектарн ||SP-SS1-NL-23 | D2240: 32.95 | E2240: usd | F2240: 1 | G2240: 986.00 | H2240: 1.50 | I2240: 690.20 | J2240: 31.20 | K2240: 5 | L2240: =RC[-3]/100*RC[-1] -> 1.50
A2241: 11 | B2241: H2923/XL | C2241: Штани SOFT SHELL флектарн ||SP-SS1-NL-23 | D2241: 32.95 | E2241: usd | F2241: 1 | G2241: 986.00 | H2241: 1.50 | I2241: 690.20 | J2241: 31.20 | K2241: 5 | L2241: =RC[-3]/100*RC[-1] -> 1.50 | M2241: =SUM(R[-11]C[-1]:RC[-1]) -> 
A2243: #8417 (2014-09-12) Львів Назар Максимович - Відправлено-Продано
A2244: N | B2244: арт | C2244: назва | D2244: закуп | F2244: к-ть | G2244: цiна | H2244: кф | I2244: продж | J2244: дохiд | K2244: % | L2244: з-та
A2245: 1 | B2245: H12101/M | C2245: ECWCS куртка TRILAMINAT ACU ||KU-EC2-NL-10 | D2245: 43.99 | E2245: usd | F2245: 4 | G2245: 1315.00 | H2245: 1.49 | I2245: 3682.00 | J2245: 162.80 | K2245: 5 | L2245: =RC[-3]/100*RC[-1] -> 1.49
A2246: 2 | B2246: H12101/L | C2246: ECWCS куртка TRILAMINAT ACU ||KU-EC2-NL-10 | D2246: 43.99 | E2246: usd | F2246: 1 | G2246: 1315.00 | H2246: 1.49 | I2246: 920.50 | J2246: 40.70 | K2246: 5 | L2246: =RC[-3]/100*RC[-1] -> 1.49
A2247: 3 | B2247: H12101/XL | C2247: ECWCS куртка TRILAMINAT ACU ||KU-EC2-NL-10 | D2247: 43.99 | E2247: usd | F2247: 3 | G2247: 1315.00 | H2247: 1.49 | I2247: 2761.50 | J2247: 122.10 | K2247: 5 | L2247: =RC[-3]/100*RC[-1] -> 1.49
A2248: 4 | B2248: H1210/M | C2248: ECWCS штаны TRILAMINAT ACU ||SP-EC2-NL-10 | D2248: 35.80 | E2248: usd | F2248: 4 | G2248: 1071.00 | H2248: 1.50 | I2248: 2998.80 | J2248: 134.80 | K2248: 5 | L2248: =RC[-3]/100*RC[-1] -> 1.50
A2249: 5 | B2249: H1210/L | C2249: ECWCS штаны TRILAMINAT ACU ||SP-EC2-NL-10 | D2249: 35.80 | E2249: usd | F2249: 1 | G2249: 1071.00 | H2249: 1.50 | I2249: 749.70 | J2249: 33.70 | K2249: 5 | L2249: =RC[-3]/100*RC[-1] -> 1.50
A2250: 6 | B2250: H1210/XL | C2250: ECWCS штаны TRILAMINAT ACU ||SP-EC2-NL-10 | D2250: 35.80 | E2250: usd | F2250: 2 | G2250: 1071.00 | H2250: 1.50 | I2250: 1499.40 | J2250: 67.40 | K2250: 5 | L2250: =RC[-3]/100*RC[-1] -> 1.50
A2251: 7 | B2251: H5940/XLL | C2251: CPU штаны A-TACS AU (PolyCotton) ||SP-CPU-PR-40 | D2251: 32.12 | E2251: usd | F2251: 1 | G2251: 940.00 | H2251: 1.46 | I2251: 658.00 | J2251: 15.60 | K2251: 5 | L2251: =RC[-3]/100*RC[-1] -> 1.46
A2252: 8 | B2252: H59401/LR | C2252: CPU китель A-TACS AU (PolyCotton) ||BL-CPU-PR-40 | D2252: 32.12 | E2252: usd | F2252: 1 | G2252: 940.00 | H2252: 1.46 | I2252: 658.00 | J2252: 15.60 | K2252: 5 | L2252: =RC[-3]/100*RC[-1] -> 1.46
A2253: 9 | B2253: H4304/MR | C2253: US SFU штаны польский вудлэнд (PolyCotton) ||SP-SFU-PR-04 | D2253: 14.49 | E2253: usd | F2253: 1 | G2253: 433.00 | H2253: 1.49 | I2253: 303.10 | J2253: 13.30 | K2253: 5 | L2253: =RC[-3]/100*RC[-1] -> 1.49
A2254: 10 | B2254: H43041/MR | C2254: US SFU китель польский вудлэнд (PolyCotton) ||BL-SFU-PR-04 | D2254: 14.49 | E2254: usd | F2254: 1 | G2254: 433.00 | H2254: 1.49 | I2254: 303.10 | J2254: 13.30 | K2254: 5 | L2254: =RC[-3]/100*RC[-1] -> 1.49 | M2254: =SUM(R[-10]C[-1]:RC[-1]) -> 
A2256: #8423 (2014-09-12) Львів Назар Максимович - Відправлено-Продано
A2257: N | B2257: арт | C2257: назва | D2257: закуп | F2257: к-ть | G2257: цiна | H2257: кф | I2257: продж | J2257: дохiд | K2257: % | L2257: з-та
A2258: 1 | B2258: M800332/43 | C2258: Берцы MAGNUM Precision Ultra Lite CT WPI Wide | D2258: 53.25 | E2258: usd | F2258: 1 | G2258: 1227.00 | H2258: 1.15 | I2258: 858.90 | J2258: -206.10 | K2258: 5 | L2258: =RC[-3]/100*RC[-1] -> 1.15
A2259: 2 | B2259: _10444/M | C2259: Куртка МА-1 олива ||10401001/903 | D2259: 21.50 | E2259: euro | F2259: 1 | G2259: 672.00 | H2259: 1.25 | I2259: 470.40 | J2259: -67.10 | K2259: 5 | L2259: =RC[-3]/100*RC[-1] -> 1.25
A2260: 3 | B2260: H65031/XL | C2260: Куртка М65 с отстегивающейся курткой вудлэнд (NYCO) ||KU-M65-NY-03 | D2260: 37.22 | E2260: usd | F2260: 2 | G2260: 1148.00 | H2260: 1.54 | I2260: 1607.20 | J2260: 118.40 | K2260: 5 | L2260: =RC[-3]/100*RC[-1] -> 1.54
A2261: 4 | B2261: H4199/LR | C2261: US SFU штаны укр.-цифра (PolyCotton) ||SP-SFU-PR-99 | D2261: 15.44 | E2261: usd | F2261: 1 | G2261: 462.00 | H2261: 1.50 | I2261: 323.40 | J2261: 14.60 | K2261: 5 | L2261: =RC[-3]/100*RC[-1] -> 1.50
A2262: 5 | B2262: M800332/41 | C2262: Берцы MAGNUM Precision Ultra Lite CT WPI Wide | D2262: 53.25 | E2262: usd | F2262: 1 | G2262: 1227.00 | H2262: 1.15 | I2262: 858.90 | J2262: -206.10 | K2262: 5 | L2262: =RC[-3]/100*RC[-1] -> 1.15
A2263: 6 | B2263: M800332/42 | C2263: Берцы MAGNUM Precision Ultra Lite CT WPI Wide | D2263: 53.25 | E2263: usd | F2263: 1 | G2263: 1227.00 | H2263: 1.15 | I2263: 858.90 | J2263: -206.10 | K2263: 5 | L2263: =RC[-3]/100*RC[-1] -> 1.15 | M2263: =SUM(R[-6]C[-1]:RC[-1]) -> 
A2265: #8430 (2014-09-12) Львів Назар Максимович - Відправлено-Продано
A2266: N | B2266: арт | C2266: назва | D2266: закуп | F2266: к-ть | G2266: цiна | H2266: кф | I2266: продж | J2266: дохiд | K2266: % | L2266: з-та
A2267: 1 | B2267: AC-SCT-OD/L | C2267: Перчатки тактические Armored Claw kevlar, nomex олива | D2267: 150.00 | E2267: zl | F2267: 4 | G2267: 300.00 | H2267: 0.40 | I2267: 900.00 | J2267: -2100.00 | K2267: 5 | L2267: =RC[-3]/100*RC[-1] -> 0.40
A2268: 2 | B2268: AC-SCT-OD/XL | C2268: Перчатки тактические Armored Claw kevlar, nomex олива | D2268: 150.00 | E2268: zl | F2268: 2 | G2268: 300.00 | H2268: 0.40 | I2268: 450.00 | J2268: -1050.00 | K2268: 5 | L2268: =RC[-3]/100*RC[-1] -> 0.40
A2269: 3 | B2269: AC-SCT-BLK/L | C2269: Перчатки тактические Armored Claw kevlar, nomex чёрные | D2269: 150.00 | E2269: zl | F2269: 2 | G2269: 300.00 | H2269: 0.40 | I2269: 450.00 | J2269: -1050.00 | K2269: 5 | L2269: =RC[-3]/100*RC[-1] -> 0.40
A2270: 4 | B2270: AC-SCT-BLK/M | C2270: Перчатки тактические Armored Claw kevlar, nomex чёрные | D2270: 150.00 | E2270: zl | F2270: 2 | G2270: 300.00 | H2270: 0.40 | I2270: 450.00 | J2270: -1050.00 | K2270: 5 | L2270: =RC[-3]/100*RC[-1] -> 0.40 | M2270: =SUM(R[-4]C[-1]:RC[-1]) -> 
A2272: #8449 (2014-09-13) Львів Назар Максимович - Відправлено-Продано
A2273: N | B2273: арт | C2273: назва | D2273: закуп | F2273: к-ть | G2273: цiна | H2273: кф | I2273: продж | J2273: дохiд | K2273: % | L2273: з-та
A2274: 1 | B2274: H47101/MR | C2274: US ACU китель ACU (PolyCotton) ||BL-ACU-PR-10 | D2274: 17.43 | E2274: usd | F2274: 1 | G2274: 521.00 | H2274: 1.49 | I2274: 364.70 | J2274: 16.10 | K2274: 5 | L2274: =RC[-3]/100*RC[-1] -> 1.49
A2275: 2 | B2275: K12021-B | C2275: Рюкзак 3-Day Assault Backpack 26л чёрный ||M51612021-BK | D2275: 23.43 | E2275: usd | F2275: 1 | G2275: 701.00 | H2275: 1.50 | I2275: 490.70 | J2275: 22.10 | K2275: 5 | L2275: =RC[-3]/100*RC[-1] -> 1.50 | M2275: =SUM(R[-2]C[-1]:RC[-1]) -> 
A2277: #8511 (2014-09-15) Львів Назар Максимович - Відправлено-Продано
A2278: N | B2278: арт | C2278: назва | D2278: закуп | F2278: к-ть | G2278: цiна | H2278: кф | I2278: продж | J2278: дохiд | K2278: % | L2278: з-та
A2279: 1 | B2279: H41991/MR | C2279: US SFU китель укр.-цифра (PolyCotton) ||BL-SFU-PR-99 | D2279: 15.44 | E2279: usd | F2279: 1 | G2279: 462.00 | H2279: 1.50 | I2279: 323.40 | J2279: 14.60 | K2279: 5 | L2279: =RC[-3]/100*RC[-1] -> 1.50
A2280: 2 | B2280: H4199/MR | C2280: US SFU штаны укр.-цифра (PolyCotton) ||SP-SFU-PR-99 | D2280: 15.44 | E2280: usd | F2280: 1 | G2280: 462.00 | H2280: 1.50 | I2280: 323.40 | J2280: 14.60 | K2280: 5 | L2280: =RC[-3]/100*RC[-1] -> 1.50
A2281: 3 | B2281: H4199/LR | C2281: US SFU штаны укр.-цифра (PolyCotton) ||SP-SFU-PR-99 | D2281: 15.44 | E2281: usd | F2281: 1 | G2281: 462.00 | H2281: 1.50 | I2281: 323.40 | J2281: 14.60 | K2281: 5 | L2281: =RC[-3]/100*RC[-1] -> 1.50
A2282: 4 | B2282: H41991/XLR | C2282: US SFU китель укр.-цифра (PolyCotton) ||BL-SFU-PR-99 | D2282: 15.44 | E2282: usd | F2282: 10 | G2282: 462.00 | H2282: 1.50 | I2282: 3234.00 | J2282: 146.00 | K2282: 5 | L2282: =RC[-3]/100*RC[-1] -> 1.50
A2283: 5 | B2283: H4199/LR | C2283: US SFU штаны укр.-цифра (PolyCotton) ||SP-SFU-PR-99 | D2283: 15.44 | E2283: usd | F2283: 10 | G2283: 462.00 | H2283: 1.50 | I2283: 3234.00 | J2283: 146.00 | K2283: 5 | L2283: =RC[-3]/100*RC[-1] -> 1.50
A2284: 6 | B2284: H6101/42 | C2284: Берцы FIELD CUIR WATERPROOF GK ||BU-FCW-LE-01 | D2284: 63.90 | E2284: usd | F2284: 2 | G2284: 1911.00 | H2284: 1.50 | I2284: 2675.40 | J2284: 119.40 | K2284: 5 | L2284: =RC[-3]/100*RC[-1] -> 1.50
A2285: 7 | B2285: H6101/43 | C2285: Берцы FIELD CUIR WATERPROOF GK ||BU-FCW-LE-01 | D2285: 63.90 | E2285: usd | F2285: 1 | G2285: 1911.00 | H2285: 1.50 | I2285: 1337.70 | J2285: 59.70 | K2285: 5 | L2285: =RC[-3]/100*RC[-1] -> 1.50
A2286: 8 | B2286: M800332/42 | C2286: Берцы MAGNUM Precision Ultra Lite CT WPI Wide | D2286: 53.25 | E2286: usd | F2286: 2 | G2286: 1227.00 | H2286: 1.15 | I2286: 1717.80 | J2286: -412.20 | K2286: 5 | L2286: =RC[-3]/100*RC[-1] -> 1.15
A2287: 9 | B2287: M800332/43 | C2287: Берцы MAGNUM Precision Ultra Lite CT WPI Wide | D2287: 53.25 | E2287: usd | F2287: 2 | G2287: 1227.00 | H2287: 1.15 | I2287: 1717.80 | J2287: -412.20 | K2287: 5 | L2287: =RC[-3]/100*RC[-1] -> 1.15
A2288: 10 | B2288: H41991/LR | C2288: US SFU китель укр.-цифра (PolyCotton) ||BL-SFU-PR-99 | D2288: 15.44 | E2288: usd | F2288: 3 | G2288: 462.00 | H2288: 1.50 | I2288: 970.20 | J2288: 43.80 | K2288: 5 | L2288: =RC[-3]/100*RC[-1] -> 1.50 | M2288: =SUM(R[-10]C[-1]:RC[-1]) -> 
A2290: #8536 (2014-09-15) Львів Назар Максимович - Відправлено-Продано
A2291: N | B2291: арт | C2291: назва | D2291: закуп | F2291: к-ть | G2291: цiна | H2291: кф | I2291: продж | J2291: дохiд | K2291: % | L2291: з-та
A2292: 1 | B2292: H41991/MR | C2292: US SFU китель укр.-цифра (PolyCotton) ||BL-SFU-PR-99 | D2292: 15.44 | E2292: usd | F2292: 10 | G2292: 462.00 | H2292: 1.50 | I2292: 3234.00 | J2292: 146.00 | K2292: 5 | L2292: =RC[-3]/100*RC[-1] -> 1.50
A2293: 2 | B2293: H4199/MR | C2293: US SFU штаны укр.-цифра (PolyCotton) ||SP-SFU-PR-99 | D2293: 15.44 | E2293: usd | F2293: 10 | G2293: 462.00 | H2293: 1.50 | I2293: 3234.00 | J2293: 146.00 | K2293: 5 | L2293: =RC[-3]/100*RC[-1] -> 1.50 | M2293: =SUM(R[-2]C[-1]:RC[-1]) -> 
A2295: #8571 (2014-09-16) Львів Назар Максимович - Відправлено-Продано
A2296: N | B2296: арт | C2296: назва | D2296: закуп | F2296: к-ть | G2296: цiна | H2296: кф | I2296: продж | J2296: дохiд | K2296: % | L2296: з-та
A2297: 1 | B2297: H0815 | C2297: US жетон стальной с резинкой||NS-NS1-SS-15 | D2297: 1.30 | E2297: usd | F2297: 10 | G2297: 38.00 | H2297: 1.46 | I2297: 266.00 | J2297: 6.00 | K2297: 5 | L2297: =RC[-3]/100*RC[-1] -> 1.46
A2298: 2 | B2298: H12101/L | C2298: ECWCS куртка TRILAMINAT ACU ||KU-EC2-NL-10 | D2298: 43.99 | E2298: usd | F2298: 1 | G2298: 1315.00 | H2298: 1.49 | I2298: 920.50 | J2298: 40.70 | K2298: 5 | L2298: =RC[-3]/100*RC[-1] -> 1.49
A2299: 3 | B2299: H1210/L | C2299: ECWCS штаны TRILAMINAT ACU ||SP-EC2-NL-10 | D2299: 35.80 | E2299: usd | F2299: 1 | G2299: 1071.00 | H2299: 1.50 | I2299: 749.70 | J2299: 33.70 | K2299: 5 | L2299: =RC[-3]/100*RC[-1] -> 1.50
A2300: 4 | B2300: _1400020 | C2300: Каремат туристический 10мм | D2300: 4.15 | E2300: Инт | F2300: 20 | G2300: 95.00 | H2300: 1.14 | I2300: 1330.00 | J2300: -330.00 | K2300: 5 | L2300: =RC[-3]/100*RC[-1] -> 1.14
A2301: 5 | B2301: M17079-BK | C2301: Перчатки без палые чорные [Производитель: ACM] ||M51617079-BK | D2301: 4.17 | E2301: usd | F2301: 10 | G2301: 195.00 | H2301: 2.34 | I2301: 1365.00 | J2301: 531.00 | K2301: 5 | L2301: =RC[-3]/100*RC[-1] -> 2.34
A2302: 6 | B2302: H7933 | C2302: Шапка флисовая MP Camo ||CZ-DOK-FL-33 | D2302: 4.00 | E2302: usd | F2302: 3 | G2302: 115.00 | H2302: 1.44 | I2302: 241.50 | J2302: 1.50 | K2302: 5 | L2302: =RC[-3]/100*RC[-1] -> 1.44
A2303: 7 | B2303: H7914 | C2303: Шапка флисовая мультикам ||CZ-DOK-FL-14 | D2303: 4.00 | E2303: usd | F2303: 3 | G2303: 115.00 | H2303: 1.44 | I2303: 241.50 | J2303: 1.50 | K2303: 5 | L2303: =RC[-3]/100*RC[-1] -> 1.44
A2304: 8 | B2304: _1400021 | C2304: Каремат-сидушка туристический 8мм олива | D2304: 1.00 | E2304: Инт | F2304: 10 | G2304: 40.00 | H2304: 2.00 | I2304: 280.00 | J2304: 80.00 | K2304: 5 | L2304: =RC[-3]/100*RC[-1] -> 2.00
A2305: 9 | B2305: H59401/MR | C2305: CPU китель A-TACS AU (PolyCotton) ||BL-CPU-PR-40 | D2305: 32.12 | E2305: usd | F2305: 1 | G2305: 940.00 | H2305: 1.46 | I2305: 658.00 | J2305: 15.60 | K2305: 5 | L2305: =RC[-3]/100*RC[-1] -> 1.46
A2306: 10 | B2306: H5940/ML | C2306: CPU штаны A-TACS AU (PolyCotton) ||SP-CPU-PR-40 | D2306: 32.12 | E2306: usd | F2306: 1 | G2306: 940.00 | H2306: 1.46 | I2306: 658.00 | J2306: 15.60 | K2306: 5 | L2306: =RC[-3]/100*RC[-1] -> 1.46 | M2306: =SUM(R[-10]C[-1]:RC[-1]) -> 
A2308: #8577 (2014-09-16) Львів Назар Максимович - Відправлено-Продано
A2309: N | B2309: арт | C2309: назва | D2309: закуп | F2309: к-ть | G2309: цiна | H2309: кф | I2309: продж | J2309: дохiд | K2309: % | L2309: з-та
A2310: 1 | B2310: _M860-1 | C2310: Нож MORAKNIV® Companion MG Carbon ||NZ-860-ST-02 | D2310: 6.06 | E2310: usd | F2310: 15 | G2310: 122.00 | H2310: 1.01 | I2310: 1464.00 | J2310: -353.73 | K2310: 5 | L2310: =RC[-3]/100*RC[-1] -> 1.01 | M2310: =SUM(R[-1]C[-1]:RC[-1]) -> 
A2312: #8658 (2014-09-18) Львів Назар Максимович - Відправлено-Продано
A2313: N | B2313: арт | C2313: назва | D2313: закуп | F2313: к-ть | G2313: цiна | H2313: кф | I2313: продж | J2313: дохiд | K2313: % | L2313: з-та
A2314: 1 | B2314: _3378-1/45 | C2314: Берцы STAR FORCE THUNDERSTORM HI чёрные | D2314: 33.53 | E2314: euro | F2314: 4 | G2314: 947.00 | H2314: 1.13 | I2314: 2651.60 | J2314: -701.40 | K2314: 5 | L2314: =RC[-3]/100*RC[-1] -> 1.13
A2315: 2 | B2315: _3378-1/46 | C2315: Берцы STAR FORCE THUNDERSTORM HI чёрные | D2315: 33.53 | E2315: euro | F2315: 6 | G2315: 947.00 | H2315: 1.13 | I2315: 3977.40 | J2315: -1052.10 | K2315: 5 | L2315: =RC[-3]/100*RC[-1] -> 1.13 | M2315: =SUM(R[-2]C[-1]:RC[-1]) -> 
A2317: #8684 (2014-09-19) Львів Назар Максимович - Відправлено-Продано
A2318: N | B2318: арт | C2318: назва | D2318: закуп | F2318: к-ть | G2318: цiна | H2318: кф | I2318: продж | J2318: дохiд | K2318: % | L2318: з-та
A2319: 1 | B2319: H4314/SL | C2319: US SFU штаны мультикам (NYCO R/S) ||SP-SFU-PR-14 | D2319: 16.64 | E2319: usd | F2319: 1 | G2319: 582.00 | H2319: 1.75 | I2319: 407.40 | J2319: 74.60 | K2319: 5 | L2319: =RC[-3]/100*RC[-1] -> 1.75
A2320: 2 | B2320: H4199/LL | C2320: US SFU штаны укр.-цифра (PolyCotton) ||SP-SFU-PR-99 | D2320: 15.44 | E2320: usd | F2320: 4 | G2320: 533.00 | H2320: 1.73 | I2320: 1492.40 | J2320: 257.20 | K2320: 5 | L2320: =RC[-3]/100*RC[-1] -> 1.73
A2321: 3 | B2321: H4304/LR | C2321: US SFU штаны польский вудлэнд (PolyCotton) ||SP-SFU-PR-04 | D2321: 14.49 | E2321: usd | F2321: 1 | G2321: 500.00 | H2321: 1.73 | I2321: 350.00 | J2321: 60.20 | K2321: 5 | L2321: =RC[-3]/100*RC[-1] -> 1.73
A2322: 4 | B2322: H43041/LR | C2322: US SFU китель польский вудлэнд (PolyCotton) ||BL-SFU-PR-04 | D2322: 14.49 | E2322: usd | F2322: 1 | G2322: 500.00 | H2322: 1.73 | I2322: 350.00 | J2322: 60.20 | K2322: 5 | L2322: =RC[-3]/100*RC[-1] -> 1.73 | M2322: =SUM(R[-4]C[-1]:RC[-1]) -> 
A2324: #8687 (2014-09-19) Львів Назар Максимович - Відправлено-Продано
A2325: N | B2325: арт | C2325: назва | D2325: закуп | F2325: к-ть | G2325: цiна | H2325: кф | I2325: продж | J2325: дохiд | K2325: % | L2325: з-та
A2326: 1 | B2326: H5940/LL | C2326: CPU штаны A-TACS AU (PolyCotton) ||SP-CPU-PR-40 | D2326: 32.12 | E2326: usd | F2326: 1 | G2326: 1085.00 | H2326: 1.69 | I2326: 759.50 | J2326: 117.10 | K2326: 5 | L2326: =RC[-3]/100*RC[-1] -> 1.69
A2327: 2 | B2327: H59401/LR | C2327: CPU китель A-TACS AU (PolyCotton) ||BL-CPU-PR-40 | D2327: 32.12 | E2327: usd | F2327: 1 | G2327: 1085.00 | H2327: 1.69 | I2327: 759.50 | J2327: 117.10 | K2327: 5 | L2327: =RC[-3]/100*RC[-1] -> 1.69 | M2327: =SUM(R[-2]C[-1]:RC[-1]) -> 
A2329: #8705 (2014-09-19) Львів Назар Максимович - Прихід товару
A2330: N | B2330: арт | C2330: назва | D2330: закуп | F2330: к-ть | G2330: цiна | H2330: кф | I2330: продж | J2330: дохiд | K2330: % | L2330: з-та
A2331: 1 | B2331: _1.1606 | C2331: Бинокль TASCO 22x36 ||B-22 | D2331: 16.10 | E2331: Инт | F2331: 1 | G2331: 210.00 | H2331: 0.65 | I2331: 210.00 | J2331: -112.00 | K2331: 5 | L2331: =RC[-3]/100*RC[-1] -> 0.65
A2332: 2 | B2332: _1.1606 | C2332: Бинокль TASCO 22x36 ||B-22 | D2332: 16.10 | E2332: Инт | F2332: 9 | G2332: 210.00 | H2332: 0.65 | I2332: 1890.00 | J2332: -1008.00 | K2332: 5 | L2332: =RC[-3]/100*RC[-1] -> 0.65
A2333: 3 | B2333: 833774/L | C2333: Костюм дождевик Adventure | D2333: 275.00 | E2333: грн | F2333: 100 | G2333: 275.00 | H2333: 1.00 | I2333: 27500.00 | J2333: 0.00 | K2333: 5 | L2333: =RC[-3]/100*RC[-1] -> 1.00
A2334: 4 | B2334: 833774/M | C2334: Костюм дождевик Adventure | D2334: 275.00 | E2334: грн | F2334: 10 | G2334: 275.00 | H2334: 1.00 | I2334: 2750.00 | J2334: 0.00 | K2334: 5 | L2334: =RC[-3]/100*RC[-1] -> 1.00
A2335: 5 | B2335: _455500 | C2335: Набор для чистки оружия 4.5/5.5 мм | D2335: 7.24 | E2335: Инт | F2335: 50 | G2335: 105.00 | H2335: 0.72 | I2335: 5250.00 | J2335: -1991.38 | K2335: 5 | L2335: =RC[-3]/100*RC[-1] -> 0.72
A2336: 6 | B2336: _661-0011/XL | C2336: Перчатки тактические олива OAKLEY | D2336: 298.00 | E2336: грн | F2336: 1 | G2336: 298.00 | H2336: 1.00 | I2336: 298.00 | J2336: 0.00 | K2336: 5 | L2336: =RC[-3]/100*RC[-1] -> 1.00
A2337: 7 | B2337: _661-0011/XL | C2337: Перчатки тактические олива OAKLEY | D2337: 298.00 | E2337: грн | F2337: 1 | G2337: 298.00 | H2337: 1.00 | I2337: 298.00 | J2337: 0.00 | K2337: 5 | L2337: =RC[-3]/100*RC[-1] -> 1.00
A2338: 8 | B2338: 833675 | C2338: Пончо Adventure | D2338: 175.00 | E2338: грн | F2338: 1 | G2338: 175.00 | H2338: 1.00 | I2338: 175.00 | J2338: 0.00 | K2338: 5 | L2338: =RC[-3]/100*RC[-1] -> 1.00
A2339: 9 | B2339: 833675 | C2339: Пончо Adventure | D2339: 175.00 | E2339: грн | F2339: 4 | G2339: 175.00 | H2339: 1.00 | I2339: 700.00 | J2339: 0.00 | K2339: 5 | L2339: =RC[-3]/100*RC[-1] -> 1.00 | M2339: =SUM(R[-9]C[-1]:RC[-1]) -> 
A2341: #8752 (2014-09-22) Львів Назар Максимович - Прихід товару
A2342: N | B2342: арт | C2342: назва | D2342: закуп | F2342: к-ть | G2342: цiна | H2342: кф | I2342: продж | J2342: дохiд | K2342: % | L2342: з-та
A2343: 1 | B2343: _N232323 | C2343: Мачете-кукри НОКС | D2343: 33.60 | E2343: Инт | F2343: 3 | G2343: 420.00 | H2343: 0.63 | I2343: 1260.00 | J2343: -756.00 | K2343: 5 | L2343: =RC[-3]/100*RC[-1] -> 0.63
A2344: 2 | B2344: _19-0700 | C2344: Набор для чистки оружия в кейсе | D2344: 21.24 | E2344: Инт | F2344: 1 | G2344: 298.00 | H2344: 0.70 | I2344: 298.00 | J2344: -126.80 | K2344: 5 | L2344: =RC[-3]/100*RC[-1] -> 0.70
A2345: 3 | B2345: _N129-34 | C2345: Нож Витязь Бурундук | D2345: 18.24 | E2345: Инт | F2345: 5 | G2345: 228.00 | H2345: 0.63 | I2345: 1140.00 | J2345: -684.00 | K2345: 5 | L2345: =RC[-3]/100*RC[-1] -> 0.63
A2346: 4 | B2346: _N98-341 | C2346: Нож Витязь Диверсант | D2346: 23.36 | E2346: Инт | F2346: 2 | G2346: 292.00 | H2346: 0.63 | I2346: 584.00 | J2346: -350.40 | K2346: 5 | L2346: =RC[-3]/100*RC[-1] -> 0.63
A2347: 5 | B2347: _N750750 | C2347: Нож VIKING NORWEY | D2347: 25.60 | E2347: Инт | F2347: 1 | G2347: 320.00 | H2347: 0.63 | I2347: 320.00 | J2347: -192.00 | K2347: 5 | L2347: =RC[-3]/100*RC[-1] -> 0.63
A2348: 6 | B2348: _N750750 | C2348: Нож VIKING NORWEY | D2348: 25.60 | E2348: Инт | F2348: 1 | G2348: 320.00 | H2348: 0.63 | I2348: 320.00 | J2348: -192.00 | K2348: 5 | L2348: =RC[-3]/100*RC[-1] -> 0.63
A2349: 7 | B2349: _N075075 | C2349: Нож VIKING NORWEY Милитари | D2349: 12.40 | E2349: Инт | F2349: 5 | G2349: 155.00 | H2349: 0.63 | I2349: 775.00 | J2349: -465.00 | K2349: 5 | L2349: =RC[-3]/100*RC[-1] -> 0.63
A2350: 8 | B2350: _N3558-3 | C2350: Нож VIKING NORWEY нескладной | D2350: 18.24 | E2350: Инт | F2350: 2 | G2350: 228.00 | H2350: 0.63 | I2350: 456.00 | J2350: -273.60 | K2350: 5 | L2350: =RC[-3]/100*RC[-1] -> 0.63
A2351: 9 | B2351: _N085-71 | C2351: Нож VIKING NORWEY нескладной чёрный | D2351: 29.20 | E2351: Инт | F2351: 2 | G2351: 365.00 | H2351: 0.63 | I2351: 730.00 | J2351: -438.00 | K2351: 5 | L2351: =RC[-3]/100*RC[-1] -> 0.63
A2352: 10 | B2352: _N00014 | C2352: Нож НОКС Боец | D2352: 26.24 | E2352: Инт | F2352: 2 | G2352: 328.00 | H2352: 0.63 | I2352: 656.00 | J2352: -393.60 | K2352: 5 | L2352: =RC[-3]/100*RC[-1] -> 0.63
A2353: 11 | B2353: _N20-20-20 | C2353: Нож НОКС Гюрза | D2353: 35.20 | E2353: Инт | F2353: 2 | G2353: 440.00 | H2353: 0.63 | I2353: 880.00 | J2353: -528.00 | K2353: 5 | L2353: =RC[-3]/100*RC[-1] -> 0.63
A2354: 12 | B2354: _N207-34 | C2354: Нож НОКС Сайгак | D2354: 12.16 | E2354: Инт | F2354: 5 | G2354: 152.00 | H2354: 0.63 | I2354: 760.00 | J2354: -456.00 | K2354: 5 | L2354: =RC[-3]/100*RC[-1] -> 0.63 | M2354: =SUM(R[-12]C[-1]:RC[-1]) -> 
A2356: #8779 (2014-09-23) Львів Назар Максимович - Відправлено-Продано
A2357: N | B2357: арт | C2357: назва | D2357: закуп | F2357: к-ть | G2357: цiна | H2357: кф | I2357: продж | J2357: дохiд | K2357: % | L2357: з-та
A2358: 1 | B2358: _1400021 | C2358: Каремат-сидушка туристический 8мм олива | D2358: 1.00 | E2358: Инт | F2358: 10 | G2358: 40.00 | H2358: 2.00 | I2358: 280.00 | J2358: 80.00 | K2358: 5 | L2358: =RC[-3]/100*RC[-1] -> 2.00
A2359: 2 | B2359: _14680 | C2359: Набор посуды алюминиевый (3 миски,сковорода,пальник) ||14660000 | D2359: 8.75 | E2359: euro | F2359: 1 | G2359: 273.00 | H2359: 1.25 | I2359: 191.10 | J2359: -27.65 | K2359: 5 | L2359: =RC[-3]/100*RC[-1] -> 1.25
A2360: 3 | B2360: _14680 | C2360: Набор посуды алюминиевый (3 миски,сковорода,пальник) ||14660000 | D2360: 8.75 | E2360: euro | F2360: 1 | G2360: 273.00 | H2360: 1.25 | I2360: 191.10 | J2360: -27.65 | K2360: 5 | L2360: =RC[-3]/100*RC[-1] -> 1.25
A2361: 4 | B2361: DS8838/XL | C2361: Носки водонепроницаемые Dexshell Coolvent Lite | D2361: 12.82 | E2361: usd | F2361: 1 | G2361: 312.00 | H2361: 1.22 | I2361: 218.40 | J2361: -37.99 | K2361: 5 | L2361: =RC[-3]/100*RC[-1] -> 1.22
A2362: 5 | B2362: H8602/130 | C2362: Ремень TOUGH NAVY SEAL олива ||PS-NAV-CO-01 | D2362: 4.23 | E2362: usd | F2362: 2 | G2362: 145.00 | H2362: 1.71 | I2362: 203.00 | J2362: 33.80 | K2362: 5 | L2362: =RC[-3]/100*RC[-1] -> 1.71
A2363: 6 | B2363: H8601/130 | C2363: Ремень TOUGH NAVY SEAL чёрный ||PS-NAV-CO-02 | D2363: 4.23 | E2363: usd | F2363: 3 | G2363: 145.00 | H2363: 1.71 | I2363: 304.50 | J2363: 50.70 | K2363: 5 | L2363: =RC[-3]/100*RC[-1] -> 1.71
A2364: 7 | B2364: H8913/130 | C2364: Ремень TOUGH US MARINES койот ||PS-USM-CO-13 | D2364: 3.68 | E2364: usd | F2364: 2 | G2364: 145.00 | H2364: 1.97 | I2364: 203.00 | J2364: 55.80 | K2364: 5 | L2364: =RC[-3]/100*RC[-1] -> 1.97
A2365: 8 | B2365: H7914 | C2365: Шапка флисовая мультикам ||CZ-DOK-FL-14 | D2365: 4.00 | E2365: usd | F2365: 5 | G2365: 133.00 | H2365: 1.66 | I2365: 465.50 | J2365: 65.50 | K2365: 5 | L2365: =RC[-3]/100*RC[-1] -> 1.66
A2366: 9 | B2366: H7904 | C2366: Шапка флисовая пол.вудлэнд ||CZ-DOK-FL-04 | D2366: 3.00 | E2366: usd | F2366: 5 | G2366: 114.00 | H2366: 1.90 | I2366: 399.00 | J2366: 99.00 | K2366: 5 | L2366: =RC[-3]/100*RC[-1] -> 1.90 | M2366: =SUM(R[-9]C[-1]:RC[-1]) -> 
A2368: #8786 (2014-09-23) Львів Назар Максимович - Прихід товару
A2369: N | B2369: арт | C2369: назва | D2369: закуп | F2369: к-ть | G2369: цiна | H2369: кф | I2369: продж | J2369: дохiд | K2369: % | L2369: з-та
A2370: 1 | B2370: 15813-C | C2370: Перчатки тактические MFH coyote | D2370: 507.00 | E2370: zl | F2370: 1 | G2370: 507.00 | H2370: 0.20 | I2370: 507.00 | J2370: -2028.00 | K2370: 5 | L2370: =RC[-3]/100*RC[-1] -> 0.20
A2371: 2 | B2371: 15813-O | C2371: Перчатки тактические MFH oliv | D2371: 507.00 | E2371: zl | F2371: 1 | G2371: 507.00 | H2371: 0.20 | I2371: 507.00 | J2371: -2028.00 | K2371: 5 | L2371: =RC[-3]/100*RC[-1] -> 0.20
A2372: 3 | B2372: 15813-O | C2372: Перчатки тактические MFH oliv | D2372: 507.00 | E2372: zl | F2372: 1 | G2372: 507.00 | H2372: 0.20 | I2372: 507.00 | J2372: -2028.00 | K2372: 5 | L2372: =RC[-3]/100*RC[-1] -> 0.20
A2373: 4 | B2373: 15813-H | C2373: Перчатки тактические MFH хаки | D2373: 507.00 | E2373: zl | F2373: 1 | G2373: 507.00 | H2373: 0.20 | I2373: 507.00 | J2373: -2028.00 | K2373: 5 | L2373: =RC[-3]/100*RC[-1] -> 0.20
A2374: 5 | B2374: 15813-H | C2374: Перчатки тактические MFH хаки | D2374: 507.00 | E2374: zl | F2374: 1 | G2374: 507.00 | H2374: 0.20 | I2374: 507.00 | J2374: -2028.00 | K2374: 5 | L2374: =RC[-3]/100*RC[-1] -> 0.20
A2375: 6 | B2375: _25833 | C2375: Очки MFH | D2375: 780.00 | E2375: zl | F2375: 1 | G2375: 780.00 | H2375: 0.20 | I2375: 780.00 | J2375: -3120.00 | K2375: 5 | L2375: =RC[-3]/100*RC[-1] -> 0.20 | M2375: =SUM(R[-6]C[-1]:RC[-1]) -> 
A2377: #8789 (2014-09-23) Львів Назар Максимович - Відправлено-Продано
A2378: N | B2378: арт | C2378: назва | D2378: закуп | F2378: к-ть | G2378: цiна | H2378: кф | I2378: продж | J2378: дохiд | K2378: % | L2378: з-та
A2379: 1 | B2379: X101/48 | C2379: BW пуловер (акриловый) чёрный (3 нитки) ||X10839/48 | D2379: 18.75 | E2379: Инт | F2379: 1 | G2379: 240.00 | H2379: 0.64 | I2379: 168.00 | J2379: -207.00 | K2379: 5 | L2379: =RC[-3]/100*RC[-1] -> 0.64
A2380: 2 | B2380: H59401/MR | C2380: CPU китель A-TACS AU (PolyCotton) ||BL-CPU-PR-40 | D2380: 32.12 | E2380: usd | F2380: 1 | G2380: 1085.00 | H2380: 1.69 | I2380: 759.50 | J2380: 117.10 | K2380: 5 | L2380: =RC[-3]/100*RC[-1] -> 1.69
A2381: 3 | B2381: H5940/ML | C2381: CPU штаны A-TACS AU (PolyCotton) ||SP-CPU-PR-40 | D2381: 32.12 | E2381: usd | F2381: 1 | G2381: 1085.00 | H2381: 1.69 | I2381: 759.50 | J2381: 117.10 | K2381: 5 | L2381: =RC[-3]/100*RC[-1] -> 1.69
A2382: 4 | B2382: H26041/2XL | C2382: Куртка PATRIOT флисовая польский вудлэнд 390г/м (superfine) ||BL-PAT-HF-04 | D2382: 27.00 | E2382: usd | F2382: 1 | G2382: 969.00 | H2382: 1.79 | I2382: 678.30 | J2382: 138.30 | K2382: 5 | L2382: =RC[-3]/100*RC[-1] -> 1.79
A2383: 5 | B2383: _10181/XXL | C2383: Куртка-аляска US N3B длинная олива ||10181001/906 | D2383: 34.50 | E2383: euro | F2383: 1 | G2383: 1078.00 | H2383: 1.25 | I2383: 754.60 | J2383: -107.90 | K2383: 5 | L2383: =RC[-3]/100*RC[-1] -> 1.25
A2384: 6 | B2384: _542693 | C2384: Таблетки для дезинфенкции воды Javel Aqua (10шт) | D2384: 0.76 | E2384: Инт | F2384: 1 | G2384: 20.00 | H2384: 1.32 | I2384: 14.00 | J2384: -1.20 | K2384: 5 | L2384: =RC[-3]/100*RC[-1] -> 1.32 | M2384: =SUM(R[-6]C[-1]:RC[-1]) -> 
A2386: #8810 (2014-09-23) Львів Назар Максимович - Відправлено-Продано
A2387: N | B2387: арт | C2387: назва | D2387: закуп | F2387: к-ть | G2387: цiна | H2387: кф | I2387: продж | J2387: дохiд | K2387: % | L2387: з-та
A2388: 1 | B2388: H7201 | C2388: US BDU кепка чёрная ( PolyCotton Ripstop) ||CZ-COM-NR-01 | D2388: 2.33 | E2388: usd | F2388: 5 | G2388: 83.00 | H2388: 1.78 | I2388: 290.50 | J2388: 57.50 | K2388: 5 | L2388: =RC[-3]/100*RC[-1] -> 1.78
A2389: 2 | B2389: H41991/LR | C2389: US SFU китель укр.-цифра (PolyCotton) ||BL-SFU-PR-99 | D2389: 15.44 | E2389: usd | F2389: 2 | G2389: 533.00 | H2389: 1.73 | I2389: 746.20 | J2389: 128.60 | K2389: 5 | L2389: =RC[-3]/100*RC[-1] -> 1.73 | M2389: =SUM(R[-2]C[-1]:RC[-1]) -> 
A2391: #8812 (2014-09-23) Львів Назар Максимович - Відправлено-Продано
A2392: N | B2392: арт | C2392: назва | D2392: закуп | F2392: к-ть | G2392: цiна | H2392: кф | I2392: продж | J2392: дохiд | K2392: % | L2392: з-та
A2393: 1 | B2393: H0220/11 | C2393: Носки шерстяные высокие (белые) ||SK-NOR-WA-20 | D2393: 5.27 | E2393: usd | F2393: 1 | G2393: 181.00 | H2393: 1.72 | I2393: 126.70 | J2393: 21.30 | K2393: 5 | L2393: =RC[-3]/100*RC[-1] -> 1.72
A2394: 2 | B2394: H26331/2XL | C2394: Куртка PATRIOT флисовая MP CAMO 390г/м (superfine) ||BL-PAT-HF-33 | D2394: 31.03 | E2394: usd | F2394: 1 | G2394: 1075.00 | H2394: 1.73 | I2394: 752.50 | J2394: 131.90 | K2394: 5 | L2394: =RC[-3]/100*RC[-1] -> 1.73
A2395: 3 | B2395: H43141/2XLR | C2395: US SFU китель мультикам (PolyCotton) ||BL-SFU-PR-14 | D2395: 16.64 | E2395: usd | F2395: 1 | G2395: 582.00 | H2395: 1.75 | I2395: 407.40 | J2395: 74.60 | K2395: 5 | L2395: =RC[-3]/100*RC[-1] -> 1.75
A2396: 4 | B2396: H49141/XLR | C2396: Рубашка COMBAT мультикам с налокотниками (NYCO POL) ||KO-CS2-PO-14 | D2396: 25.88 | E2396: usd | F2396: 1 | G2396: 893.00 | H2396: 1.73 | I2396: 625.10 | J2396: 107.50 | K2396: 5 | L2396: =RC[-3]/100*RC[-1] -> 1.73
A2397: 5 | B2397: H5914/XXLL | C2397: CPU штаны мультикамо (PolyCotton) ||SP-CPU-PR-14 | D2397: 21.56 | E2397: usd | F2397: 1 | G2397: 740.00 | H2397: 1.72 | I2397: 518.00 | J2397: 86.80 | K2397: 5 | L2397: =RC[-3]/100*RC[-1] -> 1.72
A2398: 6 | B2398: H7233/L-59 | C2398: PCS кепка MP CAMO ||CZ-PCS-PT-33 | D2398: 4.58 | E2398: usd | F2398: 1 | G2398: 158.00 | H2398: 1.72 | I2398: 110.60 | J2398: 19.00 | K2398: 5 | L2398: =RC[-3]/100*RC[-1] -> 1.72 | M2398: =SUM(R[-6]C[-1]:RC[-1]) -> 
A2400: #8814 (2014-09-23) Львів Назар Максимович - Відправлено-Продано
A2401: N | B2401: арт | C2401: назва | D2401: закуп | F2401: к-ть | G2401: цiна | H2401: кф | I2401: продж | J2401: дохiд | K2401: % | L2401: з-та
A2402: 1 | B2402: K11010-O | C2402: Плечеременная разгрузочная система олива || M51611010-OD | D2402: 24.23 | E2402: usd | F2402: 7 | G2402: 826.00 | H2402: 1.70 | I2402: 4047.40 | J2402: 655.20 | K2402: 5 | L2402: =RC[-3]/100*RC[-1] -> 1.70 | M2402: =SUM(R[-1]C[-1]:RC[-1]) -> 
A2404: #8877 (2014-09-24) Львів Назар Максимович - Відправлено-Продано
A2405: N | B2405: арт | C2405: назва | D2405: закуп | F2405: к-ть | G2405: цiна | H2405: кф | I2405: продж | J2405: дохiд | K2405: % | L2405: з-та
A2406: 1 | B2406: H7202 | C2406: US BDU кепка олива (NYCO R/S) ||CZ-COM-CR-02 | D2406: 2.33 | E2406: usd | F2406: 2 | G2406: 83.00 | H2406: 1.78 | I2406: 116.20 | J2406: 23.00 | K2406: 5 | L2406: =RC[-3]/100*RC[-1] -> 1.78
A2407: 2 | B2407: H7232 | C2407: US BDU кепка олива драп ( PolyCotton Ripstop) ||CZ-COM-NR-32 | D2407: 2.33 | E2407: usd | F2407: 2 | G2407: 83.00 | H2407: 1.78 | I2407: 116.20 | J2407: 23.00 | K2407: 5 | L2407: =RC[-3]/100*RC[-1] -> 1.78
A2408: 3 | B2408: H7002/XL | C2408: US GI панама с шейной защитой олива (R/S) / 7 3/4 ||KA-BON-CR-02 | D2408: 4.06 | E2408: usd | F2408: 2 | G2408: 140.00 | H2408: 1.72 | I2408: 196.00 | J2408: 33.60 | K2408: 5 | L2408: =RC[-3]/100*RC[-1] -> 1.72
A2409: 4 | B2409: H43011/XLR | C2409: US SFU китель чёрный (PolyCotton) ||BL-SFU-PR-01 | D2409: 15.03 | E2409: usd | F2409: 1 | G2409: 500.00 | H2409: 1.66 | I2409: 350.00 | J2409: 49.40 | K2409: 5 | L2409: =RC[-3]/100*RC[-1] -> 1.66
A2410: 5 | B2410: H4301/LL | C2410: US SFU штаны чёрные (PolyCotton) ||SP-SFU-PR-01 | D2410: 15.03 | E2410: usd | F2410: 1 | G2410: 500.00 | H2410: 1.66 | I2410: 350.00 | J2410: 49.40 | K2410: 5 | L2410: =RC[-3]/100*RC[-1] -> 1.66
A2411: 6 | B2411: _14906 | C2411: Горелка для сухого спирту ||14906000 | D2411: 2.50 | E2411: euro | F2411: 2 | G2411: 71.00 | H2411: 1.14 | I2411: 99.40 | J2411: -25.60 | K2411: 5 | L2411: =RC[-3]/100*RC[-1] -> 1.14
A2412: 7 | B2412: H26331/2XL | C2412: Куртка PATRIOT флисовая MP CAMO 390г/м (superfine) ||BL-PAT-HF-33 | D2412: 31.03 | E2412: usd | F2412: 1 | G2412: 1075.00 | H2412: 1.73 | I2412: 752.50 | J2412: 131.90 | K2412: 5 | L2412: =RC[-3]/100*RC[-1] -> 1.73
A2413: 8 | B2413: H26331/XL | C2413: Куртка PATRIOT флисовая MP CAMO 390г/м (superfine) ||BL-PAT-HF-33 | D2413: 31.03 | E2413: usd | F2413: 1 | G2413: 1075.00 | H2413: 1.73 | I2413: 752.50 | J2413: 131.90 | K2413: 5 | L2413: =RC[-3]/100*RC[-1] -> 1.73
A2414: 9 | B2414: _125502 | C2414: Перчатки THINSULATE акриловые без пальцев вудлэнд ||12540020 | D2414: 2.25 | E2414: euro | F2414: 10 | G2414: 65.00 | H2414: 1.16 | I2414: 455.00 | J2414: -107.50 | K2414: 5 | L2414: =RC[-3]/100*RC[-1] -> 1.16
A2415: 10 | B2415: _12550 | C2415: Перчатки THINSULATE акриловые без пальцев олива ||12540001 | D2415: 2.00 | E2415: euro | F2415: 10 | G2415: 60.00 | H2415: 1.20 | I2415: 420.00 | J2415: -80.00 | K2415: 5 | L2415: =RC[-3]/100*RC[-1] -> 1.20
A2416: 11 | B2416: AC-SCT-BLK/M | C2416: Перчатки тактические Armored Claw kevlar, nomex чёрные | D2416: 150.00 | E2416: zl | F2416: 1 | G2416: 300.00 | H2416: 0.40 | I2416: 210.00 | J2416: -540.00 | K2416: 5 | L2416: =RC[-3]/100*RC[-1] -> 0.40
A2417: 12 | B2417: H49141/2XLR | C2417: Рубашка COMBAT мультикам с налокотниками (NYCO POL) ||KO-CS2-PO-14 | D2417: 25.88 | E2417: usd | F2417: 1 | G2417: 893.00 | H2417: 1.73 | I2417: 625.10 | J2417: 107.50 | K2417: 5 | L2417: =RC[-3]/100*RC[-1] -> 1.73 | M2417: =SUM(R[-12]C[-1]:RC[-1]) -> 
A2419: #8918 (2014-09-25) Львів Назар Максимович - Відправлено-Продано
A2420: N | B2420: арт | C2420: назва | D2420: закуп | F2420: к-ть | G2420: цiна | H2420: кф | I2420: продж | J2420: дохiд | K2420: % | L2420: з-та
A2421: 1 | B2421: _10476/XL | C2421: Куртка-аляска US N2B короткая синя ||10410003/905 | D2421: 32.00 | E2421: euro | F2421: 1 | G2421: 1000.00 | H2421: 1.25 | I2421: 700.00 | J2421: -100.00 | K2421: 5 | L2421: =RC[-3]/100*RC[-1] -> 1.25
A2422: 2 | B2422: H0815 | C2422: US жетон стальной с резинкой||NS-NS1-SS-15 | D2422: 1.30 | E2422: usd | F2422: 10 | G2422: 44.00 | H2422: 1.69 | I2422: 308.00 | J2422: 48.00 | K2422: 5 | L2422: =RC[-3]/100*RC[-1] -> 1.69 | M2422: =SUM(R[-2]C[-1]:RC[-1]) -> 
A2424: #8953 (2014-09-26) Львів Назар Максимович - Відправлено-Продано
A2425: N | B2425: арт | C2425: назва | D2425: закуп | F2425: к-ть | G2425: цiна | H2425: кф | I2425: продж | J2425: дохiд | K2425: % | L2425: з-та
A2426: 1 | B2426: H43041/LR | C2426: US SFU китель польский вудлэнд (PolyCotton) ||BL-SFU-PR-04 | D2426: 14.49 | E2426: usd | F2426: 1 | G2426: 500.00 | H2426: 1.73 | I2426: 350.00 | J2426: 60.20 | K2426: 5 | L2426: =RC[-3]/100*RC[-1] -> 1.73
A2427: 2 | B2427: H4304/LR | C2427: US SFU штаны польский вудлэнд (PolyCotton) ||SP-SFU-PR-04 | D2427: 14.49 | E2427: usd | F2427: 1 | G2427: 500.00 | H2427: 1.73 | I2427: 350.00 | J2427: 60.20 | K2427: 5 | L2427: =RC[-3]/100*RC[-1] -> 1.73 | M2427: =SUM(R[-2]C[-1]:RC[-1]) -> 
A2429: #9014 (2014-09-29) Львів Назар Максимович - Відправлено-Продано
A2430: N | B2430: арт | C2430: назва | D2430: закуп | F2430: к-ть | G2430: цiна | H2430: кф | I2430: продж | J2430: дохiд | K2430: % | L2430: з-та
A2431: 1 | B2431: K11005-C | C2431: Розгрузочна система тактическая STRIKE с подсумками койот ||M51611005-TAN | D2431: 18.19 | E2431: usd | F2431: 2 | G2431: 704.00 | H2431: 1.94 | I2431: 985.60 | J2431: 258.00 | K2431: 5 | L2431: =RC[-3]/100*RC[-1] -> 1.94
A2432: 2 | B2432: K11005-B | C2432: Розгрузочна система тактическая STRIKE с подсумками чёрный ||M51611005-BK | D2432: 18.19 | E2432: usd | F2432: 2 | G2432: 704.00 | H2432: 1.94 | I2432: 985.60 | J2432: 258.00 | K2432: 5 | L2432: =RC[-3]/100*RC[-1] -> 1.94
A2433: 3 | B2433: K11004-AT | C2433: Розгруз. Ciras Mar ATACS [Производитель: ACM] ||M51611004-ATACS | D2433: 51.75 | E2433: usd | F2433: 1 | G2433: 1851.00 | H2433: 1.79 | I2433: 1295.70 | J2433: 260.70 | K2433: 5 | L2433: =RC[-3]/100*RC[-1] -> 1.79 | M2433: =SUM(R[-3]C[-1]:RC[-1]) -> 
A2435: #9048 (2014-09-30) Львів Назар Максимович - Відправлено-Продано
A2436: N | B2436: арт | C2436: назва | D2436: закуп | F2436: к-ть | G2436: цiна | H2436: кф | I2436: продж | J2436: дохiд | K2436: % | L2436: з-та
A2437: 1 | B2437: H5902/ML | C2437: CPU штаны олива (PolyCotton) ||SP-CPU-PR-02 | D2437: 20.10 | E2437: usd | F2437: 1 | G2437: 692.00 | H2437: 1.72 | I2437: 484.40 | J2437: 82.40 | K2437: 5 | L2437: =RC[-3]/100*RC[-1] -> 1.72
A2438: 2 | B2438: H4302/LR | C2438: US SFU штаны олива (NYCO R/S) ||SP-SFU-NR-02 SP-SFU-PR-02 | D2438: 15.03 | E2438: usd | F2438: 1 | G2438: 500.00 | H2438: 1.66 | I2438: 350.00 | J2438: 49.40 | K2438: 5 | L2438: =RC[-3]/100*RC[-1] -> 1.66
A2439: 3 | B2439: _14906 | C2439: Горелка для сухого спирту ||14906000 | D2439: 2.50 | E2439: euro | F2439: 2 | G2439: 71.00 | H2439: 1.14 | I2439: 99.40 | J2439: -25.60 | K2439: 5 | L2439: =RC[-3]/100*RC[-1] -> 1.14
A2440: 4 | B2440: 50703-14 | C2440: Наколінники AltaSOFT Flexline койот [ALTA] ||OK-ASL-CD-11 | D2440: 13.95 | E2440: usd | F2440: 1 | G2440: 481.00 | H2440: 1.72 | I2440: 336.70 | J2440: 57.70 | K2440: 5 | L2440: =RC[-3]/100*RC[-1] -> 1.72
A2441: 5 | B2441: AC-SCT-OD/M | C2441: Перчатки тактические Armored Claw kevlar, nomex олива | D2441: 150.00 | E2441: zl | F2441: 1 | G2441: 300.00 | H2441: 0.40 | I2441: 210.00 | J2441: -540.00 | K2441: 5 | L2441: =RC[-3]/100*RC[-1] -> 0.40
A2442: 6 | B2442: H49141/2XLR | C2442: Рубашка COMBAT мультикам с налокотниками (NYCO POL) ||KO-CS2-PO-14 | D2442: 25.88 | E2442: usd | F2442: 1 | G2442: 893.00 | H2442: 1.73 | I2442: 625.10 | J2442: 107.50 | K2442: 5 | L2442: =RC[-3]/100*RC[-1] -> 1.73
A2443: 7 | B2443: H7933 | C2443: Шапка флисовая MP Camo ||CZ-DOK-FL-33 | D2443: 4.00 | E2443: usd | F2443: 5 | G2443: 133.00 | H2443: 1.66 | I2443: 465.50 | J2443: 65.50 | K2443: 5 | L2443: =RC[-3]/100*RC[-1] -> 1.66
A2444: 8 | B2444: H7922 | C2444: Шапка флисовая вегетато ||CZ-DOK-FL-22 | D2444: 3.00 | E2444: usd | F2444: 10 | G2444: 114.00 | H2444: 1.90 | I2444: 798.00 | J2444: 198.00 | K2444: 5 | L2444: =RC[-3]/100*RC[-1] -> 1.90
A2445: 9 | B2445: H7911 | C2445: Шапка флисовая койот ||CZ-DOK-FL-11 | D2445: 2.00 | E2445: usd | F2445: 10 | G2445: 114.00 | H2445: 2.85 | I2445: 798.00 | J2445: 398.00 | K2445: 5 | L2445: =RC[-3]/100*RC[-1] -> 2.85
A2446: 10 | B2446: H7904 | C2446: Шапка флисовая пол.вудлэнд ||CZ-DOK-FL-04 | D2446: 3.00 | E2446: usd | F2446: 10 | G2446: 114.00 | H2446: 1.90 | I2446: 798.00 | J2446: 198.00 | K2446: 5 | L2446: =RC[-3]/100*RC[-1] -> 1.90
A2447: 11 | B2447: H7901 | C2447: Шапка флисовая чёрная ||CZ-DOK-FL-01 | D2447: 2.00 | E2447: usd | F2447: 10 | G2447: 114.00 | H2447: 2.85 | I2447: 798.00 | J2447: 398.00 | K2447: 5 | L2447: =RC[-3]/100*RC[-1] -> 2.85 | M2447: =SUM(R[-11]C[-1]:RC[-1]) -> 
A2449: #9061 (2014-09-30) Львів Назар Максимович - Відправлено-Продано
A2450: N | B2450: арт | C2450: назва | D2450: закуп | F2450: к-ть | G2450: цiна | H2450: кф | I2450: продж | J2450: дохiд | K2450: % | L2450: з-та
A2451: 1 | B2451: M800332/41 | C2451: Берцы MAGNUM Precision Ultra Lite CT WPI Wide | D2451: 53.25 | E2451: usd | F2451: 1 | G2451: 1415.00 | H2451: 1.33 | I2451: 990.50 | J2451: -74.50 | K2451: 5 | L2451: =RC[-3]/100*RC[-1] -> 1.33 | M2451: =SUM(R[-1]C[-1]:RC[-1]) -> 
A2453: #9085 (2014-10-01) Львів Назар Максимович - Прихід товару
A2454: N | B2454: арт | C2454: назва | D2454: закуп | F2454: к-ть | G2454: цiна | H2454: кф | I2454: продж | J2454: дохiд | K2454: % | L2454: з-та
A2455: 1 | B2455: _19-0700 | C2455: Набор для чистки оружия в кейсе | D2455: 21.24 | E2455: Инт | F2455: 1 | G2455: 308.00 | H2455: 0.73 | I2455: 308.00 | J2455: -116.80 | K2455: 5 | L2455: =RC[-3]/100*RC[-1] -> 0.73
A2456: 2 | B2456: _19-0700 | C2456: Набор для чистки оружия в кейсе | D2456: 21.24 | E2456: Инт | F2456: 3 | G2456: 308.00 | H2456: 0.73 | I2456: 924.00 | J2456: -350.40 | K2456: 5 | L2456: =RC[-3]/100*RC[-1] -> 0.73
A2457: 3 | B2457: _N324000 | C2457: Нож VIKING NORWEY нескладной | D2457: 38.91 | E2457: Инт | F2457: 1 | G2457: 486.40 | H2457: 0.63 | I2457: 486.40 | J2457: -291.84 | K2457: 5 | L2457: =RC[-3]/100*RC[-1] -> 0.63
A2458: 4 | B2458: _N324000 | C2458: Нож VIKING NORWEY нескладной | D2458: 38.91 | E2458: Инт | F2458: 4 | G2458: 486.40 | H2458: 0.63 | I2458: 1945.60 | J2458: -1167.36 | K2458: 5 | L2458: =RC[-3]/100*RC[-1] -> 0.63
A2459: 5 | B2459: _N4607-37 | C2459: Нож VIKING NORWEY нескладной (танто) | D2459: 18.24 | E2459: Инт | F2459: 2 | G2459: 228.00 | H2459: 0.63 | I2459: 456.00 | J2459: -273.60 | K2459: 5 | L2459: =RC[-3]/100*RC[-1] -> 0.63
A2460: 6 | B2460: _N4607-37 | C2460: Нож VIKING NORWEY нескладной (танто) | D2460: 18.24 | E2460: Инт | F2460: 1 | G2460: 228.00 | H2460: 0.63 | I2460: 228.00 | J2460: -136.80 | K2460: 5 | L2460: =RC[-3]/100*RC[-1] -> 0.63
A2461: 7 | B2461: _N3558-3 | C2461: Нож VIKING NORWEY нескладной | D2461: 18.24 | E2461: Инт | F2461: 3 | G2461: 228.00 | H2461: 0.63 | I2461: 684.00 | J2461: -410.40 | K2461: 5 | L2461: =RC[-3]/100*RC[-1] -> 0.63
A2462: 8 | B2462: _N3558-3 | C2462: Нож VIKING NORWEY нескладной | D2462: 18.24 | E2462: Инт | F2462: 1 | G2462: 228.00 | H2462: 0.63 | I2462: 228.00 | J2462: -136.80 | K2462: 5 | L2462: =RC[-3]/100*RC[-1] -> 0.63
A2463: 9 | B2463: _N35-34 | C2463: Нож Витязь Кабан | D2463: 20.67 | E2463: Инт | F2463: 1 | G2463: 258.40 | H2463: 0.63 | I2463: 258.40 | J2463: -155.04 | K2463: 5 | L2463: =RC[-3]/100*RC[-1] -> 0.63
A2464: 10 | B2464: _N35-34 | C2464: Нож Витязь Кабан | D2464: 20.67 | E2464: Инт | F2464: 4 | G2464: 258.40 | H2464: 0.63 | I2464: 1033.60 | J2464: -620.16 | K2464: 5 | L2464: =RC[-3]/100*RC[-1] -> 0.63
A2465: 11 | B2465: _N164-33 | C2465: Нож Витязь Кордон | D2465: 20.67 | E2465: Инт | F2465: 1 | G2465: 258.40 | H2465: 0.63 | I2465: 258.40 | J2465: -155.04 | K2465: 5 | L2465: =RC[-3]/100*RC[-1] -> 0.63
A2466: 12 | B2466: _N164-33 | C2466: Нож Витязь Кордон | D2466: 20.67 | E2466: Инт | F2466: 3 | G2466: 258.40 | H2466: 0.63 | I2466: 775.20 | J2466: -465.12 | K2466: 5 | L2466: =RC[-3]/100*RC[-1] -> 0.63
A2467: 13 | B2467: _873-5555 | C2467: Очки LUNIA (спортивные, 5 сменных линз ) | D2467: 45.83 | E2467: Инт | F2467: 1 | G2467: 550.00 | H2467: 0.60 | I2467: 550.00 | J2467: -366.67 | K2467: 5 | L2467: =RC[-3]/100*RC[-1] -> 0.60
A2468: 14 | B2468: _873-5555 | C2468: Очки LUNIA (спортивные, 5 сменных линз ) | D2468: 45.83 | E2468: Инт | F2468: 7 | G2468: 550.00 | H2468: 0.60 | I2468: 3850.00 | J2468: -2566.66 | K2468: 5 | L2468: =RC[-3]/100*RC[-1] -> 0.60 | M2468: =SUM(R[-14]C[-1]:RC[-1]) -> 
A2470: #9104 (2014-10-01) Львів Назар Максимович - Відправлено-Продано
A2471: N | B2471: арт | C2471: назва | D2471: закуп | F2471: к-ть | G2471: цiна | H2471: кф | I2471: продж | J2471: дохiд | K2471: % | L2471: з-та
A2472: 1 | B2472: H6101/44 | C2472: Берцы FIELD CUIR WATERPROOF GK ||BU-FCW-LE-01 | D2472: 63.90 | E2472: usd | F2472: 1 | G2472: 2205.00 | H2472: 1.73 | I2472: 1543.50 | J2472: 265.50 | K2472: 5 | L2472: =RC[-3]/100*RC[-1] -> 1.73 | M2472: =SUM(R[-1]C[-1]:RC[-1]) -> 
A2474: #9132 (2014-10-02) Львів Назар Максимович - Прихід товару
A2475: N | B2475: арт | C2475: назва | D2475: закуп | F2475: к-ть | G2475: цiна | H2475: кф | I2475: продж | J2475: дохiд | K2475: % | L2475: з-та
A2476: 1 | B2476: 22449-O/L | C2476: Перчатки тактические ARMY GLOVES oliv | D2476: 507.00 | E2476: zl | F2476: 1 | G2476: 507.00 | H2476: 0.20 | I2476: 507.00 | J2476: -2028.00 | K2476: 5 | L2476: =RC[-3]/100*RC[-1] -> 0.20
A2477: 2 | B2477: 22449-O/L | C2477: Перчатки тактические ARMY GLOVES oliv | D2477: 507.00 | E2477: zl | F2477: 1 | G2477: 507.00 | H2477: 0.20 | I2477: 507.00 | J2477: -2028.00 | K2477: 5 | L2477: =RC[-3]/100*RC[-1] -> 0.20
A2478: 3 | B2478: 22450-B/L | C2478: Перчатки тактические ARMY GLOVES Black | D2478: 507.00 | E2478: zl | F2478: 1 | G2478: 507.00 | H2478: 0.20 | I2478: 507.00 | J2478: -2028.00 | K2478: 5 | L2478: =RC[-3]/100*RC[-1] -> 0.20
A2479: 4 | B2479: 22450-B/XL | C2479: Перчатки тактические ARMY GLOVES Black | D2479: 507.00 | E2479: zl | F2479: 1 | G2479: 507.00 | H2479: 0.20 | I2479: 507.00 | J2479: -2028.00 | K2479: 5 | L2479: =RC[-3]/100*RC[-1] -> 0.20
A2480: 5 | B2480: 22450-B/XXL | C2480: Перчатки тактические ARMY GLOVES Black | D2480: 507.00 | E2480: zl | F2480: 1 | G2480: 507.00 | H2480: 0.20 | I2480: 507.00 | J2480: -2028.00 | K2480: 5 | L2480: =RC[-3]/100*RC[-1] -> 0.20
A2481: 6 | B2481: 15813-O | C2481: Перчатки тактические MFH oliv | D2481: 507.00 | E2481: zl | F2481: 1 | G2481: 507.00 | H2481: 0.20 | I2481: 507.00 | J2481: -2028.00 | K2481: 5 | L2481: =RC[-3]/100*RC[-1] -> 0.20
A2482: 7 | B2482: 15813-O | C2482: Перчатки тактические MFH oliv | D2482: 507.00 | E2482: zl | F2482: 1 | G2482: 507.00 | H2482: 0.20 | I2482: 507.00 | J2482: -2028.00 | K2482: 5 | L2482: =RC[-3]/100*RC[-1] -> 0.20
A2483: 8 | B2483: 15813-H | C2483: Перчатки тактические MFH хаки | D2483: 507.00 | E2483: zl | F2483: 2 | G2483: 507.00 | H2483: 0.20 | I2483: 1014.00 | J2483: -4056.00 | K2483: 5 | L2483: =RC[-3]/100*RC[-1] -> 0.20 | M2483: =SUM(R[-8]C[-1]:RC[-1]) -> 
A2485: #9135 (2014-10-02) Львів Назар Максимович - Відправлено-Продано
A2486: N | B2486: арт | C2486: назва | D2486: закуп | F2486: к-ть | G2486: цiна | H2486: кф | I2486: продж | J2486: дохiд | K2486: % | L2486: з-та
A2487: 1 | B2487: X4021 | C2487: Балаклава олива с 1-м отв. нинзя (100%хлопок) ||X76012 | D2487: 3.15 | E2487: Инт | F2487: 10 | G2487: 65.00 | H2487: 1.03 | I2487: 455.00 | J2487: -175.00 | K2487: 5 | L2487: =RC[-3]/100*RC[-1] -> 1.03
A2488: 2 | B2488: X402 | C2488: Балаклава олива с 1-м отв.(100%хлопок) ||X76012 | D2488: 3.15 | E2488: Инт | F2488: 10 | G2488: 65.00 | H2488: 1.03 | I2488: 455.00 | J2488: -175.00 | K2488: 5 | L2488: =RC[-3]/100*RC[-1] -> 1.03
A2489: 3 | B2489: H7602 | C2489: Балаклава олива с 1-м отв.(96%хлопок, 4%лайкра) ||CZ-KO1-CO-02 | D2489: 1.82 | E2489: usd | F2489: 10 | G2489: 75.00 | H2489: 2.06 | I2489: 525.00 | J2489: 161.00 | K2489: 5 | L2489: =RC[-3]/100*RC[-1] -> 2.06
A2490: 4 | B2490: X4011 | C2490: Балаклава чёрная с 1-м отв. нинзя(100%хлопок) ||X76011 | D2490: 3.15 | E2490: Инт | F2490: 10 | G2490: 65.00 | H2490: 1.03 | I2490: 455.00 | J2490: -175.00 | K2490: 5 | L2490: =RC[-3]/100*RC[-1] -> 1.03
A2491: 5 | B2491: X406 | C2491: Балаклава чёрная с 1-м отв. тепла (100%хлопок) || | D2491: 3.15 | E2491: Инт | F2491: 10 | G2491: 65.00 | H2491: 1.03 | I2491: 455.00 | J2491: -175.00 | K2491: 5 | L2491: =RC[-3]/100*RC[-1] -> 1.03
A2492: 6 | B2492: X401 | C2492: Балаклава чёрная с 1-м отв.(100%хлопок) ||X7601 | D2492: 3.15 | E2492: Инт | F2492: 10 | G2492: 65.00 | H2492: 1.03 | I2492: 455.00 | J2492: -175.00 | K2492: 5 | L2492: =RC[-3]/100*RC[-1] -> 1.03
A2493: 7 | B2493: H7601 | C2493: Балаклава чёрная с 1-м отв.(96%хлопок, 4%лайкра) ||CZ-KO1-CO-01 | D2493: 1.82 | E2493: usd | F2493: 10 | G2493: 75.00 | H2493: 2.06 | I2493: 525.00 | J2493: 161.00 | K2493: 5 | L2493: =RC[-3]/100*RC[-1] -> 2.06 | M2493: =SUM(R[-7]C[-1]:RC[-1]) -> 
A2495: #9167 (2014-10-03) Львів Назар Максимович - Відправлено-Продано
A2496: N | B2496: арт | C2496: назва | D2496: закуп | F2496: к-ть | G2496: цiна | H2496: кф | I2496: продж | J2496: дохiд | K2496: % | L2496: з-та
A2497: 1 | B2497: K12028-AT | C2497: Рюкзак Modular System снайперский Atacs N-600D ||M51612028-ATACS | D2497: 29.42 | E2497: usd | F2497: 1 | G2497: 1003.00 | H2497: 1.70 | I2497: 702.10 | J2497: 113.70 | K2497: 5 | L2497: =RC[-3]/100*RC[-1] -> 1.70 | M2497: =SUM(R[-1]C[-1]:RC[-1]) -> 
A2499: #9168 (2014-10-03) Львів Назар Максимович - Відправлено-Продано
A2500: N | B2500: арт | C2500: назва | D2500: закуп | F2500: к-ть | G2500: цiна | H2500: кф | I2500: продж | J2500: дохiд | K2500: % | L2500: з-та
A2501: 1 | B2501: K11005-C | C2501: Розгрузочна система тактическая STRIKE с подсумками койот ||M51611005-TAN | D2501: 18.19 | E2501: usd | F2501: 2 | G2501: 704.00 | H2501: 1.94 | I2501: 985.60 | J2501: 258.00 | K2501: 5 | L2501: =RC[-3]/100*RC[-1] -> 1.94
A2502: 2 | B2502: K11005-O | C2502: Розгрузочна система тактическая STRIKE с подсумками олива ||M51611005-OD | D2502: 18.19 | E2502: usd | F2502: 2 | G2502: 704.00 | H2502: 1.94 | I2502: 985.60 | J2502: 258.00 | K2502: 5 | L2502: =RC[-3]/100*RC[-1] -> 1.94
A2503: 3 | B2503: K11005-B | C2503: Розгрузочна система тактическая STRIKE с подсумками чёрный ||M51611005-BK | D2503: 18.19 | E2503: usd | F2503: 1 | G2503: 704.00 | H2503: 1.94 | I2503: 492.80 | J2503: 129.00 | K2503: 5 | L2503: =RC[-3]/100*RC[-1] -> 1.94
A2504: 4 | B2504: K11005-B | C2504: Розгрузочна система тактическая STRIKE с подсумками чёрный ||M51611005-BK | D2504: 18.19 | E2504: usd | F2504: 1 | G2504: 704.00 | H2504: 1.94 | I2504: 492.80 | J2504: 129.00 | K2504: 5 | L2504: =RC[-3]/100*RC[-1] -> 1.94 | M2504: =SUM(R[-4]C[-1]:RC[-1]) -> 
A2506: #9169 (2014-10-03) Львів Назар Максимович - Відправлено-Продано
A2507: N | B2507: арт | C2507: назва | D2507: закуп | F2507: к-ть | G2507: цiна | H2507: кф | I2507: продж | J2507: дохiд | K2507: % | L2507: з-та
A2508: 1 | B2508: H4013/SR | C2508: URBAN TACTICAL штаны хаки ||SP-UTL-CO-13 | D2508: 37.13 | E2508: usd | F2508: 1 | G2508: 1282.00 | H2508: 1.73 | I2508: 897.40 | J2508: 154.80 | K2508: 5 | L2508: =RC[-3]/100*RC[-1] -> 1.73 | M2508: =SUM(R[-1]C[-1]:RC[-1]) -> 
A2510: #9243 (2014-10-06) Львів Назар Максимович - Відправлено-Продано
A2511: N | B2511: арт | C2511: назва | D2511: закуп | F2511: к-ть | G2511: цiна | H2511: кф | I2511: продж | J2511: дохiд | K2511: % | L2511: з-та
A2512: 1 | B2512: M800004/44.5 | C2512: Берцы MAGNUM Spider 8.1 Urban SZ(USA Version) | D2512: 59.25 | E2512: usd | F2512: 2 | G2512: 1581.00 | H2512: 1.33 | I2512: 2213.40 | J2512: -156.60 | K2512: 5 | L2512: =RC[-3]/100*RC[-1] -> 1.33
A2513: 2 | B2513: H65021/LR | C2513: Куртка М65 с отстегивающейся курткой олива (NYCO) ||KU-M65-NY-02 | D2513: 38.39 | E2513: usd | F2513: 1 | G2513: 1324.00 | H2513: 1.72 | I2513: 926.80 | J2513: 159.00 | K2513: 5 | L2513: =RC[-3]/100*RC[-1] -> 1.72
A2514: 3 | B2514: _10580/M | C2514: US NAVY бушлат чёрный (с чорними гудзиками) ||10580000/903 | D2514: 27.50 | E2514: euro | F2514: 1 | G2514: 794.00 | H2514: 1.15 | I2514: 555.80 | J2514: -131.70 | K2514: 5 | L2514: =RC[-3]/100*RC[-1] -> 1.15
A2515: 4 | B2515: H4413/LR | C2515: US BDU штаны бежевые (R/S) ||SP-BDU-CR-13 | D2515: 13.64 | E2515: usd | F2515: 1 | G2515: 486.00 | H2515: 1.78 | I2515: 340.20 | J2515: 67.40 | K2515: 5 | L2515: =RC[-3]/100*RC[-1] -> 1.78
A2516: 5 | B2516: _10181/L | C2516: Куртка-аляска US N3B длинная олива ||10181001/904 | D2516: 34.50 | E2516: euro | F2516: 1 | G2516: 1078.00 | H2516: 1.25 | I2516: 754.60 | J2516: -107.90 | K2516: 5 | L2516: =RC[-3]/100*RC[-1] -> 1.25 | M2516: =SUM(R[-5]C[-1]:RC[-1]) -> 
A2518: #9301 (2014-10-08) Львів Назар Максимович - Відправлено-Продано
A2519: N | B2519: арт | C2519: назва | D2519: закуп | F2519: к-ть | G2519: цiна | H2519: кф | I2519: продж | J2519: дохiд | K2519: % | L2519: з-та
A2520: 1 | B2520: H2401/L | C2520: Куртка DEFENDER POLICE флисовая чёрная ||BL-DEF-HF-01 | D2520: 22.86 | E2520: usd | F2520: 1 | G2520: 789.00 | H2520: 1.73 | I2520: 552.30 | J2520: 95.10 | K2520: 5 | L2520: =RC[-3]/100*RC[-1] -> 1.73
A2521: 2 | B2521: H2401/2XL | C2521: Куртка DEFENDER POLICE флисовая чёрная ||BL-DEF-HF-01 | D2521: 22.86 | E2521: usd | F2521: 1 | G2521: 789.00 | H2521: 1.73 | I2521: 552.30 | J2521: 95.10 | K2521: 5 | L2521: =RC[-3]/100*RC[-1] -> 1.73 | M2521: =SUM(R[-2]C[-1]:RC[-1]) -> 
A2523: #9432 (2014-10-13) Львів Назар Максимович - Відправлено-Продано
A2524: N | B2524: арт | C2524: назва | D2524: закуп | F2524: к-ть | G2524: цiна | H2524: кф | I2524: продж | J2524: дохiд | K2524: % | L2524: з-та
A2525: 1 | B2525: H65031/XL | C2525: Куртка М65 с отстегивающейся курткой вудлэнд (NYCO) ||KU-M65-NY-03 | D2525: 37.22 | E2525: usd | F2525: 1 | G2525: 1324.00 | H2525: 1.78 | I2525: 926.80 | J2525: 182.40 | K2525: 5 | L2525: =RC[-3]/100*RC[-1] -> 1.78
A2526: 2 | B2526: K12088-С | C2526: Рюкзак Tactical Backpack for 13" laptop койот ||M51612088-TAN | D2526: 21.61 | E2526: usd | F2526: 1 | G2526: 746.00 | H2526: 1.73 | I2526: 522.20 | J2526: 90.00 | K2526: 5 | L2526: =RC[-3]/100*RC[-1] -> 1.73
A2527: 3 | B2527: H0815 | C2527: US жетон стальной с резинкой||NS-NS1-SS-15 | D2527: 1.30 | E2527: usd | F2527: 15 | G2527: 44.00 | H2527: 1.69 | I2527: 462.00 | J2527: 72.00 | K2527: 5 | L2527: =RC[-3]/100*RC[-1] -> 1.69
A2528: 4 | B2528: _10476/XL | C2528: Куртка-аляска US N2B короткая синя ||10410003/905 | D2528: 32.00 | E2528: euro | F2528: 1 | G2528: 1000.00 | H2528: 1.25 | I2528: 700.00 | J2528: -100.00 | K2528: 5 | L2528: =RC[-3]/100*RC[-1] -> 1.25
A2529: 5 | B2529: H65021/LL | C2529: Куртка М65 с отстегивающейся курткой олива (NYCO) ||KU-M65-NY-02 | D2529: 38.39 | E2529: usd | F2529: 1 | G2529: 1324.00 | H2529: 1.72 | I2529: 926.80 | J2529: 159.00 | K2529: 5 | L2529: =RC[-3]/100*RC[-1] -> 1.72
A2530: 6 | B2530: H65021/XLL | C2530: Куртка М65 с отстегивающейся курткой олива (NYCO) ||KU-M65-NY-02 | D2530: 38.39 | E2530: usd | F2530: 1 | G2530: 1324.00 | H2530: 1.72 | I2530: 926.80 | J2530: 159.00 | K2530: 5 | L2530: =RC[-3]/100*RC[-1] -> 1.72
A2531: 7 | B2531: H65021/2XLR | C2531: Куртка М65 с отстегивающейся курткой олива (NYCO) ||KU-M65-NY-02 | D2531: 38.39 | E2531: usd | F2531: 1 | G2531: 1324.00 | H2531: 1.72 | I2531: 926.80 | J2531: 159.00 | K2531: 5 | L2531: =RC[-3]/100*RC[-1] -> 1.72
A2532: 8 | B2532: H5902/ML | C2532: CPU штаны олива (PolyCotton) ||SP-CPU-PR-02 | D2532: 20.10 | E2532: usd | F2532: 2 | G2532: 692.00 | H2532: 1.72 | I2532: 968.80 | J2532: 164.80 | K2532: 5 | L2532: =RC[-3]/100*RC[-1] -> 1.72
A2533: 9 | B2533: H5902/LL | C2533: CPU штаны олива (PolyCotton) ||SP-CPU-PR-02 | D2533: 20.10 | E2533: usd | F2533: 1 | G2533: 692.00 | H2533: 1.72 | I2533: 484.40 | J2533: 82.40 | K2533: 5 | L2533: =RC[-3]/100*RC[-1] -> 1.72
A2534: 10 | B2534: _10181/L | C2534: Куртка-аляска US N3B длинная олива ||10181001/904 | D2534: 34.50 | E2534: euro | F2534: 1 | G2534: 1078.00 | H2534: 1.25 | I2534: 754.60 | J2534: -107.90 | K2534: 5 | L2534: =RC[-3]/100*RC[-1] -> 1.25
A2535: 11 | B2535: H4304/LR | C2535: US SFU штаны польский вудлэнд (PolyCotton) ||SP-SFU-PR-04 | D2535: 14.49 | E2535: usd | F2535: 1 | G2535: 500.00 | H2535: 1.73 | I2535: 350.00 | J2535: 60.20 | K2535: 5 | L2535: =RC[-3]/100*RC[-1] -> 1.73
A2536: 12 | B2536: H4304/XLR | C2536: US SFU штаны польский вудлэнд (PolyCotton) ||SP-SFU-PR-04 | D2536: 14.49 | E2536: usd | F2536: 1 | G2536: 500.00 | H2536: 1.73 | I2536: 350.00 | J2536: 60.20 | K2536: 5 | L2536: =RC[-3]/100*RC[-1] -> 1.73
A2537: 13 | B2537: H43041/LR | C2537: US SFU китель польский вудлэнд (PolyCotton) ||BL-SFU-PR-04 | D2537: 14.49 | E2537: usd | F2537: 1 | G2537: 500.00 | H2537: 1.73 | I2537: 350.00 | J2537: 60.20 | K2537: 5 | L2537: =RC[-3]/100*RC[-1] -> 1.73
A2538: 14 | B2538: H43041/XLR | C2538: US SFU китель польский вудлэнд (PolyCotton) ||BL-SFU-PR-04 | D2538: 14.49 | E2538: usd | F2538: 1 | G2538: 500.00 | H2538: 1.73 | I2538: 350.00 | J2538: 60.20 | K2538: 5 | L2538: =RC[-3]/100*RC[-1] -> 1.73 | M2538: =SUM(R[-14]C[-1]:RC[-1]) -> 
A2540: #9436 (2014-10-13) Львів Назар Максимович - Відправлено-Продано
A2541: N | B2541: арт | C2541: назва | D2541: закуп | F2541: к-ть | G2541: цiна | H2541: кф | I2541: продж | J2541: дохiд | K2541: % | L2541: з-та
A2542: 1 | B2542: H65021/2XLR | C2542: Куртка М65 с отстегивающейся курткой олива (NYCO) ||KU-M65-NY-02 | D2542: 38.39 | E2542: usd | F2542: 1 | G2542: 1324.00 | H2542: 1.72 | I2542: 926.80 | J2542: 159.00 | K2542: 5 | L2542: =RC[-3]/100*RC[-1] -> 1.72
A2543: 2 | B2543: H4302/2XLR | C2543: US SFU штаны олива (NYCO R/S) ||SP-SFU-NR-02 SP-SFU-PR-02 | D2543: 15.03 | E2543: usd | F2543: 1 | G2543: 500.00 | H2543: 1.66 | I2543: 350.00 | J2543: 49.40 | K2543: 5 | L2543: =RC[-3]/100*RC[-1] -> 1.66 | M2543: =SUM(R[-2]C[-1]:RC[-1]) -> 
A2545: #9439 (2014-10-13) Львів Назар Максимович - Відправлено-Продано
A2546: N | B2546: арт | C2546: назва | D2546: закуп | F2546: к-ть | G2546: цiна | H2546: кф | I2546: продж | J2546: дохiд | K2546: % | L2546: з-та
A2547: 1 | B2547: H65021/LL | C2547: Куртка М65 с отстегивающейся курткой олива (NYCO) ||KU-M65-NY-02 | D2547: 38.39 | E2547: usd | F2547: 1 | G2547: 1324.00 | H2547: 1.72 | I2547: 926.80 | J2547: 159.00 | K2547: 5 | L2547: =RC[-3]/100*RC[-1] -> 1.72 | M2547: =SUM(R[-1]C[-1]:RC[-1]) -> 
A2549: #9491 (2014-10-14) Львів Назар Максимович - Прихід товару
A2550: N | B2550: арт | C2550: назва | D2550: закуп | F2550: к-ть | G2550: цiна | H2550: кф | I2550: продж | J2550: дохiд | K2550: % | L2550: з-та
A2551: 1 | B2551: _661-0070 | C2551: Перчатки без палые кожаные | D2551: 6.70 | E2551: Инт | F2551: 13 | G2551: 98.00 | H2551: 0.73 | I2551: 1274.00 | J2551: -468.00 | K2551: 5 | L2551: =RC[-3]/100*RC[-1] -> 0.73
A2552: 2 | B2552: _608-0202/L | C2552: Перчатки тактические олива (без палые) | D2552: 17.25 | E2552: Инт | F2552: 10 | G2552: 250.00 | H2552: 0.72 | I2552: 2500.00 | J2552: -950.00 | K2552: 5 | L2552: =RC[-3]/100*RC[-1] -> 0.72
A2553: 3 | B2553: _608-0202/XL | C2553: Перчатки тактические олива (без палые) | D2553: 17.25 | E2553: Инт | F2553: 20 | G2553: 250.00 | H2553: 0.72 | I2553: 5000.00 | J2553: -1900.00 | K2553: 5 | L2553: =RC[-3]/100*RC[-1] -> 0.72
A2554: 4 | B2554: _608-0201/L | C2554: Перчатки тактические чёрные (без палые) | D2554: 250.00 | E2554: грн | F2554: 10 | G2554: 250.00 | H2554: 1.00 | I2554: 2500.00 | J2554: 0.00 | K2554: 5 | L2554: =RC[-3]/100*RC[-1] -> 1.00
A2555: 5 | B2555: _608-0201/XL | C2555: Перчатки тактические чёрные (без палые) | D2555: 250.00 | E2555: грн | F2555: 20 | G2555: 250.00 | H2555: 1.00 | I2555: 5000.00 | J2555: 0.00 | K2555: 5 | L2555: =RC[-3]/100*RC[-1] -> 1.00 | M2555: =SUM(R[-5]C[-1]:RC[-1]) -> 
A2557: #9601 (2014-10-17) Львів Назар Максимович - Прихід товару
A2558: N | B2558: арт | C2558: назва | D2558: закуп | F2558: к-ть | G2558: цiна | H2558: кф | I2558: продж | J2558: дохiд | K2558: % | L2558: з-та
A2559: 1 | B2559: _L646016 | C2559: Фонарь на голову CARP PRO SENSOR | D2559: 12.76 | E2559: Инт | F2559: 1 | G2559: 185.00 | H2559: 0.72 | I2559: 185.00 | J2559: -70.20 | K2559: 5 | L2559: =RC[-3]/100*RC[-1] -> 0.72
A2560: 2 | B2560: _L827019 | C2560: Фонарь-лампа CARP PRO | D2560: 8.21 | E2560: Инт | F2560: 10 | G2560: 119.00 | H2560: 0.72 | I2560: 1190.00 | J2560: -452.00 | K2560: 5 | L2560: =RC[-3]/100*RC[-1] -> 0.72
A2561: 3 | B2561: _L354010 | C2561: Фонарь-лампа CARP PRO 3 | D2561: 11.66 | E2561: Инт | F2561: 10 | G2561: 169.00 | H2561: 0.72 | I2561: 1690.00 | J2561: -642.00 | K2561: 5 | L2561: =RC[-3]/100*RC[-1] -> 0.72
A2562: 4 | B2562: _L353013 | C2562: Фонарь-лампа FORREST | D2562: 3.31 | E2562: Инт | F2562: 6 | G2562: 48.00 | H2562: 0.73 | I2562: 288.00 | J2562: -109.20 | K2562: 5 | L2562: =RC[-3]/100*RC[-1] -> 0.73
A2563: 5 | B2563: _L360011 | C2563: Фонарь-лампа FORREST | D2563: 15.66 | E2563: Инт | F2563: 5 | G2563: 227.00 | H2563: 0.72 | I2563: 1135.00 | J2563: -430.52 | K2563: 5 | L2563: =RC[-3]/100*RC[-1] -> 0.72
A2564: 6 | B2564: _L362015 | C2564: Фонарь-лампа FORREST | D2564: 12.34 | E2564: Инт | F2564: 5 | G2564: 179.00 | H2564: 0.73 | I2564: 895.00 | J2564: -339.00 | K2564: 5 | L2564: =RC[-3]/100*RC[-1] -> 0.73
A2565: 7 | B2565: _L647013 | C2565: Фонарь-лампа FORREST | D2565: 6.48 | E2565: Инт | F2565: 10 | G2565: 94.00 | H2565: 0.73 | I2565: 940.00 | J2565: -356.00 | K2565: 5 | L2565: =RC[-3]/100*RC[-1] -> 0.73 | M2565: =SUM(R[-7]C[-1]:RC[-1]) -> 
A2567: #9603 (2014-10-17) Львів Назар Максимович - Відправлено-Продано
A2568: N | B2568: арт | C2568: назва | D2568: закуп | F2568: к-ть | G2568: цiна | H2568: кф | I2568: продж | J2568: дохiд | K2568: % | L2568: з-та
A2569: 1 | B2569: _23-0302 | C2569: Прицел оптический PILAD 4x32LD (круг с точкою) | D2569: 84.49 | E2569: Инт | F2569: 1 | G2569: 1546.00 | H2569: 0.91 | I2569: 1546.00 | J2569: -143.75 | K2569: 5 | L2569: =RC[-3]/100*RC[-1] -> 0.91
A2570: 2 | B2570: _01128 | C2570: Прицел коллиматорный ПК-А(T) | D2570: 1408.00 | E2570: грн | F2570: 1 | G2570: 1972.00 | H2570: 1.40 | I2570: 1972.00 | J2570: 564.00 | K2570: 5 | L2570: =RC[-3]/100*RC[-1] -> 1.40
A2571: 3 | B2571: _01050 | C2571: Прицел оптический PILAD 8x48 сетка | D2571: 79.66 | E2571: Инт | F2571: 1 | G2571: 1369.00 | H2571: 0.86 | I2571: 1369.00 | J2571: -224.20 | K2571: 5 | L2571: =RC[-3]/100*RC[-1] -> 0.86
A2572: 4 | B2572: _03643 | C2572: Прицел оптический ПОСП 8x42 ИЖ-18 | D2572: 154.85 | E2572: Инт | F2572: 1 | G2572: 2790.00 | H2572: 0.90 | I2572: 2790.00 | J2572: -307.00 | K2572: 5 | L2572: =RC[-3]/100*RC[-1] -> 0.90 | M2572: =SUM(R[-4]C[-1]:RC[-1]) -> 
A2574: #9606 (2014-10-17) Львів Назар Максимович - Прихід товару
A2575: N | B2575: арт | C2575: назва | D2575: закуп | F2575: к-ть | G2575: цiна | H2575: кф | I2575: продж | J2575: дохiд | K2575: % | L2575: з-та
A2576: 1 | B2576: 22449-O/XXL | C2576: Перчатки тактические ARMY GLOVES oliv | D2576: 507.00 | E2576: zl | F2576: 2 | G2576: 507.00 | H2576: 0.20 | I2576: 1014.00 | J2576: -4056.00 | K2576: 5 | L2576: =RC[-3]/100*RC[-1] -> 0.20
A2577: 2 | B2577: 22450-B/XL | C2577: Перчатки тактические ARMY GLOVES Black | D2577: 507.00 | E2577: zl | F2577: 1 | G2577: 507.00 | H2577: 0.20 | I2577: 507.00 | J2577: -2028.00 | K2577: 5 | L2577: =RC[-3]/100*RC[-1] -> 0.20
A2578: 3 | B2578: 15813-C | C2578: Перчатки тактические MFH coyote | D2578: 507.00 | E2578: zl | F2578: 1 | G2578: 507.00 | H2578: 0.20 | I2578: 507.00 | J2578: -2028.00 | K2578: 5 | L2578: =RC[-3]/100*RC[-1] -> 0.20
A2579: 4 | B2579: 15823B-XL | C2579: Перчатки тактические Neopren black | D2579: 507.00 | E2579: zl | F2579: 1 | G2579: 698.00 | H2579: 0.28 | I2579: 488.60 | J2579: -2046.40 | K2579: 5 | L2579: =RC[-3]/100*RC[-1] -> 0.28
A2580: 5 | B2580: 15823O-XL | C2580: Перчатки тактические Neopren oliv | D2580: 507.00 | E2580: zl | F2580: 1 | G2580: 507.00 | H2580: 0.20 | I2580: 507.00 | J2580: -2028.00 | K2580: 5 | L2580: =RC[-3]/100*RC[-1] -> 0.20 | M2580: =SUM(R[-5]C[-1]:RC[-1]) -> 
A2582: #9700 (2014-10-21) Львів Назар Максимович - Відправлено-Продано
A2583: N | B2583: арт | C2583: назва | D2583: закуп | F2583: к-ть | G2583: цiна | H2583: кф | I2583: продж | J2583: дохiд | K2583: % | L2583: з-та
A2584: 1 | B2584: H7201 | C2584: US BDU кепка чёрная ( PolyCotton Ripstop) ||CZ-COM-NR-01 | D2584: 2.33 | E2584: usd | F2584: 1 | G2584: 83.00 | H2584: 1.78 | I2584: 58.10 | J2584: 11.50 | K2584: 5 | L2584: =RC[-3]/100*RC[-1] -> 1.78
A2585: 2 | B2585: H43011/MR | C2585: US SFU китель чёрный (PolyCotton) ||BL-SFU-PR-01 | D2585: 15.03 | E2585: usd | F2585: 1 | G2585: 500.00 | H2585: 1.66 | I2585: 350.00 | J2585: 49.40 | K2585: 5 | L2585: =RC[-3]/100*RC[-1] -> 1.66
A2586: 3 | B2586: H4301/MR | C2586: US SFU штаны чёрные (PolyCotton) ||SP-SFU-PR-01 | D2586: 15.03 | E2586: usd | F2586: 1 | G2586: 500.00 | H2586: 1.66 | I2586: 350.00 | J2586: 49.40 | K2586: 5 | L2586: =RC[-3]/100*RC[-1] -> 1.66
A2587: 4 | B2587: _10181/L | C2587: Куртка-аляска US N3B длинная олива ||10181001/904 | D2587: 34.50 | E2587: euro | F2587: 1 | G2587: 1078.00 | H2587: 1.25 | I2587: 754.60 | J2587: -107.90 | K2587: 5 | L2587: =RC[-3]/100*RC[-1] -> 1.25
A2588: 5 | B2588: H0815 | C2588: US жетон стальной с резинкой||NS-NS1-SS-15 | D2588: 1.30 | E2588: usd | F2588: 10 | G2588: 44.00 | H2588: 1.69 | I2588: 308.00 | J2588: 48.00 | K2588: 5 | L2588: =RC[-3]/100*RC[-1] -> 1.69
A2589: 6 | B2589: H2401/XL | C2589: Куртка DEFENDER POLICE флисовая чёрная ||BL-DEF-HF-01 | D2589: 22.86 | E2589: usd | F2589: 1 | G2589: 789.00 | H2589: 1.73 | I2589: 552.30 | J2589: 95.10 | K2589: 5 | L2589: =RC[-3]/100*RC[-1] -> 1.73
A2590: 7 | B2590: H2401/3XL | C2590: Куртка DEFENDER POLICE флисовая чёрная ||BL-DEF-HF-01 | D2590: 22.86 | E2590: usd | F2590: 1 | G2590: 789.00 | H2590: 1.73 | I2590: 552.30 | J2590: 95.10 | K2590: 5 | L2590: =RC[-3]/100*RC[-1] -> 1.73 | M2590: =SUM(R[-7]C[-1]:RC[-1]) -> 
A2592: #10005 (2014-10-29) Львів Назар Максимович - Відправлено-Продано
A2593: N | B2593: арт | C2593: назва | D2593: закуп | F2593: к-ть | G2593: цiна | H2593: кф | I2593: продж | J2593: дохiд | K2593: % | L2593: з-та
A2594: 1 | B2594: H3302/2XL | C2594: Комплект термобілизни (95% полиэстер 5% спандекс) олива ||KP-UN2-PO-02/2XL | D2594: 19.99 | E2594: usd | F2594: 2 | G2594: 712.00 | H2594: 1.78 | I2594: 996.80 | J2594: 197.20 | K2594: 5 | L2594: =RC[-3]/100*RC[-1] -> 1.78
A2595: 2 | B2595: H7202 | C2595: US BDU кепка олива (NYCO R/S) ||CZ-COM-CR-02 | D2595: 2.33 | E2595: usd | F2595: 5 | G2595: 83.00 | H2595: 1.78 | I2595: 290.50 | J2595: 57.50 | K2595: 5 | L2595: =RC[-3]/100*RC[-1] -> 1.78
A2596: 3 | B2596: H7902 | C2596: Шапка флисовая олива ||CZ-DOK-FL-02 | D2596: 2.00 | E2596: usd | F2596: 4 | G2596: 114.00 | H2596: 2.85 | I2596: 319.20 | J2596: 159.20 | K2596: 5 | L2596: =RC[-3]/100*RC[-1] -> 2.85
A2597: 4 | B2597: H7914 | C2597: Шапка флисовая мультикам ||CZ-DOK-FL-14 | D2597: 4.00 | E2597: usd | F2597: 4 | G2597: 133.00 | H2597: 1.66 | I2597: 372.40 | J2597: 52.40 | K2597: 5 | L2597: =RC[-3]/100*RC[-1] -> 1.66
A2598: 5 | B2598: H7602 | C2598: Балаклава олива с 1-м отв.(96%хлопок, 4%лайкра) ||CZ-KO1-CO-02 | D2598: 1.82 | E2598: usd | F2598: 4 | G2598: 75.00 | H2598: 2.06 | I2598: 210.00 | J2598: 64.40 | K2598: 5 | L2598: =RC[-3]/100*RC[-1] -> 2.06
A2599: 6 | B2599: H7601N | C2599: Балаклава чёрная с 1-м отв.(ComfortDry) ||CZ-KO2-FG-01 | D2599: 5.66 | E2599: usd | F2599: 4 | G2599: 211.00 | H2599: 1.86 | I2599: 590.80 | J2599: 138.00 | K2599: 5 | L2599: =RC[-3]/100*RC[-1] -> 1.86
A2600: 7 | B2600: H46031/XLR | C2600: US BDU китель вудлэнд (PolyCotton) ||BL-BDU-PR-03 | D2600: 13.64 | E2600: usd | F2600: 1 | G2600: 486.00 | H2600: 1.78 | I2600: 340.20 | J2600: 67.40 | K2600: 5 | L2600: =RC[-3]/100*RC[-1] -> 1.78
A2601: 8 | B2601: H4603/XLR | C2601: US BDU штаны вудлэнд (PolyCotton) ||SP-BDU-PR-03 | D2601: 13.64 | E2601: usd | F2601: 2 | G2601: 486.00 | H2601: 1.78 | I2601: 680.40 | J2601: 134.80 | K2601: 5 | L2601: =RC[-3]/100*RC[-1] -> 1.78
A2602: 9 | B2602: H43041/LR | C2602: US SFU китель польский вудлэнд (PolyCotton) ||BL-SFU-PR-04 | D2602: 14.49 | E2602: usd | F2602: 1 | G2602: 500.00 | H2602: 1.73 | I2602: 350.00 | J2602: 60.20 | K2602: 5 | L2602: =RC[-3]/100*RC[-1] -> 1.73
A2603: 10 | B2603: H43041/XLR | C2603: US SFU китель польский вудлэнд (PolyCotton) ||BL-SFU-PR-04 | D2603: 14.49 | E2603: usd | F2603: 1 | G2603: 500.00 | H2603: 1.73 | I2603: 350.00 | J2603: 60.20 | K2603: 5 | L2603: =RC[-3]/100*RC[-1] -> 1.73
A2604: 11 | B2604: H41991/MR | C2604: US SFU китель укр.-цифра (PolyCotton) ||BL-SFU-PR-99 | D2604: 15.44 | E2604: usd | F2604: 1 | G2604: 533.00 | H2604: 1.73 | I2604: 373.10 | J2604: 64.30 | K2604: 5 | L2604: =RC[-3]/100*RC[-1] -> 1.73
A2605: 12 | B2605: H4304/LR | C2605: US SFU штаны польский вудлэнд (PolyCotton) ||SP-SFU-PR-04 | D2605: 14.49 | E2605: usd | F2605: 2 | G2605: 500.00 | H2605: 1.73 | I2605: 700.00 | J2605: 120.40 | K2605: 5 | L2605: =RC[-3]/100*RC[-1] -> 1.73
A2606: 13 | B2606: H4199/ML | C2606: US SFU штаны укр.-цифра (PolyCotton) ||SP-SFU-PR-99 | D2606: 15.44 | E2606: usd | F2606: 1 | G2606: 533.00 | H2606: 1.73 | I2606: 373.10 | J2606: 64.30 | K2606: 5 | L2606: =RC[-3]/100*RC[-1] -> 1.73
A2607: 14 | B2607: H65031/L | C2607: Куртка М65 с отстегивающейся курткой вудлэнд (NYCO) ||KU-M65-NY-03 | D2607: 37.22 | E2607: usd | F2607: 1 | G2607: 1324.00 | H2607: 1.78 | I2607: 926.80 | J2607: 182.40 | K2607: 5 | L2607: =RC[-3]/100*RC[-1] -> 1.78
A2608: 15 | B2608: H65031/XL | C2608: Куртка М65 с отстегивающейся курткой вудлэнд (NYCO) ||KU-M65-NY-03 | D2608: 37.22 | E2608: usd | F2608: 1 | G2608: 1324.00 | H2608: 1.78 | I2608: 926.80 | J2608: 182.40 | K2608: 5 | L2608: =RC[-3]/100*RC[-1] -> 1.78
A2609: 16 | B2609: H65021/ML | C2609: Куртка М65 с отстегивающейся курткой олива (NYCO) ||KU-M65-NY-02 | D2609: 38.39 | E2609: usd | F2609: 1 | G2609: 1324.00 | H2609: 1.72 | I2609: 926.80 | J2609: 159.00 | K2609: 5 | L2609: =RC[-3]/100*RC[-1] -> 1.72
A2610: 17 | B2610: H41991/SL | C2610: US SFU китель укр.-цифра (PolyCotton) ||BL-SFU-PR-99 | D2610: 15.44 | E2610: usd | F2610: 1 | G2610: 533.00 | H2610: 1.73 | I2610: 373.10 | J2610: 64.30 | K2610: 5 | L2610: =RC[-3]/100*RC[-1] -> 1.73
A2611: 18 | B2611: H41991/SR | C2611: US SFU китель укр.-цифра (PolyCotton) ||BL-SFU-PR-99 | D2611: 15.44 | E2611: usd | F2611: 1 | G2611: 533.00 | H2611: 1.73 | I2611: 373.10 | J2611: 64.30 | K2611: 5 | L2611: =RC[-3]/100*RC[-1] -> 1.73
A2612: 19 | B2612: H4199/LL | C2612: US SFU штаны укр.-цифра (PolyCotton) ||SP-SFU-PR-99 | D2612: 15.44 | E2612: usd | F2612: 1 | G2612: 533.00 | H2612: 1.73 | I2612: 373.10 | J2612: 64.30 | K2612: 5 | L2612: =RC[-3]/100*RC[-1] -> 1.73
A2613: 20 | B2613: H4199/LR | C2613: US SFU штаны укр.-цифра (PolyCotton) ||SP-SFU-PR-99 | D2613: 15.44 | E2613: usd | F2613: 1 | G2613: 533.00 | H2613: 1.73 | I2613: 373.10 | J2613: 64.30 | K2613: 5 | L2613: =RC[-3]/100*RC[-1] -> 1.73
A2614: 21 | B2614: H4199/MR | C2614: US SFU штаны укр.-цифра (PolyCotton) ||SP-SFU-PR-99 | D2614: 15.44 | E2614: usd | F2614: 1 | G2614: 533.00 | H2614: 1.73 | I2614: 373.10 | J2614: 64.30 | K2614: 5 | L2614: =RC[-3]/100*RC[-1] -> 1.73
A2615: 22 | B2615: H4199/SL | C2615: US SFU штаны укр.-цифра (PolyCotton) ||SP-SFU-PR-99 | D2615: 15.44 | E2615: usd | F2615: 1 | G2615: 533.00 | H2615: 1.73 | I2615: 373.10 | J2615: 64.30 | K2615: 5 | L2615: =RC[-3]/100*RC[-1] -> 1.73
A2616: 23 | B2616: H4199/SR | C2616: US SFU штаны укр.-цифра (PolyCotton) ||SP-SFU-PR-99 | D2616: 15.44 | E2616: usd | F2616: 1 | G2616: 533.00 | H2616: 1.73 | I2616: 373.10 | J2616: 64.30 | K2616: 5 | L2616: =RC[-3]/100*RC[-1] -> 1.73
A2617: 24 | B2617: R1283/40 | C2617: Берци кожа чёрные Украина | D2617: 70.00 | E2617: usd | F2617: 1 | G2617: 1500.00 | H2617: 1.07 | I2617: 1050.00 | J2617: -350.00 | K2617: 5 | L2617: =RC[-3]/100*RC[-1] -> 1.07
A2618: 25 | B2618: R1283/41 | C2618: Берци кожа чёрные Украина | D2618: 70.00 | E2618: usd | F2618: 1 | G2618: 1500.00 | H2618: 1.07 | I2618: 1050.00 | J2618: -350.00 | K2618: 5 | L2618: =RC[-3]/100*RC[-1] -> 1.07
A2619: 26 | B2619: R1283/45 | C2619: Берци кожа чёрные Украина | D2619: 70.00 | E2619: usd | F2619: 1 | G2619: 1500.00 | H2619: 1.07 | I2619: 1050.00 | J2619: -350.00 | K2619: 5 | L2619: =RC[-3]/100*RC[-1] -> 1.07
A2620: 27 | B2620: H3501/L | C2620: Комплект термобілизни (100% полиэстер) чёрный ||KP-UN1-PO-01 | D2620: 13.71 | E2620: usd | F2620: 3 | G2620: 488.00 | H2620: 1.78 | I2620: 1024.80 | J2620: 202.20 | K2620: 5 | L2620: =RC[-3]/100*RC[-1] -> 1.78
A2621: 28 | B2621: H3501/M | C2621: Комплект термобілизни (100% полиэстер) чёрный ||KP-UN1-PO-01 | D2621: 13.71 | E2621: usd | F2621: 3 | G2621: 488.00 | H2621: 1.78 | I2621: 1024.80 | J2621: 202.20 | K2621: 5 | L2621: =RC[-3]/100*RC[-1] -> 1.78
A2622: 29 | B2622: H3501/S | C2622: Комплект термобілизни (100% полиэстер) чёрный ||KP-UN1-PO-01 | D2622: 13.71 | E2622: usd | F2622: 3 | G2622: 488.00 | H2622: 1.78 | I2622: 1024.80 | J2622: 202.20 | K2622: 5 | L2622: =RC[-3]/100*RC[-1] -> 1.78
A2623: 30 | B2623: H3501/XL | C2623: Комплект термобілизни (100% полиэстер) чёрный ||KP-UN1-PO-01 | D2623: 13.71 | E2623: usd | F2623: 2 | G2623: 488.00 | H2623: 1.78 | I2623: 683.20 | J2623: 134.80 | K2623: 5 | L2623: =RC[-3]/100*RC[-1] -> 1.78
A2624: 31 | B2624: H2016/L | C2624: Куртка LIBERTY флисовая чорн/олива 390г/м (superfine) ||BL-LIB-HF-16 | D2624: 28.04 | E2624: usd | F2624: 2 | G2624: 967.00 | H2624: 1.72 | I2624: 1353.80 | J2624: 232.40 | K2624: 5 | L2624: =RC[-3]/100*RC[-1] -> 1.72
A2625: 32 | B2625: H2016/M | C2625: Куртка LIBERTY флисовая чорн/олива 390г/м (superfine) ||BL-LIB-HF-16 | D2625: 28.04 | E2625: usd | F2625: 2 | G2625: 967.00 | H2625: 1.72 | I2625: 1353.80 | J2625: 232.40 | K2625: 5 | L2625: =RC[-3]/100*RC[-1] -> 1.72
A2626: 33 | B2626: _13846/40-42 | C2626: Носки серые высокие фінські | D2626: 20.00 | E2626: zl | F2626: 3 | G2626: 50.00 | H2626: 0.50 | I2626: 105.00 | J2626: -195.00 | K2626: 5 | L2626: =RC[-3]/100*RC[-1] -> 0.50
A2627: 34 | B2627: _13846/43 | C2627: Носки серые высокие фінські | D2627: 20.00 | E2627: zl | F2627: 4 | G2627: 50.00 | H2627: 0.50 | I2627: 140.00 | J2627: -260.00 | K2627: 5 | L2627: =RC[-3]/100*RC[-1] -> 0.50
A2628: 35 | B2628: _13846/44-45 | C2628: Носки серые высокие фінські | D2628: 20.00 | E2628: zl | F2628: 3 | G2628: 50.00 | H2628: 0.50 | I2628: 105.00 | J2628: -195.00 | K2628: 5 | L2628: =RC[-3]/100*RC[-1] -> 0.50
A2629: 36 | B2629: H8001/120 | C2629: Ремень HKN чёрный ||PS-HKN-CO-01 | D2629: 3.30 | E2629: usd | F2629: 2 | G2629: 148.00 | H2629: 2.24 | I2629: 207.20 | J2629: 75.20 | K2629: 5 | L2629: =RC[-3]/100*RC[-1] -> 2.24
A2630: 37 | B2630: H8001/130 | C2630: Ремень HKN чёрный ||PS-HKN-CO-01 | D2630: 3.30 | E2630: usd | F2630: 3 | G2630: 148.00 | H2630: 2.24 | I2630: 310.80 | J2630: 112.80 | K2630: 5 | L2630: =RC[-3]/100*RC[-1] -> 2.24
A2631: 38 | B2631: _MJ850 | C2631: Фонарик MAGIC SHINE MJ-850 | D2631: 68.69 | E2631: Инт | F2631: 1 | G2631: 1360.00 | H2631: 0.99 | I2631: 1088.00 | J2631: -285.87 | K2631: 5 | L2631: =RC[-3]/100*RC[-1] -> 0.99
A2632: 39 | B2632: _TK60 | C2632: Фонарь FENIX TK60 R5 | D2632: 120.00 | E2632: usd | F2632: 1 | G2632: 2685.00 | H2632: 1.12 | I2632: 1879.50 | J2632: -520.50 | K2632: 5 | L2632: =RC[-3]/100*RC[-1] -> 1.12
A2633: 40 | B2633: _TK35 | C2633: Фонарь FENIX ТК35 UE MT-G2 | D2633: 102.53 | E2633: usd | F2633: 2 | G2633: 2270.00 | H2633: 1.11 | I2633: 3178.00 | J2633: -923.20 | K2633: 5 | L2633: =RC[-3]/100*RC[-1] -> 1.11 | M2633: =SUM(R[-40]C[-1]:RC[-1]) -> 
A2635: #10062 (2014-10-30) Львів Назар Максимович - Прихід товару
A2636: N | B2636: арт | C2636: назва | D2636: закуп | F2636: к-ть | G2636: цiна | H2636: кф | I2636: продж | J2636: дохiд | K2636: % | L2636: з-та
A2637: 1 | B2637: _17804 | C2637: Револьвер под патрон Флобера SNIPE - 3" (г/м) | D2637: 170.35 | E2637: Инт | F2637: 2 | G2637: 2470.00 | H2637: 0.72 | I2637: 4940.00 | J2637: -1873.80 | K2637: 5 | L2637: =RC[-3]/100*RC[-1] -> 0.72
A2638: 2 | B2638: _18402 | C2638: Револьвер под патрон Флобера SNIPE - 3" (орех укр) | D2638: 166.28 | E2638: Инт | F2638: 1 | G2638: 2411.00 | H2638: 0.72 | I2638: 2411.00 | J2638: -914.52 | K2638: 5 | L2638: =RC[-3]/100*RC[-1] -> 0.72
A2639: 3 | B2639: _17805 | C2639: Револьвер под патрон Флобера SNIPE - 3" (орех чешский) | D2639: 175.45 | E2639: Инт | F2639: 1 | G2639: 2544.00 | H2639: 0.73 | I2639: 2544.00 | J2639: -964.96 | K2639: 5 | L2639: =RC[-3]/100*RC[-1] -> 0.73
A2640: 4 | B2640: _17803 | C2640: Револьвер под патрон Флобера SNIPE - 3" (пластик) | D2640: 157.17 | E2640: Инт | F2640: 2 | G2640: 2279.00 | H2640: 0.73 | I2640: 4558.00 | J2640: -1728.88 | K2640: 5 | L2640: =RC[-3]/100*RC[-1] -> 0.73
A2641: 5 | B2641: _17806 | C2641: Револьвер под патрон Флобера SNIPE - 4" (бук) | D2641: 166.28 | E2641: Инт | F2641: 1 | G2641: 2411.00 | H2641: 0.72 | I2641: 2411.00 | J2641: -914.52 | K2641: 5 | L2641: =RC[-3]/100*RC[-1] -> 0.72
A2642: 6 | B2642: _17808 | C2642: Револьвер под патрон Флобера SNIPE - 4" (г/м) | D2642: 175.45 | E2642: Инт | F2642: 2 | G2642: 2544.00 | H2642: 0.73 | I2642: 5088.00 | J2642: -1929.92 | K2642: 5 | L2642: =RC[-3]/100*RC[-1] -> 0.73
A2643: 7 | B2643: _18403 | C2643: Револьвер под патрон Флобера SNIPE - 4" (орех укр) | D2643: 171.38 | E2643: Инт | F2643: 1 | G2643: 2485.00 | H2643: 0.73 | I2643: 2485.00 | J2643: -942.58 | K2643: 5 | L2643: =RC[-3]/100*RC[-1] -> 0.73
A2644: 8 | B2644: _17809 | C2644: Револьвер под патрон Флобера SNIPE - 4" (орех чешский) | D2644: 180.48 | E2644: Инт | F2644: 1 | G2644: 2617.00 | H2644: 0.72 | I2644: 2617.00 | J2644: -992.66 | K2644: 5 | L2644: =RC[-3]/100*RC[-1] -> 0.72
A2645: 9 | B2645: _17807 | C2645: Револьвер под патрон Флобера SNIPE - 4" (пластик) | D2645: 162.21 | E2645: Инт | F2645: 2 | G2645: 2352.00 | H2645: 0.72 | I2645: 4704.00 | J2645: -1784.28 | K2645: 5 | L2645: =RC[-3]/100*RC[-1] -> 0.72
A2646: 10 | B2646: _17811 | C2646: Револьвер под патрон Флобера SNIPE - 6" (бук) | D2646: 182.48 | E2646: Инт | F2646: 1 | G2646: 2646.00 | H2646: 0.72 | I2646: 2646.00 | J2646: -1003.66 | K2646: 5 | L2646: =RC[-3]/100*RC[-1] -> 0.72
A2647: 11 | B2647: _17812 | C2647: Револьвер под патрон Флобера SNIPE - 6" (г/м) | D2647: 192.62 | E2647: Инт | F2647: 1 | G2647: 2793.00 | H2647: 0.72 | I2647: 2793.00 | J2647: -1059.42 | K2647: 5 | L2647: =RC[-3]/100*RC[-1] -> 0.72
A2648: 12 | B2648: _17813 | C2648: Револьвер под патрон Флобера SNIPE - 6" (орех) | D2648: 187.59 | E2648: Инт | F2648: 1 | G2648: 2720.00 | H2648: 0.73 | I2648: 2720.00 | J2648: -1031.72 | K2648: 5 | L2648: =RC[-3]/100*RC[-1] -> 0.73
A2649: 13 | B2649: _17810 | C2649: Револьвер под патрон Флобера SNIPE - 6" (пластик) | D2649: 177.45 | E2649: Инт | F2649: 1 | G2649: 2573.00 | H2649: 0.73 | I2649: 2573.00 | J2649: -975.96 | K2649: 5 | L2649: =RC[-3]/100*RC[-1] -> 0.73
A2650: 14 | B2650: _178131 | C2650: Револьвер под патрон Флобера SNIPE - 6" (чешский орех) | D2650: 196.69 | E2650: Инт | F2650: 1 | G2650: 2852.00 | H2650: 0.72 | I2650: 2852.00 | J2650: -1081.80 | K2650: 5 | L2650: =RC[-3]/100*RC[-1] -> 0.72 | M2650: =SUM(R[-14]C[-1]:RC[-1]) -> 
A2652: #10081 (2014-10-30) Львів Назар Максимович - Прихід товару
A2653: N | B2653: арт | C2653: назва | D2653: закуп | F2653: к-ть | G2653: цiна | H2653: кф | I2653: продж | J2653: дохiд | K2653: % | L2653: з-та
A2654: 1 | B2654: _429.00.00 | C2654: Масло Clever Ballistol 50мл. ружейное,в стекле | D2654: 3.08 | E2654: Инт | F2654: 5 | G2654: 44.70 | H2654: 0.72 | I2654: 223.50 | J2654: -84.78 | K2654: 5 | L2654: =RC[-3]/100*RC[-1] -> 0.72
A2655: 2 | B2655: _429.00.12 | C2655: Масло для чистки BALLISTOL Gunex-2000 400мл спрей | D2655: 13.93 | E2655: Инт | F2655: 5 | G2655: 202.00 | H2655: 0.73 | I2655: 1010.00 | J2655: -383.10 | K2655: 5 | L2655: =RC[-3]/100*RC[-1] -> 0.73
A2656: 3 | B2656: _429.00.10 | C2656: Масло для чистки BALLISTOL Gunex-2000 50мл. спрей | D2656: 4.41 | E2656: Инт | F2656: 10 | G2656: 64.00 | H2656: 0.73 | I2656: 640.00 | J2656: -242.76 | K2656: 5 | L2656: =RC[-3]/100*RC[-1] -> 0.73
A2657: 4 | B2657: _429.00.03 | C2657: Масло для чистки Clever BALLISTOL 100мл спрей | D2657: 5.45 | E2657: Инт | F2657: 20 | G2657: 79.00 | H2657: 0.72 | I2657: 1580.00 | J2657: -599.31 | K2657: 5 | L2657: =RC[-3]/100*RC[-1] -> 0.72
A2658: 5 | B2658: _429.00.04 | C2658: Масло для чистки Clever BALLISTOL 200мл спрей | D2658: 7.31 | E2658: Инт | F2658: 10 | G2658: 106.00 | H2658: 0.73 | I2658: 1060.00 | J2658: -402.00 | K2658: 5 | L2658: =RC[-3]/100*RC[-1] -> 0.73
A2659: 6 | B2659: _429.00.02 | C2659: Масло для чистки Clever BALLISTOL 50мл спрей | D2659: 3.66 | E2659: Инт | F2659: 20 | G2659: 53.00 | H2659: 0.73 | I2659: 1060.00 | J2659: -402.07 | K2659: 5 | L2659: =RC[-3]/100*RC[-1] -> 0.73
A2660: 7 | B2660: _429.00.11 | C2660: Масло для чистки Clever BALLISTOL Gunex-2000 200мл. спрей | D2660: 8.55 | E2660: Инт | F2660: 5 | G2660: 124.00 | H2660: 0.73 | I2660: 620.00 | J2660: -235.17 | K2660: 5 | L2660: =RC[-3]/100*RC[-1] -> 0.73
A2661: 8 | B2661: _204.63.31 | C2661: Нож OPINEL 10VRN | D2661: 7.20 | E2661: euro | F2661: 5 | G2661: 149.00 | H2661: 0.83 | I2661: 745.00 | J2661: -155.00 | K2661: 5 | L2661: =RC[-3]/100*RC[-1] -> 0.83
A2662: 9 | B2662: _204.63.32 | C2662: Нож OPINEL 12VRN | D2662: 9.50 | E2662: euro | F2662: 2 | G2662: 196.00 | H2662: 0.83 | I2662: 392.00 | J2662: -83.00 | K2662: 5 | L2662: =RC[-3]/100*RC[-1] -> 0.83
A2663: 10 | B2663: _204.78.35 | C2663: Нож OPINEL 7VRI | D2663: 6.00 | E2663: euro | F2663: 2 | G2663: 123.00 | H2663: 0.82 | I2663: 246.00 | J2663: -54.00 | K2663: 5 | L2663: =RC[-3]/100*RC[-1] -> 0.82
A2664: 11 | B2664: _204.78.55 | C2664: Нож OPINEL 7VRI блистер | D2664: 6.60 | E2664: euro | F2664: 3 | G2664: 136.00 | H2664: 0.82 | I2664: 408.00 | J2664: -87.00 | K2664: 5 | L2664: =RC[-3]/100*RC[-1] -> 0.82
A2665: 12 | B2665: _204.78.61 | C2665: Нож OPINEL 7VRI голубой | D2665: 6.50 | E2665: euro | F2665: 2 | G2665: 134.00 | H2665: 0.82 | I2665: 268.00 | J2665: -57.00 | K2665: 5 | L2665: =RC[-3]/100*RC[-1] -> 0.82
A2666: 13 | B2666: _204.78.62 | C2666: Нож OPINEL 7VRI светло-зелёный | D2666: 6.50 | E2666: euro | F2666: 2 | G2666: 134.00 | H2666: 0.82 | I2666: 268.00 | J2666: -57.00 | K2666: 5 | L2666: =RC[-3]/100*RC[-1] -> 0.82
A2667: 14 | B2667: _204.00.10 | C2667: Нож OPINEL 8VRI | D2667: 6.00 | E2667: euro | F2667: 7 | G2667: 124.00 | H2667: 0.83 | I2667: 868.00 | J2667: -182.00 | K2667: 5 | L2667: =RC[-3]/100*RC[-1] -> 0.83
A2668: 15 | B2668: _204.78.54 | C2668: Нож OPINEL 8VRI Trekking | D2668: 7.00 | E2668: euro | F2668: 3 | G2668: 145.00 | H2668: 0.83 | I2668: 435.00 | J2668: -90.00 | K2668: 5 | L2668: =RC[-3]/100*RC[-1] -> 0.83
A2669: 16 | B2669: _204.78.66 | C2669: Нож OPINEL 8VRI красный | D2669: 6.70 | E2669: euro | F2669: 3 | G2669: 136.00 | H2669: 0.81 | I2669: 408.00 | J2669: -94.50 | K2669: 5 | L2669: =RC[-3]/100*RC[-1] -> 0.81
A2670: 17 | B2670: _204.78.65 | C2670: Нож OPINEL 8VRI синий | D2670: 6.70 | E2670: euro | F2670: 3 | G2670: 138.00 | H2670: 0.82 | I2670: 414.00 | J2670: -88.50 | K2670: 5 | L2670: =RC[-3]/100*RC[-1] -> 0.82
A2671: 18 | B2671: _204.78.00 | C2671: Нож OPINEL Effilts 10cm oliv | D2671: 15.00 | E2671: euro | F2671: 2 | G2671: 310.00 | H2671: 0.83 | I2671: 620.00 | J2671: -130.00 | K2671: 5 | L2671: =RC[-3]/100*RC[-1] -> 0.83
A2672: 19 | B2672: _204.68.26 | C2672: Нож OPINEL Effits 15cm bubinga | D2672: 16.00 | E2672: euro | F2672: 2 | G2672: 330.00 | H2672: 0.83 | I2672: 660.00 | J2672: -140.00 | K2672: 5 | L2672: =RC[-3]/100*RC[-1] -> 0.83
A2673: 20 | B2673: _5.0747 | C2673: Нож WALTHER PPQ Tanto, 440 SS | D2673: 19.57 | E2673: euro | F2673: 2 | G2673: 362.00 | H2673: 0.74 | I2673: 724.00 | J2673: -254.50 | K2673: 5 | L2673: =RC[-3]/100*RC[-1] -> 0.74
A2674: 21 | B2674: _5.0715 | C2674: Нож WALTHER Black Tac | D2674: 20.70 | E2674: euro | F2674: 3 | G2674: 383.00 | H2674: 0.74 | I2674: 1149.00 | J2674: -403.50 | K2674: 5 | L2674: =RC[-3]/100*RC[-1] -> 0.74
A2675: 22 | B2675: _5.0716 | C2675: Нож WALTHER Black Tack Tanto | D2675: 20.65 | E2675: euro | F2675: 3 | G2675: 382.00 | H2675: 0.74 | I2675: 1146.00 | J2675: -402.65 | K2675: 5 | L2675: =RC[-3]/100*RC[-1] -> 0.74
A2676: 23 | B2676: _5.074 | C2676: Нож WALTHER Black Tack Tanto Flat Dark Earth | D2676: 20.65 | E2676: euro | F2676: 2 | G2676: 382.00 | H2676: 0.74 | I2676: 764.00 | J2676: -268.43 | K2676: 5 | L2676: =RC[-3]/100*RC[-1] -> 0.74
A2677: 24 | B2677: _5.0728 | C2677: Нож WALTHER ERC black, 440 SS | D2677: 20.70 | E2677: euro | F2677: 2 | G2677: 383.00 | H2677: 0.74 | I2677: 766.00 | J2677: -269.14 | K2677: 5 | L2677: =RC[-3]/100*RC[-1] -> 0.74
A2678: 25 | B2678: _5.0729 | C2678: Нож WALTHER ERC blackyellow, 440 SS | D2678: 20.70 | E2678: euro | F2678: 2 | G2678: 383.00 | H2678: 0.74 | I2678: 766.00 | J2678: -269.14 | K2678: 5 | L2678: =RC[-3]/100*RC[-1] -> 0.74
A2679: 26 | B2679: _5.0908 | C2679: Нож WALTHER Elite Force EF104, SS | D2679: 9.19 | E2679: euro | F2679: 3 | G2679: 170.00 | H2679: 0.74 | I2679: 510.00 | J2679: -179.19 | K2679: 5 | L2679: =RC[-3]/100*RC[-1] -> 0.74
A2680: 27 | B2680: _5.0749 | C2680: Нож WALTHER P99, 440 SS | D2680: 20.70 | E2680: euro | F2680: 3 | G2680: 383.00 | H2680: 0.74 | I2680: 1149.00 | J2680: -403.70 | K2680: 5 | L2680: =RC[-3]/100*RC[-1] -> 0.74
A2681: 28 | B2681: _5.0746 | C2681: Нож WALTHER PPQ, 440 SS | D2681: 19.57 | E2681: euro | F2681: 2 | G2681: 362.00 | H2681: 0.74 | I2681: 724.00 | J2681: -254.38 | K2681: 5 | L2681: =RC[-3]/100*RC[-1] -> 0.74
A2682: 29 | B2682: _5.0719 | C2682: Нож WALTHER SUB Companion Knife | D2682: 14.97 | E2682: euro | F2682: 2 | G2682: 277.00 | H2682: 0.74 | I2682: 554.00 | J2682: -194.65 | K2682: 5 | L2682: =RC[-3]/100*RC[-1] -> 0.74
A2683: 30 | B2683: _5.0717 | C2683: Нож WALTHER Silver Tack | D2683: 19.05 | E2683: euro | F2683: 2 | G2683: 383.00 | H2683: 0.80 | I2683: 766.00 | J2683: -186.50 | K2683: 5 | L2683: =RC[-3]/100*RC[-1] -> 0.80
A2684: 31 | B2684: _5.0753 | C2684: Нож WALTHER Silver Tack XL | D2684: 20.70 | E2684: euro | F2684: 2 | G2684: 383.00 | H2684: 0.74 | I2684: 766.00 | J2684: -269.14 | K2684: 5 | L2684: =RC[-3]/100*RC[-1] -> 0.74
A2685: 32 | B2685: _5.814 | C2685: Пістолет пневматичний Legends C96 | D2685: 91.21 | E2685: Инт | F2685: 1 | G2685: 1277.00 | H2685: 0.70 | I2685: 1277.00 | J2685: -547.20 | K2685: 5 | L2685: =RC[-3]/100*RC[-1] -> 0.70 | M2685: =SUM(R[-32]C[-1]:RC[-1]) -> 
A2687: #10086 (2014-10-30) Львів Назар Максимович - Прихід товару
A2688: N | B2688: арт | C2688: назва | D2688: закуп | F2688: к-ть | G2688: цiна | H2688: кф | I2688: продж | J2688: дохiд | K2688: % | L2688: з-та
A2689: 1 | B2689: _92BK | C2689: Mеч тренировочный Cold Steel Bokken | D2689: 57.29 | E2689: Инт | F2689: 2 | G2689: 487.00 | H2689: 0.43 | I2689: 974.00 | J2689: -1317.60 | K2689: 5 | L2689: =RC[-3]/100*RC[-1] -> 0.43
A2690: 2 | B2690: _210CV | C2690: Винтовка пневматическая CROSMAN Nitro Venom + 3-9x32 | D2690: 216.50 | E2690: Инт | F2690: 1 | G2690: 3031.00 | H2690: 0.70 | I2690: 3031.00 | J2690: -1299.00 | K2690: 5 | L2690: =RC[-3]/100*RC[-1] -> 0.70
A2691: 3 | B2691: _210CVD | C2691: Винтовка пневматическая CROSMAN Nitro Venom Dusk | D2691: 205.07 | E2691: Инт | F2691: 1 | G2691: 2871.00 | H2691: 0.70 | I2691: 2871.00 | J2691: -1230.42 | K2691: 5 | L2691: =RC[-3]/100*RC[-1] -> 0.70
A2692: 4 | B2692: _X-125 | C2692: Винтовка пневматическая HATSAN-125 | D2692: 170.86 | E2692: Инт | F2692: 2 | G2692: 2392.00 | H2692: 0.70 | I2692: 4784.00 | J2692: -2050.28 | K2692: 5 | L2692: =RC[-3]/100*RC[-1] -> 0.70
A2693: 5 | B2693: _X-125S | C2693: Винтовка пневматическая HATSAN-125 Sniper | D2693: 250.71 | E2693: Инт | F2693: 1 | G2693: 3510.00 | H2693: 0.70 | I2693: 3510.00 | J2693: -1504.28 | K2693: 5 | L2693: =RC[-3]/100*RC[-1] -> 0.70
A2694: 6 | B2694: _X-125TH | C2694: Винтовка пневматическая HATSAN-125TH | D2694: 170.86 | E2694: Инт | F2694: 2 | G2694: 2392.00 | H2694: 0.70 | I2694: 4784.00 | J2694: -2050.28 | K2694: 5 | L2694: =RC[-3]/100*RC[-1] -> 0.70
A2695: 7 | B2695: _X-125THV | C2695: Винтовка пневматическая HATSAN-125TH Vortex | D2695: 216.50 | E2695: Инт | F2695: 1 | G2695: 3031.00 | H2695: 0.70 | I2695: 3031.00 | J2695: -1299.00 | K2695: 5 | L2695: =RC[-3]/100*RC[-1] -> 0.70
A2696: 8 | B2696: _91SPB | C2696: Маркер COLD STEEL Pocket Shark | D2696: 6.20 | E2696: Инт | F2696: 5 | G2696: 99.00 | H2696: 0.80 | I2696: 495.00 | J2696: -125.00 | K2696: 5 | L2696: =RC[-3]/100*RC[-1] -> 0.80
A2697: 9 | B2697: _97BAM18S | C2697: Мачете COLD STEEL Barong Machete 18" | D2697: 27.00 | E2697: Инт | F2697: 2 | G2697: 430.00 | H2697: 0.80 | I2697: 860.00 | J2697: -220.00 | K2697: 5 | L2697: =RC[-3]/100*RC[-1] -> 0.80
A2698: 10 | B2698: _97JMS | C2698: Мачете COLD STEEL Jungle с чехлом | D2698: 31.00 | E2698: Инт | F2698: 2 | G2698: 495.00 | H2698: 0.80 | I2698: 990.00 | J2698: -250.00 | K2698: 5 | L2698: =RC[-3]/100*RC[-1] -> 0.80
A2699: 11 | B2699: _97KMS | C2699: Мачете COLD STEEL Kukri Machete | D2699: 22.50 | E2699: Инт | F2699: 5 | G2699: 358.00 | H2699: 0.80 | I2699: 1790.00 | J2699: -460.00 | K2699: 5 | L2699: =RC[-3]/100*RC[-1] -> 0.80
A2700: 12 | B2700: _97MKM | C2700: Мачете COLD STEEL Magnum Kukri Machete | D2700: 26.00 | E2700: Инт | F2700: 4 | G2700: 415.00 | H2700: 0.80 | I2700: 1660.00 | J2700: -420.00 | K2700: 5 | L2700: =RC[-3]/100*RC[-1] -> 0.80
A2701: 13 | B2701: _97PM | C2701: Мачете COLD STEEL Panga | D2701: 15.50 | E2701: Инт | F2701: 4 | G2701: 248.00 | H2701: 0.80 | I2701: 992.00 | J2701: -248.00 | K2701: 5 | L2701: =RC[-3]/100*RC[-1] -> 0.80
A2702: 14 | B2702: _97AM18 | C2702: Мачете COLD STEELL Latin-18 | D2702: 14.50 | E2702: Инт | F2702: 5 | G2702: 232.00 | H2702: 0.80 | I2702: 1160.00 | J2702: -290.00 | K2702: 5 | L2702: =RC[-3]/100*RC[-1] -> 0.80
A2703: 15 | B2703: _97AM24 | C2703: Мачете COLD STEELL Latin-24 | D2703: 17.50 | E2703: Инт | F2703: 5 | G2703: 280.00 | H2703: 0.80 | I2703: 1400.00 | J2703: -350.00 | K2703: 5 | L2703: =RC[-3]/100*RC[-1] -> 0.80
A2704: 16 | B2704: _92FBA | C2704: Нож COLD STEEL Boot Blade FGX | D2704: 13.50 | E2704: Инт | F2704: 3 | G2704: 215.00 | H2704: 0.80 | I2704: 645.00 | J2704: -165.00 | K2704: 5 | L2704: =RC[-3]/100*RC[-1] -> 0.80
A2705: 17 | B2705: _92FBB | C2705: Нож COLD STEEL Boot Blade II FGX | D2705: 10.00 | E2705: Инт | F2705: 3 | G2705: 160.00 | H2705: 0.80 | I2705: 480.00 | J2705: -120.00 | K2705: 5 | L2705: =RC[-3]/100*RC[-1] -> 0.80
A2706: 18 | B2706: _92DD | C2706: Нож COLD STEEL Delta Dart FGX | D2706: 4.80 | E2706: Инт | F2706: 10 | G2706: 77.00 | H2706: 0.80 | I2706: 770.00 | J2706: -190.00 | K2706: 5 | L2706: =RC[-3]/100*RC[-1] -> 0.80
A2707: 19 | B2707: _20PC | C2707: Нож COLD STEEL Finn Bear | D2707: 14.00 | E2707: Инт | F2707: 5 | G2707: 224.00 | H2707: 0.80 | I2707: 1120.00 | J2707: -280.00 | K2707: 5 | L2707: =RC[-3]/100*RC[-1] -> 0.80
A2708: 20 | B2708: _20K | C2708: Нож COLD STEEL Kudu | D2708: 7.60 | E2708: Инт | F2708: 5 | G2708: 121.00 | H2708: 0.80 | I2708: 605.00 | J2708: -155.00 | K2708: 5 | L2708: =RC[-3]/100*RC[-1] -> 0.80
A2709: 21 | B2709: _95FB | C2709: Нож COLD STEEL Pocket Bushman | D2709: 31.50 | E2709: Инт | F2709: 2 | G2709: 502.00 | H2709: 0.80 | I2709: 1004.00 | J2709: -256.00 | K2709: 5 | L2709: =RC[-3]/100*RC[-1] -> 0.80
A2710: 22 | B2710: _92FPA | C2710: Нож COLD STEEL Push Blade I FGX | D2710: 13.50 | E2710: Инт | F2710: 3 | G2710: 215.00 | H2710: 0.80 | I2710: 645.00 | J2710: -165.00 | K2710: 5 | L2710: =RC[-3]/100*RC[-1] -> 0.80
A2711: 23 | B2711: _92FPB | C2711: Нож COLD STEEL Push Blade II FGX | D2711: 11.00 | E2711: Инт | F2711: 3 | G2711: 168.00 | H2711: 0.76 | I2711: 504.00 | J2711: -156.00 | K2711: 5 | L2711: =RC[-3]/100*RC[-1] -> 0.76
A2712: 24 | B2712: _20RBC | C2712: Нож COLD STEEL Roach Belly | D2712: 14.00 | E2712: Инт | F2712: 5 | G2712: 223.00 | H2712: 0.80 | I2712: 1115.00 | J2712: -285.00 | K2712: 5 | L2712: =RC[-3]/100*RC[-1] -> 0.80
A2713: 25 | B2713: _26SP | C2713: Нож COLD STEEL Ti-Lite 4" Zytel | D2713: 56.00 | E2713: Инт | F2713: 1 | G2713: 894.00 | H2713: 0.80 | I2713: 894.00 | J2713: -226.00 | K2713: 5 | L2713: =RC[-3]/100*RC[-1] -> 0.80
A2714: 26 | B2714: _29TLC | C2714: Нож COLD STEEL Voyager LG. CLP PT Plain | D2714: 52.00 | E2714: Инт | F2714: 1 | G2714: 830.00 | H2714: 0.80 | I2714: 830.00 | J2714: -210.00 | K2714: 5 | L2714: =RC[-3]/100*RC[-1] -> 0.80
A2715: 27 | B2715: _29TLT | C2715: Нож COLD STEEL Voyager LG. Tanto Plain | D2715: 52.00 | E2715: Инт | F2715: 1 | G2715: 830.00 | H2715: 0.80 | I2715: 830.00 | J2715: -210.00 | K2715: 5 | L2715: =RC[-3]/100*RC[-1] -> 0.80
A2716: 28 | B2716: _29TMC | C2716: Нож COLD STEEL Voyager Med. CLP PT Plain Edge | D2716: 45.00 | E2716: Инт | F2716: 1 | G2716: 717.00 | H2716: 0.80 | I2716: 717.00 | J2716: -183.00 | K2716: 5 | L2716: =RC[-3]/100*RC[-1] -> 0.80
A2717: 29 | B2717: _3410 | C2717: Нож KERSHAW Chill (8CR13MOV, plain) | D2717: 28.00 | E2717: Инт | F2717: 1 | G2717: 387.00 | H2717: 0.69 | I2717: 387.00 | J2717: -173.00 | K2717: 5 | L2717: =RC[-3]/100*RC[-1] -> 0.69
A2718: 30 | B2718: _3650 | C2718: Нож KERSHAW Volt II Serr (8CR13MOV) | D2718: 42.00 | E2718: Инт | F2718: 1 | G2718: 592.00 | H2718: 0.70 | I2718: 592.00 | J2718: -248.00 | K2718: 5 | L2718: =RC[-3]/100*RC[-1] -> 0.70
A2719: 31 | B2719: _BY03P2 | C2719: Нож SPYDERCO Byrd Cara Cara 2 | D2719: 25.50 | E2719: Инт | F2719: 2 | G2719: 407.00 | H2719: 0.80 | I2719: 814.00 | J2719: -206.00 | K2719: 5 | L2719: =RC[-3]/100*RC[-1] -> 0.80
A2720: 32 | B2720: _BY03PS2 | C2720: Нож SPYDERCO Byrd Cara Cara 2, сталева ручка, півсеррейтор | D2720: 25.50 | E2720: Инт | F2720: 2 | G2720: 407.00 | H2720: 0.80 | I2720: 814.00 | J2720: -206.00 | K2720: 5 | L2720: =RC[-3]/100*RC[-1] -> 0.80
A2721: 33 | B2721: _10FPGR | C2721: Нож SPYDERCO Endura Green | D2721: 67.00 | E2721: Инт | F2721: 1 | G2721: 1069.00 | H2721: 0.80 | I2721: 1069.00 | J2721: -271.00 | K2721: 5 | L2721: =RC[-3]/100*RC[-1] -> 0.80
A2722: 34 | B2722: _10FPGY | C2722: Нож SPYDERCO Endura Grey | D2722: 67.00 | E2722: Инт | F2722: 1 | G2722: 1085.00 | H2722: 0.81 | I2722: 1085.00 | J2722: -255.00 | K2722: 5 | L2722: =RC[-3]/100*RC[-1] -> 0.81
A2723: 35 | B2723: _81GPCMO2 | C2723: Нож SPYDERCO Para-Military 2, Camo G-10 | D2723: 119.00 | E2723: usd | F2723: 1 | G2723: 1899.00 | H2723: 0.80 | I2723: 1899.00 | J2723: -481.00 | K2723: 5 | L2723: =RC[-3]/100*RC[-1] -> 0.80
A2724: 36 | B2724: _122GP | C2724: Нож SPYDERCO Tenacious | D2724: 41.50 | E2724: Инт | F2724: 3 | G2724: 662.00 | H2724: 0.80 | I2724: 1986.00 | J2724: -504.00 | K2724: 5 | L2724: =RC[-3]/100*RC[-1] -> 0.80
A2725: 37 | B2725: _PC77B | C2725: Пістолет CROSMAN PC77B | D2725: 62.71 | E2725: Инт | F2725: 1 | G2725: 878.00 | H2725: 0.70 | I2725: 878.00 | J2725: -376.29 | K2725: 5 | L2725: =RC[-3]/100*RC[-1] -> 0.70
A2726: 38 | B2726: _221-2300 | C2726: Винтовка пневматическая CROSMAN Comrade АК | D2726: 96.86 | E2726: Инт | F2726: 2 | G2726: 1356.00 | H2726: 0.70 | I2726: 2712.00 | J2726: -1162.40 | K2726: 5 | L2726: =RC[-3]/100*RC[-1] -> 0.70
A2727: 39 | B2727: _1429.00.31 | C2727: Рогатка Marksman Folding Slingshot складная с магнитным кожетком [3055] | D2727: 9.24 | E2727: Инт | F2727: 3 | G2727: 134.00 | H2727: 0.72 | I2727: 402.00 | J2727: -152.48 | K2727: 5 | L2727: =RC[-3]/100*RC[-1] -> 0.72
A2728: 40 | B2728: _90FH | C2728: Топор COLD STEEL Frontier Hawk | D2728: 33.50 | E2728: Инт | F2728: 1 | G2728: 535.00 | H2728: 0.80 | I2728: 535.00 | J2728: -135.00 | K2728: 5 | L2728: =RC[-3]/100*RC[-1] -> 0.80
A2729: 41 | B2729: _90PHH | C2729: Топор COLD STEEL Pipe Haw | D2729: 39.00 | E2729: Инт | F2729: 2 | G2729: 622.00 | H2729: 0.80 | I2729: 1244.00 | J2729: -316.00 | K2729: 5 | L2729: =RC[-3]/100*RC[-1] -> 0.80
A2730: 42 | B2730: _2000SH | C2730: Шарики BB KWC - 2000шт. в "гранате" оцинкованные | D2730: 6.27 | E2730: Инт | F2730: 10 | G2730: 69.00 | H2730: 0.55 | I2730: 690.00 | J2730: -564.55 | K2730: 5 | L2730: =RC[-3]/100*RC[-1] -> 0.55 | M2730: =SUM(R[-42]C[-1]:RC[-1]) -> 
A2732: #10091 (2014-10-30) Львів Назар Максимович - Клієнт повернув
A2733: N | B2733: арт | C2733: назва | D2733: закуп | F2733: к-ть | G2733: цiна | H2733: кф | I2733: продж | J2733: дохiд | K2733: % | L2733: з-та
A2734: 1 | B2734: H7601N | C2734: Балаклава чёрная с 1-м отв.(ComfortDry) ||CZ-KO2-FG-01 | D2734: 5.66 | E2734: usd | F2734: 4 | G2734: 211.00 | H2734: 1.86 | I2734: 590.80 | J2734: 138.00 | K2734: 5 | L2734: =RC[-3]/100*RC[-1] -> 1.86 | M2734: =SUM(R[-1]C[-1]:RC[-1]) -> 
A2736: #10093 (2014-10-30) Львів Назар Максимович - Відправлено-Продано
A2737: N | B2737: арт | C2737: назва | D2737: закуп | F2737: к-ть | G2737: цiна | H2737: кф | I2737: продж | J2737: дохiд | K2737: % | L2737: з-та
A2738: 1 | B2738: K104707/LR | C2738: Комплект формы марпат ACU китель, штаны, кепка (R/S) ||KP-ACU-PR-07 | D2738: 14.00 | E2738: usd | F2738: 5 | G2738: 650.00 | H2738: 2.32 | I2738: 2275.00 | J2738: 875.00 | K2738: 5 | L2738: =RC[-3]/100*RC[-1] -> 2.32
A2739: 2 | B2739: K104707/MR | C2739: Комплект формы марпат ACU китель, штаны, кепка (R/S) ||KP-ACU-PR-07 | D2739: 14.00 | E2739: usd | F2739: 5 | G2739: 650.00 | H2739: 2.32 | I2739: 2275.00 | J2739: 875.00 | K2739: 5 | L2739: =RC[-3]/100*RC[-1] -> 2.32 | M2739: =SUM(R[-2]C[-1]:RC[-1]) -> 
A2741: #10124 (2014-10-31) Львів Назар Максимович - Відправлено-Продано
A2742: N | B2742: арт | C2742: назва | D2742: закуп | F2742: к-ть | G2742: цiна | H2742: кф | I2742: продж | J2742: дохiд | K2742: % | L2742: з-та
A2743: 1 | B2743: R1284/42 | C2743: Берци кожа чёрные утепленные Украина | D2743: 70.00 | E2743: usd | F2743: 1 | G2743: 1500.00 | H2743: 1.07 | I2743: 1275.00 | J2743: -125.00 | K2743: 5 | L2743: =RC[-3]/100*RC[-1] -> 1.07
A2744: 2 | B2744: K104707/SR | C2744: Комплект формы марпат ACU китель, штаны, кепка (R/S) ||KP-ACU-PR-07 | D2744: 14.00 | E2744: usd | F2744: 1 | G2744: 650.00 | H2744: 2.32 | I2744: 455.00 | J2744: 175.00 | K2744: 5 | L2744: =RC[-3]/100*RC[-1] -> 2.32
A2745: 3 | B2745: L0004 | C2745: Кресало FS9.5*101 | D2745: 8.65 | E2745: Инт | F2745: 4 | G2745: 105.00 | H2745: 0.61 | I2745: 357.00 | J2745: -335.00 | K2745: 5 | L2745: =RC[-3]/100*RC[-1] -> 0.61
A2746: 4 | B2746: _01044 | C2746: Прицел оптический YUKON Craft 1.5-6х42 | D2746: 2776.00 | E2746: грн | F2746: 1 | G2746: 3925.00 | H2746: 1.41 | I2746: 3336.25 | J2746: 560.25 | K2746: 5 | L2746: =RC[-3]/100*RC[-1] -> 1.41
A2747: 5 | B2747: _1568.06.06 | C2747: Точило LANSKY Deluxe Diamond Sharpening System | D2747: 91.00 | E2747: usd | F2747: 1 | G2747: 1194.00 | H2747: 0.66 | I2747: 955.20 | J2747: -864.80 | K2747: 5 | L2747: =RC[-3]/100*RC[-1] -> 0.66 | M2747: =SUM(R[-5]C[-1]:RC[-1]) -> 
A2749: #10186 (2014-11-03) Львів Назар Максимович - Відправлено-Продано
A2750: N | B2750: арт | C2750: назва | D2750: закуп | F2750: к-ть | G2750: цiна | H2750: кф | I2750: продж | J2750: дохiд | K2750: % | L2750: з-та
A2751: 1 | B2751: H2202/S | C2751: Куртка GUNFIGHTER олива ||KU-GUN-FM-02 | D2751: 50.89 | E2751: usd | F2751: 1 | G2751: 1756.00 | H2751: 1.73 | I2751: 1229.20 | J2751: 211.40 | K2751: 5 | L2751: =RC[-3]/100*RC[-1] -> 1.73 | M2751: =SUM(R[-1]C[-1]:RC[-1]) -> 
A2753: #10250 (2014-11-05) Львів Назар Максимович - Відправлено-Продано
A2754: N | B2754: арт | C2754: назва | D2754: закуп | F2754: к-ть | G2754: цiна | H2754: кф | I2754: продж | J2754: дохiд | K2754: % | L2754: з-та
A2755: 1 | B2755: H2014/L | C2755: Куртка LIBERTY флисовая мультикам 390г/м (superfine) ||BL-LIB-HF-14 | D2755: 31.00 | E2755: usd | F2755: 1 | G2755: 1074.00 | H2755: 1.73 | I2755: 751.80 | J2755: 131.80 | K2755: 5 | L2755: =RC[-3]/100*RC[-1] -> 1.73
A2756: 2 | B2756: H2014/M | C2756: Куртка LIBERTY флисовая мультикам 390г/м (superfine) ||BL-LIB-HF-14 | D2756: 31.00 | E2756: usd | F2756: 1 | G2756: 1074.00 | H2756: 1.73 | I2756: 751.80 | J2756: 131.80 | K2756: 5 | L2756: =RC[-3]/100*RC[-1] -> 1.73
A2757: 3 | B2757: H5914/LR | C2757: CPU штаны мультикамо (PolyCotton) ||SP-CPU-PR-14 | D2757: 21.56 | E2757: usd | F2757: 2 | G2757: 740.00 | H2757: 1.72 | I2757: 1036.00 | J2757: 173.60 | K2757: 5 | L2757: =RC[-3]/100*RC[-1] -> 1.72
A2758: 4 | B2758: H5914/MR | C2758: CPU штаны мультикамо (PolyCotton) ||SP-CPU-PR-14 | D2758: 21.56 | E2758: usd | F2758: 2 | G2758: 740.00 | H2758: 1.72 | I2758: 1036.00 | J2758: 173.60 | K2758: 5 | L2758: =RC[-3]/100*RC[-1] -> 1.72
A2759: 5 | B2759: H5914/SR | C2759: CPU штаны мультикамо (PolyCotton) ||SP-CPU-PR-14 | D2759: 21.56 | E2759: usd | F2759: 2 | G2759: 740.00 | H2759: 1.72 | I2759: 1036.00 | J2759: 173.60 | K2759: 5 | L2759: =RC[-3]/100*RC[-1] -> 1.72
A2760: 6 | B2760: H23011/L | C2760: Куртка CLASSIC ARMY (флис-кордура) чёрная ||BL-CAF-FM-01 | D2760: 37.52 | E2760: usd | F2760: 1 | G2760: 1294.00 | H2760: 1.72 | I2760: 905.80 | J2760: 155.40 | K2760: 5 | L2760: =RC[-3]/100*RC[-1] -> 1.72 | M2760: =SUM(R[-6]C[-1]:RC[-1]) -> 
A2762: #10262 (2014-11-05) Львів Назар Максимович - Відправлено-Продано
A2763: N | B2763: арт | C2763: назва | D2763: закуп | F2763: к-ть | G2763: цiна | H2763: кф | I2763: продж | J2763: дохiд | K2763: % | L2763: з-та
A2764: 1 | B2764: H5914/LR | C2764: CPU штаны мультикамо (PolyCotton) ||SP-CPU-PR-14 | D2764: 21.56 | E2764: usd | F2764: 1 | G2764: 740.00 | H2764: 1.72 | I2764: 518.00 | J2764: 86.80 | K2764: 5 | L2764: =RC[-3]/100*RC[-1] -> 1.72
A2765: 2 | B2765: H4304/XLR | C2765: US SFU штаны польский вудлэнд (PolyCotton) ||SP-SFU-PR-04 | D2765: 14.49 | E2765: usd | F2765: 1 | G2765: 500.00 | H2765: 1.73 | I2765: 350.00 | J2765: 60.20 | K2765: 5 | L2765: =RC[-3]/100*RC[-1] -> 1.73
A2766: 3 | B2766: H4199/ML | C2766: US SFU штаны укр.-цифра (PolyCotton) ||SP-SFU-PR-99 | D2766: 15.44 | E2766: usd | F2766: 1 | G2766: 533.00 | H2766: 1.73 | I2766: 373.10 | J2766: 64.30 | K2766: 5 | L2766: =RC[-3]/100*RC[-1] -> 1.73
A2767: 4 | B2767: X401 | C2767: Балаклава чёрная с 1-м отв.(100%хлопок) ||X7601 | D2767: 3.15 | E2767: Инт | F2767: 4 | G2767: 65.00 | H2767: 1.03 | I2767: 182.00 | J2767: -70.00 | K2767: 5 | L2767: =RC[-3]/100*RC[-1] -> 1.03
A2768: 5 | B2768: H7514 | C2768: Блайзер мультикам (Polycotton) ||CZ-BBC-PR-14 | D2768: 4.31 | E2768: usd | F2768: 1 | G2768: 149.00 | H2768: 1.73 | I2768: 104.30 | J2768: 18.10 | K2768: 5 | L2768: =RC[-3]/100*RC[-1] -> 1.73
A2769: 6 | B2769: H65031/L | C2769: Куртка М65 с отстегивающейся курткой вудлэнд (NYCO) ||KU-M65-NY-03 | D2769: 37.22 | E2769: usd | F2769: 1 | G2769: 1324.00 | H2769: 1.78 | I2769: 926.80 | J2769: 182.40 | K2769: 5 | L2769: =RC[-3]/100*RC[-1] -> 1.78
A2770: 7 | B2770: _10181/XL | C2770: Куртка-аляска US N3B длинная олива ||10181001/905 | D2770: 34.50 | E2770: euro | F2770: 1 | G2770: 1078.00 | H2770: 1.25 | I2770: 754.60 | J2770: -107.90 | K2770: 5 | L2770: =RC[-3]/100*RC[-1] -> 1.25
A2771: 8 | B2771: H0500/UA | C2771: Ліпучка Флаг України резина ||OD-FUA-RB-26 | D2771: 2.92 | E2771: usd | F2771: 2 | G2771: 89.00 | H2771: 1.52 | I2771: 124.60 | J2771: 7.80 | K2771: 5 | L2771: =RC[-3]/100*RC[-1] -> 1.52
A2772: 9 | B2772: K12088-С | C2772: Рюкзак Tactical Backpack for 13" laptop койот ||M51612088-TAN | D2772: 21.61 | E2772: usd | F2772: 1 | G2772: 746.00 | H2772: 1.73 | I2772: 522.20 | J2772: 90.00 | K2772: 5 | L2772: =RC[-3]/100*RC[-1] -> 1.73
A2773: 10 | B2773: H7914 | C2773: Шапка флисовая мультикам ||CZ-DOK-FL-14 | D2773: 4.00 | E2773: usd | F2773: 5 | G2773: 133.00 | H2773: 1.66 | I2773: 465.50 | J2773: 65.50 | K2773: 5 | L2773: =RC[-3]/100*RC[-1] -> 1.66
A2774: 11 | B2774: H7904 | C2774: Шапка флисовая пол.вудлэнд ||CZ-DOK-FL-04 | D2774: 3.00 | E2774: usd | F2774: 5 | G2774: 114.00 | H2774: 1.90 | I2774: 399.00 | J2774: 99.00 | K2774: 5 | L2774: =RC[-3]/100*RC[-1] -> 1.90 | M2774: =SUM(R[-11]C[-1]:RC[-1]) -> 
A2776: #10289 (2014-11-06) Львів Назар Максимович - Прихід товару
A2777: N | B2777: арт | C2777: назва | D2777: закуп | F2777: к-ть | G2777: цiна | H2777: кф | I2777: продж | J2777: дохiд | K2777: % | L2777: з-та
A2778: 1 | B2778: _CZ7955 | C2778: Спальный мешок CarpZoom Extreme Sleeping Bag | D2778: 42.00 | E2778: Инт | F2778: 1 | G2778: 754.00 | H2778: 0.90 | I2778: 754.00 | J2778: -86.00 | K2778: 5 | L2778: =RC[-3]/100*RC[-1] -> 0.90 | M2778: =SUM(R[-1]C[-1]:RC[-1]) -> 
A2780: #10307 (2014-11-06) Львів Назар Максимович - Відправлено-Продано
A2781: N | B2781: арт | C2781: назва | D2781: закуп | F2781: к-ть | G2781: цiна | H2781: кф | I2781: продж | J2781: дохiд | K2781: % | L2781: з-та
A2782: 1 | B2782: K12234-O | C2782: Подсумок універс. для оружия олива [A.C.M] ||M51612234-OD | D2782: 5.44 | E2782: usd | F2782: 1 | G2782: 187.00 | H2782: 1.72 | I2782: 130.90 | J2782: 22.10 | K2782: 5 | L2782: =RC[-3]/100*RC[-1] -> 1.72
A2783: 2 | B2783: K17121-T | C2783: Очки FL8013 затемненные ||M51617121-TEA | D2783: 3.00 | E2783: usd | F2783: 1 | G2783: 114.00 | H2783: 1.90 | I2783: 79.80 | J2783: 19.80 | K2783: 5 | L2783: =RC[-3]/100*RC[-1] -> 1.90
A2784: 3 | B2784: _K17066-B | C2784: Окуляри защитные чёрные ||M51617066-TEA | D2784: 2.97 | E2784: usd | F2784: 1 | G2784: 114.00 | H2784: 1.92 | I2784: 79.80 | J2784: 20.40 | K2784: 5 | L2784: =RC[-3]/100*RC[-1] -> 1.92
A2785: 4 | B2785: K13193-O | C2785: Подсумок для радиостанции большой 85Х200мм олива [A.C.M] ||M51613193-OD | D2785: 3.50 | E2785: usd | F2785: 2 | G2785: 122.00 | H2785: 1.74 | I2785: 170.80 | J2785: 30.80 | K2785: 5 | L2785: =RC[-3]/100*RC[-1] -> 1.74 | M2785: =SUM(R[-4]C[-1]:RC[-1]) -> 
A2787: #10376 (2014-11-10) Львів Назар Максимович - Відправлено-Продано
A2788: N | B2788: арт | C2788: назва | D2788: закуп | F2788: к-ть | G2788: цiна | H2788: кф | I2788: продж | J2788: дохiд | K2788: % | L2788: з-та
A2789: 1 | B2789: H0007/M-L | C2789: Костюм маскировочный CHILLIE USMC digital woodland ||KP-GHL-PO-07 | D2789: 35.30 | E2789: usd | F2789: 1 | G2789: 1217.00 | H2789: 1.72 | I2789: 851.90 | J2789: 145.90 | K2789: 5 | L2789: =RC[-3]/100*RC[-1] -> 1.72 | M2789: =SUM(R[-1]C[-1]:RC[-1]) -> 
A2791: #10394 (2014-11-10) Львів Назар Максимович - Прихід товару
A2792: N | B2792: арт | C2792: назва | D2792: закуп | F2792: к-ть | G2792: цiна | H2792: кф | I2792: продж | J2792: дохiд | K2792: % | L2792: з-та
A2793: 1 | B2793: _CZ7375 | C2793: Рюкзак CARP ZOOM 50л | D2793: 485.00 | E2793: грн | F2793: 1 | G2793: 485.00 | H2793: 1.00 | I2793: 485.00 | J2793: 0.00 | K2793: 5 | L2793: =RC[-3]/100*RC[-1] -> 1.00
A2794: 2 | B2794: _CZ7771 | C2794: Рюкзак CARP ZOOM 70л | D2794: 595.00 | E2794: грн | F2794: 1 | G2794: 595.00 | H2794: 1.00 | I2794: 595.00 | J2794: 0.00 | K2794: 5 | L2794: =RC[-3]/100*RC[-1] -> 1.00
A2795: 3 | B2795: _CZ7955 | C2795: Спальный мешок CarpZoom Extreme Sleeping Bag | D2795: 42.00 | E2795: Инт | F2795: 5 | G2795: 754.00 | H2795: 0.90 | I2795: 3770.00 | J2795: -430.00 | K2795: 5 | L2795: =RC[-3]/100*RC[-1] -> 0.90 | M2795: =SUM(R[-3]C[-1]:RC[-1]) -> 
A2797: #10511 (2014-11-12) Львів Назар Максимович - Відправлено-Продано
A2798: N | B2798: арт | C2798: назва | D2798: закуп | F2798: к-ть | G2798: цiна | H2798: кф | I2798: продж | J2798: дохiд | K2798: % | L2798: з-та
A2799: 1 | B2799: _1400020 | C2799: Каремат туристический 10мм | D2799: 4.15 | E2799: Инт | F2799: 10 | G2799: 135.00 | H2799: 1.63 | I2799: 1080.00 | J2799: 250.00 | K2799: 5 | L2799: =RC[-3]/100*RC[-1] -> 1.63
A2800: 2 | B2800: _01044 | C2800: Прицел оптический YUKON Craft 1.5-6х42 | D2800: 2776.00 | E2800: грн | F2800: 1 | G2800: 3925.00 | H2800: 1.41 | I2800: 3336.25 | J2800: 560.25 | K2800: 5 | L2800: =RC[-3]/100*RC[-1] -> 1.41 | M2800: =SUM(R[-2]C[-1]:RC[-1]) -> 
A2802: #10552 (2014-11-13) Львів Назар Максимович - Відправлено-Продано
A2803: N | B2803: арт | C2803: назва | D2803: закуп | F2803: к-ть | G2803: цiна | H2803: кф | I2803: продж | J2803: дохiд | K2803: % | L2803: з-та
A2804: 1 | B2804: _1400021 | C2804: Каремат-сидушка туристический 8мм олива | D2804: 1.00 | E2804: Инт | F2804: 5 | G2804: 40.00 | H2804: 2.00 | I2804: 160.00 | J2804: 60.00 | K2804: 5 | L2804: =RC[-3]/100*RC[-1] -> 2.00
A2805: 2 | B2805: H2301/L | C2805: Куртка CLASSIC ARMY флисовая чёрная ||BL-CAF-FL-01 | D2805: 18.29 | E2805: usd | F2805: 2 | G2805: 758.00 | H2805: 2.07 | I2805: 1061.20 | J2805: 329.60 | K2805: 5 | L2805: =RC[-3]/100*RC[-1] -> 2.07
A2806: 3 | B2806: H2401/XL | C2806: Куртка DEFENDER POLICE флисовая чёрная ||BL-DEF-HF-01 | D2806: 22.86 | E2806: usd | F2806: 1 | G2806: 947.00 | H2806: 2.07 | I2806: 662.90 | J2806: 205.70 | K2806: 5 | L2806: =RC[-3]/100*RC[-1] -> 2.07 | M2806: =SUM(R[-3]C[-1]:RC[-1]) -> 
A2808: #10569 (2014-11-14) Львів Назар Максимович - Прихід товару
A2809: N | B2809: арт | C2809: назва | D2809: закуп | F2809: к-ть | G2809: цiна | H2809: кф | I2809: продж | J2809: дохiд | K2809: % | L2809: з-та
A2810: 1 | B2810: _BY02P | C2810: Нож BLADETECH black plain (копія) (Navy K615) | D2810: 16.00 | E2810: Инт | F2810: 3 | G2810: 288.00 | H2810: 0.90 | I2810: 864.00 | J2810: -96.00 | K2810: 5 | L2810: =RC[-3]/100*RC[-1] -> 0.90
A2811: 2 | B2811: _K1001 | C2811: Нож NAVY | D2811: 2.22 | E2811: Инт | F2811: 3 | G2811: 39.96 | H2811: 0.90 | I2811: 119.88 | J2811: -13.32 | K2811: 5 | L2811: =RC[-3]/100*RC[-1] -> 0.90
A2812: 3 | B2812: _K501 | C2812: Нож NAVY | D2812: 7.50 | E2812: Инт | F2812: 3 | G2812: 135.00 | H2812: 0.90 | I2812: 405.00 | J2812: -45.00 | K2812: 5 | L2812: =RC[-3]/100*RC[-1] -> 0.90
A2813: 4 | B2813: _K505 | C2813: Нож NAVY | D2813: 6.44 | E2813: Инт | F2813: 3 | G2813: 115.92 | H2813: 0.90 | I2813: 347.76 | J2813: -38.64 | K2813: 5 | L2813: =RC[-3]/100*RC[-1] -> 0.90
A2814: 5 | B2814: _K506 | C2814: Нож NAVY | D2814: 10.28 | E2814: Инт | F2814: 3 | G2814: 185.04 | H2814: 0.90 | I2814: 555.12 | J2814: -61.68 | K2814: 5 | L2814: =RC[-3]/100*RC[-1] -> 0.90
A2815: 6 | B2815: _K510 | C2815: Нож NAVY | D2815: 12.44 | E2815: Инт | F2815: 3 | G2815: 223.92 | H2815: 0.90 | I2815: 671.76 | J2815: -74.64 | K2815: 5 | L2815: =RC[-3]/100*RC[-1] -> 0.90
A2816: 7 | B2816: _K607 | C2816: Нож NAVY | D2816: 14.22 | E2816: Инт | F2816: 3 | G2816: 255.96 | H2816: 0.90 | I2816: 767.88 | J2816: -85.32 | K2816: 5 | L2816: =RC[-3]/100*RC[-1] -> 0.90
A2817: 8 | B2817: _K610 | C2817: Нож NAVY | D2817: 14.22 | E2817: Инт | F2817: 3 | G2817: 256.00 | H2817: 0.90 | I2817: 768.00 | J2817: -85.20 | K2817: 5 | L2817: =RC[-3]/100*RC[-1] -> 0.90
A2818: 9 | B2818: _K627 | C2818: Нож NAVY | D2818: 16.00 | E2818: Инт | F2818: 3 | G2818: 288.00 | H2818: 0.90 | I2818: 864.00 | J2818: -96.00 | K2818: 5 | L2818: =RC[-3]/100*RC[-1] -> 0.90
A2819: 10 | B2819: _K622 | C2819: Нож NAVY (копія Al Mar) | D2819: 15.11 | E2819: Инт | F2819: 3 | G2819: 271.98 | H2819: 0.90 | I2819: 815.94 | J2819: -90.66 | K2819: 5 | L2819: =RC[-3]/100*RC[-1] -> 0.90
A2820: 11 | B2820: _K631PS | C2820: Нож NAVY (копія Spyderco Police, півсерейтор) | D2820: 14.67 | E2820: Инт | F2820: 3 | G2820: 264.00 | H2820: 0.90 | I2820: 792.00 | J2820: -88.00 | K2820: 5 | L2820: =RC[-3]/100*RC[-1] -> 0.90
A2821: 12 | B2821: _K4040 | C2821: Нож NAVY BYRD | D2821: 4.44 | E2821: Инт | F2821: 3 | G2821: 80.00 | H2821: 0.90 | I2821: 240.00 | J2821: -26.67 | K2821: 5 | L2821: =RC[-3]/100*RC[-1] -> 0.90
A2822: 13 | B2822: _K627C | C2822: Нож NAVY карбон | D2822: 16.00 | E2822: Инт | F2822: 3 | G2822: 288.00 | H2822: 0.90 | I2822: 864.00 | J2822: -96.00 | K2822: 5 | L2822: =RC[-3]/100*RC[-1] -> 0.90 | M2822: =SUM(R[-13]C[-1]:RC[-1]) -> 
A2824: #10573 (2014-11-14) Львів Назар Максимович - Прихід товару
A2825: N | B2825: арт | C2825: назва | D2825: закуп | F2825: к-ть | G2825: цiна | H2825: кф | I2825: продж | J2825: дохiд | K2825: % | L2825: з-та
A2826: 1 | B2826: _826826 | C2826: Мультитул TRAVELER | D2826: 6.44 | E2826: Инт | F2826: 3 | G2826: 116.00 | H2826: 0.90 | I2826: 348.00 | J2826: -38.40 | K2826: 5 | L2826: =RC[-3]/100*RC[-1] -> 0.90
A2827: 2 | B2827: _842842 | C2827: Мультитул TRAVELER | D2827: 6.89 | E2827: Инт | F2827: 2 | G2827: 124.00 | H2827: 0.90 | I2827: 248.00 | J2827: -27.60 | K2827: 5 | L2827: =RC[-3]/100*RC[-1] -> 0.90
A2828: 3 | B2828: _509509 | C2828: Мультитул-плоскогубцы TRAVELER | D2828: 6.06 | E2828: Инт | F2828: 5 | G2828: 109.00 | H2828: 0.90 | I2828: 545.00 | J2828: -61.00 | K2828: 5 | L2828: =RC[-3]/100*RC[-1] -> 0.90
A2829: 4 | B2829: _629629 | C2829: Мультитул-плоскогубцы TRAVELER | D2829: 6.33 | E2829: Инт | F2829: 2 | G2829: 114.00 | H2829: 0.90 | I2829: 228.00 | J2829: -25.20 | K2829: 5 | L2829: =RC[-3]/100*RC[-1] -> 0.90
A2830: 5 | B2830: _832832 | C2830: Мультитул-плоскогубцы TRAVELER | D2830: 6.44 | E2830: Инт | F2830: 2 | G2830: 116.00 | H2830: 0.90 | I2830: 232.00 | J2830: -25.60 | K2830: 5 | L2830: =RC[-3]/100*RC[-1] -> 0.90
A2831: 6 | B2831: _155155-O | C2831: Перчатки флисовые олива | D2831: 1.83 | E2831: Инт | F2831: 5 | G2831: 33.00 | H2831: 0.90 | I2831: 165.00 | J2831: -18.33 | K2831: 5 | L2831: =RC[-3]/100*RC[-1] -> 0.90
A2832: 7 | B2832: _15301-O | C2832: Перчатки флисовые койот BREATHTEX | D2832: 11.11 | E2832: Инт | F2832: 5 | G2832: 200.00 | H2832: 0.90 | I2832: 1000.00 | J2832: -111.00 | K2832: 5 | L2832: =RC[-3]/100*RC[-1] -> 0.90
A2833: 8 | B2833: _155155-B | C2833: Перчатки флисовые чёрные | D2833: 1.83 | E2833: Инт | F2833: 5 | G2833: 33.00 | H2833: 0.90 | I2833: 165.00 | J2833: -18.33 | K2833: 5 | L2833: =RC[-3]/100*RC[-1] -> 0.90
A2834: 9 | B2834: _916596 | C2834: Шапка чёрная с флисовой подкладкой | D2834: 2.35 | E2834: Инт | F2834: 6 | G2834: 42.00 | H2834: 0.89 | I2834: 252.00 | J2834: -30.00 | K2834: 5 | L2834: =RC[-3]/100*RC[-1] -> 0.89 | M2834: =SUM(R[-9]C[-1]:RC[-1]) -> 
A2836: #10603 (2014-11-16) Львів Назар Максимович - Відправлено-Продано
A2837: N | B2837: арт | C2837: назва | D2837: закуп | F2837: к-ть | G2837: цiна | H2837: кф | I2837: продж | J2837: дохiд | K2837: % | L2837: з-та
A2838: 1 | B2838: _13846/43 | C2838: Носки серые высокие фінські | D2838: 20.00 | E2838: zl | F2838: 30 | G2838: 50.00 | H2838: 0.50 | I2838: 1050.00 | J2838: -1950.00 | K2838: 5 | L2838: =RC[-3]/100*RC[-1] -> 0.50
A2839: 2 | B2839: _13846/44-45 | C2839: Носки серые высокие фінські | D2839: 20.00 | E2839: zl | F2839: 6 | G2839: 50.00 | H2839: 0.50 | I2839: 210.00 | J2839: -390.00 | K2839: 5 | L2839: =RC[-3]/100*RC[-1] -> 0.50 | M2839: =SUM(R[-2]C[-1]:RC[-1]) -> 
A2841: #10665 (2014-11-18) Львів Назар Максимович - Прихід товару
A2842: N | B2842: арт | C2842: назва | D2842: закуп | F2842: к-ть | G2842: цiна | H2842: кф | I2842: продж | J2842: дохiд | K2842: % | L2842: з-та
A2843: 1 | B2843: _DA45 | C2843: Нож Browning DA45 (копія) | D2843: 9.77 | E2843: Инт | F2843: 5 | G2843: 175.86 | H2843: 0.90 | I2843: 879.30 | J2843: -97.70 | K2843: 5 | L2843: =RC[-3]/100*RC[-1] -> 0.90
A2844: 2 | B2844: _331000-1 | C2844: Нож Viking Norwey метательный | D2844: 9.05 | E2844: Инт | F2844: 5 | G2844: 162.90 | H2844: 0.90 | I2844: 814.50 | J2844: -90.50 | K2844: 5 | L2844: =RC[-3]/100*RC[-1] -> 0.90
A2845: 3 | B2845: _331000-2 | C2845: Нож Viking Norwey метательный | D2845: 10.00 | E2845: Инт | F2845: 5 | G2845: 180.00 | H2845: 0.90 | I2845: 900.00 | J2845: -100.00 | K2845: 5 | L2845: =RC[-3]/100*RC[-1] -> 0.90
A2846: 4 | B2846: _HK6003 | C2846: Нож метательный (комплект 3 шт) | D2846: 7.11 | E2846: Инт | F2846: 10 | G2846: 127.98 | H2846: 0.90 | I2846: 1279.80 | J2846: -142.20 | K2846: 5 | L2846: =RC[-3]/100*RC[-1] -> 0.90
A2847: 5 | B2847: _YF008 | C2847: Нож метательный (комплект 3 шт) | D2847: 6.83 | E2847: Инт | F2847: 10 | G2847: 122.94 | H2847: 0.90 | I2847: 1229.40 | J2847: -136.60 | K2847: 5 | L2847: =RC[-3]/100*RC[-1] -> 0.90
A2848: 6 | B2848: _YF045 | C2848: Нож метательный (комплект 3 шт) | D2848: 5.44 | E2848: Инт | F2848: 10 | G2848: 97.92 | H2848: 0.90 | I2848: 979.20 | J2848: -108.80 | K2848: 5 | L2848: =RC[-3]/100*RC[-1] -> 0.90
A2849: 7 | B2849: _SA28 | C2849: Нож нескладной | D2849: 12.72 | E2849: Инт | F2849: 8 | G2849: 228.96 | H2849: 0.90 | I2849: 1831.68 | J2849: -203.52 | K2849: 5 | L2849: =RC[-3]/100*RC[-1] -> 0.90
A2850: 8 | B2850: _2200133 | C2850: Нож нескладной BEAR GRYLLS GERBER mod. 31-000752 (копия) | D2850: 12.72 | E2850: Инт | F2850: 2 | G2850: 228.96 | H2850: 0.90 | I2850: 457.92 | J2850: -50.88 | K2850: 5 | L2850: =RC[-3]/100*RC[-1] -> 0.90
A2851: 9 | B2851: _154422 | C2851: Нож нескладной Fallkniven F1 (копия) | D2851: 13.61 | E2851: Инт | F2851: 5 | G2851: 244.98 | H2851: 0.90 | I2851: 1224.90 | J2851: -136.10 | K2851: 5 | L2851: =RC[-3]/100*RC[-1] -> 0.90
A2852: 10 | B2852: _151800 | C2852: Нож нескладной COLUMBIA mod. 1518 | D2852: 7.22 | E2852: Инт | F2852: 5 | G2852: 129.96 | H2852: 0.90 | I2852: 649.80 | J2852: -72.20 | K2852: 5 | L2852: =RC[-3]/100*RC[-1] -> 0.90
A2853: 11 | B2853: _409409 | C2853: Нож складной COLUMBIA | D2853: 4.55 | E2853: Инт | F2853: 5 | G2853: 81.90 | H2853: 0.90 | I2853: 409.50 | J2853: -45.50 | K2853: 5 | L2853: =RC[-3]/100*RC[-1] -> 0.90
A2854: 12 | B2854: _585858 | C2854: Нож складной EXTREMA RATIO (копия) | D2854: 12.00 | E2854: Инт | F2854: 5 | G2854: 216.00 | H2854: 0.90 | I2854: 1080.00 | J2854: -120.00 | K2854: 5 | L2854: =RC[-3]/100*RC[-1] -> 0.90
A2855: 13 | B2855: _155155-O | C2855: Перчатки флисовые олива | D2855: 1.83 | E2855: Инт | F2855: 60 | G2855: 33.00 | H2855: 0.90 | I2855: 1980.00 | J2855: -220.00 | K2855: 5 | L2855: =RC[-3]/100*RC[-1] -> 0.90
A2856: 14 | B2856: _155155-B | C2856: Перчатки флисовые чёрные | D2856: 1.83 | E2856: Инт | F2856: 60 | G2856: 33.00 | H2856: 0.90 | I2856: 1980.00 | J2856: -220.00 | K2856: 5 | L2856: =RC[-3]/100*RC[-1] -> 0.90 | M2856: =SUM(R[-14]C[-1]:RC[-1]) -> 
A2858: #10666 (2014-11-18) Львів Назар Максимович - Відправлено-Продано
A2859: N | B2859: арт | C2859: назва | D2859: закуп | F2859: к-ть | G2859: цiна | H2859: кф | I2859: продж | J2859: дохiд | K2859: % | L2859: з-та
A2860: 1 | B2860: _13846/43 | C2860: Носки серые высокие фінські | D2860: 20.00 | E2860: zl | F2860: 100 | G2860: 50.00 | H2860: 0.50 | I2860: 3500.00 | J2860: -6500.00 | K2860: 5 | L2860: =RC[-3]/100*RC[-1] -> 0.50
A2861: 2 | B2861: _13846/44-45 | C2861: Носки серые высокие фінські | D2861: 20.00 | E2861: zl | F2861: 20 | G2861: 50.00 | H2861: 0.50 | I2861: 700.00 | J2861: -1300.00 | K2861: 5 | L2861: =RC[-3]/100*RC[-1] -> 0.50 | M2861: =SUM(R[-2]C[-1]:RC[-1]) -> 
A2863: #10668 (2014-11-18) Львів Назар Максимович - Прихід товару
A2864: N | B2864: арт | C2864: назва | D2864: закуп | F2864: к-ть | G2864: цiна | H2864: кф | I2864: продж | J2864: дохiд | K2864: % | L2864: з-та
A2865: 1 | B2865: _NK617 | C2865: Нож складной NAVY | D2865: 14.50 | E2865: Инт | F2865: 3 | G2865: 261.00 | H2865: 0.90 | I2865: 783.00 | J2865: -87.00 | K2865: 5 | L2865: =RC[-3]/100*RC[-1] -> 0.90
A2866: 2 | B2866: _NK632 | C2866: Нож складной NAVY | D2866: 14.50 | E2866: Инт | F2866: 3 | G2866: 261.00 | H2866: 0.90 | I2866: 783.00 | J2866: -87.00 | K2866: 5 | L2866: =RC[-3]/100*RC[-1] -> 0.90
A2867: 3 | B2867: _NK801 | C2867: Нож складной NAVY | D2867: 14.60 | E2867: Инт | F2867: 3 | G2867: 262.80 | H2867: 0.90 | I2867: 788.40 | J2867: -87.60 | K2867: 5 | L2867: =RC[-3]/100*RC[-1] -> 0.90
A2868: 4 | B2868: _NK633 | C2868: Нож складной NAVY (копия Spyderco Endura) плейн | D2868: 15.00 | E2868: Инт | F2868: 3 | G2868: 270.00 | H2868: 0.90 | I2868: 810.00 | J2868: -90.00 | K2868: 5 | L2868: =RC[-3]/100*RC[-1] -> 0.90
A2869: 5 | B2869: _NK633PS | C2869: Нож складной NAVY (копия Spyderco Endura) полу-серрейтор | D2869: 15.00 | E2869: Инт | F2869: 3 | G2869: 270.00 | H2869: 0.90 | I2869: 810.00 | J2869: -90.00 | K2869: 5 | L2869: =RC[-3]/100*RC[-1] -> 0.90
A2870: 6 | B2870: _NK633S | C2870: Нож складной NAVY (копия Spyderco Endura) серрейтор | D2870: 15.00 | E2870: Инт | F2870: 3 | G2870: 270.00 | H2870: 0.90 | I2870: 810.00 | J2870: -90.00 | K2870: 5 | L2870: =RC[-3]/100*RC[-1] -> 0.90 | M2870: =SUM(R[-6]C[-1]:RC[-1]) -> 
A2872: #10687 (2014-11-18) Львів Назар Максимович - Відправлено-Продано
A2873: N | B2873: арт | C2873: назва | D2873: закуп | F2873: к-ть | G2873: цiна | H2873: кф | I2873: продж | J2873: дохiд | K2873: % | L2873: з-та
A2874: 1 | B2874: H12141/XXL | C2874: ECWCS куртка TRILAMINAT Gen.2 мультикам ||KU-EC2-NL-14 | D2874: 43.99 | E2874: usd | F2874: 1 | G2874: 1820.00 | H2874: 2.07 | I2874: 1274.00 | J2874: 394.20 | K2874: 5 | L2874: =RC[-3]/100*RC[-1] -> 2.07 | M2874: =SUM(R[-1]C[-1]:RC[-1]) -> 
A2876: #10753 (2014-11-21) Львів Назар Максимович - Відправлено-Продано
A2877: N | B2877: арт | C2877: назва | D2877: закуп | F2877: к-ть | G2877: цiна | H2877: кф | I2877: продж | J2877: дохiд | K2877: % | L2877: з-та
A2878: 1 | B2878: _01044 | C2878: Прицел оптический YUKON Craft 1.5-6х42 | D2878: 2776.00 | E2878: грн | F2878: 1 | G2878: 3925.00 | H2878: 1.41 | I2878: 3336.25 | J2878: 560.25 | K2878: 5 | L2878: =RC[-3]/100*RC[-1] -> 1.41 | M2878: =SUM(R[-1]C[-1]:RC[-1]) -> 
A2880: #10773 (2014-11-24) Львів Назар Максимович - Відправлено-Продано
A2881: N | B2881: арт | C2881: назва | D2881: закуп | F2881: к-ть | G2881: цiна | H2881: кф | I2881: продж | J2881: дохiд | K2881: % | L2881: з-та
A2882: 1 | B2882: _ARB-L2 | C2882: Аккумулятор FENIX 18650 2600mAh | D2882: 8.07 | E2882: Инт | F2882: 2 | G2882: 217.00 | H2882: 1.34 | I2882: 325.50 | J2882: 2.74 | K2882: 5 | L2882: =RC[-3]/100*RC[-1] -> 1.34
A2883: 2 | B2883: H2033/L | C2883: Куртка LIBERTY флисовая MP Camo 390г/м (superfine) ||BL-LIB-HF-33 | D2883: 31.03 | E2883: usd | F2883: 1 | G2883: 1261.00 | H2883: 2.03 | I2883: 882.70 | J2883: 262.10 | K2883: 5 | L2883: =RC[-3]/100*RC[-1] -> 2.03
A2884: 3 | B2884: H2033/M | C2884: Куртка LIBERTY флисовая MP Camo 390г/м (superfine) ||BL-LIB-HF-33 | D2884: 31.03 | E2884: usd | F2884: 1 | G2884: 1261.00 | H2884: 2.03 | I2884: 882.70 | J2884: 262.10 | K2884: 5 | L2884: =RC[-3]/100*RC[-1] -> 2.03
A2885: 4 | B2885: H2016/L | C2885: Куртка LIBERTY флисовая чорн/олива 390г/м (superfine) ||BL-LIB-HF-16 | D2885: 28.04 | E2885: usd | F2885: 2 | G2885: 1160.00 | H2885: 2.07 | I2885: 1624.00 | J2885: 502.60 | K2885: 5 | L2885: =RC[-3]/100*RC[-1] -> 2.07
A2886: 5 | B2886: H2016/M | C2886: Куртка LIBERTY флисовая чорн/олива 390г/м (superfine) ||BL-LIB-HF-16 | D2886: 28.04 | E2886: usd | F2886: 1 | G2886: 1160.00 | H2886: 2.07 | I2886: 812.00 | J2886: 251.30 | K2886: 5 | L2886: =RC[-3]/100*RC[-1] -> 2.07
A2887: 6 | B2887: H65031/L | C2887: Куртка М65 с отстегивающейся курткой вудлэнд (NYCO) ||KU-M65-NY-03 | D2887: 37.22 | E2887: usd | F2887: 1 | G2887: 1588.00 | H2887: 2.13 | I2887: 1111.60 | J2887: 367.20 | K2887: 5 | L2887: =RC[-3]/100*RC[-1] -> 2.13
A2888: 7 | B2888: H65021/MR | C2888: Куртка М65 с отстегивающейся курткой олива (NYCO) ||KU-M65-NY-02 | D2888: 38.39 | E2888: usd | F2888: 1 | G2888: 1589.00 | H2888: 2.07 | I2888: 1112.30 | J2888: 344.50 | K2888: 5 | L2888: =RC[-3]/100*RC[-1] -> 2.07
A2889: 8 | B2889: _10477/L | C2889: Куртка-аляска US N2B короткая чёрная ||10410002/904 | D2889: 32.00 | E2889: euro | F2889: 1 | G2889: 1840.00 | H2889: 2.30 | I2889: 1288.00 | J2889: 488.00 | K2889: 5 | L2889: =RC[-3]/100*RC[-1] -> 2.30
A2890: 9 | B2890: _13846/44-45 | C2890: Носки серые высокие фінські | D2890: 20.00 | E2890: zl | F2890: 100 | G2890: 50.00 | H2890: 0.50 | I2890: 3500.00 | J2890: -6500.00 | K2890: 5 | L2890: =RC[-3]/100*RC[-1] -> 0.50
A2891: 10 | B2891: H7902 | C2891: Шапка флисовая олива ||CZ-DOK-FL-02 | D2891: 2.00 | E2891: usd | F2891: 5 | G2891: 137.00 | H2891: 3.43 | I2891: 479.50 | J2891: 279.50 | K2891: 5 | L2891: =RC[-3]/100*RC[-1] -> 3.43
A2892: 11 | B2892: H7901 | C2892: Шапка флисовая чёрная ||CZ-DOK-FL-01 | D2892: 2.00 | E2892: usd | F2892: 10 | G2892: 137.00 | H2892: 3.43 | I2892: 959.00 | J2892: 559.00 | K2892: 5 | L2892: =RC[-3]/100*RC[-1] -> 3.43 | M2892: =SUM(R[-11]C[-1]:RC[-1]) -> 
A2894: #10779 (2014-11-24) Львів Назар Максимович - Прихід товару
A2895: N | B2895: арт | C2895: назва | D2895: закуп | F2895: к-ть | G2895: цiна | H2895: кф | I2895: продж | J2895: дохiд | K2895: % | L2895: з-та
A2896: 1 | B2896: _601-7030 | C2896: Балаклава белая (70% шерсть 30%акрил) | D2896: 3.88 | E2896: Инт | F2896: 5 | G2896: 69.84 | H2896: 0.90 | I2896: 349.20 | J2896: -38.80 | K2896: 5 | L2896: =RC[-3]/100*RC[-1] -> 0.90
A2897: 2 | B2897: 40484-1 | C2897: Балаклава чёрная вязаная | D2897: 2.53 | E2897: Инт | F2897: 50 | G2897: 45.54 | H2897: 0.90 | I2897: 2277.00 | J2897: -253.00 | K2897: 5 | L2897: =RC[-3]/100*RC[-1] -> 0.90
A2898: 3 | B2898: 40484-2 | C2898: Балаклава чёрная флисовая | D2898: 2.94 | E2898: Инт | F2898: 50 | G2898: 52.92 | H2898: 0.90 | I2898: 2646.00 | J2898: -294.00 | K2898: 5 | L2898: =RC[-3]/100*RC[-1] -> 0.90
A2899: 4 | B2899: 120274/L | C2899: Куртка флисовая coyote POLAR | D2899: 18.11 | E2899: Инт | F2899: 4 | G2899: 325.98 | H2899: 0.90 | I2899: 1303.92 | J2899: -144.88 | K2899: 5 | L2899: =RC[-3]/100*RC[-1] -> 0.90
A2900: 5 | B2900: 120274/XL | C2900: Куртка флисовая coyote POLAR | D2900: 18.11 | E2900: Инт | F2900: 4 | G2900: 325.98 | H2900: 0.90 | I2900: 1303.92 | J2900: -144.88 | K2900: 5 | L2900: =RC[-3]/100*RC[-1] -> 0.90
A2901: 6 | B2901: 120274/XXL | C2901: Куртка флисовая coyote POLAR | D2901: 18.11 | E2901: Инт | F2901: 2 | G2901: 325.98 | H2901: 0.90 | I2901: 651.96 | J2901: -72.44 | K2901: 5 | L2901: =RC[-3]/100*RC[-1] -> 0.90
A2902: 7 | B2902: _N939393 | C2902: Нож нескладной | D2902: 4.16 | E2902: Инт | F2902: 3 | G2902: 74.88 | H2902: 0.90 | I2902: 224.64 | J2902: -24.96 | K2902: 5 | L2902: =RC[-3]/100*RC[-1] -> 0.90
A2903: 8 | B2903: _608-9401/L | C2903: Перчатки тактические олива FreeSolder | D2903: 25.83 | E2903: Инт | F2903: 5 | G2903: 464.94 | H2903: 0.90 | I2903: 2324.70 | J2903: -258.30 | K2903: 5 | L2903: =RC[-3]/100*RC[-1] -> 0.90
A2904: 9 | B2904: _608-9401/XL | C2904: Перчатки тактические олива FreeSolder | D2904: 25.83 | E2904: Инт | F2904: 5 | G2904: 464.94 | H2904: 0.90 | I2904: 2324.70 | J2904: -258.30 | K2904: 5 | L2904: =RC[-3]/100*RC[-1] -> 0.90
A2905: 10 | B2905: _155155-B | C2905: Перчатки флисовые чёрные | D2905: 1.83 | E2905: Инт | F2905: 120 | G2905: 33.00 | H2905: 0.90 | I2905: 3960.00 | J2905: -439.99 | K2905: 5 | L2905: =RC[-3]/100*RC[-1] -> 0.90
A2906: 11 | B2906: _WL140 | C2906: Планка WEAVER 140мм | D2906: 5.00 | E2906: Инт | F2906: 10 | G2906: 90.00 | H2906: 0.90 | I2906: 900.00 | J2906: -100.00 | K2906: 5 | L2906: =RC[-3]/100*RC[-1] -> 0.90
A2907: 12 | B2907: _WL90 | C2907: Планка WEAVER 90мм | D2907: 4.55 | E2907: Инт | F2907: 10 | G2907: 81.90 | H2907: 0.90 | I2907: 819.00 | J2907: -91.00 | K2907: 5 | L2907: =RC[-3]/100*RC[-1] -> 0.90
A2908: 13 | B2908: 65961/2XL | C2908: Термобелье флисовое +балаклава ||маломірка! | D2908: 14.48 | E2908: Инт | F2908: 5 | G2908: 260.64 | H2908: 0.90 | I2908: 1303.20 | J2908: -144.80 | K2908: 5 | L2908: =RC[-3]/100*RC[-1] -> 0.90
A2909: 14 | B2909: 65961/XL | C2909: Термобелье флисовое +балаклава ||маломірка! | D2909: 14.48 | E2909: Инт | F2909: 5 | G2909: 260.64 | H2909: 0.90 | I2909: 1303.20 | J2909: -144.80 | K2909: 5 | L2909: =RC[-3]/100*RC[-1] -> 0.90
A2910: 15 | B2910: _916596-1 | C2910: Шапка олива с флисовой подкладкой | D2910: 2.50 | E2910: Инт | F2910: 50 | G2910: 42.30 | H2910: 0.85 | I2910: 2115.00 | J2910: -385.00 | K2910: 5 | L2910: =RC[-3]/100*RC[-1] -> 0.85
A2911: 16 | B2911: _916596 | C2911: Шапка чёрная с флисовой подкладкой | D2911: 2.35 | E2911: Инт | F2911: 50 | G2911: 42.30 | H2911: 0.90 | I2911: 2115.00 | J2911: -235.00 | K2911: 5 | L2911: =RC[-3]/100*RC[-1] -> 0.90 | M2911: =SUM(R[-16]C[-1]:RC[-1]) -> 
A2913: #10791 (2014-11-24) Львів Назар Максимович - Клієнт повернув
A2914: N | B2914: арт | C2914: назва | D2914: закуп | F2914: к-ть | G2914: цiна | H2914: кф | I2914: продж | J2914: дохiд | K2914: % | L2914: з-та
A2915: 1 | B2915: _MJ850 | C2915: Фонарик MAGIC SHINE MJ-850 | D2915: 68.69 | E2915: Инт | F2915: 1 | G2915: 2040.00 | H2915: 1.48 | I2915: 1088.00 | J2915: -285.87 | K2915: 5 | L2915: =RC[-3]/100*RC[-1] -> 1.48 | M2915: =SUM(R[-1]C[-1]:RC[-1]) -> 
A2917: #10802 (2014-11-25) Львів Назар Максимович - Відправлено-Продано
A2918: N | B2918: арт | C2918: назва | D2918: закуп | F2918: к-ть | G2918: цiна | H2918: кф | I2918: продж | J2918: дохiд | K2918: % | L2918: з-та
A2919: 1 | B2919: M800332/41.5 | C2919: Берцы MAGNUM Precision Ultra Lite CT WPI Wide | D2919: 53.25 | E2919: usd | F2919: 1 | G2919: 1698.00 | H2919: 1.59 | I2919: 1188.60 | J2919: 123.60 | K2919: 5 | L2919: =RC[-3]/100*RC[-1] -> 1.59
A2920: 2 | B2920: M800332/41 | C2920: Берцы MAGNUM Precision Ultra Lite CT WPI Wide | D2920: 53.25 | E2920: usd | F2920: 1 | G2920: 1698.00 | H2920: 1.59 | I2920: 1188.60 | J2920: 123.60 | K2920: 5 | L2920: =RC[-3]/100*RC[-1] -> 1.59 | M2920: =SUM(R[-2]C[-1]:RC[-1]) -> 
A2922: #10836 (2014-11-26) Львів Назар Максимович - Прихід товару
A2923: N | B2923: арт | C2923: назва | D2923: закуп | F2923: к-ть | G2923: цiна | H2923: кф | I2923: продж | J2923: дохiд | K2923: % | L2923: з-та
A2924: 1 | B2924: _155155-O | C2924: Перчатки флисовые олива | D2924: 1.83 | E2924: Инт | F2924: 120 | G2924: 33.00 | H2924: 0.90 | I2924: 3960.00 | J2924: -439.99 | K2924: 5 | L2924: =RC[-3]/100*RC[-1] -> 0.90
A2925: 2 | B2925: _KWC-0548 | C2925: Пістолет пневматичний KWC PM (KM-44 DHN) | D2925: 41.70 | E2925: Инт | F2925: 5 | G2925: 750.60 | H2925: 0.90 | I2925: 3753.00 | J2925: -417.00 | K2925: 5 | L2925: =RC[-3]/100*RC[-1] -> 0.90
A2926: 3 | B2926: _916596 | C2926: Шапка чёрная с флисовой подкладкой | D2926: 2.35 | E2926: Инт | F2926: 50 | G2926: 42.30 | H2926: 0.90 | I2926: 2115.00 | J2926: -235.00 | K2926: 5 | L2926: =RC[-3]/100*RC[-1] -> 0.90 | M2926: =SUM(R[-3]C[-1]:RC[-1]) -> 
A2928: #10845 (2014-11-26) Львів Назар Максимович - Відправлено-Продано
A2929: N | B2929: арт | C2929: назва | D2929: закуп | F2929: к-ть | G2929: цiна | H2929: кф | I2929: продж | J2929: дохiд | K2929: % | L2929: з-та
A2930: 1 | B2930: _01044 | C2930: Прицел оптический YUKON Craft 1.5-6х42 | D2930: 2776.00 | E2930: грн | F2930: 1 | G2930: 3925.00 | H2930: 1.41 | I2930: 3336.25 | J2930: 560.25 | K2930: 5 | L2930: =RC[-3]/100*RC[-1] -> 1.41 | M2930: =SUM(R[-1]C[-1]:RC[-1]) -> 
A2932: #10860 (2014-11-27) Львів Назар Максимович - Відправлено-Продано
A2933: N | B2933: арт | C2933: назва | D2933: закуп | F2933: к-ть | G2933: цiна | H2933: кф | I2933: продж | J2933: дохiд | K2933: % | L2933: з-та
A2934: 1 | B2934: H8602/130 | C2934: Ремень TOUGH NAVY SEAL олива ||PS-NAV-CO-01 | D2934: 4.23 | E2934: usd | F2934: 2 | G2934: 174.00 | H2934: 2.06 | I2934: 243.60 | J2934: 74.40 | K2934: 5 | L2934: =RC[-3]/100*RC[-1] -> 2.06
A2935: 2 | B2935: H8602/140 | C2935: Ремень TOUGH NAVY SEAL олива ||PS-NAV-CO-01 | D2935: 4.23 | E2935: usd | F2935: 2 | G2935: 174.00 | H2935: 2.06 | I2935: 243.60 | J2935: 74.40 | K2935: 5 | L2935: =RC[-3]/100*RC[-1] -> 2.06
A2936: 3 | B2936: H8602/120 | C2936: Ремень TOUGH NAVY SEAL олива ||PS-NAV-CO-01 | D2936: 4.23 | E2936: usd | F2936: 1 | G2936: 174.00 | H2936: 2.06 | I2936: 121.80 | J2936: 37.20 | K2936: 5 | L2936: =RC[-3]/100*RC[-1] -> 2.06
A2937: 4 | B2937: H8901/130 | C2937: Ремень TOUGH US MARINES чёрный ||PS-USM-CO-01 | D2937: 3.68 | E2937: usd | F2937: 1 | G2937: 174.00 | H2937: 2.36 | I2937: 121.80 | J2937: 48.20 | K2937: 5 | L2937: =RC[-3]/100*RC[-1] -> 2.36
A2938: 5 | B2938: H8901/140 | C2938: Ремень TOUGH US MARINES чёрный ||PS-USM-CO-01 | D2938: 3.68 | E2938: usd | F2938: 1 | G2938: 174.00 | H2938: 2.36 | I2938: 121.80 | J2938: 48.20 | K2938: 5 | L2938: =RC[-3]/100*RC[-1] -> 2.36
A2939: 6 | B2939: H8901/120 | C2939: Ремень TOUGH US MARINES чёрный ||PS-USM-CO-01 | D2939: 3.68 | E2939: usd | F2939: 1 | G2939: 174.00 | H2939: 2.36 | I2939: 121.80 | J2939: 48.20 | K2939: 5 | L2939: =RC[-3]/100*RC[-1] -> 2.36 | M2939: =SUM(R[-6]C[-1]:RC[-1]) -> 
A2941: #10863 (2014-11-27) Львів Назар Максимович - Прихід товару
A2942: N | B2942: арт | C2942: назва | D2942: закуп | F2942: к-ть | G2942: цiна | H2942: кф | I2942: продж | J2942: дохiд | K2942: % | L2942: з-та
A2943: 1 | B2943: _B3-3 | C2943: Винтовка пневматическая B3-3 | D2943: 38.03 | E2943: Инт | F2943: 5 | G2943: 684.54 | H2943: 0.90 | I2943: 3422.70 | J2943: -380.30 | K2943: 5 | L2943: =RC[-3]/100*RC[-1] -> 0.90
A2944: 2 | B2944: _XT-B2 | C2944: Винтовка пневматическая XTSG XT-B2 | D2944: 32.84 | E2944: Инт | F2944: 1 | G2944: 591.12 | H2944: 0.90 | I2944: 591.12 | J2944: -65.68 | K2944: 5 | L2944: =RC[-3]/100*RC[-1] -> 0.90
A2945: 3 | B2945: _XT-B2 | C2945: Винтовка пневматическая XTSG XT-B2 | D2945: 32.84 | E2945: Инт | F2945: 4 | G2945: 591.12 | H2945: 0.90 | I2945: 2364.48 | J2945: -262.72 | K2945: 5 | L2945: =RC[-3]/100*RC[-1] -> 0.90 | M2945: =SUM(R[-3]C[-1]:RC[-1]) -> 
A2947: #10874 (2014-11-27) Львів Назар Максимович - Відправлено-Продано
A2948: N | B2948: арт | C2948: назва | D2948: закуп | F2948: к-ть | G2948: цiна | H2948: кф | I2948: продж | J2948: дохiд | K2948: % | L2948: з-та
A2949: 1 | B2949: H6502/SR | C2949: US М65 штаны олива (NYCO) ||SP-M65-NY-02 | D2949: 19.44 | E2949: usd | F2949: 1 | G2949: 923.00 | H2949: 2.37 | I2949: 646.10 | J2949: 257.30 | K2949: 5 | L2949: =RC[-3]/100*RC[-1] -> 2.37
A2950: 2 | B2950: H65021/MR | C2950: Куртка М65 с отстегивающейся курткой олива (NYCO) ||KU-M65-NY-02 | D2950: 38.39 | E2950: usd | F2950: 2 | G2950: 1589.00 | H2950: 2.07 | I2950: 2224.60 | J2950: 689.00 | K2950: 5 | L2950: =RC[-3]/100*RC[-1] -> 2.07 | M2950: =SUM(R[-2]C[-1]:RC[-1]) -> 
A2952: #10894 (2014-11-28) Львів Назар Максимович - Відправлено-Продано
A2953: N | B2953: арт | C2953: назва | D2953: закуп | F2953: к-ть | G2953: цiна | H2953: кф | I2953: продж | J2953: дохiд | K2953: % | L2953: з-та
A2954: 1 | B2954: _13846/44-45 | C2954: Носки серые высокие фінські | D2954: 20.00 | E2954: zl | F2954: 18 | G2954: 50.00 | H2954: 0.50 | I2954: 630.00 | J2954: -1170.00 | K2954: 5 | L2954: =RC[-3]/100*RC[-1] -> 0.50 | M2954: =SUM(R[-1]C[-1]:RC[-1]) -> 
A2956: #10897 (2014-11-28) Львів Назар Максимович - Прихід товару
A2957: N | B2957: арт | C2957: назва | D2957: закуп | F2957: к-ть | G2957: цiна | H2957: кф | I2957: продж | J2957: дохiд | K2957: % | L2957: з-та
A2958: 1 | B2958: N00011 | C2958: Комплект (наколенники и налокотники) олива | D2958: 22.78 | E2958: Инт | F2958: 5 | G2958: 410.04 | H2958: 0.90 | I2958: 2050.20 | J2958: -227.80 | K2958: 5 | L2958: =RC[-3]/100*RC[-1] -> 0.90
A2959: 2 | B2959: _703025-BR | C2959: Перчатки флисовые коричневые | D2959: 1.78 | E2959: Инт | F2959: 30 | G2959: 32.04 | H2959: 0.90 | I2959: 961.20 | J2959: -106.80 | K2959: 5 | L2959: =RC[-3]/100*RC[-1] -> 0.90
A2960: 3 | B2960: _703025-G | C2960: Перчатки флисовые серые | D2960: 1.78 | E2960: Инт | F2960: 30 | G2960: 32.04 | H2960: 0.90 | I2960: 961.20 | J2960: -106.80 | K2960: 5 | L2960: =RC[-3]/100*RC[-1] -> 0.90
A2961: 4 | B2961: _703025-BL | C2961: Перчатки флисовые синие | D2961: 1.78 | E2961: Инт | F2961: 40 | G2961: 32.04 | H2961: 0.90 | I2961: 1281.60 | J2961: -142.40 | K2961: 5 | L2961: =RC[-3]/100*RC[-1] -> 0.90
A2962: 5 | B2962: _703025-B | C2962: Перчатки флисовые чёрные | D2962: 1.78 | E2962: Инт | F2962: 50 | G2962: 32.04 | H2962: 0.90 | I2962: 1602.00 | J2962: -178.00 | K2962: 5 | L2962: =RC[-3]/100*RC[-1] -> 0.90 | M2962: =SUM(R[-5]C[-1]:RC[-1]) -> 
A2964: #10905 (2014-11-28) Львів Назар Максимович - Відправлено-Продано
A2965: N | B2965: арт | C2965: назва | D2965: закуп | F2965: к-ть | G2965: цiна | H2965: кф | I2965: продж | J2965: дохiд | K2965: % | L2965: з-та
A2966: 1 | B2966: H3301/L | C2966: Комплект термобілизни (95% полиэстер 5% спандекс) чёрный ||KP-UN2-PO-01/L | D2966: 19.99 | E2966: usd | F2966: 1 | G2966: 855.00 | H2966: 2.14 | I2966: 598.50 | J2966: 198.70 | K2966: 5 | L2966: =RC[-3]/100*RC[-1] -> 2.14
A2967: 2 | B2967: H3301/XL | C2967: Комплект термобілизни (95% полиэстер 5% спандекс) чёрный ||KP-UN2-PO-01/XL | D2967: 19.99 | E2967: usd | F2967: 1 | G2967: 855.00 | H2967: 2.14 | I2967: 598.50 | J2967: 198.70 | K2967: 5 | L2967: =RC[-3]/100*RC[-1] -> 2.14 | M2967: =SUM(R[-2]C[-1]:RC[-1]) -> 
A2969: #10931 (2014-12-01) Львів Назар Максимович - Прихід товару
A2970: N | B2970: арт | C2970: назва | D2970: закуп | F2970: к-ть | G2970: цiна | H2970: кф | I2970: продж | J2970: дохiд | K2970: % | L2970: з-та
A2971: 1 | B2971: _601-7030-3 | C2971: Балаклава белая (50% шерсть 50%акрил) | D2971: 3.67 | E2971: Инт | F2971: 6 | G2971: 66.06 | H2971: 0.90 | I2971: 396.36 | J2971: -44.04 | K2971: 5 | L2971: =RC[-3]/100*RC[-1] -> 0.90
A2972: 2 | B2972: _874404 | C2972: Балаклава двойная чёрная | D2972: 4.10 | E2972: Инт | F2972: 50 | G2972: 73.80 | H2972: 0.90 | I2972: 3690.00 | J2972: -410.00 | K2972: 5 | L2972: =RC[-3]/100*RC[-1] -> 0.90 | M2972: =SUM(R[-2]C[-1]:RC[-1]) -> 
A2974: #10947 (2014-12-01) Львів Назар Максимович - Прихід товару
A2975: N | B2975: арт | C2975: назва | D2975: закуп | F2975: к-ть | G2975: цiна | H2975: кф | I2975: продж | J2975: дохiд | K2975: % | L2975: з-та
A2976: 1 | B2976: _155155-O | C2976: Перчатки флисовые олива | D2976: 1.83 | E2976: Инт | F2976: 120 | G2976: 33.00 | H2976: 0.90 | I2976: 3960.00 | J2976: -439.99 | K2976: 5 | L2976: =RC[-3]/100*RC[-1] -> 0.90
A2977: 2 | B2977: _273-1200 | C2977: Пістолет пневматичний SAS Makarov PM | D2977: 40.84 | E2977: Инт | F2977: 1 | G2977: 735.12 | H2977: 0.90 | I2977: 735.12 | J2977: -81.68 | K2977: 5 | L2977: =RC[-3]/100*RC[-1] -> 0.90
A2978: 3 | B2978: _273-1200 | C2978: Пістолет пневматичний SAS Makarov PM | D2978: 40.84 | E2978: Инт | F2978: 3 | G2978: 735.12 | H2978: 0.90 | I2978: 2205.36 | J2978: -245.04 | K2978: 5 | L2978: =RC[-3]/100*RC[-1] -> 0.90
A2979: 4 | B2979: _N254-2543 | C2979: Термоодеяло | D2979: 2.73 | E2979: Инт | F2979: 1 | G2979: 49.14 | H2979: 0.90 | I2979: 49.14 | J2979: -5.46 | K2979: 5 | L2979: =RC[-3]/100*RC[-1] -> 0.90
A2980: 5 | B2980: _N254-2543 | C2980: Термоодеяло | D2980: 2.73 | E2980: Инт | F2980: 15 | G2980: 49.14 | H2980: 0.90 | I2980: 737.10 | J2980: -81.90 | K2980: 5 | L2980: =RC[-3]/100*RC[-1] -> 0.90 | M2980: =SUM(R[-5]C[-1]:RC[-1]) -> 
A2982: #10949 (2014-12-01) Львів Назар Максимович - Відправлено-Продано
A2983: N | B2983: арт | C2983: назва | D2983: закуп | F2983: к-ть | G2983: цiна | H2983: кф | I2983: продж | J2983: дохiд | K2983: % | L2983: з-та
A2984: 1 | B2984: _11957/Р/1 | C2984: Рос.костюм маскировочный белый | D2984: 2.80 | E2984: euro | F2984: 1 | G2984: 151.00 | H2984: 2.16 | I2984: 105.70 | J2984: 35.70 | K2984: 5 | L2984: =RC[-3]/100*RC[-1] -> 2.16
A2985: 2 | B2985: _11957/Р/2 | C2985: Рос.костюм маскировочный белый | D2985: 2.80 | E2985: euro | F2985: 1 | G2985: 151.00 | H2985: 2.16 | I2985: 105.70 | J2985: 35.70 | K2985: 5 | L2985: =RC[-3]/100*RC[-1] -> 2.16 | M2985: =SUM(R[-2]C[-1]:RC[-1]) -> 
A2987: #10991 (2014-12-03) Львів Назар Максимович - Відправлено-Продано
A2988: N | B2988: арт | C2988: назва | D2988: закуп | F2988: к-ть | G2988: цiна | H2988: кф | I2988: продж | J2988: дохiд | K2988: % | L2988: з-та
A2989: 1 | B2989: K17086-O | C2989: Ремень 1-точ.(Bungee) к MP5/G3/M4 олива ||M51617086-OD | D2989: 2.96 | E2989: usd | F2989: 1 | G2989: 143.00 | H2989: 2.42 | I2989: 100.10 | J2989: 40.90 | K2989: 5 | L2989: =RC[-3]/100*RC[-1] -> 2.42
A2990: 2 | B2990: H65021/XLR | C2990: Куртка М65 с отстегивающейся курткой олива (NYCO) ||KU-M65-NY-02 | D2990: 38.39 | E2990: usd | F2990: 1 | G2990: 1589.00 | H2990: 2.07 | I2990: 1112.30 | J2990: 344.50 | K2990: 5 | L2990: =RC[-3]/100*RC[-1] -> 2.07
A2991: 3 | B2991: H43021/XLR | C2991: US SFU китель олива (PolyCotton) ||BL-SFU-PR-02 | D2991: 15.03 | E2991: usd | F2991: 1 | G2991: 600.00 | H2991: 2.00 | I2991: 420.00 | J2991: 119.40 | K2991: 5 | L2991: =RC[-3]/100*RC[-1] -> 2.00
A2992: 4 | B2992: H4302/XLR | C2992: US SFU штаны олива (NYCO R/S) ||SP-SFU-NR-02 SP-SFU-PR-02 | D2992: 15.03 | E2992: usd | F2992: 1 | G2992: 600.00 | H2992: 2.00 | I2992: 420.00 | J2992: 119.40 | K2992: 5 | L2992: =RC[-3]/100*RC[-1] -> 2.00 | M2992: =SUM(R[-4]C[-1]:RC[-1]) -> 
A2994: #11032 (2014-12-04) Львів Назар Максимович - Відправлено-Продано
A2995: N | B2995: арт | C2995: назва | D2995: закуп | F2995: к-ть | G2995: цiна | H2995: кф | I2995: продж | J2995: дохiд | K2995: % | L2995: з-та
A2996: 1 | B2996: H7914 | C2996: Шапка флисовая мультикам ||CZ-DOK-FL-14 | D2996: 4.00 | E2996: usd | F2996: 3 | G2996: 159.00 | H2996: 1.99 | I2996: 333.90 | J2996: 93.90 | K2996: 5 | L2996: =RC[-3]/100*RC[-1] -> 1.99 | M2996: =SUM(R[-1]C[-1]:RC[-1]) -> 
A2998: #11071 (2014-12-05) Львів Назар Максимович - Відправлено-Продано
A2999: N | B2999: арт | C2999: назва | D2999: закуп | F2999: к-ть | G2999: цiна | H2999: кф | I2999: продж | J2999: дохiд | K2999: % | L2999: з-та
A3000: 1 | B3000: _10181/M | C3000: Куртка-аляска US N3B длинная олива ||10181001/903 | D3000: 34.50 | E3000: euro | F3000: 1 | G3000: 1984.00 | H3000: 2.30 | I3000: 1388.80 | J3000: 526.30 | K3000: 5 | L3000: =RC[-3]/100*RC[-1] -> 2.30
A3001: 2 | B3001: _10181/L | C3001: Куртка-аляска US N3B длинная олива ||10181001/904 | D3001: 34.50 | E3001: euro | F3001: 1 | G3001: 1984.00 | H3001: 2.30 | I3001: 1388.80 | J3001: 526.30 | K3001: 5 | L3001: =RC[-3]/100*RC[-1] -> 2.30 | M3001: =SUM(R[-2]C[-1]:RC[-1]) -> 
A3003: #11127 (2014-12-09) Львів Назар Максимович - Відправлено-Продано
A3004: N | B3004: арт | C3004: назва | D3004: закуп | F3004: к-ть | G3004: цiна | H3004: кф | I3004: продж | J3004: дохiд | K3004: % | L3004: з-та
A3005: 1 | B3005: M800332/43 | C3005: Берцы MAGNUM Precision Ultra Lite CT WPI Wide | D3005: 53.25 | E3005: usd | F3005: 1 | G3005: 1698.00 | H3005: 1.59 | I3005: 1188.60 | J3005: 123.60 | K3005: 5 | L3005: =RC[-3]/100*RC[-1] -> 1.59 | M3005: =SUM(R[-1]C[-1]:RC[-1]) -> 
A3007: #11142 (2014-12-09) Львів Назар Максимович - Прихід товару
A3008: N | B3008: арт | C3008: назва | D3008: закуп | F3008: к-ть | G3008: цiна | H3008: кф | I3008: продж | J3008: дохiд | K3008: % | L3008: з-та
A3009: 1 | B3009: _52469/L | C3009: Перчатки флисовые Adventure | D3009: 8.06 | E3009: Инт | F3009: 10 | G3009: 145.08 | H3009: 0.90 | I3009: 1450.80 | J3009: -161.20 | K3009: 5 | L3009: =RC[-3]/100*RC[-1] -> 0.90
A3010: 2 | B3010: _52469/XL | C3010: Перчатки флисовые Adventure | D3010: 8.06 | E3010: Инт | F3010: 10 | G3010: 145.08 | H3010: 0.90 | I3010: 1450.80 | J3010: -161.20 | K3010: 5 | L3010: =RC[-3]/100*RC[-1] -> 0.90
A3011: 3 | B3011: _703025-11 | C3011: Перчатки флисовые Adventure | D3011: 10.84 | E3011: Инт | F3011: 5 | G3011: 195.12 | H3011: 0.90 | I3011: 975.60 | J3011: -108.40 | K3011: 5 | L3011: =RC[-3]/100*RC[-1] -> 0.90
A3012: 4 | B3012: _916596-1 | C3012: Шапка олива с флисовой подкладкой | D3012: 2.50 | E3012: Инт | F3012: 100 | G3012: 45.00 | H3012: 0.90 | I3012: 4500.00 | J3012: -500.00 | K3012: 5 | L3012: =RC[-3]/100*RC[-1] -> 0.90 | M3012: =SUM(R[-4]C[-1]:RC[-1]) -> 
A3014: #11143 (2014-12-09) Львів Назар Максимович - Відправлено-Продано
A3015: N | B3015: арт | C3015: назва | D3015: закуп | F3015: к-ть | G3015: цiна | H3015: кф | I3015: продж | J3015: дохiд | K3015: % | L3015: з-та
A3016: 1 | B3016: H65021/MR | C3016: Куртка М65 с отстегивающейся курткой олива (NYCO) ||KU-M65-NY-02 | D3016: 38.39 | E3016: usd | F3016: 1 | G3016: 1589.00 | H3016: 2.07 | I3016: 1112.30 | J3016: 344.50 | K3016: 5 | L3016: =RC[-3]/100*RC[-1] -> 2.07
A3017: 2 | B3017: K12234-O | C3017: Подсумок універс. для оружия олива [A.C.M] ||M51612234-OD | D3017: 5.44 | E3017: usd | F3017: 1 | G3017: 224.00 | H3017: 2.06 | I3017: 156.80 | J3017: 48.00 | K3017: 5 | L3017: =RC[-3]/100*RC[-1] -> 2.06
A3018: 3 | B3018: _TRP008.01 | C3018: Рюкзак SASHBAG | D3018: 5.99 | E3018: Инт | F3018: 1 | G3018: 168.00 | H3018: 1.40 | I3018: 134.40 | J3018: 14.59 | K3018: 5 | L3018: =RC[-3]/100*RC[-1] -> 1.40
A3019: 4 | B3019: A19-125 | C3019: Сумка для документов ACROPOLIS ||СДД-ш | D3019: 115.00 | E3019: грн | F3019: 1 | G3019: 167.00 | H3019: 1.45 | I3019: 133.60 | J3019: 18.60 | K3019: 5 | L3019: =RC[-3]/100*RC[-1] -> 1.45 | M3019: =SUM(R[-4]C[-1]:RC[-1]) -> 
A3021: #11210 (2014-12-12) Львів Назар Максимович - Відправлено-Продано
A3022: N | B3022: арт | C3022: назва | D3022: закуп | F3022: к-ть | G3022: цiна | H3022: кф | I3022: продж | J3022: дохiд | K3022: % | L3022: з-та
A3023: 1 | B3023: H65021/MR | C3023: Куртка М65 с отстегивающейся курткой олива (NYCO) ||KU-M65-NY-02 | D3023: 38.39 | E3023: usd | F3023: 1 | G3023: 1589.00 | H3023: 2.07 | I3023: 1112.30 | J3023: 344.50 | K3023: 5 | L3023: =RC[-3]/100*RC[-1] -> 2.07 | M3023: =SUM(R[-1]C[-1]:RC[-1]) -> 
A3025: #11252 (2014-12-15) Львів Назар Максимович - Відправлено-Продано
A3026: N | B3026: арт | C3026: назва | D3026: закуп | F3026: к-ть | G3026: цiна | H3026: кф | I3026: продж | J3026: дохiд | K3026: % | L3026: з-та
A3027: 1 | B3027: _10181/XL | C3027: Куртка-аляска US N3B длинная олива ||10181001/905 | D3027: 34.50 | E3027: euro | F3027: 1 | G3027: 1984.00 | H3027: 2.30 | I3027: 1388.80 | J3027: 526.30 | K3027: 5 | L3027: =RC[-3]/100*RC[-1] -> 2.30
A3028: 2 | B3028: H0815 | C3028: US жетон стальной с резинкой||NS-NS1-SS-15 | D3028: 1.30 | E3028: usd | F3028: 5 | G3028: 53.00 | H3028: 2.04 | I3028: 185.50 | J3028: 55.50 | K3028: 5 | L3028: =RC[-3]/100*RC[-1] -> 2.04 | M3028: =SUM(R[-2]C[-1]:RC[-1]) -> 
A3030: #11283 (2014-12-16) Львів Назар Максимович - Відправлено-Продано
A3031: N | B3031: арт | C3031: назва | D3031: закуп | F3031: к-ть | G3031: цiна | H3031: кф | I3031: продж | J3031: дохiд | K3031: % | L3031: з-та
A3032: 1 | B3032: H4201/LL | C3032: US SFU штаны чёрные (PolyCotton Twill) ||SP-SFU-PT-01 | D3032: 14.49 | E3032: usd | F3032: 2 | G3032: 667.00 | H3032: 2.30 | I3032: 933.80 | J3032: 354.20 | K3032: 5 | L3032: =RC[-3]/100*RC[-1] -> 2.30
A3033: 2 | B3033: H2401/XL | C3033: Куртка DEFENDER POLICE флисовая чёрная ||BL-DEF-HF-01 | D3033: 22.86 | E3033: usd | F3033: 2 | G3033: 1052.00 | H3033: 2.30 | I3033: 1472.80 | J3033: 558.40 | K3033: 5 | L3033: =RC[-3]/100*RC[-1] -> 2.30 | M3033: =SUM(R[-2]C[-1]:RC[-1]) -> 
A3035: #11409 (2014-12-23) Львів Назар Максимович - Відправлено-Продано
A3036: N | B3036: арт | C3036: назва | D3036: закуп | F3036: к-ть | G3036: цiна | H3036: кф | I3036: продж | J3036: дохiд | K3036: % | L3036: з-та
A3037: 1 | B3037: H2401/XL | C3037: Куртка DEFENDER POLICE флисовая чёрная ||BL-DEF-HF-01 | D3037: 457 | E3037: * | F3037: 1 | G3037: 1052.00 | H3037: 2.30 | I3037: 736.40 | J3037: 279.40 | K3037: 5 | L3037: =RC[-3]/100*RC[-1] -> 2.30
A3038: 2 | B3038: H2401/3XL | C3038: Куртка DEFENDER POLICE флисовая чёрная ||BL-DEF-HF-01 | D3038: 457 | E3038: * | F3038: 1 | G3038: 1052.00 | H3038: 2.30 | I3038: 736.40 | J3038: 279.40 | K3038: 5 | L3038: =RC[-3]/100*RC[-1] -> 2.30 | M3038: =SUM(R[-2]C[-1]:RC[-1]) -> 
A3040: #11422 (2014-12-23) Львів Назар Максимович - Відправлено-Продано
A3041: N | B3041: арт | C3041: назва | D3041: закуп | F3041: к-ть | G3041: цiна | H3041: кф | I3041: продж | J3041: дохiд | K3041: % | L3041: з-та
A3042: 1 | B3042: _774432 | C3042: Тепловизор Quantum LD 50S | D3042: 52141 | E3042: * | F3042: 1 | G3042: 72110.00 | H3042: 1.38 | I3042: 57355.00 | J3042: 5214.00 | K3042: 5 | L3042: =RC[-3]/100*RC[-1] -> 1.38 | M3042: =SUM(R[-1]C[-1]:RC[-1]) -> 
A3044: #11424 (2014-12-23) Львів Назар Максимович - Відправлено-Продано
A3045: N | B3045: арт | C3045: назва | D3045: закуп | F3045: к-ть | G3045: цiна | H3045: кф | I3045: продж | J3045: дохiд | K3045: % | L3045: з-та
A3046: 1 | B3046: _774432 | C3046: Тепловизор Quantum LD 50S | D3046: 52141 | E3046: * | F3046: 1 | G3046: 72110.00 | H3046: 1.38 | I3046: 57355.00 | J3046: 5214.00 | K3046: 5 | L3046: =RC[-3]/100*RC[-1] -> 1.38 | M3046: =SUM(R[-1]C[-1]:RC[-1]) -> 
A3048: #11463 (2014-12-25) Львів Назар Максимович - Відправлено-Продано
A3049: N | B3049: арт | C3049: назва | D3049: закуп | F3049: к-ть | G3049: цiна | H3049: кф | I3049: продж | J3049: дохiд | K3049: % | L3049: з-та
A3050: 1 | B3050: H7202 | C3050: US BDU кепка олива (NYCO R/S) ||CZ-COM-CR-02 | D3050: 47 | E3050: * | F3050: 5 | G3050: 111.00 | H3050: 2.36 | I3050: 388.50 | J3050: 153.50 | K3050: 5 | L3050: =RC[-3]/100*RC[-1] -> 2.36
A3051: 2 | B3051: H43041/MR | C3051: US SFU китель польский вудлэнд (PolyCotton) ||BL-SFU-PR-04 | D3051: 290 | E3051: * | F3051: 1 | G3051: 667.00 | H3051: 2.30 | I3051: 466.90 | J3051: 176.90 | K3051: 5 | L3051: =RC[-3]/100*RC[-1] -> 2.30
A3052: 3 | B3052: H4304/MR | C3052: US SFU штаны польский вудлэнд (PolyCotton) ||SP-SFU-PR-04 | D3052: 290 | E3052: * | F3052: 1 | G3052: 667.00 | H3052: 2.30 | I3052: 466.90 | J3052: 176.90 | K3052: 5 | L3052: =RC[-3]/100*RC[-1] -> 2.30
A3053: 4 | B3053: _10181/XL | C3053: Куртка-аляска US N3B длинная олива ||10181001/905 | D3053: 862 | E3053: * | F3053: 1 | G3053: 2156.00 | H3053: 2.50 | I3053: 1509.20 | J3053: 647.20 | K3053: 5 | L3053: =RC[-3]/100*RC[-1] -> 2.50
A3054: 5 | B3054: H4199/LR | C3054: US SFU штаны укр.-цифра (PolyCotton) ||SP-SFU-PR-99 | D3054: 309 | E3054: * | F3054: 1 | G3054: 711.00 | H3054: 2.30 | I3054: 497.70 | J3054: 188.70 | K3054: 5 | L3054: =RC[-3]/100*RC[-1] -> 2.30
A3055: 6 | B3055: H4199/SL | C3055: US SFU штаны укр.-цифра (PolyCotton) ||SP-SFU-PR-99 | D3055: 309 | E3055: * | F3055: 1 | G3055: 711.00 | H3055: 2.30 | I3055: 497.70 | J3055: 188.70 | K3055: 5 | L3055: =RC[-3]/100*RC[-1] -> 2.30
A3056: 7 | B3056: H41991/SL | C3056: US SFU китель укр.-цифра (PolyCotton) ||BL-SFU-PR-99 | D3056: 309 | E3056: * | F3056: 1 | G3056: 711.00 | H3056: 2.30 | I3056: 497.70 | J3056: 188.70 | K3056: 5 | L3056: =RC[-3]/100*RC[-1] -> 2.30 | M3056: =SUM(R[-7]C[-1]:RC[-1]) -> 
A3058: #11526 (2014-12-29) Львів Назар Максимович - Відправлено-Продано
A3059: N | B3059: арт | C3059: назва | D3059: закуп | F3059: к-ть | G3059: цiна | H3059: кф | I3059: продж | J3059: дохiд | K3059: % | L3059: з-та
A3060: 1 | B3060: VNS231696 | C3060: Аккумулятор 9.6V 1600mAh/NiMH stick | D3060: 10.37 | E3060: usd | F3060: 1 | G3060: 319.00 | H3060: 1.54 | I3060: 287.10 | J3060: 79.70 | K3060: 5 | L3060: =RC[-3]/100*RC[-1] -> 1.54
A3061: 2 | B3061: _774432 | C3061: Тепловизор Quantum LD 50S | D3061: 52141.00 | E3061: грн | F3061: 1 | G3061: 72110.00 | H3061: 1.38 | I3061: 57355.00 | J3061: 5214.00 | K3061: 5 | L3061: =RC[-3]/100*RC[-1] -> 1.38 | M3061: =SUM(R[-2]C[-1]:RC[-1]) -> 
A3063: #11546 (2014-12-30) Львів Назар Максимович - Прихід товару
A3064: N | B3064: арт | C3064: назва | D3064: закуп | F3064: к-ть | G3064: цiна | H3064: кф | I3064: продж | J3064: дохiд | K3064: % | L3064: з-та
A3065: 1 | B3065: _QQ005 | C3065: Крепление для подствольного фонаря||QQ 005 | D3065: 3.68 | E3065: Инт | F3065: 1 | G3065: 73.50 | H3065: 1.00 | I3065: 73.50 | J3065: -0.10 | K3065: 5 | L3065: =RC[-3]/100*RC[-1] -> 1.00
A3066: 2 | B3066: _QQ005 | C3066: Крепление для подствольного фонаря||QQ 005 | D3066: 3.68 | E3066: Инт | F3066: 9 | G3066: 73.50 | H3066: 1.00 | I3066: 661.50 | J3066: -0.90 | K3066: 5 | L3066: =RC[-3]/100*RC[-1] -> 1.00
A3067: 3 | B3067: _5.8310 | C3067: Пістолет пневматичний COLT Defender | D3067: 63.25 | E3067: Инт | F3067: 1 | G3067: 1265.00 | H3067: 1.00 | I3067: 1265.00 | J3067: 0.00 | K3067: 5 | L3067: =RC[-3]/100*RC[-1] -> 1.00 | M3067: =SUM(R[-3]C[-1]:RC[-1]) -> 
A3069: #11548 (2014-12-30) Львів Назар Максимович - Прихід товару
A3070: N | B3070: арт | C3070: назва | D3070: закуп | F3070: к-ть | G3070: цiна | H3070: кф | I3070: продж | J3070: дохiд | K3070: % | L3070: з-та
A3071: 1 | B3071: _8006-057 | C3071: Пульки для пнев. оружия WINNER 0.57 гр ( 500 шт ) 4.5мм | D3071: 2.75 | E3071: Инт | F3071: 30 | G3071: 55.00 | H3071: 1.00 | I3071: 1650.00 | J3071: 0.00 | K3071: 5 | L3071: =RC[-3]/100*RC[-1] -> 1.00
A3072: 2 | B3072: _8006-065 | C3072: Пульки для пнев. оружия WINNER 0.65 гр ( 450 шт ) 4.5мм | D3072: 2.75 | E3072: Инт | F3072: 30 | G3072: 55.00 | H3072: 1.00 | I3072: 1650.00 | J3072: 0.00 | K3072: 5 | L3072: =RC[-3]/100*RC[-1] -> 1.00
A3073: 3 | B3073: _8006-074 | C3073: Пульки для пнев. оружия WINNER 0.74 гр ( 400 шт ) 4.5мм | D3073: 2.75 | E3073: Инт | F3073: 20 | G3073: 55.00 | H3073: 1.00 | I3073: 1100.00 | J3073: 0.00 | K3073: 5 | L3073: =RC[-3]/100*RC[-1] -> 1.00
A3074: 4 | B3074: _8006-103 | C3074: Пульки для пнев. оружия WINNER 1.03 гр ( 250 шт ) 4.5мм | D3074: 2.90 | E3074: Инт | F3074: 5 | G3074: 58.00 | H3074: 1.00 | I3074: 290.00 | J3074: 0.00 | K3074: 5 | L3074: =RC[-3]/100*RC[-1] -> 1.00 | M3074: =SUM(R[-4]C[-1]:RC[-1]) -> 
A3076: #11637 (2015-01-13) Львів Назар Максимович - Відправлено-Продано
A3077: N | B3077: арт | C3077: назва | D3077: закуп | F3077: к-ть | G3077: цiна | H3077: кф | I3077: продж | J3077: дохiд | K3077: % | L3077: з-та
A3078: 1 | B3078: H3301/L | C3078: Комплект термобілизни (95% полиэстер 5% спандекс) чёрный ||KP-UN2-PO-01/L | D3078: 400 | E3078: * | F3078: 1 | G3078: 880.00 | H3078: 2.20 | I3078: 616.00 | J3078: 216.00 | K3078: 5 | L3078: =RC[-3]/100*RC[-1] -> 2.20
A3079: 2 | B3079: H0815 | C3079: US жетон стальной с резинкой||NS-NS1-SS-15 | D3079: 26 | E3079: * | F3079: 5 | G3079: 59.00 | H3079: 2.27 | I3079: 206.50 | J3079: 76.50 | K3079: 5 | L3079: =RC[-3]/100*RC[-1] -> 2.27
A3080: 3 | B3080: H7820 | C3080: Хустка SHEMAGH біло/чёрная ||CZ-ARF-CO-20 | D3080: 72 | E3080: * | F3080: 1 | G3080: 159.00 | H3080: 2.21 | I3080: 111.30 | J3080: 39.30 | K3080: 5 | L3080: =RC[-3]/100*RC[-1] -> 2.21
A3081: 4 | B3081: H7811 | C3081: Хустка SHEMAGH койот/чёрная ||CZ-ARF-CO-11 | D3081: 72 | E3081: * | F3081: 1 | G3081: 159.00 | H3081: 2.21 | I3081: 111.30 | J3081: 39.30 | K3081: 5 | L3081: =RC[-3]/100*RC[-1] -> 2.21
A3082: 5 | B3082: _10484/L | C3082: Куртка CWU олива ||10404001/904 | D3082: 569 | E3082: * | F3082: 1 | G3082: 1422.00 | H3082: 2.50 | I3082: 995.40 | J3082: 426.40 | K3082: 5 | L3082: =RC[-3]/100*RC[-1] -> 2.50
A3083: 6 | B3083: H9002/120 | C3083: Ремень ARMY BELT олива ||PS-ARM-CO-02 | D3083: 85 | E3083: * | F3083: 2 | G3083: 193.00 | H3083: 2.27 | I3083: 270.20 | J3083: 100.20 | K3083: 5 | L3083: =RC[-3]/100*RC[-1] -> 2.27
A3084: 7 | B3084: H8602/120 | C3084: Ремень TOUGH NAVY SEAL олива ||PS-NAV-CO-01 | D3084: 85 | E3084: * | F3084: 1 | G3084: 193.00 | H3084: 2.27 | I3084: 135.10 | J3084: 50.10 | K3084: 5 | L3084: =RC[-3]/100*RC[-1] -> 2.27
A3085: 8 | B3085: H8602/140 | C3085: Ремень TOUGH NAVY SEAL олива ||PS-NAV-CO-01 | D3085: 85 | E3085: * | F3085: 1 | G3085: 193.00 | H3085: 2.27 | I3085: 135.10 | J3085: 50.10 | K3085: 5 | L3085: =RC[-3]/100*RC[-1] -> 2.27
A3086: 9 | B3086: H7201 | C3086: US BDU кепка чёрная ( PolyCotton Ripstop) ||CZ-COM-NR-01 | D3086: 47 | E3086: * | F3086: 3 | G3086: 103.00 | H3086: 2.19 | I3086: 216.30 | J3086: 75.30 | K3086: 5 | L3086: =RC[-3]/100*RC[-1] -> 2.19
A3087: 10 | B3087: H7202 | C3087: US BDU кепка олива (NYCO R/S) ||CZ-COM-CR-02 | D3087: 47 | E3087: * | F3087: 5 | G3087: 103.00 | H3087: 2.19 | I3087: 360.50 | J3087: 125.50 | K3087: 5 | L3087: =RC[-3]/100*RC[-1] -> 2.19 | M3087: =SUM(R[-10]C[-1]:RC[-1]) -> 
A3089: #11665 (2015-01-14) Львів Назар Максимович - Відправлено-Продано
A3090: N | B3090: арт | C3090: назва | D3090: закуп | F3090: к-ть | G3090: цiна | H3090: кф | I3090: продж | J3090: дохiд | K3090: % | L3090: з-та
A3091: 1 | B3091: _M11602 | C3091: Нож MORA® Bushcraft Forest | D3091: 381 | E3091: * | F3091: 2 | G3091: 591.00 | H3091: 1.55 | I3091: 1004.70 | J3091: 242.70 | K3091: 5 | L3091: =RC[-3]/100*RC[-1] -> 1.55 | M3091: =SUM(R[-1]C[-1]:RC[-1]) -> 
A3093: #11727 (2015-01-19) Львів Назар Максимович - Відправлено-Продано
A3094: N | B3094: арт | C3094: назва | D3094: закуп | F3094: к-ть | G3094: цiна | H3094: кф | I3094: продж | J3094: дохiд | K3094: % | L3094: з-та
A3095: 1 | B3095: _00376 | C3095: ПНВ Прицел SENTINEL 2.5x50 (Weaver-auto)||ПС | D3095: 4451.70 | E3095: грн | F3095: 1 | G3095: 11760.00 | H3095: 2.64 | I3095: 10584.00 | J3095: 6132.30 | K3095: 5 | L3095: =RC[-3]/100*RC[-1] -> 2.64
A3096: 2 | B3096: _744679 | C3096: ПНВ Прицел SENTINEL 2.5x50 L (Weaver Long)||ПС | D3096: 7306.00 | E3096: грн | F3096: 1 | G3096: 10716.00 | H3096: 1.47 | I3096: 9644.40 | J3096: 2338.40 | K3096: 5 | L3096: =RC[-3]/100*RC[-1] -> 1.47
A3097: 3 | B3097: _00381 | C3097: ПНВ Прицел SENTINEL 3x60 L Weather Long||ПС | D3097: 7597.00 | E3097: грн | F3097: 1 | G3097: 12225.00 | H3097: 1.61 | I3097: 11002.50 | J3097: 3405.50 | K3097: 5 | L3097: =RC[-3]/100*RC[-1] -> 1.61 | M3097: =SUM(R[-3]C[-1]:RC[-1]) -> 
A3099: #11750 (2015-01-20) Львів Назар Максимович - Відправлено-Продано
A3100: N | B3100: арт | C3100: назва | D3100: закуп | F3100: к-ть | G3100: цiна | H3100: кф | I3100: продж | J3100: дохiд | K3100: % | L3100: з-та
A3101: 1 | B3101: H4710/XLL | C3101: US ACU штаны ACU (PolyCotton) ||SP-ACU-PR-10 | D3101: 17.43 | E3101: usd | F3101: 1 | G3101: 767.00 | H3101: 2.20 | I3101: 536.90 | J3101: 188.30 | K3101: 5 | L3101: =RC[-3]/100*RC[-1] -> 2.20
A3102: 2 | B3102: H7820 | C3102: Хустка SHEMAGH біло/чёрная ||CZ-ARF-CO-20 | D3102: 3.62 | E3102: usd | F3102: 1 | G3102: 159.00 | H3102: 2.20 | I3102: 111.30 | J3102: 38.90 | K3102: 5 | L3102: =RC[-3]/100*RC[-1] -> 2.20
A3103: 3 | B3103: H7811 | C3103: Хустка SHEMAGH койот/чёрная ||CZ-ARF-CO-11 | D3103: 3.62 | E3103: usd | F3103: 1 | G3103: 159.00 | H3103: 2.20 | I3103: 111.30 | J3103: 38.90 | K3103: 5 | L3103: =RC[-3]/100*RC[-1] -> 2.20
A3104: 4 | B3104: H7914 | C3104: Шапка флисовая мультикам ||CZ-DOK-FL-14 | D3104: 4.00 | E3104: usd | F3104: 1 | G3104: 200.00 | H3104: 2.50 | I3104: 140.00 | J3104: 60.00 | K3104: 5 | L3104: =RC[-3]/100*RC[-1] -> 2.50
A3105: 5 | B3105: H7904 | C3105: Шапка флисовая пол.вудлэнд ||CZ-DOK-FL-04 | D3105: 3.00 | E3105: usd | F3105: 1 | G3105: 150.00 | H3105: 2.50 | I3105: 105.00 | J3105: 45.00 | K3105: 5 | L3105: =RC[-3]/100*RC[-1] -> 2.50 | M3105: =SUM(R[-5]C[-1]:RC[-1]) -> 
A3107: #11846 (2015-01-23) Львів Назар Максимович - Відправлено-Продано
A3108: N | B3108: арт | C3108: назва | D3108: закуп | F3108: к-ть | G3108: цiна | H3108: кф | I3108: продж | J3108: дохiд | K3108: % | L3108: з-та
A3109: 1 | B3109: H47101/LR | C3109: US ACU китель ACU (PolyCotton) ||BL-ACU-PR-10 | D3109: 349 | E3109: * | F3109: 1 | G3109: 767.00 | H3109: 2.20 | I3109: 536.90 | J3109: 187.90 | K3109: 5 | L3109: =RC[-3]/100*RC[-1] -> 2.20
A3110: 2 | B3110: _10482/L | C3110: Куртка CWU синя ||10404003/904 | D3110: 569 | E3110: * | F3110: 1 | G3110: 1422.00 | H3110: 2.50 | I3110: 995.40 | J3110: 426.40 | K3110: 5 | L3110: =RC[-3]/100*RC[-1] -> 2.50
A3111: 3 | B3111: H7602 | C3111: Балаклава олива с 1-м отв.(96%хлопок, 4%лайкра) ||CZ-KO1-CO-02 | D3111: 36 | E3111: * | F3111: 7 | G3111: 91.00 | H3111: 2.53 | I3111: 445.90 | J3111: 193.90 | K3111: 5 | L3111: =RC[-3]/100*RC[-1] -> 2.53
A3112: 4 | B3112: H7601 | C3112: Балаклава чёрная с 1-м отв.(96%хлопок, 4%лайкра) ||CZ-KO1-CO-01 | D3112: 36 | E3112: * | F3112: 3 | G3112: 91.00 | H3112: 2.53 | I3112: 191.10 | J3112: 83.10 | K3112: 5 | L3112: =RC[-3]/100*RC[-1] -> 2.53
A3113: 5 | B3113: H7201 | C3113: US BDU кепка чёрная ( PolyCotton Ripstop) ||CZ-COM-NR-01 | D3113: 47 | E3113: * | F3113: 2 | G3113: 103.00 | H3113: 2.19 | I3113: 144.20 | J3113: 50.20 | K3113: 5 | L3113: =RC[-3]/100*RC[-1] -> 2.19
A3114: 6 | B3114: H7202 | C3114: US BDU кепка олива (NYCO R/S) ||CZ-COM-CR-02 | D3114: 47 | E3114: * | F3114: 3 | G3114: 103.00 | H3114: 2.19 | I3114: 216.30 | J3114: 75.30 | K3114: 5 | L3114: =RC[-3]/100*RC[-1] -> 2.19
A3115: 7 | B3115: H9002/120 | C3115: Ремень ARMY BELT олива ||PS-ARM-CO-02 | D3115: 85 | E3115: * | F3115: 1 | G3115: 193.00 | H3115: 2.27 | I3115: 135.10 | J3115: 50.10 | K3115: 5 | L3115: =RC[-3]/100*RC[-1] -> 2.27
A3116: 8 | B3116: H8602/130 | C3116: Ремень TOUGH NAVY SEAL олива ||PS-NAV-CO-01 | D3116: 85 | E3116: * | F3116: 1 | G3116: 193.00 | H3116: 2.27 | I3116: 135.10 | J3116: 50.10 | K3116: 5 | L3116: =RC[-3]/100*RC[-1] -> 2.27 | M3116: =SUM(R[-8]C[-1]:RC[-1]) -> 
A3118: #11898 (2015-01-26) Львів Назар Максимович - Відправлено-Продано
A3119: N | B3119: арт | C3119: назва | D3119: закуп | F3119: к-ть | G3119: цiна | H3119: кф | I3119: продж | J3119: дохiд | K3119: % | L3119: з-та
A3120: 1 | B3120: _774628 | C3120: Цифровая насадка на прицел Forward DFA75 50 мм | D3120: 13618 | E3120: * | F3120: 1 | G3120: 22705.00 | H3120: 1.67 | I3120: 18540.00 | J3120: 4922.00 | K3120: 5 | L3120: =RC[-3]/100*RC[-1] -> 1.67 | M3120: =SUM(R[-1]C[-1]:RC[-1]) -> 
A3122: #12040 (2015-02-02) Львів Назар Максимович - Відправлено-Продано
A3123: N | B3123: арт | C3123: назва | D3123: закуп | F3123: к-ть | G3123: цiна | H3123: кф | I3123: продж | J3123: дохiд | K3123: % | L3123: з-та
A3124: 1 | B3124: _10181/XL | C3124: Куртка-аляска US N3B длинная олива ||10181001/905 | D3124: 862 | E3124: * | F3124: 1 | G3124: 2156.00 | H3124: 2.50 | I3124: 1509.20 | J3124: 647.20 | K3124: 5 | L3124: =RC[-3]/100*RC[-1] -> 2.50
A3125: 2 | B3125: H9002/120 | C3125: Ремень ARMY BELT олива ||PS-ARM-CO-02 | D3125: 85 | E3125: * | F3125: 3 | G3125: 193.00 | H3125: 2.27 | I3125: 405.30 | J3125: 150.30 | K3125: 5 | L3125: =RC[-3]/100*RC[-1] -> 2.27
A3126: 3 | B3126: H8902/130 | C3126: Ремень TOUGH US MARINES олива ||PS-USM-CO-02 | D3126: 74 | E3126: * | F3126: 3 | G3126: 193.00 | H3126: 2.61 | I3126: 405.30 | J3126: 183.30 | K3126: 5 | L3126: =RC[-3]/100*RC[-1] -> 2.61
A3127: 4 | B3127: H0815 | C3127: US жетон стальной с резинкой||NS-NS1-SS-15 | D3127: 26 | E3127: * | F3127: 10 | G3127: 59.00 | H3127: 2.27 | I3127: 413.00 | J3127: 153.00 | K3127: 5 | L3127: =RC[-3]/100*RC[-1] -> 2.27
A3128: 5 | B3128: H7202 | C3128: US BDU кепка олива (NYCO R/S) ||CZ-COM-CR-02 | D3128: 47 | E3128: * | F3128: 10 | G3128: 103.00 | H3128: 2.19 | I3128: 721.00 | J3128: 251.00 | K3128: 5 | L3128: =RC[-3]/100*RC[-1] -> 2.19
A3129: 6 | B3129: H7201 | C3129: US BDU кепка чёрная ( PolyCotton Ripstop) ||CZ-COM-NR-01 | D3129: 47 | E3129: * | F3129: 10 | G3129: 103.00 | H3129: 2.19 | I3129: 721.00 | J3129: 251.00 | K3129: 5 | L3129: =RC[-3]/100*RC[-1] -> 2.19
A3130: 7 | B3130: H43041/MR | C3130: US SFU китель польский вудлэнд (PolyCotton) ||BL-SFU-PR-04 | D3130: 290 | E3130: * | F3130: 1 | G3130: 638.00 | H3130: 2.20 | I3130: 446.60 | J3130: 156.60 | K3130: 5 | L3130: =RC[-3]/100*RC[-1] -> 2.20
A3131: 8 | B3131: H4304/MR | C3131: US SFU штаны польский вудлэнд (PolyCotton) ||SP-SFU-PR-04 | D3131: 290 | E3131: * | F3131: 1 | G3131: 638.00 | H3131: 2.20 | I3131: 446.60 | J3131: 156.60 | K3131: 5 | L3131: =RC[-3]/100*RC[-1] -> 2.20
A3132: 9 | B3132: H5940/ML | C3132: CPU штаны A-TACS AU (PolyCotton) ||SP-CPU-PR-40 | D3132: 642 | E3132: * | F3132: 1 | G3132: 1413.00 | H3132: 2.20 | I3132: 989.10 | J3132: 347.10 | K3132: 5 | L3132: =RC[-3]/100*RC[-1] -> 2.20 | M3132: =SUM(R[-9]C[-1]:RC[-1]) -> 
A3134: #12082 (2015-02-04) Львів Назар Максимович - Зарезервовано
A3135: N | B3135: арт | C3135: назва | D3135: закуп | F3135: к-ть | G3135: цiна | H3135: кф | I3135: продж | J3135: дохiд | K3135: % | L3135: з-та
A3136: 1 | B3136: _10181/XXL | C3136: Куртка-аляска US N3B длинная олива ||10181001/906 | D3136: 862 | E3136: * | F3136: 1 | G3136: 2156.00 | H3136: 2.50 | I3136: 1509.20 | J3136: 647.20 | K3136: 5 | L3136: =RC[-3]/100*RC[-1] -> 2.50 | M3136: =SUM(R[-1]C[-1]:RC[-1]) -> 