Sheet:  name
D1: Вхiднi данi | H1: Зкореговано
C2: Закуп: | D2: 93584 | G2: грн
C3: Продано: | D3: 220159 | G3: грн
C4: Дохiд-Коефiцiент: | D4: 126575(2.35)
C5: Процент з-ти: | D5: 2 | G5: %
C6: Нараховано з-ти: | D6: 4403.18 | G6: грн | H6: =SUM(R[4]C[4]:R[472]C[4]) -> 
B7: курси: Все 0 , грн 1 , usd 20 , euro 25 , zl 5 , Инт 20 ,
A9: #11575 (2015-01-09) Магазин Уніформи - Відправлено-Продано
A10: N | B10: арт | C10: назва | D10: закуп | F10: к-ть | G10: цiна | H10: кф | I10: продж | J10: дохiд | K10: % | L10: з-та
A11: 1 | B11: 40484-2 | C11: Балаклава чёрная флисовая | D11: 2.94 | E11: Инт | F11: 2 | G11: 106.00 | H11: 1.80 | I11: 212.00 | J11: 94.40 | K11: 2 | L11: =RC[-3]/100*RC[-1] -> 1.80
A12: 2 | B12: _155155-B | C12: Перчатки флисовые чёрные | D12: 1.83 | E12: Инт | F12: 1 | G12: 83.00 | H12: 2.26 | I12: 83.00 | J12: 46.33 | K12: 2 | L12: =RC[-3]/100*RC[-1] -> 2.26
A13: 3 | B13: 40484-2 | C13: Балаклава чёрная флисовая | D13: 2.94 | E13: Инт | F13: 1 | G13: 106.00 | H13: 1.80 | I13: 95.40 | J13: 36.60 | K13: 2 | L13: =RC[-3]/100*RC[-1] -> 1.80
A14: 4 | B14: _12550 | C14: Перчатки THINSULATE акриловые без пальцев олива ||12540001 | D14: 2.00 | E14: euro | F14: 1 | G14: 120.00 | H14: 2.40 | I14: 108.00 | J14: 58.00 | K14: 2 | L14: =RC[-3]/100*RC[-1] -> 2.40
A15: 5 | B15: G4502/86-170 | C15: Комплект теплого нательного белья (100% полиэстер) олива | D15: 90 | E15: * | F15: 1 | G15: 250.00 | H15: 2.78 | I15: 225.00 | J15: 135.00 | K15: 2 | L15: =RC[-3]/100*RC[-1] -> 2.78
A16: 6 | B16: H5914/SR | C16: CPU штаны мультикамо (PolyCotton) ||SP-CPU-PR-14 | D16: 428 | E16: * | F16: 1 | G16: 942.00 | H16: 2.20 | I16: 847.80 | J16: 419.80 | K16: 2 | L16: =RC[-3]/100*RC[-1] -> 2.20
A17: 7 | B17: H43141/SR | C17: US SFU китель мультикам (PolyCotton) ||BL-SFU-PR-14 | D17: 333 | E17: * | F17: 1 | G17: 732.00 | H17: 2.20 | I17: 631.80 | J17: 298.80 | K17: 2 | L17: =RC[-3]/100*RC[-1] -> 2.20
A18: 8 | B18: A19-143 | C18: Стакан металический маленький ACROPOLIS ||СХМ-1з | D18: 21 | E18: * | F18: 1 | G18: 25.00 | H18: 1.19 | I18: 22.50 | J18: 1.50 | K18: 2 | L18: =RC[-3]/100*RC[-1] -> 1.19
A19: 9 | B19: H02301/M | C19: Носки высокие MEDIUMWEIGHT ||р39-42 ||SK-MWT-WA-01 | D19: 92 | E19: * | F19: 1 | G19: 202.00 | H19: 2.20 | I19: 202.00 | J19: 110.00 | K19: 2 | L19: =RC[-3]/100*RC[-1] -> 2.20
A20: 10 | B20: H0201/10 | C20: Носки шерстяные высокие (чёрные) ||SK-NOR-WA-01 | D20: 108 | E20: * | F20: 1 | G20: 238.00 | H20: 2.20 | I20: 238.00 | J20: 130.00 | K20: 2 | L20: =RC[-3]/100*RC[-1] -> 2.20
A21: 11 | B21: SSS | C21: Салфетки для чистки оружия | D21: 140 | E21: * | F21: 1 | G21: 15.00 | H21: 0.11 | I21: 15.00 | J21: -125.00 | K21: 2 | L21: =RC[-3]/100*RC[-1] -> 0.11
A22: 12 | B22: H0131/M | C22: Перчатки тактические Half Finger чёрные ||RK-HFG-PO-01 | D22: 158 | E22: * | F22: 1 | G22: 347.00 | H22: 2.20 | I22: 312.30 | J22: 154.30 | K22: 2 | L22: =RC[-3]/100*RC[-1] -> 2.20
A23: 13 | B23: H5503/XLL | C23: CARGO штаны вудлэнд (NYCO) ||SP-CAR-NT-03 | D23: 345 | E23: * | F23: 1 | G23: 759.00 | H23: 2.20 | I23: 683.10 | J23: 338.10 | K23: 2 | L23: =RC[-3]/100*RC[-1] -> 2.20
A24: 14 | B24: H7820 | C24: Хустка SHEMAGH біло/чёрная ||CZ-ARF-CO-20 | D24: 72 | E24: * | F24: 1 | G24: 159.00 | H24: 2.21 | I24: 159.00 | J24: 87.00 | K24: 2 | L24: =RC[-3]/100*RC[-1] -> 2.21
A25: 15 | B25: H3302/S | C25: Комплект термобілизни (95% полиэстер 5% спандекс) олива ||KP-UN2-PO-02/S | D25: 400 | E25: * | F25: 1 | G25: 880.00 | H25: 2.20 | I25: 792.00 | J25: 392.00 | K25: 2 | L25: =RC[-3]/100*RC[-1] -> 2.20
A26: 16 | B26: K13082-A | C26: Хлястик T-тип d-ring - ACU [Производитель: ACM] ||M51613082-ACU | D26: 28 | E26: * | F26: 2 | G26: 61.00 | H26: 2.18 | I26: 109.80 | J26: 53.80 | K26: 2 | L26: =RC[-3]/100*RC[-1] -> 2.18
A27: 17 | B27: H7901 | C27: Шапка флисовая чёрная ||CZ-DOK-FL-01 | D27: 40 | E27: * | F27: 1 | G27: 100.00 | H27: 2.50 | I27: 80.00 | J27: 40.00 | K27: 2 | L27: =RC[-3]/100*RC[-1] -> 2.50
A28: 18 | B28: _125501 | C28: Перчатки THINSULATE акриловые без пальцев чёрные ||12540002 | D28: 50 | E28: * | F28: 1 | G28: 120.00 | H28: 2.40 | I28: 120.00 | J28: 70.00 | K28: 2 | L28: =RC[-3]/100*RC[-1] -> 2.40
A29: 19 | B29: H7232 | C29: US BDU кепка олива драп ( PolyCotton Ripstop) ||CZ-COM-NR-32 | D29: 47 | E29: * | F29: 1 | G29: 103.00 | H29: 2.19 | I29: 103.00 | J29: 56.00 | K29: 2 | L29: =RC[-3]/100*RC[-1] -> 2.19
A30: 20 | B30: _109341/G/6/42 | C30: BW гольф на молнии олива (оригинал) TL ||10901001/9 | D30: 300 | E30: * | F30: 4 | G30: 20.00 | H30: 0.07 | I30: 80.00 | J30: -1120.00 | K30: 2 | L30: =RC[-3]/100*RC[-1] -> 0.07
A31: 21 | B31: H0613 | C31: Резиновая кружка хаки ||TK-FOL-PP-13 | D31: 23 | E31: * | F31: 1 | G31: 51.00 | H31: 2.22 | I31: 51.00 | J31: 28.00 | K31: 2 | L31: =RC[-3]/100*RC[-1] -> 2.22 | M31: =SUM(R[-21]C[-1]:RC[-1]) -> 
A33: #11597 (2015-01-10) Магазин Уніформи - Відправлено-Продано
A34: N | B34: арт | C34: назва | D34: закуп | F34: к-ть | G34: цiна | H34: кф | I34: продж | J34: дохiд | K34: % | L34: з-та
A35: 1 | B35: H02101/M | C35: Носки высокие HEAVYWEIGHT ||р39-42 ||SK-HWT-WA-01 | D35: 97 | E35: * | F35: 1 | G35: 213.00 | H35: 2.20 | I35: 213.00 | J35: 116.00 | K35: 2 | L35: =RC[-3]/100*RC[-1] -> 2.20
A36: 2 | B36: H47101/LR | C36: US ACU китель ACU (PolyCotton) ||BL-ACU-PR-10 | D36: 349 | E36: * | F36: 1 | G36: 767.00 | H36: 2.20 | I36: 690.30 | J36: 341.30 | K36: 2 | L36: =RC[-3]/100*RC[-1] -> 2.20
A37: 3 | B37: H4710/LR | C37: US ACU штаны ACU (PolyCotton) ||SP-ACU-PR-10 | D37: 349 | E37: * | F37: 1 | G37: 767.00 | H37: 2.20 | I37: 690.30 | J37: 341.30 | K37: 2 | L37: =RC[-3]/100*RC[-1] -> 2.20
A38: 4 | B38: G4502/92-175 | C38: Комплект теплого нательного белья (100% полиэстер) олива | D38: 90 | E38: * | F38: 1 | G38: 250.00 | H38: 2.78 | I38: 225.00 | J38: 135.00 | K38: 2 | L38: =RC[-3]/100*RC[-1] -> 2.78
A39: 5 | B39: H4011/LR | C39: URBAN TACTICAL штаны койот ||SP-UTL-CO-11 | D39: 743 | E39: * | F39: 1 | G39: 1634.00 | H39: 2.20 | I39: 1470.60 | J39: 727.60 | K39: 2 | L39: =RC[-3]/100*RC[-1] -> 2.20
A40: 6 | B40: H4632/LR | C40: US BDU штаны олива драп (NYCO R/S) ||SP-BDU-NR-32 | D40: 281 | E40: * | F40: 1 | G40: 619.00 | H40: 2.20 | I40: 619.00 | J40: 338.00 | K40: 2 | L40: =RC[-3]/100*RC[-1] -> 2.20
A41: 7 | B41: A0256 | C41: Нашивка 38-а піхотна дивізія армии США ||139581 | D41: 38 | E41: * | F41: 1 | G41: 26.00 | H41: 0.68 | I41: 26.00 | J41: -12.00 | K41: 2 | L41: =RC[-3]/100*RC[-1] -> 0.68
A42: 8 | B42: X4011 | C42: Балаклава чёрная с 1-м отв. нинзя(100%хлопок) ||X76011 | D42: 63 | E42: * | F42: 1 | G42: 80.00 | H42: 1.27 | I42: 80.00 | J42: 17.00 | K42: 2 | L42: =RC[-3]/100*RC[-1] -> 1.27
A43: 9 | B43: _916596-1 | C43: Шапка олива с флисовой подкладкой | D43: 50 | E43: * | F43: 1 | G43: 125.00 | H43: 2.50 | I43: 125.00 | J43: 75.00 | K43: 2 | L43: =RC[-3]/100*RC[-1] -> 2.50
A44: 10 | B44: K17222-C | C44: Балаклава SKULL type C-чёрная [Производитель: ACM] ||M51617222-C | D44: 53 | E44: * | F44: 1 | G44: 117.00 | H44: 2.21 | I44: 117.00 | J44: 64.00 | K44: 2 | L44: =RC[-3]/100*RC[-1] -> 2.21
A45: 11 | B45: H7901 | C45: Шапка флисовая чёрная ||CZ-DOK-FL-01 | D45: 40 | E45: * | F45: 1 | G45: 100.00 | H45: 2.50 | I45: 100.00 | J45: 60.00 | K45: 2 | L45: =RC[-3]/100*RC[-1] -> 2.50
A46: 12 | B46: H3502/XS | C46: Комплект термобілизни (100% полиэстер) олива ||KP-UN1-PO-02 | D46: 274 | E46: * | F46: 2 | G46: 603.00 | H46: 2.20 | I46: 1085.40 | J46: 537.40 | K46: 2 | L46: =RC[-3]/100*RC[-1] -> 2.20
A47: 13 | B47: H3302/XS | C47: Комплект термобілизни (95% полиэстер 5% спандекс) олива ||KP-UN2-PO-02/XS | D47: 400 | E47: * | F47: 1 | G47: 880.00 | H47: 2.20 | I47: 792.00 | J47: 392.00 | K47: 2 | L47: =RC[-3]/100*RC[-1] -> 2.20
A48: 14 | B48: 40484-2 | C48: Балаклава чёрная флисовая | D48: 59 | E48: * | F48: 1 | G48: 106.00 | H48: 1.80 | I48: 95.40 | J48: 36.40 | K48: 2 | L48: =RC[-3]/100*RC[-1] -> 1.80
A49: 15 | B49: H8601/140 | C49: Ремень TOUGH NAVY SEAL чёрный ||PS-NAV-CO-02 | D49: 85 | E49: * | F49: 1 | G49: 193.00 | H49: 2.27 | I49: 193.00 | J49: 108.00 | K49: 2 | L49: =RC[-3]/100*RC[-1] -> 2.27
A50: 16 | B50: _108195/54(3) | C50: Тельник морской с голуб.полосами длинный рукав (байковый) | D50: 1100 | E50: * | F50: 1 | G50: 133.00 | H50: 0.12 | I50: 133.00 | J50: -967.00 | K50: 2 | L50: =RC[-3]/100*RC[-1] -> 0.12
A51: 17 | B51: H47101/MR | C51: US ACU китель ACU (PolyCotton) ||BL-ACU-PR-10 | D51: 349 | E51: * | F51: 1 | G51: 767.00 | H51: 2.20 | I51: 613.60 | J51: 264.60 | K51: 2 | L51: =RC[-3]/100*RC[-1] -> 2.20
A52: 18 | B52: H47101/XLR | C52: US ACU китель ACU (PolyCotton) ||BL-ACU-PR-10 | D52: 349 | E52: * | F52: 1 | G52: 767.00 | H52: 2.20 | I52: 613.60 | J52: 264.60 | K52: 2 | L52: =RC[-3]/100*RC[-1] -> 2.20
A53: 19 | B53: H4710/MR | C53: US ACU штаны ACU (PolyCotton) ||SP-ACU-PR-10 | D53: 349 | E53: * | F53: 1 | G53: 767.00 | H53: 2.20 | I53: 613.60 | J53: 264.60 | K53: 2 | L53: =RC[-3]/100*RC[-1] -> 2.20
A54: 20 | B54: H4710/XLR | C54: US ACU штаны ACU (PolyCotton) ||SP-ACU-PR-10 | D54: 349 | E54: * | F54: 1 | G54: 767.00 | H54: 2.20 | I54: 613.60 | J54: 264.60 | K54: 2 | L54: =RC[-3]/100*RC[-1] -> 2.20
A55: 21 | B55: H49101/MR | C55: Рубашка COMBAT ACU с налокотниками (NYCO POL) ||KO-CS2-PO-10 | D55: 518 | E55: * | F55: 1 | G55: 1139.00 | H55: 2.20 | I55: 911.20 | J55: 393.20 | K55: 2 | L55: =RC[-3]/100*RC[-1] -> 2.20
A56: 22 | B56: _11957/Р/2 | C56: Рос.костюм маскировочный белый | D56: 70 | E56: * | F56: 5 | G56: 164.00 | H56: 2.34 | I56: 656.00 | J56: 306.00 | K56: 2 | L56: =RC[-3]/100*RC[-1] -> 2.34
A57: 23 | B57: H0141/XL | C57: Перчатки тактические US Model чёрные ||RK-USM-PO-01 | D57: 209 | E57: * | F57: 2 | G57: 459.00 | H57: 2.20 | I57: 734.40 | J57: 316.40 | K57: 2 | L57: =RC[-3]/100*RC[-1] -> 2.20
A58: 24 | B58: H7811 | C58: Хустка SHEMAGH койот/чёрная ||CZ-ARF-CO-11 | D58: 72 | E58: * | F58: 2 | G58: 159.00 | H58: 2.21 | I58: 254.40 | J58: 110.40 | K58: 2 | L58: =RC[-3]/100*RC[-1] -> 2.21
A59: 25 | B59: H7820 | C59: Хустка SHEMAGH біло/чёрная ||CZ-ARF-CO-20 | D59: 72 | E59: * | F59: 18 | G59: 159.00 | H59: 2.21 | I59: 2289.60 | J59: 993.60 | K59: 2 | L59: =RC[-3]/100*RC[-1] -> 2.21
A60: 26 | B60: K17112-B | C60: Маска-сетка короткая чёрная ||M51617112-BK | D60: 80 | E60: * | F60: 1 | G60: 176.00 | H60: 2.20 | I60: 123.20 | J60: 43.20 | K60: 2 | L60: =RC[-3]/100*RC[-1] -> 2.20
A61: 27 | B61: Бабки | C61: Прихід Грошей | D61: 0.00 | E61: грн | F61: 1 | G61: 0.00 | H61: 0.00 | I61: 35524.90 | J61: 35523.90 | K61: 2 | L61: =RC[-3]/100*RC[-1] -> 0.00 | M61: =SUM(R[-27]C[-1]:RC[-1]) -> 
A63: #11612 (2015-01-12) Магазин Уніформи - Відправлено-Продано
A64: N | B64: арт | C64: назва | D64: закуп | F64: к-ть | G64: цiна | H64: кф | I64: продж | J64: дохiд | K64: % | L64: з-та
A65: 1 | B65: _155155-O | C65: Перчатки флисовые олива | D65: 37 | E65: * | F65: 1 | G65: 83.00 | H65: 2.24 | I65: 83.00 | J65: 46.00 | K65: 2 | L65: =RC[-3]/100*RC[-1] -> 2.24
A66: 2 | B66: H02101/L | C66: Носки высокие HEAVYWEIGHT ||р43-46 ||SK-HWT-WA-01 | D66: 97 | E66: * | F66: 1 | G66: 213.00 | H66: 2.20 | I66: 213.00 | J66: 116.00 | K66: 2 | L66: =RC[-3]/100*RC[-1] -> 2.20
A67: 3 | B67: 40484-2 | C67: Балаклава чёрная флисовая | D67: 59 | E67: * | F67: 2 | G67: 106.00 | H67: 1.80 | I67: 212.00 | J67: 94.00 | K67: 2 | L67: =RC[-3]/100*RC[-1] -> 1.80
A68: 4 | B68: H4027/MR | C68: URBAN TACTICAL штаны Jungle Green ||SP-UTL-CO-27 | D68: 743 | E68: * | F68: 1 | G68: 1634.00 | H68: 2.20 | I68: 1470.60 | J68: 727.60 | K68: 2 | L68: =RC[-3]/100*RC[-1] -> 2.20
A69: 5 | B69: H88001/L | C69: Ремень US UTILITY чёрный нейлон ||PS-UTL-NL-01 | D69: 112 | E69: * | F69: 1 | G69: 257.00 | H69: 2.29 | I69: 257.00 | J69: 145.00 | K69: 2 | L69: =RC[-3]/100*RC[-1] -> 2.29
A70: 6 | B70: H3301/M | C70: Комплект термобілизни (95% полиэстер 5% спандекс) чёрный ||KP-UN2-PO-01/M | D70: 400 | E70: * | F70: 1 | G70: 880.00 | H70: 2.20 | I70: 880.00 | J70: 480.00 | K70: 2 | L70: =RC[-3]/100*RC[-1] -> 2.20
A71: 7 | B71: R0415 | C71: Тарелка алюминиевая глубокая СССР | D71: 26 | E71: * | F71: 1 | G71: 56.00 | H71: 2.15 | I71: 56.00 | J71: 30.00 | K71: 2 | L71: =RC[-3]/100*RC[-1] -> 2.15
A72: 8 | B72: X4021 | C72: Балаклава олива с 1-м отв. нинзя (100%хлопок) ||X76012 | D72: 63 | E72: * | F72: 1 | G72: 80.00 | H72: 1.27 | I72: 80.00 | J72: 17.00 | K72: 2 | L72: =RC[-3]/100*RC[-1] -> 1.27
A73: 9 | B73: H43041/LR | C73: US SFU китель польский вудлэнд (PolyCotton) ||BL-SFU-PR-04 | D73: 290 | E73: * | F73: 1 | G73: 638.00 | H73: 2.20 | I73: 574.20 | J73: 284.20 | K73: 2 | L73: =RC[-3]/100*RC[-1] -> 2.20
A74: 10 | B74: H4304/MR | C74: US SFU штаны польский вудлэнд (PolyCotton) ||SP-SFU-PR-04 | D74: 290 | E74: * | F74: 1 | G74: 638.00 | H74: 2.20 | I74: 574.20 | J74: 284.20 | K74: 2 | L74: =RC[-3]/100*RC[-1] -> 2.20
A75: 11 | B75: H5827/LR | C75: URBAN TACTICAL штаны Jungle Green PolyCotton ||SP-UTL-PR-27 | D75: 569 | E75: * | F75: 1 | G75: 1251.00 | H75: 2.20 | I75: 1125.90 | J75: 556.90 | K75: 2 | L75: =RC[-3]/100*RC[-1] -> 2.20
A76: 12 | B76: H3302/XS | C76: Комплект термобілизни (95% полиэстер 5% спандекс) олива ||KP-UN2-PO-02/XS | D76: 400 | E76: * | F76: -1 | G76: 880.00 | H76: 2.20 | I76: -880.00 | J76: -480.00 | K76: 2 | L76: =RC[-3]/100*RC[-1] -> 2.20
A77: 13 | B77: H3301/L | C77: Комплект термобілизни (95% полиэстер 5% спандекс) чёрный ||KP-UN2-PO-01/L | D77: 400 | E77: * | F77: 1 | G77: 880.00 | H77: 2.20 | I77: 0.00 | J77: -400.00 | K77: 2 | L77: =RC[-3]/100*RC[-1] -> 2.20 | M77: =SUM(R[-13]C[-1]:RC[-1]) -> 
A79: #11636 (2015-01-13) Магазин Уніформи - Відправлено-Продано
A80: N | B80: арт | C80: назва | D80: закуп | F80: к-ть | G80: цiна | H80: кф | I80: продж | J80: дохiд | K80: % | L80: з-та
A81: 1 | B81: X4021 | C81: Балаклава олива с 1-м отв. нинзя (100%хлопок) ||X76012 | D81: 63 | E81: * | F81: 1 | G81: 80.00 | H81: 1.27 | I81: 80.00 | J81: 17.00 | K81: 2 | L81: =RC[-3]/100*RC[-1] -> 1.27
A82: 2 | B82: H3402/M | C82: Футболка олива ||TS-TSH-CO-29 | D82: 81 | E82: * | F82: 1 | G82: 179.00 | H82: 2.21 | I82: 179.00 | J82: 98.00 | K82: 2 | L82: =RC[-3]/100*RC[-1] -> 2.21
A83: 3 | B83: H5914/MR | C83: CPU штаны мультикамо (PolyCotton) ||SP-CPU-PR-14 | D83: 428 | E83: * | F83: 1 | G83: 942.00 | H83: 2.20 | I83: 987.00 | J83: 559.00 | K83: 2 | L83: =RC[-3]/100*RC[-1] -> 2.20
A84: 4 | B84: H47141/MR | C84: US ACU китель мультикам (NYCO R/S) ||BL-ACU-PR-14 | D84: 461 | E84: * | F84: 1 | G84: 1013.00 | H84: 2.20 | I84: 1059.00 | J84: 598.00 | K84: 2 | L84: =RC[-3]/100*RC[-1] -> 2.20
A85: 5 | B85: H3301/M | C85: Комплект термобілизни (95% полиэстер 5% спандекс) чёрный ||KP-UN2-PO-01/M | D85: 400 | E85: * | F85: 1 | G85: 880.00 | H85: 2.20 | I85: 880.00 | J85: 480.00 | K85: 2 | L85: =RC[-3]/100*RC[-1] -> 2.20
A86: 6 | B86: _11957/Р/2 | C86: Рос.костюм маскировочный белый | D86: 70 | E86: * | F86: 1 | G86: 164.00 | H86: 2.34 | I86: 164.00 | J86: 94.00 | K86: 2 | L86: =RC[-3]/100*RC[-1] -> 2.34
A87: 7 | B87: X4011 | C87: Балаклава чёрная с 1-м отв. нинзя(100%хлопок) ||X76011 | D87: 63 | E87: * | F87: 1 | G87: 80.00 | H87: 1.27 | I87: 80.00 | J87: 17.00 | K87: 2 | L87: =RC[-3]/100*RC[-1] -> 1.27
A88: 8 | B88: K17112-B | C88: Маска-сетка короткая чёрная ||M51617112-BK | D88: 80 | E88: * | F88: 2 | G88: 177.00 | H88: 2.21 | I88: 354.00 | J88: 194.00 | K88: 2 | L88: =RC[-3]/100*RC[-1] -> 2.21
A89: 9 | B89: K17128-B | C89: Реплика шлема MICH2001 RIS чёрный ||M51617128-BK | D89: 379 | E89: * | F89: 1 | G89: 872.00 | H89: 2.30 | I89: 872.00 | J89: 493.00 | K89: 2 | L89: =RC[-3]/100*RC[-1] -> 2.30
A90: 10 | B90: EM1812 | C90: Чохол-кавер на шлем MICH2001 ACU | D90: 87 | E90: * | F90: 1 | G90: 219.00 | H90: 2.52 | I90: 219.00 | J90: 132.00 | K90: 2 | L90: =RC[-3]/100*RC[-1] -> 2.52
A91: 11 | B91: H5814/MR | C91: URBAN TACTICAL штаны мультикам (NYCO R/S) ||SP-UTL-NR-14 | D91: 615 | E91: * | F91: 2 | G91: 1353.00 | H91: 2.20 | I91: 2435.40 | J91: 1205.40 | K91: 2 | L91: =RC[-3]/100*RC[-1] -> 2.20
A92: 12 | B92: H9013/120 | C92: Ремень ARMY BELT хаки ||PS-ARM-CO-13 | D92: 85 | E92: * | F92: 1 | G92: 193.00 | H92: 2.27 | I92: 173.70 | J92: 88.70 | K92: 2 | L92: =RC[-3]/100*RC[-1] -> 2.27
A93: 13 | B93: H7514 | C93: Блайзер мультикам (Polycotton) ||CZ-BBC-PR-14 | D93: 86 | E93: * | F93: 1 | G93: 190.00 | H93: 2.21 | I93: 171.00 | J93: 85.00 | K93: 2 | L93: =RC[-3]/100*RC[-1] -> 2.21
A94: 14 | B94: H7914 | C94: Шапка флисовая мультикам ||CZ-DOK-FL-14 | D94: 80 | E94: * | F94: 1 | G94: 200.00 | H94: 2.50 | I94: 180.00 | J94: 100.00 | K94: 2 | L94: =RC[-3]/100*RC[-1] -> 2.50
A95: 15 | B95: _608-0202/L | C95: Перчатки тактические олива (без палые) | D95: 345 | E95: * | F95: 1 | G95: 517.00 | H95: 1.50 | I95: 465.30 | J95: 120.30 | K95: 2 | L95: =RC[-3]/100*RC[-1] -> 1.50
A96: 16 | B96: H0141/M | C96: Перчатки тактические US Model чёрные ||RK-USM-PO-01 | D96: 209 | E96: * | F96: 1 | G96: 459.00 | H96: 2.20 | I96: 413.10 | J96: 204.10 | K96: 2 | L96: =RC[-3]/100*RC[-1] -> 2.20
A97: 17 | B97: H3410/M | C97: Футболка ACU ||TS-TSH-CO-10 | D97: 81 | E97: * | F97: 1 | G97: 179.00 | H97: 2.21 | I97: 179.00 | J97: 98.00 | K97: 2 | L97: =RC[-3]/100*RC[-1] -> 2.21
A98: 18 | B98: H7210/M | C98: US BDU кепка ACU (NYCO R/S) ||CZ-ACU-NR-10 | D98: 86 | E98: * | F98: 1 | G98: 190.00 | H98: 2.21 | I98: 190.00 | J98: 104.00 | K98: 2 | L98: =RC[-3]/100*RC[-1] -> 2.21
A99: 19 | B99: _108190/54(3) | C99: Тельник морской с голуб.полосами длинный рукав | D99: 125 | E99: * | F99: 1 | G99: 50.00 | H99: 0.40 | I99: 50.00 | J99: -75.00 | K99: 2 | L99: =RC[-3]/100*RC[-1] -> 0.40
A100: 20 | B100: H7106 | C100: US BDU кепка польский дезерт (R/S) ||CZ-COM-CR-06 | D100: 47 | E100: * | F100: 1 | G100: 103.00 | H100: 2.19 | I100: 103.00 | J100: 56.00 | K100: 2 | L100: =RC[-3]/100*RC[-1] -> 2.19
A101: 21 | B101: H5503/XLL | C101: CARGO штаны вудлэнд (NYCO) ||SP-CAR-NT-03 | D101: 345 | E101: * | F101: 1 | G101: 759.00 | H101: 2.20 | I101: 683.10 | J101: 338.10 | K101: 2 | L101: =RC[-3]/100*RC[-1] -> 2.20 | M101: =SUM(R[-21]C[-1]:RC[-1]) -> 
A103: #11673 (2015-01-15) Магазин Уніформи - Відправлено-Продано
A104: N | B104: арт | C104: назва | D104: закуп | F104: к-ть | G104: цiна | H104: кф | I104: продж | J104: дохiд | K104: % | L104: з-та
A105: 1 | B105: DS8838/XL | C105: Носки водонепроницаемые Dexshell Coolvent Lite | D105: 256 | E105: * | F105: 1 | G105: 384.00 | H105: 1.50 | I105: 384.00 | J105: 128.00 | K105: 2 | L105: =RC[-3]/100*RC[-1] -> 1.50
A106: 2 | B106: _13072/30 | C106: NVA носки серые нові 44 ||91307200 | D106: 19 | E106: * | F106: 1 | G106: 43.00 | H106: 2.26 | I106: 43.00 | J106: 24.00 | K106: 2 | L106: =RC[-3]/100*RC[-1] -> 2.26
A107: 3 | B107: X4011 | C107: Балаклава чёрная с 1-м отв. нинзя(100%хлопок) ||X76011 | D107: 63 | E107: * | F107: 1 | G107: 80.00 | H107: 1.27 | I107: 80.00 | J107: 17.00 | K107: 2 | L107: =RC[-3]/100*RC[-1] -> 1.27
A108: 4 | B108: 40484-2 | C108: Балаклава чёрная флисовая | D108: 59 | E108: * | F108: 1 | G108: 106.00 | H108: 1.80 | I108: 106.00 | J108: 47.00 | K108: 2 | L108: =RC[-3]/100*RC[-1] -> 1.80
A109: 5 | B109: H4311/SR | C109: US SFU штаны койот (PolyCotton) ||SP-SFU-PR-11 | D109: 301 | E109: * | F109: 1 | G109: 661.00 | H109: 2.20 | I109: 594.90 | J109: 293.90 | K109: 2 | L109: =RC[-3]/100*RC[-1] -> 2.20
A110: 6 | B110: H8913/120 | C110: Ремень TOUGH US MARINES койот ||PS-USM-CO-13 | D110: 74 | E110: * | F110: 1 | G110: 193.00 | H110: 2.61 | I110: 173.70 | J110: 99.70 | K110: 2 | L110: =RC[-3]/100*RC[-1] -> 2.61
A111: 7 | B111: H7201 | C111: US BDU кепка чёрная ( PolyCotton Ripstop) ||CZ-COM-NR-01 | D111: 47 | E111: * | F111: 2 | G111: 103.00 | H111: 2.19 | I111: 185.40 | J111: 91.40 | K111: 2 | L111: =RC[-3]/100*RC[-1] -> 2.19
A112: 8 | B112: X7299 | C112: US BDU кепка украинская цифра ( PolyCotton Ripstop) | D112: 45 | E112: * | F112: 1 | G112: 99.00 | H112: 2.20 | I112: 89.10 | J112: 44.10 | K112: 2 | L112: =RC[-3]/100*RC[-1] -> 2.20
A113: 9 | B113: _916596 | C113: Шапка чёрная с флисовой подкладкой | D113: 47 | E113: * | F113: 1 | G113: 118.00 | H113: 2.51 | I113: 106.20 | J113: 59.20 | K113: 2 | L113: =RC[-3]/100*RC[-1] -> 2.51
A114: 10 | B114: _181302/120 | C114: Ремень Другої Мировой Войны без пряжки | D114: 1600 | E114: * | F114: 1 | G114: 230.00 | H114: 0.14 | I114: 195.50 | J114: -1404.50 | K114: 2 | L114: =RC[-3]/100*RC[-1] -> 0.14
A115: 11 | B115: S172 | C115: Пряжка к ременя "SS" солдатская | D115: 200 | E115: * | F115: 1 | G115: 235.00 | H115: 1.18 | I115: 199.75 | J115: -0.25 | K115: 2 | L115: =RC[-3]/100*RC[-1] -> 1.18
A116: 12 | B116: H3501/M | C116: Комплект термобілизни (100% полиэстер) чёрный ||KP-UN1-PO-01 | D116: 274 | E116: * | F116: 1 | G116: 603.00 | H116: 2.20 | I116: 603.00 | J116: 329.00 | K116: 2 | L116: =RC[-3]/100*RC[-1] -> 2.20
A117: 13 | B117: EM6628A | C117: Шапка-труба MARPAT||EM6628A | D117: 85 | E117: * | F117: 1 | G117: 187.00 | H117: 2.20 | I117: 187.00 | J117: 102.00 | K117: 2 | L117: =RC[-3]/100*RC[-1] -> 2.20
A118: 14 | B118: _11957/Р/2 | C118: Рос.костюм маскировочный белый | D118: 70 | E118: * | F118: 10 | G118: 164.00 | H118: 2.34 | I118: 1476.00 | J118: 776.00 | K118: 2 | L118: =RC[-3]/100*RC[-1] -> 2.34 | M118: =SUM(R[-14]C[-1]:RC[-1]) -> 
A120: #11695 (2015-01-16) Магазин Уніформи - Відправлено-Продано
A121: N | B121: арт | C121: назва | D121: закуп | F121: к-ть | G121: цiна | H121: кф | I121: продж | J121: дохiд | K121: % | L121: з-та
A122: 1 | B122: X601 | C122: Шапка шерстяная камуфляжна | D122: 2.00 | E122: Инт | F122: 1 | G122: 120.00 | H122: 3.00 | I122: 120.00 | J122: 80.00 | K122: 2 | L122: =RC[-3]/100*RC[-1] -> 3.00
A123: 2 | B123: H47141/SR | C123: US ACU китель мультикам (NYCO R/S) ||BL-ACU-PR-14 | D123: 23.03 | E123: usd | F123: 1 | G123: 1013.00 | H123: 2.20 | I123: 1013.00 | J123: 552.40 | K123: 2 | L123: =RC[-3]/100*RC[-1] -> 2.20
A124: 3 | B124: H5914/SR | C124: CPU штаны мультикамо (PolyCotton) ||SP-CPU-PR-14 | D124: 21.56 | E124: usd | F124: 1 | G124: 949.00 | H124: 2.20 | I124: 942.00 | J124: 510.80 | K124: 2 | L124: =RC[-3]/100*RC[-1] -> 2.20
A125: 4 | B125: _15993/G | C125: BW ремень-стяжка олива 50см б/у ||91599300 | D125: 0.25 | E125: euro | F125: 1 | G125: 16.00 | H125: 2.56 | I125: 16.00 | J125: 9.75 | K125: 2 | L125: =RC[-3]/100*RC[-1] -> 2.56
A126: 5 | B126: _15993/G | C126: BW ремень-стяжка олива 50см б/у ||91599300 | D126: 0.25 | E126: euro | F126: 2 | G126: 16.00 | H126: 2.56 | I126: 32.00 | J126: 19.50 | K126: 2 | L126: =RC[-3]/100*RC[-1] -> 2.56
A127: 6 | B127: H0141/L | C127: Перчатки тактические US Model чёрные ||RK-USM-PO-01 | D127: 10.43 | E127: usd | F127: 1 | G127: 459.00 | H127: 2.20 | I127: 459.00 | J127: 250.40 | K127: 2 | L127: =RC[-3]/100*RC[-1] -> 2.20
A128: 7 | B128: H0141/L | C128: Перчатки тактические US Model чёрные ||RK-USM-PO-01 | D128: 10.43 | E128: usd | F128: 1 | G128: 459.00 | H128: 2.20 | I128: 459.00 | J128: 250.40 | K128: 2 | L128: =RC[-3]/100*RC[-1] -> 2.20
A129: 8 | B129: 53112-16 | C129: Налокотники AltaCONTOUR мультикам [ALTA] ||OL-ACV-CD-34 | D129: 21.60 | E129: usd | F129: 1 | G129: 950.00 | H129: 2.20 | I129: 950.00 | J129: 518.00 | K129: 2 | L129: =RC[-3]/100*RC[-1] -> 2.20
A130: 9 | B130: 52913-16 | C130: Наколінники AltaCOUNTOUR Flexible мультикам [ALTA] ||OK-ACL-CD-34 | D130: 24.21 | E130: usd | F130: 1 | G130: 1065.00 | H130: 2.20 | I130: 1065.00 | J130: 580.80 | K130: 2 | L130: =RC[-3]/100*RC[-1] -> 2.20
A131: 10 | B131: H7914 | C131: Шапка флисовая мультикам ||CZ-DOK-FL-14 | D131: 4.00 | E131: usd | F131: 1 | G131: 200.00 | H131: 2.50 | I131: 200.00 | J131: 120.00 | K131: 2 | L131: =RC[-3]/100*RC[-1] -> 2.50
A132: 11 | B132: H5814/LR | C132: URBAN TACTICAL штаны мультикам (NYCO R/S) ||SP-UTL-NR-14 | D132: 30.75 | E132: usd | F132: 1 | G132: 1353.00 | H132: 2.20 | I132: 1353.00 | J132: 738.00 | K132: 2 | L132: =RC[-3]/100*RC[-1] -> 2.20
A133: 12 | B133: H3301/L | C133: Комплект термобілизни (95% полиэстер 5% спандекс) чёрный ||KP-UN2-PO-01/L | D133: 19.99 | E133: usd | F133: 1 | G133: 880.00 | H133: 2.20 | I133: 880.00 | J133: 480.20 | K133: 2 | L133: =RC[-3]/100*RC[-1] -> 2.20
A134: 13 | B134: H47141/MR | C134: US ACU китель мультикам (NYCO R/S) ||BL-ACU-PR-14 | D134: 23.03 | E134: usd | F134: 1 | G134: 1013.00 | H134: 2.20 | I134: 1013.00 | J134: 552.40 | K134: 2 | L134: =RC[-3]/100*RC[-1] -> 2.20
A135: 14 | B135: BD5560B | C135: Тактический ремень мультикам | D135: 6.81 | E135: usd | F135: 1 | G135: 300.00 | H135: 2.20 | I135: 300.00 | J135: 163.80 | K135: 2 | L135: =RC[-3]/100*RC[-1] -> 2.20
A136: 15 | B136: H02101/L | C136: Носки высокие HEAVYWEIGHT ||р43-46 ||SK-HWT-WA-01 | D136: 4.83 | E136: usd | F136: 1 | G136: 213.00 | H136: 2.20 | I136: 213.00 | J136: 116.40 | K136: 2 | L136: =RC[-3]/100*RC[-1] -> 2.20
A137: 16 | B137: H7513 | C137: Блайзер беж (Polycotton) ||CZ-BBC-CR-13 | D137: 4.31 | E137: usd | F137: 1 | G137: 190.00 | H137: 2.20 | I137: 190.00 | J137: 103.80 | K137: 2 | L137: =RC[-3]/100*RC[-1] -> 2.20
A138: 17 | B138: H4027/SR | C138: URBAN TACTICAL штаны Jungle Green ||SP-UTL-CO-27 | D138: 37.13 | E138: usd | F138: 1 | G138: 1634.00 | H138: 2.20 | I138: 1634.00 | J138: 891.40 | K138: 2 | L138: =RC[-3]/100*RC[-1] -> 2.20
A139: 18 | B139: H6502/SR | C139: US М65 штаны олива (NYCO) ||SP-M65-NY-02 | D139: 19.44 | E139: usd | F139: 1 | G139: 855.00 | H139: 2.20 | I139: 769.50 | J139: 380.70 | K139: 2 | L139: =RC[-3]/100*RC[-1] -> 2.20
A140: 19 | B140: _11957/Р/2 | C140: Рос.костюм маскировочный белый | D140: 2.80 | E140: euro | F140: 25 | G140: 164.00 | H140: 2.34 | I140: 3690.00 | J140: 1940.00 | K140: 2 | L140: =RC[-3]/100*RC[-1] -> 2.34
A141: 20 | B141: _TRC-019 | C141: Термокружка TRAMP с поїлкою 400мл | D141: 6.40 | E141: Инт | F141: 1 | G141: 196.00 | H141: 1.53 | I141: 176.40 | J141: 48.40 | K141: 2 | L141: =RC[-3]/100*RC[-1] -> 1.53
A142: 21 | B142: H0141/M | C142: Перчатки тактические US Model чёрные ||RK-USM-PO-01 | D142: 10.43 | E142: usd | F142: 1 | G142: 459.00 | H142: 2.20 | I142: 413.10 | J142: 204.50 | K142: 2 | L142: =RC[-3]/100*RC[-1] -> 2.20
A143: 22 | B143: H7514 | C143: Блайзер мультикам (Polycotton) ||CZ-BBC-PR-14 | D143: 86 | E143: * | F143: 1 | G143: 190.00 | H143: 2.21 | I143: 190.00 | J143: 104.00 | K143: 2 | L143: =RC[-3]/100*RC[-1] -> 2.21 | M143: =SUM(R[-22]C[-1]:RC[-1]) -> 
A145: #11721 (2015-01-19) Магазин Уніформи - Відправлено-Продано
A146: N | B146: арт | C146: назва | D146: закуп | F146: к-ть | G146: цiна | H146: кф | I146: продж | J146: дохiд | K146: % | L146: з-та
A147: 1 | B147: H02101/L | C147: Носки высокие HEAVYWEIGHT ||р43-46 ||SK-HWT-WA-01 | D147: 97 | E147: * | F147: 1 | G147: 213.00 | H147: 2.20 | I147: 213.00 | J147: 116.00 | K147: 2 | L147: =RC[-3]/100*RC[-1] -> 2.20
A148: 2 | B148: H7904 | C148: Шапка флисовая пол.вудлэнд ||CZ-DOK-FL-04 | D148: 60 | E148: * | F148: 1 | G148: 150.00 | H148: 2.50 | I148: 120.00 | J148: 60.00 | K148: 2 | L148: =RC[-3]/100*RC[-1] -> 2.50
A149: 3 | B149: H7914 | C149: Шапка флисовая мультикам ||CZ-DOK-FL-14 | D149: 80 | E149: * | F149: 1 | G149: 200.00 | H149: 2.50 | I149: 200.00 | J149: 120.00 | K149: 2 | L149: =RC[-3]/100*RC[-1] -> 2.50
A150: 4 | B150: H0141/S | C150: Перчатки тактические US Model чёрные ||RK-USM-PO-01 | D150: 209 | E150: * | F150: 1 | G150: 459.00 | H150: 2.20 | I150: 459.00 | J150: 250.00 | K150: 2 | L150: =RC[-3]/100*RC[-1] -> 2.20
A151: 5 | B151: _155155-O | C151: Перчатки флисовые олива | D151: 37 | E151: * | F151: 1 | G151: 83.00 | H151: 2.24 | I151: 83.00 | J151: 46.00 | K151: 2 | L151: =RC[-3]/100*RC[-1] -> 2.24
A152: 6 | B152: H02101/M | C152: Носки высокие HEAVYWEIGHT ||р39-42 ||SK-HWT-WA-01 | D152: 97 | E152: * | F152: 1 | G152: 213.00 | H152: 2.20 | I152: 213.00 | J152: 116.00 | K152: 2 | L152: =RC[-3]/100*RC[-1] -> 2.20
A153: 7 | B153: 52913-16 | C153: Наколінники AltaCOUNTOUR Flexible мультикам [ALTA] ||OK-ACL-CD-34 | D153: 484 | E153: * | F153: 1 | G153: 1065.00 | H153: 2.20 | I153: 1065.00 | J153: 581.00 | K153: 2 | L153: =RC[-3]/100*RC[-1] -> 2.20
A154: 8 | B154: X4011 | C154: Балаклава чёрная с 1-м отв. нинзя(100%хлопок) ||X76011 | D154: 63 | E154: * | F154: 1 | G154: 80.00 | H154: 1.27 | I154: 80.00 | J154: 17.00 | K154: 2 | L154: =RC[-3]/100*RC[-1] -> 1.27
A155: 9 | B155: _18309008 | C155: WH лычки UFFZ.INF.белые (REPRO) | D155: 162 | E155: * | F155: 1 | G155: 374.00 | H155: 2.31 | I155: 374.00 | J155: 212.00 | K155: 2 | L155: =RC[-3]/100*RC[-1] -> 2.31
A156: 10 | B156: A19-169/25-27 | C156: Носки охотничьи зимние ACROPOLIS ||ШКМ-2/25-27 | D156: 21 | E156: * | F156: 1 | G156: 33.00 | H156: 1.57 | I156: 33.00 | J156: 12.00 | K156: 2 | L156: =RC[-3]/100*RC[-1] -> 1.57
A157: 11 | B157: X4021 | C157: Балаклава олива с 1-м отв. нинзя (100%хлопок) ||X76012 | D157: 63 | E157: * | F157: 1 | G157: 80.00 | H157: 1.27 | I157: 80.00 | J157: 17.00 | K157: 2 | L157: =RC[-3]/100*RC[-1] -> 1.27 | M157: =SUM(R[-11]C[-1]:RC[-1]) -> 
A159: #11728 (2015-01-19) Магазин Уніформи - Відправлено-Продано
A160: N | B160: арт | C160: назва | D160: закуп | F160: к-ть | G160: цiна | H160: кф | I160: продж | J160: дохiд | K160: % | L160: з-та
A161: 1 | B161: G0001 | C161: Комплект (наколенники и налокотники) койот | D161: 350 | E161: * | F161: 1 | G161: 600.00 | H161: 1.71 | I161: 600.00 | J161: 250.00 | K161: 2 | L161: =RC[-3]/100*RC[-1] -> 1.71
A162: 2 | B162: X4011 | C162: Балаклава чёрная с 1-м отв. нинзя(100%хлопок) ||X76011 | D162: 63 | E162: * | F162: 1 | G162: 80.00 | H162: 1.27 | I162: 80.00 | J162: 17.00 | K162: 2 | L162: =RC[-3]/100*RC[-1] -> 1.27
A163: 3 | B163: _TRC-037 | C163: Кружка TRAMP 500 мл, складные ручки | D163: 141 | E163: * | F163: 1 | G163: 226.00 | H163: 1.60 | I163: 203.40 | J163: 62.40 | K163: 2 | L163: =RC[-3]/100*RC[-1] -> 1.60
A164: 4 | B164: H7214/M-57 | C164: US ACU кепка мультикам (NYCO R/S) ||CZ-ACU-PR-14 | D164: 86 | E164: * | F164: 1 | G164: 190.00 | H164: 2.21 | I164: 171.00 | J164: 85.00 | K164: 2 | L164: =RC[-3]/100*RC[-1] -> 2.21
A165: 5 | B165: H7914 | C165: Шапка флисовая мультикам ||CZ-DOK-FL-14 | D165: 80 | E165: * | F165: 1 | G165: 200.00 | H165: 2.50 | I165: 180.00 | J165: 100.00 | K165: 2 | L165: =RC[-3]/100*RC[-1] -> 2.50
A166: 6 | B166: H5914/MR | C166: CPU штаны мультикамо (PolyCotton) ||SP-CPU-PR-14 | D166: 431 | E166: * | F166: 1 | G166: 949.00 | H166: 2.20 | I166: 854.10 | J166: 423.10 | K166: 2 | L166: =RC[-3]/100*RC[-1] -> 2.20
A167: 7 | B167: 50413-15 | C167: Наколінники AltaFLEX Long Cap UCP(R) [ALTA] ||OK-AFL-CD-10 | D167: 351 | E167: * | F167: 1 | G167: 772.00 | H167: 2.20 | I167: 694.80 | J167: 343.80 | K167: 2 | L167: =RC[-3]/100*RC[-1] -> 2.20
A168: 8 | B168: 53112-15 | C168: Налокотники AltaCONTOUR UCP(R) [ALTA] ||OL-ACV-CD-10 | D168: 432 | E168: * | F168: 1 | G168: 950.00 | H168: 2.20 | I168: 855.00 | J168: 423.00 | K168: 2 | L168: =RC[-3]/100*RC[-1] -> 2.20
A169: 9 | B169: H98701 | C169: Портмоне чорне ||PF-PRF-PO-01 | D169: 48 | E169: * | F169: 1 | G169: 111.00 | H169: 2.31 | I169: 99.90 | J169: 51.90 | K169: 2 | L169: =RC[-3]/100*RC[-1] -> 2.31
A170: 10 | B170: A16661/L | C170: Шлем кевларовий б/у | D170: 3500 | E170: * | F170: 1 | G170: 5796.00 | H170: 1.66 | I170: 5216.40 | J170: 1716.40 | K170: 2 | L170: =RC[-3]/100*RC[-1] -> 1.66
A171: 11 | B171: H7914 | C171: Шапка флисовая мультикам ||CZ-DOK-FL-14 | D171: 80 | E171: * | F171: 1 | G171: 200.00 | H171: 2.50 | I171: 160.00 | J171: 80.00 | K171: 2 | L171: =RC[-3]/100*RC[-1] -> 2.50
A172: 12 | B172: _11957/XXL | C172: BW костюм маскировочный зимний камуфляж ||11971000/906 | D172: 488 | E172: * | F172: 1 | G172: 1122.00 | H172: 2.30 | I172: 1122.00 | J172: 634.00 | K172: 2 | L172: =RC[-3]/100*RC[-1] -> 2.30
A173: 13 | B173: 40484-2 | C173: Балаклава чёрная флисовая | D173: 59 | E173: * | F173: 1 | G173: 106.00 | H173: 1.80 | I173: 106.00 | J173: 47.00 | K173: 2 | L173: =RC[-3]/100*RC[-1] -> 1.80
A174: 14 | B174: _155155-B | C174: Перчатки флисовые чёрные | D174: 37 | E174: * | F174: 1 | G174: 83.00 | H174: 2.24 | I174: 83.00 | J174: 46.00 | K174: 2 | L174: =RC[-3]/100*RC[-1] -> 2.24 | M174: =SUM(R[-14]C[-1]:RC[-1]) -> 
A176: #11746 (2015-01-20) Магазин Уніформи - Відправлено-Продано
A177: N | B177: арт | C177: назва | D177: закуп | F177: к-ть | G177: цiна | H177: кф | I177: продж | J177: дохiд | K177: % | L177: з-та
A178: 1 | B178: H7914 | C178: Шапка флисовая мультикам ||CZ-DOK-FL-14 | D178: 4.00 | E178: usd | F178: 1 | G178: 200.00 | H178: 2.50 | I178: 180.00 | J178: 100.00 | K178: 2 | L178: =RC[-3]/100*RC[-1] -> 2.50
A179: 2 | B179: H0501G/AB+ | C179: Ліпучка група крові чёрная резина ||OD-BLP-RB-01 | D179: 2.01 | E179: usd | F179: 1 | G179: 89.00 | H179: 2.21 | I179: 80.10 | J179: 39.90 | K179: 2 | L179: =RC[-3]/100*RC[-1] -> 2.21
A180: 3 | B180: H7514 | C180: Блайзер мультикам (Polycotton) ||CZ-BBC-PR-14 | D180: 4.31 | E180: usd | F180: 1 | G180: 190.00 | H180: 2.20 | I180: 171.00 | J180: 84.80 | K180: 2 | L180: =RC[-3]/100*RC[-1] -> 2.20
A181: 4 | B181: H45031/2XLR | C181: US BDU китель вудлэнд (NYCO) ||BL-BDU-NT-03 | D181: 14.06 | E181: usd | F181: 1 | G181: 619.00 | H181: 2.20 | I181: 619.00 | J181: 337.80 | K181: 2 | L181: =RC[-3]/100*RC[-1] -> 2.20
A182: 5 | B182: H4503/2XLR | C182: US BDU штаны вудлэнд (NYCO) ||SP-BDU-NT-03 | D182: 14.06 | E182: usd | F182: 1 | G182: 619.00 | H182: 2.20 | I182: 619.00 | J182: 337.80 | K182: 2 | L182: =RC[-3]/100*RC[-1] -> 2.20
A183: 6 | B183: A19-143 | C183: Стакан металический маленький ACROPOLIS ||СХМ-1з | D183: 17.42 | E183: грн | F183: 1 | G183: 25.00 | H183: 1.44 | I183: 25.00 | J183: 7.58 | K183: 2 | L183: =RC[-3]/100*RC[-1] -> 1.44
A184: 7 | B184: H9002/120 | C184: Ремень ARMY BELT олива ||PS-ARM-CO-02 | D184: 4.23 | E184: usd | F184: 1 | G184: 193.00 | H184: 2.28 | I184: 193.00 | J184: 108.40 | K184: 2 | L184: =RC[-3]/100*RC[-1] -> 2.28
A185: 8 | B185: _11957/Р/2 | C185: Рос.костюм маскировочный белый | D185: 2.80 | E185: euro | F185: 10 | G185: 164.00 | H185: 2.34 | I185: 1476.00 | J185: 776.00 | K185: 2 | L185: =RC[-3]/100*RC[-1] -> 2.34
A186: 9 | B186: K104707/MR | C186: Комплект формы марпат ACU китель, штаны, кепка (R/S) ||KP-ACU-PR-07 | D186: 14.00 | E186: usd | F186: 1 | G186: 616.00 | H186: 2.20 | I186: 616.00 | J186: 336.00 | K186: 2 | L186: =RC[-3]/100*RC[-1] -> 2.20
A187: 10 | B187: X402 | C187: Балаклава олива с 1-м отв.(100%хлопок) ||X76012 | D187: 3.15 | E187: Инт | F187: 1 | G187: 80.00 | H187: 1.27 | I187: 80.00 | J187: 17.00 | K187: 2 | L187: =RC[-3]/100*RC[-1] -> 1.27
A188: 11 | B188: X4021 | C188: Балаклава олива с 1-м отв. нинзя (100%хлопок) ||X76012 | D188: 3.15 | E188: Инт | F188: 1 | G188: 80.00 | H188: 1.27 | I188: 80.00 | J188: 17.00 | K188: 2 | L188: =RC[-3]/100*RC[-1] -> 1.27
A189: 12 | B189: H7911 | C189: Шапка флисовая койот ||CZ-DOK-FL-11 | D189: 2.00 | E189: usd | F189: 1 | G189: 100.00 | H189: 2.50 | I189: 100.00 | J189: 60.00 | K189: 2 | L189: =RC[-3]/100*RC[-1] -> 2.50
A190: 13 | B190: H9013/120 | C190: Ремень ARMY BELT хаки ||PS-ARM-CO-13 | D190: 4.23 | E190: usd | F190: 1 | G190: 193.00 | H190: 2.28 | I190: 193.00 | J190: 108.40 | K190: 2 | L190: =RC[-3]/100*RC[-1] -> 2.28
A191: 14 | B191: H7811 | C191: Хустка SHEMAGH койот/чёрная ||CZ-ARF-CO-11 | D191: 72 | E191: * | F191: 1 | G191: 159.00 | H191: 2.21 | I191: 159.00 | J191: 87.00 | K191: 2 | L191: =RC[-3]/100*RC[-1] -> 2.21 | M191: =SUM(R[-14]C[-1]:RC[-1]) -> 
A193: #11782 (2015-01-21) Магазин Уніформи - Відправлено-Продано
A194: N | B194: арт | C194: назва | D194: закуп | F194: к-ть | G194: цiна | H194: кф | I194: продж | J194: дохiд | K194: % | L194: з-та
A195: 1 | B195: EM6628D | C195: Шапка-труба ATAK-FG ||EM6628D | D195: 85 | E195: * | F195: 1 | G195: 187.00 | H195: 2.20 | I195: 187.00 | J195: 102.00 | K195: 2 | L195: =RC[-3]/100*RC[-1] -> 2.20
A196: 2 | B196: H0301 | C196: Наколінники неопренові к штанів ||OC-LPI-NE-01 | D196: 99 | E196: * | F196: 1 | G196: 217.00 | H196: 2.19 | I196: 217.00 | J196: 118.00 | K196: 2 | L196: =RC[-3]/100*RC[-1] -> 2.19
A197: 3 | B197: H8902/120 | C197: Ремень TOUGH US MARINES олива ||PS-USM-CO-02 | D197: 74 | E197: * | F197: 1 | G197: 193.00 | H197: 2.61 | I197: 193.00 | J197: 119.00 | K197: 2 | L197: =RC[-3]/100*RC[-1] -> 2.61
A198: 4 | B198: _TRC-029 | C198: Термос TRAMP 1,6 л | D198: 399 | E198: * | F198: 1 | G198: 559.00 | H198: 1.40 | I198: 559.00 | J198: 160.00 | K198: 2 | L198: =RC[-3]/100*RC[-1] -> 1.40
A199: 5 | B199: H7911 | C199: Шапка флисовая койот ||CZ-DOK-FL-11 | D199: 40 | E199: * | F199: 1 | G199: 100.00 | H199: 2.50 | I199: 100.00 | J199: 60.00 | K199: 2 | L199: =RC[-3]/100*RC[-1] -> 2.50
A200: 6 | B200: H3302/2XL | C200: Комплект термобілизни (95% полиэстер 5% спандекс) олива ||KP-UN2-PO-02/2XL | D200: 400 | E200: * | F200: 1 | G200: 880.00 | H200: 2.20 | I200: 880.00 | J200: 480.00 | K200: 2 | L200: =RC[-3]/100*RC[-1] -> 2.20
A201: 7 | B201: H7514 | C201: Блайзер мультикам (Polycotton) ||CZ-BBC-PR-14 | D201: 86 | E201: * | F201: 1 | G201: 190.00 | H201: 2.21 | I201: 190.00 | J201: 104.00 | K201: 2 | L201: =RC[-3]/100*RC[-1] -> 2.21
A202: 8 | B202: H4027/2XLR | C202: URBAN TACTICAL штаны Jungle Green ||SP-UTL-CO-27 | D202: 743 | E202: * | F202: 1 | G202: 1634.00 | H202: 2.20 | I202: 1470.60 | J202: 727.60 | K202: 2 | L202: =RC[-3]/100*RC[-1] -> 2.20
A203: 9 | B203: DS8838/XL | C203: Носки водонепроницаемые Dexshell Coolvent Lite | D203: 256 | E203: * | F203: 1 | G203: 384.00 | H203: 1.50 | I203: 345.60 | J203: 89.60 | K203: 2 | L203: =RC[-3]/100*RC[-1] -> 1.50
A204: 10 | B204: DS8830W/L | C204: Носки водонепроницаемые DexShell Overcalf Wading | D204: 483 | E204: * | F204: 1 | G204: 725.00 | H204: 1.50 | I204: 580.00 | J204: 97.00 | K204: 2 | L204: =RC[-3]/100*RC[-1] -> 1.50
A205: 11 | B205: H3301/XL | C205: Комплект термобілизни (95% полиэстер 5% спандекс) чёрный ||KP-UN2-PO-01/XL | D205: 400 | E205: * | F205: 1 | G205: 880.00 | H205: 2.20 | I205: 704.00 | J205: 304.00 | K205: 2 | L205: =RC[-3]/100*RC[-1] -> 2.20
A206: 12 | B206: 40484-2 | C206: Балаклава чёрная флисовая | D206: 59 | E206: * | F206: 1 | G206: 106.00 | H206: 1.80 | I206: 106.00 | J206: 47.00 | K206: 2 | L206: =RC[-3]/100*RC[-1] -> 1.80
A207: 13 | B207: H2014/XL | C207: Куртка LIBERTY флисовая мультикам 390г/м (superfine) ||BL-LIB-HF-14 | D207: 620 | E207: * | F207: 1 | G207: 1364.00 | H207: 2.20 | I207: 1091.20 | J207: 471.20 | K207: 2 | L207: =RC[-3]/100*RC[-1] -> 2.20 | M207: =SUM(R[-13]C[-1]:RC[-1]) -> 
A209: #11808 (2015-01-22) Магазин Уніформи - Відправлено-Продано
A210: N | B210: арт | C210: назва | D210: закуп | F210: к-ть | G210: цiна | H210: кф | I210: продж | J210: дохiд | K210: % | L210: з-та
A211: 1 | B211: X4011 | C211: Балаклава чёрная с 1-м отв. нинзя(100%хлопок) ||X76011 | D211: 63 | E211: * | F211: 3 | G211: 80.00 | H211: 1.27 | I211: 240.00 | J211: 51.00 | K211: 2 | L211: =RC[-3]/100*RC[-1] -> 1.27
A212: 2 | B212: H0602 | C212: Резиновая кружка олива ||TK-FOL-PP-02 | D212: 23 | E212: * | F212: 1 | G212: 51.00 | H212: 2.22 | I212: 51.00 | J212: 28.00 | K212: 2 | L212: =RC[-3]/100*RC[-1] -> 2.22
A213: 3 | B213: _TRC-008 | C213: Термокружка TRAMP 225 мл | D213: 93 | E213: * | F213: 1 | G213: 153.00 | H213: 1.65 | I213: 153.00 | J213: 60.00 | K213: 2 | L213: =RC[-3]/100*RC[-1] -> 1.65
A214: 4 | B214: H02101/L | C214: Носки высокие HEAVYWEIGHT ||р43-46 ||SK-HWT-WA-01 | D214: 97 | E214: * | F214: 1 | G214: 213.00 | H214: 2.20 | I214: 203.00 | J214: 106.00 | K214: 2 | L214: =RC[-3]/100*RC[-1] -> 2.20
A215: 5 | B215: _703025-11 | C215: Перчатки флисовые Adventure | D215: 217 | E215: * | F215: 1 | G215: 361.00 | H215: 1.66 | I215: 360.00 | J215: 143.00 | K215: 2 | L215: =RC[-3]/100*RC[-1] -> 1.66
A216: 6 | B216: _11957/Р/1 | C216: Рос.костюм маскировочный белый | D216: 70 | E216: * | F216: 1 | G216: 164.00 | H216: 2.34 | I216: 164.00 | J216: 94.00 | K216: 2 | L216: =RC[-3]/100*RC[-1] -> 2.34
A217: 7 | B217: H7902 | C217: Шапка флисовая олива ||CZ-DOK-FL-02 | D217: 40 | E217: * | F217: 1 | G217: 100.00 | H217: 2.50 | I217: 80.00 | J217: 40.00 | K217: 2 | L217: =RC[-3]/100*RC[-1] -> 2.50
A218: 8 | B218: _155155-B | C218: Перчатки флисовые чёрные | D218: 37 | E218: * | F218: 1 | G218: 83.00 | H218: 2.24 | I218: 83.00 | J218: 46.00 | K218: 2 | L218: =RC[-3]/100*RC[-1] -> 2.24
A219: 9 | B219: H3412/L | C219: Футболка Black Camo ||TS-TSH-CO-12 | D219: 81 | E219: * | F219: 2 | G219: 179.00 | H219: 2.21 | I219: 358.00 | J219: 196.00 | K219: 2 | L219: =RC[-3]/100*RC[-1] -> 2.21
A220: 10 | B220: H02101/M | C220: Носки высокие HEAVYWEIGHT ||р39-42 ||SK-HWT-WA-01 | D220: 97 | E220: * | F220: 1 | G220: 213.00 | H220: 2.20 | I220: 213.00 | J220: 116.00 | K220: 2 | L220: =RC[-3]/100*RC[-1] -> 2.20
A221: 11 | B221: H7201 | C221: US BDU кепка чёрная ( PolyCotton Ripstop) ||CZ-COM-NR-01 | D221: 47 | E221: * | F221: 1 | G221: 103.00 | H221: 2.19 | I221: 103.00 | J221: 56.00 | K221: 2 | L221: =RC[-3]/100*RC[-1] -> 2.19
A222: 12 | B222: 40484-2 | C222: Балаклава чёрная флисовая | D222: 59 | E222: * | F222: 1 | G222: 106.00 | H222: 1.80 | I222: 106.00 | J222: 47.00 | K222: 2 | L222: =RC[-3]/100*RC[-1] -> 1.80
A223: 13 | B223: X4021 | C223: Балаклава олива с 1-м отв. нинзя (100%хлопок) ||X76012 | D223: 63 | E223: * | F223: 2 | G223: 80.00 | H223: 1.27 | I223: 160.00 | J223: 34.00 | K223: 2 | L223: =RC[-3]/100*RC[-1] -> 1.27 | M223: =SUM(R[-13]C[-1]:RC[-1]) -> 
A225: #11839 (2015-01-23) Магазин Уніформи - Відправлено-Продано
A226: N | B226: арт | C226: назва | D226: закуп | F226: к-ть | G226: цiна | H226: кф | I226: продж | J226: дохiд | K226: % | L226: з-та
A227: 1 | B227: M0011/2XL | C227: Футболка Sc белая | D227: 900 | E227: * | F227: 1 | G227: 60.00 | H227: 0.07 | I227: 60.00 | J227: -840.00 | K227: 2 | L227: =RC[-3]/100*RC[-1] -> 0.07
A228: 2 | B228: H5409/2XL | C228: US RANGER штаны мэтро (R/S) | D228: 200 | E228: * | F228: 1 | G228: 440.00 | H228: 2.20 | I228: 461.00 | J228: 261.00 | K228: 2 | L228: =RC[-3]/100*RC[-1] -> 2.20
A229: 3 | B229: H3301/2XL | C229: Комплект термобілизни (95% полиэстер 5% спандекс) чёрный ||KP-UN2-PO-01/2XL | D229: 400 | E229: * | F229: 1 | G229: 880.00 | H229: 2.20 | I229: 880.00 | J229: 480.00 | K229: 2 | L229: =RC[-3]/100*RC[-1] -> 2.20
A230: 4 | B230: _108190/54(3) | C230: Тельник морской с голуб.полосами длинный рукав | D230: 125 | E230: * | F230: 1 | G230: 50.00 | H230: 0.40 | I230: 50.00 | J230: -75.00 | K230: 2 | L230: =RC[-3]/100*RC[-1] -> 0.40
A231: 5 | B231: _874404 | C231: Балаклава двойная чёрная | D231: 82 | E231: * | F231: 1 | G231: 161.00 | H231: 1.96 | I231: 161.00 | J231: 79.00 | K231: 2 | L231: =RC[-3]/100*RC[-1] -> 1.96
A232: 6 | B232: R0415 | C232: Тарелка алюминиевая глубокая СССР | D232: 26 | E232: * | F232: 1 | G232: 56.00 | H232: 2.15 | I232: 56.00 | J232: 30.00 | K232: 2 | L232: =RC[-3]/100*RC[-1] -> 2.15
A233: 7 | B233: G0001 | C233: Комплект (наколенники и налокотники) койот | D233: 350 | E233: * | F233: 1 | G233: 600.00 | H233: 1.71 | I233: 600.00 | J233: 250.00 | K233: 2 | L233: =RC[-3]/100*RC[-1] -> 1.71
A234: 8 | B234: H43021/SR | C234: US SFU китель олива (PolyCotton) ||BL-SFU-PR-02 | D234: 301 | E234: * | F234: 1 | G234: 661.00 | H234: 2.20 | I234: 661.00 | J234: 360.00 | K234: 2 | L234: =RC[-3]/100*RC[-1] -> 2.20
A235: 9 | B235: X2099/48 | C235: Футболка укр-цифра X3445/48 | D235: 75 | E235: * | F235: 1 | G235: 133.00 | H235: 1.77 | I235: 133.00 | J235: 58.00 | K235: 2 | L235: =RC[-3]/100*RC[-1] -> 1.77
A236: 10 | B236: K104707/SR | C236: Комплект формы марпат ACU китель, штаны, кепка (R/S) ||KP-ACU-PR-07 | D236: 280 | E236: * | F236: 1 | G236: 616.00 | H236: 2.20 | I236: 616.00 | J236: 336.00 | K236: 2 | L236: =RC[-3]/100*RC[-1] -> 2.20
A237: 11 | B237: K17112-B | C237: Маска-сетка короткая чёрная ||M51617112-BK | D237: 80 | E237: * | F237: 1 | G237: 176.00 | H237: 2.20 | I237: 176.00 | J237: 96.00 | K237: 2 | L237: =RC[-3]/100*RC[-1] -> 2.20
A238: 12 | B238: пасок13 | C238: Пасок ременний хаки 120 см | D238: 0.01 | E238: zl | F238: 1 | G238: 40.00 | H238: 800.00 | I238: 40.00 | J238: 39.95 | K238: 2 | L238: =RC[-3]/100*RC[-1] -> 800.00
A239: 13 | B239: H0141/S | C239: Перчатки тактические US Model чёрные ||RK-USM-PO-01 | D239: 209 | E239: * | F239: 1 | G239: 459.00 | H239: 2.20 | I239: 459.00 | J239: 250.00 | K239: 2 | L239: =RC[-3]/100*RC[-1] -> 2.20
A240: 14 | B240: H7901 | C240: Шапка флисовая чёрная ||CZ-DOK-FL-01 | D240: 40 | E240: * | F240: 1 | G240: 100.00 | H240: 2.50 | I240: 90.00 | J240: 50.00 | K240: 2 | L240: =RC[-3]/100*RC[-1] -> 2.50
A241: 15 | B241: H0502G/A+ | C241: Ліпучка група крові олива резина ||OD-BLP-RB-02 | D241: 40 | E241: * | F241: 1 | G241: 89.00 | H241: 2.23 | I241: 89.00 | J241: 49.00 | K241: 2 | L241: =RC[-3]/100*RC[-1] -> 2.23 | M241: =SUM(R[-15]C[-1]:RC[-1]) -> 
A243: #11843 (2015-01-23) Магазин Уніформи - Відправлено-Продано
A244: N | B244: арт | C244: назва | D244: закуп | F244: к-ть | G244: цiна | H244: кф | I244: продж | J244: дохiд | K244: % | L244: з-та
A245: 1 | B245: H5814/LR | C245: URBAN TACTICAL штаны мультикам (NYCO R/S) ||SP-UTL-NR-14 | D245: 30.75 | E245: usd | F245: 1 | G245: 1353.00 | H245: 2.20 | I245: 1217.70 | J245: 602.70 | K245: 2 | L245: =RC[-3]/100*RC[-1] -> 2.20
A246: 2 | B246: H7514 | C246: Блайзер мультикам (Polycotton) ||CZ-BBC-PR-14 | D246: 4.31 | E246: usd | F246: 1 | G246: 190.00 | H246: 2.20 | I246: 171.00 | J246: 84.80 | K246: 2 | L246: =RC[-3]/100*RC[-1] -> 2.20
A247: 3 | B247: H3102/L | C247: Куртка Alpha Grid Fleece олива ||BL-ALP-FG-02 | D247: 24.64 | E247: usd | F247: 1 | G247: 1084.00 | H247: 2.20 | I247: 975.60 | J247: 482.80 | K247: 2 | L247: =RC[-3]/100*RC[-1] -> 2.20
A248: 4 | B248: H2233/XL | C248: Куртка GUNFIGHTER MP Camo||KU-GUN-FM-33 | D248: 55.81 | E248: usd | F248: 1 | G248: 2456.00 | H248: 2.20 | I248: 2210.40 | J248: 1094.20 | K248: 2 | L248: =RC[-3]/100*RC[-1] -> 2.20
A249: 5 | B249: H2201/L | C249: Куртка GUNFIGHTER чёрная ||KU-GUN-FM-01 | D249: 50.89 | E249: usd | F249: 1 | G249: 2239.00 | H249: 2.20 | I249: 2015.10 | J249: 997.30 | K249: 2 | L249: =RC[-3]/100*RC[-1] -> 2.20
A250: 6 | B250: H2014/L | C250: Куртка LIBERTY флисовая мультикам 390г/м (superfine) ||BL-LIB-HF-14 | D250: 31.00 | E250: usd | F250: 1 | G250: 1364.00 | H250: 2.20 | I250: 1227.60 | J250: 607.60 | K250: 2 | L250: =RC[-3]/100*RC[-1] -> 2.20
A251: 7 | B251: H02101/M | C251: Носки высокие HEAVYWEIGHT ||р39-42 ||SK-HWT-WA-01 | D251: 4.83 | E251: usd | F251: 1 | G251: 213.00 | H251: 2.20 | I251: 191.70 | J251: 95.10 | K251: 2 | L251: =RC[-3]/100*RC[-1] -> 2.20
A252: 8 | B252: H02301/M | C252: Носки высокие MEDIUMWEIGHT ||р39-42 ||SK-MWT-WA-01 | D252: 4.58 | E252: usd | F252: 1 | G252: 202.00 | H252: 2.21 | I252: 181.80 | J252: 90.20 | K252: 2 | L252: =RC[-3]/100*RC[-1] -> 2.21
A253: 9 | B253: H8902/120 | C253: Ремень TOUGH US MARINES олива ||PS-USM-CO-02 | D253: 3.68 | E253: usd | F253: 1 | G253: 193.00 | H253: 2.62 | I253: 173.70 | J253: 100.10 | K253: 2 | L253: =RC[-3]/100*RC[-1] -> 2.62
A254: 10 | B254: EM6628C | C254: Шапка-труба мультикамо ||EM6628C | D254: 4.24 | E254: usd | F254: 1 | G254: 187.00 | H254: 2.21 | I254: 168.30 | J254: 83.50 | K254: 2 | L254: =RC[-3]/100*RC[-1] -> 2.21 | M254: =SUM(R[-10]C[-1]:RC[-1]) -> 
A256: #11844 (2015-01-23) Магазин Уніформи - Відправлено-Продано
A257: N | B257: арт | C257: назва | D257: закуп | F257: к-ть | G257: цiна | H257: кф | I257: продж | J257: дохiд | K257: % | L257: з-та
A258: 1 | B258: H5827/LR | C258: URBAN TACTICAL штаны Jungle Green PolyCotton ||SP-UTL-PR-27 | D258: 28.43 | E258: usd | F258: 2 | G258: 1251.00 | H258: 2.20 | I258: 2251.80 | J258: 1114.60 | K258: 2 | L258: =RC[-3]/100*RC[-1] -> 2.20
A259: 2 | B259: H5814/LR | C259: URBAN TACTICAL штаны мультикам (NYCO R/S) ||SP-UTL-NR-14 | D259: 30.75 | E259: usd | F259: 1 | G259: 1353.00 | H259: 2.20 | I259: 1217.70 | J259: 602.70 | K259: 2 | L259: =RC[-3]/100*RC[-1] -> 2.20
A260: 3 | B260: H7504 | C260: Блайзер PL Woodland(Polycotton) ||CZ-BBC-PR-04 | D260: 4.31 | E260: usd | F260: 1 | G260: 190.00 | H260: 2.20 | I260: 171.00 | J260: 84.80 | K260: 2 | L260: =RC[-3]/100*RC[-1] -> 2.20
A261: 4 | B261: H7514 | C261: Блайзер мультикам (Polycotton) ||CZ-BBC-PR-14 | D261: 4.31 | E261: usd | F261: 1 | G261: 190.00 | H261: 2.20 | I261: 171.00 | J261: 84.80 | K261: 2 | L261: =RC[-3]/100*RC[-1] -> 2.20
A262: 5 | B262: H3301/L | C262: Комплект термобілизни (95% полиэстер 5% спандекс) чёрный ||KP-UN2-PO-01/L | D262: 19.99 | E262: usd | F262: 2 | G262: 880.00 | H262: 2.20 | I262: 1584.00 | J262: 784.40 | K262: 2 | L262: =RC[-3]/100*RC[-1] -> 2.20
A263: 6 | B263: H2727/L | C263: Куртка COMMANDER Jungle Green||BL-CMR-FM-27 | D263: 36.66 | E263: usd | F263: 1 | G263: 1613.00 | H263: 2.20 | I263: 1451.70 | J263: 718.50 | K263: 2 | L263: =RC[-3]/100*RC[-1] -> 2.20
A264: 7 | B264: H2227/L | C264: Куртка GUNFIGHTER Jungle Green||KU-GUN-FM-27 | D264: 50.89 | E264: usd | F264: 1 | G264: 2239.00 | H264: 2.20 | I264: 2015.10 | J264: 997.30 | K264: 2 | L264: =RC[-3]/100*RC[-1] -> 2.20
A265: 8 | B265: H02101/M | C265: Носки высокие HEAVYWEIGHT ||р39-42 ||SK-HWT-WA-01 | D265: 4.83 | E265: usd | F265: 2 | G265: 213.00 | H265: 2.20 | I265: 383.40 | J265: 190.20 | K265: 2 | L265: =RC[-3]/100*RC[-1] -> 2.20
A266: 9 | B266: H02301/M | C266: Носки высокие MEDIUMWEIGHT ||р39-42 ||SK-MWT-WA-01 | D266: 4.58 | E266: usd | F266: 2 | G266: 202.00 | H266: 2.21 | I266: 363.60 | J266: 180.40 | K266: 2 | L266: =RC[-3]/100*RC[-1] -> 2.21
A267: 10 | B267: H0131/M | C267: Перчатки тактические Half Finger чёрные ||RK-HFG-PO-01 | D267: 7.88 | E267: usd | F267: 1 | G267: 347.00 | H267: 2.20 | I267: 312.30 | J267: 154.70 | K267: 2 | L267: =RC[-3]/100*RC[-1] -> 2.20
A268: 11 | B268: H0141/L | C268: Перчатки тактические US Model чёрные ||RK-USM-PO-01 | D268: 10.43 | E268: usd | F268: 2 | G268: 459.00 | H268: 2.20 | I268: 826.20 | J268: 409.00 | K268: 2 | L268: =RC[-3]/100*RC[-1] -> 2.20
A269: 12 | B269: _608-0202/L | C269: Перчатки тактические олива (без палые) | D269: 17.25 | E269: Инт | F269: 1 | G269: 517.00 | H269: 1.50 | I269: 465.30 | J269: 120.30 | K269: 2 | L269: =RC[-3]/100*RC[-1] -> 1.50
A270: 13 | B270: H98702 | C270: Портмоне олива ||PF-PRF-PO-02 | D270: 2.42 | E270: usd | F270: 2 | G270: 111.00 | H270: 2.29 | I270: 199.80 | J270: 103.00 | K270: 2 | L270: =RC[-3]/100*RC[-1] -> 2.29
A271: 14 | B271: H3414/L | C271: Футболка мультикам ||TS-TSH-CO-14 | D271: 4.06 | E271: usd | F271: 1 | G271: 179.00 | H271: 2.21 | I271: 161.10 | J271: 79.95 | K271: 2 | L271: =RC[-3]/100*RC[-1] -> 2.21
A272: 15 | B272: H3404/XL | C272: Футболка польский вудлэнд ||TS-TSH-CO-04 | D272: 4.06 | E272: usd | F272: 3 | G272: 179.00 | H272: 2.21 | I272: 483.30 | J272: 239.85 | K272: 2 | L272: =RC[-3]/100*RC[-1] -> 2.21
A273: 16 | B273: EM6628D | C273: Шапка-труба ATAK-FG ||EM6628D | D273: 4.24 | E273: usd | F273: 1 | G273: 187.00 | H273: 2.21 | I273: 168.30 | J273: 83.50 | K273: 2 | L273: =RC[-3]/100*RC[-1] -> 2.21
A274: 17 | B274: EM6628C | C274: Шапка-труба мультикамо ||EM6628C | D274: 4.24 | E274: usd | F274: 1 | G274: 187.00 | H274: 2.21 | I274: 168.30 | J274: 83.50 | K274: 2 | L274: =RC[-3]/100*RC[-1] -> 2.21 | M274: =SUM(R[-17]C[-1]:RC[-1]) -> 
A276: #11862 (2015-01-24) Магазин Уніформи - Відправлено-Продано
A277: N | B277: арт | C277: назва | D277: закуп | F277: к-ть | G277: цiна | H277: кф | I277: продж | J277: дохiд | K277: % | L277: з-та
A278: 1 | B278: H7820 | C278: Хустка SHEMAGH біло/чёрная ||CZ-ARF-CO-20 | D278: 3.62 | E278: usd | F278: 1 | G278: 159.00 | H278: 2.20 | I278: 143.00 | J278: 70.60 | K278: 2 | L278: =RC[-3]/100*RC[-1] -> 2.20
A279: 2 | B279: Бабки | C279: Прихід Грошей | D279: 0.00 | E279: грн | F279: 1 | G279: 0.00 | H279: 0.00 | I279: 20927.00 | J279: 20926.00 | K279: 2 | L279: =RC[-3]/100*RC[-1] -> 0.00
A280: 3 | B280: H0131/M | C280: Перчатки тактические Half Finger чёрные ||RK-HFG-PO-01 | D280: 7.88 | E280: usd | F280: 1 | G280: 347.00 | H280: 2.20 | I280: 312.00 | J280: 154.40 | K280: 2 | L280: =RC[-3]/100*RC[-1] -> 2.20
A281: 4 | B281: _703025-G | C281: Перчатки флисовые серые | D281: 1.78 | E281: Инт | F281: 1 | G281: 61.00 | H281: 1.71 | I281: 61.00 | J281: 25.40 | K281: 2 | L281: =RC[-3]/100*RC[-1] -> 1.71
A282: 5 | B282: X4041 | C282: Балаклава дубок с 1-м отв. нинзя (100%хлопок) ||X7600 | D282: 3.15 | E282: Инт | F282: 1 | G282: 80.00 | H282: 1.27 | I282: 80.00 | J282: 17.00 | K282: 2 | L282: =RC[-3]/100*RC[-1] -> 1.27
A283: 6 | B283: _11957/XL | C283: BW костюм маскировочный зимний камуфляж ||11971000/905 | D283: 19.50 | E283: euro | F283: 1 | G283: 1122.00 | H283: 2.30 | I283: 1009.80 | J283: 522.30 | K283: 2 | L283: =RC[-3]/100*RC[-1] -> 2.30
A284: 7 | B284: X4011 | C284: Балаклава чёрная с 1-м отв. нинзя(100%хлопок) ||X76011 | D284: 3.15 | E284: Инт | F284: 1 | G284: 80.00 | H284: 1.27 | I284: 72.00 | J284: 9.00 | K284: 2 | L284: =RC[-3]/100*RC[-1] -> 1.27
A285: 8 | B285: H7901 | C285: Шапка флисовая чёрная ||CZ-DOK-FL-01 | D285: 2.00 | E285: usd | F285: 1 | G285: 100.00 | H285: 2.50 | I285: 100.00 | J285: 60.00 | K285: 2 | L285: =RC[-3]/100*RC[-1] -> 2.50
A286: 9 | B286: H7902 | C286: Шапка флисовая олива ||CZ-DOK-FL-02 | D286: 2.00 | E286: usd | F286: 1 | G286: 100.00 | H286: 2.50 | I286: 100.00 | J286: 60.00 | K286: 2 | L286: =RC[-3]/100*RC[-1] -> 2.50
A287: 10 | B287: H4503/XLR | C287: US BDU штаны вудлэнд (NYCO) ||SP-BDU-NT-03 | D287: 14.06 | E287: usd | F287: 1 | G287: 619.00 | H287: 2.20 | I287: 557.10 | J287: 275.90 | K287: 2 | L287: =RC[-3]/100*RC[-1] -> 2.20
A288: 11 | B288: H3301/XL | C288: Комплект термобілизни (95% полиэстер 5% спандекс) чёрный ||KP-UN2-PO-01/XL | D288: 19.99 | E288: usd | F288: 2 | G288: 880.00 | H288: 2.20 | I288: 1584.00 | J288: 784.40 | K288: 2 | L288: =RC[-3]/100*RC[-1] -> 2.20
A289: 12 | B289: _608-9401/L | C289: Перчатки тактические олива FreeSolder | D289: 25.83 | E289: Инт | F289: 1 | G289: 750.00 | H289: 1.45 | I289: 675.00 | J289: 158.40 | K289: 2 | L289: =RC[-3]/100*RC[-1] -> 1.45
A290: 13 | B290: _TRC-011 | C290: Кружка TRAMP 300 мл, складные ручки | D290: 3.60 | E290: Инт | F290: 1 | G290: 117.00 | H290: 1.63 | I290: 93.60 | J290: 21.60 | K290: 2 | L290: =RC[-3]/100*RC[-1] -> 1.63
A291: 14 | B291: Бабки | C291: Прихід Грошей | D291: 0.00 | E291: грн | F291: 1 | G291: 0.00 | H291: 0.00 | I291: 100.00 | J291: 99.00 | K291: 2 | L291: =RC[-3]/100*RC[-1] -> 0.00 | M291: =SUM(R[-14]C[-1]:RC[-1]) -> 
A293: #11869 (2015-01-26) Магазин Уніформи - Відправлено-Продано
A294: N | B294: арт | C294: назва | D294: закуп | F294: к-ть | G294: цiна | H294: кф | I294: продж | J294: дохiд | K294: % | L294: з-та
A295: 1 | B295: H5928/LR | C295: CPU штаны грецьк. кам (PolyCotton) ||SP-CPU-PR-28 | D295: 402 | E295: * | F295: 1 | G295: 884.00 | H295: 2.20 | I295: 884.00 | J295: 482.00 | K295: 2 | L295: =RC[-3]/100*RC[-1] -> 2.20
A296: 2 | B296: _108195/54(3) | C296: Тельник морской с голуб.полосами длинный рукав (байковый) | D296: 1100 | E296: * | F296: 1 | G296: 133.00 | H296: 0.12 | I296: 133.00 | J296: -967.00 | K296: 2 | L296: =RC[-3]/100*RC[-1] -> 0.12
A297: 3 | B297: X402 | C297: Балаклава олива с 1-м отв.(100%хлопок) ||X76012 | D297: 63 | E297: * | F297: 1 | G297: 80.00 | H297: 1.27 | I297: 80.00 | J297: 17.00 | K297: 2 | L297: =RC[-3]/100*RC[-1] -> 1.27
A298: 4 | B298: H3414/S | C298: Футболка мультикам ||TS-TSH-CO-14 | D298: 81 | E298: * | F298: 1 | G298: 179.00 | H298: 2.21 | I298: 161.10 | J298: 80.10 | K298: 2 | L298: =RC[-3]/100*RC[-1] -> 2.21
A299: 5 | B299: X4021 | C299: Балаклава олива с 1-м отв. нинзя (100%хлопок) ||X76012 | D299: 63 | E299: * | F299: 1 | G299: 80.00 | H299: 1.27 | I299: 72.00 | J299: 9.00 | K299: 2 | L299: =RC[-3]/100*RC[-1] -> 1.27
A300: 6 | B300: H3302/XS | C300: Комплект термобілизни (95% полиэстер 5% спандекс) олива ||KP-UN2-PO-02/XS | D300: 400 | E300: * | F300: 1 | G300: 880.00 | H300: 2.20 | I300: 792.00 | J300: 392.00 | K300: 2 | L300: =RC[-3]/100*RC[-1] -> 2.20
A301: 7 | B301: H5914/SR | C301: CPU штаны мультикамо (PolyCotton) ||SP-CPU-PR-14 | D301: 431 | E301: * | F301: 1 | G301: 949.00 | H301: 2.20 | I301: 854.10 | J301: 423.10 | K301: 2 | L301: =RC[-3]/100*RC[-1] -> 2.20
A302: 8 | B302: H47141/SR | C302: US ACU китель мультикам (NYCO R/S) ||BL-ACU-PR-14 | D302: 461 | E302: * | F302: 1 | G302: 1013.00 | H302: 2.20 | I302: 911.70 | J302: 450.70 | K302: 2 | L302: =RC[-3]/100*RC[-1] -> 2.20
A303: 9 | B303: _11957/Р/1 | C303: Рос.костюм маскировочный белый | D303: 70 | E303: * | F303: 1 | G303: 164.00 | H303: 2.34 | I303: 147.60 | J303: 77.60 | K303: 2 | L303: =RC[-3]/100*RC[-1] -> 2.34
A304: 10 | B304: _11957/Р/2 | C304: Рос.костюм маскировочный белый | D304: 70 | E304: * | F304: 1 | G304: 164.00 | H304: 2.34 | I304: 147.60 | J304: 77.60 | K304: 2 | L304: =RC[-3]/100*RC[-1] -> 2.34
A305: 11 | B305: H0514/0+ | C305: Ліпучка група крові мультикам ||OD-BLP-PO-14 | D305: 27 | E305: * | F305: 1 | G305: 61.00 | H305: 2.26 | I305: 61.00 | J305: 34.00 | K305: 2 | L305: =RC[-3]/100*RC[-1] -> 2.26
A306: 12 | B306: H5814/XLL | C306: URBAN TACTICAL штаны мультикам (NYCO R/S) ||SP-UTL-NR-14 | D306: 615 | E306: * | F306: 1 | G306: 1353.00 | H306: 2.20 | I306: 1217.70 | J306: 602.70 | K306: 2 | L306: =RC[-3]/100*RC[-1] -> 2.20
A307: 13 | B307: H7214/XL-61 | C307: US ACU кепка мультикам (NYCO R/S) ||CZ-ACU-PR-14 | D307: 86 | E307: * | F307: 1 | G307: 190.00 | H307: 2.21 | I307: 171.00 | J307: 85.00 | K307: 2 | L307: =RC[-3]/100*RC[-1] -> 2.21
A308: 14 | B308: EM1811 | C308: Чохол-кавер на шлем MICH2001 мультикам | D308: 87 | E308: * | F308: 3 | G308: 219.00 | H308: 2.52 | I308: 657.00 | J308: 396.00 | K308: 2 | L308: =RC[-3]/100*RC[-1] -> 2.52
A309: 15 | B309: H3414/XL | C309: Футболка мультикам ||TS-TSH-CO-14 | D309: 81 | E309: * | F309: 1 | G309: 179.00 | H309: 2.21 | I309: 161.10 | J309: 80.10 | K309: 2 | L309: =RC[-3]/100*RC[-1] -> 2.21
A310: 16 | B310: H7901 | C310: Шапка флисовая чёрная ||CZ-DOK-FL-01 | D310: 40 | E310: * | F310: 1 | G310: 100.00 | H310: 2.50 | I310: 100.00 | J310: 60.00 | K310: 2 | L310: =RC[-3]/100*RC[-1] -> 2.50
A311: 17 | B311: X4011 | C311: Балаклава чёрная с 1-м отв. нинзя(100%хлопок) ||X76011 | D311: 63 | E311: * | F311: 1 | G311: 80.00 | H311: 1.27 | I311: 80.00 | J311: 17.00 | K311: 2 | L311: =RC[-3]/100*RC[-1] -> 1.27
A312: 18 | B312: _155155-B | C312: Перчатки флисовые чёрные | D312: 37 | E312: * | F312: 1 | G312: 83.00 | H312: 2.24 | I312: 83.00 | J312: 46.00 | K312: 2 | L312: =RC[-3]/100*RC[-1] -> 2.24
A313: 19 | B313: H3301/L | C313: Комплект термобілизни (95% полиэстер 5% спандекс) чёрный ||KP-UN2-PO-01/L | D313: 400 | E313: * | F313: 1 | G313: 880.00 | H313: 2.20 | I313: 880.00 | J313: 480.00 | K313: 2 | L313: =RC[-3]/100*RC[-1] -> 2.20
A314: 20 | B314: H0202/11 | C314: Носки шерстяные высокие (олива) ||SK-NOR-WA-02 | D314: 102 | E314: * | F314: 1 | G314: 225.00 | H314: 2.21 | I314: 202.50 | J314: 100.50 | K314: 2 | L314: =RC[-3]/100*RC[-1] -> 2.21
A315: 21 | B315: H02101/M | C315: Носки высокие HEAVYWEIGHT ||р39-42 ||SK-HWT-WA-01 | D315: 97 | E315: * | F315: 1 | G315: 213.00 | H315: 2.20 | I315: 191.70 | J315: 94.70 | K315: 2 | L315: =RC[-3]/100*RC[-1] -> 2.20
A316: 22 | B316: H3502/L | C316: Комплект термобілизни (100% полиэстер) олива ||KP-UN1-PO-02 | D316: 274 | E316: * | F316: 1 | G316: 603.00 | H316: 2.20 | I316: 542.70 | J316: 268.70 | K316: 2 | L316: =RC[-3]/100*RC[-1] -> 2.20 | M316: =SUM(R[-22]C[-1]:RC[-1]) -> 
A318: #11914 (2015-01-27) Магазин Уніформи - Відправлено-Продано
A319: N | B319: арт | C319: назва | D319: закуп | F319: к-ть | G319: цiна | H319: кф | I319: продж | J319: дохiд | K319: % | L319: з-та
A320: 1 | B320: H7902 | C320: Шапка флисовая олива ||CZ-DOK-FL-02 | D320: 2.00 | E320: usd | F320: 1 | G320: 100.00 | H320: 2.50 | I320: 100.00 | J320: 60.00 | K320: 2 | L320: =RC[-3]/100*RC[-1] -> 2.50
A321: 2 | B321: H6501/SR | C321: US М65 штаны чёрные (NYCO) ||SP-M65-NY-01 | D321: 19.44 | E321: usd | F321: 1 | G321: 855.00 | H321: 2.20 | I321: 855.00 | J321: 466.20 | K321: 2 | L321: =RC[-3]/100*RC[-1] -> 2.20
A322: 3 | B322: _608-0202/XL | C322: Перчатки тактические олива (без палые) | D322: 17.25 | E322: Инт | F322: 1 | G322: 517.00 | H322: 1.50 | I322: 465.30 | J322: 120.30 | K322: 2 | L322: =RC[-3]/100*RC[-1] -> 1.50
A323: 4 | B323: K17222-C | C323: Балаклава SKULL type C-чёрная [Производитель: ACM] ||M51617222-C | D323: 2.65 | E323: usd | F323: 1 | G323: 117.00 | H323: 2.21 | I323: 117.00 | J323: 64.00 | K323: 2 | L323: =RC[-3]/100*RC[-1] -> 2.21
A324: 5 | B324: A0199 | C324: Значок Спеціаліста підривника вищої категорії ||170403 | D324: 3.70 | E324: euro | F324: 1 | G324: 55.00 | H324: 0.59 | I324: 55.00 | J324: -37.50 | K324: 2 | L324: =RC[-3]/100*RC[-1] -> 0.59
A325: 6 | B325: H47101/LR | C325: US ACU китель ACU (PolyCotton) ||BL-ACU-PR-10 | D325: 17.43 | E325: usd | F325: 2 | G325: 767.00 | H325: 2.20 | I325: 1225.00 | J325: 527.80 | K325: 2 | L325: =RC[-3]/100*RC[-1] -> 2.20
A326: 7 | B326: H4710/LR | C326: US ACU штаны ACU (PolyCotton) ||SP-ACU-PR-10 | D326: 17.43 | E326: usd | F326: 2 | G326: 767.00 | H326: 2.20 | I326: 1225.00 | J326: 527.80 | K326: 2 | L326: =RC[-3]/100*RC[-1] -> 2.20
A327: 8 | B327: H0613 | C327: Резиновая кружка хаки ||TK-FOL-PP-13 | D327: 1.15 | E327: usd | F327: 1 | G327: 51.00 | H327: 2.22 | I327: 51.00 | J327: 28.00 | K327: 2 | L327: =RC[-3]/100*RC[-1] -> 2.22
A328: 9 | B328: H3410/L | C328: Футболка ACU ||TS-TSH-CO-10 | D328: 4.06 | E328: usd | F328: 2 | G328: 179.00 | H328: 2.21 | I328: 280.00 | J328: 117.70 | K328: 2 | L328: =RC[-3]/100*RC[-1] -> 2.21
A329: 10 | B329: H4001/MR | C329: URBAN TACTICAL штаны чёрные ||SP-UTL-CO-01 | D329: 37.13 | E329: usd | F329: 1 | G329: 1634.00 | H329: 2.20 | I329: 1470.60 | J329: 728.00 | K329: 2 | L329: =RC[-3]/100*RC[-1] -> 2.20
A330: 11 | B330: H7904 | C330: Шапка флисовая пол.вудлэнд ||CZ-DOK-FL-04 | D330: 3.00 | E330: usd | F330: 1 | G330: 150.00 | H330: 2.50 | I330: 141.00 | J330: 81.00 | K330: 2 | L330: =RC[-3]/100*RC[-1] -> 2.50
A331: 12 | B331: _12550 | C331: Перчатки THINSULATE акриловые без пальцев олива ||12540001 | D331: 2.00 | E331: euro | F331: 1 | G331: 120.00 | H331: 2.40 | I331: 112.80 | J331: 62.80 | K331: 2 | L331: =RC[-3]/100*RC[-1] -> 2.40
A332: 13 | B332: H59041/SR | C332: CPU китель польский вудлэнд (PolyCotton) ||BL-CPU-PR-04 | D332: 20.10 | E332: usd | F332: 1 | G332: 884.00 | H332: 2.20 | I332: 830.96 | J332: 428.96 | K332: 2 | L332: =RC[-3]/100*RC[-1] -> 2.20
A333: 14 | B333: H5904/SR | C333: CPU штаны польский вудлэнд (PolyCotton) ||SP-CPU-PR-04 | D333: 20.10 | E333: usd | F333: 1 | G333: 884.00 | H333: 2.20 | I333: 830.96 | J333: 428.96 | K333: 2 | L333: =RC[-3]/100*RC[-1] -> 2.20
A334: 15 | B334: H3404/S | C334: Футболка польский вудлэнд ||TS-TSH-CO-04 | D334: 4.06 | E334: usd | F334: 1 | G334: 179.00 | H334: 2.21 | I334: 168.26 | J334: 87.11 | K334: 2 | L334: =RC[-3]/100*RC[-1] -> 2.21
A335: 16 | B335: H3301/M | C335: Комплект термобілизни (95% полиэстер 5% спандекс) чёрный ||KP-UN2-PO-01/M | D335: 19.99 | E335: usd | F335: 1 | G335: 880.00 | H335: 2.20 | I335: 827.20 | J335: 427.40 | K335: 2 | L335: =RC[-3]/100*RC[-1] -> 2.20 | M335: =SUM(R[-16]C[-1]:RC[-1]) -> 
A337: #11930 (2015-01-28) Магазин Уніформи - Відправлено-Продано
A338: N | B338: арт | C338: назва | D338: закуп | F338: к-ть | G338: цiна | H338: кф | I338: продж | J338: дохiд | K338: % | L338: з-та
A339: 1 | B339: H7014/M | C339: US GI панама мультикам (NYCO) ||7 1/4 ||KA-USM-NT-14 | D339: 92 | E339: * | F339: 1 | G339: 202.00 | H339: 2.20 | I339: 202.00 | J339: 110.00 | K339: 2 | L339: =RC[-3]/100*RC[-1] -> 2.20
A340: 2 | B340: H3410/XL | C340: Футболка ACU ||TS-TSH-CO-10 | D340: 81 | E340: * | F340: 1 | G340: 179.00 | H340: 2.21 | I340: 179.00 | J340: 98.00 | K340: 2 | L340: =RC[-3]/100*RC[-1] -> 2.21
A341: 3 | B341: _108195/50(3) | C341: Тельник морской с голуб.полосами длинный рукав (байковый) | D341: 1100 | E341: * | F341: 1 | G341: 133.00 | H341: 0.12 | I341: 133.00 | J341: -967.00 | K341: 2 | L341: =RC[-3]/100*RC[-1] -> 0.12
A342: 4 | B342: _108195/52(2) | C342: Тельник морской с голуб.полосами длинный рукав (байковый) | D342: 55 | E342: * | F342: 1 | G342: 120.00 | H342: 2.18 | I342: 120.00 | J342: 65.00 | K342: 2 | L342: =RC[-3]/100*RC[-1] -> 2.18
A343: 5 | B343: X4011 | C343: Балаклава чёрная с 1-м отв. нинзя(100%хлопок) ||X76011 | D343: 63 | E343: * | F343: 1 | G343: 80.00 | H343: 1.27 | I343: 80.00 | J343: 17.00 | K343: 2 | L343: =RC[-3]/100*RC[-1] -> 1.27
A344: 6 | B344: _17811 | C344: Нашивка текст.Флаг US олива ||16851500 | D344: 12 | E344: * | F344: 1 | G344: 38.00 | H344: 3.17 | I344: 38.00 | J344: 26.00 | K344: 2 | L344: =RC[-3]/100*RC[-1] -> 3.17
A345: 7 | B345: A0273 | C345: Нашивка 49-а Бронетанкова дивізія армии США (кол.) ||140581 | D345: 30 | E345: * | F345: 1 | G345: 21.00 | H345: 0.70 | I345: 21.00 | J345: -9.00 | K345: 2 | L345: =RC[-3]/100*RC[-1] -> 0.70
A346: 8 | B346: A0272 | C346: Знак 49-а Бронетанкова дивізія армии США ||140493 | D346: 93 | E346: * | F346: 1 | G346: 64.00 | H346: 0.69 | I346: 64.00 | J346: -29.00 | K346: 2 | L346: =RC[-3]/100*RC[-1] -> 0.69
A347: 9 | B347: _108190/52(3) | C347: Тельник морской с голуб.полосами длинный рукав | D347: 125 | E347: * | F347: 1 | G347: 50.00 | H347: 0.40 | I347: 50.00 | J347: -75.00 | K347: 2 | L347: =RC[-3]/100*RC[-1] -> 0.40
A348: 10 | B348: H7214/L-59 | C348: US ACU кепка мультикам (NYCO R/S) ||CZ-ACU-PR-14 | D348: 86 | E348: * | F348: 1 | G348: 190.00 | H348: 2.21 | I348: 152.00 | J348: 66.00 | K348: 2 | L348: =RC[-3]/100*RC[-1] -> 2.21
A349: 11 | B349: 40484-1 | C349: Балаклава чёрная вязаная | D349: 51 | E349: * | F349: 1 | G349: 94.00 | H349: 1.84 | I349: 94.00 | J349: 43.00 | K349: 2 | L349: =RC[-3]/100*RC[-1] -> 1.84
A350: 12 | B350: Паккуль-1 | C350: Паккуль беж. | D350: 120 | E350: * | F350: 1 | G350: 185.00 | H350: 1.54 | I350: 185.00 | J350: 65.00 | K350: 2 | L350: =RC[-3]/100*RC[-1] -> 1.54
A351: 13 | B351: A16661/L | C351: Шлем кевларовий б/у | D351: 3500 | E351: * | F351: 1 | G351: 5796.00 | H351: 1.66 | I351: 4926.60 | J351: 1426.60 | K351: 2 | L351: =RC[-3]/100*RC[-1] -> 1.66
A352: 14 | B352: H7811 | C352: Хустка SHEMAGH койот/чёрная ||CZ-ARF-CO-11 | D352: 72 | E352: * | F352: 1 | G352: 159.00 | H352: 2.21 | I352: 127.20 | J352: 55.20 | K352: 2 | L352: =RC[-3]/100*RC[-1] -> 2.21
A353: 15 | B353: H59141/LR | C353: CPU китель мультикамо (PolyCotton) ||BL-CPU-PR-14 | D353: 431 | E353: * | F353: 1 | G353: 949.00 | H353: 2.20 | I353: 759.20 | J353: 328.20 | K353: 2 | L353: =RC[-3]/100*RC[-1] -> 2.20
A354: 16 | B354: H5914/LR | C354: CPU штаны мультикамо (PolyCotton) ||SP-CPU-PR-14 | D354: 431 | E354: * | F354: 1 | G354: 949.00 | H354: 2.20 | I354: 759.20 | J354: 328.20 | K354: 2 | L354: =RC[-3]/100*RC[-1] -> 2.20
A355: 17 | B355: H3301/L | C355: Комплект термобілизни (95% полиэстер 5% спандекс) чёрный ||KP-UN2-PO-01/L | D355: 400 | E355: * | F355: 1 | G355: 880.00 | H355: 2.20 | I355: 704.00 | J355: 304.00 | K355: 2 | L355: =RC[-3]/100*RC[-1] -> 2.20
A356: 18 | B356: G4502/92-175 | C356: Комплект теплого нательного белья (100% полиэстер) олива | D356: 90 | E356: * | F356: 1 | G356: 250.00 | H356: 2.78 | I356: 200.00 | J356: 110.00 | K356: 2 | L356: =RC[-3]/100*RC[-1] -> 2.78
A357: 19 | B357: _608-0202/L | C357: Перчатки тактические олива (без палые) | D357: 345 | E357: * | F357: 1 | G357: 517.00 | H357: 1.50 | I357: 413.60 | J357: 68.60 | K357: 2 | L357: =RC[-3]/100*RC[-1] -> 1.50
A358: 20 | B358: X601 | C358: Шапка шерстяная камуфляжна | D358: 40 | E358: * | F358: 1 | G358: 120.00 | H358: 3.00 | I358: 120.00 | J358: 80.00 | K358: 2 | L358: =RC[-3]/100*RC[-1] -> 3.00
A359: 21 | B359: _TRC-029 | C359: Термос TRAMP 1,6 л | D359: 399 | E359: * | F359: 1 | G359: 559.00 | H359: 1.40 | I359: 559.00 | J359: 160.00 | K359: 2 | L359: =RC[-3]/100*RC[-1] -> 1.40 | M359: =SUM(R[-21]C[-1]:RC[-1]) -> 
A361: #11962 (2015-01-29) Магазин Уніформи - Відправлено-Продано
A362: N | B362: арт | C362: назва | D362: закуп | F362: к-ть | G362: цiна | H362: кф | I362: продж | J362: дохiд | K362: % | L362: з-та
A363: 1 | B363: H3301/L | C363: Комплект термобілизни (95% полиэстер 5% спандекс) чёрный ||KP-UN2-PO-01/L | D363: 19.99 | E363: usd | F363: 1 | G363: 880.00 | H363: 2.20 | I363: 792.00 | J363: 392.20 | K363: 2 | L363: =RC[-3]/100*RC[-1] -> 2.20
A364: 2 | B364: _TRC-037 | C364: Кружка TRAMP 500 мл, складные ручки | D364: 7.04 | E364: Инт | F364: 1 | G364: 226.00 | H364: 1.61 | I364: 203.40 | J364: 62.60 | K364: 2 | L364: =RC[-3]/100*RC[-1] -> 1.61
A365: 3 | B365: H3301/XL | C365: Комплект термобілизни (95% полиэстер 5% спандекс) чёрный ||KP-UN2-PO-01/XL | D365: 19.99 | E365: usd | F365: 1 | G365: 880.00 | H365: 2.20 | I365: 792.00 | J365: 392.20 | K365: 2 | L365: =RC[-3]/100*RC[-1] -> 2.20
A366: 4 | B366: _11957/Р/1 | C366: Рос.костюм маскировочный белый | D366: 2.80 | E366: euro | F366: 1 | G366: 164.00 | H366: 2.34 | I366: 147.60 | J366: 77.60 | K366: 2 | L366: =RC[-3]/100*RC[-1] -> 2.34
A367: 5 | B367: _11957/Р/1 | C367: Рос.костюм маскировочный белый | D367: 2.80 | E367: euro | F367: 4 | G367: 164.00 | H367: 2.34 | I367: 590.40 | J367: 310.40 | K367: 2 | L367: =RC[-3]/100*RC[-1] -> 2.34
A368: 6 | B368: _11957/Р/2 | C368: Рос.костюм маскировочный белый | D368: 2.80 | E368: euro | F368: 10 | G368: 164.00 | H368: 2.34 | I368: 1476.00 | J368: 776.00 | K368: 2 | L368: =RC[-3]/100*RC[-1] -> 2.34
A369: 7 | B369: GWD2 | C369: Набор рюмок GRAND WAY (4 шт.)||D3 | D369: 0.82 | E369: Инт | F369: 1 | G369: 27.00 | H369: 1.64 | I369: 27.00 | J369: 10.54 | K369: 2 | L369: =RC[-3]/100*RC[-1] -> 1.64
A370: 8 | B370: _TRC-030 | C370: Термос TRAMP 0,5 л | D370: 11.60 | E370: Инт | F370: 1 | G370: 324.00 | H370: 1.40 | I370: 324.00 | J370: 92.00 | K370: 2 | L370: =RC[-3]/100*RC[-1] -> 1.40
A371: 9 | B371: H120 | C371: Підтяжки KL олива б/у | D371: 1.25 | E371: usd | F371: 1 | G371: 59.00 | H371: 2.36 | I371: 59.00 | J371: 34.00 | K371: 2 | L371: =RC[-3]/100*RC[-1] -> 2.36
A372: 10 | B372: X4021 | C372: Балаклава олива с 1-м отв. нинзя (100%хлопок) ||X76012 | D372: 3.15 | E372: Инт | F372: 1 | G372: 80.00 | H372: 1.27 | I372: 80.00 | J372: 17.00 | K372: 2 | L372: =RC[-3]/100*RC[-1] -> 1.27
A373: 11 | B373: X4021 | C373: Балаклава олива с 1-м отв. нинзя (100%хлопок) ||X76012 | D373: 3.15 | E373: Инт | F373: 1 | G373: 80.00 | H373: 1.27 | I373: 80.00 | J373: 17.00 | K373: 2 | L373: =RC[-3]/100*RC[-1] -> 1.27
A374: 12 | B374: _155155-O | C374: Перчатки флисовые олива | D374: 1.83 | E374: Инт | F374: 1 | G374: 83.00 | H374: 2.26 | I374: 83.00 | J374: 46.33 | K374: 2 | L374: =RC[-3]/100*RC[-1] -> 2.26
A375: 13 | B375: H0141/S | C375: Перчатки тактические US Model чёрные ||RK-USM-PO-01 | D375: 10.43 | E375: usd | F375: 1 | G375: 459.00 | H375: 2.20 | I375: 413.10 | J375: 204.50 | K375: 2 | L375: =RC[-3]/100*RC[-1] -> 2.20
A376: 14 | B376: H3301/S | C376: Комплект термобілизни (95% полиэстер 5% спандекс) чёрный ||KP-UN2-PO-01/S | D376: 19.99 | E376: usd | F376: 1 | G376: 880.00 | H376: 2.20 | I376: 792.00 | J376: 392.20 | K376: 2 | L376: =RC[-3]/100*RC[-1] -> 2.20
A377: 15 | B377: _12185/S | C377: Шапка-ушанка MA1 чёрная ||12105002/902 | D377: 5.00 | E377: euro | F377: 1 | G377: 294.00 | H377: 2.35 | I377: 264.60 | J377: 139.60 | K377: 2 | L377: =RC[-3]/100*RC[-1] -> 2.35
A378: 16 | B378: _916596 | C378: Шапка чёрная с флисовой подкладкой | D378: 2.35 | E378: Инт | F378: 1 | G378: 118.00 | H378: 2.51 | I378: 118.00 | J378: 71.00 | K378: 2 | L378: =RC[-3]/100*RC[-1] -> 2.51
A379: 17 | B379: H120 | C379: Підтяжки KL олива б/у | D379: 1.25 | E379: usd | F379: 1 | G379: 59.00 | H379: 2.36 | I379: 59.00 | J379: 34.00 | K379: 2 | L379: =RC[-3]/100*RC[-1] -> 2.36
A380: 18 | B380: _703025-B | C380: Перчатки флисовые чёрные | D380: 1.78 | E380: Инт | F380: 1 | G380: 61.00 | H380: 1.71 | I380: 61.00 | J380: 25.40 | K380: 2 | L380: =RC[-3]/100*RC[-1] -> 1.71
A381: 19 | B381: _155155-B | C381: Перчатки флисовые чёрные | D381: 1.83 | E381: Инт | F381: 1 | G381: 83.00 | H381: 2.26 | I381: 83.00 | J381: 46.33 | K381: 2 | L381: =RC[-3]/100*RC[-1] -> 2.26
A382: 20 | B382: X4011 | C382: Балаклава чёрная с 1-м отв. нинзя(100%хлопок) ||X76011 | D382: 3.15 | E382: Инт | F382: 1 | G382: 80.00 | H382: 1.27 | I382: 80.00 | J382: 17.00 | K382: 2 | L382: =RC[-3]/100*RC[-1] -> 1.27
A383: 21 | B383: H4503/SL | C383: US BDU штаны вудлэнд (NYCO) ||SP-BDU-NT-03 | D383: 14.06 | E383: usd | F383: 1 | G383: 619.00 | H383: 2.20 | I383: 557.10 | J383: 275.90 | K383: 2 | L383: =RC[-3]/100*RC[-1] -> 2.20
A384: 22 | B384: X4021 | C384: Балаклава олива с 1-м отв. нинзя (100%хлопок) ||X76012 | D384: 3.15 | E384: Инт | F384: 1 | G384: 80.00 | H384: 1.27 | I384: 80.00 | J384: 17.00 | K384: 2 | L384: =RC[-3]/100*RC[-1] -> 1.27
A385: 23 | B385: _108195/50(3) | C385: Тельник морской с голуб.полосами длинный рукав (байковый) | D385: 55.00 | E385: usd | F385: 1 | G385: 133.00 | H385: 0.12 | I385: 133.00 | J385: -967.00 | K385: 2 | L385: =RC[-3]/100*RC[-1] -> 0.12
A386: 24 | B386: _108195/52(2) | C386: Тельник морской с голуб.полосами длинный рукав (байковый) | D386: 55.00 | E386: грн | F386: 1 | G386: 120.00 | H386: 2.18 | I386: 120.00 | J386: 65.00 | K386: 2 | L386: =RC[-3]/100*RC[-1] -> 2.18
A387: 25 | B387: X4011 | C387: Балаклава чёрная с 1-м отв. нинзя(100%хлопок) ||X76011 | D387: 3.15 | E387: Инт | F387: 1 | G387: 80.00 | H387: 1.27 | I387: 80.00 | J387: 17.00 | K387: 2 | L387: =RC[-3]/100*RC[-1] -> 1.27
A388: 26 | B388: H7902 | C388: Шапка флисовая олива ||CZ-DOK-FL-02 | D388: 2.00 | E388: usd | F388: 1 | G388: 100.00 | H388: 2.50 | I388: 100.00 | J388: 60.00 | K388: 2 | L388: =RC[-3]/100*RC[-1] -> 2.50
A389: 27 | B389: H0415 | C389: Набор посуды 3 предметн. из нержавеющей стали||ME-MEN-SS-15 | D389: 6.38 | E389: usd | F389: 1 | G389: 281.00 | H389: 2.20 | I389: 281.00 | J389: 153.40 | K389: 2 | L389: =RC[-3]/100*RC[-1] -> 2.20
A390: 28 | B390: _12936 | C390: Шнурки чёрные140см ||12910002 | D390: 0.45 | E390: euro | F390: 1 | G390: 34.00 | H390: 3.02 | I390: 34.00 | J390: 22.75 | K390: 2 | L390: =RC[-3]/100*RC[-1] -> 3.02 | M390: =SUM(R[-28]C[-1]:RC[-1]) -> 
A392: #11994 (2015-01-30) Магазин Уніформи - Відправлено-Продано
A393: N | B393: арт | C393: назва | D393: закуп | F393: к-ть | G393: цiна | H393: кф | I393: продж | J393: дохiд | K393: % | L393: з-та
A394: 1 | B394: H7210/S | C394: US BDU кепка ACU (NYCO R/S) ||CZ-ACU-NR-10 | D394: 86 | E394: * | F394: 1 | G394: 190.00 | H394: 2.21 | I394: 190.00 | J394: 104.00 | K394: 2 | L394: =RC[-3]/100*RC[-1] -> 2.21
A395: 2 | B395: H0121/L | C395: Перчатки тактические IHD чёрные ||RK-IHD-PO-01 | D395: 247 | E395: * | F395: 1 | G395: 544.00 | H395: 2.20 | I395: 544.00 | J395: 297.00 | K395: 2 | L395: =RC[-3]/100*RC[-1] -> 2.20
A396: 3 | B396: H7202 | C396: US BDU кепка олива (NYCO R/S) ||CZ-COM-CR-02 | D396: 47 | E396: * | F396: 1 | G396: 103.00 | H396: 2.19 | I396: 103.00 | J396: 56.00 | K396: 2 | L396: =RC[-3]/100*RC[-1] -> 2.19
A397: 4 | B397: H7811 | C397: Хустка SHEMAGH койот/чёрная ||CZ-ARF-CO-11 | D397: 72 | E397: * | F397: 1 | G397: 159.00 | H397: 2.21 | I397: 159.00 | J397: 87.00 | K397: 2 | L397: =RC[-3]/100*RC[-1] -> 2.21
A398: 5 | B398: H7901 | C398: Шапка флисовая чёрная ||CZ-DOK-FL-01 | D398: 40 | E398: * | F398: 1 | G398: 100.00 | H398: 2.50 | I398: 100.00 | J398: 60.00 | K398: 2 | L398: =RC[-3]/100*RC[-1] -> 2.50
A399: 6 | B399: H7902 | C399: Шапка флисовая олива ||CZ-DOK-FL-02 | D399: 40 | E399: * | F399: 1 | G399: 100.00 | H399: 2.50 | I399: 100.00 | J399: 60.00 | K399: 2 | L399: =RC[-3]/100*RC[-1] -> 2.50
A400: 7 | B400: H59041/LR | C400: CPU китель польский вудлэнд (PolyCotton) ||BL-CPU-PR-04 | D400: 402 | E400: * | F400: 1 | G400: 884.00 | H400: 2.20 | I400: 795.60 | J400: 393.60 | K400: 2 | L400: =RC[-3]/100*RC[-1] -> 2.20
A401: 8 | B401: H5904/MR | C401: CPU штаны польский вудлэнд (PolyCotton) ||SP-CPU-PR-04 | D401: 402 | E401: * | F401: 1 | G401: 884.00 | H401: 2.20 | I401: 795.60 | J401: 393.60 | K401: 2 | L401: =RC[-3]/100*RC[-1] -> 2.20
A402: 9 | B402: H7904 | C402: Шапка флисовая пол.вудлэнд ||CZ-DOK-FL-04 | D402: 60 | E402: * | F402: 1 | G402: 150.00 | H402: 2.50 | I402: 135.00 | J402: 75.00 | K402: 2 | L402: =RC[-3]/100*RC[-1] -> 2.50
A403: 10 | B403: H7820 | C403: Хустка SHEMAGH біло/чёрная ||CZ-ARF-CO-20 | D403: 72 | E403: * | F403: 1 | G403: 159.00 | H403: 2.21 | I403: 159.00 | J403: 87.00 | K403: 2 | L403: =RC[-3]/100*RC[-1] -> 2.21
A404: 11 | B404: X4021 | C404: Балаклава олива с 1-м отв. нинзя (100%хлопок) ||X76012 | D404: 63 | E404: * | F404: 1 | G404: 80.00 | H404: 1.27 | I404: 80.00 | J404: 17.00 | K404: 2 | L404: =RC[-3]/100*RC[-1] -> 1.27
A405: 12 | B405: X4011 | C405: Балаклава чёрная с 1-м отв. нинзя(100%хлопок) ||X76011 | D405: 63 | E405: * | F405: 1 | G405: 80.00 | H405: 1.27 | I405: 80.00 | J405: 17.00 | K405: 2 | L405: =RC[-3]/100*RC[-1] -> 1.27 | M405: =SUM(R[-12]C[-1]:RC[-1]) -> 
A407: #12012 (2015-01-31) Магазин Уніформи - Відправлено-Продано
A408: N | B408: арт | C408: назва | D408: закуп | F408: к-ть | G408: цiна | H408: кф | I408: продж | J408: дохiд | K408: % | L408: з-та
A409: 1 | B409: H5814/SR | C409: URBAN TACTICAL штаны мультикам (NYCO R/S) ||SP-UTL-NR-14 | D409: 30.75 | E409: usd | F409: 1 | G409: 1353.00 | H409: 2.20 | I409: 1217.70 | J409: 602.70 | K409: 2 | L409: =RC[-3]/100*RC[-1] -> 2.20
A410: 2 | B410: H9013/120 | C410: Ремень ARMY BELT хаки ||PS-ARM-CO-13 | D410: 4.23 | E410: usd | F410: 1 | G410: 193.00 | H410: 2.28 | I410: 173.70 | J410: 89.10 | K410: 2 | L410: =RC[-3]/100*RC[-1] -> 2.28
A411: 3 | B411: K104707/SR | C411: Комплект формы марпат ACU китель, штаны, кепка (R/S) ||KP-ACU-PR-07 | D411: 14.00 | E411: usd | F411: 1 | G411: 616.00 | H411: 2.20 | I411: 616.00 | J411: 336.00 | K411: 2 | L411: =RC[-3]/100*RC[-1] -> 2.20
A412: 4 | B412: H8601/130 | C412: Ремень TOUGH NAVY SEAL чёрный ||PS-NAV-CO-02 | D412: 4.23 | E412: usd | F412: 1 | G412: 193.00 | H412: 2.28 | I412: 193.00 | J412: 108.40 | K412: 2 | L412: =RC[-3]/100*RC[-1] -> 2.28
A413: 5 | B413: _155155-O | C413: Перчатки флисовые олива | D413: 1.83 | E413: Инт | F413: 1 | G413: 83.00 | H413: 2.26 | I413: 83.00 | J413: 46.33 | K413: 2 | L413: =RC[-3]/100*RC[-1] -> 2.26
A414: 6 | B414: _TRC-011 | C414: Кружка TRAMP 300 мл, складные ручки | D414: 3.60 | E414: Инт | F414: 1 | G414: 117.00 | H414: 1.63 | I414: 117.00 | J414: 45.00 | K414: 2 | L414: =RC[-3]/100*RC[-1] -> 1.63
A415: 7 | B415: K17222-F | C415: Балаклава SKULL type F-чёрная [Производитель: ACM] ||M51617222-F | D415: 2.65 | E415: usd | F415: 1 | G415: 117.00 | H415: 2.21 | I415: 117.00 | J415: 64.00 | K415: 2 | L415: =RC[-3]/100*RC[-1] -> 2.21
A416: 8 | B416: H7902 | C416: Шапка флисовая олива ||CZ-DOK-FL-02 | D416: 2.00 | E416: usd | F416: 1 | G416: 100.00 | H416: 2.50 | I416: 100.00 | J416: 60.00 | K416: 2 | L416: =RC[-3]/100*RC[-1] -> 2.50
A417: 9 | B417: H88001/L | C417: Ремень US UTILITY чёрный нейлон ||PS-UTL-NL-01 | D417: 5.59 | E417: usd | F417: 1 | G417: 257.00 | H417: 2.30 | I417: 257.00 | J417: 145.20 | K417: 2 | L417: =RC[-3]/100*RC[-1] -> 2.30
A418: 10 | B418: H3301/XL | C418: Комплект термобілизни (95% полиэстер 5% спандекс) чёрный ||KP-UN2-PO-01/XL | D418: 19.99 | E418: usd | F418: 1 | G418: 880.00 | H418: 2.20 | I418: 836.00 | J418: 436.20 | K418: 2 | L418: =RC[-3]/100*RC[-1] -> 2.20
A419: 11 | B419: H59041/SR | C419: CPU китель польский вудлэнд (PolyCotton) ||BL-CPU-PR-04 | D419: 20.10 | E419: usd | F419: 1 | G419: 884.00 | H419: 2.20 | I419: 795.60 | J419: 393.60 | K419: 2 | L419: =RC[-3]/100*RC[-1] -> 2.20
A420: 12 | B420: H5904/SR | C420: CPU штаны польский вудлэнд (PolyCotton) ||SP-CPU-PR-04 | D420: 20.10 | E420: usd | F420: 1 | G420: 884.00 | H420: 2.20 | I420: 795.60 | J420: 393.60 | K420: 2 | L420: =RC[-3]/100*RC[-1] -> 2.20
A421: 13 | B421: H7904 | C421: Шапка флисовая пол.вудлэнд ||CZ-DOK-FL-04 | D421: 3.00 | E421: usd | F421: 1 | G421: 150.00 | H421: 2.50 | I421: 135.00 | J421: 75.00 | K421: 2 | L421: =RC[-3]/100*RC[-1] -> 2.50
A422: 14 | B422: H3404/S | C422: Футболка польский вудлэнд ||TS-TSH-CO-04 | D422: 4.06 | E422: usd | F422: 1 | G422: 179.00 | H422: 2.21 | I422: 161.10 | J422: 79.95 | K422: 2 | L422: =RC[-3]/100*RC[-1] -> 2.21
A423: 15 | B423: G4502/86-170 | C423: Комплект теплого нательного белья (100% полиэстер) олива | D423: 90.00 | E423: грн | F423: 1 | G423: 250.00 | H423: 2.78 | I423: 225.00 | J423: 135.00 | K423: 2 | L423: =RC[-3]/100*RC[-1] -> 2.78
A424: 16 | B424: H02101/M | C424: Носки высокие HEAVYWEIGHT ||р39-42 ||SK-HWT-WA-01 | D424: 4.83 | E424: usd | F424: 1 | G424: 213.00 | H424: 2.20 | I424: 191.70 | J424: 95.10 | K424: 2 | L424: =RC[-3]/100*RC[-1] -> 2.20
A425: 17 | B425: _155155-B | C425: Перчатки флисовые чёрные | D425: 1.83 | E425: Инт | F425: 1 | G425: 83.00 | H425: 2.26 | I425: 83.00 | J425: 46.33 | K425: 2 | L425: =RC[-3]/100*RC[-1] -> 2.26
A426: 18 | B426: _916596 | C426: Шапка чёрная с флисовой подкладкой | D426: 2.35 | E426: Инт | F426: 1 | G426: 118.00 | H426: 2.51 | I426: 118.00 | J426: 71.00 | K426: 2 | L426: =RC[-3]/100*RC[-1] -> 2.51
A427: 19 | B427: X4011 | C427: Балаклава чёрная с 1-м отв. нинзя(100%хлопок) ||X76011 | D427: 3.15 | E427: Инт | F427: 1 | G427: 80.00 | H427: 1.27 | I427: 80.00 | J427: 17.00 | K427: 2 | L427: =RC[-3]/100*RC[-1] -> 1.27
A428: 20 | B428: H3410/S | C428: Футболка ACU ||TS-TSH-CO-10 | D428: 4.06 | E428: usd | F428: 1 | G428: 179.00 | H428: 2.21 | I428: 179.00 | J428: 97.85 | K428: 2 | L428: =RC[-3]/100*RC[-1] -> 2.21
A429: 21 | B429: H3430/S | C429: Футболка койот-браун ||TS-TSH-CO-30 | D429: 4.06 | E429: usd | F429: 1 | G429: 179.00 | H429: 2.21 | I429: 179.00 | J429: 97.85 | K429: 2 | L429: =RC[-3]/100*RC[-1] -> 2.21
A430: 22 | B430: H3411/S | C430: Футболка койот||TS-TSH-CO-11 | D430: 4.06 | E430: usd | F430: 1 | G430: 179.00 | H430: 2.20 | I430: 179.00 | J430: 97.80 | K430: 2 | L430: =RC[-3]/100*RC[-1] -> 2.20
A431: 23 | B431: _916596-1 | C431: Шапка олива с флисовой подкладкой | D431: 2.50 | E431: Инт | F431: 1 | G431: 125.00 | H431: 2.50 | I431: 125.00 | J431: 75.00 | K431: 2 | L431: =RC[-3]/100*RC[-1] -> 2.50
A432: 24 | B432: H7914 | C432: Шапка флисовая мультикам ||CZ-DOK-FL-14 | D432: 4.00 | E432: usd | F432: 1 | G432: 200.00 | H432: 2.50 | I432: 200.00 | J432: 120.00 | K432: 2 | L432: =RC[-3]/100*RC[-1] -> 2.50
A433: 25 | B433: _B1973/56 | C433: Швед.кепка олива | D433: 10.00 | E433: usd | F433: 1 | G433: 30.00 | H433: 0.15 | I433: 30.00 | J433: -170.00 | K433: 2 | L433: =RC[-3]/100*RC[-1] -> 0.15 | M433: =SUM(R[-25]C[-1]:RC[-1]) -> 
A435: #12022 (2015-02-02) Магазин Уніформи - Відправлено-Продано
A436: N | B436: арт | C436: назва | D436: закуп | F436: к-ть | G436: цiна | H436: кф | I436: продж | J436: дохiд | K436: % | L436: з-та
A437: 1 | B437: EM6628A | C437: Шапка-труба MARPAT||EM6628A | D437: 4.24 | E437: usd | F437: 1 | G437: 187.00 | H437: 2.21 | I437: 187.00 | J437: 102.20 | K437: 2 | L437: =RC[-3]/100*RC[-1] -> 2.21
A438: 2 | B438: _155155-B | C438: Перчатки флисовые чёрные | D438: 1.83 | E438: Инт | F438: 1 | G438: 83.00 | H438: 2.26 | I438: 74.70 | J438: 38.03 | K438: 2 | L438: =RC[-3]/100*RC[-1] -> 2.26
A439: 3 | B439: H02101/M | C439: Носки высокие HEAVYWEIGHT ||р39-42 ||SK-HWT-WA-01 | D439: 4.83 | E439: usd | F439: 2 | G439: 213.00 | H439: 2.20 | I439: 383.40 | J439: 190.20 | K439: 2 | L439: =RC[-3]/100*RC[-1] -> 2.20
A440: 4 | B440: _11601/G/02 | C440: BW китель флектарн б/у ||91160121-002 | D440: 30.00 | E440: грн | F440: 1 | G440: 70.00 | H440: 2.33 | I440: 70.00 | J440: 40.00 | K440: 2 | L440: =RC[-3]/100*RC[-1] -> 2.33
A441: 5 | B441: 53112-14 | C441: Налокотники AltaCONTOUR койот [ALTA] ||OL-ACV-CD-11 | D441: 20.25 | E441: usd | F441: 1 | G441: 891.00 | H441: 2.20 | I441: 801.90 | J441: 396.90 | K441: 2 | L441: =RC[-3]/100*RC[-1] -> 2.20
A442: 6 | B442: 52913-14 | C442: Наколінники AltaCOUNTOUR Flexible койот [ALTA] ||OK-ACL-CD-11 | D442: 22.41 | E442: usd | F442: 1 | G442: 986.00 | H442: 2.20 | I442: 887.40 | J442: 439.20 | K442: 2 | L442: =RC[-3]/100*RC[-1] -> 2.20
A443: 7 | B443: H7601 | C443: Балаклава чёрная с 1-м отв.(96%хлопок, 4%лайкра) ||CZ-KO1-CO-01 | D443: 1.82 | E443: usd | F443: 1 | G443: 91.00 | H443: 2.50 | I443: 100.00 | J443: 63.60 | K443: 2 | L443: =RC[-3]/100*RC[-1] -> 2.50
A444: 8 | B444: H0141/L | C444: Перчатки тактические US Model чёрные ||RK-USM-PO-01 | D444: 10.43 | E444: usd | F444: 1 | G444: 459.00 | H444: 2.20 | I444: 459.00 | J444: 250.40 | K444: 2 | L444: =RC[-3]/100*RC[-1] -> 2.20
A445: 9 | B445: H4309/MR | C445: US SFU штаны мэтро (NYCO R/S) ||SP-SFU-NR-09 | D445: 14.49 | E445: usd | F445: 1 | G445: 638.00 | H445: 2.20 | I445: 638.00 | J445: 348.20 | K445: 2 | L445: =RC[-3]/100*RC[-1] -> 2.20
A446: 10 | B446: 40484-1 | C446: Балаклава чёрная вязаная | D446: 2.53 | E446: Инт | F446: 1 | G446: 94.00 | H446: 1.86 | I446: 94.00 | J446: 43.40 | K446: 2 | L446: =RC[-3]/100*RC[-1] -> 1.86
A447: 11 | B447: H9001/120 | C447: Ремень ARMY BELT чёрный ||PS-ARM-CO-01 | D447: 4.23 | E447: usd | F447: 1 | G447: 193.00 | H447: 2.28 | I447: 193.00 | J447: 108.40 | K447: 2 | L447: =RC[-3]/100*RC[-1] -> 2.28
A448: 12 | B448: 52913-18 | C448: Наколінники AltaCOUNTOUR Flexible A-TACS(R) [ALTA] ||OK-ACL-CD-35 | D448: 24.21 | E448: usd | F448: 1 | G448: 1065.00 | H448: 2.20 | I448: 958.50 | J448: 474.30 | K448: 2 | L448: =RC[-3]/100*RC[-1] -> 2.20
A449: 13 | B449: H8913/140 | C449: Ремень TOUGH US MARINES койот ||PS-USM-CO-13 | D449: 3.68 | E449: usd | F449: 1 | G449: 193.00 | H449: 2.62 | I449: 164.05 | J449: 90.45 | K449: 2 | L449: =RC[-3]/100*RC[-1] -> 2.62
A450: 14 | B450: H7901 | C450: Шапка флисовая чёрная ||CZ-DOK-FL-01 | D450: 2.00 | E450: usd | F450: 1 | G450: 100.00 | H450: 2.50 | I450: 100.00 | J450: 60.00 | K450: 2 | L450: =RC[-3]/100*RC[-1] -> 2.50
A451: 15 | B451: H0602 | C451: Резиновая кружка олива ||TK-FOL-PP-02 | D451: 1.15 | E451: usd | F451: 1 | G451: 51.00 | H451: 2.22 | I451: 51.00 | J451: 28.00 | K451: 2 | L451: =RC[-3]/100*RC[-1] -> 2.22
A452: 16 | B452: BD7649-A | C452: Браслет Paracord survival ACU [Производитель: ACM] | D452: 3.62 | E452: usd | F452: 1 | G452: 159.00 | H452: 2.20 | I452: 159.00 | J452: 86.60 | K452: 2 | L452: =RC[-3]/100*RC[-1] -> 2.20
A453: 17 | B453: X4021 | C453: Балаклава олива с 1-м отв. нинзя (100%хлопок) ||X76012 | D453: 3.15 | E453: Инт | F453: 1 | G453: 80.00 | H453: 1.27 | I453: 80.00 | J453: 17.00 | K453: 2 | L453: =RC[-3]/100*RC[-1] -> 1.27 | M453: =SUM(R[-17]C[-1]:RC[-1]) -> 
A455: #12054 (2015-02-03) Магазин Уніформи - Відправлено-Продано
A456: N | B456: арт | C456: назва | D456: закуп | F456: к-ть | G456: цiна | H456: кф | I456: продж | J456: дохiд | K456: % | L456: з-та
A457: 1 | B457: H7901 | C457: Шапка флисовая чёрная ||CZ-DOK-FL-01 | D457: 40 | E457: * | F457: 2 | G457: 100.00 | H457: 2.50 | I457: 200.00 | J457: 120.00 | K457: 2 | L457: =RC[-3]/100*RC[-1] -> 2.50
A458: 2 | B458: H7232 | C458: US BDU кепка олива драп ( PolyCotton Ripstop) ||CZ-COM-NR-32 | D458: 47 | E458: * | F458: 1 | G458: 103.00 | H458: 2.19 | I458: 103.00 | J458: 56.00 | K458: 2 | L458: =RC[-3]/100*RC[-1] -> 2.19
A459: 3 | B459: H4710/SR | C459: US ACU штаны ACU (PolyCotton) ||SP-ACU-PR-10 | D459: 349 | E459: * | F459: 1 | G459: 767.00 | H459: 2.20 | I459: 690.30 | J459: 341.30 | K459: 2 | L459: =RC[-3]/100*RC[-1] -> 2.20
A460: 4 | B460: _108190/54(3) | C460: Тельник морской с голуб.полосами длинный рукав | D460: 125 | E460: * | F460: 1 | G460: 50.00 | H460: 0.40 | I460: 50.00 | J460: -75.00 | K460: 2 | L460: =RC[-3]/100*RC[-1] -> 0.40
A461: 5 | B461: H88001/L | C461: Ремень US UTILITY чёрный нейлон ||PS-UTL-NL-01 | D461: 112 | E461: * | F461: 1 | G461: 257.00 | H461: 2.29 | I461: 257.00 | J461: 145.00 | K461: 2 | L461: =RC[-3]/100*RC[-1] -> 2.29 | M461: =SUM(R[-5]C[-1]:RC[-1]) -> 