Sheet:  name
D1: Вхiднi данi | H1: Зкореговано
C2: Закуп: | D2: 58318 | G2: грн
C3: Продано: | D3: 97508 | G3: грн
C4: Дохiд-Коефiцiент: | D4: 39191(1.67)
C5: Процент з-ти: | D5: 2 | G5: %
C6: Нараховано з-ти: | D6: 1950.17 | G6: грн | H6: =SUM(R[4]C[4]:R[270]C[4]) -> 
B7: курси: Все 0 , грн 1 , usd 20 , euro 25 , zl 5 , Инт 20 ,
A9: #11567 (2015-01-09) Магазин туризму - Відправлено-Продано
A10: N | B10: арт | C10: назва | D10: закуп | F10: к-ть | G10: цiна | H10: кф | I10: продж | J10: дохiд | K10: % | L10: з-та
A11: 1 | B11: K16164-B | C11: Мушка складная к М-серии чёрная [Производитель: ACM] ||M51616164-BK | D11: 228 | E11: * | F11: 1 | G11: 459.00 | H11: 2.01 | I11: 459.00 | J11: 231.00 | K11: 2 | L11: =RC[-3]/100*RC[-1] -> 2.01
A12: 2 | B12: K17173-B | C12: Петля магазинна к М-серии резина чёрная [Производитель: P] ||M51617173-BK | D12: 39 | E12: * | F12: 3 | G12: 89.00 | H12: 2.28 | I12: 267.00 | J12: 150.00 | K12: 2 | L12: =RC[-3]/100*RC[-1] -> 2.28
A13: 3 | B13: K5-0378A | C13: Шарики BB 6мм 0,20x2000 [PREMIUM] ||PJBB 0,2-2000 | D13: 38 | E13: * | F13: 1 | G13: 87.00 | H13: 2.29 | I13: 87.00 | J13: 49.00 | K13: 2 | L13: =RC[-3]/100*RC[-1] -> 2.29
A14: 4 | B14: _3929 | C14: Кобура тактическая кожанная | D14: 350 | E14: * | F14: 1 | G14: 235.00 | H14: 0.67 | I14: 235.00 | J14: -115.00 | K14: 2 | L14: =RC[-3]/100*RC[-1] -> 0.67
A15: 5 | B15: B1020 | C15: Швед. одеяло серое 210х160 | D15: 215 | E15: * | F15: 5 | G15: 311.00 | H15: 1.45 | I15: 1400.00 | J15: 325.00 | K15: 2 | L15: =RC[-3]/100*RC[-1] -> 1.45 | M15: =SUM(R[-5]C[-1]:RC[-1]) -> 
A17: #11596 (2015-01-10) Магазин туризму - Відправлено-Продано
A18: N | B18: арт | C18: назва | D18: закуп | F18: к-ть | G18: цiна | H18: кф | I18: продж | J18: дохiд | K18: % | L18: з-та
A19: 1 | B19: _26-0005 | C19: Гарнитура к KENWOOD Quansheng Puxing Motorola GP-888(1х провод. прозрачный возд) [Китай] | D19: 8.00 | E19: usd | F19: 2 | G19: 234.00 | H19: 1.46 | I19: 468.00 | J19: 148.00 | K19: 2 | L19: =RC[-3]/100*RC[-1] -> 1.46
A20: 2 | B20: K5-1351-В | C20: Магазин страйкбольный механический к AK/AKM (150шар) чёрный [CM]||K5-1351 BK | D20: 4.64 | E20: usd | F20: 2 | G20: 200.00 | H20: 2.16 | I20: 400.00 | J20: 214.40 | K20: 2 | L20: =RC[-3]/100*RC[-1] -> 2.16
A21: 3 | B21: K5-0378A | C21: Шарики BB 6мм 0,20x2000 [PREMIUM] ||PJBB 0,2-2000 | D21: 1.88 | E21: usd | F21: 1 | G21: 87.00 | H21: 2.31 | I21: 87.00 | J21: 49.40 | K21: 2 | L21: =RC[-3]/100*RC[-1] -> 2.31
A22: 4 | B22: K5-0378B | C22: Шарики BB 6мм 0,20x4000 [PREMIUM] ||PJBB 0,2-4000 | D22: 3.57 | E22: usd | F22: 2 | G22: 171.00 | H22: 2.39 | I22: 342.00 | J22: 199.20 | K22: 2 | L22: =RC[-3]/100*RC[-1] -> 2.39
A23: 5 | B23: _11030-094 | C23: Шарики BB 6мм 0,20x3000 [EXCEL] бутылка | D23: 115 | E23: * | F23: 1 | G23: 97.00 | H23: 0.84 | I23: 97.00 | J23: -18.00 | K23: 2 | L23: =RC[-3]/100*RC[-1] -> 0.84
A24: 6 | B24: K4-1995 | C24: Винтовка электропневматическая страйкбольная AK74U рам.приклад (метал+дерево) RK01 [P tune] | D24: 1931 | E24: * | F24: 1 | G24: 3766.00 | H24: 1.95 | I24: 3577.70 | J24: 1646.70 | K24: 2 | L24: =RC[-3]/100*RC[-1] -> 1.95
A25: 7 | B25: K13048-W | C25: Кобура набедренная вудлэнд ||M51613048-WL | D25: 97 | E25: * | F25: 3 | G25: 223.00 | H25: 2.30 | I25: 602.10 | J25: 311.10 | K25: 2 | L25: =RC[-3]/100*RC[-1] -> 2.30
A26: 8 | B26: _14906 | C26: Горелка для сухого спирту ||14906000 | D26: 62 | E26: * | F26: 1 | G26: 142.00 | H26: 2.29 | I26: 142.00 | J26: 80.00 | K26: 2 | L26: =RC[-3]/100*RC[-1] -> 2.29
A27: 9 | B27: _542693 | C27: Таблетки для дезинфенкции воды Javel Aqua (10шт) | D27: 15 | E27: * | F27: 2 | G27: 25.00 | H27: 1.67 | I27: 50.00 | J27: 20.00 | K27: 2 | L27: =RC[-3]/100*RC[-1] -> 1.67
A28: 10 | B28: A19-39 | C28: Сумка рибальська ACROPOLIS ||РС-1у | D28: 423 | E28: * | F28: 1 | G28: 575.00 | H28: 1.36 | I28: 575.00 | J28: 152.00 | K28: 2 | L28: =RC[-3]/100*RC[-1] -> 1.36
A29: 11 | B29: A19-184 | C29: Подсумок гранатный олива ACROPOLIS||ПГР-1 | D29: 50 | E29: * | F29: 1 | G29: 70.00 | H29: 1.40 | I29: 70.00 | J29: 20.00 | K29: 2 | L29: =RC[-3]/100*RC[-1] -> 1.40
A30: 12 | B30: K4-2760 | C30: Винтовка электропневматическая страйкбольная AKS74U (метал+дерево) [Производитель: CYMA.045A] | D30: 2377 | E30: * | F30: 1 | G30: 4207.00 | H30: 1.77 | I30: 4207.00 | J30: 1830.00 | K30: 2 | L30: =RC[-3]/100*RC[-1] -> 1.77
A31: 13 | B31: K4-2956 | C31: Винтовка пневматическая страйкбольна HI-POWER M870 SHOTGUN 420 fps | D31: 774 | E31: * | F31: 1 | G31: 1577.00 | H31: 2.04 | I31: 1577.00 | J31: 803.00 | K31: 2 | L31: =RC[-3]/100*RC[-1] -> 2.04
A32: 14 | B32: K5-0772 | C32: Шарики BB 6мм 0,23x3000 [PREMIUM] ||PJBB 0,23-3000 | D32: 71 | E32: * | F32: 1 | G32: 171.00 | H32: 2.41 | I32: 171.00 | J32: 100.00 | K32: 2 | L32: =RC[-3]/100*RC[-1] -> 2.41
A33: 15 | B33: _N550200 | C33: Кобура оперативная ПМ с подсумком | D33: 270 | E33: * | F33: 1 | G33: 382.00 | H33: 1.41 | I33: 382.00 | J33: 112.00 | K33: 2 | L33: =RC[-3]/100*RC[-1] -> 1.41
A34: 16 | B34: K5-0772 | C34: Шарики BB 6мм 0,23x3000 [PREMIUM] ||PJBB 0,23-3000 | D34: 71 | E34: * | F34: 1 | G34: 171.00 | H34: 2.41 | I34: 171.00 | J34: 100.00 | K34: 2 | L34: =RC[-3]/100*RC[-1] -> 2.41
A35: 17 | B35: BD0767 | C35: Адаптер магазинов М4 к G36 ||BD0767 K5-0643 | D35: 174 | E35: * | F35: 1 | G35: 416.00 | H35: 2.39 | I35: 416.00 | J35: 242.00 | K35: 2 | L35: =RC[-3]/100*RC[-1] -> 2.39
A36: 18 | B36: KBB-23 | C36: Шарики BB 6мм 0,23x4300 [GUARDER] ||BB-23(BAG) | D36: 157 | E36: * | F36: 1 | G36: 253.00 | H36: 1.61 | I36: 0.00 | J36: -157.00 | K36: 2 | L36: =RC[-3]/100*RC[-1] -> 1.61 | M36: =SUM(R[-18]C[-1]:RC[-1]) -> 
A38: #11610 (2015-01-12) Магазин туризму - Відправлено-Продано
A39: N | B39: арт | C39: назва | D39: закуп | F39: к-ть | G39: цiна | H39: кф | I39: продж | J39: дохiд | K39: % | L39: з-та
A40: 1 | B40: K13068-AT | C40: Подсумок універс.25х8.5х13 ATACS [A.C.M] ||M51613068-ATACS | D40: 4.43 | E40: usd | F40: 1 | G40: 195.00 | H40: 2.20 | I40: 175.50 | J40: 86.90 | K40: 2 | L40: =RC[-3]/100*RC[-1] -> 2.20
A41: 2 | B41: A19-186 | C41: Кобура набедренная ACROPOLIS||КП-1 | D41: 190.00 | E41: грн | F41: 1 | G41: 275.00 | H41: 1.45 | I41: 275.00 | J41: 85.00 | K41: 2 | L41: =RC[-3]/100*RC[-1] -> 1.45
A42: 3 | B42: _542693 | C42: Таблетки для дезинфенкции воды Javel Aqua (10шт) | D42: 0.76 | E42: Инт | F42: 2 | G42: 25.00 | H42: 1.64 | I42: 50.00 | J42: 19.60 | K42: 2 | L42: =RC[-3]/100*RC[-1] -> 1.64
A43: 4 | B43: _N254-2543 | C43: Термоодеяло | D43: 2.73 | E43: Инт | F43: 1 | G43: 94.00 | H43: 1.72 | I43: 60.00 | J43: 5.40 | K43: 2 | L43: =RC[-3]/100*RC[-1] -> 1.72
A44: 5 | B44: A19-161 | C44: Сумка гігієнічна ACROPOLIS ||СГ-1 | D44: 31.50 | E44: грн | F44: 1 | G44: 45.00 | H44: 1.43 | I44: 45.00 | J44: 13.50 | K44: 2 | L44: =RC[-3]/100*RC[-1] -> 1.43 | M44: =SUM(R[-5]C[-1]:RC[-1]) -> 
A46: #11635 (2015-01-13) Магазин туризму - Відправлено-Продано
A47: N | B47: арт | C47: назва | D47: закуп | F47: к-ть | G47: цiна | H47: кф | I47: продж | J47: дохiд | K47: % | L47: з-та
A48: 1 | B48: A19-34 | C48: Сигн.-звук. ошийник (большой) ACROPOLIS ||СЗО-1а | D48: 43 | E48: * | F48: 1 | G48: 53.00 | H48: 1.23 | I48: 47.70 | J48: 4.70 | K48: 2 | L48: =RC[-3]/100*RC[-1] -> 1.23
A49: 2 | B49: K5-0378A | C49: Шарики BB 6мм 0,20x2000 [PREMIUM] ||PJBB 0,2-2000 | D49: 38 | E49: * | F49: 1 | G49: 87.00 | H49: 2.29 | I49: 87.00 | J49: 49.00 | K49: 2 | L49: =RC[-3]/100*RC[-1] -> 2.29
A50: 3 | B50: K12082-A | C50: Рюкзак MOLLE Tactical Backpack ACU ||M51612082-ACU | D50: 380 | E50: * | F50: 1 | G50: 836.00 | H50: 2.20 | I50: 836.00 | J50: 456.00 | K50: 2 | L50: =RC[-3]/100*RC[-1] -> 2.20
A51: 4 | B51: K11023-M | C51: Розгруз. New Mesh Vest мультикам [A.C.M] ||M51611023-CP | D51: 308 | E51: * | F51: 1 | G51: 678.00 | H51: 2.20 | I51: 610.20 | J51: 302.20 | K51: 2 | L51: =RC[-3]/100*RC[-1] -> 2.20
A52: 5 | B52: K12212-M | C52: Подсумок магазинный двойной G36/M4/AK мультикам [A.C.M] ||M51612212-CP | D52: 102 | E52: * | F52: 1 | G52: 224.00 | H52: 2.20 | I52: 201.60 | J52: 99.60 | K52: 2 | L52: =RC[-3]/100*RC[-1] -> 2.20
A53: 6 | B53: K11162-M | C53: Розгруз. Interceptor Body Armour мультикам [A.C.M] ||M51611162-CP | D53: 780 | E53: * | F53: 1 | G53: 1716.00 | H53: 2.20 | I53: 1630.20 | J53: 850.20 | K53: 2 | L53: =RC[-3]/100*RC[-1] -> 2.20
A54: 7 | B54: K11005-AT | C54: Розгрузочна система тактическая STRIKE с подсумками Atacs ||M51611005-ATACS | D54: 460 | E54: * | F54: 1 | G54: 1012.00 | H54: 2.20 | I54: 910.80 | J54: 450.80 | K54: 2 | L54: =RC[-3]/100*RC[-1] -> 2.20
A55: 8 | B55: K5-0378A | C55: Шарики BB 6мм 0,20x2000 [PREMIUM] ||PJBB 0,2-2000 | D55: 38 | E55: * | F55: 1 | G55: 87.00 | H55: 2.29 | I55: 87.00 | J55: 49.00 | K55: 2 | L55: =RC[-3]/100*RC[-1] -> 2.29
A56: 9 | B56: H159310 | C56: Лента маскировочная универсальная 50мм (4,5м) ACU ||TM-SCG-PO-10 | D56: 42 | E56: * | F56: 1 | G56: 97.00 | H56: 2.31 | I56: 97.00 | J56: 55.00 | K56: 2 | L56: =RC[-3]/100*RC[-1] -> 2.31
A57: 10 | B57: K032-20 | C57: Шарики BB 6мм 0,32x2000 [PREMIUM] ||PJBB 0,32-2000 | D57: 89 | E57: * | F57: 1 | G57: 183.00 | H57: 2.06 | I57: 183.00 | J57: 94.00 | K57: 2 | L57: =RC[-3]/100*RC[-1] -> 2.06
A58: 11 | B58: K5-0378B | C58: Шарики BB 6мм 0,20x4000 [PREMIUM] ||PJBB 0,2-4000 | D58: 71 | E58: * | F58: 1 | G58: 171.00 | H58: 2.41 | I58: 171.00 | J58: 100.00 | K58: 2 | L58: =RC[-3]/100*RC[-1] -> 2.41
A59: 12 | B59: A19-1881 | C59: Разгр. жилет АК олива с поясом ACROPOLIS||РЗ-1п | D59: 511 | E59: * | F59: 1 | G59: 715.00 | H59: 1.40 | I59: 715.00 | J59: 204.00 | K59: 2 | L59: =RC[-3]/100*RC[-1] -> 1.40
A60: 13 | B60: K12024-O | C60: Рюкзак 3-Day Assault 36л олива ||M51612024-OD | D60: 520 | E60: * | F60: 1 | G60: 1144.00 | H60: 2.20 | I60: 915.20 | J60: 395.20 | K60: 2 | L60: =RC[-3]/100*RC[-1] -> 2.20 | M60: =SUM(R[-13]C[-1]:RC[-1]) -> 
A62: #11652 (2015-01-14) Магазин туризму - Відправлено-Продано
A63: N | B63: арт | C63: назва | D63: закуп | F63: к-ть | G63: цiна | H63: кф | I63: продж | J63: дохiд | K63: % | L63: з-та
A64: 1 | B64: _26-0705 | C64: Рация VOYAGER IP-66 MAX 400-470 МГц, 5Вт,1500mAp Li-ion водостійка | D64: 1260 | E64: * | F64: 2 | G64: 1928.00 | H64: 1.53 | I64: 3470.40 | J64: 950.40 | K64: 2 | L64: =RC[-3]/100*RC[-1] -> 1.53
A65: 2 | B65: _26-0020 | C65: Кабель 12В авто к стакана KENWOOD Quansheng [Китай] | D65: 60 | E65: * | F65: 2 | G65: 152.00 | H65: 2.53 | I65: 273.60 | J65: 153.60 | K65: 2 | L65: =RC[-3]/100*RC[-1] -> 2.53
A66: 3 | B66: A19-36 | C66: Стул для відпочинку ACROPOLIS ||СТ-1 | D66: 220 | E66: * | F66: 1 | G66: 310.00 | H66: 1.41 | I66: 310.00 | J66: 90.00 | K66: 2 | L66: =RC[-3]/100*RC[-1] -> 1.41
A67: 4 | B67: _19-1142 | C67: Патронташ на приклад (камуфляжный) | D67: 45 | E67: * | F67: 1 | G67: 65.00 | H67: 1.44 | I67: 65.00 | J67: 20.00 | K67: 2 | L67: =RC[-3]/100*RC[-1] -> 1.44
A68: 5 | B68: K17088N-С | C68: Ремень 3-точ.тактический MP5/G3/M4 койот (нейлон)[Производитель: ACM] ||M51617088N-TAN | D68: 111 | E68: * | F68: 1 | G68: 269.00 | H68: 2.42 | I68: 242.10 | J68: 131.10 | K68: 2 | L68: =RC[-3]/100*RC[-1] -> 2.42 | M68: =SUM(R[-5]C[-1]:RC[-1]) -> 
A70: #11676 (2015-01-15) Магазин туризму - Відправлено-Продано
A71: N | B71: арт | C71: назва | D71: закуп | F71: к-ть | G71: цiна | H71: кф | I71: продж | J71: дохiд | K71: % | L71: з-та
A72: 1 | B72: K12032-ATACS | C72: Рюкзак Combat Camping 65л ATACS N-600D ||M51612032-ATACS | D72: 615 | E72: * | F72: 1 | G72: 1354.00 | H72: 2.20 | I72: 1218.60 | J72: 603.60 | K72: 2 | L72: =RC[-3]/100*RC[-1] -> 2.20
A73: 2 | B73: K4-1703 | C73: Винтовка электропневматическая страйкбольная M4 (метал) [BI3681] | D73: 2601 | E73: * | F73: 1 | G73: 4759.00 | H73: 1.83 | I73: 4759.00 | J73: 2158.00 | K73: 2 | L73: =RC[-3]/100*RC[-1] -> 1.83
A74: 3 | B74: _18789/G-O | C74: US чехол на флягу оригинал (олива) б/у | D74: 40 | E74: * | F74: 1 | G74: 60.00 | H74: 1.50 | I74: 60.00 | J74: 20.00 | K74: 2 | L74: =RC[-3]/100*RC[-1] -> 1.50
A75: 4 | B75: K13028-M | C75: Кобура набедренная MOLLE tactical backpack мультикам ||M51613028-CP | D75: 152 | E75: * | F75: 1 | G75: 350.00 | H75: 2.30 | I75: 350.00 | J75: 198.00 | K75: 2 | L75: =RC[-3]/100*RC[-1] -> 2.30
A76: 5 | B76: A19-190 | C76: Подсумок аптечка ACROPOLIS||ПМ-1 | D76: 100 | E76: * | F76: 1 | G76: 145.00 | H76: 1.45 | I76: 145.00 | J76: 45.00 | K76: 2 | L76: =RC[-3]/100*RC[-1] -> 1.45
A77: 6 | B77: K12024-D | C77: Рюкзак 3-Day Assault 36л марпат ||M51612024-DW | D77: 520 | E77: * | F77: 1 | G77: 1144.00 | H77: 2.20 | I77: 1144.00 | J77: 624.00 | K77: 2 | L77: =RC[-3]/100*RC[-1] -> 2.20
A78: 7 | B78: _14906 | C78: Горелка для сухого спирту ||14906000 | D78: 62 | E78: * | F78: 1 | G78: 142.00 | H78: 2.29 | I78: 142.00 | J78: 80.00 | K78: 2 | L78: =RC[-3]/100*RC[-1] -> 2.29
A79: 8 | B79: K5-0179 | C79: Зарядное устройство для магазинов (470шар) [DiBoys] | D79: 82 | E79: * | F79: 1 | G79: 189.00 | H79: 2.30 | I79: 189.00 | J79: 107.00 | K79: 2 | L79: =RC[-3]/100*RC[-1] -> 2.30
A80: 9 | B80: KBB-23 | C80: Шарики BB 6мм 0,23x4300 [GUARDER] ||BB-23(BAG) | D80: 157 | E80: * | F80: 1 | G80: 253.00 | H80: 1.61 | I80: 253.00 | J80: 96.00 | K80: 2 | L80: =RC[-3]/100*RC[-1] -> 1.61
A81: 10 | B81: _TRP012.08 | C81: Рюкзак ULTRA | D81: 106 | E81: * | F81: 1 | G81: 160.00 | H81: 1.51 | I81: 155.00 | J81: 49.00 | K81: 2 | L81: =RC[-3]/100*RC[-1] -> 1.51 | M81: =SUM(R[-10]C[-1]:RC[-1]) -> 
A83: #11697 (2015-01-16) Магазин туризму - Відправлено-Продано
A84: N | B84: арт | C84: назва | D84: закуп | F84: к-ть | G84: цiна | H84: кф | I84: продж | J84: дохiд | K84: % | L84: з-та
A85: 1 | B85: _1400021 | C85: Каремат-сидушка туристический 8мм олива | D85: 20 | E85: * | F85: 1 | G85: 57.00 | H85: 2.85 | I85: 57.00 | J85: 37.00 | K85: 2 | L85: =RC[-3]/100*RC[-1] -> 2.85
A86: 2 | B86: _19-11423 | C86: Ремень для винтовки adventure | D86: 40 | E86: * | F86: 1 | G86: 60.00 | H86: 1.50 | I86: 60.00 | J86: 20.00 | K86: 2 | L86: =RC[-3]/100*RC[-1] -> 1.50
A87: 3 | B87: K12024-D | C87: Рюкзак 3-Day Assault 36л марпат ||M51612024-DW | D87: 520 | E87: * | F87: 1 | G87: 1144.00 | H87: 2.20 | I87: 1144.00 | J87: 624.00 | K87: 2 | L87: =RC[-3]/100*RC[-1] -> 2.20
A88: 4 | B88: KBB-23 | C88: Шарики BB 6мм 0,23x4300 [GUARDER] ||BB-23(BAG) | D88: 157 | E88: * | F88: 1 | G88: 253.00 | H88: 1.61 | I88: 253.00 | J88: 96.00 | K88: 2 | L88: =RC[-3]/100*RC[-1] -> 1.61
A89: 5 | B89: A13851/G | C89: Баул прорезинений оливковий | D89: 17 | E89: * | F89: 1 | G89: 54.00 | H89: 3.18 | I89: 48.60 | J89: 31.60 | K89: 2 | L89: =RC[-3]/100*RC[-1] -> 3.18 | M89: =SUM(R[-5]C[-1]:RC[-1]) -> 
A91: #11722 (2015-01-19) Магазин туризму - Відправлено-Продано
A92: N | B92: арт | C92: назва | D92: закуп | F92: к-ть | G92: цiна | H92: кф | I92: продж | J92: дохiд | K92: % | L92: з-та
A93: 1 | B93: A19-117 | C93: Футляр для винтовки ACROPOLIS ||ФЗ-8б | D93: 461 | E93: * | F93: 1 | G93: 651.00 | H93: 1.41 | I93: 651.00 | J93: 190.00 | K93: 2 | L93: =RC[-3]/100*RC[-1] -> 1.41
A94: 2 | B94: _19-1101 | C94: Подсумок на 8 патронів (кожаный) | D94: 55 | E94: * | F94: 1 | G94: 80.00 | H94: 1.45 | I94: 80.00 | J94: 25.00 | K94: 2 | L94: =RC[-3]/100*RC[-1] -> 1.45
A95: 3 | B95: _11030-094 | C95: Шарики BB 6мм 0,20x3000 [EXCEL] бутылка | D95: 115 | E95: * | F95: 1 | G95: 97.00 | H95: 0.84 | I95: 97.00 | J95: -18.00 | K95: 2 | L95: =RC[-3]/100*RC[-1] -> 0.84
A96: 4 | B96: K12025-M | C96: Рюкзак 3-Day Assault 30л мультикам ||M51612025-CP | D96: 353 | E96: * | F96: 1 | G96: 777.00 | H96: 2.20 | I96: 777.00 | J96: 424.00 | K96: 2 | L96: =RC[-3]/100*RC[-1] -> 2.20
A97: 5 | B97: _16172 | C97: Шарики BB 6мм 0,20x6000 [BLASTER-DEVIL] - бутылка | D97: 171 | E97: * | F97: 1 | G97: 180.00 | H97: 1.05 | I97: 180.00 | J97: 9.00 | K97: 2 | L97: =RC[-3]/100*RC[-1] -> 1.05
A98: 6 | B98: _542693 | C98: Таблетки для дезинфенкции воды Javel Aqua (10шт) | D98: 15 | E98: * | F98: 10 | G98: 25.00 | H98: 1.67 | I98: 250.00 | J98: 100.00 | K98: 2 | L98: =RC[-3]/100*RC[-1] -> 1.67
A99: 7 | B99: A19-190 | C99: Подсумок аптечка ACROPOLIS||ПМ-1 | D99: 100 | E99: * | F99: 1 | G99: 145.00 | H99: 1.45 | I99: 145.00 | J99: 45.00 | K99: 2 | L99: =RC[-3]/100*RC[-1] -> 1.45
A100: 8 | B100: L0004 | C100: Кресало FS9.5*101 | D100: 173 | E100: * | F100: 1 | G100: 263.00 | H100: 1.52 | I100: 263.00 | J100: 90.00 | K100: 2 | L100: =RC[-3]/100*RC[-1] -> 1.52
A101: 9 | B101: H155021 | C101: Пилка туристическая с кільцями ||PD-PD1-SS-15 | D101: 38 | E101: * | F101: 1 | G101: 84.00 | H101: 2.21 | I101: 84.00 | J101: 46.00 | K101: 2 | L101: =RC[-3]/100*RC[-1] -> 2.21
A102: 10 | B102: K5-0379B | C102: Шарики BB 6мм 0,25x4000 [PREMIUM] ||PJBB 0,25-4000 | D102: 100 | E102: * | F102: 1 | G102: 243.00 | H102: 2.43 | I102: 243.00 | J102: 143.00 | K102: 2 | L102: =RC[-3]/100*RC[-1] -> 2.43
A103: 11 | B103: K5-0379B | C103: Шарики BB 6мм 0,25x4000 [PREMIUM] ||PJBB 0,25-4000 | D103: 100 | E103: * | F103: 1 | G103: 243.00 | H103: 2.43 | I103: 243.00 | J103: 143.00 | K103: 2 | L103: =RC[-3]/100*RC[-1] -> 2.43
A104: 12 | B104: K5-0378A | C104: Шарики BB 6мм 0,20x2000 [PREMIUM] ||PJBB 0,2-2000 | D104: 38 | E104: * | F104: 1 | G104: 87.00 | H104: 2.29 | I104: 87.00 | J104: 49.00 | K104: 2 | L104: =RC[-3]/100*RC[-1] -> 2.29
A105: 13 | B105: A19-139 | C105: Охотничий ремень ACROPOLIS ||МР-10 | D105: 71 | E105: * | F105: 1 | G105: 85.00 | H105: 1.20 | I105: 85.00 | J105: 14.00 | K105: 2 | L105: =RC[-3]/100*RC[-1] -> 1.20
A106: 14 | B106: A19-136 | C106: Футляр для винтовки ACROPOLIS ||ФЗ-7в | D106: 507 | E106: * | F106: 1 | G106: 619.00 | H106: 1.22 | I106: 619.00 | J106: 112.00 | K106: 2 | L106: =RC[-3]/100*RC[-1] -> 1.22 | M106: =SUM(R[-14]C[-1]:RC[-1]) -> 
A108: #11725 (2015-01-19) Магазин туризму - Відправлено-Продано
A109: N | B109: арт | C109: назва | D109: закуп | F109: к-ть | G109: цiна | H109: кф | I109: продж | J109: дохiд | K109: % | L109: з-та
A110: 1 | B110: K11002-A | C110: Розгруз. FA ACU [WwCH] ||M51611002-ACU | D110: 1272 | E110: * | F110: 1 | G110: 2798.00 | H110: 2.20 | I110: 2518.20 | J110: 1246.20 | K110: 2 | L110: =RC[-3]/100*RC[-1] -> 2.20
A111: 2 | B111: Брон | C111: Бронепластина 4-й класс | D111: 1400 | E111: * | F111: 2 | G111: 1662.00 | H111: 1.19 | I111: 3324.00 | J111: 524.00 | K111: 2 | L111: =RC[-3]/100*RC[-1] -> 1.19
A112: 3 | B112: _N550200 | C112: Кобура оперативная ПМ с подсумком | D112: 270 | E112: * | F112: 1 | G112: 382.00 | H112: 1.41 | I112: 382.00 | J112: 112.00 | K112: 2 | L112: =RC[-3]/100*RC[-1] -> 1.41
A113: 4 | B113: K4-3178 | C113: Винтовка снайперская страйкбольная. пневм. MB01 койот [Well] | D113: 1631 | E113: * | F113: 1 | G113: 2805.00 | H113: 1.72 | I113: 2524.50 | J113: 893.50 | K113: 2 | L113: =RC[-3]/100*RC[-1] -> 1.72
A114: 5 | B114: K5-0882 | C114: Комплект для тюнинга WARRIOR (MB01, MB05) 170м/с | D114: 256 | E114: * | F114: 1 | G114: 589.00 | H114: 2.30 | I114: 589.00 | J114: 333.00 | K114: 2 | L114: =RC[-3]/100*RC[-1] -> 2.30
A115: 6 | B115: K032-20 | C115: Шарики BB 6мм 0,32x2000 [PREMIUM] ||PJBB 0,32-2000 | D115: 89 | E115: * | F115: 1 | G115: 183.00 | H115: 2.06 | I115: 183.00 | J115: 94.00 | K115: 2 | L115: =RC[-3]/100*RC[-1] -> 2.06
A116: 7 | B116: K12083-M | C116: Рюкзак Combat с кишенею для винтовки мультикам ||M51612083-CP | D116: 569 | E116: * | F116: 1 | G116: 1251.00 | H116: 2.20 | I116: 1125.90 | J116: 556.90 | K116: 2 | L116: =RC[-3]/100*RC[-1] -> 2.20
A117: 8 | B117: A19-78 | C117: Чохол для оружия (L-118) ACROPOLIS ||ЧДЗ-1 | D117: 160 | E117: * | F117: 1 | G117: 192.00 | H117: 1.20 | I117: 192.00 | J117: 32.00 | K117: 2 | L117: =RC[-3]/100*RC[-1] -> 1.20 | M117: =SUM(R[-8]C[-1]:RC[-1]) -> 
A119: #11748 (2015-01-20) Магазин туризму - Відправлено-Продано
A120: N | B120: арт | C120: назва | D120: закуп | F120: к-ть | G120: цiна | H120: кф | I120: продж | J120: дохiд | K120: % | L120: з-та
A121: 1 | B121: _19-1125 | C121: Чохол МЦ woodland | D121: 150 | E121: * | F121: 1 | G121: 220.00 | H121: 1.47 | I121: 220.00 | J121: 70.00 | K121: 2 | L121: =RC[-3]/100*RC[-1] -> 1.47
A122: 2 | B122: K17133-DW | C122: Плечеременная разгрузочная система марпат ||M51617133-DW | D122: 155 | E122: * | F122: 1 | G122: 342.00 | H122: 2.21 | I122: 342.00 | J122: 187.00 | K122: 2 | L122: =RC[-3]/100*RC[-1] -> 2.21
A123: 3 | B123: K13191-M | C123: Подсумок магазинный один. мультикам AK/RPK [A.C.M] ||M51613191-CP | D123: 73 | E123: * | F123: 3 | G123: 160.00 | H123: 2.19 | I123: 432.00 | J123: 213.00 | K123: 2 | L123: =RC[-3]/100*RC[-1] -> 2.19
A124: 4 | B124: _542693 | C124: Таблетки для дезинфенкции воды Javel Aqua (10шт) | D124: 15 | E124: * | F124: 1 | G124: 25.00 | H124: 1.67 | I124: 25.00 | J124: 10.00 | K124: 2 | L124: =RC[-3]/100*RC[-1] -> 1.67
A125: 5 | B125: KG-1000 | C125: GREEN GAS 1000мл | D125: 94 | E125: * | F125: 1 | G125: 248.00 | H125: 2.64 | I125: 0.00 | J125: -94.00 | K125: 2 | L125: =RC[-3]/100*RC[-1] -> 2.64 | M125: =SUM(R[-5]C[-1]:RC[-1]) -> 
A127: #11785 (2015-01-21) Магазин туризму - Відправлено-Продано
A128: N | B128: арт | C128: назва | D128: закуп | F128: к-ть | G128: цiна | H128: кф | I128: продж | J128: дохiд | K128: % | L128: з-та
A129: 1 | B129: H90111 | C129: Подсумок Modular System магазинный койот №1 ||LA-M01-PO-11 | D129: 64 | E129: * | F129: 2 | G129: 141.00 | H129: 2.20 | I129: 253.80 | J129: 125.80 | K129: 2 | L129: =RC[-3]/100*RC[-1] -> 2.20
A130: 2 | B130: _TRA-026 | C130: Гермопакет 13x20 см | D130: 49 | E130: * | F130: 1 | G130: 77.00 | H130: 1.57 | I130: 77.00 | J130: 28.00 | K130: 2 | L130: =RC[-3]/100*RC[-1] -> 1.57
A131: 3 | B131: K13165-O | C131: Подсумок Leg Linear Utility Pounch олива [A.C.M] ||M51613165-OD | D131: 229 | E131: * | F131: 1 | G131: 503.00 | H131: 2.20 | I131: 452.70 | J131: 223.70 | K131: 2 | L131: =RC[-3]/100*RC[-1] -> 2.20
A132: 4 | B132: A19-48 | C132: Футляр двохсекційний (L-135) ACROPOLIS ||КВ-3в | D132: 306 | E132: * | F132: 1 | G132: 368.00 | H132: 1.20 | I132: 368.00 | J132: 62.00 | K132: 2 | L132: =RC[-3]/100*RC[-1] -> 1.20
A133: 5 | B133: K12083-M | C133: Рюкзак Combat с кишенею для винтовки мультикам ||M51612083-CP | D133: 569 | E133: * | F133: 1 | G133: 1251.00 | H133: 2.20 | I133: 1125.90 | J133: 556.90 | K133: 2 | L133: =RC[-3]/100*RC[-1] -> 2.20
A134: 6 | B134: K12025-С | C134: Рюкзак 3-Day Assault 30л койот ||M51612025-TAN | D134: 353 | E134: * | F134: 1 | G134: 777.00 | H134: 2.20 | I134: 699.30 | J134: 346.30 | K134: 2 | L134: =RC[-3]/100*RC[-1] -> 2.20 | M134: =SUM(R[-6]C[-1]:RC[-1]) -> 
A136: #11811 (2015-01-22) Магазин туризму - Відправлено-Продано
A137: N | B137: арт | C137: назва | D137: закуп | F137: к-ть | G137: цiна | H137: кф | I137: продж | J137: дохiд | K137: % | L137: з-та
A138: 1 | B138: A19-183 | C138: Подсумок для сброса магазинов олива ACROPOLIS||СВМ-1 | D138: 62.00 | E138: грн | F138: 1 | G138: 85.00 | H138: 1.37 | I138: 85.00 | J138: 23.00 | K138: 2 | L138: =RC[-3]/100*RC[-1] -> 1.37
A139: 2 | B139: H1621 | C139: Шарф-сетка Foliage Green 95X115см ||CZ-SOR-CO-21 | D139: 7.34 | E139: usd | F139: 1 | G139: 337.00 | H139: 2.30 | I139: 337.00 | J139: 190.20 | K139: 2 | L139: =RC[-3]/100*RC[-1] -> 2.30
A140: 3 | B140: A19-190 | C140: Подсумок аптечка ACROPOLIS||ПМ-1 | D140: 100.00 | E140: грн | F140: 1 | G140: 145.00 | H140: 1.45 | I140: 145.00 | J140: 45.00 | K140: 2 | L140: =RC[-3]/100*RC[-1] -> 1.45
A141: 4 | B141: _1400021 | C141: Каремат-сидушка туристический 8мм олива | D141: 1.00 | E141: Инт | F141: 1 | G141: 57.00 | H141: 2.85 | I141: 57.00 | J141: 37.00 | K141: 2 | L141: =RC[-3]/100*RC[-1] -> 2.85
A142: 5 | B142: A19-186 | C142: Кобура набедренная ACROPOLIS||КП-1 | D142: 190.00 | E142: грн | F142: 2 | G142: 275.00 | H142: 1.45 | I142: 522.50 | J142: 142.50 | K142: 2 | L142: =RC[-3]/100*RC[-1] -> 1.45
A143: 6 | B143: A19-185 | C143: Ремень 3.-точ ACROPOLIS||РТО-1 | D143: 179.00 | E143: грн | F143: 1 | G143: 250.00 | H143: 1.40 | I143: 237.50 | J143: 58.50 | K143: 2 | L143: =RC[-3]/100*RC[-1] -> 1.40 | M143: =SUM(R[-6]C[-1]:RC[-1]) -> 
A145: #11841 (2015-01-23) Магазин туризму - Відправлено-Продано
A146: N | B146: арт | C146: назва | D146: закуп | F146: к-ть | G146: цiна | H146: кф | I146: продж | J146: дохiд | K146: % | L146: з-та
A147: 1 | B147: K13035-C | C147: Подсумок магазинный тройной M4/AK койот [A.C.M] ||M51613035-TAN | D147: 89 | E147: * | F147: 1 | G147: 195.00 | H147: 2.19 | I147: 195.00 | J147: 106.00 | K147: 2 | L147: =RC[-3]/100*RC[-1] -> 2.19
A148: 2 | B148: _16079 | C148: Гидроспрей 500мл FCKW-FREI ||10640000 | D148: 69 | E148: * | F148: 1 | G148: 158.00 | H148: 2.29 | I148: 158.00 | J148: 89.00 | K148: 2 | L148: =RC[-3]/100*RC[-1] -> 2.29
A149: 3 | B149: K12036-A | C149: Рюкзак Becker Patrol Pack MOLLE ACU ||M51612036-ACU | D149: 446 | E149: * | F149: 1 | G149: 982.00 | H149: 2.20 | I149: 785.60 | J149: 339.60 | K149: 2 | L149: =RC[-3]/100*RC[-1] -> 2.20
A150: 4 | B150: KGG-105 | C150: Пістолет газопневматический страйкбольний (Green Gas) BERETTA M92F/M9 [STTI] (ABS) | D150: 269 | E150: * | F150: 1 | G150: 683.00 | H150: 2.54 | I150: 683.00 | J150: 414.00 | K150: 2 | L150: =RC[-3]/100*RC[-1] -> 2.54
A151: 5 | B151: _16171 | C151: Шарики BB 6мм 0,20x3000 [BLASTER-DEVIL] бутылка | D151: 91 | E151: * | F151: 1 | G151: 90.00 | H151: 0.99 | I151: 90.00 | J151: -1.00 | K151: 2 | L151: =RC[-3]/100*RC[-1] -> 0.99
A152: 6 | B152: K13068-AT | C152: Подсумок універс.25х8.5х13 ATACS [A.C.M] ||M51613068-ATACS | D152: 89 | E152: * | F152: 1 | G152: 195.00 | H152: 2.19 | I152: 195.00 | J152: 106.00 | K152: 2 | L152: =RC[-3]/100*RC[-1] -> 2.19
A153: 7 | B153: K13002-TAN | C153: Подсумок MOLLE 12 кал. 6 шт коёт [A.C.M] ||M51613002-TAN | D153: 94 | E153: * | F153: 1 | G153: 207.00 | H153: 2.20 | I153: 207.00 | J153: 113.00 | K153: 2 | L153: =RC[-3]/100*RC[-1] -> 2.20
A154: 8 | B154: A19-184 | C154: Подсумок гранатный олива ACROPOLIS||ПГР-1 | D154: 50 | E154: * | F154: 1 | G154: 70.00 | H154: 1.40 | I154: 70.00 | J154: 20.00 | K154: 2 | L154: =RC[-3]/100*RC[-1] -> 1.40
A155: 9 | B155: _CZ7955 | C155: Спальный мешок CarpZoom Extreme Sleeping Bag | D155: 840 | E155: * | F155: 1 | G155: 1345.00 | H155: 1.60 | I155: 1089.00 | J155: 249.00 | K155: 2 | L155: =RC[-3]/100*RC[-1] -> 1.60
A156: 10 | B156: A19-145 | C156: Фуляр на патрони ACROPOLIS ||ПП-2 | D156: 254 | E156: * | F156: 1 | G156: 370.00 | H156: 1.46 | I156: 370.00 | J156: 116.00 | K156: 2 | L156: =RC[-3]/100*RC[-1] -> 1.46
A157: 11 | B157: K13034-C | C157: Подсумок магазинный двойной койот M4/AK ||M51613034-TAN | D157: 79 | E157: * | F157: 1 | G157: 173.00 | H157: 2.19 | I157: 173.00 | J157: 94.00 | K157: 2 | L157: =RC[-3]/100*RC[-1] -> 2.19 | M157: =SUM(R[-11]C[-1]:RC[-1]) -> 
A159: #11860 (2015-01-24) Магазин туризму - Відправлено-Продано
A160: N | B160: арт | C160: назва | D160: закуп | F160: к-ть | G160: цiна | H160: кф | I160: продж | J160: дохiд | K160: % | L160: з-та
A161: 1 | B161: A19-01 | C161: Відро рибальське ACROPOLIS (Д-30см) ||ВР-1а | D161: 35.30 | E161: грн | F161: 1 | G161: 52.00 | H161: 1.47 | I161: 52.00 | J161: 16.70 | K161: 2 | L161: =RC[-3]/100*RC[-1] -> 1.47
A162: 2 | B162: H159310 | C162: Лента маскировочная универсальная 50мм (4,5м) ACU ||TM-SCG-PO-10 | D162: 2.10 | E162: usd | F162: 1 | G162: 97.00 | H162: 2.31 | I162: 97.00 | J162: 55.00 | K162: 2 | L162: =RC[-3]/100*RC[-1] -> 2.31
A163: 3 | B163: A19-185 | C163: Ремень 3.-точ ACROPOLIS||РТО-1 | D163: 179.00 | E163: грн | F163: 1 | G163: 250.00 | H163: 1.40 | I163: 250.00 | J163: 71.00 | K163: 2 | L163: =RC[-3]/100*RC[-1] -> 1.40
A164: 4 | B164: A19-156 | C164: Чохол для льодобура ACROPOLIS ||ЧДЛ-11 | D164: 61.32 | E164: грн | F164: 1 | G164: 74.00 | H164: 1.21 | I164: 74.00 | J164: 12.68 | K164: 2 | L164: =RC[-3]/100*RC[-1] -> 1.21
A165: 5 | B165: KBB-23 | C165: Шарики BB 6мм 0,23x4300 [GUARDER] ||BB-23(BAG) | D165: 7.87 | E165: usd | F165: 1 | G165: 253.00 | H165: 1.61 | I165: 190.00 | J165: 32.60 | K165: 2 | L165: =RC[-3]/100*RC[-1] -> 1.61
A166: 6 | B166: K0001-MM | C166: Переходник Mini-to-T [MINI M]||VB MINI M | D166: 1.00 | E166: usd | F166: 1 | G166: 39.00 | H166: 1.95 | I166: 39.00 | J166: 19.00 | K166: 2 | L166: =RC[-3]/100*RC[-1] -> 1.95
A167: 7 | B167: K13022-M | C167: Подсумок поясной на сброс магазинный сетка мультикам ||M51613022-CP | D167: 3.45 | E167: usd | F167: 1 | G167: 152.00 | H167: 2.20 | I167: 152.00 | J167: 83.00 | K167: 2 | L167: =RC[-3]/100*RC[-1] -> 2.20
A168: 8 | B168: K13049-B | C168: Кобура набедренная чёрная ||M51613049-BK | D168: 6.06 | E168: usd | F168: 1 | G168: 279.00 | H168: 2.30 | I168: 279.00 | J168: 157.80 | K168: 2 | L168: =RC[-3]/100*RC[-1] -> 2.30
A169: 9 | B169: K12082-С | C169: Рюкзак MOLLE Tactical Backpack койот ||M51612082-TAN | D169: 19.17 | E169: usd | F169: 1 | G169: 843.00 | H169: 2.20 | I169: 758.70 | J169: 375.30 | K169: 2 | L169: =RC[-3]/100*RC[-1] -> 2.20
A170: 10 | B170: H9711 | C170: Рюкзак RACCOON 20л койот ||PL-RCN-PO-11 | D170: 23.00 | E170: usd | F170: 2 | G170: 1012.00 | H170: 2.20 | I170: 1821.60 | J170: 901.60 | K170: 2 | L170: =RC[-3]/100*RC[-1] -> 2.20
A171: 11 | B171: _14906 | C171: Горелка для сухого спирту ||14906000 | D171: 62 | E171: * | F171: 1 | G171: 142.00 | H171: 2.29 | I171: 127.80 | J171: 65.80 | K171: 2 | L171: =RC[-3]/100*RC[-1] -> 2.29
A172: 12 | B172: A19-187 | C172: Подсумок для рации олива ACROPOLIS||ЧР-1 | D172: 65 | E172: * | F172: 1 | G172: 98.00 | H172: 1.51 | I172: 98.00 | J172: 33.00 | K172: 2 | L172: =RC[-3]/100*RC[-1] -> 1.51
A173: 13 | B173: K12210-O | C173: Подсумок сумок магазинный двойной M4/AK олива [A.C.M] ||M51612210-OD | D173: 115 | E173: * | F173: 1 | G173: 253.00 | H173: 2.20 | I173: 227.70 | J173: 112.70 | K173: 2 | L173: =RC[-3]/100*RC[-1] -> 2.20
A174: 14 | B174: K11023-O | C174: Розгруз. New Mesh Vest олива [A.C.M] ||M51611023-OD | D174: 308 | E174: * | F174: 1 | G174: 678.00 | H174: 2.20 | I174: 610.20 | J174: 302.20 | K174: 2 | L174: =RC[-3]/100*RC[-1] -> 2.20
A175: 15 | B175: A19-187 | C175: Подсумок для рации олива ACROPOLIS||ЧР-1 | D175: 65 | E175: * | F175: 1 | G175: 98.00 | H175: 1.51 | I175: 98.00 | J175: 33.00 | K175: 2 | L175: =RC[-3]/100*RC[-1] -> 1.51
A176: 16 | B176: K12213-C | C176: Подсумок для ножа койот [A.C.M] ||M51612213-TAN | D176: 74 | E176: * | F176: 1 | G176: 163.00 | H176: 2.20 | I176: 146.70 | J176: 72.70 | K176: 2 | L176: =RC[-3]/100*RC[-1] -> 2.20
A177: 17 | B177: _916196 | C177: Рос. кобура для сигнального пистолета M44 б/у ||91619600 | D177: 62 | E177: * | F177: 1 | G177: 240.00 | H177: 3.87 | I177: 240.00 | J177: 178.00 | K177: 2 | L177: =RC[-3]/100*RC[-1] -> 3.87 | M177: =SUM(R[-17]C[-1]:RC[-1]) -> 
A179: #11870 (2015-01-26) Магазин туризму - Відправлено-Продано
A180: N | B180: арт | C180: назва | D180: закуп | F180: к-ть | G180: цiна | H180: кф | I180: продж | J180: дохiд | K180: % | L180: з-та
A181: 1 | B181: K5-0378A | C181: Шарики BB 6мм 0,20x2000 [PREMIUM] ||PJBB 0,2-2000 | D181: 38 | E181: * | F181: 1 | G181: 87.00 | H181: 2.29 | I181: 87.00 | J181: 49.00 | K181: 2 | L181: =RC[-3]/100*RC[-1] -> 2.29
A182: 2 | B182: KG-1000 | C182: GREEN GAS 1000мл | D182: 94 | E182: * | F182: 1 | G182: 248.00 | H182: 2.64 | I182: 248.00 | J182: 154.00 | K182: 2 | L182: =RC[-3]/100*RC[-1] -> 2.64
A183: 3 | B183: K8-9905 | C183: Пістолет газопневматический страйкбольний (Green Gas) G23 GLOCK блоубек [KJW] | D183: 727 | E183: * | F183: 1 | G183: 1645.00 | H183: 2.26 | I183: 1645.00 | J183: 918.00 | K183: 2 | L183: =RC[-3]/100*RC[-1] -> 2.26
A184: 4 | B184: A19-186 | C184: Кобура набедренная ACROPOLIS||КП-1 | D184: 190 | E184: * | F184: 2 | G184: 275.00 | H184: 1.45 | I184: 550.00 | J184: 170.00 | K184: 2 | L184: =RC[-3]/100*RC[-1] -> 1.45
A185: 5 | B185: Брон | C185: Бронепластина 4-й класс | D185: 1400 | E185: * | F185: 1 | G185: 1662.00 | H185: 1.19 | I185: 1662.00 | J185: 262.00 | K185: 2 | L185: =RC[-3]/100*RC[-1] -> 1.19
A186: 6 | B186: K17088-B | C186: Ремень 3-точ.тактический MP5/G3/M4 чёрный (котон)[Производитель: ACM] ||M51617088-BK | D186: 63 | E186: * | F186: 1 | G186: 203.00 | H186: 3.22 | I186: 203.00 | J186: 140.00 | K186: 2 | L186: =RC[-3]/100*RC[-1] -> 3.22
A187: 7 | B187: A19-201 | C187: Нагрудник олива ACROPOLIS ||РЗ-5 | D187: 1211 | E187: * | F187: 1 | G187: 1695.00 | H187: 1.40 | I187: 1695.00 | J187: 484.00 | K187: 2 | L187: =RC[-3]/100*RC[-1] -> 1.40
A188: 8 | B188: _TRM-007 | C188: Спальный мешок-одеяло ||CП-5 люкс | D188: 520 | E188: * | F188: 1 | G188: 802.00 | H188: 1.54 | I188: 721.80 | J188: 201.80 | K188: 2 | L188: =RC[-3]/100*RC[-1] -> 1.54
A189: 9 | B189: K11018-W | C189: Розгруз. Chest Rigg AK с подсумками вудлэнд ||M51611018-WL | D189: 276 | E189: * | F189: 1 | G189: 607.00 | H189: 2.20 | I189: 607.00 | J189: 331.00 | K189: 2 | L189: =RC[-3]/100*RC[-1] -> 2.20
A190: 10 | B190: K13028-M | C190: Кобура набедренная MOLLE tactical backpack мультикам ||M51613028-CP | D190: 152 | E190: * | F190: 2 | G190: 350.00 | H190: 2.30 | I190: 700.00 | J190: 396.00 | K190: 2 | L190: =RC[-3]/100*RC[-1] -> 2.30
A191: 11 | B191: H91414 | C191: Подсумок M-14 магазинный двойной мультикам ||MO-M14-NL-14 | D191: 150 | E191: * | F191: 1 | G191: 330.00 | H191: 2.20 | I191: 297.00 | J191: 147.00 | K191: 2 | L191: =RC[-3]/100*RC[-1] -> 2.20
A192: 12 | B192: K13022-M | C192: Подсумок поясной на сброс магазинный сетка мультикам ||M51613022-CP | D192: 69 | E192: * | F192: 2 | G192: 152.00 | H192: 2.20 | I192: 304.00 | J192: 166.00 | K192: 2 | L192: =RC[-3]/100*RC[-1] -> 2.20 | M192: =SUM(R[-12]C[-1]:RC[-1]) -> 
A194: #11911 (2015-01-27) Магазин туризму - Відправлено-Продано
A195: N | B195: арт | C195: назва | D195: закуп | F195: к-ть | G195: цiна | H195: кф | I195: продж | J195: дохiд | K195: % | L195: з-та
A196: 1 | B196: K12234-B | C196: Подсумок універс. для оружия чёрный [A.C.M] ||M51612234-BK | D196: 109 | E196: * | F196: 1 | G196: 239.00 | H196: 2.19 | I196: 239.00 | J196: 130.00 | K196: 2 | L196: =RC[-3]/100*RC[-1] -> 2.19
A197: 2 | B197: A19-190 | C197: Подсумок аптечка ACROPOLIS||ПМ-1 | D197: 100 | E197: * | F197: 1 | G197: 145.00 | H197: 1.45 | I197: 145.00 | J197: 45.00 | K197: 2 | L197: =RC[-3]/100*RC[-1] -> 1.45
A198: 3 | B198: _1400021 | C198: Каремат-сидушка туристический 8мм олива | D198: 20 | E198: * | F198: 1 | G198: 57.00 | H198: 2.85 | I198: 57.00 | J198: 37.00 | K198: 2 | L198: =RC[-3]/100*RC[-1] -> 2.85
A199: 4 | B199: _187512T | C199: Подсумок магазинный к THOMSON | D199: 1100 | E199: * | F199: 1 | G199: 100.00 | H199: 0.09 | I199: 100.00 | J199: -1000.00 | K199: 2 | L199: =RC[-3]/100*RC[-1] -> 0.09
A200: 5 | B200: K5-0378B | C200: Шарики BB 6мм 0,20x4000 [PREMIUM] ||PJBB 0,2-4000 | D200: 71 | E200: * | F200: 1 | G200: 171.00 | H200: 2.41 | I200: 171.00 | J200: 100.00 | K200: 2 | L200: =RC[-3]/100*RC[-1] -> 2.41
A201: 6 | B201: K17195-С | C201: Ремень 3-точ.тактический G3/M4/M15/M16 койот [Производитель: ACM] ||M51617195-TAN | D201: 156 | E201: * | F201: 1 | G201: 360.00 | H201: 2.31 | I201: 360.00 | J201: 204.00 | K201: 2 | L201: =RC[-3]/100*RC[-1] -> 2.31
A202: 7 | B202: H9711 | C202: Рюкзак RACCOON 20л койот ||PL-RCN-PO-11 | D202: 460 | E202: * | F202: 1 | G202: 1012.00 | H202: 2.20 | I202: 809.60 | J202: 349.60 | K202: 2 | L202: =RC[-3]/100*RC[-1] -> 2.20
A203: 8 | B203: K13048-M | C203: Кобура набедренная мультикам ||M51613048-CP | D203: 97 | E203: * | F203: 1 | G203: 223.00 | H203: 2.30 | I203: 223.00 | J203: 126.00 | K203: 2 | L203: =RC[-3]/100*RC[-1] -> 2.30 | M203: =SUM(R[-8]C[-1]:RC[-1]) -> 
A205: #11932 (2015-01-28) Магазин туризму - Відправлено-Продано
A206: N | B206: арт | C206: назва | D206: закуп | F206: к-ть | G206: цiна | H206: кф | I206: продж | J206: дохiд | K206: % | L206: з-та
A207: 1 | B207: K12216-W | C207: Панель набедренная MOLLE вудлэнд [A.C.M] ||M51612216-WL | D207: 142 | E207: * | F207: 1 | G207: 313.00 | H207: 2.20 | I207: 313.00 | J207: 171.00 | K207: 2 | L207: =RC[-3]/100*RC[-1] -> 2.20
A208: 2 | B208: A19-190 | C208: Подсумок аптечка ACROPOLIS||ПМ-1 | D208: 100 | E208: * | F208: 1 | G208: 145.00 | H208: 1.45 | I208: 145.00 | J208: 45.00 | K208: 2 | L208: =RC[-3]/100*RC[-1] -> 1.45
A209: 3 | B209: K13048-F | C209: Кобура набедренная флектарн ||M51613048-GF | D209: 97 | E209: * | F209: 1 | G209: 223.00 | H209: 2.30 | I209: 223.00 | J209: 126.00 | K209: 2 | L209: =RC[-3]/100*RC[-1] -> 2.30
A210: 4 | B210: A19-201 | C210: Нагрудник олива ACROPOLIS ||РЗ-5 | D210: 1211 | E210: * | F210: 1 | G210: 1695.00 | H210: 1.40 | I210: 1610.25 | J210: 399.25 | K210: 2 | L210: =RC[-3]/100*RC[-1] -> 1.40 | M210: =SUM(R[-4]C[-1]:RC[-1]) -> 
A212: #11966 (2015-01-29) Магазин туризму - Відправлено-Продано
A213: N | B213: арт | C213: назва | D213: закуп | F213: к-ть | G213: цiна | H213: кф | I213: продж | J213: дохiд | K213: % | L213: з-та
A214: 1 | B214: K13048-B | C214: Кобура набедренная чёрная ||M51613048-BK | D214: 97 | E214: * | F214: 1 | G214: 223.00 | H214: 2.30 | I214: 211.85 | J214: 114.85 | K214: 2 | L214: =RC[-3]/100*RC[-1] -> 2.30
A215: 2 | B215: _1400021 | C215: Каремат-сидушка туристический 8мм олива | D215: 20 | E215: * | F215: 1 | G215: 57.00 | H215: 2.85 | I215: 54.15 | J215: 34.15 | K215: 2 | L215: =RC[-3]/100*RC[-1] -> 2.85
A216: 3 | B216: A19-185 | C216: Ремень 3.-точ ACROPOLIS||РТО-1 | D216: 179 | E216: * | F216: 1 | G216: 250.00 | H216: 1.40 | I216: 237.50 | J216: 58.50 | K216: 2 | L216: =RC[-3]/100*RC[-1] -> 1.40
A217: 4 | B217: _19-1118 | C217: Ремень регулювальний | D217: 60 | E217: * | F217: 1 | G217: 90.00 | H217: 1.50 | I217: 90.00 | J217: 30.00 | K217: 2 | L217: =RC[-3]/100*RC[-1] -> 1.50
A218: 5 | B218: K12021-С | C218: Рюкзак 3-Day Assault Backpack 26л койот ||M51612021-TAN | D218: 468 | E218: * | F218: 1 | G218: 1030.00 | H218: 2.20 | I218: 927.00 | J218: 459.00 | K218: 2 | L218: =RC[-3]/100*RC[-1] -> 2.20 | M218: =SUM(R[-5]C[-1]:RC[-1]) -> 
A220: #11997 (2015-01-30) Магазин туризму - Відправлено-Продано
A221: N | B221: арт | C221: назва | D221: закуп | F221: к-ть | G221: цiна | H221: кф | I221: продж | J221: дохiд | K221: % | L221: з-та
A222: 1 | B222: K13048-B | C222: Кобура набедренная чёрная ||M51613048-BK | D222: 4.85 | E222: usd | F222: 1 | G222: 223.00 | H222: 2.30 | I222: 223.00 | J222: 126.00 | K222: 2 | L222: =RC[-3]/100*RC[-1] -> 2.30
A223: 2 | B223: H159310 | C223: Лента маскировочная универсальная 50мм (4,5м) ACU ||TM-SCG-PO-10 | D223: 42 | E223: * | F223: 1 | G223: 97.00 | H223: 2.31 | I223: 97.00 | J223: 55.00 | K223: 2 | L223: =RC[-3]/100*RC[-1] -> 2.31
A224: 3 | B224: K11009-F | C224: Розгруз. Ciras Land флектарн [WwCH] ||M51611009-GF | D224: 1068 | E224: * | F224: 1 | G224: 2350.00 | H224: 2.20 | I224: 2115.00 | J224: 1047.00 | K224: 2 | L224: =RC[-3]/100*RC[-1] -> 2.20
A225: 4 | B225: K13022-F | C225: Подсумок поясной на сброс магазинный сетка флектарн ||M51613022-GF | D225: 69 | E225: * | F225: 1 | G225: 152.00 | H225: 2.20 | I225: 152.00 | J225: 83.00 | K225: 2 | L225: =RC[-3]/100*RC[-1] -> 2.20
A226: 5 | B226: K12022-O | C226: Рюкзак Tactical Backpack 20л олива ||M51612022-OD | D226: 383 | E226: * | F226: 1 | G226: 843.00 | H226: 2.20 | I226: 716.55 | J226: 333.55 | K226: 2 | L226: =RC[-3]/100*RC[-1] -> 2.20
A227: 6 | B227: H9711 | C227: Рюкзак RACCOON 20л койот ||PL-RCN-PO-11 | D227: 460 | E227: * | F227: 1 | G227: 1012.00 | H227: 2.20 | I227: 910.80 | J227: 450.80 | K227: 2 | L227: =RC[-3]/100*RC[-1] -> 2.20
A228: 7 | B228: K12036-С | C228: Рюкзак Becker Patrol Pack MOLLE койот ||M51612036-TAN | D228: 446 | E228: * | F228: 1 | G228: 982.00 | H228: 2.20 | I228: 883.80 | J228: 437.80 | K228: 2 | L228: =RC[-3]/100*RC[-1] -> 2.20 | M228: =SUM(R[-7]C[-1]:RC[-1]) -> 
A230: #12015 (2015-01-31) Магазин туризму - Відправлено-Продано
A231: N | B231: арт | C231: назва | D231: закуп | F231: к-ть | G231: цiна | H231: кф | I231: продж | J231: дохiд | K231: % | L231: з-та
A232: 1 | B232: K11005-O | C232: Розгрузочна система тактическая STRIKE с подсумками олива ||M51611005-OD | D232: 364 | E232: * | F232: 1 | G232: 800.00 | H232: 2.20 | I232: 800.00 | J232: 436.00 | K232: 2 | L232: =RC[-3]/100*RC[-1] -> 2.20
A233: 2 | B233: K5-0378B | C233: Шарики BB 6мм 0,20x4000 [PREMIUM] ||PJBB 0,2-4000 | D233: 71 | E233: * | F233: 1 | G233: 171.00 | H233: 2.41 | I233: 171.00 | J233: 100.00 | K233: 2 | L233: =RC[-3]/100*RC[-1] -> 2.41
A234: 3 | B234: A2131/G | C234: Камелбэк-рюкзак олива с липучками б/у | D234: 200 | E234: * | F234: 1 | G234: 105.00 | H234: 0.53 | I234: 105.00 | J234: -95.00 | K234: 2 | L234: =RC[-3]/100*RC[-1] -> 0.53
A235: 4 | B235: K17072-C | C235: Вставка к камелбэк МЕДУЗА 1л коёт шланг ||M51617072-TAN | D235: 78 | E235: * | F235: 1 | G235: 172.00 | H235: 2.21 | I235: 172.00 | J235: 94.00 | K235: 2 | L235: =RC[-3]/100*RC[-1] -> 2.21
A236: 5 | B236: _TRM-007 | C236: Спальный мешок-одеяло ||CП-5 люкс | D236: 520 | E236: * | F236: 1 | G236: 802.00 | H236: 1.54 | I236: 721.80 | J236: 201.80 | K236: 2 | L236: =RC[-3]/100*RC[-1] -> 1.54
A237: 6 | B237: _26-0628 | C237: Горелка газовая GUCIO big (d=18) | D237: 175 | E237: * | F237: 1 | G237: 265.00 | H237: 1.51 | I237: 238.50 | J237: 63.50 | K237: 2 | L237: =RC[-3]/100*RC[-1] -> 1.51
A238: 7 | B238: A19-1881 | C238: Разгр. жилет АК олива с поясом ACROPOLIS||РЗ-1п | D238: 511 | E238: * | F238: 1 | G238: 715.00 | H238: 1.40 | I238: 715.00 | J238: 204.00 | K238: 2 | L238: =RC[-3]/100*RC[-1] -> 1.40
A239: 8 | B239: K11014-W | C239: Жилет PT Tactical Body Armor вудлэнд ||M51611014-WL | D239: 264 | E239: * | F239: 1 | G239: 581.00 | H239: 2.20 | I239: 522.90 | J239: 258.90 | K239: 2 | L239: =RC[-3]/100*RC[-1] -> 2.20
A240: 9 | B240: K11014-C | C240: Жилет PT Tactical Body Armor койот ||M51611014-TAN | D240: 264 | E240: * | F240: 1 | G240: 581.00 | H240: 2.20 | I240: 522.90 | J240: 258.90 | K240: 2 | L240: =RC[-3]/100*RC[-1] -> 2.20
A241: 10 | B241: K11014-M | C241: Жилет PT Tactical Body Armor мультикам ||M51611014-CP | D241: 264 | E241: * | F241: 1 | G241: 581.00 | H241: 2.20 | I241: 522.90 | J241: 258.90 | K241: 2 | L241: =RC[-3]/100*RC[-1] -> 2.20
A242: 11 | B242: K13028-M | C242: Кобура набедренная MOLLE tactical backpack мультикам ||M51613028-CP | D242: 152 | E242: * | F242: 1 | G242: 350.00 | H242: 2.30 | I242: 350.00 | J242: 198.00 | K242: 2 | L242: =RC[-3]/100*RC[-1] -> 2.30
A243: 12 | B243: K5-1351-В | C243: Магазин страйкбольный механический к AK/AKM (150шар) чёрный [CM]||K5-1351 BK | D243: 93 | E243: * | F243: 1 | G243: 200.00 | H243: 2.15 | I243: 200.00 | J243: 107.00 | K243: 2 | L243: =RC[-3]/100*RC[-1] -> 2.15
A244: 13 | B244: K5-0176-B-500 | C244: Магазин страйкбольный бункерный к AK74 (500шар) чёрный [Производитель: P] | D244: 74 | E244: * | F244: 1 | G244: 200.00 | H244: 2.70 | I244: 200.00 | J244: 126.00 | K244: 2 | L244: =RC[-3]/100*RC[-1] -> 2.70
A245: 14 | B245: _542693 | C245: Таблетки для дезинфенкции воды Javel Aqua (10шт) | D245: 15 | E245: * | F245: 8 | G245: 25.00 | H245: 1.67 | I245: 200.00 | J245: 80.00 | K245: 2 | L245: =RC[-3]/100*RC[-1] -> 1.67 | M245: =SUM(R[-14]C[-1]:RC[-1]) -> 
A247: #12025 (2015-02-02) Магазин туризму - Відправлено-Продано
A248: N | B248: арт | C248: назва | D248: закуп | F248: к-ть | G248: цiна | H248: кф | I248: продж | J248: дохiд | K248: % | L248: з-та
A249: 1 | B249: A13851/G | C249: Баул прорезинений оливковий | D249: 17 | E249: * | F249: 1 | G249: 54.00 | H249: 3.18 | I249: 54.00 | J249: 37.00 | K249: 2 | L249: =RC[-3]/100*RC[-1] -> 3.18
A250: 2 | B250: _TRM-005 | C250: Спальный мешок-одеяло oliv||CП-3Б | D250: 380 | E250: * | F250: 1 | G250: 599.00 | H250: 1.58 | I250: 539.10 | J250: 159.10 | K250: 2 | L250: =RC[-3]/100*RC[-1] -> 1.58
A251: 3 | B251: _TRM-007 | C251: Спальный мешок-одеяло ||CП-5 люкс | D251: 520 | E251: * | F251: 5 | G251: 802.00 | H251: 1.54 | I251: 3609.00 | J251: 1009.00 | K251: 2 | L251: =RC[-3]/100*RC[-1] -> 1.54
A252: 4 | B252: H159310 | C252: Лента маскировочная универсальная 50мм (4,5м) ACU ||TM-SCG-PO-10 | D252: 42 | E252: * | F252: 1 | G252: 97.00 | H252: 2.31 | I252: 97.00 | J252: 55.00 | K252: 2 | L252: =RC[-3]/100*RC[-1] -> 2.31
A253: 5 | B253: _542693 | C253: Таблетки для дезинфенкции воды Javel Aqua (10шт) | D253: 15 | E253: * | F253: 8 | G253: 25.00 | H253: 1.67 | I253: 200.00 | J253: 80.00 | K253: 2 | L253: =RC[-3]/100*RC[-1] -> 1.67
A254: 6 | B254: _1400020 | C254: Каремат туристический 10мм | D254: 83 | E254: * | F254: 2 | G254: 150.00 | H254: 1.81 | I254: 300.00 | J254: 134.00 | K254: 2 | L254: =RC[-3]/100*RC[-1] -> 1.81
A255: 7 | B255: K5-0772 | C255: Шарики BB 6мм 0,23x3000 [PREMIUM] ||PJBB 0,23-3000 | D255: 71 | E255: * | F255: 2 | G255: 171.00 | H255: 2.41 | I255: 342.00 | J255: 200.00 | K255: 2 | L255: =RC[-3]/100*RC[-1] -> 2.41
A256: 8 | B256: _14947 | C256: Мікроосвітлювач (импорт) рыбацкий 10шт. ||14931000 | D256: 19 | E256: * | F256: 2 | G256: 43.00 | H256: 2.26 | I256: 86.00 | J256: 48.00 | K256: 2 | L256: =RC[-3]/100*RC[-1] -> 2.26
A257: 9 | B257: K13048-B | C257: Кобура набедренная чёрная ||M51613048-BK | D257: 97 | E257: * | F257: 1 | G257: 223.00 | H257: 2.30 | I257: 223.00 | J257: 126.00 | K257: 2 | L257: =RC[-3]/100*RC[-1] -> 2.30
A258: 10 | B258: K13048-A | C258: Кобура набедренная ACU ||M51613048-ACU | D258: 97 | E258: * | F258: 1 | G258: 223.00 | H258: 2.30 | I258: 223.00 | J258: 126.00 | K258: 2 | L258: =RC[-3]/100*RC[-1] -> 2.30
A259: 11 | B259: A19-184 | C259: Подсумок гранатный олива ACROPOLIS||ПГР-1 | D259: 50 | E259: * | F259: 2 | G259: 70.00 | H259: 1.40 | I259: 140.00 | J259: 40.00 | K259: 2 | L259: =RC[-3]/100*RC[-1] -> 1.40 | M259: =SUM(R[-11]C[-1]:RC[-1]) -> 